frame.number,frame.time_relative,frame.len,eth.src,eth.dst,ip.src,ip.dst,_ws.col.protocol,_ws.col.info
"1","0.000000000","42","6e:9f:ff:47:5d:4f","ff:ff:ff:ff:ff:ff",,,"ARP","ARP Announcement for 172.20.0.3"
"2","0.034539894","42","6e:9f:ff:47:5d:4f","ff:ff:ff:ff:ff:ff",,,"ARP","Who has 172.20.0.2? Tell 172.20.0.3"
"3","0.034566650","42","b2:92:d2:3c:f2:8d","6e:9f:ff:47:5d:4f",,,"ARP","172.20.0.2 is at b2:92:d2:3c:f2:8d"
"4","0.034573736","74","6e:9f:ff:47:5d:4f","b2:92:d2:3c:f2:8d","172.20.0.3","172.20.0.2","TCP","58794 → 4433 [SYN] Seq=0 Win=64240 Len=0 MSS=1460 SACK_PERM TSval=2186071125 TSecr=0 WS=128"
"5","0.034593647","74","b2:92:d2:3c:f2:8d","6e:9f:ff:47:5d:4f","172.20.0.2","172.20.0.3","TCP","4433 → 58794 [SYN, ACK] Seq=0 Ack=1 Win=65160 Len=0 MSS=1460 SACK_PERM TSval=2880642055 TSecr=2186071125 WS=128"
"6","0.034611408","66","6e:9f:ff:47:5d:4f","b2:92:d2:3c:f2:8d","172.20.0.3","172.20.0.2","TCP","58794 → 4433 [ACK] Seq=1 Ack=1 Win=64256 Len=0 TSval=2186071125 TSecr=2880642055"
"7","0.034661391","1353","6e:9f:ff:47:5d:4f","b2:92:d2:3c:f2:8d","172.20.0.3","172.20.0.2","TLSv1.2","Client Hello"
"8","0.034668408","66","b2:92:d2:3c:f2:8d","6e:9f:ff:47:5d:4f","172.20.0.2","172.20.0.3","TCP","4433 → 58794 [ACK] Seq=1 Ack=1288 Win=64128 Len=0 TSval=2880642055 TSecr=2186071125"
"9","0.040755381","1537","b2:92:d2:3c:f2:8d","6e:9f:ff:47:5d:4f","172.20.0.2","172.20.0.3","TLSv1.3","Server Hello, Change Cipher Spec, Application Data, Application Data, Application Data, Application Data"
"10","0.040810421","66","6e:9f:ff:47:5d:4f","b2:92:d2:3c:f2:8d","172.20.0.3","172.20.0.2","TCP","58794 → 4433 [ACK] Seq=1288 Ack=1472 Win=64128 Len=0 TSval=2186071131 TSecr=2880642061"
"11","0.043503007","146","6e:9f:ff:47:5d:4f","b2:92:d2:3c:f2:8d","172.20.0.3","172.20.0.2","TLSv1.3","Change Cipher Spec, Application Data"
"12","0.043572459","66","6e:9f:ff:47:5d:4f","b2:92:d2:3c:f2:8d","172.20.0.3","172.20.0.2","TCP","58794 → 4433 [RST, ACK] Seq=1368 Ack=1472 Win=64128 Len=0 TSval=2186071134 TSecr=2880642061"
"13","0.058507127","74","6e:9f:ff:47:5d:4f","b2:92:d2:3c:f2:8d","172.20.0.3","172.20.0.2","TCP","58800 → 4433 [SYN] Seq=0 Win=64240 Len=0 MSS=1460 SACK_PERM TSval=2186071149 TSecr=0 WS=128"
"14","0.058536608","74","b2:92:d2:3c:f2:8d","6e:9f:ff:47:5d:4f","172.20.0.2","172.20.0.3","TCP","4433 → 58800 [SYN, ACK] Seq=0 Ack=1 Win=65160 Len=0 MSS=1460 SACK_PERM TSval=2880642079 TSecr=2186071149 WS=128"
"15","0.058556455","66","6e:9f:ff:47:5d:4f","b2:92:d2:3c:f2:8d","172.20.0.3","172.20.0.2","TCP","58800 → 4433 [ACK] Seq=1 Ack=1 Win=64256 Len=0 TSval=2186071149 TSecr=2880642079"
"16","0.058604593","1353","6e:9f:ff:47:5d:4f","b2:92:d2:3c:f2:8d","172.20.0.3","172.20.0.2","TLSv1.2","Client Hello"
"17","0.058614001","66","b2:92:d2:3c:f2:8d","6e:9f:ff:47:5d:4f","172.20.0.2","172.20.0.3","TCP","4433 → 58800 [ACK] Seq=1 Ack=1288 Win=64128 Len=0 TSval=2880642079 TSecr=2186071149"
"18","0.060435513","1537","b2:92:d2:3c:f2:8d","6e:9f:ff:47:5d:4f","172.20.0.2","172.20.0.3","TLSv1.3","Server Hello, Change Cipher Spec, Application Data, Application Data, Application Data, Application Data"
"19","0.060470395","66","6e:9f:ff:47:5d:4f","b2:92:d2:3c:f2:8d","172.20.0.3","172.20.0.2","TCP","58800 → 4433 [ACK] Seq=1288 Ack=1472 Win=64128 Len=0 TSval=2186071151 TSecr=2880642081"
"20","0.063739795","146","6e:9f:ff:47:5d:4f","b2:92:d2:3c:f2:8d","172.20.0.3","172.20.0.2","TLSv1.3","Change Cipher Spec, Application Data"
"21","0.063811150","66","6e:9f:ff:47:5d:4f","b2:92:d2:3c:f2:8d","172.20.0.3","172.20.0.2","TCP","58800 → 4433 [RST, ACK] Seq=1368 Ack=1472 Win=64128 Len=0 TSval=2186071154 TSecr=2880642081"
"22","0.079421221","74","6e:9f:ff:47:5d:4f","b2:92:d2:3c:f2:8d","172.20.0.3","172.20.0.2","TCP","58804 → 4433 [SYN] Seq=0 Win=64240 Len=0 MSS=1460 SACK_PERM TSval=2186071170 TSecr=0 WS=128"
"23","0.079452700","74","b2:92:d2:3c:f2:8d","6e:9f:ff:47:5d:4f","172.20.0.2","172.20.0.3","TCP","4433 → 58804 [SYN, ACK] Seq=0 Ack=1 Win=65160 Len=0 MSS=1460 SACK_PERM TSval=2880642100 TSecr=2186071170 WS=128"
"24","0.079472451","66","6e:9f:ff:47:5d:4f","b2:92:d2:3c:f2:8d","172.20.0.3","172.20.0.2","TCP","58804 → 4433 [ACK] Seq=1 Ack=1 Win=64256 Len=0 TSval=2186071170 TSecr=2880642100"
"25","0.079515801","1353","6e:9f:ff:47:5d:4f","b2:92:d2:3c:f2:8d","172.20.0.3","172.20.0.2","TLSv1.2","Client Hello"
"26","0.081423937","1537","b2:92:d2:3c:f2:8d","6e:9f:ff:47:5d:4f","172.20.0.2","172.20.0.3","TLSv1.3","Server Hello, Change Cipher Spec, Application Data, Application Data, Application Data, Application Data"
"27","0.081464847","66","6e:9f:ff:47:5d:4f","b2:92:d2:3c:f2:8d","172.20.0.3","172.20.0.2","TCP","58804 → 4433 [ACK] Seq=1288 Ack=1472 Win=64128 Len=0 TSval=2186071172 TSecr=2880642102"
"28","0.084059490","146","6e:9f:ff:47:5d:4f","b2:92:d2:3c:f2:8d","172.20.0.3","172.20.0.2","TLSv1.3","Change Cipher Spec, Application Data"
"29","0.084125579","66","6e:9f:ff:47:5d:4f","b2:92:d2:3c:f2:8d","172.20.0.3","172.20.0.2","TCP","58804 → 4433 [RST, ACK] Seq=1368 Ack=1472 Win=64128 Len=0 TSval=2186071174 TSecr=2880642102"
"30","0.098339262","74","6e:9f:ff:47:5d:4f","b2:92:d2:3c:f2:8d","172.20.0.3","172.20.0.2","TCP","58820 → 4433 [SYN] Seq=0 Win=64240 Len=0 MSS=1460 SACK_PERM TSval=2186071189 TSecr=0 WS=128"
"31","0.098370151","74","b2:92:d2:3c:f2:8d","6e:9f:ff:47:5d:4f","172.20.0.2","172.20.0.3","TCP","4433 → 58820 [SYN, ACK] Seq=0 Ack=1 Win=65160 Len=0 MSS=1460 SACK_PERM TSval=2880642119 TSecr=2186071189 WS=128"
"32","0.098391067","66","6e:9f:ff:47:5d:4f","b2:92:d2:3c:f2:8d","172.20.0.3","172.20.0.2","TCP","58820 → 4433 [ACK] Seq=1 Ack=1 Win=64256 Len=0 TSval=2186071189 TSecr=2880642119"
"33","0.098439008","1353","6e:9f:ff:47:5d:4f","b2:92:d2:3c:f2:8d","172.20.0.3","172.20.0.2","TLSv1.2","Client Hello"
"34","0.098446376","66","b2:92:d2:3c:f2:8d","6e:9f:ff:47:5d:4f","172.20.0.2","172.20.0.3","TCP","4433 → 58820 [ACK] Seq=1 Ack=1288 Win=64128 Len=0 TSval=2880642119 TSecr=2186071189"
"35","0.100559584","1537","b2:92:d2:3c:f2:8d","6e:9f:ff:47:5d:4f","172.20.0.2","172.20.0.3","TLSv1.3","Server Hello, Change Cipher Spec, Application Data, Application Data, Application Data, Application Data"
"36","0.100629816","66","6e:9f:ff:47:5d:4f","b2:92:d2:3c:f2:8d","172.20.0.3","172.20.0.2","TCP","58820 → 4433 [ACK] Seq=1288 Ack=1472 Win=64128 Len=0 TSval=2186071191 TSecr=2880642121"
"37","0.103100561","146","6e:9f:ff:47:5d:4f","b2:92:d2:3c:f2:8d","172.20.0.3","172.20.0.2","TLSv1.3","Change Cipher Spec, Application Data"
"38","0.103167315","66","6e:9f:ff:47:5d:4f","b2:92:d2:3c:f2:8d","172.20.0.3","172.20.0.2","TCP","58820 → 4433 [RST, ACK] Seq=1368 Ack=1472 Win=64128 Len=0 TSval=2186071193 TSecr=2880642121"
"39","0.117289131","74","6e:9f:ff:47:5d:4f","b2:92:d2:3c:f2:8d","172.20.0.3","172.20.0.2","TCP","58832 → 4433 [SYN] Seq=0 Win=64240 Len=0 MSS=1460 SACK_PERM TSval=2186071208 TSecr=0 WS=128"
"40","1.000883944","42","6e:9f:ff:47:5d:4f","ff:ff:ff:ff:ff:ff",,,"ARP","ARP Announcement for 172.20.0.3"
"41","1.130317060","74","6e:9f:ff:47:5d:4f","b2:92:d2:3c:f2:8d","172.20.0.3","172.20.0.2","TCP","[TCP Retransmission] 58832 → 4433 [SYN] Seq=0 Win=64240 Len=0 MSS=1460 SACK_PERM TSval=2186072221 TSecr=0 WS=128"
"42","1.130333161","74","b2:92:d2:3c:f2:8d","6e:9f:ff:47:5d:4f","172.20.0.2","172.20.0.3","TCP","4433 → 58832 [SYN, ACK] Seq=0 Ack=1 Win=65160 Len=0 MSS=1460 SACK_PERM TSval=2880643151 TSecr=2186071208 WS=128"
"43","1.130364328","66","6e:9f:ff:47:5d:4f","b2:92:d2:3c:f2:8d","172.20.0.3","172.20.0.2","TCP","58832 → 4433 [ACK] Seq=1 Ack=1 Win=64256 Len=0 TSval=2186072221 TSecr=2880643151"
"44","1.130443356","1353","6e:9f:ff:47:5d:4f","b2:92:d2:3c:f2:8d","172.20.0.3","172.20.0.2","TLSv1.2","Client Hello"
"45","1.130451587","66","b2:92:d2:3c:f2:8d","6e:9f:ff:47:5d:4f","172.20.0.2","172.20.0.3","TCP","4433 → 58832 [ACK] Seq=1 Ack=1288 Win=64128 Len=0 TSval=2880643151 TSecr=2186072221"
"46","1.132308075","1514","b2:92:d2:3c:f2:8d","6e:9f:ff:47:5d:4f","172.20.0.2","172.20.0.3","TLSv1.3","Server Hello, Change Cipher Spec, Application Data, Application Data, Application Data"
"47","1.132338952","66","6e:9f:ff:47:5d:4f","b2:92:d2:3c:f2:8d","172.20.0.3","172.20.0.2","TCP","58832 → 4433 [ACK] Seq=1288 Ack=1449 Win=64128 Len=0 TSval=2186072223 TSecr=2880643153"
"48","1.132350054","89","b2:92:d2:3c:f2:8d","6e:9f:ff:47:5d:4f","172.20.0.2","172.20.0.3","TLSv1.3","Application Data"
"49","1.132358480","66","6e:9f:ff:47:5d:4f","b2:92:d2:3c:f2:8d","172.20.0.3","172.20.0.2","TCP","58832 → 4433 [ACK] Seq=1288 Ack=1472 Win=64128 Len=0 TSval=2186072223 TSecr=2880643153"
"50","1.135109778","146","6e:9f:ff:47:5d:4f","b2:92:d2:3c:f2:8d","172.20.0.3","172.20.0.2","TLSv1.3","Change Cipher Spec, Application Data"
"51","1.135178461","66","6e:9f:ff:47:5d:4f","b2:92:d2:3c:f2:8d","172.20.0.3","172.20.0.2","TCP","58832 → 4433 [RST, ACK] Seq=1368 Ack=1472 Win=64128 Len=0 TSval=2186072225 TSecr=2880643153"
"52","1.150029844","74","6e:9f:ff:47:5d:4f","b2:92:d2:3c:f2:8d","172.20.0.3","172.20.0.2","TCP","58846 → 4433 [SYN] Seq=0 Win=64240 Len=0 MSS=1460 SACK_PERM TSval=2186072240 TSecr=0 WS=128"
"53","1.150055997","74","b2:92:d2:3c:f2:8d","6e:9f:ff:47:5d:4f","172.20.0.2","172.20.0.3","TCP","4433 → 58846 [SYN, ACK] Seq=0 Ack=1 Win=65160 Len=0 MSS=1460 SACK_PERM TSval=2880643170 TSecr=2186072240 WS=128"
"54","1.150072380","66","6e:9f:ff:47:5d:4f","b2:92:d2:3c:f2:8d","172.20.0.3","172.20.0.2","TCP","58846 → 4433 [ACK] Seq=1 Ack=1 Win=64256 Len=0 TSval=2186072240 TSecr=2880643170"
"55","1.150117627","1353","6e:9f:ff:47:5d:4f","b2:92:d2:3c:f2:8d","172.20.0.3","172.20.0.2","TLSv1.2","Client Hello"
"56","1.150124071","66","b2:92:d2:3c:f2:8d","6e:9f:ff:47:5d:4f","172.20.0.2","172.20.0.3","TCP","4433 → 58846 [ACK] Seq=1 Ack=1288 Win=64128 Len=0 TSval=2880643170 TSecr=2186072240"
"57","1.151859640","1537","b2:92:d2:3c:f2:8d","6e:9f:ff:47:5d:4f","172.20.0.2","172.20.0.3","TLSv1.3","Server Hello, Change Cipher Spec, Application Data, Application Data, Application Data, Application Data"
"58","1.151898065","66","6e:9f:ff:47:5d:4f","b2:92:d2:3c:f2:8d","172.20.0.3","172.20.0.2","TCP","58846 → 4433 [ACK] Seq=1288 Ack=1472 Win=64128 Len=0 TSval=2186072242 TSecr=2880643172"
"59","1.154549877","146","6e:9f:ff:47:5d:4f","b2:92:d2:3c:f2:8d","172.20.0.3","172.20.0.2","TLSv1.3","Change Cipher Spec, Application Data"
"60","1.154619578","66","6e:9f:ff:47:5d:4f","b2:92:d2:3c:f2:8d","172.20.0.3","172.20.0.2","TCP","58846 → 4433 [RST, ACK] Seq=1368 Ack=1472 Win=64128 Len=0 TSval=2186072245 TSecr=2880643172"
"61","1.168619286","74","6e:9f:ff:47:5d:4f","b2:92:d2:3c:f2:8d","172.20.0.3","172.20.0.2","TCP","58860 → 4433 [SYN] Seq=0 Win=64240 Len=0 MSS=1460 SACK_PERM TSval=2186072259 TSecr=0 WS=128"
"62","1.168646565","74","b2:92:d2:3c:f2:8d","6e:9f:ff:47:5d:4f","172.20.0.2","172.20.0.3","TCP","4433 → 58860 [SYN, ACK] Seq=0 Ack=1 Win=65160 Len=0 MSS=1460 SACK_PERM TSval=2880643189 TSecr=2186072259 WS=128"
"63","1.168664602","66","6e:9f:ff:47:5d:4f","b2:92:d2:3c:f2:8d","172.20.0.3","172.20.0.2","TCP","58860 → 4433 [ACK] Seq=1 Ack=1 Win=64256 Len=0 TSval=2186072259 TSecr=2880643189"
"64","1.168708047","1353","6e:9f:ff:47:5d:4f","b2:92:d2:3c:f2:8d","172.20.0.3","172.20.0.2","TLSv1.2","Client Hello"
"65","1.168712799","66","b2:92:d2:3c:f2:8d","6e:9f:ff:47:5d:4f","172.20.0.2","172.20.0.3","TCP","4433 → 58860 [ACK] Seq=1 Ack=1288 Win=64128 Len=0 TSval=2880643189 TSecr=2186072259"
"66","1.170507681","1537","b2:92:d2:3c:f2:8d","6e:9f:ff:47:5d:4f","172.20.0.2","172.20.0.3","TLSv1.3","Server Hello, Change Cipher Spec, Application Data, Application Data, Application Data, Application Data"
"67","1.170557154","66","6e:9f:ff:47:5d:4f","b2:92:d2:3c:f2:8d","172.20.0.3","172.20.0.2","TCP","58860 → 4433 [ACK] Seq=1288 Ack=1472 Win=64128 Len=0 TSval=2186072261 TSecr=2880643191"
"68","1.173149576","146","6e:9f:ff:47:5d:4f","b2:92:d2:3c:f2:8d","172.20.0.3","172.20.0.2","TLSv1.3","Change Cipher Spec, Application Data"
"69","1.173225885","66","6e:9f:ff:47:5d:4f","b2:92:d2:3c:f2:8d","172.20.0.3","172.20.0.2","TCP","58860 → 4433 [RST, ACK] Seq=1368 Ack=1472 Win=64128 Len=0 TSval=2186072263 TSecr=2880643191"
"70","1.187082929","74","6e:9f:ff:47:5d:4f","b2:92:d2:3c:f2:8d","172.20.0.3","172.20.0.2","TCP","58874 → 4433 [SYN] Seq=0 Win=64240 Len=0 MSS=1460 SACK_PERM TSval=2186072277 TSecr=0 WS=128"
"71","1.187112372","74","b2:92:d2:3c:f2:8d","6e:9f:ff:47:5d:4f","172.20.0.2","172.20.0.3","TCP","4433 → 58874 [SYN, ACK] Seq=0 Ack=1 Win=65160 Len=0 MSS=1460 SACK_PERM TSval=2880643207 TSecr=2186072277 WS=128"
"72","1.187130009","66","6e:9f:ff:47:5d:4f","b2:92:d2:3c:f2:8d","172.20.0.3","172.20.0.2","TCP","58874 → 4433 [ACK] Seq=1 Ack=1 Win=64256 Len=0 TSval=2186072277 TSecr=2880643207"
"73","1.187179026","1353","6e:9f:ff:47:5d:4f","b2:92:d2:3c:f2:8d","172.20.0.3","172.20.0.2","TLSv1.2","Client Hello"
"74","1.187185099","66","b2:92:d2:3c:f2:8d","6e:9f:ff:47:5d:4f","172.20.0.2","172.20.0.3","TCP","4433 → 58874 [ACK] Seq=1 Ack=1288 Win=64128 Len=0 TSval=2880643207 TSecr=2186072277"
"75","1.188787033","1537","b2:92:d2:3c:f2:8d","6e:9f:ff:47:5d:4f","172.20.0.2","172.20.0.3","TLSv1.3","Server Hello, Change Cipher Spec, Application Data, Application Data, Application Data, Application Data"
"76","1.188825880","66","6e:9f:ff:47:5d:4f","b2:92:d2:3c:f2:8d","172.20.0.3","172.20.0.2","TCP","58874 → 4433 [ACK] Seq=1288 Ack=1472 Win=64128 Len=0 TSval=2186072279 TSecr=2880643209"
"77","1.191383982","146","6e:9f:ff:47:5d:4f","b2:92:d2:3c:f2:8d","172.20.0.3","172.20.0.2","TLSv1.3","Change Cipher Spec, Application Data"
"78","1.191448632","66","6e:9f:ff:47:5d:4f","b2:92:d2:3c:f2:8d","172.20.0.3","172.20.0.2","TCP","58874 → 4433 [RST, ACK] Seq=1368 Ack=1472 Win=64128 Len=0 TSval=2186072282 TSecr=2880643209"
"79","1.205981578","74","6e:9f:ff:47:5d:4f","b2:92:d2:3c:f2:8d","172.20.0.3","172.20.0.2","TCP","58882 → 4433 [SYN] Seq=0 Win=64240 Len=0 MSS=1460 SACK_PERM TSval=2186072296 TSecr=0 WS=128"
"80","1.206017210","74","b2:92:d2:3c:f2:8d","6e:9f:ff:47:5d:4f","172.20.0.2","172.20.0.3","TCP","4433 → 58882 [SYN, ACK] Seq=0 Ack=1 Win=65160 Len=0 MSS=1460 SACK_PERM TSval=2880643226 TSecr=2186072296 WS=128"
"81","1.206041679","66","6e:9f:ff:47:5d:4f","b2:92:d2:3c:f2:8d","172.20.0.3","172.20.0.2","TCP","58882 → 4433 [ACK] Seq=1 Ack=1 Win=64256 Len=0 TSval=2186072296 TSecr=2880643226"
"82","1.206099460","1353","6e:9f:ff:47:5d:4f","b2:92:d2:3c:f2:8d","172.20.0.3","172.20.0.2","TLSv1.2","Client Hello"
"83","1.206109281","66","b2:92:d2:3c:f2:8d","6e:9f:ff:47:5d:4f","172.20.0.2","172.20.0.3","TCP","4433 → 58882 [ACK] Seq=1 Ack=1288 Win=64128 Len=0 TSval=2880643226 TSecr=2186072296"
"84","1.211278761","89","b2:92:d2:3c:f2:8d","6e:9f:ff:47:5d:4f","172.20.0.2","172.20.0.3","SSL","[TCP Previous segment not captured] , Continuation Data"
"85","1.211329066","78","6e:9f:ff:47:5d:4f","b2:92:d2:3c:f2:8d","172.20.0.3","172.20.0.2","TCP","[TCP Dup ACK 81#1] 58882 → 4433 [ACK] Seq=1288 Ack=1 Win=64256 Len=0 TSval=2186072302 TSecr=2880643226 SLE=1449 SRE=1472"
"86","1.211340072","1514","b2:92:d2:3c:f2:8d","6e:9f:ff:47:5d:4f","172.20.0.2","172.20.0.3","TCP","[TCP Retransmission] 4433 → 58882 [ACK] Seq=1 Ack=1288 Win=64128 Len=1448 TSval=2880643232 TSecr=2186072302"
"87","1.211355007","66","6e:9f:ff:47:5d:4f","b2:92:d2:3c:f2:8d","172.20.0.3","172.20.0.2","TCP","58882 → 4433 [ACK] Seq=1288 Ack=1472 Win=64128 Len=0 TSval=2186072302 TSecr=2880643232"
"88","1.214265216","146","6e:9f:ff:47:5d:4f","b2:92:d2:3c:f2:8d","172.20.0.3","172.20.0.2","TLSv1.2","Change Cipher Spec, Application Data"
"89","1.214339005","66","6e:9f:ff:47:5d:4f","b2:92:d2:3c:f2:8d","172.20.0.3","172.20.0.2","TCP","58882 → 4433 [RST, ACK] Seq=1368 Ack=1472 Win=64128 Len=0 TSval=2186072305 TSecr=2880643232"
"90","1.228971563","74","6e:9f:ff:47:5d:4f","b2:92:d2:3c:f2:8d","172.20.0.3","172.20.0.2","TCP","58894 → 4433 [SYN] Seq=0 Win=64240 Len=0 MSS=1460 SACK_PERM TSval=2186072319 TSecr=0 WS=128"
"91","1.229000609","74","b2:92:d2:3c:f2:8d","6e:9f:ff:47:5d:4f","172.20.0.2","172.20.0.3","TCP","4433 → 58894 [SYN, ACK] Seq=0 Ack=1 Win=65160 Len=0 MSS=1460 SACK_PERM TSval=2880643249 TSecr=2186072319 WS=128"
"92","1.229018626","66","6e:9f:ff:47:5d:4f","b2:92:d2:3c:f2:8d","172.20.0.3","172.20.0.2","TCP","58894 → 4433 [ACK] Seq=1 Ack=1 Win=64256 Len=0 TSval=2186072319 TSecr=2880643249"
"93","1.229072113","1353","6e:9f:ff:47:5d:4f","b2:92:d2:3c:f2:8d","172.20.0.3","172.20.0.2","TLSv1.2","Client Hello"
"94","1.229077282","66","b2:92:d2:3c:f2:8d","6e:9f:ff:47:5d:4f","172.20.0.2","172.20.0.3","TCP","4433 → 58894 [ACK] Seq=1 Ack=1288 Win=64128 Len=0 TSval=2880643249 TSecr=2186072319"
"95","1.230782155","1537","b2:92:d2:3c:f2:8d","6e:9f:ff:47:5d:4f","172.20.0.2","172.20.0.3","TLSv1.3","Server Hello, Change Cipher Spec, Application Data, Application Data, Application Data, Application Data"
"96","1.230827876","66","6e:9f:ff:47:5d:4f","b2:92:d2:3c:f2:8d","172.20.0.3","172.20.0.2","TCP","58894 → 4433 [ACK] Seq=1288 Ack=1472 Win=64128 Len=0 TSval=2186072321 TSecr=2880643251"
"97","1.233456128","146","6e:9f:ff:47:5d:4f","b2:92:d2:3c:f2:8d","172.20.0.3","172.20.0.2","TLSv1.3","Change Cipher Spec, Application Data"
"98","1.233525560","66","6e:9f:ff:47:5d:4f","b2:92:d2:3c:f2:8d","172.20.0.3","172.20.0.2","TCP","58894 → 4433 [RST, ACK] Seq=1368 Ack=1472 Win=64128 Len=0 TSval=2186072324 TSecr=2880643251"
"99","1.247562449","74","6e:9f:ff:47:5d:4f","b2:92:d2:3c:f2:8d","172.20.0.3","172.20.0.2","TCP","58902 → 4433 [SYN] Seq=0 Win=64240 Len=0 MSS=1460 SACK_PERM TSval=2186072338 TSecr=0 WS=128"
"100","2.000833428","42","6e:9f:ff:47:5d:4f","ff:ff:ff:ff:ff:ff",,,"ARP","ARP Announcement for 172.20.0.3"
"101","2.282309694","74","b2:92:d2:3c:f2:8d","6e:9f:ff:47:5d:4f","172.20.0.2","172.20.0.3","TCP","4433 → 58902 [SYN, ACK] Seq=0 Ack=1 Win=65160 Len=0 MSS=1460 SACK_PERM TSval=2880644303 TSecr=2186072338 WS=128"
"102","2.282346452","74","6e:9f:ff:47:5d:4f","b2:92:d2:3c:f2:8d","172.20.0.3","172.20.0.2","TCP","[TCP Retransmission] 58902 → 4433 [SYN] Seq=0 Win=64240 Len=0 MSS=1460 SACK_PERM TSval=2186073373 TSecr=0 WS=128"
"103","2.282404964","66","6e:9f:ff:47:5d:4f","b2:92:d2:3c:f2:8d","172.20.0.3","172.20.0.2","TCP","58902 → 4433 [ACK] Seq=1 Ack=1 Win=64256 Len=0 TSval=2186073373 TSecr=2880644303"
"104","2.282492604","1353","6e:9f:ff:47:5d:4f","b2:92:d2:3c:f2:8d","172.20.0.3","172.20.0.2","TLSv1.2","Client Hello"
"105","2.282507937","66","b2:92:d2:3c:f2:8d","6e:9f:ff:47:5d:4f","172.20.0.2","172.20.0.3","TCP","4433 → 58902 [ACK] Seq=1 Ack=1288 Win=64128 Len=0 TSval=2880644303 TSecr=2186073373"
"106","2.490288101","89","b2:92:d2:3c:f2:8d","6e:9f:ff:47:5d:4f","172.20.0.2","172.20.0.3","SSL","[TCP Previous segment not captured] , Continuation Data"
"107","2.490359492","78","6e:9f:ff:47:5d:4f","b2:92:d2:3c:f2:8d","172.20.0.3","172.20.0.2","TCP","[TCP Dup ACK 103#1] 58902 → 4433 [ACK] Seq=1288 Ack=1 Win=64256 Len=0 TSval=2186073581 TSecr=2880644303 SLE=1449 SRE=1472"
"108","2.490373351","1514","b2:92:d2:3c:f2:8d","6e:9f:ff:47:5d:4f","172.20.0.2","172.20.0.3","TCP","[TCP Retransmission] 4433 → 58902 [ACK] Seq=1 Ack=1288 Win=64128 Len=1448 TSval=2880644511 TSecr=2186073581"
"109","2.490396259","66","6e:9f:ff:47:5d:4f","b2:92:d2:3c:f2:8d","172.20.0.3","172.20.0.2","TCP","58902 → 4433 [ACK] Seq=1288 Ack=1472 Win=64128 Len=0 TSval=2186073581 TSecr=2880644511"
"110","2.493396973","146","6e:9f:ff:47:5d:4f","b2:92:d2:3c:f2:8d","172.20.0.3","172.20.0.2","TLSv1.2","Change Cipher Spec, Application Data"
"111","2.493471751","66","6e:9f:ff:47:5d:4f","b2:92:d2:3c:f2:8d","172.20.0.3","172.20.0.2","TCP","58902 → 4433 [RST, ACK] Seq=1368 Ack=1472 Win=64128 Len=0 TSval=2186073584 TSecr=2880644511"
"112","2.508240392","74","6e:9f:ff:47:5d:4f","b2:92:d2:3c:f2:8d","172.20.0.3","172.20.0.2","TCP","58918 → 4433 [SYN] Seq=0 Win=64240 Len=0 MSS=1460 SACK_PERM TSval=2186073598 TSecr=0 WS=128"
"113","2.508280736","74","b2:92:d2:3c:f2:8d","6e:9f:ff:47:5d:4f","172.20.0.2","172.20.0.3","TCP","4433 → 58918 [SYN, ACK] Seq=0 Ack=1 Win=65160 Len=0 MSS=1460 SACK_PERM TSval=2880644529 TSecr=2186073598 WS=128"
"114","2.508299383","66","6e:9f:ff:47:5d:4f","b2:92:d2:3c:f2:8d","172.20.0.3","172.20.0.2","TCP","58918 → 4433 [ACK] Seq=1 Ack=1 Win=64256 Len=0 TSval=2186073599 TSecr=2880644529"
"115","2.508345204","1353","6e:9f:ff:47:5d:4f","b2:92:d2:3c:f2:8d","172.20.0.3","172.20.0.2","TLSv1.2","Client Hello"
"116","2.508350198","66","b2:92:d2:3c:f2:8d","6e:9f:ff:47:5d:4f","172.20.0.2","172.20.0.3","TCP","4433 → 58918 [ACK] Seq=1 Ack=1288 Win=64128 Len=0 TSval=2880644529 TSecr=2186073599"
"117","2.514269180","89","b2:92:d2:3c:f2:8d","6e:9f:ff:47:5d:4f","172.20.0.2","172.20.0.3","SSL","[TCP Previous segment not captured] , Continuation Data"
"118","2.514304134","78","6e:9f:ff:47:5d:4f","b2:92:d2:3c:f2:8d","172.20.0.3","172.20.0.2","TCP","[TCP Dup ACK 114#1] 58918 → 4433 [ACK] Seq=1288 Ack=1 Win=64256 Len=0 TSval=2186073605 TSecr=2880644529 SLE=1449 SRE=1472"
"119","2.722289130","1514","b2:92:d2:3c:f2:8d","6e:9f:ff:47:5d:4f","172.20.0.2","172.20.0.3","TCP","[TCP Retransmission] 4433 → 58918 [ACK] Seq=1 Ack=1288 Win=64128 Len=1448 TSval=2880644743 TSecr=2186073605"
"120","2.722359126","66","6e:9f:ff:47:5d:4f","b2:92:d2:3c:f2:8d","172.20.0.3","172.20.0.2","TCP","58918 → 4433 [ACK] Seq=1288 Ack=1472 Win=64128 Len=0 TSval=2186073813 TSecr=2880644743"
"121","2.725318152","146","6e:9f:ff:47:5d:4f","b2:92:d2:3c:f2:8d","172.20.0.3","172.20.0.2","TLSv1.2","Change Cipher Spec, Application Data"
"122","2.725405331","66","6e:9f:ff:47:5d:4f","b2:92:d2:3c:f2:8d","172.20.0.3","172.20.0.2","TCP","58918 → 4433 [RST, ACK] Seq=1368 Ack=1472 Win=64128 Len=0 TSval=2186073816 TSecr=2880644743"
"123","2.739692112","74","6e:9f:ff:47:5d:4f","b2:92:d2:3c:f2:8d","172.20.0.3","172.20.0.2","TCP","58932 → 4433 [SYN] Seq=0 Win=64240 Len=0 MSS=1460 SACK_PERM TSval=2186073830 TSecr=0 WS=128"
"124","3.754321436","74","b2:92:d2:3c:f2:8d","6e:9f:ff:47:5d:4f","172.20.0.2","172.20.0.3","TCP","4433 → 58932 [SYN, ACK] Seq=0 Ack=1 Win=65160 Len=0 MSS=1460 SACK_PERM TSval=2880645775 TSecr=2186073830 WS=128"
"125","3.754354544","74","6e:9f:ff:47:5d:4f","b2:92:d2:3c:f2:8d","172.20.0.3","172.20.0.2","TCP","[TCP Retransmission] 58932 → 4433 [SYN] Seq=0 Win=64240 Len=0 MSS=1460 SACK_PERM TSval=2186074845 TSecr=0 WS=128"
"126","3.754371348","74","b2:92:d2:3c:f2:8d","6e:9f:ff:47:5d:4f","172.20.0.2","172.20.0.3","TCP","[TCP Retransmission] 4433 → 58932 [SYN, ACK] Seq=0 Ack=1 Win=65160 Len=0 MSS=1460 SACK_PERM TSval=2880645775 TSecr=2186073830 WS=128"
"127","3.754405375","66","6e:9f:ff:47:5d:4f","b2:92:d2:3c:f2:8d","172.20.0.3","172.20.0.2","TCP","58932 → 4433 [ACK] Seq=1 Ack=1 Win=64256 Len=0 TSval=2186074845 TSecr=2880645775"
"128","3.754438242","66","6e:9f:ff:47:5d:4f","b2:92:d2:3c:f2:8d","172.20.0.3","172.20.0.2","TCP","[TCP Dup ACK 127#1] 58932 → 4433 [ACK] Seq=1 Ack=1 Win=64256 Len=0 TSval=2186074845 TSecr=2880645775"
"129","3.754513963","1353","6e:9f:ff:47:5d:4f","b2:92:d2:3c:f2:8d","172.20.0.3","172.20.0.2","TLSv1.2","Client Hello"
"130","3.754520503","66","b2:92:d2:3c:f2:8d","6e:9f:ff:47:5d:4f","172.20.0.2","172.20.0.3","TCP","4433 → 58932 [ACK] Seq=1 Ack=1288 Win=64128 Len=0 TSval=2880645775 TSecr=2186074845"
"131","3.756285453","1514","b2:92:d2:3c:f2:8d","6e:9f:ff:47:5d:4f","172.20.0.2","172.20.0.3","TLSv1.3","Server Hello, Change Cipher Spec, Application Data, Application Data, Application Data"
"132","3.756324771","66","6e:9f:ff:47:5d:4f","b2:92:d2:3c:f2:8d","172.20.0.3","172.20.0.2","TCP","58932 → 4433 [ACK] Seq=1288 Ack=1449 Win=64128 Len=0 TSval=2186074847 TSecr=2880645777"
"133","3.756334038","89","b2:92:d2:3c:f2:8d","6e:9f:ff:47:5d:4f","172.20.0.2","172.20.0.3","TLSv1.3","Application Data"
"134","3.756339336","66","6e:9f:ff:47:5d:4f","b2:92:d2:3c:f2:8d","172.20.0.3","172.20.0.2","TCP","58932 → 4433 [ACK] Seq=1288 Ack=1472 Win=64128 Len=0 TSval=2186074847 TSecr=2880645777"
"135","3.759035167","146","6e:9f:ff:47:5d:4f","b2:92:d2:3c:f2:8d","172.20.0.3","172.20.0.2","TLSv1.3","Change Cipher Spec, Application Data"
"136","3.759110039","66","6e:9f:ff:47:5d:4f","b2:92:d2:3c:f2:8d","172.20.0.3","172.20.0.2","TCP","58932 → 4433 [RST, ACK] Seq=1368 Ack=1472 Win=64128 Len=0 TSval=2186074849 TSecr=2880645777"
"137","3.773283696","74","6e:9f:ff:47:5d:4f","b2:92:d2:3c:f2:8d","172.20.0.3","172.20.0.2","TCP","58948 → 4433 [SYN] Seq=0 Win=64240 Len=0 MSS=1460 SACK_PERM TSval=2186074863 TSecr=0 WS=128"
"138","3.773314057","74","b2:92:d2:3c:f2:8d","6e:9f:ff:47:5d:4f","172.20.0.2","172.20.0.3","TCP","4433 → 58948 [SYN, ACK] Seq=0 Ack=1 Win=65160 Len=0 MSS=1460 SACK_PERM TSval=2880645794 TSecr=2186074863 WS=128"
"139","3.773332336","66","6e:9f:ff:47:5d:4f","b2:92:d2:3c:f2:8d","172.20.0.3","172.20.0.2","TCP","58948 → 4433 [ACK] Seq=1 Ack=1 Win=64256 Len=0 TSval=2186074864 TSecr=2880645794"
"140","3.773381184","1353","6e:9f:ff:47:5d:4f","b2:92:d2:3c:f2:8d","172.20.0.3","172.20.0.2","TLSv1.2","Client Hello"
"141","3.775116804","1537","b2:92:d2:3c:f2:8d","6e:9f:ff:47:5d:4f","172.20.0.2","172.20.0.3","TLSv1.3","Server Hello, Change Cipher Spec, Application Data, Application Data, Application Data, Application Data"
"142","3.775167605","66","6e:9f:ff:47:5d:4f","b2:92:d2:3c:f2:8d","172.20.0.3","172.20.0.2","TCP","58948 → 4433 [ACK] Seq=1288 Ack=1472 Win=64128 Len=0 TSval=2186074865 TSecr=2880645795"
"143","3.777755401","146","6e:9f:ff:47:5d:4f","b2:92:d2:3c:f2:8d","172.20.0.3","172.20.0.2","TLSv1.3","Change Cipher Spec, Application Data"
"144","3.777823630","66","6e:9f:ff:47:5d:4f","b2:92:d2:3c:f2:8d","172.20.0.3","172.20.0.2","TCP","58948 → 4433 [RST, ACK] Seq=1368 Ack=1472 Win=64128 Len=0 TSval=2186074868 TSecr=2880645795"
"145","3.791996989","74","6e:9f:ff:47:5d:4f","b2:92:d2:3c:f2:8d","172.20.0.3","172.20.0.2","TCP","58950 → 4433 [SYN] Seq=0 Win=64240 Len=0 MSS=1460 SACK_PERM TSval=2186074882 TSecr=0 WS=128"
"146","3.792025991","74","b2:92:d2:3c:f2:8d","6e:9f:ff:47:5d:4f","172.20.0.2","172.20.0.3","TCP","4433 → 58950 [SYN, ACK] Seq=0 Ack=1 Win=65160 Len=0 MSS=1460 SACK_PERM TSval=2880645812 TSecr=2186074882 WS=128"
"147","3.792045860","66","6e:9f:ff:47:5d:4f","b2:92:d2:3c:f2:8d","172.20.0.3","172.20.0.2","TCP","58950 → 4433 [ACK] Seq=1 Ack=1 Win=64256 Len=0 TSval=2186074882 TSecr=2880645812"
"148","3.792091447","1353","6e:9f:ff:47:5d:4f","b2:92:d2:3c:f2:8d","172.20.0.3","172.20.0.2","TLSv1.2","Client Hello"
"149","3.792097998","66","b2:92:d2:3c:f2:8d","6e:9f:ff:47:5d:4f","172.20.0.2","172.20.0.3","TCP","4433 → 58950 [ACK] Seq=1 Ack=1288 Win=64128 Len=0 TSval=2880645812 TSecr=2186074882"
"150","3.793803044","1537","b2:92:d2:3c:f2:8d","6e:9f:ff:47:5d:4f","172.20.0.2","172.20.0.3","TLSv1.3","Server Hello, Change Cipher Spec, Application Data, Application Data, Application Data, Application Data"
"151","3.793838095","66","6e:9f:ff:47:5d:4f","b2:92:d2:3c:f2:8d","172.20.0.3","172.20.0.2","TCP","58950 → 4433 [ACK] Seq=1288 Ack=1472 Win=64128 Len=0 TSval=2186074884 TSecr=2880645814"
"152","3.796456894","146","6e:9f:ff:47:5d:4f","b2:92:d2:3c:f2:8d","172.20.0.3","172.20.0.2","TLSv1.3","Change Cipher Spec, Application Data"
"153","3.796537026","66","6e:9f:ff:47:5d:4f","b2:92:d2:3c:f2:8d","172.20.0.3","172.20.0.2","TCP","58950 → 4433 [RST, ACK] Seq=1368 Ack=1472 Win=64128 Len=0 TSval=2186074887 TSecr=2880645814"
"154","3.812853133","74","6e:9f:ff:47:5d:4f","b2:92:d2:3c:f2:8d","172.20.0.3","172.20.0.2","TCP","58962 → 4433 [SYN] Seq=0 Win=64240 Len=0 MSS=1460 SACK_PERM TSval=2186074903 TSecr=0 WS=128"
"155","3.812884178","74","b2:92:d2:3c:f2:8d","6e:9f:ff:47:5d:4f","172.20.0.2","172.20.0.3","TCP","4433 → 58962 [SYN, ACK] Seq=0 Ack=1 Win=65160 Len=0 MSS=1460 SACK_PERM TSval=2880645833 TSecr=2186074903 WS=128"
"156","3.812901950","66","6e:9f:ff:47:5d:4f","b2:92:d2:3c:f2:8d","172.20.0.3","172.20.0.2","TCP","58962 → 4433 [ACK] Seq=1 Ack=1 Win=64256 Len=0 TSval=2186074903 TSecr=2880645833"
"157","3.812947363","1353","6e:9f:ff:47:5d:4f","b2:92:d2:3c:f2:8d","172.20.0.3","172.20.0.2","TLSv1.2","Client Hello"
"158","3.812953285","66","b2:92:d2:3c:f2:8d","6e:9f:ff:47:5d:4f","172.20.0.2","172.20.0.3","TCP","4433 → 58962 [ACK] Seq=1 Ack=1288 Win=64128 Len=0 TSval=2880645833 TSecr=2186074903"
"159","3.818277125","89","b2:92:d2:3c:f2:8d","6e:9f:ff:47:5d:4f","172.20.0.2","172.20.0.3","SSL","[TCP Previous segment not captured] , Continuation Data"
"160","3.818305508","78","6e:9f:ff:47:5d:4f","b2:92:d2:3c:f2:8d","172.20.0.3","172.20.0.2","TCP","[TCP Dup ACK 156#1] 58962 → 4433 [ACK] Seq=1288 Ack=1 Win=64256 Len=0 TSval=2186074909 TSecr=2880645833 SLE=1449 SRE=1472"
"161","4.026292779","1514","b2:92:d2:3c:f2:8d","6e:9f:ff:47:5d:4f","172.20.0.2","172.20.0.3","TCP","[TCP Retransmission] 4433 → 58962 [ACK] Seq=1 Ack=1288 Win=64128 Len=1448 TSval=2880646047 TSecr=2186074909"
"162","4.026359363","66","6e:9f:ff:47:5d:4f","b2:92:d2:3c:f2:8d","172.20.0.3","172.20.0.2","TCP","58962 → 4433 [ACK] Seq=1288 Ack=1472 Win=64128 Len=0 TSval=2186075117 TSecr=2880646047"
"163","4.029295825","146","6e:9f:ff:47:5d:4f","b2:92:d2:3c:f2:8d","172.20.0.3","172.20.0.2","TLSv1.2","Change Cipher Spec, Application Data"
"164","4.029373335","66","6e:9f:ff:47:5d:4f","b2:92:d2:3c:f2:8d","172.20.0.3","172.20.0.2","TCP","58962 → 4433 [RST, ACK] Seq=1368 Ack=1472 Win=64128 Len=0 TSval=2186075120 TSecr=2880646047"
"165","4.043555264","74","6e:9f:ff:47:5d:4f","b2:92:d2:3c:f2:8d","172.20.0.3","172.20.0.2","TCP","58970 → 4433 [SYN] Seq=0 Win=64240 Len=0 MSS=1460 SACK_PERM TSval=2186075134 TSecr=0 WS=128"
"166","4.043586986","74","b2:92:d2:3c:f2:8d","6e:9f:ff:47:5d:4f","172.20.0.2","172.20.0.3","TCP","4433 → 58970 [SYN, ACK] Seq=0 Ack=1 Win=65160 Len=0 MSS=1460 SACK_PERM TSval=2880646064 TSecr=2186075134 WS=128"
"167","4.043607275","66","6e:9f:ff:47:5d:4f","b2:92:d2:3c:f2:8d","172.20.0.3","172.20.0.2","TCP","58970 → 4433 [ACK] Seq=1 Ack=1 Win=64256 Len=0 TSval=2186075134 TSecr=2880646064"
"168","4.043652802","1353","6e:9f:ff:47:5d:4f","b2:92:d2:3c:f2:8d","172.20.0.3","172.20.0.2","TLSv1.2","Client Hello"
"169","4.043659987","66","b2:92:d2:3c:f2:8d","6e:9f:ff:47:5d:4f","172.20.0.2","172.20.0.3","TCP","4433 → 58970 [ACK] Seq=1 Ack=1288 Win=64128 Len=0 TSval=2880646064 TSecr=2186075134"
"170","4.045388138","1537","b2:92:d2:3c:f2:8d","6e:9f:ff:47:5d:4f","172.20.0.2","172.20.0.3","TLSv1.3","Server Hello, Change Cipher Spec, Application Data, Application Data, Application Data, Application Data"
"171","4.045423635","66","6e:9f:ff:47:5d:4f","b2:92:d2:3c:f2:8d","172.20.0.3","172.20.0.2","TCP","58970 → 4433 [ACK] Seq=1288 Ack=1472 Win=64128 Len=0 TSval=2186075136 TSecr=2880646066"
"172","4.047815920","146","6e:9f:ff:47:5d:4f","b2:92:d2:3c:f2:8d","172.20.0.3","172.20.0.2","TLSv1.3","Change Cipher Spec, Application Data"
"173","4.047872480","66","6e:9f:ff:47:5d:4f","b2:92:d2:3c:f2:8d","172.20.0.3","172.20.0.2","TCP","58970 → 4433 [RST, ACK] Seq=1368 Ack=1472 Win=64128 Len=0 TSval=2186075138 TSecr=2880646066"
"174","4.061959110","74","6e:9f:ff:47:5d:4f","b2:92:d2:3c:f2:8d","172.20.0.3","172.20.0.2","TCP","58972 → 4433 [SYN] Seq=0 Win=64240 Len=0 MSS=1460 SACK_PERM TSval=2186075152 TSecr=0 WS=128"
"175","4.061986174","74","b2:92:d2:3c:f2:8d","6e:9f:ff:47:5d:4f","172.20.0.2","172.20.0.3","TCP","4433 → 58972 [SYN, ACK] Seq=0 Ack=1 Win=65160 Len=0 MSS=1460 SACK_PERM TSval=2880646082 TSecr=2186075152 WS=128"
"176","4.062004466","66","6e:9f:ff:47:5d:4f","b2:92:d2:3c:f2:8d","172.20.0.3","172.20.0.2","TCP","58972 → 4433 [ACK] Seq=1 Ack=1 Win=64256 Len=0 TSval=2186075152 TSecr=2880646082"
"177","4.062065968","1353","6e:9f:ff:47:5d:4f","b2:92:d2:3c:f2:8d","172.20.0.3","172.20.0.2","TLSv1.2","Client Hello"
"178","4.062071246","66","b2:92:d2:3c:f2:8d","6e:9f:ff:47:5d:4f","172.20.0.2","172.20.0.3","TCP","4433 → 58972 [ACK] Seq=1 Ack=1288 Win=64128 Len=0 TSval=2880646082 TSecr=2186075152"
"179","4.063822076","1537","b2:92:d2:3c:f2:8d","6e:9f:ff:47:5d:4f","172.20.0.2","172.20.0.3","TLSv1.3","Server Hello, Change Cipher Spec, Application Data, Application Data, Application Data, Application Data"
"180","4.063858186","66","6e:9f:ff:47:5d:4f","b2:92:d2:3c:f2:8d","172.20.0.3","172.20.0.2","TCP","58972 → 4433 [ACK] Seq=1288 Ack=1472 Win=64128 Len=0 TSval=2186075154 TSecr=2880646084"
"181","4.066364782","146","6e:9f:ff:47:5d:4f","b2:92:d2:3c:f2:8d","172.20.0.3","172.20.0.2","TLSv1.3","Change Cipher Spec, Application Data"
"182","4.066430831","66","6e:9f:ff:47:5d:4f","b2:92:d2:3c:f2:8d","172.20.0.3","172.20.0.2","TCP","58972 → 4433 [RST, ACK] Seq=1368 Ack=1472 Win=64128 Len=0 TSval=2186075157 TSecr=2880646084"
"183","4.080212734","74","6e:9f:ff:47:5d:4f","b2:92:d2:3c:f2:8d","172.20.0.3","172.20.0.2","TCP","58976 → 4433 [SYN] Seq=0 Win=64240 Len=0 MSS=1460 SACK_PERM TSval=2186075170 TSecr=0 WS=128"
"184","4.080240817","74","b2:92:d2:3c:f2:8d","6e:9f:ff:47:5d:4f","172.20.0.2","172.20.0.3","TCP","4433 → 58976 [SYN, ACK] Seq=0 Ack=1 Win=65160 Len=0 MSS=1460 SACK_PERM TSval=2880646100 TSecr=2186075170 WS=128"
"185","4.080302794","66","6e:9f:ff:47:5d:4f","b2:92:d2:3c:f2:8d","172.20.0.3","172.20.0.2","TCP","58976 → 4433 [ACK] Seq=1 Ack=1 Win=64256 Len=0 TSval=2186075171 TSecr=2880646100"
"186","4.080353984","1353","6e:9f:ff:47:5d:4f","b2:92:d2:3c:f2:8d","172.20.0.3","172.20.0.2","TLSv1.2","Client Hello"
"187","4.080371924","66","b2:92:d2:3c:f2:8d","6e:9f:ff:47:5d:4f","172.20.0.2","172.20.0.3","TCP","4433 → 58976 [ACK] Seq=1 Ack=1288 Win=64128 Len=0 TSval=2880646101 TSecr=2186075171"
"188","4.082082758","1537","b2:92:d2:3c:f2:8d","6e:9f:ff:47:5d:4f","172.20.0.2","172.20.0.3","TLSv1.3","Server Hello, Change Cipher Spec, Application Data, Application Data, Application Data, Application Data"
"189","4.082117774","66","6e:9f:ff:47:5d:4f","b2:92:d2:3c:f2:8d","172.20.0.3","172.20.0.2","TCP","58976 → 4433 [ACK] Seq=1288 Ack=1472 Win=64128 Len=0 TSval=2186075172 TSecr=2880646102"
"190","4.084812944","146","6e:9f:ff:47:5d:4f","b2:92:d2:3c:f2:8d","172.20.0.3","172.20.0.2","TLSv1.3","Change Cipher Spec, Application Data"
"191","4.084876978","66","6e:9f:ff:47:5d:4f","b2:92:d2:3c:f2:8d","172.20.0.3","172.20.0.2","TCP","58976 → 4433 [RST, ACK] Seq=1368 Ack=1472 Win=64128 Len=0 TSval=2186075175 TSecr=2880646102"
"192","4.098454445","74","6e:9f:ff:47:5d:4f","b2:92:d2:3c:f2:8d","172.20.0.3","172.20.0.2","TCP","58984 → 4433 [SYN] Seq=0 Win=64240 Len=0 MSS=1460 SACK_PERM TSval=2186075189 TSecr=0 WS=128"
"193","5.162338761","74","6e:9f:ff:47:5d:4f","b2:92:d2:3c:f2:8d","172.20.0.3","172.20.0.2","TCP","[TCP Retransmission] 58984 → 4433 [SYN] Seq=0 Win=64240 Len=0 MSS=1460 SACK_PERM TSval=2186076253 TSecr=0 WS=128"
"194","6.186342624","74","6e:9f:ff:47:5d:4f","b2:92:d2:3c:f2:8d","172.20.0.3","172.20.0.2","TCP","[TCP Retransmission] 58984 → 4433 [SYN] Seq=0 Win=64240 Len=0 MSS=1460 SACK_PERM TSval=2186077277 TSecr=0 WS=128"
"195","6.186373909","74","b2:92:d2:3c:f2:8d","6e:9f:ff:47:5d:4f","172.20.0.2","172.20.0.3","TCP","4433 → 58984 [SYN, ACK] Seq=0 Ack=1 Win=65160 Len=0 MSS=1460 SACK_PERM TSval=2880648207 TSecr=2186075189 WS=128"
"196","6.186421456","66","6e:9f:ff:47:5d:4f","b2:92:d2:3c:f2:8d","172.20.0.3","172.20.0.2","TCP","58984 → 4433 [ACK] Seq=1 Ack=1 Win=64256 Len=0 TSval=2186077277 TSecr=2880648207"
"197","6.186511091","1353","6e:9f:ff:47:5d:4f","b2:92:d2:3c:f2:8d","172.20.0.3","172.20.0.2","TLSv1.2","Client Hello"
"198","6.186526108","66","b2:92:d2:3c:f2:8d","6e:9f:ff:47:5d:4f","172.20.0.2","172.20.0.3","TCP","4433 → 58984 [ACK] Seq=1 Ack=1288 Win=64128 Len=0 TSval=2880648207 TSecr=2186077277"
"199","6.188373912","1514","b2:92:d2:3c:f2:8d","6e:9f:ff:47:5d:4f","172.20.0.2","172.20.0.3","TLSv1.3","Server Hello, Change Cipher Spec, Application Data, Application Data, Application Data"
"200","6.188402256","66","6e:9f:ff:47:5d:4f","b2:92:d2:3c:f2:8d","172.20.0.3","172.20.0.2","TCP","58984 → 4433 [ACK] Seq=1288 Ack=1449 Win=64128 Len=0 TSval=2186077279 TSecr=2880648209"
"201","6.188410899","89","b2:92:d2:3c:f2:8d","6e:9f:ff:47:5d:4f","172.20.0.2","172.20.0.3","TLSv1.3","Application Data"
"202","6.188417031","66","6e:9f:ff:47:5d:4f","b2:92:d2:3c:f2:8d","172.20.0.3","172.20.0.2","TCP","58984 → 4433 [ACK] Seq=1288 Ack=1472 Win=64128 Len=0 TSval=2186077279 TSecr=2880648209"
"203","6.191262267","146","6e:9f:ff:47:5d:4f","b2:92:d2:3c:f2:8d","172.20.0.3","172.20.0.2","TLSv1.3","Change Cipher Spec, Application Data"
"204","6.191326056","66","6e:9f:ff:47:5d:4f","b2:92:d2:3c:f2:8d","172.20.0.3","172.20.0.2","TCP","58984 → 4433 [RST, ACK] Seq=1368 Ack=1472 Win=64128 Len=0 TSval=2186077282 TSecr=2880648209"
"205","6.206428822","74","6e:9f:ff:47:5d:4f","b2:92:d2:3c:f2:8d","172.20.0.3","172.20.0.2","TCP","54698 → 4433 [SYN] Seq=0 Win=64240 Len=0 MSS=1460 SACK_PERM TSval=2186077297 TSecr=0 WS=128"
"206","6.206456321","74","b2:92:d2:3c:f2:8d","6e:9f:ff:47:5d:4f","172.20.0.2","172.20.0.3","TCP","4433 → 54698 [SYN, ACK] Seq=0 Ack=1 Win=65160 Len=0 MSS=1460 SACK_PERM TSval=2880648227 TSecr=2186077297 WS=128"
"207","6.206474644","66","6e:9f:ff:47:5d:4f","b2:92:d2:3c:f2:8d","172.20.0.3","172.20.0.2","TCP","54698 → 4433 [ACK] Seq=1 Ack=1 Win=64256 Len=0 TSval=2186077297 TSecr=2880648227"
"208","6.206531575","1353","6e:9f:ff:47:5d:4f","b2:92:d2:3c:f2:8d","172.20.0.3","172.20.0.2","TLSv1.2","Client Hello"
"209","6.206536959","66","b2:92:d2:3c:f2:8d","6e:9f:ff:47:5d:4f","172.20.0.2","172.20.0.3","TCP","4433 → 54698 [ACK] Seq=1 Ack=1288 Win=64128 Len=0 TSval=2880648227 TSecr=2186077297"
"210","6.208284165","1537","b2:92:d2:3c:f2:8d","6e:9f:ff:47:5d:4f","172.20.0.2","172.20.0.3","TLSv1.3","Server Hello, Change Cipher Spec, Application Data, Application Data, Application Data, Application Data"
"211","6.208324467","66","6e:9f:ff:47:5d:4f","b2:92:d2:3c:f2:8d","172.20.0.3","172.20.0.2","TCP","54698 → 4433 [ACK] Seq=1288 Ack=1472 Win=64128 Len=0 TSval=2186077299 TSecr=2880648229"
"212","6.210926410","146","6e:9f:ff:47:5d:4f","b2:92:d2:3c:f2:8d","172.20.0.3","172.20.0.2","TLSv1.3","Change Cipher Spec, Application Data"
"213","6.211012474","66","6e:9f:ff:47:5d:4f","b2:92:d2:3c:f2:8d","172.20.0.3","172.20.0.2","TCP","54698 → 4433 [RST, ACK] Seq=1368 Ack=1472 Win=64128 Len=0 TSval=2186077301 TSecr=2880648229"
"214","6.225414263","74","6e:9f:ff:47:5d:4f","b2:92:d2:3c:f2:8d","172.20.0.3","172.20.0.2","TCP","54706 → 4433 [SYN] Seq=0 Win=64240 Len=0 MSS=1460 SACK_PERM TSval=2186077316 TSecr=0 WS=128"
"215","7.274330405","74","b2:92:d2:3c:f2:8d","6e:9f:ff:47:5d:4f","172.20.0.2","172.20.0.3","TCP","4433 → 54706 [SYN, ACK] Seq=0 Ack=1 Win=65160 Len=0 MSS=1460 SACK_PERM TSval=2880649295 TSecr=2186077316 WS=128"
"216","7.274384414","74","6e:9f:ff:47:5d:4f","b2:92:d2:3c:f2:8d","172.20.0.3","172.20.0.2","TCP","[TCP Retransmission] 54706 → 4433 [SYN] Seq=0 Win=64240 Len=0 MSS=1460 SACK_PERM TSval=2186078365 TSecr=0 WS=128"
"217","7.274464536","66","6e:9f:ff:47:5d:4f","b2:92:d2:3c:f2:8d","172.20.0.3","172.20.0.2","TCP","54706 → 4433 [ACK] Seq=1 Ack=1 Win=64256 Len=0 TSval=2186078365 TSecr=2880649295"
"218","7.274565434","1353","6e:9f:ff:47:5d:4f","b2:92:d2:3c:f2:8d","172.20.0.3","172.20.0.2","TLSv1.2","Client Hello"
"219","7.274593216","66","b2:92:d2:3c:f2:8d","6e:9f:ff:47:5d:4f","172.20.0.2","172.20.0.3","TCP","4433 → 54706 [ACK] Seq=1 Ack=1288 Win=64128 Len=0 TSval=2880649295 TSecr=2186078365"
"220","7.276359655","1514","b2:92:d2:3c:f2:8d","6e:9f:ff:47:5d:4f","172.20.0.2","172.20.0.3","TLSv1.3","Server Hello, Change Cipher Spec, Application Data, Application Data, Application Data"
"221","7.276389652","66","6e:9f:ff:47:5d:4f","b2:92:d2:3c:f2:8d","172.20.0.3","172.20.0.2","TCP","54706 → 4433 [ACK] Seq=1288 Ack=1449 Win=64128 Len=0 TSval=2186078367 TSecr=2880649297"
"222","7.482295804","89","b2:92:d2:3c:f2:8d","6e:9f:ff:47:5d:4f","172.20.0.2","172.20.0.3","TLSv1.3","Application Data"
"223","7.482386029","66","6e:9f:ff:47:5d:4f","b2:92:d2:3c:f2:8d","172.20.0.3","172.20.0.2","TCP","54706 → 4433 [ACK] Seq=1288 Ack=1472 Win=64128 Len=0 TSval=2186078573 TSecr=2880649503"
"224","7.482650144","146","6e:9f:ff:47:5d:4f","b2:92:d2:3c:f2:8d","172.20.0.3","172.20.0.2","TLSv1.3","Change Cipher Spec, Application Data"
"225","7.482728971","66","6e:9f:ff:47:5d:4f","b2:92:d2:3c:f2:8d","172.20.0.3","172.20.0.2","TCP","54706 → 4433 [RST, ACK] Seq=1368 Ack=1472 Win=64128 Len=0 TSval=2186078573 TSecr=2880649503"
