frame.number,frame.time_relative,frame.len,eth.src,eth.dst,ip.src,ip.dst,_ws.col.protocol,_ws.col.info
"1","0.000000000","42","32:db:2c:c1:a4:ed","ff:ff:ff:ff:ff:ff",,,"ARP","ARP Announcement for 172.20.0.3"
"2","0.032694299","42","32:db:2c:c1:a4:ed","ff:ff:ff:ff:ff:ff",,,"ARP","Who has 172.20.0.2? Tell 172.20.0.3"
"3","0.032726368","42","ba:af:dd:fd:0f:27","32:db:2c:c1:a4:ed",,,"ARP","172.20.0.2 is at ba:af:dd:fd:0f:27"
"4","0.032735574","74","32:db:2c:c1:a4:ed","ba:af:dd:fd:0f:27","172.20.0.3","172.20.0.2","TCP","45050 → 4433 [SYN] Seq=0 Win=64240 Len=0 MSS=1460 SACK_PERM TSval=2188639927 TSecr=0 WS=128"
"5","0.032761033","74","ba:af:dd:fd:0f:27","32:db:2c:c1:a4:ed","172.20.0.2","172.20.0.3","TCP","4433 → 45050 [SYN, ACK] Seq=0 Ack=1 Win=65160 Len=0 MSS=1460 SACK_PERM TSval=2883210857 TSecr=2188639927 WS=128"
"6","0.032781402","66","32:db:2c:c1:a4:ed","ba:af:dd:fd:0f:27","172.20.0.3","172.20.0.2","TCP","45050 → 4433 [ACK] Seq=1 Ack=1 Win=64256 Len=0 TSval=2188639927 TSecr=2883210857"
"7","0.032827040","2056","32:db:2c:c1:a4:ed","ba:af:dd:fd:0f:27","172.20.0.3","172.20.0.2","TLSv1.2","Client Hello"
"8","0.032834163","66","ba:af:dd:fd:0f:27","32:db:2c:c1:a4:ed","172.20.0.2","172.20.0.3","TCP","4433 → 45050 [ACK] Seq=1 Ack=1991 Win=64128 Len=0 TSval=2883210857 TSecr=2188639927"
"9","0.246077799","1514","ba:af:dd:fd:0f:27","32:db:2c:c1:a4:ed","172.20.0.2","172.20.0.3","SSL",""
"10","0.246134822","66","32:db:2c:c1:a4:ed","ba:af:dd:fd:0f:27","172.20.0.3","172.20.0.2","TCP","45050 → 4433 [ACK] Seq=1991 Ack=1449 Win=64128 Len=0 TSval=2188640141 TSecr=2883211071"
"11","0.246148108","1096","ba:af:dd:fd:0f:27","32:db:2c:c1:a4:ed","172.20.0.2","172.20.0.3","TLSv1.3","Server Hello, Change Cipher Spec, Application Data, Application Data, Application Data, Application Data"
"12","0.246155164","66","32:db:2c:c1:a4:ed","ba:af:dd:fd:0f:27","172.20.0.3","172.20.0.2","TCP","45050 → 4433 [ACK] Seq=1991 Ack=2479 Win=64128 Len=0 TSval=2188640141 TSecr=2883211071"
"13","0.251649237","146","32:db:2c:c1:a4:ed","ba:af:dd:fd:0f:27","172.20.0.3","172.20.0.2","TLSv1.3","Change Cipher Spec, Application Data"
"14","0.251728601","66","32:db:2c:c1:a4:ed","ba:af:dd:fd:0f:27","172.20.0.3","172.20.0.2","TCP","45050 → 4433 [RST, ACK] Seq=2071 Ack=2479 Win=64128 Len=0 TSval=2188640146 TSecr=2883211071"
"15","0.263713719","74","32:db:2c:c1:a4:ed","ba:af:dd:fd:0f:27","172.20.0.3","172.20.0.2","TCP","45066 → 4433 [SYN] Seq=0 Win=64240 Len=0 MSS=1460 SACK_PERM TSval=2188640158 TSecr=0 WS=128"
"16","0.263745337","74","ba:af:dd:fd:0f:27","32:db:2c:c1:a4:ed","172.20.0.2","172.20.0.3","TCP","4433 → 45066 [SYN, ACK] Seq=0 Ack=1 Win=65160 Len=0 MSS=1460 SACK_PERM TSval=2883211088 TSecr=2188640158 WS=128"
"17","0.263764019","66","32:db:2c:c1:a4:ed","ba:af:dd:fd:0f:27","172.20.0.3","172.20.0.2","TCP","45066 → 4433 [ACK] Seq=1 Ack=1 Win=64256 Len=0 TSval=2188640158 TSecr=2883211088"
"18","0.263811544","2056","32:db:2c:c1:a4:ed","ba:af:dd:fd:0f:27","172.20.0.3","172.20.0.2","TLSv1.2","Client Hello"
"19","0.263818669","66","ba:af:dd:fd:0f:27","32:db:2c:c1:a4:ed","172.20.0.2","172.20.0.3","TCP","4433 → 45066 [ACK] Seq=1 Ack=1991 Win=64128 Len=0 TSval=2883211088 TSecr=2188640158"
"20","0.267259782","2544","ba:af:dd:fd:0f:27","32:db:2c:c1:a4:ed","172.20.0.2","172.20.0.3","TLSv1.3","Server Hello, Change Cipher Spec, Application Data, Application Data, Application Data, Application Data"
"21","0.267299223","66","32:db:2c:c1:a4:ed","ba:af:dd:fd:0f:27","172.20.0.3","172.20.0.2","TCP","45066 → 4433 [ACK] Seq=1991 Ack=2479 Win=64128 Len=0 TSval=2188640162 TSecr=2883211092"
"22","0.272828816","146","32:db:2c:c1:a4:ed","ba:af:dd:fd:0f:27","172.20.0.3","172.20.0.2","TLSv1.3","Change Cipher Spec, Application Data"
"23","0.272919389","66","32:db:2c:c1:a4:ed","ba:af:dd:fd:0f:27","172.20.0.3","172.20.0.2","TCP","45066 → 4433 [RST, ACK] Seq=2071 Ack=2479 Win=64128 Len=0 TSval=2188640167 TSecr=2883211092"
"24","0.285129914","74","32:db:2c:c1:a4:ed","ba:af:dd:fd:0f:27","172.20.0.3","172.20.0.2","TCP","45072 → 4433 [SYN] Seq=0 Win=64240 Len=0 MSS=1460 SACK_PERM TSval=2188640180 TSecr=0 WS=128"
"25","0.285162899","74","ba:af:dd:fd:0f:27","32:db:2c:c1:a4:ed","172.20.0.2","172.20.0.3","TCP","4433 → 45072 [SYN, ACK] Seq=0 Ack=1 Win=65160 Len=0 MSS=1460 SACK_PERM TSval=2883211110 TSecr=2188640180 WS=128"
"26","0.285183535","66","32:db:2c:c1:a4:ed","ba:af:dd:fd:0f:27","172.20.0.3","172.20.0.2","TCP","45072 → 4433 [ACK] Seq=1 Ack=1 Win=64256 Len=0 TSval=2188640180 TSecr=2883211110"
"27","0.285233384","2056","32:db:2c:c1:a4:ed","ba:af:dd:fd:0f:27","172.20.0.3","172.20.0.2","TLSv1.2","Client Hello"
"28","0.285241056","66","ba:af:dd:fd:0f:27","32:db:2c:c1:a4:ed","172.20.0.2","172.20.0.3","TCP","4433 → 45072 [ACK] Seq=1 Ack=1991 Win=64128 Len=0 TSval=2883211110 TSecr=2188640180"
"29","0.288668647","2544","ba:af:dd:fd:0f:27","32:db:2c:c1:a4:ed","172.20.0.2","172.20.0.3","TLSv1.3","Server Hello, Change Cipher Spec, Application Data, Application Data, Application Data, Application Data"
"30","0.288703864","66","32:db:2c:c1:a4:ed","ba:af:dd:fd:0f:27","172.20.0.3","172.20.0.2","TCP","45072 → 4433 [ACK] Seq=1991 Ack=2479 Win=64128 Len=0 TSval=2188640183 TSecr=2883211113"
"31","0.293740047","146","32:db:2c:c1:a4:ed","ba:af:dd:fd:0f:27","172.20.0.3","172.20.0.2","TLSv1.3","Change Cipher Spec, Application Data"
"32","0.293815463","66","32:db:2c:c1:a4:ed","ba:af:dd:fd:0f:27","172.20.0.3","172.20.0.2","TCP","45072 → 4433 [RST, ACK] Seq=2071 Ack=2479 Win=64128 Len=0 TSval=2188640188 TSecr=2883211113"
"33","0.305479727","74","32:db:2c:c1:a4:ed","ba:af:dd:fd:0f:27","172.20.0.3","172.20.0.2","TCP","45082 → 4433 [SYN] Seq=0 Win=64240 Len=0 MSS=1460 SACK_PERM TSval=2188640200 TSecr=0 WS=128"
"34","0.305519616","74","ba:af:dd:fd:0f:27","32:db:2c:c1:a4:ed","172.20.0.2","172.20.0.3","TCP","4433 → 45082 [SYN, ACK] Seq=0 Ack=1 Win=65160 Len=0 MSS=1460 SACK_PERM TSval=2883211130 TSecr=2188640200 WS=128"
"35","0.305546208","66","32:db:2c:c1:a4:ed","ba:af:dd:fd:0f:27","172.20.0.3","172.20.0.2","TCP","45082 → 4433 [ACK] Seq=1 Ack=1 Win=64256 Len=0 TSval=2188640200 TSecr=2883211130"
"36","0.305608347","2056","32:db:2c:c1:a4:ed","ba:af:dd:fd:0f:27","172.20.0.3","172.20.0.2","TLSv1.2","Client Hello"
"37","0.305615605","66","ba:af:dd:fd:0f:27","32:db:2c:c1:a4:ed","172.20.0.2","172.20.0.3","TCP","4433 → 45082 [ACK] Seq=1 Ack=1991 Win=64128 Len=0 TSval=2883211130 TSecr=2188640200"
"38","0.309022700","2543","ba:af:dd:fd:0f:27","32:db:2c:c1:a4:ed","172.20.0.2","172.20.0.3","TLSv1.3","Server Hello, Change Cipher Spec, Application Data, Application Data, Application Data, Application Data"
"39","0.309076934","66","32:db:2c:c1:a4:ed","ba:af:dd:fd:0f:27","172.20.0.3","172.20.0.2","TCP","45082 → 4433 [ACK] Seq=1991 Ack=2478 Win=64128 Len=0 TSval=2188640204 TSecr=2883211133"
"40","0.316738181","146","32:db:2c:c1:a4:ed","ba:af:dd:fd:0f:27","172.20.0.3","172.20.0.2","TLSv1.3","Change Cipher Spec, Application Data"
"41","0.316842601","66","32:db:2c:c1:a4:ed","ba:af:dd:fd:0f:27","172.20.0.3","172.20.0.2","TCP","45082 → 4433 [RST, ACK] Seq=2071 Ack=2478 Win=64128 Len=0 TSval=2188640211 TSecr=2883211133"
"42","0.328993167","74","32:db:2c:c1:a4:ed","ba:af:dd:fd:0f:27","172.20.0.3","172.20.0.2","TCP","45084 → 4433 [SYN] Seq=0 Win=64240 Len=0 MSS=1460 SACK_PERM TSval=2188640223 TSecr=0 WS=128"
"43","0.329029091","74","ba:af:dd:fd:0f:27","32:db:2c:c1:a4:ed","172.20.0.2","172.20.0.3","TCP","4433 → 45084 [SYN, ACK] Seq=0 Ack=1 Win=65160 Len=0 MSS=1460 SACK_PERM TSval=2883211153 TSecr=2188640223 WS=128"
"44","0.329067438","66","32:db:2c:c1:a4:ed","ba:af:dd:fd:0f:27","172.20.0.3","172.20.0.2","TCP","45084 → 4433 [ACK] Seq=1 Ack=1 Win=64256 Len=0 TSval=2188640224 TSecr=2883211153"
"45","0.329116147","2056","32:db:2c:c1:a4:ed","ba:af:dd:fd:0f:27","172.20.0.3","172.20.0.2","TLSv1.2","Client Hello"
"46","0.329133605","66","ba:af:dd:fd:0f:27","32:db:2c:c1:a4:ed","172.20.0.2","172.20.0.3","TCP","4433 → 45084 [ACK] Seq=1 Ack=1991 Win=64128 Len=0 TSval=2883211154 TSecr=2188640224"
"47","0.332454625","2544","ba:af:dd:fd:0f:27","32:db:2c:c1:a4:ed","172.20.0.2","172.20.0.3","TLSv1.3","Server Hello, Change Cipher Spec, Application Data, Application Data, Application Data, Application Data"
"48","0.332509513","66","32:db:2c:c1:a4:ed","ba:af:dd:fd:0f:27","172.20.0.3","172.20.0.2","TCP","45084 → 4433 [ACK] Seq=1991 Ack=2479 Win=64128 Len=0 TSval=2188640227 TSecr=2883211157"
"49","0.337630221","146","32:db:2c:c1:a4:ed","ba:af:dd:fd:0f:27","172.20.0.3","172.20.0.2","TLSv1.3","Change Cipher Spec, Application Data"
"50","0.337703053","66","32:db:2c:c1:a4:ed","ba:af:dd:fd:0f:27","172.20.0.3","172.20.0.2","TCP","45084 → 4433 [RST, ACK] Seq=2071 Ack=2479 Win=64128 Len=0 TSval=2188640232 TSecr=2883211157"
"51","0.348753858","74","32:db:2c:c1:a4:ed","ba:af:dd:fd:0f:27","172.20.0.3","172.20.0.2","TCP","45090 → 4433 [SYN] Seq=0 Win=64240 Len=0 MSS=1460 SACK_PERM TSval=2188640243 TSecr=0 WS=128"
"52","0.348782594","74","ba:af:dd:fd:0f:27","32:db:2c:c1:a4:ed","172.20.0.2","172.20.0.3","TCP","4433 → 45090 [SYN, ACK] Seq=0 Ack=1 Win=65160 Len=0 MSS=1460 SACK_PERM TSval=2883211173 TSecr=2188640243 WS=128"
"53","0.348799004","66","32:db:2c:c1:a4:ed","ba:af:dd:fd:0f:27","172.20.0.3","172.20.0.2","TCP","45090 → 4433 [ACK] Seq=1 Ack=1 Win=64256 Len=0 TSval=2188640243 TSecr=2883211173"
"54","0.348845728","2056","32:db:2c:c1:a4:ed","ba:af:dd:fd:0f:27","172.20.0.3","172.20.0.2","TLSv1.2","Client Hello"
"55","0.348851750","66","ba:af:dd:fd:0f:27","32:db:2c:c1:a4:ed","172.20.0.2","172.20.0.3","TCP","4433 → 45090 [ACK] Seq=1 Ack=1991 Win=64128 Len=0 TSval=2883211173 TSecr=2188640243"
"56","0.352060814","2544","ba:af:dd:fd:0f:27","32:db:2c:c1:a4:ed","172.20.0.2","172.20.0.3","TLSv1.3","Server Hello, Change Cipher Spec, Application Data, Application Data, Application Data, Application Data"
"57","0.352104943","66","32:db:2c:c1:a4:ed","ba:af:dd:fd:0f:27","172.20.0.3","172.20.0.2","TCP","45090 → 4433 [ACK] Seq=1991 Ack=2479 Win=64128 Len=0 TSval=2188640247 TSecr=2883211176"
"58","0.357369866","146","32:db:2c:c1:a4:ed","ba:af:dd:fd:0f:27","172.20.0.3","172.20.0.2","TLSv1.3","Change Cipher Spec, Application Data"
"59","0.357463642","66","32:db:2c:c1:a4:ed","ba:af:dd:fd:0f:27","172.20.0.3","172.20.0.2","TCP","45090 → 4433 [RST, ACK] Seq=2071 Ack=2479 Win=64128 Len=0 TSval=2188640252 TSecr=2883211176"
"60","0.369161326","74","32:db:2c:c1:a4:ed","ba:af:dd:fd:0f:27","172.20.0.3","172.20.0.2","TCP","45102 → 4433 [SYN] Seq=0 Win=64240 Len=0 MSS=1460 SACK_PERM TSval=2188640264 TSecr=0 WS=128"
"61","0.369189687","74","ba:af:dd:fd:0f:27","32:db:2c:c1:a4:ed","172.20.0.2","172.20.0.3","TCP","4433 → 45102 [SYN, ACK] Seq=0 Ack=1 Win=65160 Len=0 MSS=1460 SACK_PERM TSval=2883211194 TSecr=2188640264 WS=128"
"62","0.369209899","66","32:db:2c:c1:a4:ed","ba:af:dd:fd:0f:27","172.20.0.3","172.20.0.2","TCP","45102 → 4433 [ACK] Seq=1 Ack=1 Win=64256 Len=0 TSval=2188640264 TSecr=2883211194"
"63","0.369257135","2056","32:db:2c:c1:a4:ed","ba:af:dd:fd:0f:27","172.20.0.3","172.20.0.2","TLSv1.2","Client Hello"
"64","0.369265226","66","ba:af:dd:fd:0f:27","32:db:2c:c1:a4:ed","172.20.0.2","172.20.0.3","TCP","4433 → 45102 [ACK] Seq=1 Ack=1991 Win=64128 Len=0 TSval=2883211194 TSecr=2188640264"
"65","0.990082454","1514","ba:af:dd:fd:0f:27","32:db:2c:c1:a4:ed","172.20.0.2","172.20.0.3","SSL",""
"66","0.990153752","66","32:db:2c:c1:a4:ed","ba:af:dd:fd:0f:27","172.20.0.3","172.20.0.2","TCP","45102 → 4433 [ACK] Seq=1991 Ack=1449 Win=64128 Len=0 TSval=2188640885 TSecr=2883211815"
"67","0.990166686","1096","ba:af:dd:fd:0f:27","32:db:2c:c1:a4:ed","172.20.0.2","172.20.0.3","TLSv1.3","Server Hello, Change Cipher Spec, Application Data, Application Data, Application Data, Application Data"
"68","0.990174288","66","32:db:2c:c1:a4:ed","ba:af:dd:fd:0f:27","172.20.0.3","172.20.0.2","TCP","45102 → 4433 [ACK] Seq=1991 Ack=2479 Win=64128 Len=0 TSval=2188640885 TSecr=2883211815"
"69","0.995408985","146","32:db:2c:c1:a4:ed","ba:af:dd:fd:0f:27","172.20.0.3","172.20.0.2","TLSv1.3","Change Cipher Spec, Application Data"
"70","0.995488573","66","32:db:2c:c1:a4:ed","ba:af:dd:fd:0f:27","172.20.0.3","172.20.0.2","TCP","45102 → 4433 [RST, ACK] Seq=2071 Ack=2479 Win=64128 Len=0 TSval=2188640890 TSecr=2883211815"
"71","1.000763472","42","32:db:2c:c1:a4:ed","ff:ff:ff:ff:ff:ff",,,"ARP","ARP Announcement for 172.20.0.3"
"72","1.007002581","74","32:db:2c:c1:a4:ed","ba:af:dd:fd:0f:27","172.20.0.3","172.20.0.2","TCP","45112 → 4433 [SYN] Seq=0 Win=64240 Len=0 MSS=1460 SACK_PERM TSval=2188640901 TSecr=0 WS=128"
"73","2.001292575","42","32:db:2c:c1:a4:ed","ff:ff:ff:ff:ff:ff",,,"ARP","ARP Announcement for 172.20.0.3"
"74","2.054099675","74","ba:af:dd:fd:0f:27","32:db:2c:c1:a4:ed","172.20.0.2","172.20.0.3","TCP","4433 → 45112 [SYN, ACK] Seq=0 Ack=1 Win=65160 Len=0 MSS=1460 SACK_PERM TSval=2883212879 TSecr=2188640901 WS=128"
"75","2.054122831","74","32:db:2c:c1:a4:ed","ba:af:dd:fd:0f:27","172.20.0.3","172.20.0.2","TCP","[TCP Retransmission] 45112 → 4433 [SYN] Seq=0 Win=64240 Len=0 MSS=1460 SACK_PERM TSval=2188641949 TSecr=0 WS=128"
"76","2.054136793","74","ba:af:dd:fd:0f:27","32:db:2c:c1:a4:ed","172.20.0.2","172.20.0.3","TCP","[TCP Out-Of-Order] 4433 → 45112 [SYN, ACK] Seq=0 Ack=1 Win=65160 Len=0 MSS=1460 SACK_PERM TSval=2883212879 TSecr=2188640901 WS=128"
"77","2.054171548","66","32:db:2c:c1:a4:ed","ba:af:dd:fd:0f:27","172.20.0.3","172.20.0.2","TCP","45112 → 4433 [ACK] Seq=1 Ack=1 Win=64256 Len=0 TSval=2188641949 TSecr=2883212879"
"78","2.054195888","66","32:db:2c:c1:a4:ed","ba:af:dd:fd:0f:27","172.20.0.3","172.20.0.2","TCP","[TCP Dup ACK 77#1] 45112 → 4433 [ACK] Seq=1 Ack=1 Win=64256 Len=0 TSval=2188641949 TSecr=2883212879"
"79","2.054253746","2056","32:db:2c:c1:a4:ed","ba:af:dd:fd:0f:27","172.20.0.3","172.20.0.2","TLSv1.2","Client Hello"
"80","2.054260839","66","ba:af:dd:fd:0f:27","32:db:2c:c1:a4:ed","172.20.0.2","172.20.0.3","TCP","4433 → 45112 [ACK] Seq=1 Ack=1991 Win=64128 Len=0 TSval=2883212879 TSecr=2188641949"
"81","2.057477377","1514","ba:af:dd:fd:0f:27","32:db:2c:c1:a4:ed","172.20.0.2","172.20.0.3","SSL",""
"82","2.057510077","66","32:db:2c:c1:a4:ed","ba:af:dd:fd:0f:27","172.20.0.3","172.20.0.2","TCP","45112 → 4433 [ACK] Seq=1991 Ack=1449 Win=64128 Len=0 TSval=2188641952 TSecr=2883212882"
"83","2.262082798","1096","ba:af:dd:fd:0f:27","32:db:2c:c1:a4:ed","172.20.0.2","172.20.0.3","TLSv1.3","Server Hello, Change Cipher Spec, Application Data, Application Data, Application Data, Application Data"
"84","2.262167685","66","32:db:2c:c1:a4:ed","ba:af:dd:fd:0f:27","172.20.0.3","172.20.0.2","TCP","45112 → 4433 [ACK] Seq=1991 Ack=2479 Win=64128 Len=0 TSval=2188642157 TSecr=2883213087"
"85","2.267422285","146","32:db:2c:c1:a4:ed","ba:af:dd:fd:0f:27","172.20.0.3","172.20.0.2","TLSv1.3","Change Cipher Spec, Application Data"
"86","2.267500891","66","32:db:2c:c1:a4:ed","ba:af:dd:fd:0f:27","172.20.0.3","172.20.0.2","TCP","45112 → 4433 [RST, ACK] Seq=2071 Ack=2479 Win=64128 Len=0 TSval=2188642162 TSecr=2883213087"
"87","2.278882411","74","32:db:2c:c1:a4:ed","ba:af:dd:fd:0f:27","172.20.0.3","172.20.0.2","TCP","45128 → 4433 [SYN] Seq=0 Win=64240 Len=0 MSS=1460 SACK_PERM TSval=2188642173 TSecr=0 WS=128"
"88","2.278914939","74","ba:af:dd:fd:0f:27","32:db:2c:c1:a4:ed","172.20.0.2","172.20.0.3","TCP","4433 → 45128 [SYN, ACK] Seq=0 Ack=1 Win=65160 Len=0 MSS=1460 SACK_PERM TSval=2883213103 TSecr=2188642173 WS=128"
"89","2.278933737","66","32:db:2c:c1:a4:ed","ba:af:dd:fd:0f:27","172.20.0.3","172.20.0.2","TCP","45128 → 4433 [ACK] Seq=1 Ack=1 Win=64256 Len=0 TSval=2188642173 TSecr=2883213103"
"90","2.278987234","2056","32:db:2c:c1:a4:ed","ba:af:dd:fd:0f:27","172.20.0.3","172.20.0.2","TLSv1.2","Client Hello"
"91","2.283059477","608","32:db:2c:c1:a4:ed","ba:af:dd:fd:0f:27","172.20.0.3","172.20.0.2","TCP","[TCP Retransmission] 45128 → 4433 [PSH, ACK] Seq=1449 Ack=1 Win=64256 Len=542 TSval=2188642178 TSecr=2883213103"
"92","2.283067459","78","ba:af:dd:fd:0f:27","32:db:2c:c1:a4:ed","172.20.0.2","172.20.0.3","TCP","[TCP Previous segment not captured] 4433 → 45128 [ACK] Seq=2478 Ack=1991 Win=64128 Len=0 TSval=2883213108 TSecr=2188642178 SLE=1449 SRE=1991"
"93","2.286069604","1095","ba:af:dd:fd:0f:27","32:db:2c:c1:a4:ed","172.20.0.2","172.20.0.3","TCP","[TCP Retransmission] 4433 → 45128 [PSH, ACK] Seq=1449 Ack=1991 Win=64128 Len=1029 TSval=2883213111 TSecr=2188642178"
"94","2.286107465","78","32:db:2c:c1:a4:ed","ba:af:dd:fd:0f:27","172.20.0.3","172.20.0.2","TCP","[TCP Dup ACK 89#1] 45128 → 4433 [ACK] Seq=1991 Ack=1 Win=64256 Len=0 TSval=2188642181 TSecr=2883213103 SLE=1449 SRE=2478"
"95","2.286115093","1514","ba:af:dd:fd:0f:27","32:db:2c:c1:a4:ed","172.20.0.2","172.20.0.3","TCP","[TCP Retransmission] 4433 → 45128 [ACK] Seq=1 Ack=1991 Win=64128 Len=1448 TSval=2883213111 TSecr=2188642181"
"96","2.286128679","66","32:db:2c:c1:a4:ed","ba:af:dd:fd:0f:27","172.20.0.3","172.20.0.2","TCP","45128 → 4433 [ACK] Seq=1991 Ack=2478 Win=64128 Len=0 TSval=2188642181 TSecr=2883213111"
"97","2.291135219","146","32:db:2c:c1:a4:ed","ba:af:dd:fd:0f:27","172.20.0.3","172.20.0.2","TLSv1.2","Change Cipher Spec, Application Data"
"98","2.291216919","66","32:db:2c:c1:a4:ed","ba:af:dd:fd:0f:27","172.20.0.3","172.20.0.2","TCP","45128 → 4433 [RST, ACK] Seq=2071 Ack=2478 Win=64128 Len=0 TSval=2188642186 TSecr=2883213111"
"99","2.302383838","74","32:db:2c:c1:a4:ed","ba:af:dd:fd:0f:27","172.20.0.3","172.20.0.2","TCP","45130 → 4433 [SYN] Seq=0 Win=64240 Len=0 MSS=1460 SACK_PERM TSval=2188642197 TSecr=0 WS=128"
"100","2.302412971","74","ba:af:dd:fd:0f:27","32:db:2c:c1:a4:ed","172.20.0.2","172.20.0.3","TCP","4433 → 45130 [SYN, ACK] Seq=0 Ack=1 Win=65160 Len=0 MSS=1460 SACK_PERM TSval=2883213127 TSecr=2188642197 WS=128"
"101","2.302429934","66","32:db:2c:c1:a4:ed","ba:af:dd:fd:0f:27","172.20.0.3","172.20.0.2","TCP","45130 → 4433 [ACK] Seq=1 Ack=1 Win=64256 Len=0 TSval=2188642197 TSecr=2883213127"
"102","2.302476062","2056","32:db:2c:c1:a4:ed","ba:af:dd:fd:0f:27","172.20.0.3","172.20.0.2","TLSv1.2","Client Hello"
"103","2.302482843","66","ba:af:dd:fd:0f:27","32:db:2c:c1:a4:ed","172.20.0.2","172.20.0.3","TCP","4433 → 45130 [ACK] Seq=1 Ack=1991 Win=64128 Len=0 TSval=2883213127 TSecr=2188642197"
"104","2.305680608","2543","ba:af:dd:fd:0f:27","32:db:2c:c1:a4:ed","172.20.0.2","172.20.0.3","TLSv1.3","Server Hello, Change Cipher Spec, Application Data, Application Data, Application Data, Application Data"
"105","2.305712962","66","32:db:2c:c1:a4:ed","ba:af:dd:fd:0f:27","172.20.0.3","172.20.0.2","TCP","45130 → 4433 [ACK] Seq=1991 Ack=2478 Win=64128 Len=0 TSval=2188642200 TSecr=2883213130"
"106","2.310633188","146","32:db:2c:c1:a4:ed","ba:af:dd:fd:0f:27","172.20.0.3","172.20.0.2","TLSv1.3","Change Cipher Spec, Application Data"
"107","2.310701673","66","32:db:2c:c1:a4:ed","ba:af:dd:fd:0f:27","172.20.0.3","172.20.0.2","TCP","45130 → 4433 [RST, ACK] Seq=2071 Ack=2478 Win=64128 Len=0 TSval=2188642205 TSecr=2883213130"
"108","2.321570121","74","32:db:2c:c1:a4:ed","ba:af:dd:fd:0f:27","172.20.0.3","172.20.0.2","TCP","45134 → 4433 [SYN] Seq=0 Win=64240 Len=0 MSS=1460 SACK_PERM TSval=2188642216 TSecr=0 WS=128"
"109","2.321600615","74","ba:af:dd:fd:0f:27","32:db:2c:c1:a4:ed","172.20.0.2","172.20.0.3","TCP","4433 → 45134 [SYN, ACK] Seq=0 Ack=1 Win=65160 Len=0 MSS=1460 SACK_PERM TSval=2883213146 TSecr=2188642216 WS=128"
"110","2.321618924","66","32:db:2c:c1:a4:ed","ba:af:dd:fd:0f:27","172.20.0.3","172.20.0.2","TCP","45134 → 4433 [ACK] Seq=1 Ack=1 Win=64256 Len=0 TSval=2188642216 TSecr=2883213146"
"111","2.321664718","2056","32:db:2c:c1:a4:ed","ba:af:dd:fd:0f:27","172.20.0.3","172.20.0.2","TLSv1.2","Client Hello"
"112","2.321671137","66","ba:af:dd:fd:0f:27","32:db:2c:c1:a4:ed","172.20.0.2","172.20.0.3","TCP","4433 → 45134 [ACK] Seq=1 Ack=1991 Win=64128 Len=0 TSval=2883213146 TSecr=2188642216"
"113","2.328062971","1096","ba:af:dd:fd:0f:27","32:db:2c:c1:a4:ed","172.20.0.2","172.20.0.3","TCP","[TCP Previous segment not captured] 4433 → 45134 [PSH, ACK] Seq=1449 Ack=1991 Win=64128 Len=1030 TSval=2883213153 TSecr=2188642216"
"114","2.328097049","78","32:db:2c:c1:a4:ed","ba:af:dd:fd:0f:27","172.20.0.3","172.20.0.2","TCP","[TCP Dup ACK 110#1] 45134 → 4433 [ACK] Seq=1991 Ack=1 Win=64256 Len=0 TSval=2188642223 TSecr=2883213146 SLE=1449 SRE=2479"
"115","2.328106186","1514","ba:af:dd:fd:0f:27","32:db:2c:c1:a4:ed","172.20.0.2","172.20.0.3","TCP","[TCP Out-Of-Order] 4433 → 45134 [ACK] Seq=1 Ack=1991 Win=64128 Len=1448 TSval=2883213153 TSecr=2188642223"
"116","2.328119743","66","32:db:2c:c1:a4:ed","ba:af:dd:fd:0f:27","172.20.0.3","172.20.0.2","TCP","45134 → 4433 [ACK] Seq=1991 Ack=2479 Win=64128 Len=0 TSval=2188642223 TSecr=2883213153"
"117","2.333120754","146","32:db:2c:c1:a4:ed","ba:af:dd:fd:0f:27","172.20.0.3","172.20.0.2","TLSv1.2","Change Cipher Spec, Application Data"
"118","2.333182457","66","32:db:2c:c1:a4:ed","ba:af:dd:fd:0f:27","172.20.0.3","172.20.0.2","TCP","45134 → 4433 [RST, ACK] Seq=2071 Ack=2479 Win=64128 Len=0 TSval=2188642228 TSecr=2883213153"
"119","2.343762008","74","32:db:2c:c1:a4:ed","ba:af:dd:fd:0f:27","172.20.0.3","172.20.0.2","TCP","45142 → 4433 [SYN] Seq=0 Win=64240 Len=0 MSS=1460 SACK_PERM TSval=2188642238 TSecr=0 WS=128"
"120","2.343789711","74","ba:af:dd:fd:0f:27","32:db:2c:c1:a4:ed","172.20.0.2","172.20.0.3","TCP","4433 → 45142 [SYN, ACK] Seq=0 Ack=1 Win=65160 Len=0 MSS=1460 SACK_PERM TSval=2883213168 TSecr=2188642238 WS=128"
"121","2.343806466","66","32:db:2c:c1:a4:ed","ba:af:dd:fd:0f:27","172.20.0.3","172.20.0.2","TCP","45142 → 4433 [ACK] Seq=1 Ack=1 Win=64256 Len=0 TSval=2188642238 TSecr=2883213168"
"122","2.343857581","2056","32:db:2c:c1:a4:ed","ba:af:dd:fd:0f:27","172.20.0.3","172.20.0.2","TLSv1.2","Client Hello"
"123","2.343861975","66","ba:af:dd:fd:0f:27","32:db:2c:c1:a4:ed","172.20.0.2","172.20.0.3","TCP","4433 → 45142 [ACK] Seq=1 Ack=1991 Win=64128 Len=0 TSval=2883213168 TSecr=2188642238"
"124","2.347021817","2543","ba:af:dd:fd:0f:27","32:db:2c:c1:a4:ed","172.20.0.2","172.20.0.3","TLSv1.3","Server Hello, Change Cipher Spec, Application Data, Application Data, Application Data, Application Data"
"125","2.347062007","66","32:db:2c:c1:a4:ed","ba:af:dd:fd:0f:27","172.20.0.3","172.20.0.2","TCP","45142 → 4433 [ACK] Seq=1991 Ack=2478 Win=64128 Len=0 TSval=2188642242 TSecr=2883213171"
"126","2.352017294","146","32:db:2c:c1:a4:ed","ba:af:dd:fd:0f:27","172.20.0.3","172.20.0.2","TLSv1.3","Change Cipher Spec, Application Data"
"127","2.352095977","66","32:db:2c:c1:a4:ed","ba:af:dd:fd:0f:27","172.20.0.3","172.20.0.2","TCP","45142 → 4433 [RST, ACK] Seq=2071 Ack=2478 Win=64128 Len=0 TSval=2188642247 TSecr=2883213171"
"128","2.362980774","74","32:db:2c:c1:a4:ed","ba:af:dd:fd:0f:27","172.20.0.3","172.20.0.2","TCP","45152 → 4433 [SYN] Seq=0 Win=64240 Len=0 MSS=1460 SACK_PERM TSval=2188642257 TSecr=0 WS=128"
"129","2.363008111","74","ba:af:dd:fd:0f:27","32:db:2c:c1:a4:ed","172.20.0.2","172.20.0.3","TCP","4433 → 45152 [SYN, ACK] Seq=0 Ack=1 Win=65160 Len=0 MSS=1460 SACK_PERM TSval=2883213187 TSecr=2188642257 WS=128"
"130","2.363028129","66","32:db:2c:c1:a4:ed","ba:af:dd:fd:0f:27","172.20.0.3","172.20.0.2","TCP","45152 → 4433 [ACK] Seq=1 Ack=1 Win=64256 Len=0 TSval=2188642257 TSecr=2883213187"
"131","2.363088403","2056","32:db:2c:c1:a4:ed","ba:af:dd:fd:0f:27","172.20.0.3","172.20.0.2","TLSv1.2","Client Hello"
"132","2.363095419","66","ba:af:dd:fd:0f:27","32:db:2c:c1:a4:ed","172.20.0.2","172.20.0.3","TCP","4433 → 45152 [ACK] Seq=1 Ack=1991 Win=64128 Len=0 TSval=2883213188 TSecr=2188642258"
"133","2.366378347","2544","ba:af:dd:fd:0f:27","32:db:2c:c1:a4:ed","172.20.0.2","172.20.0.3","TLSv1.3","Server Hello, Change Cipher Spec, Application Data, Application Data, Application Data, Application Data"
"134","2.366406290","66","32:db:2c:c1:a4:ed","ba:af:dd:fd:0f:27","172.20.0.3","172.20.0.2","TCP","45152 → 4433 [ACK] Seq=1991 Ack=2479 Win=64128 Len=0 TSval=2188642261 TSecr=2883213191"
"135","2.371222494","146","32:db:2c:c1:a4:ed","ba:af:dd:fd:0f:27","172.20.0.3","172.20.0.2","TLSv1.3","Change Cipher Spec, Application Data"
"136","2.371281775","66","32:db:2c:c1:a4:ed","ba:af:dd:fd:0f:27","172.20.0.3","172.20.0.2","TCP","45152 → 4433 [RST, ACK] Seq=2071 Ack=2479 Win=64128 Len=0 TSval=2188642266 TSecr=2883213191"
"137","2.382069829","74","32:db:2c:c1:a4:ed","ba:af:dd:fd:0f:27","172.20.0.3","172.20.0.2","TCP","45158 → 4433 [SYN] Seq=0 Win=64240 Len=0 MSS=1460 SACK_PERM TSval=2188642276 TSecr=0 WS=128"
"138","3.398103223","74","ba:af:dd:fd:0f:27","32:db:2c:c1:a4:ed","172.20.0.2","172.20.0.3","TCP","4433 → 45158 [SYN, ACK] Seq=0 Ack=1 Win=65160 Len=0 MSS=1460 SACK_PERM TSval=2883214223 TSecr=2188642276 WS=128"
"139","3.398161895","74","32:db:2c:c1:a4:ed","ba:af:dd:fd:0f:27","172.20.0.3","172.20.0.2","TCP","[TCP Retransmission] 45158 → 4433 [SYN] Seq=0 Win=64240 Len=0 MSS=1460 SACK_PERM TSval=2188643293 TSecr=0 WS=128"
"140","3.398177217","74","ba:af:dd:fd:0f:27","32:db:2c:c1:a4:ed","172.20.0.2","172.20.0.3","TCP","[TCP Retransmission] 4433 → 45158 [SYN, ACK] Seq=0 Ack=1 Win=65160 Len=0 MSS=1460 SACK_PERM TSval=2883214223 TSecr=2188642276 WS=128"
"141","3.398222471","66","32:db:2c:c1:a4:ed","ba:af:dd:fd:0f:27","172.20.0.3","172.20.0.2","TCP","45158 → 4433 [ACK] Seq=1 Ack=1 Win=64256 Len=0 TSval=2188643293 TSecr=2883214223"
"142","3.398247706","66","32:db:2c:c1:a4:ed","ba:af:dd:fd:0f:27","172.20.0.3","172.20.0.2","TCP","[TCP Dup ACK 141#1] 45158 → 4433 [ACK] Seq=1 Ack=1 Win=64256 Len=0 TSval=2188643293 TSecr=2883214223"
"143","3.398320439","2056","32:db:2c:c1:a4:ed","ba:af:dd:fd:0f:27","172.20.0.3","172.20.0.2","TLSv1.2","Client Hello"
"144","3.398335611","66","ba:af:dd:fd:0f:27","32:db:2c:c1:a4:ed","172.20.0.2","172.20.0.3","TCP","4433 → 45158 [ACK] Seq=1 Ack=1991 Win=64128 Len=0 TSval=2883214223 TSecr=2188643293"
"145","3.606078215","1096","ba:af:dd:fd:0f:27","32:db:2c:c1:a4:ed","172.20.0.2","172.20.0.3","SSL","[TCP Previous segment not captured] , Continuation Data"
"146","3.606135773","78","32:db:2c:c1:a4:ed","ba:af:dd:fd:0f:27","172.20.0.3","172.20.0.2","TCP","[TCP Dup ACK 141#2] 45158 → 4433 [ACK] Seq=1991 Ack=1 Win=64256 Len=0 TSval=2188643501 TSecr=2883214223 SLE=1449 SRE=2479"
"147","3.606148950","1514","ba:af:dd:fd:0f:27","32:db:2c:c1:a4:ed","172.20.0.2","172.20.0.3","SSL","[TCP Fast Retransmission] "
"148","3.606176331","66","32:db:2c:c1:a4:ed","ba:af:dd:fd:0f:27","172.20.0.3","172.20.0.2","TCP","45158 → 4433 [ACK] Seq=1991 Ack=2479 Win=64128 Len=0 TSval=2188643501 TSecr=2883214431"
"149","3.611488764","146","32:db:2c:c1:a4:ed","ba:af:dd:fd:0f:27","172.20.0.3","172.20.0.2","TLSv1.2","Change Cipher Spec, Application Data"
"150","3.611571514","66","32:db:2c:c1:a4:ed","ba:af:dd:fd:0f:27","172.20.0.3","172.20.0.2","TCP","45158 → 4433 [RST, ACK] Seq=2071 Ack=2479 Win=64128 Len=0 TSval=2188643506 TSecr=2883214431"
"151","3.622797996","74","32:db:2c:c1:a4:ed","ba:af:dd:fd:0f:27","172.20.0.3","172.20.0.2","TCP","45162 → 4433 [SYN] Seq=0 Win=64240 Len=0 MSS=1460 SACK_PERM TSval=2188643517 TSecr=0 WS=128"
"152","3.622827219","74","ba:af:dd:fd:0f:27","32:db:2c:c1:a4:ed","172.20.0.2","172.20.0.3","TCP","4433 → 45162 [SYN, ACK] Seq=0 Ack=1 Win=65160 Len=0 MSS=1460 SACK_PERM TSval=2883214447 TSecr=2188643517 WS=128"
"153","3.622844763","66","32:db:2c:c1:a4:ed","ba:af:dd:fd:0f:27","172.20.0.3","172.20.0.2","TCP","45162 → 4433 [ACK] Seq=1 Ack=1 Win=64256 Len=0 TSval=2188643517 TSecr=2883214447"
"154","3.622893985","2056","32:db:2c:c1:a4:ed","ba:af:dd:fd:0f:27","172.20.0.3","172.20.0.2","TLSv1.2","Client Hello"
"155","3.622899668","66","ba:af:dd:fd:0f:27","32:db:2c:c1:a4:ed","172.20.0.2","172.20.0.3","TCP","4433 → 45162 [ACK] Seq=1 Ack=1991 Win=64128 Len=0 TSval=2883214447 TSecr=2188643517"
"156","3.626132343","2543","ba:af:dd:fd:0f:27","32:db:2c:c1:a4:ed","172.20.0.2","172.20.0.3","TLSv1.3","Server Hello, Change Cipher Spec, Application Data, Application Data, Application Data, Application Data"
"157","3.626170332","66","32:db:2c:c1:a4:ed","ba:af:dd:fd:0f:27","172.20.0.3","172.20.0.2","TCP","45162 → 4433 [ACK] Seq=1991 Ack=2478 Win=64128 Len=0 TSval=2188643521 TSecr=2883214451"
"158","3.631304812","146","32:db:2c:c1:a4:ed","ba:af:dd:fd:0f:27","172.20.0.3","172.20.0.2","TLSv1.3","Change Cipher Spec, Application Data"
"159","3.631382300","66","32:db:2c:c1:a4:ed","ba:af:dd:fd:0f:27","172.20.0.3","172.20.0.2","TCP","45162 → 4433 [RST, ACK] Seq=2071 Ack=2478 Win=64128 Len=0 TSval=2188643526 TSecr=2883214451"
"160","3.642231810","74","32:db:2c:c1:a4:ed","ba:af:dd:fd:0f:27","172.20.0.3","172.20.0.2","TCP","45164 → 4433 [SYN] Seq=0 Win=64240 Len=0 MSS=1460 SACK_PERM TSval=2188643537 TSecr=0 WS=128"
"161","3.642262012","74","ba:af:dd:fd:0f:27","32:db:2c:c1:a4:ed","172.20.0.2","172.20.0.3","TCP","4433 → 45164 [SYN, ACK] Seq=0 Ack=1 Win=65160 Len=0 MSS=1460 SACK_PERM TSval=2883214467 TSecr=2188643537 WS=128"
"162","3.642279529","66","32:db:2c:c1:a4:ed","ba:af:dd:fd:0f:27","172.20.0.3","172.20.0.2","TCP","45164 → 4433 [ACK] Seq=1 Ack=1 Win=64256 Len=0 TSval=2188643537 TSecr=2883214467"
"163","3.642334135","2056","32:db:2c:c1:a4:ed","ba:af:dd:fd:0f:27","172.20.0.3","172.20.0.2","TLSv1.2","Client Hello"
"164","3.645497942","2543","ba:af:dd:fd:0f:27","32:db:2c:c1:a4:ed","172.20.0.2","172.20.0.3","TLSv1.3","Server Hello, Change Cipher Spec, Application Data, Application Data, Application Data, Application Data"
"165","3.645534915","66","32:db:2c:c1:a4:ed","ba:af:dd:fd:0f:27","172.20.0.3","172.20.0.2","TCP","45164 → 4433 [ACK] Seq=1991 Ack=2478 Win=64128 Len=0 TSval=2188643540 TSecr=2883214470"
"166","3.650533899","146","32:db:2c:c1:a4:ed","ba:af:dd:fd:0f:27","172.20.0.3","172.20.0.2","TLSv1.3","Change Cipher Spec, Application Data"
"167","3.650611739","66","32:db:2c:c1:a4:ed","ba:af:dd:fd:0f:27","172.20.0.3","172.20.0.2","TCP","45164 → 4433 [RST, ACK] Seq=2071 Ack=2478 Win=64128 Len=0 TSval=2188643545 TSecr=2883214470"
"168","3.661374812","74","32:db:2c:c1:a4:ed","ba:af:dd:fd:0f:27","172.20.0.3","172.20.0.2","TCP","45166 → 4433 [SYN] Seq=0 Win=64240 Len=0 MSS=1460 SACK_PERM TSval=2188643556 TSecr=0 WS=128"
"169","3.661401258","74","ba:af:dd:fd:0f:27","32:db:2c:c1:a4:ed","172.20.0.2","172.20.0.3","TCP","4433 → 45166 [SYN, ACK] Seq=0 Ack=1 Win=65160 Len=0 MSS=1460 SACK_PERM TSval=2883214486 TSecr=2188643556 WS=128"
"170","3.661418852","66","32:db:2c:c1:a4:ed","ba:af:dd:fd:0f:27","172.20.0.3","172.20.0.2","TCP","45166 → 4433 [ACK] Seq=1 Ack=1 Win=64256 Len=0 TSval=2188643556 TSecr=2883214486"
"171","3.661474469","2056","32:db:2c:c1:a4:ed","ba:af:dd:fd:0f:27","172.20.0.3","172.20.0.2","TLSv1.2","Client Hello"
"172","3.661479137","66","ba:af:dd:fd:0f:27","32:db:2c:c1:a4:ed","172.20.0.2","172.20.0.3","TCP","4433 → 45166 [ACK] Seq=1 Ack=1991 Win=64128 Len=0 TSval=2883214486 TSecr=2188643556"
"173","3.666859336","2542","ba:af:dd:fd:0f:27","32:db:2c:c1:a4:ed","172.20.0.2","172.20.0.3","TLSv1.3","Server Hello, Change Cipher Spec, Application Data, Application Data, Application Data, Application Data"
"174","3.666905006","66","32:db:2c:c1:a4:ed","ba:af:dd:fd:0f:27","172.20.0.3","172.20.0.2","TCP","45166 → 4433 [ACK] Seq=1991 Ack=2477 Win=64128 Len=0 TSval=2188643561 TSecr=2883214491"
"175","3.671891647","146","32:db:2c:c1:a4:ed","ba:af:dd:fd:0f:27","172.20.0.3","172.20.0.2","TLSv1.3","Change Cipher Spec, Application Data"
"176","3.671980366","66","32:db:2c:c1:a4:ed","ba:af:dd:fd:0f:27","172.20.0.3","172.20.0.2","TCP","45166 → 4433 [RST, ACK] Seq=2071 Ack=2477 Win=64128 Len=0 TSval=2188643566 TSecr=2883214491"
"177","3.682953469","74","32:db:2c:c1:a4:ed","ba:af:dd:fd:0f:27","172.20.0.3","172.20.0.2","TCP","45182 → 4433 [SYN] Seq=0 Win=64240 Len=0 MSS=1460 SACK_PERM TSval=2188643577 TSecr=0 WS=128"
"178","3.682984045","74","ba:af:dd:fd:0f:27","32:db:2c:c1:a4:ed","172.20.0.2","172.20.0.3","TCP","4433 → 45182 [SYN, ACK] Seq=0 Ack=1 Win=65160 Len=0 MSS=1460 SACK_PERM TSval=2883214507 TSecr=2188643577 WS=128"
"179","3.683002070","66","32:db:2c:c1:a4:ed","ba:af:dd:fd:0f:27","172.20.0.3","172.20.0.2","TCP","45182 → 4433 [ACK] Seq=1 Ack=1 Win=64256 Len=0 TSval=2188643577 TSecr=2883214507"
"180","3.683059806","2056","32:db:2c:c1:a4:ed","ba:af:dd:fd:0f:27","172.20.0.3","172.20.0.2","TLSv1.2","Client Hello"
"181","3.683066996","66","ba:af:dd:fd:0f:27","32:db:2c:c1:a4:ed","172.20.0.2","172.20.0.3","TCP","4433 → 45182 [ACK] Seq=1 Ack=1991 Win=64128 Len=0 TSval=2883214508 TSecr=2188643578"
"182","3.686319397","2543","ba:af:dd:fd:0f:27","32:db:2c:c1:a4:ed","172.20.0.2","172.20.0.3","TLSv1.3","Server Hello, Change Cipher Spec, Application Data, Application Data, Application Data, Application Data"
"183","3.686351708","66","32:db:2c:c1:a4:ed","ba:af:dd:fd:0f:27","172.20.0.3","172.20.0.2","TCP","45182 → 4433 [ACK] Seq=1991 Ack=2478 Win=64128 Len=0 TSval=2188643581 TSecr=2883214511"
"184","3.691333184","146","32:db:2c:c1:a4:ed","ba:af:dd:fd:0f:27","172.20.0.3","172.20.0.2","TLSv1.3","Change Cipher Spec, Application Data"
"185","3.691405636","66","32:db:2c:c1:a4:ed","ba:af:dd:fd:0f:27","172.20.0.3","172.20.0.2","TCP","45182 → 4433 [RST, ACK] Seq=2071 Ack=2478 Win=64128 Len=0 TSval=2188643586 TSecr=2883214511"
"186","3.702141803","74","32:db:2c:c1:a4:ed","ba:af:dd:fd:0f:27","172.20.0.3","172.20.0.2","TCP","45192 → 4433 [SYN] Seq=0 Win=64240 Len=0 MSS=1460 SACK_PERM TSval=2188643597 TSecr=0 WS=128"
"187","3.702170738","74","ba:af:dd:fd:0f:27","32:db:2c:c1:a4:ed","172.20.0.2","172.20.0.3","TCP","4433 → 45192 [SYN, ACK] Seq=0 Ack=1 Win=65160 Len=0 MSS=1460 SACK_PERM TSval=2883214527 TSecr=2188643597 WS=128"
"188","3.702188217","66","32:db:2c:c1:a4:ed","ba:af:dd:fd:0f:27","172.20.0.3","172.20.0.2","TCP","45192 → 4433 [ACK] Seq=1 Ack=1 Win=64256 Len=0 TSval=2188643597 TSecr=2883214527"
"189","3.702232114","2056","32:db:2c:c1:a4:ed","ba:af:dd:fd:0f:27","172.20.0.3","172.20.0.2","TLSv1.2","Client Hello"
"190","3.702237407","66","ba:af:dd:fd:0f:27","32:db:2c:c1:a4:ed","172.20.0.2","172.20.0.3","TCP","4433 → 45192 [ACK] Seq=1 Ack=1991 Win=64128 Len=0 TSval=2883214527 TSecr=2188643597"
"191","3.705370406","2542","ba:af:dd:fd:0f:27","32:db:2c:c1:a4:ed","172.20.0.2","172.20.0.3","TLSv1.3","Server Hello, Change Cipher Spec, Application Data, Application Data, Application Data, Application Data"
"192","3.705404527","66","32:db:2c:c1:a4:ed","ba:af:dd:fd:0f:27","172.20.0.3","172.20.0.2","TCP","45192 → 4433 [ACK] Seq=1991 Ack=2477 Win=64128 Len=0 TSval=2188643600 TSecr=2883214530"
"193","3.710381010","146","32:db:2c:c1:a4:ed","ba:af:dd:fd:0f:27","172.20.0.3","172.20.0.2","TLSv1.3","Change Cipher Spec, Application Data"
"194","3.710455492","66","32:db:2c:c1:a4:ed","ba:af:dd:fd:0f:27","172.20.0.3","172.20.0.2","TCP","45192 → 4433 [RST, ACK] Seq=2071 Ack=2477 Win=64128 Len=0 TSval=2188643605 TSecr=2883214530"
"195","3.721470744","74","32:db:2c:c1:a4:ed","ba:af:dd:fd:0f:27","172.20.0.3","172.20.0.2","TCP","45196 → 4433 [SYN] Seq=0 Win=64240 Len=0 MSS=1460 SACK_PERM TSval=2188643616 TSecr=0 WS=128"
"196","4.742114031","74","ba:af:dd:fd:0f:27","32:db:2c:c1:a4:ed","172.20.0.2","172.20.0.3","TCP","4433 → 45196 [SYN, ACK] Seq=0 Ack=1 Win=65160 Len=0 MSS=1460 SACK_PERM TSval=2883215567 TSecr=2188643616 WS=128"
"197","4.742144111","74","32:db:2c:c1:a4:ed","ba:af:dd:fd:0f:27","172.20.0.3","172.20.0.2","TCP","[TCP Retransmission] 45196 → 4433 [SYN] Seq=0 Win=64240 Len=0 MSS=1460 SACK_PERM TSval=2188644637 TSecr=0 WS=128"
"198","4.742162565","74","ba:af:dd:fd:0f:27","32:db:2c:c1:a4:ed","172.20.0.2","172.20.0.3","TCP","[TCP Retransmission] 4433 → 45196 [SYN, ACK] Seq=0 Ack=1 Win=65160 Len=0 MSS=1460 SACK_PERM TSval=2883215567 TSecr=2188643616 WS=128"
"199","4.742208942","66","32:db:2c:c1:a4:ed","ba:af:dd:fd:0f:27","172.20.0.3","172.20.0.2","TCP","45196 → 4433 [ACK] Seq=1 Ack=1 Win=64256 Len=0 TSval=2188644637 TSecr=2883215567"
"200","4.742256294","66","32:db:2c:c1:a4:ed","ba:af:dd:fd:0f:27","172.20.0.3","172.20.0.2","TCP","[TCP Dup ACK 199#1] 45196 → 4433 [ACK] Seq=1 Ack=1 Win=64256 Len=0 TSval=2188644637 TSecr=2883215567"
"201","4.742325533","2056","32:db:2c:c1:a4:ed","ba:af:dd:fd:0f:27","172.20.0.3","172.20.0.2","TLSv1.2","Client Hello"
"202","4.742335931","66","ba:af:dd:fd:0f:27","32:db:2c:c1:a4:ed","172.20.0.2","172.20.0.3","TCP","4433 → 45196 [ACK] Seq=1 Ack=1991 Win=64128 Len=0 TSval=2883215567 TSecr=2188644637"
"203","4.745606896","1514","ba:af:dd:fd:0f:27","32:db:2c:c1:a4:ed","172.20.0.2","172.20.0.3","SSL",""
"204","4.745640496","66","32:db:2c:c1:a4:ed","ba:af:dd:fd:0f:27","172.20.0.3","172.20.0.2","TCP","45196 → 4433 [ACK] Seq=1991 Ack=1449 Win=64128 Len=0 TSval=2188644640 TSecr=2883215570"
"205","4.950082824","1096","ba:af:dd:fd:0f:27","32:db:2c:c1:a4:ed","172.20.0.2","172.20.0.3","TLSv1.3","Server Hello, Change Cipher Spec, Application Data, Application Data, Application Data, Application Data"
"206","4.950167491","66","32:db:2c:c1:a4:ed","ba:af:dd:fd:0f:27","172.20.0.3","172.20.0.2","TCP","45196 → 4433 [ACK] Seq=1991 Ack=2479 Win=64128 Len=0 TSval=2188644845 TSecr=2883215775"
"207","4.955427558","146","32:db:2c:c1:a4:ed","ba:af:dd:fd:0f:27","172.20.0.3","172.20.0.2","TLSv1.3","Change Cipher Spec, Application Data"
"208","4.955506660","66","32:db:2c:c1:a4:ed","ba:af:dd:fd:0f:27","172.20.0.3","172.20.0.2","TCP","45196 → 4433 [RST, ACK] Seq=2071 Ack=2479 Win=64128 Len=0 TSval=2188644850 TSecr=2883215775"
"209","4.966404529","74","32:db:2c:c1:a4:ed","ba:af:dd:fd:0f:27","172.20.0.3","172.20.0.2","TCP","45210 → 4433 [SYN] Seq=0 Win=64240 Len=0 MSS=1460 SACK_PERM TSval=2188644861 TSecr=0 WS=128"
"210","4.966437957","74","ba:af:dd:fd:0f:27","32:db:2c:c1:a4:ed","172.20.0.2","172.20.0.3","TCP","4433 → 45210 [SYN, ACK] Seq=0 Ack=1 Win=65160 Len=0 MSS=1460 SACK_PERM TSval=2883215791 TSecr=2188644861 WS=128"
"211","4.966457211","66","32:db:2c:c1:a4:ed","ba:af:dd:fd:0f:27","172.20.0.3","172.20.0.2","TCP","45210 → 4433 [ACK] Seq=1 Ack=1 Win=64256 Len=0 TSval=2188644861 TSecr=2883215791"
"212","4.966502918","2056","32:db:2c:c1:a4:ed","ba:af:dd:fd:0f:27","172.20.0.3","172.20.0.2","TLSv1.2","Client Hello"
"213","4.966519563","66","ba:af:dd:fd:0f:27","32:db:2c:c1:a4:ed","172.20.0.2","172.20.0.3","TCP","4433 → 45210 [ACK] Seq=1 Ack=1991 Win=64128 Len=0 TSval=2883215791 TSecr=2188644861"
"214","4.969918079","2544","ba:af:dd:fd:0f:27","32:db:2c:c1:a4:ed","172.20.0.2","172.20.0.3","TLSv1.3","Server Hello, Change Cipher Spec, Application Data, Application Data, Application Data, Application Data"
"215","4.969950578","66","32:db:2c:c1:a4:ed","ba:af:dd:fd:0f:27","172.20.0.3","172.20.0.2","TCP","45210 → 4433 [ACK] Seq=1991 Ack=2479 Win=64128 Len=0 TSval=2188644864 TSecr=2883215794"
"216","4.974854276","146","32:db:2c:c1:a4:ed","ba:af:dd:fd:0f:27","172.20.0.3","172.20.0.2","TLSv1.3","Change Cipher Spec, Application Data"
"217","4.974927318","66","32:db:2c:c1:a4:ed","ba:af:dd:fd:0f:27","172.20.0.3","172.20.0.2","TCP","45210 → 4433 [RST, ACK] Seq=2071 Ack=2479 Win=64128 Len=0 TSval=2188644869 TSecr=2883215794"
"218","4.985572299","74","32:db:2c:c1:a4:ed","ba:af:dd:fd:0f:27","172.20.0.3","172.20.0.2","TCP","45222 → 4433 [SYN] Seq=0 Win=64240 Len=0 MSS=1460 SACK_PERM TSval=2188644880 TSecr=0 WS=128"
"219","4.985599561","74","ba:af:dd:fd:0f:27","32:db:2c:c1:a4:ed","172.20.0.2","172.20.0.3","TCP","4433 → 45222 [SYN, ACK] Seq=0 Ack=1 Win=65160 Len=0 MSS=1460 SACK_PERM TSval=2883215810 TSecr=2188644880 WS=128"
"220","4.985616432","66","32:db:2c:c1:a4:ed","ba:af:dd:fd:0f:27","172.20.0.3","172.20.0.2","TCP","45222 → 4433 [ACK] Seq=1 Ack=1 Win=64256 Len=0 TSval=2188644880 TSecr=2883215810"
"221","4.985662173","2056","32:db:2c:c1:a4:ed","ba:af:dd:fd:0f:27","172.20.0.3","172.20.0.2","TLSv1.2","Client Hello"
"222","4.985669542","66","ba:af:dd:fd:0f:27","32:db:2c:c1:a4:ed","172.20.0.2","172.20.0.3","TCP","4433 → 45222 [ACK] Seq=1 Ack=1991 Win=64128 Len=0 TSval=2883215810 TSecr=2188644880"
"223","4.988749214","2543","ba:af:dd:fd:0f:27","32:db:2c:c1:a4:ed","172.20.0.2","172.20.0.3","TLSv1.3","Server Hello, Change Cipher Spec, Application Data, Application Data, Application Data, Application Data"
"224","4.988774983","66","32:db:2c:c1:a4:ed","ba:af:dd:fd:0f:27","172.20.0.3","172.20.0.2","TCP","45222 → 4433 [ACK] Seq=1991 Ack=2478 Win=64128 Len=0 TSval=2188644883 TSecr=2883215813"
