frame.number,frame.time_relative,frame.len,eth.src,eth.dst,ip.src,ip.dst,_ws.col.protocol,_ws.col.info
"1","0.000000000","95","f2:21:64:f0:41:09","33:33:00:00:00:fb",,,"MDNS","Standard query 0x0000 PTR _smb._tcp.local, ""QM"" question"
"2","0.077274077","208","f2:21:64:f0:41:09","33:33:00:00:00:fb",,,"MDNS","Standard query response 0x0000 PTR MONTE-VIRTUAL-MACHINE._smb._tcp.local TXT, cache flush SRV, cache flush 0 0 445 monte-virtual-machine.local AAAA, cache flush fe80::f021:64ff:fef0:4109"
"3","3.699558361","42","c2:ec:c0:e5:c6:77","ff:ff:ff:ff:ff:ff",,,"ARP","ARP Announcement for 172.20.0.3"
"4","3.730127650","42","c2:ec:c0:e5:c6:77","ff:ff:ff:ff:ff:ff",,,"ARP","Who has 172.20.0.2? Tell 172.20.0.3"
"5","4.700630797","42","c2:ec:c0:e5:c6:77","ff:ff:ff:ff:ff:ff",,,"ARP","ARP Announcement for 172.20.0.3"
"6","4.749767474","42","c2:ec:c0:e5:c6:77","ff:ff:ff:ff:ff:ff",,,"ARP","Who has 172.20.0.2? Tell 172.20.0.3"
"7","5.700007282","42","c2:ec:c0:e5:c6:77","ff:ff:ff:ff:ff:ff",,,"ARP","ARP Announcement for 172.20.0.3"
"8","5.773767111","42","c2:ec:c0:e5:c6:77","ff:ff:ff:ff:ff:ff",,,"ARP","Who has 172.20.0.2? Tell 172.20.0.3"
"9","5.773791285","42","be:cb:ce:0a:c9:f6","c2:ec:c0:e5:c6:77",,,"ARP","172.20.0.2 is at be:cb:ce:0a:c9:f6"
"10","5.773807090","74","c2:ec:c0:e5:c6:77","be:cb:ce:0a:c9:f6","172.20.0.3","172.20.0.2","TCP","33912 → 4433 [SYN] Seq=0 Win=64240 Len=0 MSS=1460 SACK_PERM TSval=2187780833 TSecr=0 WS=128"
"11","5.773859311","74","be:cb:ce:0a:c9:f6","c2:ec:c0:e5:c6:77","172.20.0.2","172.20.0.3","TCP","4433 → 33912 [SYN, ACK] Seq=0 Ack=1 Win=65160 Len=0 MSS=1460 SACK_PERM TSval=2882353807 TSecr=2187780833 WS=128"
"12","5.773894574","66","c2:ec:c0:e5:c6:77","be:cb:ce:0a:c9:f6","172.20.0.3","172.20.0.2","TCP","33912 → 4433 [ACK] Seq=1 Ack=1 Win=64256 Len=0 TSval=2187782877 TSecr=2882353807"
"13","5.773983141","1672","c2:ec:c0:e5:c6:77","be:cb:ce:0a:c9:f6","172.20.0.3","172.20.0.2","TLSv1.2","Client Hello"
"14","5.773990703","66","be:cb:ce:0a:c9:f6","c2:ec:c0:e5:c6:77","172.20.0.2","172.20.0.3","TCP","4433 → 33912 [ACK] Seq=1 Ack=1607 Win=64128 Len=0 TSval=2882353807 TSecr=2187782877"
"15","5.776786883","1955","be:cb:ce:0a:c9:f6","c2:ec:c0:e5:c6:77","172.20.0.2","172.20.0.3","TLSv1.3","Server Hello, Change Cipher Spec, Application Data, Application Data, Application Data, Application Data"
"16","5.776817515","66","c2:ec:c0:e5:c6:77","be:cb:ce:0a:c9:f6","172.20.0.3","172.20.0.2","TCP","33912 → 4433 [ACK] Seq=1607 Ack=1890 Win=64128 Len=0 TSval=2187782880 TSecr=2882353810"
"17","5.779560883","146","c2:ec:c0:e5:c6:77","be:cb:ce:0a:c9:f6","172.20.0.3","172.20.0.2","TLSv1.3","Change Cipher Spec, Application Data"
"18","5.779628914","66","c2:ec:c0:e5:c6:77","be:cb:ce:0a:c9:f6","172.20.0.3","172.20.0.2","TCP","33912 → 4433 [RST, ACK] Seq=1687 Ack=1890 Win=64128 Len=0 TSval=2187782882 TSecr=2882353810"
"19","5.791826544","74","c2:ec:c0:e5:c6:77","be:cb:ce:0a:c9:f6","172.20.0.3","172.20.0.2","TCP","33918 → 4433 [SYN] Seq=0 Win=64240 Len=0 MSS=1460 SACK_PERM TSval=2187782895 TSecr=0 WS=128"
"20","5.791860903","74","be:cb:ce:0a:c9:f6","c2:ec:c0:e5:c6:77","172.20.0.2","172.20.0.3","TCP","4433 → 33918 [SYN, ACK] Seq=0 Ack=1 Win=65160 Len=0 MSS=1460 SACK_PERM TSval=2882353825 TSecr=2187782895 WS=128"
"21","5.791879480","66","c2:ec:c0:e5:c6:77","be:cb:ce:0a:c9:f6","172.20.0.3","172.20.0.2","TCP","33918 → 4433 [ACK] Seq=1 Ack=1 Win=64256 Len=0 TSval=2187782895 TSecr=2882353825"
"22","5.791926327","1672","c2:ec:c0:e5:c6:77","be:cb:ce:0a:c9:f6","172.20.0.3","172.20.0.2","TLSv1.2","Client Hello"
"23","5.791931570","66","be:cb:ce:0a:c9:f6","c2:ec:c0:e5:c6:77","172.20.0.2","172.20.0.3","TCP","4433 → 33918 [ACK] Seq=1 Ack=1607 Win=64128 Len=0 TSval=2882353825 TSecr=2187782895"
"24","5.796741836","505","be:cb:ce:0a:c9:f6","c2:ec:c0:e5:c6:77","172.20.0.2","172.20.0.3","SSL","[TCP Previous segment not captured] , Continuation Data"
"25","5.796780376","78","c2:ec:c0:e5:c6:77","be:cb:ce:0a:c9:f6","172.20.0.3","172.20.0.2","TCP","[TCP Dup ACK 21#1] 33918 → 4433 [ACK] Seq=1607 Ack=1 Win=64256 Len=0 TSval=2187782900 TSecr=2882353825 SLE=1449 SRE=1888"
"26","5.796790072","1514","be:cb:ce:0a:c9:f6","c2:ec:c0:e5:c6:77","172.20.0.2","172.20.0.3","TCP","[TCP Out-Of-Order] 4433 → 33918 [ACK] Seq=1 Ack=1607 Win=64128 Len=1448 TSval=2882353830 TSecr=2187782900"
"27","5.796802886","66","c2:ec:c0:e5:c6:77","be:cb:ce:0a:c9:f6","172.20.0.3","172.20.0.2","TCP","33918 → 4433 [ACK] Seq=1607 Ack=1888 Win=64128 Len=0 TSval=2187782900 TSecr=2882353830"
"28","5.799778027","146","c2:ec:c0:e5:c6:77","be:cb:ce:0a:c9:f6","172.20.0.3","172.20.0.2","TLSv1.2","Change Cipher Spec, Application Data"
"29","5.799843810","66","c2:ec:c0:e5:c6:77","be:cb:ce:0a:c9:f6","172.20.0.3","172.20.0.2","TCP","33918 → 4433 [RST, ACK] Seq=1687 Ack=1888 Win=64128 Len=0 TSval=2187782903 TSecr=2882353830"
"30","5.811799656","74","c2:ec:c0:e5:c6:77","be:cb:ce:0a:c9:f6","172.20.0.3","172.20.0.2","TCP","33922 → 4433 [SYN] Seq=0 Win=64240 Len=0 MSS=1460 SACK_PERM TSval=2187782915 TSecr=0 WS=128"
"31","5.811831804","74","be:cb:ce:0a:c9:f6","c2:ec:c0:e5:c6:77","172.20.0.2","172.20.0.3","TCP","4433 → 33922 [SYN, ACK] Seq=0 Ack=1 Win=65160 Len=0 MSS=1460 SACK_PERM TSval=2882353845 TSecr=2187782915 WS=128"
"32","5.811851192","66","c2:ec:c0:e5:c6:77","be:cb:ce:0a:c9:f6","172.20.0.3","172.20.0.2","TCP","33922 → 4433 [ACK] Seq=1 Ack=1 Win=64256 Len=0 TSval=2187782915 TSecr=2882353845"
"33","5.811897235","1672","c2:ec:c0:e5:c6:77","be:cb:ce:0a:c9:f6","172.20.0.3","172.20.0.2","TLSv1.2","Client Hello"
"34","5.813569919","1954","be:cb:ce:0a:c9:f6","c2:ec:c0:e5:c6:77","172.20.0.2","172.20.0.3","TLSv1.3","Server Hello, Change Cipher Spec, Application Data, Application Data, Application Data, Application Data"
"35","5.813599895","66","c2:ec:c0:e5:c6:77","be:cb:ce:0a:c9:f6","172.20.0.3","172.20.0.2","TCP","33922 → 4433 [ACK] Seq=1607 Ack=1889 Win=64128 Len=0 TSval=2187782916 TSecr=2882353846"
"36","5.816501765","146","c2:ec:c0:e5:c6:77","be:cb:ce:0a:c9:f6","172.20.0.3","172.20.0.2","TLSv1.3","Change Cipher Spec, Application Data"
"37","5.816573012","66","c2:ec:c0:e5:c6:77","be:cb:ce:0a:c9:f6","172.20.0.3","172.20.0.2","TCP","33922 → 4433 [RST, ACK] Seq=1687 Ack=1889 Win=64128 Len=0 TSval=2187782919 TSecr=2882353846"
"38","5.827340072","74","c2:ec:c0:e5:c6:77","be:cb:ce:0a:c9:f6","172.20.0.3","172.20.0.2","TCP","33934 → 4433 [SYN] Seq=0 Win=64240 Len=0 MSS=1460 SACK_PERM TSval=2187782930 TSecr=0 WS=128"
"39","5.827379097","74","be:cb:ce:0a:c9:f6","c2:ec:c0:e5:c6:77","172.20.0.2","172.20.0.3","TCP","4433 → 33934 [SYN, ACK] Seq=0 Ack=1 Win=65160 Len=0 MSS=1460 SACK_PERM TSval=2882353860 TSecr=2187782930 WS=128"
"40","5.827396466","66","c2:ec:c0:e5:c6:77","be:cb:ce:0a:c9:f6","172.20.0.3","172.20.0.2","TCP","33934 → 4433 [ACK] Seq=1 Ack=1 Win=64256 Len=0 TSval=2187782930 TSecr=2882353860"
"41","5.827436531","1672","c2:ec:c0:e5:c6:77","be:cb:ce:0a:c9:f6","172.20.0.3","172.20.0.2","TLSv1.2","Client Hello"
"42","5.827442320","66","be:cb:ce:0a:c9:f6","c2:ec:c0:e5:c6:77","172.20.0.2","172.20.0.3","TCP","4433 → 33934 [ACK] Seq=1 Ack=1607 Win=64128 Len=0 TSval=2882353860 TSecr=2187782930"
"43","6.037759990","1514","be:cb:ce:0a:c9:f6","c2:ec:c0:e5:c6:77","172.20.0.2","172.20.0.3","TLSv1.3","Server Hello, Change Cipher Spec, Application Data"
"44","6.037837153","66","c2:ec:c0:e5:c6:77","be:cb:ce:0a:c9:f6","172.20.0.3","172.20.0.2","TCP","33934 → 4433 [ACK] Seq=1607 Ack=1449 Win=64128 Len=0 TSval=2187783141 TSecr=2882354071"
"45","6.037850951","506","be:cb:ce:0a:c9:f6","c2:ec:c0:e5:c6:77","172.20.0.2","172.20.0.3","TLSv1.3","Application Data, Application Data, Application Data"
"46","6.037857064","66","c2:ec:c0:e5:c6:77","be:cb:ce:0a:c9:f6","172.20.0.3","172.20.0.2","TCP","33934 → 4433 [ACK] Seq=1607 Ack=1889 Win=64128 Len=0 TSval=2187783141 TSecr=2882354071"
"47","6.040838969","146","c2:ec:c0:e5:c6:77","be:cb:ce:0a:c9:f6","172.20.0.3","172.20.0.2","TLSv1.3","Change Cipher Spec, Application Data"
"48","6.040910515","66","c2:ec:c0:e5:c6:77","be:cb:ce:0a:c9:f6","172.20.0.3","172.20.0.2","TCP","33934 → 4433 [RST, ACK] Seq=1687 Ack=1889 Win=64128 Len=0 TSval=2187783144 TSecr=2882354071"
"49","6.052327171","74","c2:ec:c0:e5:c6:77","be:cb:ce:0a:c9:f6","172.20.0.3","172.20.0.2","TCP","33950 → 4433 [SYN] Seq=0 Win=64240 Len=0 MSS=1460 SACK_PERM TSval=2187783155 TSecr=0 WS=128"
"50","6.052354171","74","be:cb:ce:0a:c9:f6","c2:ec:c0:e5:c6:77","172.20.0.2","172.20.0.3","TCP","4433 → 33950 [SYN, ACK] Seq=0 Ack=1 Win=65160 Len=0 MSS=1460 SACK_PERM TSval=2882354085 TSecr=2187783155 WS=128"
"51","6.052373161","66","c2:ec:c0:e5:c6:77","be:cb:ce:0a:c9:f6","172.20.0.3","172.20.0.2","TCP","33950 → 4433 [ACK] Seq=1 Ack=1 Win=64256 Len=0 TSval=2187783155 TSecr=2882354085"
"52","6.052421948","1672","c2:ec:c0:e5:c6:77","be:cb:ce:0a:c9:f6","172.20.0.3","172.20.0.2","TLSv1.2","Client Hello"
"53","6.052428917","66","be:cb:ce:0a:c9:f6","c2:ec:c0:e5:c6:77","172.20.0.2","172.20.0.3","TCP","4433 → 33950 [ACK] Seq=1 Ack=1607 Win=64128 Len=0 TSval=2882354085 TSecr=2187783155"
"54","6.054015437","1953","be:cb:ce:0a:c9:f6","c2:ec:c0:e5:c6:77","172.20.0.2","172.20.0.3","TLSv1.3","Server Hello, Change Cipher Spec, Application Data, Application Data, Application Data, Application Data"
"55","6.054042521","66","c2:ec:c0:e5:c6:77","be:cb:ce:0a:c9:f6","172.20.0.3","172.20.0.2","TCP","33950 → 4433 [ACK] Seq=1607 Ack=1888 Win=64128 Len=0 TSval=2187783157 TSecr=2882354087"
"56","6.056730826","146","c2:ec:c0:e5:c6:77","be:cb:ce:0a:c9:f6","172.20.0.3","172.20.0.2","TLSv1.3","Change Cipher Spec, Application Data"
"57","6.056808332","66","c2:ec:c0:e5:c6:77","be:cb:ce:0a:c9:f6","172.20.0.3","172.20.0.2","TCP","33950 → 4433 [RST, ACK] Seq=1687 Ack=1888 Win=64128 Len=0 TSval=2187783160 TSecr=2882354087"
"58","6.068192747","74","c2:ec:c0:e5:c6:77","be:cb:ce:0a:c9:f6","172.20.0.3","172.20.0.2","TCP","33964 → 4433 [SYN] Seq=0 Win=64240 Len=0 MSS=1460 SACK_PERM TSval=2187783171 TSecr=0 WS=128"
"59","6.068235944","74","be:cb:ce:0a:c9:f6","c2:ec:c0:e5:c6:77","172.20.0.2","172.20.0.3","TCP","4433 → 33964 [SYN, ACK] Seq=0 Ack=1 Win=65160 Len=0 MSS=1460 SACK_PERM TSval=2882354101 TSecr=2187783171 WS=128"
"60","6.068254785","66","c2:ec:c0:e5:c6:77","be:cb:ce:0a:c9:f6","172.20.0.3","172.20.0.2","TCP","33964 → 4433 [ACK] Seq=1 Ack=1 Win=64256 Len=0 TSval=2187783171 TSecr=2882354101"
"61","6.068313414","1672","c2:ec:c0:e5:c6:77","be:cb:ce:0a:c9:f6","172.20.0.3","172.20.0.2","TLSv1.2","Client Hello"
"62","6.068319285","66","be:cb:ce:0a:c9:f6","c2:ec:c0:e5:c6:77","172.20.0.2","172.20.0.3","TCP","4433 → 33964 [ACK] Seq=1 Ack=1607 Win=64128 Len=0 TSval=2882354101 TSecr=2187783171"
"63","6.069993883","1954","be:cb:ce:0a:c9:f6","c2:ec:c0:e5:c6:77","172.20.0.2","172.20.0.3","TLSv1.3","Server Hello, Change Cipher Spec, Application Data, Application Data, Application Data, Application Data"
"64","6.070022646","66","c2:ec:c0:e5:c6:77","be:cb:ce:0a:c9:f6","172.20.0.3","172.20.0.2","TCP","33964 → 4433 [ACK] Seq=1607 Ack=1889 Win=64128 Len=0 TSval=2187783173 TSecr=2882354103"
"65","6.072699795","146","c2:ec:c0:e5:c6:77","be:cb:ce:0a:c9:f6","172.20.0.3","172.20.0.2","TLSv1.3","Change Cipher Spec, Application Data"
"66","6.072778603","66","c2:ec:c0:e5:c6:77","be:cb:ce:0a:c9:f6","172.20.0.3","172.20.0.2","TCP","33964 → 4433 [RST, ACK] Seq=1687 Ack=1889 Win=64128 Len=0 TSval=2187783176 TSecr=2882354103"
"67","6.084243161","74","c2:ec:c0:e5:c6:77","be:cb:ce:0a:c9:f6","172.20.0.3","172.20.0.2","TCP","33966 → 4433 [SYN] Seq=0 Win=64240 Len=0 MSS=1460 SACK_PERM TSval=2187783187 TSecr=0 WS=128"
"68","7.117826886","74","c2:ec:c0:e5:c6:77","be:cb:ce:0a:c9:f6","172.20.0.3","172.20.0.2","TCP","[TCP Retransmission] 33966 → 4433 [SYN] Seq=0 Win=64240 Len=0 MSS=1460 SACK_PERM TSval=2187784221 TSecr=0 WS=128"
"69","7.117841962","74","be:cb:ce:0a:c9:f6","c2:ec:c0:e5:c6:77","172.20.0.2","172.20.0.3","TCP","4433 → 33966 [SYN, ACK] Seq=0 Ack=1 Win=65160 Len=0 MSS=1460 SACK_PERM TSval=2882355151 TSecr=2187783187 WS=128"
"70","7.117886806","66","c2:ec:c0:e5:c6:77","be:cb:ce:0a:c9:f6","172.20.0.3","172.20.0.2","TCP","33966 → 4433 [ACK] Seq=1 Ack=1 Win=64256 Len=0 TSval=2187784221 TSecr=2882355151"
"71","7.117997247","1672","c2:ec:c0:e5:c6:77","be:cb:ce:0a:c9:f6","172.20.0.3","172.20.0.2","TLSv1.2","Client Hello"
"72","7.118011516","66","be:cb:ce:0a:c9:f6","c2:ec:c0:e5:c6:77","172.20.0.2","172.20.0.3","TCP","4433 → 33966 [ACK] Seq=1 Ack=1607 Win=64128 Len=0 TSval=2882355151 TSecr=2187784221"
"73","7.119809404","1514","be:cb:ce:0a:c9:f6","c2:ec:c0:e5:c6:77","172.20.0.2","172.20.0.3","TLSv1.3","Server Hello, Change Cipher Spec, Application Data"
"74","7.119858431","66","c2:ec:c0:e5:c6:77","be:cb:ce:0a:c9:f6","172.20.0.3","172.20.0.2","TCP","33966 → 4433 [ACK] Seq=1607 Ack=1449 Win=64128 Len=0 TSval=2187784223 TSecr=2882355153"
"75","7.119870701","506","be:cb:ce:0a:c9:f6","c2:ec:c0:e5:c6:77","172.20.0.2","172.20.0.3","TLSv1.3","Application Data, Application Data, Application Data"
"76","7.119876195","66","c2:ec:c0:e5:c6:77","be:cb:ce:0a:c9:f6","172.20.0.3","172.20.0.2","TCP","33966 → 4433 [ACK] Seq=1607 Ack=1889 Win=64128 Len=0 TSval=2187784223 TSecr=2882355153"
"77","7.122781228","146","c2:ec:c0:e5:c6:77","be:cb:ce:0a:c9:f6","172.20.0.3","172.20.0.2","TLSv1.3","Change Cipher Spec, Application Data"
"78","7.122849025","66","c2:ec:c0:e5:c6:77","be:cb:ce:0a:c9:f6","172.20.0.3","172.20.0.2","TCP","33966 → 4433 [RST, ACK] Seq=1687 Ack=1889 Win=64128 Len=0 TSval=2187784226 TSecr=2882355153"
"79","7.134449972","74","c2:ec:c0:e5:c6:77","be:cb:ce:0a:c9:f6","172.20.0.3","172.20.0.2","TCP","33968 → 4433 [SYN] Seq=0 Win=64240 Len=0 MSS=1460 SACK_PERM TSval=2187784237 TSecr=0 WS=128"
"80","7.134486489","74","be:cb:ce:0a:c9:f6","c2:ec:c0:e5:c6:77","172.20.0.2","172.20.0.3","TCP","4433 → 33968 [SYN, ACK] Seq=0 Ack=1 Win=65160 Len=0 MSS=1460 SACK_PERM TSval=2882355167 TSecr=2187784237 WS=128"
"81","7.134507723","66","c2:ec:c0:e5:c6:77","be:cb:ce:0a:c9:f6","172.20.0.3","172.20.0.2","TCP","33968 → 4433 [ACK] Seq=1 Ack=1 Win=64256 Len=0 TSval=2187784237 TSecr=2882355167"
"82","7.134565256","1672","c2:ec:c0:e5:c6:77","be:cb:ce:0a:c9:f6","172.20.0.3","172.20.0.2","TLSv1.2","Client Hello"
"83","7.134572499","66","be:cb:ce:0a:c9:f6","c2:ec:c0:e5:c6:77","172.20.0.2","172.20.0.3","TCP","4433 → 33968 [ACK] Seq=1 Ack=1607 Win=64128 Len=0 TSval=2882355167 TSecr=2187784237"
"84","7.136207088","1953","be:cb:ce:0a:c9:f6","c2:ec:c0:e5:c6:77","172.20.0.2","172.20.0.3","TLSv1.3","Server Hello, Change Cipher Spec, Application Data, Application Data, Application Data, Application Data"
"85","7.136239585","66","c2:ec:c0:e5:c6:77","be:cb:ce:0a:c9:f6","172.20.0.3","172.20.0.2","TCP","33968 → 4433 [ACK] Seq=1607 Ack=1888 Win=64128 Len=0 TSval=2187784239 TSecr=2882355169"
"86","7.139164651","146","c2:ec:c0:e5:c6:77","be:cb:ce:0a:c9:f6","172.20.0.3","172.20.0.2","TLSv1.3","Change Cipher Spec, Application Data"
"87","7.139225818","66","c2:ec:c0:e5:c6:77","be:cb:ce:0a:c9:f6","172.20.0.3","172.20.0.2","TCP","33968 → 4433 [RST, ACK] Seq=1687 Ack=1888 Win=64128 Len=0 TSval=2187784242 TSecr=2882355169"
"88","7.155102996","74","c2:ec:c0:e5:c6:77","be:cb:ce:0a:c9:f6","172.20.0.3","172.20.0.2","TCP","33980 → 4433 [SYN] Seq=0 Win=64240 Len=0 MSS=1460 SACK_PERM TSval=2187784258 TSecr=0 WS=128"
"89","7.155144955","74","be:cb:ce:0a:c9:f6","c2:ec:c0:e5:c6:77","172.20.0.2","172.20.0.3","TCP","4433 → 33980 [SYN, ACK] Seq=0 Ack=1 Win=65160 Len=0 MSS=1460 SACK_PERM TSval=2882355188 TSecr=2187784258 WS=128"
"90","7.155174011","66","c2:ec:c0:e5:c6:77","be:cb:ce:0a:c9:f6","172.20.0.3","172.20.0.2","TCP","33980 → 4433 [ACK] Seq=1 Ack=1 Win=64256 Len=0 TSval=2187784258 TSecr=2882355188"
"91","7.155247528","1672","c2:ec:c0:e5:c6:77","be:cb:ce:0a:c9:f6","172.20.0.3","172.20.0.2","TLSv1.2","Client Hello"
"92","7.155256487","66","be:cb:ce:0a:c9:f6","c2:ec:c0:e5:c6:77","172.20.0.2","172.20.0.3","TCP","4433 → 33980 [ACK] Seq=1 Ack=1607 Win=64128 Len=0 TSval=2882355188 TSecr=2187784258"
"93","7.157225012","1954","be:cb:ce:0a:c9:f6","c2:ec:c0:e5:c6:77","172.20.0.2","172.20.0.3","TLSv1.3","Server Hello, Change Cipher Spec, Application Data, Application Data, Application Data, Application Data"
"94","7.157270195","66","c2:ec:c0:e5:c6:77","be:cb:ce:0a:c9:f6","172.20.0.3","172.20.0.2","TCP","33980 → 4433 [ACK] Seq=1607 Ack=1889 Win=64128 Len=0 TSval=2187784260 TSecr=2882355190"
"95","7.161882833","146","c2:ec:c0:e5:c6:77","be:cb:ce:0a:c9:f6","172.20.0.3","172.20.0.2","TLSv1.3","Change Cipher Spec, Application Data"
"96","7.161972776","66","c2:ec:c0:e5:c6:77","be:cb:ce:0a:c9:f6","172.20.0.3","172.20.0.2","TCP","33980 → 4433 [RST, ACK] Seq=1687 Ack=1889 Win=64128 Len=0 TSval=2187784265 TSecr=2882355190"
"97","7.173666392","74","c2:ec:c0:e5:c6:77","be:cb:ce:0a:c9:f6","172.20.0.3","172.20.0.2","TCP","33990 → 4433 [SYN] Seq=0 Win=64240 Len=0 MSS=1460 SACK_PERM TSval=2187784276 TSecr=0 WS=128"
"98","8.205783496","74","be:cb:ce:0a:c9:f6","c2:ec:c0:e5:c6:77","172.20.0.2","172.20.0.3","TCP","4433 → 33990 [SYN, ACK] Seq=0 Ack=1 Win=65160 Len=0 MSS=1460 SACK_PERM TSval=2882356239 TSecr=2187784276 WS=128"
"99","8.205814861","74","c2:ec:c0:e5:c6:77","be:cb:ce:0a:c9:f6","172.20.0.3","172.20.0.2","TCP","[TCP Retransmission] 33990 → 4433 [SYN] Seq=0 Win=64240 Len=0 MSS=1460 SACK_PERM TSval=2187785309 TSecr=0 WS=128"
"100","8.205834166","74","be:cb:ce:0a:c9:f6","c2:ec:c0:e5:c6:77","172.20.0.2","172.20.0.3","TCP","[TCP Retransmission] 4433 → 33990 [SYN, ACK] Seq=0 Ack=1 Win=65160 Len=0 MSS=1460 SACK_PERM TSval=2882356239 TSecr=2187784276 WS=128"
"101","8.205878058","66","c2:ec:c0:e5:c6:77","be:cb:ce:0a:c9:f6","172.20.0.3","172.20.0.2","TCP","33990 → 4433 [ACK] Seq=1 Ack=1 Win=64256 Len=0 TSval=2187785309 TSecr=2882356239"
"102","8.205903886","66","c2:ec:c0:e5:c6:77","be:cb:ce:0a:c9:f6","172.20.0.3","172.20.0.2","TCP","[TCP Dup ACK 101#1] 33990 → 4433 [ACK] Seq=1 Ack=1 Win=64256 Len=0 TSval=2187785309 TSecr=2882356239"
"103","8.205965554","1672","c2:ec:c0:e5:c6:77","be:cb:ce:0a:c9:f6","172.20.0.3","172.20.0.2","TLSv1.2","Client Hello"
"104","8.205983123","66","be:cb:ce:0a:c9:f6","c2:ec:c0:e5:c6:77","172.20.0.2","172.20.0.3","TCP","4433 → 33990 [ACK] Seq=1 Ack=1607 Win=64128 Len=0 TSval=2882356239 TSecr=2187785309"
"105","8.413760370","506","be:cb:ce:0a:c9:f6","c2:ec:c0:e5:c6:77","172.20.0.2","172.20.0.3","SSL","[TCP Previous segment not captured] , Continuation Data"
"106","8.413820716","78","c2:ec:c0:e5:c6:77","be:cb:ce:0a:c9:f6","172.20.0.3","172.20.0.2","TCP","[TCP Dup ACK 101#2] 33990 → 4433 [ACK] Seq=1607 Ack=1 Win=64256 Len=0 TSval=2187785517 TSecr=2882356239 SLE=1449 SRE=1889"
"107","8.413832862","1514","be:cb:ce:0a:c9:f6","c2:ec:c0:e5:c6:77","172.20.0.2","172.20.0.3","TLSv1.3","[TCP Fast Retransmission] , Server Hello, Change Cipher Spec, Application Data"
"108","8.413849457","66","c2:ec:c0:e5:c6:77","be:cb:ce:0a:c9:f6","172.20.0.3","172.20.0.2","TCP","33990 → 4433 [ACK] Seq=1607 Ack=1889 Win=64128 Len=0 TSval=2187785517 TSecr=2882356447"
"109","8.416956163","146","c2:ec:c0:e5:c6:77","be:cb:ce:0a:c9:f6","172.20.0.3","172.20.0.2","TLSv1.3","Change Cipher Spec, Application Data"
"110","8.417040367","66","c2:ec:c0:e5:c6:77","be:cb:ce:0a:c9:f6","172.20.0.3","172.20.0.2","TCP","33990 → 4433 [RST, ACK] Seq=1687 Ack=1889 Win=64128 Len=0 TSval=2187785520 TSecr=2882356447"
"111","8.428894833","74","c2:ec:c0:e5:c6:77","be:cb:ce:0a:c9:f6","172.20.0.3","172.20.0.2","TCP","34002 → 4433 [SYN] Seq=0 Win=64240 Len=0 MSS=1460 SACK_PERM TSval=2187785532 TSecr=0 WS=128"
"112","8.428943275","74","be:cb:ce:0a:c9:f6","c2:ec:c0:e5:c6:77","172.20.0.2","172.20.0.3","TCP","4433 → 34002 [SYN, ACK] Seq=0 Ack=1 Win=65160 Len=0 MSS=1460 SACK_PERM TSval=2882356462 TSecr=2187785532 WS=128"
"113","8.428962784","66","c2:ec:c0:e5:c6:77","be:cb:ce:0a:c9:f6","172.20.0.3","172.20.0.2","TCP","34002 → 4433 [ACK] Seq=1 Ack=1 Win=64256 Len=0 TSval=2187785532 TSecr=2882356462"
"114","8.429018500","1672","c2:ec:c0:e5:c6:77","be:cb:ce:0a:c9:f6","172.20.0.3","172.20.0.2","TLSv1.2","Client Hello"
"115","8.429023933","66","be:cb:ce:0a:c9:f6","c2:ec:c0:e5:c6:77","172.20.0.2","172.20.0.3","TCP","4433 → 34002 [ACK] Seq=1 Ack=1607 Win=64128 Len=0 TSval=2882356462 TSecr=2187785532"
"116","8.431036224","1954","be:cb:ce:0a:c9:f6","c2:ec:c0:e5:c6:77","172.20.0.2","172.20.0.3","TLSv1.3","Server Hello, Change Cipher Spec, Application Data, Application Data, Application Data, Application Data"
"117","8.431079582","66","c2:ec:c0:e5:c6:77","be:cb:ce:0a:c9:f6","172.20.0.3","172.20.0.2","TCP","34002 → 4433 [ACK] Seq=1607 Ack=1889 Win=64128 Len=0 TSval=2187785534 TSecr=2882356464"
"118","8.433932230","146","c2:ec:c0:e5:c6:77","be:cb:ce:0a:c9:f6","172.20.0.3","172.20.0.2","TLSv1.3","Change Cipher Spec, Application Data"
"119","8.433997196","66","c2:ec:c0:e5:c6:77","be:cb:ce:0a:c9:f6","172.20.0.3","172.20.0.2","TCP","34002 → 4433 [RST, ACK] Seq=1687 Ack=1889 Win=64128 Len=0 TSval=2187785537 TSecr=2882356464"
"120","8.445073488","74","c2:ec:c0:e5:c6:77","be:cb:ce:0a:c9:f6","172.20.0.3","172.20.0.2","TCP","34018 → 4433 [SYN] Seq=0 Win=64240 Len=0 MSS=1460 SACK_PERM TSval=2187785548 TSecr=0 WS=128"
"121","8.445105270","74","be:cb:ce:0a:c9:f6","c2:ec:c0:e5:c6:77","172.20.0.2","172.20.0.3","TCP","4433 → 34018 [SYN, ACK] Seq=0 Ack=1 Win=65160 Len=0 MSS=1460 SACK_PERM TSval=2882356478 TSecr=2187785548 WS=128"
"122","8.445122367","66","c2:ec:c0:e5:c6:77","be:cb:ce:0a:c9:f6","172.20.0.3","172.20.0.2","TCP","34018 → 4433 [ACK] Seq=1 Ack=1 Win=64256 Len=0 TSval=2187785548 TSecr=2882356478"
"123","8.445167255","1672","c2:ec:c0:e5:c6:77","be:cb:ce:0a:c9:f6","172.20.0.3","172.20.0.2","TLSv1.2","Client Hello"
"124","8.446907722","1955","be:cb:ce:0a:c9:f6","c2:ec:c0:e5:c6:77","172.20.0.2","172.20.0.3","TLSv1.3","Server Hello, Change Cipher Spec, Application Data, Application Data, Application Data, Application Data"
"125","8.446941779","66","c2:ec:c0:e5:c6:77","be:cb:ce:0a:c9:f6","172.20.0.3","172.20.0.2","TCP","34018 → 4433 [ACK] Seq=1607 Ack=1890 Win=64128 Len=0 TSval=2187785550 TSecr=2882356480"
"126","8.449649686","146","c2:ec:c0:e5:c6:77","be:cb:ce:0a:c9:f6","172.20.0.3","172.20.0.2","TLSv1.3","Change Cipher Spec, Application Data"
"127","8.449710367","66","c2:ec:c0:e5:c6:77","be:cb:ce:0a:c9:f6","172.20.0.3","172.20.0.2","TCP","34018 → 4433 [RST, ACK] Seq=1687 Ack=1890 Win=64128 Len=0 TSval=2187785552 TSecr=2882356480"
"128","8.460538798","74","c2:ec:c0:e5:c6:77","be:cb:ce:0a:c9:f6","172.20.0.3","172.20.0.2","TCP","34026 → 4433 [SYN] Seq=0 Win=64240 Len=0 MSS=1460 SACK_PERM TSval=2187785563 TSecr=0 WS=128"
"129","8.460580921","74","be:cb:ce:0a:c9:f6","c2:ec:c0:e5:c6:77","172.20.0.2","172.20.0.3","TCP","4433 → 34026 [SYN, ACK] Seq=0 Ack=1 Win=65160 Len=0 MSS=1460 SACK_PERM TSval=2882356493 TSecr=2187785563 WS=128"
"130","8.460600148","66","c2:ec:c0:e5:c6:77","be:cb:ce:0a:c9:f6","172.20.0.3","172.20.0.2","TCP","34026 → 4433 [ACK] Seq=1 Ack=1 Win=64256 Len=0 TSval=2187785563 TSecr=2882356493"
"131","8.460650092","1672","c2:ec:c0:e5:c6:77","be:cb:ce:0a:c9:f6","172.20.0.3","172.20.0.2","TLSv1.2","Client Hello"
"132","8.460657146","66","be:cb:ce:0a:c9:f6","c2:ec:c0:e5:c6:77","172.20.0.2","172.20.0.3","TCP","4433 → 34026 [ACK] Seq=1 Ack=1607 Win=64128 Len=0 TSval=2882356493 TSecr=2187785563"
"133","8.462320503","1953","be:cb:ce:0a:c9:f6","c2:ec:c0:e5:c6:77","172.20.0.2","172.20.0.3","TLSv1.3","Server Hello, Change Cipher Spec, Application Data, Application Data, Application Data, Application Data"
"134","8.462353407","66","c2:ec:c0:e5:c6:77","be:cb:ce:0a:c9:f6","172.20.0.3","172.20.0.2","TCP","34026 → 4433 [ACK] Seq=1607 Ack=1888 Win=64128 Len=0 TSval=2187785565 TSecr=2882356495"
"135","8.464916978","146","c2:ec:c0:e5:c6:77","be:cb:ce:0a:c9:f6","172.20.0.3","172.20.0.2","TLSv1.3","Change Cipher Spec, Application Data"
"136","8.464967822","66","c2:ec:c0:e5:c6:77","be:cb:ce:0a:c9:f6","172.20.0.3","172.20.0.2","TCP","34026 → 4433 [RST, ACK] Seq=1687 Ack=1888 Win=64128 Len=0 TSval=2187785568 TSecr=2882356495"
"137","8.475181282","74","c2:ec:c0:e5:c6:77","be:cb:ce:0a:c9:f6","172.20.0.3","172.20.0.2","TCP","34030 → 4433 [SYN] Seq=0 Win=64240 Len=0 MSS=1460 SACK_PERM TSval=2187785578 TSecr=0 WS=128"
"138","8.475202005","74","be:cb:ce:0a:c9:f6","c2:ec:c0:e5:c6:77","172.20.0.2","172.20.0.3","TCP","4433 → 34030 [SYN, ACK] Seq=0 Ack=1 Win=65160 Len=0 MSS=1460 SACK_PERM TSval=2882356508 TSecr=2187785578 WS=128"
"139","8.475217329","66","c2:ec:c0:e5:c6:77","be:cb:ce:0a:c9:f6","172.20.0.3","172.20.0.2","TCP","34030 → 4433 [ACK] Seq=1 Ack=1 Win=64256 Len=0 TSval=2187785578 TSecr=2882356508"
"140","8.475249534","1672","c2:ec:c0:e5:c6:77","be:cb:ce:0a:c9:f6","172.20.0.3","172.20.0.2","TLSv1.2","Client Hello"
"141","8.475255884","66","be:cb:ce:0a:c9:f6","c2:ec:c0:e5:c6:77","172.20.0.2","172.20.0.3","TCP","4433 → 34030 [ACK] Seq=1 Ack=1607 Win=64128 Len=0 TSval=2882356508 TSecr=2187785578"
"142","8.480740174","506","be:cb:ce:0a:c9:f6","c2:ec:c0:e5:c6:77","172.20.0.2","172.20.0.3","SSL","[TCP Previous segment not captured] , Continuation Data"
"143","8.480762831","78","c2:ec:c0:e5:c6:77","be:cb:ce:0a:c9:f6","172.20.0.3","172.20.0.2","TCP","[TCP Dup ACK 139#1] 34030 → 4433 [ACK] Seq=1607 Ack=1 Win=64256 Len=0 TSval=2187785584 TSecr=2882356508 SLE=1449 SRE=1889"
"144","8.480771456","1514","be:cb:ce:0a:c9:f6","c2:ec:c0:e5:c6:77","172.20.0.2","172.20.0.3","TCP","[TCP Out-Of-Order] 4433 → 34030 [ACK] Seq=1 Ack=1607 Win=64128 Len=1448 TSval=2882356514 TSecr=2187785584"
"145","8.480783317","66","c2:ec:c0:e5:c6:77","be:cb:ce:0a:c9:f6","172.20.0.3","172.20.0.2","TCP","34030 → 4433 [ACK] Seq=1607 Ack=1889 Win=64128 Len=0 TSval=2187785584 TSecr=2882356514"
"146","8.483327602","146","c2:ec:c0:e5:c6:77","be:cb:ce:0a:c9:f6","172.20.0.3","172.20.0.2","TLSv1.2","Change Cipher Spec, Application Data"
"147","8.483375244","66","c2:ec:c0:e5:c6:77","be:cb:ce:0a:c9:f6","172.20.0.3","172.20.0.2","TCP","34030 → 4433 [RST, ACK] Seq=1687 Ack=1889 Win=64128 Len=0 TSval=2187785586 TSecr=2882356514"
"148","8.493991441","74","c2:ec:c0:e5:c6:77","be:cb:ce:0a:c9:f6","172.20.0.3","172.20.0.2","TCP","34040 → 4433 [SYN] Seq=0 Win=64240 Len=0 MSS=1460 SACK_PERM TSval=2187785597 TSecr=0 WS=128"
"149","8.494018004","74","be:cb:ce:0a:c9:f6","c2:ec:c0:e5:c6:77","172.20.0.2","172.20.0.3","TCP","4433 → 34040 [SYN, ACK] Seq=0 Ack=1 Win=65160 Len=0 MSS=1460 SACK_PERM TSval=2882356527 TSecr=2187785597 WS=128"
"150","8.494035484","66","c2:ec:c0:e5:c6:77","be:cb:ce:0a:c9:f6","172.20.0.3","172.20.0.2","TCP","34040 → 4433 [ACK] Seq=1 Ack=1 Win=64256 Len=0 TSval=2187785597 TSecr=2882356527"
"151","8.494087701","1672","c2:ec:c0:e5:c6:77","be:cb:ce:0a:c9:f6","172.20.0.3","172.20.0.2","TLSv1.2","Client Hello"
"152","8.494092541","66","be:cb:ce:0a:c9:f6","c2:ec:c0:e5:c6:77","172.20.0.2","172.20.0.3","TCP","4433 → 34040 [ACK] Seq=1 Ack=1607 Win=64128 Len=0 TSval=2882356527 TSecr=2187785597"
"153","8.495745138","1954","be:cb:ce:0a:c9:f6","c2:ec:c0:e5:c6:77","172.20.0.2","172.20.0.3","TLSv1.3","Server Hello, Change Cipher Spec, Application Data, Application Data, Application Data, Application Data"
"154","8.495774934","66","c2:ec:c0:e5:c6:77","be:cb:ce:0a:c9:f6","172.20.0.3","172.20.0.2","TCP","34040 → 4433 [ACK] Seq=1607 Ack=1889 Win=64128 Len=0 TSval=2187785599 TSecr=2882356529"
"155","8.498435530","146","c2:ec:c0:e5:c6:77","be:cb:ce:0a:c9:f6","172.20.0.3","172.20.0.2","TLSv1.3","Change Cipher Spec, Application Data"
"156","8.498495437","66","c2:ec:c0:e5:c6:77","be:cb:ce:0a:c9:f6","172.20.0.3","172.20.0.2","TCP","34040 → 4433 [RST, ACK] Seq=1687 Ack=1889 Win=64128 Len=0 TSval=2187785601 TSecr=2882356529"
"157","8.509075605","74","c2:ec:c0:e5:c6:77","be:cb:ce:0a:c9:f6","172.20.0.3","172.20.0.2","TCP","34048 → 4433 [SYN] Seq=0 Win=64240 Len=0 MSS=1460 SACK_PERM TSval=2187785612 TSecr=0 WS=128"
"158","8.509108814","74","be:cb:ce:0a:c9:f6","c2:ec:c0:e5:c6:77","172.20.0.2","172.20.0.3","TCP","4433 → 34048 [SYN, ACK] Seq=0 Ack=1 Win=65160 Len=0 MSS=1460 SACK_PERM TSval=2882356542 TSecr=2187785612 WS=128"
"159","8.509126459","66","c2:ec:c0:e5:c6:77","be:cb:ce:0a:c9:f6","172.20.0.3","172.20.0.2","TCP","34048 → 4433 [ACK] Seq=1 Ack=1 Win=64256 Len=0 TSval=2187785612 TSecr=2882356542"
"160","8.509163583","1672","c2:ec:c0:e5:c6:77","be:cb:ce:0a:c9:f6","172.20.0.3","172.20.0.2","TLSv1.2","Client Hello"
"161","8.509169317","66","be:cb:ce:0a:c9:f6","c2:ec:c0:e5:c6:77","172.20.0.2","172.20.0.3","TCP","4433 → 34048 [ACK] Seq=1 Ack=1607 Win=64128 Len=0 TSval=2882356542 TSecr=2187785612"
"162","8.510719943","1953","be:cb:ce:0a:c9:f6","c2:ec:c0:e5:c6:77","172.20.0.2","172.20.0.3","TLSv1.3","Server Hello, Change Cipher Spec, Application Data, Application Data, Application Data, Application Data"
"163","8.510751258","66","c2:ec:c0:e5:c6:77","be:cb:ce:0a:c9:f6","172.20.0.3","172.20.0.2","TCP","34048 → 4433 [ACK] Seq=1607 Ack=1888 Win=64128 Len=0 TSval=2187785614 TSecr=2882356543"
"164","8.513310034","146","c2:ec:c0:e5:c6:77","be:cb:ce:0a:c9:f6","172.20.0.3","172.20.0.2","TLSv1.3","Change Cipher Spec, Application Data"
"165","8.513358941","66","c2:ec:c0:e5:c6:77","be:cb:ce:0a:c9:f6","172.20.0.3","172.20.0.2","TCP","34048 → 4433 [RST, ACK] Seq=1687 Ack=1888 Win=64128 Len=0 TSval=2187785616 TSecr=2882356543"
"166","8.523558500","74","c2:ec:c0:e5:c6:77","be:cb:ce:0a:c9:f6","172.20.0.3","172.20.0.2","TCP","34052 → 4433 [SYN] Seq=0 Win=64240 Len=0 MSS=1460 SACK_PERM TSval=2187785626 TSecr=0 WS=128"
"167","8.523587918","74","be:cb:ce:0a:c9:f6","c2:ec:c0:e5:c6:77","172.20.0.2","172.20.0.3","TCP","4433 → 34052 [SYN, ACK] Seq=0 Ack=1 Win=65160 Len=0 MSS=1460 SACK_PERM TSval=2882356556 TSecr=2187785626 WS=128"
"168","8.523603208","66","c2:ec:c0:e5:c6:77","be:cb:ce:0a:c9:f6","172.20.0.3","172.20.0.2","TCP","34052 → 4433 [ACK] Seq=1 Ack=1 Win=64256 Len=0 TSval=2187785626 TSecr=2882356556"
"169","8.523654216","1672","c2:ec:c0:e5:c6:77","be:cb:ce:0a:c9:f6","172.20.0.3","172.20.0.2","TLSv1.2","Client Hello"
"170","8.523663378","66","be:cb:ce:0a:c9:f6","c2:ec:c0:e5:c6:77","172.20.0.2","172.20.0.3","TCP","4433 → 34052 [ACK] Seq=1 Ack=1607 Win=64128 Len=0 TSval=2882356556 TSecr=2187785626"
"171","8.525196727","1955","be:cb:ce:0a:c9:f6","c2:ec:c0:e5:c6:77","172.20.0.2","172.20.0.3","TLSv1.3","Server Hello, Change Cipher Spec, Application Data, Application Data, Application Data, Application Data"
"172","8.525245198","66","c2:ec:c0:e5:c6:77","be:cb:ce:0a:c9:f6","172.20.0.3","172.20.0.2","TCP","34052 → 4433 [ACK] Seq=1607 Ack=1890 Win=64128 Len=0 TSval=2187785628 TSecr=2882356558"
"173","8.527908326","146","c2:ec:c0:e5:c6:77","be:cb:ce:0a:c9:f6","172.20.0.3","172.20.0.2","TLSv1.3","Change Cipher Spec, Application Data"
"174","8.527959131","66","c2:ec:c0:e5:c6:77","be:cb:ce:0a:c9:f6","172.20.0.3","172.20.0.2","TCP","34052 → 4433 [RST, ACK] Seq=1687 Ack=1890 Win=64128 Len=0 TSval=2187785631 TSecr=2882356558"
"175","8.538499836","74","c2:ec:c0:e5:c6:77","be:cb:ce:0a:c9:f6","172.20.0.3","172.20.0.2","TCP","34068 → 4433 [SYN] Seq=0 Win=64240 Len=0 MSS=1460 SACK_PERM TSval=2187785641 TSecr=0 WS=128"
"176","8.538528232","74","be:cb:ce:0a:c9:f6","c2:ec:c0:e5:c6:77","172.20.0.2","172.20.0.3","TCP","4433 → 34068 [SYN, ACK] Seq=0 Ack=1 Win=65160 Len=0 MSS=1460 SACK_PERM TSval=2882356571 TSecr=2187785641 WS=128"
"177","8.538546041","66","c2:ec:c0:e5:c6:77","be:cb:ce:0a:c9:f6","172.20.0.3","172.20.0.2","TCP","34068 → 4433 [ACK] Seq=1 Ack=1 Win=64256 Len=0 TSval=2187785641 TSecr=2882356571"
"178","8.538591972","1672","c2:ec:c0:e5:c6:77","be:cb:ce:0a:c9:f6","172.20.0.3","172.20.0.2","TLSv1.2","Client Hello"
"179","8.538598589","66","be:cb:ce:0a:c9:f6","c2:ec:c0:e5:c6:77","172.20.0.2","172.20.0.3","TCP","4433 → 34068 [ACK] Seq=1 Ack=1607 Win=64128 Len=0 TSval=2882356571 TSecr=2187785641"
"180","8.540189738","1953","be:cb:ce:0a:c9:f6","c2:ec:c0:e5:c6:77","172.20.0.2","172.20.0.3","TLSv1.3","Server Hello, Change Cipher Spec, Application Data, Application Data, Application Data, Application Data"
"181","8.540233142","66","c2:ec:c0:e5:c6:77","be:cb:ce:0a:c9:f6","172.20.0.3","172.20.0.2","TCP","34068 → 4433 [ACK] Seq=1607 Ack=1888 Win=64128 Len=0 TSval=2187785643 TSecr=2882356573"
"182","8.542921040","146","c2:ec:c0:e5:c6:77","be:cb:ce:0a:c9:f6","172.20.0.3","172.20.0.2","TLSv1.3","Change Cipher Spec, Application Data"
"183","8.542980268","66","c2:ec:c0:e5:c6:77","be:cb:ce:0a:c9:f6","172.20.0.3","172.20.0.2","TCP","34068 → 4433 [RST, ACK] Seq=1687 Ack=1888 Win=64128 Len=0 TSval=2187785646 TSecr=2882356573"
"184","8.554644065","74","c2:ec:c0:e5:c6:77","be:cb:ce:0a:c9:f6","172.20.0.3","172.20.0.2","TCP","34084 → 4433 [SYN] Seq=0 Win=64240 Len=0 MSS=1460 SACK_PERM TSval=2187785657 TSecr=0 WS=128"
"185","8.554677499","74","be:cb:ce:0a:c9:f6","c2:ec:c0:e5:c6:77","172.20.0.2","172.20.0.3","TCP","4433 → 34084 [SYN, ACK] Seq=0 Ack=1 Win=65160 Len=0 MSS=1460 SACK_PERM TSval=2882356587 TSecr=2187785657 WS=128"
"186","8.554700942","66","c2:ec:c0:e5:c6:77","be:cb:ce:0a:c9:f6","172.20.0.3","172.20.0.2","TCP","34084 → 4433 [ACK] Seq=1 Ack=1 Win=64256 Len=0 TSval=2187785657 TSecr=2882356587"
"187","8.554764007","1672","c2:ec:c0:e5:c6:77","be:cb:ce:0a:c9:f6","172.20.0.3","172.20.0.2","TLSv1.2","Client Hello"
"188","8.554769974","66","be:cb:ce:0a:c9:f6","c2:ec:c0:e5:c6:77","172.20.0.2","172.20.0.3","TCP","4433 → 34084 [ACK] Seq=1 Ack=1607 Win=64128 Len=0 TSval=2882356588 TSecr=2187785658"
"189","8.559743325","506","be:cb:ce:0a:c9:f6","c2:ec:c0:e5:c6:77","172.20.0.2","172.20.0.3","SSL","[TCP Previous segment not captured] , Continuation Data"
"190","8.559786828","78","c2:ec:c0:e5:c6:77","be:cb:ce:0a:c9:f6","172.20.0.3","172.20.0.2","TCP","[TCP Dup ACK 186#1] 34084 → 4433 [ACK] Seq=1607 Ack=1 Win=64256 Len=0 TSval=2187785663 TSecr=2882356588 SLE=1449 SRE=1889"
"191","8.559797584","1514","be:cb:ce:0a:c9:f6","c2:ec:c0:e5:c6:77","172.20.0.2","172.20.0.3","TCP","[TCP Out-Of-Order] 4433 → 34084 [ACK] Seq=1 Ack=1607 Win=64128 Len=1448 TSval=2882356593 TSecr=2187785663"
"192","8.559813431","66","c2:ec:c0:e5:c6:77","be:cb:ce:0a:c9:f6","172.20.0.3","172.20.0.2","TCP","34084 → 4433 [ACK] Seq=1607 Ack=1889 Win=64128 Len=0 TSval=2187785663 TSecr=2882356593"
"193","8.562561770","146","c2:ec:c0:e5:c6:77","be:cb:ce:0a:c9:f6","172.20.0.3","172.20.0.2","TLSv1.2","Change Cipher Spec, Application Data"
"194","8.562618061","66","c2:ec:c0:e5:c6:77","be:cb:ce:0a:c9:f6","172.20.0.3","172.20.0.2","TCP","34084 → 4433 [RST, ACK] Seq=1687 Ack=1889 Win=64128 Len=0 TSval=2187785665 TSecr=2882356593"
"195","8.573600801","74","c2:ec:c0:e5:c6:77","be:cb:ce:0a:c9:f6","172.20.0.3","172.20.0.2","TCP","34088 → 4433 [SYN] Seq=0 Win=64240 Len=0 MSS=1460 SACK_PERM TSval=2187785676 TSecr=0 WS=128"
"196","8.573637967","74","be:cb:ce:0a:c9:f6","c2:ec:c0:e5:c6:77","172.20.0.2","172.20.0.3","TCP","4433 → 34088 [SYN, ACK] Seq=0 Ack=1 Win=65160 Len=0 MSS=1460 SACK_PERM TSval=2882356606 TSecr=2187785676 WS=128"
"197","8.573656166","66","c2:ec:c0:e5:c6:77","be:cb:ce:0a:c9:f6","172.20.0.3","172.20.0.2","TCP","34088 → 4433 [ACK] Seq=1 Ack=1 Win=64256 Len=0 TSval=2187785676 TSecr=2882356606"
"198","8.573698804","1672","c2:ec:c0:e5:c6:77","be:cb:ce:0a:c9:f6","172.20.0.3","172.20.0.2","TLSv1.2","Client Hello"
"199","8.573705228","66","be:cb:ce:0a:c9:f6","c2:ec:c0:e5:c6:77","172.20.0.2","172.20.0.3","TCP","4433 → 34088 [ACK] Seq=1 Ack=1607 Win=64128 Len=0 TSval=2882356606 TSecr=2187785676"
"200","8.578744511","506","be:cb:ce:0a:c9:f6","c2:ec:c0:e5:c6:77","172.20.0.2","172.20.0.3","TCP","[TCP Previous segment not captured] 4433 → 34088 [PSH, ACK] Seq=1449 Ack=1607 Win=64128 Len=440 TSval=2882356612 TSecr=2187785676"
"201","8.578771628","78","c2:ec:c0:e5:c6:77","be:cb:ce:0a:c9:f6","172.20.0.3","172.20.0.2","TCP","[TCP Dup ACK 197#1] 34088 → 4433 [ACK] Seq=1607 Ack=1 Win=64256 Len=0 TSval=2187785682 TSecr=2882356606 SLE=1449 SRE=1889"
"202","8.781768880","1514","be:cb:ce:0a:c9:f6","c2:ec:c0:e5:c6:77","172.20.0.2","172.20.0.3","TCP","[TCP Retransmission] 4433 → 34088 [ACK] Seq=1 Ack=1607 Win=64128 Len=1448 TSval=2882356815 TSecr=2187785682"
"203","8.781816703","66","c2:ec:c0:e5:c6:77","be:cb:ce:0a:c9:f6","172.20.0.3","172.20.0.2","TCP","34088 → 4433 [ACK] Seq=1607 Ack=1889 Win=64128 Len=0 TSval=2187785885 TSecr=2882356815"
"204","8.785110590","146","c2:ec:c0:e5:c6:77","be:cb:ce:0a:c9:f6","172.20.0.3","172.20.0.2","TLSv1.2","Change Cipher Spec, Application Data"
"205","8.785185770","66","c2:ec:c0:e5:c6:77","be:cb:ce:0a:c9:f6","172.20.0.3","172.20.0.2","TCP","34088 → 4433 [RST, ACK] Seq=1687 Ack=1889 Win=64128 Len=0 TSval=2187785888 TSecr=2882356815"
"206","8.796517833","74","c2:ec:c0:e5:c6:77","be:cb:ce:0a:c9:f6","172.20.0.3","172.20.0.2","TCP","34096 → 4433 [SYN] Seq=0 Win=64240 Len=0 MSS=1460 SACK_PERM TSval=2187785899 TSecr=0 WS=128"
"207","8.796549534","74","be:cb:ce:0a:c9:f6","c2:ec:c0:e5:c6:77","172.20.0.2","172.20.0.3","TCP","4433 → 34096 [SYN, ACK] Seq=0 Ack=1 Win=65160 Len=0 MSS=1460 SACK_PERM TSval=2882356829 TSecr=2187785899 WS=128"
"208","8.796566992","66","c2:ec:c0:e5:c6:77","be:cb:ce:0a:c9:f6","172.20.0.3","172.20.0.2","TCP","34096 → 4433 [ACK] Seq=1 Ack=1 Win=64256 Len=0 TSval=2187785899 TSecr=2882356829"
"209","8.796607498","1672","c2:ec:c0:e5:c6:77","be:cb:ce:0a:c9:f6","172.20.0.3","172.20.0.2","TLSv1.2","Client Hello"
"210","8.796625472","66","be:cb:ce:0a:c9:f6","c2:ec:c0:e5:c6:77","172.20.0.2","172.20.0.3","TCP","4433 → 34096 [ACK] Seq=1 Ack=1607 Win=64128 Len=0 TSval=2882356829 TSecr=2187785899"
"211","8.798292703","1953","be:cb:ce:0a:c9:f6","c2:ec:c0:e5:c6:77","172.20.0.2","172.20.0.3","TLSv1.3","Server Hello, Change Cipher Spec, Application Data, Application Data, Application Data, Application Data"
"212","8.798319812","66","c2:ec:c0:e5:c6:77","be:cb:ce:0a:c9:f6","172.20.0.3","172.20.0.2","TCP","34096 → 4433 [ACK] Seq=1607 Ack=1888 Win=64128 Len=0 TSval=2187785901 TSecr=2882356831"
"213","8.800985854","146","c2:ec:c0:e5:c6:77","be:cb:ce:0a:c9:f6","172.20.0.3","172.20.0.2","TLSv1.3","Change Cipher Spec, Application Data"
"214","8.801046405","66","c2:ec:c0:e5:c6:77","be:cb:ce:0a:c9:f6","172.20.0.3","172.20.0.2","TCP","34096 → 4433 [RST, ACK] Seq=1687 Ack=1888 Win=64128 Len=0 TSval=2187785904 TSecr=2882356831"
"215","8.812501168","74","c2:ec:c0:e5:c6:77","be:cb:ce:0a:c9:f6","172.20.0.3","172.20.0.2","TCP","34104 → 4433 [SYN] Seq=0 Win=64240 Len=0 MSS=1460 SACK_PERM TSval=2187785915 TSecr=0 WS=128"
"216","8.812533877","74","be:cb:ce:0a:c9:f6","c2:ec:c0:e5:c6:77","172.20.0.2","172.20.0.3","TCP","4433 → 34104 [SYN, ACK] Seq=0 Ack=1 Win=65160 Len=0 MSS=1460 SACK_PERM TSval=2882356845 TSecr=2187785915 WS=128"
"217","8.812554102","66","c2:ec:c0:e5:c6:77","be:cb:ce:0a:c9:f6","172.20.0.3","172.20.0.2","TCP","34104 → 4433 [ACK] Seq=1 Ack=1 Win=64256 Len=0 TSval=2187785915 TSecr=2882356845"
"218","8.812596607","1672","c2:ec:c0:e5:c6:77","be:cb:ce:0a:c9:f6","172.20.0.3","172.20.0.2","TLSv1.2","Client Hello"
"219","8.812603717","66","be:cb:ce:0a:c9:f6","c2:ec:c0:e5:c6:77","172.20.0.2","172.20.0.3","TCP","4433 → 34104 [ACK] Seq=1 Ack=1607 Win=64128 Len=0 TSval=2882356845 TSecr=2187785915"
"220","8.814269829","1955","be:cb:ce:0a:c9:f6","c2:ec:c0:e5:c6:77","172.20.0.2","172.20.0.3","TLSv1.3","Server Hello, Change Cipher Spec, Application Data, Application Data, Application Data, Application Data"
"221","8.814297268","66","c2:ec:c0:e5:c6:77","be:cb:ce:0a:c9:f6","172.20.0.3","172.20.0.2","TCP","34104 → 4433 [ACK] Seq=1607 Ack=1890 Win=64128 Len=0 TSval=2187785917 TSecr=2882356847"
"222","8.816929968","146","c2:ec:c0:e5:c6:77","be:cb:ce:0a:c9:f6","172.20.0.3","172.20.0.2","TLSv1.3","Change Cipher Spec, Application Data"
"223","8.816989461","66","c2:ec:c0:e5:c6:77","be:cb:ce:0a:c9:f6","172.20.0.3","172.20.0.2","TCP","34104 → 4433 [RST, ACK] Seq=1687 Ack=1890 Win=64128 Len=0 TSval=2187785920 TSecr=2882356847"
"224","8.828423898","74","c2:ec:c0:e5:c6:77","be:cb:ce:0a:c9:f6","172.20.0.3","172.20.0.2","TCP","34118 → 4433 [SYN] Seq=0 Win=64240 Len=0 MSS=1460 SACK_PERM TSval=2187785931 TSecr=0 WS=128"
"225","8.828486056","74","be:cb:ce:0a:c9:f6","c2:ec:c0:e5:c6:77","172.20.0.2","172.20.0.3","TCP","4433 → 34118 [SYN, ACK] Seq=0 Ack=1 Win=65160 Len=0 MSS=1460 SACK_PERM TSval=2882356861 TSecr=2187785931 WS=128"
