frame.number,frame.time_relative,frame.len,eth.src,eth.dst,ip.src,ip.dst,_ws.col.protocol,_ws.col.info
"1","0.000000000","239","a6:88:e7:56:12:fb","33:33:00:00:00:fb",,,"MDNS","Standard query 0x0000 PTR _ipps._tcp.local, ""QM"" question PTR _ftp._tcp.local, ""QM"" question PTR _webdav._tcp.local, ""QM"" question PTR _webdavs._tcp.local, ""QM"" question PTR _sftp-ssh._tcp.local, ""QM"" question PTR _smb._tcp.local, ""QM"" question PTR _afpovertcp._tcp.local, ""QM"" question PTR _nfs._tcp.local, ""QM"" question PTR _ipp._tcp.local, ""QM"" question PTR MONTE-VIRTUAL-MACHINE._smb._tcp.local"
"2","0.016290410","287","f2:21:64:f0:41:09","ff:ff:ff:ff:ff:ff","172.20.0.1","172.20.255.255","BROWSER","Local Master Announcement , Workstation, Server, Print Queue Server, Xenix Server, NT Workstation, NT Server, Master Browser, DFS server"
"3","0.016326839","264","f2:21:64:f0:41:09","ff:ff:ff:ff:ff:ff","172.20.0.1","172.20.255.255","BROWSER","Domain/Workgroup Announcement WORKGROUP, NT Workstation, Domain Enum"
"4","4.934781620","42","5e:a0:93:18:2f:49","ff:ff:ff:ff:ff:ff",,,"ARP","ARP Announcement for 172.20.0.3"
"5","4.966374675","42","5e:a0:93:18:2f:49","ff:ff:ff:ff:ff:ff",,,"ARP","Who has 172.20.0.2? Tell 172.20.0.3"
"6","5.935301979","42","5e:a0:93:18:2f:49","ff:ff:ff:ff:ff:ff",,,"ARP","ARP Announcement for 172.20.0.3"
"7","6.011895097","42","5e:a0:93:18:2f:49","ff:ff:ff:ff:ff:ff",,,"ARP","Who has 172.20.0.2? Tell 172.20.0.3"
"8","6.011915618","42","8a:6e:b9:79:24:d7","5e:a0:93:18:2f:49",,,"ARP","172.20.0.2 is at 8a:6e:b9:79:24:d7"
"9","6.011928563","74","5e:a0:93:18:2f:49","8a:6e:b9:79:24:d7","172.20.0.3","172.20.0.2","TCP","56804 → 4433 [SYN] Seq=0 Win=64240 Len=0 MSS=1460 SACK_PERM TSval=2186953607 TSecr=0 WS=128"
"10","6.011966793","74","8a:6e:b9:79:24:d7","5e:a0:93:18:2f:49","172.20.0.2","172.20.0.3","TCP","4433 → 56804 [SYN, ACK] Seq=0 Ack=1 Win=65160 Len=0 MSS=1460 SACK_PERM TSval=2881525583 TSecr=2186953607 WS=128"
"11","6.011997110","66","5e:a0:93:18:2f:49","8a:6e:b9:79:24:d7","172.20.0.3","172.20.0.2","TCP","56804 → 4433 [ACK] Seq=1 Ack=1 Win=64256 Len=0 TSval=2186954653 TSecr=2881525583"
"12","6.012073024","552","5e:a0:93:18:2f:49","8a:6e:b9:79:24:d7","172.20.0.3","172.20.0.2","TLSv1.2","Client Hello"
"13","6.012080394","66","8a:6e:b9:79:24:d7","5e:a0:93:18:2f:49","172.20.0.2","172.20.0.3","TCP","4433 → 56804 [ACK] Seq=1 Ack=487 Win=64768 Len=0 TSval=2881525583 TSecr=2186954653"
"14","6.014521932","922","8a:6e:b9:79:24:d7","5e:a0:93:18:2f:49","172.20.0.2","172.20.0.3","TLSv1.3","Server Hello, Change Cipher Spec, Application Data, Application Data, Application Data, Application Data"
"15","6.014562444","66","5e:a0:93:18:2f:49","8a:6e:b9:79:24:d7","172.20.0.3","172.20.0.2","TCP","56804 → 4433 [ACK] Seq=487 Ack=857 Win=63488 Len=0 TSval=2186954655 TSecr=2881525585"
"16","6.017257072","146","5e:a0:93:18:2f:49","8a:6e:b9:79:24:d7","172.20.0.3","172.20.0.2","TLSv1.3","Change Cipher Spec, Application Data"
"17","6.017314951","66","5e:a0:93:18:2f:49","8a:6e:b9:79:24:d7","172.20.0.3","172.20.0.2","TCP","56804 → 4433 [RST, ACK] Seq=567 Ack=857 Win=64000 Len=0 TSval=2186954658 TSecr=2881525585"
"18","6.028765856","74","5e:a0:93:18:2f:49","8a:6e:b9:79:24:d7","172.20.0.3","172.20.0.2","TCP","56818 → 4433 [SYN] Seq=0 Win=64240 Len=0 MSS=1460 SACK_PERM TSval=2186954669 TSecr=0 WS=128"
"19","6.028792154","74","8a:6e:b9:79:24:d7","5e:a0:93:18:2f:49","172.20.0.2","172.20.0.3","TCP","4433 → 56818 [SYN, ACK] Seq=0 Ack=1 Win=65160 Len=0 MSS=1460 SACK_PERM TSval=2881525599 TSecr=2186954669 WS=128"
"20","6.028808344","66","5e:a0:93:18:2f:49","8a:6e:b9:79:24:d7","172.20.0.3","172.20.0.2","TCP","56818 → 4433 [ACK] Seq=1 Ack=1 Win=64256 Len=0 TSval=2186954669 TSecr=2881525599"
"21","6.028871457","552","5e:a0:93:18:2f:49","8a:6e:b9:79:24:d7","172.20.0.3","172.20.0.2","TLSv1.2","Client Hello"
"22","6.028875830","66","8a:6e:b9:79:24:d7","5e:a0:93:18:2f:49","172.20.0.2","172.20.0.3","TCP","4433 → 56818 [ACK] Seq=1 Ack=487 Win=64768 Len=0 TSval=2881525600 TSecr=2186954670"
"23","6.235893744","923","8a:6e:b9:79:24:d7","5e:a0:93:18:2f:49","172.20.0.2","172.20.0.3","TLSv1.3","Server Hello, Change Cipher Spec, Application Data, Application Data, Application Data, Application Data"
"24","6.235960454","66","5e:a0:93:18:2f:49","8a:6e:b9:79:24:d7","172.20.0.3","172.20.0.2","TCP","56818 → 4433 [ACK] Seq=487 Ack=858 Win=63488 Len=0 TSval=2186954877 TSecr=2881525807"
"25","6.239737707","146","5e:a0:93:18:2f:49","8a:6e:b9:79:24:d7","172.20.0.3","172.20.0.2","TLSv1.3","Change Cipher Spec, Application Data"
"26","6.239838813","66","5e:a0:93:18:2f:49","8a:6e:b9:79:24:d7","172.20.0.3","172.20.0.2","TCP","56818 → 4433 [RST, ACK] Seq=567 Ack=858 Win=64000 Len=0 TSval=2186954880 TSecr=2881525807"
"27","6.252240321","74","5e:a0:93:18:2f:49","8a:6e:b9:79:24:d7","172.20.0.3","172.20.0.2","TCP","56830 → 4433 [SYN] Seq=0 Win=64240 Len=0 MSS=1460 SACK_PERM TSval=2186954893 TSecr=0 WS=128"
"28","6.252270456","74","8a:6e:b9:79:24:d7","5e:a0:93:18:2f:49","172.20.0.2","172.20.0.3","TCP","4433 → 56830 [SYN, ACK] Seq=0 Ack=1 Win=65160 Len=0 MSS=1460 SACK_PERM TSval=2881525823 TSecr=2186954893 WS=128"
"29","6.252288223","66","5e:a0:93:18:2f:49","8a:6e:b9:79:24:d7","172.20.0.3","172.20.0.2","TCP","56830 → 4433 [ACK] Seq=1 Ack=1 Win=64256 Len=0 TSval=2186954893 TSecr=2881525823"
"30","6.252331285","552","5e:a0:93:18:2f:49","8a:6e:b9:79:24:d7","172.20.0.3","172.20.0.2","TLSv1.2","Client Hello"
"31","6.255673535","921","8a:6e:b9:79:24:d7","5e:a0:93:18:2f:49","172.20.0.2","172.20.0.3","TLSv1.3","Server Hello, Change Cipher Spec, Application Data, Application Data, Application Data, Application Data"
"32","6.255721591","66","5e:a0:93:18:2f:49","8a:6e:b9:79:24:d7","172.20.0.3","172.20.0.2","TCP","56830 → 4433 [ACK] Seq=487 Ack=856 Win=63488 Len=0 TSval=2186954896 TSecr=2881525826"
"33","6.258698939","146","5e:a0:93:18:2f:49","8a:6e:b9:79:24:d7","172.20.0.3","172.20.0.2","TLSv1.3","Change Cipher Spec, Application Data"
"34","6.258794649","66","5e:a0:93:18:2f:49","8a:6e:b9:79:24:d7","172.20.0.3","172.20.0.2","TCP","56830 → 4433 [RST, ACK] Seq=567 Ack=856 Win=64000 Len=0 TSval=2186954899 TSecr=2881525826"
"35","6.271419952","74","5e:a0:93:18:2f:49","8a:6e:b9:79:24:d7","172.20.0.3","172.20.0.2","TCP","56834 → 4433 [SYN] Seq=0 Win=64240 Len=0 MSS=1460 SACK_PERM TSval=2186954912 TSecr=0 WS=128"
"36","6.271448265","74","8a:6e:b9:79:24:d7","5e:a0:93:18:2f:49","172.20.0.2","172.20.0.3","TCP","4433 → 56834 [SYN, ACK] Seq=0 Ack=1 Win=65160 Len=0 MSS=1460 SACK_PERM TSval=2881525842 TSecr=2186954912 WS=128"
"37","6.271465022","66","5e:a0:93:18:2f:49","8a:6e:b9:79:24:d7","172.20.0.3","172.20.0.2","TCP","56834 → 4433 [ACK] Seq=1 Ack=1 Win=64256 Len=0 TSval=2186954912 TSecr=2881525842"
"38","6.271504687","552","5e:a0:93:18:2f:49","8a:6e:b9:79:24:d7","172.20.0.3","172.20.0.2","TLSv1.2","Client Hello"
"39","6.273572607","922","8a:6e:b9:79:24:d7","5e:a0:93:18:2f:49","172.20.0.2","172.20.0.3","TLSv1.3","Server Hello, Change Cipher Spec, Application Data, Application Data, Application Data, Application Data"
"40","6.273610562","66","5e:a0:93:18:2f:49","8a:6e:b9:79:24:d7","172.20.0.3","172.20.0.2","TCP","56834 → 4433 [ACK] Seq=487 Ack=857 Win=63488 Len=0 TSval=2186954914 TSecr=2881525844"
"41","6.276728062","146","5e:a0:93:18:2f:49","8a:6e:b9:79:24:d7","172.20.0.3","172.20.0.2","TLSv1.3","Change Cipher Spec, Application Data"
"42","6.276804249","66","5e:a0:93:18:2f:49","8a:6e:b9:79:24:d7","172.20.0.3","172.20.0.2","TCP","56834 → 4433 [RST, ACK] Seq=567 Ack=857 Win=64000 Len=0 TSval=2186954917 TSecr=2881525844"
"43","6.288899537","74","5e:a0:93:18:2f:49","8a:6e:b9:79:24:d7","172.20.0.3","172.20.0.2","TCP","56840 → 4433 [SYN] Seq=0 Win=64240 Len=0 MSS=1460 SACK_PERM TSval=2186954929 TSecr=0 WS=128"
"44","6.288930752","74","8a:6e:b9:79:24:d7","5e:a0:93:18:2f:49","172.20.0.2","172.20.0.3","TCP","4433 → 56840 [SYN, ACK] Seq=0 Ack=1 Win=65160 Len=0 MSS=1460 SACK_PERM TSval=2881525860 TSecr=2186954929 WS=128"
"45","6.288948420","66","5e:a0:93:18:2f:49","8a:6e:b9:79:24:d7","172.20.0.3","172.20.0.2","TCP","56840 → 4433 [ACK] Seq=1 Ack=1 Win=64256 Len=0 TSval=2186954930 TSecr=2881525860"
"46","6.288993658","552","5e:a0:93:18:2f:49","8a:6e:b9:79:24:d7","172.20.0.3","172.20.0.2","TLSv1.2","Client Hello"
"47","6.290952198","922","8a:6e:b9:79:24:d7","5e:a0:93:18:2f:49","172.20.0.2","172.20.0.3","TLSv1.3","Server Hello, Change Cipher Spec, Application Data, Application Data, Application Data, Application Data"
"48","6.290989740","66","5e:a0:93:18:2f:49","8a:6e:b9:79:24:d7","172.20.0.3","172.20.0.2","TCP","56840 → 4433 [ACK] Seq=487 Ack=857 Win=63488 Len=0 TSval=2186954932 TSecr=2881525862"
"49","6.293995640","146","5e:a0:93:18:2f:49","8a:6e:b9:79:24:d7","172.20.0.3","172.20.0.2","TLSv1.3","Change Cipher Spec, Application Data"
"50","6.294065200","66","5e:a0:93:18:2f:49","8a:6e:b9:79:24:d7","172.20.0.3","172.20.0.2","TCP","56840 → 4433 [RST, ACK] Seq=567 Ack=857 Win=64000 Len=0 TSval=2186954935 TSecr=2881525862"
"51","6.305474573","74","5e:a0:93:18:2f:49","8a:6e:b9:79:24:d7","172.20.0.3","172.20.0.2","TCP","56848 → 4433 [SYN] Seq=0 Win=64240 Len=0 MSS=1460 SACK_PERM TSval=2186954946 TSecr=0 WS=128"
"52","6.305504071","74","8a:6e:b9:79:24:d7","5e:a0:93:18:2f:49","172.20.0.2","172.20.0.3","TCP","4433 → 56848 [SYN, ACK] Seq=0 Ack=1 Win=65160 Len=0 MSS=1460 SACK_PERM TSval=2881525876 TSecr=2186954946 WS=128"
"53","6.305521950","66","5e:a0:93:18:2f:49","8a:6e:b9:79:24:d7","172.20.0.3","172.20.0.2","TCP","56848 → 4433 [ACK] Seq=1 Ack=1 Win=64256 Len=0 TSval=2186954946 TSecr=2881525876"
"54","6.305579207","552","5e:a0:93:18:2f:49","8a:6e:b9:79:24:d7","172.20.0.3","172.20.0.2","TLSv1.2","Client Hello"
"55","6.305585463","66","8a:6e:b9:79:24:d7","5e:a0:93:18:2f:49","172.20.0.2","172.20.0.3","TCP","4433 → 56848 [ACK] Seq=1 Ack=487 Win=64768 Len=0 TSval=2881525876 TSecr=2186954946"
"56","6.307716365","921","8a:6e:b9:79:24:d7","5e:a0:93:18:2f:49","172.20.0.2","172.20.0.3","TLSv1.3","Server Hello, Change Cipher Spec, Application Data, Application Data, Application Data, Application Data"
"57","6.307759938","66","5e:a0:93:18:2f:49","8a:6e:b9:79:24:d7","172.20.0.3","172.20.0.2","TCP","56848 → 4433 [ACK] Seq=487 Ack=856 Win=63488 Len=0 TSval=2186954948 TSecr=2881525878"
"58","6.311116321","146","5e:a0:93:18:2f:49","8a:6e:b9:79:24:d7","172.20.0.3","172.20.0.2","TLSv1.3","Change Cipher Spec, Application Data"
"59","6.311219119","66","5e:a0:93:18:2f:49","8a:6e:b9:79:24:d7","172.20.0.3","172.20.0.2","TCP","56848 → 4433 [RST, ACK] Seq=567 Ack=856 Win=64000 Len=0 TSval=2186954952 TSecr=2881525878"
"60","6.323473082","74","5e:a0:93:18:2f:49","8a:6e:b9:79:24:d7","172.20.0.3","172.20.0.2","TCP","56862 → 4433 [SYN] Seq=0 Win=64240 Len=0 MSS=1460 SACK_PERM TSval=2186954964 TSecr=0 WS=128"
"61","6.323499050","74","8a:6e:b9:79:24:d7","5e:a0:93:18:2f:49","172.20.0.2","172.20.0.3","TCP","4433 → 56862 [SYN, ACK] Seq=0 Ack=1 Win=65160 Len=0 MSS=1460 SACK_PERM TSval=2881525894 TSecr=2186954964 WS=128"
"62","6.323516850","66","5e:a0:93:18:2f:49","8a:6e:b9:79:24:d7","172.20.0.3","172.20.0.2","TCP","56862 → 4433 [ACK] Seq=1 Ack=1 Win=64256 Len=0 TSval=2186954964 TSecr=2881525894"
"63","6.323556305","552","5e:a0:93:18:2f:49","8a:6e:b9:79:24:d7","172.20.0.3","172.20.0.2","TLSv1.2","Client Hello"
"64","6.323573978","66","8a:6e:b9:79:24:d7","5e:a0:93:18:2f:49","172.20.0.2","172.20.0.3","TCP","4433 → 56862 [ACK] Seq=1 Ack=487 Win=64768 Len=0 TSval=2881525894 TSecr=2186954964"
"65","6.325791098","922","8a:6e:b9:79:24:d7","5e:a0:93:18:2f:49","172.20.0.2","172.20.0.3","TLSv1.3","Server Hello, Change Cipher Spec, Application Data, Application Data, Application Data, Application Data"
"66","6.325825357","66","5e:a0:93:18:2f:49","8a:6e:b9:79:24:d7","172.20.0.3","172.20.0.2","TCP","56862 → 4433 [ACK] Seq=487 Ack=857 Win=63488 Len=0 TSval=2186954966 TSecr=2881525896"
"67","6.328819942","146","5e:a0:93:18:2f:49","8a:6e:b9:79:24:d7","172.20.0.3","172.20.0.2","TLSv1.3","Change Cipher Spec, Application Data"
"68","6.328906424","66","5e:a0:93:18:2f:49","8a:6e:b9:79:24:d7","172.20.0.3","172.20.0.2","TCP","56862 → 4433 [RST, ACK] Seq=567 Ack=857 Win=64000 Len=0 TSval=2186954970 TSecr=2881525896"
"69","6.340329232","74","5e:a0:93:18:2f:49","8a:6e:b9:79:24:d7","172.20.0.3","172.20.0.2","TCP","56874 → 4433 [SYN] Seq=0 Win=64240 Len=0 MSS=1460 SACK_PERM TSval=2186954981 TSecr=0 WS=128"
"70","6.936020242","42","5e:a0:93:18:2f:49","ff:ff:ff:ff:ff:ff",,,"ARP","ARP Announcement for 172.20.0.3"
"71","7.355913947","74","8a:6e:b9:79:24:d7","5e:a0:93:18:2f:49","172.20.0.2","172.20.0.3","TCP","4433 → 56874 [SYN, ACK] Seq=0 Ack=1 Win=65160 Len=0 MSS=1460 SACK_PERM TSval=2881526927 TSecr=2186954981 WS=128"
"72","7.355940273","74","5e:a0:93:18:2f:49","8a:6e:b9:79:24:d7","172.20.0.3","172.20.0.2","TCP","[TCP Retransmission] 56874 → 4433 [SYN] Seq=0 Win=64240 Len=0 MSS=1460 SACK_PERM TSval=2186955997 TSecr=0 WS=128"
"73","7.355953795","74","8a:6e:b9:79:24:d7","5e:a0:93:18:2f:49","172.20.0.2","172.20.0.3","TCP","[TCP Out-Of-Order] 4433 → 56874 [SYN, ACK] Seq=0 Ack=1 Win=65160 Len=0 MSS=1460 SACK_PERM TSval=2881526927 TSecr=2186954981 WS=128"
"74","7.355988992","66","5e:a0:93:18:2f:49","8a:6e:b9:79:24:d7","172.20.0.3","172.20.0.2","TCP","56874 → 4433 [ACK] Seq=1 Ack=1 Win=64256 Len=0 TSval=2186955997 TSecr=2881526927"
"75","7.356012702","66","5e:a0:93:18:2f:49","8a:6e:b9:79:24:d7","172.20.0.3","172.20.0.2","TCP","[TCP Dup ACK 74#1] 56874 → 4433 [ACK] Seq=1 Ack=1 Win=64256 Len=0 TSval=2186955997 TSecr=2881526927"
"76","7.356065343","552","5e:a0:93:18:2f:49","8a:6e:b9:79:24:d7","172.20.0.3","172.20.0.2","TLSv1.2","Client Hello"
"77","7.356071421","66","8a:6e:b9:79:24:d7","5e:a0:93:18:2f:49","172.20.0.2","172.20.0.3","TCP","4433 → 56874 [ACK] Seq=1 Ack=487 Win=64768 Len=0 TSval=2881526927 TSecr=2186955997"
"78","7.358057174","922","8a:6e:b9:79:24:d7","5e:a0:93:18:2f:49","172.20.0.2","172.20.0.3","TLSv1.3","Server Hello, Change Cipher Spec, Application Data, Application Data, Application Data, Application Data"
"79","7.358087809","66","5e:a0:93:18:2f:49","8a:6e:b9:79:24:d7","172.20.0.3","172.20.0.2","TCP","56874 → 4433 [ACK] Seq=487 Ack=857 Win=63488 Len=0 TSval=2186955999 TSecr=2881526929"
"80","7.360895404","146","5e:a0:93:18:2f:49","8a:6e:b9:79:24:d7","172.20.0.3","172.20.0.2","TLSv1.3","Change Cipher Spec, Application Data"
"81","7.360961477","66","5e:a0:93:18:2f:49","8a:6e:b9:79:24:d7","172.20.0.3","172.20.0.2","TCP","56874 → 4433 [RST, ACK] Seq=567 Ack=857 Win=64000 Len=0 TSval=2186956002 TSecr=2881526929"
"82","7.372799501","74","5e:a0:93:18:2f:49","8a:6e:b9:79:24:d7","172.20.0.3","172.20.0.2","TCP","56886 → 4433 [SYN] Seq=0 Win=64240 Len=0 MSS=1460 SACK_PERM TSval=2186956013 TSecr=0 WS=128"
"83","8.379931607","74","8a:6e:b9:79:24:d7","5e:a0:93:18:2f:49","172.20.0.2","172.20.0.3","TCP","4433 → 56886 [SYN, ACK] Seq=0 Ack=1 Win=65160 Len=0 MSS=1460 SACK_PERM TSval=2881527951 TSecr=2186956013 WS=128"
"84","8.379961912","74","5e:a0:93:18:2f:49","8a:6e:b9:79:24:d7","172.20.0.3","172.20.0.2","TCP","[TCP Retransmission] 56886 → 4433 [SYN] Seq=0 Win=64240 Len=0 MSS=1460 SACK_PERM TSval=2186957021 TSecr=0 WS=128"
"85","8.379978850","74","8a:6e:b9:79:24:d7","5e:a0:93:18:2f:49","172.20.0.2","172.20.0.3","TCP","[TCP Out-Of-Order] 4433 → 56886 [SYN, ACK] Seq=0 Ack=1 Win=65160 Len=0 MSS=1460 SACK_PERM TSval=2881527951 TSecr=2186956013 WS=128"
"86","8.380029059","66","5e:a0:93:18:2f:49","8a:6e:b9:79:24:d7","172.20.0.3","172.20.0.2","TCP","56886 → 4433 [ACK] Seq=1 Ack=1 Win=64256 Len=0 TSval=2186957021 TSecr=2881527951"
"87","8.380058779","66","5e:a0:93:18:2f:49","8a:6e:b9:79:24:d7","172.20.0.3","172.20.0.2","TCP","[TCP Dup ACK 86#1] 56886 → 4433 [ACK] Seq=1 Ack=1 Win=64256 Len=0 TSval=2186957021 TSecr=2881527951"
"88","8.380140131","552","5e:a0:93:18:2f:49","8a:6e:b9:79:24:d7","172.20.0.3","172.20.0.2","TLSv1.2","Client Hello"
"89","8.380149115","66","8a:6e:b9:79:24:d7","5e:a0:93:18:2f:49","172.20.0.2","172.20.0.3","TCP","4433 → 56886 [ACK] Seq=1 Ack=487 Win=64768 Len=0 TSval=2881527951 TSecr=2186957021"
"90","8.587893721","922","8a:6e:b9:79:24:d7","5e:a0:93:18:2f:49","172.20.0.2","172.20.0.3","TLSv1.3","Server Hello, Change Cipher Spec, Application Data, Application Data, Application Data, Application Data"
"91","8.587964843","66","5e:a0:93:18:2f:49","8a:6e:b9:79:24:d7","172.20.0.3","172.20.0.2","TCP","56886 → 4433 [ACK] Seq=487 Ack=857 Win=63488 Len=0 TSval=2186957229 TSecr=2881528159"
"92","8.590933241","146","5e:a0:93:18:2f:49","8a:6e:b9:79:24:d7","172.20.0.3","172.20.0.2","TLSv1.3","Change Cipher Spec, Application Data"
"93","8.591011608","66","5e:a0:93:18:2f:49","8a:6e:b9:79:24:d7","172.20.0.3","172.20.0.2","TCP","56886 → 4433 [RST, ACK] Seq=567 Ack=857 Win=64000 Len=0 TSval=2186957232 TSecr=2881528159"
"94","8.603428542","74","5e:a0:93:18:2f:49","8a:6e:b9:79:24:d7","172.20.0.3","172.20.0.2","TCP","39532 → 4433 [SYN] Seq=0 Win=64240 Len=0 MSS=1460 SACK_PERM TSval=2186957244 TSecr=0 WS=128"
"95","8.603462944","74","8a:6e:b9:79:24:d7","5e:a0:93:18:2f:49","172.20.0.2","172.20.0.3","TCP","4433 → 39532 [SYN, ACK] Seq=0 Ack=1 Win=65160 Len=0 MSS=1460 SACK_PERM TSval=2881528174 TSecr=2186957244 WS=128"
"96","8.603482427","66","5e:a0:93:18:2f:49","8a:6e:b9:79:24:d7","172.20.0.3","172.20.0.2","TCP","39532 → 4433 [ACK] Seq=1 Ack=1 Win=64256 Len=0 TSval=2186957244 TSecr=2881528174"
"97","8.603527888","552","5e:a0:93:18:2f:49","8a:6e:b9:79:24:d7","172.20.0.3","172.20.0.2","TLSv1.2","Client Hello"
"98","8.603533242","66","8a:6e:b9:79:24:d7","5e:a0:93:18:2f:49","172.20.0.2","172.20.0.3","TCP","4433 → 39532 [ACK] Seq=1 Ack=487 Win=64768 Len=0 TSval=2881528174 TSecr=2186957244"
"99","8.606976509","921","8a:6e:b9:79:24:d7","5e:a0:93:18:2f:49","172.20.0.2","172.20.0.3","TLSv1.3","Server Hello, Change Cipher Spec, Application Data, Application Data, Application Data, Application Data"
"100","8.607018692","66","5e:a0:93:18:2f:49","8a:6e:b9:79:24:d7","172.20.0.3","172.20.0.2","TCP","39532 → 4433 [ACK] Seq=487 Ack=856 Win=63488 Len=0 TSval=2186957248 TSecr=2881528178"
"101","8.609691230","146","5e:a0:93:18:2f:49","8a:6e:b9:79:24:d7","172.20.0.3","172.20.0.2","TLSv1.3","Change Cipher Spec, Application Data"
"102","8.609752376","66","5e:a0:93:18:2f:49","8a:6e:b9:79:24:d7","172.20.0.3","172.20.0.2","TCP","39532 → 4433 [RST, ACK] Seq=567 Ack=856 Win=64000 Len=0 TSval=2186957250 TSecr=2881528178"
"103","8.621751175","74","5e:a0:93:18:2f:49","8a:6e:b9:79:24:d7","172.20.0.3","172.20.0.2","TCP","39548 → 4433 [SYN] Seq=0 Win=64240 Len=0 MSS=1460 SACK_PERM TSval=2186957262 TSecr=0 WS=128"
"104","8.621787558","74","8a:6e:b9:79:24:d7","5e:a0:93:18:2f:49","172.20.0.2","172.20.0.3","TCP","4433 → 39548 [SYN, ACK] Seq=0 Ack=1 Win=65160 Len=0 MSS=1460 SACK_PERM TSval=2881528192 TSecr=2186957262 WS=128"
"105","8.621807149","66","5e:a0:93:18:2f:49","8a:6e:b9:79:24:d7","172.20.0.3","172.20.0.2","TCP","39548 → 4433 [ACK] Seq=1 Ack=1 Win=64256 Len=0 TSval=2186957262 TSecr=2881528192"
"106","8.621862304","552","5e:a0:93:18:2f:49","8a:6e:b9:79:24:d7","172.20.0.3","172.20.0.2","TLSv1.2","Client Hello"
"107","8.621869878","66","8a:6e:b9:79:24:d7","5e:a0:93:18:2f:49","172.20.0.2","172.20.0.3","TCP","4433 → 39548 [ACK] Seq=1 Ack=487 Win=64768 Len=0 TSval=2881528193 TSecr=2186957262"
"108","8.623967174","923","8a:6e:b9:79:24:d7","5e:a0:93:18:2f:49","172.20.0.2","172.20.0.3","TLSv1.3","Server Hello, Change Cipher Spec, Application Data, Application Data, Application Data, Application Data"
"109","8.623996584","66","5e:a0:93:18:2f:49","8a:6e:b9:79:24:d7","172.20.0.3","172.20.0.2","TCP","39548 → 4433 [ACK] Seq=487 Ack=858 Win=63488 Len=0 TSval=2186957265 TSecr=2881528195"
"110","8.626939116","146","5e:a0:93:18:2f:49","8a:6e:b9:79:24:d7","172.20.0.3","172.20.0.2","TLSv1.3","Change Cipher Spec, Application Data"
"111","8.626991889","66","5e:a0:93:18:2f:49","8a:6e:b9:79:24:d7","172.20.0.3","172.20.0.2","TCP","39548 → 4433 [RST, ACK] Seq=567 Ack=858 Win=64000 Len=0 TSval=2186957268 TSecr=2881528195"
"112","8.642121373","74","5e:a0:93:18:2f:49","8a:6e:b9:79:24:d7","172.20.0.3","172.20.0.2","TCP","39558 → 4433 [SYN] Seq=0 Win=64240 Len=0 MSS=1460 SACK_PERM TSval=2186957283 TSecr=0 WS=128"
"113","8.642152526","74","8a:6e:b9:79:24:d7","5e:a0:93:18:2f:49","172.20.0.2","172.20.0.3","TCP","4433 → 39558 [SYN, ACK] Seq=0 Ack=1 Win=65160 Len=0 MSS=1460 SACK_PERM TSval=2881528213 TSecr=2186957283 WS=128"
"114","8.642175657","66","5e:a0:93:18:2f:49","8a:6e:b9:79:24:d7","172.20.0.3","172.20.0.2","TCP","39558 → 4433 [ACK] Seq=1 Ack=1 Win=64256 Len=0 TSval=2186957283 TSecr=2881528213"
"115","8.642245614","552","5e:a0:93:18:2f:49","8a:6e:b9:79:24:d7","172.20.0.3","172.20.0.2","TLSv1.2","Client Hello"
"116","8.642266761","66","8a:6e:b9:79:24:d7","5e:a0:93:18:2f:49","172.20.0.2","172.20.0.3","TCP","4433 → 39558 [ACK] Seq=1 Ack=487 Win=64768 Len=0 TSval=2881528213 TSecr=2186957283"
"117","8.644355534","922","8a:6e:b9:79:24:d7","5e:a0:93:18:2f:49","172.20.0.2","172.20.0.3","TLSv1.3","Server Hello, Change Cipher Spec, Application Data, Application Data, Application Data, Application Data"
"118","8.644382994","66","5e:a0:93:18:2f:49","8a:6e:b9:79:24:d7","172.20.0.3","172.20.0.2","TCP","39558 → 4433 [ACK] Seq=487 Ack=857 Win=63488 Len=0 TSval=2186957285 TSecr=2881528215"
"119","8.648981388","146","5e:a0:93:18:2f:49","8a:6e:b9:79:24:d7","172.20.0.3","172.20.0.2","TLSv1.3","Change Cipher Spec, Application Data"
"120","8.649071376","66","5e:a0:93:18:2f:49","8a:6e:b9:79:24:d7","172.20.0.3","172.20.0.2","TCP","39558 → 4433 [RST, ACK] Seq=567 Ack=857 Win=64000 Len=0 TSval=2186957290 TSecr=2881528215"
"121","8.661284392","74","5e:a0:93:18:2f:49","8a:6e:b9:79:24:d7","172.20.0.3","172.20.0.2","TCP","39572 → 4433 [SYN] Seq=0 Win=64240 Len=0 MSS=1460 SACK_PERM TSval=2186957302 TSecr=0 WS=128"
"122","8.661310029","74","8a:6e:b9:79:24:d7","5e:a0:93:18:2f:49","172.20.0.2","172.20.0.3","TCP","4433 → 39572 [SYN, ACK] Seq=0 Ack=1 Win=65160 Len=0 MSS=1460 SACK_PERM TSval=2881528232 TSecr=2186957302 WS=128"
"123","8.661328008","66","5e:a0:93:18:2f:49","8a:6e:b9:79:24:d7","172.20.0.3","172.20.0.2","TCP","39572 → 4433 [ACK] Seq=1 Ack=1 Win=64256 Len=0 TSval=2186957302 TSecr=2881528232"
"124","8.661371959","552","5e:a0:93:18:2f:49","8a:6e:b9:79:24:d7","172.20.0.3","172.20.0.2","TLSv1.2","Client Hello"
"125","8.663348637","923","8a:6e:b9:79:24:d7","5e:a0:93:18:2f:49","172.20.0.2","172.20.0.3","TLSv1.3","Server Hello, Change Cipher Spec, Application Data, Application Data, Application Data, Application Data"
"126","8.663381754","66","5e:a0:93:18:2f:49","8a:6e:b9:79:24:d7","172.20.0.3","172.20.0.2","TCP","39572 → 4433 [ACK] Seq=487 Ack=858 Win=63488 Len=0 TSval=2186957304 TSecr=2881528234"
"127","8.666117872","146","5e:a0:93:18:2f:49","8a:6e:b9:79:24:d7","172.20.0.3","172.20.0.2","TLSv1.3","Change Cipher Spec, Application Data"
"128","8.666187226","66","5e:a0:93:18:2f:49","8a:6e:b9:79:24:d7","172.20.0.3","172.20.0.2","TCP","39572 → 4433 [RST, ACK] Seq=567 Ack=858 Win=64000 Len=0 TSval=2186957307 TSecr=2881528234"
"129","8.678226314","74","5e:a0:93:18:2f:49","8a:6e:b9:79:24:d7","172.20.0.3","172.20.0.2","TCP","39586 → 4433 [SYN] Seq=0 Win=64240 Len=0 MSS=1460 SACK_PERM TSval=2186957319 TSecr=0 WS=128"
"130","9.723927313","74","8a:6e:b9:79:24:d7","5e:a0:93:18:2f:49","172.20.0.2","172.20.0.3","TCP","4433 → 39586 [SYN, ACK] Seq=0 Ack=1 Win=65160 Len=0 MSS=1460 SACK_PERM TSval=2881529295 TSecr=2186957319 WS=128"
"131","9.723973752","74","5e:a0:93:18:2f:49","8a:6e:b9:79:24:d7","172.20.0.3","172.20.0.2","TCP","[TCP Retransmission] 39586 → 4433 [SYN] Seq=0 Win=64240 Len=0 MSS=1460 SACK_PERM TSval=2186958365 TSecr=0 WS=128"
"132","9.723996128","74","8a:6e:b9:79:24:d7","5e:a0:93:18:2f:49","172.20.0.2","172.20.0.3","TCP","[TCP Out-Of-Order] 4433 → 39586 [SYN, ACK] Seq=0 Ack=1 Win=65160 Len=0 MSS=1460 SACK_PERM TSval=2881529295 TSecr=2186957319 WS=128"
"133","9.724051400","66","5e:a0:93:18:2f:49","8a:6e:b9:79:24:d7","172.20.0.3","172.20.0.2","TCP","39586 → 4433 [ACK] Seq=1 Ack=1 Win=64256 Len=0 TSval=2186958365 TSecr=2881529295"
"134","9.724083084","66","5e:a0:93:18:2f:49","8a:6e:b9:79:24:d7","172.20.0.3","172.20.0.2","TCP","[TCP Dup ACK 133#1] 39586 → 4433 [ACK] Seq=1 Ack=1 Win=64256 Len=0 TSval=2186958365 TSecr=2881529295"
"135","9.724136064","552","5e:a0:93:18:2f:49","8a:6e:b9:79:24:d7","172.20.0.3","172.20.0.2","TLSv1.2","Client Hello"
"136","9.724152991","66","8a:6e:b9:79:24:d7","5e:a0:93:18:2f:49","172.20.0.2","172.20.0.3","TCP","4433 → 39586 [ACK] Seq=1 Ack=487 Win=64768 Len=0 TSval=2881529295 TSecr=2186958365"
"137","9.726145729","922","8a:6e:b9:79:24:d7","5e:a0:93:18:2f:49","172.20.0.2","172.20.0.3","TLSv1.3","Server Hello, Change Cipher Spec, Application Data, Application Data, Application Data, Application Data"
"138","9.726181913","66","5e:a0:93:18:2f:49","8a:6e:b9:79:24:d7","172.20.0.3","172.20.0.2","TCP","39586 → 4433 [ACK] Seq=487 Ack=857 Win=63488 Len=0 TSval=2186958367 TSecr=2881529297"
"139","9.730931991","146","5e:a0:93:18:2f:49","8a:6e:b9:79:24:d7","172.20.0.3","172.20.0.2","TLSv1.3","Change Cipher Spec, Application Data"
"140","9.731027245","66","5e:a0:93:18:2f:49","8a:6e:b9:79:24:d7","172.20.0.3","172.20.0.2","TCP","39586 → 4433 [RST, ACK] Seq=567 Ack=857 Win=64000 Len=0 TSval=2186958372 TSecr=2881529297"
"141","9.742852340","74","5e:a0:93:18:2f:49","8a:6e:b9:79:24:d7","172.20.0.3","172.20.0.2","TCP","39602 → 4433 [SYN] Seq=0 Win=64240 Len=0 MSS=1460 SACK_PERM TSval=2186958383 TSecr=0 WS=128"
"142","9.742885209","74","8a:6e:b9:79:24:d7","5e:a0:93:18:2f:49","172.20.0.2","172.20.0.3","TCP","4433 → 39602 [SYN, ACK] Seq=0 Ack=1 Win=65160 Len=0 MSS=1460 SACK_PERM TSval=2881529314 TSecr=2186958383 WS=128"
"143","9.742902669","66","5e:a0:93:18:2f:49","8a:6e:b9:79:24:d7","172.20.0.3","172.20.0.2","TCP","39602 → 4433 [ACK] Seq=1 Ack=1 Win=64256 Len=0 TSval=2186958384 TSecr=2881529314"
"144","9.742944169","552","5e:a0:93:18:2f:49","8a:6e:b9:79:24:d7","172.20.0.3","172.20.0.2","TLSv1.2","Client Hello"
"145","9.742949652","66","8a:6e:b9:79:24:d7","5e:a0:93:18:2f:49","172.20.0.2","172.20.0.3","TCP","4433 → 39602 [ACK] Seq=1 Ack=487 Win=64768 Len=0 TSval=2881529314 TSecr=2186958384"
"146","9.744889215","921","8a:6e:b9:79:24:d7","5e:a0:93:18:2f:49","172.20.0.2","172.20.0.3","TLSv1.3","Server Hello, Change Cipher Spec, Application Data, Application Data, Application Data, Application Data"
"147","9.744925552","66","5e:a0:93:18:2f:49","8a:6e:b9:79:24:d7","172.20.0.3","172.20.0.2","TCP","39602 → 4433 [ACK] Seq=487 Ack=856 Win=63488 Len=0 TSval=2186958386 TSecr=2881529316"
"148","9.747712963","146","5e:a0:93:18:2f:49","8a:6e:b9:79:24:d7","172.20.0.3","172.20.0.2","TLSv1.3","Change Cipher Spec, Application Data"
"149","9.747785009","66","5e:a0:93:18:2f:49","8a:6e:b9:79:24:d7","172.20.0.3","172.20.0.2","TCP","39602 → 4433 [RST, ACK] Seq=567 Ack=856 Win=64000 Len=0 TSval=2186958388 TSecr=2881529316"
"150","9.758763764","74","5e:a0:93:18:2f:49","8a:6e:b9:79:24:d7","172.20.0.3","172.20.0.2","TCP","39610 → 4433 [SYN] Seq=0 Win=64240 Len=0 MSS=1460 SACK_PERM TSval=2186958399 TSecr=0 WS=128"
"151","9.758792843","74","8a:6e:b9:79:24:d7","5e:a0:93:18:2f:49","172.20.0.2","172.20.0.3","TCP","4433 → 39610 [SYN, ACK] Seq=0 Ack=1 Win=65160 Len=0 MSS=1460 SACK_PERM TSval=2881529329 TSecr=2186958399 WS=128"
"152","9.758810212","66","5e:a0:93:18:2f:49","8a:6e:b9:79:24:d7","172.20.0.3","172.20.0.2","TCP","39610 → 4433 [ACK] Seq=1 Ack=1 Win=64256 Len=0 TSval=2186958399 TSecr=2881529329"
"153","9.758851362","552","5e:a0:93:18:2f:49","8a:6e:b9:79:24:d7","172.20.0.3","172.20.0.2","TLSv1.2","Client Hello"
"154","9.758870799","66","8a:6e:b9:79:24:d7","5e:a0:93:18:2f:49","172.20.0.2","172.20.0.3","TCP","4433 → 39610 [ACK] Seq=1 Ack=487 Win=64768 Len=0 TSval=2881529329 TSecr=2186958399"
"155","9.760745129","922","8a:6e:b9:79:24:d7","5e:a0:93:18:2f:49","172.20.0.2","172.20.0.3","TLSv1.3","Server Hello, Change Cipher Spec, Application Data, Application Data, Application Data, Application Data"
"156","9.760784252","66","5e:a0:93:18:2f:49","8a:6e:b9:79:24:d7","172.20.0.3","172.20.0.2","TCP","39610 → 4433 [ACK] Seq=487 Ack=857 Win=63488 Len=0 TSval=2186958401 TSecr=2881529331"
"157","9.763429530","146","5e:a0:93:18:2f:49","8a:6e:b9:79:24:d7","172.20.0.3","172.20.0.2","TLSv1.3","Change Cipher Spec, Application Data"
"158","9.763489350","66","5e:a0:93:18:2f:49","8a:6e:b9:79:24:d7","172.20.0.3","172.20.0.2","TCP","39610 → 4433 [RST, ACK] Seq=567 Ack=857 Win=64000 Len=0 TSval=2186958404 TSecr=2881529331"
"159","9.774619021","74","5e:a0:93:18:2f:49","8a:6e:b9:79:24:d7","172.20.0.3","172.20.0.2","TCP","39614 → 4433 [SYN] Seq=0 Win=64240 Len=0 MSS=1460 SACK_PERM TSval=2186958415 TSecr=0 WS=128"
"160","9.774645631","74","8a:6e:b9:79:24:d7","5e:a0:93:18:2f:49","172.20.0.2","172.20.0.3","TCP","4433 → 39614 [SYN, ACK] Seq=0 Ack=1 Win=65160 Len=0 MSS=1460 SACK_PERM TSval=2881529345 TSecr=2186958415 WS=128"
"161","9.774664154","66","5e:a0:93:18:2f:49","8a:6e:b9:79:24:d7","172.20.0.3","172.20.0.2","TCP","39614 → 4433 [ACK] Seq=1 Ack=1 Win=64256 Len=0 TSval=2186958415 TSecr=2881529345"
"162","9.774716983","552","5e:a0:93:18:2f:49","8a:6e:b9:79:24:d7","172.20.0.3","172.20.0.2","TLSv1.2","Client Hello"
"163","9.774724344","66","8a:6e:b9:79:24:d7","5e:a0:93:18:2f:49","172.20.0.2","172.20.0.3","TCP","4433 → 39614 [ACK] Seq=1 Ack=487 Win=64768 Len=0 TSval=2881529345 TSecr=2186958415"
"164","9.776701873","923","8a:6e:b9:79:24:d7","5e:a0:93:18:2f:49","172.20.0.2","172.20.0.3","TLSv1.3","Server Hello, Change Cipher Spec, Application Data, Application Data, Application Data, Application Data"
"165","9.776731277","66","5e:a0:93:18:2f:49","8a:6e:b9:79:24:d7","172.20.0.3","172.20.0.2","TCP","39614 → 4433 [ACK] Seq=487 Ack=858 Win=63488 Len=0 TSval=2186958417 TSecr=2881529347"
"166","9.779353146","146","5e:a0:93:18:2f:49","8a:6e:b9:79:24:d7","172.20.0.3","172.20.0.2","TLSv1.3","Change Cipher Spec, Application Data"
"167","9.779404798","66","5e:a0:93:18:2f:49","8a:6e:b9:79:24:d7","172.20.0.3","172.20.0.2","TCP","39614 → 4433 [RST, ACK] Seq=567 Ack=858 Win=64000 Len=0 TSval=2186958420 TSecr=2881529347"
"168","9.790886320","74","5e:a0:93:18:2f:49","8a:6e:b9:79:24:d7","172.20.0.3","172.20.0.2","TCP","39620 → 4433 [SYN] Seq=0 Win=64240 Len=0 MSS=1460 SACK_PERM TSval=2186958431 TSecr=0 WS=128"
"169","9.790915350","74","8a:6e:b9:79:24:d7","5e:a0:93:18:2f:49","172.20.0.2","172.20.0.3","TCP","4433 → 39620 [SYN, ACK] Seq=0 Ack=1 Win=65160 Len=0 MSS=1460 SACK_PERM TSval=2881529362 TSecr=2186958431 WS=128"
"170","9.790939375","66","5e:a0:93:18:2f:49","8a:6e:b9:79:24:d7","172.20.0.3","172.20.0.2","TCP","39620 → 4433 [ACK] Seq=1 Ack=1 Win=64256 Len=0 TSval=2186958432 TSecr=2881529362"
"171","9.790993429","552","5e:a0:93:18:2f:49","8a:6e:b9:79:24:d7","172.20.0.3","172.20.0.2","TLSv1.2","Client Hello"
"172","9.790999007","66","8a:6e:b9:79:24:d7","5e:a0:93:18:2f:49","172.20.0.2","172.20.0.3","TCP","4433 → 39620 [ACK] Seq=1 Ack=487 Win=64768 Len=0 TSval=2881529362 TSecr=2186958432"
"173","9.792983134","921","8a:6e:b9:79:24:d7","5e:a0:93:18:2f:49","172.20.0.2","172.20.0.3","TLSv1.3","Server Hello, Change Cipher Spec, Application Data, Application Data, Application Data, Application Data"
"174","9.793017384","66","5e:a0:93:18:2f:49","8a:6e:b9:79:24:d7","172.20.0.3","172.20.0.2","TCP","39620 → 4433 [ACK] Seq=487 Ack=856 Win=63488 Len=0 TSval=2186958434 TSecr=2881529364"
"175","9.795735677","146","5e:a0:93:18:2f:49","8a:6e:b9:79:24:d7","172.20.0.3","172.20.0.2","TLSv1.3","Change Cipher Spec, Application Data"
"176","9.795800593","66","5e:a0:93:18:2f:49","8a:6e:b9:79:24:d7","172.20.0.3","172.20.0.2","TCP","39620 → 4433 [RST, ACK] Seq=567 Ack=856 Win=64000 Len=0 TSval=2186958436 TSecr=2881529364"
"177","9.807008471","74","5e:a0:93:18:2f:49","8a:6e:b9:79:24:d7","172.20.0.3","172.20.0.2","TCP","39632 → 4433 [SYN] Seq=0 Win=64240 Len=0 MSS=1460 SACK_PERM TSval=2186958448 TSecr=0 WS=128"
"178","10.811966150","74","5e:a0:93:18:2f:49","8a:6e:b9:79:24:d7","172.20.0.3","172.20.0.2","TCP","[TCP Retransmission] 39632 → 4433 [SYN] Seq=0 Win=64240 Len=0 MSS=1460 SACK_PERM TSval=2186959453 TSecr=0 WS=128"
"179","11.835922252","74","5e:a0:93:18:2f:49","8a:6e:b9:79:24:d7","172.20.0.3","172.20.0.2","TCP","[TCP Retransmission] 39632 → 4433 [SYN] Seq=0 Win=64240 Len=0 MSS=1460 SACK_PERM TSval=2186960477 TSecr=0 WS=128"
"180","11.835952190","74","8a:6e:b9:79:24:d7","5e:a0:93:18:2f:49","172.20.0.2","172.20.0.3","TCP","4433 → 39632 [SYN, ACK] Seq=0 Ack=1 Win=65160 Len=0 MSS=1460 SACK_PERM TSval=2881531407 TSecr=2186958448 WS=128"
"181","11.835985783","66","5e:a0:93:18:2f:49","8a:6e:b9:79:24:d7","172.20.0.3","172.20.0.2","TCP","39632 → 4433 [ACK] Seq=1 Ack=1 Win=64256 Len=0 TSval=2186960477 TSecr=2881531407"
"182","11.836077639","552","5e:a0:93:18:2f:49","8a:6e:b9:79:24:d7","172.20.0.3","172.20.0.2","TLSv1.2","Client Hello"
"183","11.836085900","66","8a:6e:b9:79:24:d7","5e:a0:93:18:2f:49","172.20.0.2","172.20.0.3","TCP","4433 → 39632 [ACK] Seq=1 Ack=487 Win=64768 Len=0 TSval=2881531407 TSecr=2186960477"
"184","11.838084959","922","8a:6e:b9:79:24:d7","5e:a0:93:18:2f:49","172.20.0.2","172.20.0.3","TLSv1.3","Server Hello, Change Cipher Spec, Application Data, Application Data, Application Data, Application Data"
"185","11.838118757","66","5e:a0:93:18:2f:49","8a:6e:b9:79:24:d7","172.20.0.3","172.20.0.2","TCP","39632 → 4433 [ACK] Seq=487 Ack=857 Win=63488 Len=0 TSval=2186960479 TSecr=2881531409"
"186","11.840964591","146","5e:a0:93:18:2f:49","8a:6e:b9:79:24:d7","172.20.0.3","172.20.0.2","TLSv1.3","Change Cipher Spec, Application Data"
"187","11.841031885","66","5e:a0:93:18:2f:49","8a:6e:b9:79:24:d7","172.20.0.3","172.20.0.2","TCP","39632 → 4433 [RST, ACK] Seq=567 Ack=857 Win=64000 Len=0 TSval=2186960482 TSecr=2881531409"
"188","11.852702892","74","5e:a0:93:18:2f:49","8a:6e:b9:79:24:d7","172.20.0.3","172.20.0.2","TCP","39642 → 4433 [SYN] Seq=0 Win=64240 Len=0 MSS=1460 SACK_PERM TSval=2186960493 TSecr=0 WS=128"
"189","11.852733702","74","8a:6e:b9:79:24:d7","5e:a0:93:18:2f:49","172.20.0.2","172.20.0.3","TCP","4433 → 39642 [SYN, ACK] Seq=0 Ack=1 Win=65160 Len=0 MSS=1460 SACK_PERM TSval=2881531423 TSecr=2186960493 WS=128"
"190","11.852753611","66","5e:a0:93:18:2f:49","8a:6e:b9:79:24:d7","172.20.0.3","172.20.0.2","TCP","39642 → 4433 [ACK] Seq=1 Ack=1 Win=64256 Len=0 TSval=2186960493 TSecr=2881531423"
"191","11.852806220","552","5e:a0:93:18:2f:49","8a:6e:b9:79:24:d7","172.20.0.3","172.20.0.2","TLSv1.2","Client Hello"
"192","11.852811605","66","8a:6e:b9:79:24:d7","5e:a0:93:18:2f:49","172.20.0.2","172.20.0.3","TCP","4433 → 39642 [ACK] Seq=1 Ack=487 Win=64768 Len=0 TSval=2881531423 TSecr=2186960493"
"193","11.854785124","922","8a:6e:b9:79:24:d7","5e:a0:93:18:2f:49","172.20.0.2","172.20.0.3","TLSv1.3","Server Hello, Change Cipher Spec, Application Data, Application Data, Application Data, Application Data"
"194","11.854839511","66","5e:a0:93:18:2f:49","8a:6e:b9:79:24:d7","172.20.0.3","172.20.0.2","TCP","39642 → 4433 [ACK] Seq=487 Ack=857 Win=63488 Len=0 TSval=2186960495 TSecr=2881531425"
"195","11.857415550","146","5e:a0:93:18:2f:49","8a:6e:b9:79:24:d7","172.20.0.3","172.20.0.2","TLSv1.3","Change Cipher Spec, Application Data"
"196","11.857466885","66","5e:a0:93:18:2f:49","8a:6e:b9:79:24:d7","172.20.0.3","172.20.0.2","TCP","39642 → 4433 [RST, ACK] Seq=567 Ack=857 Win=64000 Len=0 TSval=2186960498 TSecr=2881531425"
"197","11.868038930","74","5e:a0:93:18:2f:49","8a:6e:b9:79:24:d7","172.20.0.3","172.20.0.2","TCP","39656 → 4433 [SYN] Seq=0 Win=64240 Len=0 MSS=1460 SACK_PERM TSval=2186960509 TSecr=0 WS=128"
"198","11.868061025","74","8a:6e:b9:79:24:d7","5e:a0:93:18:2f:49","172.20.0.2","172.20.0.3","TCP","4433 → 39656 [SYN, ACK] Seq=0 Ack=1 Win=65160 Len=0 MSS=1460 SACK_PERM TSval=2881531439 TSecr=2186960509 WS=128"
"199","11.868076342","66","5e:a0:93:18:2f:49","8a:6e:b9:79:24:d7","172.20.0.3","172.20.0.2","TCP","39656 → 4433 [ACK] Seq=1 Ack=1 Win=64256 Len=0 TSval=2186960509 TSecr=2881531439"
"200","11.868117313","552","5e:a0:93:18:2f:49","8a:6e:b9:79:24:d7","172.20.0.3","172.20.0.2","TLSv1.2","Client Hello"
"201","11.868122344","66","8a:6e:b9:79:24:d7","5e:a0:93:18:2f:49","172.20.0.2","172.20.0.3","TCP","4433 → 39656 [ACK] Seq=1 Ack=487 Win=64768 Len=0 TSval=2881531439 TSecr=2186960509"
"202","12.075891340","922","8a:6e:b9:79:24:d7","5e:a0:93:18:2f:49","172.20.0.2","172.20.0.3","TLSv1.3","Server Hello, Change Cipher Spec, Application Data, Application Data, Application Data, Application Data"
"203","12.075974588","66","5e:a0:93:18:2f:49","8a:6e:b9:79:24:d7","172.20.0.3","172.20.0.2","TCP","39656 → 4433 [ACK] Seq=487 Ack=857 Win=63488 Len=0 TSval=2186960717 TSecr=2881531647"
"204","12.078885800","146","5e:a0:93:18:2f:49","8a:6e:b9:79:24:d7","172.20.0.3","172.20.0.2","TLSv1.3","Change Cipher Spec, Application Data"
"205","12.078954463","66","5e:a0:93:18:2f:49","8a:6e:b9:79:24:d7","172.20.0.3","172.20.0.2","TCP","39656 → 4433 [RST, ACK] Seq=567 Ack=857 Win=64000 Len=0 TSval=2186960720 TSecr=2881531647"
"206","12.090600890","74","5e:a0:93:18:2f:49","8a:6e:b9:79:24:d7","172.20.0.3","172.20.0.2","TCP","39670 → 4433 [SYN] Seq=0 Win=64240 Len=0 MSS=1460 SACK_PERM TSval=2186960731 TSecr=0 WS=128"
"207","13.115928755","74","8a:6e:b9:79:24:d7","5e:a0:93:18:2f:49","172.20.0.2","172.20.0.3","TCP","4433 → 39670 [SYN, ACK] Seq=0 Ack=1 Win=65160 Len=0 MSS=1460 SACK_PERM TSval=2881532687 TSecr=2186960731 WS=128"
"208","13.115986622","74","5e:a0:93:18:2f:49","8a:6e:b9:79:24:d7","172.20.0.3","172.20.0.2","TCP","[TCP Retransmission] 39670 → 4433 [SYN] Seq=0 Win=64240 Len=0 MSS=1460 SACK_PERM TSval=2186961757 TSecr=0 WS=128"
"209","13.116005518","74","8a:6e:b9:79:24:d7","5e:a0:93:18:2f:49","172.20.0.2","172.20.0.3","TCP","[TCP Retransmission] 4433 → 39670 [SYN, ACK] Seq=0 Ack=1 Win=65160 Len=0 MSS=1460 SACK_PERM TSval=2881532687 TSecr=2186960731 WS=128"
"210","13.116050675","66","5e:a0:93:18:2f:49","8a:6e:b9:79:24:d7","172.20.0.3","172.20.0.2","TCP","39670 → 4433 [ACK] Seq=1 Ack=1 Win=64256 Len=0 TSval=2186961757 TSecr=2881532687"
"211","13.116075892","66","5e:a0:93:18:2f:49","8a:6e:b9:79:24:d7","172.20.0.3","172.20.0.2","TCP","[TCP Dup ACK 210#1] 39670 → 4433 [ACK] Seq=1 Ack=1 Win=64256 Len=0 TSval=2186961757 TSecr=2881532687"
"212","13.116149412","552","5e:a0:93:18:2f:49","8a:6e:b9:79:24:d7","172.20.0.3","172.20.0.2","TLSv1.2","Client Hello"
"213","13.118370337","922","8a:6e:b9:79:24:d7","5e:a0:93:18:2f:49","172.20.0.2","172.20.0.3","TLSv1.3","Server Hello, Change Cipher Spec, Application Data, Application Data, Application Data, Application Data"
"214","13.118420697","66","5e:a0:93:18:2f:49","8a:6e:b9:79:24:d7","172.20.0.3","172.20.0.2","TCP","39670 → 4433 [ACK] Seq=487 Ack=857 Win=63488 Len=0 TSval=2186961759 TSecr=2881532689"
"215","13.121280683","146","5e:a0:93:18:2f:49","8a:6e:b9:79:24:d7","172.20.0.3","172.20.0.2","TLSv1.3","Change Cipher Spec, Application Data"
"216","13.121363389","66","5e:a0:93:18:2f:49","8a:6e:b9:79:24:d7","172.20.0.3","172.20.0.2","TCP","39670 → 4433 [RST, ACK] Seq=567 Ack=857 Win=64000 Len=0 TSval=2186961762 TSecr=2881532689"
"217","13.133157497","74","5e:a0:93:18:2f:49","8a:6e:b9:79:24:d7","172.20.0.3","172.20.0.2","TCP","39680 → 4433 [SYN] Seq=0 Win=64240 Len=0 MSS=1460 SACK_PERM TSval=2186961774 TSecr=0 WS=128"
"218","14.139919662","74","8a:6e:b9:79:24:d7","5e:a0:93:18:2f:49","172.20.0.2","172.20.0.3","TCP","4433 → 39680 [SYN, ACK] Seq=0 Ack=1 Win=65160 Len=0 MSS=1460 SACK_PERM TSval=2881533711 TSecr=2186961774 WS=128"
"219","14.139939734","74","5e:a0:93:18:2f:49","8a:6e:b9:79:24:d7","172.20.0.3","172.20.0.2","TCP","[TCP Retransmission] 39680 → 4433 [SYN] Seq=0 Win=64240 Len=0 MSS=1460 SACK_PERM TSval=2186962781 TSecr=0 WS=128"
"220","14.139956389","74","8a:6e:b9:79:24:d7","5e:a0:93:18:2f:49","172.20.0.2","172.20.0.3","TCP","[TCP Retransmission] 4433 → 39680 [SYN, ACK] Seq=0 Ack=1 Win=65160 Len=0 MSS=1460 SACK_PERM TSval=2881533711 TSecr=2186961774 WS=128"
