frame.number,frame.time_relative,frame.len,eth.src,eth.dst,ip.src,ip.dst,_ws.col.protocol,_ws.col.info
"1","0.000000000","42","c2:ea:ec:4e:9c:d6","ff:ff:ff:ff:ff:ff",,,"ARP","ARP Announcement for 172.20.0.3"
"2","0.036378613","42","c2:ea:ec:4e:9c:d6","ff:ff:ff:ff:ff:ff",,,"ARP","Who has 172.20.0.2? Tell 172.20.0.3"
"3","0.036406094","42","2a:7b:b7:64:0e:71","c2:ea:ec:4e:9c:d6",,,"ARP","172.20.0.2 is at 2a:7b:b7:64:0e:71"
"4","0.036414003","74","c2:ea:ec:4e:9c:d6","2a:7b:b7:64:0e:71","172.20.0.3","172.20.0.2","TCP","53992 → 4433 [SYN] Seq=0 Win=64240 Len=0 MSS=1460 SACK_PERM TSval=2188428260 TSecr=0 WS=128"
"5","0.036436510","74","2a:7b:b7:64:0e:71","c2:ea:ec:4e:9c:d6","172.20.0.2","172.20.0.3","TCP","4433 → 53992 [SYN, ACK] Seq=0 Ack=1 Win=65160 Len=0 MSS=1460 SACK_PERM TSval=2882999190 TSecr=2188428260 WS=128"
"6","0.036454152","66","c2:ea:ec:4e:9c:d6","2a:7b:b7:64:0e:71","172.20.0.3","172.20.0.2","TCP","53992 → 4433 [ACK] Seq=1 Ack=1 Win=64256 Len=0 TSval=2188428260 TSecr=2882999190"
"7","0.036513448","2189","c2:ea:ec:4e:9c:d6","2a:7b:b7:64:0e:71","172.20.0.3","172.20.0.2","TLSv1.2","Client Hello"
"8","0.036519192","66","2a:7b:b7:64:0e:71","c2:ea:ec:4e:9c:d6","172.20.0.2","172.20.0.3","TCP","4433 → 53992 [ACK] Seq=1 Ack=2124 Win=64128 Len=0 TSval=2882999190 TSecr=2188428260"
"9","0.051688821","2677","2a:7b:b7:64:0e:71","c2:ea:ec:4e:9c:d6","172.20.0.2","172.20.0.3","TLSv1.3","Server Hello, Change Cipher Spec, Application Data, Application Data, Application Data, Application Data"
"10","0.051738131","66","c2:ea:ec:4e:9c:d6","2a:7b:b7:64:0e:71","172.20.0.3","172.20.0.2","TCP","53992 → 4433 [ACK] Seq=2124 Ack=2612 Win=64128 Len=0 TSval=2188428275 TSecr=2882999205"
"11","0.061245987","146","c2:ea:ec:4e:9c:d6","2a:7b:b7:64:0e:71","172.20.0.3","172.20.0.2","TLSv1.3","Change Cipher Spec, Application Data"
"12","0.061334255","66","c2:ea:ec:4e:9c:d6","2a:7b:b7:64:0e:71","172.20.0.3","172.20.0.2","TCP","53992 → 4433 [RST, ACK] Seq=2204 Ack=2612 Win=64128 Len=0 TSval=2188428285 TSecr=2882999205"
"13","0.077943754","74","c2:ea:ec:4e:9c:d6","2a:7b:b7:64:0e:71","172.20.0.3","172.20.0.2","TCP","54008 → 4433 [SYN] Seq=0 Win=64240 Len=0 MSS=1460 SACK_PERM TSval=2188428301 TSecr=0 WS=128"
"14","1.000831983","42","c2:ea:ec:4e:9c:d6","ff:ff:ff:ff:ff:ff",,,"ARP","ARP Announcement for 172.20.0.3"
"15","1.117894286","74","2a:7b:b7:64:0e:71","c2:ea:ec:4e:9c:d6","172.20.0.2","172.20.0.3","TCP","4433 → 54008 [SYN, ACK] Seq=0 Ack=1 Win=65160 Len=0 MSS=1460 SACK_PERM TSval=2883000271 TSecr=2188428301 WS=128"
"16","1.117935759","74","c2:ea:ec:4e:9c:d6","2a:7b:b7:64:0e:71","172.20.0.3","172.20.0.2","TCP","[TCP Retransmission] 54008 → 4433 [SYN] Seq=0 Win=64240 Len=0 MSS=1460 SACK_PERM TSval=2188429341 TSecr=0 WS=128"
"17","1.117954605","74","2a:7b:b7:64:0e:71","c2:ea:ec:4e:9c:d6","172.20.0.2","172.20.0.3","TCP","[TCP Out-Of-Order] 4433 → 54008 [SYN, ACK] Seq=0 Ack=1 Win=65160 Len=0 MSS=1460 SACK_PERM TSval=2883000271 TSecr=2188428301 WS=128"
"18","1.118000565","66","c2:ea:ec:4e:9c:d6","2a:7b:b7:64:0e:71","172.20.0.3","172.20.0.2","TCP","54008 → 4433 [ACK] Seq=1 Ack=1 Win=64256 Len=0 TSval=2188429341 TSecr=2883000271"
"19","1.118030537","66","c2:ea:ec:4e:9c:d6","2a:7b:b7:64:0e:71","172.20.0.3","172.20.0.2","TCP","[TCP Dup ACK 18#1] 54008 → 4433 [ACK] Seq=1 Ack=1 Win=64256 Len=0 TSval=2188429341 TSecr=2883000271"
"20","1.118131290","2189","c2:ea:ec:4e:9c:d6","2a:7b:b7:64:0e:71","172.20.0.3","172.20.0.2","TLSv1.2","Client Hello"
"21","1.118146342","66","2a:7b:b7:64:0e:71","c2:ea:ec:4e:9c:d6","172.20.0.2","172.20.0.3","TCP","4433 → 54008 [ACK] Seq=1 Ack=2124 Win=64128 Len=0 TSval=2883000272 TSecr=2188429341"
"22","1.130731174","1514","2a:7b:b7:64:0e:71","c2:ea:ec:4e:9c:d6","172.20.0.2","172.20.0.3","SSL",""
"23","1.130785587","66","c2:ea:ec:4e:9c:d6","2a:7b:b7:64:0e:71","172.20.0.3","172.20.0.2","TCP","54008 → 4433 [ACK] Seq=2124 Ack=1449 Win=64128 Len=0 TSval=2188429354 TSecr=2883000284"
"24","1.130796902","1228","2a:7b:b7:64:0e:71","c2:ea:ec:4e:9c:d6","172.20.0.2","172.20.0.3","TLSv1.3","Server Hello, Change Cipher Spec, Application Data, Application Data, Application Data, Application Data"
"25","1.130802061","66","c2:ea:ec:4e:9c:d6","2a:7b:b7:64:0e:71","172.20.0.3","172.20.0.2","TCP","54008 → 4433 [ACK] Seq=2124 Ack=2611 Win=64128 Len=0 TSval=2188429354 TSecr=2883000284"
"26","1.140142732","146","c2:ea:ec:4e:9c:d6","2a:7b:b7:64:0e:71","172.20.0.3","172.20.0.2","TLSv1.3","Change Cipher Spec, Application Data"
"27","1.140244873","66","c2:ea:ec:4e:9c:d6","2a:7b:b7:64:0e:71","172.20.0.3","172.20.0.2","TCP","54008 → 4433 [RST, ACK] Seq=2204 Ack=2611 Win=64128 Len=0 TSval=2188429364 TSecr=2883000284"
"28","1.157462548","74","c2:ea:ec:4e:9c:d6","2a:7b:b7:64:0e:71","172.20.0.3","172.20.0.2","TCP","54020 → 4433 [SYN] Seq=0 Win=64240 Len=0 MSS=1460 SACK_PERM TSval=2188429381 TSecr=0 WS=128"
"29","1.157494613","74","2a:7b:b7:64:0e:71","c2:ea:ec:4e:9c:d6","172.20.0.2","172.20.0.3","TCP","4433 → 54020 [SYN, ACK] Seq=0 Ack=1 Win=65160 Len=0 MSS=1460 SACK_PERM TSval=2883000311 TSecr=2188429381 WS=128"
"30","1.157514324","66","c2:ea:ec:4e:9c:d6","2a:7b:b7:64:0e:71","172.20.0.3","172.20.0.2","TCP","54020 → 4433 [ACK] Seq=1 Ack=1 Win=64256 Len=0 TSval=2188429381 TSecr=2883000311"
"31","1.157559908","2189","c2:ea:ec:4e:9c:d6","2a:7b:b7:64:0e:71","172.20.0.3","172.20.0.2","TLSv1.2","Client Hello"
"32","1.157567623","66","2a:7b:b7:64:0e:71","c2:ea:ec:4e:9c:d6","172.20.0.2","172.20.0.3","TCP","4433 → 54020 [ACK] Seq=1 Ack=2124 Win=64128 Len=0 TSval=2883000311 TSecr=2188429381"
"33","1.173132103","1228","2a:7b:b7:64:0e:71","c2:ea:ec:4e:9c:d6","172.20.0.2","172.20.0.3","SSL","[TCP Previous segment not captured] , Continuation Data"
"34","1.173171960","78","c2:ea:ec:4e:9c:d6","2a:7b:b7:64:0e:71","172.20.0.3","172.20.0.2","TCP","[TCP Dup ACK 30#1] 54020 → 4433 [ACK] Seq=2124 Ack=1 Win=64256 Len=0 TSval=2188429397 TSecr=2883000311 SLE=1449 SRE=2611"
"35","1.173181824","1514","2a:7b:b7:64:0e:71","c2:ea:ec:4e:9c:d6","172.20.0.2","172.20.0.3","TCP","[TCP Out-Of-Order] 4433 → 54020 [ACK] Seq=1 Ack=2124 Win=64128 Len=1448 TSval=2883000327 TSecr=2188429397"
"36","1.173195141","66","c2:ea:ec:4e:9c:d6","2a:7b:b7:64:0e:71","172.20.0.3","172.20.0.2","TCP","54020 → 4433 [ACK] Seq=2124 Ack=2611 Win=64128 Len=0 TSval=2188429397 TSecr=2883000327"
"37","1.182424442","146","c2:ea:ec:4e:9c:d6","2a:7b:b7:64:0e:71","172.20.0.3","172.20.0.2","TLSv1.2","Change Cipher Spec, Application Data"
"38","1.182506937","66","c2:ea:ec:4e:9c:d6","2a:7b:b7:64:0e:71","172.20.0.3","172.20.0.2","TCP","54020 → 4433 [RST, ACK] Seq=2204 Ack=2611 Win=64128 Len=0 TSval=2188429406 TSecr=2883000327"
"39","1.199869263","74","c2:ea:ec:4e:9c:d6","2a:7b:b7:64:0e:71","172.20.0.3","172.20.0.2","TCP","54028 → 4433 [SYN] Seq=0 Win=64240 Len=0 MSS=1460 SACK_PERM TSval=2188429423 TSecr=0 WS=128"
"40","1.199899344","74","2a:7b:b7:64:0e:71","c2:ea:ec:4e:9c:d6","172.20.0.2","172.20.0.3","TCP","4433 → 54028 [SYN, ACK] Seq=0 Ack=1 Win=65160 Len=0 MSS=1460 SACK_PERM TSval=2883000353 TSecr=2188429423 WS=128"
"41","1.199919485","66","c2:ea:ec:4e:9c:d6","2a:7b:b7:64:0e:71","172.20.0.3","172.20.0.2","TCP","54028 → 4433 [ACK] Seq=1 Ack=1 Win=64256 Len=0 TSval=2188429423 TSecr=2883000353"
"42","1.199978312","2189","c2:ea:ec:4e:9c:d6","2a:7b:b7:64:0e:71","172.20.0.3","172.20.0.2","TLSv1.2","Client Hello"
"43","1.199983659","66","2a:7b:b7:64:0e:71","c2:ea:ec:4e:9c:d6","172.20.0.2","172.20.0.3","TCP","4433 → 54028 [ACK] Seq=1 Ack=2124 Win=64128 Len=0 TSval=2883000353 TSecr=2188429423"
"44","1.215124853","1228","2a:7b:b7:64:0e:71","c2:ea:ec:4e:9c:d6","172.20.0.2","172.20.0.3","SSL","[TCP Previous segment not captured] , Continuation Data"
"45","1.215158984","78","c2:ea:ec:4e:9c:d6","2a:7b:b7:64:0e:71","172.20.0.3","172.20.0.2","TCP","[TCP Dup ACK 41#1] 54028 → 4433 [ACK] Seq=2124 Ack=1 Win=64256 Len=0 TSval=2188429439 TSecr=2883000353 SLE=1449 SRE=2611"
"46","1.215168301","1514","2a:7b:b7:64:0e:71","c2:ea:ec:4e:9c:d6","172.20.0.2","172.20.0.3","TCP","[TCP Out-Of-Order] 4433 → 54028 [ACK] Seq=1 Ack=2124 Win=64128 Len=1448 TSval=2883000369 TSecr=2188429439"
"47","1.215182095","66","c2:ea:ec:4e:9c:d6","2a:7b:b7:64:0e:71","172.20.0.3","172.20.0.2","TCP","54028 → 4433 [ACK] Seq=2124 Ack=2611 Win=64128 Len=0 TSval=2188429439 TSecr=2883000369"
"48","1.227065409","146","c2:ea:ec:4e:9c:d6","2a:7b:b7:64:0e:71","172.20.0.3","172.20.0.2","TLSv1.2","Change Cipher Spec, Application Data"
"49","1.227187780","66","c2:ea:ec:4e:9c:d6","2a:7b:b7:64:0e:71","172.20.0.3","172.20.0.2","TCP","54028 → 4433 [RST, ACK] Seq=2204 Ack=2611 Win=64128 Len=0 TSval=2188429451 TSecr=2883000369"
"50","1.244139690","74","c2:ea:ec:4e:9c:d6","2a:7b:b7:64:0e:71","172.20.0.3","172.20.0.2","TCP","54032 → 4433 [SYN] Seq=0 Win=64240 Len=0 MSS=1460 SACK_PERM TSval=2188429467 TSecr=0 WS=128"
"51","1.244167541","74","2a:7b:b7:64:0e:71","c2:ea:ec:4e:9c:d6","172.20.0.2","172.20.0.3","TCP","4433 → 54032 [SYN, ACK] Seq=0 Ack=1 Win=65160 Len=0 MSS=1460 SACK_PERM TSval=2883000398 TSecr=2188429467 WS=128"
"52","1.244185517","66","c2:ea:ec:4e:9c:d6","2a:7b:b7:64:0e:71","172.20.0.3","172.20.0.2","TCP","54032 → 4433 [ACK] Seq=1 Ack=1 Win=64256 Len=0 TSval=2188429468 TSecr=2883000398"
"53","1.244230301","2189","c2:ea:ec:4e:9c:d6","2a:7b:b7:64:0e:71","172.20.0.3","172.20.0.2","TLSv1.2","Client Hello"
"54","1.244247908","66","2a:7b:b7:64:0e:71","c2:ea:ec:4e:9c:d6","172.20.0.2","172.20.0.3","TCP","4433 → 54032 [ACK] Seq=1 Ack=2124 Win=64128 Len=0 TSval=2883000398 TSecr=2188429468"
"55","1.256069759","2675","2a:7b:b7:64:0e:71","c2:ea:ec:4e:9c:d6","172.20.0.2","172.20.0.3","TLSv1.3","Server Hello, Change Cipher Spec, Application Data, Application Data, Application Data, Application Data"
"56","1.256125001","66","c2:ea:ec:4e:9c:d6","2a:7b:b7:64:0e:71","172.20.0.3","172.20.0.2","TCP","54032 → 4433 [ACK] Seq=2124 Ack=2610 Win=64128 Len=0 TSval=2188429479 TSecr=2883000409"
"57","1.265336643","146","c2:ea:ec:4e:9c:d6","2a:7b:b7:64:0e:71","172.20.0.3","172.20.0.2","TLSv1.3","Change Cipher Spec, Application Data"
"58","1.265415336","66","c2:ea:ec:4e:9c:d6","2a:7b:b7:64:0e:71","172.20.0.3","172.20.0.2","TCP","54032 → 4433 [RST, ACK] Seq=2204 Ack=2610 Win=64128 Len=0 TSval=2188429489 TSecr=2883000409"
"59","1.288044176","74","c2:ea:ec:4e:9c:d6","2a:7b:b7:64:0e:71","172.20.0.3","172.20.0.2","TCP","54048 → 4433 [SYN] Seq=0 Win=64240 Len=0 MSS=1460 SACK_PERM TSval=2188429511 TSecr=0 WS=128"
"60","2.000694983","42","c2:ea:ec:4e:9c:d6","ff:ff:ff:ff:ff:ff",,,"ARP","ARP Announcement for 172.20.0.3"
"61","2.333161139","74","2a:7b:b7:64:0e:71","c2:ea:ec:4e:9c:d6","172.20.0.2","172.20.0.3","TCP","4433 → 54048 [SYN, ACK] Seq=0 Ack=1 Win=65160 Len=0 MSS=1460 SACK_PERM TSval=2883001487 TSecr=2188429511 WS=128"
"62","2.333179539","74","c2:ea:ec:4e:9c:d6","2a:7b:b7:64:0e:71","172.20.0.3","172.20.0.2","TCP","[TCP Retransmission] 54048 → 4433 [SYN] Seq=0 Win=64240 Len=0 MSS=1460 SACK_PERM TSval=2188430557 TSecr=0 WS=128"
"63","2.333194135","74","2a:7b:b7:64:0e:71","c2:ea:ec:4e:9c:d6","172.20.0.2","172.20.0.3","TCP","[TCP Out-Of-Order] 4433 → 54048 [SYN, ACK] Seq=0 Ack=1 Win=65160 Len=0 MSS=1460 SACK_PERM TSval=2883001487 TSecr=2188429511 WS=128"
"64","2.333238228","66","c2:ea:ec:4e:9c:d6","2a:7b:b7:64:0e:71","172.20.0.3","172.20.0.2","TCP","54048 → 4433 [ACK] Seq=1 Ack=1 Win=64256 Len=0 TSval=2188430557 TSecr=2883001487"
"65","2.333266120","66","c2:ea:ec:4e:9c:d6","2a:7b:b7:64:0e:71","172.20.0.3","172.20.0.2","TCP","[TCP Dup ACK 64#1] 54048 → 4433 [ACK] Seq=1 Ack=1 Win=64256 Len=0 TSval=2188430557 TSecr=2883001487"
"66","2.333326706","2189","c2:ea:ec:4e:9c:d6","2a:7b:b7:64:0e:71","172.20.0.3","172.20.0.2","TLSv1.2","Client Hello"
"67","2.333343688","66","2a:7b:b7:64:0e:71","c2:ea:ec:4e:9c:d6","172.20.0.2","172.20.0.3","TCP","4433 → 54048 [ACK] Seq=1 Ack=2124 Win=64128 Len=0 TSval=2883001487 TSecr=2188430557"
"68","2.345763948","1514","2a:7b:b7:64:0e:71","c2:ea:ec:4e:9c:d6","172.20.0.2","172.20.0.3","SSL",""
"69","2.345812354","66","c2:ea:ec:4e:9c:d6","2a:7b:b7:64:0e:71","172.20.0.3","172.20.0.2","TCP","54048 → 4433 [ACK] Seq=2124 Ack=1449 Win=64128 Len=0 TSval=2188430569 TSecr=2883001499"
"70","2.549138569","1229","2a:7b:b7:64:0e:71","c2:ea:ec:4e:9c:d6","172.20.0.2","172.20.0.3","TLSv1.3","Server Hello, Change Cipher Spec, Application Data, Application Data, Application Data, Application Data"
"71","2.549193002","66","c2:ea:ec:4e:9c:d6","2a:7b:b7:64:0e:71","172.20.0.3","172.20.0.2","TCP","54048 → 4433 [ACK] Seq=2124 Ack=2612 Win=64128 Len=0 TSval=2188430773 TSecr=2883001703"
"72","2.558810104","146","c2:ea:ec:4e:9c:d6","2a:7b:b7:64:0e:71","172.20.0.3","172.20.0.2","TLSv1.3","Change Cipher Spec, Application Data"
"73","2.558904584","66","c2:ea:ec:4e:9c:d6","2a:7b:b7:64:0e:71","172.20.0.3","172.20.0.2","TCP","54048 → 4433 [RST, ACK] Seq=2204 Ack=2612 Win=64128 Len=0 TSval=2188430782 TSecr=2883001703"
"74","2.576799138","74","c2:ea:ec:4e:9c:d6","2a:7b:b7:64:0e:71","172.20.0.3","172.20.0.2","TCP","54050 → 4433 [SYN] Seq=0 Win=64240 Len=0 MSS=1460 SACK_PERM TSval=2188430800 TSecr=0 WS=128"
"75","2.576833209","74","2a:7b:b7:64:0e:71","c2:ea:ec:4e:9c:d6","172.20.0.2","172.20.0.3","TCP","4433 → 54050 [SYN, ACK] Seq=0 Ack=1 Win=65160 Len=0 MSS=1460 SACK_PERM TSval=2883001730 TSecr=2188430800 WS=128"
"76","2.576855566","66","c2:ea:ec:4e:9c:d6","2a:7b:b7:64:0e:71","172.20.0.3","172.20.0.2","TCP","54050 → 4433 [ACK] Seq=1 Ack=1 Win=64256 Len=0 TSval=2188430800 TSecr=2883001730"
"77","2.577028701","2189","c2:ea:ec:4e:9c:d6","2a:7b:b7:64:0e:71","172.20.0.3","172.20.0.2","TLSv1.2","Client Hello"
"78","2.577049673","66","2a:7b:b7:64:0e:71","c2:ea:ec:4e:9c:d6","172.20.0.2","172.20.0.3","TCP","4433 → 54050 [ACK] Seq=1 Ack=2124 Win=64128 Len=0 TSval=2883001730 TSecr=2188430800"
"79","2.589084162","2676","2a:7b:b7:64:0e:71","c2:ea:ec:4e:9c:d6","172.20.0.2","172.20.0.3","TLSv1.3","Server Hello, Change Cipher Spec, Application Data, Application Data, Application Data, Application Data"
"80","2.589149135","66","c2:ea:ec:4e:9c:d6","2a:7b:b7:64:0e:71","172.20.0.3","172.20.0.2","TCP","54050 → 4433 [ACK] Seq=2124 Ack=2611 Win=64128 Len=0 TSval=2188430813 TSecr=2883001742"
"81","2.598840794","146","c2:ea:ec:4e:9c:d6","2a:7b:b7:64:0e:71","172.20.0.3","172.20.0.2","TLSv1.3","Change Cipher Spec, Application Data"
"82","2.598925709","66","c2:ea:ec:4e:9c:d6","2a:7b:b7:64:0e:71","172.20.0.3","172.20.0.2","TCP","54050 → 4433 [RST, ACK] Seq=2204 Ack=2611 Win=64128 Len=0 TSval=2188430822 TSecr=2883001742"
"83","2.616546544","74","c2:ea:ec:4e:9c:d6","2a:7b:b7:64:0e:71","172.20.0.3","172.20.0.2","TCP","54058 → 4433 [SYN] Seq=0 Win=64240 Len=0 MSS=1460 SACK_PERM TSval=2188430840 TSecr=0 WS=128"
"84","3.677197225","74","c2:ea:ec:4e:9c:d6","2a:7b:b7:64:0e:71","172.20.0.3","172.20.0.2","TCP","[TCP Retransmission] 54058 → 4433 [SYN] Seq=0 Win=64240 Len=0 MSS=1460 SACK_PERM TSval=2188431901 TSecr=0 WS=128"
"85","3.677210537","74","2a:7b:b7:64:0e:71","c2:ea:ec:4e:9c:d6","172.20.0.2","172.20.0.3","TCP","4433 → 54058 [SYN, ACK] Seq=0 Ack=1 Win=65160 Len=0 MSS=1460 SACK_PERM TSval=2883002831 TSecr=2188430840 WS=128"
"86","3.677243106","66","c2:ea:ec:4e:9c:d6","2a:7b:b7:64:0e:71","172.20.0.3","172.20.0.2","TCP","54058 → 4433 [ACK] Seq=1 Ack=1 Win=64256 Len=0 TSval=2188431901 TSecr=2883002831"
"87","3.677340311","2189","c2:ea:ec:4e:9c:d6","2a:7b:b7:64:0e:71","172.20.0.3","172.20.0.2","TLSv1.2","Client Hello"
"88","3.677347306","66","2a:7b:b7:64:0e:71","c2:ea:ec:4e:9c:d6","172.20.0.2","172.20.0.3","TCP","4433 → 54058 [ACK] Seq=1 Ack=2124 Win=64128 Len=0 TSval=2883002831 TSecr=2188431901"
"89","3.689414092","1514","2a:7b:b7:64:0e:71","c2:ea:ec:4e:9c:d6","172.20.0.2","172.20.0.3","SSL",""
"90","3.689459711","66","c2:ea:ec:4e:9c:d6","2a:7b:b7:64:0e:71","172.20.0.3","172.20.0.2","TCP","54058 → 4433 [ACK] Seq=2124 Ack=1449 Win=64128 Len=0 TSval=2188431913 TSecr=2883002843"
"91","3.689468737","1229","2a:7b:b7:64:0e:71","c2:ea:ec:4e:9c:d6","172.20.0.2","172.20.0.3","TLSv1.3","Server Hello, Change Cipher Spec, Application Data, Application Data, Application Data, Application Data"
"92","3.689474288","66","c2:ea:ec:4e:9c:d6","2a:7b:b7:64:0e:71","172.20.0.3","172.20.0.2","TCP","54058 → 4433 [ACK] Seq=2124 Ack=2612 Win=64128 Len=0 TSval=2188431913 TSecr=2883002843"
"93","3.698755076","146","c2:ea:ec:4e:9c:d6","2a:7b:b7:64:0e:71","172.20.0.3","172.20.0.2","TLSv1.3","Change Cipher Spec, Application Data"
"94","3.698839603","66","c2:ea:ec:4e:9c:d6","2a:7b:b7:64:0e:71","172.20.0.3","172.20.0.2","TCP","54058 → 4433 [RST, ACK] Seq=2204 Ack=2612 Win=64128 Len=0 TSval=2188431922 TSecr=2883002843"
"95","3.715919326","74","c2:ea:ec:4e:9c:d6","2a:7b:b7:64:0e:71","172.20.0.3","172.20.0.2","TCP","54066 → 4433 [SYN] Seq=0 Win=64240 Len=0 MSS=1460 SACK_PERM TSval=2188431939 TSecr=0 WS=128"
"96","3.715950312","74","2a:7b:b7:64:0e:71","c2:ea:ec:4e:9c:d6","172.20.0.2","172.20.0.3","TCP","4433 → 54066 [SYN, ACK] Seq=0 Ack=1 Win=65160 Len=0 MSS=1460 SACK_PERM TSval=2883002869 TSecr=2188431939 WS=128"
"97","3.715970003","66","c2:ea:ec:4e:9c:d6","2a:7b:b7:64:0e:71","172.20.0.3","172.20.0.2","TCP","54066 → 4433 [ACK] Seq=1 Ack=1 Win=64256 Len=0 TSval=2188431939 TSecr=2883002869"
"98","3.716026279","2189","c2:ea:ec:4e:9c:d6","2a:7b:b7:64:0e:71","172.20.0.3","172.20.0.2","TLSv1.2","Client Hello"
"99","3.716033541","66","2a:7b:b7:64:0e:71","c2:ea:ec:4e:9c:d6","172.20.0.2","172.20.0.3","TCP","4433 → 54066 [ACK] Seq=1 Ack=2124 Win=64128 Len=0 TSval=2883002869 TSecr=2188431939"
"100","3.728103972","2677","2a:7b:b7:64:0e:71","c2:ea:ec:4e:9c:d6","172.20.0.2","172.20.0.3","TLSv1.3","Server Hello, Change Cipher Spec, Application Data, Application Data, Application Data, Application Data"
"101","3.728148138","66","c2:ea:ec:4e:9c:d6","2a:7b:b7:64:0e:71","172.20.0.3","172.20.0.2","TCP","54066 → 4433 [ACK] Seq=2124 Ack=2612 Win=64128 Len=0 TSval=2188431952 TSecr=2883002881"
"102","3.737120091","146","c2:ea:ec:4e:9c:d6","2a:7b:b7:64:0e:71","172.20.0.3","172.20.0.2","TLSv1.3","Change Cipher Spec, Application Data"
"103","3.737184668","66","c2:ea:ec:4e:9c:d6","2a:7b:b7:64:0e:71","172.20.0.3","172.20.0.2","TCP","54066 → 4433 [RST, ACK] Seq=2204 Ack=2612 Win=64128 Len=0 TSval=2188431961 TSecr=2883002881"
"104","3.753626155","74","c2:ea:ec:4e:9c:d6","2a:7b:b7:64:0e:71","172.20.0.3","172.20.0.2","TCP","54068 → 4433 [SYN] Seq=0 Win=64240 Len=0 MSS=1460 SACK_PERM TSval=2188431977 TSecr=0 WS=128"
"105","3.753653270","74","2a:7b:b7:64:0e:71","c2:ea:ec:4e:9c:d6","172.20.0.2","172.20.0.3","TCP","4433 → 54068 [SYN, ACK] Seq=0 Ack=1 Win=65160 Len=0 MSS=1460 SACK_PERM TSval=2883002907 TSecr=2188431977 WS=128"
"106","3.753672330","66","c2:ea:ec:4e:9c:d6","2a:7b:b7:64:0e:71","172.20.0.3","172.20.0.2","TCP","54068 → 4433 [ACK] Seq=1 Ack=1 Win=64256 Len=0 TSval=2188431977 TSecr=2883002907"
"107","3.753718176","2189","c2:ea:ec:4e:9c:d6","2a:7b:b7:64:0e:71","172.20.0.3","172.20.0.2","TLSv1.2","Client Hello"
"108","3.753725405","66","2a:7b:b7:64:0e:71","c2:ea:ec:4e:9c:d6","172.20.0.2","172.20.0.3","TCP","4433 → 54068 [ACK] Seq=1 Ack=2124 Win=64128 Len=0 TSval=2883002907 TSecr=2188431977"
"109","3.765404679","2676","2a:7b:b7:64:0e:71","c2:ea:ec:4e:9c:d6","172.20.0.2","172.20.0.3","TLSv1.3","Server Hello, Change Cipher Spec, Application Data, Application Data, Application Data, Application Data"
"110","3.765433350","66","c2:ea:ec:4e:9c:d6","2a:7b:b7:64:0e:71","172.20.0.3","172.20.0.2","TCP","54068 → 4433 [ACK] Seq=2124 Ack=2611 Win=64128 Len=0 TSval=2188431989 TSecr=2883002919"
"111","3.774297093","146","c2:ea:ec:4e:9c:d6","2a:7b:b7:64:0e:71","172.20.0.3","172.20.0.2","TLSv1.3","Change Cipher Spec, Application Data"
"112","3.774359339","66","c2:ea:ec:4e:9c:d6","2a:7b:b7:64:0e:71","172.20.0.3","172.20.0.2","TCP","54068 → 4433 [RST, ACK] Seq=2204 Ack=2611 Win=64128 Len=0 TSval=2188431998 TSecr=2883002919"
"113","3.791172652","74","c2:ea:ec:4e:9c:d6","2a:7b:b7:64:0e:71","172.20.0.3","172.20.0.2","TCP","54074 → 4433 [SYN] Seq=0 Win=64240 Len=0 MSS=1460 SACK_PERM TSval=2188432015 TSecr=0 WS=128"
"114","3.791199745","74","2a:7b:b7:64:0e:71","c2:ea:ec:4e:9c:d6","172.20.0.2","172.20.0.3","TCP","4433 → 54074 [SYN, ACK] Seq=0 Ack=1 Win=65160 Len=0 MSS=1460 SACK_PERM TSval=2883002945 TSecr=2188432015 WS=128"
"115","3.791220249","66","c2:ea:ec:4e:9c:d6","2a:7b:b7:64:0e:71","172.20.0.3","172.20.0.2","TCP","54074 → 4433 [ACK] Seq=1 Ack=1 Win=64256 Len=0 TSval=2188432015 TSecr=2883002945"
"116","3.791270731","2189","c2:ea:ec:4e:9c:d6","2a:7b:b7:64:0e:71","172.20.0.3","172.20.0.2","TLSv1.2","Client Hello"
"117","3.791277571","66","2a:7b:b7:64:0e:71","c2:ea:ec:4e:9c:d6","172.20.0.2","172.20.0.3","TCP","4433 → 54074 [ACK] Seq=1 Ack=2124 Win=64128 Len=0 TSval=2883002945 TSecr=2188432015"
"118","3.803809514","2676","2a:7b:b7:64:0e:71","c2:ea:ec:4e:9c:d6","172.20.0.2","172.20.0.3","TLSv1.3","Server Hello, Change Cipher Spec, Application Data, Application Data, Application Data, Application Data"
"119","3.803863169","66","c2:ea:ec:4e:9c:d6","2a:7b:b7:64:0e:71","172.20.0.3","172.20.0.2","TCP","54074 → 4433 [ACK] Seq=2124 Ack=2611 Win=64128 Len=0 TSval=2188432027 TSecr=2883002957"
"120","3.813059317","146","c2:ea:ec:4e:9c:d6","2a:7b:b7:64:0e:71","172.20.0.3","172.20.0.2","TLSv1.3","Change Cipher Spec, Application Data"
"121","3.813148508","66","c2:ea:ec:4e:9c:d6","2a:7b:b7:64:0e:71","172.20.0.3","172.20.0.2","TCP","54074 → 4433 [RST, ACK] Seq=2204 Ack=2611 Win=64128 Len=0 TSval=2188432037 TSecr=2883002957"
"122","3.829718736","74","c2:ea:ec:4e:9c:d6","2a:7b:b7:64:0e:71","172.20.0.3","172.20.0.2","TCP","54090 → 4433 [SYN] Seq=0 Win=64240 Len=0 MSS=1460 SACK_PERM TSval=2188432053 TSecr=0 WS=128"
"123","3.829745847","74","2a:7b:b7:64:0e:71","c2:ea:ec:4e:9c:d6","172.20.0.2","172.20.0.3","TCP","4433 → 54090 [SYN, ACK] Seq=0 Ack=1 Win=65160 Len=0 MSS=1460 SACK_PERM TSval=2883002983 TSecr=2188432053 WS=128"
"124","3.829764891","66","c2:ea:ec:4e:9c:d6","2a:7b:b7:64:0e:71","172.20.0.3","172.20.0.2","TCP","54090 → 4433 [ACK] Seq=1 Ack=1 Win=64256 Len=0 TSval=2188432053 TSecr=2883002983"
"125","3.829808253","2189","c2:ea:ec:4e:9c:d6","2a:7b:b7:64:0e:71","172.20.0.3","172.20.0.2","TLSv1.2","Client Hello"
"126","3.829814775","66","2a:7b:b7:64:0e:71","c2:ea:ec:4e:9c:d6","172.20.0.2","172.20.0.3","TCP","4433 → 54090 [ACK] Seq=1 Ack=2124 Win=64128 Len=0 TSval=2883002983 TSecr=2188432053"
"127","3.841622172","2676","2a:7b:b7:64:0e:71","c2:ea:ec:4e:9c:d6","172.20.0.2","172.20.0.3","TLSv1.3","Server Hello, Change Cipher Spec, Application Data, Application Data, Application Data, Application Data"
"128","3.841674756","66","c2:ea:ec:4e:9c:d6","2a:7b:b7:64:0e:71","172.20.0.3","172.20.0.2","TCP","54090 → 4433 [ACK] Seq=2124 Ack=2611 Win=64128 Len=0 TSval=2188432065 TSecr=2883002995"
"129","3.850827641","146","c2:ea:ec:4e:9c:d6","2a:7b:b7:64:0e:71","172.20.0.3","172.20.0.2","TLSv1.3","Change Cipher Spec, Application Data"
"130","3.850902645","66","c2:ea:ec:4e:9c:d6","2a:7b:b7:64:0e:71","172.20.0.3","172.20.0.2","TCP","54090 → 4433 [RST, ACK] Seq=2204 Ack=2611 Win=64128 Len=0 TSval=2188432074 TSecr=2883002995"
"131","3.867710359","74","c2:ea:ec:4e:9c:d6","2a:7b:b7:64:0e:71","172.20.0.3","172.20.0.2","TCP","54106 → 4433 [SYN] Seq=0 Win=64240 Len=0 MSS=1460 SACK_PERM TSval=2188432091 TSecr=0 WS=128"
"132","3.867737988","74","2a:7b:b7:64:0e:71","c2:ea:ec:4e:9c:d6","172.20.0.2","172.20.0.3","TCP","4433 → 54106 [SYN, ACK] Seq=0 Ack=1 Win=65160 Len=0 MSS=1460 SACK_PERM TSval=2883003021 TSecr=2188432091 WS=128"
"133","3.867757868","66","c2:ea:ec:4e:9c:d6","2a:7b:b7:64:0e:71","172.20.0.3","172.20.0.2","TCP","54106 → 4433 [ACK] Seq=1 Ack=1 Win=64256 Len=0 TSval=2188432091 TSecr=2883003021"
"134","3.867814980","2189","c2:ea:ec:4e:9c:d6","2a:7b:b7:64:0e:71","172.20.0.3","172.20.0.2","TLSv1.2","Client Hello"
"135","3.867820545","66","2a:7b:b7:64:0e:71","c2:ea:ec:4e:9c:d6","172.20.0.2","172.20.0.3","TCP","4433 → 54106 [ACK] Seq=1 Ack=2124 Win=64128 Len=0 TSval=2883003021 TSecr=2188432091"
"136","3.879653821","2677","2a:7b:b7:64:0e:71","c2:ea:ec:4e:9c:d6","172.20.0.2","172.20.0.3","TLSv1.3","Server Hello, Change Cipher Spec, Application Data, Application Data, Application Data, Application Data"
"137","3.879703822","66","c2:ea:ec:4e:9c:d6","2a:7b:b7:64:0e:71","172.20.0.3","172.20.0.2","TCP","54106 → 4433 [ACK] Seq=2124 Ack=2612 Win=64128 Len=0 TSval=2188432103 TSecr=2883003033"
"138","3.889018263","146","c2:ea:ec:4e:9c:d6","2a:7b:b7:64:0e:71","172.20.0.3","172.20.0.2","TLSv1.3","Change Cipher Spec, Application Data"
"139","3.889115771","66","c2:ea:ec:4e:9c:d6","2a:7b:b7:64:0e:71","172.20.0.3","172.20.0.2","TCP","54106 → 4433 [RST, ACK] Seq=2204 Ack=2612 Win=64128 Len=0 TSval=2188432113 TSecr=2883003033"
"140","3.906842465","74","c2:ea:ec:4e:9c:d6","2a:7b:b7:64:0e:71","172.20.0.3","172.20.0.2","TCP","54108 → 4433 [SYN] Seq=0 Win=64240 Len=0 MSS=1460 SACK_PERM TSval=2188432130 TSecr=0 WS=128"
"141","3.906880979","74","2a:7b:b7:64:0e:71","c2:ea:ec:4e:9c:d6","172.20.0.2","172.20.0.3","TCP","4433 → 54108 [SYN, ACK] Seq=0 Ack=1 Win=65160 Len=0 MSS=1460 SACK_PERM TSval=2883003060 TSecr=2188432130 WS=128"
"142","3.906902370","66","c2:ea:ec:4e:9c:d6","2a:7b:b7:64:0e:71","172.20.0.3","172.20.0.2","TCP","54108 → 4433 [ACK] Seq=1 Ack=1 Win=64256 Len=0 TSval=2188432130 TSecr=2883003060"
"143","3.906953710","2189","c2:ea:ec:4e:9c:d6","2a:7b:b7:64:0e:71","172.20.0.3","172.20.0.2","TLSv1.2","Client Hello"
"144","3.906960691","66","2a:7b:b7:64:0e:71","c2:ea:ec:4e:9c:d6","172.20.0.2","172.20.0.3","TCP","4433 → 54108 [ACK] Seq=1 Ack=2124 Win=64128 Len=0 TSval=2883003060 TSecr=2188432130"
"145","3.918840873","2676","2a:7b:b7:64:0e:71","c2:ea:ec:4e:9c:d6","172.20.0.2","172.20.0.3","TLSv1.3","Server Hello, Change Cipher Spec, Application Data, Application Data, Application Data, Application Data"
"146","3.918890231","66","c2:ea:ec:4e:9c:d6","2a:7b:b7:64:0e:71","172.20.0.3","172.20.0.2","TCP","54108 → 4433 [ACK] Seq=2124 Ack=2611 Win=64128 Len=0 TSval=2188432142 TSecr=2883003072"
"147","3.928135043","146","c2:ea:ec:4e:9c:d6","2a:7b:b7:64:0e:71","172.20.0.3","172.20.0.2","TLSv1.3","Change Cipher Spec, Application Data"
"148","3.928222527","66","c2:ea:ec:4e:9c:d6","2a:7b:b7:64:0e:71","172.20.0.3","172.20.0.2","TCP","54108 → 4433 [RST, ACK] Seq=2204 Ack=2611 Win=64128 Len=0 TSval=2188432152 TSecr=2883003072"
"149","3.944725131","74","c2:ea:ec:4e:9c:d6","2a:7b:b7:64:0e:71","172.20.0.3","172.20.0.2","TCP","54122 → 4433 [SYN] Seq=0 Win=64240 Len=0 MSS=1460 SACK_PERM TSval=2188432168 TSecr=0 WS=128"
"150","3.944750805","74","2a:7b:b7:64:0e:71","c2:ea:ec:4e:9c:d6","172.20.0.2","172.20.0.3","TCP","4433 → 54122 [SYN, ACK] Seq=0 Ack=1 Win=65160 Len=0 MSS=1460 SACK_PERM TSval=2883003098 TSecr=2188432168 WS=128"
"151","3.944769236","66","c2:ea:ec:4e:9c:d6","2a:7b:b7:64:0e:71","172.20.0.3","172.20.0.2","TCP","54122 → 4433 [ACK] Seq=1 Ack=1 Win=64256 Len=0 TSval=2188432168 TSecr=2883003098"
"152","3.944815910","2189","c2:ea:ec:4e:9c:d6","2a:7b:b7:64:0e:71","172.20.0.3","172.20.0.2","TLSv1.2","Client Hello"
"153","3.948124768","741","c2:ea:ec:4e:9c:d6","2a:7b:b7:64:0e:71","172.20.0.3","172.20.0.2","TCP","[TCP Retransmission] 54122 → 4433 [PSH, ACK] Seq=1449 Ack=1 Win=64256 Len=675 TSval=2188432172 TSecr=2883003098"
"154","3.948132008","78","2a:7b:b7:64:0e:71","c2:ea:ec:4e:9c:d6","172.20.0.2","172.20.0.3","TCP","4433 → 54122 [ACK] Seq=1 Ack=2124 Win=64128 Len=0 TSval=2883003102 TSecr=2188432172 SLE=1449 SRE=2124"
"155","3.956885882","2676","2a:7b:b7:64:0e:71","c2:ea:ec:4e:9c:d6","172.20.0.2","172.20.0.3","TLSv1.3","Server Hello, Change Cipher Spec, Application Data, Application Data, Application Data, Application Data"
"156","3.956920474","66","c2:ea:ec:4e:9c:d6","2a:7b:b7:64:0e:71","172.20.0.3","172.20.0.2","TCP","54122 → 4433 [ACK] Seq=2124 Ack=2611 Win=64128 Len=0 TSval=2188432180 TSecr=2883003110"
"157","3.966083943","146","c2:ea:ec:4e:9c:d6","2a:7b:b7:64:0e:71","172.20.0.3","172.20.0.2","TLSv1.3","Change Cipher Spec, Application Data"
"158","3.966174405","66","c2:ea:ec:4e:9c:d6","2a:7b:b7:64:0e:71","172.20.0.3","172.20.0.2","TCP","54122 → 4433 [RST, ACK] Seq=2204 Ack=2611 Win=64128 Len=0 TSval=2188432190 TSecr=2883003110"
"159","3.982857616","74","c2:ea:ec:4e:9c:d6","2a:7b:b7:64:0e:71","172.20.0.3","172.20.0.2","TCP","54128 → 4433 [SYN] Seq=0 Win=64240 Len=0 MSS=1460 SACK_PERM TSval=2188432206 TSecr=0 WS=128"
"160","5.021182072","74","2a:7b:b7:64:0e:71","c2:ea:ec:4e:9c:d6","172.20.0.2","172.20.0.3","TCP","4433 → 54128 [SYN, ACK] Seq=0 Ack=1 Win=65160 Len=0 MSS=1460 SACK_PERM TSval=2883004175 TSecr=2188432206 WS=128"
"161","5.021223114","74","c2:ea:ec:4e:9c:d6","2a:7b:b7:64:0e:71","172.20.0.3","172.20.0.2","TCP","[TCP Retransmission] 54128 → 4433 [SYN] Seq=0 Win=64240 Len=0 MSS=1460 SACK_PERM TSval=2188433245 TSecr=0 WS=128"
"162","5.021283653","66","c2:ea:ec:4e:9c:d6","2a:7b:b7:64:0e:71","172.20.0.3","172.20.0.2","TCP","54128 → 4433 [ACK] Seq=1 Ack=1 Win=64256 Len=0 TSval=2188433245 TSecr=2883004175"
"163","5.021386103","2189","c2:ea:ec:4e:9c:d6","2a:7b:b7:64:0e:71","172.20.0.3","172.20.0.2","TLSv1.2","Client Hello"
"164","5.021401143","66","2a:7b:b7:64:0e:71","c2:ea:ec:4e:9c:d6","172.20.0.2","172.20.0.3","TCP","4433 → 54128 [ACK] Seq=1 Ack=2124 Win=64128 Len=0 TSval=2883004175 TSecr=2188433245"
"165","5.237144825","1229","2a:7b:b7:64:0e:71","c2:ea:ec:4e:9c:d6","172.20.0.2","172.20.0.3","SSL","[TCP Previous segment not captured] , Continuation Data"
"166","5.237212384","78","c2:ea:ec:4e:9c:d6","2a:7b:b7:64:0e:71","172.20.0.3","172.20.0.2","TCP","[TCP Dup ACK 162#1] 54128 → 4433 [ACK] Seq=2124 Ack=1 Win=64256 Len=0 TSval=2188433461 TSecr=2883004175 SLE=1449 SRE=2612"
"167","5.445147823","1514","2a:7b:b7:64:0e:71","c2:ea:ec:4e:9c:d6","172.20.0.2","172.20.0.3","TCP","[TCP Retransmission] 4433 → 54128 [ACK] Seq=1 Ack=2124 Win=64128 Len=1448 TSval=2883004599 TSecr=2188433461"
"168","5.445218826","66","c2:ea:ec:4e:9c:d6","2a:7b:b7:64:0e:71","172.20.0.3","172.20.0.2","TCP","54128 → 4433 [ACK] Seq=2124 Ack=2612 Win=64128 Len=0 TSval=2188433669 TSecr=2883004599"
"169","5.454557398","146","c2:ea:ec:4e:9c:d6","2a:7b:b7:64:0e:71","172.20.0.3","172.20.0.2","TLSv1.2","Change Cipher Spec, Application Data"
"170","5.454638073","66","c2:ea:ec:4e:9c:d6","2a:7b:b7:64:0e:71","172.20.0.3","172.20.0.2","TCP","54128 → 4433 [RST, ACK] Seq=2204 Ack=2612 Win=64128 Len=0 TSval=2188433678 TSecr=2883004599"
"171","5.471587398","74","c2:ea:ec:4e:9c:d6","2a:7b:b7:64:0e:71","172.20.0.3","172.20.0.2","TCP","54134 → 4433 [SYN] Seq=0 Win=64240 Len=0 MSS=1460 SACK_PERM TSval=2188433695 TSecr=0 WS=128"
"172","6.493211291","74","c2:ea:ec:4e:9c:d6","2a:7b:b7:64:0e:71","172.20.0.3","172.20.0.2","TCP","[TCP Retransmission] 54134 → 4433 [SYN] Seq=0 Win=64240 Len=0 MSS=1460 SACK_PERM TSval=2188434717 TSecr=0 WS=128"
"173","6.493226272","74","2a:7b:b7:64:0e:71","c2:ea:ec:4e:9c:d6","172.20.0.2","172.20.0.3","TCP","4433 → 54134 [SYN, ACK] Seq=0 Ack=1 Win=65160 Len=0 MSS=1460 SACK_PERM TSval=2883005647 TSecr=2188433695 WS=128"
"174","6.493264459","66","c2:ea:ec:4e:9c:d6","2a:7b:b7:64:0e:71","172.20.0.3","172.20.0.2","TCP","54134 → 4433 [ACK] Seq=1 Ack=1 Win=64256 Len=0 TSval=2188434717 TSecr=2883005647"
"175","6.493358719","2189","c2:ea:ec:4e:9c:d6","2a:7b:b7:64:0e:71","172.20.0.3","172.20.0.2","TLSv1.2","Client Hello"
"176","6.493365767","66","2a:7b:b7:64:0e:71","c2:ea:ec:4e:9c:d6","172.20.0.2","172.20.0.3","TCP","4433 → 54134 [ACK] Seq=1 Ack=2124 Win=64128 Len=0 TSval=2883005647 TSecr=2188434717"
"177","6.709144233","1228","2a:7b:b7:64:0e:71","c2:ea:ec:4e:9c:d6","172.20.0.2","172.20.0.3","SSL","[TCP Previous segment not captured] , Continuation Data"
"178","6.709211747","78","c2:ea:ec:4e:9c:d6","2a:7b:b7:64:0e:71","172.20.0.3","172.20.0.2","TCP","[TCP Dup ACK 174#1] 54134 → 4433 [ACK] Seq=2124 Ack=1 Win=64256 Len=0 TSval=2188434933 TSecr=2883005647 SLE=1449 SRE=2611"
"179","6.709222318","1514","2a:7b:b7:64:0e:71","c2:ea:ec:4e:9c:d6","172.20.0.2","172.20.0.3","TCP","[TCP Retransmission] 4433 → 54134 [ACK] Seq=1 Ack=2124 Win=64128 Len=1448 TSval=2883005863 TSecr=2188434933"
"180","6.709245957","66","c2:ea:ec:4e:9c:d6","2a:7b:b7:64:0e:71","172.20.0.3","172.20.0.2","TCP","54134 → 4433 [ACK] Seq=2124 Ack=2611 Win=64128 Len=0 TSval=2188434933 TSecr=2883005863"
"181","6.718686733","146","c2:ea:ec:4e:9c:d6","2a:7b:b7:64:0e:71","172.20.0.3","172.20.0.2","TLSv1.2","Change Cipher Spec, Application Data"
"182","6.718763172","66","c2:ea:ec:4e:9c:d6","2a:7b:b7:64:0e:71","172.20.0.3","172.20.0.2","TCP","54134 → 4433 [RST, ACK] Seq=2204 Ack=2611 Win=64128 Len=0 TSval=2188434942 TSecr=2883005863"
"183","6.735768670","74","c2:ea:ec:4e:9c:d6","2a:7b:b7:64:0e:71","172.20.0.3","172.20.0.2","TCP","54138 → 4433 [SYN] Seq=0 Win=64240 Len=0 MSS=1460 SACK_PERM TSval=2188434959 TSecr=0 WS=128"
"184","6.735796281","74","2a:7b:b7:64:0e:71","c2:ea:ec:4e:9c:d6","172.20.0.2","172.20.0.3","TCP","4433 → 54138 [SYN, ACK] Seq=0 Ack=1 Win=65160 Len=0 MSS=1460 SACK_PERM TSval=2883005889 TSecr=2188434959 WS=128"
"185","6.735815911","66","c2:ea:ec:4e:9c:d6","2a:7b:b7:64:0e:71","172.20.0.3","172.20.0.2","TCP","54138 → 4433 [ACK] Seq=1 Ack=1 Win=64256 Len=0 TSval=2188434959 TSecr=2883005889"
"186","6.735861556","2189","c2:ea:ec:4e:9c:d6","2a:7b:b7:64:0e:71","172.20.0.3","172.20.0.2","TLSv1.2","Client Hello"
"187","6.739140519","741","c2:ea:ec:4e:9c:d6","2a:7b:b7:64:0e:71","172.20.0.3","172.20.0.2","TCP","[TCP Retransmission] 54138 → 4433 [PSH, ACK] Seq=1449 Ack=1 Win=64256 Len=675 TSval=2188434963 TSecr=2883005889"
"188","6.739153568","78","2a:7b:b7:64:0e:71","c2:ea:ec:4e:9c:d6","172.20.0.2","172.20.0.3","TCP","4433 → 54138 [ACK] Seq=1 Ack=2124 Win=64128 Len=0 TSval=2883005893 TSecr=2188434963 SLE=1449 SRE=2124"
"189","6.747628424","2677","2a:7b:b7:64:0e:71","c2:ea:ec:4e:9c:d6","172.20.0.2","172.20.0.3","TLSv1.3","Server Hello, Change Cipher Spec, Application Data, Application Data, Application Data, Application Data"
"190","6.747664249","66","c2:ea:ec:4e:9c:d6","2a:7b:b7:64:0e:71","172.20.0.3","172.20.0.2","TCP","54138 → 4433 [ACK] Seq=2124 Ack=2612 Win=64128 Len=0 TSval=2188434971 TSecr=2883005901"
"191","6.756999860","146","c2:ea:ec:4e:9c:d6","2a:7b:b7:64:0e:71","172.20.0.3","172.20.0.2","TLSv1.3","Change Cipher Spec, Application Data"
"192","6.757085363","66","c2:ea:ec:4e:9c:d6","2a:7b:b7:64:0e:71","172.20.0.3","172.20.0.2","TCP","54138 → 4433 [RST, ACK] Seq=2204 Ack=2612 Win=64128 Len=0 TSval=2188434980 TSecr=2883005901"
"193","6.774034018","74","c2:ea:ec:4e:9c:d6","2a:7b:b7:64:0e:71","172.20.0.3","172.20.0.2","TCP","54150 → 4433 [SYN] Seq=0 Win=64240 Len=0 MSS=1460 SACK_PERM TSval=2188434997 TSecr=0 WS=128"
"194","6.774061580","74","2a:7b:b7:64:0e:71","c2:ea:ec:4e:9c:d6","172.20.0.2","172.20.0.3","TCP","4433 → 54150 [SYN, ACK] Seq=0 Ack=1 Win=65160 Len=0 MSS=1460 SACK_PERM TSval=2883005927 TSecr=2188434997 WS=128"
"195","6.774081096","66","c2:ea:ec:4e:9c:d6","2a:7b:b7:64:0e:71","172.20.0.3","172.20.0.2","TCP","54150 → 4433 [ACK] Seq=1 Ack=1 Win=64256 Len=0 TSval=2188434997 TSecr=2883005927"
"196","6.774140566","2189","c2:ea:ec:4e:9c:d6","2a:7b:b7:64:0e:71","172.20.0.3","172.20.0.2","TLSv1.2","Client Hello"
"197","6.774145614","66","2a:7b:b7:64:0e:71","c2:ea:ec:4e:9c:d6","172.20.0.2","172.20.0.3","TCP","4433 → 54150 [ACK] Seq=1 Ack=2124 Win=64128 Len=0 TSval=2883005928 TSecr=2188434998"
"198","6.785924444","2677","2a:7b:b7:64:0e:71","c2:ea:ec:4e:9c:d6","172.20.0.2","172.20.0.3","TLSv1.3","Server Hello, Change Cipher Spec, Application Data, Application Data, Application Data, Application Data"
"199","6.785993748","66","c2:ea:ec:4e:9c:d6","2a:7b:b7:64:0e:71","172.20.0.3","172.20.0.2","TCP","54150 → 4433 [ACK] Seq=2124 Ack=2612 Win=64128 Len=0 TSval=2188435009 TSecr=2883005939"
"200","6.795495968","146","c2:ea:ec:4e:9c:d6","2a:7b:b7:64:0e:71","172.20.0.3","172.20.0.2","TLSv1.3","Change Cipher Spec, Application Data"
"201","6.795583982","66","c2:ea:ec:4e:9c:d6","2a:7b:b7:64:0e:71","172.20.0.3","172.20.0.2","TCP","54150 → 4433 [RST, ACK] Seq=2204 Ack=2612 Win=64128 Len=0 TSval=2188435019 TSecr=2883005939"
"202","6.812360405","74","c2:ea:ec:4e:9c:d6","2a:7b:b7:64:0e:71","172.20.0.3","172.20.0.2","TCP","54162 → 4433 [SYN] Seq=0 Win=64240 Len=0 MSS=1460 SACK_PERM TSval=2188435036 TSecr=0 WS=128"
"203","6.812388791","74","2a:7b:b7:64:0e:71","c2:ea:ec:4e:9c:d6","172.20.0.2","172.20.0.3","TCP","4433 → 54162 [SYN, ACK] Seq=0 Ack=1 Win=65160 Len=0 MSS=1460 SACK_PERM TSval=2883005966 TSecr=2188435036 WS=128"
"204","6.812407926","66","c2:ea:ec:4e:9c:d6","2a:7b:b7:64:0e:71","172.20.0.3","172.20.0.2","TCP","54162 → 4433 [ACK] Seq=1 Ack=1 Win=64256 Len=0 TSval=2188435036 TSecr=2883005966"
"205","6.812453736","2189","c2:ea:ec:4e:9c:d6","2a:7b:b7:64:0e:71","172.20.0.3","172.20.0.2","TLSv1.2","Client Hello"
"206","6.812460458","66","2a:7b:b7:64:0e:71","c2:ea:ec:4e:9c:d6","172.20.0.2","172.20.0.3","TCP","4433 → 54162 [ACK] Seq=1 Ack=2124 Win=64128 Len=0 TSval=2883005966 TSecr=2188435036"
"207","6.828122953","1229","2a:7b:b7:64:0e:71","c2:ea:ec:4e:9c:d6","172.20.0.2","172.20.0.3","SSL","[TCP Previous segment not captured] , Continuation Data"
"208","6.828165576","78","c2:ea:ec:4e:9c:d6","2a:7b:b7:64:0e:71","172.20.0.3","172.20.0.2","TCP","[TCP Dup ACK 204#1] 54162 → 4433 [ACK] Seq=2124 Ack=1 Win=64256 Len=0 TSval=2188435052 TSecr=2883005966 SLE=1449 SRE=2612"
"209","6.828173908","1514","2a:7b:b7:64:0e:71","c2:ea:ec:4e:9c:d6","172.20.0.2","172.20.0.3","TCP","[TCP Retransmission] 4433 → 54162 [ACK] Seq=1 Ack=2124 Win=64128 Len=1448 TSval=2883005982 TSecr=2188435052"
"210","6.828186579","66","c2:ea:ec:4e:9c:d6","2a:7b:b7:64:0e:71","172.20.0.3","172.20.0.2","TCP","54162 → 4433 [ACK] Seq=2124 Ack=2612 Win=64128 Len=0 TSval=2188435052 TSecr=2883005982"
"211","6.837968953","146","c2:ea:ec:4e:9c:d6","2a:7b:b7:64:0e:71","172.20.0.3","172.20.0.2","TLSv1.2","Change Cipher Spec, Application Data"
"212","6.838067540","66","c2:ea:ec:4e:9c:d6","2a:7b:b7:64:0e:71","172.20.0.3","172.20.0.2","TCP","54162 → 4433 [RST, ACK] Seq=2204 Ack=2612 Win=64128 Len=0 TSval=2188435061 TSecr=2883005982"
"213","6.854872208","74","c2:ea:ec:4e:9c:d6","2a:7b:b7:64:0e:71","172.20.0.3","172.20.0.2","TCP","54168 → 4433 [SYN] Seq=0 Win=64240 Len=0 MSS=1460 SACK_PERM TSval=2188435078 TSecr=0 WS=128"
"214","6.854901021","74","2a:7b:b7:64:0e:71","c2:ea:ec:4e:9c:d6","172.20.0.2","172.20.0.3","TCP","4433 → 54168 [SYN, ACK] Seq=0 Ack=1 Win=65160 Len=0 MSS=1460 SACK_PERM TSval=2883006008 TSecr=2188435078 WS=128"
"215","6.854920917","66","c2:ea:ec:4e:9c:d6","2a:7b:b7:64:0e:71","172.20.0.3","172.20.0.2","TCP","54168 → 4433 [ACK] Seq=1 Ack=1 Win=64256 Len=0 TSval=2188435078 TSecr=2883006008"
"216","6.854967692","2189","c2:ea:ec:4e:9c:d6","2a:7b:b7:64:0e:71","172.20.0.3","172.20.0.2","TLSv1.2","Client Hello"
"217","6.854974986","66","2a:7b:b7:64:0e:71","c2:ea:ec:4e:9c:d6","172.20.0.2","172.20.0.3","TCP","4433 → 54168 [ACK] Seq=1 Ack=2124 Win=64128 Len=0 TSval=2883006008 TSecr=2188435078"
"218","6.867638036","2676","2a:7b:b7:64:0e:71","c2:ea:ec:4e:9c:d6","172.20.0.2","172.20.0.3","TLSv1.3","Server Hello, Change Cipher Spec, Application Data, Application Data, Application Data, Application Data"
"219","6.867691710","66","c2:ea:ec:4e:9c:d6","2a:7b:b7:64:0e:71","172.20.0.3","172.20.0.2","TCP","54168 → 4433 [ACK] Seq=2124 Ack=2611 Win=64128 Len=0 TSval=2188435091 TSecr=2883006021"
"220","6.877774324","146","c2:ea:ec:4e:9c:d6","2a:7b:b7:64:0e:71","172.20.0.3","172.20.0.2","TLSv1.3","Change Cipher Spec, Application Data"
"221","6.877850268","66","c2:ea:ec:4e:9c:d6","2a:7b:b7:64:0e:71","172.20.0.3","172.20.0.2","TCP","54168 → 4433 [RST, ACK] Seq=2204 Ack=2611 Win=64128 Len=0 TSval=2188435101 TSecr=2883006021"
"222","6.894603069","74","c2:ea:ec:4e:9c:d6","2a:7b:b7:64:0e:71","172.20.0.3","172.20.0.2","TCP","54176 → 4433 [SYN] Seq=0 Win=64240 Len=0 MSS=1460 SACK_PERM TSval=2188435118 TSecr=0 WS=128"
"223","7.901166677","74","2a:7b:b7:64:0e:71","c2:ea:ec:4e:9c:d6","172.20.0.2","172.20.0.3","TCP","4433 → 54176 [SYN, ACK] Seq=0 Ack=1 Win=65160 Len=0 MSS=1460 SACK_PERM TSval=2883007055 TSecr=2188435118 WS=128"
