frame.number,frame.time_relative,frame.len,eth.src,eth.dst,ip.src,ip.dst,_ws.col.protocol,_ws.col.info
"1","0.000000000","239","aa:10:3d:40:d9:be","33:33:00:00:00:fb",,,"MDNS","Standard query 0x0000 PTR _ipps._tcp.local, ""QM"" question PTR _ftp._tcp.local, ""QM"" question PTR _webdav._tcp.local, ""QM"" question PTR _webdavs._tcp.local, ""QM"" question PTR _sftp-ssh._tcp.local, ""QM"" question PTR _smb._tcp.local, ""QM"" question PTR _afpovertcp._tcp.local, ""QM"" question PTR _nfs._tcp.local, ""QM"" question PTR _ipp._tcp.local, ""QM"" question PTR MONTE-VIRTUAL-MACHINE._smb._tcp.local"
"2","0.791709364","70","aa:10:3d:40:d9:be","33:33:00:00:00:02",,,"ICMPv6","Router Solicitation from aa:10:3d:40:d9:be"
"3","2.644297470","42","4e:a8:6d:31:eb:81","ff:ff:ff:ff:ff:ff",,,"ARP","ARP Announcement for 172.20.0.3"
"4","2.674701472","42","4e:a8:6d:31:eb:81","ff:ff:ff:ff:ff:ff",,,"ARP","Who has 172.20.0.2? Tell 172.20.0.3"
"5","2.674727462","42","22:ca:25:f5:86:46","4e:a8:6d:31:eb:81",,,"ARP","172.20.0.2 is at 22:ca:25:f5:86:46"
"6","2.674734976","74","4e:a8:6d:31:eb:81","22:ca:25:f5:86:46","172.20.0.3","172.20.0.2","TCP","48772 → 4433 [SYN] Seq=0 Win=64240 Len=0 MSS=1460 SACK_PERM TSval=2186474871 TSecr=0 WS=128"
"7","2.674753906","74","22:ca:25:f5:86:46","4e:a8:6d:31:eb:81","172.20.0.2","172.20.0.3","TCP","4433 → 48772 [SYN, ACK] Seq=0 Ack=1 Win=65160 Len=0 MSS=1460 SACK_PERM TSval=2881045802 TSecr=2186474871 WS=128"
"8","2.674771385","66","4e:a8:6d:31:eb:81","22:ca:25:f5:86:46","172.20.0.3","172.20.0.2","TCP","48772 → 4433 [ACK] Seq=1 Ack=1 Win=64256 Len=0 TSval=2186474872 TSecr=2881045802"
"9","2.674831510","1288","4e:a8:6d:31:eb:81","22:ca:25:f5:86:46","172.20.0.3","172.20.0.2","TLSv1.2","Client Hello"
"10","2.676035066","1472","22:ca:25:f5:86:46","4e:a8:6d:31:eb:81","172.20.0.2","172.20.0.3","TLSv1.3","Server Hello, Change Cipher Spec, Application Data, Application Data, Application Data, Application Data"
"11","2.676070788","66","4e:a8:6d:31:eb:81","22:ca:25:f5:86:46","172.20.0.3","172.20.0.2","TCP","48772 → 4433 [ACK] Seq=1223 Ack=1407 Win=64128 Len=0 TSval=2186474873 TSecr=2881045803"
"12","2.677051797","146","4e:a8:6d:31:eb:81","22:ca:25:f5:86:46","172.20.0.3","172.20.0.2","TLSv1.3","Change Cipher Spec, Application Data"
"13","2.677109121","66","4e:a8:6d:31:eb:81","22:ca:25:f5:86:46","172.20.0.3","172.20.0.2","TCP","48772 → 4433 [RST, ACK] Seq=1303 Ack=1407 Win=64128 Len=0 TSval=2186474874 TSecr=2881045803"
"14","2.687880418","74","4e:a8:6d:31:eb:81","22:ca:25:f5:86:46","172.20.0.3","172.20.0.2","TCP","48776 → 4433 [SYN] Seq=0 Win=64240 Len=0 MSS=1460 SACK_PERM TSval=2186474885 TSecr=0 WS=128"
"15","2.687908307","74","22:ca:25:f5:86:46","4e:a8:6d:31:eb:81","172.20.0.2","172.20.0.3","TCP","4433 → 48776 [SYN, ACK] Seq=0 Ack=1 Win=65160 Len=0 MSS=1460 SACK_PERM TSval=2881045815 TSecr=2186474885 WS=128"
"16","2.687926768","66","4e:a8:6d:31:eb:81","22:ca:25:f5:86:46","172.20.0.3","172.20.0.2","TCP","48776 → 4433 [ACK] Seq=1 Ack=1 Win=64256 Len=0 TSval=2186474885 TSecr=2881045815"
"17","2.687971470","1288","4e:a8:6d:31:eb:81","22:ca:25:f5:86:46","172.20.0.3","172.20.0.2","TLSv1.2","Client Hello"
"18","2.687979232","66","22:ca:25:f5:86:46","4e:a8:6d:31:eb:81","172.20.0.2","172.20.0.3","TCP","4433 → 48776 [ACK] Seq=1 Ack=1223 Win=64128 Len=0 TSval=2881045815 TSecr=2186474885"
"19","2.688481948","1472","22:ca:25:f5:86:46","4e:a8:6d:31:eb:81","172.20.0.2","172.20.0.3","TLSv1.3","Server Hello, Change Cipher Spec, Application Data, Application Data, Application Data, Application Data"
"20","2.688515466","66","4e:a8:6d:31:eb:81","22:ca:25:f5:86:46","172.20.0.3","172.20.0.2","TCP","48776 → 4433 [ACK] Seq=1223 Ack=1407 Win=64128 Len=0 TSval=2186474885 TSecr=2881045815"
"21","2.689462660","146","4e:a8:6d:31:eb:81","22:ca:25:f5:86:46","172.20.0.3","172.20.0.2","TLSv1.3","Change Cipher Spec, Application Data"
"22","2.689517677","66","4e:a8:6d:31:eb:81","22:ca:25:f5:86:46","172.20.0.3","172.20.0.2","TCP","48776 → 4433 [RST, ACK] Seq=1303 Ack=1407 Win=64128 Len=0 TSval=2186474886 TSecr=2881045815"
"23","2.700153700","74","4e:a8:6d:31:eb:81","22:ca:25:f5:86:46","172.20.0.3","172.20.0.2","TCP","48786 → 4433 [SYN] Seq=0 Win=64240 Len=0 MSS=1460 SACK_PERM TSval=2186474897 TSecr=0 WS=128"
"24","2.700180614","74","22:ca:25:f5:86:46","4e:a8:6d:31:eb:81","172.20.0.2","172.20.0.3","TCP","4433 → 48786 [SYN, ACK] Seq=0 Ack=1 Win=65160 Len=0 MSS=1460 SACK_PERM TSval=2881045827 TSecr=2186474897 WS=128"
"25","2.700199477","66","4e:a8:6d:31:eb:81","22:ca:25:f5:86:46","172.20.0.3","172.20.0.2","TCP","48786 → 4433 [ACK] Seq=1 Ack=1 Win=64256 Len=0 TSval=2186474897 TSecr=2881045827"
"26","2.700242341","1288","4e:a8:6d:31:eb:81","22:ca:25:f5:86:46","172.20.0.3","172.20.0.2","TLSv1.2","Client Hello"
"27","2.700248771","66","22:ca:25:f5:86:46","4e:a8:6d:31:eb:81","172.20.0.2","172.20.0.3","TCP","4433 → 48786 [ACK] Seq=1 Ack=1223 Win=64128 Len=0 TSval=2881045827 TSecr=2186474897"
"28","2.700728989","1472","22:ca:25:f5:86:46","4e:a8:6d:31:eb:81","172.20.0.2","172.20.0.3","TLSv1.3","Server Hello, Change Cipher Spec, Application Data, Application Data, Application Data, Application Data"
"29","2.700759157","66","4e:a8:6d:31:eb:81","22:ca:25:f5:86:46","172.20.0.3","172.20.0.2","TCP","48786 → 4433 [ACK] Seq=1223 Ack=1407 Win=64128 Len=0 TSval=2186474898 TSecr=2881045828"
"30","2.701762270","146","4e:a8:6d:31:eb:81","22:ca:25:f5:86:46","172.20.0.3","172.20.0.2","TLSv1.3","Change Cipher Spec, Application Data"
"31","2.701822062","66","4e:a8:6d:31:eb:81","22:ca:25:f5:86:46","172.20.0.3","172.20.0.2","TCP","48786 → 4433 [RST, ACK] Seq=1303 Ack=1407 Win=64128 Len=0 TSval=2186474899 TSecr=2881045828"
"32","2.712483056","74","4e:a8:6d:31:eb:81","22:ca:25:f5:86:46","172.20.0.3","172.20.0.2","TCP","48794 → 4433 [SYN] Seq=0 Win=64240 Len=0 MSS=1460 SACK_PERM TSval=2186474909 TSecr=0 WS=128"
"33","2.712512756","74","22:ca:25:f5:86:46","4e:a8:6d:31:eb:81","172.20.0.2","172.20.0.3","TCP","4433 → 48794 [SYN, ACK] Seq=0 Ack=1 Win=65160 Len=0 MSS=1460 SACK_PERM TSval=2881045839 TSecr=2186474909 WS=128"
"34","2.712533142","66","4e:a8:6d:31:eb:81","22:ca:25:f5:86:46","172.20.0.3","172.20.0.2","TCP","48794 → 4433 [ACK] Seq=1 Ack=1 Win=64256 Len=0 TSval=2186474909 TSecr=2881045839"
"35","2.712583419","1288","4e:a8:6d:31:eb:81","22:ca:25:f5:86:46","172.20.0.3","172.20.0.2","TLSv1.2","Client Hello"
"36","2.712591121","66","22:ca:25:f5:86:46","4e:a8:6d:31:eb:81","172.20.0.2","172.20.0.3","TCP","4433 → 48794 [ACK] Seq=1 Ack=1223 Win=64128 Len=0 TSval=2881045839 TSecr=2186474909"
"37","2.713088692","1472","22:ca:25:f5:86:46","4e:a8:6d:31:eb:81","172.20.0.2","172.20.0.3","TLSv1.3","Server Hello, Change Cipher Spec, Application Data, Application Data, Application Data, Application Data"
"38","2.713125416","66","4e:a8:6d:31:eb:81","22:ca:25:f5:86:46","172.20.0.3","172.20.0.2","TCP","48794 → 4433 [ACK] Seq=1223 Ack=1407 Win=64128 Len=0 TSval=2186474910 TSecr=2881045840"
"39","2.714152899","146","4e:a8:6d:31:eb:81","22:ca:25:f5:86:46","172.20.0.3","172.20.0.2","TLSv1.3","Change Cipher Spec, Application Data"
"40","2.714213957","66","4e:a8:6d:31:eb:81","22:ca:25:f5:86:46","172.20.0.3","172.20.0.2","TCP","48794 → 4433 [RST, ACK] Seq=1303 Ack=1407 Win=64128 Len=0 TSval=2186474911 TSecr=2881045840"
"41","2.725708859","74","4e:a8:6d:31:eb:81","22:ca:25:f5:86:46","172.20.0.3","172.20.0.2","TCP","48810 → 4433 [SYN] Seq=0 Win=64240 Len=0 MSS=1460 SACK_PERM TSval=2186474922 TSecr=0 WS=128"
"42","3.645980236","42","4e:a8:6d:31:eb:81","ff:ff:ff:ff:ff:ff",,,"ARP","ARP Announcement for 172.20.0.3"
"43","3.735733658","74","22:ca:25:f5:86:46","4e:a8:6d:31:eb:81","172.20.0.2","172.20.0.3","TCP","4433 → 48810 [SYN, ACK] Seq=0 Ack=1 Win=65160 Len=0 MSS=1460 SACK_PERM TSval=2881046863 TSecr=2186474922 WS=128"
"44","3.735760403","74","4e:a8:6d:31:eb:81","22:ca:25:f5:86:46","172.20.0.3","172.20.0.2","TCP","[TCP Retransmission] 48810 → 4433 [SYN] Seq=0 Win=64240 Len=0 MSS=1460 SACK_PERM TSval=2186475933 TSecr=0 WS=128"
"45","3.735773361","74","22:ca:25:f5:86:46","4e:a8:6d:31:eb:81","172.20.0.2","172.20.0.3","TCP","[TCP Retransmission] 4433 → 48810 [SYN, ACK] Seq=0 Ack=1 Win=65160 Len=0 MSS=1460 SACK_PERM TSval=2881046863 TSecr=2186474922 WS=128"
"46","3.735804521","66","4e:a8:6d:31:eb:81","22:ca:25:f5:86:46","172.20.0.3","172.20.0.2","TCP","48810 → 4433 [ACK] Seq=1 Ack=1 Win=64256 Len=0 TSval=2186475933 TSecr=2881046863"
"47","3.735838887","66","4e:a8:6d:31:eb:81","22:ca:25:f5:86:46","172.20.0.3","172.20.0.2","TCP","[TCP Dup ACK 46#1] 48810 → 4433 [ACK] Seq=1 Ack=1 Win=64256 Len=0 TSval=2186475933 TSecr=2881046863"
"48","3.735893592","1288","4e:a8:6d:31:eb:81","22:ca:25:f5:86:46","172.20.0.3","172.20.0.2","TLSv1.2","Client Hello"
"49","3.735899912","66","22:ca:25:f5:86:46","4e:a8:6d:31:eb:81","172.20.0.2","172.20.0.3","TCP","4433 → 48810 [ACK] Seq=1 Ack=1223 Win=64128 Len=0 TSval=2881046863 TSecr=2186475933"
"50","3.736402399","1472","22:ca:25:f5:86:46","4e:a8:6d:31:eb:81","172.20.0.2","172.20.0.3","TLSv1.3","Server Hello, Change Cipher Spec, Application Data, Application Data, Application Data, Application Data"
"51","3.736435391","66","4e:a8:6d:31:eb:81","22:ca:25:f5:86:46","172.20.0.3","172.20.0.2","TCP","48810 → 4433 [ACK] Seq=1223 Ack=1407 Win=64128 Len=0 TSval=2186475933 TSecr=2881046863"
"52","3.737654597","146","4e:a8:6d:31:eb:81","22:ca:25:f5:86:46","172.20.0.3","172.20.0.2","TLSv1.3","Change Cipher Spec, Application Data"
"53","3.737745137","66","4e:a8:6d:31:eb:81","22:ca:25:f5:86:46","172.20.0.3","172.20.0.2","TCP","48810 → 4433 [RST, ACK] Seq=1303 Ack=1407 Win=64128 Len=0 TSval=2186475935 TSecr=2881046863"
"54","3.748445507","74","4e:a8:6d:31:eb:81","22:ca:25:f5:86:46","172.20.0.3","172.20.0.2","TCP","48824 → 4433 [SYN] Seq=0 Win=64240 Len=0 MSS=1460 SACK_PERM TSval=2186475945 TSecr=0 WS=128"
"55","3.748470664","74","22:ca:25:f5:86:46","4e:a8:6d:31:eb:81","172.20.0.2","172.20.0.3","TCP","4433 → 48824 [SYN, ACK] Seq=0 Ack=1 Win=65160 Len=0 MSS=1460 SACK_PERM TSval=2881046875 TSecr=2186475945 WS=128"
"56","3.748487443","66","4e:a8:6d:31:eb:81","22:ca:25:f5:86:46","172.20.0.3","172.20.0.2","TCP","48824 → 4433 [ACK] Seq=1 Ack=1 Win=64256 Len=0 TSval=2186475945 TSecr=2881046875"
"57","3.748528106","1288","4e:a8:6d:31:eb:81","22:ca:25:f5:86:46","172.20.0.3","172.20.0.2","TLSv1.2","Client Hello"
"58","3.748533668","66","22:ca:25:f5:86:46","4e:a8:6d:31:eb:81","172.20.0.2","172.20.0.3","TCP","4433 → 48824 [ACK] Seq=1 Ack=1223 Win=64128 Len=0 TSval=2881046875 TSecr=2186475945"
"59","3.951707024","1472","22:ca:25:f5:86:46","4e:a8:6d:31:eb:81","172.20.0.2","172.20.0.3","TLSv1.3","Server Hello, Change Cipher Spec, Application Data, Application Data, Application Data, Application Data"
"60","3.951762639","66","4e:a8:6d:31:eb:81","22:ca:25:f5:86:46","172.20.0.3","172.20.0.2","TCP","48824 → 4433 [ACK] Seq=1223 Ack=1407 Win=64128 Len=0 TSval=2186476149 TSecr=2881047079"
"61","3.953486617","146","4e:a8:6d:31:eb:81","22:ca:25:f5:86:46","172.20.0.3","172.20.0.2","TLSv1.3","Change Cipher Spec, Application Data"
"62","3.953589606","66","4e:a8:6d:31:eb:81","22:ca:25:f5:86:46","172.20.0.3","172.20.0.2","TCP","48824 → 4433 [RST, ACK] Seq=1303 Ack=1407 Win=64128 Len=0 TSval=2186476150 TSecr=2881047079"
"63","3.965941346","74","4e:a8:6d:31:eb:81","22:ca:25:f5:86:46","172.20.0.3","172.20.0.2","TCP","48836 → 4433 [SYN] Seq=0 Win=64240 Len=0 MSS=1460 SACK_PERM TSval=2186476163 TSecr=0 WS=128"
"64","3.965969434","74","22:ca:25:f5:86:46","4e:a8:6d:31:eb:81","172.20.0.2","172.20.0.3","TCP","4433 → 48836 [SYN, ACK] Seq=0 Ack=1 Win=65160 Len=0 MSS=1460 SACK_PERM TSval=2881047093 TSecr=2186476163 WS=128"
"65","3.965989513","66","4e:a8:6d:31:eb:81","22:ca:25:f5:86:46","172.20.0.3","172.20.0.2","TCP","48836 → 4433 [ACK] Seq=1 Ack=1 Win=64256 Len=0 TSval=2186476163 TSecr=2881047093"
"66","3.966038298","1288","4e:a8:6d:31:eb:81","22:ca:25:f5:86:46","172.20.0.3","172.20.0.2","TLSv1.2","Client Hello"
"67","3.966048117","66","22:ca:25:f5:86:46","4e:a8:6d:31:eb:81","172.20.0.2","172.20.0.3","TCP","4433 → 48836 [ACK] Seq=1 Ack=1223 Win=64128 Len=0 TSval=2881047093 TSecr=2186476163"
"68","3.966488677","1472","22:ca:25:f5:86:46","4e:a8:6d:31:eb:81","172.20.0.2","172.20.0.3","TLSv1.3","Server Hello, Change Cipher Spec, Application Data, Application Data, Application Data, Application Data"
"69","3.966523743","66","4e:a8:6d:31:eb:81","22:ca:25:f5:86:46","172.20.0.3","172.20.0.2","TCP","48836 → 4433 [ACK] Seq=1223 Ack=1407 Win=64128 Len=0 TSval=2186476163 TSecr=2881047093"
"70","3.967524754","146","4e:a8:6d:31:eb:81","22:ca:25:f5:86:46","172.20.0.3","172.20.0.2","TLSv1.3","Change Cipher Spec, Application Data"
"71","3.967593408","66","4e:a8:6d:31:eb:81","22:ca:25:f5:86:46","172.20.0.3","172.20.0.2","TCP","48836 → 4433 [RST, ACK] Seq=1303 Ack=1407 Win=64128 Len=0 TSval=2186476164 TSecr=2881047093"
"72","3.978463262","74","4e:a8:6d:31:eb:81","22:ca:25:f5:86:46","172.20.0.3","172.20.0.2","TCP","48850 → 4433 [SYN] Seq=0 Win=64240 Len=0 MSS=1460 SACK_PERM TSval=2186476175 TSecr=0 WS=128"
"73","3.978490701","74","22:ca:25:f5:86:46","4e:a8:6d:31:eb:81","172.20.0.2","172.20.0.3","TCP","4433 → 48850 [SYN, ACK] Seq=0 Ack=1 Win=65160 Len=0 MSS=1460 SACK_PERM TSval=2881047105 TSecr=2186476175 WS=128"
"74","3.978508167","66","4e:a8:6d:31:eb:81","22:ca:25:f5:86:46","172.20.0.3","172.20.0.2","TCP","48850 → 4433 [ACK] Seq=1 Ack=1 Win=64256 Len=0 TSval=2186476175 TSecr=2881047105"
"75","3.978550869","1288","4e:a8:6d:31:eb:81","22:ca:25:f5:86:46","172.20.0.3","172.20.0.2","TLSv1.2","Client Hello"
"76","3.978556978","66","22:ca:25:f5:86:46","4e:a8:6d:31:eb:81","172.20.0.2","172.20.0.3","TCP","4433 → 48850 [ACK] Seq=1 Ack=1223 Win=64128 Len=0 TSval=2881047105 TSecr=2186476175"
"77","4.391713416","1472","22:ca:25:f5:86:46","4e:a8:6d:31:eb:81","172.20.0.2","172.20.0.3","TLSv1.3","Server Hello, Change Cipher Spec, Application Data, Application Data, Application Data, Application Data"
"78","4.391792123","66","4e:a8:6d:31:eb:81","22:ca:25:f5:86:46","172.20.0.3","172.20.0.2","TCP","48850 → 4433 [ACK] Seq=1223 Ack=1407 Win=64128 Len=0 TSval=2186476589 TSecr=2881047519"
"79","4.393043983","146","4e:a8:6d:31:eb:81","22:ca:25:f5:86:46","172.20.0.3","172.20.0.2","TLSv1.3","Change Cipher Spec, Application Data"
"80","4.393113707","66","4e:a8:6d:31:eb:81","22:ca:25:f5:86:46","172.20.0.3","172.20.0.2","TCP","48850 → 4433 [RST, ACK] Seq=1303 Ack=1407 Win=64128 Len=0 TSval=2186476590 TSecr=2881047519"
"81","4.404292239","74","4e:a8:6d:31:eb:81","22:ca:25:f5:86:46","172.20.0.3","172.20.0.2","TCP","59768 → 4433 [SYN] Seq=0 Win=64240 Len=0 MSS=1460 SACK_PERM TSval=2186476601 TSecr=0 WS=128"
"82","4.404324782","74","22:ca:25:f5:86:46","4e:a8:6d:31:eb:81","172.20.0.2","172.20.0.3","TCP","4433 → 59768 [SYN, ACK] Seq=0 Ack=1 Win=65160 Len=0 MSS=1460 SACK_PERM TSval=2881047531 TSecr=2186476601 WS=128"
"83","4.404346301","66","4e:a8:6d:31:eb:81","22:ca:25:f5:86:46","172.20.0.3","172.20.0.2","TCP","59768 → 4433 [ACK] Seq=1 Ack=1 Win=64256 Len=0 TSval=2186476601 TSecr=2881047531"
"84","4.404390750","1288","4e:a8:6d:31:eb:81","22:ca:25:f5:86:46","172.20.0.3","172.20.0.2","TLSv1.2","Client Hello"
"85","4.404411269","66","22:ca:25:f5:86:46","4e:a8:6d:31:eb:81","172.20.0.2","172.20.0.3","TCP","4433 → 59768 [ACK] Seq=1 Ack=1223 Win=64128 Len=0 TSval=2881047531 TSecr=2186476601"
"86","4.404966589","1472","22:ca:25:f5:86:46","4e:a8:6d:31:eb:81","172.20.0.2","172.20.0.3","TLSv1.3","Server Hello, Change Cipher Spec, Application Data, Application Data, Application Data, Application Data"
"87","4.404989388","66","4e:a8:6d:31:eb:81","22:ca:25:f5:86:46","172.20.0.3","172.20.0.2","TCP","59768 → 4433 [ACK] Seq=1223 Ack=1407 Win=64128 Len=0 TSval=2186476602 TSecr=2881047532"
"88","4.405999978","146","4e:a8:6d:31:eb:81","22:ca:25:f5:86:46","172.20.0.3","172.20.0.2","TLSv1.3","Change Cipher Spec, Application Data"
"89","4.406055548","66","4e:a8:6d:31:eb:81","22:ca:25:f5:86:46","172.20.0.3","172.20.0.2","TCP","59768 → 4433 [RST, ACK] Seq=1303 Ack=1407 Win=64128 Len=0 TSval=2186476603 TSecr=2881047532"
"90","4.417392780","74","4e:a8:6d:31:eb:81","22:ca:25:f5:86:46","172.20.0.3","172.20.0.2","TCP","59780 → 4433 [SYN] Seq=0 Win=64240 Len=0 MSS=1460 SACK_PERM TSval=2186476614 TSecr=0 WS=128"
"91","4.645402373","42","4e:a8:6d:31:eb:81","ff:ff:ff:ff:ff:ff",,,"ARP","ARP Announcement for 172.20.0.3"
"92","5.463767737","74","4e:a8:6d:31:eb:81","22:ca:25:f5:86:46","172.20.0.3","172.20.0.2","TCP","[TCP Retransmission] 59780 → 4433 [SYN] Seq=0 Win=64240 Len=0 MSS=1460 SACK_PERM TSval=2186477661 TSecr=0 WS=128"
"93","5.463785696","74","22:ca:25:f5:86:46","4e:a8:6d:31:eb:81","172.20.0.2","172.20.0.3","TCP","4433 → 59780 [SYN, ACK] Seq=0 Ack=1 Win=65160 Len=0 MSS=1460 SACK_PERM TSval=2881048591 TSecr=2186476614 WS=128"
"94","5.463820386","66","4e:a8:6d:31:eb:81","22:ca:25:f5:86:46","172.20.0.3","172.20.0.2","TCP","59780 → 4433 [ACK] Seq=1 Ack=1 Win=64256 Len=0 TSval=2186477661 TSecr=2881048591"
"95","5.463916734","1288","4e:a8:6d:31:eb:81","22:ca:25:f5:86:46","172.20.0.3","172.20.0.2","TLSv1.2","Client Hello"
"96","5.463925183","66","22:ca:25:f5:86:46","4e:a8:6d:31:eb:81","172.20.0.2","172.20.0.3","TCP","4433 → 59780 [ACK] Seq=1 Ack=1223 Win=64128 Len=0 TSval=2881048591 TSecr=2186477661"
"97","5.671716764","1472","22:ca:25:f5:86:46","4e:a8:6d:31:eb:81","172.20.0.2","172.20.0.3","TLSv1.3","Server Hello, Change Cipher Spec, Application Data, Application Data, Application Data, Application Data"
"98","5.671799064","66","4e:a8:6d:31:eb:81","22:ca:25:f5:86:46","172.20.0.3","172.20.0.2","TCP","59780 → 4433 [ACK] Seq=1223 Ack=1407 Win=64128 Len=0 TSval=2186477869 TSecr=2881048799"
"99","5.673102612","146","4e:a8:6d:31:eb:81","22:ca:25:f5:86:46","172.20.0.3","172.20.0.2","TLSv1.3","Change Cipher Spec, Application Data"
"100","5.673179494","66","4e:a8:6d:31:eb:81","22:ca:25:f5:86:46","172.20.0.3","172.20.0.2","TCP","59780 → 4433 [RST, ACK] Seq=1303 Ack=1407 Win=64128 Len=0 TSval=2186477870 TSecr=2881048799"
"101","5.684706326","74","4e:a8:6d:31:eb:81","22:ca:25:f5:86:46","172.20.0.3","172.20.0.2","TCP","59790 → 4433 [SYN] Seq=0 Win=64240 Len=0 MSS=1460 SACK_PERM TSval=2186477881 TSecr=0 WS=128"
"102","5.684734881","74","22:ca:25:f5:86:46","4e:a8:6d:31:eb:81","172.20.0.2","172.20.0.3","TCP","4433 → 59790 [SYN, ACK] Seq=0 Ack=1 Win=65160 Len=0 MSS=1460 SACK_PERM TSval=2881048812 TSecr=2186477881 WS=128"
"103","5.684752325","66","4e:a8:6d:31:eb:81","22:ca:25:f5:86:46","172.20.0.3","172.20.0.2","TCP","59790 → 4433 [ACK] Seq=1 Ack=1 Win=64256 Len=0 TSval=2186477882 TSecr=2881048812"
"104","5.684794654","1288","4e:a8:6d:31:eb:81","22:ca:25:f5:86:46","172.20.0.3","172.20.0.2","TLSv1.2","Client Hello"
"105","5.684800765","66","22:ca:25:f5:86:46","4e:a8:6d:31:eb:81","172.20.0.2","172.20.0.3","TCP","4433 → 59790 [ACK] Seq=1 Ack=1223 Win=64128 Len=0 TSval=2881048812 TSecr=2186477882"
"106","5.685275417","1472","22:ca:25:f5:86:46","4e:a8:6d:31:eb:81","172.20.0.2","172.20.0.3","TLSv1.3","Server Hello, Change Cipher Spec, Application Data, Application Data, Application Data, Application Data"
"107","5.685309547","66","4e:a8:6d:31:eb:81","22:ca:25:f5:86:46","172.20.0.3","172.20.0.2","TCP","59790 → 4433 [ACK] Seq=1223 Ack=1407 Win=64128 Len=0 TSval=2186477882 TSecr=2881048812"
"108","5.686272009","146","4e:a8:6d:31:eb:81","22:ca:25:f5:86:46","172.20.0.3","172.20.0.2","TLSv1.3","Change Cipher Spec, Application Data"
"109","5.686330738","66","4e:a8:6d:31:eb:81","22:ca:25:f5:86:46","172.20.0.3","172.20.0.2","TCP","59790 → 4433 [RST, ACK] Seq=1303 Ack=1407 Win=64128 Len=0 TSval=2186477883 TSecr=2881048812"
"110","5.696992866","74","4e:a8:6d:31:eb:81","22:ca:25:f5:86:46","172.20.0.3","172.20.0.2","TCP","59802 → 4433 [SYN] Seq=0 Win=64240 Len=0 MSS=1460 SACK_PERM TSval=2186477894 TSecr=0 WS=128"
"111","5.697016745","74","22:ca:25:f5:86:46","4e:a8:6d:31:eb:81","172.20.0.2","172.20.0.3","TCP","4433 → 59802 [SYN, ACK] Seq=0 Ack=1 Win=65160 Len=0 MSS=1460 SACK_PERM TSval=2881048824 TSecr=2186477894 WS=128"
"112","5.697036346","66","4e:a8:6d:31:eb:81","22:ca:25:f5:86:46","172.20.0.3","172.20.0.2","TCP","59802 → 4433 [ACK] Seq=1 Ack=1 Win=64256 Len=0 TSval=2186477894 TSecr=2881048824"
"113","5.697077183","1288","4e:a8:6d:31:eb:81","22:ca:25:f5:86:46","172.20.0.3","172.20.0.2","TLSv1.2","Client Hello"
"114","5.697083455","66","22:ca:25:f5:86:46","4e:a8:6d:31:eb:81","172.20.0.2","172.20.0.3","TCP","4433 → 59802 [ACK] Seq=1 Ack=1223 Win=64128 Len=0 TSval=2881048824 TSecr=2186477894"
"115","5.903714916","1472","22:ca:25:f5:86:46","4e:a8:6d:31:eb:81","172.20.0.2","172.20.0.3","TLSv1.3","Server Hello, Change Cipher Spec, Application Data, Application Data, Application Data, Application Data"
"116","5.903780482","66","4e:a8:6d:31:eb:81","22:ca:25:f5:86:46","172.20.0.3","172.20.0.2","TCP","59802 → 4433 [ACK] Seq=1223 Ack=1407 Win=64128 Len=0 TSval=2186478101 TSecr=2881049031"
"117","5.905036709","146","4e:a8:6d:31:eb:81","22:ca:25:f5:86:46","172.20.0.3","172.20.0.2","TLSv1.3","Change Cipher Spec, Application Data"
"118","5.905123196","66","4e:a8:6d:31:eb:81","22:ca:25:f5:86:46","172.20.0.3","172.20.0.2","TCP","59802 → 4433 [RST, ACK] Seq=1303 Ack=1407 Win=64128 Len=0 TSval=2186478102 TSecr=2881049031"
"119","5.918080049","74","4e:a8:6d:31:eb:81","22:ca:25:f5:86:46","172.20.0.3","172.20.0.2","TCP","59806 → 4433 [SYN] Seq=0 Win=64240 Len=0 MSS=1460 SACK_PERM TSval=2186478115 TSecr=0 WS=128"
"120","6.935739454","74","22:ca:25:f5:86:46","4e:a8:6d:31:eb:81","172.20.0.2","172.20.0.3","TCP","4433 → 59806 [SYN, ACK] Seq=0 Ack=1 Win=65160 Len=0 MSS=1460 SACK_PERM TSval=2881050063 TSecr=2186478115 WS=128"
"121","6.935764568","74","4e:a8:6d:31:eb:81","22:ca:25:f5:86:46","172.20.0.3","172.20.0.2","TCP","[TCP Retransmission] 59806 → 4433 [SYN] Seq=0 Win=64240 Len=0 MSS=1460 SACK_PERM TSval=2186479133 TSecr=0 WS=128"
"122","6.935777985","74","22:ca:25:f5:86:46","4e:a8:6d:31:eb:81","172.20.0.2","172.20.0.3","TCP","[TCP Retransmission] 4433 → 59806 [SYN, ACK] Seq=0 Ack=1 Win=65160 Len=0 MSS=1460 SACK_PERM TSval=2881050063 TSecr=2186478115 WS=128"
"123","6.935811206","66","4e:a8:6d:31:eb:81","22:ca:25:f5:86:46","172.20.0.3","172.20.0.2","TCP","59806 → 4433 [ACK] Seq=1 Ack=1 Win=64256 Len=0 TSval=2186479133 TSecr=2881050063"
"124","6.935835034","66","4e:a8:6d:31:eb:81","22:ca:25:f5:86:46","172.20.0.3","172.20.0.2","TCP","[TCP Dup ACK 123#1] 59806 → 4433 [ACK] Seq=1 Ack=1 Win=64256 Len=0 TSval=2186479133 TSecr=2881050063"
"125","6.935909416","1288","4e:a8:6d:31:eb:81","22:ca:25:f5:86:46","172.20.0.3","172.20.0.2","TLSv1.2","Client Hello"
"126","6.935915724","66","22:ca:25:f5:86:46","4e:a8:6d:31:eb:81","172.20.0.2","172.20.0.3","TCP","4433 → 59806 [ACK] Seq=1 Ack=1223 Win=64128 Len=0 TSval=2881050063 TSecr=2186479133"
"127","6.936407948","1472","22:ca:25:f5:86:46","4e:a8:6d:31:eb:81","172.20.0.2","172.20.0.3","TLSv1.3","Server Hello, Change Cipher Spec, Application Data, Application Data, Application Data, Application Data"
"128","6.936444744","66","4e:a8:6d:31:eb:81","22:ca:25:f5:86:46","172.20.0.3","172.20.0.2","TCP","59806 → 4433 [ACK] Seq=1223 Ack=1407 Win=64128 Len=0 TSval=2186479133 TSecr=2881050063"
"129","6.937525042","146","4e:a8:6d:31:eb:81","22:ca:25:f5:86:46","172.20.0.3","172.20.0.2","TLSv1.3","Change Cipher Spec, Application Data"
"130","6.937594300","66","4e:a8:6d:31:eb:81","22:ca:25:f5:86:46","172.20.0.3","172.20.0.2","TCP","59806 → 4433 [RST, ACK] Seq=1303 Ack=1407 Win=64128 Len=0 TSval=2186479134 TSecr=2881050063"
"131","6.948754650","74","4e:a8:6d:31:eb:81","22:ca:25:f5:86:46","172.20.0.3","172.20.0.2","TCP","59810 → 4433 [SYN] Seq=0 Win=64240 Len=0 MSS=1460 SACK_PERM TSval=2186479146 TSecr=0 WS=128"
"132","6.948783328","74","22:ca:25:f5:86:46","4e:a8:6d:31:eb:81","172.20.0.2","172.20.0.3","TCP","4433 → 59810 [SYN, ACK] Seq=0 Ack=1 Win=65160 Len=0 MSS=1460 SACK_PERM TSval=2881050076 TSecr=2186479146 WS=128"
"133","6.948803019","66","4e:a8:6d:31:eb:81","22:ca:25:f5:86:46","172.20.0.3","172.20.0.2","TCP","59810 → 4433 [ACK] Seq=1 Ack=1 Win=64256 Len=0 TSval=2186479146 TSecr=2881050076"
"134","6.948847337","1288","4e:a8:6d:31:eb:81","22:ca:25:f5:86:46","172.20.0.3","172.20.0.2","TLSv1.2","Client Hello"
"135","6.948867635","66","22:ca:25:f5:86:46","4e:a8:6d:31:eb:81","172.20.0.2","172.20.0.3","TCP","4433 → 59810 [ACK] Seq=1 Ack=1223 Win=64128 Len=0 TSval=2881050076 TSecr=2186479146"
"136","6.949380005","1472","22:ca:25:f5:86:46","4e:a8:6d:31:eb:81","172.20.0.2","172.20.0.3","TLSv1.3","Server Hello, Change Cipher Spec, Application Data, Application Data, Application Data, Application Data"
"137","6.949405143","66","4e:a8:6d:31:eb:81","22:ca:25:f5:86:46","172.20.0.3","172.20.0.2","TCP","59810 → 4433 [ACK] Seq=1223 Ack=1407 Win=64128 Len=0 TSval=2186479146 TSecr=2881050076"
"138","6.950371162","146","4e:a8:6d:31:eb:81","22:ca:25:f5:86:46","172.20.0.3","172.20.0.2","TLSv1.3","Change Cipher Spec, Application Data"
"139","6.950426503","66","4e:a8:6d:31:eb:81","22:ca:25:f5:86:46","172.20.0.3","172.20.0.2","TCP","59810 → 4433 [RST, ACK] Seq=1303 Ack=1407 Win=64128 Len=0 TSval=2186479147 TSecr=2881050076"
"140","6.961536988","74","4e:a8:6d:31:eb:81","22:ca:25:f5:86:46","172.20.0.3","172.20.0.2","TCP","59826 → 4433 [SYN] Seq=0 Win=64240 Len=0 MSS=1460 SACK_PERM TSval=2186479158 TSecr=0 WS=128"
"141","6.961568477","74","22:ca:25:f5:86:46","4e:a8:6d:31:eb:81","172.20.0.2","172.20.0.3","TCP","4433 → 59826 [SYN, ACK] Seq=0 Ack=1 Win=65160 Len=0 MSS=1460 SACK_PERM TSval=2881050088 TSecr=2186479158 WS=128"
"142","6.961603408","66","4e:a8:6d:31:eb:81","22:ca:25:f5:86:46","172.20.0.3","172.20.0.2","TCP","59826 → 4433 [ACK] Seq=1 Ack=1 Win=64256 Len=0 TSval=2186479158 TSecr=2881050088"
"143","6.961657063","1288","4e:a8:6d:31:eb:81","22:ca:25:f5:86:46","172.20.0.3","172.20.0.2","TLSv1.2","Client Hello"
"144","6.961673075","66","22:ca:25:f5:86:46","4e:a8:6d:31:eb:81","172.20.0.2","172.20.0.3","TCP","4433 → 59826 [ACK] Seq=1 Ack=1223 Win=64128 Len=0 TSval=2881050088 TSecr=2186479158"
"145","6.962158121","1472","22:ca:25:f5:86:46","4e:a8:6d:31:eb:81","172.20.0.2","172.20.0.3","TLSv1.3","Server Hello, Change Cipher Spec, Application Data, Application Data, Application Data, Application Data"
"146","6.962192086","66","4e:a8:6d:31:eb:81","22:ca:25:f5:86:46","172.20.0.3","172.20.0.2","TCP","59826 → 4433 [ACK] Seq=1223 Ack=1407 Win=64128 Len=0 TSval=2186479159 TSecr=2881050089"
"147","6.963176200","146","4e:a8:6d:31:eb:81","22:ca:25:f5:86:46","172.20.0.3","172.20.0.2","TLSv1.3","Change Cipher Spec, Application Data"
"148","6.963236492","66","4e:a8:6d:31:eb:81","22:ca:25:f5:86:46","172.20.0.3","172.20.0.2","TCP","59826 → 4433 [RST, ACK] Seq=1303 Ack=1407 Win=64128 Len=0 TSval=2186479160 TSecr=2881050089"
"149","6.973848268","74","4e:a8:6d:31:eb:81","22:ca:25:f5:86:46","172.20.0.3","172.20.0.2","TCP","59832 → 4433 [SYN] Seq=0 Win=64240 Len=0 MSS=1460 SACK_PERM TSval=2186479171 TSecr=0 WS=128"
"150","6.973872606","74","22:ca:25:f5:86:46","4e:a8:6d:31:eb:81","172.20.0.2","172.20.0.3","TCP","4433 → 59832 [SYN, ACK] Seq=0 Ack=1 Win=65160 Len=0 MSS=1460 SACK_PERM TSval=2881050101 TSecr=2186479171 WS=128"
"151","6.973889592","66","4e:a8:6d:31:eb:81","22:ca:25:f5:86:46","172.20.0.3","172.20.0.2","TCP","59832 → 4433 [ACK] Seq=1 Ack=1 Win=64256 Len=0 TSval=2186479171 TSecr=2881050101"
"152","6.973931122","1288","4e:a8:6d:31:eb:81","22:ca:25:f5:86:46","172.20.0.3","172.20.0.2","TLSv1.2","Client Hello"
"153","6.973938264","66","22:ca:25:f5:86:46","4e:a8:6d:31:eb:81","172.20.0.2","172.20.0.3","TCP","4433 → 59832 [ACK] Seq=1 Ack=1223 Win=64128 Len=0 TSval=2881050101 TSecr=2186479171"
"154","6.974366533","1472","22:ca:25:f5:86:46","4e:a8:6d:31:eb:81","172.20.0.2","172.20.0.3","TLSv1.3","Server Hello, Change Cipher Spec, Application Data, Application Data, Application Data, Application Data"
"155","6.974402581","66","4e:a8:6d:31:eb:81","22:ca:25:f5:86:46","172.20.0.3","172.20.0.2","TCP","59832 → 4433 [ACK] Seq=1223 Ack=1407 Win=64128 Len=0 TSval=2186479171 TSecr=2881050101"
"156","6.975460985","146","4e:a8:6d:31:eb:81","22:ca:25:f5:86:46","172.20.0.3","172.20.0.2","TLSv1.3","Change Cipher Spec, Application Data"
"157","6.975520645","66","4e:a8:6d:31:eb:81","22:ca:25:f5:86:46","172.20.0.3","172.20.0.2","TCP","59832 → 4433 [RST, ACK] Seq=1303 Ack=1407 Win=64128 Len=0 TSval=2186479172 TSecr=2881050101"
"158","6.986138645","74","4e:a8:6d:31:eb:81","22:ca:25:f5:86:46","172.20.0.3","172.20.0.2","TCP","59834 → 4433 [SYN] Seq=0 Win=64240 Len=0 MSS=1460 SACK_PERM TSval=2186479183 TSecr=0 WS=128"
"159","6.986164727","74","22:ca:25:f5:86:46","4e:a8:6d:31:eb:81","172.20.0.2","172.20.0.3","TCP","4433 → 59834 [SYN, ACK] Seq=0 Ack=1 Win=65160 Len=0 MSS=1460 SACK_PERM TSval=2881050113 TSecr=2186479183 WS=128"
"160","6.986182007","66","4e:a8:6d:31:eb:81","22:ca:25:f5:86:46","172.20.0.3","172.20.0.2","TCP","59834 → 4433 [ACK] Seq=1 Ack=1 Win=64256 Len=0 TSval=2186479183 TSecr=2881050113"
"161","6.986223435","1288","4e:a8:6d:31:eb:81","22:ca:25:f5:86:46","172.20.0.3","172.20.0.2","TLSv1.2","Client Hello"
"162","6.986231104","66","22:ca:25:f5:86:46","4e:a8:6d:31:eb:81","172.20.0.2","172.20.0.3","TCP","4433 → 59834 [ACK] Seq=1 Ack=1223 Win=64128 Len=0 TSval=2881050113 TSecr=2186479183"
"163","6.986659306","1472","22:ca:25:f5:86:46","4e:a8:6d:31:eb:81","172.20.0.2","172.20.0.3","TLSv1.3","Server Hello, Change Cipher Spec, Application Data, Application Data, Application Data, Application Data"
"164","6.986712054","66","4e:a8:6d:31:eb:81","22:ca:25:f5:86:46","172.20.0.3","172.20.0.2","TCP","59834 → 4433 [ACK] Seq=1223 Ack=1407 Win=64128 Len=0 TSval=2186479184 TSecr=2881050113"
"165","6.987664384","146","4e:a8:6d:31:eb:81","22:ca:25:f5:86:46","172.20.0.3","172.20.0.2","TLSv1.3","Change Cipher Spec, Application Data"
"166","6.987727493","66","4e:a8:6d:31:eb:81","22:ca:25:f5:86:46","172.20.0.3","172.20.0.2","TCP","59834 → 4433 [RST, ACK] Seq=1303 Ack=1407 Win=64128 Len=0 TSval=2186479185 TSecr=2881050113"
"167","6.998260962","74","4e:a8:6d:31:eb:81","22:ca:25:f5:86:46","172.20.0.3","172.20.0.2","TCP","59842 → 4433 [SYN] Seq=0 Win=64240 Len=0 MSS=1460 SACK_PERM TSval=2186479195 TSecr=0 WS=128"
"168","6.998285213","74","22:ca:25:f5:86:46","4e:a8:6d:31:eb:81","172.20.0.2","172.20.0.3","TCP","4433 → 59842 [SYN, ACK] Seq=0 Ack=1 Win=65160 Len=0 MSS=1460 SACK_PERM TSval=2881050125 TSecr=2186479195 WS=128"
"169","6.998303789","66","4e:a8:6d:31:eb:81","22:ca:25:f5:86:46","172.20.0.3","172.20.0.2","TCP","59842 → 4433 [ACK] Seq=1 Ack=1 Win=64256 Len=0 TSval=2186479195 TSecr=2881050125"
"170","6.998346061","1288","4e:a8:6d:31:eb:81","22:ca:25:f5:86:46","172.20.0.3","172.20.0.2","TLSv1.2","Client Hello"
"171","6.998854872","1472","22:ca:25:f5:86:46","4e:a8:6d:31:eb:81","172.20.0.2","172.20.0.3","TLSv1.3","Server Hello, Change Cipher Spec, Application Data, Application Data, Application Data, Application Data"
"172","6.998889669","66","4e:a8:6d:31:eb:81","22:ca:25:f5:86:46","172.20.0.3","172.20.0.2","TCP","59842 → 4433 [ACK] Seq=1223 Ack=1407 Win=64128 Len=0 TSval=2186479196 TSecr=2881050126"
"173","6.999869727","146","4e:a8:6d:31:eb:81","22:ca:25:f5:86:46","172.20.0.3","172.20.0.2","TLSv1.3","Change Cipher Spec, Application Data"
"174","6.999934554","66","4e:a8:6d:31:eb:81","22:ca:25:f5:86:46","172.20.0.3","172.20.0.2","TCP","59842 → 4433 [RST, ACK] Seq=1303 Ack=1407 Win=64128 Len=0 TSval=2186479197 TSecr=2881050126"
"175","7.010360569","74","4e:a8:6d:31:eb:81","22:ca:25:f5:86:46","172.20.0.3","172.20.0.2","TCP","59846 → 4433 [SYN] Seq=0 Win=64240 Len=0 MSS=1460 SACK_PERM TSval=2186479207 TSecr=0 WS=128"
"176","7.010386487","74","22:ca:25:f5:86:46","4e:a8:6d:31:eb:81","172.20.0.2","172.20.0.3","TCP","4433 → 59846 [SYN, ACK] Seq=0 Ack=1 Win=65160 Len=0 MSS=1460 SACK_PERM TSval=2881050137 TSecr=2186479207 WS=128"
"177","7.010404798","66","4e:a8:6d:31:eb:81","22:ca:25:f5:86:46","172.20.0.3","172.20.0.2","TCP","59846 → 4433 [ACK] Seq=1 Ack=1 Win=64256 Len=0 TSval=2186479207 TSecr=2881050137"
"178","7.010443804","1288","4e:a8:6d:31:eb:81","22:ca:25:f5:86:46","172.20.0.3","172.20.0.2","TLSv1.2","Client Hello"
"179","7.010449079","66","22:ca:25:f5:86:46","4e:a8:6d:31:eb:81","172.20.0.2","172.20.0.3","TCP","4433 → 59846 [ACK] Seq=1 Ack=1223 Win=64128 Len=0 TSval=2881050137 TSecr=2186479207"
"180","7.010907379","1472","22:ca:25:f5:86:46","4e:a8:6d:31:eb:81","172.20.0.2","172.20.0.3","TLSv1.3","Server Hello, Change Cipher Spec, Application Data, Application Data, Application Data, Application Data"
"181","7.010940776","66","4e:a8:6d:31:eb:81","22:ca:25:f5:86:46","172.20.0.3","172.20.0.2","TCP","59846 → 4433 [ACK] Seq=1223 Ack=1407 Win=64128 Len=0 TSval=2186479208 TSecr=2881050138"
"182","7.011898912","146","4e:a8:6d:31:eb:81","22:ca:25:f5:86:46","172.20.0.3","172.20.0.2","TLSv1.3","Change Cipher Spec, Application Data"
"183","7.011957250","66","4e:a8:6d:31:eb:81","22:ca:25:f5:86:46","172.20.0.3","172.20.0.2","TCP","59846 → 4433 [RST, ACK] Seq=1303 Ack=1407 Win=64128 Len=0 TSval=2186479209 TSecr=2881050138"
"184","7.022518153","74","4e:a8:6d:31:eb:81","22:ca:25:f5:86:46","172.20.0.3","172.20.0.2","TCP","59852 → 4433 [SYN] Seq=0 Win=64240 Len=0 MSS=1460 SACK_PERM TSval=2186479219 TSecr=0 WS=128"
"185","7.022543493","74","22:ca:25:f5:86:46","4e:a8:6d:31:eb:81","172.20.0.2","172.20.0.3","TCP","4433 → 59852 [SYN, ACK] Seq=0 Ack=1 Win=65160 Len=0 MSS=1460 SACK_PERM TSval=2881050149 TSecr=2186479219 WS=128"
"186","7.022559486","66","4e:a8:6d:31:eb:81","22:ca:25:f5:86:46","172.20.0.3","172.20.0.2","TCP","59852 → 4433 [ACK] Seq=1 Ack=1 Win=64256 Len=0 TSval=2186479219 TSecr=2881050149"
"187","7.022602680","1288","4e:a8:6d:31:eb:81","22:ca:25:f5:86:46","172.20.0.3","172.20.0.2","TLSv1.2","Client Hello"
"188","7.022609639","66","22:ca:25:f5:86:46","4e:a8:6d:31:eb:81","172.20.0.2","172.20.0.3","TCP","4433 → 59852 [ACK] Seq=1 Ack=1223 Win=64128 Len=0 TSval=2881050149 TSecr=2186479219"
"189","7.023050028","1472","22:ca:25:f5:86:46","4e:a8:6d:31:eb:81","172.20.0.2","172.20.0.3","TLSv1.3","Server Hello, Change Cipher Spec, Application Data, Application Data, Application Data, Application Data"
"190","7.023081736","66","4e:a8:6d:31:eb:81","22:ca:25:f5:86:46","172.20.0.3","172.20.0.2","TCP","59852 → 4433 [ACK] Seq=1223 Ack=1407 Win=64128 Len=0 TSval=2186479220 TSecr=2881050150"
"191","7.024049650","146","4e:a8:6d:31:eb:81","22:ca:25:f5:86:46","172.20.0.3","172.20.0.2","TLSv1.3","Change Cipher Spec, Application Data"
"192","7.024104248","66","4e:a8:6d:31:eb:81","22:ca:25:f5:86:46","172.20.0.3","172.20.0.2","TCP","59852 → 4433 [RST, ACK] Seq=1303 Ack=1407 Win=64128 Len=0 TSval=2186479221 TSecr=2881050150"
"193","7.035356991","74","4e:a8:6d:31:eb:81","22:ca:25:f5:86:46","172.20.0.3","172.20.0.2","TCP","59866 → 4433 [SYN] Seq=0 Win=64240 Len=0 MSS=1460 SACK_PERM TSval=2186479232 TSecr=0 WS=128"
"194","7.035386998","74","22:ca:25:f5:86:46","4e:a8:6d:31:eb:81","172.20.0.2","172.20.0.3","TCP","4433 → 59866 [SYN, ACK] Seq=0 Ack=1 Win=65160 Len=0 MSS=1460 SACK_PERM TSval=2881050162 TSecr=2186479232 WS=128"
"195","7.035406359","66","4e:a8:6d:31:eb:81","22:ca:25:f5:86:46","172.20.0.3","172.20.0.2","TCP","59866 → 4433 [ACK] Seq=1 Ack=1 Win=64256 Len=0 TSval=2186479232 TSecr=2881050162"
"196","7.035453018","1288","4e:a8:6d:31:eb:81","22:ca:25:f5:86:46","172.20.0.3","172.20.0.2","TLSv1.2","Client Hello"
"197","7.035460204","66","22:ca:25:f5:86:46","4e:a8:6d:31:eb:81","172.20.0.2","172.20.0.3","TCP","4433 → 59866 [ACK] Seq=1 Ack=1223 Win=64128 Len=0 TSval=2881050162 TSecr=2186479232"
"198","7.035919696","1472","22:ca:25:f5:86:46","4e:a8:6d:31:eb:81","172.20.0.2","172.20.0.3","TLSv1.3","Server Hello, Change Cipher Spec, Application Data, Application Data, Application Data, Application Data"
"199","7.035948098","66","4e:a8:6d:31:eb:81","22:ca:25:f5:86:46","172.20.0.3","172.20.0.2","TCP","59866 → 4433 [ACK] Seq=1223 Ack=1407 Win=64128 Len=0 TSval=2186479233 TSecr=2881050163"
"200","7.037060134","146","4e:a8:6d:31:eb:81","22:ca:25:f5:86:46","172.20.0.3","172.20.0.2","TLSv1.3","Change Cipher Spec, Application Data"
"201","7.037122971","66","4e:a8:6d:31:eb:81","22:ca:25:f5:86:46","172.20.0.3","172.20.0.2","TCP","59866 → 4433 [RST, ACK] Seq=1303 Ack=1407 Win=64128 Len=0 TSval=2186479234 TSecr=2881050163"
"202","7.047766676","74","4e:a8:6d:31:eb:81","22:ca:25:f5:86:46","172.20.0.3","172.20.0.2","TCP","59870 → 4433 [SYN] Seq=0 Win=64240 Len=0 MSS=1460 SACK_PERM TSval=2186479245 TSecr=0 WS=128"
"203","8.087742352","74","22:ca:25:f5:86:46","4e:a8:6d:31:eb:81","172.20.0.2","172.20.0.3","TCP","4433 → 59870 [SYN, ACK] Seq=0 Ack=1 Win=65160 Len=0 MSS=1460 SACK_PERM TSval=2881051215 TSecr=2186479245 WS=128"
"204","8.087784197","74","4e:a8:6d:31:eb:81","22:ca:25:f5:86:46","172.20.0.3","172.20.0.2","TCP","[TCP Retransmission] 59870 → 4433 [SYN] Seq=0 Win=64240 Len=0 MSS=1460 SACK_PERM TSval=2186480285 TSecr=0 WS=128"
"205","8.087797927","74","22:ca:25:f5:86:46","4e:a8:6d:31:eb:81","172.20.0.2","172.20.0.3","TCP","[TCP Retransmission] 4433 → 59870 [SYN, ACK] Seq=0 Ack=1 Win=65160 Len=0 MSS=1460 SACK_PERM TSval=2881051215 TSecr=2186479245 WS=128"
"206","8.087842746","66","4e:a8:6d:31:eb:81","22:ca:25:f5:86:46","172.20.0.3","172.20.0.2","TCP","59870 → 4433 [ACK] Seq=1 Ack=1 Win=64256 Len=0 TSval=2186480285 TSecr=2881051215"
"207","8.087874782","66","4e:a8:6d:31:eb:81","22:ca:25:f5:86:46","172.20.0.3","172.20.0.2","TCP","[TCP Dup ACK 206#1] 59870 → 4433 [ACK] Seq=1 Ack=1 Win=64256 Len=0 TSval=2186480285 TSecr=2881051215"
"208","8.087943140","1288","4e:a8:6d:31:eb:81","22:ca:25:f5:86:46","172.20.0.3","172.20.0.2","TLSv1.2","Client Hello"
"209","8.087957271","66","22:ca:25:f5:86:46","4e:a8:6d:31:eb:81","172.20.0.2","172.20.0.3","TCP","4433 → 59870 [ACK] Seq=1 Ack=1223 Win=64128 Len=0 TSval=2881051215 TSecr=2186480285"
"210","8.295706952","1472","22:ca:25:f5:86:46","4e:a8:6d:31:eb:81","172.20.0.2","172.20.0.3","TLSv1.3","Server Hello, Change Cipher Spec, Application Data, Application Data, Application Data, Application Data"
"211","8.295762526","66","4e:a8:6d:31:eb:81","22:ca:25:f5:86:46","172.20.0.3","172.20.0.2","TCP","59870 → 4433 [ACK] Seq=1223 Ack=1407 Win=64128 Len=0 TSval=2186480493 TSecr=2881051423"
"212","8.296988578","146","4e:a8:6d:31:eb:81","22:ca:25:f5:86:46","172.20.0.3","172.20.0.2","TLSv1.3","Change Cipher Spec, Application Data"
"213","8.297061847","66","4e:a8:6d:31:eb:81","22:ca:25:f5:86:46","172.20.0.3","172.20.0.2","TCP","59870 → 4433 [RST, ACK] Seq=1303 Ack=1407 Win=64128 Len=0 TSval=2186480494 TSecr=2881051423"
"214","8.308087182","74","4e:a8:6d:31:eb:81","22:ca:25:f5:86:46","172.20.0.3","172.20.0.2","TCP","59878 → 4433 [SYN] Seq=0 Win=64240 Len=0 MSS=1460 SACK_PERM TSval=2186480505 TSecr=0 WS=128"
"215","8.308112998","74","22:ca:25:f5:86:46","4e:a8:6d:31:eb:81","172.20.0.2","172.20.0.3","TCP","4433 → 59878 [SYN, ACK] Seq=0 Ack=1 Win=65160 Len=0 MSS=1460 SACK_PERM TSval=2881051435 TSecr=2186480505 WS=128"
"216","8.308131784","66","4e:a8:6d:31:eb:81","22:ca:25:f5:86:46","172.20.0.3","172.20.0.2","TCP","59878 → 4433 [ACK] Seq=1 Ack=1 Win=64256 Len=0 TSval=2186480505 TSecr=2881051435"
"217","8.308176084","1288","4e:a8:6d:31:eb:81","22:ca:25:f5:86:46","172.20.0.3","172.20.0.2","TLSv1.2","Client Hello"
"218","8.308603922","1472","22:ca:25:f5:86:46","4e:a8:6d:31:eb:81","172.20.0.2","172.20.0.3","TLSv1.3","Server Hello, Change Cipher Spec, Application Data, Application Data, Application Data, Application Data"
"219","8.308646430","66","4e:a8:6d:31:eb:81","22:ca:25:f5:86:46","172.20.0.3","172.20.0.2","TCP","59878 → 4433 [ACK] Seq=1223 Ack=1407 Win=64128 Len=0 TSval=2186480505 TSecr=2881051435"
"220","8.309641288","146","4e:a8:6d:31:eb:81","22:ca:25:f5:86:46","172.20.0.3","172.20.0.2","TLSv1.3","Change Cipher Spec, Application Data"
"221","8.309721053","66","4e:a8:6d:31:eb:81","22:ca:25:f5:86:46","172.20.0.3","172.20.0.2","TCP","59878 → 4433 [RST, ACK] Seq=1303 Ack=1407 Win=64128 Len=0 TSval=2186480507 TSecr=2881051435"
"222","8.320292344","74","4e:a8:6d:31:eb:81","22:ca:25:f5:86:46","172.20.0.3","172.20.0.2","TCP","59890 → 4433 [SYN] Seq=0 Win=64240 Len=0 MSS=1460 SACK_PERM TSval=2186480517 TSecr=0 WS=128"
