frame.number,frame.time_relative,frame.len,eth.src,eth.dst,ip.src,ip.dst,_ws.col.protocol,_ws.col.info
"1","0.000000000","239","f2:21:64:f0:41:09","33:33:00:00:00:fb",,,"MDNS","Standard query 0x0000 PTR _ipps._tcp.local, ""QM"" question PTR _ftp._tcp.local, ""QM"" question PTR _webdav._tcp.local, ""QM"" question PTR _webdavs._tcp.local, ""QM"" question PTR _sftp-ssh._tcp.local, ""QM"" question PTR _smb._tcp.local, ""QM"" question PTR _afpovertcp._tcp.local, ""QM"" question PTR _nfs._tcp.local, ""QM"" question PTR _ipp._tcp.local, ""QM"" question PTR MONTE-VIRTUAL-MACHINE._smb._tcp.local"
"2","4.501399001","42","f2:5a:2c:5e:4c:67","ff:ff:ff:ff:ff:ff",,,"ARP","ARP Announcement for 172.20.0.3"
"3","4.531780082","42","f2:5a:2c:5e:4c:67","ff:ff:ff:ff:ff:ff",,,"ARP","Who has 172.20.0.2? Tell 172.20.0.3"
"4","5.501863069","42","f2:5a:2c:5e:4c:67","ff:ff:ff:ff:ff:ff",,,"ARP","ARP Announcement for 172.20.0.3"
"5","5.557500654","42","f2:5a:2c:5e:4c:67","ff:ff:ff:ff:ff:ff",,,"ARP","Who has 172.20.0.2? Tell 172.20.0.3"
"6","5.557521034","42","0e:81:eb:ee:58:4d","f2:5a:2c:5e:4c:67",,,"ARP","172.20.0.2 is at 0e:81:eb:ee:58:4d"
"7","5.557535967","74","f2:5a:2c:5e:4c:67","0e:81:eb:ee:58:4d","172.20.0.3","172.20.0.2","TCP","43650 → 4433 [SYN] Seq=0 Win=64240 Len=0 MSS=1460 SACK_PERM TSval=2184536475 TSecr=0 WS=128"
"8","5.557574593","74","0e:81:eb:ee:58:4d","f2:5a:2c:5e:4c:67","172.20.0.2","172.20.0.3","TCP","4433 → 43650 [SYN, ACK] Seq=0 Ack=1 Win=65160 Len=0 MSS=1460 SACK_PERM TSval=2879108431 TSecr=2184536475 WS=128"
"9","5.557606864","66","f2:5a:2c:5e:4c:67","0e:81:eb:ee:58:4d","172.20.0.3","172.20.0.2","TCP","43650 → 4433 [ACK] Seq=1 Ack=1 Win=64256 Len=0 TSval=2184537501 TSecr=2879108431"
"10","5.557698465","561","f2:5a:2c:5e:4c:67","0e:81:eb:ee:58:4d","172.20.0.3","172.20.0.2","TLSv1.2","Client Hello"
"11","5.558732382","769","0e:81:eb:ee:58:4d","f2:5a:2c:5e:4c:67","172.20.0.2","172.20.0.3","TLSv1.3","Server Hello, Change Cipher Spec, Application Data, Application Data, Application Data, Application Data"
"12","5.558763213","66","f2:5a:2c:5e:4c:67","0e:81:eb:ee:58:4d","172.20.0.3","172.20.0.2","TCP","43650 → 4433 [ACK] Seq=496 Ack=704 Win=63616 Len=0 TSval=2184537502 TSecr=2879108432"
"13","5.559689564","146","f2:5a:2c:5e:4c:67","0e:81:eb:ee:58:4d","172.20.0.3","172.20.0.2","TLSv1.3","Change Cipher Spec, Application Data"
"14","5.559754730","66","f2:5a:2c:5e:4c:67","0e:81:eb:ee:58:4d","172.20.0.3","172.20.0.2","TCP","43650 → 4433 [RST, ACK] Seq=576 Ack=704 Win=63616 Len=0 TSval=2184537503 TSecr=2879108432"
"15","5.571038525","74","f2:5a:2c:5e:4c:67","0e:81:eb:ee:58:4d","172.20.0.3","172.20.0.2","TCP","43662 → 4433 [SYN] Seq=0 Win=64240 Len=0 MSS=1460 SACK_PERM TSval=2184537514 TSecr=0 WS=128"
"16","5.571070810","74","0e:81:eb:ee:58:4d","f2:5a:2c:5e:4c:67","172.20.0.2","172.20.0.3","TCP","4433 → 43662 [SYN, ACK] Seq=0 Ack=1 Win=65160 Len=0 MSS=1460 SACK_PERM TSval=2879108444 TSecr=2184537514 WS=128"
"17","5.571089622","66","f2:5a:2c:5e:4c:67","0e:81:eb:ee:58:4d","172.20.0.3","172.20.0.2","TCP","43662 → 4433 [ACK] Seq=1 Ack=1 Win=64256 Len=0 TSval=2184537514 TSecr=2879108444"
"18","5.571137106","561","f2:5a:2c:5e:4c:67","0e:81:eb:ee:58:4d","172.20.0.3","172.20.0.2","TLSv1.2","Client Hello"
"19","5.571143671","66","0e:81:eb:ee:58:4d","f2:5a:2c:5e:4c:67","172.20.0.2","172.20.0.3","TCP","4433 → 43662 [ACK] Seq=1 Ack=496 Win=64768 Len=0 TSval=2879108444 TSecr=2184537514"
"20","5.773485221","769","0e:81:eb:ee:58:4d","f2:5a:2c:5e:4c:67","172.20.0.2","172.20.0.3","TLSv1.3","Server Hello, Change Cipher Spec, Application Data, Application Data, Application Data, Application Data"
"21","5.773541984","66","f2:5a:2c:5e:4c:67","0e:81:eb:ee:58:4d","172.20.0.3","172.20.0.2","TCP","43662 → 4433 [ACK] Seq=496 Ack=704 Win=63616 Len=0 TSval=2184537717 TSecr=2879108647"
"22","5.774552037","146","f2:5a:2c:5e:4c:67","0e:81:eb:ee:58:4d","172.20.0.3","172.20.0.2","TLSv1.3","Change Cipher Spec, Application Data"
"23","5.774632997","66","f2:5a:2c:5e:4c:67","0e:81:eb:ee:58:4d","172.20.0.3","172.20.0.2","TCP","43662 → 4433 [RST, ACK] Seq=576 Ack=704 Win=63616 Len=0 TSval=2184537718 TSecr=2879108647"
"24","5.785860417","74","f2:5a:2c:5e:4c:67","0e:81:eb:ee:58:4d","172.20.0.3","172.20.0.2","TCP","43678 → 4433 [SYN] Seq=0 Win=64240 Len=0 MSS=1460 SACK_PERM TSval=2184537729 TSecr=0 WS=128"
"25","5.785891166","74","0e:81:eb:ee:58:4d","f2:5a:2c:5e:4c:67","172.20.0.2","172.20.0.3","TCP","4433 → 43678 [SYN, ACK] Seq=0 Ack=1 Win=65160 Len=0 MSS=1460 SACK_PERM TSval=2879108659 TSecr=2184537729 WS=128"
"26","5.785909595","66","f2:5a:2c:5e:4c:67","0e:81:eb:ee:58:4d","172.20.0.3","172.20.0.2","TCP","43678 → 4433 [ACK] Seq=1 Ack=1 Win=64256 Len=0 TSval=2184537729 TSecr=2879108659"
"27","5.785948768","561","f2:5a:2c:5e:4c:67","0e:81:eb:ee:58:4d","172.20.0.3","172.20.0.2","TLSv1.2","Client Hello"
"28","5.785954589","66","0e:81:eb:ee:58:4d","f2:5a:2c:5e:4c:67","172.20.0.2","172.20.0.3","TCP","4433 → 43678 [ACK] Seq=1 Ack=496 Win=64768 Len=0 TSval=2879108659 TSecr=2184537729"
"29","5.786508941","769","0e:81:eb:ee:58:4d","f2:5a:2c:5e:4c:67","172.20.0.2","172.20.0.3","TLSv1.3","Server Hello, Change Cipher Spec, Application Data, Application Data, Application Data, Application Data"
"30","5.786538755","66","f2:5a:2c:5e:4c:67","0e:81:eb:ee:58:4d","172.20.0.3","172.20.0.2","TCP","43678 → 4433 [ACK] Seq=496 Ack=704 Win=63616 Len=0 TSval=2184537730 TSecr=2879108660"
"31","5.787312306","146","f2:5a:2c:5e:4c:67","0e:81:eb:ee:58:4d","172.20.0.3","172.20.0.2","TLSv1.3","Change Cipher Spec, Application Data"
"32","5.787373427","66","f2:5a:2c:5e:4c:67","0e:81:eb:ee:58:4d","172.20.0.3","172.20.0.2","TCP","43678 → 4433 [RST, ACK] Seq=576 Ack=704 Win=63616 Len=0 TSval=2184537730 TSecr=2879108660"
"33","5.797625244","74","f2:5a:2c:5e:4c:67","0e:81:eb:ee:58:4d","172.20.0.3","172.20.0.2","TCP","43690 → 4433 [SYN] Seq=0 Win=64240 Len=0 MSS=1460 SACK_PERM TSval=2184537741 TSecr=0 WS=128"
"34","5.797646797","74","0e:81:eb:ee:58:4d","f2:5a:2c:5e:4c:67","172.20.0.2","172.20.0.3","TCP","4433 → 43690 [SYN, ACK] Seq=0 Ack=1 Win=65160 Len=0 MSS=1460 SACK_PERM TSval=2879108671 TSecr=2184537741 WS=128"
"35","5.797661906","66","f2:5a:2c:5e:4c:67","0e:81:eb:ee:58:4d","172.20.0.3","172.20.0.2","TCP","43690 → 4433 [ACK] Seq=1 Ack=1 Win=64256 Len=0 TSval=2184537741 TSecr=2879108671"
"36","5.797696854","561","f2:5a:2c:5e:4c:67","0e:81:eb:ee:58:4d","172.20.0.3","172.20.0.2","TLSv1.2","Client Hello"
"37","5.797702028","66","0e:81:eb:ee:58:4d","f2:5a:2c:5e:4c:67","172.20.0.2","172.20.0.3","TCP","4433 → 43690 [ACK] Seq=1 Ack=496 Win=64768 Len=0 TSval=2879108671 TSecr=2184537741"
"38","5.798164920","769","0e:81:eb:ee:58:4d","f2:5a:2c:5e:4c:67","172.20.0.2","172.20.0.3","TLSv1.3","Server Hello, Change Cipher Spec, Application Data, Application Data, Application Data, Application Data"
"39","5.798190887","66","f2:5a:2c:5e:4c:67","0e:81:eb:ee:58:4d","172.20.0.3","172.20.0.2","TCP","43690 → 4433 [ACK] Seq=496 Ack=704 Win=63616 Len=0 TSval=2184537741 TSecr=2879108671"
"40","5.798983300","146","f2:5a:2c:5e:4c:67","0e:81:eb:ee:58:4d","172.20.0.3","172.20.0.2","TLSv1.3","Change Cipher Spec, Application Data"
"41","5.799038199","66","f2:5a:2c:5e:4c:67","0e:81:eb:ee:58:4d","172.20.0.3","172.20.0.2","TCP","43690 → 4433 [RST, ACK] Seq=576 Ack=704 Win=63616 Len=0 TSval=2184537742 TSecr=2879108671"
"42","5.809504166","74","f2:5a:2c:5e:4c:67","0e:81:eb:ee:58:4d","172.20.0.3","172.20.0.2","TCP","43702 → 4433 [SYN] Seq=0 Win=64240 Len=0 MSS=1460 SACK_PERM TSval=2184537753 TSecr=0 WS=128"
"43","5.809530778","74","0e:81:eb:ee:58:4d","f2:5a:2c:5e:4c:67","172.20.0.2","172.20.0.3","TCP","4433 → 43702 [SYN, ACK] Seq=0 Ack=1 Win=65160 Len=0 MSS=1460 SACK_PERM TSval=2879108683 TSecr=2184537753 WS=128"
"44","5.809548292","66","f2:5a:2c:5e:4c:67","0e:81:eb:ee:58:4d","172.20.0.3","172.20.0.2","TCP","43702 → 4433 [ACK] Seq=1 Ack=1 Win=64256 Len=0 TSval=2184537753 TSecr=2879108683"
"45","5.809588707","561","f2:5a:2c:5e:4c:67","0e:81:eb:ee:58:4d","172.20.0.3","172.20.0.2","TLSv1.2","Client Hello"
"46","5.809593792","66","0e:81:eb:ee:58:4d","f2:5a:2c:5e:4c:67","172.20.0.2","172.20.0.3","TCP","4433 → 43702 [ACK] Seq=1 Ack=496 Win=64768 Len=0 TSval=2879108683 TSecr=2184537753"
"47","5.810133583","769","0e:81:eb:ee:58:4d","f2:5a:2c:5e:4c:67","172.20.0.2","172.20.0.3","TLSv1.3","Server Hello, Change Cipher Spec, Application Data, Application Data, Application Data, Application Data"
"48","5.810167495","66","f2:5a:2c:5e:4c:67","0e:81:eb:ee:58:4d","172.20.0.3","172.20.0.2","TCP","43702 → 4433 [ACK] Seq=496 Ack=704 Win=63616 Len=0 TSval=2184537753 TSecr=2879108683"
"49","5.810968940","146","f2:5a:2c:5e:4c:67","0e:81:eb:ee:58:4d","172.20.0.3","172.20.0.2","TLSv1.3","Change Cipher Spec, Application Data"
"50","5.811025405","66","f2:5a:2c:5e:4c:67","0e:81:eb:ee:58:4d","172.20.0.3","172.20.0.2","TCP","43702 → 4433 [RST, ACK] Seq=576 Ack=704 Win=63616 Len=0 TSval=2184537754 TSecr=2879108683"
"51","5.821487357","74","f2:5a:2c:5e:4c:67","0e:81:eb:ee:58:4d","172.20.0.3","172.20.0.2","TCP","43708 → 4433 [SYN] Seq=0 Win=64240 Len=0 MSS=1460 SACK_PERM TSval=2184537765 TSecr=0 WS=128"
"52","5.821512566","74","0e:81:eb:ee:58:4d","f2:5a:2c:5e:4c:67","172.20.0.2","172.20.0.3","TCP","4433 → 43708 [SYN, ACK] Seq=0 Ack=1 Win=65160 Len=0 MSS=1460 SACK_PERM TSval=2879108695 TSecr=2184537765 WS=128"
"53","5.821528278","66","f2:5a:2c:5e:4c:67","0e:81:eb:ee:58:4d","172.20.0.3","172.20.0.2","TCP","43708 → 4433 [ACK] Seq=1 Ack=1 Win=64256 Len=0 TSval=2184537765 TSecr=2879108695"
"54","5.821569230","561","f2:5a:2c:5e:4c:67","0e:81:eb:ee:58:4d","172.20.0.3","172.20.0.2","TLSv1.2","Client Hello"
"55","5.821574315","66","0e:81:eb:ee:58:4d","f2:5a:2c:5e:4c:67","172.20.0.2","172.20.0.3","TCP","4433 → 43708 [ACK] Seq=1 Ack=496 Win=64768 Len=0 TSval=2879108695 TSecr=2184537765"
"56","5.822068728","769","0e:81:eb:ee:58:4d","f2:5a:2c:5e:4c:67","172.20.0.2","172.20.0.3","TLSv1.3","Server Hello, Change Cipher Spec, Application Data, Application Data, Application Data, Application Data"
"57","5.822099117","66","f2:5a:2c:5e:4c:67","0e:81:eb:ee:58:4d","172.20.0.3","172.20.0.2","TCP","43708 → 4433 [ACK] Seq=496 Ack=704 Win=63616 Len=0 TSval=2184537765 TSecr=2879108695"
"58","5.822941810","146","f2:5a:2c:5e:4c:67","0e:81:eb:ee:58:4d","172.20.0.3","172.20.0.2","TLSv1.3","Change Cipher Spec, Application Data"
"59","5.822998238","66","f2:5a:2c:5e:4c:67","0e:81:eb:ee:58:4d","172.20.0.3","172.20.0.2","TCP","43708 → 4433 [RST, ACK] Seq=576 Ack=704 Win=63616 Len=0 TSval=2184537766 TSecr=2879108695"
"60","5.833197056","74","f2:5a:2c:5e:4c:67","0e:81:eb:ee:58:4d","172.20.0.3","172.20.0.2","TCP","43724 → 4433 [SYN] Seq=0 Win=64240 Len=0 MSS=1460 SACK_PERM TSval=2184537776 TSecr=0 WS=128"
"61","5.833221345","74","0e:81:eb:ee:58:4d","f2:5a:2c:5e:4c:67","172.20.0.2","172.20.0.3","TCP","4433 → 43724 [SYN, ACK] Seq=0 Ack=1 Win=65160 Len=0 MSS=1460 SACK_PERM TSval=2879108706 TSecr=2184537776 WS=128"
"62","5.833238557","66","f2:5a:2c:5e:4c:67","0e:81:eb:ee:58:4d","172.20.0.3","172.20.0.2","TCP","43724 → 4433 [ACK] Seq=1 Ack=1 Win=64256 Len=0 TSval=2184537776 TSecr=2879108706"
"63","5.833275670","561","f2:5a:2c:5e:4c:67","0e:81:eb:ee:58:4d","172.20.0.3","172.20.0.2","TLSv1.2","Client Hello"
"64","5.833282181","66","0e:81:eb:ee:58:4d","f2:5a:2c:5e:4c:67","172.20.0.2","172.20.0.3","TCP","4433 → 43724 [ACK] Seq=1 Ack=496 Win=64768 Len=0 TSval=2879108706 TSecr=2184537776"
"65","5.833767059","769","0e:81:eb:ee:58:4d","f2:5a:2c:5e:4c:67","172.20.0.2","172.20.0.3","TLSv1.3","Server Hello, Change Cipher Spec, Application Data, Application Data, Application Data, Application Data"
"66","5.833793314","66","f2:5a:2c:5e:4c:67","0e:81:eb:ee:58:4d","172.20.0.3","172.20.0.2","TCP","43724 → 4433 [ACK] Seq=496 Ack=704 Win=63616 Len=0 TSval=2184537777 TSecr=2879108707"
"67","5.834588016","146","f2:5a:2c:5e:4c:67","0e:81:eb:ee:58:4d","172.20.0.3","172.20.0.2","TLSv1.3","Change Cipher Spec, Application Data"
"68","5.834639775","66","f2:5a:2c:5e:4c:67","0e:81:eb:ee:58:4d","172.20.0.3","172.20.0.2","TCP","43724 → 4433 [RST, ACK] Seq=576 Ack=704 Win=63616 Len=0 TSval=2184537778 TSecr=2879108707"
"69","5.844628473","74","f2:5a:2c:5e:4c:67","0e:81:eb:ee:58:4d","172.20.0.3","172.20.0.2","TCP","43736 → 4433 [SYN] Seq=0 Win=64240 Len=0 MSS=1460 SACK_PERM TSval=2184537788 TSecr=0 WS=128"
"70","5.844649997","74","0e:81:eb:ee:58:4d","f2:5a:2c:5e:4c:67","172.20.0.2","172.20.0.3","TCP","4433 → 43736 [SYN, ACK] Seq=0 Ack=1 Win=65160 Len=0 MSS=1460 SACK_PERM TSval=2879108718 TSecr=2184537788 WS=128"
"71","5.844665776","66","f2:5a:2c:5e:4c:67","0e:81:eb:ee:58:4d","172.20.0.3","172.20.0.2","TCP","43736 → 4433 [ACK] Seq=1 Ack=1 Win=64256 Len=0 TSval=2184537788 TSecr=2879108718"
"72","5.844703483","561","f2:5a:2c:5e:4c:67","0e:81:eb:ee:58:4d","172.20.0.3","172.20.0.2","TLSv1.2","Client Hello"
"73","5.844708900","66","0e:81:eb:ee:58:4d","f2:5a:2c:5e:4c:67","172.20.0.2","172.20.0.3","TCP","4433 → 43736 [ACK] Seq=1 Ack=496 Win=64768 Len=0 TSval=2879108718 TSecr=2184537788"
"74","5.845112620","769","0e:81:eb:ee:58:4d","f2:5a:2c:5e:4c:67","172.20.0.2","172.20.0.3","TLSv1.3","Server Hello, Change Cipher Spec, Application Data, Application Data, Application Data, Application Data"
"75","5.845135787","66","f2:5a:2c:5e:4c:67","0e:81:eb:ee:58:4d","172.20.0.3","172.20.0.2","TCP","43736 → 4433 [ACK] Seq=496 Ack=704 Win=63616 Len=0 TSval=2184537788 TSecr=2879108718"
"76","5.845930425","146","f2:5a:2c:5e:4c:67","0e:81:eb:ee:58:4d","172.20.0.3","172.20.0.2","TLSv1.3","Change Cipher Spec, Application Data"
"77","5.845985428","66","f2:5a:2c:5e:4c:67","0e:81:eb:ee:58:4d","172.20.0.3","172.20.0.2","TCP","43736 → 4433 [RST, ACK] Seq=576 Ack=704 Win=63616 Len=0 TSval=2184537789 TSecr=2879108718"
"78","5.855728349","74","f2:5a:2c:5e:4c:67","0e:81:eb:ee:58:4d","172.20.0.3","172.20.0.2","TCP","43742 → 4433 [SYN] Seq=0 Win=64240 Len=0 MSS=1460 SACK_PERM TSval=2184537799 TSecr=0 WS=128"
"79","5.855746799","74","0e:81:eb:ee:58:4d","f2:5a:2c:5e:4c:67","172.20.0.2","172.20.0.3","TCP","4433 → 43742 [SYN, ACK] Seq=0 Ack=1 Win=65160 Len=0 MSS=1460 SACK_PERM TSval=2879108729 TSecr=2184537799 WS=128"
"80","5.855760350","66","f2:5a:2c:5e:4c:67","0e:81:eb:ee:58:4d","172.20.0.3","172.20.0.2","TCP","43742 → 4433 [ACK] Seq=1 Ack=1 Win=64256 Len=0 TSval=2184537799 TSecr=2879108729"
"81","5.855813210","561","f2:5a:2c:5e:4c:67","0e:81:eb:ee:58:4d","172.20.0.3","172.20.0.2","TLSv1.2","Client Hello"
"82","5.855818925","66","0e:81:eb:ee:58:4d","f2:5a:2c:5e:4c:67","172.20.0.2","172.20.0.3","TCP","4433 → 43742 [ACK] Seq=1 Ack=496 Win=64768 Len=0 TSval=2879108729 TSecr=2184537799"
"83","5.856216626","769","0e:81:eb:ee:58:4d","f2:5a:2c:5e:4c:67","172.20.0.2","172.20.0.3","TLSv1.3","Server Hello, Change Cipher Spec, Application Data, Application Data, Application Data, Application Data"
"84","5.856239566","66","f2:5a:2c:5e:4c:67","0e:81:eb:ee:58:4d","172.20.0.3","172.20.0.2","TCP","43742 → 4433 [ACK] Seq=496 Ack=704 Win=63616 Len=0 TSval=2184537799 TSecr=2879108729"
"85","5.857037045","146","f2:5a:2c:5e:4c:67","0e:81:eb:ee:58:4d","172.20.0.3","172.20.0.2","TLSv1.3","Change Cipher Spec, Application Data"
"86","5.857110637","66","f2:5a:2c:5e:4c:67","0e:81:eb:ee:58:4d","172.20.0.3","172.20.0.2","TCP","43742 → 4433 [RST, ACK] Seq=576 Ack=704 Win=63616 Len=0 TSval=2184537800 TSecr=2879108729"
"87","5.866932560","74","f2:5a:2c:5e:4c:67","0e:81:eb:ee:58:4d","172.20.0.3","172.20.0.2","TCP","43752 → 4433 [SYN] Seq=0 Win=64240 Len=0 MSS=1460 SACK_PERM TSval=2184537810 TSecr=0 WS=128"
"88","5.866951753","74","0e:81:eb:ee:58:4d","f2:5a:2c:5e:4c:67","172.20.0.2","172.20.0.3","TCP","4433 → 43752 [SYN, ACK] Seq=0 Ack=1 Win=65160 Len=0 MSS=1460 SACK_PERM TSval=2879108740 TSecr=2184537810 WS=128"
"89","5.866965552","66","f2:5a:2c:5e:4c:67","0e:81:eb:ee:58:4d","172.20.0.3","172.20.0.2","TCP","43752 → 4433 [ACK] Seq=1 Ack=1 Win=64256 Len=0 TSval=2184537810 TSecr=2879108740"
"90","5.867000438","561","f2:5a:2c:5e:4c:67","0e:81:eb:ee:58:4d","172.20.0.3","172.20.0.2","TLSv1.2","Client Hello"
"91","5.867006287","66","0e:81:eb:ee:58:4d","f2:5a:2c:5e:4c:67","172.20.0.2","172.20.0.3","TCP","4433 → 43752 [ACK] Seq=1 Ack=496 Win=64768 Len=0 TSval=2879108740 TSecr=2184537810"
"92","5.867402806","769","0e:81:eb:ee:58:4d","f2:5a:2c:5e:4c:67","172.20.0.2","172.20.0.3","TLSv1.3","Server Hello, Change Cipher Spec, Application Data, Application Data, Application Data, Application Data"
"93","5.867426628","66","f2:5a:2c:5e:4c:67","0e:81:eb:ee:58:4d","172.20.0.3","172.20.0.2","TCP","43752 → 4433 [ACK] Seq=496 Ack=704 Win=63616 Len=0 TSval=2184537810 TSecr=2879108740"
"94","5.868231098","146","f2:5a:2c:5e:4c:67","0e:81:eb:ee:58:4d","172.20.0.3","172.20.0.2","TLSv1.3","Change Cipher Spec, Application Data"
"95","5.868286794","66","f2:5a:2c:5e:4c:67","0e:81:eb:ee:58:4d","172.20.0.3","172.20.0.2","TCP","43752 → 4433 [RST, ACK] Seq=576 Ack=704 Win=63616 Len=0 TSval=2184537811 TSecr=2879108740"
"96","5.878207424","74","f2:5a:2c:5e:4c:67","0e:81:eb:ee:58:4d","172.20.0.3","172.20.0.2","TCP","43762 → 4433 [SYN] Seq=0 Win=64240 Len=0 MSS=1460 SACK_PERM TSval=2184537821 TSecr=0 WS=128"
"97","5.878226250","74","0e:81:eb:ee:58:4d","f2:5a:2c:5e:4c:67","172.20.0.2","172.20.0.3","TCP","4433 → 43762 [SYN, ACK] Seq=0 Ack=1 Win=65160 Len=0 MSS=1460 SACK_PERM TSval=2879108751 TSecr=2184537821 WS=128"
"98","5.878240670","66","f2:5a:2c:5e:4c:67","0e:81:eb:ee:58:4d","172.20.0.3","172.20.0.2","TCP","43762 → 4433 [ACK] Seq=1 Ack=1 Win=64256 Len=0 TSval=2184537821 TSecr=2879108751"
"99","5.878273457","561","f2:5a:2c:5e:4c:67","0e:81:eb:ee:58:4d","172.20.0.3","172.20.0.2","TLSv1.2","Client Hello"
"100","5.878278562","66","0e:81:eb:ee:58:4d","f2:5a:2c:5e:4c:67","172.20.0.2","172.20.0.3","TCP","4433 → 43762 [ACK] Seq=1 Ack=496 Win=64768 Len=0 TSval=2879108751 TSecr=2184537821"
"101","6.085480536","769","0e:81:eb:ee:58:4d","f2:5a:2c:5e:4c:67","172.20.0.2","172.20.0.3","TLSv1.3","Server Hello, Change Cipher Spec, Application Data, Application Data, Application Data, Application Data"
"102","6.085545654","66","f2:5a:2c:5e:4c:67","0e:81:eb:ee:58:4d","172.20.0.3","172.20.0.2","TCP","43762 → 4433 [ACK] Seq=496 Ack=704 Win=63616 Len=0 TSval=2184538029 TSecr=2879108959"
"103","6.086676496","146","f2:5a:2c:5e:4c:67","0e:81:eb:ee:58:4d","172.20.0.3","172.20.0.2","TLSv1.3","Change Cipher Spec, Application Data"
"104","6.086749580","66","f2:5a:2c:5e:4c:67","0e:81:eb:ee:58:4d","172.20.0.3","172.20.0.2","TCP","43762 → 4433 [RST, ACK] Seq=576 Ack=704 Win=63616 Len=0 TSval=2184538030 TSecr=2879108959"
"105","6.099784730","74","f2:5a:2c:5e:4c:67","0e:81:eb:ee:58:4d","172.20.0.3","172.20.0.2","TCP","43766 → 4433 [SYN] Seq=0 Win=64240 Len=0 MSS=1460 SACK_PERM TSval=2184538043 TSecr=0 WS=128"
"106","6.099813635","74","0e:81:eb:ee:58:4d","f2:5a:2c:5e:4c:67","172.20.0.2","172.20.0.3","TCP","4433 → 43766 [SYN, ACK] Seq=0 Ack=1 Win=65160 Len=0 MSS=1460 SACK_PERM TSval=2879108973 TSecr=2184538043 WS=128"
"107","6.099830357","66","f2:5a:2c:5e:4c:67","0e:81:eb:ee:58:4d","172.20.0.3","172.20.0.2","TCP","43766 → 4433 [ACK] Seq=1 Ack=1 Win=64256 Len=0 TSval=2184538043 TSecr=2879108973"
"108","6.099889529","561","f2:5a:2c:5e:4c:67","0e:81:eb:ee:58:4d","172.20.0.3","172.20.0.2","TLSv1.2","Client Hello"
"109","6.099895392","66","0e:81:eb:ee:58:4d","f2:5a:2c:5e:4c:67","172.20.0.2","172.20.0.3","TCP","4433 → 43766 [ACK] Seq=1 Ack=496 Win=64768 Len=0 TSval=2879108973 TSecr=2184538043"
"110","6.100417149","769","0e:81:eb:ee:58:4d","f2:5a:2c:5e:4c:67","172.20.0.2","172.20.0.3","TLSv1.3","Server Hello, Change Cipher Spec, Application Data, Application Data, Application Data, Application Data"
"111","6.100458012","66","f2:5a:2c:5e:4c:67","0e:81:eb:ee:58:4d","172.20.0.3","172.20.0.2","TCP","43766 → 4433 [ACK] Seq=496 Ack=704 Win=63616 Len=0 TSval=2184538043 TSecr=2879108973"
"112","6.101256778","146","f2:5a:2c:5e:4c:67","0e:81:eb:ee:58:4d","172.20.0.3","172.20.0.2","TLSv1.3","Change Cipher Spec, Application Data"
"113","6.101316628","66","f2:5a:2c:5e:4c:67","0e:81:eb:ee:58:4d","172.20.0.3","172.20.0.2","TCP","43766 → 4433 [RST, ACK] Seq=576 Ack=704 Win=63616 Len=0 TSval=2184538044 TSecr=2879108973"
"114","6.111497121","74","f2:5a:2c:5e:4c:67","0e:81:eb:ee:58:4d","172.20.0.3","172.20.0.2","TCP","43774 → 4433 [SYN] Seq=0 Win=64240 Len=0 MSS=1460 SACK_PERM TSval=2184538055 TSecr=0 WS=128"
"115","6.111521556","74","0e:81:eb:ee:58:4d","f2:5a:2c:5e:4c:67","172.20.0.2","172.20.0.3","TCP","4433 → 43774 [SYN, ACK] Seq=0 Ack=1 Win=65160 Len=0 MSS=1460 SACK_PERM TSval=2879108985 TSecr=2184538055 WS=128"
"116","6.111537072","66","f2:5a:2c:5e:4c:67","0e:81:eb:ee:58:4d","172.20.0.3","172.20.0.2","TCP","43774 → 4433 [ACK] Seq=1 Ack=1 Win=64256 Len=0 TSval=2184538055 TSecr=2879108985"
"117","6.111571898","561","f2:5a:2c:5e:4c:67","0e:81:eb:ee:58:4d","172.20.0.3","172.20.0.2","TLSv1.2","Client Hello"
"118","6.111577025","66","0e:81:eb:ee:58:4d","f2:5a:2c:5e:4c:67","172.20.0.2","172.20.0.3","TCP","4433 → 43774 [ACK] Seq=1 Ack=496 Win=64768 Len=0 TSval=2879108985 TSecr=2184538055"
"119","6.112076670","769","0e:81:eb:ee:58:4d","f2:5a:2c:5e:4c:67","172.20.0.2","172.20.0.3","TLSv1.3","Server Hello, Change Cipher Spec, Application Data, Application Data, Application Data, Application Data"
"120","6.112102918","66","f2:5a:2c:5e:4c:67","0e:81:eb:ee:58:4d","172.20.0.3","172.20.0.2","TCP","43774 → 4433 [ACK] Seq=496 Ack=704 Win=63616 Len=0 TSval=2184538055 TSecr=2879108985"
"121","6.112894010","146","f2:5a:2c:5e:4c:67","0e:81:eb:ee:58:4d","172.20.0.3","172.20.0.2","TLSv1.3","Change Cipher Spec, Application Data"
"122","6.112948284","66","f2:5a:2c:5e:4c:67","0e:81:eb:ee:58:4d","172.20.0.3","172.20.0.2","TCP","43774 → 4433 [RST, ACK] Seq=576 Ack=704 Win=63616 Len=0 TSval=2184538056 TSecr=2879108985"
"123","6.122823380","74","f2:5a:2c:5e:4c:67","0e:81:eb:ee:58:4d","172.20.0.3","172.20.0.2","TCP","43784 → 4433 [SYN] Seq=0 Win=64240 Len=0 MSS=1460 SACK_PERM TSval=2184538066 TSecr=0 WS=128"
"124","6.122844811","74","0e:81:eb:ee:58:4d","f2:5a:2c:5e:4c:67","172.20.0.2","172.20.0.3","TCP","4433 → 43784 [SYN, ACK] Seq=0 Ack=1 Win=65160 Len=0 MSS=1460 SACK_PERM TSval=2879108996 TSecr=2184538066 WS=128"
"125","6.122858802","66","f2:5a:2c:5e:4c:67","0e:81:eb:ee:58:4d","172.20.0.3","172.20.0.2","TCP","43784 → 4433 [ACK] Seq=1 Ack=1 Win=64256 Len=0 TSval=2184538066 TSecr=2879108996"
"126","6.122897094","561","f2:5a:2c:5e:4c:67","0e:81:eb:ee:58:4d","172.20.0.3","172.20.0.2","TLSv1.2","Client Hello"
"127","6.122902344","66","0e:81:eb:ee:58:4d","f2:5a:2c:5e:4c:67","172.20.0.2","172.20.0.3","TCP","4433 → 43784 [ACK] Seq=1 Ack=496 Win=64768 Len=0 TSval=2879108996 TSecr=2184538066"
"128","6.123330134","769","0e:81:eb:ee:58:4d","f2:5a:2c:5e:4c:67","172.20.0.2","172.20.0.3","TLSv1.3","Server Hello, Change Cipher Spec, Application Data, Application Data, Application Data, Application Data"
"129","6.123354629","66","f2:5a:2c:5e:4c:67","0e:81:eb:ee:58:4d","172.20.0.3","172.20.0.2","TCP","43784 → 4433 [ACK] Seq=496 Ack=704 Win=63616 Len=0 TSval=2184538066 TSecr=2879108996"
"130","6.124119463","146","f2:5a:2c:5e:4c:67","0e:81:eb:ee:58:4d","172.20.0.3","172.20.0.2","TLSv1.3","Change Cipher Spec, Application Data"
"131","6.124172035","66","f2:5a:2c:5e:4c:67","0e:81:eb:ee:58:4d","172.20.0.3","172.20.0.2","TCP","43784 → 4433 [RST, ACK] Seq=576 Ack=704 Win=63616 Len=0 TSval=2184538067 TSecr=2879108996"
"132","6.133675737","74","f2:5a:2c:5e:4c:67","0e:81:eb:ee:58:4d","172.20.0.3","172.20.0.2","TCP","43790 → 4433 [SYN] Seq=0 Win=64240 Len=0 MSS=1460 SACK_PERM TSval=2184538077 TSecr=0 WS=128"
"133","6.133693542","74","0e:81:eb:ee:58:4d","f2:5a:2c:5e:4c:67","172.20.0.2","172.20.0.3","TCP","4433 → 43790 [SYN, ACK] Seq=0 Ack=1 Win=65160 Len=0 MSS=1460 SACK_PERM TSval=2879109007 TSecr=2184538077 WS=128"
"134","6.133707105","66","f2:5a:2c:5e:4c:67","0e:81:eb:ee:58:4d","172.20.0.3","172.20.0.2","TCP","43790 → 4433 [ACK] Seq=1 Ack=1 Win=64256 Len=0 TSval=2184538077 TSecr=2879109007"
"135","6.133740402","561","f2:5a:2c:5e:4c:67","0e:81:eb:ee:58:4d","172.20.0.3","172.20.0.2","TLSv1.2","Client Hello"
"136","6.133745248","66","0e:81:eb:ee:58:4d","f2:5a:2c:5e:4c:67","172.20.0.2","172.20.0.3","TCP","4433 → 43790 [ACK] Seq=1 Ack=496 Win=64768 Len=0 TSval=2879109007 TSecr=2184538077"
"137","6.134150091","769","0e:81:eb:ee:58:4d","f2:5a:2c:5e:4c:67","172.20.0.2","172.20.0.3","TLSv1.3","Server Hello, Change Cipher Spec, Application Data, Application Data, Application Data, Application Data"
"138","6.134173037","66","f2:5a:2c:5e:4c:67","0e:81:eb:ee:58:4d","172.20.0.3","172.20.0.2","TCP","43790 → 4433 [ACK] Seq=496 Ack=704 Win=63616 Len=0 TSval=2184538077 TSecr=2879109007"
"139","6.135018947","146","f2:5a:2c:5e:4c:67","0e:81:eb:ee:58:4d","172.20.0.3","172.20.0.2","TLSv1.3","Change Cipher Spec, Application Data"
"140","6.135071066","66","f2:5a:2c:5e:4c:67","0e:81:eb:ee:58:4d","172.20.0.3","172.20.0.2","TCP","43790 → 4433 [RST, ACK] Seq=576 Ack=704 Win=63616 Len=0 TSval=2184538078 TSecr=2879109007"
"141","6.144603140","74","f2:5a:2c:5e:4c:67","0e:81:eb:ee:58:4d","172.20.0.3","172.20.0.2","TCP","43796 → 4433 [SYN] Seq=0 Win=64240 Len=0 MSS=1460 SACK_PERM TSval=2184538088 TSecr=0 WS=128"
"142","6.144622848","74","0e:81:eb:ee:58:4d","f2:5a:2c:5e:4c:67","172.20.0.2","172.20.0.3","TCP","4433 → 43796 [SYN, ACK] Seq=0 Ack=1 Win=65160 Len=0 MSS=1460 SACK_PERM TSval=2879109018 TSecr=2184538088 WS=128"
"143","6.144636895","66","f2:5a:2c:5e:4c:67","0e:81:eb:ee:58:4d","172.20.0.3","172.20.0.2","TCP","43796 → 4433 [ACK] Seq=1 Ack=1 Win=64256 Len=0 TSval=2184538088 TSecr=2879109018"
"144","6.144667506","561","f2:5a:2c:5e:4c:67","0e:81:eb:ee:58:4d","172.20.0.3","172.20.0.2","TLSv1.2","Client Hello"
"145","6.144673921","66","0e:81:eb:ee:58:4d","f2:5a:2c:5e:4c:67","172.20.0.2","172.20.0.3","TCP","4433 → 43796 [ACK] Seq=1 Ack=496 Win=64768 Len=0 TSval=2879109018 TSecr=2184538088"
"146","6.145075307","769","0e:81:eb:ee:58:4d","f2:5a:2c:5e:4c:67","172.20.0.2","172.20.0.3","TLSv1.3","Server Hello, Change Cipher Spec, Application Data, Application Data, Application Data, Application Data"
"147","6.145098400","66","f2:5a:2c:5e:4c:67","0e:81:eb:ee:58:4d","172.20.0.3","172.20.0.2","TCP","43796 → 4433 [ACK] Seq=496 Ack=704 Win=63616 Len=0 TSval=2184538088 TSecr=2879109018"
"148","6.145861989","146","f2:5a:2c:5e:4c:67","0e:81:eb:ee:58:4d","172.20.0.3","172.20.0.2","TLSv1.3","Change Cipher Spec, Application Data"
"149","6.145914792","66","f2:5a:2c:5e:4c:67","0e:81:eb:ee:58:4d","172.20.0.3","172.20.0.2","TCP","43796 → 4433 [RST, ACK] Seq=576 Ack=704 Win=63616 Len=0 TSval=2184538089 TSecr=2879109018"
"150","6.155606973","74","f2:5a:2c:5e:4c:67","0e:81:eb:ee:58:4d","172.20.0.3","172.20.0.2","TCP","43808 → 4433 [SYN] Seq=0 Win=64240 Len=0 MSS=1460 SACK_PERM TSval=2184538099 TSecr=0 WS=128"
"151","6.155627802","74","0e:81:eb:ee:58:4d","f2:5a:2c:5e:4c:67","172.20.0.2","172.20.0.3","TCP","4433 → 43808 [SYN, ACK] Seq=0 Ack=1 Win=65160 Len=0 MSS=1460 SACK_PERM TSval=2879109029 TSecr=2184538099 WS=128"
"152","6.155642977","66","f2:5a:2c:5e:4c:67","0e:81:eb:ee:58:4d","172.20.0.3","172.20.0.2","TCP","43808 → 4433 [ACK] Seq=1 Ack=1 Win=64256 Len=0 TSval=2184538099 TSecr=2879109029"
"153","6.155678940","561","f2:5a:2c:5e:4c:67","0e:81:eb:ee:58:4d","172.20.0.3","172.20.0.2","TLSv1.2","Client Hello"
"154","6.155684256","66","0e:81:eb:ee:58:4d","f2:5a:2c:5e:4c:67","172.20.0.2","172.20.0.3","TCP","4433 → 43808 [ACK] Seq=1 Ack=496 Win=64768 Len=0 TSval=2879109029 TSecr=2184538099"
"155","6.156107787","769","0e:81:eb:ee:58:4d","f2:5a:2c:5e:4c:67","172.20.0.2","172.20.0.3","TLSv1.3","Server Hello, Change Cipher Spec, Application Data, Application Data, Application Data, Application Data"
"156","6.156135971","66","f2:5a:2c:5e:4c:67","0e:81:eb:ee:58:4d","172.20.0.3","172.20.0.2","TCP","43808 → 4433 [ACK] Seq=496 Ack=704 Win=63616 Len=0 TSval=2184538099 TSecr=2879109029"
"157","6.156903199","146","f2:5a:2c:5e:4c:67","0e:81:eb:ee:58:4d","172.20.0.3","172.20.0.2","TLSv1.3","Change Cipher Spec, Application Data"
"158","6.156955840","66","f2:5a:2c:5e:4c:67","0e:81:eb:ee:58:4d","172.20.0.3","172.20.0.2","TCP","43808 → 4433 [RST, ACK] Seq=576 Ack=704 Win=63616 Len=0 TSval=2184538100 TSecr=2879109029"
"159","6.166808605","74","f2:5a:2c:5e:4c:67","0e:81:eb:ee:58:4d","172.20.0.3","172.20.0.2","TCP","43820 → 4433 [SYN] Seq=0 Win=64240 Len=0 MSS=1460 SACK_PERM TSval=2184538110 TSecr=0 WS=128"
"160","6.166835475","74","0e:81:eb:ee:58:4d","f2:5a:2c:5e:4c:67","172.20.0.2","172.20.0.3","TCP","4433 → 43820 [SYN, ACK] Seq=0 Ack=1 Win=65160 Len=0 MSS=1460 SACK_PERM TSval=2879109040 TSecr=2184538110 WS=128"
"161","6.166856813","66","f2:5a:2c:5e:4c:67","0e:81:eb:ee:58:4d","172.20.0.3","172.20.0.2","TCP","43820 → 4433 [ACK] Seq=1 Ack=1 Win=64256 Len=0 TSval=2184538110 TSecr=2879109040"
"162","6.166889518","561","f2:5a:2c:5e:4c:67","0e:81:eb:ee:58:4d","172.20.0.3","172.20.0.2","TLSv1.2","Client Hello"
"163","6.166895818","66","0e:81:eb:ee:58:4d","f2:5a:2c:5e:4c:67","172.20.0.2","172.20.0.3","TCP","4433 → 43820 [ACK] Seq=1 Ack=496 Win=64768 Len=0 TSval=2879109040 TSecr=2184538110"
"164","6.167303700","769","0e:81:eb:ee:58:4d","f2:5a:2c:5e:4c:67","172.20.0.2","172.20.0.3","TLSv1.3","Server Hello, Change Cipher Spec, Application Data, Application Data, Application Data, Application Data"
"165","6.167330006","66","f2:5a:2c:5e:4c:67","0e:81:eb:ee:58:4d","172.20.0.3","172.20.0.2","TCP","43820 → 4433 [ACK] Seq=496 Ack=704 Win=63616 Len=0 TSval=2184538110 TSecr=2879109040"
"166","6.168146099","146","f2:5a:2c:5e:4c:67","0e:81:eb:ee:58:4d","172.20.0.3","172.20.0.2","TLSv1.3","Change Cipher Spec, Application Data"
"167","6.168201136","66","f2:5a:2c:5e:4c:67","0e:81:eb:ee:58:4d","172.20.0.3","172.20.0.2","TCP","43820 → 4433 [RST, ACK] Seq=576 Ack=704 Win=63616 Len=0 TSval=2184538111 TSecr=2879109040"
"168","6.178325283","74","f2:5a:2c:5e:4c:67","0e:81:eb:ee:58:4d","172.20.0.3","172.20.0.2","TCP","43836 → 4433 [SYN] Seq=0 Win=64240 Len=0 MSS=1460 SACK_PERM TSval=2184538121 TSecr=0 WS=128"
"169","6.178345349","74","0e:81:eb:ee:58:4d","f2:5a:2c:5e:4c:67","172.20.0.2","172.20.0.3","TCP","4433 → 43836 [SYN, ACK] Seq=0 Ack=1 Win=65160 Len=0 MSS=1460 SACK_PERM TSval=2879109051 TSecr=2184538121 WS=128"
"170","6.178366014","66","f2:5a:2c:5e:4c:67","0e:81:eb:ee:58:4d","172.20.0.3","172.20.0.2","TCP","43836 → 4433 [ACK] Seq=1 Ack=1 Win=64256 Len=0 TSval=2184538121 TSecr=2879109051"
"171","6.178400044","561","f2:5a:2c:5e:4c:67","0e:81:eb:ee:58:4d","172.20.0.3","172.20.0.2","TLSv1.2","Client Hello"
"172","6.178405031","66","0e:81:eb:ee:58:4d","f2:5a:2c:5e:4c:67","172.20.0.2","172.20.0.3","TCP","4433 → 43836 [ACK] Seq=1 Ack=496 Win=64768 Len=0 TSval=2879109051 TSecr=2184538121"
"173","6.178880925","769","0e:81:eb:ee:58:4d","f2:5a:2c:5e:4c:67","172.20.0.2","172.20.0.3","TLSv1.3","Server Hello, Change Cipher Spec, Application Data, Application Data, Application Data, Application Data"
"174","6.178908049","66","f2:5a:2c:5e:4c:67","0e:81:eb:ee:58:4d","172.20.0.3","172.20.0.2","TCP","43836 → 4433 [ACK] Seq=496 Ack=704 Win=63616 Len=0 TSval=2184538122 TSecr=2879109052"
"175","6.179772587","146","f2:5a:2c:5e:4c:67","0e:81:eb:ee:58:4d","172.20.0.3","172.20.0.2","TLSv1.3","Change Cipher Spec, Application Data"
"176","6.179827679","66","f2:5a:2c:5e:4c:67","0e:81:eb:ee:58:4d","172.20.0.3","172.20.0.2","TCP","43836 → 4433 [RST, ACK] Seq=576 Ack=704 Win=63616 Len=0 TSval=2184538123 TSecr=2879109052"
"177","6.190910527","74","f2:5a:2c:5e:4c:67","0e:81:eb:ee:58:4d","172.20.0.3","172.20.0.2","TCP","43852 → 4433 [SYN] Seq=0 Win=64240 Len=0 MSS=1460 SACK_PERM TSval=2184538134 TSecr=0 WS=128"
"178","6.190940455","74","0e:81:eb:ee:58:4d","f2:5a:2c:5e:4c:67","172.20.0.2","172.20.0.3","TCP","4433 → 43852 [SYN, ACK] Seq=0 Ack=1 Win=65160 Len=0 MSS=1460 SACK_PERM TSval=2879109064 TSecr=2184538134 WS=128"
"179","6.190958550","66","f2:5a:2c:5e:4c:67","0e:81:eb:ee:58:4d","172.20.0.3","172.20.0.2","TCP","43852 → 4433 [ACK] Seq=1 Ack=1 Win=64256 Len=0 TSval=2184538134 TSecr=2879109064"
"180","6.191002906","561","f2:5a:2c:5e:4c:67","0e:81:eb:ee:58:4d","172.20.0.3","172.20.0.2","TLSv1.2","Client Hello"
"181","6.191008524","66","0e:81:eb:ee:58:4d","f2:5a:2c:5e:4c:67","172.20.0.2","172.20.0.3","TCP","4433 → 43852 [ACK] Seq=1 Ack=496 Win=64768 Len=0 TSval=2879109064 TSecr=2184538134"
"182","6.191589485","769","0e:81:eb:ee:58:4d","f2:5a:2c:5e:4c:67","172.20.0.2","172.20.0.3","TLSv1.3","Server Hello, Change Cipher Spec, Application Data, Application Data, Application Data, Application Data"
"183","6.191620416","66","f2:5a:2c:5e:4c:67","0e:81:eb:ee:58:4d","172.20.0.3","172.20.0.2","TCP","43852 → 4433 [ACK] Seq=496 Ack=704 Win=63616 Len=0 TSval=2184538135 TSecr=2879109065"
"184","6.192433009","146","f2:5a:2c:5e:4c:67","0e:81:eb:ee:58:4d","172.20.0.3","172.20.0.2","TLSv1.3","Change Cipher Spec, Application Data"
"185","6.192510507","66","f2:5a:2c:5e:4c:67","0e:81:eb:ee:58:4d","172.20.0.3","172.20.0.2","TCP","43852 → 4433 [RST, ACK] Seq=576 Ack=704 Win=63616 Len=0 TSval=2184538136 TSecr=2879109065"
"186","6.203354338","74","f2:5a:2c:5e:4c:67","0e:81:eb:ee:58:4d","172.20.0.3","172.20.0.2","TCP","43866 → 4433 [SYN] Seq=0 Win=64240 Len=0 MSS=1460 SACK_PERM TSval=2184538146 TSecr=0 WS=128"
"187","6.203383832","74","0e:81:eb:ee:58:4d","f2:5a:2c:5e:4c:67","172.20.0.2","172.20.0.3","TCP","4433 → 43866 [SYN, ACK] Seq=0 Ack=1 Win=65160 Len=0 MSS=1460 SACK_PERM TSval=2879109076 TSecr=2184538146 WS=128"
"188","6.203401617","66","f2:5a:2c:5e:4c:67","0e:81:eb:ee:58:4d","172.20.0.3","172.20.0.2","TCP","43866 → 4433 [ACK] Seq=1 Ack=1 Win=64256 Len=0 TSval=2184538146 TSecr=2879109076"
"189","6.203464574","561","f2:5a:2c:5e:4c:67","0e:81:eb:ee:58:4d","172.20.0.3","172.20.0.2","TLSv1.2","Client Hello"
"190","6.203470913","66","0e:81:eb:ee:58:4d","f2:5a:2c:5e:4c:67","172.20.0.2","172.20.0.3","TCP","4433 → 43866 [ACK] Seq=1 Ack=496 Win=64768 Len=0 TSval=2879109077 TSecr=2184538147"
"191","6.203977127","769","0e:81:eb:ee:58:4d","f2:5a:2c:5e:4c:67","172.20.0.2","172.20.0.3","TLSv1.3","Server Hello, Change Cipher Spec, Application Data, Application Data, Application Data, Application Data"
"192","6.204009405","66","f2:5a:2c:5e:4c:67","0e:81:eb:ee:58:4d","172.20.0.3","172.20.0.2","TCP","43866 → 4433 [ACK] Seq=496 Ack=704 Win=63616 Len=0 TSval=2184538147 TSecr=2879109077"
"193","6.204849585","146","f2:5a:2c:5e:4c:67","0e:81:eb:ee:58:4d","172.20.0.3","172.20.0.2","TLSv1.3","Change Cipher Spec, Application Data"
"194","6.204905662","66","f2:5a:2c:5e:4c:67","0e:81:eb:ee:58:4d","172.20.0.3","172.20.0.2","TCP","43866 → 4433 [RST, ACK] Seq=576 Ack=704 Win=63616 Len=0 TSval=2184538148 TSecr=2879109077"
"195","6.215101802","74","f2:5a:2c:5e:4c:67","0e:81:eb:ee:58:4d","172.20.0.3","172.20.0.2","TCP","43882 → 4433 [SYN] Seq=0 Win=64240 Len=0 MSS=1460 SACK_PERM TSval=2184538158 TSecr=0 WS=128"
"196","6.215122395","74","0e:81:eb:ee:58:4d","f2:5a:2c:5e:4c:67","172.20.0.2","172.20.0.3","TCP","4433 → 43882 [SYN, ACK] Seq=0 Ack=1 Win=65160 Len=0 MSS=1460 SACK_PERM TSval=2879109088 TSecr=2184538158 WS=128"
"197","6.215137024","66","f2:5a:2c:5e:4c:67","0e:81:eb:ee:58:4d","172.20.0.3","172.20.0.2","TCP","43882 → 4433 [ACK] Seq=1 Ack=1 Win=64256 Len=0 TSval=2184538158 TSecr=2879109088"
"198","6.215170882","561","f2:5a:2c:5e:4c:67","0e:81:eb:ee:58:4d","172.20.0.3","172.20.0.2","TLSv1.2","Client Hello"
"199","6.215175760","66","0e:81:eb:ee:58:4d","f2:5a:2c:5e:4c:67","172.20.0.2","172.20.0.3","TCP","4433 → 43882 [ACK] Seq=1 Ack=496 Win=64768 Len=0 TSval=2879109088 TSecr=2184538158"
"200","6.215639797","769","0e:81:eb:ee:58:4d","f2:5a:2c:5e:4c:67","172.20.0.2","172.20.0.3","TLSv1.3","Server Hello, Change Cipher Spec, Application Data, Application Data, Application Data, Application Data"
"201","6.215663295","66","f2:5a:2c:5e:4c:67","0e:81:eb:ee:58:4d","172.20.0.3","172.20.0.2","TCP","43882 → 4433 [ACK] Seq=496 Ack=704 Win=63616 Len=0 TSval=2184538159 TSecr=2879109089"
"202","6.216429321","146","f2:5a:2c:5e:4c:67","0e:81:eb:ee:58:4d","172.20.0.3","172.20.0.2","TLSv1.3","Change Cipher Spec, Application Data"
"203","6.216495839","66","f2:5a:2c:5e:4c:67","0e:81:eb:ee:58:4d","172.20.0.3","172.20.0.2","TCP","43882 → 4433 [RST, ACK] Seq=576 Ack=704 Win=63616 Len=0 TSval=2184538160 TSecr=2879109089"
"204","6.227364072","74","f2:5a:2c:5e:4c:67","0e:81:eb:ee:58:4d","172.20.0.3","172.20.0.2","TCP","43898 → 4433 [SYN] Seq=0 Win=64240 Len=0 MSS=1460 SACK_PERM TSval=2184538170 TSecr=0 WS=128"
"205","6.227399391","74","0e:81:eb:ee:58:4d","f2:5a:2c:5e:4c:67","172.20.0.2","172.20.0.3","TCP","4433 → 43898 [SYN, ACK] Seq=0 Ack=1 Win=65160 Len=0 MSS=1460 SACK_PERM TSval=2879109100 TSecr=2184538170 WS=128"
"206","6.227418590","66","f2:5a:2c:5e:4c:67","0e:81:eb:ee:58:4d","172.20.0.3","172.20.0.2","TCP","43898 → 4433 [ACK] Seq=1 Ack=1 Win=64256 Len=0 TSval=2184538170 TSecr=2879109100"
"207","6.227477035","561","f2:5a:2c:5e:4c:67","0e:81:eb:ee:58:4d","172.20.0.3","172.20.0.2","TLSv1.2","Client Hello"
"208","6.227996987","769","0e:81:eb:ee:58:4d","f2:5a:2c:5e:4c:67","172.20.0.2","172.20.0.3","TLSv1.3","Server Hello, Change Cipher Spec, Application Data, Application Data, Application Data, Application Data"
"209","6.228030490","66","f2:5a:2c:5e:4c:67","0e:81:eb:ee:58:4d","172.20.0.3","172.20.0.2","TCP","43898 → 4433 [ACK] Seq=496 Ack=704 Win=63616 Len=0 TSval=2184538171 TSecr=2879109101"
"210","6.228874118","146","f2:5a:2c:5e:4c:67","0e:81:eb:ee:58:4d","172.20.0.3","172.20.0.2","TLSv1.3","Change Cipher Spec, Application Data"
"211","6.228933768","66","f2:5a:2c:5e:4c:67","0e:81:eb:ee:58:4d","172.20.0.3","172.20.0.2","TCP","43898 → 4433 [RST, ACK] Seq=576 Ack=704 Win=63616 Len=0 TSval=2184538172 TSecr=2879109101"
"212","6.239591224","74","f2:5a:2c:5e:4c:67","0e:81:eb:ee:58:4d","172.20.0.3","172.20.0.2","TCP","43902 → 4433 [SYN] Seq=0 Win=64240 Len=0 MSS=1460 SACK_PERM TSval=2184538183 TSecr=0 WS=128"
"213","6.239617003","74","0e:81:eb:ee:58:4d","f2:5a:2c:5e:4c:67","172.20.0.2","172.20.0.3","TCP","4433 → 43902 [SYN, ACK] Seq=0 Ack=1 Win=65160 Len=0 MSS=1460 SACK_PERM TSval=2879109113 TSecr=2184538183 WS=128"
"214","6.239634968","66","f2:5a:2c:5e:4c:67","0e:81:eb:ee:58:4d","172.20.0.3","172.20.0.2","TCP","43902 → 4433 [ACK] Seq=1 Ack=1 Win=64256 Len=0 TSval=2184538183 TSecr=2879109113"
"215","6.239681858","561","f2:5a:2c:5e:4c:67","0e:81:eb:ee:58:4d","172.20.0.3","172.20.0.2","TLSv1.2","Client Hello"
"216","6.239687258","66","0e:81:eb:ee:58:4d","f2:5a:2c:5e:4c:67","172.20.0.2","172.20.0.3","TCP","4433 → 43902 [ACK] Seq=1 Ack=496 Win=64768 Len=0 TSval=2879109113 TSecr=2184538183"
"217","6.240223712","769","0e:81:eb:ee:58:4d","f2:5a:2c:5e:4c:67","172.20.0.2","172.20.0.3","TLSv1.3","Server Hello, Change Cipher Spec, Application Data, Application Data, Application Data, Application Data"
"218","6.240252320","66","f2:5a:2c:5e:4c:67","0e:81:eb:ee:58:4d","172.20.0.3","172.20.0.2","TCP","43902 → 4433 [ACK] Seq=496 Ack=704 Win=63616 Len=0 TSval=2184538183 TSecr=2879109113"
"219","6.241064294","146","f2:5a:2c:5e:4c:67","0e:81:eb:ee:58:4d","172.20.0.3","172.20.0.2","TLSv1.3","Change Cipher Spec, Application Data"
"220","6.241120580","66","f2:5a:2c:5e:4c:67","0e:81:eb:ee:58:4d","172.20.0.3","172.20.0.2","TCP","43902 → 4433 [RST, ACK] Seq=576 Ack=704 Win=63616 Len=0 TSval=2184538184 TSecr=2879109113"
"221","6.251102970","74","f2:5a:2c:5e:4c:67","0e:81:eb:ee:58:4d","172.20.0.3","172.20.0.2","TCP","43908 → 4433 [SYN] Seq=0 Win=64240 Len=0 MSS=1460 SACK_PERM TSval=2184538194 TSecr=0 WS=128"
"222","6.251127577","74","0e:81:eb:ee:58:4d","f2:5a:2c:5e:4c:67","172.20.0.2","172.20.0.3","TCP","4433 → 43908 [SYN, ACK] Seq=0 Ack=1 Win=65160 Len=0 MSS=1460 SACK_PERM TSval=2879109124 TSecr=2184538194 WS=128"
"223","6.251144107","66","f2:5a:2c:5e:4c:67","0e:81:eb:ee:58:4d","172.20.0.3","172.20.0.2","TCP","43908 → 4433 [ACK] Seq=1 Ack=1 Win=64256 Len=0 TSval=2184538194 TSecr=2879109124"
"224","6.251180626","561","f2:5a:2c:5e:4c:67","0e:81:eb:ee:58:4d","172.20.0.3","172.20.0.2","TLSv1.2","Client Hello"
