frame.number,frame.time_relative,frame.len,eth.src,eth.dst,ip.src,ip.dst,_ws.col.protocol,_ws.col.info
"1","0.000000000","42","16:39:72:0f:c3:3f","ff:ff:ff:ff:ff:ff",,,"ARP","ARP Announcement for 172.20.0.3"
"2","0.032646901","42","16:39:72:0f:c3:3f","ff:ff:ff:ff:ff:ff",,,"ARP","Who has 172.20.0.2? Tell 172.20.0.3"
"3","0.032677948","42","3e:75:64:7d:c2:53","16:39:72:0f:c3:3f",,,"ARP","172.20.0.2 is at 3e:75:64:7d:c2:53"
"4","0.032703647","74","16:39:72:0f:c3:3f","3e:75:64:7d:c2:53","172.20.0.3","172.20.0.2","TCP","58622 → 4433 [SYN] Seq=0 Win=64240 Len=0 MSS=1460 SACK_PERM TSval=2185854095 TSecr=0 WS=128"
"5","0.032728394","74","3e:75:64:7d:c2:53","16:39:72:0f:c3:3f","172.20.0.2","172.20.0.3","TCP","4433 → 58622 [SYN, ACK] Seq=0 Ack=1 Win=65160 Len=0 MSS=1460 SACK_PERM TSval=2880425025 TSecr=2185854095 WS=128"
"6","0.032747086","66","16:39:72:0f:c3:3f","3e:75:64:7d:c2:53","172.20.0.3","172.20.0.2","TCP","58622 → 4433 [ACK] Seq=1 Ack=1 Win=64256 Len=0 TSval=2185854095 TSecr=2880425025"
"7","0.032786050","528","16:39:72:0f:c3:3f","3e:75:64:7d:c2:53","172.20.0.3","172.20.0.2","TLSv1.2","Client Hello"
"8","0.032792656","66","3e:75:64:7d:c2:53","16:39:72:0f:c3:3f","172.20.0.2","172.20.0.3","TCP","4433 → 58622 [ACK] Seq=1 Ack=463 Win=64768 Len=0 TSval=2880425025 TSecr=2185854095"
"9","0.033753360","736","3e:75:64:7d:c2:53","16:39:72:0f:c3:3f","172.20.0.2","172.20.0.3","TLSv1.3","Server Hello, Change Cipher Spec, Application Data, Application Data, Application Data, Application Data"
"10","0.033803593","66","16:39:72:0f:c3:3f","3e:75:64:7d:c2:53","172.20.0.3","172.20.0.2","TCP","58622 → 4433 [ACK] Seq=463 Ack=671 Win=63616 Len=0 TSval=2185854096 TSecr=2880425026"
"11","0.035338587","146","16:39:72:0f:c3:3f","3e:75:64:7d:c2:53","172.20.0.3","172.20.0.2","TLSv1.3","Change Cipher Spec, Application Data"
"12","0.035444356","66","16:39:72:0f:c3:3f","3e:75:64:7d:c2:53","172.20.0.3","172.20.0.2","TCP","58622 → 4433 [RST, ACK] Seq=543 Ack=671 Win=63616 Len=0 TSval=2185854098 TSecr=2880425026"
"13","0.047080797","74","16:39:72:0f:c3:3f","3e:75:64:7d:c2:53","172.20.0.3","172.20.0.2","TCP","58630 → 4433 [SYN] Seq=0 Win=64240 Len=0 MSS=1460 SACK_PERM TSval=2185854109 TSecr=0 WS=128"
"14","1.001515478","42","16:39:72:0f:c3:3f","ff:ff:ff:ff:ff:ff",,,"ARP","ARP Announcement for 172.20.0.3"
"15","1.070283842","74","3e:75:64:7d:c2:53","16:39:72:0f:c3:3f","172.20.0.2","172.20.0.3","TCP","4433 → 58630 [SYN, ACK] Seq=0 Ack=1 Win=65160 Len=0 MSS=1460 SACK_PERM TSval=2880426063 TSecr=2185854109 WS=128"
"16","1.070301510","74","16:39:72:0f:c3:3f","3e:75:64:7d:c2:53","172.20.0.3","172.20.0.2","TCP","[TCP Retransmission] 58630 → 4433 [SYN] Seq=0 Win=64240 Len=0 MSS=1460 SACK_PERM TSval=2185855133 TSecr=0 WS=128"
"17","1.070317735","74","3e:75:64:7d:c2:53","16:39:72:0f:c3:3f","172.20.0.2","172.20.0.3","TCP","[TCP Out-Of-Order] 4433 → 58630 [SYN, ACK] Seq=0 Ack=1 Win=65160 Len=0 MSS=1460 SACK_PERM TSval=2880426063 TSecr=2185854109 WS=128"
"18","1.070353758","66","16:39:72:0f:c3:3f","3e:75:64:7d:c2:53","172.20.0.3","172.20.0.2","TCP","58630 → 4433 [ACK] Seq=1 Ack=1 Win=64256 Len=0 TSval=2185855133 TSecr=2880426063"
"19","1.070378467","66","16:39:72:0f:c3:3f","3e:75:64:7d:c2:53","172.20.0.3","172.20.0.2","TCP","[TCP Dup ACK 18#1] 58630 → 4433 [ACK] Seq=1 Ack=1 Win=64256 Len=0 TSval=2185855133 TSecr=2880426063"
"20","1.070426810","528","16:39:72:0f:c3:3f","3e:75:64:7d:c2:53","172.20.0.3","172.20.0.2","TLSv1.2","Client Hello"
"21","1.070433614","66","3e:75:64:7d:c2:53","16:39:72:0f:c3:3f","172.20.0.2","172.20.0.3","TCP","4433 → 58630 [ACK] Seq=1 Ack=463 Win=64768 Len=0 TSval=2880426063 TSecr=2185855133"
"22","1.070977964","736","3e:75:64:7d:c2:53","16:39:72:0f:c3:3f","172.20.0.2","172.20.0.3","TLSv1.3","Server Hello, Change Cipher Spec, Application Data, Application Data, Application Data, Application Data"
"23","1.071009734","66","16:39:72:0f:c3:3f","3e:75:64:7d:c2:53","172.20.0.3","172.20.0.2","TCP","58630 → 4433 [ACK] Seq=463 Ack=671 Win=63616 Len=0 TSval=2185855133 TSecr=2880426063"
"24","1.071931004","146","16:39:72:0f:c3:3f","3e:75:64:7d:c2:53","172.20.0.3","172.20.0.2","TLSv1.3","Change Cipher Spec, Application Data"
"25","1.071988909","66","16:39:72:0f:c3:3f","3e:75:64:7d:c2:53","172.20.0.3","172.20.0.2","TCP","58630 → 4433 [RST, ACK] Seq=543 Ack=671 Win=63616 Len=0 TSval=2185855134 TSecr=2880426063"
"26","1.083141888","74","16:39:72:0f:c3:3f","3e:75:64:7d:c2:53","172.20.0.3","172.20.0.2","TCP","58638 → 4433 [SYN] Seq=0 Win=64240 Len=0 MSS=1460 SACK_PERM TSval=2185855145 TSecr=0 WS=128"
"27","1.083170918","74","3e:75:64:7d:c2:53","16:39:72:0f:c3:3f","172.20.0.2","172.20.0.3","TCP","4433 → 58638 [SYN, ACK] Seq=0 Ack=1 Win=65160 Len=0 MSS=1460 SACK_PERM TSval=2880426075 TSecr=2185855145 WS=128"
"28","1.083189562","66","16:39:72:0f:c3:3f","3e:75:64:7d:c2:53","172.20.0.3","172.20.0.2","TCP","58638 → 4433 [ACK] Seq=1 Ack=1 Win=64256 Len=0 TSval=2185855145 TSecr=2880426075"
"29","1.083236207","528","16:39:72:0f:c3:3f","3e:75:64:7d:c2:53","172.20.0.3","172.20.0.2","TLSv1.2","Client Hello"
"30","1.083242833","66","3e:75:64:7d:c2:53","16:39:72:0f:c3:3f","172.20.0.2","172.20.0.3","TCP","4433 → 58638 [ACK] Seq=1 Ack=463 Win=64768 Len=0 TSval=2880426076 TSecr=2185855145"
"31","1.083708217","736","3e:75:64:7d:c2:53","16:39:72:0f:c3:3f","172.20.0.2","172.20.0.3","TLSv1.3","Server Hello, Change Cipher Spec, Application Data, Application Data, Application Data, Application Data"
"32","1.083737312","66","16:39:72:0f:c3:3f","3e:75:64:7d:c2:53","172.20.0.3","172.20.0.2","TCP","58638 → 4433 [ACK] Seq=463 Ack=671 Win=63616 Len=0 TSval=2185855146 TSecr=2880426076"
"33","1.084598756","146","16:39:72:0f:c3:3f","3e:75:64:7d:c2:53","172.20.0.3","172.20.0.2","TLSv1.3","Change Cipher Spec, Application Data"
"34","1.084673732","66","16:39:72:0f:c3:3f","3e:75:64:7d:c2:53","172.20.0.3","172.20.0.2","TCP","58638 → 4433 [RST, ACK] Seq=543 Ack=671 Win=63616 Len=0 TSval=2185855147 TSecr=2880426076"
"35","1.094998455","74","16:39:72:0f:c3:3f","3e:75:64:7d:c2:53","172.20.0.3","172.20.0.2","TCP","58648 → 4433 [SYN] Seq=0 Win=64240 Len=0 MSS=1460 SACK_PERM TSval=2185855157 TSecr=0 WS=128"
"36","1.095023570","74","3e:75:64:7d:c2:53","16:39:72:0f:c3:3f","172.20.0.2","172.20.0.3","TCP","4433 → 58648 [SYN, ACK] Seq=0 Ack=1 Win=65160 Len=0 MSS=1460 SACK_PERM TSval=2880426087 TSecr=2185855157 WS=128"
"37","1.095037636","66","16:39:72:0f:c3:3f","3e:75:64:7d:c2:53","172.20.0.3","172.20.0.2","TCP","58648 → 4433 [ACK] Seq=1 Ack=1 Win=64256 Len=0 TSval=2185855157 TSecr=2880426087"
"38","1.095071840","528","16:39:72:0f:c3:3f","3e:75:64:7d:c2:53","172.20.0.3","172.20.0.2","TLSv1.2","Client Hello"
"39","1.095077031","66","3e:75:64:7d:c2:53","16:39:72:0f:c3:3f","172.20.0.2","172.20.0.3","TCP","4433 → 58648 [ACK] Seq=1 Ack=463 Win=64768 Len=0 TSval=2880426087 TSecr=2185855157"
"40","1.095474217","736","3e:75:64:7d:c2:53","16:39:72:0f:c3:3f","172.20.0.2","172.20.0.3","TLSv1.3","Server Hello, Change Cipher Spec, Application Data, Application Data, Application Data, Application Data"
"41","1.095497836","66","16:39:72:0f:c3:3f","3e:75:64:7d:c2:53","172.20.0.3","172.20.0.2","TCP","58648 → 4433 [ACK] Seq=463 Ack=671 Win=63616 Len=0 TSval=2185855158 TSecr=2880426088"
"42","1.096245275","146","16:39:72:0f:c3:3f","3e:75:64:7d:c2:53","172.20.0.3","172.20.0.2","TLSv1.3","Change Cipher Spec, Application Data"
"43","1.096296646","66","16:39:72:0f:c3:3f","3e:75:64:7d:c2:53","172.20.0.3","172.20.0.2","TCP","58648 → 4433 [RST, ACK] Seq=543 Ack=671 Win=63616 Len=0 TSval=2185855159 TSecr=2880426088"
"44","1.106124240","74","16:39:72:0f:c3:3f","3e:75:64:7d:c2:53","172.20.0.3","172.20.0.2","TCP","58658 → 4433 [SYN] Seq=0 Win=64240 Len=0 MSS=1460 SACK_PERM TSval=2185855168 TSecr=0 WS=128"
"45","2.001002094","42","16:39:72:0f:c3:3f","ff:ff:ff:ff:ff:ff",,,"ARP","ARP Announcement for 172.20.0.3"
"46","2.158302727","74","16:39:72:0f:c3:3f","3e:75:64:7d:c2:53","172.20.0.3","172.20.0.2","TCP","[TCP Retransmission] 58658 → 4433 [SYN] Seq=0 Win=64240 Len=0 MSS=1460 SACK_PERM TSval=2185856221 TSecr=0 WS=128"
"47","2.158318490","74","3e:75:64:7d:c2:53","16:39:72:0f:c3:3f","172.20.0.2","172.20.0.3","TCP","4433 → 58658 [SYN, ACK] Seq=0 Ack=1 Win=65160 Len=0 MSS=1460 SACK_PERM TSval=2880427151 TSecr=2185855168 WS=128"
"48","2.158348691","66","16:39:72:0f:c3:3f","3e:75:64:7d:c2:53","172.20.0.3","172.20.0.2","TCP","58658 → 4433 [ACK] Seq=1 Ack=1 Win=64256 Len=0 TSval=2185856221 TSecr=2880427151"
"49","2.158416531","528","16:39:72:0f:c3:3f","3e:75:64:7d:c2:53","172.20.0.3","172.20.0.2","TLSv1.2","Client Hello"
"50","2.158954632","736","3e:75:64:7d:c2:53","16:39:72:0f:c3:3f","172.20.0.2","172.20.0.3","TLSv1.3","Server Hello, Change Cipher Spec, Application Data, Application Data, Application Data, Application Data"
"51","2.158999658","66","16:39:72:0f:c3:3f","3e:75:64:7d:c2:53","172.20.0.3","172.20.0.2","TCP","58658 → 4433 [ACK] Seq=463 Ack=671 Win=63616 Len=0 TSval=2185856221 TSecr=2880427151"
"52","2.159969945","146","16:39:72:0f:c3:3f","3e:75:64:7d:c2:53","172.20.0.3","172.20.0.2","TLSv1.3","Change Cipher Spec, Application Data"
"53","2.160040489","66","16:39:72:0f:c3:3f","3e:75:64:7d:c2:53","172.20.0.3","172.20.0.2","TCP","58658 → 4433 [RST, ACK] Seq=543 Ack=671 Win=63616 Len=0 TSval=2185856222 TSecr=2880427151"
"54","2.171269458","74","16:39:72:0f:c3:3f","3e:75:64:7d:c2:53","172.20.0.3","172.20.0.2","TCP","58664 → 4433 [SYN] Seq=0 Win=64240 Len=0 MSS=1460 SACK_PERM TSval=2185856233 TSecr=0 WS=128"
"55","2.171300477","74","3e:75:64:7d:c2:53","16:39:72:0f:c3:3f","172.20.0.2","172.20.0.3","TCP","4433 → 58664 [SYN, ACK] Seq=0 Ack=1 Win=65160 Len=0 MSS=1460 SACK_PERM TSval=2880427164 TSecr=2185856233 WS=128"
"56","2.171317627","66","16:39:72:0f:c3:3f","3e:75:64:7d:c2:53","172.20.0.3","172.20.0.2","TCP","58664 → 4433 [ACK] Seq=1 Ack=1 Win=64256 Len=0 TSval=2185856234 TSecr=2880427164"
"57","2.171359333","528","16:39:72:0f:c3:3f","3e:75:64:7d:c2:53","172.20.0.3","172.20.0.2","TLSv1.2","Client Hello"
"58","2.171378425","66","3e:75:64:7d:c2:53","16:39:72:0f:c3:3f","172.20.0.2","172.20.0.3","TCP","4433 → 58664 [ACK] Seq=1 Ack=463 Win=64768 Len=0 TSval=2880427164 TSecr=2185856234"
"59","2.171880089","736","3e:75:64:7d:c2:53","16:39:72:0f:c3:3f","172.20.0.2","172.20.0.3","TLSv1.3","Server Hello, Change Cipher Spec, Application Data, Application Data, Application Data, Application Data"
"60","2.171906119","66","16:39:72:0f:c3:3f","3e:75:64:7d:c2:53","172.20.0.3","172.20.0.2","TCP","58664 → 4433 [ACK] Seq=463 Ack=671 Win=63616 Len=0 TSval=2185856234 TSecr=2880427164"
"61","2.172694935","146","16:39:72:0f:c3:3f","3e:75:64:7d:c2:53","172.20.0.3","172.20.0.2","TLSv1.3","Change Cipher Spec, Application Data"
"62","2.172749475","66","16:39:72:0f:c3:3f","3e:75:64:7d:c2:53","172.20.0.3","172.20.0.2","TCP","58664 → 4433 [RST, ACK] Seq=543 Ack=671 Win=63616 Len=0 TSval=2185856235 TSecr=2880427164"
"63","2.187736326","74","16:39:72:0f:c3:3f","3e:75:64:7d:c2:53","172.20.0.3","172.20.0.2","TCP","58672 → 4433 [SYN] Seq=0 Win=64240 Len=0 MSS=1460 SACK_PERM TSval=2185856250 TSecr=0 WS=128"
"64","2.187779871","74","3e:75:64:7d:c2:53","16:39:72:0f:c3:3f","172.20.0.2","172.20.0.3","TCP","4433 → 58672 [SYN, ACK] Seq=0 Ack=1 Win=65160 Len=0 MSS=1460 SACK_PERM TSval=2880427180 TSecr=2185856250 WS=128"
"65","2.187804082","66","16:39:72:0f:c3:3f","3e:75:64:7d:c2:53","172.20.0.3","172.20.0.2","TCP","58672 → 4433 [ACK] Seq=1 Ack=1 Win=64256 Len=0 TSval=2185856250 TSecr=2880427180"
"66","2.187855580","528","16:39:72:0f:c3:3f","3e:75:64:7d:c2:53","172.20.0.3","172.20.0.2","TLSv1.2","Client Hello"
"67","2.187864601","66","3e:75:64:7d:c2:53","16:39:72:0f:c3:3f","172.20.0.2","172.20.0.3","TCP","4433 → 58672 [ACK] Seq=1 Ack=463 Win=64768 Len=0 TSval=2880427180 TSecr=2185856250"
"68","2.188395990","736","3e:75:64:7d:c2:53","16:39:72:0f:c3:3f","172.20.0.2","172.20.0.3","TLSv1.3","Server Hello, Change Cipher Spec, Application Data, Application Data, Application Data, Application Data"
"69","2.188425832","66","16:39:72:0f:c3:3f","3e:75:64:7d:c2:53","172.20.0.3","172.20.0.2","TCP","58672 → 4433 [ACK] Seq=463 Ack=671 Win=63616 Len=0 TSval=2185856251 TSecr=2880427181"
"70","2.189644088","146","16:39:72:0f:c3:3f","3e:75:64:7d:c2:53","172.20.0.3","172.20.0.2","TLSv1.3","Change Cipher Spec, Application Data"
"71","2.189720534","66","16:39:72:0f:c3:3f","3e:75:64:7d:c2:53","172.20.0.3","172.20.0.2","TCP","58672 → 4433 [RST, ACK] Seq=543 Ack=671 Win=63616 Len=0 TSval=2185856252 TSecr=2880427181"
"72","2.202056676","74","16:39:72:0f:c3:3f","3e:75:64:7d:c2:53","172.20.0.3","172.20.0.2","TCP","37266 → 4433 [SYN] Seq=0 Win=64240 Len=0 MSS=1460 SACK_PERM TSval=2185856264 TSecr=0 WS=128"
"73","2.202091086","74","3e:75:64:7d:c2:53","16:39:72:0f:c3:3f","172.20.0.2","172.20.0.3","TCP","4433 → 37266 [SYN, ACK] Seq=0 Ack=1 Win=65160 Len=0 MSS=1460 SACK_PERM TSval=2880427194 TSecr=2185856264 WS=128"
"74","2.202111537","66","16:39:72:0f:c3:3f","3e:75:64:7d:c2:53","172.20.0.3","172.20.0.2","TCP","37266 → 4433 [ACK] Seq=1 Ack=1 Win=64256 Len=0 TSval=2185856264 TSecr=2880427194"
"75","2.202160027","528","16:39:72:0f:c3:3f","3e:75:64:7d:c2:53","172.20.0.3","172.20.0.2","TLSv1.2","Client Hello"
"76","2.202165517","66","3e:75:64:7d:c2:53","16:39:72:0f:c3:3f","172.20.0.2","172.20.0.3","TCP","4433 → 37266 [ACK] Seq=1 Ack=463 Win=64768 Len=0 TSval=2880427194 TSecr=2185856264"
"77","2.202751796","736","3e:75:64:7d:c2:53","16:39:72:0f:c3:3f","172.20.0.2","172.20.0.3","TLSv1.3","Server Hello, Change Cipher Spec, Application Data, Application Data, Application Data, Application Data"
"78","2.202793009","66","16:39:72:0f:c3:3f","3e:75:64:7d:c2:53","172.20.0.3","172.20.0.2","TCP","37266 → 4433 [ACK] Seq=463 Ack=671 Win=63616 Len=0 TSval=2185856265 TSecr=2880427195"
"79","2.203668649","146","16:39:72:0f:c3:3f","3e:75:64:7d:c2:53","172.20.0.3","172.20.0.2","TLSv1.3","Change Cipher Spec, Application Data"
"80","2.203745339","66","16:39:72:0f:c3:3f","3e:75:64:7d:c2:53","172.20.0.3","172.20.0.2","TCP","37266 → 4433 [RST, ACK] Seq=543 Ack=671 Win=63616 Len=0 TSval=2185856266 TSecr=2880427195"
"81","2.216068914","74","16:39:72:0f:c3:3f","3e:75:64:7d:c2:53","172.20.0.3","172.20.0.2","TCP","37278 → 4433 [SYN] Seq=0 Win=64240 Len=0 MSS=1460 SACK_PERM TSval=2185856278 TSecr=0 WS=128"
"82","3.246291540","74","3e:75:64:7d:c2:53","16:39:72:0f:c3:3f","172.20.0.2","172.20.0.3","TCP","4433 → 37278 [SYN, ACK] Seq=0 Ack=1 Win=65160 Len=0 MSS=1460 SACK_PERM TSval=2880428239 TSecr=2185856278 WS=128"
"83","3.246321850","74","16:39:72:0f:c3:3f","3e:75:64:7d:c2:53","172.20.0.3","172.20.0.2","TCP","[TCP Retransmission] 37278 → 4433 [SYN] Seq=0 Win=64240 Len=0 MSS=1460 SACK_PERM TSval=2185857309 TSecr=0 WS=128"
"84","3.246341007","74","3e:75:64:7d:c2:53","16:39:72:0f:c3:3f","172.20.0.2","172.20.0.3","TCP","[TCP Retransmission] 4433 → 37278 [SYN, ACK] Seq=0 Ack=1 Win=65160 Len=0 MSS=1460 SACK_PERM TSval=2880428239 TSecr=2185856278 WS=128"
"85","3.246378448","66","16:39:72:0f:c3:3f","3e:75:64:7d:c2:53","172.20.0.3","172.20.0.2","TCP","37278 → 4433 [ACK] Seq=1 Ack=1 Win=64256 Len=0 TSval=2185857309 TSecr=2880428239"
"86","3.246401587","66","16:39:72:0f:c3:3f","3e:75:64:7d:c2:53","172.20.0.3","172.20.0.2","TCP","[TCP Dup ACK 85#1] 37278 → 4433 [ACK] Seq=1 Ack=1 Win=64256 Len=0 TSval=2185857309 TSecr=2880428239"
"87","3.246455452","528","16:39:72:0f:c3:3f","3e:75:64:7d:c2:53","172.20.0.3","172.20.0.2","TLSv1.2","Client Hello"
"88","3.246469601","66","3e:75:64:7d:c2:53","16:39:72:0f:c3:3f","172.20.0.2","172.20.0.3","TCP","4433 → 37278 [ACK] Seq=1 Ack=463 Win=64768 Len=0 TSval=2880428239 TSecr=2185857309"
"89","3.247000535","736","3e:75:64:7d:c2:53","16:39:72:0f:c3:3f","172.20.0.2","172.20.0.3","TLSv1.3","Server Hello, Change Cipher Spec, Application Data, Application Data, Application Data, Application Data"
"90","3.247028428","66","16:39:72:0f:c3:3f","3e:75:64:7d:c2:53","172.20.0.3","172.20.0.2","TCP","37278 → 4433 [ACK] Seq=463 Ack=671 Win=63616 Len=0 TSval=2185857309 TSecr=2880428239"
"91","3.247953870","146","16:39:72:0f:c3:3f","3e:75:64:7d:c2:53","172.20.0.3","172.20.0.2","TLSv1.3","Change Cipher Spec, Application Data"
"92","3.248019380","66","16:39:72:0f:c3:3f","3e:75:64:7d:c2:53","172.20.0.3","172.20.0.2","TCP","37278 → 4433 [RST, ACK] Seq=543 Ack=671 Win=63616 Len=0 TSval=2185857310 TSecr=2880428239"
"93","3.259086211","74","16:39:72:0f:c3:3f","3e:75:64:7d:c2:53","172.20.0.3","172.20.0.2","TCP","37280 → 4433 [SYN] Seq=0 Win=64240 Len=0 MSS=1460 SACK_PERM TSval=2185857321 TSecr=0 WS=128"
"94","3.259110769","74","3e:75:64:7d:c2:53","16:39:72:0f:c3:3f","172.20.0.2","172.20.0.3","TCP","4433 → 37280 [SYN, ACK] Seq=0 Ack=1 Win=65160 Len=0 MSS=1460 SACK_PERM TSval=2880428251 TSecr=2185857321 WS=128"
"95","3.259126683","66","16:39:72:0f:c3:3f","3e:75:64:7d:c2:53","172.20.0.3","172.20.0.2","TCP","37280 → 4433 [ACK] Seq=1 Ack=1 Win=64256 Len=0 TSval=2185857321 TSecr=2880428251"
"96","3.259167794","528","16:39:72:0f:c3:3f","3e:75:64:7d:c2:53","172.20.0.3","172.20.0.2","TLSv1.2","Client Hello"
"97","3.259173632","66","3e:75:64:7d:c2:53","16:39:72:0f:c3:3f","172.20.0.2","172.20.0.3","TCP","4433 → 37280 [ACK] Seq=1 Ack=463 Win=64768 Len=0 TSval=2880428251 TSecr=2185857321"
"98","3.259595958","736","3e:75:64:7d:c2:53","16:39:72:0f:c3:3f","172.20.0.2","172.20.0.3","TLSv1.3","Server Hello, Change Cipher Spec, Application Data, Application Data, Application Data, Application Data"
"99","3.259624421","66","16:39:72:0f:c3:3f","3e:75:64:7d:c2:53","172.20.0.3","172.20.0.2","TCP","37280 → 4433 [ACK] Seq=463 Ack=671 Win=63616 Len=0 TSval=2185857322 TSecr=2880428252"
"100","3.260391307","146","16:39:72:0f:c3:3f","3e:75:64:7d:c2:53","172.20.0.3","172.20.0.2","TLSv1.3","Change Cipher Spec, Application Data"
"101","3.260443915","66","16:39:72:0f:c3:3f","3e:75:64:7d:c2:53","172.20.0.3","172.20.0.2","TCP","37280 → 4433 [RST, ACK] Seq=543 Ack=671 Win=63616 Len=0 TSval=2185857323 TSecr=2880428252"
"102","3.272367746","74","16:39:72:0f:c3:3f","3e:75:64:7d:c2:53","172.20.0.3","172.20.0.2","TCP","37294 → 4433 [SYN] Seq=0 Win=64240 Len=0 MSS=1460 SACK_PERM TSval=2185857335 TSecr=0 WS=128"
"103","3.272401325","74","3e:75:64:7d:c2:53","16:39:72:0f:c3:3f","172.20.0.2","172.20.0.3","TCP","4433 → 37294 [SYN, ACK] Seq=0 Ack=1 Win=65160 Len=0 MSS=1460 SACK_PERM TSval=2880428265 TSecr=2185857335 WS=128"
"104","3.272419020","66","16:39:72:0f:c3:3f","3e:75:64:7d:c2:53","172.20.0.3","172.20.0.2","TCP","37294 → 4433 [ACK] Seq=1 Ack=1 Win=64256 Len=0 TSval=2185857335 TSecr=2880428265"
"105","3.272463124","528","16:39:72:0f:c3:3f","3e:75:64:7d:c2:53","172.20.0.3","172.20.0.2","TLSv1.2","Client Hello"
"106","3.272469862","66","3e:75:64:7d:c2:53","16:39:72:0f:c3:3f","172.20.0.2","172.20.0.3","TCP","4433 → 37294 [ACK] Seq=1 Ack=463 Win=64768 Len=0 TSval=2880428265 TSecr=2185857335"
"107","3.272966771","736","3e:75:64:7d:c2:53","16:39:72:0f:c3:3f","172.20.0.2","172.20.0.3","TLSv1.3","Server Hello, Change Cipher Spec, Application Data, Application Data, Application Data, Application Data"
"108","3.273001716","66","16:39:72:0f:c3:3f","3e:75:64:7d:c2:53","172.20.0.3","172.20.0.2","TCP","37294 → 4433 [ACK] Seq=463 Ack=671 Win=63616 Len=0 TSval=2185857335 TSecr=2880428265"
"109","3.273808698","146","16:39:72:0f:c3:3f","3e:75:64:7d:c2:53","172.20.0.3","172.20.0.2","TLSv1.3","Change Cipher Spec, Application Data"
"110","3.273870566","66","16:39:72:0f:c3:3f","3e:75:64:7d:c2:53","172.20.0.3","172.20.0.2","TCP","37294 → 4433 [RST, ACK] Seq=543 Ack=671 Win=63616 Len=0 TSval=2185857336 TSecr=2880428265"
"111","3.284974993","74","16:39:72:0f:c3:3f","3e:75:64:7d:c2:53","172.20.0.3","172.20.0.2","TCP","37298 → 4433 [SYN] Seq=0 Win=64240 Len=0 MSS=1460 SACK_PERM TSval=2185857347 TSecr=0 WS=128"
"112","4.334317858","74","16:39:72:0f:c3:3f","3e:75:64:7d:c2:53","172.20.0.3","172.20.0.2","TCP","[TCP Retransmission] 37298 → 4433 [SYN] Seq=0 Win=64240 Len=0 MSS=1460 SACK_PERM TSval=2185858397 TSecr=0 WS=128"
"113","4.334336877","74","3e:75:64:7d:c2:53","16:39:72:0f:c3:3f","172.20.0.2","172.20.0.3","TCP","4433 → 37298 [SYN, ACK] Seq=0 Ack=1 Win=65160 Len=0 MSS=1460 SACK_PERM TSval=2880429327 TSecr=2185857347 WS=128"
"114","4.334371875","66","16:39:72:0f:c3:3f","3e:75:64:7d:c2:53","172.20.0.3","172.20.0.2","TCP","37298 → 4433 [ACK] Seq=1 Ack=1 Win=64256 Len=0 TSval=2185858397 TSecr=2880429327"
"115","4.334450519","528","16:39:72:0f:c3:3f","3e:75:64:7d:c2:53","172.20.0.3","172.20.0.2","TLSv1.2","Client Hello"
"116","4.334464409","66","3e:75:64:7d:c2:53","16:39:72:0f:c3:3f","172.20.0.2","172.20.0.3","TCP","4433 → 37298 [ACK] Seq=1 Ack=463 Win=64768 Len=0 TSval=2880429327 TSecr=2185858397"
"117","4.335013022","736","3e:75:64:7d:c2:53","16:39:72:0f:c3:3f","172.20.0.2","172.20.0.3","TLSv1.3","Server Hello, Change Cipher Spec, Application Data, Application Data, Application Data, Application Data"
"118","4.335075210","66","16:39:72:0f:c3:3f","3e:75:64:7d:c2:53","172.20.0.3","172.20.0.2","TCP","37298 → 4433 [ACK] Seq=463 Ack=671 Win=63616 Len=0 TSval=2185858397 TSecr=2880429327"
"119","4.336090836","146","16:39:72:0f:c3:3f","3e:75:64:7d:c2:53","172.20.0.3","172.20.0.2","TLSv1.3","Change Cipher Spec, Application Data"
"120","4.336171420","66","16:39:72:0f:c3:3f","3e:75:64:7d:c2:53","172.20.0.3","172.20.0.2","TCP","37298 → 4433 [RST, ACK] Seq=543 Ack=671 Win=63616 Len=0 TSval=2185858398 TSecr=2880429327"
"121","4.347446420","74","16:39:72:0f:c3:3f","3e:75:64:7d:c2:53","172.20.0.3","172.20.0.2","TCP","37312 → 4433 [SYN] Seq=0 Win=64240 Len=0 MSS=1460 SACK_PERM TSval=2185858410 TSecr=0 WS=128"
"122","4.347483387","74","3e:75:64:7d:c2:53","16:39:72:0f:c3:3f","172.20.0.2","172.20.0.3","TCP","4433 → 37312 [SYN, ACK] Seq=0 Ack=1 Win=65160 Len=0 MSS=1460 SACK_PERM TSval=2880429340 TSecr=2185858410 WS=128"
"123","4.347500059","66","16:39:72:0f:c3:3f","3e:75:64:7d:c2:53","172.20.0.3","172.20.0.2","TCP","37312 → 4433 [ACK] Seq=1 Ack=1 Win=64256 Len=0 TSval=2185858410 TSecr=2880429340"
"124","4.347537631","528","16:39:72:0f:c3:3f","3e:75:64:7d:c2:53","172.20.0.3","172.20.0.2","TLSv1.2","Client Hello"
"125","4.347542365","66","3e:75:64:7d:c2:53","16:39:72:0f:c3:3f","172.20.0.2","172.20.0.3","TCP","4433 → 37312 [ACK] Seq=1 Ack=463 Win=64768 Len=0 TSval=2880429340 TSecr=2185858410"
"126","4.348032639","736","3e:75:64:7d:c2:53","16:39:72:0f:c3:3f","172.20.0.2","172.20.0.3","TLSv1.3","Server Hello, Change Cipher Spec, Application Data, Application Data, Application Data, Application Data"
"127","4.348063258","66","16:39:72:0f:c3:3f","3e:75:64:7d:c2:53","172.20.0.3","172.20.0.2","TCP","37312 → 4433 [ACK] Seq=463 Ack=671 Win=63616 Len=0 TSval=2185858410 TSecr=2880429340"
"128","4.348844240","146","16:39:72:0f:c3:3f","3e:75:64:7d:c2:53","172.20.0.3","172.20.0.2","TLSv1.3","Change Cipher Spec, Application Data"
"129","4.348897640","66","16:39:72:0f:c3:3f","3e:75:64:7d:c2:53","172.20.0.3","172.20.0.2","TCP","37312 → 4433 [RST, ACK] Seq=543 Ack=671 Win=63616 Len=0 TSval=2185858411 TSecr=2880429340"
"130","4.358532595","74","16:39:72:0f:c3:3f","3e:75:64:7d:c2:53","172.20.0.3","172.20.0.2","TCP","37316 → 4433 [SYN] Seq=0 Win=64240 Len=0 MSS=1460 SACK_PERM TSval=2185858421 TSecr=0 WS=128"
"131","4.358558623","74","3e:75:64:7d:c2:53","16:39:72:0f:c3:3f","172.20.0.2","172.20.0.3","TCP","4433 → 37316 [SYN, ACK] Seq=0 Ack=1 Win=65160 Len=0 MSS=1460 SACK_PERM TSval=2880429351 TSecr=2185858421 WS=128"
"132","4.358573163","66","16:39:72:0f:c3:3f","3e:75:64:7d:c2:53","172.20.0.3","172.20.0.2","TCP","37316 → 4433 [ACK] Seq=1 Ack=1 Win=64256 Len=0 TSval=2185858421 TSecr=2880429351"
"133","4.358604134","528","16:39:72:0f:c3:3f","3e:75:64:7d:c2:53","172.20.0.3","172.20.0.2","TLSv1.2","Client Hello"
"134","4.358609149","66","3e:75:64:7d:c2:53","16:39:72:0f:c3:3f","172.20.0.2","172.20.0.3","TCP","4433 → 37316 [ACK] Seq=1 Ack=463 Win=64768 Len=0 TSval=2880429351 TSecr=2185858421"
"135","4.359011068","736","3e:75:64:7d:c2:53","16:39:72:0f:c3:3f","172.20.0.2","172.20.0.3","TLSv1.3","Server Hello, Change Cipher Spec, Application Data, Application Data, Application Data, Application Data"
"136","4.359035542","66","16:39:72:0f:c3:3f","3e:75:64:7d:c2:53","172.20.0.3","172.20.0.2","TCP","37316 → 4433 [ACK] Seq=463 Ack=671 Win=63616 Len=0 TSval=2185858421 TSecr=2880429351"
"137","4.359766766","146","16:39:72:0f:c3:3f","3e:75:64:7d:c2:53","172.20.0.3","172.20.0.2","TLSv1.3","Change Cipher Spec, Application Data"
"138","4.359818431","66","16:39:72:0f:c3:3f","3e:75:64:7d:c2:53","172.20.0.3","172.20.0.2","TCP","37316 → 4433 [RST, ACK] Seq=543 Ack=671 Win=63616 Len=0 TSval=2185858422 TSecr=2880429351"
"139","4.368971394","74","16:39:72:0f:c3:3f","3e:75:64:7d:c2:53","172.20.0.3","172.20.0.2","TCP","37318 → 4433 [SYN] Seq=0 Win=64240 Len=0 MSS=1460 SACK_PERM TSval=2185858431 TSecr=0 WS=128"
"140","4.368997397","74","3e:75:64:7d:c2:53","16:39:72:0f:c3:3f","172.20.0.2","172.20.0.3","TCP","4433 → 37318 [SYN, ACK] Seq=0 Ack=1 Win=65160 Len=0 MSS=1460 SACK_PERM TSval=2880429361 TSecr=2185858431 WS=128"
"141","4.369011110","66","16:39:72:0f:c3:3f","3e:75:64:7d:c2:53","172.20.0.3","172.20.0.2","TCP","37318 → 4433 [ACK] Seq=1 Ack=1 Win=64256 Len=0 TSval=2185858431 TSecr=2880429361"
"142","4.369040681","528","16:39:72:0f:c3:3f","3e:75:64:7d:c2:53","172.20.0.3","172.20.0.2","TLSv1.2","Client Hello"
"143","4.369430821","736","3e:75:64:7d:c2:53","16:39:72:0f:c3:3f","172.20.0.2","172.20.0.3","TLSv1.3","Server Hello, Change Cipher Spec, Application Data, Application Data, Application Data, Application Data"
"144","4.369454095","66","16:39:72:0f:c3:3f","3e:75:64:7d:c2:53","172.20.0.3","172.20.0.2","TCP","37318 → 4433 [ACK] Seq=463 Ack=671 Win=63616 Len=0 TSval=2185858432 TSecr=2880429362"
"145","4.370207231","146","16:39:72:0f:c3:3f","3e:75:64:7d:c2:53","172.20.0.3","172.20.0.2","TLSv1.3","Change Cipher Spec, Application Data"
"146","4.370274110","66","16:39:72:0f:c3:3f","3e:75:64:7d:c2:53","172.20.0.3","172.20.0.2","TCP","37318 → 4433 [RST, ACK] Seq=543 Ack=671 Win=63616 Len=0 TSval=2185858433 TSecr=2880429362"
"147","4.379517882","74","16:39:72:0f:c3:3f","3e:75:64:7d:c2:53","172.20.0.3","172.20.0.2","TCP","37334 → 4433 [SYN] Seq=0 Win=64240 Len=0 MSS=1460 SACK_PERM TSval=2185858442 TSecr=0 WS=128"
"148","4.379539342","74","3e:75:64:7d:c2:53","16:39:72:0f:c3:3f","172.20.0.2","172.20.0.3","TCP","4433 → 37334 [SYN, ACK] Seq=0 Ack=1 Win=65160 Len=0 MSS=1460 SACK_PERM TSval=2880429372 TSecr=2185858442 WS=128"
"149","4.379553811","66","16:39:72:0f:c3:3f","3e:75:64:7d:c2:53","172.20.0.3","172.20.0.2","TCP","37334 → 4433 [ACK] Seq=1 Ack=1 Win=64256 Len=0 TSval=2185858442 TSecr=2880429372"
"150","4.379589117","528","16:39:72:0f:c3:3f","3e:75:64:7d:c2:53","172.20.0.3","172.20.0.2","TLSv1.2","Client Hello"
"151","4.379595694","66","3e:75:64:7d:c2:53","16:39:72:0f:c3:3f","172.20.0.2","172.20.0.3","TCP","4433 → 37334 [ACK] Seq=1 Ack=463 Win=64768 Len=0 TSval=2880429372 TSecr=2185858442"
"152","4.379946941","736","3e:75:64:7d:c2:53","16:39:72:0f:c3:3f","172.20.0.2","172.20.0.3","TLSv1.3","Server Hello, Change Cipher Spec, Application Data, Application Data, Application Data, Application Data"
"153","4.379970643","66","16:39:72:0f:c3:3f","3e:75:64:7d:c2:53","172.20.0.3","172.20.0.2","TCP","37334 → 4433 [ACK] Seq=463 Ack=671 Win=63616 Len=0 TSval=2185858442 TSecr=2880429372"
"154","4.380695405","146","16:39:72:0f:c3:3f","3e:75:64:7d:c2:53","172.20.0.3","172.20.0.2","TLSv1.3","Change Cipher Spec, Application Data"
"155","4.380749384","66","16:39:72:0f:c3:3f","3e:75:64:7d:c2:53","172.20.0.3","172.20.0.2","TCP","37334 → 4433 [RST, ACK] Seq=543 Ack=671 Win=63616 Len=0 TSval=2185858443 TSecr=2880429372"
"156","4.389775553","74","16:39:72:0f:c3:3f","3e:75:64:7d:c2:53","172.20.0.3","172.20.0.2","TCP","37350 → 4433 [SYN] Seq=0 Win=64240 Len=0 MSS=1460 SACK_PERM TSval=2185858452 TSecr=0 WS=128"
"157","5.422303041","74","16:39:72:0f:c3:3f","3e:75:64:7d:c2:53","172.20.0.3","172.20.0.2","TCP","[TCP Retransmission] 37350 → 4433 [SYN] Seq=0 Win=64240 Len=0 MSS=1460 SACK_PERM TSval=2185859485 TSecr=0 WS=128"
"158","5.422319844","74","3e:75:64:7d:c2:53","16:39:72:0f:c3:3f","172.20.0.2","172.20.0.3","TCP","4433 → 37350 [SYN, ACK] Seq=0 Ack=1 Win=65160 Len=0 MSS=1460 SACK_PERM TSval=2880430415 TSecr=2185858452 WS=128"
"159","5.422350463","66","16:39:72:0f:c3:3f","3e:75:64:7d:c2:53","172.20.0.3","172.20.0.2","TCP","37350 → 4433 [ACK] Seq=1 Ack=1 Win=64256 Len=0 TSval=2185859485 TSecr=2880430415"
"160","5.422423785","528","16:39:72:0f:c3:3f","3e:75:64:7d:c2:53","172.20.0.3","172.20.0.2","TLSv1.2","Client Hello"
"161","5.422431242","66","3e:75:64:7d:c2:53","16:39:72:0f:c3:3f","172.20.0.2","172.20.0.3","TCP","4433 → 37350 [ACK] Seq=1 Ack=463 Win=64768 Len=0 TSval=2880430415 TSecr=2185859485"
"162","5.422986898","736","3e:75:64:7d:c2:53","16:39:72:0f:c3:3f","172.20.0.2","172.20.0.3","TLSv1.3","Server Hello, Change Cipher Spec, Application Data, Application Data, Application Data, Application Data"
"163","5.423018767","66","16:39:72:0f:c3:3f","3e:75:64:7d:c2:53","172.20.0.3","172.20.0.2","TCP","37350 → 4433 [ACK] Seq=463 Ack=671 Win=63616 Len=0 TSval=2185859485 TSecr=2880430415"
"164","5.423987363","146","16:39:72:0f:c3:3f","3e:75:64:7d:c2:53","172.20.0.3","172.20.0.2","TLSv1.3","Change Cipher Spec, Application Data"
"165","5.424055347","66","16:39:72:0f:c3:3f","3e:75:64:7d:c2:53","172.20.0.3","172.20.0.2","TCP","37350 → 4433 [RST, ACK] Seq=543 Ack=671 Win=63616 Len=0 TSval=2185859486 TSecr=2880430415"
"166","5.435140107","74","16:39:72:0f:c3:3f","3e:75:64:7d:c2:53","172.20.0.3","172.20.0.2","TCP","37354 → 4433 [SYN] Seq=0 Win=64240 Len=0 MSS=1460 SACK_PERM TSval=2185859497 TSecr=0 WS=128"
"167","6.446290373","74","3e:75:64:7d:c2:53","16:39:72:0f:c3:3f","172.20.0.2","172.20.0.3","TCP","4433 → 37354 [SYN, ACK] Seq=0 Ack=1 Win=65160 Len=0 MSS=1460 SACK_PERM TSval=2880431439 TSecr=2185859497 WS=128"
"168","6.446326815","74","16:39:72:0f:c3:3f","3e:75:64:7d:c2:53","172.20.0.3","172.20.0.2","TCP","[TCP Retransmission] 37354 → 4433 [SYN] Seq=0 Win=64240 Len=0 MSS=1460 SACK_PERM TSval=2185860509 TSecr=0 WS=128"
"169","6.446342948","74","3e:75:64:7d:c2:53","16:39:72:0f:c3:3f","172.20.0.2","172.20.0.3","TCP","[TCP Retransmission] 4433 → 37354 [SYN, ACK] Seq=0 Ack=1 Win=65160 Len=0 MSS=1460 SACK_PERM TSval=2880431439 TSecr=2185859497 WS=128"
"170","6.446380449","66","16:39:72:0f:c3:3f","3e:75:64:7d:c2:53","172.20.0.3","172.20.0.2","TCP","37354 → 4433 [ACK] Seq=1 Ack=1 Win=64256 Len=0 TSval=2185860509 TSecr=2880431439"
"171","6.446405686","66","16:39:72:0f:c3:3f","3e:75:64:7d:c2:53","172.20.0.3","172.20.0.2","TCP","[TCP Dup ACK 170#1] 37354 → 4433 [ACK] Seq=1 Ack=1 Win=64256 Len=0 TSval=2185860509 TSecr=2880431439"
"172","6.446486175","528","16:39:72:0f:c3:3f","3e:75:64:7d:c2:53","172.20.0.3","172.20.0.2","TLSv1.2","Client Hello"
"173","6.446501111","66","3e:75:64:7d:c2:53","16:39:72:0f:c3:3f","172.20.0.2","172.20.0.3","TCP","4433 → 37354 [ACK] Seq=1 Ack=463 Win=64768 Len=0 TSval=2880431439 TSecr=2185860509"
"174","6.447026671","736","3e:75:64:7d:c2:53","16:39:72:0f:c3:3f","172.20.0.2","172.20.0.3","TLSv1.3","Server Hello, Change Cipher Spec, Application Data, Application Data, Application Data, Application Data"
"175","6.447053545","66","16:39:72:0f:c3:3f","3e:75:64:7d:c2:53","172.20.0.3","172.20.0.2","TCP","37354 → 4433 [ACK] Seq=463 Ack=671 Win=63616 Len=0 TSval=2185860509 TSecr=2880431439"
"176","6.447976584","146","16:39:72:0f:c3:3f","3e:75:64:7d:c2:53","172.20.0.3","172.20.0.2","TLSv1.3","Change Cipher Spec, Application Data"
"177","6.448042686","66","16:39:72:0f:c3:3f","3e:75:64:7d:c2:53","172.20.0.3","172.20.0.2","TCP","37354 → 4433 [RST, ACK] Seq=543 Ack=671 Win=63616 Len=0 TSval=2185860510 TSecr=2880431439"
"178","6.459242595","74","16:39:72:0f:c3:3f","3e:75:64:7d:c2:53","172.20.0.3","172.20.0.2","TCP","37364 → 4433 [SYN] Seq=0 Win=64240 Len=0 MSS=1460 SACK_PERM TSval=2185860521 TSecr=0 WS=128"
"179","6.459269405","74","3e:75:64:7d:c2:53","16:39:72:0f:c3:3f","172.20.0.2","172.20.0.3","TCP","4433 → 37364 [SYN, ACK] Seq=0 Ack=1 Win=65160 Len=0 MSS=1460 SACK_PERM TSval=2880431452 TSecr=2185860521 WS=128"
"180","6.459283804","66","16:39:72:0f:c3:3f","3e:75:64:7d:c2:53","172.20.0.3","172.20.0.2","TCP","37364 → 4433 [ACK] Seq=1 Ack=1 Win=64256 Len=0 TSval=2185860522 TSecr=2880431452"
"181","6.459349293","528","16:39:72:0f:c3:3f","3e:75:64:7d:c2:53","172.20.0.3","172.20.0.2","TLSv1.2","Client Hello"
"182","6.459355031","66","3e:75:64:7d:c2:53","16:39:72:0f:c3:3f","172.20.0.2","172.20.0.3","TCP","4433 → 37364 [ACK] Seq=1 Ack=463 Win=64768 Len=0 TSval=2880431452 TSecr=2185860522"
"183","6.662266351","736","3e:75:64:7d:c2:53","16:39:72:0f:c3:3f","172.20.0.2","172.20.0.3","TLSv1.3","Server Hello, Change Cipher Spec, Application Data, Application Data, Application Data, Application Data"
"184","6.662343715","66","16:39:72:0f:c3:3f","3e:75:64:7d:c2:53","172.20.0.3","172.20.0.2","TCP","37364 → 4433 [ACK] Seq=463 Ack=671 Win=63616 Len=0 TSval=2185860725 TSecr=2880431655"
"185","6.663461189","146","16:39:72:0f:c3:3f","3e:75:64:7d:c2:53","172.20.0.3","172.20.0.2","TLSv1.3","Change Cipher Spec, Application Data"
"186","6.663534366","66","16:39:72:0f:c3:3f","3e:75:64:7d:c2:53","172.20.0.3","172.20.0.2","TCP","37364 → 4433 [RST, ACK] Seq=543 Ack=671 Win=63616 Len=0 TSval=2185860726 TSecr=2880431655"
"187","6.674525122","74","16:39:72:0f:c3:3f","3e:75:64:7d:c2:53","172.20.0.3","172.20.0.2","TCP","37370 → 4433 [SYN] Seq=0 Win=64240 Len=0 MSS=1460 SACK_PERM TSval=2185860737 TSecr=0 WS=128"
"188","7.726302353","74","16:39:72:0f:c3:3f","3e:75:64:7d:c2:53","172.20.0.3","172.20.0.2","TCP","[TCP Retransmission] 37370 → 4433 [SYN] Seq=0 Win=64240 Len=0 MSS=1460 SACK_PERM TSval=2185861789 TSecr=0 WS=128"
"189","7.726321724","74","3e:75:64:7d:c2:53","16:39:72:0f:c3:3f","172.20.0.2","172.20.0.3","TCP","4433 → 37370 [SYN, ACK] Seq=0 Ack=1 Win=65160 Len=0 MSS=1460 SACK_PERM TSval=2880432719 TSecr=2185860737 WS=128"
"190","7.726352829","66","16:39:72:0f:c3:3f","3e:75:64:7d:c2:53","172.20.0.3","172.20.0.2","TCP","37370 → 4433 [ACK] Seq=1 Ack=1 Win=64256 Len=0 TSval=2185861789 TSecr=2880432719"
"191","7.726421537","528","16:39:72:0f:c3:3f","3e:75:64:7d:c2:53","172.20.0.3","172.20.0.2","TLSv1.2","Client Hello"
"192","7.726428609","66","3e:75:64:7d:c2:53","16:39:72:0f:c3:3f","172.20.0.2","172.20.0.3","TCP","4433 → 37370 [ACK] Seq=1 Ack=463 Win=64768 Len=0 TSval=2880432719 TSecr=2185861789"
"193","7.726947908","736","3e:75:64:7d:c2:53","16:39:72:0f:c3:3f","172.20.0.2","172.20.0.3","TLSv1.3","Server Hello, Change Cipher Spec, Application Data, Application Data, Application Data, Application Data"
"194","7.726978735","66","16:39:72:0f:c3:3f","3e:75:64:7d:c2:53","172.20.0.3","172.20.0.2","TCP","37370 → 4433 [ACK] Seq=463 Ack=671 Win=63616 Len=0 TSval=2185861789 TSecr=2880432719"
"195","7.727872743","146","16:39:72:0f:c3:3f","3e:75:64:7d:c2:53","172.20.0.3","172.20.0.2","TLSv1.3","Change Cipher Spec, Application Data"
"196","7.727932993","66","16:39:72:0f:c3:3f","3e:75:64:7d:c2:53","172.20.0.3","172.20.0.2","TCP","37370 → 4433 [RST, ACK] Seq=543 Ack=671 Win=63616 Len=0 TSval=2185861790 TSecr=2880432719"
"197","7.738765609","74","16:39:72:0f:c3:3f","3e:75:64:7d:c2:53","172.20.0.3","172.20.0.2","TCP","37380 → 4433 [SYN] Seq=0 Win=64240 Len=0 MSS=1460 SACK_PERM TSval=2185861801 TSecr=0 WS=128"
"198","7.738788397","74","3e:75:64:7d:c2:53","16:39:72:0f:c3:3f","172.20.0.2","172.20.0.3","TCP","4433 → 37380 [SYN, ACK] Seq=0 Ack=1 Win=65160 Len=0 MSS=1460 SACK_PERM TSval=2880432731 TSecr=2185861801 WS=128"
"199","7.738804547","66","16:39:72:0f:c3:3f","3e:75:64:7d:c2:53","172.20.0.3","172.20.0.2","TCP","37380 → 4433 [ACK] Seq=1 Ack=1 Win=64256 Len=0 TSval=2185861801 TSecr=2880432731"
"200","7.738837886","528","16:39:72:0f:c3:3f","3e:75:64:7d:c2:53","172.20.0.3","172.20.0.2","TLSv1.2","Client Hello"
"201","7.739277727","736","3e:75:64:7d:c2:53","16:39:72:0f:c3:3f","172.20.0.2","172.20.0.3","TLSv1.3","Server Hello, Change Cipher Spec, Application Data, Application Data, Application Data, Application Data"
"202","7.739303578","66","16:39:72:0f:c3:3f","3e:75:64:7d:c2:53","172.20.0.3","172.20.0.2","TCP","37380 → 4433 [ACK] Seq=463 Ack=671 Win=63616 Len=0 TSval=2185861802 TSecr=2880432732"
"203","7.740048431","146","16:39:72:0f:c3:3f","3e:75:64:7d:c2:53","172.20.0.3","172.20.0.2","TLSv1.3","Change Cipher Spec, Application Data"
"204","7.740102432","66","16:39:72:0f:c3:3f","3e:75:64:7d:c2:53","172.20.0.3","172.20.0.2","TCP","37380 → 4433 [RST, ACK] Seq=543 Ack=671 Win=63616 Len=0 TSval=2185861802 TSecr=2880432732"
"205","7.749772854","74","16:39:72:0f:c3:3f","3e:75:64:7d:c2:53","172.20.0.3","172.20.0.2","TCP","37392 → 4433 [SYN] Seq=0 Win=64240 Len=0 MSS=1460 SACK_PERM TSval=2185861812 TSecr=0 WS=128"
"206","7.749796551","74","3e:75:64:7d:c2:53","16:39:72:0f:c3:3f","172.20.0.2","172.20.0.3","TCP","4433 → 37392 [SYN, ACK] Seq=0 Ack=1 Win=65160 Len=0 MSS=1460 SACK_PERM TSval=2880432742 TSecr=2185861812 WS=128"
"207","7.749811689","66","16:39:72:0f:c3:3f","3e:75:64:7d:c2:53","172.20.0.3","172.20.0.2","TCP","37392 → 4433 [ACK] Seq=1 Ack=1 Win=64256 Len=0 TSval=2185861812 TSecr=2880432742"
"208","7.749843263","528","16:39:72:0f:c3:3f","3e:75:64:7d:c2:53","172.20.0.3","172.20.0.2","TLSv1.2","Client Hello"
"209","7.749847734","66","3e:75:64:7d:c2:53","16:39:72:0f:c3:3f","172.20.0.2","172.20.0.3","TCP","4433 → 37392 [ACK] Seq=1 Ack=463 Win=64768 Len=0 TSval=2880432742 TSecr=2185861812"
"210","7.958265075","736","3e:75:64:7d:c2:53","16:39:72:0f:c3:3f","172.20.0.2","172.20.0.3","TLSv1.3","Server Hello, Change Cipher Spec, Application Data, Application Data, Application Data, Application Data"
"211","7.958331684","66","16:39:72:0f:c3:3f","3e:75:64:7d:c2:53","172.20.0.3","172.20.0.2","TCP","37392 → 4433 [ACK] Seq=463 Ack=671 Win=63616 Len=0 TSval=2185862021 TSecr=2880432951"
"212","7.959448203","146","16:39:72:0f:c3:3f","3e:75:64:7d:c2:53","172.20.0.3","172.20.0.2","TLSv1.3","Change Cipher Spec, Application Data"
"213","7.959516069","66","16:39:72:0f:c3:3f","3e:75:64:7d:c2:53","172.20.0.3","172.20.0.2","TCP","37392 → 4433 [RST, ACK] Seq=543 Ack=671 Win=63616 Len=0 TSval=2185862022 TSecr=2880432951"
"214","7.970366038","74","16:39:72:0f:c3:3f","3e:75:64:7d:c2:53","172.20.0.3","172.20.0.2","TCP","37408 → 4433 [SYN] Seq=0 Win=64240 Len=0 MSS=1460 SACK_PERM TSval=2185862033 TSecr=0 WS=128"
"215","7.970404921","74","3e:75:64:7d:c2:53","16:39:72:0f:c3:3f","172.20.0.2","172.20.0.3","TCP","4433 → 37408 [SYN, ACK] Seq=0 Ack=1 Win=65160 Len=0 MSS=1460 SACK_PERM TSval=2880432963 TSecr=2185862033 WS=128"
"216","7.970425054","66","16:39:72:0f:c3:3f","3e:75:64:7d:c2:53","172.20.0.3","172.20.0.2","TCP","37408 → 4433 [ACK] Seq=1 Ack=1 Win=64256 Len=0 TSval=2185862033 TSecr=2880432963"
"217","7.970466544","528","16:39:72:0f:c3:3f","3e:75:64:7d:c2:53","172.20.0.3","172.20.0.2","TLSv1.2","Client Hello"
"218","7.970471055","66","3e:75:64:7d:c2:53","16:39:72:0f:c3:3f","172.20.0.2","172.20.0.3","TCP","4433 → 37408 [ACK] Seq=1 Ack=463 Win=64768 Len=0 TSval=2880432963 TSecr=2185862033"
"219","7.970926490","736","3e:75:64:7d:c2:53","16:39:72:0f:c3:3f","172.20.0.2","172.20.0.3","TLSv1.3","Server Hello, Change Cipher Spec, Application Data, Application Data, Application Data, Application Data"
"220","7.970953025","66","16:39:72:0f:c3:3f","3e:75:64:7d:c2:53","172.20.0.3","172.20.0.2","TCP","37408 → 4433 [ACK] Seq=463 Ack=671 Win=63616 Len=0 TSval=2185862033 TSecr=2880432963"
"221","7.971730832","146","16:39:72:0f:c3:3f","3e:75:64:7d:c2:53","172.20.0.3","172.20.0.2","TLSv1.3","Change Cipher Spec, Application Data"
"222","7.971787434","66","16:39:72:0f:c3:3f","3e:75:64:7d:c2:53","172.20.0.3","172.20.0.2","TCP","37408 → 4433 [RST, ACK] Seq=543 Ack=671 Win=63616 Len=0 TSval=2185862034 TSecr=2880432963"
"223","7.981778568","74","16:39:72:0f:c3:3f","3e:75:64:7d:c2:53","172.20.0.3","172.20.0.2","TCP","37416 → 4433 [SYN] Seq=0 Win=64240 Len=0 MSS=1460 SACK_PERM TSval=2185862044 TSecr=0 WS=128"
