frame.number,frame.time_relative,frame.len,eth.src,eth.dst,ip.src,ip.dst,_ws.col.protocol,_ws.col.info
"1","0.000000000","42","96:24:75:f7:ad:41","ff:ff:ff:ff:ff:ff",,,"ARP","ARP Announcement for 172.20.0.3"
"2","0.033782138","42","96:24:75:f7:ad:41","ff:ff:ff:ff:ff:ff",,,"ARP","Who has 172.20.0.2? Tell 172.20.0.3"
"3","0.033810581","42","76:38:f9:a6:9c:44","96:24:75:f7:ad:41",,,"ARP","172.20.0.2 is at 76:38:f9:a6:9c:44"
"4","0.033817421","74","96:24:75:f7:ad:41","76:38:f9:a6:9c:44","172.20.0.3","172.20.0.2","TCP","45010 → 4433 [SYN] Seq=0 Win=64240 Len=0 MSS=1460 SACK_PERM TSval=2182300928 TSecr=0 WS=128"
"5","0.033840927","74","76:38:f9:a6:9c:44","96:24:75:f7:ad:41","172.20.0.2","172.20.0.3","TCP","4433 → 45010 [SYN, ACK] Seq=0 Ack=1 Win=65160 Len=0 MSS=1460 SACK_PERM TSval=2876871858 TSecr=2182300928 WS=128"
"6","0.033861120","66","96:24:75:f7:ad:41","76:38:f9:a6:9c:44","172.20.0.3","172.20.0.2","TCP","45010 → 4433 [ACK] Seq=1 Ack=1 Win=64256 Len=0 TSval=2182300928 TSecr=2876871858"
"7","0.033907071","1353","96:24:75:f7:ad:41","76:38:f9:a6:9c:44","172.20.0.3","172.20.0.2","TLSv1.2","Client Hello"
"8","0.033912416","66","76:38:f9:a6:9c:44","96:24:75:f7:ad:41","172.20.0.2","172.20.0.3","TCP","4433 → 45010 [ACK] Seq=1 Ack=1288 Win=64128 Len=0 TSval=2876871858 TSecr=2182300928"
"9","0.038115677","1537","76:38:f9:a6:9c:44","96:24:75:f7:ad:41","172.20.0.2","172.20.0.3","TLSv1.3","Server Hello, Change Cipher Spec, Application Data, Application Data, Application Data, Application Data"
"10","0.038159535","66","96:24:75:f7:ad:41","76:38:f9:a6:9c:44","172.20.0.3","172.20.0.2","TCP","45010 → 4433 [ACK] Seq=1288 Ack=1472 Win=64128 Len=0 TSval=2182300932 TSecr=2876871862"
"11","0.040703635","146","96:24:75:f7:ad:41","76:38:f9:a6:9c:44","172.20.0.3","172.20.0.2","TLSv1.3","Change Cipher Spec, Application Data"
"12","0.040766274","66","96:24:75:f7:ad:41","76:38:f9:a6:9c:44","172.20.0.3","172.20.0.2","TCP","45010 → 4433 [RST, ACK] Seq=1368 Ack=1472 Win=64128 Len=0 TSval=2182300935 TSecr=2876871862"
"13","0.054925833","74","96:24:75:f7:ad:41","76:38:f9:a6:9c:44","172.20.0.3","172.20.0.2","TCP","45024 → 4433 [SYN] Seq=0 Win=64240 Len=0 MSS=1460 SACK_PERM TSval=2182300949 TSecr=0 WS=128"
"14","0.054955022","74","76:38:f9:a6:9c:44","96:24:75:f7:ad:41","172.20.0.2","172.20.0.3","TCP","4433 → 45024 [SYN, ACK] Seq=0 Ack=1 Win=65160 Len=0 MSS=1460 SACK_PERM TSval=2876871879 TSecr=2182300949 WS=128"
"15","0.054972914","66","96:24:75:f7:ad:41","76:38:f9:a6:9c:44","172.20.0.3","172.20.0.2","TCP","45024 → 4433 [ACK] Seq=1 Ack=1 Win=64256 Len=0 TSval=2182300949 TSecr=2876871879"
"16","0.055016510","1353","96:24:75:f7:ad:41","76:38:f9:a6:9c:44","172.20.0.3","172.20.0.2","TLSv1.2","Client Hello"
"17","0.055023941","66","76:38:f9:a6:9c:44","96:24:75:f7:ad:41","172.20.0.2","172.20.0.3","TCP","4433 → 45024 [ACK] Seq=1 Ack=1288 Win=64128 Len=0 TSval=2876871879 TSecr=2182300949"
"18","0.056606309","1537","76:38:f9:a6:9c:44","96:24:75:f7:ad:41","172.20.0.2","172.20.0.3","TLSv1.3","Server Hello, Change Cipher Spec, Application Data, Application Data, Application Data, Application Data"
"19","0.056638341","66","96:24:75:f7:ad:41","76:38:f9:a6:9c:44","172.20.0.3","172.20.0.2","TCP","45024 → 4433 [ACK] Seq=1288 Ack=1472 Win=64128 Len=0 TSval=2182300951 TSecr=2876871881"
"20","0.059335252","146","96:24:75:f7:ad:41","76:38:f9:a6:9c:44","172.20.0.3","172.20.0.2","TLSv1.3","Change Cipher Spec, Application Data"
"21","0.059392882","66","96:24:75:f7:ad:41","76:38:f9:a6:9c:44","172.20.0.3","172.20.0.2","TCP","45024 → 4433 [RST, ACK] Seq=1368 Ack=1472 Win=64128 Len=0 TSval=2182300954 TSecr=2876871881"
"22","0.073123604","74","96:24:75:f7:ad:41","76:38:f9:a6:9c:44","172.20.0.3","172.20.0.2","TCP","45034 → 4433 [SYN] Seq=0 Win=64240 Len=0 MSS=1460 SACK_PERM TSval=2182300967 TSecr=0 WS=128"
"23","0.073174309","74","76:38:f9:a6:9c:44","96:24:75:f7:ad:41","172.20.0.2","172.20.0.3","TCP","4433 → 45034 [SYN, ACK] Seq=0 Ack=1 Win=65160 Len=0 MSS=1460 SACK_PERM TSval=2876871898 TSecr=2182300967 WS=128"
"24","0.073195587","66","96:24:75:f7:ad:41","76:38:f9:a6:9c:44","172.20.0.3","172.20.0.2","TCP","45034 → 4433 [ACK] Seq=1 Ack=1 Win=64256 Len=0 TSval=2182300968 TSecr=2876871898"
"25","0.073238863","1353","96:24:75:f7:ad:41","76:38:f9:a6:9c:44","172.20.0.3","172.20.0.2","TLSv1.2","Client Hello"
"26","0.073245870","66","76:38:f9:a6:9c:44","96:24:75:f7:ad:41","172.20.0.2","172.20.0.3","TCP","4433 → 45034 [ACK] Seq=1 Ack=1288 Win=64128 Len=0 TSval=2876871898 TSecr=2182300968"
"27","0.074782540","1537","76:38:f9:a6:9c:44","96:24:75:f7:ad:41","172.20.0.2","172.20.0.3","TLSv1.3","Server Hello, Change Cipher Spec, Application Data, Application Data, Application Data, Application Data"
"28","0.074815265","66","96:24:75:f7:ad:41","76:38:f9:a6:9c:44","172.20.0.3","172.20.0.2","TCP","45034 → 4433 [ACK] Seq=1288 Ack=1472 Win=64128 Len=0 TSval=2182300969 TSecr=2876871899"
"29","0.077306916","146","96:24:75:f7:ad:41","76:38:f9:a6:9c:44","172.20.0.3","172.20.0.2","TLSv1.3","Change Cipher Spec, Application Data"
"30","0.077362410","66","96:24:75:f7:ad:41","76:38:f9:a6:9c:44","172.20.0.3","172.20.0.2","TCP","45034 → 4433 [RST, ACK] Seq=1368 Ack=1472 Win=64128 Len=0 TSval=2182300972 TSecr=2876871899"
"31","0.090868344","74","96:24:75:f7:ad:41","76:38:f9:a6:9c:44","172.20.0.3","172.20.0.2","TCP","45050 → 4433 [SYN] Seq=0 Win=64240 Len=0 MSS=1460 SACK_PERM TSval=2182300985 TSecr=0 WS=128"
"32","0.090896165","74","76:38:f9:a6:9c:44","96:24:75:f7:ad:41","172.20.0.2","172.20.0.3","TCP","4433 → 45050 [SYN, ACK] Seq=0 Ack=1 Win=65160 Len=0 MSS=1460 SACK_PERM TSval=2876871915 TSecr=2182300985 WS=128"
"33","0.090914653","66","96:24:75:f7:ad:41","76:38:f9:a6:9c:44","172.20.0.3","172.20.0.2","TCP","45050 → 4433 [ACK] Seq=1 Ack=1 Win=64256 Len=0 TSval=2182300985 TSecr=2876871915"
"34","0.090951550","1353","96:24:75:f7:ad:41","76:38:f9:a6:9c:44","172.20.0.3","172.20.0.2","TLSv1.2","Client Hello"
"35","0.090957660","66","76:38:f9:a6:9c:44","96:24:75:f7:ad:41","172.20.0.2","172.20.0.3","TCP","4433 → 45050 [ACK] Seq=1 Ack=1288 Win=64128 Len=0 TSval=2876871915 TSecr=2182300985"
"36","0.092481799","1537","76:38:f9:a6:9c:44","96:24:75:f7:ad:41","172.20.0.2","172.20.0.3","TLSv1.3","Server Hello, Change Cipher Spec, Application Data, Application Data, Application Data, Application Data"
"37","0.092510733","66","96:24:75:f7:ad:41","76:38:f9:a6:9c:44","172.20.0.3","172.20.0.2","TCP","45050 → 4433 [ACK] Seq=1288 Ack=1472 Win=64128 Len=0 TSval=2182300987 TSecr=2876871917"
"38","0.094985575","146","96:24:75:f7:ad:41","76:38:f9:a6:9c:44","172.20.0.3","172.20.0.2","TLSv1.3","Change Cipher Spec, Application Data"
"39","0.095041944","66","96:24:75:f7:ad:41","76:38:f9:a6:9c:44","172.20.0.3","172.20.0.2","TCP","45050 → 4433 [RST, ACK] Seq=1368 Ack=1472 Win=64128 Len=0 TSval=2182300989 TSecr=2876871917"
"40","0.109902699","74","96:24:75:f7:ad:41","76:38:f9:a6:9c:44","172.20.0.3","172.20.0.2","TCP","45062 → 4433 [SYN] Seq=0 Win=64240 Len=0 MSS=1460 SACK_PERM TSval=2182301004 TSecr=0 WS=128"
"41","0.109931601","74","76:38:f9:a6:9c:44","96:24:75:f7:ad:41","172.20.0.2","172.20.0.3","TCP","4433 → 45062 [SYN, ACK] Seq=0 Ack=1 Win=65160 Len=0 MSS=1460 SACK_PERM TSval=2876871934 TSecr=2182301004 WS=128"
"42","0.109952194","66","96:24:75:f7:ad:41","76:38:f9:a6:9c:44","172.20.0.3","172.20.0.2","TCP","45062 → 4433 [ACK] Seq=1 Ack=1 Win=64256 Len=0 TSval=2182301004 TSecr=2876871934"
"43","0.109991679","1353","96:24:75:f7:ad:41","76:38:f9:a6:9c:44","172.20.0.3","172.20.0.2","TLSv1.2","Client Hello"
"44","0.109998166","66","76:38:f9:a6:9c:44","96:24:75:f7:ad:41","172.20.0.2","172.20.0.3","TCP","4433 → 45062 [ACK] Seq=1 Ack=1288 Win=64128 Len=0 TSval=2876871934 TSecr=2182301004"
"45","0.111630608","1537","76:38:f9:a6:9c:44","96:24:75:f7:ad:41","172.20.0.2","172.20.0.3","TLSv1.3","Server Hello, Change Cipher Spec, Application Data, Application Data, Application Data, Application Data"
"46","0.111661363","66","96:24:75:f7:ad:41","76:38:f9:a6:9c:44","172.20.0.3","172.20.0.2","TCP","45062 → 4433 [ACK] Seq=1288 Ack=1472 Win=64128 Len=0 TSval=2182301006 TSecr=2876871936"
"47","0.114186710","146","96:24:75:f7:ad:41","76:38:f9:a6:9c:44","172.20.0.3","172.20.0.2","TLSv1.3","Change Cipher Spec, Application Data"
"48","0.114244554","66","96:24:75:f7:ad:41","76:38:f9:a6:9c:44","172.20.0.3","172.20.0.2","TCP","45062 → 4433 [RST, ACK] Seq=1368 Ack=1472 Win=64128 Len=0 TSval=2182301009 TSecr=2876871936"
"49","0.127627388","74","96:24:75:f7:ad:41","76:38:f9:a6:9c:44","172.20.0.3","172.20.0.2","TCP","45072 → 4433 [SYN] Seq=0 Win=64240 Len=0 MSS=1460 SACK_PERM TSval=2182301022 TSecr=0 WS=128"
"50","0.127654117","74","76:38:f9:a6:9c:44","96:24:75:f7:ad:41","172.20.0.2","172.20.0.3","TCP","4433 → 45072 [SYN, ACK] Seq=0 Ack=1 Win=65160 Len=0 MSS=1460 SACK_PERM TSval=2876871952 TSecr=2182301022 WS=128"
"51","0.127672385","66","96:24:75:f7:ad:41","76:38:f9:a6:9c:44","172.20.0.3","172.20.0.2","TCP","45072 → 4433 [ACK] Seq=1 Ack=1 Win=64256 Len=0 TSval=2182301022 TSecr=2876871952"
"52","0.127709431","1353","96:24:75:f7:ad:41","76:38:f9:a6:9c:44","172.20.0.3","172.20.0.2","TLSv1.2","Client Hello"
"53","0.127714797","66","76:38:f9:a6:9c:44","96:24:75:f7:ad:41","172.20.0.2","172.20.0.3","TCP","4433 → 45072 [ACK] Seq=1 Ack=1288 Win=64128 Len=0 TSval=2876871952 TSecr=2182301022"
"54","0.129252704","1537","76:38:f9:a6:9c:44","96:24:75:f7:ad:41","172.20.0.2","172.20.0.3","TLSv1.3","Server Hello, Change Cipher Spec, Application Data, Application Data, Application Data, Application Data"
"55","0.129282514","66","96:24:75:f7:ad:41","76:38:f9:a6:9c:44","172.20.0.3","172.20.0.2","TCP","45072 → 4433 [ACK] Seq=1288 Ack=1472 Win=64128 Len=0 TSval=2182301024 TSecr=2876871954"
"56","0.131723641","146","96:24:75:f7:ad:41","76:38:f9:a6:9c:44","172.20.0.3","172.20.0.2","TLSv1.3","Change Cipher Spec, Application Data"
"57","0.131779242","66","96:24:75:f7:ad:41","76:38:f9:a6:9c:44","172.20.0.3","172.20.0.2","TCP","45072 → 4433 [RST, ACK] Seq=1368 Ack=1472 Win=64128 Len=0 TSval=2182301026 TSecr=2876871954"
"58","0.144961628","74","96:24:75:f7:ad:41","76:38:f9:a6:9c:44","172.20.0.3","172.20.0.2","TCP","45074 → 4433 [SYN] Seq=0 Win=64240 Len=0 MSS=1460 SACK_PERM TSval=2182301039 TSecr=0 WS=128"
"59","0.144983821","74","76:38:f9:a6:9c:44","96:24:75:f7:ad:41","172.20.0.2","172.20.0.3","TCP","4433 → 45074 [SYN, ACK] Seq=0 Ack=1 Win=65160 Len=0 MSS=1460 SACK_PERM TSval=2876871969 TSecr=2182301039 WS=128"
"60","0.145002153","66","96:24:75:f7:ad:41","76:38:f9:a6:9c:44","172.20.0.3","172.20.0.2","TCP","45074 → 4433 [ACK] Seq=1 Ack=1 Win=64256 Len=0 TSval=2182301039 TSecr=2876871969"
"61","0.145039840","1353","96:24:75:f7:ad:41","76:38:f9:a6:9c:44","172.20.0.3","172.20.0.2","TLSv1.2","Client Hello"
"62","0.145050789","66","76:38:f9:a6:9c:44","96:24:75:f7:ad:41","172.20.0.2","172.20.0.3","TCP","4433 → 45074 [ACK] Seq=1 Ack=1288 Win=64128 Len=0 TSval=2876871969 TSecr=2182301039"
"63","0.150163213","89","76:38:f9:a6:9c:44","96:24:75:f7:ad:41","172.20.0.2","172.20.0.3","SSL","[TCP Previous segment not captured] , Continuation Data"
"64","0.150187222","78","96:24:75:f7:ad:41","76:38:f9:a6:9c:44","172.20.0.3","172.20.0.2","TCP","[TCP Dup ACK 60#1] 45074 → 4433 [ACK] Seq=1288 Ack=1 Win=64256 Len=0 TSval=2182301045 TSecr=2876871969 SLE=1449 SRE=1472"
"65","0.150196651","1514","76:38:f9:a6:9c:44","96:24:75:f7:ad:41","172.20.0.2","172.20.0.3","TCP","[TCP Out-Of-Order] 4433 → 45074 [ACK] Seq=1 Ack=1288 Win=64128 Len=1448 TSval=2876871975 TSecr=2182301045"
"66","0.150208437","66","96:24:75:f7:ad:41","76:38:f9:a6:9c:44","172.20.0.3","172.20.0.2","TCP","45074 → 4433 [ACK] Seq=1288 Ack=1472 Win=64128 Len=0 TSval=2182301045 TSecr=2876871975"
"67","0.152691645","146","96:24:75:f7:ad:41","76:38:f9:a6:9c:44","172.20.0.3","172.20.0.2","TLSv1.2","Change Cipher Spec, Application Data"
"68","0.152754829","66","96:24:75:f7:ad:41","76:38:f9:a6:9c:44","172.20.0.3","172.20.0.2","TCP","45074 → 4433 [RST, ACK] Seq=1368 Ack=1472 Win=64128 Len=0 TSval=2182301047 TSecr=2876871975"
"69","0.166219287","74","96:24:75:f7:ad:41","76:38:f9:a6:9c:44","172.20.0.3","172.20.0.2","TCP","45082 → 4433 [SYN] Seq=0 Win=64240 Len=0 MSS=1460 SACK_PERM TSval=2182301061 TSecr=0 WS=128"
"70","0.166245615","74","76:38:f9:a6:9c:44","96:24:75:f7:ad:41","172.20.0.2","172.20.0.3","TCP","4433 → 45082 [SYN, ACK] Seq=0 Ack=1 Win=65160 Len=0 MSS=1460 SACK_PERM TSval=2876871991 TSecr=2182301061 WS=128"
"71","0.166270726","66","96:24:75:f7:ad:41","76:38:f9:a6:9c:44","172.20.0.3","172.20.0.2","TCP","45082 → 4433 [ACK] Seq=1 Ack=1 Win=64256 Len=0 TSval=2182301061 TSecr=2876871991"
"72","0.166313022","1353","96:24:75:f7:ad:41","76:38:f9:a6:9c:44","172.20.0.3","172.20.0.2","TLSv1.2","Client Hello"
"73","0.166319649","66","76:38:f9:a6:9c:44","96:24:75:f7:ad:41","172.20.0.2","172.20.0.3","TCP","4433 → 45082 [ACK] Seq=1 Ack=1288 Win=64128 Len=0 TSval=2876871991 TSecr=2182301061"
"74","0.167822279","1537","76:38:f9:a6:9c:44","96:24:75:f7:ad:41","172.20.0.2","172.20.0.3","TLSv1.3","Server Hello, Change Cipher Spec, Application Data, Application Data, Application Data, Application Data"
"75","0.167854582","66","96:24:75:f7:ad:41","76:38:f9:a6:9c:44","172.20.0.3","172.20.0.2","TCP","45082 → 4433 [ACK] Seq=1288 Ack=1472 Win=64128 Len=0 TSval=2182301062 TSecr=2876871992"
"76","0.170353369","146","96:24:75:f7:ad:41","76:38:f9:a6:9c:44","172.20.0.3","172.20.0.2","TLSv1.3","Change Cipher Spec, Application Data"
"77","0.170415937","66","96:24:75:f7:ad:41","76:38:f9:a6:9c:44","172.20.0.3","172.20.0.2","TCP","45082 → 4433 [RST, ACK] Seq=1368 Ack=1472 Win=64128 Len=0 TSval=2182301065 TSecr=2876871992"
"78","0.184063795","74","96:24:75:f7:ad:41","76:38:f9:a6:9c:44","172.20.0.3","172.20.0.2","TCP","45086 → 4433 [SYN] Seq=0 Win=64240 Len=0 MSS=1460 SACK_PERM TSval=2182301078 TSecr=0 WS=128"
"79","1.001246613","42","96:24:75:f7:ad:41","ff:ff:ff:ff:ff:ff",,,"ARP","ARP Announcement for 172.20.0.3"
"80","1.214203579","74","76:38:f9:a6:9c:44","96:24:75:f7:ad:41","172.20.0.2","172.20.0.3","TCP","4433 → 45086 [SYN, ACK] Seq=0 Ack=1 Win=65160 Len=0 MSS=1460 SACK_PERM TSval=2876873039 TSecr=2182301078 WS=128"
"81","1.214217803","74","96:24:75:f7:ad:41","76:38:f9:a6:9c:44","172.20.0.3","172.20.0.2","TCP","[TCP Retransmission] 45086 → 4433 [SYN] Seq=0 Win=64240 Len=0 MSS=1460 SACK_PERM TSval=2182302109 TSecr=0 WS=128"
"82","1.214231134","74","76:38:f9:a6:9c:44","96:24:75:f7:ad:41","172.20.0.2","172.20.0.3","TCP","[TCP Retransmission] 4433 → 45086 [SYN, ACK] Seq=0 Ack=1 Win=65160 Len=0 MSS=1460 SACK_PERM TSval=2876873039 TSecr=2182301078 WS=128"
"83","1.214264776","66","96:24:75:f7:ad:41","76:38:f9:a6:9c:44","172.20.0.3","172.20.0.2","TCP","45086 → 4433 [ACK] Seq=1 Ack=1 Win=64256 Len=0 TSval=2182302109 TSecr=2876873039"
"84","1.214295584","66","96:24:75:f7:ad:41","76:38:f9:a6:9c:44","172.20.0.3","172.20.0.2","TCP","[TCP Dup ACK 83#1] 45086 → 4433 [ACK] Seq=1 Ack=1 Win=64256 Len=0 TSval=2182302109 TSecr=2876873039"
"85","1.214343111","1353","96:24:75:f7:ad:41","76:38:f9:a6:9c:44","172.20.0.3","172.20.0.2","TLSv1.2","Client Hello"
"86","1.214351165","66","76:38:f9:a6:9c:44","96:24:75:f7:ad:41","172.20.0.2","172.20.0.3","TCP","4433 → 45086 [ACK] Seq=1 Ack=1288 Win=64128 Len=0 TSval=2876873039 TSecr=2182302109"
"87","1.216054470","1514","76:38:f9:a6:9c:44","96:24:75:f7:ad:41","172.20.0.2","172.20.0.3","TLSv1.3","Server Hello, Change Cipher Spec, Application Data, Application Data, Application Data"
"88","1.216087668","66","96:24:75:f7:ad:41","76:38:f9:a6:9c:44","172.20.0.3","172.20.0.2","TCP","45086 → 4433 [ACK] Seq=1288 Ack=1449 Win=64128 Len=0 TSval=2182302110 TSecr=2876873040"
"89","1.216097286","89","76:38:f9:a6:9c:44","96:24:75:f7:ad:41","172.20.0.2","172.20.0.3","TLSv1.3","Application Data"
"90","1.216102848","66","96:24:75:f7:ad:41","76:38:f9:a6:9c:44","172.20.0.3","172.20.0.2","TCP","45086 → 4433 [ACK] Seq=1288 Ack=1472 Win=64128 Len=0 TSval=2182302110 TSecr=2876873040"
"91","1.218807975","146","96:24:75:f7:ad:41","76:38:f9:a6:9c:44","172.20.0.3","172.20.0.2","TLSv1.3","Change Cipher Spec, Application Data"
"92","1.218869285","66","96:24:75:f7:ad:41","76:38:f9:a6:9c:44","172.20.0.3","172.20.0.2","TCP","45086 → 4433 [RST, ACK] Seq=1368 Ack=1472 Win=64128 Len=0 TSval=2182302113 TSecr=2876873040"
"93","1.232687454","74","96:24:75:f7:ad:41","76:38:f9:a6:9c:44","172.20.0.3","172.20.0.2","TCP","45094 → 4433 [SYN] Seq=0 Win=64240 Len=0 MSS=1460 SACK_PERM TSval=2182302127 TSecr=0 WS=128"
"94","1.232708052","74","76:38:f9:a6:9c:44","96:24:75:f7:ad:41","172.20.0.2","172.20.0.3","TCP","4433 → 45094 [SYN, ACK] Seq=0 Ack=1 Win=65160 Len=0 MSS=1460 SACK_PERM TSval=2876873057 TSecr=2182302127 WS=128"
"95","1.232724560","66","96:24:75:f7:ad:41","76:38:f9:a6:9c:44","172.20.0.3","172.20.0.2","TCP","45094 → 4433 [ACK] Seq=1 Ack=1 Win=64256 Len=0 TSval=2182302127 TSecr=2876873057"
"96","1.232761813","1353","96:24:75:f7:ad:41","76:38:f9:a6:9c:44","172.20.0.3","172.20.0.2","TLSv1.2","Client Hello"
"97","1.232767322","66","76:38:f9:a6:9c:44","96:24:75:f7:ad:41","172.20.0.2","172.20.0.3","TCP","4433 → 45094 [ACK] Seq=1 Ack=1288 Win=64128 Len=0 TSval=2876873057 TSecr=2182302127"
"98","1.238160958","89","76:38:f9:a6:9c:44","96:24:75:f7:ad:41","172.20.0.2","172.20.0.3","SSL","[TCP Previous segment not captured] , Continuation Data"
"99","1.238188632","78","96:24:75:f7:ad:41","76:38:f9:a6:9c:44","172.20.0.3","172.20.0.2","TCP","[TCP Dup ACK 95#1] 45094 → 4433 [ACK] Seq=1288 Ack=1 Win=64256 Len=0 TSval=2182302133 TSecr=2876873057 SLE=1449 SRE=1472"
"100","1.238195573","1514","76:38:f9:a6:9c:44","96:24:75:f7:ad:41","172.20.0.2","172.20.0.3","TCP","[TCP Out-Of-Order] 4433 → 45094 [ACK] Seq=1 Ack=1288 Win=64128 Len=1448 TSval=2876873063 TSecr=2182302133"
"101","1.238205470","66","96:24:75:f7:ad:41","76:38:f9:a6:9c:44","172.20.0.3","172.20.0.2","TCP","45094 → 4433 [ACK] Seq=1288 Ack=1472 Win=64128 Len=0 TSval=2182302133 TSecr=2876873063"
"102","1.240637629","146","96:24:75:f7:ad:41","76:38:f9:a6:9c:44","172.20.0.3","172.20.0.2","TLSv1.2","Change Cipher Spec, Application Data"
"103","1.240691363","66","96:24:75:f7:ad:41","76:38:f9:a6:9c:44","172.20.0.3","172.20.0.2","TCP","45094 → 4433 [RST, ACK] Seq=1368 Ack=1472 Win=64128 Len=0 TSval=2182302135 TSecr=2876873063"
"104","1.253712438","74","96:24:75:f7:ad:41","76:38:f9:a6:9c:44","172.20.0.3","172.20.0.2","TCP","45100 → 4433 [SYN] Seq=0 Win=64240 Len=0 MSS=1460 SACK_PERM TSval=2182302148 TSecr=0 WS=128"
"105","1.253732850","74","76:38:f9:a6:9c:44","96:24:75:f7:ad:41","172.20.0.2","172.20.0.3","TCP","4433 → 45100 [SYN, ACK] Seq=0 Ack=1 Win=65160 Len=0 MSS=1460 SACK_PERM TSval=2876873078 TSecr=2182302148 WS=128"
"106","1.253749466","66","96:24:75:f7:ad:41","76:38:f9:a6:9c:44","172.20.0.3","172.20.0.2","TCP","45100 → 4433 [ACK] Seq=1 Ack=1 Win=64256 Len=0 TSval=2182302148 TSecr=2876873078"
"107","1.253787724","1353","96:24:75:f7:ad:41","76:38:f9:a6:9c:44","172.20.0.3","172.20.0.2","TLSv1.2","Client Hello"
"108","1.255306986","1537","76:38:f9:a6:9c:44","96:24:75:f7:ad:41","172.20.0.2","172.20.0.3","TLSv1.3","Server Hello, Change Cipher Spec, Application Data, Application Data, Application Data, Application Data"
"109","1.255338725","66","96:24:75:f7:ad:41","76:38:f9:a6:9c:44","172.20.0.3","172.20.0.2","TCP","45100 → 4433 [ACK] Seq=1288 Ack=1472 Win=64128 Len=0 TSval=2182302150 TSecr=2876873080"
"110","1.257742172","146","96:24:75:f7:ad:41","76:38:f9:a6:9c:44","172.20.0.3","172.20.0.2","TLSv1.3","Change Cipher Spec, Application Data"
"111","1.257797842","66","96:24:75:f7:ad:41","76:38:f9:a6:9c:44","172.20.0.3","172.20.0.2","TCP","45100 → 4433 [RST, ACK] Seq=1368 Ack=1472 Win=64128 Len=0 TSval=2182302152 TSecr=2876873080"
"112","1.270869610","74","96:24:75:f7:ad:41","76:38:f9:a6:9c:44","172.20.0.3","172.20.0.2","TCP","45110 → 4433 [SYN] Seq=0 Win=64240 Len=0 MSS=1460 SACK_PERM TSval=2182302165 TSecr=0 WS=128"
"113","1.270895718","74","76:38:f9:a6:9c:44","96:24:75:f7:ad:41","172.20.0.2","172.20.0.3","TCP","4433 → 45110 [SYN, ACK] Seq=0 Ack=1 Win=65160 Len=0 MSS=1460 SACK_PERM TSval=2876873095 TSecr=2182302165 WS=128"
"114","1.270913861","66","96:24:75:f7:ad:41","76:38:f9:a6:9c:44","172.20.0.3","172.20.0.2","TCP","45110 → 4433 [ACK] Seq=1 Ack=1 Win=64256 Len=0 TSval=2182302165 TSecr=2876873095"
"115","1.270956772","1353","96:24:75:f7:ad:41","76:38:f9:a6:9c:44","172.20.0.3","172.20.0.2","TLSv1.2","Client Hello"
"116","1.270961862","66","76:38:f9:a6:9c:44","96:24:75:f7:ad:41","172.20.0.2","172.20.0.3","TCP","4433 → 45110 [ACK] Seq=1 Ack=1288 Win=64128 Len=0 TSval=2876873095 TSecr=2182302165"
"117","1.272564710","1537","76:38:f9:a6:9c:44","96:24:75:f7:ad:41","172.20.0.2","172.20.0.3","TLSv1.3","Server Hello, Change Cipher Spec, Application Data, Application Data, Application Data, Application Data"
"118","1.272595264","66","96:24:75:f7:ad:41","76:38:f9:a6:9c:44","172.20.0.3","172.20.0.2","TCP","45110 → 4433 [ACK] Seq=1288 Ack=1472 Win=64128 Len=0 TSval=2182302167 TSecr=2876873097"
"119","1.275026504","146","96:24:75:f7:ad:41","76:38:f9:a6:9c:44","172.20.0.3","172.20.0.2","TLSv1.3","Change Cipher Spec, Application Data"
"120","1.275094293","66","96:24:75:f7:ad:41","76:38:f9:a6:9c:44","172.20.0.3","172.20.0.2","TCP","45110 → 4433 [RST, ACK] Seq=1368 Ack=1472 Win=64128 Len=0 TSval=2182302169 TSecr=2876873097"
"121","1.289331034","74","96:24:75:f7:ad:41","76:38:f9:a6:9c:44","172.20.0.3","172.20.0.2","TCP","45122 → 4433 [SYN] Seq=0 Win=64240 Len=0 MSS=1460 SACK_PERM TSval=2182302184 TSecr=0 WS=128"
"122","2.001385723","42","96:24:75:f7:ad:41","ff:ff:ff:ff:ff:ff",,,"ARP","ARP Announcement for 172.20.0.3"
"123","2.302205773","74","76:38:f9:a6:9c:44","96:24:75:f7:ad:41","172.20.0.2","172.20.0.3","TCP","4433 → 45122 [SYN, ACK] Seq=0 Ack=1 Win=65160 Len=0 MSS=1460 SACK_PERM TSval=2876874127 TSecr=2182302184 WS=128"
"124","2.302232975","74","96:24:75:f7:ad:41","76:38:f9:a6:9c:44","172.20.0.3","172.20.0.2","TCP","[TCP Retransmission] 45122 → 4433 [SYN] Seq=0 Win=64240 Len=0 MSS=1460 SACK_PERM TSval=2182303197 TSecr=0 WS=128"
"125","2.302247332","74","76:38:f9:a6:9c:44","96:24:75:f7:ad:41","172.20.0.2","172.20.0.3","TCP","[TCP Retransmission] 4433 → 45122 [SYN, ACK] Seq=0 Ack=1 Win=65160 Len=0 MSS=1460 SACK_PERM TSval=2876874127 TSecr=2182302184 WS=128"
"126","2.302280977","66","96:24:75:f7:ad:41","76:38:f9:a6:9c:44","172.20.0.3","172.20.0.2","TCP","45122 → 4433 [ACK] Seq=1 Ack=1 Win=64256 Len=0 TSval=2182303197 TSecr=2876874127"
"127","2.302319223","66","96:24:75:f7:ad:41","76:38:f9:a6:9c:44","172.20.0.3","172.20.0.2","TCP","[TCP Dup ACK 126#1] 45122 → 4433 [ACK] Seq=1 Ack=1 Win=64256 Len=0 TSval=2182303197 TSecr=2876874127"
"128","2.302375734","1353","96:24:75:f7:ad:41","76:38:f9:a6:9c:44","172.20.0.3","172.20.0.2","TLSv1.2","Client Hello"
"129","2.302383029","66","76:38:f9:a6:9c:44","96:24:75:f7:ad:41","172.20.0.2","172.20.0.3","TCP","4433 → 45122 [ACK] Seq=1 Ack=1288 Win=64128 Len=0 TSval=2876874127 TSecr=2182303197"
"130","2.304206406","1514","76:38:f9:a6:9c:44","96:24:75:f7:ad:41","172.20.0.2","172.20.0.3","TLSv1.3","Server Hello, Change Cipher Spec, Application Data, Application Data, Application Data"
"131","2.304241390","66","96:24:75:f7:ad:41","76:38:f9:a6:9c:44","172.20.0.3","172.20.0.2","TCP","45122 → 4433 [ACK] Seq=1288 Ack=1449 Win=64128 Len=0 TSval=2182303199 TSecr=2876874129"
"132","2.304251795","89","76:38:f9:a6:9c:44","96:24:75:f7:ad:41","172.20.0.2","172.20.0.3","TLSv1.3","Application Data"
"133","2.304257197","66","96:24:75:f7:ad:41","76:38:f9:a6:9c:44","172.20.0.3","172.20.0.2","TCP","45122 → 4433 [ACK] Seq=1288 Ack=1472 Win=64128 Len=0 TSval=2182303199 TSecr=2876874129"
"134","2.307040941","146","96:24:75:f7:ad:41","76:38:f9:a6:9c:44","172.20.0.3","172.20.0.2","TLSv1.3","Change Cipher Spec, Application Data"
"135","2.307120024","66","96:24:75:f7:ad:41","76:38:f9:a6:9c:44","172.20.0.3","172.20.0.2","TCP","45122 → 4433 [RST, ACK] Seq=1368 Ack=1472 Win=64128 Len=0 TSval=2182303201 TSecr=2876874129"
"136","2.321277230","74","96:24:75:f7:ad:41","76:38:f9:a6:9c:44","172.20.0.3","172.20.0.2","TCP","45136 → 4433 [SYN] Seq=0 Win=64240 Len=0 MSS=1460 SACK_PERM TSval=2182303216 TSecr=0 WS=128"
"137","2.321312172","74","76:38:f9:a6:9c:44","96:24:75:f7:ad:41","172.20.0.2","172.20.0.3","TCP","4433 → 45136 [SYN, ACK] Seq=0 Ack=1 Win=65160 Len=0 MSS=1460 SACK_PERM TSval=2876874146 TSecr=2182303216 WS=128"
"138","2.321337535","66","96:24:75:f7:ad:41","76:38:f9:a6:9c:44","172.20.0.3","172.20.0.2","TCP","45136 → 4433 [ACK] Seq=1 Ack=1 Win=64256 Len=0 TSval=2182303216 TSecr=2876874146"
"139","2.321399149","1353","96:24:75:f7:ad:41","76:38:f9:a6:9c:44","172.20.0.3","172.20.0.2","TLSv1.2","Client Hello"
"140","2.321405045","66","76:38:f9:a6:9c:44","96:24:75:f7:ad:41","172.20.0.2","172.20.0.3","TCP","4433 → 45136 [ACK] Seq=1 Ack=1288 Win=64128 Len=0 TSval=2876874146 TSecr=2182303216"
"141","2.323174252","1537","76:38:f9:a6:9c:44","96:24:75:f7:ad:41","172.20.0.2","172.20.0.3","TLSv1.3","Server Hello, Change Cipher Spec, Application Data, Application Data, Application Data, Application Data"
"142","2.323212800","66","96:24:75:f7:ad:41","76:38:f9:a6:9c:44","172.20.0.3","172.20.0.2","TCP","45136 → 4433 [ACK] Seq=1288 Ack=1472 Win=64128 Len=0 TSval=2182303218 TSecr=2876874148"
"143","2.325758015","146","96:24:75:f7:ad:41","76:38:f9:a6:9c:44","172.20.0.3","172.20.0.2","TLSv1.3","Change Cipher Spec, Application Data"
"144","2.325824631","66","96:24:75:f7:ad:41","76:38:f9:a6:9c:44","172.20.0.3","172.20.0.2","TCP","45136 → 4433 [RST, ACK] Seq=1368 Ack=1472 Win=64128 Len=0 TSval=2182303220 TSecr=2876874148"
"145","2.339564694","74","96:24:75:f7:ad:41","76:38:f9:a6:9c:44","172.20.0.3","172.20.0.2","TCP","45150 → 4433 [SYN] Seq=0 Win=64240 Len=0 MSS=1460 SACK_PERM TSval=2182303234 TSecr=0 WS=128"
"146","2.339593353","74","76:38:f9:a6:9c:44","96:24:75:f7:ad:41","172.20.0.2","172.20.0.3","TCP","4433 → 45150 [SYN, ACK] Seq=0 Ack=1 Win=65160 Len=0 MSS=1460 SACK_PERM TSval=2876874164 TSecr=2182303234 WS=128"
"147","2.339610638","66","96:24:75:f7:ad:41","76:38:f9:a6:9c:44","172.20.0.3","172.20.0.2","TCP","45150 → 4433 [ACK] Seq=1 Ack=1 Win=64256 Len=0 TSval=2182303234 TSecr=2876874164"
"148","2.339657641","1353","96:24:75:f7:ad:41","76:38:f9:a6:9c:44","172.20.0.3","172.20.0.2","TLSv1.2","Client Hello"
"149","2.339663873","66","76:38:f9:a6:9c:44","96:24:75:f7:ad:41","172.20.0.2","172.20.0.3","TCP","4433 → 45150 [ACK] Seq=1 Ack=1288 Win=64128 Len=0 TSval=2876874164 TSecr=2182303234"
"150","2.341404026","1537","76:38:f9:a6:9c:44","96:24:75:f7:ad:41","172.20.0.2","172.20.0.3","TLSv1.3","Server Hello, Change Cipher Spec, Application Data, Application Data, Application Data, Application Data"
"151","2.341438441","66","96:24:75:f7:ad:41","76:38:f9:a6:9c:44","172.20.0.3","172.20.0.2","TCP","45150 → 4433 [ACK] Seq=1288 Ack=1472 Win=64128 Len=0 TSval=2182303236 TSecr=2876874166"
"152","2.343953053","146","96:24:75:f7:ad:41","76:38:f9:a6:9c:44","172.20.0.3","172.20.0.2","TLSv1.3","Change Cipher Spec, Application Data"
"153","2.344020303","66","96:24:75:f7:ad:41","76:38:f9:a6:9c:44","172.20.0.3","172.20.0.2","TCP","45150 → 4433 [RST, ACK] Seq=1368 Ack=1472 Win=64128 Len=0 TSval=2182303238 TSecr=2876874166"
"154","2.357930855","74","96:24:75:f7:ad:41","76:38:f9:a6:9c:44","172.20.0.3","172.20.0.2","TCP","45156 → 4433 [SYN] Seq=0 Win=64240 Len=0 MSS=1460 SACK_PERM TSval=2182303252 TSecr=0 WS=128"
"155","2.357960805","74","76:38:f9:a6:9c:44","96:24:75:f7:ad:41","172.20.0.2","172.20.0.3","TCP","4433 → 45156 [SYN, ACK] Seq=0 Ack=1 Win=65160 Len=0 MSS=1460 SACK_PERM TSval=2876874182 TSecr=2182303252 WS=128"
"156","2.357980415","66","96:24:75:f7:ad:41","76:38:f9:a6:9c:44","172.20.0.3","172.20.0.2","TCP","45156 → 4433 [ACK] Seq=1 Ack=1 Win=64256 Len=0 TSval=2182303252 TSecr=2876874182"
"157","2.358022213","1353","96:24:75:f7:ad:41","76:38:f9:a6:9c:44","172.20.0.3","172.20.0.2","TLSv1.2","Client Hello"
"158","2.358028952","66","76:38:f9:a6:9c:44","96:24:75:f7:ad:41","172.20.0.2","172.20.0.3","TCP","4433 → 45156 [ACK] Seq=1 Ack=1288 Win=64128 Len=0 TSval=2876874182 TSecr=2182303252"
"159","2.359882708","1537","76:38:f9:a6:9c:44","96:24:75:f7:ad:41","172.20.0.2","172.20.0.3","TLSv1.3","Server Hello, Change Cipher Spec, Application Data, Application Data, Application Data, Application Data"
"160","2.359916422","66","96:24:75:f7:ad:41","76:38:f9:a6:9c:44","172.20.0.3","172.20.0.2","TCP","45156 → 4433 [ACK] Seq=1288 Ack=1472 Win=64128 Len=0 TSval=2182303254 TSecr=2876874184"
"161","2.362510735","146","96:24:75:f7:ad:41","76:38:f9:a6:9c:44","172.20.0.3","172.20.0.2","TLSv1.3","Change Cipher Spec, Application Data"
"162","2.362583658","66","96:24:75:f7:ad:41","76:38:f9:a6:9c:44","172.20.0.3","172.20.0.2","TCP","45156 → 4433 [RST, ACK] Seq=1368 Ack=1472 Win=64128 Len=0 TSval=2182303257 TSecr=2876874184"
"163","2.376674284","74","96:24:75:f7:ad:41","76:38:f9:a6:9c:44","172.20.0.3","172.20.0.2","TCP","45168 → 4433 [SYN] Seq=0 Win=64240 Len=0 MSS=1460 SACK_PERM TSval=2182303271 TSecr=0 WS=128"
"164","2.376704205","74","76:38:f9:a6:9c:44","96:24:75:f7:ad:41","172.20.0.2","172.20.0.3","TCP","4433 → 45168 [SYN, ACK] Seq=0 Ack=1 Win=65160 Len=0 MSS=1460 SACK_PERM TSval=2876874201 TSecr=2182303271 WS=128"
"165","2.376721227","66","96:24:75:f7:ad:41","76:38:f9:a6:9c:44","172.20.0.3","172.20.0.2","TCP","45168 → 4433 [ACK] Seq=1 Ack=1 Win=64256 Len=0 TSval=2182303271 TSecr=2876874201"
"166","2.376767577","1353","96:24:75:f7:ad:41","76:38:f9:a6:9c:44","172.20.0.3","172.20.0.2","TLSv1.2","Client Hello"
"167","2.376772330","66","76:38:f9:a6:9c:44","96:24:75:f7:ad:41","172.20.0.2","172.20.0.3","TCP","4433 → 45168 [ACK] Seq=1 Ack=1288 Win=64128 Len=0 TSval=2876874201 TSecr=2182303271"
"168","2.378551548","1537","76:38:f9:a6:9c:44","96:24:75:f7:ad:41","172.20.0.2","172.20.0.3","TLSv1.3","Server Hello, Change Cipher Spec, Application Data, Application Data, Application Data, Application Data"
"169","2.378590450","66","96:24:75:f7:ad:41","76:38:f9:a6:9c:44","172.20.0.3","172.20.0.2","TCP","45168 → 4433 [ACK] Seq=1288 Ack=1472 Win=64128 Len=0 TSval=2182303273 TSecr=2876874203"
"170","2.381197877","146","96:24:75:f7:ad:41","76:38:f9:a6:9c:44","172.20.0.3","172.20.0.2","TLSv1.3","Change Cipher Spec, Application Data"
"171","2.381268069","66","96:24:75:f7:ad:41","76:38:f9:a6:9c:44","172.20.0.3","172.20.0.2","TCP","45168 → 4433 [RST, ACK] Seq=1368 Ack=1472 Win=64128 Len=0 TSval=2182303276 TSecr=2876874203"
"172","2.396016594","74","96:24:75:f7:ad:41","76:38:f9:a6:9c:44","172.20.0.3","172.20.0.2","TCP","45176 → 4433 [SYN] Seq=0 Win=64240 Len=0 MSS=1460 SACK_PERM TSval=2182303290 TSecr=0 WS=128"
"173","2.396055937","74","76:38:f9:a6:9c:44","96:24:75:f7:ad:41","172.20.0.2","172.20.0.3","TCP","4433 → 45176 [SYN, ACK] Seq=0 Ack=1 Win=65160 Len=0 MSS=1460 SACK_PERM TSval=2876874220 TSecr=2182303290 WS=128"
"174","2.396076177","66","96:24:75:f7:ad:41","76:38:f9:a6:9c:44","172.20.0.3","172.20.0.2","TCP","45176 → 4433 [ACK] Seq=1 Ack=1 Win=64256 Len=0 TSval=2182303290 TSecr=2876874220"
"175","2.396120428","1353","96:24:75:f7:ad:41","76:38:f9:a6:9c:44","172.20.0.3","172.20.0.2","TLSv1.2","Client Hello"
"176","2.396126214","66","76:38:f9:a6:9c:44","96:24:75:f7:ad:41","172.20.0.2","172.20.0.3","TCP","4433 → 45176 [ACK] Seq=1 Ack=1288 Win=64128 Len=0 TSval=2876874220 TSecr=2182303290"
"177","2.397793897","1537","76:38:f9:a6:9c:44","96:24:75:f7:ad:41","172.20.0.2","172.20.0.3","TLSv1.3","Server Hello, Change Cipher Spec, Application Data, Application Data, Application Data, Application Data"
"178","2.397829978","66","96:24:75:f7:ad:41","76:38:f9:a6:9c:44","172.20.0.3","172.20.0.2","TCP","45176 → 4433 [ACK] Seq=1288 Ack=1472 Win=64128 Len=0 TSval=2182303292 TSecr=2876874222"
"179","2.400549321","146","96:24:75:f7:ad:41","76:38:f9:a6:9c:44","172.20.0.3","172.20.0.2","TLSv1.3","Change Cipher Spec, Application Data"
"180","2.400620484","66","96:24:75:f7:ad:41","76:38:f9:a6:9c:44","172.20.0.3","172.20.0.2","TCP","45176 → 4433 [RST, ACK] Seq=1368 Ack=1472 Win=64128 Len=0 TSval=2182303295 TSecr=2876874222"
"181","2.415004280","74","96:24:75:f7:ad:41","76:38:f9:a6:9c:44","172.20.0.3","172.20.0.2","TCP","45184 → 4433 [SYN] Seq=0 Win=64240 Len=0 MSS=1460 SACK_PERM TSval=2182303309 TSecr=0 WS=128"
"182","3.454245725","74","96:24:75:f7:ad:41","76:38:f9:a6:9c:44","172.20.0.3","172.20.0.2","TCP","[TCP Retransmission] 45184 → 4433 [SYN] Seq=0 Win=64240 Len=0 MSS=1460 SACK_PERM TSval=2182304349 TSecr=0 WS=128"
"183","3.454262318","74","76:38:f9:a6:9c:44","96:24:75:f7:ad:41","172.20.0.2","172.20.0.3","TCP","4433 → 45184 [SYN, ACK] Seq=0 Ack=1 Win=65160 Len=0 MSS=1460 SACK_PERM TSval=2876875279 TSecr=2182303309 WS=128"
"184","3.454308838","66","96:24:75:f7:ad:41","76:38:f9:a6:9c:44","172.20.0.3","172.20.0.2","TCP","45184 → 4433 [ACK] Seq=1 Ack=1 Win=64256 Len=0 TSval=2182304349 TSecr=2876875279"
"185","3.454412439","1353","96:24:75:f7:ad:41","76:38:f9:a6:9c:44","172.20.0.3","172.20.0.2","TLSv1.2","Client Hello"
"186","3.454426297","66","76:38:f9:a6:9c:44","96:24:75:f7:ad:41","172.20.0.2","172.20.0.3","TCP","4433 → 45184 [ACK] Seq=1 Ack=1288 Win=64128 Len=0 TSval=2876875279 TSecr=2182304349"
"187","3.456247766","1514","76:38:f9:a6:9c:44","96:24:75:f7:ad:41","172.20.0.2","172.20.0.3","TLSv1.3","Server Hello, Change Cipher Spec, Application Data, Application Data, Application Data"
"188","3.456290356","66","96:24:75:f7:ad:41","76:38:f9:a6:9c:44","172.20.0.3","172.20.0.2","TCP","45184 → 4433 [ACK] Seq=1288 Ack=1449 Win=64128 Len=0 TSval=2182304351 TSecr=2876875281"
"189","3.456299950","89","76:38:f9:a6:9c:44","96:24:75:f7:ad:41","172.20.0.2","172.20.0.3","TLSv1.3","Application Data"
"190","3.456305334","66","96:24:75:f7:ad:41","76:38:f9:a6:9c:44","172.20.0.3","172.20.0.2","TCP","45184 → 4433 [ACK] Seq=1288 Ack=1472 Win=64128 Len=0 TSval=2182304351 TSecr=2876875281"
"191","3.459016493","146","96:24:75:f7:ad:41","76:38:f9:a6:9c:44","172.20.0.3","172.20.0.2","TLSv1.3","Change Cipher Spec, Application Data"
"192","3.459091517","66","96:24:75:f7:ad:41","76:38:f9:a6:9c:44","172.20.0.3","172.20.0.2","TCP","45184 → 4433 [RST, ACK] Seq=1368 Ack=1472 Win=64128 Len=0 TSval=2182304353 TSecr=2876875281"
"193","3.473195323","74","96:24:75:f7:ad:41","76:38:f9:a6:9c:44","172.20.0.3","172.20.0.2","TCP","45200 → 4433 [SYN] Seq=0 Win=64240 Len=0 MSS=1460 SACK_PERM TSval=2182304368 TSecr=0 WS=128"
"194","3.473227661","74","76:38:f9:a6:9c:44","96:24:75:f7:ad:41","172.20.0.2","172.20.0.3","TCP","4433 → 45200 [SYN, ACK] Seq=0 Ack=1 Win=65160 Len=0 MSS=1460 SACK_PERM TSval=2876875298 TSecr=2182304368 WS=128"
"195","3.473246966","66","96:24:75:f7:ad:41","76:38:f9:a6:9c:44","172.20.0.3","172.20.0.2","TCP","45200 → 4433 [ACK] Seq=1 Ack=1 Win=64256 Len=0 TSval=2182304368 TSecr=2876875298"
"196","3.473294788","1353","96:24:75:f7:ad:41","76:38:f9:a6:9c:44","172.20.0.3","172.20.0.2","TLSv1.2","Client Hello"
"197","3.475129467","1537","76:38:f9:a6:9c:44","96:24:75:f7:ad:41","172.20.0.2","172.20.0.3","TLSv1.3","Server Hello, Change Cipher Spec, Application Data, Application Data, Application Data, Application Data"
"198","3.475177541","66","96:24:75:f7:ad:41","76:38:f9:a6:9c:44","172.20.0.3","172.20.0.2","TCP","45200 → 4433 [ACK] Seq=1288 Ack=1472 Win=64128 Len=0 TSval=2182304370 TSecr=2876875299"
"199","3.477697693","146","96:24:75:f7:ad:41","76:38:f9:a6:9c:44","172.20.0.3","172.20.0.2","TLSv1.3","Change Cipher Spec, Application Data"
"200","3.477769794","66","96:24:75:f7:ad:41","76:38:f9:a6:9c:44","172.20.0.3","172.20.0.2","TCP","45200 → 4433 [RST, ACK] Seq=1368 Ack=1472 Win=64128 Len=0 TSval=2182304372 TSecr=2876875299"
"201","3.491842809","74","96:24:75:f7:ad:41","76:38:f9:a6:9c:44","172.20.0.3","172.20.0.2","TCP","45202 → 4433 [SYN] Seq=0 Win=64240 Len=0 MSS=1460 SACK_PERM TSval=2182304386 TSecr=0 WS=128"
"202","3.491874080","74","76:38:f9:a6:9c:44","96:24:75:f7:ad:41","172.20.0.2","172.20.0.3","TCP","4433 → 45202 [SYN, ACK] Seq=0 Ack=1 Win=65160 Len=0 MSS=1460 SACK_PERM TSval=2876875316 TSecr=2182304386 WS=128"
"203","3.491893746","66","96:24:75:f7:ad:41","76:38:f9:a6:9c:44","172.20.0.3","172.20.0.2","TCP","45202 → 4433 [ACK] Seq=1 Ack=1 Win=64256 Len=0 TSval=2182304386 TSecr=2876875316"
"204","3.491949293","1353","96:24:75:f7:ad:41","76:38:f9:a6:9c:44","172.20.0.3","172.20.0.2","TLSv1.2","Client Hello"
"205","3.493685258","1537","76:38:f9:a6:9c:44","96:24:75:f7:ad:41","172.20.0.2","172.20.0.3","TLSv1.3","Server Hello, Change Cipher Spec, Application Data, Application Data, Application Data, Application Data"
"206","3.493724489","66","96:24:75:f7:ad:41","76:38:f9:a6:9c:44","172.20.0.3","172.20.0.2","TCP","45202 → 4433 [ACK] Seq=1288 Ack=1472 Win=64128 Len=0 TSval=2182304388 TSecr=2876875318"
"207","3.496165066","146","96:24:75:f7:ad:41","76:38:f9:a6:9c:44","172.20.0.3","172.20.0.2","TLSv1.3","Change Cipher Spec, Application Data"
"208","3.496222018","66","96:24:75:f7:ad:41","76:38:f9:a6:9c:44","172.20.0.3","172.20.0.2","TCP","45202 → 4433 [RST, ACK] Seq=1368 Ack=1472 Win=64128 Len=0 TSval=2182304391 TSecr=2876875318"
"209","3.509325312","74","96:24:75:f7:ad:41","76:38:f9:a6:9c:44","172.20.0.3","172.20.0.2","TCP","45206 → 4433 [SYN] Seq=0 Win=64240 Len=0 MSS=1460 SACK_PERM TSval=2182304404 TSecr=0 WS=128"
"210","3.509351461","74","76:38:f9:a6:9c:44","96:24:75:f7:ad:41","172.20.0.2","172.20.0.3","TCP","4433 → 45206 [SYN, ACK] Seq=0 Ack=1 Win=65160 Len=0 MSS=1460 SACK_PERM TSval=2876875334 TSecr=2182304404 WS=128"
"211","3.509367882","66","96:24:75:f7:ad:41","76:38:f9:a6:9c:44","172.20.0.3","172.20.0.2","TCP","45206 → 4433 [ACK] Seq=1 Ack=1 Win=64256 Len=0 TSval=2182304404 TSecr=2876875334"
"212","3.509404890","1353","96:24:75:f7:ad:41","76:38:f9:a6:9c:44","172.20.0.3","172.20.0.2","TLSv1.2","Client Hello"
"213","3.509410756","66","76:38:f9:a6:9c:44","96:24:75:f7:ad:41","172.20.0.2","172.20.0.3","TCP","4433 → 45206 [ACK] Seq=1 Ack=1288 Win=64128 Len=0 TSval=2876875334 TSecr=2182304404"
"214","3.510855939","1537","76:38:f9:a6:9c:44","96:24:75:f7:ad:41","172.20.0.2","172.20.0.3","TLSv1.3","Server Hello, Change Cipher Spec, Application Data, Application Data, Application Data, Application Data"
"215","3.510884718","66","96:24:75:f7:ad:41","76:38:f9:a6:9c:44","172.20.0.3","172.20.0.2","TCP","45206 → 4433 [ACK] Seq=1288 Ack=1472 Win=64128 Len=0 TSval=2182304405 TSecr=2876875335"
"216","3.513277673","146","96:24:75:f7:ad:41","76:38:f9:a6:9c:44","172.20.0.3","172.20.0.2","TLSv1.3","Change Cipher Spec, Application Data"
"217","3.513333171","66","96:24:75:f7:ad:41","76:38:f9:a6:9c:44","172.20.0.3","172.20.0.2","TCP","45206 → 4433 [RST, ACK] Seq=1368 Ack=1472 Win=64128 Len=0 TSval=2182304408 TSecr=2876875335"
"218","3.526410324","74","96:24:75:f7:ad:41","76:38:f9:a6:9c:44","172.20.0.3","172.20.0.2","TCP","45220 → 4433 [SYN] Seq=0 Win=64240 Len=0 MSS=1460 SACK_PERM TSval=2182304421 TSecr=0 WS=128"
"219","3.526436556","74","76:38:f9:a6:9c:44","96:24:75:f7:ad:41","172.20.0.2","172.20.0.3","TCP","4433 → 45220 [SYN, ACK] Seq=0 Ack=1 Win=65160 Len=0 MSS=1460 SACK_PERM TSval=2876875351 TSecr=2182304421 WS=128"
"220","3.526453366","66","96:24:75:f7:ad:41","76:38:f9:a6:9c:44","172.20.0.3","172.20.0.2","TCP","45220 → 4433 [ACK] Seq=1 Ack=1 Win=64256 Len=0 TSval=2182304421 TSecr=2876875351"
"221","3.526492064","1353","96:24:75:f7:ad:41","76:38:f9:a6:9c:44","172.20.0.3","172.20.0.2","TLSv1.2","Client Hello"
"222","3.526498444","66","76:38:f9:a6:9c:44","96:24:75:f7:ad:41","172.20.0.2","172.20.0.3","TCP","4433 → 45220 [ACK] Seq=1 Ack=1288 Win=64128 Len=0 TSval=2876875351 TSecr=2182304421"
"223","3.527929713","1537","76:38:f9:a6:9c:44","96:24:75:f7:ad:41","172.20.0.2","172.20.0.3","TLSv1.3","Server Hello, Change Cipher Spec, Application Data, Application Data, Application Data, Application Data"
"224","3.527958748","66","96:24:75:f7:ad:41","76:38:f9:a6:9c:44","172.20.0.3","172.20.0.2","TCP","45220 → 4433 [ACK] Seq=1288 Ack=1472 Win=64128 Len=0 TSval=2182304422 TSecr=2876875352"
"225","3.530406636","146","96:24:75:f7:ad:41","76:38:f9:a6:9c:44","172.20.0.3","172.20.0.2","TLSv1.3","Change Cipher Spec, Application Data"
