frame.number,frame.time_relative,frame.len,eth.src,eth.dst,ip.src,ip.dst,_ws.col.protocol,_ws.col.info
"1","0.000000000","42","ba:fe:5b:69:8c:9a","ff:ff:ff:ff:ff:ff",,,"ARP","ARP Announcement for 172.20.0.3"
"2","0.035596359","42","ba:fe:5b:69:8c:9a","ff:ff:ff:ff:ff:ff",,,"ARP","Who has 172.20.0.2? Tell 172.20.0.3"
"3","0.035623540","42","de:ee:e6:56:ac:d0","ba:fe:5b:69:8c:9a",,,"ARP","172.20.0.2 is at de:ee:e6:56:ac:d0"
"4","0.035648326","74","ba:fe:5b:69:8c:9a","de:ee:e6:56:ac:d0","172.20.0.3","172.20.0.2","TCP","47326 → 4433 [SYN] Seq=0 Win=64240 Len=0 MSS=1460 SACK_PERM TSval=2184140689 TSecr=0 WS=128"
"5","0.035668991","74","de:ee:e6:56:ac:d0","ba:fe:5b:69:8c:9a","172.20.0.2","172.20.0.3","TCP","4433 → 47326 [SYN, ACK] Seq=0 Ack=1 Win=65160 Len=0 MSS=1460 SACK_PERM TSval=2878711619 TSecr=2184140689 WS=128"
"6","0.035684271","66","ba:fe:5b:69:8c:9a","de:ee:e6:56:ac:d0","172.20.0.3","172.20.0.2","TCP","47326 → 4433 [ACK] Seq=1 Ack=1 Win=64256 Len=0 TSval=2184140689 TSecr=2878711619"
"7","0.035728232","1672","ba:fe:5b:69:8c:9a","de:ee:e6:56:ac:d0","172.20.0.3","172.20.0.2","TLSv1.2","Client Hello"
"8","0.035734614","66","de:ee:e6:56:ac:d0","ba:fe:5b:69:8c:9a","172.20.0.2","172.20.0.3","TCP","4433 → 47326 [ACK] Seq=1 Ack=1607 Win=64128 Len=0 TSval=2878711619 TSecr=2184140689"
"9","0.038087824","1955","de:ee:e6:56:ac:d0","ba:fe:5b:69:8c:9a","172.20.0.2","172.20.0.3","TLSv1.3","Server Hello, Change Cipher Spec, Application Data, Application Data, Application Data, Application Data"
"10","0.038131786","66","ba:fe:5b:69:8c:9a","de:ee:e6:56:ac:d0","172.20.0.3","172.20.0.2","TCP","47326 → 4433 [ACK] Seq=1607 Ack=1890 Win=64128 Len=0 TSval=2184140691 TSecr=2878711621"
"11","0.041344320","146","ba:fe:5b:69:8c:9a","de:ee:e6:56:ac:d0","172.20.0.3","172.20.0.2","TLSv1.3","Change Cipher Spec, Application Data"
"12","0.041419072","66","ba:fe:5b:69:8c:9a","de:ee:e6:56:ac:d0","172.20.0.3","172.20.0.2","TCP","47326 → 4433 [RST, ACK] Seq=1687 Ack=1890 Win=64128 Len=0 TSval=2184140695 TSecr=2878711621"
"13","0.053436207","74","ba:fe:5b:69:8c:9a","de:ee:e6:56:ac:d0","172.20.0.3","172.20.0.2","TCP","47340 → 4433 [SYN] Seq=0 Win=64240 Len=0 MSS=1460 SACK_PERM TSval=2184140707 TSecr=0 WS=128"
"14","0.053478477","74","de:ee:e6:56:ac:d0","ba:fe:5b:69:8c:9a","172.20.0.2","172.20.0.3","TCP","4433 → 47340 [SYN, ACK] Seq=0 Ack=1 Win=65160 Len=0 MSS=1460 SACK_PERM TSval=2878711637 TSecr=2184140707 WS=128"
"15","0.053502910","66","ba:fe:5b:69:8c:9a","de:ee:e6:56:ac:d0","172.20.0.3","172.20.0.2","TCP","47340 → 4433 [ACK] Seq=1 Ack=1 Win=64256 Len=0 TSval=2184140707 TSecr=2878711637"
"16","0.053547990","1672","ba:fe:5b:69:8c:9a","de:ee:e6:56:ac:d0","172.20.0.3","172.20.0.2","TLSv1.2","Client Hello"
"17","0.053556345","66","de:ee:e6:56:ac:d0","ba:fe:5b:69:8c:9a","172.20.0.2","172.20.0.3","TCP","4433 → 47340 [ACK] Seq=1 Ack=1607 Win=64128 Len=0 TSval=2878711637 TSecr=2184140707"
"18","0.055196350","1956","de:ee:e6:56:ac:d0","ba:fe:5b:69:8c:9a","172.20.0.2","172.20.0.3","TLSv1.3","Server Hello, Change Cipher Spec, Application Data, Application Data, Application Data, Application Data"
"19","0.055240203","66","ba:fe:5b:69:8c:9a","de:ee:e6:56:ac:d0","172.20.0.3","172.20.0.2","TCP","47340 → 4433 [ACK] Seq=1607 Ack=1891 Win=64128 Len=0 TSval=2184140708 TSecr=2878711638"
"20","0.058038974","146","ba:fe:5b:69:8c:9a","de:ee:e6:56:ac:d0","172.20.0.3","172.20.0.2","TLSv1.3","Change Cipher Spec, Application Data"
"21","0.058103422","66","ba:fe:5b:69:8c:9a","de:ee:e6:56:ac:d0","172.20.0.3","172.20.0.2","TCP","47340 → 4433 [RST, ACK] Seq=1687 Ack=1891 Win=64128 Len=0 TSval=2184140711 TSecr=2878711638"
"22","0.069667144","74","ba:fe:5b:69:8c:9a","de:ee:e6:56:ac:d0","172.20.0.3","172.20.0.2","TCP","47348 → 4433 [SYN] Seq=0 Win=64240 Len=0 MSS=1460 SACK_PERM TSval=2184140723 TSecr=0 WS=128"
"23","0.069701874","74","de:ee:e6:56:ac:d0","ba:fe:5b:69:8c:9a","172.20.0.2","172.20.0.3","TCP","4433 → 47348 [SYN, ACK] Seq=0 Ack=1 Win=65160 Len=0 MSS=1460 SACK_PERM TSval=2878711653 TSecr=2184140723 WS=128"
"24","0.069731666","66","ba:fe:5b:69:8c:9a","de:ee:e6:56:ac:d0","172.20.0.3","172.20.0.2","TCP","47348 → 4433 [ACK] Seq=1 Ack=1 Win=64256 Len=0 TSval=2184140723 TSecr=2878711653"
"25","0.069775522","1672","ba:fe:5b:69:8c:9a","de:ee:e6:56:ac:d0","172.20.0.3","172.20.0.2","TLSv1.2","Client Hello"
"26","0.069783882","66","de:ee:e6:56:ac:d0","ba:fe:5b:69:8c:9a","172.20.0.2","172.20.0.3","TCP","4433 → 47348 [ACK] Seq=1 Ack=1607 Win=64128 Len=0 TSval=2878711653 TSecr=2184140723"
"27","0.076263786","507","de:ee:e6:56:ac:d0","ba:fe:5b:69:8c:9a","172.20.0.2","172.20.0.3","SSL","[TCP Previous segment not captured] , Continuation Data"
"28","0.076326727","78","ba:fe:5b:69:8c:9a","de:ee:e6:56:ac:d0","172.20.0.3","172.20.0.2","TCP","[TCP Dup ACK 24#1] 47348 → 4433 [ACK] Seq=1607 Ack=1 Win=64256 Len=0 TSval=2184140730 TSecr=2878711653 SLE=1449 SRE=1890"
"29","0.280272893","1514","de:ee:e6:56:ac:d0","ba:fe:5b:69:8c:9a","172.20.0.2","172.20.0.3","TCP","[TCP Retransmission] 4433 → 47348 [ACK] Seq=1 Ack=1607 Win=64128 Len=1448 TSval=2878711864 TSecr=2184140730"
"30","0.280331450","66","ba:fe:5b:69:8c:9a","de:ee:e6:56:ac:d0","172.20.0.3","172.20.0.2","TCP","47348 → 4433 [ACK] Seq=1607 Ack=1890 Win=64128 Len=0 TSval=2184140934 TSecr=2878711864"
"31","0.283378945","146","ba:fe:5b:69:8c:9a","de:ee:e6:56:ac:d0","172.20.0.3","172.20.0.2","TLSv1.2","Change Cipher Spec, Application Data"
"32","0.283470617","66","ba:fe:5b:69:8c:9a","de:ee:e6:56:ac:d0","172.20.0.3","172.20.0.2","TCP","47348 → 4433 [RST, ACK] Seq=1687 Ack=1890 Win=64128 Len=0 TSval=2184140937 TSecr=2878711864"
"33","0.295588000","74","ba:fe:5b:69:8c:9a","de:ee:e6:56:ac:d0","172.20.0.3","172.20.0.2","TCP","47350 → 4433 [SYN] Seq=0 Win=64240 Len=0 MSS=1460 SACK_PERM TSval=2184140949 TSecr=0 WS=128"
"34","0.295631648","74","de:ee:e6:56:ac:d0","ba:fe:5b:69:8c:9a","172.20.0.2","172.20.0.3","TCP","4433 → 47350 [SYN, ACK] Seq=0 Ack=1 Win=65160 Len=0 MSS=1460 SACK_PERM TSval=2878711879 TSecr=2184140949 WS=128"
"35","0.295655056","66","ba:fe:5b:69:8c:9a","de:ee:e6:56:ac:d0","172.20.0.3","172.20.0.2","TCP","47350 → 4433 [ACK] Seq=1 Ack=1 Win=64256 Len=0 TSval=2184140949 TSecr=2878711879"
"36","0.295700110","1672","ba:fe:5b:69:8c:9a","de:ee:e6:56:ac:d0","172.20.0.3","172.20.0.2","TLSv1.2","Client Hello"
"37","0.295707111","66","de:ee:e6:56:ac:d0","ba:fe:5b:69:8c:9a","172.20.0.2","172.20.0.3","TCP","4433 → 47350 [ACK] Seq=1 Ack=1607 Win=64128 Len=0 TSval=2878711879 TSecr=2184140949"
"38","0.298064538","1956","de:ee:e6:56:ac:d0","ba:fe:5b:69:8c:9a","172.20.0.2","172.20.0.3","TLSv1.3","Server Hello, Change Cipher Spec, Application Data, Application Data, Application Data, Application Data"
"39","0.298110906","66","ba:fe:5b:69:8c:9a","de:ee:e6:56:ac:d0","172.20.0.3","172.20.0.2","TCP","47350 → 4433 [ACK] Seq=1607 Ack=1891 Win=64128 Len=0 TSval=2184140951 TSecr=2878711881"
"40","0.300929631","146","ba:fe:5b:69:8c:9a","de:ee:e6:56:ac:d0","172.20.0.3","172.20.0.2","TLSv1.3","Change Cipher Spec, Application Data"
"41","0.301012778","66","ba:fe:5b:69:8c:9a","de:ee:e6:56:ac:d0","172.20.0.3","172.20.0.2","TCP","47350 → 4433 [RST, ACK] Seq=1687 Ack=1891 Win=64128 Len=0 TSval=2184140954 TSecr=2878711881"
"42","0.313230236","74","ba:fe:5b:69:8c:9a","de:ee:e6:56:ac:d0","172.20.0.3","172.20.0.2","TCP","47358 → 4433 [SYN] Seq=0 Win=64240 Len=0 MSS=1460 SACK_PERM TSval=2184140966 TSecr=0 WS=128"
"43","0.313286553","74","de:ee:e6:56:ac:d0","ba:fe:5b:69:8c:9a","172.20.0.2","172.20.0.3","TCP","4433 → 47358 [SYN, ACK] Seq=0 Ack=1 Win=65160 Len=0 MSS=1460 SACK_PERM TSval=2878711897 TSecr=2184140966 WS=128"
"44","0.313311889","66","ba:fe:5b:69:8c:9a","de:ee:e6:56:ac:d0","172.20.0.3","172.20.0.2","TCP","47358 → 4433 [ACK] Seq=1 Ack=1 Win=64256 Len=0 TSval=2184140967 TSecr=2878711897"
"45","0.313368406","1672","ba:fe:5b:69:8c:9a","de:ee:e6:56:ac:d0","172.20.0.3","172.20.0.2","TLSv1.2","Client Hello"
"46","0.313377424","66","de:ee:e6:56:ac:d0","ba:fe:5b:69:8c:9a","172.20.0.2","172.20.0.3","TCP","4433 → 47358 [ACK] Seq=1 Ack=1607 Win=64128 Len=0 TSval=2878711897 TSecr=2184140967"
"47","0.315044771","1956","de:ee:e6:56:ac:d0","ba:fe:5b:69:8c:9a","172.20.0.2","172.20.0.3","TLSv1.3","Server Hello, Change Cipher Spec, Application Data, Application Data, Application Data, Application Data"
"48","0.315085133","66","ba:fe:5b:69:8c:9a","de:ee:e6:56:ac:d0","172.20.0.3","172.20.0.2","TCP","47358 → 4433 [ACK] Seq=1607 Ack=1891 Win=64128 Len=0 TSval=2184140968 TSecr=2878711898"
"49","0.318930607","146","ba:fe:5b:69:8c:9a","de:ee:e6:56:ac:d0","172.20.0.3","172.20.0.2","TLSv1.3","Change Cipher Spec, Application Data"
"50","0.318993338","66","ba:fe:5b:69:8c:9a","de:ee:e6:56:ac:d0","172.20.0.3","172.20.0.2","TCP","47358 → 4433 [RST, ACK] Seq=1687 Ack=1891 Win=64128 Len=0 TSval=2184140972 TSecr=2878711898"
"51","0.331309082","74","ba:fe:5b:69:8c:9a","de:ee:e6:56:ac:d0","172.20.0.3","172.20.0.2","TCP","47364 → 4433 [SYN] Seq=0 Win=64240 Len=0 MSS=1460 SACK_PERM TSval=2184140985 TSecr=0 WS=128"
"52","0.331336952","74","de:ee:e6:56:ac:d0","ba:fe:5b:69:8c:9a","172.20.0.2","172.20.0.3","TCP","4433 → 47364 [SYN, ACK] Seq=0 Ack=1 Win=65160 Len=0 MSS=1460 SACK_PERM TSval=2878711915 TSecr=2184140985 WS=128"
"53","0.331355874","66","ba:fe:5b:69:8c:9a","de:ee:e6:56:ac:d0","172.20.0.3","172.20.0.2","TCP","47364 → 4433 [ACK] Seq=1 Ack=1 Win=64256 Len=0 TSval=2184140985 TSecr=2878711915"
"54","0.331408776","1672","ba:fe:5b:69:8c:9a","de:ee:e6:56:ac:d0","172.20.0.3","172.20.0.2","TLSv1.2","Client Hello"
"55","0.331417796","66","de:ee:e6:56:ac:d0","ba:fe:5b:69:8c:9a","172.20.0.2","172.20.0.3","TCP","4433 → 47364 [ACK] Seq=1 Ack=1607 Win=64128 Len=0 TSval=2878711915 TSecr=2184140985"
"56","0.333078618","1955","de:ee:e6:56:ac:d0","ba:fe:5b:69:8c:9a","172.20.0.2","172.20.0.3","TLSv1.3","Server Hello, Change Cipher Spec, Application Data, Application Data, Application Data, Application Data"
"57","0.333113884","66","ba:fe:5b:69:8c:9a","de:ee:e6:56:ac:d0","172.20.0.3","172.20.0.2","TCP","47364 → 4433 [ACK] Seq=1607 Ack=1890 Win=64128 Len=0 TSval=2184140986 TSecr=2878711916"
"58","0.336396729","146","ba:fe:5b:69:8c:9a","de:ee:e6:56:ac:d0","172.20.0.3","172.20.0.2","TLSv1.3","Change Cipher Spec, Application Data"
"59","0.336463603","66","ba:fe:5b:69:8c:9a","de:ee:e6:56:ac:d0","172.20.0.3","172.20.0.2","TCP","47364 → 4433 [RST, ACK] Seq=1687 Ack=1890 Win=64128 Len=0 TSval=2184140990 TSecr=2878711916"
"60","0.349574112","74","ba:fe:5b:69:8c:9a","de:ee:e6:56:ac:d0","172.20.0.3","172.20.0.2","TCP","47380 → 4433 [SYN] Seq=0 Win=64240 Len=0 MSS=1460 SACK_PERM TSval=2184141003 TSecr=0 WS=128"
"61","0.349614990","74","de:ee:e6:56:ac:d0","ba:fe:5b:69:8c:9a","172.20.0.2","172.20.0.3","TCP","4433 → 47380 [SYN, ACK] Seq=0 Ack=1 Win=65160 Len=0 MSS=1460 SACK_PERM TSval=2878711933 TSecr=2184141003 WS=128"
"62","0.349638550","66","ba:fe:5b:69:8c:9a","de:ee:e6:56:ac:d0","172.20.0.3","172.20.0.2","TCP","47380 → 4433 [ACK] Seq=1 Ack=1 Win=64256 Len=0 TSval=2184141003 TSecr=2878711933"
"63","0.349684537","1672","ba:fe:5b:69:8c:9a","de:ee:e6:56:ac:d0","172.20.0.3","172.20.0.2","TLSv1.2","Client Hello"
"64","0.349690029","66","de:ee:e6:56:ac:d0","ba:fe:5b:69:8c:9a","172.20.0.2","172.20.0.3","TCP","4433 → 47380 [ACK] Seq=1 Ack=1607 Win=64128 Len=0 TSval=2878711933 TSecr=2184141003"
"65","0.352046762","1956","de:ee:e6:56:ac:d0","ba:fe:5b:69:8c:9a","172.20.0.2","172.20.0.3","TLSv1.3","Server Hello, Change Cipher Spec, Application Data, Application Data, Application Data, Application Data"
"66","0.352084150","66","ba:fe:5b:69:8c:9a","de:ee:e6:56:ac:d0","172.20.0.3","172.20.0.2","TCP","47380 → 4433 [ACK] Seq=1607 Ack=1891 Win=64128 Len=0 TSval=2184141005 TSecr=2878711935"
"67","0.355343733","146","ba:fe:5b:69:8c:9a","de:ee:e6:56:ac:d0","172.20.0.3","172.20.0.2","TLSv1.3","Change Cipher Spec, Application Data"
"68","0.355413589","66","ba:fe:5b:69:8c:9a","de:ee:e6:56:ac:d0","172.20.0.3","172.20.0.2","TCP","47380 → 4433 [RST, ACK] Seq=1687 Ack=1891 Win=64128 Len=0 TSval=2184141009 TSecr=2878711935"
"69","0.368899126","74","ba:fe:5b:69:8c:9a","de:ee:e6:56:ac:d0","172.20.0.3","172.20.0.2","TCP","47382 → 4433 [SYN] Seq=0 Win=64240 Len=0 MSS=1460 SACK_PERM TSval=2184141022 TSecr=0 WS=128"
"70","0.368933331","74","de:ee:e6:56:ac:d0","ba:fe:5b:69:8c:9a","172.20.0.2","172.20.0.3","TCP","4433 → 47382 [SYN, ACK] Seq=0 Ack=1 Win=65160 Len=0 MSS=1460 SACK_PERM TSval=2878711952 TSecr=2184141022 WS=128"
"71","0.368953514","66","ba:fe:5b:69:8c:9a","de:ee:e6:56:ac:d0","172.20.0.3","172.20.0.2","TCP","47382 → 4433 [ACK] Seq=1 Ack=1 Win=64256 Len=0 TSval=2184141022 TSecr=2878711952"
"72","0.368999773","1672","ba:fe:5b:69:8c:9a","de:ee:e6:56:ac:d0","172.20.0.3","172.20.0.2","TLSv1.2","Client Hello"
"73","0.369004679","66","de:ee:e6:56:ac:d0","ba:fe:5b:69:8c:9a","172.20.0.2","172.20.0.3","TCP","4433 → 47382 [ACK] Seq=1 Ack=1607 Win=64128 Len=0 TSval=2878711952 TSecr=2184141022"
"74","0.370924478","1954","de:ee:e6:56:ac:d0","ba:fe:5b:69:8c:9a","172.20.0.2","172.20.0.3","TLSv1.3","Server Hello, Change Cipher Spec, Application Data, Application Data, Application Data, Application Data"
"75","0.370959374","66","ba:fe:5b:69:8c:9a","de:ee:e6:56:ac:d0","172.20.0.3","172.20.0.2","TCP","47382 → 4433 [ACK] Seq=1607 Ack=1889 Win=64128 Len=0 TSval=2184141024 TSecr=2878711954"
"76","0.373764370","146","ba:fe:5b:69:8c:9a","de:ee:e6:56:ac:d0","172.20.0.3","172.20.0.2","TLSv1.3","Change Cipher Spec, Application Data"
"77","0.373832676","66","ba:fe:5b:69:8c:9a","de:ee:e6:56:ac:d0","172.20.0.3","172.20.0.2","TCP","47382 → 4433 [RST, ACK] Seq=1687 Ack=1889 Win=64128 Len=0 TSval=2184141027 TSecr=2878711954"
"78","0.385612419","74","ba:fe:5b:69:8c:9a","de:ee:e6:56:ac:d0","172.20.0.3","172.20.0.2","TCP","47396 → 4433 [SYN] Seq=0 Win=64240 Len=0 MSS=1460 SACK_PERM TSval=2184141039 TSecr=0 WS=128"
"79","0.385647950","74","de:ee:e6:56:ac:d0","ba:fe:5b:69:8c:9a","172.20.0.2","172.20.0.3","TCP","4433 → 47396 [SYN, ACK] Seq=0 Ack=1 Win=65160 Len=0 MSS=1460 SACK_PERM TSval=2878711969 TSecr=2184141039 WS=128"
"80","0.385670766","66","ba:fe:5b:69:8c:9a","de:ee:e6:56:ac:d0","172.20.0.3","172.20.0.2","TCP","47396 → 4433 [ACK] Seq=1 Ack=1 Win=64256 Len=0 TSval=2184141039 TSecr=2878711969"
"81","0.385717234","1672","ba:fe:5b:69:8c:9a","de:ee:e6:56:ac:d0","172.20.0.3","172.20.0.2","TLSv1.2","Client Hello"
"82","0.385731075","66","de:ee:e6:56:ac:d0","ba:fe:5b:69:8c:9a","172.20.0.2","172.20.0.3","TCP","4433 → 47396 [ACK] Seq=1 Ack=1607 Win=64128 Len=0 TSval=2878711969 TSecr=2184141039"
"83","0.388179161","1955","de:ee:e6:56:ac:d0","ba:fe:5b:69:8c:9a","172.20.0.2","172.20.0.3","TLSv1.3","Server Hello, Change Cipher Spec, Application Data, Application Data, Application Data, Application Data"
"84","0.388211395","66","ba:fe:5b:69:8c:9a","de:ee:e6:56:ac:d0","172.20.0.3","172.20.0.2","TCP","47396 → 4433 [ACK] Seq=1607 Ack=1890 Win=64128 Len=0 TSval=2184141041 TSecr=2878711971"
"85","0.390947640","146","ba:fe:5b:69:8c:9a","de:ee:e6:56:ac:d0","172.20.0.3","172.20.0.2","TLSv1.3","Change Cipher Spec, Application Data"
"86","0.391017061","66","ba:fe:5b:69:8c:9a","de:ee:e6:56:ac:d0","172.20.0.3","172.20.0.2","TCP","47396 → 4433 [RST, ACK] Seq=1687 Ack=1890 Win=64128 Len=0 TSval=2184141044 TSecr=2878711971"
"87","0.403900292","74","ba:fe:5b:69:8c:9a","de:ee:e6:56:ac:d0","172.20.0.3","172.20.0.2","TCP","47402 → 4433 [SYN] Seq=0 Win=64240 Len=0 MSS=1460 SACK_PERM TSval=2184141057 TSecr=0 WS=128"
"88","0.403930178","74","de:ee:e6:56:ac:d0","ba:fe:5b:69:8c:9a","172.20.0.2","172.20.0.3","TCP","4433 → 47402 [SYN, ACK] Seq=0 Ack=1 Win=65160 Len=0 MSS=1460 SACK_PERM TSval=2878711987 TSecr=2184141057 WS=128"
"89","0.403951084","66","ba:fe:5b:69:8c:9a","de:ee:e6:56:ac:d0","172.20.0.3","172.20.0.2","TCP","47402 → 4433 [ACK] Seq=1 Ack=1 Win=64256 Len=0 TSval=2184141057 TSecr=2878711987"
"90","0.403998297","1672","ba:fe:5b:69:8c:9a","de:ee:e6:56:ac:d0","172.20.0.3","172.20.0.2","TLSv1.2","Client Hello"
"91","0.404023449","66","de:ee:e6:56:ac:d0","ba:fe:5b:69:8c:9a","172.20.0.2","172.20.0.3","TCP","4433 → 47402 [ACK] Seq=1 Ack=1607 Win=64128 Len=0 TSval=2878711987 TSecr=2184141057"
"92","0.406426157","1954","de:ee:e6:56:ac:d0","ba:fe:5b:69:8c:9a","172.20.0.2","172.20.0.3","TLSv1.3","Server Hello, Change Cipher Spec, Application Data, Application Data, Application Data, Application Data"
"93","0.406485510","66","ba:fe:5b:69:8c:9a","de:ee:e6:56:ac:d0","172.20.0.3","172.20.0.2","TCP","47402 → 4433 [ACK] Seq=1607 Ack=1889 Win=64128 Len=0 TSval=2184141060 TSecr=2878711990"
"94","0.409199791","146","ba:fe:5b:69:8c:9a","de:ee:e6:56:ac:d0","172.20.0.3","172.20.0.2","TLSv1.3","Change Cipher Spec, Application Data"
"95","0.409283559","66","ba:fe:5b:69:8c:9a","de:ee:e6:56:ac:d0","172.20.0.3","172.20.0.2","TCP","47402 → 4433 [RST, ACK] Seq=1687 Ack=1889 Win=64128 Len=0 TSval=2184141063 TSecr=2878711990"
"96","0.420757592","74","ba:fe:5b:69:8c:9a","de:ee:e6:56:ac:d0","172.20.0.3","172.20.0.2","TCP","47414 → 4433 [SYN] Seq=0 Win=64240 Len=0 MSS=1460 SACK_PERM TSval=2184141074 TSecr=0 WS=128"
"97","0.420788214","74","de:ee:e6:56:ac:d0","ba:fe:5b:69:8c:9a","172.20.0.2","172.20.0.3","TCP","4433 → 47414 [SYN, ACK] Seq=0 Ack=1 Win=65160 Len=0 MSS=1460 SACK_PERM TSval=2878712004 TSecr=2184141074 WS=128"
"98","0.420807419","66","ba:fe:5b:69:8c:9a","de:ee:e6:56:ac:d0","172.20.0.3","172.20.0.2","TCP","47414 → 4433 [ACK] Seq=1 Ack=1 Win=64256 Len=0 TSval=2184141074 TSecr=2878712004"
"99","0.420855484","1672","ba:fe:5b:69:8c:9a","de:ee:e6:56:ac:d0","172.20.0.3","172.20.0.2","TLSv1.2","Client Hello"
"100","0.420862378","66","de:ee:e6:56:ac:d0","ba:fe:5b:69:8c:9a","172.20.0.2","172.20.0.3","TCP","4433 → 47414 [ACK] Seq=1 Ack=1607 Win=64128 Len=0 TSval=2878712004 TSecr=2184141074"
"101","0.423150528","1956","de:ee:e6:56:ac:d0","ba:fe:5b:69:8c:9a","172.20.0.2","172.20.0.3","TLSv1.3","Server Hello, Change Cipher Spec, Application Data, Application Data, Application Data, Application Data"
"102","0.423193799","66","ba:fe:5b:69:8c:9a","de:ee:e6:56:ac:d0","172.20.0.3","172.20.0.2","TCP","47414 → 4433 [ACK] Seq=1607 Ack=1891 Win=64128 Len=0 TSval=2184141076 TSecr=2878712006"
"103","0.425967736","146","ba:fe:5b:69:8c:9a","de:ee:e6:56:ac:d0","172.20.0.3","172.20.0.2","TLSv1.3","Change Cipher Spec, Application Data"
"104","0.426034372","66","ba:fe:5b:69:8c:9a","de:ee:e6:56:ac:d0","172.20.0.3","172.20.0.2","TCP","47414 → 4433 [RST, ACK] Seq=1687 Ack=1891 Win=64128 Len=0 TSval=2184141079 TSecr=2878712006"
"105","0.437948066","74","ba:fe:5b:69:8c:9a","de:ee:e6:56:ac:d0","172.20.0.3","172.20.0.2","TCP","47422 → 4433 [SYN] Seq=0 Win=64240 Len=0 MSS=1460 SACK_PERM TSval=2184141091 TSecr=0 WS=128"
"106","0.437979700","74","de:ee:e6:56:ac:d0","ba:fe:5b:69:8c:9a","172.20.0.2","172.20.0.3","TCP","4433 → 47422 [SYN, ACK] Seq=0 Ack=1 Win=65160 Len=0 MSS=1460 SACK_PERM TSval=2878712021 TSecr=2184141091 WS=128"
"107","0.437998275","66","ba:fe:5b:69:8c:9a","de:ee:e6:56:ac:d0","172.20.0.3","172.20.0.2","TCP","47422 → 4433 [ACK] Seq=1 Ack=1 Win=64256 Len=0 TSval=2184141091 TSecr=2878712021"
"108","0.438046621","1672","ba:fe:5b:69:8c:9a","de:ee:e6:56:ac:d0","172.20.0.3","172.20.0.2","TLSv1.2","Client Hello"
"109","0.438052835","66","de:ee:e6:56:ac:d0","ba:fe:5b:69:8c:9a","172.20.0.2","172.20.0.3","TCP","4433 → 47422 [ACK] Seq=1 Ack=1607 Win=64128 Len=0 TSval=2878712021 TSecr=2184141091"
"110","0.440823456","1956","de:ee:e6:56:ac:d0","ba:fe:5b:69:8c:9a","172.20.0.2","172.20.0.3","TLSv1.3","Server Hello, Change Cipher Spec, Application Data, Application Data, Application Data, Application Data"
"111","0.440882201","66","ba:fe:5b:69:8c:9a","de:ee:e6:56:ac:d0","172.20.0.3","172.20.0.2","TCP","47422 → 4433 [ACK] Seq=1607 Ack=1891 Win=64128 Len=0 TSval=2184141094 TSecr=2878712024"
"112","0.443943322","146","ba:fe:5b:69:8c:9a","de:ee:e6:56:ac:d0","172.20.0.3","172.20.0.2","TLSv1.3","Change Cipher Spec, Application Data"
"113","0.444008972","66","ba:fe:5b:69:8c:9a","de:ee:e6:56:ac:d0","172.20.0.3","172.20.0.2","TCP","47422 → 4433 [RST, ACK] Seq=1687 Ack=1891 Win=64128 Len=0 TSval=2184141097 TSecr=2878712024"
"114","0.457845102","74","ba:fe:5b:69:8c:9a","de:ee:e6:56:ac:d0","172.20.0.3","172.20.0.2","TCP","47434 → 4433 [SYN] Seq=0 Win=64240 Len=0 MSS=1460 SACK_PERM TSval=2184141111 TSecr=0 WS=128"
"115","0.457873790","74","de:ee:e6:56:ac:d0","ba:fe:5b:69:8c:9a","172.20.0.2","172.20.0.3","TCP","4433 → 47434 [SYN, ACK] Seq=0 Ack=1 Win=65160 Len=0 MSS=1460 SACK_PERM TSval=2878712041 TSecr=2184141111 WS=128"
"116","0.457892763","66","ba:fe:5b:69:8c:9a","de:ee:e6:56:ac:d0","172.20.0.3","172.20.0.2","TCP","47434 → 4433 [ACK] Seq=1 Ack=1 Win=64256 Len=0 TSval=2184141111 TSecr=2878712041"
"117","0.457949911","1672","ba:fe:5b:69:8c:9a","de:ee:e6:56:ac:d0","172.20.0.3","172.20.0.2","TLSv1.2","Client Hello"
"118","0.457957517","66","de:ee:e6:56:ac:d0","ba:fe:5b:69:8c:9a","172.20.0.2","172.20.0.3","TCP","4433 → 47434 [ACK] Seq=1 Ack=1607 Win=64128 Len=0 TSval=2878712041 TSecr=2184141111"
"119","0.460206078","1955","de:ee:e6:56:ac:d0","ba:fe:5b:69:8c:9a","172.20.0.2","172.20.0.3","TLSv1.3","Server Hello, Change Cipher Spec, Application Data, Application Data, Application Data, Application Data"
"120","0.460252831","66","ba:fe:5b:69:8c:9a","de:ee:e6:56:ac:d0","172.20.0.3","172.20.0.2","TCP","47434 → 4433 [ACK] Seq=1607 Ack=1890 Win=64128 Len=0 TSval=2184141113 TSecr=2878712043"
"121","0.463200964","146","ba:fe:5b:69:8c:9a","de:ee:e6:56:ac:d0","172.20.0.3","172.20.0.2","TLSv1.3","Change Cipher Spec, Application Data"
"122","0.463316440","66","ba:fe:5b:69:8c:9a","de:ee:e6:56:ac:d0","172.20.0.3","172.20.0.2","TCP","47434 → 4433 [RST, ACK] Seq=1687 Ack=1890 Win=64128 Len=0 TSval=2184141117 TSecr=2878712043"
"123","0.475410177","74","ba:fe:5b:69:8c:9a","de:ee:e6:56:ac:d0","172.20.0.3","172.20.0.2","TCP","47450 → 4433 [SYN] Seq=0 Win=64240 Len=0 MSS=1460 SACK_PERM TSval=2184141129 TSecr=0 WS=128"
"124","0.475438092","74","de:ee:e6:56:ac:d0","ba:fe:5b:69:8c:9a","172.20.0.2","172.20.0.3","TCP","4433 → 47450 [SYN, ACK] Seq=0 Ack=1 Win=65160 Len=0 MSS=1460 SACK_PERM TSval=2878712059 TSecr=2184141129 WS=128"
"125","0.475455616","66","ba:fe:5b:69:8c:9a","de:ee:e6:56:ac:d0","172.20.0.3","172.20.0.2","TCP","47450 → 4433 [ACK] Seq=1 Ack=1 Win=64256 Len=0 TSval=2184141129 TSecr=2878712059"
"126","0.475504827","1672","ba:fe:5b:69:8c:9a","de:ee:e6:56:ac:d0","172.20.0.3","172.20.0.2","TLSv1.2","Client Hello"
"127","0.475509698","66","de:ee:e6:56:ac:d0","ba:fe:5b:69:8c:9a","172.20.0.2","172.20.0.3","TCP","4433 → 47450 [ACK] Seq=1 Ack=1607 Win=64128 Len=0 TSval=2878712059 TSecr=2184141129"
"128","0.478479176","1954","de:ee:e6:56:ac:d0","ba:fe:5b:69:8c:9a","172.20.0.2","172.20.0.3","TLSv1.3","Server Hello, Change Cipher Spec, Application Data, Application Data, Application Data, Application Data"
"129","0.478530821","66","ba:fe:5b:69:8c:9a","de:ee:e6:56:ac:d0","172.20.0.3","172.20.0.2","TCP","47450 → 4433 [ACK] Seq=1607 Ack=1889 Win=64128 Len=0 TSval=2184141132 TSecr=2878712062"
"130","0.481554525","146","ba:fe:5b:69:8c:9a","de:ee:e6:56:ac:d0","172.20.0.3","172.20.0.2","TLSv1.3","Change Cipher Spec, Application Data"
"131","0.481623878","66","ba:fe:5b:69:8c:9a","de:ee:e6:56:ac:d0","172.20.0.3","172.20.0.2","TCP","47450 → 4433 [RST, ACK] Seq=1687 Ack=1889 Win=64128 Len=0 TSval=2184141135 TSecr=2878712062"
"132","0.492725514","74","ba:fe:5b:69:8c:9a","de:ee:e6:56:ac:d0","172.20.0.3","172.20.0.2","TCP","47460 → 4433 [SYN] Seq=0 Win=64240 Len=0 MSS=1460 SACK_PERM TSval=2184141146 TSecr=0 WS=128"
"133","0.492753174","74","de:ee:e6:56:ac:d0","ba:fe:5b:69:8c:9a","172.20.0.2","172.20.0.3","TCP","4433 → 47460 [SYN, ACK] Seq=0 Ack=1 Win=65160 Len=0 MSS=1460 SACK_PERM TSval=2878712076 TSecr=2184141146 WS=128"
"134","0.492772752","66","ba:fe:5b:69:8c:9a","de:ee:e6:56:ac:d0","172.20.0.3","172.20.0.2","TCP","47460 → 4433 [ACK] Seq=1 Ack=1 Win=64256 Len=0 TSval=2184141146 TSecr=2878712076"
"135","0.492818778","1672","ba:fe:5b:69:8c:9a","de:ee:e6:56:ac:d0","172.20.0.3","172.20.0.2","TLSv1.2","Client Hello"
"136","0.492823154","66","de:ee:e6:56:ac:d0","ba:fe:5b:69:8c:9a","172.20.0.2","172.20.0.3","TCP","4433 → 47460 [ACK] Seq=1 Ack=1607 Win=64128 Len=0 TSval=2878712076 TSecr=2184141146"
"137","0.494619564","1955","de:ee:e6:56:ac:d0","ba:fe:5b:69:8c:9a","172.20.0.2","172.20.0.3","TLSv1.3","Server Hello, Change Cipher Spec, Application Data, Application Data, Application Data, Application Data"
"138","0.494661705","66","ba:fe:5b:69:8c:9a","de:ee:e6:56:ac:d0","172.20.0.3","172.20.0.2","TCP","47460 → 4433 [ACK] Seq=1607 Ack=1890 Win=64128 Len=0 TSval=2184141148 TSecr=2878712078"
"139","0.497516188","146","ba:fe:5b:69:8c:9a","de:ee:e6:56:ac:d0","172.20.0.3","172.20.0.2","TLSv1.3","Change Cipher Spec, Application Data"
"140","0.497585895","66","ba:fe:5b:69:8c:9a","de:ee:e6:56:ac:d0","172.20.0.3","172.20.0.2","TCP","47460 → 4433 [RST, ACK] Seq=1687 Ack=1890 Win=64128 Len=0 TSval=2184141151 TSecr=2878712078"
"141","0.512911000","74","ba:fe:5b:69:8c:9a","de:ee:e6:56:ac:d0","172.20.0.3","172.20.0.2","TCP","47472 → 4433 [SYN] Seq=0 Win=64240 Len=0 MSS=1460 SACK_PERM TSval=2184141166 TSecr=0 WS=128"
"142","1.000530471","42","ba:fe:5b:69:8c:9a","ff:ff:ff:ff:ff:ff",,,"ARP","ARP Announcement for 172.20.0.3"
"143","1.519288087","74","de:ee:e6:56:ac:d0","ba:fe:5b:69:8c:9a","172.20.0.2","172.20.0.3","TCP","4433 → 47472 [SYN, ACK] Seq=0 Ack=1 Win=65160 Len=0 MSS=1460 SACK_PERM TSval=2878713103 TSecr=2184141166 WS=128"
"144","1.519304816","74","ba:fe:5b:69:8c:9a","de:ee:e6:56:ac:d0","172.20.0.3","172.20.0.2","TCP","[TCP Retransmission] 47472 → 4433 [SYN] Seq=0 Win=64240 Len=0 MSS=1460 SACK_PERM TSval=2184142173 TSecr=0 WS=128"
"145","1.519320115","74","de:ee:e6:56:ac:d0","ba:fe:5b:69:8c:9a","172.20.0.2","172.20.0.3","TCP","[TCP Out-Of-Order] 4433 → 47472 [SYN, ACK] Seq=0 Ack=1 Win=65160 Len=0 MSS=1460 SACK_PERM TSval=2878713103 TSecr=2184141166 WS=128"
"146","1.519352653","66","ba:fe:5b:69:8c:9a","de:ee:e6:56:ac:d0","172.20.0.3","172.20.0.2","TCP","47472 → 4433 [ACK] Seq=1 Ack=1 Win=64256 Len=0 TSval=2184142173 TSecr=2878713103"
"147","1.519373719","66","ba:fe:5b:69:8c:9a","de:ee:e6:56:ac:d0","172.20.0.3","172.20.0.2","TCP","[TCP Dup ACK 146#1] 47472 → 4433 [ACK] Seq=1 Ack=1 Win=64256 Len=0 TSval=2184142173 TSecr=2878713103"
"148","1.519437369","1672","ba:fe:5b:69:8c:9a","de:ee:e6:56:ac:d0","172.20.0.3","172.20.0.2","TLSv1.2","Client Hello"
"149","1.519443611","66","de:ee:e6:56:ac:d0","ba:fe:5b:69:8c:9a","172.20.0.2","172.20.0.3","TCP","4433 → 47472 [ACK] Seq=1 Ack=1607 Win=64128 Len=0 TSval=2878713103 TSecr=2184142173"
"150","1.521299848","1514","de:ee:e6:56:ac:d0","ba:fe:5b:69:8c:9a","172.20.0.2","172.20.0.3","TLSv1.3","Server Hello, Change Cipher Spec, Application Data"
"151","1.521329381","66","ba:fe:5b:69:8c:9a","de:ee:e6:56:ac:d0","172.20.0.3","172.20.0.2","TCP","47472 → 4433 [ACK] Seq=1607 Ack=1449 Win=64128 Len=0 TSval=2184142175 TSecr=2878713105"
"152","1.521337272","508","de:ee:e6:56:ac:d0","ba:fe:5b:69:8c:9a","172.20.0.2","172.20.0.3","TLSv1.3","Application Data, Application Data, Application Data"
"153","1.521341881","66","ba:fe:5b:69:8c:9a","de:ee:e6:56:ac:d0","172.20.0.3","172.20.0.2","TCP","47472 → 4433 [ACK] Seq=1607 Ack=1891 Win=64128 Len=0 TSval=2184142175 TSecr=2878713105"
"154","1.524208149","146","ba:fe:5b:69:8c:9a","de:ee:e6:56:ac:d0","172.20.0.3","172.20.0.2","TLSv1.3","Change Cipher Spec, Application Data"
"155","1.524288190","66","ba:fe:5b:69:8c:9a","de:ee:e6:56:ac:d0","172.20.0.3","172.20.0.2","TCP","47472 → 4433 [RST, ACK] Seq=1687 Ack=1891 Win=64128 Len=0 TSval=2184142178 TSecr=2878713105"
"156","1.536244899","74","ba:fe:5b:69:8c:9a","de:ee:e6:56:ac:d0","172.20.0.3","172.20.0.2","TCP","47482 → 4433 [SYN] Seq=0 Win=64240 Len=0 MSS=1460 SACK_PERM TSval=2184142189 TSecr=0 WS=128"
"157","1.536270611","74","de:ee:e6:56:ac:d0","ba:fe:5b:69:8c:9a","172.20.0.2","172.20.0.3","TCP","4433 → 47482 [SYN, ACK] Seq=0 Ack=1 Win=65160 Len=0 MSS=1460 SACK_PERM TSval=2878713120 TSecr=2184142189 WS=128"
"158","1.536313273","66","ba:fe:5b:69:8c:9a","de:ee:e6:56:ac:d0","172.20.0.3","172.20.0.2","TCP","47482 → 4433 [ACK] Seq=1 Ack=1 Win=64256 Len=0 TSval=2184142190 TSecr=2878713120"
"159","1.536364696","1672","ba:fe:5b:69:8c:9a","de:ee:e6:56:ac:d0","172.20.0.3","172.20.0.2","TLSv1.2","Client Hello"
"160","1.536371355","66","de:ee:e6:56:ac:d0","ba:fe:5b:69:8c:9a","172.20.0.2","172.20.0.3","TCP","4433 → 47482 [ACK] Seq=1 Ack=1607 Win=64128 Len=0 TSval=2878713120 TSecr=2184142190"
"161","1.538028385","1955","de:ee:e6:56:ac:d0","ba:fe:5b:69:8c:9a","172.20.0.2","172.20.0.3","TLSv1.3","Server Hello, Change Cipher Spec, Application Data, Application Data, Application Data, Application Data"
"162","1.538070194","66","ba:fe:5b:69:8c:9a","de:ee:e6:56:ac:d0","172.20.0.3","172.20.0.2","TCP","47482 → 4433 [ACK] Seq=1607 Ack=1890 Win=64128 Len=0 TSval=2184142191 TSecr=2878713121"
"163","1.540727518","146","ba:fe:5b:69:8c:9a","de:ee:e6:56:ac:d0","172.20.0.3","172.20.0.2","TLSv1.3","Change Cipher Spec, Application Data"
"164","1.540785456","66","ba:fe:5b:69:8c:9a","de:ee:e6:56:ac:d0","172.20.0.3","172.20.0.2","TCP","47482 → 4433 [RST, ACK] Seq=1687 Ack=1890 Win=64128 Len=0 TSval=2184142194 TSecr=2878713121"
"165","1.551610079","74","ba:fe:5b:69:8c:9a","de:ee:e6:56:ac:d0","172.20.0.3","172.20.0.2","TCP","47492 → 4433 [SYN] Seq=0 Win=64240 Len=0 MSS=1460 SACK_PERM TSval=2184142205 TSecr=0 WS=128"
"166","1.551634517","74","de:ee:e6:56:ac:d0","ba:fe:5b:69:8c:9a","172.20.0.2","172.20.0.3","TCP","4433 → 47492 [SYN, ACK] Seq=0 Ack=1 Win=65160 Len=0 MSS=1460 SACK_PERM TSval=2878713135 TSecr=2184142205 WS=128"
"167","1.551651352","66","ba:fe:5b:69:8c:9a","de:ee:e6:56:ac:d0","172.20.0.3","172.20.0.2","TCP","47492 → 4433 [ACK] Seq=1 Ack=1 Win=64256 Len=0 TSval=2184142205 TSecr=2878713135"
"168","1.551693980","1672","ba:fe:5b:69:8c:9a","de:ee:e6:56:ac:d0","172.20.0.3","172.20.0.2","TLSv1.2","Client Hello"
"169","1.551699961","66","de:ee:e6:56:ac:d0","ba:fe:5b:69:8c:9a","172.20.0.2","172.20.0.3","TCP","4433 → 47492 [ACK] Seq=1 Ack=1607 Win=64128 Len=0 TSval=2878713135 TSecr=2184142205"
"170","1.553391451","1956","de:ee:e6:56:ac:d0","ba:fe:5b:69:8c:9a","172.20.0.2","172.20.0.3","TLSv1.3","Server Hello, Change Cipher Spec, Application Data, Application Data, Application Data, Application Data"
"171","1.553433592","66","ba:fe:5b:69:8c:9a","de:ee:e6:56:ac:d0","172.20.0.3","172.20.0.2","TCP","47492 → 4433 [ACK] Seq=1607 Ack=1891 Win=64128 Len=0 TSval=2184142207 TSecr=2878713137"
"172","1.556050120","146","ba:fe:5b:69:8c:9a","de:ee:e6:56:ac:d0","172.20.0.3","172.20.0.2","TLSv1.3","Change Cipher Spec, Application Data"
"173","1.556108573","66","ba:fe:5b:69:8c:9a","de:ee:e6:56:ac:d0","172.20.0.3","172.20.0.2","TCP","47492 → 4433 [RST, ACK] Seq=1687 Ack=1891 Win=64128 Len=0 TSval=2184142209 TSecr=2878713137"
"174","1.566654812","74","ba:fe:5b:69:8c:9a","de:ee:e6:56:ac:d0","172.20.0.3","172.20.0.2","TCP","47494 → 4433 [SYN] Seq=0 Win=64240 Len=0 MSS=1460 SACK_PERM TSval=2184142220 TSecr=0 WS=128"
"175","1.566681083","74","de:ee:e6:56:ac:d0","ba:fe:5b:69:8c:9a","172.20.0.2","172.20.0.3","TCP","4433 → 47494 [SYN, ACK] Seq=0 Ack=1 Win=65160 Len=0 MSS=1460 SACK_PERM TSval=2878713150 TSecr=2184142220 WS=128"
"176","1.566696338","66","ba:fe:5b:69:8c:9a","de:ee:e6:56:ac:d0","172.20.0.3","172.20.0.2","TCP","47494 → 4433 [ACK] Seq=1 Ack=1 Win=64256 Len=0 TSval=2184142220 TSecr=2878713150"
"177","1.566740149","1672","ba:fe:5b:69:8c:9a","de:ee:e6:56:ac:d0","172.20.0.3","172.20.0.2","TLSv1.2","Client Hello"
"178","1.566746958","66","de:ee:e6:56:ac:d0","ba:fe:5b:69:8c:9a","172.20.0.2","172.20.0.3","TCP","4433 → 47494 [ACK] Seq=1 Ack=1607 Win=64128 Len=0 TSval=2878713150 TSecr=2184142220"
"179","1.568446697","1954","de:ee:e6:56:ac:d0","ba:fe:5b:69:8c:9a","172.20.0.2","172.20.0.3","TLSv1.3","Server Hello, Change Cipher Spec, Application Data, Application Data, Application Data, Application Data"
"180","1.568488246","66","ba:fe:5b:69:8c:9a","de:ee:e6:56:ac:d0","172.20.0.3","172.20.0.2","TCP","47494 → 4433 [ACK] Seq=1607 Ack=1889 Win=64128 Len=0 TSval=2184142222 TSecr=2878713152"
"181","1.571142980","146","ba:fe:5b:69:8c:9a","de:ee:e6:56:ac:d0","172.20.0.3","172.20.0.2","TLSv1.3","Change Cipher Spec, Application Data"
"182","1.571203510","66","ba:fe:5b:69:8c:9a","de:ee:e6:56:ac:d0","172.20.0.3","172.20.0.2","TCP","47494 → 4433 [RST, ACK] Seq=1687 Ack=1889 Win=64128 Len=0 TSval=2184142224 TSecr=2878713152"
"183","1.581979911","74","ba:fe:5b:69:8c:9a","de:ee:e6:56:ac:d0","172.20.0.3","172.20.0.2","TCP","47504 → 4433 [SYN] Seq=0 Win=64240 Len=0 MSS=1460 SACK_PERM TSval=2184142235 TSecr=0 WS=128"
"184","1.582006957","74","de:ee:e6:56:ac:d0","ba:fe:5b:69:8c:9a","172.20.0.2","172.20.0.3","TCP","4433 → 47504 [SYN, ACK] Seq=0 Ack=1 Win=65160 Len=0 MSS=1460 SACK_PERM TSval=2878713165 TSecr=2184142235 WS=128"
"185","1.582023795","66","ba:fe:5b:69:8c:9a","de:ee:e6:56:ac:d0","172.20.0.3","172.20.0.2","TCP","47504 → 4433 [ACK] Seq=1 Ack=1 Win=64256 Len=0 TSval=2184142235 TSecr=2878713165"
"186","1.582068292","1672","ba:fe:5b:69:8c:9a","de:ee:e6:56:ac:d0","172.20.0.3","172.20.0.2","TLSv1.2","Client Hello"
"187","1.582074681","66","de:ee:e6:56:ac:d0","ba:fe:5b:69:8c:9a","172.20.0.2","172.20.0.3","TCP","4433 → 47504 [ACK] Seq=1 Ack=1607 Win=64128 Len=0 TSval=2878713165 TSecr=2184142235"
"188","1.583844379","1955","de:ee:e6:56:ac:d0","ba:fe:5b:69:8c:9a","172.20.0.2","172.20.0.3","TLSv1.3","Server Hello, Change Cipher Spec, Application Data, Application Data, Application Data, Application Data"
"189","1.583877872","66","ba:fe:5b:69:8c:9a","de:ee:e6:56:ac:d0","172.20.0.3","172.20.0.2","TCP","47504 → 4433 [ACK] Seq=1607 Ack=1890 Win=64128 Len=0 TSval=2184142237 TSecr=2878713167"
"190","1.586570692","146","ba:fe:5b:69:8c:9a","de:ee:e6:56:ac:d0","172.20.0.3","172.20.0.2","TLSv1.3","Change Cipher Spec, Application Data"
"191","1.586629493","66","ba:fe:5b:69:8c:9a","de:ee:e6:56:ac:d0","172.20.0.3","172.20.0.2","TCP","47504 → 4433 [RST, ACK] Seq=1687 Ack=1890 Win=64128 Len=0 TSval=2184142240 TSecr=2878713167"
"192","1.597891784","74","ba:fe:5b:69:8c:9a","de:ee:e6:56:ac:d0","172.20.0.3","172.20.0.2","TCP","47508 → 4433 [SYN] Seq=0 Win=64240 Len=0 MSS=1460 SACK_PERM TSval=2184142251 TSecr=0 WS=128"
"193","1.597917392","74","de:ee:e6:56:ac:d0","ba:fe:5b:69:8c:9a","172.20.0.2","172.20.0.3","TCP","4433 → 47508 [SYN, ACK] Seq=0 Ack=1 Win=65160 Len=0 MSS=1460 SACK_PERM TSval=2878713181 TSecr=2184142251 WS=128"
"194","1.597936075","66","ba:fe:5b:69:8c:9a","de:ee:e6:56:ac:d0","172.20.0.3","172.20.0.2","TCP","47508 → 4433 [ACK] Seq=1 Ack=1 Win=64256 Len=0 TSval=2184142251 TSecr=2878713181"
"195","1.597983247","1672","ba:fe:5b:69:8c:9a","de:ee:e6:56:ac:d0","172.20.0.3","172.20.0.2","TLSv1.2","Client Hello"
"196","1.597989805","66","de:ee:e6:56:ac:d0","ba:fe:5b:69:8c:9a","172.20.0.2","172.20.0.3","TCP","4433 → 47508 [ACK] Seq=1 Ack=1607 Win=64128 Len=0 TSval=2878713181 TSecr=2184142251"
"197","1.599611569","1955","de:ee:e6:56:ac:d0","ba:fe:5b:69:8c:9a","172.20.0.2","172.20.0.3","TLSv1.3","Server Hello, Change Cipher Spec, Application Data, Application Data, Application Data, Application Data"
"198","1.599640823","66","ba:fe:5b:69:8c:9a","de:ee:e6:56:ac:d0","172.20.0.3","172.20.0.2","TCP","47508 → 4433 [ACK] Seq=1607 Ack=1890 Win=64128 Len=0 TSval=2184142253 TSecr=2878713183"
"199","1.602242272","146","ba:fe:5b:69:8c:9a","de:ee:e6:56:ac:d0","172.20.0.3","172.20.0.2","TLSv1.3","Change Cipher Spec, Application Data"
"200","1.602296890","66","ba:fe:5b:69:8c:9a","de:ee:e6:56:ac:d0","172.20.0.3","172.20.0.2","TCP","47508 → 4433 [RST, ACK] Seq=1687 Ack=1890 Win=64128 Len=0 TSval=2184142256 TSecr=2878713183"
"201","1.612610862","74","ba:fe:5b:69:8c:9a","de:ee:e6:56:ac:d0","172.20.0.3","172.20.0.2","TCP","47518 → 4433 [SYN] Seq=0 Win=64240 Len=0 MSS=1460 SACK_PERM TSval=2184142266 TSecr=0 WS=128"
"202","1.612633909","74","de:ee:e6:56:ac:d0","ba:fe:5b:69:8c:9a","172.20.0.2","172.20.0.3","TCP","4433 → 47518 [SYN, ACK] Seq=0 Ack=1 Win=65160 Len=0 MSS=1460 SACK_PERM TSval=2878713196 TSecr=2184142266 WS=128"
"203","1.612649995","66","ba:fe:5b:69:8c:9a","de:ee:e6:56:ac:d0","172.20.0.3","172.20.0.2","TCP","47518 → 4433 [ACK] Seq=1 Ack=1 Win=64256 Len=0 TSval=2184142266 TSecr=2878713196"
"204","1.612688339","1672","ba:fe:5b:69:8c:9a","de:ee:e6:56:ac:d0","172.20.0.3","172.20.0.2","TLSv1.2","Client Hello"
"205","1.612695013","66","de:ee:e6:56:ac:d0","ba:fe:5b:69:8c:9a","172.20.0.2","172.20.0.3","TCP","4433 → 47518 [ACK] Seq=1 Ack=1607 Win=64128 Len=0 TSval=2878713196 TSecr=2184142266"
"206","1.614240954","1955","de:ee:e6:56:ac:d0","ba:fe:5b:69:8c:9a","172.20.0.2","172.20.0.3","TLSv1.3","Server Hello, Change Cipher Spec, Application Data, Application Data, Application Data, Application Data"
"207","1.614265934","66","ba:fe:5b:69:8c:9a","de:ee:e6:56:ac:d0","172.20.0.3","172.20.0.2","TCP","47518 → 4433 [ACK] Seq=1607 Ack=1890 Win=64128 Len=0 TSval=2184142268 TSecr=2878713197"
"208","1.616857550","146","ba:fe:5b:69:8c:9a","de:ee:e6:56:ac:d0","172.20.0.3","172.20.0.2","TLSv1.3","Change Cipher Spec, Application Data"
"209","1.616917513","66","ba:fe:5b:69:8c:9a","de:ee:e6:56:ac:d0","172.20.0.3","172.20.0.2","TCP","47518 → 4433 [RST, ACK] Seq=1687 Ack=1890 Win=64128 Len=0 TSval=2184142270 TSecr=2878713197"
"210","1.627923626","74","ba:fe:5b:69:8c:9a","de:ee:e6:56:ac:d0","172.20.0.3","172.20.0.2","TCP","47524 → 4433 [SYN] Seq=0 Win=64240 Len=0 MSS=1460 SACK_PERM TSval=2184142281 TSecr=0 WS=128"
"211","2.000674467","42","ba:fe:5b:69:8c:9a","ff:ff:ff:ff:ff:ff",,,"ARP","ARP Announcement for 172.20.0.3"
"212","2.671365173","74","de:ee:e6:56:ac:d0","ba:fe:5b:69:8c:9a","172.20.0.2","172.20.0.3","TCP","4433 → 47524 [SYN, ACK] Seq=0 Ack=1 Win=65160 Len=0 MSS=1460 SACK_PERM TSval=2878714255 TSecr=2184142281 WS=128"
"213","2.671391668","74","ba:fe:5b:69:8c:9a","de:ee:e6:56:ac:d0","172.20.0.3","172.20.0.2","TCP","[TCP Retransmission] 47524 → 4433 [SYN] Seq=0 Win=64240 Len=0 MSS=1460 SACK_PERM TSval=2184143325 TSecr=0 WS=128"
"214","2.671409029","74","de:ee:e6:56:ac:d0","ba:fe:5b:69:8c:9a","172.20.0.2","172.20.0.3","TCP","[TCP Out-Of-Order] 4433 → 47524 [SYN, ACK] Seq=0 Ack=1 Win=65160 Len=0 MSS=1460 SACK_PERM TSval=2878714255 TSecr=2184142281 WS=128"
"215","2.671442509","66","ba:fe:5b:69:8c:9a","de:ee:e6:56:ac:d0","172.20.0.3","172.20.0.2","TCP","47524 → 4433 [ACK] Seq=1 Ack=1 Win=64256 Len=0 TSval=2184143325 TSecr=2878714255"
"216","2.671473101","66","ba:fe:5b:69:8c:9a","de:ee:e6:56:ac:d0","172.20.0.3","172.20.0.2","TCP","[TCP Dup ACK 215#1] 47524 → 4433 [ACK] Seq=1 Ack=1 Win=64256 Len=0 TSval=2184143325 TSecr=2878714255"
"217","2.671526535","1672","ba:fe:5b:69:8c:9a","de:ee:e6:56:ac:d0","172.20.0.3","172.20.0.2","TLSv1.2","Client Hello"
"218","2.671533191","66","de:ee:e6:56:ac:d0","ba:fe:5b:69:8c:9a","172.20.0.2","172.20.0.3","TCP","4433 → 47524 [ACK] Seq=1 Ack=1607 Win=64128 Len=0 TSval=2878714255 TSecr=2184143325"
"219","2.673394893","1514","de:ee:e6:56:ac:d0","ba:fe:5b:69:8c:9a","172.20.0.2","172.20.0.3","TLSv1.3","Server Hello, Change Cipher Spec, Application Data"
"220","2.673424099","66","ba:fe:5b:69:8c:9a","de:ee:e6:56:ac:d0","172.20.0.3","172.20.0.2","TCP","47524 → 4433 [ACK] Seq=1607 Ack=1449 Win=64128 Len=0 TSval=2184143327 TSecr=2878714257"
"221","2.879270428","508","de:ee:e6:56:ac:d0","ba:fe:5b:69:8c:9a","172.20.0.2","172.20.0.3","TLSv1.3","Application Data, Application Data, Application Data"
"222","2.879356330","66","ba:fe:5b:69:8c:9a","de:ee:e6:56:ac:d0","172.20.0.3","172.20.0.2","TCP","47524 → 4433 [ACK] Seq=1607 Ack=1891 Win=64128 Len=0 TSval=2184143533 TSecr=2878714463"
"223","2.881833606","146","ba:fe:5b:69:8c:9a","de:ee:e6:56:ac:d0","172.20.0.3","172.20.0.2","TLSv1.3","Change Cipher Spec, Application Data"
"224","2.881908057","66","ba:fe:5b:69:8c:9a","de:ee:e6:56:ac:d0","172.20.0.3","172.20.0.2","TCP","47524 → 4433 [RST, ACK] Seq=1687 Ack=1891 Win=64128 Len=0 TSval=2184143535 TSecr=2878714463"
