frame.number,frame.time_relative,frame.len,eth.src,eth.dst,ip.src,ip.dst,_ws.col.protocol,_ws.col.info
"1","0.000000000","42","06:b3:6c:70:4f:ab","ff:ff:ff:ff:ff:ff",,,"ARP","ARP Announcement for 172.20.0.3"
"2","0.036505794","42","06:b3:6c:70:4f:ab","ff:ff:ff:ff:ff:ff",,,"ARP","Who has 172.20.0.2? Tell 172.20.0.3"
"3","0.036530256","42","c6:96:25:ab:d1:61","06:b3:6c:70:4f:ab",,,"ARP","172.20.0.2 is at c6:96:25:ab:d1:61"
"4","0.036538454","74","06:b3:6c:70:4f:ab","c6:96:25:ab:d1:61","172.20.0.3","172.20.0.2","TCP","36052 → 4433 [SYN] Seq=0 Win=64240 Len=0 MSS=1460 SACK_PERM TSval=2182735203 TSecr=0 WS=128"
"5","0.036557526","74","c6:96:25:ab:d1:61","06:b3:6c:70:4f:ab","172.20.0.2","172.20.0.3","TCP","4433 → 36052 [SYN, ACK] Seq=0 Ack=1 Win=65160 Len=0 MSS=1460 SACK_PERM TSval=2877306133 TSecr=2182735203 WS=128"
"6","0.036573085","66","06:b3:6c:70:4f:ab","c6:96:25:ab:d1:61","172.20.0.3","172.20.0.2","TCP","36052 → 4433 [ACK] Seq=1 Ack=1 Win=64256 Len=0 TSval=2182735203 TSecr=2877306133"
"7","0.036613744","1769","06:b3:6c:70:4f:ab","c6:96:25:ab:d1:61","172.20.0.3","172.20.0.2","TLSv1.2","Client Hello"
"8","0.036620152","66","c6:96:25:ab:d1:61","06:b3:6c:70:4f:ab","172.20.0.2","172.20.0.3","TCP","4433 → 36052 [ACK] Seq=1 Ack=1704 Win=64128 Len=0 TSval=2877306133 TSecr=2182735203"
"9","0.045077952","2053","c6:96:25:ab:d1:61","06:b3:6c:70:4f:ab","172.20.0.2","172.20.0.3","TLSv1.3","Server Hello, Change Cipher Spec, Application Data, Application Data, Application Data, Application Data"
"10","0.045113895","66","06:b3:6c:70:4f:ab","c6:96:25:ab:d1:61","172.20.0.3","172.20.0.2","TCP","36052 → 4433 [ACK] Seq=1704 Ack=1988 Win=64128 Len=0 TSval=2182735211 TSecr=2877306141"
"11","0.050383122","146","06:b3:6c:70:4f:ab","c6:96:25:ab:d1:61","172.20.0.3","172.20.0.2","TLSv1.3","Change Cipher Spec, Application Data"
"12","0.050444614","66","06:b3:6c:70:4f:ab","c6:96:25:ab:d1:61","172.20.0.3","172.20.0.2","TCP","36052 → 4433 [RST, ACK] Seq=1784 Ack=1988 Win=64128 Len=0 TSval=2182735217 TSecr=2877306141"
"13","0.065473444","74","06:b3:6c:70:4f:ab","c6:96:25:ab:d1:61","172.20.0.3","172.20.0.2","TCP","36064 → 4433 [SYN] Seq=0 Win=64240 Len=0 MSS=1460 SACK_PERM TSval=2182735232 TSecr=0 WS=128"
"14","0.065502809","74","c6:96:25:ab:d1:61","06:b3:6c:70:4f:ab","172.20.0.2","172.20.0.3","TCP","4433 → 36064 [SYN, ACK] Seq=0 Ack=1 Win=65160 Len=0 MSS=1460 SACK_PERM TSval=2877306162 TSecr=2182735232 WS=128"
"15","0.065522653","66","06:b3:6c:70:4f:ab","c6:96:25:ab:d1:61","172.20.0.3","172.20.0.2","TCP","36064 → 4433 [ACK] Seq=1 Ack=1 Win=64256 Len=0 TSval=2182735232 TSecr=2877306162"
"16","0.065563611","1769","06:b3:6c:70:4f:ab","c6:96:25:ab:d1:61","172.20.0.3","172.20.0.2","TLSv1.2","Client Hello"
"17","0.065570464","66","c6:96:25:ab:d1:61","06:b3:6c:70:4f:ab","172.20.0.2","172.20.0.3","TCP","4433 → 36064 [ACK] Seq=1 Ack=1704 Win=64128 Len=0 TSval=2877306162 TSecr=2182735232"
"18","0.071513894","2051","c6:96:25:ab:d1:61","06:b3:6c:70:4f:ab","172.20.0.2","172.20.0.3","TLSv1.3","Server Hello, Change Cipher Spec, Application Data, Application Data, Application Data, Application Data"
"19","0.071544110","66","06:b3:6c:70:4f:ab","c6:96:25:ab:d1:61","172.20.0.3","172.20.0.2","TCP","36064 → 4433 [ACK] Seq=1704 Ack=1986 Win=64128 Len=0 TSval=2182735238 TSecr=2877306168"
"20","0.076809075","146","06:b3:6c:70:4f:ab","c6:96:25:ab:d1:61","172.20.0.3","172.20.0.2","TLSv1.3","Change Cipher Spec, Application Data"
"21","0.076886157","66","06:b3:6c:70:4f:ab","c6:96:25:ab:d1:61","172.20.0.3","172.20.0.2","TCP","36064 → 4433 [RST, ACK] Seq=1784 Ack=1986 Win=64128 Len=0 TSval=2182735243 TSecr=2877306168"
"22","0.092965940","74","06:b3:6c:70:4f:ab","c6:96:25:ab:d1:61","172.20.0.3","172.20.0.2","TCP","36076 → 4433 [SYN] Seq=0 Win=64240 Len=0 MSS=1460 SACK_PERM TSval=2182735259 TSecr=0 WS=128"
"23","0.092995416","74","c6:96:25:ab:d1:61","06:b3:6c:70:4f:ab","172.20.0.2","172.20.0.3","TCP","4433 → 36076 [SYN, ACK] Seq=0 Ack=1 Win=65160 Len=0 MSS=1460 SACK_PERM TSval=2877306189 TSecr=2182735259 WS=128"
"24","0.093014712","66","06:b3:6c:70:4f:ab","c6:96:25:ab:d1:61","172.20.0.3","172.20.0.2","TCP","36076 → 4433 [ACK] Seq=1 Ack=1 Win=64256 Len=0 TSval=2182735259 TSecr=2877306189"
"25","0.093066214","1769","06:b3:6c:70:4f:ab","c6:96:25:ab:d1:61","172.20.0.3","172.20.0.2","TLSv1.2","Client Hello"
"26","0.093073714","66","c6:96:25:ab:d1:61","06:b3:6c:70:4f:ab","172.20.0.2","172.20.0.3","TCP","4433 → 36076 [ACK] Seq=1 Ack=1704 Win=64128 Len=0 TSval=2877306189 TSecr=2182735259"
"27","0.099267961","2052","c6:96:25:ab:d1:61","06:b3:6c:70:4f:ab","172.20.0.2","172.20.0.3","TLSv1.3","Server Hello, Change Cipher Spec, Application Data, Application Data, Application Data, Application Data"
"28","0.099323575","66","06:b3:6c:70:4f:ab","c6:96:25:ab:d1:61","172.20.0.3","172.20.0.2","TCP","36076 → 4433 [ACK] Seq=1704 Ack=1987 Win=64128 Len=0 TSval=2182735266 TSecr=2877306195"
"29","0.104886974","146","06:b3:6c:70:4f:ab","c6:96:25:ab:d1:61","172.20.0.3","172.20.0.2","TLSv1.3","Change Cipher Spec, Application Data"
"30","0.104955570","66","06:b3:6c:70:4f:ab","c6:96:25:ab:d1:61","172.20.0.3","172.20.0.2","TCP","36076 → 4433 [RST, ACK] Seq=1784 Ack=1987 Win=64128 Len=0 TSval=2182735271 TSecr=2877306195"
"31","0.126999456","74","06:b3:6c:70:4f:ab","c6:96:25:ab:d1:61","172.20.0.3","172.20.0.2","TCP","36078 → 4433 [SYN] Seq=0 Win=64240 Len=0 MSS=1460 SACK_PERM TSval=2182735293 TSecr=0 WS=128"
"32","0.127040363","74","c6:96:25:ab:d1:61","06:b3:6c:70:4f:ab","172.20.0.2","172.20.0.3","TCP","4433 → 36078 [SYN, ACK] Seq=0 Ack=1 Win=65160 Len=0 MSS=1460 SACK_PERM TSval=2877306223 TSecr=2182735293 WS=128"
"33","0.127073257","66","06:b3:6c:70:4f:ab","c6:96:25:ab:d1:61","172.20.0.3","172.20.0.2","TCP","36078 → 4433 [ACK] Seq=1 Ack=1 Win=64256 Len=0 TSval=2182735293 TSecr=2877306223"
"34","0.127151934","1769","06:b3:6c:70:4f:ab","c6:96:25:ab:d1:61","172.20.0.3","172.20.0.2","TLSv1.2","Client Hello"
"35","0.127162287","66","c6:96:25:ab:d1:61","06:b3:6c:70:4f:ab","172.20.0.2","172.20.0.3","TCP","4433 → 36078 [ACK] Seq=1 Ack=1704 Win=64128 Len=0 TSval=2877306223 TSecr=2182735293"
"36","0.133444912","2053","c6:96:25:ab:d1:61","06:b3:6c:70:4f:ab","172.20.0.2","172.20.0.3","TLSv1.3","Server Hello, Change Cipher Spec, Application Data, Application Data, Application Data, Application Data"
"37","0.133492318","66","06:b3:6c:70:4f:ab","c6:96:25:ab:d1:61","172.20.0.3","172.20.0.2","TCP","36078 → 4433 [ACK] Seq=1704 Ack=1988 Win=64128 Len=0 TSval=2182735300 TSecr=2877306230"
"38","0.138906980","146","06:b3:6c:70:4f:ab","c6:96:25:ab:d1:61","172.20.0.3","172.20.0.2","TLSv1.3","Change Cipher Spec, Application Data"
"39","0.138980253","66","06:b3:6c:70:4f:ab","c6:96:25:ab:d1:61","172.20.0.3","172.20.0.2","TCP","36078 → 4433 [RST, ACK] Seq=1784 Ack=1988 Win=64128 Len=0 TSval=2182735305 TSecr=2877306230"
"40","0.154445927","74","06:b3:6c:70:4f:ab","c6:96:25:ab:d1:61","172.20.0.3","172.20.0.2","TCP","36082 → 4433 [SYN] Seq=0 Win=64240 Len=0 MSS=1460 SACK_PERM TSval=2182735321 TSecr=0 WS=128"
"41","0.154477923","74","c6:96:25:ab:d1:61","06:b3:6c:70:4f:ab","172.20.0.2","172.20.0.3","TCP","4433 → 36082 [SYN, ACK] Seq=0 Ack=1 Win=65160 Len=0 MSS=1460 SACK_PERM TSval=2877306251 TSecr=2182735321 WS=128"
"42","0.154498323","66","06:b3:6c:70:4f:ab","c6:96:25:ab:d1:61","172.20.0.3","172.20.0.2","TCP","36082 → 4433 [ACK] Seq=1 Ack=1 Win=64256 Len=0 TSval=2182735321 TSecr=2877306251"
"43","0.154552408","1769","06:b3:6c:70:4f:ab","c6:96:25:ab:d1:61","172.20.0.3","172.20.0.2","TLSv1.2","Client Hello"
"44","0.154558092","66","c6:96:25:ab:d1:61","06:b3:6c:70:4f:ab","172.20.0.2","172.20.0.3","TCP","4433 → 36082 [ACK] Seq=1 Ack=1704 Win=64128 Len=0 TSval=2877306251 TSecr=2182735321"
"45","0.160624079","2053","c6:96:25:ab:d1:61","06:b3:6c:70:4f:ab","172.20.0.2","172.20.0.3","TLSv1.3","Server Hello, Change Cipher Spec, Application Data, Application Data, Application Data, Application Data"
"46","0.160655509","66","06:b3:6c:70:4f:ab","c6:96:25:ab:d1:61","172.20.0.3","172.20.0.2","TCP","36082 → 4433 [ACK] Seq=1704 Ack=1988 Win=64128 Len=0 TSval=2182735327 TSecr=2877306257"
"47","0.165766892","146","06:b3:6c:70:4f:ab","c6:96:25:ab:d1:61","172.20.0.3","172.20.0.2","TLSv1.3","Change Cipher Spec, Application Data"
"48","0.165821462","66","06:b3:6c:70:4f:ab","c6:96:25:ab:d1:61","172.20.0.3","172.20.0.2","TCP","36082 → 4433 [RST, ACK] Seq=1784 Ack=1988 Win=64128 Len=0 TSval=2182735332 TSecr=2877306257"
"49","0.180526936","74","06:b3:6c:70:4f:ab","c6:96:25:ab:d1:61","172.20.0.3","172.20.0.2","TCP","36098 → 4433 [SYN] Seq=0 Win=64240 Len=0 MSS=1460 SACK_PERM TSval=2182735347 TSecr=0 WS=128"
"50","0.180556789","74","c6:96:25:ab:d1:61","06:b3:6c:70:4f:ab","172.20.0.2","172.20.0.3","TCP","4433 → 36098 [SYN, ACK] Seq=0 Ack=1 Win=65160 Len=0 MSS=1460 SACK_PERM TSval=2877306277 TSecr=2182735347 WS=128"
"51","0.180578279","66","06:b3:6c:70:4f:ab","c6:96:25:ab:d1:61","172.20.0.3","172.20.0.2","TCP","36098 → 4433 [ACK] Seq=1 Ack=1 Win=64256 Len=0 TSval=2182735347 TSecr=2877306277"
"52","0.180616783","1769","06:b3:6c:70:4f:ab","c6:96:25:ab:d1:61","172.20.0.3","172.20.0.2","TLSv1.2","Client Hello"
"53","0.180622993","66","c6:96:25:ab:d1:61","06:b3:6c:70:4f:ab","172.20.0.2","172.20.0.3","TCP","4433 → 36098 [ACK] Seq=1 Ack=1704 Win=64128 Len=0 TSval=2877306277 TSecr=2182735347"
"54","0.186396587","2051","c6:96:25:ab:d1:61","06:b3:6c:70:4f:ab","172.20.0.2","172.20.0.3","TLSv1.3","Server Hello, Change Cipher Spec, Application Data, Application Data, Application Data, Application Data"
"55","0.186430446","66","06:b3:6c:70:4f:ab","c6:96:25:ab:d1:61","172.20.0.3","172.20.0.2","TCP","36098 → 4433 [ACK] Seq=1704 Ack=1986 Win=64128 Len=0 TSval=2182735353 TSecr=2877306283"
"56","0.191691090","146","06:b3:6c:70:4f:ab","c6:96:25:ab:d1:61","172.20.0.3","172.20.0.2","TLSv1.3","Change Cipher Spec, Application Data"
"57","0.191754174","66","06:b3:6c:70:4f:ab","c6:96:25:ab:d1:61","172.20.0.3","172.20.0.2","TCP","36098 → 4433 [RST, ACK] Seq=1784 Ack=1986 Win=64128 Len=0 TSval=2182735358 TSecr=2877306283"
"58","0.206523788","74","06:b3:6c:70:4f:ab","c6:96:25:ab:d1:61","172.20.0.3","172.20.0.2","TCP","36104 → 4433 [SYN] Seq=0 Win=64240 Len=0 MSS=1460 SACK_PERM TSval=2182735373 TSecr=0 WS=128"
"59","0.206549432","74","c6:96:25:ab:d1:61","06:b3:6c:70:4f:ab","172.20.0.2","172.20.0.3","TCP","4433 → 36104 [SYN, ACK] Seq=0 Ack=1 Win=65160 Len=0 MSS=1460 SACK_PERM TSval=2877306303 TSecr=2182735373 WS=128"
"60","0.206568893","66","06:b3:6c:70:4f:ab","c6:96:25:ab:d1:61","172.20.0.3","172.20.0.2","TCP","36104 → 4433 [ACK] Seq=1 Ack=1 Win=64256 Len=0 TSval=2182735373 TSecr=2877306303"
"61","0.206609389","1769","06:b3:6c:70:4f:ab","c6:96:25:ab:d1:61","172.20.0.3","172.20.0.2","TLSv1.2","Client Hello"
"62","0.206615177","66","c6:96:25:ab:d1:61","06:b3:6c:70:4f:ab","172.20.0.2","172.20.0.3","TCP","4433 → 36104 [ACK] Seq=1 Ack=1704 Win=64128 Len=0 TSval=2877306303 TSecr=2182735373"
"63","0.212533643","2053","c6:96:25:ab:d1:61","06:b3:6c:70:4f:ab","172.20.0.2","172.20.0.3","TLSv1.3","Server Hello, Change Cipher Spec, Application Data, Application Data, Application Data, Application Data"
"64","0.212565081","66","06:b3:6c:70:4f:ab","c6:96:25:ab:d1:61","172.20.0.3","172.20.0.2","TCP","36104 → 4433 [ACK] Seq=1704 Ack=1988 Win=64128 Len=0 TSval=2182735379 TSecr=2877306309"
"65","0.217833533","146","06:b3:6c:70:4f:ab","c6:96:25:ab:d1:61","172.20.0.3","172.20.0.2","TLSv1.3","Change Cipher Spec, Application Data"
"66","0.217896154","66","06:b3:6c:70:4f:ab","c6:96:25:ab:d1:61","172.20.0.3","172.20.0.2","TCP","36104 → 4433 [RST, ACK] Seq=1784 Ack=1988 Win=64128 Len=0 TSval=2182735384 TSecr=2877306309"
"67","0.237547697","74","06:b3:6c:70:4f:ab","c6:96:25:ab:d1:61","172.20.0.3","172.20.0.2","TCP","36110 → 4433 [SYN] Seq=0 Win=64240 Len=0 MSS=1460 SACK_PERM TSval=2182735404 TSecr=0 WS=128"
"68","0.237577713","74","c6:96:25:ab:d1:61","06:b3:6c:70:4f:ab","172.20.0.2","172.20.0.3","TCP","4433 → 36110 [SYN, ACK] Seq=0 Ack=1 Win=65160 Len=0 MSS=1460 SACK_PERM TSval=2877306334 TSecr=2182735404 WS=128"
"69","0.237598660","66","06:b3:6c:70:4f:ab","c6:96:25:ab:d1:61","172.20.0.3","172.20.0.2","TCP","36110 → 4433 [ACK] Seq=1 Ack=1 Win=64256 Len=0 TSval=2182735404 TSecr=2877306334"
"70","0.237653488","1769","06:b3:6c:70:4f:ab","c6:96:25:ab:d1:61","172.20.0.3","172.20.0.2","TLSv1.2","Client Hello"
"71","0.237660987","66","c6:96:25:ab:d1:61","06:b3:6c:70:4f:ab","172.20.0.2","172.20.0.3","TCP","4433 → 36110 [ACK] Seq=1 Ack=1704 Win=64128 Len=0 TSval=2877306334 TSecr=2182735404"
"72","0.248317936","2053","c6:96:25:ab:d1:61","06:b3:6c:70:4f:ab","172.20.0.2","172.20.0.3","TLSv1.3","Server Hello, Change Cipher Spec, Application Data, Application Data, Application Data, Application Data"
"73","0.248373837","66","06:b3:6c:70:4f:ab","c6:96:25:ab:d1:61","172.20.0.3","172.20.0.2","TCP","36110 → 4433 [ACK] Seq=1704 Ack=1988 Win=64128 Len=0 TSval=2182735415 TSecr=2877306344"
"74","0.253919550","146","06:b3:6c:70:4f:ab","c6:96:25:ab:d1:61","172.20.0.3","172.20.0.2","TLSv1.3","Change Cipher Spec, Application Data"
"75","0.254003405","66","06:b3:6c:70:4f:ab","c6:96:25:ab:d1:61","172.20.0.3","172.20.0.2","TCP","36110 → 4433 [RST, ACK] Seq=1784 Ack=1988 Win=64128 Len=0 TSval=2182735420 TSecr=2877306344"
"76","0.269794795","74","06:b3:6c:70:4f:ab","c6:96:25:ab:d1:61","172.20.0.3","172.20.0.2","TCP","36112 → 4433 [SYN] Seq=0 Win=64240 Len=0 MSS=1460 SACK_PERM TSval=2182735436 TSecr=0 WS=128"
"77","0.269823248","74","c6:96:25:ab:d1:61","06:b3:6c:70:4f:ab","172.20.0.2","172.20.0.3","TCP","4433 → 36112 [SYN, ACK] Seq=0 Ack=1 Win=65160 Len=0 MSS=1460 SACK_PERM TSval=2877306366 TSecr=2182735436 WS=128"
"78","0.269842427","66","06:b3:6c:70:4f:ab","c6:96:25:ab:d1:61","172.20.0.3","172.20.0.2","TCP","36112 → 4433 [ACK] Seq=1 Ack=1 Win=64256 Len=0 TSval=2182735436 TSecr=2877306366"
"79","0.269886943","1769","06:b3:6c:70:4f:ab","c6:96:25:ab:d1:61","172.20.0.3","172.20.0.2","TLSv1.2","Client Hello"
"80","0.269892008","66","c6:96:25:ab:d1:61","06:b3:6c:70:4f:ab","172.20.0.2","172.20.0.3","TCP","4433 → 36112 [ACK] Seq=1 Ack=1704 Win=64128 Len=0 TSval=2877306366 TSecr=2182735436"
"81","0.280314048","2052","c6:96:25:ab:d1:61","06:b3:6c:70:4f:ab","172.20.0.2","172.20.0.3","TLSv1.3","Server Hello, Change Cipher Spec, Application Data, Application Data, Application Data, Application Data"
"82","0.280376650","66","06:b3:6c:70:4f:ab","c6:96:25:ab:d1:61","172.20.0.3","172.20.0.2","TCP","36112 → 4433 [ACK] Seq=1704 Ack=1987 Win=64128 Len=0 TSval=2182735447 TSecr=2877306376"
"83","0.285910328","146","06:b3:6c:70:4f:ab","c6:96:25:ab:d1:61","172.20.0.3","172.20.0.2","TLSv1.3","Change Cipher Spec, Application Data"
"84","0.285984734","66","06:b3:6c:70:4f:ab","c6:96:25:ab:d1:61","172.20.0.3","172.20.0.2","TCP","36112 → 4433 [RST, ACK] Seq=1784 Ack=1987 Win=64128 Len=0 TSval=2182735452 TSecr=2877306376"
"85","0.304727160","74","06:b3:6c:70:4f:ab","c6:96:25:ab:d1:61","172.20.0.3","172.20.0.2","TCP","36118 → 4433 [SYN] Seq=0 Win=64240 Len=0 MSS=1460 SACK_PERM TSval=2182735471 TSecr=0 WS=128"
"86","0.304758270","74","c6:96:25:ab:d1:61","06:b3:6c:70:4f:ab","172.20.0.2","172.20.0.3","TCP","4433 → 36118 [SYN, ACK] Seq=0 Ack=1 Win=65160 Len=0 MSS=1460 SACK_PERM TSval=2877306401 TSecr=2182735471 WS=128"
"87","0.304834317","66","06:b3:6c:70:4f:ab","c6:96:25:ab:d1:61","172.20.0.3","172.20.0.2","TCP","36118 → 4433 [ACK] Seq=1 Ack=1 Win=64256 Len=0 TSval=2182735471 TSecr=2877306401"
"88","0.305063504","1769","06:b3:6c:70:4f:ab","c6:96:25:ab:d1:61","172.20.0.3","172.20.0.2","TLSv1.2","Client Hello"
"89","0.305123982","66","c6:96:25:ab:d1:61","06:b3:6c:70:4f:ab","172.20.0.2","172.20.0.3","TCP","4433 → 36118 [ACK] Seq=1 Ack=1704 Win=64128 Len=0 TSval=2877306401 TSecr=2182735471"
"90","0.315579108","2052","c6:96:25:ab:d1:61","06:b3:6c:70:4f:ab","172.20.0.2","172.20.0.3","TLSv1.3","Server Hello, Change Cipher Spec, Application Data, Application Data, Application Data, Application Data"
"91","0.315637771","66","06:b3:6c:70:4f:ab","c6:96:25:ab:d1:61","172.20.0.3","172.20.0.2","TCP","36118 → 4433 [ACK] Seq=1704 Ack=1987 Win=64128 Len=0 TSval=2182735482 TSecr=2877306412"
"92","0.321204746","146","06:b3:6c:70:4f:ab","c6:96:25:ab:d1:61","172.20.0.3","172.20.0.2","TLSv1.3","Change Cipher Spec, Application Data"
"93","0.321306830","66","06:b3:6c:70:4f:ab","c6:96:25:ab:d1:61","172.20.0.3","172.20.0.2","TCP","36118 → 4433 [RST, ACK] Seq=1784 Ack=1987 Win=64128 Len=0 TSval=2182735487 TSecr=2877306412"
"94","0.336720207","74","06:b3:6c:70:4f:ab","c6:96:25:ab:d1:61","172.20.0.3","172.20.0.2","TCP","36124 → 4433 [SYN] Seq=0 Win=64240 Len=0 MSS=1460 SACK_PERM TSval=2182735503 TSecr=0 WS=128"
"95","0.336751724","74","c6:96:25:ab:d1:61","06:b3:6c:70:4f:ab","172.20.0.2","172.20.0.3","TCP","4433 → 36124 [SYN, ACK] Seq=0 Ack=1 Win=65160 Len=0 MSS=1460 SACK_PERM TSval=2877306433 TSecr=2182735503 WS=128"
"96","0.336772076","66","06:b3:6c:70:4f:ab","c6:96:25:ab:d1:61","172.20.0.3","172.20.0.2","TCP","36124 → 4433 [ACK] Seq=1 Ack=1 Win=64256 Len=0 TSval=2182735503 TSecr=2877306433"
"97","0.336819174","1769","06:b3:6c:70:4f:ab","c6:96:25:ab:d1:61","172.20.0.3","172.20.0.2","TLSv1.2","Client Hello"
"98","0.340310812","321","06:b3:6c:70:4f:ab","c6:96:25:ab:d1:61","172.20.0.3","172.20.0.2","TCP","[TCP Retransmission] 36124 → 4433 [PSH, ACK] Seq=1449 Ack=1 Win=64256 Len=255 TSval=2182735507 TSecr=2877306433"
"99","0.340316820","78","c6:96:25:ab:d1:61","06:b3:6c:70:4f:ab","172.20.0.2","172.20.0.3","TCP","4433 → 36124 [ACK] Seq=1 Ack=1704 Win=64128 Len=0 TSval=2877306437 TSecr=2182735507 SLE=1449 SRE=1704"
"100","0.342896814","2052","c6:96:25:ab:d1:61","06:b3:6c:70:4f:ab","172.20.0.2","172.20.0.3","TLSv1.3","Server Hello, Change Cipher Spec, Application Data, Application Data, Application Data, Application Data"
"101","0.342924440","66","06:b3:6c:70:4f:ab","c6:96:25:ab:d1:61","172.20.0.3","172.20.0.2","TCP","36124 → 4433 [ACK] Seq=1704 Ack=1987 Win=64128 Len=0 TSval=2182735509 TSecr=2877306439"
"102","0.348127910","146","06:b3:6c:70:4f:ab","c6:96:25:ab:d1:61","172.20.0.3","172.20.0.2","TLSv1.3","Change Cipher Spec, Application Data"
"103","0.348183381","66","06:b3:6c:70:4f:ab","c6:96:25:ab:d1:61","172.20.0.3","172.20.0.2","TCP","36124 → 4433 [RST, ACK] Seq=1784 Ack=1987 Win=64128 Len=0 TSval=2182735514 TSecr=2877306439"
"104","0.362957557","74","06:b3:6c:70:4f:ab","c6:96:25:ab:d1:61","172.20.0.3","172.20.0.2","TCP","36134 → 4433 [SYN] Seq=0 Win=64240 Len=0 MSS=1460 SACK_PERM TSval=2182735529 TSecr=0 WS=128"
"105","0.362982435","74","c6:96:25:ab:d1:61","06:b3:6c:70:4f:ab","172.20.0.2","172.20.0.3","TCP","4433 → 36134 [SYN, ACK] Seq=0 Ack=1 Win=65160 Len=0 MSS=1460 SACK_PERM TSval=2877306459 TSecr=2182735529 WS=128"
"106","0.362999536","66","06:b3:6c:70:4f:ab","c6:96:25:ab:d1:61","172.20.0.3","172.20.0.2","TCP","36134 → 4433 [ACK] Seq=1 Ack=1 Win=64256 Len=0 TSval=2182735529 TSecr=2877306459"
"107","0.363041788","1769","06:b3:6c:70:4f:ab","c6:96:25:ab:d1:61","172.20.0.3","172.20.0.2","TLSv1.2","Client Hello"
"108","0.363049116","66","c6:96:25:ab:d1:61","06:b3:6c:70:4f:ab","172.20.0.2","172.20.0.3","TCP","4433 → 36134 [ACK] Seq=1 Ack=1704 Win=64128 Len=0 TSval=2877306459 TSecr=2182735529"
"109","0.372310936","603","c6:96:25:ab:d1:61","06:b3:6c:70:4f:ab","172.20.0.2","172.20.0.3","SSL","[TCP Previous segment not captured] , Continuation Data"
"110","0.372342290","78","06:b3:6c:70:4f:ab","c6:96:25:ab:d1:61","172.20.0.3","172.20.0.2","TCP","[TCP Dup ACK 106#1] 36134 → 4433 [ACK] Seq=1704 Ack=1 Win=64256 Len=0 TSval=2182735539 TSecr=2877306459 SLE=1449 SRE=1986"
"111","0.372353552","1514","c6:96:25:ab:d1:61","06:b3:6c:70:4f:ab","172.20.0.2","172.20.0.3","TCP","[TCP Retransmission] 4433 → 36134 [ACK] Seq=1 Ack=1704 Win=64128 Len=1448 TSval=2877306469 TSecr=2182735539"
"112","0.372367040","66","06:b3:6c:70:4f:ab","c6:96:25:ab:d1:61","172.20.0.3","172.20.0.2","TCP","36134 → 4433 [ACK] Seq=1704 Ack=1986 Win=64128 Len=0 TSval=2182735539 TSecr=2877306469"
"113","0.377570733","146","06:b3:6c:70:4f:ab","c6:96:25:ab:d1:61","172.20.0.3","172.20.0.2","TLSv1.2","Change Cipher Spec, Application Data"
"114","0.377628163","66","06:b3:6c:70:4f:ab","c6:96:25:ab:d1:61","172.20.0.3","172.20.0.2","TCP","36134 → 4433 [RST, ACK] Seq=1784 Ack=1986 Win=64128 Len=0 TSval=2182735544 TSecr=2877306469"
"115","0.392402629","74","06:b3:6c:70:4f:ab","c6:96:25:ab:d1:61","172.20.0.3","172.20.0.2","TCP","36142 → 4433 [SYN] Seq=0 Win=64240 Len=0 MSS=1460 SACK_PERM TSval=2182735559 TSecr=0 WS=128"
"116","1.000738968","42","06:b3:6c:70:4f:ab","ff:ff:ff:ff:ff:ff",,,"ARP","ARP Announcement for 172.20.0.3"
"117","1.438350135","74","c6:96:25:ab:d1:61","06:b3:6c:70:4f:ab","172.20.0.2","172.20.0.3","TCP","4433 → 36142 [SYN, ACK] Seq=0 Ack=1 Win=65160 Len=0 MSS=1460 SACK_PERM TSval=2877307535 TSecr=2182735559 WS=128"
"118","1.438367380","74","06:b3:6c:70:4f:ab","c6:96:25:ab:d1:61","172.20.0.3","172.20.0.2","TCP","[TCP Retransmission] 36142 → 4433 [SYN] Seq=0 Win=64240 Len=0 MSS=1460 SACK_PERM TSval=2182736605 TSecr=0 WS=128"
"119","1.438383464","74","c6:96:25:ab:d1:61","06:b3:6c:70:4f:ab","172.20.0.2","172.20.0.3","TCP","[TCP Out-Of-Order] 4433 → 36142 [SYN, ACK] Seq=0 Ack=1 Win=65160 Len=0 MSS=1460 SACK_PERM TSval=2877307535 TSecr=2182735559 WS=128"
"120","1.438417909","66","06:b3:6c:70:4f:ab","c6:96:25:ab:d1:61","172.20.0.3","172.20.0.2","TCP","36142 → 4433 [ACK] Seq=1 Ack=1 Win=64256 Len=0 TSval=2182736605 TSecr=2877307535"
"121","1.438440679","66","06:b3:6c:70:4f:ab","c6:96:25:ab:d1:61","172.20.0.3","172.20.0.2","TCP","[TCP Dup ACK 120#1] 36142 → 4433 [ACK] Seq=1 Ack=1 Win=64256 Len=0 TSval=2182736605 TSecr=2877307535"
"122","1.438488042","1769","06:b3:6c:70:4f:ab","c6:96:25:ab:d1:61","172.20.0.3","172.20.0.2","TLSv1.2","Client Hello"
"123","1.438494469","66","c6:96:25:ab:d1:61","06:b3:6c:70:4f:ab","172.20.0.2","172.20.0.3","TCP","4433 → 36142 [ACK] Seq=1 Ack=1704 Win=64128 Len=0 TSval=2877307535 TSecr=2182736605"
"124","1.444544984","1514","c6:96:25:ab:d1:61","06:b3:6c:70:4f:ab","172.20.0.2","172.20.0.3","TLSv1.3","Server Hello, Change Cipher Spec, Application Data"
"125","1.444582066","66","06:b3:6c:70:4f:ab","c6:96:25:ab:d1:61","172.20.0.3","172.20.0.2","TCP","36142 → 4433 [ACK] Seq=1704 Ack=1449 Win=64128 Len=0 TSval=2182736611 TSecr=2877307541"
"126","1.444591039","604","c6:96:25:ab:d1:61","06:b3:6c:70:4f:ab","172.20.0.2","172.20.0.3","TLSv1.3","Application Data, Application Data, Application Data"
"127","1.444596612","66","06:b3:6c:70:4f:ab","c6:96:25:ab:d1:61","172.20.0.3","172.20.0.2","TCP","36142 → 4433 [ACK] Seq=1704 Ack=1987 Win=64128 Len=0 TSval=2182736611 TSecr=2877307541"
"128","1.449996182","146","06:b3:6c:70:4f:ab","c6:96:25:ab:d1:61","172.20.0.3","172.20.0.2","TLSv1.3","Change Cipher Spec, Application Data"
"129","1.450059440","66","06:b3:6c:70:4f:ab","c6:96:25:ab:d1:61","172.20.0.3","172.20.0.2","TCP","36142 → 4433 [RST, ACK] Seq=1784 Ack=1987 Win=64128 Len=0 TSval=2182736616 TSecr=2877307541"
"130","1.465455429","74","06:b3:6c:70:4f:ab","c6:96:25:ab:d1:61","172.20.0.3","172.20.0.2","TCP","41142 → 4433 [SYN] Seq=0 Win=64240 Len=0 MSS=1460 SACK_PERM TSval=2182736632 TSecr=0 WS=128"
"131","1.465481538","74","c6:96:25:ab:d1:61","06:b3:6c:70:4f:ab","172.20.0.2","172.20.0.3","TCP","4433 → 41142 [SYN, ACK] Seq=0 Ack=1 Win=65160 Len=0 MSS=1460 SACK_PERM TSval=2877307562 TSecr=2182736632 WS=128"
"132","1.465500023","66","06:b3:6c:70:4f:ab","c6:96:25:ab:d1:61","172.20.0.3","172.20.0.2","TCP","41142 → 4433 [ACK] Seq=1 Ack=1 Win=64256 Len=0 TSval=2182736632 TSecr=2877307562"
"133","1.465542753","1769","06:b3:6c:70:4f:ab","c6:96:25:ab:d1:61","172.20.0.3","172.20.0.2","TLSv1.2","Client Hello"
"134","1.465548989","66","c6:96:25:ab:d1:61","06:b3:6c:70:4f:ab","172.20.0.2","172.20.0.3","TCP","4433 → 41142 [ACK] Seq=1 Ack=1704 Win=64128 Len=0 TSval=2877307562 TSecr=2182736632"
"135","1.471324721","2052","c6:96:25:ab:d1:61","06:b3:6c:70:4f:ab","172.20.0.2","172.20.0.3","TLSv1.3","Server Hello, Change Cipher Spec, Application Data, Application Data, Application Data, Application Data"
"136","1.471354773","66","06:b3:6c:70:4f:ab","c6:96:25:ab:d1:61","172.20.0.3","172.20.0.2","TCP","41142 → 4433 [ACK] Seq=1704 Ack=1987 Win=64128 Len=0 TSval=2182736638 TSecr=2877307568"
"137","1.476421089","146","06:b3:6c:70:4f:ab","c6:96:25:ab:d1:61","172.20.0.3","172.20.0.2","TLSv1.3","Change Cipher Spec, Application Data"
"138","1.476522389","66","06:b3:6c:70:4f:ab","c6:96:25:ab:d1:61","172.20.0.3","172.20.0.2","TCP","41142 → 4433 [RST, ACK] Seq=1784 Ack=1987 Win=64128 Len=0 TSval=2182736643 TSecr=2877307568"
"139","1.491784487","74","06:b3:6c:70:4f:ab","c6:96:25:ab:d1:61","172.20.0.3","172.20.0.2","TCP","41152 → 4433 [SYN] Seq=0 Win=64240 Len=0 MSS=1460 SACK_PERM TSval=2182736658 TSecr=0 WS=128"
"140","1.491813733","74","c6:96:25:ab:d1:61","06:b3:6c:70:4f:ab","172.20.0.2","172.20.0.3","TCP","4433 → 41152 [SYN, ACK] Seq=0 Ack=1 Win=65160 Len=0 MSS=1460 SACK_PERM TSval=2877307588 TSecr=2182736658 WS=128"
"141","1.491833392","66","06:b3:6c:70:4f:ab","c6:96:25:ab:d1:61","172.20.0.3","172.20.0.2","TCP","41152 → 4433 [ACK] Seq=1 Ack=1 Win=64256 Len=0 TSval=2182736658 TSecr=2877307588"
"142","1.491884153","1769","06:b3:6c:70:4f:ab","c6:96:25:ab:d1:61","172.20.0.3","172.20.0.2","TLSv1.2","Client Hello"
"143","1.491891933","66","c6:96:25:ab:d1:61","06:b3:6c:70:4f:ab","172.20.0.2","172.20.0.3","TCP","4433 → 41152 [ACK] Seq=1 Ack=1704 Win=64128 Len=0 TSval=2877307588 TSecr=2182736658"
"144","1.497864578","2053","c6:96:25:ab:d1:61","06:b3:6c:70:4f:ab","172.20.0.2","172.20.0.3","TLSv1.3","Server Hello, Change Cipher Spec, Application Data, Application Data, Application Data, Application Data"
"145","1.497901635","66","06:b3:6c:70:4f:ab","c6:96:25:ab:d1:61","172.20.0.3","172.20.0.2","TCP","41152 → 4433 [ACK] Seq=1704 Ack=1988 Win=64128 Len=0 TSval=2182736664 TSecr=2877307594"
"146","1.503108611","146","06:b3:6c:70:4f:ab","c6:96:25:ab:d1:61","172.20.0.3","172.20.0.2","TLSv1.3","Change Cipher Spec, Application Data"
"147","1.503169135","66","06:b3:6c:70:4f:ab","c6:96:25:ab:d1:61","172.20.0.3","172.20.0.2","TCP","41152 → 4433 [RST, ACK] Seq=1784 Ack=1988 Win=64128 Len=0 TSval=2182736669 TSecr=2877307594"
"148","1.518396781","74","06:b3:6c:70:4f:ab","c6:96:25:ab:d1:61","172.20.0.3","172.20.0.2","TCP","41160 → 4433 [SYN] Seq=0 Win=64240 Len=0 MSS=1460 SACK_PERM TSval=2182736685 TSecr=0 WS=128"
"149","1.518424658","74","c6:96:25:ab:d1:61","06:b3:6c:70:4f:ab","172.20.0.2","172.20.0.3","TCP","4433 → 41160 [SYN, ACK] Seq=0 Ack=1 Win=65160 Len=0 MSS=1460 SACK_PERM TSval=2877307615 TSecr=2182736685 WS=128"
"150","1.518444483","66","06:b3:6c:70:4f:ab","c6:96:25:ab:d1:61","172.20.0.3","172.20.0.2","TCP","41160 → 4433 [ACK] Seq=1 Ack=1 Win=64256 Len=0 TSval=2182736685 TSecr=2877307615"
"151","1.518486927","1769","06:b3:6c:70:4f:ab","c6:96:25:ab:d1:61","172.20.0.3","172.20.0.2","TLSv1.2","Client Hello"
"152","1.518492252","66","c6:96:25:ab:d1:61","06:b3:6c:70:4f:ab","172.20.0.2","172.20.0.3","TCP","4433 → 41160 [ACK] Seq=1 Ack=1704 Win=64128 Len=0 TSval=2877307615 TSecr=2182736685"
"153","1.524442665","2052","c6:96:25:ab:d1:61","06:b3:6c:70:4f:ab","172.20.0.2","172.20.0.3","TLSv1.3","Server Hello, Change Cipher Spec, Application Data, Application Data, Application Data, Application Data"
"154","1.524473111","66","06:b3:6c:70:4f:ab","c6:96:25:ab:d1:61","172.20.0.3","172.20.0.2","TCP","41160 → 4433 [ACK] Seq=1704 Ack=1987 Win=64128 Len=0 TSval=2182736691 TSecr=2877307621"
"155","1.529598227","146","06:b3:6c:70:4f:ab","c6:96:25:ab:d1:61","172.20.0.3","172.20.0.2","TLSv1.3","Change Cipher Spec, Application Data"
"156","1.529654023","66","06:b3:6c:70:4f:ab","c6:96:25:ab:d1:61","172.20.0.3","172.20.0.2","TCP","41160 → 4433 [RST, ACK] Seq=1784 Ack=1987 Win=64128 Len=0 TSval=2182736696 TSecr=2877307621"
"157","1.544802932","74","06:b3:6c:70:4f:ab","c6:96:25:ab:d1:61","172.20.0.3","172.20.0.2","TCP","41168 → 4433 [SYN] Seq=0 Win=64240 Len=0 MSS=1460 SACK_PERM TSval=2182736711 TSecr=0 WS=128"
"158","1.544832145","74","c6:96:25:ab:d1:61","06:b3:6c:70:4f:ab","172.20.0.2","172.20.0.3","TCP","4433 → 41168 [SYN, ACK] Seq=0 Ack=1 Win=65160 Len=0 MSS=1460 SACK_PERM TSval=2877307641 TSecr=2182736711 WS=128"
"159","1.544850914","66","06:b3:6c:70:4f:ab","c6:96:25:ab:d1:61","172.20.0.3","172.20.0.2","TCP","41168 → 4433 [ACK] Seq=1 Ack=1 Win=64256 Len=0 TSval=2182736711 TSecr=2877307641"
"160","1.544900070","1769","06:b3:6c:70:4f:ab","c6:96:25:ab:d1:61","172.20.0.3","172.20.0.2","TLSv1.2","Client Hello"
"161","1.544906525","66","c6:96:25:ab:d1:61","06:b3:6c:70:4f:ab","172.20.0.2","172.20.0.3","TCP","4433 → 41168 [ACK] Seq=1 Ack=1704 Win=64128 Len=0 TSval=2877307641 TSecr=2182736711"
"162","1.550918704","2053","c6:96:25:ab:d1:61","06:b3:6c:70:4f:ab","172.20.0.2","172.20.0.3","TLSv1.3","Server Hello, Change Cipher Spec, Application Data, Application Data, Application Data, Application Data"
"163","1.550953990","66","06:b3:6c:70:4f:ab","c6:96:25:ab:d1:61","172.20.0.3","172.20.0.2","TCP","41168 → 4433 [ACK] Seq=1704 Ack=1988 Win=64128 Len=0 TSval=2182736717 TSecr=2877307647"
"164","1.556216957","146","06:b3:6c:70:4f:ab","c6:96:25:ab:d1:61","172.20.0.3","172.20.0.2","TLSv1.3","Change Cipher Spec, Application Data"
"165","1.556288450","66","06:b3:6c:70:4f:ab","c6:96:25:ab:d1:61","172.20.0.3","172.20.0.2","TCP","41168 → 4433 [RST, ACK] Seq=1784 Ack=1988 Win=64128 Len=0 TSval=2182736722 TSecr=2877307647"
"166","1.571234528","74","06:b3:6c:70:4f:ab","c6:96:25:ab:d1:61","172.20.0.3","172.20.0.2","TCP","41178 → 4433 [SYN] Seq=0 Win=64240 Len=0 MSS=1460 SACK_PERM TSval=2182736737 TSecr=0 WS=128"
"167","1.571261597","74","c6:96:25:ab:d1:61","06:b3:6c:70:4f:ab","172.20.0.2","172.20.0.3","TCP","4433 → 41178 [SYN, ACK] Seq=0 Ack=1 Win=65160 Len=0 MSS=1460 SACK_PERM TSval=2877307667 TSecr=2182736737 WS=128"
"168","1.571278634","66","06:b3:6c:70:4f:ab","c6:96:25:ab:d1:61","172.20.0.3","172.20.0.2","TCP","41178 → 4433 [ACK] Seq=1 Ack=1 Win=64256 Len=0 TSval=2182736737 TSecr=2877307667"
"169","1.571335587","1769","06:b3:6c:70:4f:ab","c6:96:25:ab:d1:61","172.20.0.3","172.20.0.2","TLSv1.2","Client Hello"
"170","1.571340164","66","c6:96:25:ab:d1:61","06:b3:6c:70:4f:ab","172.20.0.2","172.20.0.3","TCP","4433 → 41178 [ACK] Seq=1 Ack=1704 Win=64128 Len=0 TSval=2877307668 TSecr=2182736738"
"171","1.577319781","2052","c6:96:25:ab:d1:61","06:b3:6c:70:4f:ab","172.20.0.2","172.20.0.3","TLSv1.3","Server Hello, Change Cipher Spec, Application Data, Application Data, Application Data, Application Data"
"172","1.577349667","66","06:b3:6c:70:4f:ab","c6:96:25:ab:d1:61","172.20.0.3","172.20.0.2","TCP","41178 → 4433 [ACK] Seq=1704 Ack=1987 Win=64128 Len=0 TSval=2182736744 TSecr=2877307674"
"173","1.582484804","146","06:b3:6c:70:4f:ab","c6:96:25:ab:d1:61","172.20.0.3","172.20.0.2","TLSv1.3","Change Cipher Spec, Application Data"
"174","1.582538521","66","06:b3:6c:70:4f:ab","c6:96:25:ab:d1:61","172.20.0.3","172.20.0.2","TCP","41178 → 4433 [RST, ACK] Seq=1784 Ack=1987 Win=64128 Len=0 TSval=2182736749 TSecr=2877307674"
"175","1.596595394","74","06:b3:6c:70:4f:ab","c6:96:25:ab:d1:61","172.20.0.3","172.20.0.2","TCP","41180 → 4433 [SYN] Seq=0 Win=64240 Len=0 MSS=1460 SACK_PERM TSval=2182736763 TSecr=0 WS=128"
"176","1.596616324","74","c6:96:25:ab:d1:61","06:b3:6c:70:4f:ab","172.20.0.2","172.20.0.3","TCP","4433 → 41180 [SYN, ACK] Seq=0 Ack=1 Win=65160 Len=0 MSS=1460 SACK_PERM TSval=2877307693 TSecr=2182736763 WS=128"
"177","1.596631930","66","06:b3:6c:70:4f:ab","c6:96:25:ab:d1:61","172.20.0.3","172.20.0.2","TCP","41180 → 4433 [ACK] Seq=1 Ack=1 Win=64256 Len=0 TSval=2182736763 TSecr=2877307693"
"178","1.596668170","1769","06:b3:6c:70:4f:ab","c6:96:25:ab:d1:61","172.20.0.3","172.20.0.2","TLSv1.2","Client Hello"
"179","1.596673732","66","c6:96:25:ab:d1:61","06:b3:6c:70:4f:ab","172.20.0.2","172.20.0.3","TCP","4433 → 41180 [ACK] Seq=1 Ack=1704 Win=64128 Len=0 TSval=2877307693 TSecr=2182736763"
"180","1.602435909","2052","c6:96:25:ab:d1:61","06:b3:6c:70:4f:ab","172.20.0.2","172.20.0.3","TLSv1.3","Server Hello, Change Cipher Spec, Application Data, Application Data, Application Data, Application Data"
"181","1.602465500","66","06:b3:6c:70:4f:ab","c6:96:25:ab:d1:61","172.20.0.3","172.20.0.2","TCP","41180 → 4433 [ACK] Seq=1704 Ack=1987 Win=64128 Len=0 TSval=2182736769 TSecr=2877307699"
"182","1.607477812","146","06:b3:6c:70:4f:ab","c6:96:25:ab:d1:61","172.20.0.3","172.20.0.2","TLSv1.3","Change Cipher Spec, Application Data"
"183","1.607530036","66","06:b3:6c:70:4f:ab","c6:96:25:ab:d1:61","172.20.0.3","172.20.0.2","TCP","41180 → 4433 [RST, ACK] Seq=1784 Ack=1987 Win=64128 Len=0 TSval=2182736774 TSecr=2877307699"
"184","1.622392717","74","06:b3:6c:70:4f:ab","c6:96:25:ab:d1:61","172.20.0.3","172.20.0.2","TCP","41182 → 4433 [SYN] Seq=0 Win=64240 Len=0 MSS=1460 SACK_PERM TSval=2182736789 TSecr=0 WS=128"
"185","1.622418942","74","c6:96:25:ab:d1:61","06:b3:6c:70:4f:ab","172.20.0.2","172.20.0.3","TCP","4433 → 41182 [SYN, ACK] Seq=0 Ack=1 Win=65160 Len=0 MSS=1460 SACK_PERM TSval=2877307719 TSecr=2182736789 WS=128"
"186","1.622437832","66","06:b3:6c:70:4f:ab","c6:96:25:ab:d1:61","172.20.0.3","172.20.0.2","TCP","41182 → 4433 [ACK] Seq=1 Ack=1 Win=64256 Len=0 TSval=2182736789 TSecr=2877307719"
"187","1.622481028","1769","06:b3:6c:70:4f:ab","c6:96:25:ab:d1:61","172.20.0.3","172.20.0.2","TLSv1.2","Client Hello"
"188","1.622500884","66","c6:96:25:ab:d1:61","06:b3:6c:70:4f:ab","172.20.0.2","172.20.0.3","TCP","4433 → 41182 [ACK] Seq=1 Ack=1704 Win=64128 Len=0 TSval=2877307719 TSecr=2182736789"
"189","1.628420085","2052","c6:96:25:ab:d1:61","06:b3:6c:70:4f:ab","172.20.0.2","172.20.0.3","TLSv1.3","Server Hello, Change Cipher Spec, Application Data, Application Data, Application Data, Application Data"
"190","1.628452965","66","06:b3:6c:70:4f:ab","c6:96:25:ab:d1:61","172.20.0.3","172.20.0.2","TCP","41182 → 4433 [ACK] Seq=1704 Ack=1987 Win=64128 Len=0 TSval=2182736795 TSecr=2877307725"
"191","1.633847793","146","06:b3:6c:70:4f:ab","c6:96:25:ab:d1:61","172.20.0.3","172.20.0.2","TLSv1.3","Change Cipher Spec, Application Data"
"192","1.633915942","66","06:b3:6c:70:4f:ab","c6:96:25:ab:d1:61","172.20.0.3","172.20.0.2","TCP","41182 → 4433 [RST, ACK] Seq=1784 Ack=1987 Win=64128 Len=0 TSval=2182736800 TSecr=2877307725"
"193","1.648433220","74","06:b3:6c:70:4f:ab","c6:96:25:ab:d1:61","172.20.0.3","172.20.0.2","TCP","41196 → 4433 [SYN] Seq=0 Win=64240 Len=0 MSS=1460 SACK_PERM TSval=2182736815 TSecr=0 WS=128"
"194","1.648457977","74","c6:96:25:ab:d1:61","06:b3:6c:70:4f:ab","172.20.0.2","172.20.0.3","TCP","4433 → 41196 [SYN, ACK] Seq=0 Ack=1 Win=65160 Len=0 MSS=1460 SACK_PERM TSval=2877307745 TSecr=2182736815 WS=128"
"195","1.648474746","66","06:b3:6c:70:4f:ab","c6:96:25:ab:d1:61","172.20.0.3","172.20.0.2","TCP","41196 → 4433 [ACK] Seq=1 Ack=1 Win=64256 Len=0 TSval=2182736815 TSecr=2877307745"
"196","1.648520398","1769","06:b3:6c:70:4f:ab","c6:96:25:ab:d1:61","172.20.0.3","172.20.0.2","TLSv1.2","Client Hello"
"197","1.648525169","66","c6:96:25:ab:d1:61","06:b3:6c:70:4f:ab","172.20.0.2","172.20.0.3","TCP","4433 → 41196 [ACK] Seq=1 Ack=1704 Win=64128 Len=0 TSval=2877307745 TSecr=2182736815"
"198","1.654376771","2052","c6:96:25:ab:d1:61","06:b3:6c:70:4f:ab","172.20.0.2","172.20.0.3","TLSv1.3","Server Hello, Change Cipher Spec, Application Data, Application Data, Application Data, Application Data"
"199","1.654404566","66","06:b3:6c:70:4f:ab","c6:96:25:ab:d1:61","172.20.0.3","172.20.0.2","TCP","41196 → 4433 [ACK] Seq=1704 Ack=1987 Win=64128 Len=0 TSval=2182736821 TSecr=2877307751"
"200","1.659471150","146","06:b3:6c:70:4f:ab","c6:96:25:ab:d1:61","172.20.0.3","172.20.0.2","TLSv1.3","Change Cipher Spec, Application Data"
"201","1.659539018","66","06:b3:6c:70:4f:ab","c6:96:25:ab:d1:61","172.20.0.3","172.20.0.2","TCP","41196 → 4433 [RST, ACK] Seq=1784 Ack=1987 Win=64128 Len=0 TSval=2182736826 TSecr=2877307751"
"202","1.673411878","74","06:b3:6c:70:4f:ab","c6:96:25:ab:d1:61","172.20.0.3","172.20.0.2","TCP","41208 → 4433 [SYN] Seq=0 Win=64240 Len=0 MSS=1460 SACK_PERM TSval=2182736840 TSecr=0 WS=128"
"203","1.673432295","74","c6:96:25:ab:d1:61","06:b3:6c:70:4f:ab","172.20.0.2","172.20.0.3","TCP","4433 → 41208 [SYN, ACK] Seq=0 Ack=1 Win=65160 Len=0 MSS=1460 SACK_PERM TSval=2877307770 TSecr=2182736840 WS=128"
"204","1.673447297","66","06:b3:6c:70:4f:ab","c6:96:25:ab:d1:61","172.20.0.3","172.20.0.2","TCP","41208 → 4433 [ACK] Seq=1 Ack=1 Win=64256 Len=0 TSval=2182736840 TSecr=2877307770"
"205","1.673485091","1769","06:b3:6c:70:4f:ab","c6:96:25:ab:d1:61","172.20.0.3","172.20.0.2","TLSv1.2","Client Hello"
"206","1.677306710","321","06:b3:6c:70:4f:ab","c6:96:25:ab:d1:61","172.20.0.3","172.20.0.2","TCP","[TCP Retransmission] 41208 → 4433 [PSH, ACK] Seq=1449 Ack=1 Win=64256 Len=255 TSval=2182736844 TSecr=2877307770"
"207","1.677311044","78","c6:96:25:ab:d1:61","06:b3:6c:70:4f:ab","172.20.0.2","172.20.0.3","TCP","4433 → 41208 [ACK] Seq=1 Ack=1704 Win=64128 Len=0 TSval=2877307774 TSecr=2182736844 SLE=1449 SRE=1704"
"208","1.679189208","2052","c6:96:25:ab:d1:61","06:b3:6c:70:4f:ab","172.20.0.2","172.20.0.3","TLSv1.3","Server Hello, Change Cipher Spec, Application Data, Application Data, Application Data, Application Data"
"209","1.679216423","66","06:b3:6c:70:4f:ab","c6:96:25:ab:d1:61","172.20.0.3","172.20.0.2","TCP","41208 → 4433 [ACK] Seq=1704 Ack=1987 Win=64128 Len=0 TSval=2182736845 TSecr=2877307775"
"210","1.684695514","146","06:b3:6c:70:4f:ab","c6:96:25:ab:d1:61","172.20.0.3","172.20.0.2","TLSv1.3","Change Cipher Spec, Application Data"
"211","1.684745467","66","06:b3:6c:70:4f:ab","c6:96:25:ab:d1:61","172.20.0.3","172.20.0.2","TCP","41208 → 4433 [RST, ACK] Seq=1784 Ack=1987 Win=64128 Len=0 TSval=2182736851 TSecr=2877307775"
"212","1.699975666","74","06:b3:6c:70:4f:ab","c6:96:25:ab:d1:61","172.20.0.3","172.20.0.2","TCP","41218 → 4433 [SYN] Seq=0 Win=64240 Len=0 MSS=1460 SACK_PERM TSval=2182736866 TSecr=0 WS=128"
"213","1.700004567","74","c6:96:25:ab:d1:61","06:b3:6c:70:4f:ab","172.20.0.2","172.20.0.3","TCP","4433 → 41218 [SYN, ACK] Seq=0 Ack=1 Win=65160 Len=0 MSS=1460 SACK_PERM TSval=2877307796 TSecr=2182736866 WS=128"
"214","1.700023086","66","06:b3:6c:70:4f:ab","c6:96:25:ab:d1:61","172.20.0.3","172.20.0.2","TCP","41218 → 4433 [ACK] Seq=1 Ack=1 Win=64256 Len=0 TSval=2182736866 TSecr=2877307796"
"215","1.700074719","1769","06:b3:6c:70:4f:ab","c6:96:25:ab:d1:61","172.20.0.3","172.20.0.2","TLSv1.2","Client Hello"
"216","1.700080297","66","c6:96:25:ab:d1:61","06:b3:6c:70:4f:ab","172.20.0.2","172.20.0.3","TCP","4433 → 41218 [ACK] Seq=1 Ack=1704 Win=64128 Len=0 TSval=2877307796 TSecr=2182736866"
"217","1.706115892","2051","c6:96:25:ab:d1:61","06:b3:6c:70:4f:ab","172.20.0.2","172.20.0.3","TLSv1.3","Server Hello, Change Cipher Spec, Application Data, Application Data, Application Data, Application Data"
"218","1.706158804","66","06:b3:6c:70:4f:ab","c6:96:25:ab:d1:61","172.20.0.3","172.20.0.2","TCP","41218 → 4433 [ACK] Seq=1704 Ack=1986 Win=64128 Len=0 TSval=2182736872 TSecr=2877307802"
"219","1.711709147","146","06:b3:6c:70:4f:ab","c6:96:25:ab:d1:61","172.20.0.3","172.20.0.2","TLSv1.3","Change Cipher Spec, Application Data"
"220","1.711776229","66","06:b3:6c:70:4f:ab","c6:96:25:ab:d1:61","172.20.0.3","172.20.0.2","TCP","41218 → 4433 [RST, ACK] Seq=1784 Ack=1986 Win=64128 Len=0 TSval=2182736878 TSecr=2877307802"
"221","1.727341068","74","06:b3:6c:70:4f:ab","c6:96:25:ab:d1:61","172.20.0.3","172.20.0.2","TCP","41226 → 4433 [SYN] Seq=0 Win=64240 Len=0 MSS=1460 SACK_PERM TSval=2182736894 TSecr=0 WS=128"
"222","1.727368227","74","c6:96:25:ab:d1:61","06:b3:6c:70:4f:ab","172.20.0.2","172.20.0.3","TCP","4433 → 41226 [SYN, ACK] Seq=0 Ack=1 Win=65160 Len=0 MSS=1460 SACK_PERM TSval=2877307824 TSecr=2182736894 WS=128"
"223","1.727387117","66","06:b3:6c:70:4f:ab","c6:96:25:ab:d1:61","172.20.0.3","172.20.0.2","TCP","41226 → 4433 [ACK] Seq=1 Ack=1 Win=64256 Len=0 TSval=2182736894 TSecr=2877307824"
"224","1.727434186","1769","06:b3:6c:70:4f:ab","c6:96:25:ab:d1:61","172.20.0.3","172.20.0.2","TLSv1.2","Client Hello"
