frame.number,frame.time_relative,frame.len,eth.src,eth.dst,ip.src,ip.dst,_ws.col.protocol,_ws.col.info
"1","0.000000000","239","c2:3a:e1:14:61:9e","33:33:00:00:00:fb",,,"MDNS","Standard query 0x0000 PTR _ipps._tcp.local, ""QM"" question PTR _ftp._tcp.local, ""QM"" question PTR _webdav._tcp.local, ""QM"" question PTR _webdavs._tcp.local, ""QM"" question PTR _sftp-ssh._tcp.local, ""QM"" question PTR _smb._tcp.local, ""QM"" question PTR _afpovertcp._tcp.local, ""QM"" question PTR _nfs._tcp.local, ""QM"" question PTR _ipp._tcp.local, ""QM"" question PTR MONTE-VIRTUAL-MACHINE._smb._tcp.local"
"2","0.366128695","70","c2:3a:e1:14:61:9e","33:33:00:00:00:02",,,"ICMPv6","Router Solicitation from c2:3a:e1:14:61:9e"
"3","3.152033059","42","e6:8b:00:6a:55:09","ff:ff:ff:ff:ff:ff",,,"ARP","ARP Announcement for 172.20.0.3"
"4","3.182749901","42","e6:8b:00:6a:55:09","ff:ff:ff:ff:ff:ff",,,"ARP","Who has 172.20.0.2? Tell 172.20.0.3"
"5","3.182780040","42","d6:e4:00:f7:59:3b","e6:8b:00:6a:55:09",,,"ARP","172.20.0.2 is at d6:e4:00:f7:59:3b"
"6","3.182787684","74","e6:8b:00:6a:55:09","d6:e4:00:f7:59:3b","172.20.0.3","172.20.0.2","TCP","56326 → 4433 [SYN] Seq=0 Win=64240 Len=0 MSS=1460 SACK_PERM TSval=2184387869 TSecr=0 WS=128"
"7","3.182809595","74","d6:e4:00:f7:59:3b","e6:8b:00:6a:55:09","172.20.0.2","172.20.0.3","TCP","4433 → 56326 [SYN, ACK] Seq=0 Ack=1 Win=65160 Len=0 MSS=1460 SACK_PERM TSval=2878958799 TSecr=2184387869 WS=128"
"8","3.182827521","66","e6:8b:00:6a:55:09","d6:e4:00:f7:59:3b","172.20.0.3","172.20.0.2","TCP","56326 → 4433 [ACK] Seq=1 Ack=1 Win=64256 Len=0 TSval=2184387869 TSecr=2878958799"
"9","3.182880885","2056","e6:8b:00:6a:55:09","d6:e4:00:f7:59:3b","172.20.0.3","172.20.0.2","TLSv1.2","Client Hello"
"10","3.182888709","66","d6:e4:00:f7:59:3b","e6:8b:00:6a:55:09","172.20.0.2","172.20.0.3","TCP","4433 → 56326 [ACK] Seq=1 Ack=1991 Win=64128 Len=0 TSval=2878958799 TSecr=2184387869"
"11","3.186634651","2545","d6:e4:00:f7:59:3b","e6:8b:00:6a:55:09","172.20.0.2","172.20.0.3","TLSv1.3","Server Hello, Change Cipher Spec, Application Data, Application Data, Application Data, Application Data"
"12","3.186674061","66","e6:8b:00:6a:55:09","d6:e4:00:f7:59:3b","172.20.0.3","172.20.0.2","TCP","56326 → 4433 [ACK] Seq=1991 Ack=2480 Win=64128 Len=0 TSval=2184387873 TSecr=2878958803"
"13","3.191588558","146","e6:8b:00:6a:55:09","d6:e4:00:f7:59:3b","172.20.0.3","172.20.0.2","TLSv1.3","Change Cipher Spec, Application Data"
"14","3.191652902","66","e6:8b:00:6a:55:09","d6:e4:00:f7:59:3b","172.20.0.3","172.20.0.2","TCP","56326 → 4433 [RST, ACK] Seq=2071 Ack=2480 Win=64128 Len=0 TSval=2184387878 TSecr=2878958803"
"15","3.206960783","74","e6:8b:00:6a:55:09","d6:e4:00:f7:59:3b","172.20.0.3","172.20.0.2","TCP","56332 → 4433 [SYN] Seq=0 Win=64240 Len=0 MSS=1460 SACK_PERM TSval=2184387893 TSecr=0 WS=128"
"16","3.206997505","74","d6:e4:00:f7:59:3b","e6:8b:00:6a:55:09","172.20.0.2","172.20.0.3","TCP","4433 → 56332 [SYN, ACK] Seq=0 Ack=1 Win=65160 Len=0 MSS=1460 SACK_PERM TSval=2878958823 TSecr=2184387893 WS=128"
"17","3.207031431","66","e6:8b:00:6a:55:09","d6:e4:00:f7:59:3b","172.20.0.3","172.20.0.2","TCP","56332 → 4433 [ACK] Seq=1 Ack=1 Win=64256 Len=0 TSval=2184387893 TSecr=2878958823"
"18","3.207094601","2056","e6:8b:00:6a:55:09","d6:e4:00:f7:59:3b","172.20.0.3","172.20.0.2","TLSv1.2","Client Hello"
"19","3.207116440","66","d6:e4:00:f7:59:3b","e6:8b:00:6a:55:09","172.20.0.2","172.20.0.3","TCP","4433 → 56332 [ACK] Seq=1 Ack=1991 Win=64128 Len=0 TSval=2878958824 TSecr=2184387893"
"20","3.212575289","2546","d6:e4:00:f7:59:3b","e6:8b:00:6a:55:09","172.20.0.2","172.20.0.3","TLSv1.3","Server Hello, Change Cipher Spec, Application Data, Application Data, Application Data, Application Data"
"21","3.212637899","66","e6:8b:00:6a:55:09","d6:e4:00:f7:59:3b","172.20.0.3","172.20.0.2","TCP","56332 → 4433 [ACK] Seq=1991 Ack=2481 Win=64128 Len=0 TSval=2184387899 TSecr=2878958829"
"22","3.221457976","146","e6:8b:00:6a:55:09","d6:e4:00:f7:59:3b","172.20.0.3","172.20.0.2","TLSv1.3","Change Cipher Spec, Application Data"
"23","3.221558607","66","e6:8b:00:6a:55:09","d6:e4:00:f7:59:3b","172.20.0.3","172.20.0.2","TCP","56332 → 4433 [RST, ACK] Seq=2071 Ack=2481 Win=64128 Len=0 TSval=2184387908 TSecr=2878958829"
"24","3.236390634","74","e6:8b:00:6a:55:09","d6:e4:00:f7:59:3b","172.20.0.3","172.20.0.2","TCP","56338 → 4433 [SYN] Seq=0 Win=64240 Len=0 MSS=1460 SACK_PERM TSval=2184387923 TSecr=0 WS=128"
"25","3.236428750","74","d6:e4:00:f7:59:3b","e6:8b:00:6a:55:09","172.20.0.2","172.20.0.3","TCP","4433 → 56338 [SYN, ACK] Seq=0 Ack=1 Win=65160 Len=0 MSS=1460 SACK_PERM TSval=2878958853 TSecr=2184387923 WS=128"
"26","3.236454584","66","e6:8b:00:6a:55:09","d6:e4:00:f7:59:3b","172.20.0.3","172.20.0.2","TCP","56338 → 4433 [ACK] Seq=1 Ack=1 Win=64256 Len=0 TSval=2184387923 TSecr=2878958853"
"27","3.236516313","2056","e6:8b:00:6a:55:09","d6:e4:00:f7:59:3b","172.20.0.3","172.20.0.2","TLSv1.2","Client Hello"
"28","3.236536674","66","d6:e4:00:f7:59:3b","e6:8b:00:6a:55:09","172.20.0.2","172.20.0.3","TCP","4433 → 56338 [ACK] Seq=1 Ack=1991 Win=64128 Len=0 TSval=2878958853 TSecr=2184387923"
"29","3.239925141","2546","d6:e4:00:f7:59:3b","e6:8b:00:6a:55:09","172.20.0.2","172.20.0.3","TLSv1.3","Server Hello, Change Cipher Spec, Application Data, Application Data, Application Data, Application Data"
"30","3.239963919","66","e6:8b:00:6a:55:09","d6:e4:00:f7:59:3b","172.20.0.3","172.20.0.2","TCP","56338 → 4433 [ACK] Seq=1991 Ack=2481 Win=64128 Len=0 TSval=2184387926 TSecr=2878958856"
"31","3.245872502","146","e6:8b:00:6a:55:09","d6:e4:00:f7:59:3b","172.20.0.3","172.20.0.2","TLSv1.3","Change Cipher Spec, Application Data"
"32","3.245957698","66","e6:8b:00:6a:55:09","d6:e4:00:f7:59:3b","172.20.0.3","172.20.0.2","TCP","56338 → 4433 [RST, ACK] Seq=2071 Ack=2481 Win=64128 Len=0 TSval=2184387932 TSecr=2878958856"
"33","3.258068628","74","e6:8b:00:6a:55:09","d6:e4:00:f7:59:3b","172.20.0.3","172.20.0.2","TCP","56342 → 4433 [SYN] Seq=0 Win=64240 Len=0 MSS=1460 SACK_PERM TSval=2184387944 TSecr=0 WS=128"
"34","3.258127691","74","d6:e4:00:f7:59:3b","e6:8b:00:6a:55:09","172.20.0.2","172.20.0.3","TCP","4433 → 56342 [SYN, ACK] Seq=0 Ack=1 Win=65160 Len=0 MSS=1460 SACK_PERM TSval=2878958875 TSecr=2184387944 WS=128"
"35","3.258149800","66","e6:8b:00:6a:55:09","d6:e4:00:f7:59:3b","172.20.0.3","172.20.0.2","TCP","56342 → 4433 [ACK] Seq=1 Ack=1 Win=64256 Len=0 TSval=2184387945 TSecr=2878958875"
"36","3.258195395","2056","e6:8b:00:6a:55:09","d6:e4:00:f7:59:3b","172.20.0.3","172.20.0.2","TLSv1.2","Client Hello"
"37","3.258200978","66","d6:e4:00:f7:59:3b","e6:8b:00:6a:55:09","172.20.0.2","172.20.0.3","TCP","4433 → 56342 [ACK] Seq=1 Ack=1991 Win=64128 Len=0 TSval=2878958875 TSecr=2184387945"
"38","3.263480597","2546","d6:e4:00:f7:59:3b","e6:8b:00:6a:55:09","172.20.0.2","172.20.0.3","TLSv1.3","Server Hello, Change Cipher Spec, Application Data, Application Data, Application Data, Application Data"
"39","3.263523816","66","e6:8b:00:6a:55:09","d6:e4:00:f7:59:3b","172.20.0.3","172.20.0.2","TCP","56342 → 4433 [ACK] Seq=1991 Ack=2481 Win=64128 Len=0 TSval=2184387950 TSecr=2878958880"
"40","3.268789984","146","e6:8b:00:6a:55:09","d6:e4:00:f7:59:3b","172.20.0.3","172.20.0.2","TLSv1.3","Change Cipher Spec, Application Data"
"41","3.268860855","66","e6:8b:00:6a:55:09","d6:e4:00:f7:59:3b","172.20.0.3","172.20.0.2","TCP","56342 → 4433 [RST, ACK] Seq=2071 Ack=2481 Win=64128 Len=0 TSval=2184387955 TSecr=2878958880"
"42","3.284673945","74","e6:8b:00:6a:55:09","d6:e4:00:f7:59:3b","172.20.0.3","172.20.0.2","TCP","56346 → 4433 [SYN] Seq=0 Win=64240 Len=0 MSS=1460 SACK_PERM TSval=2184387971 TSecr=0 WS=128"
"43","3.284713355","74","d6:e4:00:f7:59:3b","e6:8b:00:6a:55:09","172.20.0.2","172.20.0.3","TCP","4433 → 56346 [SYN, ACK] Seq=0 Ack=1 Win=65160 Len=0 MSS=1460 SACK_PERM TSval=2878958901 TSecr=2184387971 WS=128"
"44","3.284742629","66","e6:8b:00:6a:55:09","d6:e4:00:f7:59:3b","172.20.0.3","172.20.0.2","TCP","56346 → 4433 [ACK] Seq=1 Ack=1 Win=64256 Len=0 TSval=2184387971 TSecr=2878958901"
"45","3.284815165","2056","e6:8b:00:6a:55:09","d6:e4:00:f7:59:3b","172.20.0.3","172.20.0.2","TLSv1.2","Client Hello"
"46","3.284825639","66","d6:e4:00:f7:59:3b","e6:8b:00:6a:55:09","172.20.0.2","172.20.0.3","TCP","4433 → 56346 [ACK] Seq=1 Ack=1991 Win=64128 Len=0 TSval=2878958901 TSecr=2184387971"
"47","3.288236611","2546","d6:e4:00:f7:59:3b","e6:8b:00:6a:55:09","172.20.0.2","172.20.0.3","TLSv1.3","Server Hello, Change Cipher Spec, Application Data, Application Data, Application Data, Application Data"
"48","3.288282466","66","e6:8b:00:6a:55:09","d6:e4:00:f7:59:3b","172.20.0.3","172.20.0.2","TCP","56346 → 4433 [ACK] Seq=1991 Ack=2481 Win=64128 Len=0 TSval=2184387975 TSecr=2878958905"
"49","3.293492801","146","e6:8b:00:6a:55:09","d6:e4:00:f7:59:3b","172.20.0.3","172.20.0.2","TLSv1.3","Change Cipher Spec, Application Data"
"50","3.293578718","66","e6:8b:00:6a:55:09","d6:e4:00:f7:59:3b","172.20.0.3","172.20.0.2","TCP","56346 → 4433 [RST, ACK] Seq=2071 Ack=2481 Win=64128 Len=0 TSval=2184387980 TSecr=2878958905"
"51","3.305741261","74","e6:8b:00:6a:55:09","d6:e4:00:f7:59:3b","172.20.0.3","172.20.0.2","TCP","56362 → 4433 [SYN] Seq=0 Win=64240 Len=0 MSS=1460 SACK_PERM TSval=2184387992 TSecr=0 WS=128"
"52","3.305776442","74","d6:e4:00:f7:59:3b","e6:8b:00:6a:55:09","172.20.0.2","172.20.0.3","TCP","4433 → 56362 [SYN, ACK] Seq=0 Ack=1 Win=65160 Len=0 MSS=1460 SACK_PERM TSval=2878958922 TSecr=2184387992 WS=128"
"53","3.305798042","66","e6:8b:00:6a:55:09","d6:e4:00:f7:59:3b","172.20.0.3","172.20.0.2","TCP","56362 → 4433 [ACK] Seq=1 Ack=1 Win=64256 Len=0 TSval=2184387992 TSecr=2878958922"
"54","3.305854746","2056","e6:8b:00:6a:55:09","d6:e4:00:f7:59:3b","172.20.0.3","172.20.0.2","TLSv1.2","Client Hello"
"55","3.305861040","66","d6:e4:00:f7:59:3b","e6:8b:00:6a:55:09","172.20.0.2","172.20.0.3","TCP","4433 → 56362 [ACK] Seq=1 Ack=1991 Win=64128 Len=0 TSval=2878958922 TSecr=2184387992"
"56","3.309112754","2546","d6:e4:00:f7:59:3b","e6:8b:00:6a:55:09","172.20.0.2","172.20.0.3","TLSv1.3","Server Hello, Change Cipher Spec, Application Data, Application Data, Application Data, Application Data"
"57","3.309145622","66","e6:8b:00:6a:55:09","d6:e4:00:f7:59:3b","172.20.0.3","172.20.0.2","TCP","56362 → 4433 [ACK] Seq=1991 Ack=2481 Win=64128 Len=0 TSval=2184387996 TSecr=2878958925"
"58","3.314112017","146","e6:8b:00:6a:55:09","d6:e4:00:f7:59:3b","172.20.0.3","172.20.0.2","TLSv1.3","Change Cipher Spec, Application Data"
"59","3.314178735","66","e6:8b:00:6a:55:09","d6:e4:00:f7:59:3b","172.20.0.3","172.20.0.2","TCP","56362 → 4433 [RST, ACK] Seq=2071 Ack=2481 Win=64128 Len=0 TSval=2184388001 TSecr=2878958925"
"60","3.325007549","74","e6:8b:00:6a:55:09","d6:e4:00:f7:59:3b","172.20.0.3","172.20.0.2","TCP","56376 → 4433 [SYN] Seq=0 Win=64240 Len=0 MSS=1460 SACK_PERM TSval=2184388011 TSecr=0 WS=128"
"61","3.325034219","74","d6:e4:00:f7:59:3b","e6:8b:00:6a:55:09","172.20.0.2","172.20.0.3","TCP","4433 → 56376 [SYN, ACK] Seq=0 Ack=1 Win=65160 Len=0 MSS=1460 SACK_PERM TSval=2878958941 TSecr=2184388011 WS=128"
"62","3.325052244","66","e6:8b:00:6a:55:09","d6:e4:00:f7:59:3b","172.20.0.3","172.20.0.2","TCP","56376 → 4433 [ACK] Seq=1 Ack=1 Win=64256 Len=0 TSval=2184388011 TSecr=2878958941"
"63","3.325104359","2056","e6:8b:00:6a:55:09","d6:e4:00:f7:59:3b","172.20.0.3","172.20.0.2","TLSv1.2","Client Hello"
"64","3.325111347","66","d6:e4:00:f7:59:3b","e6:8b:00:6a:55:09","172.20.0.2","172.20.0.3","TCP","4433 → 56376 [ACK] Seq=1 Ack=1991 Win=64128 Len=0 TSval=2878958942 TSecr=2184388011"
"65","3.328307470","2546","d6:e4:00:f7:59:3b","e6:8b:00:6a:55:09","172.20.0.2","172.20.0.3","TLSv1.3","Server Hello, Change Cipher Spec, Application Data, Application Data, Application Data, Application Data"
"66","3.328337999","66","e6:8b:00:6a:55:09","d6:e4:00:f7:59:3b","172.20.0.3","172.20.0.2","TCP","56376 → 4433 [ACK] Seq=1991 Ack=2481 Win=64128 Len=0 TSval=2184388015 TSecr=2878958945"
"67","3.333317952","146","e6:8b:00:6a:55:09","d6:e4:00:f7:59:3b","172.20.0.3","172.20.0.2","TLSv1.3","Change Cipher Spec, Application Data"
"68","3.333379924","66","e6:8b:00:6a:55:09","d6:e4:00:f7:59:3b","172.20.0.3","172.20.0.2","TCP","56376 → 4433 [RST, ACK] Seq=2071 Ack=2481 Win=64128 Len=0 TSval=2184388020 TSecr=2878958945"
"69","3.343888809","74","e6:8b:00:6a:55:09","d6:e4:00:f7:59:3b","172.20.0.3","172.20.0.2","TCP","56382 → 4433 [SYN] Seq=0 Win=64240 Len=0 MSS=1460 SACK_PERM TSval=2184388030 TSecr=0 WS=128"
"70","3.343914802","74","d6:e4:00:f7:59:3b","e6:8b:00:6a:55:09","172.20.0.2","172.20.0.3","TCP","4433 → 56382 [SYN, ACK] Seq=0 Ack=1 Win=65160 Len=0 MSS=1460 SACK_PERM TSval=2878958960 TSecr=2184388030 WS=128"
"71","3.343933187","66","e6:8b:00:6a:55:09","d6:e4:00:f7:59:3b","172.20.0.3","172.20.0.2","TCP","56382 → 4433 [ACK] Seq=1 Ack=1 Win=64256 Len=0 TSval=2184388030 TSecr=2878958960"
"72","3.343975893","2056","e6:8b:00:6a:55:09","d6:e4:00:f7:59:3b","172.20.0.3","172.20.0.2","TLSv1.2","Client Hello"
"73","3.343982257","66","d6:e4:00:f7:59:3b","e6:8b:00:6a:55:09","172.20.0.2","172.20.0.3","TCP","4433 → 56382 [ACK] Seq=1 Ack=1991 Win=64128 Len=0 TSval=2878958960 TSecr=2184388030"
"74","3.347043563","2546","d6:e4:00:f7:59:3b","e6:8b:00:6a:55:09","172.20.0.2","172.20.0.3","TLSv1.3","Server Hello, Change Cipher Spec, Application Data, Application Data, Application Data, Application Data"
"75","3.347070811","66","e6:8b:00:6a:55:09","d6:e4:00:f7:59:3b","172.20.0.3","172.20.0.2","TCP","56382 → 4433 [ACK] Seq=1991 Ack=2481 Win=64128 Len=0 TSval=2184388033 TSecr=2878958963"
"76","3.351969939","146","e6:8b:00:6a:55:09","d6:e4:00:f7:59:3b","172.20.0.3","172.20.0.2","TLSv1.3","Change Cipher Spec, Application Data"
"77","3.352040295","66","e6:8b:00:6a:55:09","d6:e4:00:f7:59:3b","172.20.0.3","172.20.0.2","TCP","56382 → 4433 [RST, ACK] Seq=2071 Ack=2481 Win=64128 Len=0 TSval=2184388038 TSecr=2878958963"
"78","3.362942851","74","e6:8b:00:6a:55:09","d6:e4:00:f7:59:3b","172.20.0.3","172.20.0.2","TCP","56386 → 4433 [SYN] Seq=0 Win=64240 Len=0 MSS=1460 SACK_PERM TSval=2184388049 TSecr=0 WS=128"
"79","3.362969115","74","d6:e4:00:f7:59:3b","e6:8b:00:6a:55:09","172.20.0.2","172.20.0.3","TCP","4433 → 56386 [SYN, ACK] Seq=0 Ack=1 Win=65160 Len=0 MSS=1460 SACK_PERM TSval=2878958979 TSecr=2184388049 WS=128"
"80","3.362986280","66","e6:8b:00:6a:55:09","d6:e4:00:f7:59:3b","172.20.0.3","172.20.0.2","TCP","56386 → 4433 [ACK] Seq=1 Ack=1 Win=64256 Len=0 TSval=2184388049 TSecr=2878958979"
"81","3.363035741","2056","e6:8b:00:6a:55:09","d6:e4:00:f7:59:3b","172.20.0.3","172.20.0.2","TLSv1.2","Client Hello"
"82","3.363042387","66","d6:e4:00:f7:59:3b","e6:8b:00:6a:55:09","172.20.0.2","172.20.0.3","TCP","4433 → 56386 [ACK] Seq=1 Ack=1991 Win=64128 Len=0 TSval=2878958979 TSecr=2184388049"
"83","3.366108316","2546","d6:e4:00:f7:59:3b","e6:8b:00:6a:55:09","172.20.0.2","172.20.0.3","TLSv1.3","Server Hello, Change Cipher Spec, Application Data, Application Data, Application Data, Application Data"
"84","3.366134441","66","e6:8b:00:6a:55:09","d6:e4:00:f7:59:3b","172.20.0.3","172.20.0.2","TCP","56386 → 4433 [ACK] Seq=1991 Ack=2481 Win=64128 Len=0 TSval=2184388053 TSecr=2878958982"
"85","3.371016423","146","e6:8b:00:6a:55:09","d6:e4:00:f7:59:3b","172.20.0.3","172.20.0.2","TLSv1.3","Change Cipher Spec, Application Data"
"86","3.371082186","66","e6:8b:00:6a:55:09","d6:e4:00:f7:59:3b","172.20.0.3","172.20.0.2","TCP","56386 → 4433 [RST, ACK] Seq=2071 Ack=2481 Win=64128 Len=0 TSval=2184388057 TSecr=2878958982"
"87","3.381830621","74","e6:8b:00:6a:55:09","d6:e4:00:f7:59:3b","172.20.0.3","172.20.0.2","TCP","56396 → 4433 [SYN] Seq=0 Win=64240 Len=0 MSS=1460 SACK_PERM TSval=2184388068 TSecr=0 WS=128"
"88","3.381858987","74","d6:e4:00:f7:59:3b","e6:8b:00:6a:55:09","172.20.0.2","172.20.0.3","TCP","4433 → 56396 [SYN, ACK] Seq=0 Ack=1 Win=65160 Len=0 MSS=1460 SACK_PERM TSval=2878958998 TSecr=2184388068 WS=128"
"89","3.381877557","66","e6:8b:00:6a:55:09","d6:e4:00:f7:59:3b","172.20.0.3","172.20.0.2","TCP","56396 → 4433 [ACK] Seq=1 Ack=1 Win=64256 Len=0 TSval=2184388068 TSecr=2878958998"
"90","3.381921061","2056","e6:8b:00:6a:55:09","d6:e4:00:f7:59:3b","172.20.0.3","172.20.0.2","TLSv1.2","Client Hello"
"91","3.381927551","66","d6:e4:00:f7:59:3b","e6:8b:00:6a:55:09","172.20.0.2","172.20.0.3","TCP","4433 → 56396 [ACK] Seq=1 Ack=1991 Win=64128 Len=0 TSval=2878958998 TSecr=2184388068"
"92","3.385044494","2546","d6:e4:00:f7:59:3b","e6:8b:00:6a:55:09","172.20.0.2","172.20.0.3","TLSv1.3","Server Hello, Change Cipher Spec, Application Data, Application Data, Application Data, Application Data"
"93","3.385072338","66","e6:8b:00:6a:55:09","d6:e4:00:f7:59:3b","172.20.0.3","172.20.0.2","TCP","56396 → 4433 [ACK] Seq=1991 Ack=2481 Win=64128 Len=0 TSval=2184388071 TSecr=2878959001"
"94","3.389961567","146","e6:8b:00:6a:55:09","d6:e4:00:f7:59:3b","172.20.0.3","172.20.0.2","TLSv1.3","Change Cipher Spec, Application Data"
"95","3.390040424","66","e6:8b:00:6a:55:09","d6:e4:00:f7:59:3b","172.20.0.3","172.20.0.2","TCP","56396 → 4433 [RST, ACK] Seq=2071 Ack=2481 Win=64128 Len=0 TSval=2184388076 TSecr=2878959001"
"96","3.400847664","74","e6:8b:00:6a:55:09","d6:e4:00:f7:59:3b","172.20.0.3","172.20.0.2","TCP","56402 → 4433 [SYN] Seq=0 Win=64240 Len=0 MSS=1460 SACK_PERM TSval=2184388087 TSecr=0 WS=128"
"97","3.400877091","74","d6:e4:00:f7:59:3b","e6:8b:00:6a:55:09","172.20.0.2","172.20.0.3","TCP","4433 → 56402 [SYN, ACK] Seq=0 Ack=1 Win=65160 Len=0 MSS=1460 SACK_PERM TSval=2878959017 TSecr=2184388087 WS=128"
"98","3.400895801","66","e6:8b:00:6a:55:09","d6:e4:00:f7:59:3b","172.20.0.3","172.20.0.2","TCP","56402 → 4433 [ACK] Seq=1 Ack=1 Win=64256 Len=0 TSval=2184388087 TSecr=2878959017"
"99","3.400935993","2056","e6:8b:00:6a:55:09","d6:e4:00:f7:59:3b","172.20.0.3","172.20.0.2","TLSv1.2","Client Hello"
"100","3.400941003","66","d6:e4:00:f7:59:3b","e6:8b:00:6a:55:09","172.20.0.2","172.20.0.3","TCP","4433 → 56402 [ACK] Seq=1 Ack=1991 Win=64128 Len=0 TSval=2878959017 TSecr=2184388087"
"101","3.407114876","1098","d6:e4:00:f7:59:3b","e6:8b:00:6a:55:09","172.20.0.2","172.20.0.3","SSL","[TCP Previous segment not captured] , Continuation Data"
"102","3.407139150","78","e6:8b:00:6a:55:09","d6:e4:00:f7:59:3b","172.20.0.3","172.20.0.2","TCP","[TCP Dup ACK 98#1] 56402 → 4433 [ACK] Seq=1991 Ack=1 Win=64256 Len=0 TSval=2184388094 TSecr=2878959017 SLE=1449 SRE=2481"
"103","3.407149224","1514","d6:e4:00:f7:59:3b","e6:8b:00:6a:55:09","172.20.0.2","172.20.0.3","TCP","[TCP Out-Of-Order] 4433 → 56402 [ACK] Seq=1 Ack=1991 Win=64128 Len=1448 TSval=2878959024 TSecr=2184388094"
"104","3.407160559","66","e6:8b:00:6a:55:09","d6:e4:00:f7:59:3b","172.20.0.3","172.20.0.2","TCP","56402 → 4433 [ACK] Seq=1991 Ack=2481 Win=64128 Len=0 TSval=2184388094 TSecr=2878959024"
"105","3.412163091","146","e6:8b:00:6a:55:09","d6:e4:00:f7:59:3b","172.20.0.3","172.20.0.2","TLSv1.2","Change Cipher Spec, Application Data"
"106","3.412228504","66","e6:8b:00:6a:55:09","d6:e4:00:f7:59:3b","172.20.0.3","172.20.0.2","TCP","56402 → 4433 [RST, ACK] Seq=2071 Ack=2481 Win=64128 Len=0 TSval=2184388099 TSecr=2878959024"
"107","3.422907013","74","e6:8b:00:6a:55:09","d6:e4:00:f7:59:3b","172.20.0.3","172.20.0.2","TCP","56408 → 4433 [SYN] Seq=0 Win=64240 Len=0 MSS=1460 SACK_PERM TSval=2184388109 TSecr=0 WS=128"
"108","3.422935610","74","d6:e4:00:f7:59:3b","e6:8b:00:6a:55:09","172.20.0.2","172.20.0.3","TCP","4433 → 56408 [SYN, ACK] Seq=0 Ack=1 Win=65160 Len=0 MSS=1460 SACK_PERM TSval=2878959039 TSecr=2184388109 WS=128"
"109","3.422954526","66","e6:8b:00:6a:55:09","d6:e4:00:f7:59:3b","172.20.0.3","172.20.0.2","TCP","56408 → 4433 [ACK] Seq=1 Ack=1 Win=64256 Len=0 TSval=2184388109 TSecr=2878959039"
"110","3.422996768","2056","e6:8b:00:6a:55:09","d6:e4:00:f7:59:3b","172.20.0.3","172.20.0.2","TLSv1.2","Client Hello"
"111","3.423009714","66","d6:e4:00:f7:59:3b","e6:8b:00:6a:55:09","172.20.0.2","172.20.0.3","TCP","4433 → 56408 [ACK] Seq=1 Ack=1991 Win=64128 Len=0 TSval=2878959039 TSecr=2184388109"
"112","3.426103814","2546","d6:e4:00:f7:59:3b","e6:8b:00:6a:55:09","172.20.0.2","172.20.0.3","TLSv1.3","Server Hello, Change Cipher Spec, Application Data, Application Data, Application Data, Application Data"
"113","3.426130307","66","e6:8b:00:6a:55:09","d6:e4:00:f7:59:3b","172.20.0.3","172.20.0.2","TCP","56408 → 4433 [ACK] Seq=1991 Ack=2481 Win=64128 Len=0 TSval=2184388113 TSecr=2878959042"
"114","3.430968156","146","e6:8b:00:6a:55:09","d6:e4:00:f7:59:3b","172.20.0.3","172.20.0.2","TLSv1.3","Change Cipher Spec, Application Data"
"115","3.431032264","66","e6:8b:00:6a:55:09","d6:e4:00:f7:59:3b","172.20.0.3","172.20.0.2","TCP","56408 → 4433 [RST, ACK] Seq=2071 Ack=2481 Win=64128 Len=0 TSval=2184388117 TSecr=2878959042"
"116","3.441403008","74","e6:8b:00:6a:55:09","d6:e4:00:f7:59:3b","172.20.0.3","172.20.0.2","TCP","56416 → 4433 [SYN] Seq=0 Win=64240 Len=0 MSS=1460 SACK_PERM TSval=2184388128 TSecr=0 WS=128"
"117","3.441427983","74","d6:e4:00:f7:59:3b","e6:8b:00:6a:55:09","172.20.0.2","172.20.0.3","TCP","4433 → 56416 [SYN, ACK] Seq=0 Ack=1 Win=65160 Len=0 MSS=1460 SACK_PERM TSval=2878959058 TSecr=2184388128 WS=128"
"118","3.441444538","66","e6:8b:00:6a:55:09","d6:e4:00:f7:59:3b","172.20.0.3","172.20.0.2","TCP","56416 → 4433 [ACK] Seq=1 Ack=1 Win=64256 Len=0 TSval=2184388128 TSecr=2878959058"
"119","3.441480949","2056","e6:8b:00:6a:55:09","d6:e4:00:f7:59:3b","172.20.0.3","172.20.0.2","TLSv1.2","Client Hello"
"120","3.441486200","66","d6:e4:00:f7:59:3b","e6:8b:00:6a:55:09","172.20.0.2","172.20.0.3","TCP","4433 → 56416 [ACK] Seq=1 Ack=1991 Win=64128 Len=0 TSval=2878959058 TSecr=2184388128"
"121","3.444552350","2546","d6:e4:00:f7:59:3b","e6:8b:00:6a:55:09","172.20.0.2","172.20.0.3","TLSv1.3","Server Hello, Change Cipher Spec, Application Data, Application Data, Application Data, Application Data"
"122","3.444577534","66","e6:8b:00:6a:55:09","d6:e4:00:f7:59:3b","172.20.0.3","172.20.0.2","TCP","56416 → 4433 [ACK] Seq=1991 Ack=2481 Win=64128 Len=0 TSval=2184388131 TSecr=2878959061"
"123","3.449479641","146","e6:8b:00:6a:55:09","d6:e4:00:f7:59:3b","172.20.0.3","172.20.0.2","TLSv1.3","Change Cipher Spec, Application Data"
"124","3.449538035","66","e6:8b:00:6a:55:09","d6:e4:00:f7:59:3b","172.20.0.3","172.20.0.2","TCP","56416 → 4433 [RST, ACK] Seq=2071 Ack=2481 Win=64128 Len=0 TSval=2184388136 TSecr=2878959061"
"125","3.459795347","74","e6:8b:00:6a:55:09","d6:e4:00:f7:59:3b","172.20.0.3","172.20.0.2","TCP","56418 → 4433 [SYN] Seq=0 Win=64240 Len=0 MSS=1460 SACK_PERM TSval=2184388146 TSecr=0 WS=128"
"126","3.459816646","74","d6:e4:00:f7:59:3b","e6:8b:00:6a:55:09","172.20.0.2","172.20.0.3","TCP","4433 → 56418 [SYN, ACK] Seq=0 Ack=1 Win=65160 Len=0 MSS=1460 SACK_PERM TSval=2878959076 TSecr=2184388146 WS=128"
"127","3.459831594","66","e6:8b:00:6a:55:09","d6:e4:00:f7:59:3b","172.20.0.3","172.20.0.2","TCP","56418 → 4433 [ACK] Seq=1 Ack=1 Win=64256 Len=0 TSval=2184388146 TSecr=2878959076"
"128","3.459869496","2056","e6:8b:00:6a:55:09","d6:e4:00:f7:59:3b","172.20.0.3","172.20.0.2","TLSv1.2","Client Hello"
"129","3.459875041","66","d6:e4:00:f7:59:3b","e6:8b:00:6a:55:09","172.20.0.2","172.20.0.3","TCP","4433 → 56418 [ACK] Seq=1 Ack=1991 Win=64128 Len=0 TSval=2878959076 TSecr=2184388146"
"130","3.466119386","1098","d6:e4:00:f7:59:3b","e6:8b:00:6a:55:09","172.20.0.2","172.20.0.3","SSL","[TCP Previous segment not captured] , Continuation Data"
"131","3.466144921","78","e6:8b:00:6a:55:09","d6:e4:00:f7:59:3b","172.20.0.3","172.20.0.2","TCP","[TCP Dup ACK 127#1] 56418 → 4433 [ACK] Seq=1991 Ack=1 Win=64256 Len=0 TSval=2184388153 TSecr=2878959076 SLE=1449 SRE=2481"
"132","3.466157021","1514","d6:e4:00:f7:59:3b","e6:8b:00:6a:55:09","172.20.0.2","172.20.0.3","TCP","[TCP Retransmission] 4433 → 56418 [ACK] Seq=1 Ack=1991 Win=64128 Len=1448 TSval=2878959083 TSecr=2184388153"
"133","3.466169978","66","e6:8b:00:6a:55:09","d6:e4:00:f7:59:3b","172.20.0.3","172.20.0.2","TCP","56418 → 4433 [ACK] Seq=1991 Ack=2481 Win=64128 Len=0 TSval=2184388153 TSecr=2878959083"
"134","3.471003117","146","e6:8b:00:6a:55:09","d6:e4:00:f7:59:3b","172.20.0.3","172.20.0.2","TLSv1.2","Change Cipher Spec, Application Data"
"135","3.471056191","66","e6:8b:00:6a:55:09","d6:e4:00:f7:59:3b","172.20.0.3","172.20.0.2","TCP","56418 → 4433 [RST, ACK] Seq=2071 Ack=2481 Win=64128 Len=0 TSval=2184388157 TSecr=2878959083"
"136","3.481518278","74","e6:8b:00:6a:55:09","d6:e4:00:f7:59:3b","172.20.0.3","172.20.0.2","TCP","56434 → 4433 [SYN] Seq=0 Win=64240 Len=0 MSS=1460 SACK_PERM TSval=2184388168 TSecr=0 WS=128"
"137","3.481539878","74","d6:e4:00:f7:59:3b","e6:8b:00:6a:55:09","172.20.0.2","172.20.0.3","TCP","4433 → 56434 [SYN, ACK] Seq=0 Ack=1 Win=65160 Len=0 MSS=1460 SACK_PERM TSval=2878959098 TSecr=2184388168 WS=128"
"138","3.481555014","66","e6:8b:00:6a:55:09","d6:e4:00:f7:59:3b","172.20.0.3","172.20.0.2","TCP","56434 → 4433 [ACK] Seq=1 Ack=1 Win=64256 Len=0 TSval=2184388168 TSecr=2878959098"
"139","3.481589112","2056","e6:8b:00:6a:55:09","d6:e4:00:f7:59:3b","172.20.0.3","172.20.0.2","TLSv1.2","Client Hello"
"140","3.481594344","66","d6:e4:00:f7:59:3b","e6:8b:00:6a:55:09","172.20.0.2","172.20.0.3","TCP","4433 → 56434 [ACK] Seq=1 Ack=1991 Win=64128 Len=0 TSval=2878959098 TSecr=2184388168"
"141","3.488111224","1098","d6:e4:00:f7:59:3b","e6:8b:00:6a:55:09","172.20.0.2","172.20.0.3","SSL","[TCP Previous segment not captured] , Continuation Data"
"142","3.488135153","78","e6:8b:00:6a:55:09","d6:e4:00:f7:59:3b","172.20.0.3","172.20.0.2","TCP","[TCP Dup ACK 138#1] 56434 → 4433 [ACK] Seq=1991 Ack=1 Win=64256 Len=0 TSval=2184388175 TSecr=2878959098 SLE=1449 SRE=2481"
"143","3.488142664","1514","d6:e4:00:f7:59:3b","e6:8b:00:6a:55:09","172.20.0.2","172.20.0.3","TCP","[TCP Out-Of-Order] 4433 → 56434 [ACK] Seq=1 Ack=1991 Win=64128 Len=1448 TSval=2878959105 TSecr=2184388175"
"144","3.488154690","66","e6:8b:00:6a:55:09","d6:e4:00:f7:59:3b","172.20.0.3","172.20.0.2","TCP","56434 → 4433 [ACK] Seq=1991 Ack=2481 Win=64128 Len=0 TSval=2184388175 TSecr=2878959105"
"145","3.493551295","146","e6:8b:00:6a:55:09","d6:e4:00:f7:59:3b","172.20.0.3","172.20.0.2","TLSv1.2","Change Cipher Spec, Application Data"
"146","3.493616340","66","e6:8b:00:6a:55:09","d6:e4:00:f7:59:3b","172.20.0.3","172.20.0.2","TCP","56434 → 4433 [RST, ACK] Seq=2071 Ack=2481 Win=64128 Len=0 TSval=2184388180 TSecr=2878959105"
"147","3.505046727","74","e6:8b:00:6a:55:09","d6:e4:00:f7:59:3b","172.20.0.3","172.20.0.2","TCP","56440 → 4433 [SYN] Seq=0 Win=64240 Len=0 MSS=1460 SACK_PERM TSval=2184388191 TSecr=0 WS=128"
"148","3.505073723","74","d6:e4:00:f7:59:3b","e6:8b:00:6a:55:09","172.20.0.2","172.20.0.3","TCP","4433 → 56440 [SYN, ACK] Seq=0 Ack=1 Win=65160 Len=0 MSS=1460 SACK_PERM TSval=2878959121 TSecr=2184388191 WS=128"
"149","3.505095267","66","e6:8b:00:6a:55:09","d6:e4:00:f7:59:3b","172.20.0.3","172.20.0.2","TCP","56440 → 4433 [ACK] Seq=1 Ack=1 Win=64256 Len=0 TSval=2184388191 TSecr=2878959121"
"150","3.505147593","2056","e6:8b:00:6a:55:09","d6:e4:00:f7:59:3b","172.20.0.3","172.20.0.2","TLSv1.2","Client Hello"
"151","3.505153509","66","d6:e4:00:f7:59:3b","e6:8b:00:6a:55:09","172.20.0.2","172.20.0.3","TCP","4433 → 56440 [ACK] Seq=1 Ack=1991 Win=64128 Len=0 TSval=2878959122 TSecr=2184388192"
"152","3.508222192","2545","d6:e4:00:f7:59:3b","e6:8b:00:6a:55:09","172.20.0.2","172.20.0.3","TLSv1.3","Server Hello, Change Cipher Spec, Application Data, Application Data, Application Data, Application Data"
"153","3.508248714","66","e6:8b:00:6a:55:09","d6:e4:00:f7:59:3b","172.20.0.3","172.20.0.2","TCP","56440 → 4433 [ACK] Seq=1991 Ack=2480 Win=64128 Len=0 TSval=2184388195 TSecr=2878959125"
"154","3.513574991","146","e6:8b:00:6a:55:09","d6:e4:00:f7:59:3b","172.20.0.3","172.20.0.2","TLSv1.3","Change Cipher Spec, Application Data"
"155","3.513643595","66","e6:8b:00:6a:55:09","d6:e4:00:f7:59:3b","172.20.0.3","172.20.0.2","TCP","56440 → 4433 [RST, ACK] Seq=2071 Ack=2480 Win=64128 Len=0 TSval=2184388200 TSecr=2878959125"
"156","3.525997501","74","e6:8b:00:6a:55:09","d6:e4:00:f7:59:3b","172.20.0.3","172.20.0.2","TCP","56456 → 4433 [SYN] Seq=0 Win=64240 Len=0 MSS=1460 SACK_PERM TSval=2184388212 TSecr=0 WS=128"
"157","3.526042343","74","d6:e4:00:f7:59:3b","e6:8b:00:6a:55:09","172.20.0.2","172.20.0.3","TCP","4433 → 56456 [SYN, ACK] Seq=0 Ack=1 Win=65160 Len=0 MSS=1460 SACK_PERM TSval=2878959142 TSecr=2184388212 WS=128"
"158","3.526062775","66","e6:8b:00:6a:55:09","d6:e4:00:f7:59:3b","172.20.0.3","172.20.0.2","TCP","56456 → 4433 [ACK] Seq=1 Ack=1 Win=64256 Len=0 TSval=2184388212 TSecr=2878959142"
"159","3.526126402","2056","e6:8b:00:6a:55:09","d6:e4:00:f7:59:3b","172.20.0.3","172.20.0.2","TLSv1.2","Client Hello"
"160","3.526134136","66","d6:e4:00:f7:59:3b","e6:8b:00:6a:55:09","172.20.0.2","172.20.0.3","TCP","4433 → 56456 [ACK] Seq=1 Ack=1991 Win=64128 Len=0 TSval=2878959143 TSecr=2184388213"
"161","3.529611015","2546","d6:e4:00:f7:59:3b","e6:8b:00:6a:55:09","172.20.0.2","172.20.0.3","TLSv1.3","Server Hello, Change Cipher Spec, Application Data, Application Data, Application Data, Application Data"
"162","3.529654100","66","e6:8b:00:6a:55:09","d6:e4:00:f7:59:3b","172.20.0.3","172.20.0.2","TCP","56456 → 4433 [ACK] Seq=1991 Ack=2481 Win=64128 Len=0 TSval=2184388216 TSecr=2878959146"
"163","3.535378282","146","e6:8b:00:6a:55:09","d6:e4:00:f7:59:3b","172.20.0.3","172.20.0.2","TLSv1.3","Change Cipher Spec, Application Data"
"164","3.535452126","66","e6:8b:00:6a:55:09","d6:e4:00:f7:59:3b","172.20.0.3","172.20.0.2","TCP","56456 → 4433 [RST, ACK] Seq=2071 Ack=2481 Win=64128 Len=0 TSval=2184388222 TSecr=2878959146"
"165","3.546712686","74","e6:8b:00:6a:55:09","d6:e4:00:f7:59:3b","172.20.0.3","172.20.0.2","TCP","56460 → 4433 [SYN] Seq=0 Win=64240 Len=0 MSS=1460 SACK_PERM TSval=2184388233 TSecr=0 WS=128"
"166","3.546742038","74","d6:e4:00:f7:59:3b","e6:8b:00:6a:55:09","172.20.0.2","172.20.0.3","TCP","4433 → 56460 [SYN, ACK] Seq=0 Ack=1 Win=65160 Len=0 MSS=1460 SACK_PERM TSval=2878959163 TSecr=2184388233 WS=128"
"167","3.546763583","66","e6:8b:00:6a:55:09","d6:e4:00:f7:59:3b","172.20.0.3","172.20.0.2","TCP","56460 → 4433 [ACK] Seq=1 Ack=1 Win=64256 Len=0 TSval=2184388233 TSecr=2878959163"
"168","3.546821265","2056","e6:8b:00:6a:55:09","d6:e4:00:f7:59:3b","172.20.0.3","172.20.0.2","TLSv1.2","Client Hello"
"169","3.546831181","66","d6:e4:00:f7:59:3b","e6:8b:00:6a:55:09","172.20.0.2","172.20.0.3","TCP","4433 → 56460 [ACK] Seq=1 Ack=1991 Win=64128 Len=0 TSval=2878959163 TSecr=2184388233"
"170","3.550175150","2546","d6:e4:00:f7:59:3b","e6:8b:00:6a:55:09","172.20.0.2","172.20.0.3","TLSv1.3","Server Hello, Change Cipher Spec, Application Data, Application Data, Application Data, Application Data"
"171","3.550207392","66","e6:8b:00:6a:55:09","d6:e4:00:f7:59:3b","172.20.0.3","172.20.0.2","TCP","56460 → 4433 [ACK] Seq=1991 Ack=2481 Win=64128 Len=0 TSval=2184388237 TSecr=2878959167"
"172","3.555216162","146","e6:8b:00:6a:55:09","d6:e4:00:f7:59:3b","172.20.0.3","172.20.0.2","TLSv1.3","Change Cipher Spec, Application Data"
"173","3.555285025","66","e6:8b:00:6a:55:09","d6:e4:00:f7:59:3b","172.20.0.3","172.20.0.2","TCP","56460 → 4433 [RST, ACK] Seq=2071 Ack=2481 Win=64128 Len=0 TSval=2184388242 TSecr=2878959167"
"174","3.567019543","74","e6:8b:00:6a:55:09","d6:e4:00:f7:59:3b","172.20.0.3","172.20.0.2","TCP","56470 → 4433 [SYN] Seq=0 Win=64240 Len=0 MSS=1460 SACK_PERM TSval=2184388253 TSecr=0 WS=128"
"175","3.567047000","74","d6:e4:00:f7:59:3b","e6:8b:00:6a:55:09","172.20.0.2","172.20.0.3","TCP","4433 → 56470 [SYN, ACK] Seq=0 Ack=1 Win=65160 Len=0 MSS=1460 SACK_PERM TSval=2878959183 TSecr=2184388253 WS=128"
"176","3.567064613","66","e6:8b:00:6a:55:09","d6:e4:00:f7:59:3b","172.20.0.3","172.20.0.2","TCP","56470 → 4433 [ACK] Seq=1 Ack=1 Win=64256 Len=0 TSval=2184388253 TSecr=2878959183"
"177","3.567132549","2056","e6:8b:00:6a:55:09","d6:e4:00:f7:59:3b","172.20.0.3","172.20.0.2","TLSv1.2","Client Hello"
"178","3.567139663","66","d6:e4:00:f7:59:3b","e6:8b:00:6a:55:09","172.20.0.2","172.20.0.3","TCP","4433 → 56470 [ACK] Seq=1 Ack=1991 Win=64128 Len=0 TSval=2878959184 TSecr=2184388254"
"179","3.570293112","2546","d6:e4:00:f7:59:3b","e6:8b:00:6a:55:09","172.20.0.2","172.20.0.3","TLSv1.3","Server Hello, Change Cipher Spec, Application Data, Application Data, Application Data, Application Data"
"180","3.570323937","66","e6:8b:00:6a:55:09","d6:e4:00:f7:59:3b","172.20.0.3","172.20.0.2","TCP","56470 → 4433 [ACK] Seq=1991 Ack=2481 Win=64128 Len=0 TSval=2184388257 TSecr=2878959187"
"181","3.575338433","146","e6:8b:00:6a:55:09","d6:e4:00:f7:59:3b","172.20.0.3","172.20.0.2","TLSv1.3","Change Cipher Spec, Application Data"
"182","3.575405574","66","e6:8b:00:6a:55:09","d6:e4:00:f7:59:3b","172.20.0.3","172.20.0.2","TCP","56470 → 4433 [RST, ACK] Seq=2071 Ack=2481 Win=64128 Len=0 TSval=2184388262 TSecr=2878959187"
"183","3.586820513","74","e6:8b:00:6a:55:09","d6:e4:00:f7:59:3b","172.20.0.3","172.20.0.2","TCP","56474 → 4433 [SYN] Seq=0 Win=64240 Len=0 MSS=1460 SACK_PERM TSval=2184388273 TSecr=0 WS=128"
"184","3.586850052","74","d6:e4:00:f7:59:3b","e6:8b:00:6a:55:09","172.20.0.2","172.20.0.3","TCP","4433 → 56474 [SYN, ACK] Seq=0 Ack=1 Win=65160 Len=0 MSS=1460 SACK_PERM TSval=2878959203 TSecr=2184388273 WS=128"
"185","3.586869350","66","e6:8b:00:6a:55:09","d6:e4:00:f7:59:3b","172.20.0.3","172.20.0.2","TCP","56474 → 4433 [ACK] Seq=1 Ack=1 Win=64256 Len=0 TSval=2184388273 TSecr=2878959203"
"186","3.586910894","2056","e6:8b:00:6a:55:09","d6:e4:00:f7:59:3b","172.20.0.3","172.20.0.2","TLSv1.2","Client Hello"
"187","3.586917511","66","d6:e4:00:f7:59:3b","e6:8b:00:6a:55:09","172.20.0.2","172.20.0.3","TCP","4433 → 56474 [ACK] Seq=1 Ack=1991 Win=64128 Len=0 TSval=2878959203 TSecr=2184388273"
"188","3.590061780","2545","d6:e4:00:f7:59:3b","e6:8b:00:6a:55:09","172.20.0.2","172.20.0.3","TLSv1.3","Server Hello, Change Cipher Spec, Application Data, Application Data, Application Data, Application Data"
"189","3.590095377","66","e6:8b:00:6a:55:09","d6:e4:00:f7:59:3b","172.20.0.3","172.20.0.2","TCP","56474 → 4433 [ACK] Seq=1991 Ack=2480 Win=64128 Len=0 TSval=2184388276 TSecr=2878959206"
"190","3.595065244","146","e6:8b:00:6a:55:09","d6:e4:00:f7:59:3b","172.20.0.3","172.20.0.2","TLSv1.3","Change Cipher Spec, Application Data"
"191","3.595144539","66","e6:8b:00:6a:55:09","d6:e4:00:f7:59:3b","172.20.0.3","172.20.0.2","TCP","56474 → 4433 [RST, ACK] Seq=2071 Ack=2480 Win=64128 Len=0 TSval=2184388282 TSecr=2878959206"
"192","3.605864397","74","e6:8b:00:6a:55:09","d6:e4:00:f7:59:3b","172.20.0.3","172.20.0.2","TCP","56478 → 4433 [SYN] Seq=0 Win=64240 Len=0 MSS=1460 SACK_PERM TSval=2184388292 TSecr=0 WS=128"
"193","3.605889620","74","d6:e4:00:f7:59:3b","e6:8b:00:6a:55:09","172.20.0.2","172.20.0.3","TCP","4433 → 56478 [SYN, ACK] Seq=0 Ack=1 Win=65160 Len=0 MSS=1460 SACK_PERM TSval=2878959222 TSecr=2184388292 WS=128"
"194","3.605906316","66","e6:8b:00:6a:55:09","d6:e4:00:f7:59:3b","172.20.0.3","172.20.0.2","TCP","56478 → 4433 [ACK] Seq=1 Ack=1 Win=64256 Len=0 TSval=2184388292 TSecr=2878959222"
"195","3.605945199","2056","e6:8b:00:6a:55:09","d6:e4:00:f7:59:3b","172.20.0.3","172.20.0.2","TLSv1.2","Client Hello"
"196","3.605950644","66","d6:e4:00:f7:59:3b","e6:8b:00:6a:55:09","172.20.0.2","172.20.0.3","TCP","4433 → 56478 [ACK] Seq=1 Ack=1991 Win=64128 Len=0 TSval=2878959222 TSecr=2184388292"
"197","3.609182160","2545","d6:e4:00:f7:59:3b","e6:8b:00:6a:55:09","172.20.0.2","172.20.0.3","TLSv1.3","Server Hello, Change Cipher Spec, Application Data, Application Data, Application Data, Application Data"
"198","3.609208279","66","e6:8b:00:6a:55:09","d6:e4:00:f7:59:3b","172.20.0.3","172.20.0.2","TCP","56478 → 4433 [ACK] Seq=1991 Ack=2480 Win=64128 Len=0 TSval=2184388296 TSecr=2878959226"
"199","3.614075837","146","e6:8b:00:6a:55:09","d6:e4:00:f7:59:3b","172.20.0.3","172.20.0.2","TLSv1.3","Change Cipher Spec, Application Data"
"200","3.614145541","66","e6:8b:00:6a:55:09","d6:e4:00:f7:59:3b","172.20.0.3","172.20.0.2","TCP","56478 → 4433 [RST, ACK] Seq=2071 Ack=2480 Win=64128 Len=0 TSval=2184388301 TSecr=2878959226"
"201","3.624839331","74","e6:8b:00:6a:55:09","d6:e4:00:f7:59:3b","172.20.0.3","172.20.0.2","TCP","56484 → 4433 [SYN] Seq=0 Win=64240 Len=0 MSS=1460 SACK_PERM TSval=2184388311 TSecr=0 WS=128"
"202","3.624862672","74","d6:e4:00:f7:59:3b","e6:8b:00:6a:55:09","172.20.0.2","172.20.0.3","TCP","4433 → 56484 [SYN, ACK] Seq=0 Ack=1 Win=65160 Len=0 MSS=1460 SACK_PERM TSval=2878959241 TSecr=2184388311 WS=128"
"203","3.624880565","66","e6:8b:00:6a:55:09","d6:e4:00:f7:59:3b","172.20.0.3","172.20.0.2","TCP","56484 → 4433 [ACK] Seq=1 Ack=1 Win=64256 Len=0 TSval=2184388311 TSecr=2878959241"
"204","3.624921734","2056","e6:8b:00:6a:55:09","d6:e4:00:f7:59:3b","172.20.0.3","172.20.0.2","TLSv1.2","Client Hello"
"205","3.624927613","66","d6:e4:00:f7:59:3b","e6:8b:00:6a:55:09","172.20.0.2","172.20.0.3","TCP","4433 → 56484 [ACK] Seq=1 Ack=1991 Win=64128 Len=0 TSval=2878959241 TSecr=2184388311"
"206","3.627988975","2546","d6:e4:00:f7:59:3b","e6:8b:00:6a:55:09","172.20.0.2","172.20.0.3","TLSv1.3","Server Hello, Change Cipher Spec, Application Data, Application Data, Application Data, Application Data"
"207","3.628016889","66","e6:8b:00:6a:55:09","d6:e4:00:f7:59:3b","172.20.0.3","172.20.0.2","TCP","56484 → 4433 [ACK] Seq=1991 Ack=2481 Win=64128 Len=0 TSval=2184388314 TSecr=2878959244"
"208","3.632983833","146","e6:8b:00:6a:55:09","d6:e4:00:f7:59:3b","172.20.0.3","172.20.0.2","TLSv1.3","Change Cipher Spec, Application Data"
"209","3.633045359","66","e6:8b:00:6a:55:09","d6:e4:00:f7:59:3b","172.20.0.3","172.20.0.2","TCP","56484 → 4433 [RST, ACK] Seq=2071 Ack=2481 Win=64128 Len=0 TSval=2184388319 TSecr=2878959244"
"210","3.643923912","74","e6:8b:00:6a:55:09","d6:e4:00:f7:59:3b","172.20.0.3","172.20.0.2","TCP","56494 → 4433 [SYN] Seq=0 Win=64240 Len=0 MSS=1460 SACK_PERM TSval=2184388330 TSecr=0 WS=128"
"211","3.643949968","74","d6:e4:00:f7:59:3b","e6:8b:00:6a:55:09","172.20.0.2","172.20.0.3","TCP","4433 → 56494 [SYN, ACK] Seq=0 Ack=1 Win=65160 Len=0 MSS=1460 SACK_PERM TSval=2878959260 TSecr=2184388330 WS=128"
"212","3.643966894","66","e6:8b:00:6a:55:09","d6:e4:00:f7:59:3b","172.20.0.3","172.20.0.2","TCP","56494 → 4433 [ACK] Seq=1 Ack=1 Win=64256 Len=0 TSval=2184388330 TSecr=2878959260"
"213","3.644012630","2056","e6:8b:00:6a:55:09","d6:e4:00:f7:59:3b","172.20.0.3","172.20.0.2","TLSv1.2","Client Hello"
"214","3.644018104","66","d6:e4:00:f7:59:3b","e6:8b:00:6a:55:09","172.20.0.2","172.20.0.3","TCP","4433 → 56494 [ACK] Seq=1 Ack=1991 Win=64128 Len=0 TSval=2878959260 TSecr=2184388330"
"215","3.647852634","2546","d6:e4:00:f7:59:3b","e6:8b:00:6a:55:09","172.20.0.2","172.20.0.3","TLSv1.3","Server Hello, Change Cipher Spec, Application Data, Application Data, Application Data, Application Data"
"216","3.647885880","66","e6:8b:00:6a:55:09","d6:e4:00:f7:59:3b","172.20.0.3","172.20.0.2","TCP","56494 → 4433 [ACK] Seq=1991 Ack=2481 Win=64128 Len=0 TSval=2184388334 TSecr=2878959264"
"217","3.652802078","146","e6:8b:00:6a:55:09","d6:e4:00:f7:59:3b","172.20.0.3","172.20.0.2","TLSv1.3","Change Cipher Spec, Application Data"
"218","3.652861628","66","e6:8b:00:6a:55:09","d6:e4:00:f7:59:3b","172.20.0.3","172.20.0.2","TCP","56494 → 4433 [RST, ACK] Seq=2071 Ack=2481 Win=64128 Len=0 TSval=2184388339 TSecr=2878959264"
"219","3.663325189","74","e6:8b:00:6a:55:09","d6:e4:00:f7:59:3b","172.20.0.3","172.20.0.2","TCP","56506 → 4433 [SYN] Seq=0 Win=64240 Len=0 MSS=1460 SACK_PERM TSval=2184388350 TSecr=0 WS=128"
"220","7.736799534","42","e6:8b:00:6a:55:09","ff:ff:ff:ff:ff:ff",,,"ARP","ARP Announcement for 172.20.0.3"
"221","8.301485513","74","d6:e4:00:f7:59:3b","e6:8b:00:6a:55:09","172.20.0.2","172.20.0.3","TCP","4433 → 56506 [SYN, ACK] Seq=0 Ack=1 Win=65160 Len=0 MSS=1460 SACK_PERM TSval=2878960335 TSecr=2184388350 WS=128"
"222","8.301521699","74","e6:8b:00:6a:55:09","d6:e4:00:f7:59:3b","172.20.0.3","172.20.0.2","TCP","[TCP Retransmission] 56506 → 4433 [SYN] Seq=0 Win=64240 Len=0 MSS=1460 SACK_PERM TSval=2184389405 TSecr=0 WS=128"
