frame.number,frame.time_relative,frame.len,eth.src,eth.dst,ip.src,ip.dst,_ws.col.protocol,_ws.col.info
"1","0.000000000","42","6e:d1:f8:73:f0:b3","ff:ff:ff:ff:ff:ff",,,"ARP","ARP Announcement for 172.20.0.3"
"2","0.032216793","42","6e:d1:f8:73:f0:b3","ff:ff:ff:ff:ff:ff",,,"ARP","Who has 172.20.0.2? Tell 172.20.0.3"
"3","0.032248928","42","da:0a:fd:8e:e0:a3","6e:d1:f8:73:f0:b3",,,"ARP","172.20.0.2 is at da:0a:fd:8e:e0:a3"
"4","0.032257607","74","6e:d1:f8:73:f0:b3","da:0a:fd:8e:e0:a3","172.20.0.3","172.20.0.2","TCP","49384 → 4433 [SYN] Seq=0 Win=64240 Len=0 MSS=1460 SACK_PERM TSval=2182383282 TSecr=0 WS=128"
"5","0.032284491","74","da:0a:fd:8e:e0:a3","6e:d1:f8:73:f0:b3","172.20.0.2","172.20.0.3","TCP","4433 → 49384 [SYN, ACK] Seq=0 Ack=1 Win=65160 Len=0 MSS=1460 SACK_PERM TSval=2876954212 TSecr=2182383282 WS=128"
"6","0.032308247","66","6e:d1:f8:73:f0:b3","da:0a:fd:8e:e0:a3","172.20.0.3","172.20.0.2","TCP","49384 → 4433 [ACK] Seq=1 Ack=1 Win=64256 Len=0 TSval=2182383282 TSecr=2876954212"
"7","0.032375338","1320","6e:d1:f8:73:f0:b3","da:0a:fd:8e:e0:a3","172.20.0.3","172.20.0.2","TLSv1.2","Client Hello"
"8","0.032386111","66","da:0a:fd:8e:e0:a3","6e:d1:f8:73:f0:b3","172.20.0.2","172.20.0.3","TCP","4433 → 49384 [ACK] Seq=1 Ack=1255 Win=64128 Len=0 TSval=2876954212 TSecr=2182383282"
"9","0.033620305","1504","da:0a:fd:8e:e0:a3","6e:d1:f8:73:f0:b3","172.20.0.2","172.20.0.3","TLSv1.3","Server Hello, Change Cipher Spec, Application Data, Application Data, Application Data, Application Data"
"10","0.033665732","66","6e:d1:f8:73:f0:b3","da:0a:fd:8e:e0:a3","172.20.0.3","172.20.0.2","TCP","49384 → 4433 [ACK] Seq=1255 Ack=1439 Win=64128 Len=0 TSval=2182383283 TSecr=2876954213"
"11","0.034774439","146","6e:d1:f8:73:f0:b3","da:0a:fd:8e:e0:a3","172.20.0.3","172.20.0.2","TLSv1.3","Change Cipher Spec, Application Data"
"12","0.034840895","66","6e:d1:f8:73:f0:b3","da:0a:fd:8e:e0:a3","172.20.0.3","172.20.0.2","TCP","49384 → 4433 [RST, ACK] Seq=1335 Ack=1439 Win=64128 Len=0 TSval=2182383285 TSecr=2876954213"
"13","0.045915976","74","6e:d1:f8:73:f0:b3","da:0a:fd:8e:e0:a3","172.20.0.3","172.20.0.2","TCP","49400 → 4433 [SYN] Seq=0 Win=64240 Len=0 MSS=1460 SACK_PERM TSval=2182383296 TSecr=0 WS=128"
"14","0.045944951","74","da:0a:fd:8e:e0:a3","6e:d1:f8:73:f0:b3","172.20.0.2","172.20.0.3","TCP","4433 → 49400 [SYN, ACK] Seq=0 Ack=1 Win=65160 Len=0 MSS=1460 SACK_PERM TSval=2876954226 TSecr=2182383296 WS=128"
"15","0.045963496","66","6e:d1:f8:73:f0:b3","da:0a:fd:8e:e0:a3","172.20.0.3","172.20.0.2","TCP","49400 → 4433 [ACK] Seq=1 Ack=1 Win=64256 Len=0 TSval=2182383296 TSecr=2876954226"
"16","0.046008772","1320","6e:d1:f8:73:f0:b3","da:0a:fd:8e:e0:a3","172.20.0.3","172.20.0.2","TLSv1.2","Client Hello"
"17","0.046015607","66","da:0a:fd:8e:e0:a3","6e:d1:f8:73:f0:b3","172.20.0.2","172.20.0.3","TCP","4433 → 49400 [ACK] Seq=1 Ack=1255 Win=64128 Len=0 TSval=2876954226 TSecr=2182383296"
"18","0.046734001","1504","da:0a:fd:8e:e0:a3","6e:d1:f8:73:f0:b3","172.20.0.2","172.20.0.3","TLSv1.3","Server Hello, Change Cipher Spec, Application Data, Application Data, Application Data, Application Data"
"19","0.046782640","66","6e:d1:f8:73:f0:b3","da:0a:fd:8e:e0:a3","172.20.0.3","172.20.0.2","TCP","49400 → 4433 [ACK] Seq=1255 Ack=1439 Win=64128 Len=0 TSval=2182383297 TSecr=2876954226"
"20","0.047834788","146","6e:d1:f8:73:f0:b3","da:0a:fd:8e:e0:a3","172.20.0.3","172.20.0.2","TLSv1.3","Change Cipher Spec, Application Data"
"21","0.047895364","66","6e:d1:f8:73:f0:b3","da:0a:fd:8e:e0:a3","172.20.0.3","172.20.0.2","TCP","49400 → 4433 [RST, ACK] Seq=1335 Ack=1439 Win=64128 Len=0 TSval=2182383298 TSecr=2876954226"
"22","0.058927047","74","6e:d1:f8:73:f0:b3","da:0a:fd:8e:e0:a3","172.20.0.3","172.20.0.2","TCP","49414 → 4433 [SYN] Seq=0 Win=64240 Len=0 MSS=1460 SACK_PERM TSval=2182383309 TSecr=0 WS=128"
"23","1.001031060","42","6e:d1:f8:73:f0:b3","ff:ff:ff:ff:ff:ff",,,"ARP","ARP Announcement for 172.20.0.3"
"24","1.098793713","74","da:0a:fd:8e:e0:a3","6e:d1:f8:73:f0:b3","172.20.0.2","172.20.0.3","TCP","4433 → 49414 [SYN, ACK] Seq=0 Ack=1 Win=65160 Len=0 MSS=1460 SACK_PERM TSval=2876955279 TSecr=2182383309 WS=128"
"25","1.098813470","74","6e:d1:f8:73:f0:b3","da:0a:fd:8e:e0:a3","172.20.0.3","172.20.0.2","TCP","[TCP Retransmission] 49414 → 4433 [SYN] Seq=0 Win=64240 Len=0 MSS=1460 SACK_PERM TSval=2182384349 TSecr=0 WS=128"
"26","1.098829927","74","da:0a:fd:8e:e0:a3","6e:d1:f8:73:f0:b3","172.20.0.2","172.20.0.3","TCP","[TCP Retransmission] 4433 → 49414 [SYN, ACK] Seq=0 Ack=1 Win=65160 Len=0 MSS=1460 SACK_PERM TSval=2876955279 TSecr=2182383309 WS=128"
"27","1.098876025","66","6e:d1:f8:73:f0:b3","da:0a:fd:8e:e0:a3","172.20.0.3","172.20.0.2","TCP","49414 → 4433 [ACK] Seq=1 Ack=1 Win=64256 Len=0 TSval=2182384349 TSecr=2876955279"
"28","1.098901894","66","6e:d1:f8:73:f0:b3","da:0a:fd:8e:e0:a3","172.20.0.3","172.20.0.2","TCP","[TCP Dup ACK 27#1] 49414 → 4433 [ACK] Seq=1 Ack=1 Win=64256 Len=0 TSval=2182384349 TSecr=2876955279"
"29","1.098957178","1320","6e:d1:f8:73:f0:b3","da:0a:fd:8e:e0:a3","172.20.0.3","172.20.0.2","TLSv1.2","Client Hello"
"30","1.098963329","66","da:0a:fd:8e:e0:a3","6e:d1:f8:73:f0:b3","172.20.0.2","172.20.0.3","TCP","4433 → 49414 [ACK] Seq=1 Ack=1255 Win=64128 Len=0 TSval=2876955279 TSecr=2182384349"
"31","1.099607272","1504","da:0a:fd:8e:e0:a3","6e:d1:f8:73:f0:b3","172.20.0.2","172.20.0.3","TLSv1.3","Server Hello, Change Cipher Spec, Application Data, Application Data, Application Data, Application Data"
"32","1.099643439","66","6e:d1:f8:73:f0:b3","da:0a:fd:8e:e0:a3","172.20.0.3","172.20.0.2","TCP","49414 → 4433 [ACK] Seq=1255 Ack=1439 Win=64128 Len=0 TSval=2182384349 TSecr=2876955279"
"33","1.100923922","146","6e:d1:f8:73:f0:b3","da:0a:fd:8e:e0:a3","172.20.0.3","172.20.0.2","TLSv1.3","Change Cipher Spec, Application Data"
"34","1.100987022","66","6e:d1:f8:73:f0:b3","da:0a:fd:8e:e0:a3","172.20.0.3","172.20.0.2","TCP","49414 → 4433 [RST, ACK] Seq=1335 Ack=1439 Win=64128 Len=0 TSval=2182384351 TSecr=2876955279"
"35","1.112631100","74","6e:d1:f8:73:f0:b3","da:0a:fd:8e:e0:a3","172.20.0.3","172.20.0.2","TCP","49424 → 4433 [SYN] Seq=0 Win=64240 Len=0 MSS=1460 SACK_PERM TSval=2182384362 TSecr=0 WS=128"
"36","1.112669253","74","da:0a:fd:8e:e0:a3","6e:d1:f8:73:f0:b3","172.20.0.2","172.20.0.3","TCP","4433 → 49424 [SYN, ACK] Seq=0 Ack=1 Win=65160 Len=0 MSS=1460 SACK_PERM TSval=2876955292 TSecr=2182384362 WS=128"
"37","1.112690087","66","6e:d1:f8:73:f0:b3","da:0a:fd:8e:e0:a3","172.20.0.3","172.20.0.2","TCP","49424 → 4433 [ACK] Seq=1 Ack=1 Win=64256 Len=0 TSval=2182384362 TSecr=2876955292"
"38","1.112755200","1320","6e:d1:f8:73:f0:b3","da:0a:fd:8e:e0:a3","172.20.0.3","172.20.0.2","TLSv1.2","Client Hello"
"39","1.113362454","1504","da:0a:fd:8e:e0:a3","6e:d1:f8:73:f0:b3","172.20.0.2","172.20.0.3","TLSv1.3","Server Hello, Change Cipher Spec, Application Data, Application Data, Application Data, Application Data"
"40","1.113401845","66","6e:d1:f8:73:f0:b3","da:0a:fd:8e:e0:a3","172.20.0.3","172.20.0.2","TCP","49424 → 4433 [ACK] Seq=1255 Ack=1439 Win=64128 Len=0 TSval=2182384363 TSecr=2876955293"
"41","1.114485334","146","6e:d1:f8:73:f0:b3","da:0a:fd:8e:e0:a3","172.20.0.3","172.20.0.2","TLSv1.3","Change Cipher Spec, Application Data"
"42","1.114549721","66","6e:d1:f8:73:f0:b3","da:0a:fd:8e:e0:a3","172.20.0.3","172.20.0.2","TCP","49424 → 4433 [RST, ACK] Seq=1335 Ack=1439 Win=64128 Len=0 TSval=2182384364 TSecr=2876955293"
"43","1.125597902","74","6e:d1:f8:73:f0:b3","da:0a:fd:8e:e0:a3","172.20.0.3","172.20.0.2","TCP","49430 → 4433 [SYN] Seq=0 Win=64240 Len=0 MSS=1460 SACK_PERM TSval=2182384375 TSecr=0 WS=128"
"44","2.000510542","42","6e:d1:f8:73:f0:b3","ff:ff:ff:ff:ff:ff",,,"ARP","ARP Announcement for 172.20.0.3"
"45","2.187798785","74","da:0a:fd:8e:e0:a3","6e:d1:f8:73:f0:b3","172.20.0.2","172.20.0.3","TCP","4433 → 49430 [SYN, ACK] Seq=0 Ack=1 Win=65160 Len=0 MSS=1460 SACK_PERM TSval=2876956368 TSecr=2182384375 WS=128"
"46","2.187816379","74","6e:d1:f8:73:f0:b3","da:0a:fd:8e:e0:a3","172.20.0.3","172.20.0.2","TCP","[TCP Retransmission] 49430 → 4433 [SYN] Seq=0 Win=64240 Len=0 MSS=1460 SACK_PERM TSval=2182385438 TSecr=0 WS=128"
"47","2.187834109","74","da:0a:fd:8e:e0:a3","6e:d1:f8:73:f0:b3","172.20.0.2","172.20.0.3","TCP","[TCP Retransmission] 4433 → 49430 [SYN, ACK] Seq=0 Ack=1 Win=65160 Len=0 MSS=1460 SACK_PERM TSval=2876956368 TSecr=2182384375 WS=128"
"48","2.187868386","66","6e:d1:f8:73:f0:b3","da:0a:fd:8e:e0:a3","172.20.0.3","172.20.0.2","TCP","49430 → 4433 [ACK] Seq=1 Ack=1 Win=64256 Len=0 TSval=2182385438 TSecr=2876956368"
"49","2.187894945","66","6e:d1:f8:73:f0:b3","da:0a:fd:8e:e0:a3","172.20.0.3","172.20.0.2","TCP","[TCP Dup ACK 48#1] 49430 → 4433 [ACK] Seq=1 Ack=1 Win=64256 Len=0 TSval=2182385438 TSecr=2876956368"
"50","2.187941549","1320","6e:d1:f8:73:f0:b3","da:0a:fd:8e:e0:a3","172.20.0.3","172.20.0.2","TLSv1.2","Client Hello"
"51","2.187949902","66","da:0a:fd:8e:e0:a3","6e:d1:f8:73:f0:b3","172.20.0.2","172.20.0.3","TCP","4433 → 49430 [ACK] Seq=1 Ack=1255 Win=64128 Len=0 TSval=2876956368 TSecr=2182385438"
"52","2.188678764","1504","da:0a:fd:8e:e0:a3","6e:d1:f8:73:f0:b3","172.20.0.2","172.20.0.3","TLSv1.3","Server Hello, Change Cipher Spec, Application Data, Application Data, Application Data, Application Data"
"53","2.188708940","66","6e:d1:f8:73:f0:b3","da:0a:fd:8e:e0:a3","172.20.0.3","172.20.0.2","TCP","49430 → 4433 [ACK] Seq=1255 Ack=1439 Win=64128 Len=0 TSval=2182385438 TSecr=2876956368"
"54","2.190039542","146","6e:d1:f8:73:f0:b3","da:0a:fd:8e:e0:a3","172.20.0.3","172.20.0.2","TLSv1.3","Change Cipher Spec, Application Data"
"55","2.190112370","66","6e:d1:f8:73:f0:b3","da:0a:fd:8e:e0:a3","172.20.0.3","172.20.0.2","TCP","49430 → 4433 [RST, ACK] Seq=1335 Ack=1439 Win=64128 Len=0 TSval=2182385440 TSecr=2876956368"
"56","2.202162168","74","6e:d1:f8:73:f0:b3","da:0a:fd:8e:e0:a3","172.20.0.3","172.20.0.2","TCP","49442 → 4433 [SYN] Seq=0 Win=64240 Len=0 MSS=1460 SACK_PERM TSval=2182385452 TSecr=0 WS=128"
"57","2.202194621","74","da:0a:fd:8e:e0:a3","6e:d1:f8:73:f0:b3","172.20.0.2","172.20.0.3","TCP","4433 → 49442 [SYN, ACK] Seq=0 Ack=1 Win=65160 Len=0 MSS=1460 SACK_PERM TSval=2876956382 TSecr=2182385452 WS=128"
"58","2.202212772","66","6e:d1:f8:73:f0:b3","da:0a:fd:8e:e0:a3","172.20.0.3","172.20.0.2","TCP","49442 → 4433 [ACK] Seq=1 Ack=1 Win=64256 Len=0 TSval=2182385452 TSecr=2876956382"
"59","2.202259028","1320","6e:d1:f8:73:f0:b3","da:0a:fd:8e:e0:a3","172.20.0.3","172.20.0.2","TLSv1.2","Client Hello"
"60","2.202265465","66","da:0a:fd:8e:e0:a3","6e:d1:f8:73:f0:b3","172.20.0.2","172.20.0.3","TCP","4433 → 49442 [ACK] Seq=1 Ack=1255 Win=64128 Len=0 TSval=2876956382 TSecr=2182385452"
"61","2.202980675","1504","da:0a:fd:8e:e0:a3","6e:d1:f8:73:f0:b3","172.20.0.2","172.20.0.3","TLSv1.3","Server Hello, Change Cipher Spec, Application Data, Application Data, Application Data, Application Data"
"62","2.203024917","66","6e:d1:f8:73:f0:b3","da:0a:fd:8e:e0:a3","172.20.0.3","172.20.0.2","TCP","49442 → 4433 [ACK] Seq=1255 Ack=1439 Win=64128 Len=0 TSval=2182385453 TSecr=2876956383"
"63","2.204162236","146","6e:d1:f8:73:f0:b3","da:0a:fd:8e:e0:a3","172.20.0.3","172.20.0.2","TLSv1.3","Change Cipher Spec, Application Data"
"64","2.204222011","66","6e:d1:f8:73:f0:b3","da:0a:fd:8e:e0:a3","172.20.0.3","172.20.0.2","TCP","49442 → 4433 [RST, ACK] Seq=1335 Ack=1439 Win=64128 Len=0 TSval=2182385454 TSecr=2876956383"
"65","2.215365771","74","6e:d1:f8:73:f0:b3","da:0a:fd:8e:e0:a3","172.20.0.3","172.20.0.2","TCP","49458 → 4433 [SYN] Seq=0 Win=64240 Len=0 MSS=1460 SACK_PERM TSval=2182385465 TSecr=0 WS=128"
"66","2.215395055","74","da:0a:fd:8e:e0:a3","6e:d1:f8:73:f0:b3","172.20.0.2","172.20.0.3","TCP","4433 → 49458 [SYN, ACK] Seq=0 Ack=1 Win=65160 Len=0 MSS=1460 SACK_PERM TSval=2876956395 TSecr=2182385465 WS=128"
"67","2.215415211","66","6e:d1:f8:73:f0:b3","da:0a:fd:8e:e0:a3","172.20.0.3","172.20.0.2","TCP","49458 → 4433 [ACK] Seq=1 Ack=1 Win=64256 Len=0 TSval=2182385465 TSecr=2876956395"
"68","2.215458874","1320","6e:d1:f8:73:f0:b3","da:0a:fd:8e:e0:a3","172.20.0.3","172.20.0.2","TLSv1.2","Client Hello"
"69","2.215465206","66","da:0a:fd:8e:e0:a3","6e:d1:f8:73:f0:b3","172.20.0.2","172.20.0.3","TCP","4433 → 49458 [ACK] Seq=1 Ack=1255 Win=64128 Len=0 TSval=2876956395 TSecr=2182385465"
"70","2.216177106","1504","da:0a:fd:8e:e0:a3","6e:d1:f8:73:f0:b3","172.20.0.2","172.20.0.3","TLSv1.3","Server Hello, Change Cipher Spec, Application Data, Application Data, Application Data, Application Data"
"71","2.216215251","66","6e:d1:f8:73:f0:b3","da:0a:fd:8e:e0:a3","172.20.0.3","172.20.0.2","TCP","49458 → 4433 [ACK] Seq=1255 Ack=1439 Win=64128 Len=0 TSval=2182385466 TSecr=2876956396"
"72","2.217537917","146","6e:d1:f8:73:f0:b3","da:0a:fd:8e:e0:a3","172.20.0.3","172.20.0.2","TLSv1.3","Change Cipher Spec, Application Data"
"73","2.217606639","66","6e:d1:f8:73:f0:b3","da:0a:fd:8e:e0:a3","172.20.0.3","172.20.0.2","TCP","49458 → 4433 [RST, ACK] Seq=1335 Ack=1439 Win=64128 Len=0 TSval=2182385467 TSecr=2876956396"
"74","2.228810606","74","6e:d1:f8:73:f0:b3","da:0a:fd:8e:e0:a3","172.20.0.3","172.20.0.2","TCP","49462 → 4433 [SYN] Seq=0 Win=64240 Len=0 MSS=1460 SACK_PERM TSval=2182385479 TSecr=0 WS=128"
"75","2.228842314","74","da:0a:fd:8e:e0:a3","6e:d1:f8:73:f0:b3","172.20.0.2","172.20.0.3","TCP","4433 → 49462 [SYN, ACK] Seq=0 Ack=1 Win=65160 Len=0 MSS=1460 SACK_PERM TSval=2876956409 TSecr=2182385479 WS=128"
"76","2.228860825","66","6e:d1:f8:73:f0:b3","da:0a:fd:8e:e0:a3","172.20.0.3","172.20.0.2","TCP","49462 → 4433 [ACK] Seq=1 Ack=1 Win=64256 Len=0 TSval=2182385479 TSecr=2876956409"
"77","2.228903655","1320","6e:d1:f8:73:f0:b3","da:0a:fd:8e:e0:a3","172.20.0.3","172.20.0.2","TLSv1.2","Client Hello"
"78","2.228910468","66","da:0a:fd:8e:e0:a3","6e:d1:f8:73:f0:b3","172.20.0.2","172.20.0.3","TCP","4433 → 49462 [ACK] Seq=1 Ack=1255 Win=64128 Len=0 TSval=2876956409 TSecr=2182385479"
"79","2.229565660","1504","da:0a:fd:8e:e0:a3","6e:d1:f8:73:f0:b3","172.20.0.2","172.20.0.3","TLSv1.3","Server Hello, Change Cipher Spec, Application Data, Application Data, Application Data, Application Data"
"80","2.229600665","66","6e:d1:f8:73:f0:b3","da:0a:fd:8e:e0:a3","172.20.0.3","172.20.0.2","TCP","49462 → 4433 [ACK] Seq=1255 Ack=1439 Win=64128 Len=0 TSval=2182385479 TSecr=2876956409"
"81","2.230816202","146","6e:d1:f8:73:f0:b3","da:0a:fd:8e:e0:a3","172.20.0.3","172.20.0.2","TLSv1.3","Change Cipher Spec, Application Data"
"82","2.230885994","66","6e:d1:f8:73:f0:b3","da:0a:fd:8e:e0:a3","172.20.0.3","172.20.0.2","TCP","49462 → 4433 [RST, ACK] Seq=1335 Ack=1439 Win=64128 Len=0 TSval=2182385481 TSecr=2876956409"
"83","2.242409058","74","6e:d1:f8:73:f0:b3","da:0a:fd:8e:e0:a3","172.20.0.3","172.20.0.2","TCP","49478 → 4433 [SYN] Seq=0 Win=64240 Len=0 MSS=1460 SACK_PERM TSval=2182385492 TSecr=0 WS=128"
"84","2.242443122","74","da:0a:fd:8e:e0:a3","6e:d1:f8:73:f0:b3","172.20.0.2","172.20.0.3","TCP","4433 → 49478 [SYN, ACK] Seq=0 Ack=1 Win=65160 Len=0 MSS=1460 SACK_PERM TSval=2876956422 TSecr=2182385492 WS=128"
"85","2.242464423","66","6e:d1:f8:73:f0:b3","da:0a:fd:8e:e0:a3","172.20.0.3","172.20.0.2","TCP","49478 → 4433 [ACK] Seq=1 Ack=1 Win=64256 Len=0 TSval=2182385492 TSecr=2876956422"
"86","2.242509417","1320","6e:d1:f8:73:f0:b3","da:0a:fd:8e:e0:a3","172.20.0.3","172.20.0.2","TLSv1.2","Client Hello"
"87","2.242516377","66","da:0a:fd:8e:e0:a3","6e:d1:f8:73:f0:b3","172.20.0.2","172.20.0.3","TCP","4433 → 49478 [ACK] Seq=1 Ack=1255 Win=64128 Len=0 TSval=2876956422 TSecr=2182385492"
"88","2.243147607","1504","da:0a:fd:8e:e0:a3","6e:d1:f8:73:f0:b3","172.20.0.2","172.20.0.3","TLSv1.3","Server Hello, Change Cipher Spec, Application Data, Application Data, Application Data, Application Data"
"89","2.243192787","66","6e:d1:f8:73:f0:b3","da:0a:fd:8e:e0:a3","172.20.0.3","172.20.0.2","TCP","49478 → 4433 [ACK] Seq=1255 Ack=1439 Win=64128 Len=0 TSval=2182385493 TSecr=2876956423"
"90","2.244459908","146","6e:d1:f8:73:f0:b3","da:0a:fd:8e:e0:a3","172.20.0.3","172.20.0.2","TLSv1.3","Change Cipher Spec, Application Data"
"91","2.244541436","66","6e:d1:f8:73:f0:b3","da:0a:fd:8e:e0:a3","172.20.0.3","172.20.0.2","TCP","49478 → 4433 [RST, ACK] Seq=1335 Ack=1439 Win=64128 Len=0 TSval=2182385494 TSecr=2876956423"
"92","2.256368370","74","6e:d1:f8:73:f0:b3","da:0a:fd:8e:e0:a3","172.20.0.3","172.20.0.2","TCP","49484 → 4433 [SYN] Seq=0 Win=64240 Len=0 MSS=1460 SACK_PERM TSval=2182385506 TSecr=0 WS=128"
"93","2.256405141","74","da:0a:fd:8e:e0:a3","6e:d1:f8:73:f0:b3","172.20.0.2","172.20.0.3","TCP","4433 → 49484 [SYN, ACK] Seq=0 Ack=1 Win=65160 Len=0 MSS=1460 SACK_PERM TSval=2876956436 TSecr=2182385506 WS=128"
"94","2.256429745","66","6e:d1:f8:73:f0:b3","da:0a:fd:8e:e0:a3","172.20.0.3","172.20.0.2","TCP","49484 → 4433 [ACK] Seq=1 Ack=1 Win=64256 Len=0 TSval=2182385506 TSecr=2876956436"
"95","2.256475515","1320","6e:d1:f8:73:f0:b3","da:0a:fd:8e:e0:a3","172.20.0.3","172.20.0.2","TLSv1.2","Client Hello"
"96","2.256481433","66","da:0a:fd:8e:e0:a3","6e:d1:f8:73:f0:b3","172.20.0.2","172.20.0.3","TCP","4433 → 49484 [ACK] Seq=1 Ack=1255 Win=64128 Len=0 TSval=2876956436 TSecr=2182385506"
"97","2.257118868","1504","da:0a:fd:8e:e0:a3","6e:d1:f8:73:f0:b3","172.20.0.2","172.20.0.3","TLSv1.3","Server Hello, Change Cipher Spec, Application Data, Application Data, Application Data, Application Data"
"98","2.257159364","66","6e:d1:f8:73:f0:b3","da:0a:fd:8e:e0:a3","172.20.0.3","172.20.0.2","TCP","49484 → 4433 [ACK] Seq=1255 Ack=1439 Win=64128 Len=0 TSval=2182385507 TSecr=2876956437"
"99","2.258378080","146","6e:d1:f8:73:f0:b3","da:0a:fd:8e:e0:a3","172.20.0.3","172.20.0.2","TLSv1.3","Change Cipher Spec, Application Data"
"100","2.258442917","66","6e:d1:f8:73:f0:b3","da:0a:fd:8e:e0:a3","172.20.0.3","172.20.0.2","TCP","49484 → 4433 [RST, ACK] Seq=1335 Ack=1439 Win=64128 Len=0 TSval=2182385508 TSecr=2876956437"
"101","2.269566139","74","6e:d1:f8:73:f0:b3","da:0a:fd:8e:e0:a3","172.20.0.3","172.20.0.2","TCP","49496 → 4433 [SYN] Seq=0 Win=64240 Len=0 MSS=1460 SACK_PERM TSval=2182385519 TSecr=0 WS=128"
"102","2.269597638","74","da:0a:fd:8e:e0:a3","6e:d1:f8:73:f0:b3","172.20.0.2","172.20.0.3","TCP","4433 → 49496 [SYN, ACK] Seq=0 Ack=1 Win=65160 Len=0 MSS=1460 SACK_PERM TSval=2876956449 TSecr=2182385519 WS=128"
"103","2.269619386","66","6e:d1:f8:73:f0:b3","da:0a:fd:8e:e0:a3","172.20.0.3","172.20.0.2","TCP","49496 → 4433 [ACK] Seq=1 Ack=1 Win=64256 Len=0 TSval=2182385519 TSecr=2876956449"
"104","2.269674295","1320","6e:d1:f8:73:f0:b3","da:0a:fd:8e:e0:a3","172.20.0.3","172.20.0.2","TLSv1.2","Client Hello"
"105","2.270308036","1504","da:0a:fd:8e:e0:a3","6e:d1:f8:73:f0:b3","172.20.0.2","172.20.0.3","TLSv1.3","Server Hello, Change Cipher Spec, Application Data, Application Data, Application Data, Application Data"
"106","2.270340758","66","6e:d1:f8:73:f0:b3","da:0a:fd:8e:e0:a3","172.20.0.3","172.20.0.2","TCP","49496 → 4433 [ACK] Seq=1255 Ack=1439 Win=64128 Len=0 TSval=2182385520 TSecr=2876956450"
"107","2.271402275","146","6e:d1:f8:73:f0:b3","da:0a:fd:8e:e0:a3","172.20.0.3","172.20.0.2","TLSv1.3","Change Cipher Spec, Application Data"
"108","2.271469719","66","6e:d1:f8:73:f0:b3","da:0a:fd:8e:e0:a3","172.20.0.3","172.20.0.2","TCP","49496 → 4433 [RST, ACK] Seq=1335 Ack=1439 Win=64128 Len=0 TSval=2182385521 TSecr=2876956450"
"109","2.282857793","74","6e:d1:f8:73:f0:b3","da:0a:fd:8e:e0:a3","172.20.0.3","172.20.0.2","TCP","49500 → 4433 [SYN] Seq=0 Win=64240 Len=0 MSS=1460 SACK_PERM TSval=2182385533 TSecr=0 WS=128"
"110","2.282886039","74","da:0a:fd:8e:e0:a3","6e:d1:f8:73:f0:b3","172.20.0.2","172.20.0.3","TCP","4433 → 49500 [SYN, ACK] Seq=0 Ack=1 Win=65160 Len=0 MSS=1460 SACK_PERM TSval=2876956463 TSecr=2182385533 WS=128"
"111","2.282904581","66","6e:d1:f8:73:f0:b3","da:0a:fd:8e:e0:a3","172.20.0.3","172.20.0.2","TCP","49500 → 4433 [ACK] Seq=1 Ack=1 Win=64256 Len=0 TSval=2182385533 TSecr=2876956463"
"112","2.282941237","1320","6e:d1:f8:73:f0:b3","da:0a:fd:8e:e0:a3","172.20.0.3","172.20.0.2","TLSv1.2","Client Hello"
"113","2.282947359","66","da:0a:fd:8e:e0:a3","6e:d1:f8:73:f0:b3","172.20.0.2","172.20.0.3","TCP","4433 → 49500 [ACK] Seq=1 Ack=1255 Win=64128 Len=0 TSval=2876956463 TSecr=2182385533"
"114","2.283608401","1504","da:0a:fd:8e:e0:a3","6e:d1:f8:73:f0:b3","172.20.0.2","172.20.0.3","TLSv1.3","Server Hello, Change Cipher Spec, Application Data, Application Data, Application Data, Application Data"
"115","2.283655079","66","6e:d1:f8:73:f0:b3","da:0a:fd:8e:e0:a3","172.20.0.3","172.20.0.2","TCP","49500 → 4433 [ACK] Seq=1255 Ack=1439 Win=64128 Len=0 TSval=2182385533 TSecr=2876956463"
"116","2.284733405","146","6e:d1:f8:73:f0:b3","da:0a:fd:8e:e0:a3","172.20.0.3","172.20.0.2","TLSv1.3","Change Cipher Spec, Application Data"
"117","2.284820934","66","6e:d1:f8:73:f0:b3","da:0a:fd:8e:e0:a3","172.20.0.3","172.20.0.2","TCP","49500 → 4433 [RST, ACK] Seq=1335 Ack=1439 Win=64128 Len=0 TSval=2182385535 TSecr=2876956463"
"118","2.296810124","74","6e:d1:f8:73:f0:b3","da:0a:fd:8e:e0:a3","172.20.0.3","172.20.0.2","TCP","49516 → 4433 [SYN] Seq=0 Win=64240 Len=0 MSS=1460 SACK_PERM TSval=2182385547 TSecr=0 WS=128"
"119","2.296839863","74","da:0a:fd:8e:e0:a3","6e:d1:f8:73:f0:b3","172.20.0.2","172.20.0.3","TCP","4433 → 49516 [SYN, ACK] Seq=0 Ack=1 Win=65160 Len=0 MSS=1460 SACK_PERM TSval=2876956477 TSecr=2182385547 WS=128"
"120","2.296858429","66","6e:d1:f8:73:f0:b3","da:0a:fd:8e:e0:a3","172.20.0.3","172.20.0.2","TCP","49516 → 4433 [ACK] Seq=1 Ack=1 Win=64256 Len=0 TSval=2182385547 TSecr=2876956477"
"121","2.296902204","1320","6e:d1:f8:73:f0:b3","da:0a:fd:8e:e0:a3","172.20.0.3","172.20.0.2","TLSv1.2","Client Hello"
"122","2.296908608","66","da:0a:fd:8e:e0:a3","6e:d1:f8:73:f0:b3","172.20.0.2","172.20.0.3","TCP","4433 → 49516 [ACK] Seq=1 Ack=1255 Win=64128 Len=0 TSval=2876956477 TSecr=2182385547"
"123","2.297467632","1504","da:0a:fd:8e:e0:a3","6e:d1:f8:73:f0:b3","172.20.0.2","172.20.0.3","TLSv1.3","Server Hello, Change Cipher Spec, Application Data, Application Data, Application Data, Application Data"
"124","2.297501094","66","6e:d1:f8:73:f0:b3","da:0a:fd:8e:e0:a3","172.20.0.3","172.20.0.2","TCP","49516 → 4433 [ACK] Seq=1255 Ack=1439 Win=64128 Len=0 TSval=2182385547 TSecr=2876956477"
"125","2.298780713","146","6e:d1:f8:73:f0:b3","da:0a:fd:8e:e0:a3","172.20.0.3","172.20.0.2","TLSv1.3","Change Cipher Spec, Application Data"
"126","2.298862836","66","6e:d1:f8:73:f0:b3","da:0a:fd:8e:e0:a3","172.20.0.3","172.20.0.2","TCP","49516 → 4433 [RST, ACK] Seq=1335 Ack=1439 Win=64128 Len=0 TSval=2182385549 TSecr=2876956477"
"127","2.310830140","74","6e:d1:f8:73:f0:b3","da:0a:fd:8e:e0:a3","172.20.0.3","172.20.0.2","TCP","49518 → 4433 [SYN] Seq=0 Win=64240 Len=0 MSS=1460 SACK_PERM TSval=2182385561 TSecr=0 WS=128"
"128","2.310856501","74","da:0a:fd:8e:e0:a3","6e:d1:f8:73:f0:b3","172.20.0.2","172.20.0.3","TCP","4433 → 49518 [SYN, ACK] Seq=0 Ack=1 Win=65160 Len=0 MSS=1460 SACK_PERM TSval=2876956491 TSecr=2182385561 WS=128"
"129","2.310874897","66","6e:d1:f8:73:f0:b3","da:0a:fd:8e:e0:a3","172.20.0.3","172.20.0.2","TCP","49518 → 4433 [ACK] Seq=1 Ack=1 Win=64256 Len=0 TSval=2182385561 TSecr=2876956491"
"130","2.310918413","1320","6e:d1:f8:73:f0:b3","da:0a:fd:8e:e0:a3","172.20.0.3","172.20.0.2","TLSv1.2","Client Hello"
"131","2.310924965","66","da:0a:fd:8e:e0:a3","6e:d1:f8:73:f0:b3","172.20.0.2","172.20.0.3","TCP","4433 → 49518 [ACK] Seq=1 Ack=1255 Win=64128 Len=0 TSval=2876956491 TSecr=2182385561"
"132","2.311505827","1504","da:0a:fd:8e:e0:a3","6e:d1:f8:73:f0:b3","172.20.0.2","172.20.0.3","TLSv1.3","Server Hello, Change Cipher Spec, Application Data, Application Data, Application Data, Application Data"
"133","2.311541985","66","6e:d1:f8:73:f0:b3","da:0a:fd:8e:e0:a3","172.20.0.3","172.20.0.2","TCP","49518 → 4433 [ACK] Seq=1255 Ack=1439 Win=64128 Len=0 TSval=2182385561 TSecr=2876956491"
"134","2.312769849","146","6e:d1:f8:73:f0:b3","da:0a:fd:8e:e0:a3","172.20.0.3","172.20.0.2","TLSv1.3","Change Cipher Spec, Application Data"
"135","2.312834362","66","6e:d1:f8:73:f0:b3","da:0a:fd:8e:e0:a3","172.20.0.3","172.20.0.2","TCP","49518 → 4433 [RST, ACK] Seq=1335 Ack=1439 Win=64128 Len=0 TSval=2182385563 TSecr=2876956491"
"136","2.324797809","74","6e:d1:f8:73:f0:b3","da:0a:fd:8e:e0:a3","172.20.0.3","172.20.0.2","TCP","49522 → 4433 [SYN] Seq=0 Win=64240 Len=0 MSS=1460 SACK_PERM TSval=2182385575 TSecr=0 WS=128"
"137","2.324829634","74","da:0a:fd:8e:e0:a3","6e:d1:f8:73:f0:b3","172.20.0.2","172.20.0.3","TCP","4433 → 49522 [SYN, ACK] Seq=0 Ack=1 Win=65160 Len=0 MSS=1460 SACK_PERM TSval=2876956505 TSecr=2182385575 WS=128"
"138","2.324849627","66","6e:d1:f8:73:f0:b3","da:0a:fd:8e:e0:a3","172.20.0.3","172.20.0.2","TCP","49522 → 4433 [ACK] Seq=1 Ack=1 Win=64256 Len=0 TSval=2182385575 TSecr=2876956505"
"139","2.324894944","1320","6e:d1:f8:73:f0:b3","da:0a:fd:8e:e0:a3","172.20.0.3","172.20.0.2","TLSv1.2","Client Hello"
"140","2.324902733","66","da:0a:fd:8e:e0:a3","6e:d1:f8:73:f0:b3","172.20.0.2","172.20.0.3","TCP","4433 → 49522 [ACK] Seq=1 Ack=1255 Win=64128 Len=0 TSval=2876956505 TSecr=2182385575"
"141","2.325544897","1504","da:0a:fd:8e:e0:a3","6e:d1:f8:73:f0:b3","172.20.0.2","172.20.0.3","TLSv1.3","Server Hello, Change Cipher Spec, Application Data, Application Data, Application Data, Application Data"
"142","2.325587534","66","6e:d1:f8:73:f0:b3","da:0a:fd:8e:e0:a3","172.20.0.3","172.20.0.2","TCP","49522 → 4433 [ACK] Seq=1255 Ack=1439 Win=64128 Len=0 TSval=2182385575 TSecr=2876956505"
"143","2.326931118","146","6e:d1:f8:73:f0:b3","da:0a:fd:8e:e0:a3","172.20.0.3","172.20.0.2","TLSv1.3","Change Cipher Spec, Application Data"
"144","2.327005891","66","6e:d1:f8:73:f0:b3","da:0a:fd:8e:e0:a3","172.20.0.3","172.20.0.2","TCP","49522 → 4433 [RST, ACK] Seq=1335 Ack=1439 Win=64128 Len=0 TSval=2182385577 TSecr=2876956505"
"145","2.338527522","74","6e:d1:f8:73:f0:b3","da:0a:fd:8e:e0:a3","172.20.0.3","172.20.0.2","TCP","49536 → 4433 [SYN] Seq=0 Win=64240 Len=0 MSS=1460 SACK_PERM TSval=2182385588 TSecr=0 WS=128"
"146","3.338802590","74","da:0a:fd:8e:e0:a3","6e:d1:f8:73:f0:b3","172.20.0.2","172.20.0.3","TCP","4433 → 49536 [SYN, ACK] Seq=0 Ack=1 Win=65160 Len=0 MSS=1460 SACK_PERM TSval=2876957519 TSecr=2182385588 WS=128"
"147","3.338830153","74","6e:d1:f8:73:f0:b3","da:0a:fd:8e:e0:a3","172.20.0.3","172.20.0.2","TCP","[TCP Retransmission] 49536 → 4433 [SYN] Seq=0 Win=64240 Len=0 MSS=1460 SACK_PERM TSval=2182386589 TSecr=0 WS=128"
"148","3.338875658","66","6e:d1:f8:73:f0:b3","da:0a:fd:8e:e0:a3","172.20.0.3","172.20.0.2","TCP","49536 → 4433 [ACK] Seq=1 Ack=1 Win=64256 Len=0 TSval=2182386589 TSecr=2876957519"
"149","3.338966342","1320","6e:d1:f8:73:f0:b3","da:0a:fd:8e:e0:a3","172.20.0.3","172.20.0.2","TLSv1.2","Client Hello"
"150","3.338974128","66","da:0a:fd:8e:e0:a3","6e:d1:f8:73:f0:b3","172.20.0.2","172.20.0.3","TCP","4433 → 49536 [ACK] Seq=1 Ack=1255 Win=64128 Len=0 TSval=2876957519 TSecr=2182386589"
"151","3.339634706","1504","da:0a:fd:8e:e0:a3","6e:d1:f8:73:f0:b3","172.20.0.2","172.20.0.3","TLSv1.3","Server Hello, Change Cipher Spec, Application Data, Application Data, Application Data, Application Data"
"152","3.339677890","66","6e:d1:f8:73:f0:b3","da:0a:fd:8e:e0:a3","172.20.0.3","172.20.0.2","TCP","49536 → 4433 [ACK] Seq=1255 Ack=1439 Win=64128 Len=0 TSval=2182386589 TSecr=2876957519"
"153","3.340884105","146","6e:d1:f8:73:f0:b3","da:0a:fd:8e:e0:a3","172.20.0.3","172.20.0.2","TLSv1.3","Change Cipher Spec, Application Data"
"154","3.340949808","66","6e:d1:f8:73:f0:b3","da:0a:fd:8e:e0:a3","172.20.0.3","172.20.0.2","TCP","49536 → 4433 [RST, ACK] Seq=1335 Ack=1439 Win=64128 Len=0 TSval=2182386591 TSecr=2876957519"
"155","3.351834604","74","6e:d1:f8:73:f0:b3","da:0a:fd:8e:e0:a3","172.20.0.3","172.20.0.2","TCP","54876 → 4433 [SYN] Seq=0 Win=64240 Len=0 MSS=1460 SACK_PERM TSval=2182386602 TSecr=0 WS=128"
"156","3.351862895","74","da:0a:fd:8e:e0:a3","6e:d1:f8:73:f0:b3","172.20.0.2","172.20.0.3","TCP","4433 → 54876 [SYN, ACK] Seq=0 Ack=1 Win=65160 Len=0 MSS=1460 SACK_PERM TSval=2876957532 TSecr=2182386602 WS=128"
"157","3.351880341","66","6e:d1:f8:73:f0:b3","da:0a:fd:8e:e0:a3","172.20.0.3","172.20.0.2","TCP","54876 → 4433 [ACK] Seq=1 Ack=1 Win=64256 Len=0 TSval=2182386602 TSecr=2876957532"
"158","3.351920953","1320","6e:d1:f8:73:f0:b3","da:0a:fd:8e:e0:a3","172.20.0.3","172.20.0.2","TLSv1.2","Client Hello"
"159","3.351926345","66","da:0a:fd:8e:e0:a3","6e:d1:f8:73:f0:b3","172.20.0.2","172.20.0.3","TCP","4433 → 54876 [ACK] Seq=1 Ack=1255 Win=64128 Len=0 TSval=2876957532 TSecr=2182386602"
"160","3.352840782","1504","da:0a:fd:8e:e0:a3","6e:d1:f8:73:f0:b3","172.20.0.2","172.20.0.3","TLSv1.3","Server Hello, Change Cipher Spec, Application Data, Application Data, Application Data, Application Data"
"161","3.352881608","66","6e:d1:f8:73:f0:b3","da:0a:fd:8e:e0:a3","172.20.0.3","172.20.0.2","TCP","54876 → 4433 [ACK] Seq=1255 Ack=1439 Win=64128 Len=0 TSval=2182386603 TSecr=2876957533"
"162","3.353929765","146","6e:d1:f8:73:f0:b3","da:0a:fd:8e:e0:a3","172.20.0.3","172.20.0.2","TLSv1.3","Change Cipher Spec, Application Data"
"163","3.353997276","66","6e:d1:f8:73:f0:b3","da:0a:fd:8e:e0:a3","172.20.0.3","172.20.0.2","TCP","54876 → 4433 [RST, ACK] Seq=1335 Ack=1439 Win=64128 Len=0 TSval=2182386604 TSecr=2876957533"
"164","3.365836484","74","6e:d1:f8:73:f0:b3","da:0a:fd:8e:e0:a3","172.20.0.3","172.20.0.2","TCP","54878 → 4433 [SYN] Seq=0 Win=64240 Len=0 MSS=1460 SACK_PERM TSval=2182386616 TSecr=0 WS=128"
"165","3.365869226","74","da:0a:fd:8e:e0:a3","6e:d1:f8:73:f0:b3","172.20.0.2","172.20.0.3","TCP","4433 → 54878 [SYN, ACK] Seq=0 Ack=1 Win=65160 Len=0 MSS=1460 SACK_PERM TSval=2876957546 TSecr=2182386616 WS=128"
"166","3.365889935","66","6e:d1:f8:73:f0:b3","da:0a:fd:8e:e0:a3","172.20.0.3","172.20.0.2","TCP","54878 → 4433 [ACK] Seq=1 Ack=1 Win=64256 Len=0 TSval=2182386616 TSecr=2876957546"
"167","3.365938994","1320","6e:d1:f8:73:f0:b3","da:0a:fd:8e:e0:a3","172.20.0.3","172.20.0.2","TLSv1.2","Client Hello"
"168","3.365946137","66","da:0a:fd:8e:e0:a3","6e:d1:f8:73:f0:b3","172.20.0.2","172.20.0.3","TCP","4433 → 54878 [ACK] Seq=1 Ack=1255 Win=64128 Len=0 TSval=2876957546 TSecr=2182386616"
"169","3.366554724","1504","da:0a:fd:8e:e0:a3","6e:d1:f8:73:f0:b3","172.20.0.2","172.20.0.3","TLSv1.3","Server Hello, Change Cipher Spec, Application Data, Application Data, Application Data, Application Data"
"170","3.366593369","66","6e:d1:f8:73:f0:b3","da:0a:fd:8e:e0:a3","172.20.0.3","172.20.0.2","TCP","54878 → 4433 [ACK] Seq=1255 Ack=1439 Win=64128 Len=0 TSval=2182386616 TSecr=2876957546"
"171","3.367708047","146","6e:d1:f8:73:f0:b3","da:0a:fd:8e:e0:a3","172.20.0.3","172.20.0.2","TLSv1.3","Change Cipher Spec, Application Data"
"172","3.367787303","66","6e:d1:f8:73:f0:b3","da:0a:fd:8e:e0:a3","172.20.0.3","172.20.0.2","TCP","54878 → 4433 [RST, ACK] Seq=1335 Ack=1439 Win=64128 Len=0 TSval=2182386618 TSecr=2876957546"
"173","3.379998652","74","6e:d1:f8:73:f0:b3","da:0a:fd:8e:e0:a3","172.20.0.3","172.20.0.2","TCP","54884 → 4433 [SYN] Seq=0 Win=64240 Len=0 MSS=1460 SACK_PERM TSval=2182386630 TSecr=0 WS=128"
"174","3.380029328","74","da:0a:fd:8e:e0:a3","6e:d1:f8:73:f0:b3","172.20.0.2","172.20.0.3","TCP","4433 → 54884 [SYN, ACK] Seq=0 Ack=1 Win=65160 Len=0 MSS=1460 SACK_PERM TSval=2876957560 TSecr=2182386630 WS=128"
"175","3.380048021","66","6e:d1:f8:73:f0:b3","da:0a:fd:8e:e0:a3","172.20.0.3","172.20.0.2","TCP","54884 → 4433 [ACK] Seq=1 Ack=1 Win=64256 Len=0 TSval=2182386630 TSecr=2876957560"
"176","3.380088111","1320","6e:d1:f8:73:f0:b3","da:0a:fd:8e:e0:a3","172.20.0.3","172.20.0.2","TLSv1.2","Client Hello"
"177","3.380095395","66","da:0a:fd:8e:e0:a3","6e:d1:f8:73:f0:b3","172.20.0.2","172.20.0.3","TCP","4433 → 54884 [ACK] Seq=1 Ack=1255 Win=64128 Len=0 TSval=2876957560 TSecr=2182386630"
"178","3.380689978","1504","da:0a:fd:8e:e0:a3","6e:d1:f8:73:f0:b3","172.20.0.2","172.20.0.3","TLSv1.3","Server Hello, Change Cipher Spec, Application Data, Application Data, Application Data, Application Data"
"179","3.380724467","66","6e:d1:f8:73:f0:b3","da:0a:fd:8e:e0:a3","172.20.0.3","172.20.0.2","TCP","54884 → 4433 [ACK] Seq=1255 Ack=1439 Win=64128 Len=0 TSval=2182386630 TSecr=2876957560"
"180","3.381789719","146","6e:d1:f8:73:f0:b3","da:0a:fd:8e:e0:a3","172.20.0.3","172.20.0.2","TLSv1.3","Change Cipher Spec, Application Data"
"181","3.381846089","66","6e:d1:f8:73:f0:b3","da:0a:fd:8e:e0:a3","172.20.0.3","172.20.0.2","TCP","54884 → 4433 [RST, ACK] Seq=1335 Ack=1439 Win=64128 Len=0 TSval=2182386632 TSecr=2876957560"
"182","3.392973936","74","6e:d1:f8:73:f0:b3","da:0a:fd:8e:e0:a3","172.20.0.3","172.20.0.2","TCP","54892 → 4433 [SYN] Seq=0 Win=64240 Len=0 MSS=1460 SACK_PERM TSval=2182386643 TSecr=0 WS=128"
"183","3.393005861","74","da:0a:fd:8e:e0:a3","6e:d1:f8:73:f0:b3","172.20.0.2","172.20.0.3","TCP","4433 → 54892 [SYN, ACK] Seq=0 Ack=1 Win=65160 Len=0 MSS=1460 SACK_PERM TSval=2876957573 TSecr=2182386643 WS=128"
"184","3.393025032","66","6e:d1:f8:73:f0:b3","da:0a:fd:8e:e0:a3","172.20.0.3","172.20.0.2","TCP","54892 → 4433 [ACK] Seq=1 Ack=1 Win=64256 Len=0 TSval=2182386643 TSecr=2876957573"
"185","3.393071037","1320","6e:d1:f8:73:f0:b3","da:0a:fd:8e:e0:a3","172.20.0.3","172.20.0.2","TLSv1.2","Client Hello"
"186","3.393078634","66","da:0a:fd:8e:e0:a3","6e:d1:f8:73:f0:b3","172.20.0.2","172.20.0.3","TCP","4433 → 54892 [ACK] Seq=1 Ack=1255 Win=64128 Len=0 TSval=2876957573 TSecr=2182386643"
"187","3.393725772","1504","da:0a:fd:8e:e0:a3","6e:d1:f8:73:f0:b3","172.20.0.2","172.20.0.3","TLSv1.3","Server Hello, Change Cipher Spec, Application Data, Application Data, Application Data, Application Data"
"188","3.393778702","66","6e:d1:f8:73:f0:b3","da:0a:fd:8e:e0:a3","172.20.0.3","172.20.0.2","TCP","54892 → 4433 [ACK] Seq=1255 Ack=1439 Win=64128 Len=0 TSval=2182386644 TSecr=2876957573"
"189","3.394800516","146","6e:d1:f8:73:f0:b3","da:0a:fd:8e:e0:a3","172.20.0.3","172.20.0.2","TLSv1.3","Change Cipher Spec, Application Data"
"190","3.394852306","66","6e:d1:f8:73:f0:b3","da:0a:fd:8e:e0:a3","172.20.0.3","172.20.0.2","TCP","54892 → 4433 [RST, ACK] Seq=1335 Ack=1439 Win=64128 Len=0 TSval=2182386645 TSecr=2876957573"
"191","3.404603465","74","6e:d1:f8:73:f0:b3","da:0a:fd:8e:e0:a3","172.20.0.3","172.20.0.2","TCP","54898 → 4433 [SYN] Seq=0 Win=64240 Len=0 MSS=1460 SACK_PERM TSval=2182386654 TSecr=0 WS=128"
"192","3.404623366","74","da:0a:fd:8e:e0:a3","6e:d1:f8:73:f0:b3","172.20.0.2","172.20.0.3","TCP","4433 → 54898 [SYN, ACK] Seq=0 Ack=1 Win=65160 Len=0 MSS=1460 SACK_PERM TSval=2876957584 TSecr=2182386654 WS=128"
"193","3.404637751","66","6e:d1:f8:73:f0:b3","da:0a:fd:8e:e0:a3","172.20.0.3","172.20.0.2","TCP","54898 → 4433 [ACK] Seq=1 Ack=1 Win=64256 Len=0 TSval=2182386654 TSecr=2876957584"
"194","3.404681294","1320","6e:d1:f8:73:f0:b3","da:0a:fd:8e:e0:a3","172.20.0.3","172.20.0.2","TLSv1.2","Client Hello"
"195","3.404686680","66","da:0a:fd:8e:e0:a3","6e:d1:f8:73:f0:b3","172.20.0.2","172.20.0.3","TCP","4433 → 54898 [ACK] Seq=1 Ack=1255 Win=64128 Len=0 TSval=2876957584 TSecr=2182386654"
"196","3.405267189","1504","da:0a:fd:8e:e0:a3","6e:d1:f8:73:f0:b3","172.20.0.2","172.20.0.3","TLSv1.3","Server Hello, Change Cipher Spec, Application Data, Application Data, Application Data, Application Data"
"197","3.405294166","66","6e:d1:f8:73:f0:b3","da:0a:fd:8e:e0:a3","172.20.0.3","172.20.0.2","TCP","54898 → 4433 [ACK] Seq=1255 Ack=1439 Win=64128 Len=0 TSval=2182386655 TSecr=2876957585"
"198","3.406335429","146","6e:d1:f8:73:f0:b3","da:0a:fd:8e:e0:a3","172.20.0.3","172.20.0.2","TLSv1.3","Change Cipher Spec, Application Data"
"199","3.406390595","66","6e:d1:f8:73:f0:b3","da:0a:fd:8e:e0:a3","172.20.0.3","172.20.0.2","TCP","54898 → 4433 [RST, ACK] Seq=1335 Ack=1439 Win=64128 Len=0 TSval=2182386656 TSecr=2876957585"
"200","3.416915432","74","6e:d1:f8:73:f0:b3","da:0a:fd:8e:e0:a3","172.20.0.3","172.20.0.2","TCP","54904 → 4433 [SYN] Seq=0 Win=64240 Len=0 MSS=1460 SACK_PERM TSval=2182386667 TSecr=0 WS=128"
"201","3.416944684","74","da:0a:fd:8e:e0:a3","6e:d1:f8:73:f0:b3","172.20.0.2","172.20.0.3","TCP","4433 → 54904 [SYN, ACK] Seq=0 Ack=1 Win=65160 Len=0 MSS=1460 SACK_PERM TSval=2876957597 TSecr=2182386667 WS=128"
"202","3.416962705","66","6e:d1:f8:73:f0:b3","da:0a:fd:8e:e0:a3","172.20.0.3","172.20.0.2","TCP","54904 → 4433 [ACK] Seq=1 Ack=1 Win=64256 Len=0 TSval=2182386667 TSecr=2876957597"
"203","3.417010466","1320","6e:d1:f8:73:f0:b3","da:0a:fd:8e:e0:a3","172.20.0.3","172.20.0.2","TLSv1.2","Client Hello"
"204","3.417015453","66","da:0a:fd:8e:e0:a3","6e:d1:f8:73:f0:b3","172.20.0.2","172.20.0.3","TCP","4433 → 54904 [ACK] Seq=1 Ack=1255 Win=64128 Len=0 TSval=2876957597 TSecr=2182386667"
"205","3.417659930","1504","da:0a:fd:8e:e0:a3","6e:d1:f8:73:f0:b3","172.20.0.2","172.20.0.3","TLSv1.3","Server Hello, Change Cipher Spec, Application Data, Application Data, Application Data, Application Data"
"206","3.417703574","66","6e:d1:f8:73:f0:b3","da:0a:fd:8e:e0:a3","172.20.0.3","172.20.0.2","TCP","54904 → 4433 [ACK] Seq=1255 Ack=1439 Win=64128 Len=0 TSval=2182386667 TSecr=2876957597"
"207","3.418802893","146","6e:d1:f8:73:f0:b3","da:0a:fd:8e:e0:a3","172.20.0.3","172.20.0.2","TLSv1.3","Change Cipher Spec, Application Data"
"208","3.418862162","66","6e:d1:f8:73:f0:b3","da:0a:fd:8e:e0:a3","172.20.0.3","172.20.0.2","TCP","54904 → 4433 [RST, ACK] Seq=1335 Ack=1439 Win=64128 Len=0 TSval=2182386669 TSecr=2876957597"
"209","3.429458302","74","6e:d1:f8:73:f0:b3","da:0a:fd:8e:e0:a3","172.20.0.3","172.20.0.2","TCP","54908 → 4433 [SYN] Seq=0 Win=64240 Len=0 MSS=1460 SACK_PERM TSval=2182386679 TSecr=0 WS=128"
"210","3.429482595","74","da:0a:fd:8e:e0:a3","6e:d1:f8:73:f0:b3","172.20.0.2","172.20.0.3","TCP","4433 → 54908 [SYN, ACK] Seq=0 Ack=1 Win=65160 Len=0 MSS=1460 SACK_PERM TSval=2876957609 TSecr=2182386679 WS=128"
"211","3.429498682","66","6e:d1:f8:73:f0:b3","da:0a:fd:8e:e0:a3","172.20.0.3","172.20.0.2","TCP","54908 → 4433 [ACK] Seq=1 Ack=1 Win=64256 Len=0 TSval=2182386679 TSecr=2876957609"
"212","3.429543516","1320","6e:d1:f8:73:f0:b3","da:0a:fd:8e:e0:a3","172.20.0.3","172.20.0.2","TLSv1.2","Client Hello"
"213","3.429549655","66","da:0a:fd:8e:e0:a3","6e:d1:f8:73:f0:b3","172.20.0.2","172.20.0.3","TCP","4433 → 54908 [ACK] Seq=1 Ack=1255 Win=64128 Len=0 TSval=2876957609 TSecr=2182386679"
"214","3.430276967","1504","da:0a:fd:8e:e0:a3","6e:d1:f8:73:f0:b3","172.20.0.2","172.20.0.3","TLSv1.3","Server Hello, Change Cipher Spec, Application Data, Application Data, Application Data, Application Data"
"215","3.430322337","66","6e:d1:f8:73:f0:b3","da:0a:fd:8e:e0:a3","172.20.0.3","172.20.0.2","TCP","54908 → 4433 [ACK] Seq=1255 Ack=1439 Win=64128 Len=0 TSval=2182386680 TSecr=2876957610"
"216","3.431354095","146","6e:d1:f8:73:f0:b3","da:0a:fd:8e:e0:a3","172.20.0.3","172.20.0.2","TLSv1.3","Change Cipher Spec, Application Data"
"217","3.431419533","66","6e:d1:f8:73:f0:b3","da:0a:fd:8e:e0:a3","172.20.0.3","172.20.0.2","TCP","54908 → 4433 [RST, ACK] Seq=1335 Ack=1439 Win=64128 Len=0 TSval=2182386681 TSecr=2876957610"
"218","3.442381541","74","6e:d1:f8:73:f0:b3","da:0a:fd:8e:e0:a3","172.20.0.3","172.20.0.2","TCP","54914 → 4433 [SYN] Seq=0 Win=64240 Len=0 MSS=1460 SACK_PERM TSval=2182386692 TSecr=0 WS=128"
"219","3.442409010","74","da:0a:fd:8e:e0:a3","6e:d1:f8:73:f0:b3","172.20.0.2","172.20.0.3","TCP","4433 → 54914 [SYN, ACK] Seq=0 Ack=1 Win=65160 Len=0 MSS=1460 SACK_PERM TSval=2876957622 TSecr=2182386692 WS=128"
"220","3.442426475","66","6e:d1:f8:73:f0:b3","da:0a:fd:8e:e0:a3","172.20.0.3","172.20.0.2","TCP","54914 → 4433 [ACK] Seq=1 Ack=1 Win=64256 Len=0 TSval=2182386692 TSecr=2876957622"
"221","3.442471078","1320","6e:d1:f8:73:f0:b3","da:0a:fd:8e:e0:a3","172.20.0.3","172.20.0.2","TLSv1.2","Client Hello"
"222","3.442477190","66","da:0a:fd:8e:e0:a3","6e:d1:f8:73:f0:b3","172.20.0.2","172.20.0.3","TCP","4433 → 54914 [ACK] Seq=1 Ack=1255 Win=64128 Len=0 TSval=2876957622 TSecr=2182386692"
"223","3.443107729","1504","da:0a:fd:8e:e0:a3","6e:d1:f8:73:f0:b3","172.20.0.2","172.20.0.3","TLSv1.3","Server Hello, Change Cipher Spec, Application Data, Application Data, Application Data, Application Data"
