frame.number,frame.time_relative,frame.len,eth.src,eth.dst,ip.src,ip.dst,_ws.col.protocol,_ws.col.info
"1","0.000000000","239","be:a6:22:fe:90:88","33:33:00:00:00:fb",,,"MDNS","Standard query 0x0000 PTR _ipps._tcp.local, ""QM"" question PTR _ftp._tcp.local, ""QM"" question PTR _webdav._tcp.local, ""QM"" question PTR _webdavs._tcp.local, ""QM"" question PTR _sftp-ssh._tcp.local, ""QM"" question PTR _smb._tcp.local, ""QM"" question PTR _afpovertcp._tcp.local, ""QM"" question PTR _nfs._tcp.local, ""QM"" question PTR _ipp._tcp.local, ""QM"" question PTR MONTE-VIRTUAL-MACHINE._smb._tcp.local"
"2","10.726046273","42","06:a1:5f:84:e6:1b","ff:ff:ff:ff:ff:ff",,,"ARP","ARP Announcement for 172.20.0.3"
"3","10.755277221","42","06:a1:5f:84:e6:1b","ff:ff:ff:ff:ff:ff",,,"ARP","Who has 172.20.0.2? Tell 172.20.0.3"
"4","10.755303694","42","f2:2b:14:bb:fa:12","06:a1:5f:84:e6:1b",,,"ARP","172.20.0.2 is at f2:2b:14:bb:fa:12"
"5","10.755310751","74","06:a1:5f:84:e6:1b","f2:2b:14:bb:fa:12","172.20.0.3","172.20.0.2","TCP","56910 → 4433 [SYN] Seq=0 Win=64240 Len=0 MSS=1460 SACK_PERM TSval=2182170723 TSecr=0 WS=128"
"6","10.755331018","74","f2:2b:14:bb:fa:12","06:a1:5f:84:e6:1b","172.20.0.2","172.20.0.3","TCP","4433 → 56910 [SYN, ACK] Seq=0 Ack=1 Win=65160 Len=0 MSS=1460 SACK_PERM TSval=2876741653 TSecr=2182170723 WS=128"
"7","10.755346895","66","06:a1:5f:84:e6:1b","f2:2b:14:bb:fa:12","172.20.0.3","172.20.0.2","TCP","56910 → 4433 [ACK] Seq=1 Ack=1 Win=64256 Len=0 TSval=2182170723 TSecr=2876741653"
"8","10.755401607","561","06:a1:5f:84:e6:1b","f2:2b:14:bb:fa:12","172.20.0.3","172.20.0.2","TLSv1.2","Client Hello"
"9","10.755406816","66","f2:2b:14:bb:fa:12","06:a1:5f:84:e6:1b","172.20.0.2","172.20.0.3","TCP","4433 → 56910 [ACK] Seq=1 Ack=496 Win=64768 Len=0 TSval=2876741653 TSecr=2182170723"
"10","10.756255156","769","f2:2b:14:bb:fa:12","06:a1:5f:84:e6:1b","172.20.0.2","172.20.0.3","TLSv1.3","Server Hello, Change Cipher Spec, Application Data, Application Data, Application Data, Application Data"
"11","10.756290075","66","06:a1:5f:84:e6:1b","f2:2b:14:bb:fa:12","172.20.0.3","172.20.0.2","TCP","56910 → 4433 [ACK] Seq=496 Ack=704 Win=63616 Len=0 TSval=2182170724 TSecr=2876741654"
"12","10.757134608","146","06:a1:5f:84:e6:1b","f2:2b:14:bb:fa:12","172.20.0.3","172.20.0.2","TLSv1.3","Change Cipher Spec, Application Data"
"13","10.757193122","66","06:a1:5f:84:e6:1b","f2:2b:14:bb:fa:12","172.20.0.3","172.20.0.2","TCP","56910 → 4433 [RST, ACK] Seq=576 Ack=704 Win=63616 Len=0 TSval=2182170725 TSecr=2876741654"
"14","10.769796574","74","06:a1:5f:84:e6:1b","f2:2b:14:bb:fa:12","172.20.0.3","172.20.0.2","TCP","56914 → 4433 [SYN] Seq=0 Win=64240 Len=0 MSS=1460 SACK_PERM TSval=2182170738 TSecr=0 WS=128"
"15","10.769823562","74","f2:2b:14:bb:fa:12","06:a1:5f:84:e6:1b","172.20.0.2","172.20.0.3","TCP","4433 → 56914 [SYN, ACK] Seq=0 Ack=1 Win=65160 Len=0 MSS=1460 SACK_PERM TSval=2876741668 TSecr=2182170738 WS=128"
"16","10.769841223","66","06:a1:5f:84:e6:1b","f2:2b:14:bb:fa:12","172.20.0.3","172.20.0.2","TCP","56914 → 4433 [ACK] Seq=1 Ack=1 Win=64256 Len=0 TSval=2182170738 TSecr=2876741668"
"17","10.769884956","561","06:a1:5f:84:e6:1b","f2:2b:14:bb:fa:12","172.20.0.3","172.20.0.2","TLSv1.2","Client Hello"
"18","10.770417024","769","f2:2b:14:bb:fa:12","06:a1:5f:84:e6:1b","172.20.0.2","172.20.0.3","TLSv1.3","Server Hello, Change Cipher Spec, Application Data, Application Data, Application Data, Application Data"
"19","10.770449703","66","06:a1:5f:84:e6:1b","f2:2b:14:bb:fa:12","172.20.0.3","172.20.0.2","TCP","56914 → 4433 [ACK] Seq=496 Ack=704 Win=63616 Len=0 TSval=2182170738 TSecr=2876741668"
"20","10.771322917","146","06:a1:5f:84:e6:1b","f2:2b:14:bb:fa:12","172.20.0.3","172.20.0.2","TLSv1.3","Change Cipher Spec, Application Data"
"21","10.771393705","66","06:a1:5f:84:e6:1b","f2:2b:14:bb:fa:12","172.20.0.3","172.20.0.2","TCP","56914 → 4433 [RST, ACK] Seq=576 Ack=704 Win=63616 Len=0 TSval=2182170739 TSecr=2876741668"
"22","10.782088978","74","06:a1:5f:84:e6:1b","f2:2b:14:bb:fa:12","172.20.0.3","172.20.0.2","TCP","56930 → 4433 [SYN] Seq=0 Win=64240 Len=0 MSS=1460 SACK_PERM TSval=2182170750 TSecr=0 WS=128"
"23","10.782117578","74","f2:2b:14:bb:fa:12","06:a1:5f:84:e6:1b","172.20.0.2","172.20.0.3","TCP","4433 → 56930 [SYN, ACK] Seq=0 Ack=1 Win=65160 Len=0 MSS=1460 SACK_PERM TSval=2876741680 TSecr=2182170750 WS=128"
"24","10.782135077","66","06:a1:5f:84:e6:1b","f2:2b:14:bb:fa:12","172.20.0.3","172.20.0.2","TCP","56930 → 4433 [ACK] Seq=1 Ack=1 Win=64256 Len=0 TSval=2182170750 TSecr=2876741680"
"25","10.782179064","561","06:a1:5f:84:e6:1b","f2:2b:14:bb:fa:12","172.20.0.3","172.20.0.2","TLSv1.2","Client Hello"
"26","10.782184324","66","f2:2b:14:bb:fa:12","06:a1:5f:84:e6:1b","172.20.0.2","172.20.0.3","TCP","4433 → 56930 [ACK] Seq=1 Ack=496 Win=64768 Len=0 TSval=2876741680 TSecr=2182170750"
"27","10.782771672","769","f2:2b:14:bb:fa:12","06:a1:5f:84:e6:1b","172.20.0.2","172.20.0.3","TLSv1.3","Server Hello, Change Cipher Spec, Application Data, Application Data, Application Data, Application Data"
"28","10.782802266","66","06:a1:5f:84:e6:1b","f2:2b:14:bb:fa:12","172.20.0.3","172.20.0.2","TCP","56930 → 4433 [ACK] Seq=496 Ack=704 Win=63616 Len=0 TSval=2182170751 TSecr=2876741681"
"29","10.783682166","146","06:a1:5f:84:e6:1b","f2:2b:14:bb:fa:12","172.20.0.3","172.20.0.2","TLSv1.3","Change Cipher Spec, Application Data"
"30","10.783751084","66","06:a1:5f:84:e6:1b","f2:2b:14:bb:fa:12","172.20.0.3","172.20.0.2","TCP","56930 → 4433 [RST, ACK] Seq=576 Ack=704 Win=63616 Len=0 TSval=2182170752 TSecr=2876741681"
"31","10.794669253","74","06:a1:5f:84:e6:1b","f2:2b:14:bb:fa:12","172.20.0.3","172.20.0.2","TCP","56934 → 4433 [SYN] Seq=0 Win=64240 Len=0 MSS=1460 SACK_PERM TSval=2182170763 TSecr=0 WS=128"
"32","10.794698812","74","f2:2b:14:bb:fa:12","06:a1:5f:84:e6:1b","172.20.0.2","172.20.0.3","TCP","4433 → 56934 [SYN, ACK] Seq=0 Ack=1 Win=65160 Len=0 MSS=1460 SACK_PERM TSval=2876741693 TSecr=2182170763 WS=128"
"33","10.794716884","66","06:a1:5f:84:e6:1b","f2:2b:14:bb:fa:12","172.20.0.3","172.20.0.2","TCP","56934 → 4433 [ACK] Seq=1 Ack=1 Win=64256 Len=0 TSval=2182170763 TSecr=2876741693"
"34","10.794757774","561","06:a1:5f:84:e6:1b","f2:2b:14:bb:fa:12","172.20.0.3","172.20.0.2","TLSv1.2","Client Hello"
"35","10.794763054","66","f2:2b:14:bb:fa:12","06:a1:5f:84:e6:1b","172.20.0.2","172.20.0.3","TCP","4433 → 56934 [ACK] Seq=1 Ack=496 Win=64768 Len=0 TSval=2876741693 TSecr=2182170763"
"36","10.795269147","769","f2:2b:14:bb:fa:12","06:a1:5f:84:e6:1b","172.20.0.2","172.20.0.3","TLSv1.3","Server Hello, Change Cipher Spec, Application Data, Application Data, Application Data, Application Data"
"37","10.795299209","66","06:a1:5f:84:e6:1b","f2:2b:14:bb:fa:12","172.20.0.3","172.20.0.2","TCP","56934 → 4433 [ACK] Seq=496 Ack=704 Win=63616 Len=0 TSval=2182170763 TSecr=2876741693"
"38","10.796135441","146","06:a1:5f:84:e6:1b","f2:2b:14:bb:fa:12","172.20.0.3","172.20.0.2","TLSv1.3","Change Cipher Spec, Application Data"
"39","10.796191199","66","06:a1:5f:84:e6:1b","f2:2b:14:bb:fa:12","172.20.0.3","172.20.0.2","TCP","56934 → 4433 [RST, ACK] Seq=576 Ack=704 Win=63616 Len=0 TSval=2182170764 TSecr=2876741693"
"40","10.806739789","74","06:a1:5f:84:e6:1b","f2:2b:14:bb:fa:12","172.20.0.3","172.20.0.2","TCP","56940 → 4433 [SYN] Seq=0 Win=64240 Len=0 MSS=1460 SACK_PERM TSval=2182170775 TSecr=0 WS=128"
"41","10.806766384","74","f2:2b:14:bb:fa:12","06:a1:5f:84:e6:1b","172.20.0.2","172.20.0.3","TCP","4433 → 56940 [SYN, ACK] Seq=0 Ack=1 Win=65160 Len=0 MSS=1460 SACK_PERM TSval=2876741705 TSecr=2182170775 WS=128"
"42","10.806781648","66","06:a1:5f:84:e6:1b","f2:2b:14:bb:fa:12","172.20.0.3","172.20.0.2","TCP","56940 → 4433 [ACK] Seq=1 Ack=1 Win=64256 Len=0 TSval=2182170775 TSecr=2876741705"
"43","10.806822876","561","06:a1:5f:84:e6:1b","f2:2b:14:bb:fa:12","172.20.0.3","172.20.0.2","TLSv1.2","Client Hello"
"44","10.806828752","66","f2:2b:14:bb:fa:12","06:a1:5f:84:e6:1b","172.20.0.2","172.20.0.3","TCP","4433 → 56940 [ACK] Seq=1 Ack=496 Win=64768 Len=0 TSval=2876741705 TSecr=2182170775"
"45","10.807310078","769","f2:2b:14:bb:fa:12","06:a1:5f:84:e6:1b","172.20.0.2","172.20.0.3","TLSv1.3","Server Hello, Change Cipher Spec, Application Data, Application Data, Application Data, Application Data"
"46","10.807340851","66","06:a1:5f:84:e6:1b","f2:2b:14:bb:fa:12","172.20.0.3","172.20.0.2","TCP","56940 → 4433 [ACK] Seq=496 Ack=704 Win=63616 Len=0 TSval=2182170775 TSecr=2876741705"
"47","10.808178928","146","06:a1:5f:84:e6:1b","f2:2b:14:bb:fa:12","172.20.0.3","172.20.0.2","TLSv1.3","Change Cipher Spec, Application Data"
"48","10.808234901","66","06:a1:5f:84:e6:1b","f2:2b:14:bb:fa:12","172.20.0.3","172.20.0.2","TCP","56940 → 4433 [RST, ACK] Seq=576 Ack=704 Win=63616 Len=0 TSval=2182170776 TSecr=2876741705"
"49","10.818395794","74","06:a1:5f:84:e6:1b","f2:2b:14:bb:fa:12","172.20.0.3","172.20.0.2","TCP","56948 → 4433 [SYN] Seq=0 Win=64240 Len=0 MSS=1460 SACK_PERM TSval=2182170786 TSecr=0 WS=128"
"50","10.818423098","74","f2:2b:14:bb:fa:12","06:a1:5f:84:e6:1b","172.20.0.2","172.20.0.3","TCP","4433 → 56948 [SYN, ACK] Seq=0 Ack=1 Win=65160 Len=0 MSS=1460 SACK_PERM TSval=2876741716 TSecr=2182170786 WS=128"
"51","10.818438567","66","06:a1:5f:84:e6:1b","f2:2b:14:bb:fa:12","172.20.0.3","172.20.0.2","TCP","56948 → 4433 [ACK] Seq=1 Ack=1 Win=64256 Len=0 TSval=2182170786 TSecr=2876741716"
"52","10.818498117","561","06:a1:5f:84:e6:1b","f2:2b:14:bb:fa:12","172.20.0.3","172.20.0.2","TLSv1.2","Client Hello"
"53","10.818504178","66","f2:2b:14:bb:fa:12","06:a1:5f:84:e6:1b","172.20.0.2","172.20.0.3","TCP","4433 → 56948 [ACK] Seq=1 Ack=496 Win=64768 Len=0 TSval=2876741717 TSecr=2182170787"
"54","10.818986322","769","f2:2b:14:bb:fa:12","06:a1:5f:84:e6:1b","172.20.0.2","172.20.0.3","TLSv1.3","Server Hello, Change Cipher Spec, Application Data, Application Data, Application Data, Application Data"
"55","10.819014973","66","06:a1:5f:84:e6:1b","f2:2b:14:bb:fa:12","172.20.0.3","172.20.0.2","TCP","56948 → 4433 [ACK] Seq=496 Ack=704 Win=63616 Len=0 TSval=2182170787 TSecr=2876741717"
"56","10.819809965","146","06:a1:5f:84:e6:1b","f2:2b:14:bb:fa:12","172.20.0.3","172.20.0.2","TLSv1.3","Change Cipher Spec, Application Data"
"57","10.819863280","66","06:a1:5f:84:e6:1b","f2:2b:14:bb:fa:12","172.20.0.3","172.20.0.2","TCP","56948 → 4433 [RST, ACK] Seq=576 Ack=704 Win=63616 Len=0 TSval=2182170788 TSecr=2876741717"
"58","10.830566747","74","06:a1:5f:84:e6:1b","f2:2b:14:bb:fa:12","172.20.0.3","172.20.0.2","TCP","56962 → 4433 [SYN] Seq=0 Win=64240 Len=0 MSS=1460 SACK_PERM TSval=2182170799 TSecr=0 WS=128"
"59","10.830597687","74","f2:2b:14:bb:fa:12","06:a1:5f:84:e6:1b","172.20.0.2","172.20.0.3","TCP","4433 → 56962 [SYN, ACK] Seq=0 Ack=1 Win=65160 Len=0 MSS=1460 SACK_PERM TSval=2876741729 TSecr=2182170799 WS=128"
"60","10.830617678","66","06:a1:5f:84:e6:1b","f2:2b:14:bb:fa:12","172.20.0.3","172.20.0.2","TCP","56962 → 4433 [ACK] Seq=1 Ack=1 Win=64256 Len=0 TSval=2182170799 TSecr=2876741729"
"61","10.830657001","561","06:a1:5f:84:e6:1b","f2:2b:14:bb:fa:12","172.20.0.3","172.20.0.2","TLSv1.2","Client Hello"
"62","10.830664457","66","f2:2b:14:bb:fa:12","06:a1:5f:84:e6:1b","172.20.0.2","172.20.0.3","TCP","4433 → 56962 [ACK] Seq=1 Ack=496 Win=64768 Len=0 TSval=2876741729 TSecr=2182170799"
"63","10.831196610","769","f2:2b:14:bb:fa:12","06:a1:5f:84:e6:1b","172.20.0.2","172.20.0.3","TLSv1.3","Server Hello, Change Cipher Spec, Application Data, Application Data, Application Data, Application Data"
"64","10.831229151","66","06:a1:5f:84:e6:1b","f2:2b:14:bb:fa:12","172.20.0.3","172.20.0.2","TCP","56962 → 4433 [ACK] Seq=496 Ack=704 Win=63616 Len=0 TSval=2182170799 TSecr=2876741729"
"65","10.832033062","146","06:a1:5f:84:e6:1b","f2:2b:14:bb:fa:12","172.20.0.3","172.20.0.2","TLSv1.3","Change Cipher Spec, Application Data"
"66","10.832088288","66","06:a1:5f:84:e6:1b","f2:2b:14:bb:fa:12","172.20.0.3","172.20.0.2","TCP","56962 → 4433 [RST, ACK] Seq=576 Ack=704 Win=63616 Len=0 TSval=2182170800 TSecr=2876741729"
"67","10.841865431","74","06:a1:5f:84:e6:1b","f2:2b:14:bb:fa:12","172.20.0.3","172.20.0.2","TCP","56968 → 4433 [SYN] Seq=0 Win=64240 Len=0 MSS=1460 SACK_PERM TSval=2182170810 TSecr=0 WS=128"
"68","10.841884257","74","f2:2b:14:bb:fa:12","06:a1:5f:84:e6:1b","172.20.0.2","172.20.0.3","TCP","4433 → 56968 [SYN, ACK] Seq=0 Ack=1 Win=65160 Len=0 MSS=1460 SACK_PERM TSval=2876741740 TSecr=2182170810 WS=128"
"69","10.841897536","66","06:a1:5f:84:e6:1b","f2:2b:14:bb:fa:12","172.20.0.3","172.20.0.2","TCP","56968 → 4433 [ACK] Seq=1 Ack=1 Win=64256 Len=0 TSval=2182170810 TSecr=2876741740"
"70","10.841930309","561","06:a1:5f:84:e6:1b","f2:2b:14:bb:fa:12","172.20.0.3","172.20.0.2","TLSv1.2","Client Hello"
"71","10.841935299","66","f2:2b:14:bb:fa:12","06:a1:5f:84:e6:1b","172.20.0.2","172.20.0.3","TCP","4433 → 56968 [ACK] Seq=1 Ack=496 Win=64768 Len=0 TSval=2876741740 TSecr=2182170810"
"72","10.842351476","769","f2:2b:14:bb:fa:12","06:a1:5f:84:e6:1b","172.20.0.2","172.20.0.3","TLSv1.3","Server Hello, Change Cipher Spec, Application Data, Application Data, Application Data, Application Data"
"73","10.842382025","66","06:a1:5f:84:e6:1b","f2:2b:14:bb:fa:12","172.20.0.3","172.20.0.2","TCP","56968 → 4433 [ACK] Seq=496 Ack=704 Win=63616 Len=0 TSval=2182170810 TSecr=2876741740"
"74","10.843157540","146","06:a1:5f:84:e6:1b","f2:2b:14:bb:fa:12","172.20.0.3","172.20.0.2","TLSv1.3","Change Cipher Spec, Application Data"
"75","10.843211790","66","06:a1:5f:84:e6:1b","f2:2b:14:bb:fa:12","172.20.0.3","172.20.0.2","TCP","56968 → 4433 [RST, ACK] Seq=576 Ack=704 Win=63616 Len=0 TSval=2182170811 TSecr=2876741740"
"76","10.853930489","74","06:a1:5f:84:e6:1b","f2:2b:14:bb:fa:12","172.20.0.3","172.20.0.2","TCP","56984 → 4433 [SYN] Seq=0 Win=64240 Len=0 MSS=1460 SACK_PERM TSval=2182170822 TSecr=0 WS=128"
"77","10.853956898","74","f2:2b:14:bb:fa:12","06:a1:5f:84:e6:1b","172.20.0.2","172.20.0.3","TCP","4433 → 56984 [SYN, ACK] Seq=0 Ack=1 Win=65160 Len=0 MSS=1460 SACK_PERM TSval=2876741752 TSecr=2182170822 WS=128"
"78","10.853972653","66","06:a1:5f:84:e6:1b","f2:2b:14:bb:fa:12","172.20.0.3","172.20.0.2","TCP","56984 → 4433 [ACK] Seq=1 Ack=1 Win=64256 Len=0 TSval=2182170822 TSecr=2876741752"
"79","10.854011823","561","06:a1:5f:84:e6:1b","f2:2b:14:bb:fa:12","172.20.0.3","172.20.0.2","TLSv1.2","Client Hello"
"80","10.854018420","66","f2:2b:14:bb:fa:12","06:a1:5f:84:e6:1b","172.20.0.2","172.20.0.3","TCP","4433 → 56984 [ACK] Seq=1 Ack=496 Win=64768 Len=0 TSval=2876741752 TSecr=2182170822"
"81","10.854528087","769","f2:2b:14:bb:fa:12","06:a1:5f:84:e6:1b","172.20.0.2","172.20.0.3","TLSv1.3","Server Hello, Change Cipher Spec, Application Data, Application Data, Application Data, Application Data"
"82","10.854555326","66","06:a1:5f:84:e6:1b","f2:2b:14:bb:fa:12","172.20.0.3","172.20.0.2","TCP","56984 → 4433 [ACK] Seq=496 Ack=704 Win=63616 Len=0 TSval=2182170823 TSecr=2876741753"
"83","10.855350106","146","06:a1:5f:84:e6:1b","f2:2b:14:bb:fa:12","172.20.0.3","172.20.0.2","TLSv1.3","Change Cipher Spec, Application Data"
"84","10.855421706","66","06:a1:5f:84:e6:1b","f2:2b:14:bb:fa:12","172.20.0.3","172.20.0.2","TCP","56984 → 4433 [RST, ACK] Seq=576 Ack=704 Win=63616 Len=0 TSval=2182170823 TSecr=2876741753"
"85","10.865755797","74","06:a1:5f:84:e6:1b","f2:2b:14:bb:fa:12","172.20.0.3","172.20.0.2","TCP","56988 → 4433 [SYN] Seq=0 Win=64240 Len=0 MSS=1460 SACK_PERM TSval=2182170834 TSecr=0 WS=128"
"86","10.865780123","74","f2:2b:14:bb:fa:12","06:a1:5f:84:e6:1b","172.20.0.2","172.20.0.3","TCP","4433 → 56988 [SYN, ACK] Seq=0 Ack=1 Win=65160 Len=0 MSS=1460 SACK_PERM TSval=2876741764 TSecr=2182170834 WS=128"
"87","10.865796660","66","06:a1:5f:84:e6:1b","f2:2b:14:bb:fa:12","172.20.0.3","172.20.0.2","TCP","56988 → 4433 [ACK] Seq=1 Ack=1 Win=64256 Len=0 TSval=2182170834 TSecr=2876741764"
"88","10.865835400","561","06:a1:5f:84:e6:1b","f2:2b:14:bb:fa:12","172.20.0.3","172.20.0.2","TLSv1.2","Client Hello"
"89","10.865840804","66","f2:2b:14:bb:fa:12","06:a1:5f:84:e6:1b","172.20.0.2","172.20.0.3","TCP","4433 → 56988 [ACK] Seq=1 Ack=496 Win=64768 Len=0 TSval=2876741764 TSecr=2182170834"
"90","10.866339507","769","f2:2b:14:bb:fa:12","06:a1:5f:84:e6:1b","172.20.0.2","172.20.0.3","TLSv1.3","Server Hello, Change Cipher Spec, Application Data, Application Data, Application Data, Application Data"
"91","10.866370961","66","06:a1:5f:84:e6:1b","f2:2b:14:bb:fa:12","172.20.0.3","172.20.0.2","TCP","56988 → 4433 [ACK] Seq=496 Ack=704 Win=63616 Len=0 TSval=2182170834 TSecr=2876741764"
"92","10.867161921","146","06:a1:5f:84:e6:1b","f2:2b:14:bb:fa:12","172.20.0.3","172.20.0.2","TLSv1.3","Change Cipher Spec, Application Data"
"93","10.867215999","66","06:a1:5f:84:e6:1b","f2:2b:14:bb:fa:12","172.20.0.3","172.20.0.2","TCP","56988 → 4433 [RST, ACK] Seq=576 Ack=704 Win=63616 Len=0 TSval=2182170835 TSecr=2876741764"
"94","10.876967099","74","06:a1:5f:84:e6:1b","f2:2b:14:bb:fa:12","172.20.0.3","172.20.0.2","TCP","56996 → 4433 [SYN] Seq=0 Win=64240 Len=0 MSS=1460 SACK_PERM TSval=2182170845 TSecr=0 WS=128"
"95","10.876987445","74","f2:2b:14:bb:fa:12","06:a1:5f:84:e6:1b","172.20.0.2","172.20.0.3","TCP","4433 → 56996 [SYN, ACK] Seq=0 Ack=1 Win=65160 Len=0 MSS=1460 SACK_PERM TSval=2876741775 TSecr=2182170845 WS=128"
"96","10.877001310","66","06:a1:5f:84:e6:1b","f2:2b:14:bb:fa:12","172.20.0.3","172.20.0.2","TCP","56996 → 4433 [ACK] Seq=1 Ack=1 Win=64256 Len=0 TSval=2182170845 TSecr=2876741775"
"97","10.877035427","561","06:a1:5f:84:e6:1b","f2:2b:14:bb:fa:12","172.20.0.3","172.20.0.2","TLSv1.2","Client Hello"
"98","10.877040866","66","f2:2b:14:bb:fa:12","06:a1:5f:84:e6:1b","172.20.0.2","172.20.0.3","TCP","4433 → 56996 [ACK] Seq=1 Ack=496 Win=64768 Len=0 TSval=2876741775 TSecr=2182170845"
"99","10.877430027","769","f2:2b:14:bb:fa:12","06:a1:5f:84:e6:1b","172.20.0.2","172.20.0.3","TLSv1.3","Server Hello, Change Cipher Spec, Application Data, Application Data, Application Data, Application Data"
"100","10.877452944","66","06:a1:5f:84:e6:1b","f2:2b:14:bb:fa:12","172.20.0.3","172.20.0.2","TCP","56996 → 4433 [ACK] Seq=496 Ack=704 Win=63616 Len=0 TSval=2182170845 TSecr=2876741775"
"101","10.878244320","146","06:a1:5f:84:e6:1b","f2:2b:14:bb:fa:12","172.20.0.3","172.20.0.2","TLSv1.3","Change Cipher Spec, Application Data"
"102","10.878298678","66","06:a1:5f:84:e6:1b","f2:2b:14:bb:fa:12","172.20.0.3","172.20.0.2","TCP","56996 → 4433 [RST, ACK] Seq=576 Ack=704 Win=63616 Len=0 TSval=2182170846 TSecr=2876741775"
"103","10.888108455","74","06:a1:5f:84:e6:1b","f2:2b:14:bb:fa:12","172.20.0.3","172.20.0.2","TCP","57012 → 4433 [SYN] Seq=0 Win=64240 Len=0 MSS=1460 SACK_PERM TSval=2182170856 TSecr=0 WS=128"
"104","10.888129681","74","f2:2b:14:bb:fa:12","06:a1:5f:84:e6:1b","172.20.0.2","172.20.0.3","TCP","4433 → 57012 [SYN, ACK] Seq=0 Ack=1 Win=65160 Len=0 MSS=1460 SACK_PERM TSval=2876741786 TSecr=2182170856 WS=128"
"105","10.888144354","66","06:a1:5f:84:e6:1b","f2:2b:14:bb:fa:12","172.20.0.3","172.20.0.2","TCP","57012 → 4433 [ACK] Seq=1 Ack=1 Win=64256 Len=0 TSval=2182170856 TSecr=2876741786"
"106","10.888178543","561","06:a1:5f:84:e6:1b","f2:2b:14:bb:fa:12","172.20.0.3","172.20.0.2","TLSv1.2","Client Hello"
"107","10.888184896","66","f2:2b:14:bb:fa:12","06:a1:5f:84:e6:1b","172.20.0.2","172.20.0.3","TCP","4433 → 57012 [ACK] Seq=1 Ack=496 Win=64768 Len=0 TSval=2876741786 TSecr=2182170856"
"108","10.888648745","769","f2:2b:14:bb:fa:12","06:a1:5f:84:e6:1b","172.20.0.2","172.20.0.3","TLSv1.3","Server Hello, Change Cipher Spec, Application Data, Application Data, Application Data, Application Data"
"109","10.888676230","66","06:a1:5f:84:e6:1b","f2:2b:14:bb:fa:12","172.20.0.3","172.20.0.2","TCP","57012 → 4433 [ACK] Seq=496 Ack=704 Win=63616 Len=0 TSval=2182170857 TSecr=2876741787"
"110","10.889533928","146","06:a1:5f:84:e6:1b","f2:2b:14:bb:fa:12","172.20.0.3","172.20.0.2","TLSv1.3","Change Cipher Spec, Application Data"
"111","10.889595636","66","06:a1:5f:84:e6:1b","f2:2b:14:bb:fa:12","172.20.0.3","172.20.0.2","TCP","57012 → 4433 [RST, ACK] Seq=576 Ack=704 Win=63616 Len=0 TSval=2182170858 TSecr=2876741787"
"112","10.899801915","74","06:a1:5f:84:e6:1b","f2:2b:14:bb:fa:12","172.20.0.3","172.20.0.2","TCP","57014 → 4433 [SYN] Seq=0 Win=64240 Len=0 MSS=1460 SACK_PERM TSval=2182170868 TSecr=0 WS=128"
"113","10.899821653","74","f2:2b:14:bb:fa:12","06:a1:5f:84:e6:1b","172.20.0.2","172.20.0.3","TCP","4433 → 57014 [SYN, ACK] Seq=0 Ack=1 Win=65160 Len=0 MSS=1460 SACK_PERM TSval=2876741798 TSecr=2182170868 WS=128"
"114","10.899835924","66","06:a1:5f:84:e6:1b","f2:2b:14:bb:fa:12","172.20.0.3","172.20.0.2","TCP","57014 → 4433 [ACK] Seq=1 Ack=1 Win=64256 Len=0 TSval=2182170868 TSecr=2876741798"
"115","10.899868560","561","06:a1:5f:84:e6:1b","f2:2b:14:bb:fa:12","172.20.0.3","172.20.0.2","TLSv1.2","Client Hello"
"116","10.899874023","66","f2:2b:14:bb:fa:12","06:a1:5f:84:e6:1b","172.20.0.2","172.20.0.3","TCP","4433 → 57014 [ACK] Seq=1 Ack=496 Win=64768 Len=0 TSval=2876741798 TSecr=2182170868"
"117","10.900313756","769","f2:2b:14:bb:fa:12","06:a1:5f:84:e6:1b","172.20.0.2","172.20.0.3","TLSv1.3","Server Hello, Change Cipher Spec, Application Data, Application Data, Application Data, Application Data"
"118","10.900340967","66","06:a1:5f:84:e6:1b","f2:2b:14:bb:fa:12","172.20.0.3","172.20.0.2","TCP","57014 → 4433 [ACK] Seq=496 Ack=704 Win=63616 Len=0 TSval=2182170868 TSecr=2876741798"
"119","10.901140090","146","06:a1:5f:84:e6:1b","f2:2b:14:bb:fa:12","172.20.0.3","172.20.0.2","TLSv1.3","Change Cipher Spec, Application Data"
"120","10.901194163","66","06:a1:5f:84:e6:1b","f2:2b:14:bb:fa:12","172.20.0.3","172.20.0.2","TCP","57014 → 4433 [RST, ACK] Seq=576 Ack=704 Win=63616 Len=0 TSval=2182170869 TSecr=2876741798"
"121","10.911416423","74","06:a1:5f:84:e6:1b","f2:2b:14:bb:fa:12","172.20.0.3","172.20.0.2","TCP","57016 → 4433 [SYN] Seq=0 Win=64240 Len=0 MSS=1460 SACK_PERM TSval=2182170879 TSecr=0 WS=128"
"122","10.911438060","74","f2:2b:14:bb:fa:12","06:a1:5f:84:e6:1b","172.20.0.2","172.20.0.3","TCP","4433 → 57016 [SYN, ACK] Seq=0 Ack=1 Win=65160 Len=0 MSS=1460 SACK_PERM TSval=2876741809 TSecr=2182170879 WS=128"
"123","10.911453832","66","06:a1:5f:84:e6:1b","f2:2b:14:bb:fa:12","172.20.0.3","172.20.0.2","TCP","57016 → 4433 [ACK] Seq=1 Ack=1 Win=64256 Len=0 TSval=2182170879 TSecr=2876741809"
"124","10.911542711","561","06:a1:5f:84:e6:1b","f2:2b:14:bb:fa:12","172.20.0.3","172.20.0.2","TLSv1.2","Client Hello"
"125","10.911555191","66","f2:2b:14:bb:fa:12","06:a1:5f:84:e6:1b","172.20.0.2","172.20.0.3","TCP","4433 → 57016 [ACK] Seq=1 Ack=496 Win=64768 Len=0 TSval=2876741810 TSecr=2182170880"
"126","10.911954139","769","f2:2b:14:bb:fa:12","06:a1:5f:84:e6:1b","172.20.0.2","172.20.0.3","TLSv1.3","Server Hello, Change Cipher Spec, Application Data, Application Data, Application Data, Application Data"
"127","10.911982629","66","06:a1:5f:84:e6:1b","f2:2b:14:bb:fa:12","172.20.0.3","172.20.0.2","TCP","57016 → 4433 [ACK] Seq=496 Ack=704 Win=63616 Len=0 TSval=2182170880 TSecr=2876741810"
"128","10.912870417","146","06:a1:5f:84:e6:1b","f2:2b:14:bb:fa:12","172.20.0.3","172.20.0.2","TLSv1.3","Change Cipher Spec, Application Data"
"129","10.912923639","66","06:a1:5f:84:e6:1b","f2:2b:14:bb:fa:12","172.20.0.3","172.20.0.2","TCP","57016 → 4433 [RST, ACK] Seq=576 Ack=704 Win=63616 Len=0 TSval=2182170881 TSecr=2876741810"
"130","10.924350266","74","06:a1:5f:84:e6:1b","f2:2b:14:bb:fa:12","172.20.0.3","172.20.0.2","TCP","57026 → 4433 [SYN] Seq=0 Win=64240 Len=0 MSS=1460 SACK_PERM TSval=2182170892 TSecr=0 WS=128"
"131","10.924383604","74","f2:2b:14:bb:fa:12","06:a1:5f:84:e6:1b","172.20.0.2","172.20.0.3","TCP","4433 → 57026 [SYN, ACK] Seq=0 Ack=1 Win=65160 Len=0 MSS=1460 SACK_PERM TSval=2876741822 TSecr=2182170892 WS=128"
"132","10.924401027","66","06:a1:5f:84:e6:1b","f2:2b:14:bb:fa:12","172.20.0.3","172.20.0.2","TCP","57026 → 4433 [ACK] Seq=1 Ack=1 Win=64256 Len=0 TSval=2182170892 TSecr=2876741822"
"133","10.924439482","561","06:a1:5f:84:e6:1b","f2:2b:14:bb:fa:12","172.20.0.3","172.20.0.2","TLSv1.2","Client Hello"
"134","10.924445335","66","f2:2b:14:bb:fa:12","06:a1:5f:84:e6:1b","172.20.0.2","172.20.0.3","TCP","4433 → 57026 [ACK] Seq=1 Ack=496 Win=64768 Len=0 TSval=2876741822 TSecr=2182170892"
"135","10.924899778","769","f2:2b:14:bb:fa:12","06:a1:5f:84:e6:1b","172.20.0.2","172.20.0.3","TLSv1.3","Server Hello, Change Cipher Spec, Application Data, Application Data, Application Data, Application Data"
"136","10.924929036","66","06:a1:5f:84:e6:1b","f2:2b:14:bb:fa:12","172.20.0.3","172.20.0.2","TCP","57026 → 4433 [ACK] Seq=496 Ack=704 Win=63616 Len=0 TSval=2182170893 TSecr=2876741823"
"137","10.925908451","146","06:a1:5f:84:e6:1b","f2:2b:14:bb:fa:12","172.20.0.3","172.20.0.2","TLSv1.3","Change Cipher Spec, Application Data"
"138","10.925969024","66","06:a1:5f:84:e6:1b","f2:2b:14:bb:fa:12","172.20.0.3","172.20.0.2","TCP","57026 → 4433 [RST, ACK] Seq=576 Ack=704 Win=63616 Len=0 TSval=2182170894 TSecr=2876741823"
"139","10.936326306","74","06:a1:5f:84:e6:1b","f2:2b:14:bb:fa:12","172.20.0.3","172.20.0.2","TCP","57032 → 4433 [SYN] Seq=0 Win=64240 Len=0 MSS=1460 SACK_PERM TSval=2182170904 TSecr=0 WS=128"
"140","10.936347707","74","f2:2b:14:bb:fa:12","06:a1:5f:84:e6:1b","172.20.0.2","172.20.0.3","TCP","4433 → 57032 [SYN, ACK] Seq=0 Ack=1 Win=65160 Len=0 MSS=1460 SACK_PERM TSval=2876741834 TSecr=2182170904 WS=128"
"141","10.936363349","66","06:a1:5f:84:e6:1b","f2:2b:14:bb:fa:12","172.20.0.3","172.20.0.2","TCP","57032 → 4433 [ACK] Seq=1 Ack=1 Win=64256 Len=0 TSval=2182170904 TSecr=2876741834"
"142","10.936402638","561","06:a1:5f:84:e6:1b","f2:2b:14:bb:fa:12","172.20.0.3","172.20.0.2","TLSv1.2","Client Hello"
"143","10.936408010","66","f2:2b:14:bb:fa:12","06:a1:5f:84:e6:1b","172.20.0.2","172.20.0.3","TCP","4433 → 57032 [ACK] Seq=1 Ack=496 Win=64768 Len=0 TSval=2876741834 TSecr=2182170904"
"144","10.936875547","769","f2:2b:14:bb:fa:12","06:a1:5f:84:e6:1b","172.20.0.2","172.20.0.3","TLSv1.3","Server Hello, Change Cipher Spec, Application Data, Application Data, Application Data, Application Data"
"145","10.936902564","66","06:a1:5f:84:e6:1b","f2:2b:14:bb:fa:12","172.20.0.3","172.20.0.2","TCP","57032 → 4433 [ACK] Seq=496 Ack=704 Win=63616 Len=0 TSval=2182170905 TSecr=2876741835"
"146","10.937699769","146","06:a1:5f:84:e6:1b","f2:2b:14:bb:fa:12","172.20.0.3","172.20.0.2","TLSv1.3","Change Cipher Spec, Application Data"
"147","10.937752894","66","06:a1:5f:84:e6:1b","f2:2b:14:bb:fa:12","172.20.0.3","172.20.0.2","TCP","57032 → 4433 [RST, ACK] Seq=576 Ack=704 Win=63616 Len=0 TSval=2182170906 TSecr=2876741835"
"148","10.947821252","74","06:a1:5f:84:e6:1b","f2:2b:14:bb:fa:12","172.20.0.3","172.20.0.2","TCP","57034 → 4433 [SYN] Seq=0 Win=64240 Len=0 MSS=1460 SACK_PERM TSval=2182170916 TSecr=0 WS=128"
"149","10.947843089","74","f2:2b:14:bb:fa:12","06:a1:5f:84:e6:1b","172.20.0.2","172.20.0.3","TCP","4433 → 57034 [SYN, ACK] Seq=0 Ack=1 Win=65160 Len=0 MSS=1460 SACK_PERM TSval=2876741846 TSecr=2182170916 WS=128"
"150","10.947860565","66","06:a1:5f:84:e6:1b","f2:2b:14:bb:fa:12","172.20.0.3","172.20.0.2","TCP","57034 → 4433 [ACK] Seq=1 Ack=1 Win=64256 Len=0 TSval=2182170916 TSecr=2876741846"
"151","10.947898586","561","06:a1:5f:84:e6:1b","f2:2b:14:bb:fa:12","172.20.0.3","172.20.0.2","TLSv1.2","Client Hello"
"152","10.947903269","66","f2:2b:14:bb:fa:12","06:a1:5f:84:e6:1b","172.20.0.2","172.20.0.3","TCP","4433 → 57034 [ACK] Seq=1 Ack=496 Win=64768 Len=0 TSval=2876741846 TSecr=2182170916"
"153","10.948343728","769","f2:2b:14:bb:fa:12","06:a1:5f:84:e6:1b","172.20.0.2","172.20.0.3","TLSv1.3","Server Hello, Change Cipher Spec, Application Data, Application Data, Application Data, Application Data"
"154","10.948369036","66","06:a1:5f:84:e6:1b","f2:2b:14:bb:fa:12","172.20.0.3","172.20.0.2","TCP","57034 → 4433 [ACK] Seq=496 Ack=704 Win=63616 Len=0 TSval=2182170916 TSecr=2876741846"
"155","10.949390500","146","06:a1:5f:84:e6:1b","f2:2b:14:bb:fa:12","172.20.0.3","172.20.0.2","TLSv1.3","Change Cipher Spec, Application Data"
"156","10.949456765","66","06:a1:5f:84:e6:1b","f2:2b:14:bb:fa:12","172.20.0.3","172.20.0.2","TCP","57034 → 4433 [RST, ACK] Seq=576 Ack=704 Win=63616 Len=0 TSval=2182170917 TSecr=2876741846"
"157","10.960771038","74","06:a1:5f:84:e6:1b","f2:2b:14:bb:fa:12","172.20.0.3","172.20.0.2","TCP","57046 → 4433 [SYN] Seq=0 Win=64240 Len=0 MSS=1460 SACK_PERM TSval=2182170929 TSecr=0 WS=128"
"158","10.960791674","74","f2:2b:14:bb:fa:12","06:a1:5f:84:e6:1b","172.20.0.2","172.20.0.3","TCP","4433 → 57046 [SYN, ACK] Seq=0 Ack=1 Win=65160 Len=0 MSS=1460 SACK_PERM TSval=2876741859 TSecr=2182170929 WS=128"
"159","10.960806156","66","06:a1:5f:84:e6:1b","f2:2b:14:bb:fa:12","172.20.0.3","172.20.0.2","TCP","57046 → 4433 [ACK] Seq=1 Ack=1 Win=64256 Len=0 TSval=2182170929 TSecr=2876741859"
"160","10.960838634","561","06:a1:5f:84:e6:1b","f2:2b:14:bb:fa:12","172.20.0.3","172.20.0.2","TLSv1.2","Client Hello"
"161","10.960843626","66","f2:2b:14:bb:fa:12","06:a1:5f:84:e6:1b","172.20.0.2","172.20.0.3","TCP","4433 → 57046 [ACK] Seq=1 Ack=496 Win=64768 Len=0 TSval=2876741859 TSecr=2182170929"
"162","10.961268773","769","f2:2b:14:bb:fa:12","06:a1:5f:84:e6:1b","172.20.0.2","172.20.0.3","TLSv1.3","Server Hello, Change Cipher Spec, Application Data, Application Data, Application Data, Application Data"
"163","10.961297279","66","06:a1:5f:84:e6:1b","f2:2b:14:bb:fa:12","172.20.0.3","172.20.0.2","TCP","57046 → 4433 [ACK] Seq=496 Ack=704 Win=63616 Len=0 TSval=2182170929 TSecr=2876741859"
"164","10.962102460","146","06:a1:5f:84:e6:1b","f2:2b:14:bb:fa:12","172.20.0.3","172.20.0.2","TLSv1.3","Change Cipher Spec, Application Data"
"165","10.962155440","66","06:a1:5f:84:e6:1b","f2:2b:14:bb:fa:12","172.20.0.3","172.20.0.2","TCP","57046 → 4433 [RST, ACK] Seq=576 Ack=704 Win=63616 Len=0 TSval=2182170930 TSecr=2876741859"
"166","10.972160821","74","06:a1:5f:84:e6:1b","f2:2b:14:bb:fa:12","172.20.0.3","172.20.0.2","TCP","57056 → 4433 [SYN] Seq=0 Win=64240 Len=0 MSS=1460 SACK_PERM TSval=2182170940 TSecr=0 WS=128"
"167","10.972182830","74","f2:2b:14:bb:fa:12","06:a1:5f:84:e6:1b","172.20.0.2","172.20.0.3","TCP","4433 → 57056 [SYN, ACK] Seq=0 Ack=1 Win=65160 Len=0 MSS=1460 SACK_PERM TSval=2876741870 TSecr=2182170940 WS=128"
"168","10.972198438","66","06:a1:5f:84:e6:1b","f2:2b:14:bb:fa:12","172.20.0.3","172.20.0.2","TCP","57056 → 4433 [ACK] Seq=1 Ack=1 Win=64256 Len=0 TSval=2182170940 TSecr=2876741870"
"169","10.972235299","561","06:a1:5f:84:e6:1b","f2:2b:14:bb:fa:12","172.20.0.3","172.20.0.2","TLSv1.2","Client Hello"
"170","10.972240929","66","f2:2b:14:bb:fa:12","06:a1:5f:84:e6:1b","172.20.0.2","172.20.0.3","TCP","4433 → 57056 [ACK] Seq=1 Ack=496 Win=64768 Len=0 TSval=2876741870 TSecr=2182170940"
"171","10.972675990","769","f2:2b:14:bb:fa:12","06:a1:5f:84:e6:1b","172.20.0.2","172.20.0.3","TLSv1.3","Server Hello, Change Cipher Spec, Application Data, Application Data, Application Data, Application Data"
"172","10.972699740","66","06:a1:5f:84:e6:1b","f2:2b:14:bb:fa:12","172.20.0.3","172.20.0.2","TCP","57056 → 4433 [ACK] Seq=496 Ack=704 Win=63616 Len=0 TSval=2182170941 TSecr=2876741871"
"173","10.973471099","146","06:a1:5f:84:e6:1b","f2:2b:14:bb:fa:12","172.20.0.3","172.20.0.2","TLSv1.3","Change Cipher Spec, Application Data"
"174","10.973548809","66","06:a1:5f:84:e6:1b","f2:2b:14:bb:fa:12","172.20.0.3","172.20.0.2","TCP","57056 → 4433 [RST, ACK] Seq=576 Ack=704 Win=63616 Len=0 TSval=2182170942 TSecr=2876741871"
"175","10.983850936","74","06:a1:5f:84:e6:1b","f2:2b:14:bb:fa:12","172.20.0.3","172.20.0.2","TCP","57070 → 4433 [SYN] Seq=0 Win=64240 Len=0 MSS=1460 SACK_PERM TSval=2182170952 TSecr=0 WS=128"
"176","10.983880816","74","f2:2b:14:bb:fa:12","06:a1:5f:84:e6:1b","172.20.0.2","172.20.0.3","TCP","4433 → 57070 [SYN, ACK] Seq=0 Ack=1 Win=65160 Len=0 MSS=1460 SACK_PERM TSval=2876741882 TSecr=2182170952 WS=128"
"177","10.983899247","66","06:a1:5f:84:e6:1b","f2:2b:14:bb:fa:12","172.20.0.3","172.20.0.2","TCP","57070 → 4433 [ACK] Seq=1 Ack=1 Win=64256 Len=0 TSval=2182170952 TSecr=2876741882"
"178","10.983938851","561","06:a1:5f:84:e6:1b","f2:2b:14:bb:fa:12","172.20.0.3","172.20.0.2","TLSv1.2","Client Hello"
"179","10.983945049","66","f2:2b:14:bb:fa:12","06:a1:5f:84:e6:1b","172.20.0.2","172.20.0.3","TCP","4433 → 57070 [ACK] Seq=1 Ack=496 Win=64768 Len=0 TSval=2876741882 TSecr=2182170952"
"180","10.984488809","769","f2:2b:14:bb:fa:12","06:a1:5f:84:e6:1b","172.20.0.2","172.20.0.3","TLSv1.3","Server Hello, Change Cipher Spec, Application Data, Application Data, Application Data, Application Data"
"181","10.984521349","66","06:a1:5f:84:e6:1b","f2:2b:14:bb:fa:12","172.20.0.3","172.20.0.2","TCP","57070 → 4433 [ACK] Seq=496 Ack=704 Win=63616 Len=0 TSval=2182170953 TSecr=2876741882"
"182","10.985342230","146","06:a1:5f:84:e6:1b","f2:2b:14:bb:fa:12","172.20.0.3","172.20.0.2","TLSv1.3","Change Cipher Spec, Application Data"
"183","10.985407992","66","06:a1:5f:84:e6:1b","f2:2b:14:bb:fa:12","172.20.0.3","172.20.0.2","TCP","57070 → 4433 [RST, ACK] Seq=576 Ack=704 Win=63616 Len=0 TSval=2182170953 TSecr=2876741882"
"184","10.996146132","74","06:a1:5f:84:e6:1b","f2:2b:14:bb:fa:12","172.20.0.3","172.20.0.2","TCP","57084 → 4433 [SYN] Seq=0 Win=64240 Len=0 MSS=1460 SACK_PERM TSval=2182170964 TSecr=0 WS=128"
"185","10.996172969","74","f2:2b:14:bb:fa:12","06:a1:5f:84:e6:1b","172.20.0.2","172.20.0.3","TCP","4433 → 57084 [SYN, ACK] Seq=0 Ack=1 Win=65160 Len=0 MSS=1460 SACK_PERM TSval=2876741894 TSecr=2182170964 WS=128"
"186","10.996189660","66","06:a1:5f:84:e6:1b","f2:2b:14:bb:fa:12","172.20.0.3","172.20.0.2","TCP","57084 → 4433 [ACK] Seq=1 Ack=1 Win=64256 Len=0 TSval=2182170964 TSecr=2876741894"
"187","10.996230214","561","06:a1:5f:84:e6:1b","f2:2b:14:bb:fa:12","172.20.0.3","172.20.0.2","TLSv1.2","Client Hello"
"188","10.996236301","66","f2:2b:14:bb:fa:12","06:a1:5f:84:e6:1b","172.20.0.2","172.20.0.3","TCP","4433 → 57084 [ACK] Seq=1 Ack=496 Win=64768 Len=0 TSval=2876741894 TSecr=2182170964"
"189","10.996737071","769","f2:2b:14:bb:fa:12","06:a1:5f:84:e6:1b","172.20.0.2","172.20.0.3","TLSv1.3","Server Hello, Change Cipher Spec, Application Data, Application Data, Application Data, Application Data"
"190","10.996763247","66","06:a1:5f:84:e6:1b","f2:2b:14:bb:fa:12","172.20.0.3","172.20.0.2","TCP","57084 → 4433 [ACK] Seq=496 Ack=704 Win=63616 Len=0 TSval=2182170965 TSecr=2876741895"
"191","10.997583866","146","06:a1:5f:84:e6:1b","f2:2b:14:bb:fa:12","172.20.0.3","172.20.0.2","TLSv1.3","Change Cipher Spec, Application Data"
"192","10.997641379","66","06:a1:5f:84:e6:1b","f2:2b:14:bb:fa:12","172.20.0.3","172.20.0.2","TCP","57084 → 4433 [RST, ACK] Seq=576 Ack=704 Win=63616 Len=0 TSval=2182170966 TSecr=2876741895"
"193","11.008113539","74","06:a1:5f:84:e6:1b","f2:2b:14:bb:fa:12","172.20.0.3","172.20.0.2","TCP","57086 → 4433 [SYN] Seq=0 Win=64240 Len=0 MSS=1460 SACK_PERM TSval=2182170976 TSecr=0 WS=128"
"194","11.008141096","74","f2:2b:14:bb:fa:12","06:a1:5f:84:e6:1b","172.20.0.2","172.20.0.3","TCP","4433 → 57086 [SYN, ACK] Seq=0 Ack=1 Win=65160 Len=0 MSS=1460 SACK_PERM TSval=2876741906 TSecr=2182170976 WS=128"
"195","11.008159522","66","06:a1:5f:84:e6:1b","f2:2b:14:bb:fa:12","172.20.0.3","172.20.0.2","TCP","57086 → 4433 [ACK] Seq=1 Ack=1 Win=64256 Len=0 TSval=2182170976 TSecr=2876741906"
"196","11.008207657","561","06:a1:5f:84:e6:1b","f2:2b:14:bb:fa:12","172.20.0.3","172.20.0.2","TLSv1.2","Client Hello"
"197","11.008213788","66","f2:2b:14:bb:fa:12","06:a1:5f:84:e6:1b","172.20.0.2","172.20.0.3","TCP","4433 → 57086 [ACK] Seq=1 Ack=496 Win=64768 Len=0 TSval=2876741906 TSecr=2182170976"
"198","11.008755799","769","f2:2b:14:bb:fa:12","06:a1:5f:84:e6:1b","172.20.0.2","172.20.0.3","TLSv1.3","Server Hello, Change Cipher Spec, Application Data, Application Data, Application Data, Application Data"
"199","11.008781694","66","06:a1:5f:84:e6:1b","f2:2b:14:bb:fa:12","172.20.0.3","172.20.0.2","TCP","57086 → 4433 [ACK] Seq=496 Ack=704 Win=63616 Len=0 TSval=2182170977 TSecr=2876741907"
"200","11.009596176","146","06:a1:5f:84:e6:1b","f2:2b:14:bb:fa:12","172.20.0.3","172.20.0.2","TLSv1.3","Change Cipher Spec, Application Data"
"201","11.009652623","66","06:a1:5f:84:e6:1b","f2:2b:14:bb:fa:12","172.20.0.3","172.20.0.2","TCP","57086 → 4433 [RST, ACK] Seq=576 Ack=704 Win=63616 Len=0 TSval=2182170978 TSecr=2876741907"
"202","11.020088422","74","06:a1:5f:84:e6:1b","f2:2b:14:bb:fa:12","172.20.0.3","172.20.0.2","TCP","57096 → 4433 [SYN] Seq=0 Win=64240 Len=0 MSS=1460 SACK_PERM TSval=2182170988 TSecr=0 WS=128"
"203","11.020112940","74","f2:2b:14:bb:fa:12","06:a1:5f:84:e6:1b","172.20.0.2","172.20.0.3","TCP","4433 → 57096 [SYN, ACK] Seq=0 Ack=1 Win=65160 Len=0 MSS=1460 SACK_PERM TSval=2876741918 TSecr=2182170988 WS=128"
"204","11.020128206","66","06:a1:5f:84:e6:1b","f2:2b:14:bb:fa:12","172.20.0.3","172.20.0.2","TCP","57096 → 4433 [ACK] Seq=1 Ack=1 Win=64256 Len=0 TSval=2182170988 TSecr=2876741918"
"205","11.020163835","561","06:a1:5f:84:e6:1b","f2:2b:14:bb:fa:12","172.20.0.3","172.20.0.2","TLSv1.2","Client Hello"
"206","11.020169131","66","f2:2b:14:bb:fa:12","06:a1:5f:84:e6:1b","172.20.0.2","172.20.0.3","TCP","4433 → 57096 [ACK] Seq=1 Ack=496 Win=64768 Len=0 TSval=2876741918 TSecr=2182170988"
"207","11.020683977","769","f2:2b:14:bb:fa:12","06:a1:5f:84:e6:1b","172.20.0.2","172.20.0.3","TLSv1.3","Server Hello, Change Cipher Spec, Application Data, Application Data, Application Data, Application Data"
"208","11.020710427","66","06:a1:5f:84:e6:1b","f2:2b:14:bb:fa:12","172.20.0.3","172.20.0.2","TCP","57096 → 4433 [ACK] Seq=496 Ack=704 Win=63616 Len=0 TSval=2182170989 TSecr=2876741919"
"209","11.021515220","146","06:a1:5f:84:e6:1b","f2:2b:14:bb:fa:12","172.20.0.3","172.20.0.2","TLSv1.3","Change Cipher Spec, Application Data"
"210","11.021570394","66","06:a1:5f:84:e6:1b","f2:2b:14:bb:fa:12","172.20.0.3","172.20.0.2","TCP","57096 → 4433 [RST, ACK] Seq=576 Ack=704 Win=63616 Len=0 TSval=2182170990 TSecr=2876741919"
"211","11.031762027","74","06:a1:5f:84:e6:1b","f2:2b:14:bb:fa:12","172.20.0.3","172.20.0.2","TCP","57104 → 4433 [SYN] Seq=0 Win=64240 Len=0 MSS=1460 SACK_PERM TSval=2182171000 TSecr=0 WS=128"
"212","11.031783849","74","f2:2b:14:bb:fa:12","06:a1:5f:84:e6:1b","172.20.0.2","172.20.0.3","TCP","4433 → 57104 [SYN, ACK] Seq=0 Ack=1 Win=65160 Len=0 MSS=1460 SACK_PERM TSval=2876741930 TSecr=2182171000 WS=128"
"213","11.031801345","66","06:a1:5f:84:e6:1b","f2:2b:14:bb:fa:12","172.20.0.3","172.20.0.2","TCP","57104 → 4433 [ACK] Seq=1 Ack=1 Win=64256 Len=0 TSval=2182171000 TSecr=2876741930"
"214","11.031836381","561","06:a1:5f:84:e6:1b","f2:2b:14:bb:fa:12","172.20.0.3","172.20.0.2","TLSv1.2","Client Hello"
"215","11.031841995","66","f2:2b:14:bb:fa:12","06:a1:5f:84:e6:1b","172.20.0.2","172.20.0.3","TCP","4433 → 57104 [ACK] Seq=1 Ack=496 Win=64768 Len=0 TSval=2876741930 TSecr=2182171000"
"216","11.032261200","769","f2:2b:14:bb:fa:12","06:a1:5f:84:e6:1b","172.20.0.2","172.20.0.3","TLSv1.3","Server Hello, Change Cipher Spec, Application Data, Application Data, Application Data, Application Data"
"217","11.032287222","66","06:a1:5f:84:e6:1b","f2:2b:14:bb:fa:12","172.20.0.3","172.20.0.2","TCP","57104 → 4433 [ACK] Seq=496 Ack=704 Win=63616 Len=0 TSval=2182171000 TSecr=2876741930"
"218","11.033095097","146","06:a1:5f:84:e6:1b","f2:2b:14:bb:fa:12","172.20.0.3","172.20.0.2","TLSv1.3","Change Cipher Spec, Application Data"
"219","11.033148655","66","06:a1:5f:84:e6:1b","f2:2b:14:bb:fa:12","172.20.0.3","172.20.0.2","TCP","57104 → 4433 [RST, ACK] Seq=576 Ack=704 Win=63616 Len=0 TSval=2182171001 TSecr=2876741930"
"220","11.043220633","74","06:a1:5f:84:e6:1b","f2:2b:14:bb:fa:12","172.20.0.3","172.20.0.2","TCP","57110 → 4433 [SYN] Seq=0 Win=64240 Len=0 MSS=1460 SACK_PERM TSval=2182171011 TSecr=0 WS=128"
"221","11.043242279","74","f2:2b:14:bb:fa:12","06:a1:5f:84:e6:1b","172.20.0.2","172.20.0.3","TCP","4433 → 57110 [SYN, ACK] Seq=0 Ack=1 Win=65160 Len=0 MSS=1460 SACK_PERM TSval=2876741941 TSecr=2182171011 WS=128"
"222","11.043257380","66","06:a1:5f:84:e6:1b","f2:2b:14:bb:fa:12","172.20.0.3","172.20.0.2","TCP","57110 → 4433 [ACK] Seq=1 Ack=1 Win=64256 Len=0 TSval=2182171011 TSecr=2876741941"
