frame.number,frame.time_relative,frame.len,eth.src,eth.dst,ip.src,ip.dst,_ws.col.protocol,_ws.col.info
"1","0.000000000","42","ae:6f:7d:03:61:01","ff:ff:ff:ff:ff:ff",,,"ARP","ARP Announcement for 172.20.0.3"
"2","0.038156292","42","ae:6f:7d:03:61:01","ff:ff:ff:ff:ff:ff",,,"ARP","Who has 172.20.0.2? Tell 172.20.0.3"
"3","0.038182512","42","de:76:69:10:89:1c","ae:6f:7d:03:61:01",,,"ARP","172.20.0.2 is at de:76:69:10:89:1c"
"4","0.038206243","74","ae:6f:7d:03:61:01","de:76:69:10:89:1c","172.20.0.3","172.20.0.2","TCP","56342 → 4433 [SYN] Seq=0 Win=64240 Len=0 MSS=1460 SACK_PERM TSval=2184310517 TSecr=0 WS=128"
"5","0.038230295","74","de:76:69:10:89:1c","ae:6f:7d:03:61:01","172.20.0.2","172.20.0.3","TCP","4433 → 56342 [SYN, ACK] Seq=0 Ack=1 Win=65160 Len=0 MSS=1460 SACK_PERM TSval=2878881448 TSecr=2184310517 WS=128"
"6","0.038257373","66","ae:6f:7d:03:61:01","de:76:69:10:89:1c","172.20.0.3","172.20.0.2","TCP","56342 → 4433 [ACK] Seq=1 Ack=1 Win=64256 Len=0 TSval=2184310518 TSecr=2878881448"
"7","0.038307332","2189","ae:6f:7d:03:61:01","de:76:69:10:89:1c","172.20.0.3","172.20.0.2","TLSv1.2","Client Hello"
"8","0.038314399","66","de:76:69:10:89:1c","ae:6f:7d:03:61:01","172.20.0.2","172.20.0.3","TCP","4433 → 56342 [ACK] Seq=1 Ack=2124 Win=64128 Len=0 TSval=2878881448 TSecr=2184310518"
"9","0.052832668","2679","de:76:69:10:89:1c","ae:6f:7d:03:61:01","172.20.0.2","172.20.0.3","TLSv1.3","Server Hello, Change Cipher Spec, Application Data, Application Data, Application Data, Application Data"
"10","0.052884353","66","ae:6f:7d:03:61:01","de:76:69:10:89:1c","172.20.0.3","172.20.0.2","TCP","56342 → 4433 [ACK] Seq=2124 Ack=2614 Win=64128 Len=0 TSval=2184310532 TSecr=2878881462"
"11","0.062146346","146","ae:6f:7d:03:61:01","de:76:69:10:89:1c","172.20.0.3","172.20.0.2","TLSv1.3","Change Cipher Spec, Application Data"
"12","0.062244172","66","ae:6f:7d:03:61:01","de:76:69:10:89:1c","172.20.0.3","172.20.0.2","TCP","56342 → 4433 [RST, ACK] Seq=2204 Ack=2614 Win=64128 Len=0 TSval=2184310542 TSecr=2878881462"
"13","0.079163328","74","ae:6f:7d:03:61:01","de:76:69:10:89:1c","172.20.0.3","172.20.0.2","TCP","56344 → 4433 [SYN] Seq=0 Win=64240 Len=0 MSS=1460 SACK_PERM TSval=2184310558 TSecr=0 WS=128"
"14","0.079206095","74","de:76:69:10:89:1c","ae:6f:7d:03:61:01","172.20.0.2","172.20.0.3","TCP","4433 → 56344 [SYN, ACK] Seq=0 Ack=1 Win=65160 Len=0 MSS=1460 SACK_PERM TSval=2878881488 TSecr=2184310558 WS=128"
"15","0.079226892","66","ae:6f:7d:03:61:01","de:76:69:10:89:1c","172.20.0.3","172.20.0.2","TCP","56344 → 4433 [ACK] Seq=1 Ack=1 Win=64256 Len=0 TSval=2184310559 TSecr=2878881488"
"16","0.079269834","2189","ae:6f:7d:03:61:01","de:76:69:10:89:1c","172.20.0.3","172.20.0.2","TLSv1.2","Client Hello"
"17","0.079277317","66","de:76:69:10:89:1c","ae:6f:7d:03:61:01","172.20.0.2","172.20.0.3","TCP","4433 → 56344 [ACK] Seq=1 Ack=2124 Win=64128 Len=0 TSval=2878881489 TSecr=2184310559"
"18","0.091150866","2679","de:76:69:10:89:1c","ae:6f:7d:03:61:01","172.20.0.2","172.20.0.3","TLSv1.3","Server Hello, Change Cipher Spec, Application Data, Application Data, Application Data, Application Data"
"19","0.091205045","66","ae:6f:7d:03:61:01","de:76:69:10:89:1c","172.20.0.3","172.20.0.2","TCP","56344 → 4433 [ACK] Seq=2124 Ack=2614 Win=64128 Len=0 TSval=2184310570 TSecr=2878881500"
"20","0.100710082","146","ae:6f:7d:03:61:01","de:76:69:10:89:1c","172.20.0.3","172.20.0.2","TLSv1.3","Change Cipher Spec, Application Data"
"21","0.100776547","66","ae:6f:7d:03:61:01","de:76:69:10:89:1c","172.20.0.3","172.20.0.2","TCP","56344 → 4433 [RST, ACK] Seq=2204 Ack=2614 Win=64128 Len=0 TSval=2184310580 TSecr=2878881500"
"22","0.124148036","74","ae:6f:7d:03:61:01","de:76:69:10:89:1c","172.20.0.3","172.20.0.2","TCP","56356 → 4433 [SYN] Seq=0 Win=64240 Len=0 MSS=1460 SACK_PERM TSval=2184310603 TSecr=0 WS=128"
"23","0.124206305","74","de:76:69:10:89:1c","ae:6f:7d:03:61:01","172.20.0.2","172.20.0.3","TCP","4433 → 56356 [SYN, ACK] Seq=0 Ack=1 Win=65160 Len=0 MSS=1460 SACK_PERM TSval=2878881533 TSecr=2184310603 WS=128"
"24","0.124240378","66","ae:6f:7d:03:61:01","de:76:69:10:89:1c","172.20.0.3","172.20.0.2","TCP","56356 → 4433 [ACK] Seq=1 Ack=1 Win=64256 Len=0 TSval=2184310604 TSecr=2878881533"
"25","0.124312178","2189","ae:6f:7d:03:61:01","de:76:69:10:89:1c","172.20.0.3","172.20.0.2","TLSv1.2","Client Hello"
"26","0.124323343","66","de:76:69:10:89:1c","ae:6f:7d:03:61:01","172.20.0.2","172.20.0.3","TCP","4433 → 56356 [ACK] Seq=1 Ack=2124 Win=64128 Len=0 TSval=2878881534 TSecr=2184310604"
"27","0.136450302","2679","de:76:69:10:89:1c","ae:6f:7d:03:61:01","172.20.0.2","172.20.0.3","TLSv1.3","Server Hello, Change Cipher Spec, Application Data, Application Data, Application Data, Application Data"
"28","0.136497036","66","ae:6f:7d:03:61:01","de:76:69:10:89:1c","172.20.0.3","172.20.0.2","TCP","56356 → 4433 [ACK] Seq=2124 Ack=2614 Win=64128 Len=0 TSval=2184310616 TSecr=2878881546"
"29","0.145609710","146","ae:6f:7d:03:61:01","de:76:69:10:89:1c","172.20.0.3","172.20.0.2","TLSv1.3","Change Cipher Spec, Application Data"
"30","0.145685328","66","ae:6f:7d:03:61:01","de:76:69:10:89:1c","172.20.0.3","172.20.0.2","TCP","56356 → 4433 [RST, ACK] Seq=2204 Ack=2614 Win=64128 Len=0 TSval=2184310625 TSecr=2878881546"
"31","0.162248469","74","ae:6f:7d:03:61:01","de:76:69:10:89:1c","172.20.0.3","172.20.0.2","TCP","56368 → 4433 [SYN] Seq=0 Win=64240 Len=0 MSS=1460 SACK_PERM TSval=2184310642 TSecr=0 WS=128"
"32","1.001152283","42","ae:6f:7d:03:61:01","ff:ff:ff:ff:ff:ff",,,"ARP","ARP Announcement for 172.20.0.3"
"33","1.165248875","74","de:76:69:10:89:1c","ae:6f:7d:03:61:01","172.20.0.2","172.20.0.3","TCP","4433 → 56368 [SYN, ACK] Seq=0 Ack=1 Win=65160 Len=0 MSS=1460 SACK_PERM TSval=2878882575 TSecr=2184310642 WS=128"
"34","1.165263980","74","ae:6f:7d:03:61:01","de:76:69:10:89:1c","172.20.0.3","172.20.0.2","TCP","[TCP Retransmission] 56368 → 4433 [SYN] Seq=0 Win=64240 Len=0 MSS=1460 SACK_PERM TSval=2184311645 TSecr=0 WS=128"
"35","1.165279233","74","de:76:69:10:89:1c","ae:6f:7d:03:61:01","172.20.0.2","172.20.0.3","TCP","[TCP Retransmission] 4433 → 56368 [SYN, ACK] Seq=0 Ack=1 Win=65160 Len=0 MSS=1460 SACK_PERM TSval=2878882575 TSecr=2184310642 WS=128"
"36","1.165311896","66","ae:6f:7d:03:61:01","de:76:69:10:89:1c","172.20.0.3","172.20.0.2","TCP","56368 → 4433 [ACK] Seq=1 Ack=1 Win=64256 Len=0 TSval=2184311645 TSecr=2878882575"
"37","1.165343819","66","ae:6f:7d:03:61:01","de:76:69:10:89:1c","172.20.0.3","172.20.0.2","TCP","[TCP Dup ACK 36#1] 56368 → 4433 [ACK] Seq=1 Ack=1 Win=64256 Len=0 TSval=2184311645 TSecr=2878882575"
"38","1.165395798","2189","ae:6f:7d:03:61:01","de:76:69:10:89:1c","172.20.0.3","172.20.0.2","TLSv1.2","Client Hello"
"39","1.165403580","66","de:76:69:10:89:1c","ae:6f:7d:03:61:01","172.20.0.2","172.20.0.3","TCP","4433 → 56368 [ACK] Seq=1 Ack=2124 Win=64128 Len=0 TSval=2878882575 TSecr=2184311645"
"40","1.177324544","1514","de:76:69:10:89:1c","ae:6f:7d:03:61:01","172.20.0.2","172.20.0.3","SSL",""
"41","1.177355544","66","ae:6f:7d:03:61:01","de:76:69:10:89:1c","172.20.0.3","172.20.0.2","TCP","56368 → 4433 [ACK] Seq=2124 Ack=1449 Win=64128 Len=0 TSval=2184311657 TSecr=2878882587"
"42","1.177364338","1230","de:76:69:10:89:1c","ae:6f:7d:03:61:01","172.20.0.2","172.20.0.3","TLSv1.3","Server Hello, Change Cipher Spec, Application Data, Application Data, Application Data, Application Data"
"43","1.177370089","66","ae:6f:7d:03:61:01","de:76:69:10:89:1c","172.20.0.3","172.20.0.2","TCP","56368 → 4433 [ACK] Seq=2124 Ack=2613 Win=64128 Len=0 TSval=2184311657 TSecr=2878882587"
"44","1.186351141","146","ae:6f:7d:03:61:01","de:76:69:10:89:1c","172.20.0.3","172.20.0.2","TLSv1.3","Change Cipher Spec, Application Data"
"45","1.186412970","66","ae:6f:7d:03:61:01","de:76:69:10:89:1c","172.20.0.3","172.20.0.2","TCP","56368 → 4433 [RST, ACK] Seq=2204 Ack=2613 Win=64128 Len=0 TSval=2184311666 TSecr=2878882587"
"46","1.203125162","74","ae:6f:7d:03:61:01","de:76:69:10:89:1c","172.20.0.3","172.20.0.2","TCP","56370 → 4433 [SYN] Seq=0 Win=64240 Len=0 MSS=1460 SACK_PERM TSval=2184311682 TSecr=0 WS=128"
"47","1.203154037","74","de:76:69:10:89:1c","ae:6f:7d:03:61:01","172.20.0.2","172.20.0.3","TCP","4433 → 56370 [SYN, ACK] Seq=0 Ack=1 Win=65160 Len=0 MSS=1460 SACK_PERM TSval=2878882612 TSecr=2184311682 WS=128"
"48","1.203172747","66","ae:6f:7d:03:61:01","de:76:69:10:89:1c","172.20.0.3","172.20.0.2","TCP","56370 → 4433 [ACK] Seq=1 Ack=1 Win=64256 Len=0 TSval=2184311682 TSecr=2878882612"
"49","1.203248888","2189","ae:6f:7d:03:61:01","de:76:69:10:89:1c","172.20.0.3","172.20.0.2","TLSv1.2","Client Hello"
"50","1.203255835","66","de:76:69:10:89:1c","ae:6f:7d:03:61:01","172.20.0.2","172.20.0.3","TCP","4433 → 56370 [ACK] Seq=1 Ack=2124 Win=64128 Len=0 TSval=2878882613 TSecr=2184311683"
"51","1.214891197","2679","de:76:69:10:89:1c","ae:6f:7d:03:61:01","172.20.0.2","172.20.0.3","TLSv1.3","Server Hello, Change Cipher Spec, Application Data, Application Data, Application Data, Application Data"
"52","1.214920110","66","ae:6f:7d:03:61:01","de:76:69:10:89:1c","172.20.0.3","172.20.0.2","TCP","56370 → 4433 [ACK] Seq=2124 Ack=2614 Win=64128 Len=0 TSval=2184311694 TSecr=2878882624"
"53","1.223746823","146","ae:6f:7d:03:61:01","de:76:69:10:89:1c","172.20.0.3","172.20.0.2","TLSv1.3","Change Cipher Spec, Application Data"
"54","1.223816960","66","ae:6f:7d:03:61:01","de:76:69:10:89:1c","172.20.0.3","172.20.0.2","TCP","56370 → 4433 [RST, ACK] Seq=2204 Ack=2614 Win=64128 Len=0 TSval=2184311703 TSecr=2878882624"
"55","1.240651825","74","ae:6f:7d:03:61:01","de:76:69:10:89:1c","172.20.0.3","172.20.0.2","TCP","56372 → 4433 [SYN] Seq=0 Win=64240 Len=0 MSS=1460 SACK_PERM TSval=2184311720 TSecr=0 WS=128"
"56","1.240680241","74","de:76:69:10:89:1c","ae:6f:7d:03:61:01","172.20.0.2","172.20.0.3","TCP","4433 → 56372 [SYN, ACK] Seq=0 Ack=1 Win=65160 Len=0 MSS=1460 SACK_PERM TSval=2878882650 TSecr=2184311720 WS=128"
"57","1.240699405","66","ae:6f:7d:03:61:01","de:76:69:10:89:1c","172.20.0.3","172.20.0.2","TCP","56372 → 4433 [ACK] Seq=1 Ack=1 Win=64256 Len=0 TSval=2184311720 TSecr=2878882650"
"58","1.240743216","2189","ae:6f:7d:03:61:01","de:76:69:10:89:1c","172.20.0.3","172.20.0.2","TLSv1.2","Client Hello"
"59","1.240751148","66","de:76:69:10:89:1c","ae:6f:7d:03:61:01","172.20.0.2","172.20.0.3","TCP","4433 → 56372 [ACK] Seq=1 Ack=2124 Win=64128 Len=0 TSval=2878882650 TSecr=2184311720"
"60","1.257424693","2679","de:76:69:10:89:1c","ae:6f:7d:03:61:01","172.20.0.2","172.20.0.3","TLSv1.3","Server Hello, Change Cipher Spec, Application Data, Application Data, Application Data, Application Data"
"61","1.257459320","66","ae:6f:7d:03:61:01","de:76:69:10:89:1c","172.20.0.3","172.20.0.2","TCP","56372 → 4433 [ACK] Seq=2124 Ack=2614 Win=64128 Len=0 TSval=2184311737 TSecr=2878882667"
"62","1.266453798","146","ae:6f:7d:03:61:01","de:76:69:10:89:1c","172.20.0.3","172.20.0.2","TLSv1.3","Change Cipher Spec, Application Data"
"63","1.266521377","66","ae:6f:7d:03:61:01","de:76:69:10:89:1c","172.20.0.3","172.20.0.2","TCP","56372 → 4433 [RST, ACK] Seq=2204 Ack=2614 Win=64128 Len=0 TSval=2184311746 TSecr=2878882667"
"64","1.282836593","74","ae:6f:7d:03:61:01","de:76:69:10:89:1c","172.20.0.3","172.20.0.2","TCP","56380 → 4433 [SYN] Seq=0 Win=64240 Len=0 MSS=1460 SACK_PERM TSval=2184311762 TSecr=0 WS=128"
"65","1.282860392","74","de:76:69:10:89:1c","ae:6f:7d:03:61:01","172.20.0.2","172.20.0.3","TCP","4433 → 56380 [SYN, ACK] Seq=0 Ack=1 Win=65160 Len=0 MSS=1460 SACK_PERM TSval=2878882692 TSecr=2184311762 WS=128"
"66","1.282876687","66","ae:6f:7d:03:61:01","de:76:69:10:89:1c","172.20.0.3","172.20.0.2","TCP","56380 → 4433 [ACK] Seq=1 Ack=1 Win=64256 Len=0 TSval=2184311762 TSecr=2878882692"
"67","1.282923762","2189","ae:6f:7d:03:61:01","de:76:69:10:89:1c","172.20.0.3","172.20.0.2","TLSv1.2","Client Hello"
"68","1.282930563","66","de:76:69:10:89:1c","ae:6f:7d:03:61:01","172.20.0.2","172.20.0.3","TCP","4433 → 56380 [ACK] Seq=1 Ack=2124 Win=64128 Len=0 TSval=2878882692 TSecr=2184311762"
"69","1.299215718","1231","de:76:69:10:89:1c","ae:6f:7d:03:61:01","172.20.0.2","172.20.0.3","SSL","[TCP Previous segment not captured] , Continuation Data"
"70","1.299237766","78","ae:6f:7d:03:61:01","de:76:69:10:89:1c","172.20.0.3","172.20.0.2","TCP","[TCP Dup ACK 66#1] 56380 → 4433 [ACK] Seq=2124 Ack=1 Win=64256 Len=0 TSval=2184311779 TSecr=2878882692 SLE=1449 SRE=2614"
"71","1.299247666","1514","de:76:69:10:89:1c","ae:6f:7d:03:61:01","172.20.0.2","172.20.0.3","TCP","[TCP Out-Of-Order] 4433 → 56380 [ACK] Seq=1 Ack=2124 Win=64128 Len=1448 TSval=2878882709 TSecr=2184311779"
"72","1.299261600","66","ae:6f:7d:03:61:01","de:76:69:10:89:1c","172.20.0.3","172.20.0.2","TCP","56380 → 4433 [ACK] Seq=2124 Ack=2614 Win=64128 Len=0 TSval=2184311779 TSecr=2878882709"
"73","1.308104655","146","ae:6f:7d:03:61:01","de:76:69:10:89:1c","172.20.0.3","172.20.0.2","TLSv1.2","Change Cipher Spec, Application Data"
"74","1.308172169","66","ae:6f:7d:03:61:01","de:76:69:10:89:1c","172.20.0.3","172.20.0.2","TCP","56380 → 4433 [RST, ACK] Seq=2204 Ack=2614 Win=64128 Len=0 TSval=2184311787 TSecr=2878882709"
"75","1.324477098","74","ae:6f:7d:03:61:01","de:76:69:10:89:1c","172.20.0.3","172.20.0.2","TCP","56386 → 4433 [SYN] Seq=0 Win=64240 Len=0 MSS=1460 SACK_PERM TSval=2184311804 TSecr=0 WS=128"
"76","1.324503678","74","de:76:69:10:89:1c","ae:6f:7d:03:61:01","172.20.0.2","172.20.0.3","TCP","4433 → 56386 [SYN, ACK] Seq=0 Ack=1 Win=65160 Len=0 MSS=1460 SACK_PERM TSval=2878882734 TSecr=2184311804 WS=128"
"77","1.324521918","66","ae:6f:7d:03:61:01","de:76:69:10:89:1c","172.20.0.3","172.20.0.2","TCP","56386 → 4433 [ACK] Seq=1 Ack=1 Win=64256 Len=0 TSval=2184311804 TSecr=2878882734"
"78","1.324565326","2189","ae:6f:7d:03:61:01","de:76:69:10:89:1c","172.20.0.3","172.20.0.2","TLSv1.2","Client Hello"
"79","1.324571253","66","de:76:69:10:89:1c","ae:6f:7d:03:61:01","172.20.0.2","172.20.0.3","TCP","4433 → 56386 [ACK] Seq=1 Ack=2124 Win=64128 Len=0 TSval=2878882734 TSecr=2184311804"
"80","1.336217861","2678","de:76:69:10:89:1c","ae:6f:7d:03:61:01","172.20.0.2","172.20.0.3","TLSv1.3","Server Hello, Change Cipher Spec, Application Data, Application Data, Application Data, Application Data"
"81","1.336245170","66","ae:6f:7d:03:61:01","de:76:69:10:89:1c","172.20.0.3","172.20.0.2","TCP","56386 → 4433 [ACK] Seq=2124 Ack=2613 Win=64128 Len=0 TSval=2184311816 TSecr=2878882746"
"82","1.345262965","146","ae:6f:7d:03:61:01","de:76:69:10:89:1c","172.20.0.3","172.20.0.2","TLSv1.3","Change Cipher Spec, Application Data"
"83","1.345347305","66","ae:6f:7d:03:61:01","de:76:69:10:89:1c","172.20.0.3","172.20.0.2","TCP","56386 → 4433 [RST, ACK] Seq=2204 Ack=2613 Win=64128 Len=0 TSval=2184311825 TSecr=2878882746"
"84","1.362327907","74","ae:6f:7d:03:61:01","de:76:69:10:89:1c","172.20.0.3","172.20.0.2","TCP","56390 → 4433 [SYN] Seq=0 Win=64240 Len=0 MSS=1460 SACK_PERM TSval=2184311842 TSecr=0 WS=128"
"85","1.362355285","74","de:76:69:10:89:1c","ae:6f:7d:03:61:01","172.20.0.2","172.20.0.3","TCP","4433 → 56390 [SYN, ACK] Seq=0 Ack=1 Win=65160 Len=0 MSS=1460 SACK_PERM TSval=2878882772 TSecr=2184311842 WS=128"
"86","1.362374360","66","ae:6f:7d:03:61:01","de:76:69:10:89:1c","172.20.0.3","172.20.0.2","TCP","56390 → 4433 [ACK] Seq=1 Ack=1 Win=64256 Len=0 TSval=2184311842 TSecr=2878882772"
"87","1.362415675","2189","ae:6f:7d:03:61:01","de:76:69:10:89:1c","172.20.0.3","172.20.0.2","TLSv1.2","Client Hello"
"88","1.362422918","66","de:76:69:10:89:1c","ae:6f:7d:03:61:01","172.20.0.2","172.20.0.3","TCP","4433 → 56390 [ACK] Seq=1 Ack=2124 Win=64128 Len=0 TSval=2878882772 TSecr=2184311842"
"89","1.374103276","2677","de:76:69:10:89:1c","ae:6f:7d:03:61:01","172.20.0.2","172.20.0.3","TLSv1.3","Server Hello, Change Cipher Spec, Application Data, Application Data, Application Data, Application Data"
"90","1.374134377","66","ae:6f:7d:03:61:01","de:76:69:10:89:1c","172.20.0.3","172.20.0.2","TCP","56390 → 4433 [ACK] Seq=2124 Ack=2612 Win=64128 Len=0 TSval=2184311853 TSecr=2878882783"
"91","1.383105948","146","ae:6f:7d:03:61:01","de:76:69:10:89:1c","172.20.0.3","172.20.0.2","TLSv1.3","Change Cipher Spec, Application Data"
"92","1.383166274","66","ae:6f:7d:03:61:01","de:76:69:10:89:1c","172.20.0.3","172.20.0.2","TCP","56390 → 4433 [RST, ACK] Seq=2204 Ack=2612 Win=64128 Len=0 TSval=2184311862 TSecr=2878882783"
"93","1.399256718","74","ae:6f:7d:03:61:01","de:76:69:10:89:1c","172.20.0.3","172.20.0.2","TCP","56394 → 4433 [SYN] Seq=0 Win=64240 Len=0 MSS=1460 SACK_PERM TSval=2184311879 TSecr=0 WS=128"
"94","1.399280477","74","de:76:69:10:89:1c","ae:6f:7d:03:61:01","172.20.0.2","172.20.0.3","TCP","4433 → 56394 [SYN, ACK] Seq=0 Ack=1 Win=65160 Len=0 MSS=1460 SACK_PERM TSval=2878882809 TSecr=2184311879 WS=128"
"95","1.399295531","66","ae:6f:7d:03:61:01","de:76:69:10:89:1c","172.20.0.3","172.20.0.2","TCP","56394 → 4433 [ACK] Seq=1 Ack=1 Win=64256 Len=0 TSval=2184311879 TSecr=2878882809"
"96","1.399334030","2189","ae:6f:7d:03:61:01","de:76:69:10:89:1c","172.20.0.3","172.20.0.2","TLSv1.2","Client Hello"
"97","1.399340013","66","de:76:69:10:89:1c","ae:6f:7d:03:61:01","172.20.0.2","172.20.0.3","TCP","4433 → 56394 [ACK] Seq=1 Ack=2124 Win=64128 Len=0 TSval=2878882809 TSecr=2184311879"
"98","1.410950835","2679","de:76:69:10:89:1c","ae:6f:7d:03:61:01","172.20.0.2","172.20.0.3","TLSv1.3","Server Hello, Change Cipher Spec, Application Data, Application Data, Application Data, Application Data"
"99","1.410981320","66","ae:6f:7d:03:61:01","de:76:69:10:89:1c","172.20.0.3","172.20.0.2","TCP","56394 → 4433 [ACK] Seq=2124 Ack=2614 Win=64128 Len=0 TSval=2184311890 TSecr=2878882820"
"100","1.419704221","146","ae:6f:7d:03:61:01","de:76:69:10:89:1c","172.20.0.3","172.20.0.2","TLSv1.3","Change Cipher Spec, Application Data"
"101","1.419761178","66","ae:6f:7d:03:61:01","de:76:69:10:89:1c","172.20.0.3","172.20.0.2","TCP","56394 → 4433 [RST, ACK] Seq=2204 Ack=2614 Win=64128 Len=0 TSval=2184311899 TSecr=2878882820"
"102","1.436222317","74","ae:6f:7d:03:61:01","de:76:69:10:89:1c","172.20.0.3","172.20.0.2","TCP","56410 → 4433 [SYN] Seq=0 Win=64240 Len=0 MSS=1460 SACK_PERM TSval=2184311915 TSecr=0 WS=128"
"103","1.436245736","74","de:76:69:10:89:1c","ae:6f:7d:03:61:01","172.20.0.2","172.20.0.3","TCP","4433 → 56410 [SYN, ACK] Seq=0 Ack=1 Win=65160 Len=0 MSS=1460 SACK_PERM TSval=2878882846 TSecr=2184311915 WS=128"
"104","1.436261609","66","ae:6f:7d:03:61:01","de:76:69:10:89:1c","172.20.0.3","172.20.0.2","TCP","56410 → 4433 [ACK] Seq=1 Ack=1 Win=64256 Len=0 TSval=2184311916 TSecr=2878882846"
"105","1.436304319","2189","ae:6f:7d:03:61:01","de:76:69:10:89:1c","172.20.0.3","172.20.0.2","TLSv1.2","Client Hello"
"106","1.436311124","66","de:76:69:10:89:1c","ae:6f:7d:03:61:01","172.20.0.2","172.20.0.3","TCP","4433 → 56410 [ACK] Seq=1 Ack=2124 Win=64128 Len=0 TSval=2878882846 TSecr=2184311916"
"107","1.452209684","1231","de:76:69:10:89:1c","ae:6f:7d:03:61:01","172.20.0.2","172.20.0.3","SSL","[TCP Previous segment not captured] , Continuation Data"
"108","1.452243961","78","ae:6f:7d:03:61:01","de:76:69:10:89:1c","172.20.0.3","172.20.0.2","TCP","[TCP Dup ACK 104#1] 56410 → 4433 [ACK] Seq=2124 Ack=1 Win=64256 Len=0 TSval=2184311932 TSecr=2878882846 SLE=1449 SRE=2614"
"109","1.452254831","1514","de:76:69:10:89:1c","ae:6f:7d:03:61:01","172.20.0.2","172.20.0.3","TCP","[TCP Retransmission] 4433 → 56410 [ACK] Seq=1 Ack=2124 Win=64128 Len=1448 TSval=2878882862 TSecr=2184311932"
"110","1.452273288","66","ae:6f:7d:03:61:01","de:76:69:10:89:1c","172.20.0.3","172.20.0.2","TCP","56410 → 4433 [ACK] Seq=2124 Ack=2614 Win=64128 Len=0 TSval=2184311932 TSecr=2878882862"
"111","1.461285888","146","ae:6f:7d:03:61:01","de:76:69:10:89:1c","172.20.0.3","172.20.0.2","TLSv1.2","Change Cipher Spec, Application Data"
"112","1.461348894","66","ae:6f:7d:03:61:01","de:76:69:10:89:1c","172.20.0.3","172.20.0.2","TCP","56410 → 4433 [RST, ACK] Seq=2204 Ack=2614 Win=64128 Len=0 TSval=2184311941 TSecr=2878882862"
"113","1.477451596","74","ae:6f:7d:03:61:01","de:76:69:10:89:1c","172.20.0.3","172.20.0.2","TCP","56420 → 4433 [SYN] Seq=0 Win=64240 Len=0 MSS=1460 SACK_PERM TSval=2184311957 TSecr=0 WS=128"
"114","1.477474681","74","de:76:69:10:89:1c","ae:6f:7d:03:61:01","172.20.0.2","172.20.0.3","TCP","4433 → 56420 [SYN, ACK] Seq=0 Ack=1 Win=65160 Len=0 MSS=1460 SACK_PERM TSval=2878882887 TSecr=2184311957 WS=128"
"115","1.477490711","66","ae:6f:7d:03:61:01","de:76:69:10:89:1c","172.20.0.3","172.20.0.2","TCP","56420 → 4433 [ACK] Seq=1 Ack=1 Win=64256 Len=0 TSval=2184311957 TSecr=2878882887"
"116","1.477529662","2189","ae:6f:7d:03:61:01","de:76:69:10:89:1c","172.20.0.3","172.20.0.2","TLSv1.2","Client Hello"
"117","1.477536020","66","de:76:69:10:89:1c","ae:6f:7d:03:61:01","172.20.0.2","172.20.0.3","TCP","4433 → 56420 [ACK] Seq=1 Ack=2124 Win=64128 Len=0 TSval=2878882887 TSecr=2184311957"
"118","1.489248828","2679","de:76:69:10:89:1c","ae:6f:7d:03:61:01","172.20.0.2","172.20.0.3","TLSv1.3","Server Hello, Change Cipher Spec, Application Data, Application Data, Application Data, Application Data"
"119","1.489273709","66","ae:6f:7d:03:61:01","de:76:69:10:89:1c","172.20.0.3","172.20.0.2","TCP","56420 → 4433 [ACK] Seq=2124 Ack=2614 Win=64128 Len=0 TSval=2184311969 TSecr=2878882899"
"120","1.498070925","146","ae:6f:7d:03:61:01","de:76:69:10:89:1c","172.20.0.3","172.20.0.2","TLSv1.3","Change Cipher Spec, Application Data"
"121","1.498135221","66","ae:6f:7d:03:61:01","de:76:69:10:89:1c","172.20.0.3","172.20.0.2","TCP","56420 → 4433 [RST, ACK] Seq=2204 Ack=2614 Win=64128 Len=0 TSval=2184311977 TSecr=2878882899"
"122","1.519224260","74","ae:6f:7d:03:61:01","de:76:69:10:89:1c","172.20.0.3","172.20.0.2","TCP","56428 → 4433 [SYN] Seq=0 Win=64240 Len=0 MSS=1460 SACK_PERM TSval=2184311998 TSecr=0 WS=128"
"123","1.519252718","74","de:76:69:10:89:1c","ae:6f:7d:03:61:01","172.20.0.2","172.20.0.3","TCP","4433 → 56428 [SYN, ACK] Seq=0 Ack=1 Win=65160 Len=0 MSS=1460 SACK_PERM TSval=2878882929 TSecr=2184311998 WS=128"
"124","1.519274207","66","ae:6f:7d:03:61:01","de:76:69:10:89:1c","172.20.0.3","172.20.0.2","TCP","56428 → 4433 [ACK] Seq=1 Ack=1 Win=64256 Len=0 TSval=2184311999 TSecr=2878882929"
"125","1.519323670","2189","ae:6f:7d:03:61:01","de:76:69:10:89:1c","172.20.0.3","172.20.0.2","TLSv1.2","Client Hello"
"126","1.519330791","66","de:76:69:10:89:1c","ae:6f:7d:03:61:01","172.20.0.2","172.20.0.3","TCP","4433 → 56428 [ACK] Seq=1 Ack=2124 Win=64128 Len=0 TSval=2878882929 TSecr=2184311999"
"127","1.530923568","2678","de:76:69:10:89:1c","ae:6f:7d:03:61:01","172.20.0.2","172.20.0.3","TLSv1.3","Server Hello, Change Cipher Spec, Application Data, Application Data, Application Data, Application Data"
"128","1.530958373","66","ae:6f:7d:03:61:01","de:76:69:10:89:1c","172.20.0.3","172.20.0.2","TCP","56428 → 4433 [ACK] Seq=2124 Ack=2613 Win=64128 Len=0 TSval=2184312010 TSecr=2878882940"
"129","1.540771925","146","ae:6f:7d:03:61:01","de:76:69:10:89:1c","172.20.0.3","172.20.0.2","TLSv1.3","Change Cipher Spec, Application Data"
"130","1.540881416","66","ae:6f:7d:03:61:01","de:76:69:10:89:1c","172.20.0.3","172.20.0.2","TCP","56428 → 4433 [RST, ACK] Seq=2204 Ack=2613 Win=64128 Len=0 TSval=2184312020 TSecr=2878882940"
"131","1.558855085","74","ae:6f:7d:03:61:01","de:76:69:10:89:1c","172.20.0.3","172.20.0.2","TCP","56438 → 4433 [SYN] Seq=0 Win=64240 Len=0 MSS=1460 SACK_PERM TSval=2184312038 TSecr=0 WS=128"
"132","1.558884360","74","de:76:69:10:89:1c","ae:6f:7d:03:61:01","172.20.0.2","172.20.0.3","TCP","4433 → 56438 [SYN, ACK] Seq=0 Ack=1 Win=65160 Len=0 MSS=1460 SACK_PERM TSval=2878882968 TSecr=2184312038 WS=128"
"133","1.558903722","66","ae:6f:7d:03:61:01","de:76:69:10:89:1c","172.20.0.3","172.20.0.2","TCP","56438 → 4433 [ACK] Seq=1 Ack=1 Win=64256 Len=0 TSval=2184312038 TSecr=2878882968"
"134","1.558950734","2189","ae:6f:7d:03:61:01","de:76:69:10:89:1c","172.20.0.3","172.20.0.2","TLSv1.2","Client Hello"
"135","1.558957096","66","de:76:69:10:89:1c","ae:6f:7d:03:61:01","172.20.0.2","172.20.0.3","TCP","4433 → 56438 [ACK] Seq=1 Ack=2124 Win=64128 Len=0 TSval=2878882968 TSecr=2184312038"
"136","1.570753817","2679","de:76:69:10:89:1c","ae:6f:7d:03:61:01","172.20.0.2","172.20.0.3","TLSv1.3","Server Hello, Change Cipher Spec, Application Data, Application Data, Application Data, Application Data"
"137","1.570794064","66","ae:6f:7d:03:61:01","de:76:69:10:89:1c","172.20.0.3","172.20.0.2","TCP","56438 → 4433 [ACK] Seq=2124 Ack=2614 Win=64128 Len=0 TSval=2184312050 TSecr=2878882980"
"138","1.579856239","146","ae:6f:7d:03:61:01","de:76:69:10:89:1c","172.20.0.3","172.20.0.2","TLSv1.3","Change Cipher Spec, Application Data"
"139","1.579928764","66","ae:6f:7d:03:61:01","de:76:69:10:89:1c","172.20.0.3","172.20.0.2","TCP","56438 → 4433 [RST, ACK] Seq=2204 Ack=2614 Win=64128 Len=0 TSval=2184312059 TSecr=2878882980"
"140","1.596429223","74","ae:6f:7d:03:61:01","de:76:69:10:89:1c","172.20.0.3","172.20.0.2","TCP","56446 → 4433 [SYN] Seq=0 Win=64240 Len=0 MSS=1460 SACK_PERM TSval=2184312076 TSecr=0 WS=128"
"141","1.596462902","74","de:76:69:10:89:1c","ae:6f:7d:03:61:01","172.20.0.2","172.20.0.3","TCP","4433 → 56446 [SYN, ACK] Seq=0 Ack=1 Win=65160 Len=0 MSS=1460 SACK_PERM TSval=2878883006 TSecr=2184312076 WS=128"
"142","1.596481068","66","ae:6f:7d:03:61:01","de:76:69:10:89:1c","172.20.0.3","172.20.0.2","TCP","56446 → 4433 [ACK] Seq=1 Ack=1 Win=64256 Len=0 TSval=2184312076 TSecr=2878883006"
"143","1.596525768","2189","ae:6f:7d:03:61:01","de:76:69:10:89:1c","172.20.0.3","172.20.0.2","TLSv1.2","Client Hello"
"144","1.596532021","66","de:76:69:10:89:1c","ae:6f:7d:03:61:01","172.20.0.2","172.20.0.3","TCP","4433 → 56446 [ACK] Seq=1 Ack=2124 Win=64128 Len=0 TSval=2878883006 TSecr=2184312076"
"145","1.608171536","2679","de:76:69:10:89:1c","ae:6f:7d:03:61:01","172.20.0.2","172.20.0.3","TLSv1.3","Server Hello, Change Cipher Spec, Application Data, Application Data, Application Data, Application Data"
"146","1.608224368","66","ae:6f:7d:03:61:01","de:76:69:10:89:1c","172.20.0.3","172.20.0.2","TCP","56446 → 4433 [ACK] Seq=2124 Ack=2614 Win=64128 Len=0 TSval=2184312088 TSecr=2878883017"
"147","1.617165746","146","ae:6f:7d:03:61:01","de:76:69:10:89:1c","172.20.0.3","172.20.0.2","TLSv1.3","Change Cipher Spec, Application Data"
"148","1.617251748","66","ae:6f:7d:03:61:01","de:76:69:10:89:1c","172.20.0.3","172.20.0.2","TCP","56446 → 4433 [RST, ACK] Seq=2204 Ack=2614 Win=64128 Len=0 TSval=2184312097 TSecr=2878883017"
"149","1.633264155","74","ae:6f:7d:03:61:01","de:76:69:10:89:1c","172.20.0.3","172.20.0.2","TCP","56450 → 4433 [SYN] Seq=0 Win=64240 Len=0 MSS=1460 SACK_PERM TSval=2184312113 TSecr=0 WS=128"
"150","1.633287447","74","de:76:69:10:89:1c","ae:6f:7d:03:61:01","172.20.0.2","172.20.0.3","TCP","4433 → 56450 [SYN, ACK] Seq=0 Ack=1 Win=65160 Len=0 MSS=1460 SACK_PERM TSval=2878883043 TSecr=2184312113 WS=128"
"151","1.633302819","66","ae:6f:7d:03:61:01","de:76:69:10:89:1c","172.20.0.3","172.20.0.2","TCP","56450 → 4433 [ACK] Seq=1 Ack=1 Win=64256 Len=0 TSval=2184312113 TSecr=2878883043"
"152","1.633341360","2189","ae:6f:7d:03:61:01","de:76:69:10:89:1c","172.20.0.3","172.20.0.2","TLSv1.2","Client Hello"
"153","1.633346863","66","de:76:69:10:89:1c","ae:6f:7d:03:61:01","172.20.0.2","172.20.0.3","TCP","4433 → 56450 [ACK] Seq=1 Ack=2124 Win=64128 Len=0 TSval=2878883043 TSecr=2184312113"
"154","1.644944253","2679","de:76:69:10:89:1c","ae:6f:7d:03:61:01","172.20.0.2","172.20.0.3","TLSv1.3","Server Hello, Change Cipher Spec, Application Data, Application Data, Application Data, Application Data"
"155","1.644974614","66","ae:6f:7d:03:61:01","de:76:69:10:89:1c","172.20.0.3","172.20.0.2","TCP","56450 → 4433 [ACK] Seq=2124 Ack=2614 Win=64128 Len=0 TSval=2184312124 TSecr=2878883054"
"156","1.653884211","146","ae:6f:7d:03:61:01","de:76:69:10:89:1c","172.20.0.3","172.20.0.2","TLSv1.3","Change Cipher Spec, Application Data"
"157","1.653945171","66","ae:6f:7d:03:61:01","de:76:69:10:89:1c","172.20.0.3","172.20.0.2","TCP","56450 → 4433 [RST, ACK] Seq=2204 Ack=2614 Win=64128 Len=0 TSval=2184312133 TSecr=2878883054"
"158","1.670385504","74","ae:6f:7d:03:61:01","de:76:69:10:89:1c","172.20.0.3","172.20.0.2","TCP","56458 → 4433 [SYN] Seq=0 Win=64240 Len=0 MSS=1460 SACK_PERM TSval=2184312150 TSecr=0 WS=128"
"159","1.670408753","74","de:76:69:10:89:1c","ae:6f:7d:03:61:01","172.20.0.2","172.20.0.3","TCP","4433 → 56458 [SYN, ACK] Seq=0 Ack=1 Win=65160 Len=0 MSS=1460 SACK_PERM TSval=2878883080 TSecr=2184312150 WS=128"
"160","1.670424384","66","ae:6f:7d:03:61:01","de:76:69:10:89:1c","172.20.0.3","172.20.0.2","TCP","56458 → 4433 [ACK] Seq=1 Ack=1 Win=64256 Len=0 TSval=2184312150 TSecr=2878883080"
"161","1.670465181","2189","ae:6f:7d:03:61:01","de:76:69:10:89:1c","172.20.0.3","172.20.0.2","TLSv1.2","Client Hello"
"162","1.670470773","66","de:76:69:10:89:1c","ae:6f:7d:03:61:01","172.20.0.2","172.20.0.3","TCP","4433 → 56458 [ACK] Seq=1 Ack=2124 Win=64128 Len=0 TSval=2878883080 TSecr=2184312150"
"163","1.682224941","2679","de:76:69:10:89:1c","ae:6f:7d:03:61:01","172.20.0.2","172.20.0.3","TLSv1.3","Server Hello, Change Cipher Spec, Application Data, Application Data, Application Data, Application Data"
"164","1.682253250","66","ae:6f:7d:03:61:01","de:76:69:10:89:1c","172.20.0.3","172.20.0.2","TCP","56458 → 4433 [ACK] Seq=2124 Ack=2614 Win=64128 Len=0 TSval=2184312162 TSecr=2878883092"
"165","1.691122895","146","ae:6f:7d:03:61:01","de:76:69:10:89:1c","172.20.0.3","172.20.0.2","TLSv1.3","Change Cipher Spec, Application Data"
"166","1.691193047","66","ae:6f:7d:03:61:01","de:76:69:10:89:1c","172.20.0.3","172.20.0.2","TCP","56458 → 4433 [RST, ACK] Seq=2204 Ack=2614 Win=64128 Len=0 TSval=2184312170 TSecr=2878883092"
"167","1.706838578","74","ae:6f:7d:03:61:01","de:76:69:10:89:1c","172.20.0.3","172.20.0.2","TCP","56462 → 4433 [SYN] Seq=0 Win=64240 Len=0 MSS=1460 SACK_PERM TSval=2184312186 TSecr=0 WS=128"
"168","1.706857765","74","de:76:69:10:89:1c","ae:6f:7d:03:61:01","172.20.0.2","172.20.0.3","TCP","4433 → 56462 [SYN, ACK] Seq=0 Ack=1 Win=65160 Len=0 MSS=1460 SACK_PERM TSval=2878883116 TSecr=2184312186 WS=128"
"169","1.706873077","66","ae:6f:7d:03:61:01","de:76:69:10:89:1c","172.20.0.3","172.20.0.2","TCP","56462 → 4433 [ACK] Seq=1 Ack=1 Win=64256 Len=0 TSval=2184312186 TSecr=2878883116"
"170","1.706912638","2189","ae:6f:7d:03:61:01","de:76:69:10:89:1c","172.20.0.3","172.20.0.2","TLSv1.2","Client Hello"
"171","1.706917984","66","de:76:69:10:89:1c","ae:6f:7d:03:61:01","172.20.0.2","172.20.0.3","TCP","4433 → 56462 [ACK] Seq=1 Ack=2124 Win=64128 Len=0 TSval=2878883116 TSecr=2184312186"
"172","1.718447471","2679","de:76:69:10:89:1c","ae:6f:7d:03:61:01","172.20.0.2","172.20.0.3","TLSv1.3","Server Hello, Change Cipher Spec, Application Data, Application Data, Application Data, Application Data"
"173","1.718473894","66","ae:6f:7d:03:61:01","de:76:69:10:89:1c","172.20.0.3","172.20.0.2","TCP","56462 → 4433 [ACK] Seq=2124 Ack=2614 Win=64128 Len=0 TSval=2184312198 TSecr=2878883128"
"174","1.727247574","146","ae:6f:7d:03:61:01","de:76:69:10:89:1c","172.20.0.3","172.20.0.2","TLSv1.3","Change Cipher Spec, Application Data"
"175","1.727309493","66","ae:6f:7d:03:61:01","de:76:69:10:89:1c","172.20.0.3","172.20.0.2","TCP","56462 → 4433 [RST, ACK] Seq=2204 Ack=2614 Win=64128 Len=0 TSval=2184312207 TSecr=2878883128"
"176","1.743252237","74","ae:6f:7d:03:61:01","de:76:69:10:89:1c","172.20.0.3","172.20.0.2","TCP","56472 → 4433 [SYN] Seq=0 Win=64240 Len=0 MSS=1460 SACK_PERM TSval=2184312223 TSecr=0 WS=128"
"177","1.743275389","74","de:76:69:10:89:1c","ae:6f:7d:03:61:01","172.20.0.2","172.20.0.3","TCP","4433 → 56472 [SYN, ACK] Seq=0 Ack=1 Win=65160 Len=0 MSS=1460 SACK_PERM TSval=2878883153 TSecr=2184312223 WS=128"
"178","1.743293141","66","ae:6f:7d:03:61:01","de:76:69:10:89:1c","172.20.0.3","172.20.0.2","TCP","56472 → 4433 [ACK] Seq=1 Ack=1 Win=64256 Len=0 TSval=2184312223 TSecr=2878883153"
"179","1.743334656","2189","ae:6f:7d:03:61:01","de:76:69:10:89:1c","172.20.0.3","172.20.0.2","TLSv1.2","Client Hello"
"180","1.743348660","66","de:76:69:10:89:1c","ae:6f:7d:03:61:01","172.20.0.2","172.20.0.3","TCP","4433 → 56472 [ACK] Seq=1 Ack=2124 Win=64128 Len=0 TSval=2878883153 TSecr=2184312223"
"181","1.754893841","2679","de:76:69:10:89:1c","ae:6f:7d:03:61:01","172.20.0.2","172.20.0.3","TLSv1.3","Server Hello, Change Cipher Spec, Application Data, Application Data, Application Data, Application Data"
"182","1.754917986","66","ae:6f:7d:03:61:01","de:76:69:10:89:1c","172.20.0.3","172.20.0.2","TCP","56472 → 4433 [ACK] Seq=2124 Ack=2614 Win=64128 Len=0 TSval=2184312234 TSecr=2878883164"
"183","1.763875883","146","ae:6f:7d:03:61:01","de:76:69:10:89:1c","172.20.0.3","172.20.0.2","TLSv1.3","Change Cipher Spec, Application Data"
"184","1.763935836","66","ae:6f:7d:03:61:01","de:76:69:10:89:1c","172.20.0.3","172.20.0.2","TCP","56472 → 4433 [RST, ACK] Seq=2204 Ack=2614 Win=64128 Len=0 TSval=2184312243 TSecr=2878883164"
"185","1.779846695","74","ae:6f:7d:03:61:01","de:76:69:10:89:1c","172.20.0.3","172.20.0.2","TCP","56486 → 4433 [SYN] Seq=0 Win=64240 Len=0 MSS=1460 SACK_PERM TSval=2184312259 TSecr=0 WS=128"
"186","1.779870241","74","de:76:69:10:89:1c","ae:6f:7d:03:61:01","172.20.0.2","172.20.0.3","TCP","4433 → 56486 [SYN, ACK] Seq=0 Ack=1 Win=65160 Len=0 MSS=1460 SACK_PERM TSval=2878883189 TSecr=2184312259 WS=128"
"187","1.779886843","66","ae:6f:7d:03:61:01","de:76:69:10:89:1c","172.20.0.3","172.20.0.2","TCP","56486 → 4433 [ACK] Seq=1 Ack=1 Win=64256 Len=0 TSval=2184312259 TSecr=2878883189"
"188","1.779925708","2189","ae:6f:7d:03:61:01","de:76:69:10:89:1c","172.20.0.3","172.20.0.2","TLSv1.2","Client Hello"
"189","1.779931454","66","de:76:69:10:89:1c","ae:6f:7d:03:61:01","172.20.0.2","172.20.0.3","TCP","4433 → 56486 [ACK] Seq=1 Ack=2124 Win=64128 Len=0 TSval=2878883189 TSecr=2184312259"
"190","1.791653443","2678","de:76:69:10:89:1c","ae:6f:7d:03:61:01","172.20.0.2","172.20.0.3","TLSv1.3","Server Hello, Change Cipher Spec, Application Data, Application Data, Application Data, Application Data"
"191","1.791698680","66","ae:6f:7d:03:61:01","de:76:69:10:89:1c","172.20.0.3","172.20.0.2","TCP","56486 → 4433 [ACK] Seq=2124 Ack=2613 Win=64128 Len=0 TSval=2184312271 TSecr=2878883201"
"192","1.801039642","146","ae:6f:7d:03:61:01","de:76:69:10:89:1c","172.20.0.3","172.20.0.2","TLSv1.3","Change Cipher Spec, Application Data"
"193","1.801119234","66","ae:6f:7d:03:61:01","de:76:69:10:89:1c","172.20.0.3","172.20.0.2","TCP","56486 → 4433 [RST, ACK] Seq=2204 Ack=2613 Win=64128 Len=0 TSval=2184312280 TSecr=2878883201"
"194","1.818594216","74","ae:6f:7d:03:61:01","de:76:69:10:89:1c","172.20.0.3","172.20.0.2","TCP","56494 → 4433 [SYN] Seq=0 Win=64240 Len=0 MSS=1460 SACK_PERM TSval=2184312298 TSecr=0 WS=128"
"195","1.818622562","74","de:76:69:10:89:1c","ae:6f:7d:03:61:01","172.20.0.2","172.20.0.3","TCP","4433 → 56494 [SYN, ACK] Seq=0 Ack=1 Win=65160 Len=0 MSS=1460 SACK_PERM TSval=2878883228 TSecr=2184312298 WS=128"
"196","1.818642786","66","ae:6f:7d:03:61:01","de:76:69:10:89:1c","172.20.0.3","172.20.0.2","TCP","56494 → 4433 [ACK] Seq=1 Ack=1 Win=64256 Len=0 TSval=2184312298 TSecr=2878883228"
"197","1.818688972","2189","ae:6f:7d:03:61:01","de:76:69:10:89:1c","172.20.0.3","172.20.0.2","TLSv1.2","Client Hello"
"198","1.818695531","66","de:76:69:10:89:1c","ae:6f:7d:03:61:01","172.20.0.2","172.20.0.3","TCP","4433 → 56494 [ACK] Seq=1 Ack=2124 Win=64128 Len=0 TSval=2878883228 TSecr=2184312298"
"199","1.830339895","2678","de:76:69:10:89:1c","ae:6f:7d:03:61:01","172.20.0.2","172.20.0.3","TLSv1.3","Server Hello, Change Cipher Spec, Application Data, Application Data, Application Data, Application Data"
"200","1.830368166","66","ae:6f:7d:03:61:01","de:76:69:10:89:1c","172.20.0.3","172.20.0.2","TCP","56494 → 4433 [ACK] Seq=2124 Ack=2613 Win=64128 Len=0 TSval=2184312310 TSecr=2878883240"
"201","1.839265093","146","ae:6f:7d:03:61:01","de:76:69:10:89:1c","172.20.0.3","172.20.0.2","TLSv1.3","Change Cipher Spec, Application Data"
"202","1.839326165","66","ae:6f:7d:03:61:01","de:76:69:10:89:1c","172.20.0.3","172.20.0.2","TCP","56494 → 4433 [RST, ACK] Seq=2204 Ack=2613 Win=64128 Len=0 TSval=2184312319 TSecr=2878883240"
"203","1.855907591","74","ae:6f:7d:03:61:01","de:76:69:10:89:1c","172.20.0.3","172.20.0.2","TCP","56506 → 4433 [SYN] Seq=0 Win=64240 Len=0 MSS=1460 SACK_PERM TSval=2184312335 TSecr=0 WS=128"
"204","1.855935527","74","de:76:69:10:89:1c","ae:6f:7d:03:61:01","172.20.0.2","172.20.0.3","TCP","4433 → 56506 [SYN, ACK] Seq=0 Ack=1 Win=65160 Len=0 MSS=1460 SACK_PERM TSval=2878883265 TSecr=2184312335 WS=128"
"205","1.855951931","66","ae:6f:7d:03:61:01","de:76:69:10:89:1c","172.20.0.3","172.20.0.2","TCP","56506 → 4433 [ACK] Seq=1 Ack=1 Win=64256 Len=0 TSval=2184312335 TSecr=2878883265"
"206","1.856004216","2189","ae:6f:7d:03:61:01","de:76:69:10:89:1c","172.20.0.3","172.20.0.2","TLSv1.2","Client Hello"
"207","1.856009328","66","de:76:69:10:89:1c","ae:6f:7d:03:61:01","172.20.0.2","172.20.0.3","TCP","4433 → 56506 [ACK] Seq=1 Ack=2124 Win=64128 Len=0 TSval=2878883265 TSecr=2184312335"
"208","1.867860398","2678","de:76:69:10:89:1c","ae:6f:7d:03:61:01","172.20.0.2","172.20.0.3","TLSv1.3","Server Hello, Change Cipher Spec, Application Data, Application Data, Application Data, Application Data"
"209","1.867889341","66","ae:6f:7d:03:61:01","de:76:69:10:89:1c","172.20.0.3","172.20.0.2","TCP","56506 → 4433 [ACK] Seq=2124 Ack=2613 Win=64128 Len=0 TSval=2184312347 TSecr=2878883277"
"210","1.876727048","146","ae:6f:7d:03:61:01","de:76:69:10:89:1c","172.20.0.3","172.20.0.2","TLSv1.3","Change Cipher Spec, Application Data"
"211","1.876787160","66","ae:6f:7d:03:61:01","de:76:69:10:89:1c","172.20.0.3","172.20.0.2","TCP","56506 → 4433 [RST, ACK] Seq=2204 Ack=2613 Win=64128 Len=0 TSval=2184312356 TSecr=2878883277"
"212","1.892782799","74","ae:6f:7d:03:61:01","de:76:69:10:89:1c","172.20.0.3","172.20.0.2","TCP","56514 → 4433 [SYN] Seq=0 Win=64240 Len=0 MSS=1460 SACK_PERM TSval=2184312372 TSecr=0 WS=128"
"213","1.892804910","74","de:76:69:10:89:1c","ae:6f:7d:03:61:01","172.20.0.2","172.20.0.3","TCP","4433 → 56514 [SYN, ACK] Seq=0 Ack=1 Win=65160 Len=0 MSS=1460 SACK_PERM TSval=2878883302 TSecr=2184312372 WS=128"
"214","1.892820986","66","ae:6f:7d:03:61:01","de:76:69:10:89:1c","172.20.0.3","172.20.0.2","TCP","56514 → 4433 [ACK] Seq=1 Ack=1 Win=64256 Len=0 TSval=2184312372 TSecr=2878883302"
"215","1.892867509","2189","ae:6f:7d:03:61:01","de:76:69:10:89:1c","172.20.0.3","172.20.0.2","TLSv1.2","Client Hello"
"216","1.892873315","66","de:76:69:10:89:1c","ae:6f:7d:03:61:01","172.20.0.2","172.20.0.3","TCP","4433 → 56514 [ACK] Seq=1 Ack=2124 Win=64128 Len=0 TSval=2878883302 TSecr=2184312372"
"217","1.904397007","2677","de:76:69:10:89:1c","ae:6f:7d:03:61:01","172.20.0.2","172.20.0.3","TLSv1.3","Server Hello, Change Cipher Spec, Application Data, Application Data, Application Data, Application Data"
"218","1.904422568","66","ae:6f:7d:03:61:01","de:76:69:10:89:1c","172.20.0.3","172.20.0.2","TCP","56514 → 4433 [ACK] Seq=2124 Ack=2612 Win=64128 Len=0 TSval=2184312384 TSecr=2878883314"
"219","1.913488370","146","ae:6f:7d:03:61:01","de:76:69:10:89:1c","172.20.0.3","172.20.0.2","TLSv1.3","Change Cipher Spec, Application Data"
"220","1.913546799","66","ae:6f:7d:03:61:01","de:76:69:10:89:1c","172.20.0.3","172.20.0.2","TCP","56514 → 4433 [RST, ACK] Seq=2204 Ack=2612 Win=64128 Len=0 TSval=2184312393 TSecr=2878883314"
"221","1.930180577","74","ae:6f:7d:03:61:01","de:76:69:10:89:1c","172.20.0.3","172.20.0.2","TCP","56520 → 4433 [SYN] Seq=0 Win=64240 Len=0 MSS=1460 SACK_PERM TSval=2184312409 TSecr=0 WS=128"
"222","1.930223234","74","de:76:69:10:89:1c","ae:6f:7d:03:61:01","172.20.0.2","172.20.0.3","TCP","4433 → 56520 [SYN, ACK] Seq=0 Ack=1 Win=65160 Len=0 MSS=1460 SACK_PERM TSval=2878883340 TSecr=2184312409 WS=128"
"223","1.930242950","66","ae:6f:7d:03:61:01","de:76:69:10:89:1c","172.20.0.3","172.20.0.2","TCP","56520 → 4433 [ACK] Seq=1 Ack=1 Win=64256 Len=0 TSval=2184312410 TSecr=2878883340"
"224","1.930293737","2189","ae:6f:7d:03:61:01","de:76:69:10:89:1c","172.20.0.3","172.20.0.2","TLSv1.2","Client Hello"
