frame.number,frame.time_relative,frame.len,eth.src,eth.dst,ip.src,ip.dst,_ws.col.protocol,_ws.col.info
"1","0.000000000","42","4e:d5:dc:4e:3a:eb","ff:ff:ff:ff:ff:ff",,,"ARP","ARP Announcement for 172.20.0.3"
"2","0.031041200","42","4e:d5:dc:4e:3a:eb","ff:ff:ff:ff:ff:ff",,,"ARP","Who has 172.20.0.2? Tell 172.20.0.3"
"3","0.031066562","42","aa:fb:4c:c5:9a:b1","4e:d5:dc:4e:3a:eb",,,"ARP","172.20.0.2 is at aa:fb:4c:c5:9a:b1"
"4","0.031073318","74","4e:d5:dc:4e:3a:eb","aa:fb:4c:c5:9a:b1","172.20.0.3","172.20.0.2","TCP","48100 → 4433 [SYN] Seq=0 Win=64240 Len=0 MSS=1460 SACK_PERM TSval=2182656641 TSecr=0 WS=128"
"5","0.031090879","74","aa:fb:4c:c5:9a:b1","4e:d5:dc:4e:3a:eb","172.20.0.2","172.20.0.3","TCP","4433 → 48100 [SYN, ACK] Seq=0 Ack=1 Win=65160 Len=0 MSS=1460 SACK_PERM TSval=2877227571 TSecr=2182656641 WS=128"
"6","0.031104411","66","4e:d5:dc:4e:3a:eb","aa:fb:4c:c5:9a:b1","172.20.0.3","172.20.0.2","TCP","48100 → 4433 [ACK] Seq=1 Ack=1 Win=64256 Len=0 TSval=2182656641 TSecr=2877227571"
"7","0.031146773","552","4e:d5:dc:4e:3a:eb","aa:fb:4c:c5:9a:b1","172.20.0.3","172.20.0.2","TLSv1.2","Client Hello"
"8","0.031150939","66","aa:fb:4c:c5:9a:b1","4e:d5:dc:4e:3a:eb","172.20.0.2","172.20.0.3","TCP","4433 → 48100 [ACK] Seq=1 Ack=487 Win=64768 Len=0 TSval=2877227571 TSecr=2182656641"
"9","0.033454951","922","aa:fb:4c:c5:9a:b1","4e:d5:dc:4e:3a:eb","172.20.0.2","172.20.0.3","TLSv1.3","Server Hello, Change Cipher Spec, Application Data, Application Data, Application Data, Application Data"
"10","0.033487233","66","4e:d5:dc:4e:3a:eb","aa:fb:4c:c5:9a:b1","172.20.0.3","172.20.0.2","TCP","48100 → 4433 [ACK] Seq=487 Ack=857 Win=63488 Len=0 TSval=2182656643 TSecr=2877227573"
"11","0.036124873","146","4e:d5:dc:4e:3a:eb","aa:fb:4c:c5:9a:b1","172.20.0.3","172.20.0.2","TLSv1.3","Change Cipher Spec, Application Data"
"12","0.036180192","66","4e:d5:dc:4e:3a:eb","aa:fb:4c:c5:9a:b1","172.20.0.3","172.20.0.2","TCP","48100 → 4433 [RST, ACK] Seq=567 Ack=857 Win=64000 Len=0 TSval=2182656646 TSecr=2877227573"
"13","0.047533171","74","4e:d5:dc:4e:3a:eb","aa:fb:4c:c5:9a:b1","172.20.0.3","172.20.0.2","TCP","48108 → 4433 [SYN] Seq=0 Win=64240 Len=0 MSS=1460 SACK_PERM TSval=2182656657 TSecr=0 WS=128"
"14","0.047565004","74","aa:fb:4c:c5:9a:b1","4e:d5:dc:4e:3a:eb","172.20.0.2","172.20.0.3","TCP","4433 → 48108 [SYN, ACK] Seq=0 Ack=1 Win=65160 Len=0 MSS=1460 SACK_PERM TSval=2877227587 TSecr=2182656657 WS=128"
"15","0.047583335","66","4e:d5:dc:4e:3a:eb","aa:fb:4c:c5:9a:b1","172.20.0.3","172.20.0.2","TCP","48108 → 4433 [ACK] Seq=1 Ack=1 Win=64256 Len=0 TSval=2182656657 TSecr=2877227587"
"16","0.047626186","552","4e:d5:dc:4e:3a:eb","aa:fb:4c:c5:9a:b1","172.20.0.3","172.20.0.2","TLSv1.2","Client Hello"
"17","0.047631998","66","aa:fb:4c:c5:9a:b1","4e:d5:dc:4e:3a:eb","172.20.0.2","172.20.0.3","TCP","4433 → 48108 [ACK] Seq=1 Ack=487 Win=64768 Len=0 TSval=2877227587 TSecr=2182656657"
"18","0.049629558","923","aa:fb:4c:c5:9a:b1","4e:d5:dc:4e:3a:eb","172.20.0.2","172.20.0.3","TLSv1.3","Server Hello, Change Cipher Spec, Application Data, Application Data, Application Data, Application Data"
"19","0.049661743","66","4e:d5:dc:4e:3a:eb","aa:fb:4c:c5:9a:b1","172.20.0.3","172.20.0.2","TCP","48108 → 4433 [ACK] Seq=487 Ack=858 Win=63488 Len=0 TSval=2182656659 TSecr=2877227589"
"20","0.052497490","146","4e:d5:dc:4e:3a:eb","aa:fb:4c:c5:9a:b1","172.20.0.3","172.20.0.2","TLSv1.3","Change Cipher Spec, Application Data"
"21","0.052557806","66","4e:d5:dc:4e:3a:eb","aa:fb:4c:c5:9a:b1","172.20.0.3","172.20.0.2","TCP","48108 → 4433 [RST, ACK] Seq=567 Ack=858 Win=64000 Len=0 TSval=2182656662 TSecr=2877227589"
"22","0.064758777","74","4e:d5:dc:4e:3a:eb","aa:fb:4c:c5:9a:b1","172.20.0.3","172.20.0.2","TCP","48124 → 4433 [SYN] Seq=0 Win=64240 Len=0 MSS=1460 SACK_PERM TSval=2182656674 TSecr=0 WS=128"
"23","0.064797544","74","aa:fb:4c:c5:9a:b1","4e:d5:dc:4e:3a:eb","172.20.0.2","172.20.0.3","TCP","4433 → 48124 [SYN, ACK] Seq=0 Ack=1 Win=65160 Len=0 MSS=1460 SACK_PERM TSval=2877227604 TSecr=2182656674 WS=128"
"24","0.064825503","66","4e:d5:dc:4e:3a:eb","aa:fb:4c:c5:9a:b1","172.20.0.3","172.20.0.2","TCP","48124 → 4433 [ACK] Seq=1 Ack=1 Win=64256 Len=0 TSval=2182656674 TSecr=2877227604"
"25","0.064873374","552","4e:d5:dc:4e:3a:eb","aa:fb:4c:c5:9a:b1","172.20.0.3","172.20.0.2","TLSv1.2","Client Hello"
"26","0.064878681","66","aa:fb:4c:c5:9a:b1","4e:d5:dc:4e:3a:eb","172.20.0.2","172.20.0.3","TCP","4433 → 48124 [ACK] Seq=1 Ack=487 Win=64768 Len=0 TSval=2877227604 TSecr=2182656674"
"27","0.066836833","923","aa:fb:4c:c5:9a:b1","4e:d5:dc:4e:3a:eb","172.20.0.2","172.20.0.3","TLSv1.3","Server Hello, Change Cipher Spec, Application Data, Application Data, Application Data, Application Data"
"28","0.066866708","66","4e:d5:dc:4e:3a:eb","aa:fb:4c:c5:9a:b1","172.20.0.3","172.20.0.2","TCP","48124 → 4433 [ACK] Seq=487 Ack=858 Win=63488 Len=0 TSval=2182656676 TSecr=2877227606"
"29","0.069827679","146","4e:d5:dc:4e:3a:eb","aa:fb:4c:c5:9a:b1","172.20.0.3","172.20.0.2","TLSv1.3","Change Cipher Spec, Application Data"
"30","0.069896367","66","4e:d5:dc:4e:3a:eb","aa:fb:4c:c5:9a:b1","172.20.0.3","172.20.0.2","TCP","48124 → 4433 [RST, ACK] Seq=567 Ack=858 Win=64000 Len=0 TSval=2182656679 TSecr=2877227606"
"31","0.081624443","74","4e:d5:dc:4e:3a:eb","aa:fb:4c:c5:9a:b1","172.20.0.3","172.20.0.2","TCP","48136 → 4433 [SYN] Seq=0 Win=64240 Len=0 MSS=1460 SACK_PERM TSval=2182656691 TSecr=0 WS=128"
"32","0.081651972","74","aa:fb:4c:c5:9a:b1","4e:d5:dc:4e:3a:eb","172.20.0.2","172.20.0.3","TCP","4433 → 48136 [SYN, ACK] Seq=0 Ack=1 Win=65160 Len=0 MSS=1460 SACK_PERM TSval=2877227621 TSecr=2182656691 WS=128"
"33","0.081670956","66","4e:d5:dc:4e:3a:eb","aa:fb:4c:c5:9a:b1","172.20.0.3","172.20.0.2","TCP","48136 → 4433 [ACK] Seq=1 Ack=1 Win=64256 Len=0 TSval=2182656691 TSecr=2877227621"
"34","0.081710716","552","4e:d5:dc:4e:3a:eb","aa:fb:4c:c5:9a:b1","172.20.0.3","172.20.0.2","TLSv1.2","Client Hello"
"35","0.081716820","66","aa:fb:4c:c5:9a:b1","4e:d5:dc:4e:3a:eb","172.20.0.2","172.20.0.3","TCP","4433 → 48136 [ACK] Seq=1 Ack=487 Win=64768 Len=0 TSval=2877227621 TSecr=2182656691"
"36","0.291957519","923","aa:fb:4c:c5:9a:b1","4e:d5:dc:4e:3a:eb","172.20.0.2","172.20.0.3","TLSv1.3","Server Hello, Change Cipher Spec, Application Data, Application Data, Application Data, Application Data"
"37","0.292015177","66","4e:d5:dc:4e:3a:eb","aa:fb:4c:c5:9a:b1","172.20.0.3","172.20.0.2","TCP","48136 → 4433 [ACK] Seq=487 Ack=858 Win=63488 Len=0 TSval=2182656902 TSecr=2877227832"
"38","0.295015000","146","4e:d5:dc:4e:3a:eb","aa:fb:4c:c5:9a:b1","172.20.0.3","172.20.0.2","TLSv1.3","Change Cipher Spec, Application Data"
"39","0.295111095","66","4e:d5:dc:4e:3a:eb","aa:fb:4c:c5:9a:b1","172.20.0.3","172.20.0.2","TCP","48136 → 4433 [RST, ACK] Seq=567 Ack=858 Win=64000 Len=0 TSval=2182656905 TSecr=2877227832"
"40","0.308470551","74","4e:d5:dc:4e:3a:eb","aa:fb:4c:c5:9a:b1","172.20.0.3","172.20.0.2","TCP","48148 → 4433 [SYN] Seq=0 Win=64240 Len=0 MSS=1460 SACK_PERM TSval=2182656918 TSecr=0 WS=128"
"41","0.308499589","74","aa:fb:4c:c5:9a:b1","4e:d5:dc:4e:3a:eb","172.20.0.2","172.20.0.3","TCP","4433 → 48148 [SYN, ACK] Seq=0 Ack=1 Win=65160 Len=0 MSS=1460 SACK_PERM TSval=2877227848 TSecr=2182656918 WS=128"
"42","0.308520261","66","4e:d5:dc:4e:3a:eb","aa:fb:4c:c5:9a:b1","172.20.0.3","172.20.0.2","TCP","48148 → 4433 [ACK] Seq=1 Ack=1 Win=64256 Len=0 TSval=2182656918 TSecr=2877227848"
"43","0.308560845","552","4e:d5:dc:4e:3a:eb","aa:fb:4c:c5:9a:b1","172.20.0.3","172.20.0.2","TLSv1.2","Client Hello"
"44","0.308565099","66","aa:fb:4c:c5:9a:b1","4e:d5:dc:4e:3a:eb","172.20.0.2","172.20.0.3","TCP","4433 → 48148 [ACK] Seq=1 Ack=487 Win=64768 Len=0 TSval=2877227848 TSecr=2182656918"
"45","0.310597345","923","aa:fb:4c:c5:9a:b1","4e:d5:dc:4e:3a:eb","172.20.0.2","172.20.0.3","TLSv1.3","Server Hello, Change Cipher Spec, Application Data, Application Data, Application Data, Application Data"
"46","0.310626986","66","4e:d5:dc:4e:3a:eb","aa:fb:4c:c5:9a:b1","172.20.0.3","172.20.0.2","TCP","48148 → 4433 [ACK] Seq=487 Ack=858 Win=63488 Len=0 TSval=2182656920 TSecr=2877227850"
"47","0.313251407","146","4e:d5:dc:4e:3a:eb","aa:fb:4c:c5:9a:b1","172.20.0.3","172.20.0.2","TLSv1.3","Change Cipher Spec, Application Data"
"48","0.313322155","66","4e:d5:dc:4e:3a:eb","aa:fb:4c:c5:9a:b1","172.20.0.3","172.20.0.2","TCP","48148 → 4433 [RST, ACK] Seq=567 Ack=858 Win=64000 Len=0 TSval=2182656923 TSecr=2877227850"
"49","0.324811732","74","4e:d5:dc:4e:3a:eb","aa:fb:4c:c5:9a:b1","172.20.0.3","172.20.0.2","TCP","48154 → 4433 [SYN] Seq=0 Win=64240 Len=0 MSS=1460 SACK_PERM TSval=2182656934 TSecr=0 WS=128"
"50","0.324845386","74","aa:fb:4c:c5:9a:b1","4e:d5:dc:4e:3a:eb","172.20.0.2","172.20.0.3","TCP","4433 → 48154 [SYN, ACK] Seq=0 Ack=1 Win=65160 Len=0 MSS=1460 SACK_PERM TSval=2877227864 TSecr=2182656934 WS=128"
"51","0.324865653","66","4e:d5:dc:4e:3a:eb","aa:fb:4c:c5:9a:b1","172.20.0.3","172.20.0.2","TCP","48154 → 4433 [ACK] Seq=1 Ack=1 Win=64256 Len=0 TSval=2182656934 TSecr=2877227864"
"52","0.324907964","552","4e:d5:dc:4e:3a:eb","aa:fb:4c:c5:9a:b1","172.20.0.3","172.20.0.2","TLSv1.2","Client Hello"
"53","0.324913859","66","aa:fb:4c:c5:9a:b1","4e:d5:dc:4e:3a:eb","172.20.0.2","172.20.0.3","TCP","4433 → 48154 [ACK] Seq=1 Ack=487 Win=64768 Len=0 TSval=2877227864 TSecr=2182656934"
"54","0.326986342","923","aa:fb:4c:c5:9a:b1","4e:d5:dc:4e:3a:eb","172.20.0.2","172.20.0.3","TLSv1.3","Server Hello, Change Cipher Spec, Application Data, Application Data, Application Data, Application Data"
"55","0.327027583","66","4e:d5:dc:4e:3a:eb","aa:fb:4c:c5:9a:b1","172.20.0.3","172.20.0.2","TCP","48154 → 4433 [ACK] Seq=487 Ack=858 Win=63488 Len=0 TSval=2182656937 TSecr=2877227867"
"56","0.329834655","146","4e:d5:dc:4e:3a:eb","aa:fb:4c:c5:9a:b1","172.20.0.3","172.20.0.2","TLSv1.3","Change Cipher Spec, Application Data"
"57","0.329892716","66","4e:d5:dc:4e:3a:eb","aa:fb:4c:c5:9a:b1","172.20.0.3","172.20.0.2","TCP","48154 → 4433 [RST, ACK] Seq=567 Ack=858 Win=64000 Len=0 TSval=2182656939 TSecr=2877227867"
"58","0.341499525","74","4e:d5:dc:4e:3a:eb","aa:fb:4c:c5:9a:b1","172.20.0.3","172.20.0.2","TCP","48162 → 4433 [SYN] Seq=0 Win=64240 Len=0 MSS=1460 SACK_PERM TSval=2182656951 TSecr=0 WS=128"
"59","0.341531471","74","aa:fb:4c:c5:9a:b1","4e:d5:dc:4e:3a:eb","172.20.0.2","172.20.0.3","TCP","4433 → 48162 [SYN, ACK] Seq=0 Ack=1 Win=65160 Len=0 MSS=1460 SACK_PERM TSval=2877227881 TSecr=2182656951 WS=128"
"60","0.341550037","66","4e:d5:dc:4e:3a:eb","aa:fb:4c:c5:9a:b1","172.20.0.3","172.20.0.2","TCP","48162 → 4433 [ACK] Seq=1 Ack=1 Win=64256 Len=0 TSval=2182656951 TSecr=2877227881"
"61","0.341596668","552","4e:d5:dc:4e:3a:eb","aa:fb:4c:c5:9a:b1","172.20.0.3","172.20.0.2","TLSv1.2","Client Hello"
"62","0.341602007","66","aa:fb:4c:c5:9a:b1","4e:d5:dc:4e:3a:eb","172.20.0.2","172.20.0.3","TCP","4433 → 48162 [ACK] Seq=1 Ack=487 Win=64768 Len=0 TSval=2877227881 TSecr=2182656951"
"63","0.343608495","924","aa:fb:4c:c5:9a:b1","4e:d5:dc:4e:3a:eb","172.20.0.2","172.20.0.3","TLSv1.3","Server Hello, Change Cipher Spec, Application Data, Application Data, Application Data, Application Data"
"64","0.343645024","66","4e:d5:dc:4e:3a:eb","aa:fb:4c:c5:9a:b1","172.20.0.3","172.20.0.2","TCP","48162 → 4433 [ACK] Seq=487 Ack=859 Win=63488 Len=0 TSval=2182656953 TSecr=2877227883"
"65","0.346371471","146","4e:d5:dc:4e:3a:eb","aa:fb:4c:c5:9a:b1","172.20.0.3","172.20.0.2","TLSv1.3","Change Cipher Spec, Application Data"
"66","0.346439146","66","4e:d5:dc:4e:3a:eb","aa:fb:4c:c5:9a:b1","172.20.0.3","172.20.0.2","TCP","48162 → 4433 [RST, ACK] Seq=567 Ack=859 Win=64000 Len=0 TSval=2182656956 TSecr=2877227883"
"67","0.357441861","74","4e:d5:dc:4e:3a:eb","aa:fb:4c:c5:9a:b1","172.20.0.3","172.20.0.2","TCP","48170 → 4433 [SYN] Seq=0 Win=64240 Len=0 MSS=1460 SACK_PERM TSval=2182656967 TSecr=0 WS=128"
"68","0.357470775","74","aa:fb:4c:c5:9a:b1","4e:d5:dc:4e:3a:eb","172.20.0.2","172.20.0.3","TCP","4433 → 48170 [SYN, ACK] Seq=0 Ack=1 Win=65160 Len=0 MSS=1460 SACK_PERM TSval=2877227897 TSecr=2182656967 WS=128"
"69","0.357488785","66","4e:d5:dc:4e:3a:eb","aa:fb:4c:c5:9a:b1","172.20.0.3","172.20.0.2","TCP","48170 → 4433 [ACK] Seq=1 Ack=1 Win=64256 Len=0 TSval=2182656967 TSecr=2877227897"
"70","0.357526912","552","4e:d5:dc:4e:3a:eb","aa:fb:4c:c5:9a:b1","172.20.0.3","172.20.0.2","TLSv1.2","Client Hello"
"71","0.357532706","66","aa:fb:4c:c5:9a:b1","4e:d5:dc:4e:3a:eb","172.20.0.2","172.20.0.3","TCP","4433 → 48170 [ACK] Seq=1 Ack=487 Win=64768 Len=0 TSval=2877227897 TSecr=2182656967"
"72","0.359472745","922","aa:fb:4c:c5:9a:b1","4e:d5:dc:4e:3a:eb","172.20.0.2","172.20.0.3","TLSv1.3","Server Hello, Change Cipher Spec, Application Data, Application Data, Application Data, Application Data"
"73","0.359502875","66","4e:d5:dc:4e:3a:eb","aa:fb:4c:c5:9a:b1","172.20.0.3","172.20.0.2","TCP","48170 → 4433 [ACK] Seq=487 Ack=857 Win=63488 Len=0 TSval=2182656969 TSecr=2877227899"
"74","0.362079911","146","4e:d5:dc:4e:3a:eb","aa:fb:4c:c5:9a:b1","172.20.0.3","172.20.0.2","TLSv1.3","Change Cipher Spec, Application Data"
"75","0.362132702","66","4e:d5:dc:4e:3a:eb","aa:fb:4c:c5:9a:b1","172.20.0.3","172.20.0.2","TCP","48170 → 4433 [RST, ACK] Seq=567 Ack=857 Win=64000 Len=0 TSval=2182656972 TSecr=2877227899"
"76","0.373580697","74","4e:d5:dc:4e:3a:eb","aa:fb:4c:c5:9a:b1","172.20.0.3","172.20.0.2","TCP","48176 → 4433 [SYN] Seq=0 Win=64240 Len=0 MSS=1460 SACK_PERM TSval=2182656983 TSecr=0 WS=128"
"77","0.373608587","74","aa:fb:4c:c5:9a:b1","4e:d5:dc:4e:3a:eb","172.20.0.2","172.20.0.3","TCP","4433 → 48176 [SYN, ACK] Seq=0 Ack=1 Win=65160 Len=0 MSS=1460 SACK_PERM TSval=2877227913 TSecr=2182656983 WS=128"
"78","0.373626630","66","4e:d5:dc:4e:3a:eb","aa:fb:4c:c5:9a:b1","172.20.0.3","172.20.0.2","TCP","48176 → 4433 [ACK] Seq=1 Ack=1 Win=64256 Len=0 TSval=2182656983 TSecr=2877227913"
"79","0.373668360","552","4e:d5:dc:4e:3a:eb","aa:fb:4c:c5:9a:b1","172.20.0.3","172.20.0.2","TLSv1.2","Client Hello"
"80","0.373673352","66","aa:fb:4c:c5:9a:b1","4e:d5:dc:4e:3a:eb","172.20.0.2","172.20.0.3","TCP","4433 → 48176 [ACK] Seq=1 Ack=487 Win=64768 Len=0 TSval=2877227913 TSecr=2182656983"
"81","0.375707895","923","aa:fb:4c:c5:9a:b1","4e:d5:dc:4e:3a:eb","172.20.0.2","172.20.0.3","TLSv1.3","Server Hello, Change Cipher Spec, Application Data, Application Data, Application Data, Application Data"
"82","0.375742817","66","4e:d5:dc:4e:3a:eb","aa:fb:4c:c5:9a:b1","172.20.0.3","172.20.0.2","TCP","48176 → 4433 [ACK] Seq=487 Ack=858 Win=63488 Len=0 TSval=2182656985 TSecr=2877227915"
"83","0.378343278","146","4e:d5:dc:4e:3a:eb","aa:fb:4c:c5:9a:b1","172.20.0.3","172.20.0.2","TLSv1.3","Change Cipher Spec, Application Data"
"84","0.378401227","66","4e:d5:dc:4e:3a:eb","aa:fb:4c:c5:9a:b1","172.20.0.3","172.20.0.2","TCP","48176 → 4433 [RST, ACK] Seq=567 Ack=858 Win=64000 Len=0 TSval=2182656988 TSecr=2877227915"
"85","0.389813914","74","4e:d5:dc:4e:3a:eb","aa:fb:4c:c5:9a:b1","172.20.0.3","172.20.0.2","TCP","48188 → 4433 [SYN] Seq=0 Win=64240 Len=0 MSS=1460 SACK_PERM TSval=2182656999 TSecr=0 WS=128"
"86","0.389852664","74","aa:fb:4c:c5:9a:b1","4e:d5:dc:4e:3a:eb","172.20.0.2","172.20.0.3","TCP","4433 → 48188 [SYN, ACK] Seq=0 Ack=1 Win=65160 Len=0 MSS=1460 SACK_PERM TSval=2877227929 TSecr=2182656999 WS=128"
"87","0.389874478","66","4e:d5:dc:4e:3a:eb","aa:fb:4c:c5:9a:b1","172.20.0.3","172.20.0.2","TCP","48188 → 4433 [ACK] Seq=1 Ack=1 Win=64256 Len=0 TSval=2182656999 TSecr=2877227929"
"88","0.389924670","552","4e:d5:dc:4e:3a:eb","aa:fb:4c:c5:9a:b1","172.20.0.3","172.20.0.2","TLSv1.2","Client Hello"
"89","0.389942215","66","aa:fb:4c:c5:9a:b1","4e:d5:dc:4e:3a:eb","172.20.0.2","172.20.0.3","TCP","4433 → 48188 [ACK] Seq=1 Ack=487 Win=64768 Len=0 TSval=2877227929 TSecr=2182656999"
"90","0.391846580","923","aa:fb:4c:c5:9a:b1","4e:d5:dc:4e:3a:eb","172.20.0.2","172.20.0.3","TLSv1.3","Server Hello, Change Cipher Spec, Application Data, Application Data, Application Data, Application Data"
"91","0.391877515","66","4e:d5:dc:4e:3a:eb","aa:fb:4c:c5:9a:b1","172.20.0.3","172.20.0.2","TCP","48188 → 4433 [ACK] Seq=487 Ack=858 Win=63488 Len=0 TSval=2182657001 TSecr=2877227931"
"92","0.395574981","146","4e:d5:dc:4e:3a:eb","aa:fb:4c:c5:9a:b1","172.20.0.3","172.20.0.2","TLSv1.3","Change Cipher Spec, Application Data"
"93","0.395650636","66","4e:d5:dc:4e:3a:eb","aa:fb:4c:c5:9a:b1","172.20.0.3","172.20.0.2","TCP","48188 → 4433 [RST, ACK] Seq=567 Ack=858 Win=64000 Len=0 TSval=2182657005 TSecr=2877227931"
"94","0.407342622","74","4e:d5:dc:4e:3a:eb","aa:fb:4c:c5:9a:b1","172.20.0.3","172.20.0.2","TCP","48198 → 4433 [SYN] Seq=0 Win=64240 Len=0 MSS=1460 SACK_PERM TSval=2182657017 TSecr=0 WS=128"
"95","0.407369014","74","aa:fb:4c:c5:9a:b1","4e:d5:dc:4e:3a:eb","172.20.0.2","172.20.0.3","TCP","4433 → 48198 [SYN, ACK] Seq=0 Ack=1 Win=65160 Len=0 MSS=1460 SACK_PERM TSval=2877227947 TSecr=2182657017 WS=128"
"96","0.407385464","66","4e:d5:dc:4e:3a:eb","aa:fb:4c:c5:9a:b1","172.20.0.3","172.20.0.2","TCP","48198 → 4433 [ACK] Seq=1 Ack=1 Win=64256 Len=0 TSval=2182657017 TSecr=2877227947"
"97","0.407427646","552","4e:d5:dc:4e:3a:eb","aa:fb:4c:c5:9a:b1","172.20.0.3","172.20.0.2","TLSv1.2","Client Hello"
"98","0.407434581","66","aa:fb:4c:c5:9a:b1","4e:d5:dc:4e:3a:eb","172.20.0.2","172.20.0.3","TCP","4433 → 48198 [ACK] Seq=1 Ack=487 Win=64768 Len=0 TSval=2877227947 TSecr=2182657017"
"99","0.409404848","924","aa:fb:4c:c5:9a:b1","4e:d5:dc:4e:3a:eb","172.20.0.2","172.20.0.3","TLSv1.3","Server Hello, Change Cipher Spec, Application Data, Application Data, Application Data, Application Data"
"100","0.409439984","66","4e:d5:dc:4e:3a:eb","aa:fb:4c:c5:9a:b1","172.20.0.3","172.20.0.2","TCP","48198 → 4433 [ACK] Seq=487 Ack=859 Win=63488 Len=0 TSval=2182657019 TSecr=2877227949"
"101","0.412234788","146","4e:d5:dc:4e:3a:eb","aa:fb:4c:c5:9a:b1","172.20.0.3","172.20.0.2","TLSv1.3","Change Cipher Spec, Application Data"
"102","0.412293981","66","4e:d5:dc:4e:3a:eb","aa:fb:4c:c5:9a:b1","172.20.0.3","172.20.0.2","TCP","48198 → 4433 [RST, ACK] Seq=567 Ack=859 Win=64000 Len=0 TSval=2182657022 TSecr=2877227949"
"103","0.423301541","74","4e:d5:dc:4e:3a:eb","aa:fb:4c:c5:9a:b1","172.20.0.3","172.20.0.2","TCP","48214 → 4433 [SYN] Seq=0 Win=64240 Len=0 MSS=1460 SACK_PERM TSval=2182657033 TSecr=0 WS=128"
"104","0.423328094","74","aa:fb:4c:c5:9a:b1","4e:d5:dc:4e:3a:eb","172.20.0.2","172.20.0.3","TCP","4433 → 48214 [SYN, ACK] Seq=0 Ack=1 Win=65160 Len=0 MSS=1460 SACK_PERM TSval=2877227963 TSecr=2182657033 WS=128"
"105","0.423346555","66","4e:d5:dc:4e:3a:eb","aa:fb:4c:c5:9a:b1","172.20.0.3","172.20.0.2","TCP","48214 → 4433 [ACK] Seq=1 Ack=1 Win=64256 Len=0 TSval=2182657033 TSecr=2877227963"
"106","0.423390958","552","4e:d5:dc:4e:3a:eb","aa:fb:4c:c5:9a:b1","172.20.0.3","172.20.0.2","TLSv1.2","Client Hello"
"107","0.423395132","66","aa:fb:4c:c5:9a:b1","4e:d5:dc:4e:3a:eb","172.20.0.2","172.20.0.3","TCP","4433 → 48214 [ACK] Seq=1 Ack=487 Win=64768 Len=0 TSval=2877227963 TSecr=2182657033"
"108","0.425308163","923","aa:fb:4c:c5:9a:b1","4e:d5:dc:4e:3a:eb","172.20.0.2","172.20.0.3","TLSv1.3","Server Hello, Change Cipher Spec, Application Data, Application Data, Application Data, Application Data"
"109","0.425340872","66","4e:d5:dc:4e:3a:eb","aa:fb:4c:c5:9a:b1","172.20.0.3","172.20.0.2","TCP","48214 → 4433 [ACK] Seq=487 Ack=858 Win=63488 Len=0 TSval=2182657035 TSecr=2877227965"
"110","0.427973201","146","4e:d5:dc:4e:3a:eb","aa:fb:4c:c5:9a:b1","172.20.0.3","172.20.0.2","TLSv1.3","Change Cipher Spec, Application Data"
"111","0.428032034","66","4e:d5:dc:4e:3a:eb","aa:fb:4c:c5:9a:b1","172.20.0.3","172.20.0.2","TCP","48214 → 4433 [RST, ACK] Seq=567 Ack=858 Win=64000 Len=0 TSval=2182657038 TSecr=2877227965"
"112","0.438644224","74","4e:d5:dc:4e:3a:eb","aa:fb:4c:c5:9a:b1","172.20.0.3","172.20.0.2","TCP","48230 → 4433 [SYN] Seq=0 Win=64240 Len=0 MSS=1460 SACK_PERM TSval=2182657048 TSecr=0 WS=128"
"113","0.438668321","74","aa:fb:4c:c5:9a:b1","4e:d5:dc:4e:3a:eb","172.20.0.2","172.20.0.3","TCP","4433 → 48230 [SYN, ACK] Seq=0 Ack=1 Win=65160 Len=0 MSS=1460 SACK_PERM TSval=2877227978 TSecr=2182657048 WS=128"
"114","0.438683611","66","4e:d5:dc:4e:3a:eb","aa:fb:4c:c5:9a:b1","172.20.0.3","172.20.0.2","TCP","48230 → 4433 [ACK] Seq=1 Ack=1 Win=64256 Len=0 TSval=2182657048 TSecr=2877227978"
"115","0.438723115","552","4e:d5:dc:4e:3a:eb","aa:fb:4c:c5:9a:b1","172.20.0.3","172.20.0.2","TLSv1.2","Client Hello"
"116","0.438728093","66","aa:fb:4c:c5:9a:b1","4e:d5:dc:4e:3a:eb","172.20.0.2","172.20.0.3","TCP","4433 → 48230 [ACK] Seq=1 Ack=487 Win=64768 Len=0 TSval=2877227978 TSecr=2182657048"
"117","0.643965972","924","aa:fb:4c:c5:9a:b1","4e:d5:dc:4e:3a:eb","172.20.0.2","172.20.0.3","TLSv1.3","Server Hello, Change Cipher Spec, Application Data, Application Data, Application Data, Application Data"
"118","0.644019027","66","4e:d5:dc:4e:3a:eb","aa:fb:4c:c5:9a:b1","172.20.0.3","172.20.0.2","TCP","48230 → 4433 [ACK] Seq=487 Ack=859 Win=63488 Len=0 TSval=2182657254 TSecr=2877228184"
"119","0.649179482","146","4e:d5:dc:4e:3a:eb","aa:fb:4c:c5:9a:b1","172.20.0.3","172.20.0.2","TLSv1.3","Change Cipher Spec, Application Data"
"120","0.649272546","66","4e:d5:dc:4e:3a:eb","aa:fb:4c:c5:9a:b1","172.20.0.3","172.20.0.2","TCP","48230 → 4433 [RST, ACK] Seq=567 Ack=859 Win=64000 Len=0 TSval=2182657259 TSecr=2877228184"
"121","0.661270393","74","4e:d5:dc:4e:3a:eb","aa:fb:4c:c5:9a:b1","172.20.0.3","172.20.0.2","TCP","48234 → 4433 [SYN] Seq=0 Win=64240 Len=0 MSS=1460 SACK_PERM TSval=2182657271 TSecr=0 WS=128"
"122","0.661296302","74","aa:fb:4c:c5:9a:b1","4e:d5:dc:4e:3a:eb","172.20.0.2","172.20.0.3","TCP","4433 → 48234 [SYN, ACK] Seq=0 Ack=1 Win=65160 Len=0 MSS=1460 SACK_PERM TSval=2877228201 TSecr=2182657271 WS=128"
"123","0.661312233","66","4e:d5:dc:4e:3a:eb","aa:fb:4c:c5:9a:b1","172.20.0.3","172.20.0.2","TCP","48234 → 4433 [ACK] Seq=1 Ack=1 Win=64256 Len=0 TSval=2182657271 TSecr=2877228201"
"124","0.661361038","552","4e:d5:dc:4e:3a:eb","aa:fb:4c:c5:9a:b1","172.20.0.3","172.20.0.2","TLSv1.2","Client Hello"
"125","0.661369402","66","aa:fb:4c:c5:9a:b1","4e:d5:dc:4e:3a:eb","172.20.0.2","172.20.0.3","TCP","4433 → 48234 [ACK] Seq=1 Ack=487 Win=64768 Len=0 TSval=2877228201 TSecr=2182657271"
"126","0.663363952","923","aa:fb:4c:c5:9a:b1","4e:d5:dc:4e:3a:eb","172.20.0.2","172.20.0.3","TLSv1.3","Server Hello, Change Cipher Spec, Application Data, Application Data, Application Data, Application Data"
"127","0.663397821","66","4e:d5:dc:4e:3a:eb","aa:fb:4c:c5:9a:b1","172.20.0.3","172.20.0.2","TCP","48234 → 4433 [ACK] Seq=487 Ack=858 Win=63488 Len=0 TSval=2182657273 TSecr=2877228203"
"128","0.666299868","146","4e:d5:dc:4e:3a:eb","aa:fb:4c:c5:9a:b1","172.20.0.3","172.20.0.2","TLSv1.3","Change Cipher Spec, Application Data"
"129","0.666377081","66","4e:d5:dc:4e:3a:eb","aa:fb:4c:c5:9a:b1","172.20.0.3","172.20.0.2","TCP","48234 → 4433 [RST, ACK] Seq=567 Ack=858 Win=64000 Len=0 TSval=2182657276 TSecr=2877228203"
"130","0.677760307","74","4e:d5:dc:4e:3a:eb","aa:fb:4c:c5:9a:b1","172.20.0.3","172.20.0.2","TCP","48248 → 4433 [SYN] Seq=0 Win=64240 Len=0 MSS=1460 SACK_PERM TSval=2182657287 TSecr=0 WS=128"
"131","0.677793762","74","aa:fb:4c:c5:9a:b1","4e:d5:dc:4e:3a:eb","172.20.0.2","172.20.0.3","TCP","4433 → 48248 [SYN, ACK] Seq=0 Ack=1 Win=65160 Len=0 MSS=1460 SACK_PERM TSval=2877228217 TSecr=2182657287 WS=128"
"132","0.677811717","66","4e:d5:dc:4e:3a:eb","aa:fb:4c:c5:9a:b1","172.20.0.3","172.20.0.2","TCP","48248 → 4433 [ACK] Seq=1 Ack=1 Win=64256 Len=0 TSval=2182657287 TSecr=2877228217"
"133","0.677862116","552","4e:d5:dc:4e:3a:eb","aa:fb:4c:c5:9a:b1","172.20.0.3","172.20.0.2","TLSv1.2","Client Hello"
"134","0.677869764","66","aa:fb:4c:c5:9a:b1","4e:d5:dc:4e:3a:eb","172.20.0.2","172.20.0.3","TCP","4433 → 48248 [ACK] Seq=1 Ack=487 Win=64768 Len=0 TSval=2877228217 TSecr=2182657287"
"135","0.883960198","924","aa:fb:4c:c5:9a:b1","4e:d5:dc:4e:3a:eb","172.20.0.2","172.20.0.3","TLSv1.3","Server Hello, Change Cipher Spec, Application Data, Application Data, Application Data, Application Data"
"136","0.884013730","66","4e:d5:dc:4e:3a:eb","aa:fb:4c:c5:9a:b1","172.20.0.3","172.20.0.2","TCP","48248 → 4433 [ACK] Seq=487 Ack=859 Win=63488 Len=0 TSval=2182657494 TSecr=2877228424"
"137","0.886994523","146","4e:d5:dc:4e:3a:eb","aa:fb:4c:c5:9a:b1","172.20.0.3","172.20.0.2","TLSv1.3","Change Cipher Spec, Application Data"
"138","0.887058510","66","4e:d5:dc:4e:3a:eb","aa:fb:4c:c5:9a:b1","172.20.0.3","172.20.0.2","TCP","48248 → 4433 [RST, ACK] Seq=567 Ack=859 Win=64000 Len=0 TSval=2182657497 TSecr=2877228424"
"139","0.898096005","74","4e:d5:dc:4e:3a:eb","aa:fb:4c:c5:9a:b1","172.20.0.3","172.20.0.2","TCP","48250 → 4433 [SYN] Seq=0 Win=64240 Len=0 MSS=1460 SACK_PERM TSval=2182657508 TSecr=0 WS=128"
"140","0.898121040","74","aa:fb:4c:c5:9a:b1","4e:d5:dc:4e:3a:eb","172.20.0.2","172.20.0.3","TCP","4433 → 48250 [SYN, ACK] Seq=0 Ack=1 Win=65160 Len=0 MSS=1460 SACK_PERM TSval=2877228438 TSecr=2182657508 WS=128"
"141","0.898138128","66","4e:d5:dc:4e:3a:eb","aa:fb:4c:c5:9a:b1","172.20.0.3","172.20.0.2","TCP","48250 → 4433 [ACK] Seq=1 Ack=1 Win=64256 Len=0 TSval=2182657508 TSecr=2877228438"
"142","0.898187975","552","4e:d5:dc:4e:3a:eb","aa:fb:4c:c5:9a:b1","172.20.0.3","172.20.0.2","TLSv1.2","Client Hello"
"143","0.898193835","66","aa:fb:4c:c5:9a:b1","4e:d5:dc:4e:3a:eb","172.20.0.2","172.20.0.3","TCP","4433 → 48250 [ACK] Seq=1 Ack=487 Win=64768 Len=0 TSval=2877228438 TSecr=2182657508"
"144","0.900122744","922","aa:fb:4c:c5:9a:b1","4e:d5:dc:4e:3a:eb","172.20.0.2","172.20.0.3","TLSv1.3","Server Hello, Change Cipher Spec, Application Data, Application Data, Application Data, Application Data"
"145","0.900152721","66","4e:d5:dc:4e:3a:eb","aa:fb:4c:c5:9a:b1","172.20.0.3","172.20.0.2","TCP","48250 → 4433 [ACK] Seq=487 Ack=857 Win=63488 Len=0 TSval=2182657510 TSecr=2877228440"
"146","0.903057412","146","4e:d5:dc:4e:3a:eb","aa:fb:4c:c5:9a:b1","172.20.0.3","172.20.0.2","TLSv1.3","Change Cipher Spec, Application Data"
"147","0.903130501","66","4e:d5:dc:4e:3a:eb","aa:fb:4c:c5:9a:b1","172.20.0.3","172.20.0.2","TCP","48250 → 4433 [RST, ACK] Seq=567 Ack=857 Win=64000 Len=0 TSval=2182657513 TSecr=2877228440"
"148","0.914535110","74","4e:d5:dc:4e:3a:eb","aa:fb:4c:c5:9a:b1","172.20.0.3","172.20.0.2","TCP","48252 → 4433 [SYN] Seq=0 Win=64240 Len=0 MSS=1460 SACK_PERM TSval=2182657524 TSecr=0 WS=128"
"149","0.914562229","74","aa:fb:4c:c5:9a:b1","4e:d5:dc:4e:3a:eb","172.20.0.2","172.20.0.3","TCP","4433 → 48252 [SYN, ACK] Seq=0 Ack=1 Win=65160 Len=0 MSS=1460 SACK_PERM TSval=2877228454 TSecr=2182657524 WS=128"
"150","0.914578989","66","4e:d5:dc:4e:3a:eb","aa:fb:4c:c5:9a:b1","172.20.0.3","172.20.0.2","TCP","48252 → 4433 [ACK] Seq=1 Ack=1 Win=64256 Len=0 TSval=2182657524 TSecr=2877228454"
"151","0.914616608","552","4e:d5:dc:4e:3a:eb","aa:fb:4c:c5:9a:b1","172.20.0.3","172.20.0.2","TLSv1.2","Client Hello"
"152","0.914621910","66","aa:fb:4c:c5:9a:b1","4e:d5:dc:4e:3a:eb","172.20.0.2","172.20.0.3","TCP","4433 → 48252 [ACK] Seq=1 Ack=487 Win=64768 Len=0 TSval=2877228454 TSecr=2182657524"
"153","0.916498107","924","aa:fb:4c:c5:9a:b1","4e:d5:dc:4e:3a:eb","172.20.0.2","172.20.0.3","TLSv1.3","Server Hello, Change Cipher Spec, Application Data, Application Data, Application Data, Application Data"
"154","0.916528680","66","4e:d5:dc:4e:3a:eb","aa:fb:4c:c5:9a:b1","172.20.0.3","172.20.0.2","TCP","48252 → 4433 [ACK] Seq=487 Ack=859 Win=63488 Len=0 TSval=2182657526 TSecr=2877228456"
"155","0.919212421","146","4e:d5:dc:4e:3a:eb","aa:fb:4c:c5:9a:b1","172.20.0.3","172.20.0.2","TLSv1.3","Change Cipher Spec, Application Data"
"156","0.919274191","66","4e:d5:dc:4e:3a:eb","aa:fb:4c:c5:9a:b1","172.20.0.3","172.20.0.2","TCP","48252 → 4433 [RST, ACK] Seq=567 Ack=859 Win=64000 Len=0 TSval=2182657529 TSecr=2877228456"
"157","0.930894775","74","4e:d5:dc:4e:3a:eb","aa:fb:4c:c5:9a:b1","172.20.0.3","172.20.0.2","TCP","48258 → 4433 [SYN] Seq=0 Win=64240 Len=0 MSS=1460 SACK_PERM TSval=2182657540 TSecr=0 WS=128"
"158","0.930926349","74","aa:fb:4c:c5:9a:b1","4e:d5:dc:4e:3a:eb","172.20.0.2","172.20.0.3","TCP","4433 → 48258 [SYN, ACK] Seq=0 Ack=1 Win=65160 Len=0 MSS=1460 SACK_PERM TSval=2877228470 TSecr=2182657540 WS=128"
"159","0.930960094","66","4e:d5:dc:4e:3a:eb","aa:fb:4c:c5:9a:b1","172.20.0.3","172.20.0.2","TCP","48258 → 4433 [ACK] Seq=1 Ack=1 Win=64256 Len=0 TSval=2182657541 TSecr=2877228470"
"160","0.931106180","552","4e:d5:dc:4e:3a:eb","aa:fb:4c:c5:9a:b1","172.20.0.3","172.20.0.2","TLSv1.2","Client Hello"
"161","0.931116539","66","aa:fb:4c:c5:9a:b1","4e:d5:dc:4e:3a:eb","172.20.0.2","172.20.0.3","TCP","4433 → 48258 [ACK] Seq=1 Ack=487 Win=64768 Len=0 TSval=2877228471 TSecr=2182657541"
"162","0.933067878","923","aa:fb:4c:c5:9a:b1","4e:d5:dc:4e:3a:eb","172.20.0.2","172.20.0.3","TLSv1.3","Server Hello, Change Cipher Spec, Application Data, Application Data, Application Data, Application Data"
"163","0.933095039","66","4e:d5:dc:4e:3a:eb","aa:fb:4c:c5:9a:b1","172.20.0.3","172.20.0.2","TCP","48258 → 4433 [ACK] Seq=487 Ack=858 Win=63488 Len=0 TSval=2182657543 TSecr=2877228473"
"164","0.935826798","146","4e:d5:dc:4e:3a:eb","aa:fb:4c:c5:9a:b1","172.20.0.3","172.20.0.2","TLSv1.3","Change Cipher Spec, Application Data"
"165","0.935894633","66","4e:d5:dc:4e:3a:eb","aa:fb:4c:c5:9a:b1","172.20.0.3","172.20.0.2","TCP","48258 → 4433 [RST, ACK] Seq=567 Ack=858 Win=64000 Len=0 TSval=2182657545 TSecr=2877228473"
"166","0.946970295","74","4e:d5:dc:4e:3a:eb","aa:fb:4c:c5:9a:b1","172.20.0.3","172.20.0.2","TCP","48272 → 4433 [SYN] Seq=0 Win=64240 Len=0 MSS=1460 SACK_PERM TSval=2182657556 TSecr=0 WS=128"
"167","0.946994893","74","aa:fb:4c:c5:9a:b1","4e:d5:dc:4e:3a:eb","172.20.0.2","172.20.0.3","TCP","4433 → 48272 [SYN, ACK] Seq=0 Ack=1 Win=65160 Len=0 MSS=1460 SACK_PERM TSval=2877228487 TSecr=2182657556 WS=128"
"168","0.947012035","66","4e:d5:dc:4e:3a:eb","aa:fb:4c:c5:9a:b1","172.20.0.3","172.20.0.2","TCP","48272 → 4433 [ACK] Seq=1 Ack=1 Win=64256 Len=0 TSval=2182657557 TSecr=2877228487"
"169","0.947050651","552","4e:d5:dc:4e:3a:eb","aa:fb:4c:c5:9a:b1","172.20.0.3","172.20.0.2","TLSv1.2","Client Hello"
"170","0.947056307","66","aa:fb:4c:c5:9a:b1","4e:d5:dc:4e:3a:eb","172.20.0.2","172.20.0.3","TCP","4433 → 48272 [ACK] Seq=1 Ack=487 Win=64768 Len=0 TSval=2877228487 TSecr=2182657557"
"171","0.949026257","922","aa:fb:4c:c5:9a:b1","4e:d5:dc:4e:3a:eb","172.20.0.2","172.20.0.3","TLSv1.3","Server Hello, Change Cipher Spec, Application Data, Application Data, Application Data, Application Data"
"172","0.949055632","66","4e:d5:dc:4e:3a:eb","aa:fb:4c:c5:9a:b1","172.20.0.3","172.20.0.2","TCP","48272 → 4433 [ACK] Seq=487 Ack=857 Win=63488 Len=0 TSval=2182657559 TSecr=2877228489"
"173","0.951667096","146","4e:d5:dc:4e:3a:eb","aa:fb:4c:c5:9a:b1","172.20.0.3","172.20.0.2","TLSv1.3","Change Cipher Spec, Application Data"
"174","0.951726722","66","4e:d5:dc:4e:3a:eb","aa:fb:4c:c5:9a:b1","172.20.0.3","172.20.0.2","TCP","48272 → 4433 [RST, ACK] Seq=567 Ack=857 Win=64000 Len=0 TSval=2182657561 TSecr=2877228489"
"175","0.963007324","74","4e:d5:dc:4e:3a:eb","aa:fb:4c:c5:9a:b1","172.20.0.3","172.20.0.2","TCP","48286 → 4433 [SYN] Seq=0 Win=64240 Len=0 MSS=1460 SACK_PERM TSval=2182657573 TSecr=0 WS=128"
"176","0.963036135","74","aa:fb:4c:c5:9a:b1","4e:d5:dc:4e:3a:eb","172.20.0.2","172.20.0.3","TCP","4433 → 48286 [SYN, ACK] Seq=0 Ack=1 Win=65160 Len=0 MSS=1460 SACK_PERM TSval=2877228503 TSecr=2182657573 WS=128"
"177","0.963055009","66","4e:d5:dc:4e:3a:eb","aa:fb:4c:c5:9a:b1","172.20.0.3","172.20.0.2","TCP","48286 → 4433 [ACK] Seq=1 Ack=1 Win=64256 Len=0 TSval=2182657573 TSecr=2877228503"
"178","0.963097424","552","4e:d5:dc:4e:3a:eb","aa:fb:4c:c5:9a:b1","172.20.0.3","172.20.0.2","TLSv1.2","Client Hello"
"179","0.963103781","66","aa:fb:4c:c5:9a:b1","4e:d5:dc:4e:3a:eb","172.20.0.2","172.20.0.3","TCP","4433 → 48286 [ACK] Seq=1 Ack=487 Win=64768 Len=0 TSval=2877228503 TSecr=2182657573"
"180","0.965069620","924","aa:fb:4c:c5:9a:b1","4e:d5:dc:4e:3a:eb","172.20.0.2","172.20.0.3","TLSv1.3","Server Hello, Change Cipher Spec, Application Data, Application Data, Application Data, Application Data"
"181","0.965101141","66","4e:d5:dc:4e:3a:eb","aa:fb:4c:c5:9a:b1","172.20.0.3","172.20.0.2","TCP","48286 → 4433 [ACK] Seq=487 Ack=859 Win=63488 Len=0 TSval=2182657575 TSecr=2877228505"
"182","0.967706989","146","4e:d5:dc:4e:3a:eb","aa:fb:4c:c5:9a:b1","172.20.0.3","172.20.0.2","TLSv1.3","Change Cipher Spec, Application Data"
"183","0.967760840","66","4e:d5:dc:4e:3a:eb","aa:fb:4c:c5:9a:b1","172.20.0.3","172.20.0.2","TCP","48286 → 4433 [RST, ACK] Seq=567 Ack=859 Win=64000 Len=0 TSval=2182657577 TSecr=2877228505"
"184","0.978824512","74","4e:d5:dc:4e:3a:eb","aa:fb:4c:c5:9a:b1","172.20.0.3","172.20.0.2","TCP","48302 → 4433 [SYN] Seq=0 Win=64240 Len=0 MSS=1460 SACK_PERM TSval=2182657588 TSecr=0 WS=128"
"185","0.978860175","74","aa:fb:4c:c5:9a:b1","4e:d5:dc:4e:3a:eb","172.20.0.2","172.20.0.3","TCP","4433 → 48302 [SYN, ACK] Seq=0 Ack=1 Win=65160 Len=0 MSS=1460 SACK_PERM TSval=2877228518 TSecr=2182657588 WS=128"
"186","0.978878954","66","4e:d5:dc:4e:3a:eb","aa:fb:4c:c5:9a:b1","172.20.0.3","172.20.0.2","TCP","48302 → 4433 [ACK] Seq=1 Ack=1 Win=64256 Len=0 TSval=2182657588 TSecr=2877228518"
"187","0.978926112","552","4e:d5:dc:4e:3a:eb","aa:fb:4c:c5:9a:b1","172.20.0.3","172.20.0.2","TLSv1.2","Client Hello"
"188","0.978940241","66","aa:fb:4c:c5:9a:b1","4e:d5:dc:4e:3a:eb","172.20.0.2","172.20.0.3","TCP","4433 → 48302 [ACK] Seq=1 Ack=487 Win=64768 Len=0 TSval=2877228519 TSecr=2182657588"
"189","0.980912811","923","aa:fb:4c:c5:9a:b1","4e:d5:dc:4e:3a:eb","172.20.0.2","172.20.0.3","TLSv1.3","Server Hello, Change Cipher Spec, Application Data, Application Data, Application Data, Application Data"
"190","0.980953504","66","4e:d5:dc:4e:3a:eb","aa:fb:4c:c5:9a:b1","172.20.0.3","172.20.0.2","TCP","48302 → 4433 [ACK] Seq=487 Ack=858 Win=63488 Len=0 TSval=2182657591 TSecr=2877228520"
"191","0.983576562","146","4e:d5:dc:4e:3a:eb","aa:fb:4c:c5:9a:b1","172.20.0.3","172.20.0.2","TLSv1.3","Change Cipher Spec, Application Data"
"192","0.983630143","66","4e:d5:dc:4e:3a:eb","aa:fb:4c:c5:9a:b1","172.20.0.3","172.20.0.2","TCP","48302 → 4433 [RST, ACK] Seq=567 Ack=858 Win=64000 Len=0 TSval=2182657593 TSecr=2877228520"
"193","0.994755535","74","4e:d5:dc:4e:3a:eb","aa:fb:4c:c5:9a:b1","172.20.0.3","172.20.0.2","TCP","48316 → 4433 [SYN] Seq=0 Win=64240 Len=0 MSS=1460 SACK_PERM TSval=2182657604 TSecr=0 WS=128"
"194","0.994782865","74","aa:fb:4c:c5:9a:b1","4e:d5:dc:4e:3a:eb","172.20.0.2","172.20.0.3","TCP","4433 → 48316 [SYN, ACK] Seq=0 Ack=1 Win=65160 Len=0 MSS=1460 SACK_PERM TSval=2877228534 TSecr=2182657604 WS=128"
"195","0.994799419","66","4e:d5:dc:4e:3a:eb","aa:fb:4c:c5:9a:b1","172.20.0.3","172.20.0.2","TCP","48316 → 4433 [ACK] Seq=1 Ack=1 Win=64256 Len=0 TSval=2182657604 TSecr=2877228534"
"196","0.994850582","552","4e:d5:dc:4e:3a:eb","aa:fb:4c:c5:9a:b1","172.20.0.3","172.20.0.2","TLSv1.2","Client Hello"
"197","0.994856799","66","aa:fb:4c:c5:9a:b1","4e:d5:dc:4e:3a:eb","172.20.0.2","172.20.0.3","TCP","4433 → 48316 [ACK] Seq=1 Ack=487 Win=64768 Len=0 TSval=2877228534 TSecr=2182657604"
"198","0.996828104","923","aa:fb:4c:c5:9a:b1","4e:d5:dc:4e:3a:eb","172.20.0.2","172.20.0.3","TLSv1.3","Server Hello, Change Cipher Spec, Application Data, Application Data, Application Data, Application Data"
"199","0.996864653","66","4e:d5:dc:4e:3a:eb","aa:fb:4c:c5:9a:b1","172.20.0.3","172.20.0.2","TCP","48316 → 4433 [ACK] Seq=487 Ack=858 Win=63488 Len=0 TSval=2182657606 TSecr=2877228536"
"200","0.999511811","146","4e:d5:dc:4e:3a:eb","aa:fb:4c:c5:9a:b1","172.20.0.3","172.20.0.2","TLSv1.3","Change Cipher Spec, Application Data"
"201","0.999572543","66","4e:d5:dc:4e:3a:eb","aa:fb:4c:c5:9a:b1","172.20.0.3","172.20.0.2","TCP","48316 → 4433 [RST, ACK] Seq=567 Ack=858 Win=64000 Len=0 TSval=2182657609 TSecr=2877228536"
"202","1.001168567","42","4e:d5:dc:4e:3a:eb","ff:ff:ff:ff:ff:ff",,,"ARP","ARP Announcement for 172.20.0.3"
"203","1.011047042","74","4e:d5:dc:4e:3a:eb","aa:fb:4c:c5:9a:b1","172.20.0.3","172.20.0.2","TCP","48330 → 4433 [SYN] Seq=0 Win=64240 Len=0 MSS=1460 SACK_PERM TSval=2182657621 TSecr=0 WS=128"
"204","1.011073107","74","aa:fb:4c:c5:9a:b1","4e:d5:dc:4e:3a:eb","172.20.0.2","172.20.0.3","TCP","4433 → 48330 [SYN, ACK] Seq=0 Ack=1 Win=65160 Len=0 MSS=1460 SACK_PERM TSval=2877228551 TSecr=2182657621 WS=128"
"205","1.011088981","66","4e:d5:dc:4e:3a:eb","aa:fb:4c:c5:9a:b1","172.20.0.3","172.20.0.2","TCP","48330 → 4433 [ACK] Seq=1 Ack=1 Win=64256 Len=0 TSval=2182657621 TSecr=2877228551"
"206","1.011128617","552","4e:d5:dc:4e:3a:eb","aa:fb:4c:c5:9a:b1","172.20.0.3","172.20.0.2","TLSv1.2","Client Hello"
"207","1.011132598","66","aa:fb:4c:c5:9a:b1","4e:d5:dc:4e:3a:eb","172.20.0.2","172.20.0.3","TCP","4433 → 48330 [ACK] Seq=1 Ack=487 Win=64768 Len=0 TSval=2877228551 TSecr=2182657621"
"208","1.013292195","924","aa:fb:4c:c5:9a:b1","4e:d5:dc:4e:3a:eb","172.20.0.2","172.20.0.3","TLSv1.3","Server Hello, Change Cipher Spec, Application Data, Application Data, Application Data, Application Data"
"209","1.013324018","66","4e:d5:dc:4e:3a:eb","aa:fb:4c:c5:9a:b1","172.20.0.3","172.20.0.2","TCP","48330 → 4433 [ACK] Seq=487 Ack=859 Win=63488 Len=0 TSval=2182657623 TSecr=2877228553"
"210","1.016125040","146","4e:d5:dc:4e:3a:eb","aa:fb:4c:c5:9a:b1","172.20.0.3","172.20.0.2","TLSv1.3","Change Cipher Spec, Application Data"
"211","1.016188429","66","4e:d5:dc:4e:3a:eb","aa:fb:4c:c5:9a:b1","172.20.0.3","172.20.0.2","TCP","48330 → 4433 [RST, ACK] Seq=567 Ack=859 Win=64000 Len=0 TSval=2182657626 TSecr=2877228553"
"212","1.027399292","74","4e:d5:dc:4e:3a:eb","aa:fb:4c:c5:9a:b1","172.20.0.3","172.20.0.2","TCP","48332 → 4433 [SYN] Seq=0 Win=64240 Len=0 MSS=1460 SACK_PERM TSval=2182657637 TSecr=0 WS=128"
"213","1.027427089","74","aa:fb:4c:c5:9a:b1","4e:d5:dc:4e:3a:eb","172.20.0.2","172.20.0.3","TCP","4433 → 48332 [SYN, ACK] Seq=0 Ack=1 Win=65160 Len=0 MSS=1460 SACK_PERM TSval=2877228567 TSecr=2182657637 WS=128"
"214","1.027444080","66","4e:d5:dc:4e:3a:eb","aa:fb:4c:c5:9a:b1","172.20.0.3","172.20.0.2","TCP","48332 → 4433 [ACK] Seq=1 Ack=1 Win=64256 Len=0 TSval=2182657637 TSecr=2877228567"
"215","1.027483212","552","4e:d5:dc:4e:3a:eb","aa:fb:4c:c5:9a:b1","172.20.0.3","172.20.0.2","TLSv1.2","Client Hello"
"216","1.027490398","66","aa:fb:4c:c5:9a:b1","4e:d5:dc:4e:3a:eb","172.20.0.2","172.20.0.3","TCP","4433 → 48332 [ACK] Seq=1 Ack=487 Win=64768 Len=0 TSval=2877228567 TSecr=2182657637"
"217","1.029432851","924","aa:fb:4c:c5:9a:b1","4e:d5:dc:4e:3a:eb","172.20.0.2","172.20.0.3","TLSv1.3","Server Hello, Change Cipher Spec, Application Data, Application Data, Application Data, Application Data"
"218","1.029469338","66","4e:d5:dc:4e:3a:eb","aa:fb:4c:c5:9a:b1","172.20.0.3","172.20.0.2","TCP","48332 → 4433 [ACK] Seq=487 Ack=859 Win=63488 Len=0 TSval=2182657639 TSecr=2877228569"
"219","1.032184776","146","4e:d5:dc:4e:3a:eb","aa:fb:4c:c5:9a:b1","172.20.0.3","172.20.0.2","TLSv1.3","Change Cipher Spec, Application Data"
"220","1.032252962","66","4e:d5:dc:4e:3a:eb","aa:fb:4c:c5:9a:b1","172.20.0.3","172.20.0.2","TCP","48332 → 4433 [RST, ACK] Seq=567 Ack=859 Win=64000 Len=0 TSval=2182657642 TSecr=2877228569"
"221","1.043625984","74","4e:d5:dc:4e:3a:eb","aa:fb:4c:c5:9a:b1","172.20.0.3","172.20.0.2","TCP","48344 → 4433 [SYN] Seq=0 Win=64240 Len=0 MSS=1460 SACK_PERM TSval=2182657653 TSecr=0 WS=128"
"222","1.043651806","74","aa:fb:4c:c5:9a:b1","4e:d5:dc:4e:3a:eb","172.20.0.2","172.20.0.3","TCP","4433 → 48344 [SYN, ACK] Seq=0 Ack=1 Win=65160 Len=0 MSS=1460 SACK_PERM TSval=2877228583 TSecr=2182657653 WS=128"
"223","1.043667422","66","4e:d5:dc:4e:3a:eb","aa:fb:4c:c5:9a:b1","172.20.0.3","172.20.0.2","TCP","48344 → 4433 [ACK] Seq=1 Ack=1 Win=64256 Len=0 TSval=2182657653 TSecr=2877228583"
"224","1.043707142","552","4e:d5:dc:4e:3a:eb","aa:fb:4c:c5:9a:b1","172.20.0.3","172.20.0.2","TLSv1.2","Client Hello"
"225","1.043724635","66","aa:fb:4c:c5:9a:b1","4e:d5:dc:4e:3a:eb","172.20.0.2","172.20.0.3","TCP","4433 → 48344 [ACK] Seq=1 Ack=487 Win=64768 Len=0 TSval=2877228583 TSecr=2182657653"
