frame.number,frame.time_relative,frame.len,eth.src,eth.dst,ip.src,ip.dst,_ws.col.protocol,_ws.col.info
"1","0.000000000","70","0e:bb:51:0e:00:62","33:33:00:00:00:02",,,"ICMPv6","Router Solicitation from 0e:bb:51:0e:00:62"
"2","7.029687995","42","6a:c1:c4:e0:14:71","ff:ff:ff:ff:ff:ff",,,"ARP","ARP Announcement for 172.20.0.3"
"3","7.063904216","42","6a:c1:c4:e0:14:71","ff:ff:ff:ff:ff:ff",,,"ARP","Who has 172.20.0.2? Tell 172.20.0.3"
"4","7.063938199","42","4e:3f:12:3b:4a:4e","6a:c1:c4:e0:14:71",,,"ARP","172.20.0.2 is at 4e:3f:12:3b:4a:4e"
"5","7.063947213","74","6a:c1:c4:e0:14:71","4e:3f:12:3b:4a:4e","172.20.0.3","172.20.0.2","TCP","38620 → 4433 [SYN] Seq=0 Win=64240 Len=0 MSS=1460 SACK_PERM TSval=2170132404 TSecr=0 WS=128"
"6","7.063988312","74","4e:3f:12:3b:4a:4e","6a:c1:c4:e0:14:71","172.20.0.2","172.20.0.3","TCP","4433 → 38620 [SYN, ACK] Seq=0 Ack=1 Win=65160 Len=0 MSS=1460 SACK_PERM TSval=2864703335 TSecr=2170132404 WS=128"
"7","7.064012322","66","6a:c1:c4:e0:14:71","4e:3f:12:3b:4a:4e","172.20.0.3","172.20.0.2","TCP","38620 → 4433 [ACK] Seq=1 Ack=1 Win=64256 Len=0 TSval=2170132405 TSecr=2864703335"
"8","7.064073438","2056","6a:c1:c4:e0:14:71","4e:3f:12:3b:4a:4e","172.20.0.3","172.20.0.2","TLSv1.2","Client Hello"
"9","7.064083955","66","4e:3f:12:3b:4a:4e","6a:c1:c4:e0:14:71","172.20.0.2","172.20.0.3","TCP","4433 → 38620 [ACK] Seq=1 Ack=1991 Win=64128 Len=0 TSval=2864703335 TSecr=2170132405"
"10","7.071989293","1097","4e:3f:12:3b:4a:4e","6a:c1:c4:e0:14:71","172.20.0.2","172.20.0.3","SSL","[TCP Previous segment not captured] , Continuation Data"
"11","7.072035639","78","6a:c1:c4:e0:14:71","4e:3f:12:3b:4a:4e","172.20.0.3","172.20.0.2","TCP","[TCP Dup ACK 7#1] 38620 → 4433 [ACK] Seq=1991 Ack=1 Win=64256 Len=0 TSval=2170132413 TSecr=2864703335 SLE=1449 SRE=2480"
"12","7.072046907","1514","4e:3f:12:3b:4a:4e","6a:c1:c4:e0:14:71","172.20.0.2","172.20.0.3","TCP","[TCP Out-Of-Order] 4433 → 38620 [ACK] Seq=1 Ack=1991 Win=64128 Len=1448 TSval=2864703343 TSecr=2170132413"
"13","7.072061242","66","6a:c1:c4:e0:14:71","4e:3f:12:3b:4a:4e","172.20.0.3","172.20.0.2","TCP","38620 → 4433 [ACK] Seq=1991 Ack=2480 Win=64128 Len=0 TSval=2170132413 TSecr=2864703343"
"14","7.077191029","146","6a:c1:c4:e0:14:71","4e:3f:12:3b:4a:4e","172.20.0.3","172.20.0.2","TLSv1.2","Change Cipher Spec, Application Data"
"15","7.077265237","66","6a:c1:c4:e0:14:71","4e:3f:12:3b:4a:4e","172.20.0.3","172.20.0.2","TCP","38620 → 4433 [RST, ACK] Seq=2071 Ack=2480 Win=64128 Len=0 TSval=2170132418 TSecr=2864703343"
"16","7.088576324","74","6a:c1:c4:e0:14:71","4e:3f:12:3b:4a:4e","172.20.0.3","172.20.0.2","TCP","38622 → 4433 [SYN] Seq=0 Win=64240 Len=0 MSS=1460 SACK_PERM TSval=2170132429 TSecr=0 WS=128"
"17","7.088604051","74","4e:3f:12:3b:4a:4e","6a:c1:c4:e0:14:71","172.20.0.2","172.20.0.3","TCP","4433 → 38622 [SYN, ACK] Seq=0 Ack=1 Win=65160 Len=0 MSS=1460 SACK_PERM TSval=2864703359 TSecr=2170132429 WS=128"
"18","7.088623179","66","6a:c1:c4:e0:14:71","4e:3f:12:3b:4a:4e","172.20.0.3","172.20.0.2","TCP","38622 → 4433 [ACK] Seq=1 Ack=1 Win=64256 Len=0 TSval=2170132429 TSecr=2864703359"
"19","7.088670887","2056","6a:c1:c4:e0:14:71","4e:3f:12:3b:4a:4e","172.20.0.3","172.20.0.2","TLSv1.2","Client Hello"
"20","7.088676994","66","4e:3f:12:3b:4a:4e","6a:c1:c4:e0:14:71","172.20.0.2","172.20.0.3","TCP","4433 → 38622 [ACK] Seq=1 Ack=1991 Win=64128 Len=0 TSval=2864703359 TSecr=2170132429"
"21","7.092008590","2545","4e:3f:12:3b:4a:4e","6a:c1:c4:e0:14:71","172.20.0.2","172.20.0.3","TLSv1.3","Server Hello, Change Cipher Spec, Application Data, Application Data, Application Data, Application Data"
"22","7.092045274","66","6a:c1:c4:e0:14:71","4e:3f:12:3b:4a:4e","172.20.0.3","172.20.0.2","TCP","38622 → 4433 [ACK] Seq=1991 Ack=2480 Win=64128 Len=0 TSval=2170132433 TSecr=2864703363"
"23","7.097255148","146","6a:c1:c4:e0:14:71","4e:3f:12:3b:4a:4e","172.20.0.3","172.20.0.2","TLSv1.3","Change Cipher Spec, Application Data"
"24","7.097331096","66","6a:c1:c4:e0:14:71","4e:3f:12:3b:4a:4e","172.20.0.3","172.20.0.2","TCP","38622 → 4433 [RST, ACK] Seq=2071 Ack=2480 Win=64128 Len=0 TSval=2170132438 TSecr=2864703363"
"25","7.108222995","74","6a:c1:c4:e0:14:71","4e:3f:12:3b:4a:4e","172.20.0.3","172.20.0.2","TCP","38638 → 4433 [SYN] Seq=0 Win=64240 Len=0 MSS=1460 SACK_PERM TSval=2170132449 TSecr=0 WS=128"
"26","8.030158314","42","6a:c1:c4:e0:14:71","ff:ff:ff:ff:ff:ff",,,"ARP","ARP Announcement for 172.20.0.3"
"27","8.128025712","74","4e:3f:12:3b:4a:4e","6a:c1:c4:e0:14:71","172.20.0.2","172.20.0.3","TCP","4433 → 38638 [SYN, ACK] Seq=0 Ack=1 Win=65160 Len=0 MSS=1460 SACK_PERM TSval=2864704399 TSecr=2170132449 WS=128"
"28","8.128049684","74","6a:c1:c4:e0:14:71","4e:3f:12:3b:4a:4e","172.20.0.3","172.20.0.2","TCP","[TCP Retransmission] 38638 → 4433 [SYN] Seq=0 Win=64240 Len=0 MSS=1460 SACK_PERM TSval=2170133469 TSecr=0 WS=128"
"29","8.128064805","74","4e:3f:12:3b:4a:4e","6a:c1:c4:e0:14:71","172.20.0.2","172.20.0.3","TCP","[TCP Out-Of-Order] 4433 → 38638 [SYN, ACK] Seq=0 Ack=1 Win=65160 Len=0 MSS=1460 SACK_PERM TSval=2864704399 TSecr=2170132449 WS=128"
"30","8.128100011","66","6a:c1:c4:e0:14:71","4e:3f:12:3b:4a:4e","172.20.0.3","172.20.0.2","TCP","38638 → 4433 [ACK] Seq=1 Ack=1 Win=64256 Len=0 TSval=2170133469 TSecr=2864704399"
"31","8.128133575","66","6a:c1:c4:e0:14:71","4e:3f:12:3b:4a:4e","172.20.0.3","172.20.0.2","TCP","[TCP Dup ACK 30#1] 38638 → 4433 [ACK] Seq=1 Ack=1 Win=64256 Len=0 TSval=2170133469 TSecr=2864704399"
"32","8.128190783","2056","6a:c1:c4:e0:14:71","4e:3f:12:3b:4a:4e","172.20.0.3","172.20.0.2","TLSv1.2","Client Hello"
"33","8.128197968","66","4e:3f:12:3b:4a:4e","6a:c1:c4:e0:14:71","172.20.0.2","172.20.0.3","TCP","4433 → 38638 [ACK] Seq=1 Ack=1991 Win=64128 Len=0 TSval=2864704399 TSecr=2170133469"
"34","8.131455300","1514","4e:3f:12:3b:4a:4e","6a:c1:c4:e0:14:71","172.20.0.2","172.20.0.3","SSL",""
"35","8.131486169","66","6a:c1:c4:e0:14:71","4e:3f:12:3b:4a:4e","172.20.0.3","172.20.0.2","TCP","38638 → 4433 [ACK] Seq=1991 Ack=1449 Win=64128 Len=0 TSval=2170133472 TSecr=2864704402"
"36","8.131495207","1097","4e:3f:12:3b:4a:4e","6a:c1:c4:e0:14:71","172.20.0.2","172.20.0.3","TLSv1.3","Server Hello, Change Cipher Spec, Application Data, Application Data, Application Data, Application Data"
"37","8.131500333","66","6a:c1:c4:e0:14:71","4e:3f:12:3b:4a:4e","172.20.0.3","172.20.0.2","TCP","38638 → 4433 [ACK] Seq=1991 Ack=2480 Win=64128 Len=0 TSval=2170133472 TSecr=2864704402"
"38","8.136724276","146","6a:c1:c4:e0:14:71","4e:3f:12:3b:4a:4e","172.20.0.3","172.20.0.2","TLSv1.3","Change Cipher Spec, Application Data"
"39","8.136799726","66","6a:c1:c4:e0:14:71","4e:3f:12:3b:4a:4e","172.20.0.3","172.20.0.2","TCP","38638 → 4433 [RST, ACK] Seq=2071 Ack=2480 Win=64128 Len=0 TSval=2170133477 TSecr=2864704402"
"40","8.148171445","74","6a:c1:c4:e0:14:71","4e:3f:12:3b:4a:4e","172.20.0.3","172.20.0.2","TCP","38642 → 4433 [SYN] Seq=0 Win=64240 Len=0 MSS=1460 SACK_PERM TSval=2170133489 TSecr=0 WS=128"
"41","9.031045120","42","6a:c1:c4:e0:14:71","ff:ff:ff:ff:ff:ff",,,"ARP","ARP Announcement for 172.20.0.3"
"42","9.153014252","74","4e:3f:12:3b:4a:4e","6a:c1:c4:e0:14:71","172.20.0.2","172.20.0.3","TCP","4433 → 38642 [SYN, ACK] Seq=0 Ack=1 Win=65160 Len=0 MSS=1460 SACK_PERM TSval=2864705424 TSecr=2170133489 WS=128"
"43","9.153028377","74","6a:c1:c4:e0:14:71","4e:3f:12:3b:4a:4e","172.20.0.3","172.20.0.2","TCP","[TCP Retransmission] 38642 → 4433 [SYN] Seq=0 Win=64240 Len=0 MSS=1460 SACK_PERM TSval=2170134494 TSecr=0 WS=128"
"44","9.153046005","74","4e:3f:12:3b:4a:4e","6a:c1:c4:e0:14:71","172.20.0.2","172.20.0.3","TCP","[TCP Retransmission] 4433 → 38642 [SYN, ACK] Seq=0 Ack=1 Win=65160 Len=0 MSS=1460 SACK_PERM TSval=2864705424 TSecr=2170133489 WS=128"
"45","9.153077823","66","6a:c1:c4:e0:14:71","4e:3f:12:3b:4a:4e","172.20.0.3","172.20.0.2","TCP","38642 → 4433 [ACK] Seq=1 Ack=1 Win=64256 Len=0 TSval=2170134494 TSecr=2864705424"
"46","9.153103680","66","6a:c1:c4:e0:14:71","4e:3f:12:3b:4a:4e","172.20.0.3","172.20.0.2","TCP","[TCP Dup ACK 45#1] 38642 → 4433 [ACK] Seq=1 Ack=1 Win=64256 Len=0 TSval=2170134494 TSecr=2864705424"
"47","9.153151402","2056","6a:c1:c4:e0:14:71","4e:3f:12:3b:4a:4e","172.20.0.3","172.20.0.2","TLSv1.2","Client Hello"
"48","9.153158062","66","4e:3f:12:3b:4a:4e","6a:c1:c4:e0:14:71","172.20.0.2","172.20.0.3","TCP","4433 → 38642 [ACK] Seq=1 Ack=1991 Win=64128 Len=0 TSval=2864705424 TSecr=2170134494"
"49","9.156443705","1514","4e:3f:12:3b:4a:4e","6a:c1:c4:e0:14:71","172.20.0.2","172.20.0.3","SSL",""
"50","9.156474840","66","6a:c1:c4:e0:14:71","4e:3f:12:3b:4a:4e","172.20.0.3","172.20.0.2","TCP","38642 → 4433 [ACK] Seq=1991 Ack=1449 Win=64128 Len=0 TSval=2170134497 TSecr=2864705427"
"51","9.156483176","1097","4e:3f:12:3b:4a:4e","6a:c1:c4:e0:14:71","172.20.0.2","172.20.0.3","TLSv1.3","Server Hello, Change Cipher Spec, Application Data, Application Data, Application Data, Application Data"
"52","9.156488668","66","6a:c1:c4:e0:14:71","4e:3f:12:3b:4a:4e","172.20.0.3","172.20.0.2","TCP","38642 → 4433 [ACK] Seq=1991 Ack=2480 Win=64128 Len=0 TSval=2170134497 TSecr=2864705427"
"53","9.161690168","146","6a:c1:c4:e0:14:71","4e:3f:12:3b:4a:4e","172.20.0.3","172.20.0.2","TLSv1.3","Change Cipher Spec, Application Data"
"54","9.161768801","66","6a:c1:c4:e0:14:71","4e:3f:12:3b:4a:4e","172.20.0.3","172.20.0.2","TCP","38642 → 4433 [RST, ACK] Seq=2071 Ack=2480 Win=64128 Len=0 TSval=2170134502 TSecr=2864705427"
"55","9.172858869","74","6a:c1:c4:e0:14:71","4e:3f:12:3b:4a:4e","172.20.0.3","172.20.0.2","TCP","38652 → 4433 [SYN] Seq=0 Win=64240 Len=0 MSS=1460 SACK_PERM TSval=2170134513 TSecr=0 WS=128"
"56","9.172901300","74","4e:3f:12:3b:4a:4e","6a:c1:c4:e0:14:71","172.20.0.2","172.20.0.3","TCP","4433 → 38652 [SYN, ACK] Seq=0 Ack=1 Win=65160 Len=0 MSS=1460 SACK_PERM TSval=2864705443 TSecr=2170134513 WS=128"
"57","9.172928199","66","6a:c1:c4:e0:14:71","4e:3f:12:3b:4a:4e","172.20.0.3","172.20.0.2","TCP","38652 → 4433 [ACK] Seq=1 Ack=1 Win=64256 Len=0 TSval=2170134513 TSecr=2864705443"
"58","9.172983300","2056","6a:c1:c4:e0:14:71","4e:3f:12:3b:4a:4e","172.20.0.3","172.20.0.2","TLSv1.2","Client Hello"
"59","9.172988647","66","4e:3f:12:3b:4a:4e","6a:c1:c4:e0:14:71","172.20.0.2","172.20.0.3","TCP","4433 → 38652 [ACK] Seq=1 Ack=1991 Win=64128 Len=0 TSval=2864705444 TSecr=2170134514"
"60","9.179983501","1096","4e:3f:12:3b:4a:4e","6a:c1:c4:e0:14:71","172.20.0.2","172.20.0.3","SSL","[TCP Previous segment not captured] , Continuation Data"
"61","9.180010794","78","6a:c1:c4:e0:14:71","4e:3f:12:3b:4a:4e","172.20.0.3","172.20.0.2","TCP","[TCP Dup ACK 57#1] 38652 → 4433 [ACK] Seq=1991 Ack=1 Win=64256 Len=0 TSval=2170134521 TSecr=2864705444 SLE=1449 SRE=2479"
"62","10.625003336","1514","4e:3f:12:3b:4a:4e","6a:c1:c4:e0:14:71","172.20.0.2","172.20.0.3","TCP","[TCP Retransmission] 4433 → 38652 [ACK] Seq=1 Ack=1991 Win=64128 Len=1448 TSval=2864706896 TSecr=2170134521"
"63","10.625060164","66","6a:c1:c4:e0:14:71","4e:3f:12:3b:4a:4e","172.20.0.3","172.20.0.2","TCP","38652 → 4433 [ACK] Seq=1991 Ack=2479 Win=64128 Len=0 TSval=2170135966 TSecr=2864706896"
"64","10.631469546","146","6a:c1:c4:e0:14:71","4e:3f:12:3b:4a:4e","172.20.0.3","172.20.0.2","TLSv1.2","Change Cipher Spec, Application Data"
"65","10.631606774","66","6a:c1:c4:e0:14:71","4e:3f:12:3b:4a:4e","172.20.0.3","172.20.0.2","TCP","38652 → 4433 [RST, ACK] Seq=2071 Ack=2479 Win=64128 Len=0 TSval=2170135972 TSecr=2864706896"
"66","10.644379876","74","6a:c1:c4:e0:14:71","4e:3f:12:3b:4a:4e","172.20.0.3","172.20.0.2","TCP","38658 → 4433 [SYN] Seq=0 Win=64240 Len=0 MSS=1460 SACK_PERM TSval=2170135985 TSecr=0 WS=128"
"67","10.644409970","74","4e:3f:12:3b:4a:4e","6a:c1:c4:e0:14:71","172.20.0.2","172.20.0.3","TCP","4433 → 38658 [SYN, ACK] Seq=0 Ack=1 Win=65160 Len=0 MSS=1460 SACK_PERM TSval=2864706915 TSecr=2170135985 WS=128"
"68","10.644429050","66","6a:c1:c4:e0:14:71","4e:3f:12:3b:4a:4e","172.20.0.3","172.20.0.2","TCP","38658 → 4433 [ACK] Seq=1 Ack=1 Win=64256 Len=0 TSval=2170135985 TSecr=2864706915"
"69","10.644477091","2056","6a:c1:c4:e0:14:71","4e:3f:12:3b:4a:4e","172.20.0.3","172.20.0.2","TLSv1.2","Client Hello"
"70","10.644501842","66","4e:3f:12:3b:4a:4e","6a:c1:c4:e0:14:71","172.20.0.2","172.20.0.3","TCP","4433 → 38658 [ACK] Seq=1 Ack=1991 Win=64128 Len=0 TSval=2864706915 TSecr=2170135985"
"71","10.647774330","2545","4e:3f:12:3b:4a:4e","6a:c1:c4:e0:14:71","172.20.0.2","172.20.0.3","TLSv1.3","Server Hello, Change Cipher Spec, Application Data, Application Data, Application Data, Application Data"
"72","10.647816491","66","6a:c1:c4:e0:14:71","4e:3f:12:3b:4a:4e","172.20.0.3","172.20.0.2","TCP","38658 → 4433 [ACK] Seq=1991 Ack=2480 Win=64128 Len=0 TSval=2170135988 TSecr=2864706918"
"73","10.653027714","146","6a:c1:c4:e0:14:71","4e:3f:12:3b:4a:4e","172.20.0.3","172.20.0.2","TLSv1.3","Change Cipher Spec, Application Data"
"74","10.653111100","66","6a:c1:c4:e0:14:71","4e:3f:12:3b:4a:4e","172.20.0.3","172.20.0.2","TCP","38658 → 4433 [RST, ACK] Seq=2071 Ack=2480 Win=64128 Len=0 TSval=2170135994 TSecr=2864706918"
"75","10.664884022","74","6a:c1:c4:e0:14:71","4e:3f:12:3b:4a:4e","172.20.0.3","172.20.0.2","TCP","38662 → 4433 [SYN] Seq=0 Win=64240 Len=0 MSS=1460 SACK_PERM TSval=2170136005 TSecr=0 WS=128"
"76","10.664918638","74","4e:3f:12:3b:4a:4e","6a:c1:c4:e0:14:71","172.20.0.2","172.20.0.3","TCP","4433 → 38662 [SYN, ACK] Seq=0 Ack=1 Win=65160 Len=0 MSS=1460 SACK_PERM TSval=2864706935 TSecr=2170136005 WS=128"
"77","10.664939509","66","6a:c1:c4:e0:14:71","4e:3f:12:3b:4a:4e","172.20.0.3","172.20.0.2","TCP","38662 → 4433 [ACK] Seq=1 Ack=1 Win=64256 Len=0 TSval=2170136005 TSecr=2864706935"
"78","10.665067075","2056","6a:c1:c4:e0:14:71","4e:3f:12:3b:4a:4e","172.20.0.3","172.20.0.2","TLSv1.2","Client Hello"
"79","10.665074854","66","4e:3f:12:3b:4a:4e","6a:c1:c4:e0:14:71","172.20.0.2","172.20.0.3","TCP","4433 → 38662 [ACK] Seq=1 Ack=1991 Win=64128 Len=0 TSval=2864706936 TSecr=2170136006"
"80","10.668474145","2544","4e:3f:12:3b:4a:4e","6a:c1:c4:e0:14:71","172.20.0.2","172.20.0.3","TLSv1.3","Server Hello, Change Cipher Spec, Application Data, Application Data, Application Data, Application Data"
"81","10.668511217","66","6a:c1:c4:e0:14:71","4e:3f:12:3b:4a:4e","172.20.0.3","172.20.0.2","TCP","38662 → 4433 [ACK] Seq=1991 Ack=2479 Win=64128 Len=0 TSval=2170136009 TSecr=2864706939"
"82","10.673924346","146","6a:c1:c4:e0:14:71","4e:3f:12:3b:4a:4e","172.20.0.3","172.20.0.2","TLSv1.3","Change Cipher Spec, Application Data"
"83","10.674024290","66","6a:c1:c4:e0:14:71","4e:3f:12:3b:4a:4e","172.20.0.3","172.20.0.2","TCP","38662 → 4433 [RST, ACK] Seq=2071 Ack=2479 Win=64128 Len=0 TSval=2170136015 TSecr=2864706939"
"84","10.685962454","74","6a:c1:c4:e0:14:71","4e:3f:12:3b:4a:4e","172.20.0.3","172.20.0.2","TCP","38664 → 4433 [SYN] Seq=0 Win=64240 Len=0 MSS=1460 SACK_PERM TSval=2170136026 TSecr=0 WS=128"
"85","10.685997964","74","4e:3f:12:3b:4a:4e","6a:c1:c4:e0:14:71","172.20.0.2","172.20.0.3","TCP","4433 → 38664 [SYN, ACK] Seq=0 Ack=1 Win=65160 Len=0 MSS=1460 SACK_PERM TSval=2864706957 TSecr=2170136026 WS=128"
"86","10.686017521","66","6a:c1:c4:e0:14:71","4e:3f:12:3b:4a:4e","172.20.0.3","172.20.0.2","TCP","38664 → 4433 [ACK] Seq=1 Ack=1 Win=64256 Len=0 TSval=2170136027 TSecr=2864706957"
"87","10.686069833","2056","6a:c1:c4:e0:14:71","4e:3f:12:3b:4a:4e","172.20.0.3","172.20.0.2","TLSv1.2","Client Hello"
"88","10.689841020","2545","4e:3f:12:3b:4a:4e","6a:c1:c4:e0:14:71","172.20.0.2","172.20.0.3","TLSv1.3","Server Hello, Change Cipher Spec, Application Data, Application Data, Application Data, Application Data"
"89","10.689905276","66","6a:c1:c4:e0:14:71","4e:3f:12:3b:4a:4e","172.20.0.3","172.20.0.2","TCP","38664 → 4433 [ACK] Seq=1991 Ack=2480 Win=64128 Len=0 TSval=2170136030 TSecr=2864706960"
"90","10.695104688","146","6a:c1:c4:e0:14:71","4e:3f:12:3b:4a:4e","172.20.0.3","172.20.0.2","TLSv1.3","Change Cipher Spec, Application Data"
"91","10.695189587","66","6a:c1:c4:e0:14:71","4e:3f:12:3b:4a:4e","172.20.0.3","172.20.0.2","TCP","38664 → 4433 [RST, ACK] Seq=2071 Ack=2480 Win=64128 Len=0 TSval=2170136036 TSecr=2864706960"
"92","10.706501142","74","6a:c1:c4:e0:14:71","4e:3f:12:3b:4a:4e","172.20.0.3","172.20.0.2","TCP","38678 → 4433 [SYN] Seq=0 Win=64240 Len=0 MSS=1460 SACK_PERM TSval=2170136047 TSecr=0 WS=128"
"93","10.706530393","74","4e:3f:12:3b:4a:4e","6a:c1:c4:e0:14:71","172.20.0.2","172.20.0.3","TCP","4433 → 38678 [SYN, ACK] Seq=0 Ack=1 Win=65160 Len=0 MSS=1460 SACK_PERM TSval=2864706977 TSecr=2170136047 WS=128"
"94","10.706547935","66","6a:c1:c4:e0:14:71","4e:3f:12:3b:4a:4e","172.20.0.3","172.20.0.2","TCP","38678 → 4433 [ACK] Seq=1 Ack=1 Win=64256 Len=0 TSval=2170136047 TSecr=2864706977"
"95","10.706595290","2056","6a:c1:c4:e0:14:71","4e:3f:12:3b:4a:4e","172.20.0.3","172.20.0.2","TLSv1.2","Client Hello"
"96","10.706602369","66","4e:3f:12:3b:4a:4e","6a:c1:c4:e0:14:71","172.20.0.2","172.20.0.3","TCP","4433 → 38678 [ACK] Seq=1 Ack=1991 Win=64128 Len=0 TSval=2864706977 TSecr=2170136047"
"97","10.709989363","2544","4e:3f:12:3b:4a:4e","6a:c1:c4:e0:14:71","172.20.0.2","172.20.0.3","TLSv1.3","Server Hello, Change Cipher Spec, Application Data, Application Data, Application Data, Application Data"
"98","10.710030602","66","6a:c1:c4:e0:14:71","4e:3f:12:3b:4a:4e","172.20.0.3","172.20.0.2","TCP","38678 → 4433 [ACK] Seq=1991 Ack=2479 Win=64128 Len=0 TSval=2170136051 TSecr=2864706981"
"99","10.715534680","146","6a:c1:c4:e0:14:71","4e:3f:12:3b:4a:4e","172.20.0.3","172.20.0.2","TLSv1.3","Change Cipher Spec, Application Data"
"100","10.715629474","66","6a:c1:c4:e0:14:71","4e:3f:12:3b:4a:4e","172.20.0.3","172.20.0.2","TCP","38678 → 4433 [RST, ACK] Seq=2071 Ack=2479 Win=64128 Len=0 TSval=2170136056 TSecr=2864706981"
"101","10.727362978","74","6a:c1:c4:e0:14:71","4e:3f:12:3b:4a:4e","172.20.0.3","172.20.0.2","TCP","38692 → 4433 [SYN] Seq=0 Win=64240 Len=0 MSS=1460 SACK_PERM TSval=2170136068 TSecr=0 WS=128"
"102","15.359322589","74","4e:3f:12:3b:4a:4e","6a:c1:c4:e0:14:71","172.20.0.2","172.20.0.3","TCP","4433 → 38692 [SYN, ACK] Seq=0 Ack=1 Win=65160 Len=0 MSS=1460 SACK_PERM TSval=2864708047 TSecr=2170136068 WS=128"
"103","15.359351341","74","6a:c1:c4:e0:14:71","4e:3f:12:3b:4a:4e","172.20.0.3","172.20.0.2","TCP","[TCP Retransmission] 38692 → 4433 [SYN] Seq=0 Win=64240 Len=0 MSS=1460 SACK_PERM TSval=2170137117 TSecr=0 WS=128"
"104","15.359366969","74","4e:3f:12:3b:4a:4e","6a:c1:c4:e0:14:71","172.20.0.2","172.20.0.3","TCP","[TCP Retransmission] 4433 → 38692 [SYN, ACK] Seq=0 Ack=1 Win=65160 Len=0 MSS=1460 SACK_PERM TSval=2864708047 TSecr=2170136068 WS=128"
"105","15.359405134","66","6a:c1:c4:e0:14:71","4e:3f:12:3b:4a:4e","172.20.0.3","172.20.0.2","TCP","38692 → 4433 [ACK] Seq=1 Ack=1 Win=64256 Len=0 TSval=2170137117 TSecr=2864708047"
"106","15.359435435","66","6a:c1:c4:e0:14:71","4e:3f:12:3b:4a:4e","172.20.0.3","172.20.0.2","TCP","[TCP Dup ACK 105#1] 38692 → 4433 [ACK] Seq=1 Ack=1 Win=64256 Len=0 TSval=2170137117 TSecr=2864708047"
"107","15.359498514","2056","6a:c1:c4:e0:14:71","4e:3f:12:3b:4a:4e","172.20.0.3","172.20.0.2","TLSv1.2","Client Hello"
"108","15.359505401","66","4e:3f:12:3b:4a:4e","6a:c1:c4:e0:14:71","172.20.0.2","172.20.0.3","TCP","4433 → 38692 [ACK] Seq=1 Ack=1991 Win=64128 Len=0 TSval=2864708047 TSecr=2170137117"
"109","15.775293236","1514","4e:3f:12:3b:4a:4e","6a:c1:c4:e0:14:71","172.20.0.2","172.20.0.3","SSL",""
"110","15.775377323","66","6a:c1:c4:e0:14:71","4e:3f:12:3b:4a:4e","172.20.0.3","172.20.0.2","TCP","38692 → 4433 [ACK] Seq=1991 Ack=1449 Win=64128 Len=0 TSval=2170137533 TSecr=2864708463"
"111","15.775389403","1095","4e:3f:12:3b:4a:4e","6a:c1:c4:e0:14:71","172.20.0.2","172.20.0.3","TLSv1.3","Server Hello, Change Cipher Spec, Application Data, Application Data, Application Data, Application Data"
"112","15.775397760","66","6a:c1:c4:e0:14:71","4e:3f:12:3b:4a:4e","172.20.0.3","172.20.0.2","TCP","38692 → 4433 [ACK] Seq=1991 Ack=2478 Win=64128 Len=0 TSval=2170137533 TSecr=2864708463"
"113","15.781778347","146","6a:c1:c4:e0:14:71","4e:3f:12:3b:4a:4e","172.20.0.3","172.20.0.2","TLSv1.3","Change Cipher Spec, Application Data"
"114","15.781862450","66","6a:c1:c4:e0:14:71","4e:3f:12:3b:4a:4e","172.20.0.3","172.20.0.2","TCP","38692 → 4433 [RST, ACK] Seq=2071 Ack=2478 Win=64128 Len=0 TSval=2170137539 TSecr=2864708463"
"115","15.793277248","74","6a:c1:c4:e0:14:71","4e:3f:12:3b:4a:4e","172.20.0.3","172.20.0.2","TCP","37566 → 4433 [SYN] Seq=0 Win=64240 Len=0 MSS=1460 SACK_PERM TSval=2170137550 TSecr=0 WS=128"
"116","15.793307656","74","4e:3f:12:3b:4a:4e","6a:c1:c4:e0:14:71","172.20.0.2","172.20.0.3","TCP","4433 → 37566 [SYN, ACK] Seq=0 Ack=1 Win=65160 Len=0 MSS=1460 SACK_PERM TSval=2864708481 TSecr=2170137550 WS=128"
"117","15.793326930","66","6a:c1:c4:e0:14:71","4e:3f:12:3b:4a:4e","172.20.0.3","172.20.0.2","TCP","37566 → 4433 [ACK] Seq=1 Ack=1 Win=64256 Len=0 TSval=2170137551 TSecr=2864708481"
"118","15.793373179","2056","6a:c1:c4:e0:14:71","4e:3f:12:3b:4a:4e","172.20.0.3","172.20.0.2","TLSv1.2","Client Hello"
"119","15.793381027","66","4e:3f:12:3b:4a:4e","6a:c1:c4:e0:14:71","172.20.0.2","172.20.0.3","TCP","4433 → 37566 [ACK] Seq=1 Ack=1991 Win=64128 Len=0 TSval=2864708481 TSecr=2170137551"
"120","15.798549627","2545","4e:3f:12:3b:4a:4e","6a:c1:c4:e0:14:71","172.20.0.2","172.20.0.3","TLSv1.3","Server Hello, Change Cipher Spec, Application Data, Application Data, Application Data, Application Data"
"121","15.798615336","66","6a:c1:c4:e0:14:71","4e:3f:12:3b:4a:4e","172.20.0.3","172.20.0.2","TCP","37566 → 4433 [ACK] Seq=1991 Ack=2480 Win=64128 Len=0 TSval=2170137556 TSecr=2864708486"
"122","15.803866335","146","6a:c1:c4:e0:14:71","4e:3f:12:3b:4a:4e","172.20.0.3","172.20.0.2","TLSv1.3","Change Cipher Spec, Application Data"
"123","15.803960795","66","6a:c1:c4:e0:14:71","4e:3f:12:3b:4a:4e","172.20.0.3","172.20.0.2","TCP","37566 → 4433 [RST, ACK] Seq=2071 Ack=2480 Win=64128 Len=0 TSval=2170137561 TSecr=2864708486"
"124","15.815274275","74","6a:c1:c4:e0:14:71","4e:3f:12:3b:4a:4e","172.20.0.3","172.20.0.2","TCP","37576 → 4433 [SYN] Seq=0 Win=64240 Len=0 MSS=1460 SACK_PERM TSval=2170137572 TSecr=0 WS=128"
"125","15.815301921","74","4e:3f:12:3b:4a:4e","6a:c1:c4:e0:14:71","172.20.0.2","172.20.0.3","TCP","4433 → 37576 [SYN, ACK] Seq=0 Ack=1 Win=65160 Len=0 MSS=1460 SACK_PERM TSval=2864708503 TSecr=2170137572 WS=128"
"126","15.815321214","66","6a:c1:c4:e0:14:71","4e:3f:12:3b:4a:4e","172.20.0.3","172.20.0.2","TCP","37576 → 4433 [ACK] Seq=1 Ack=1 Win=64256 Len=0 TSval=2170137573 TSecr=2864708503"
"127","15.815372349","2056","6a:c1:c4:e0:14:71","4e:3f:12:3b:4a:4e","172.20.0.3","172.20.0.2","TLSv1.2","Client Hello"
"128","15.819288866","608","6a:c1:c4:e0:14:71","4e:3f:12:3b:4a:4e","172.20.0.3","172.20.0.2","TCP","[TCP Retransmission] 37576 → 4433 [PSH, ACK] Seq=1449 Ack=1 Win=64256 Len=542 TSval=2170137577 TSecr=2864708503"
"129","15.819305125","78","4e:3f:12:3b:4a:4e","6a:c1:c4:e0:14:71","172.20.0.2","172.20.0.3","TCP","[TCP Previous segment not captured] 4433 → 37576 [ACK] Seq=2480 Ack=1991 Win=64128 Len=0 TSval=2864708507 TSecr=2170137577 SLE=1449 SRE=1991"
"130","15.822283910","1097","4e:3f:12:3b:4a:4e","6a:c1:c4:e0:14:71","172.20.0.2","172.20.0.3","TCP","[TCP Retransmission] 4433 → 37576 [PSH, ACK] Seq=1449 Ack=1991 Win=64128 Len=1031 TSval=2864708510 TSecr=2170137577"
"131","15.822338839","78","6a:c1:c4:e0:14:71","4e:3f:12:3b:4a:4e","172.20.0.3","172.20.0.2","TCP","[TCP Dup ACK 126#1] 37576 → 4433 [ACK] Seq=1991 Ack=1 Win=64256 Len=0 TSval=2170137580 TSecr=2864708503 SLE=1449 SRE=2480"
"132","15.822349210","1514","4e:3f:12:3b:4a:4e","6a:c1:c4:e0:14:71","172.20.0.2","172.20.0.3","TCP","[TCP Retransmission] 4433 → 37576 [ACK] Seq=1 Ack=1991 Win=64128 Len=1448 TSval=2864708510 TSecr=2170137580"
"133","15.822365948","66","6a:c1:c4:e0:14:71","4e:3f:12:3b:4a:4e","172.20.0.3","172.20.0.2","TCP","37576 → 4433 [ACK] Seq=1991 Ack=2480 Win=64128 Len=0 TSval=2170137580 TSecr=2864708510"
"134","15.828658423","146","6a:c1:c4:e0:14:71","4e:3f:12:3b:4a:4e","172.20.0.3","172.20.0.2","TLSv1.2","Change Cipher Spec, Application Data"
"135","15.828774642","66","6a:c1:c4:e0:14:71","4e:3f:12:3b:4a:4e","172.20.0.3","172.20.0.2","TCP","37576 → 4433 [RST, ACK] Seq=2071 Ack=2480 Win=64128 Len=0 TSval=2170137586 TSecr=2864708510"
"136","15.842444879","74","6a:c1:c4:e0:14:71","4e:3f:12:3b:4a:4e","172.20.0.3","172.20.0.2","TCP","37586 → 4433 [SYN] Seq=0 Win=64240 Len=0 MSS=1460 SACK_PERM TSval=2170137600 TSecr=0 WS=128"
"137","15.842477225","74","4e:3f:12:3b:4a:4e","6a:c1:c4:e0:14:71","172.20.0.2","172.20.0.3","TCP","4433 → 37586 [SYN, ACK] Seq=0 Ack=1 Win=65160 Len=0 MSS=1460 SACK_PERM TSval=2864708530 TSecr=2170137600 WS=128"
"138","15.842496992","66","6a:c1:c4:e0:14:71","4e:3f:12:3b:4a:4e","172.20.0.3","172.20.0.2","TCP","37586 → 4433 [ACK] Seq=1 Ack=1 Win=64256 Len=0 TSval=2170137600 TSecr=2864708530"
"139","15.842557382","2056","6a:c1:c4:e0:14:71","4e:3f:12:3b:4a:4e","172.20.0.3","172.20.0.2","TLSv1.2","Client Hello"
"140","15.846317837","608","6a:c1:c4:e0:14:71","4e:3f:12:3b:4a:4e","172.20.0.3","172.20.0.2","TCP","[TCP Retransmission] 37586 → 4433 [PSH, ACK] Seq=1449 Ack=1 Win=64256 Len=542 TSval=2170137604 TSecr=2864708530"
"141","15.846343653","78","4e:3f:12:3b:4a:4e","6a:c1:c4:e0:14:71","172.20.0.2","172.20.0.3","TCP","4433 → 37586 [ACK] Seq=1 Ack=1991 Win=64128 Len=0 TSval=2864708534 TSecr=2170137604 SLE=1449 SRE=1991"
"142","15.851316115","1096","4e:3f:12:3b:4a:4e","6a:c1:c4:e0:14:71","172.20.0.2","172.20.0.3","SSL","[TCP Previous segment not captured] , Continuation Data"
"143","15.851377674","78","6a:c1:c4:e0:14:71","4e:3f:12:3b:4a:4e","172.20.0.3","172.20.0.2","TCP","[TCP Dup ACK 138#1] 37586 → 4433 [ACK] Seq=1991 Ack=1 Win=64256 Len=0 TSval=2170137609 TSecr=2864708534 SLE=1449 SRE=2479"
"144","15.851391687","1514","4e:3f:12:3b:4a:4e","6a:c1:c4:e0:14:71","172.20.0.2","172.20.0.3","TCP","[TCP Retransmission] 4433 → 37586 [ACK] Seq=1 Ack=1991 Win=64128 Len=1448 TSval=2864708539 TSecr=2170137609"
"145","15.851411634","66","6a:c1:c4:e0:14:71","4e:3f:12:3b:4a:4e","172.20.0.3","172.20.0.2","TCP","37586 → 4433 [ACK] Seq=1991 Ack=2479 Win=64128 Len=0 TSval=2170137609 TSecr=2864708539"
"146","15.859378464","146","6a:c1:c4:e0:14:71","4e:3f:12:3b:4a:4e","172.20.0.3","172.20.0.2","TLSv1.2","Change Cipher Spec, Application Data"
"147","15.859480283","66","6a:c1:c4:e0:14:71","4e:3f:12:3b:4a:4e","172.20.0.3","172.20.0.2","TCP","37586 → 4433 [RST, ACK] Seq=2071 Ack=2479 Win=64128 Len=0 TSval=2170137617 TSecr=2864708539"
"148","15.875429728","74","6a:c1:c4:e0:14:71","4e:3f:12:3b:4a:4e","172.20.0.3","172.20.0.2","TCP","37588 → 4433 [SYN] Seq=0 Win=64240 Len=0 MSS=1460 SACK_PERM TSval=2170137633 TSecr=0 WS=128"
"149","15.875462595","74","4e:3f:12:3b:4a:4e","6a:c1:c4:e0:14:71","172.20.0.2","172.20.0.3","TCP","4433 → 37588 [SYN, ACK] Seq=0 Ack=1 Win=65160 Len=0 MSS=1460 SACK_PERM TSval=2864708563 TSecr=2170137633 WS=128"
"150","15.875483018","66","6a:c1:c4:e0:14:71","4e:3f:12:3b:4a:4e","172.20.0.3","172.20.0.2","TCP","37588 → 4433 [ACK] Seq=1 Ack=1 Win=64256 Len=0 TSval=2170137633 TSecr=2864708563"
"151","15.875537325","2056","6a:c1:c4:e0:14:71","4e:3f:12:3b:4a:4e","172.20.0.3","172.20.0.2","TLSv1.2","Client Hello"
"152","15.879317230","608","6a:c1:c4:e0:14:71","4e:3f:12:3b:4a:4e","172.20.0.3","172.20.0.2","TCP","[TCP Retransmission] 37588 → 4433 [PSH, ACK] Seq=1449 Ack=1 Win=64256 Len=542 TSval=2170137637 TSecr=2864708563"
"153","15.879341565","78","4e:3f:12:3b:4a:4e","6a:c1:c4:e0:14:71","172.20.0.2","172.20.0.3","TCP","4433 → 37588 [ACK] Seq=1 Ack=1991 Win=64128 Len=0 TSval=2864708567 TSecr=2170137637 SLE=1449 SRE=1991"
"154","15.884275899","1097","4e:3f:12:3b:4a:4e","6a:c1:c4:e0:14:71","172.20.0.2","172.20.0.3","SSL","[TCP Previous segment not captured] , Continuation Data"
"155","15.884314744","78","6a:c1:c4:e0:14:71","4e:3f:12:3b:4a:4e","172.20.0.3","172.20.0.2","TCP","[TCP Dup ACK 150#1] 37588 → 4433 [ACK] Seq=1991 Ack=1 Win=64256 Len=0 TSval=2170137642 TSecr=2864708567 SLE=1449 SRE=2480"
"156","15.884325870","1514","4e:3f:12:3b:4a:4e","6a:c1:c4:e0:14:71","172.20.0.2","172.20.0.3","TCP","[TCP Out-Of-Order] 4433 → 37588 [ACK] Seq=1 Ack=1991 Win=64128 Len=1448 TSval=2864708572 TSecr=2170137642"
"157","15.884341720","66","6a:c1:c4:e0:14:71","4e:3f:12:3b:4a:4e","172.20.0.3","172.20.0.2","TCP","37588 → 4433 [ACK] Seq=1991 Ack=2480 Win=64128 Len=0 TSval=2170137642 TSecr=2864708572"
"158","15.889591077","146","6a:c1:c4:e0:14:71","4e:3f:12:3b:4a:4e","172.20.0.3","172.20.0.2","TLSv1.2","Change Cipher Spec, Application Data"
"159","15.889694873","66","6a:c1:c4:e0:14:71","4e:3f:12:3b:4a:4e","172.20.0.3","172.20.0.2","TCP","37588 → 4433 [RST, ACK] Seq=2071 Ack=2480 Win=64128 Len=0 TSval=2170137647 TSecr=2864708572"
"160","15.904891490","74","6a:c1:c4:e0:14:71","4e:3f:12:3b:4a:4e","172.20.0.3","172.20.0.2","TCP","37598 → 4433 [SYN] Seq=0 Win=64240 Len=0 MSS=1460 SACK_PERM TSval=2170137662 TSecr=0 WS=128"
"161","15.904929155","74","4e:3f:12:3b:4a:4e","6a:c1:c4:e0:14:71","172.20.0.2","172.20.0.3","TCP","4433 → 37598 [SYN, ACK] Seq=0 Ack=1 Win=65160 Len=0 MSS=1460 SACK_PERM TSval=2864708592 TSecr=2170137662 WS=128"
"162","15.904955368","66","6a:c1:c4:e0:14:71","4e:3f:12:3b:4a:4e","172.20.0.3","172.20.0.2","TCP","37598 → 4433 [ACK] Seq=1 Ack=1 Win=64256 Len=0 TSval=2170137662 TSecr=2864708592"
"163","15.905014802","2056","6a:c1:c4:e0:14:71","4e:3f:12:3b:4a:4e","172.20.0.3","172.20.0.2","TLSv1.2","Client Hello"
"164","15.909328557","608","6a:c1:c4:e0:14:71","4e:3f:12:3b:4a:4e","172.20.0.3","172.20.0.2","TCP","[TCP Retransmission] 37598 → 4433 [PSH, ACK] Seq=1449 Ack=1 Win=64256 Len=542 TSval=2170137667 TSecr=2864708592"
"165","15.909354321","78","4e:3f:12:3b:4a:4e","6a:c1:c4:e0:14:71","172.20.0.2","172.20.0.3","TCP","4433 → 37598 [ACK] Seq=1 Ack=1991 Win=64128 Len=0 TSval=2864708597 TSecr=2170137667 SLE=1449 SRE=1991"
"166","15.909545354","2543","4e:3f:12:3b:4a:4e","6a:c1:c4:e0:14:71","172.20.0.2","172.20.0.3","TLSv1.3","Server Hello, Change Cipher Spec, Application Data, Application Data, Application Data, Application Data"
"167","15.909588299","66","6a:c1:c4:e0:14:71","4e:3f:12:3b:4a:4e","172.20.0.3","172.20.0.2","TCP","37598 → 4433 [ACK] Seq=1991 Ack=2478 Win=64128 Len=0 TSval=2170137667 TSecr=2864708597"
"168","15.917167981","146","6a:c1:c4:e0:14:71","4e:3f:12:3b:4a:4e","172.20.0.3","172.20.0.2","TLSv1.3","Change Cipher Spec, Application Data"
"169","15.917297670","66","6a:c1:c4:e0:14:71","4e:3f:12:3b:4a:4e","172.20.0.3","172.20.0.2","TCP","37598 → 4433 [RST, ACK] Seq=2071 Ack=2478 Win=64128 Len=0 TSval=2170137675 TSecr=2864708597"
"170","15.933129087","74","6a:c1:c4:e0:14:71","4e:3f:12:3b:4a:4e","172.20.0.3","172.20.0.2","TCP","37606 → 4433 [SYN] Seq=0 Win=64240 Len=0 MSS=1460 SACK_PERM TSval=2170137690 TSecr=0 WS=128"
"171","15.933177588","74","4e:3f:12:3b:4a:4e","6a:c1:c4:e0:14:71","172.20.0.2","172.20.0.3","TCP","4433 → 37606 [SYN, ACK] Seq=0 Ack=1 Win=65160 Len=0 MSS=1460 SACK_PERM TSval=2864708620 TSecr=2170137690 WS=128"
"172","15.933203348","66","6a:c1:c4:e0:14:71","4e:3f:12:3b:4a:4e","172.20.0.3","172.20.0.2","TCP","37606 → 4433 [ACK] Seq=1 Ack=1 Win=64256 Len=0 TSval=2170137690 TSecr=2864708620"
"173","15.933287436","2056","6a:c1:c4:e0:14:71","4e:3f:12:3b:4a:4e","172.20.0.3","172.20.0.2","TLSv1.2","Client Hello"
"174","15.933293860","66","4e:3f:12:3b:4a:4e","6a:c1:c4:e0:14:71","172.20.0.2","172.20.0.3","TCP","4433 → 37606 [ACK] Seq=1 Ack=1991 Win=64128 Len=0 TSval=2864708621 TSecr=2170137691"
"175","15.938032085","2545","4e:3f:12:3b:4a:4e","6a:c1:c4:e0:14:71","172.20.0.2","172.20.0.3","TLSv1.3","Server Hello, Change Cipher Spec, Application Data, Application Data, Application Data, Application Data"
"176","15.938096729","66","6a:c1:c4:e0:14:71","4e:3f:12:3b:4a:4e","172.20.0.3","172.20.0.2","TCP","37606 → 4433 [ACK] Seq=1991 Ack=2480 Win=64128 Len=0 TSval=2170137695 TSecr=2864708625"
"177","15.944426715","146","6a:c1:c4:e0:14:71","4e:3f:12:3b:4a:4e","172.20.0.3","172.20.0.2","TLSv1.3","Change Cipher Spec, Application Data"
"178","15.944536506","66","6a:c1:c4:e0:14:71","4e:3f:12:3b:4a:4e","172.20.0.3","172.20.0.2","TCP","37606 → 4433 [RST, ACK] Seq=2071 Ack=2480 Win=64128 Len=0 TSval=2170137702 TSecr=2864708625"
"179","15.959803014","74","6a:c1:c4:e0:14:71","4e:3f:12:3b:4a:4e","172.20.0.3","172.20.0.2","TCP","37616 → 4433 [SYN] Seq=0 Win=64240 Len=0 MSS=1460 SACK_PERM TSval=2170137717 TSecr=0 WS=128"
"180","15.959841276","74","4e:3f:12:3b:4a:4e","6a:c1:c4:e0:14:71","172.20.0.2","172.20.0.3","TCP","4433 → 37616 [SYN, ACK] Seq=0 Ack=1 Win=65160 Len=0 MSS=1460 SACK_PERM TSval=2864708647 TSecr=2170137717 WS=128"
"181","15.959867985","66","6a:c1:c4:e0:14:71","4e:3f:12:3b:4a:4e","172.20.0.3","172.20.0.2","TCP","37616 → 4433 [ACK] Seq=1 Ack=1 Win=64256 Len=0 TSval=2170137717 TSecr=2864708647"
"182","15.959927305","2056","6a:c1:c4:e0:14:71","4e:3f:12:3b:4a:4e","172.20.0.3","172.20.0.2","TLSv1.2","Client Hello"
"183","15.959952498","66","4e:3f:12:3b:4a:4e","6a:c1:c4:e0:14:71","172.20.0.2","172.20.0.3","TCP","4433 → 37616 [ACK] Seq=1 Ack=1991 Win=64128 Len=0 TSval=2864708647 TSecr=2170137717"
"184","15.963787326","2544","4e:3f:12:3b:4a:4e","6a:c1:c4:e0:14:71","172.20.0.2","172.20.0.3","TLSv1.3","Server Hello, Change Cipher Spec, Application Data, Application Data, Application Data, Application Data"
"185","15.963847152","66","6a:c1:c4:e0:14:71","4e:3f:12:3b:4a:4e","172.20.0.3","172.20.0.2","TCP","37616 → 4433 [ACK] Seq=1991 Ack=2479 Win=64128 Len=0 TSval=2170137721 TSecr=2864708651"
"186","15.969357673","146","6a:c1:c4:e0:14:71","4e:3f:12:3b:4a:4e","172.20.0.3","172.20.0.2","TLSv1.3","Change Cipher Spec, Application Data"
"187","15.969482117","66","6a:c1:c4:e0:14:71","4e:3f:12:3b:4a:4e","172.20.0.3","172.20.0.2","TCP","37616 → 4433 [RST, ACK] Seq=2071 Ack=2479 Win=64128 Len=0 TSval=2170137727 TSecr=2864708651"
"188","15.981262786","74","6a:c1:c4:e0:14:71","4e:3f:12:3b:4a:4e","172.20.0.3","172.20.0.2","TCP","37632 → 4433 [SYN] Seq=0 Win=64240 Len=0 MSS=1460 SACK_PERM TSval=2170137738 TSecr=0 WS=128"
"189","15.981292402","74","4e:3f:12:3b:4a:4e","6a:c1:c4:e0:14:71","172.20.0.2","172.20.0.3","TCP","4433 → 37632 [SYN, ACK] Seq=0 Ack=1 Win=65160 Len=0 MSS=1460 SACK_PERM TSval=2864708669 TSecr=2170137738 WS=128"
"190","15.981311499","66","6a:c1:c4:e0:14:71","4e:3f:12:3b:4a:4e","172.20.0.3","172.20.0.2","TCP","37632 → 4433 [ACK] Seq=1 Ack=1 Win=64256 Len=0 TSval=2170137739 TSecr=2864708669"
"191","15.981356714","2056","6a:c1:c4:e0:14:71","4e:3f:12:3b:4a:4e","172.20.0.3","172.20.0.2","TLSv1.2","Client Hello"
"192","15.981362307","66","4e:3f:12:3b:4a:4e","6a:c1:c4:e0:14:71","172.20.0.2","172.20.0.3","TCP","4433 → 37632 [ACK] Seq=1 Ack=1991 Win=64128 Len=0 TSval=2864708669 TSecr=2170137739"
"193","15.984682473","2544","4e:3f:12:3b:4a:4e","6a:c1:c4:e0:14:71","172.20.0.2","172.20.0.3","TLSv1.3","Server Hello, Change Cipher Spec, Application Data, Application Data, Application Data, Application Data"
"194","15.984725707","66","6a:c1:c4:e0:14:71","4e:3f:12:3b:4a:4e","172.20.0.3","172.20.0.2","TCP","37632 → 4433 [ACK] Seq=1991 Ack=2479 Win=64128 Len=0 TSval=2170137742 TSecr=2864708672"
"195","15.991563914","146","6a:c1:c4:e0:14:71","4e:3f:12:3b:4a:4e","172.20.0.3","172.20.0.2","TLSv1.3","Change Cipher Spec, Application Data"
"196","15.991701922","66","6a:c1:c4:e0:14:71","4e:3f:12:3b:4a:4e","172.20.0.3","172.20.0.2","TCP","37632 → 4433 [RST, ACK] Seq=2071 Ack=2479 Win=64128 Len=0 TSval=2170137749 TSecr=2864708672"
"197","16.005712830","74","6a:c1:c4:e0:14:71","4e:3f:12:3b:4a:4e","172.20.0.3","172.20.0.2","TCP","37636 → 4433 [SYN] Seq=0 Win=64240 Len=0 MSS=1460 SACK_PERM TSval=2170137763 TSecr=0 WS=128"
"198","16.005744091","74","4e:3f:12:3b:4a:4e","6a:c1:c4:e0:14:71","172.20.0.2","172.20.0.3","TCP","4433 → 37636 [SYN, ACK] Seq=0 Ack=1 Win=65160 Len=0 MSS=1460 SACK_PERM TSval=2864708693 TSecr=2170137763 WS=128"
"199","16.005765342","66","6a:c1:c4:e0:14:71","4e:3f:12:3b:4a:4e","172.20.0.3","172.20.0.2","TCP","37636 → 4433 [ACK] Seq=1 Ack=1 Win=64256 Len=0 TSval=2170137763 TSecr=2864708693"
"200","16.005823890","2056","6a:c1:c4:e0:14:71","4e:3f:12:3b:4a:4e","172.20.0.3","172.20.0.2","TLSv1.2","Client Hello"
"201","16.005846364","66","4e:3f:12:3b:4a:4e","6a:c1:c4:e0:14:71","172.20.0.2","172.20.0.3","TCP","4433 → 37636 [ACK] Seq=1 Ack=1991 Win=64128 Len=0 TSval=2864708693 TSecr=2170137763"
"202","16.011326576","2544","4e:3f:12:3b:4a:4e","6a:c1:c4:e0:14:71","172.20.0.2","172.20.0.3","TLSv1.3","Server Hello, Change Cipher Spec, Application Data, Application Data, Application Data, Application Data"
"203","16.011382584","66","6a:c1:c4:e0:14:71","4e:3f:12:3b:4a:4e","172.20.0.3","172.20.0.2","TCP","37636 → 4433 [ACK] Seq=1991 Ack=2479 Win=64128 Len=0 TSval=2170137769 TSecr=2864708699"
"204","16.017080789","146","6a:c1:c4:e0:14:71","4e:3f:12:3b:4a:4e","172.20.0.3","172.20.0.2","TLSv1.3","Change Cipher Spec, Application Data"
"205","16.017216046","66","6a:c1:c4:e0:14:71","4e:3f:12:3b:4a:4e","172.20.0.3","172.20.0.2","TCP","37636 → 4433 [RST, ACK] Seq=2071 Ack=2479 Win=64128 Len=0 TSval=2170137774 TSecr=2864708699"
"206","16.032879738","74","6a:c1:c4:e0:14:71","4e:3f:12:3b:4a:4e","172.20.0.3","172.20.0.2","TCP","37648 → 4433 [SYN] Seq=0 Win=64240 Len=0 MSS=1460 SACK_PERM TSval=2170137790 TSecr=0 WS=128"
"207","16.032918194","74","4e:3f:12:3b:4a:4e","6a:c1:c4:e0:14:71","172.20.0.2","172.20.0.3","TCP","4433 → 37648 [SYN, ACK] Seq=0 Ack=1 Win=65160 Len=0 MSS=1460 SACK_PERM TSval=2864708720 TSecr=2170137790 WS=128"
"208","16.032942155","66","6a:c1:c4:e0:14:71","4e:3f:12:3b:4a:4e","172.20.0.3","172.20.0.2","TCP","37648 → 4433 [ACK] Seq=1 Ack=1 Win=64256 Len=0 TSval=2170137790 TSecr=2864708720"
"209","16.033002783","2056","6a:c1:c4:e0:14:71","4e:3f:12:3b:4a:4e","172.20.0.3","172.20.0.2","TLSv1.2","Client Hello"
"210","16.033012248","66","4e:3f:12:3b:4a:4e","6a:c1:c4:e0:14:71","172.20.0.2","172.20.0.3","TCP","4433 → 37648 [ACK] Seq=1 Ack=1991 Win=64128 Len=0 TSval=2864708720 TSecr=2170137790"
"211","16.038678872","2545","4e:3f:12:3b:4a:4e","6a:c1:c4:e0:14:71","172.20.0.2","172.20.0.3","TLSv1.3","Server Hello, Change Cipher Spec, Application Data, Application Data, Application Data, Application Data"
"212","16.038750154","66","6a:c1:c4:e0:14:71","4e:3f:12:3b:4a:4e","172.20.0.3","172.20.0.2","TCP","37648 → 4433 [ACK] Seq=1991 Ack=2480 Win=64128 Len=0 TSval=2170137796 TSecr=2864708726"
"213","16.044072137","146","6a:c1:c4:e0:14:71","4e:3f:12:3b:4a:4e","172.20.0.3","172.20.0.2","TLSv1.3","Change Cipher Spec, Application Data"
"214","16.044174099","66","6a:c1:c4:e0:14:71","4e:3f:12:3b:4a:4e","172.20.0.3","172.20.0.2","TCP","37648 → 4433 [RST, ACK] Seq=2071 Ack=2480 Win=64128 Len=0 TSval=2170137801 TSecr=2864708726"
"215","16.056671524","74","6a:c1:c4:e0:14:71","4e:3f:12:3b:4a:4e","172.20.0.3","172.20.0.2","TCP","37658 → 4433 [SYN] Seq=0 Win=64240 Len=0 MSS=1460 SACK_PERM TSval=2170137814 TSecr=0 WS=128"
"216","16.056705698","74","4e:3f:12:3b:4a:4e","6a:c1:c4:e0:14:71","172.20.0.2","172.20.0.3","TCP","4433 → 37658 [SYN, ACK] Seq=0 Ack=1 Win=65160 Len=0 MSS=1460 SACK_PERM TSval=2864708744 TSecr=2170137814 WS=128"
"217","16.056729537","66","6a:c1:c4:e0:14:71","4e:3f:12:3b:4a:4e","172.20.0.3","172.20.0.2","TCP","37658 → 4433 [ACK] Seq=1 Ack=1 Win=64256 Len=0 TSval=2170137814 TSecr=2864708744"
"218","16.056777714","2056","6a:c1:c4:e0:14:71","4e:3f:12:3b:4a:4e","172.20.0.3","172.20.0.2","TLSv1.2","Client Hello"
"219","16.056784397","66","4e:3f:12:3b:4a:4e","6a:c1:c4:e0:14:71","172.20.0.2","172.20.0.3","TCP","4433 → 37658 [ACK] Seq=1 Ack=1991 Win=64128 Len=0 TSval=2864708744 TSecr=2170137814"
"220","16.066290380","1096","4e:3f:12:3b:4a:4e","6a:c1:c4:e0:14:71","172.20.0.2","172.20.0.3","SSL","[TCP Previous segment not captured] , Continuation Data"
"221","16.066368344","78","6a:c1:c4:e0:14:71","4e:3f:12:3b:4a:4e","172.20.0.3","172.20.0.2","TCP","[TCP Dup ACK 217#1] 37658 → 4433 [ACK] Seq=1991 Ack=1 Win=64256 Len=0 TSval=2170137824 TSecr=2864708744 SLE=1449 SRE=2479"
