frame.number,frame.time_relative,frame.len,eth.src,eth.dst,ip.src,ip.dst,_ws.col.protocol,_ws.col.info
"1","0.000000000","70","5a:1b:15:1e:e5:27","33:33:00:00:00:02",,,"ICMPv6","Router Solicitation from 5a:1b:15:1e:e5:27"
"2","0.260031526","239","5a:1b:15:1e:e5:27","33:33:00:00:00:fb",,,"MDNS","Standard query 0x0000 PTR _ipps._tcp.local, ""QM"" question PTR _ftp._tcp.local, ""QM"" question PTR _webdav._tcp.local, ""QM"" question PTR _webdavs._tcp.local, ""QM"" question PTR _sftp-ssh._tcp.local, ""QM"" question PTR _smb._tcp.local, ""QM"" question PTR _afpovertcp._tcp.local, ""QM"" question PTR _nfs._tcp.local, ""QM"" question PTR _ipp._tcp.local, ""QM"" question PTR MONTE-VIRTUAL-MACHINE._smb._tcp.local"
"3","3.712994177","42","b6:f9:e7:6d:d6:c8","ff:ff:ff:ff:ff:ff",,,"ARP","ARP Announcement for 172.20.0.3"
"4","3.754588154","42","b6:f9:e7:6d:d6:c8","ff:ff:ff:ff:ff:ff",,,"ARP","Who has 172.20.0.2? Tell 172.20.0.3"
"5","3.754622336","42","d2:ac:c9:85:7a:ca","b6:f9:e7:6d:d6:c8",,,"ARP","172.20.0.2 is at d2:ac:c9:85:7a:ca"
"6","3.754631378","74","b6:f9:e7:6d:d6:c8","d2:ac:c9:85:7a:ca","172.20.0.3","172.20.0.2","TCP","48646 → 4433 [SYN] Seq=0 Win=64240 Len=0 MSS=1460 SACK_PERM TSval=2169951431 TSecr=0 WS=128"
"7","3.754652405","74","d2:ac:c9:85:7a:ca","b6:f9:e7:6d:d6:c8","172.20.0.2","172.20.0.3","TCP","4433 → 48646 [SYN, ACK] Seq=0 Ack=1 Win=65160 Len=0 MSS=1460 SACK_PERM TSval=2864522361 TSecr=2169951431 WS=128"
"8","3.754674863","66","b6:f9:e7:6d:d6:c8","d2:ac:c9:85:7a:ca","172.20.0.3","172.20.0.2","TCP","48646 → 4433 [ACK] Seq=1 Ack=1 Win=64256 Len=0 TSval=2169951431 TSecr=2864522361"
"9","3.754736534","2189","b6:f9:e7:6d:d6:c8","d2:ac:c9:85:7a:ca","172.20.0.3","172.20.0.2","TLSv1.2","Client Hello"
"10","3.754744890","66","d2:ac:c9:85:7a:ca","b6:f9:e7:6d:d6:c8","172.20.0.2","172.20.0.3","TCP","4433 → 48646 [ACK] Seq=1 Ack=2124 Win=64128 Len=0 TSval=2864522361 TSecr=2169951431"
"11","3.772985078","1230","d2:ac:c9:85:7a:ca","b6:f9:e7:6d:d6:c8","172.20.0.2","172.20.0.3","SSL","[TCP Previous segment not captured] , Continuation Data"
"12","3.773035012","78","b6:f9:e7:6d:d6:c8","d2:ac:c9:85:7a:ca","172.20.0.3","172.20.0.2","TCP","[TCP Dup ACK 8#1] 48646 → 4433 [ACK] Seq=2124 Ack=1 Win=64256 Len=0 TSval=2169951450 TSecr=2864522361 SLE=1449 SRE=2613"
"13","3.773047457","1514","d2:ac:c9:85:7a:ca","b6:f9:e7:6d:d6:c8","172.20.0.2","172.20.0.3","TCP","[TCP Retransmission] 4433 → 48646 [ACK] Seq=1 Ack=2124 Win=64128 Len=1448 TSval=2864522380 TSecr=2169951450"
"14","3.773068133","66","b6:f9:e7:6d:d6:c8","d2:ac:c9:85:7a:ca","172.20.0.3","172.20.0.2","TCP","48646 → 4433 [ACK] Seq=2124 Ack=2613 Win=64128 Len=0 TSval=2169951450 TSecr=2864522380"
"15","3.782962296","146","b6:f9:e7:6d:d6:c8","d2:ac:c9:85:7a:ca","172.20.0.3","172.20.0.2","TLSv1.2","Change Cipher Spec, Application Data"
"16","3.783049929","66","b6:f9:e7:6d:d6:c8","d2:ac:c9:85:7a:ca","172.20.0.3","172.20.0.2","TCP","48646 → 4433 [RST, ACK] Seq=2204 Ack=2613 Win=64128 Len=0 TSval=2169951460 TSecr=2864522380"
"17","3.799635253","74","b6:f9:e7:6d:d6:c8","d2:ac:c9:85:7a:ca","172.20.0.3","172.20.0.2","TCP","48648 → 4433 [SYN] Seq=0 Win=64240 Len=0 MSS=1460 SACK_PERM TSval=2169951476 TSecr=0 WS=128"
"18","3.799664556","74","d2:ac:c9:85:7a:ca","b6:f9:e7:6d:d6:c8","172.20.0.2","172.20.0.3","TCP","4433 → 48648 [SYN, ACK] Seq=0 Ack=1 Win=65160 Len=0 MSS=1460 SACK_PERM TSval=2864522406 TSecr=2169951476 WS=128"
"19","3.799682333","66","b6:f9:e7:6d:d6:c8","d2:ac:c9:85:7a:ca","172.20.0.3","172.20.0.2","TCP","48648 → 4433 [ACK] Seq=1 Ack=1 Win=64256 Len=0 TSval=2169951476 TSecr=2864522406"
"20","3.799736464","2189","b6:f9:e7:6d:d6:c8","d2:ac:c9:85:7a:ca","172.20.0.3","172.20.0.2","TLSv1.2","Client Hello"
"21","3.802969219","741","b6:f9:e7:6d:d6:c8","d2:ac:c9:85:7a:ca","172.20.0.3","172.20.0.2","TCP","[TCP Retransmission] 48648 → 4433 [PSH, ACK] Seq=1449 Ack=1 Win=64256 Len=675 TSval=2169951480 TSecr=2864522406"
"22","3.811764010","2678","d2:ac:c9:85:7a:ca","b6:f9:e7:6d:d6:c8","172.20.0.2","172.20.0.3","TLSv1.3","Server Hello, Change Cipher Spec, Application Data, Application Data, Application Data, Application Data"
"23","3.811815913","66","b6:f9:e7:6d:d6:c8","d2:ac:c9:85:7a:ca","172.20.0.3","172.20.0.2","TCP","48648 → 4433 [ACK] Seq=2124 Ack=2613 Win=64128 Len=0 TSval=2169951488 TSecr=2864522418"
"24","3.821212581","146","b6:f9:e7:6d:d6:c8","d2:ac:c9:85:7a:ca","172.20.0.3","172.20.0.2","TLSv1.3","Change Cipher Spec, Application Data"
"25","3.821292776","66","b6:f9:e7:6d:d6:c8","d2:ac:c9:85:7a:ca","172.20.0.3","172.20.0.2","TCP","48648 → 4433 [RST, ACK] Seq=2204 Ack=2613 Win=64128 Len=0 TSval=2169951498 TSecr=2864522418"
"26","3.838557634","74","b6:f9:e7:6d:d6:c8","d2:ac:c9:85:7a:ca","172.20.0.3","172.20.0.2","TCP","48660 → 4433 [SYN] Seq=0 Win=64240 Len=0 MSS=1460 SACK_PERM TSval=2169951515 TSecr=0 WS=128"
"27","3.838596017","74","d2:ac:c9:85:7a:ca","b6:f9:e7:6d:d6:c8","172.20.0.2","172.20.0.3","TCP","4433 → 48660 [SYN, ACK] Seq=0 Ack=1 Win=65160 Len=0 MSS=1460 SACK_PERM TSval=2864522445 TSecr=2169951515 WS=128"
"28","3.838618825","66","b6:f9:e7:6d:d6:c8","d2:ac:c9:85:7a:ca","172.20.0.3","172.20.0.2","TCP","48660 → 4433 [ACK] Seq=1 Ack=1 Win=64256 Len=0 TSval=2169951515 TSecr=2864522445"
"29","3.838668399","2189","b6:f9:e7:6d:d6:c8","d2:ac:c9:85:7a:ca","172.20.0.3","172.20.0.2","TLSv1.2","Client Hello"
"30","3.838672897","66","d2:ac:c9:85:7a:ca","b6:f9:e7:6d:d6:c8","172.20.0.2","172.20.0.3","TCP","4433 → 48660 [ACK] Seq=1 Ack=2124 Win=64128 Len=0 TSval=2864522445 TSecr=2169951515"
"31","3.852006852","2676","d2:ac:c9:85:7a:ca","b6:f9:e7:6d:d6:c8","172.20.0.2","172.20.0.3","TLSv1.3","Server Hello, Change Cipher Spec, Application Data, Application Data, Application Data, Application Data"
"32","3.852075396","66","b6:f9:e7:6d:d6:c8","d2:ac:c9:85:7a:ca","172.20.0.3","172.20.0.2","TCP","48660 → 4433 [ACK] Seq=2124 Ack=2611 Win=64128 Len=0 TSval=2169951529 TSecr=2864522459"
"33","3.861799227","146","b6:f9:e7:6d:d6:c8","d2:ac:c9:85:7a:ca","172.20.0.3","172.20.0.2","TLSv1.3","Change Cipher Spec, Application Data"
"34","3.861894602","66","b6:f9:e7:6d:d6:c8","d2:ac:c9:85:7a:ca","172.20.0.3","172.20.0.2","TCP","48660 → 4433 [RST, ACK] Seq=2204 Ack=2611 Win=64128 Len=0 TSval=2169951538 TSecr=2864522459"
"35","3.879184498","74","b6:f9:e7:6d:d6:c8","d2:ac:c9:85:7a:ca","172.20.0.3","172.20.0.2","TCP","48672 → 4433 [SYN] Seq=0 Win=64240 Len=0 MSS=1460 SACK_PERM TSval=2169951556 TSecr=0 WS=128"
"36","4.714585928","42","b6:f9:e7:6d:d6:c8","ff:ff:ff:ff:ff:ff",,,"ARP","ARP Announcement for 172.20.0.3"
"37","4.928017425","74","d2:ac:c9:85:7a:ca","b6:f9:e7:6d:d6:c8","172.20.0.2","172.20.0.3","TCP","4433 → 48672 [SYN, ACK] Seq=0 Ack=1 Win=65160 Len=0 MSS=1460 SACK_PERM TSval=2864523535 TSecr=2169951556 WS=128"
"38","4.928036280","74","b6:f9:e7:6d:d6:c8","d2:ac:c9:85:7a:ca","172.20.0.3","172.20.0.2","TCP","[TCP Retransmission] 48672 → 4433 [SYN] Seq=0 Win=64240 Len=0 MSS=1460 SACK_PERM TSval=2169952605 TSecr=0 WS=128"
"39","4.928082763","66","b6:f9:e7:6d:d6:c8","d2:ac:c9:85:7a:ca","172.20.0.3","172.20.0.2","TCP","48672 → 4433 [ACK] Seq=1 Ack=1 Win=64256 Len=0 TSval=2169952605 TSecr=2864523535"
"40","4.928172956","2189","b6:f9:e7:6d:d6:c8","d2:ac:c9:85:7a:ca","172.20.0.3","172.20.0.2","TLSv1.2","Client Hello"
"41","4.928181133","66","d2:ac:c9:85:7a:ca","b6:f9:e7:6d:d6:c8","172.20.0.2","172.20.0.3","TCP","4433 → 48672 [ACK] Seq=1 Ack=2124 Win=64128 Len=0 TSval=2864523535 TSecr=2169952605"
"42","5.143994805","1229","d2:ac:c9:85:7a:ca","b6:f9:e7:6d:d6:c8","172.20.0.2","172.20.0.3","SSL","[TCP Previous segment not captured] , Continuation Data"
"43","5.144039867","78","b6:f9:e7:6d:d6:c8","d2:ac:c9:85:7a:ca","172.20.0.3","172.20.0.2","TCP","[TCP Dup ACK 39#1] 48672 → 4433 [ACK] Seq=2124 Ack=1 Win=64256 Len=0 TSval=2169952821 TSecr=2864523535 SLE=1449 SRE=2612"
"44","5.144052510","1514","d2:ac:c9:85:7a:ca","b6:f9:e7:6d:d6:c8","172.20.0.2","172.20.0.3","TCP","[TCP Retransmission] 4433 → 48672 [ACK] Seq=1 Ack=2124 Win=64128 Len=1448 TSval=2864523751 TSecr=2169952821"
"45","5.144068517","66","b6:f9:e7:6d:d6:c8","d2:ac:c9:85:7a:ca","172.20.0.3","172.20.0.2","TCP","48672 → 4433 [ACK] Seq=2124 Ack=2612 Win=64128 Len=0 TSval=2169952821 TSecr=2864523751"
"46","5.153687423","146","b6:f9:e7:6d:d6:c8","d2:ac:c9:85:7a:ca","172.20.0.3","172.20.0.2","TLSv1.2","Change Cipher Spec, Application Data"
"47","5.153767156","66","b6:f9:e7:6d:d6:c8","d2:ac:c9:85:7a:ca","172.20.0.3","172.20.0.2","TCP","48672 → 4433 [RST, ACK] Seq=2204 Ack=2612 Win=64128 Len=0 TSval=2169952830 TSecr=2864523751"
"48","5.171236592","74","b6:f9:e7:6d:d6:c8","d2:ac:c9:85:7a:ca","172.20.0.3","172.20.0.2","TCP","48686 → 4433 [SYN] Seq=0 Win=64240 Len=0 MSS=1460 SACK_PERM TSval=2169952848 TSecr=0 WS=128"
"49","5.171270881","74","d2:ac:c9:85:7a:ca","b6:f9:e7:6d:d6:c8","172.20.0.2","172.20.0.3","TCP","4433 → 48686 [SYN, ACK] Seq=0 Ack=1 Win=65160 Len=0 MSS=1460 SACK_PERM TSval=2864523778 TSecr=2169952848 WS=128"
"50","5.171291605","66","b6:f9:e7:6d:d6:c8","d2:ac:c9:85:7a:ca","172.20.0.3","172.20.0.2","TCP","48686 → 4433 [ACK] Seq=1 Ack=1 Win=64256 Len=0 TSval=2169952848 TSecr=2864523778"
"51","5.171344386","2189","b6:f9:e7:6d:d6:c8","d2:ac:c9:85:7a:ca","172.20.0.3","172.20.0.2","TLSv1.2","Client Hello"
"52","5.171352017","66","d2:ac:c9:85:7a:ca","b6:f9:e7:6d:d6:c8","172.20.0.2","172.20.0.3","TCP","4433 → 48686 [ACK] Seq=1 Ack=2124 Win=64128 Len=0 TSval=2864523778 TSecr=2169952848"
"53","5.183725054","2678","d2:ac:c9:85:7a:ca","b6:f9:e7:6d:d6:c8","172.20.0.2","172.20.0.3","TLSv1.3","Server Hello, Change Cipher Spec, Application Data, Application Data, Application Data, Application Data"
"54","5.183789265","66","b6:f9:e7:6d:d6:c8","d2:ac:c9:85:7a:ca","172.20.0.3","172.20.0.2","TCP","48686 → 4433 [ACK] Seq=2124 Ack=2613 Win=64128 Len=0 TSval=2169952860 TSecr=2864523790"
"55","5.193719656","146","b6:f9:e7:6d:d6:c8","d2:ac:c9:85:7a:ca","172.20.0.3","172.20.0.2","TLSv1.3","Change Cipher Spec, Application Data"
"56","5.193818079","66","b6:f9:e7:6d:d6:c8","d2:ac:c9:85:7a:ca","172.20.0.3","172.20.0.2","TCP","48686 → 4433 [RST, ACK] Seq=2204 Ack=2613 Win=64128 Len=0 TSval=2169952870 TSecr=2864523790"
"57","5.211766588","74","b6:f9:e7:6d:d6:c8","d2:ac:c9:85:7a:ca","172.20.0.3","172.20.0.2","TCP","48698 → 4433 [SYN] Seq=0 Win=64240 Len=0 MSS=1460 SACK_PERM TSval=2169952888 TSecr=0 WS=128"
"58","5.211796792","74","d2:ac:c9:85:7a:ca","b6:f9:e7:6d:d6:c8","172.20.0.2","172.20.0.3","TCP","4433 → 48698 [SYN, ACK] Seq=0 Ack=1 Win=65160 Len=0 MSS=1460 SACK_PERM TSval=2864523818 TSecr=2169952888 WS=128"
"59","5.211816684","66","b6:f9:e7:6d:d6:c8","d2:ac:c9:85:7a:ca","172.20.0.3","172.20.0.2","TCP","48698 → 4433 [ACK] Seq=1 Ack=1 Win=64256 Len=0 TSval=2169952888 TSecr=2864523818"
"60","5.211867280","2189","b6:f9:e7:6d:d6:c8","d2:ac:c9:85:7a:ca","172.20.0.3","172.20.0.2","TLSv1.2","Client Hello"
"61","5.211874368","66","d2:ac:c9:85:7a:ca","b6:f9:e7:6d:d6:c8","172.20.0.2","172.20.0.3","TCP","4433 → 48698 [ACK] Seq=1 Ack=2124 Win=64128 Len=0 TSval=2864523818 TSecr=2169952888"
"62","5.224943697","2678","d2:ac:c9:85:7a:ca","b6:f9:e7:6d:d6:c8","172.20.0.2","172.20.0.3","TLSv1.3","Server Hello, Change Cipher Spec, Application Data, Application Data, Application Data, Application Data"
"63","5.225004055","66","b6:f9:e7:6d:d6:c8","d2:ac:c9:85:7a:ca","172.20.0.3","172.20.0.2","TCP","48698 → 4433 [ACK] Seq=2124 Ack=2613 Win=64128 Len=0 TSval=2169952902 TSecr=2864523831"
"64","5.235150778","146","b6:f9:e7:6d:d6:c8","d2:ac:c9:85:7a:ca","172.20.0.3","172.20.0.2","TLSv1.3","Change Cipher Spec, Application Data"
"65","5.235238077","66","b6:f9:e7:6d:d6:c8","d2:ac:c9:85:7a:ca","172.20.0.3","172.20.0.2","TCP","48698 → 4433 [RST, ACK] Seq=2204 Ack=2613 Win=64128 Len=0 TSval=2169952912 TSecr=2864523831"
"66","5.253547307","74","b6:f9:e7:6d:d6:c8","d2:ac:c9:85:7a:ca","172.20.0.3","172.20.0.2","TCP","48710 → 4433 [SYN] Seq=0 Win=64240 Len=0 MSS=1460 SACK_PERM TSval=2169952930 TSecr=0 WS=128"
"67","5.253579828","74","d2:ac:c9:85:7a:ca","b6:f9:e7:6d:d6:c8","172.20.0.2","172.20.0.3","TCP","4433 → 48710 [SYN, ACK] Seq=0 Ack=1 Win=65160 Len=0 MSS=1460 SACK_PERM TSval=2864523860 TSecr=2169952930 WS=128"
"68","5.253601260","66","b6:f9:e7:6d:d6:c8","d2:ac:c9:85:7a:ca","172.20.0.3","172.20.0.2","TCP","48710 → 4433 [ACK] Seq=1 Ack=1 Win=64256 Len=0 TSval=2169952930 TSecr=2864523860"
"69","5.253652967","2189","b6:f9:e7:6d:d6:c8","d2:ac:c9:85:7a:ca","172.20.0.3","172.20.0.2","TLSv1.2","Client Hello"
"70","5.253660804","66","d2:ac:c9:85:7a:ca","b6:f9:e7:6d:d6:c8","172.20.0.2","172.20.0.3","TCP","4433 → 48710 [ACK] Seq=1 Ack=2124 Win=64128 Len=0 TSval=2864523860 TSecr=2169952930"
"71","5.266444218","2677","d2:ac:c9:85:7a:ca","b6:f9:e7:6d:d6:c8","172.20.0.2","172.20.0.3","TLSv1.3","Server Hello, Change Cipher Spec, Application Data, Application Data, Application Data, Application Data"
"72","5.266512969","66","b6:f9:e7:6d:d6:c8","d2:ac:c9:85:7a:ca","172.20.0.3","172.20.0.2","TCP","48710 → 4433 [ACK] Seq=2124 Ack=2612 Win=64128 Len=0 TSval=2169952943 TSecr=2864523873"
"73","5.276047669","146","b6:f9:e7:6d:d6:c8","d2:ac:c9:85:7a:ca","172.20.0.3","172.20.0.2","TLSv1.3","Change Cipher Spec, Application Data"
"74","5.276128430","66","b6:f9:e7:6d:d6:c8","d2:ac:c9:85:7a:ca","172.20.0.3","172.20.0.2","TCP","48710 → 4433 [RST, ACK] Seq=2204 Ack=2612 Win=64128 Len=0 TSval=2169952953 TSecr=2864523873"
"75","5.294262237","74","b6:f9:e7:6d:d6:c8","d2:ac:c9:85:7a:ca","172.20.0.3","172.20.0.2","TCP","48712 → 4433 [SYN] Seq=0 Win=64240 Len=0 MSS=1460 SACK_PERM TSval=2169952971 TSecr=0 WS=128"
"76","5.294298760","74","d2:ac:c9:85:7a:ca","b6:f9:e7:6d:d6:c8","172.20.0.2","172.20.0.3","TCP","4433 → 48712 [SYN, ACK] Seq=0 Ack=1 Win=65160 Len=0 MSS=1460 SACK_PERM TSval=2864523901 TSecr=2169952971 WS=128"
"77","5.294324790","66","b6:f9:e7:6d:d6:c8","d2:ac:c9:85:7a:ca","172.20.0.3","172.20.0.2","TCP","48712 → 4433 [ACK] Seq=1 Ack=1 Win=64256 Len=0 TSval=2169952971 TSecr=2864523901"
"78","5.294396722","2189","b6:f9:e7:6d:d6:c8","d2:ac:c9:85:7a:ca","172.20.0.3","172.20.0.2","TLSv1.2","Client Hello"
"79","5.297972126","741","b6:f9:e7:6d:d6:c8","d2:ac:c9:85:7a:ca","172.20.0.3","172.20.0.2","TCP","[TCP Retransmission] 48712 → 4433 [PSH, ACK] Seq=1449 Ack=1 Win=64256 Len=675 TSval=2169952975 TSecr=2864523901"
"80","5.297980823","78","d2:ac:c9:85:7a:ca","b6:f9:e7:6d:d6:c8","172.20.0.2","172.20.0.3","TCP","4433 → 48712 [ACK] Seq=1 Ack=2124 Win=64128 Len=0 TSval=2864523905 TSecr=2169952975 SLE=1449 SRE=2124"
"81","5.307124061","2677","d2:ac:c9:85:7a:ca","b6:f9:e7:6d:d6:c8","172.20.0.2","172.20.0.3","TLSv1.3","Server Hello, Change Cipher Spec, Application Data, Application Data, Application Data, Application Data"
"82","5.307159028","66","b6:f9:e7:6d:d6:c8","d2:ac:c9:85:7a:ca","172.20.0.3","172.20.0.2","TCP","48712 → 4433 [ACK] Seq=2124 Ack=2612 Win=64128 Len=0 TSval=2169952984 TSecr=2864523914"
"83","5.317011699","146","b6:f9:e7:6d:d6:c8","d2:ac:c9:85:7a:ca","172.20.0.3","172.20.0.2","TLSv1.3","Change Cipher Spec, Application Data"
"84","5.317102293","66","b6:f9:e7:6d:d6:c8","d2:ac:c9:85:7a:ca","172.20.0.3","172.20.0.2","TCP","48712 → 4433 [RST, ACK] Seq=2204 Ack=2612 Win=64128 Len=0 TSval=2169952994 TSecr=2864523914"
"85","5.335033643","74","b6:f9:e7:6d:d6:c8","d2:ac:c9:85:7a:ca","172.20.0.3","172.20.0.2","TCP","48724 → 4433 [SYN] Seq=0 Win=64240 Len=0 MSS=1460 SACK_PERM TSval=2169953012 TSecr=0 WS=128"
"86","5.335066081","74","d2:ac:c9:85:7a:ca","b6:f9:e7:6d:d6:c8","172.20.0.2","172.20.0.3","TCP","4433 → 48724 [SYN, ACK] Seq=0 Ack=1 Win=65160 Len=0 MSS=1460 SACK_PERM TSval=2864523942 TSecr=2169953012 WS=128"
"87","5.335086476","66","b6:f9:e7:6d:d6:c8","d2:ac:c9:85:7a:ca","172.20.0.3","172.20.0.2","TCP","48724 → 4433 [ACK] Seq=1 Ack=1 Win=64256 Len=0 TSval=2169953012 TSecr=2864523942"
"88","5.335135199","2189","b6:f9:e7:6d:d6:c8","d2:ac:c9:85:7a:ca","172.20.0.3","172.20.0.2","TLSv1.2","Client Hello"
"89","5.335142298","66","d2:ac:c9:85:7a:ca","b6:f9:e7:6d:d6:c8","172.20.0.2","172.20.0.3","TCP","4433 → 48724 [ACK] Seq=1 Ack=2124 Win=64128 Len=0 TSval=2864523942 TSecr=2169953012"
"90","5.559987488","1514","d2:ac:c9:85:7a:ca","b6:f9:e7:6d:d6:c8","172.20.0.2","172.20.0.3","SSL",""
"91","5.560070329","66","b6:f9:e7:6d:d6:c8","d2:ac:c9:85:7a:ca","172.20.0.3","172.20.0.2","TCP","48724 → 4433 [ACK] Seq=2124 Ack=1449 Win=64128 Len=0 TSval=2169953237 TSecr=2864524167"
"92","5.560089603","1230","d2:ac:c9:85:7a:ca","b6:f9:e7:6d:d6:c8","172.20.0.2","172.20.0.3","TLSv1.3","Server Hello, Change Cipher Spec, Application Data, Application Data, Application Data, Application Data"
"93","5.560118636","66","b6:f9:e7:6d:d6:c8","d2:ac:c9:85:7a:ca","172.20.0.3","172.20.0.2","TCP","48724 → 4433 [ACK] Seq=2124 Ack=2613 Win=64128 Len=0 TSval=2169953237 TSecr=2864524167"
"94","5.569629307","146","b6:f9:e7:6d:d6:c8","d2:ac:c9:85:7a:ca","172.20.0.3","172.20.0.2","TLSv1.3","Change Cipher Spec, Application Data"
"95","5.569708400","66","b6:f9:e7:6d:d6:c8","d2:ac:c9:85:7a:ca","172.20.0.3","172.20.0.2","TCP","48724 → 4433 [RST, ACK] Seq=2204 Ack=2613 Win=64128 Len=0 TSval=2169953246 TSecr=2864524167"
"96","5.586916126","74","b6:f9:e7:6d:d6:c8","d2:ac:c9:85:7a:ca","172.20.0.3","172.20.0.2","TCP","48732 → 4433 [SYN] Seq=0 Win=64240 Len=0 MSS=1460 SACK_PERM TSval=2169953263 TSecr=0 WS=128"
"97","5.586958908","74","d2:ac:c9:85:7a:ca","b6:f9:e7:6d:d6:c8","172.20.0.2","172.20.0.3","TCP","4433 → 48732 [SYN, ACK] Seq=0 Ack=1 Win=65160 Len=0 MSS=1460 SACK_PERM TSval=2864524193 TSecr=2169953263 WS=128"
"98","5.586988875","66","b6:f9:e7:6d:d6:c8","d2:ac:c9:85:7a:ca","172.20.0.3","172.20.0.2","TCP","48732 → 4433 [ACK] Seq=1 Ack=1 Win=64256 Len=0 TSval=2169953264 TSecr=2864524193"
"99","5.587033023","2189","b6:f9:e7:6d:d6:c8","d2:ac:c9:85:7a:ca","172.20.0.3","172.20.0.2","TLSv1.2","Client Hello"
"100","5.587039732","66","d2:ac:c9:85:7a:ca","b6:f9:e7:6d:d6:c8","172.20.0.2","172.20.0.3","TCP","4433 → 48732 [ACK] Seq=1 Ack=2124 Win=64128 Len=0 TSval=2864524194 TSecr=2169953264"
"101","5.598862450","2677","d2:ac:c9:85:7a:ca","b6:f9:e7:6d:d6:c8","172.20.0.2","172.20.0.3","TLSv1.3","Server Hello, Change Cipher Spec, Application Data, Application Data, Application Data, Application Data"
"102","5.598899536","66","b6:f9:e7:6d:d6:c8","d2:ac:c9:85:7a:ca","172.20.0.3","172.20.0.2","TCP","48732 → 4433 [ACK] Seq=2124 Ack=2612 Win=64128 Len=0 TSval=2169953275 TSecr=2864524205"
"103","5.607857848","146","b6:f9:e7:6d:d6:c8","d2:ac:c9:85:7a:ca","172.20.0.3","172.20.0.2","TLSv1.3","Change Cipher Spec, Application Data"
"104","5.607921524","66","b6:f9:e7:6d:d6:c8","d2:ac:c9:85:7a:ca","172.20.0.3","172.20.0.2","TCP","48732 → 4433 [RST, ACK] Seq=2204 Ack=2612 Win=64128 Len=0 TSval=2169953284 TSecr=2864524205"
"105","5.624923137","74","b6:f9:e7:6d:d6:c8","d2:ac:c9:85:7a:ca","172.20.0.3","172.20.0.2","TCP","48746 → 4433 [SYN] Seq=0 Win=64240 Len=0 MSS=1460 SACK_PERM TSval=2169953301 TSecr=0 WS=128"
"106","5.624969135","74","d2:ac:c9:85:7a:ca","b6:f9:e7:6d:d6:c8","172.20.0.2","172.20.0.3","TCP","4433 → 48746 [SYN, ACK] Seq=0 Ack=1 Win=65160 Len=0 MSS=1460 SACK_PERM TSval=2864524232 TSecr=2169953301 WS=128"
"107","5.625000802","66","b6:f9:e7:6d:d6:c8","d2:ac:c9:85:7a:ca","172.20.0.3","172.20.0.2","TCP","48746 → 4433 [ACK] Seq=1 Ack=1 Win=64256 Len=0 TSval=2169953302 TSecr=2864524232"
"108","5.625062177","2189","b6:f9:e7:6d:d6:c8","d2:ac:c9:85:7a:ca","172.20.0.3","172.20.0.2","TLSv1.2","Client Hello"
"109","5.625068267","66","d2:ac:c9:85:7a:ca","b6:f9:e7:6d:d6:c8","172.20.0.2","172.20.0.3","TCP","4433 → 48746 [ACK] Seq=1 Ack=2124 Win=64128 Len=0 TSval=2864524232 TSecr=2169953302"
"110","5.637038474","2678","d2:ac:c9:85:7a:ca","b6:f9:e7:6d:d6:c8","172.20.0.2","172.20.0.3","TLSv1.3","Server Hello, Change Cipher Spec, Application Data, Application Data, Application Data, Application Data"
"111","5.637086609","66","b6:f9:e7:6d:d6:c8","d2:ac:c9:85:7a:ca","172.20.0.3","172.20.0.2","TCP","48746 → 4433 [ACK] Seq=2124 Ack=2613 Win=64128 Len=0 TSval=2169953314 TSecr=2864524244"
"112","5.646269262","146","b6:f9:e7:6d:d6:c8","d2:ac:c9:85:7a:ca","172.20.0.3","172.20.0.2","TLSv1.3","Change Cipher Spec, Application Data"
"113","5.646342000","66","b6:f9:e7:6d:d6:c8","d2:ac:c9:85:7a:ca","172.20.0.3","172.20.0.2","TCP","48746 → 4433 [RST, ACK] Seq=2204 Ack=2613 Win=64128 Len=0 TSval=2169953323 TSecr=2864524244"
"114","5.663167858","74","b6:f9:e7:6d:d6:c8","d2:ac:c9:85:7a:ca","172.20.0.3","172.20.0.2","TCP","48756 → 4433 [SYN] Seq=0 Win=64240 Len=0 MSS=1460 SACK_PERM TSval=2169953340 TSecr=0 WS=128"
"115","5.663195342","74","d2:ac:c9:85:7a:ca","b6:f9:e7:6d:d6:c8","172.20.0.2","172.20.0.3","TCP","4433 → 48756 [SYN, ACK] Seq=0 Ack=1 Win=65160 Len=0 MSS=1460 SACK_PERM TSval=2864524270 TSecr=2169953340 WS=128"
"116","5.663215107","66","b6:f9:e7:6d:d6:c8","d2:ac:c9:85:7a:ca","172.20.0.3","172.20.0.2","TCP","48756 → 4433 [ACK] Seq=1 Ack=1 Win=64256 Len=0 TSval=2169953340 TSecr=2864524270"
"117","5.663274211","2189","b6:f9:e7:6d:d6:c8","d2:ac:c9:85:7a:ca","172.20.0.3","172.20.0.2","TLSv1.2","Client Hello"
"118","5.663279528","66","d2:ac:c9:85:7a:ca","b6:f9:e7:6d:d6:c8","172.20.0.2","172.20.0.3","TCP","4433 → 48756 [ACK] Seq=1 Ack=2124 Win=64128 Len=0 TSval=2864524270 TSecr=2169953340"
"119","5.678974614","1229","d2:ac:c9:85:7a:ca","b6:f9:e7:6d:d6:c8","172.20.0.2","172.20.0.3","SSL","[TCP Previous segment not captured] , Continuation Data"
"120","5.679035602","78","b6:f9:e7:6d:d6:c8","d2:ac:c9:85:7a:ca","172.20.0.3","172.20.0.2","TCP","[TCP Dup ACK 116#1] 48756 → 4433 [ACK] Seq=2124 Ack=1 Win=64256 Len=0 TSval=2169953356 TSecr=2864524270 SLE=1449 SRE=2612"
"121","5.679045996","1514","d2:ac:c9:85:7a:ca","b6:f9:e7:6d:d6:c8","172.20.0.2","172.20.0.3","TCP","[TCP Retransmission] 4433 → 48756 [ACK] Seq=1 Ack=2124 Win=64128 Len=1448 TSval=2864524286 TSecr=2169953356"
"122","5.679061657","66","b6:f9:e7:6d:d6:c8","d2:ac:c9:85:7a:ca","172.20.0.3","172.20.0.2","TCP","48756 → 4433 [ACK] Seq=2124 Ack=2612 Win=64128 Len=0 TSval=2169953356 TSecr=2864524286"
"123","5.688297942","146","b6:f9:e7:6d:d6:c8","d2:ac:c9:85:7a:ca","172.20.0.3","172.20.0.2","TLSv1.2","Change Cipher Spec, Application Data"
"124","5.688393973","66","b6:f9:e7:6d:d6:c8","d2:ac:c9:85:7a:ca","172.20.0.3","172.20.0.2","TCP","48756 → 4433 [RST, ACK] Seq=2204 Ack=2612 Win=64128 Len=0 TSval=2169953365 TSecr=2864524286"
"125","5.705126006","74","b6:f9:e7:6d:d6:c8","d2:ac:c9:85:7a:ca","172.20.0.3","172.20.0.2","TCP","48772 → 4433 [SYN] Seq=0 Win=64240 Len=0 MSS=1460 SACK_PERM TSval=2169953382 TSecr=0 WS=128"
"126","5.705153937","74","d2:ac:c9:85:7a:ca","b6:f9:e7:6d:d6:c8","172.20.0.2","172.20.0.3","TCP","4433 → 48772 [SYN, ACK] Seq=0 Ack=1 Win=65160 Len=0 MSS=1460 SACK_PERM TSval=2864524312 TSecr=2169953382 WS=128"
"127","5.705171791","66","b6:f9:e7:6d:d6:c8","d2:ac:c9:85:7a:ca","172.20.0.3","172.20.0.2","TCP","48772 → 4433 [ACK] Seq=1 Ack=1 Win=64256 Len=0 TSval=2169953382 TSecr=2864524312"
"128","5.705216099","2189","b6:f9:e7:6d:d6:c8","d2:ac:c9:85:7a:ca","172.20.0.3","172.20.0.2","TLSv1.2","Client Hello"
"129","5.708974668","741","b6:f9:e7:6d:d6:c8","d2:ac:c9:85:7a:ca","172.20.0.3","172.20.0.2","TCP","[TCP Retransmission] 48772 → 4433 [PSH, ACK] Seq=1449 Ack=1 Win=64256 Len=675 TSval=2169953386 TSecr=2864524312"
"130","5.708986550","78","d2:ac:c9:85:7a:ca","b6:f9:e7:6d:d6:c8","172.20.0.2","172.20.0.3","TCP","4433 → 48772 [ACK] Seq=1 Ack=2124 Win=64128 Len=0 TSval=2864524316 TSecr=2169953386 SLE=1449 SRE=2124"
"131","5.714170570","42","b6:f9:e7:6d:d6:c8","ff:ff:ff:ff:ff:ff",,,"ARP","ARP Announcement for 172.20.0.3"
"132","5.717379707","2676","d2:ac:c9:85:7a:ca","b6:f9:e7:6d:d6:c8","172.20.0.2","172.20.0.3","TLSv1.3","Server Hello, Change Cipher Spec, Application Data, Application Data, Application Data, Application Data"
"133","5.717418339","66","b6:f9:e7:6d:d6:c8","d2:ac:c9:85:7a:ca","172.20.0.3","172.20.0.2","TCP","48772 → 4433 [ACK] Seq=2124 Ack=2611 Win=64128 Len=0 TSval=2169953394 TSecr=2864524324"
"134","5.726493697","146","b6:f9:e7:6d:d6:c8","d2:ac:c9:85:7a:ca","172.20.0.3","172.20.0.2","TLSv1.3","Change Cipher Spec, Application Data"
"135","5.726577229","66","b6:f9:e7:6d:d6:c8","d2:ac:c9:85:7a:ca","172.20.0.3","172.20.0.2","TCP","48772 → 4433 [RST, ACK] Seq=2204 Ack=2611 Win=64128 Len=0 TSval=2169953403 TSecr=2864524324"
"136","5.743791985","74","b6:f9:e7:6d:d6:c8","d2:ac:c9:85:7a:ca","172.20.0.3","172.20.0.2","TCP","48788 → 4433 [SYN] Seq=0 Win=64240 Len=0 MSS=1460 SACK_PERM TSval=2169953420 TSecr=0 WS=128"
"137","5.743826048","74","d2:ac:c9:85:7a:ca","b6:f9:e7:6d:d6:c8","172.20.0.2","172.20.0.3","TCP","4433 → 48788 [SYN, ACK] Seq=0 Ack=1 Win=65160 Len=0 MSS=1460 SACK_PERM TSval=2864524350 TSecr=2169953420 WS=128"
"138","5.743846368","66","b6:f9:e7:6d:d6:c8","d2:ac:c9:85:7a:ca","172.20.0.3","172.20.0.2","TCP","48788 → 4433 [ACK] Seq=1 Ack=1 Win=64256 Len=0 TSval=2169953420 TSecr=2864524350"
"139","5.743902086","2189","b6:f9:e7:6d:d6:c8","d2:ac:c9:85:7a:ca","172.20.0.3","172.20.0.2","TLSv1.2","Client Hello"
"140","5.743909655","66","d2:ac:c9:85:7a:ca","b6:f9:e7:6d:d6:c8","172.20.0.2","172.20.0.3","TCP","4433 → 48788 [ACK] Seq=1 Ack=2124 Win=64128 Len=0 TSval=2864524350 TSecr=2169953420"
"141","5.755722804","2678","d2:ac:c9:85:7a:ca","b6:f9:e7:6d:d6:c8","172.20.0.2","172.20.0.3","TLSv1.3","Server Hello, Change Cipher Spec, Application Data, Application Data, Application Data, Application Data"
"142","5.755764415","66","b6:f9:e7:6d:d6:c8","d2:ac:c9:85:7a:ca","172.20.0.3","172.20.0.2","TCP","48788 → 4433 [ACK] Seq=2124 Ack=2613 Win=64128 Len=0 TSval=2169953432 TSecr=2864524362"
"143","5.765001180","146","b6:f9:e7:6d:d6:c8","d2:ac:c9:85:7a:ca","172.20.0.3","172.20.0.2","TLSv1.3","Change Cipher Spec, Application Data"
"144","5.765091920","66","b6:f9:e7:6d:d6:c8","d2:ac:c9:85:7a:ca","172.20.0.3","172.20.0.2","TCP","48788 → 4433 [RST, ACK] Seq=2204 Ack=2613 Win=64128 Len=0 TSval=2169953442 TSecr=2864524362"
"145","5.781662935","74","b6:f9:e7:6d:d6:c8","d2:ac:c9:85:7a:ca","172.20.0.3","172.20.0.2","TCP","48790 → 4433 [SYN] Seq=0 Win=64240 Len=0 MSS=1460 SACK_PERM TSval=2169953458 TSecr=0 WS=128"
"146","5.781689890","74","d2:ac:c9:85:7a:ca","b6:f9:e7:6d:d6:c8","172.20.0.2","172.20.0.3","TCP","4433 → 48790 [SYN, ACK] Seq=0 Ack=1 Win=65160 Len=0 MSS=1460 SACK_PERM TSval=2864524388 TSecr=2169953458 WS=128"
"147","5.781709438","66","b6:f9:e7:6d:d6:c8","d2:ac:c9:85:7a:ca","172.20.0.3","172.20.0.2","TCP","48790 → 4433 [ACK] Seq=1 Ack=1 Win=64256 Len=0 TSval=2169953458 TSecr=2864524388"
"148","5.781759584","2189","b6:f9:e7:6d:d6:c8","d2:ac:c9:85:7a:ca","172.20.0.3","172.20.0.2","TLSv1.2","Client Hello"
"149","5.781766190","66","d2:ac:c9:85:7a:ca","b6:f9:e7:6d:d6:c8","172.20.0.2","172.20.0.3","TCP","4433 → 48790 [ACK] Seq=1 Ack=2124 Win=64128 Len=0 TSval=2864524388 TSecr=2169953458"
"150","5.793653190","2677","d2:ac:c9:85:7a:ca","b6:f9:e7:6d:d6:c8","172.20.0.2","172.20.0.3","TLSv1.3","Server Hello, Change Cipher Spec, Application Data, Application Data, Application Data, Application Data"
"151","5.793704127","66","b6:f9:e7:6d:d6:c8","d2:ac:c9:85:7a:ca","172.20.0.3","172.20.0.2","TCP","48790 → 4433 [ACK] Seq=2124 Ack=2612 Win=64128 Len=0 TSval=2169953470 TSecr=2864524400"
"152","5.803507614","146","b6:f9:e7:6d:d6:c8","d2:ac:c9:85:7a:ca","172.20.0.3","172.20.0.2","TLSv1.3","Change Cipher Spec, Application Data"
"153","5.803606632","66","b6:f9:e7:6d:d6:c8","d2:ac:c9:85:7a:ca","172.20.0.3","172.20.0.2","TCP","48790 → 4433 [RST, ACK] Seq=2204 Ack=2612 Win=64128 Len=0 TSval=2169953480 TSecr=2864524400"
"154","5.820862309","74","b6:f9:e7:6d:d6:c8","d2:ac:c9:85:7a:ca","172.20.0.3","172.20.0.2","TCP","48792 → 4433 [SYN] Seq=0 Win=64240 Len=0 MSS=1460 SACK_PERM TSval=2169953497 TSecr=0 WS=128"
"155","5.820896783","74","d2:ac:c9:85:7a:ca","b6:f9:e7:6d:d6:c8","172.20.0.2","172.20.0.3","TCP","4433 → 48792 [SYN, ACK] Seq=0 Ack=1 Win=65160 Len=0 MSS=1460 SACK_PERM TSval=2864524427 TSecr=2169953497 WS=128"
"156","5.820916925","66","b6:f9:e7:6d:d6:c8","d2:ac:c9:85:7a:ca","172.20.0.3","172.20.0.2","TCP","48792 → 4433 [ACK] Seq=1 Ack=1 Win=64256 Len=0 TSval=2169953497 TSecr=2864524427"
"157","5.820993979","2189","b6:f9:e7:6d:d6:c8","d2:ac:c9:85:7a:ca","172.20.0.3","172.20.0.2","TLSv1.2","Client Hello"
"158","5.821001798","66","d2:ac:c9:85:7a:ca","b6:f9:e7:6d:d6:c8","172.20.0.2","172.20.0.3","TCP","4433 → 48792 [ACK] Seq=1 Ack=2124 Win=64128 Len=0 TSval=2864524428 TSecr=2169953498"
"159","5.833165023","2678","d2:ac:c9:85:7a:ca","b6:f9:e7:6d:d6:c8","172.20.0.2","172.20.0.3","TLSv1.3","Server Hello, Change Cipher Spec, Application Data, Application Data, Application Data, Application Data"
"160","5.833213928","66","b6:f9:e7:6d:d6:c8","d2:ac:c9:85:7a:ca","172.20.0.3","172.20.0.2","TCP","48792 → 4433 [ACK] Seq=2124 Ack=2613 Win=64128 Len=0 TSval=2169953510 TSecr=2864524440"
"161","5.842643580","146","b6:f9:e7:6d:d6:c8","d2:ac:c9:85:7a:ca","172.20.0.3","172.20.0.2","TLSv1.3","Change Cipher Spec, Application Data"
"162","5.842727217","66","b6:f9:e7:6d:d6:c8","d2:ac:c9:85:7a:ca","172.20.0.3","172.20.0.2","TCP","48792 → 4433 [RST, ACK] Seq=2204 Ack=2613 Win=64128 Len=0 TSval=2169953519 TSecr=2864524440"
"163","5.859767251","74","b6:f9:e7:6d:d6:c8","d2:ac:c9:85:7a:ca","172.20.0.3","172.20.0.2","TCP","48798 → 4433 [SYN] Seq=0 Win=64240 Len=0 MSS=1460 SACK_PERM TSval=2169953536 TSecr=0 WS=128"
"164","5.859798978","74","d2:ac:c9:85:7a:ca","b6:f9:e7:6d:d6:c8","172.20.0.2","172.20.0.3","TCP","4433 → 48798 [SYN, ACK] Seq=0 Ack=1 Win=65160 Len=0 MSS=1460 SACK_PERM TSval=2864524466 TSecr=2169953536 WS=128"
"165","5.859819127","66","b6:f9:e7:6d:d6:c8","d2:ac:c9:85:7a:ca","172.20.0.3","172.20.0.2","TCP","48798 → 4433 [ACK] Seq=1 Ack=1 Win=64256 Len=0 TSval=2169953536 TSecr=2864524466"
"166","5.859872223","2189","b6:f9:e7:6d:d6:c8","d2:ac:c9:85:7a:ca","172.20.0.3","172.20.0.2","TLSv1.2","Client Hello"
"167","5.859879349","66","d2:ac:c9:85:7a:ca","b6:f9:e7:6d:d6:c8","172.20.0.2","172.20.0.3","TCP","4433 → 48798 [ACK] Seq=1 Ack=2124 Win=64128 Len=0 TSval=2864524466 TSecr=2169953536"
"168","5.872006775","2676","d2:ac:c9:85:7a:ca","b6:f9:e7:6d:d6:c8","172.20.0.2","172.20.0.3","TLSv1.3","Server Hello, Change Cipher Spec, Application Data, Application Data, Application Data, Application Data"
"169","5.872054259","66","b6:f9:e7:6d:d6:c8","d2:ac:c9:85:7a:ca","172.20.0.3","172.20.0.2","TCP","48798 → 4433 [ACK] Seq=2124 Ack=2611 Win=64128 Len=0 TSval=2169953549 TSecr=2864524479"
"170","5.881339855","146","b6:f9:e7:6d:d6:c8","d2:ac:c9:85:7a:ca","172.20.0.3","172.20.0.2","TLSv1.3","Change Cipher Spec, Application Data"
"171","5.881421681","66","b6:f9:e7:6d:d6:c8","d2:ac:c9:85:7a:ca","172.20.0.3","172.20.0.2","TCP","48798 → 4433 [RST, ACK] Seq=2204 Ack=2611 Win=64128 Len=0 TSval=2169953558 TSecr=2864524479"
"172","5.898740849","74","b6:f9:e7:6d:d6:c8","d2:ac:c9:85:7a:ca","172.20.0.3","172.20.0.2","TCP","48806 → 4433 [SYN] Seq=0 Win=64240 Len=0 MSS=1460 SACK_PERM TSval=2169953575 TSecr=0 WS=128"
"173","5.898771753","74","d2:ac:c9:85:7a:ca","b6:f9:e7:6d:d6:c8","172.20.0.2","172.20.0.3","TCP","4433 → 48806 [SYN, ACK] Seq=0 Ack=1 Win=65160 Len=0 MSS=1460 SACK_PERM TSval=2864524505 TSecr=2169953575 WS=128"
"174","5.898791071","66","b6:f9:e7:6d:d6:c8","d2:ac:c9:85:7a:ca","172.20.0.3","172.20.0.2","TCP","48806 → 4433 [ACK] Seq=1 Ack=1 Win=64256 Len=0 TSval=2169953575 TSecr=2864524505"
"175","5.898860386","2189","b6:f9:e7:6d:d6:c8","d2:ac:c9:85:7a:ca","172.20.0.3","172.20.0.2","TLSv1.2","Client Hello"
"176","5.898867122","66","d2:ac:c9:85:7a:ca","b6:f9:e7:6d:d6:c8","172.20.0.2","172.20.0.3","TCP","4433 → 48806 [ACK] Seq=1 Ack=2124 Win=64128 Len=0 TSval=2864524505 TSecr=2169953575"
"177","5.911186049","2677","d2:ac:c9:85:7a:ca","b6:f9:e7:6d:d6:c8","172.20.0.2","172.20.0.3","TLSv1.3","Server Hello, Change Cipher Spec, Application Data, Application Data, Application Data, Application Data"
"178","5.911240438","66","b6:f9:e7:6d:d6:c8","d2:ac:c9:85:7a:ca","172.20.0.3","172.20.0.2","TCP","48806 → 4433 [ACK] Seq=2124 Ack=2612 Win=64128 Len=0 TSval=2169953588 TSecr=2864524518"
"179","5.920647119","146","b6:f9:e7:6d:d6:c8","d2:ac:c9:85:7a:ca","172.20.0.3","172.20.0.2","TLSv1.3","Change Cipher Spec, Application Data"
"180","5.920716520","66","b6:f9:e7:6d:d6:c8","d2:ac:c9:85:7a:ca","172.20.0.3","172.20.0.2","TCP","48806 → 4433 [RST, ACK] Seq=2204 Ack=2612 Win=64128 Len=0 TSval=2169953597 TSecr=2864524518"
"181","5.938763496","74","b6:f9:e7:6d:d6:c8","d2:ac:c9:85:7a:ca","172.20.0.3","172.20.0.2","TCP","48810 → 4433 [SYN] Seq=0 Win=64240 Len=0 MSS=1460 SACK_PERM TSval=2169953615 TSecr=0 WS=128"
"182","5.938801320","74","d2:ac:c9:85:7a:ca","b6:f9:e7:6d:d6:c8","172.20.0.2","172.20.0.3","TCP","4433 → 48810 [SYN, ACK] Seq=0 Ack=1 Win=65160 Len=0 MSS=1460 SACK_PERM TSval=2864524545 TSecr=2169953615 WS=128"
"183","5.938823039","66","b6:f9:e7:6d:d6:c8","d2:ac:c9:85:7a:ca","172.20.0.3","172.20.0.2","TCP","48810 → 4433 [ACK] Seq=1 Ack=1 Win=64256 Len=0 TSval=2169953615 TSecr=2864524545"
"184","5.938889765","2189","b6:f9:e7:6d:d6:c8","d2:ac:c9:85:7a:ca","172.20.0.3","172.20.0.2","TLSv1.2","Client Hello"
"185","5.941982715","741","b6:f9:e7:6d:d6:c8","d2:ac:c9:85:7a:ca","172.20.0.3","172.20.0.2","TCP","[TCP Retransmission] 48810 → 4433 [PSH, ACK] Seq=1449 Ack=1 Win=64256 Len=675 TSval=2169953619 TSecr=2864524545"
"186","5.941994695","78","d2:ac:c9:85:7a:ca","b6:f9:e7:6d:d6:c8","172.20.0.2","172.20.0.3","TCP","4433 → 48810 [ACK] Seq=1 Ack=2124 Win=64128 Len=0 TSval=2864524549 TSecr=2169953619 SLE=1449 SRE=2124"
"187","6.159982295","1514","d2:ac:c9:85:7a:ca","b6:f9:e7:6d:d6:c8","172.20.0.2","172.20.0.3","SSL",""
"188","6.160057905","66","b6:f9:e7:6d:d6:c8","d2:ac:c9:85:7a:ca","172.20.0.3","172.20.0.2","TCP","48810 → 4433 [ACK] Seq=2124 Ack=1449 Win=64128 Len=0 TSval=2169953837 TSecr=2864524767"
"189","6.160071927","1230","d2:ac:c9:85:7a:ca","b6:f9:e7:6d:d6:c8","172.20.0.2","172.20.0.3","TLSv1.3","Server Hello, Change Cipher Spec, Application Data, Application Data, Application Data, Application Data"
"190","6.160078406","66","b6:f9:e7:6d:d6:c8","d2:ac:c9:85:7a:ca","172.20.0.3","172.20.0.2","TCP","48810 → 4433 [ACK] Seq=2124 Ack=2613 Win=64128 Len=0 TSval=2169953837 TSecr=2864524767"
"191","6.169501517","146","b6:f9:e7:6d:d6:c8","d2:ac:c9:85:7a:ca","172.20.0.3","172.20.0.2","TLSv1.3","Change Cipher Spec, Application Data"
"192","6.169575092","66","b6:f9:e7:6d:d6:c8","d2:ac:c9:85:7a:ca","172.20.0.3","172.20.0.2","TCP","48810 → 4433 [RST, ACK] Seq=2204 Ack=2613 Win=64128 Len=0 TSval=2169953846 TSecr=2864524767"
"193","6.186534907","74","b6:f9:e7:6d:d6:c8","d2:ac:c9:85:7a:ca","172.20.0.3","172.20.0.2","TCP","48826 → 4433 [SYN] Seq=0 Win=64240 Len=0 MSS=1460 SACK_PERM TSval=2169953863 TSecr=0 WS=128"
"194","6.186566091","74","d2:ac:c9:85:7a:ca","b6:f9:e7:6d:d6:c8","172.20.0.2","172.20.0.3","TCP","4433 → 48826 [SYN, ACK] Seq=0 Ack=1 Win=65160 Len=0 MSS=1460 SACK_PERM TSval=2864524793 TSecr=2169953863 WS=128"
"195","6.186586517","66","b6:f9:e7:6d:d6:c8","d2:ac:c9:85:7a:ca","172.20.0.3","172.20.0.2","TCP","48826 → 4433 [ACK] Seq=1 Ack=1 Win=64256 Len=0 TSval=2169953863 TSecr=2864524793"
"196","6.186633898","2189","b6:f9:e7:6d:d6:c8","d2:ac:c9:85:7a:ca","172.20.0.3","172.20.0.2","TLSv1.2","Client Hello"
"197","6.186640718","66","d2:ac:c9:85:7a:ca","b6:f9:e7:6d:d6:c8","172.20.0.2","172.20.0.3","TCP","4433 → 48826 [ACK] Seq=1 Ack=2124 Win=64128 Len=0 TSval=2864524793 TSecr=2169953863"
"198","6.201970315","1229","d2:ac:c9:85:7a:ca","b6:f9:e7:6d:d6:c8","172.20.0.2","172.20.0.3","SSL","[TCP Previous segment not captured] , Continuation Data"
"199","6.202018437","78","b6:f9:e7:6d:d6:c8","d2:ac:c9:85:7a:ca","172.20.0.3","172.20.0.2","TCP","[TCP Dup ACK 195#1] 48826 → 4433 [ACK] Seq=2124 Ack=1 Win=64256 Len=0 TSval=2169953879 TSecr=2864524793 SLE=1449 SRE=2612"
"200","6.202030125","1514","d2:ac:c9:85:7a:ca","b6:f9:e7:6d:d6:c8","172.20.0.2","172.20.0.3","TCP","[TCP Retransmission] 4433 → 48826 [ACK] Seq=1 Ack=2124 Win=64128 Len=1448 TSval=2864524809 TSecr=2169953879"
"201","6.202042389","66","b6:f9:e7:6d:d6:c8","d2:ac:c9:85:7a:ca","172.20.0.3","172.20.0.2","TCP","48826 → 4433 [ACK] Seq=2124 Ack=2612 Win=64128 Len=0 TSval=2169953879 TSecr=2864524809"
"202","6.211513644","146","b6:f9:e7:6d:d6:c8","d2:ac:c9:85:7a:ca","172.20.0.3","172.20.0.2","TLSv1.2","Change Cipher Spec, Application Data"
"203","6.211598563","66","b6:f9:e7:6d:d6:c8","d2:ac:c9:85:7a:ca","172.20.0.3","172.20.0.2","TCP","48826 → 4433 [RST, ACK] Seq=2204 Ack=2612 Win=64128 Len=0 TSval=2169953888 TSecr=2864524809"
"204","6.228442572","74","b6:f9:e7:6d:d6:c8","d2:ac:c9:85:7a:ca","172.20.0.3","172.20.0.2","TCP","48840 → 4433 [SYN] Seq=0 Win=64240 Len=0 MSS=1460 SACK_PERM TSval=2169953905 TSecr=0 WS=128"
"205","7.232012266","74","d2:ac:c9:85:7a:ca","b6:f9:e7:6d:d6:c8","172.20.0.2","172.20.0.3","TCP","4433 → 48840 [SYN, ACK] Seq=0 Ack=1 Win=65160 Len=0 MSS=1460 SACK_PERM TSval=2864525839 TSecr=2169953905 WS=128"
"206","7.232027892","74","b6:f9:e7:6d:d6:c8","d2:ac:c9:85:7a:ca","172.20.0.3","172.20.0.2","TCP","[TCP Retransmission] 48840 → 4433 [SYN] Seq=0 Win=64240 Len=0 MSS=1460 SACK_PERM TSval=2169954909 TSecr=0 WS=128"
"207","7.232041571","74","d2:ac:c9:85:7a:ca","b6:f9:e7:6d:d6:c8","172.20.0.2","172.20.0.3","TCP","[TCP Out-Of-Order] 4433 → 48840 [SYN, ACK] Seq=0 Ack=1 Win=65160 Len=0 MSS=1460 SACK_PERM TSval=2864525839 TSecr=2169953905 WS=128"
"208","7.232072506","66","b6:f9:e7:6d:d6:c8","d2:ac:c9:85:7a:ca","172.20.0.3","172.20.0.2","TCP","48840 → 4433 [ACK] Seq=1 Ack=1 Win=64256 Len=0 TSval=2169954909 TSecr=2864525839"
"209","7.232099553","66","b6:f9:e7:6d:d6:c8","d2:ac:c9:85:7a:ca","172.20.0.3","172.20.0.2","TCP","[TCP Dup ACK 208#1] 48840 → 4433 [ACK] Seq=1 Ack=1 Win=64256 Len=0 TSval=2169954909 TSecr=2864525839"
"210","7.232151179","2189","b6:f9:e7:6d:d6:c8","d2:ac:c9:85:7a:ca","172.20.0.3","172.20.0.2","TLSv1.2","Client Hello"
"211","7.232157385","66","d2:ac:c9:85:7a:ca","b6:f9:e7:6d:d6:c8","172.20.0.2","172.20.0.3","TCP","4433 → 48840 [ACK] Seq=1 Ack=2124 Win=64128 Len=0 TSval=2864525839 TSecr=2169954909"
"212","7.244360927","1514","d2:ac:c9:85:7a:ca","b6:f9:e7:6d:d6:c8","172.20.0.2","172.20.0.3","SSL",""
"213","7.244405757","66","b6:f9:e7:6d:d6:c8","d2:ac:c9:85:7a:ca","172.20.0.3","172.20.0.2","TCP","48840 → 4433 [ACK] Seq=2124 Ack=1449 Win=64128 Len=0 TSval=2169954921 TSecr=2864525851"
"214","7.244419331","1230","d2:ac:c9:85:7a:ca","b6:f9:e7:6d:d6:c8","172.20.0.2","172.20.0.3","TLSv1.3","Server Hello, Change Cipher Spec, Application Data, Application Data, Application Data, Application Data"
"215","7.244425846","66","b6:f9:e7:6d:d6:c8","d2:ac:c9:85:7a:ca","172.20.0.3","172.20.0.2","TCP","48840 → 4433 [ACK] Seq=2124 Ack=2613 Win=64128 Len=0 TSval=2169954921 TSecr=2864525851"
"216","7.254026191","146","b6:f9:e7:6d:d6:c8","d2:ac:c9:85:7a:ca","172.20.0.3","172.20.0.2","TLSv1.3","Change Cipher Spec, Application Data"
"217","7.254103552","66","b6:f9:e7:6d:d6:c8","d2:ac:c9:85:7a:ca","172.20.0.3","172.20.0.2","TCP","48840 → 4433 [RST, ACK] Seq=2204 Ack=2613 Win=64128 Len=0 TSval=2169954931 TSecr=2864525851"
"218","7.272163417","74","b6:f9:e7:6d:d6:c8","d2:ac:c9:85:7a:ca","172.20.0.3","172.20.0.2","TCP","48854 → 4433 [SYN] Seq=0 Win=64240 Len=0 MSS=1460 SACK_PERM TSval=2169954949 TSecr=0 WS=128"
"219","7.272195861","74","d2:ac:c9:85:7a:ca","b6:f9:e7:6d:d6:c8","172.20.0.2","172.20.0.3","TCP","4433 → 48854 [SYN, ACK] Seq=0 Ack=1 Win=65160 Len=0 MSS=1460 SACK_PERM TSval=2864525879 TSecr=2169954949 WS=128"
"220","7.272216494","66","b6:f9:e7:6d:d6:c8","d2:ac:c9:85:7a:ca","172.20.0.3","172.20.0.2","TCP","48854 → 4433 [ACK] Seq=1 Ack=1 Win=64256 Len=0 TSval=2169954949 TSecr=2864525879"
"221","7.272266186","2189","b6:f9:e7:6d:d6:c8","d2:ac:c9:85:7a:ca","172.20.0.3","172.20.0.2","TLSv1.2","Client Hello"
"222","7.272273269","66","d2:ac:c9:85:7a:ca","b6:f9:e7:6d:d6:c8","172.20.0.2","172.20.0.3","TCP","4433 → 48854 [ACK] Seq=1 Ack=2124 Win=64128 Len=0 TSval=2864525879 TSecr=2169954949"
