frame.number,frame.time_relative,frame.len,eth.src,eth.dst,ip.src,ip.dst,_ws.col.protocol,_ws.col.info
"1","0.000000000","42","a6:ec:86:63:9b:d9","ff:ff:ff:ff:ff:ff",,,"ARP","ARP Announcement for 172.20.0.3"
"2","0.034329861","42","a6:ec:86:63:9b:d9","ff:ff:ff:ff:ff:ff",,,"ARP","Who has 172.20.0.2? Tell 172.20.0.3"
"3","0.034357332","42","aa:bf:7e:41:c0:92","a6:ec:86:63:9b:d9",,,"ARP","172.20.0.2 is at aa:bf:7e:41:c0:92"
"4","0.034364699","74","a6:ec:86:63:9b:d9","aa:bf:7e:41:c0:92","172.20.0.3","172.20.0.2","TCP","48068 → 4433 [SYN] Seq=0 Win=64240 Len=0 MSS=1460 SACK_PERM TSval=2169085640 TSecr=0 WS=128"
"5","0.034387643","74","aa:bf:7e:41:c0:92","a6:ec:86:63:9b:d9","172.20.0.2","172.20.0.3","TCP","4433 → 48068 [SYN, ACK] Seq=0 Ack=1 Win=65160 Len=0 MSS=1460 SACK_PERM TSval=2863656570 TSecr=2169085640 WS=128"
"6","0.034406462","66","a6:ec:86:63:9b:d9","aa:bf:7e:41:c0:92","172.20.0.3","172.20.0.2","TCP","48068 → 4433 [ACK] Seq=1 Ack=1 Win=64256 Len=0 TSval=2169085640 TSecr=2863656570"
"7","0.034452849","1769","a6:ec:86:63:9b:d9","aa:bf:7e:41:c0:92","172.20.0.3","172.20.0.2","TLSv1.2","Client Hello"
"8","0.038231139","321","a6:ec:86:63:9b:d9","aa:bf:7e:41:c0:92","172.20.0.3","172.20.0.2","TCP","[TCP Retransmission] 48068 → 4433 [PSH, ACK] Seq=1449 Ack=1 Win=64256 Len=255 TSval=2169085644 TSecr=2863656570"
"9","0.038238446","78","aa:bf:7e:41:c0:92","a6:ec:86:63:9b:d9","172.20.0.2","172.20.0.3","TCP","4433 → 48068 [ACK] Seq=1 Ack=1704 Win=64128 Len=0 TSval=2863656574 TSecr=2169085644 SLE=1449 SRE=1704"
"10","0.042987763","2053","aa:bf:7e:41:c0:92","a6:ec:86:63:9b:d9","172.20.0.2","172.20.0.3","TLSv1.3","Server Hello, Change Cipher Spec, Application Data, Application Data, Application Data, Application Data"
"11","0.043018556","66","a6:ec:86:63:9b:d9","aa:bf:7e:41:c0:92","172.20.0.3","172.20.0.2","TCP","48068 → 4433 [ACK] Seq=1704 Ack=1988 Win=64128 Len=0 TSval=2169085648 TSecr=2863656578"
"12","0.048314606","146","a6:ec:86:63:9b:d9","aa:bf:7e:41:c0:92","172.20.0.3","172.20.0.2","TLSv1.3","Change Cipher Spec, Application Data"
"13","0.048374406","66","a6:ec:86:63:9b:d9","aa:bf:7e:41:c0:92","172.20.0.3","172.20.0.2","TCP","48068 → 4433 [RST, ACK] Seq=1784 Ack=1988 Win=64128 Len=0 TSval=2169085654 TSecr=2863656578"
"14","0.063283954","74","a6:ec:86:63:9b:d9","aa:bf:7e:41:c0:92","172.20.0.3","172.20.0.2","TCP","48080 → 4433 [SYN] Seq=0 Win=64240 Len=0 MSS=1460 SACK_PERM TSval=2169085669 TSecr=0 WS=128"
"15","0.063307307","74","aa:bf:7e:41:c0:92","a6:ec:86:63:9b:d9","172.20.0.2","172.20.0.3","TCP","4433 → 48080 [SYN, ACK] Seq=0 Ack=1 Win=65160 Len=0 MSS=1460 SACK_PERM TSval=2863656599 TSecr=2169085669 WS=128"
"16","0.063324501","66","a6:ec:86:63:9b:d9","aa:bf:7e:41:c0:92","172.20.0.3","172.20.0.2","TCP","48080 → 4433 [ACK] Seq=1 Ack=1 Win=64256 Len=0 TSval=2169085669 TSecr=2863656599"
"17","0.063364913","1769","a6:ec:86:63:9b:d9","aa:bf:7e:41:c0:92","172.20.0.3","172.20.0.2","TLSv1.2","Client Hello"
"18","0.063370774","66","aa:bf:7e:41:c0:92","a6:ec:86:63:9b:d9","172.20.0.2","172.20.0.3","TCP","4433 → 48080 [ACK] Seq=1 Ack=1704 Win=64128 Len=0 TSval=2863656599 TSecr=2169085669"
"19","0.070066210","2052","aa:bf:7e:41:c0:92","a6:ec:86:63:9b:d9","172.20.0.2","172.20.0.3","TLSv1.3","Server Hello, Change Cipher Spec, Application Data, Application Data, Application Data, Application Data"
"20","0.070111793","66","a6:ec:86:63:9b:d9","aa:bf:7e:41:c0:92","172.20.0.3","172.20.0.2","TCP","48080 → 4433 [ACK] Seq=1704 Ack=1987 Win=64128 Len=0 TSval=2169085675 TSecr=2863656605"
"21","0.075406568","146","a6:ec:86:63:9b:d9","aa:bf:7e:41:c0:92","172.20.0.3","172.20.0.2","TLSv1.3","Change Cipher Spec, Application Data"
"22","0.075465854","66","a6:ec:86:63:9b:d9","aa:bf:7e:41:c0:92","172.20.0.3","172.20.0.2","TCP","48080 → 4433 [RST, ACK] Seq=1784 Ack=1987 Win=64128 Len=0 TSval=2169085681 TSecr=2863656605"
"23","0.090403380","74","a6:ec:86:63:9b:d9","aa:bf:7e:41:c0:92","172.20.0.3","172.20.0.2","TCP","48090 → 4433 [SYN] Seq=0 Win=64240 Len=0 MSS=1460 SACK_PERM TSval=2169085696 TSecr=0 WS=128"
"24","0.090430528","74","aa:bf:7e:41:c0:92","a6:ec:86:63:9b:d9","172.20.0.2","172.20.0.3","TCP","4433 → 48090 [SYN, ACK] Seq=0 Ack=1 Win=65160 Len=0 MSS=1460 SACK_PERM TSval=2863656626 TSecr=2169085696 WS=128"
"25","0.090450237","66","a6:ec:86:63:9b:d9","aa:bf:7e:41:c0:92","172.20.0.3","172.20.0.2","TCP","48090 → 4433 [ACK] Seq=1 Ack=1 Win=64256 Len=0 TSval=2169085696 TSecr=2863656626"
"26","0.090492486","1769","a6:ec:86:63:9b:d9","aa:bf:7e:41:c0:92","172.20.0.3","172.20.0.2","TLSv1.2","Client Hello"
"27","0.095212388","321","a6:ec:86:63:9b:d9","aa:bf:7e:41:c0:92","172.20.0.3","172.20.0.2","TCP","[TCP Retransmission] 48090 → 4433 [PSH, ACK] Seq=1449 Ack=1 Win=64256 Len=255 TSval=2169085701 TSecr=2863656626"
"28","0.095217752","78","aa:bf:7e:41:c0:92","a6:ec:86:63:9b:d9","172.20.0.2","172.20.0.3","TCP","4433 → 48090 [ACK] Seq=1 Ack=1704 Win=64128 Len=0 TSval=2863656631 TSecr=2169085701 SLE=1449 SRE=1704"
"29","0.096632843","2053","aa:bf:7e:41:c0:92","a6:ec:86:63:9b:d9","172.20.0.2","172.20.0.3","TLSv1.3","Server Hello, Change Cipher Spec, Application Data, Application Data, Application Data, Application Data"
"30","0.096684192","66","a6:ec:86:63:9b:d9","aa:bf:7e:41:c0:92","172.20.0.3","172.20.0.2","TCP","48090 → 4433 [ACK] Seq=1704 Ack=1988 Win=64128 Len=0 TSval=2169085702 TSecr=2863656632"
"31","0.101965309","146","a6:ec:86:63:9b:d9","aa:bf:7e:41:c0:92","172.20.0.3","172.20.0.2","TLSv1.3","Change Cipher Spec, Application Data"
"32","0.102031829","66","a6:ec:86:63:9b:d9","aa:bf:7e:41:c0:92","172.20.0.3","172.20.0.2","TCP","48090 → 4433 [RST, ACK] Seq=1784 Ack=1988 Win=64128 Len=0 TSval=2169085707 TSecr=2863656632"
"33","0.117250638","74","a6:ec:86:63:9b:d9","aa:bf:7e:41:c0:92","172.20.0.3","172.20.0.2","TCP","48098 → 4433 [SYN] Seq=0 Win=64240 Len=0 MSS=1460 SACK_PERM TSval=2169085723 TSecr=0 WS=128"
"34","0.117282262","74","aa:bf:7e:41:c0:92","a6:ec:86:63:9b:d9","172.20.0.2","172.20.0.3","TCP","4433 → 48098 [SYN, ACK] Seq=0 Ack=1 Win=65160 Len=0 MSS=1460 SACK_PERM TSval=2863656653 TSecr=2169085723 WS=128"
"35","0.117302153","66","a6:ec:86:63:9b:d9","aa:bf:7e:41:c0:92","172.20.0.3","172.20.0.2","TCP","48098 → 4433 [ACK] Seq=1 Ack=1 Win=64256 Len=0 TSval=2169085723 TSecr=2863656653"
"36","0.117347770","1769","a6:ec:86:63:9b:d9","aa:bf:7e:41:c0:92","172.20.0.3","172.20.0.2","TLSv1.2","Client Hello"
"37","0.117354365","66","aa:bf:7e:41:c0:92","a6:ec:86:63:9b:d9","172.20.0.2","172.20.0.3","TCP","4433 → 48098 [ACK] Seq=1 Ack=1704 Win=64128 Len=0 TSval=2863656653 TSecr=2169085723"
"38","0.127223132","605","aa:bf:7e:41:c0:92","a6:ec:86:63:9b:d9","172.20.0.2","172.20.0.3","SSL","[TCP Previous segment not captured] , Continuation Data"
"39","0.127269344","78","a6:ec:86:63:9b:d9","aa:bf:7e:41:c0:92","172.20.0.3","172.20.0.2","TCP","[TCP Dup ACK 35#1] 48098 → 4433 [ACK] Seq=1704 Ack=1 Win=64256 Len=0 TSval=2169085733 TSecr=2863656653 SLE=1449 SRE=1988"
"40","0.127281476","1514","aa:bf:7e:41:c0:92","a6:ec:86:63:9b:d9","172.20.0.2","172.20.0.3","TCP","[TCP Retransmission] 4433 → 48098 [ACK] Seq=1 Ack=1704 Win=64128 Len=1448 TSval=2863656663 TSecr=2169085733"
"41","0.127297134","66","a6:ec:86:63:9b:d9","aa:bf:7e:41:c0:92","172.20.0.3","172.20.0.2","TCP","48098 → 4433 [ACK] Seq=1704 Ack=1988 Win=64128 Len=0 TSval=2169085733 TSecr=2863656663"
"42","0.132623865","146","a6:ec:86:63:9b:d9","aa:bf:7e:41:c0:92","172.20.0.3","172.20.0.2","TLSv1.2","Change Cipher Spec, Application Data"
"43","0.132687763","66","a6:ec:86:63:9b:d9","aa:bf:7e:41:c0:92","172.20.0.3","172.20.0.2","TCP","48098 → 4433 [RST, ACK] Seq=1784 Ack=1988 Win=64128 Len=0 TSval=2169085738 TSecr=2863656663"
"44","0.148462195","74","a6:ec:86:63:9b:d9","aa:bf:7e:41:c0:92","172.20.0.3","172.20.0.2","TCP","48110 → 4433 [SYN] Seq=0 Win=64240 Len=0 MSS=1460 SACK_PERM TSval=2169085754 TSecr=0 WS=128"
"45","1.000906131","42","a6:ec:86:63:9b:d9","ff:ff:ff:ff:ff:ff",,,"ARP","ARP Announcement for 172.20.0.3"
"46","1.207254303","74","aa:bf:7e:41:c0:92","a6:ec:86:63:9b:d9","172.20.0.2","172.20.0.3","TCP","4433 → 48110 [SYN, ACK] Seq=0 Ack=1 Win=65160 Len=0 MSS=1460 SACK_PERM TSval=2863657743 TSecr=2169085754 WS=128"
"47","1.207283106","74","a6:ec:86:63:9b:d9","aa:bf:7e:41:c0:92","172.20.0.3","172.20.0.2","TCP","[TCP Retransmission] 48110 → 4433 [SYN] Seq=0 Win=64240 Len=0 MSS=1460 SACK_PERM TSval=2169086813 TSecr=0 WS=128"
"48","1.207298952","74","aa:bf:7e:41:c0:92","a6:ec:86:63:9b:d9","172.20.0.2","172.20.0.3","TCP","[TCP Out-Of-Order] 4433 → 48110 [SYN, ACK] Seq=0 Ack=1 Win=65160 Len=0 MSS=1460 SACK_PERM TSval=2863657743 TSecr=2169085754 WS=128"
"49","1.207335332","66","a6:ec:86:63:9b:d9","aa:bf:7e:41:c0:92","172.20.0.3","172.20.0.2","TCP","48110 → 4433 [ACK] Seq=1 Ack=1 Win=64256 Len=0 TSval=2169086813 TSecr=2863657743"
"50","1.207374393","66","a6:ec:86:63:9b:d9","aa:bf:7e:41:c0:92","172.20.0.3","172.20.0.2","TCP","[TCP Dup ACK 49#1] 48110 → 4433 [ACK] Seq=1 Ack=1 Win=64256 Len=0 TSval=2169086813 TSecr=2863657743"
"51","1.207433672","1769","a6:ec:86:63:9b:d9","aa:bf:7e:41:c0:92","172.20.0.3","172.20.0.2","TLSv1.2","Client Hello"
"52","1.213657676","1514","aa:bf:7e:41:c0:92","a6:ec:86:63:9b:d9","172.20.0.2","172.20.0.3","TLSv1.3","Server Hello, Change Cipher Spec, Application Data"
"53","1.213701324","66","a6:ec:86:63:9b:d9","aa:bf:7e:41:c0:92","172.20.0.3","172.20.0.2","TCP","48110 → 4433 [ACK] Seq=1704 Ack=1449 Win=64128 Len=0 TSval=2169086819 TSecr=2863657749"
"54","1.415233985","606","aa:bf:7e:41:c0:92","a6:ec:86:63:9b:d9","172.20.0.2","172.20.0.3","TLSv1.3","Application Data, Application Data, Application Data"
"55","1.415307050","66","a6:ec:86:63:9b:d9","aa:bf:7e:41:c0:92","172.20.0.3","172.20.0.2","TCP","48110 → 4433 [ACK] Seq=1704 Ack=1989 Win=64128 Len=0 TSval=2169087021 TSecr=2863657951"
"56","1.417731493","146","a6:ec:86:63:9b:d9","aa:bf:7e:41:c0:92","172.20.0.3","172.20.0.2","TLSv1.3","Change Cipher Spec, Application Data"
"57","1.417806080","66","a6:ec:86:63:9b:d9","aa:bf:7e:41:c0:92","172.20.0.3","172.20.0.2","TCP","48110 → 4433 [RST, ACK] Seq=1784 Ack=1989 Win=64128 Len=0 TSval=2169087023 TSecr=2863657951"
"58","1.433555625","74","a6:ec:86:63:9b:d9","aa:bf:7e:41:c0:92","172.20.0.3","172.20.0.2","TCP","53980 → 4433 [SYN] Seq=0 Win=64240 Len=0 MSS=1460 SACK_PERM TSval=2169087039 TSecr=0 WS=128"
"59","1.433586922","74","aa:bf:7e:41:c0:92","a6:ec:86:63:9b:d9","172.20.0.2","172.20.0.3","TCP","4433 → 53980 [SYN, ACK] Seq=0 Ack=1 Win=65160 Len=0 MSS=1460 SACK_PERM TSval=2863657969 TSecr=2169087039 WS=128"
"60","1.433607048","66","a6:ec:86:63:9b:d9","aa:bf:7e:41:c0:92","172.20.0.3","172.20.0.2","TCP","53980 → 4433 [ACK] Seq=1 Ack=1 Win=64256 Len=0 TSval=2169087039 TSecr=2863657969"
"61","1.433657749","1769","a6:ec:86:63:9b:d9","aa:bf:7e:41:c0:92","172.20.0.3","172.20.0.2","TLSv1.2","Client Hello"
"62","1.433664781","66","aa:bf:7e:41:c0:92","a6:ec:86:63:9b:d9","172.20.0.2","172.20.0.3","TCP","4433 → 53980 [ACK] Seq=1 Ack=1704 Win=64128 Len=0 TSval=2863657969 TSecr=2169087039"
"63","1.439999691","2054","aa:bf:7e:41:c0:92","a6:ec:86:63:9b:d9","172.20.0.2","172.20.0.3","TLSv1.3","Server Hello, Change Cipher Spec, Application Data, Application Data, Application Data, Application Data"
"64","1.440037745","66","a6:ec:86:63:9b:d9","aa:bf:7e:41:c0:92","172.20.0.3","172.20.0.2","TCP","53980 → 4433 [ACK] Seq=1704 Ack=1989 Win=64128 Len=0 TSval=2169087045 TSecr=2863657975"
"65","1.445434227","146","a6:ec:86:63:9b:d9","aa:bf:7e:41:c0:92","172.20.0.3","172.20.0.2","TLSv1.3","Change Cipher Spec, Application Data"
"66","1.445504206","66","a6:ec:86:63:9b:d9","aa:bf:7e:41:c0:92","172.20.0.3","172.20.0.2","TCP","53980 → 4433 [RST, ACK] Seq=1784 Ack=1989 Win=64128 Len=0 TSval=2169087051 TSecr=2863657975"
"67","1.461929821","74","a6:ec:86:63:9b:d9","aa:bf:7e:41:c0:92","172.20.0.3","172.20.0.2","TCP","53986 → 4433 [SYN] Seq=0 Win=64240 Len=0 MSS=1460 SACK_PERM TSval=2169087067 TSecr=0 WS=128"
"68","1.461962750","74","aa:bf:7e:41:c0:92","a6:ec:86:63:9b:d9","172.20.0.2","172.20.0.3","TCP","4433 → 53986 [SYN, ACK] Seq=0 Ack=1 Win=65160 Len=0 MSS=1460 SACK_PERM TSval=2863657997 TSecr=2169087067 WS=128"
"69","1.461982441","66","a6:ec:86:63:9b:d9","aa:bf:7e:41:c0:92","172.20.0.3","172.20.0.2","TCP","53986 → 4433 [ACK] Seq=1 Ack=1 Win=64256 Len=0 TSval=2169087067 TSecr=2863657997"
"70","1.462044149","1769","a6:ec:86:63:9b:d9","aa:bf:7e:41:c0:92","172.20.0.3","172.20.0.2","TLSv1.2","Client Hello"
"71","1.462049310","66","aa:bf:7e:41:c0:92","a6:ec:86:63:9b:d9","172.20.0.2","172.20.0.3","TCP","4433 → 53986 [ACK] Seq=1 Ack=1704 Win=64128 Len=0 TSval=2863657997 TSecr=2169087067"
"72","1.468123690","2053","aa:bf:7e:41:c0:92","a6:ec:86:63:9b:d9","172.20.0.2","172.20.0.3","TLSv1.3","Server Hello, Change Cipher Spec, Application Data, Application Data, Application Data, Application Data"
"73","1.468172145","66","a6:ec:86:63:9b:d9","aa:bf:7e:41:c0:92","172.20.0.3","172.20.0.2","TCP","53986 → 4433 [ACK] Seq=1704 Ack=1988 Win=64128 Len=0 TSval=2169087073 TSecr=2863658003"
"74","1.473608354","146","a6:ec:86:63:9b:d9","aa:bf:7e:41:c0:92","172.20.0.3","172.20.0.2","TLSv1.3","Change Cipher Spec, Application Data"
"75","1.473679248","66","a6:ec:86:63:9b:d9","aa:bf:7e:41:c0:92","172.20.0.3","172.20.0.2","TCP","53986 → 4433 [RST, ACK] Seq=1784 Ack=1988 Win=64128 Len=0 TSval=2169087079 TSecr=2863658003"
"76","1.489048953","74","a6:ec:86:63:9b:d9","aa:bf:7e:41:c0:92","172.20.0.3","172.20.0.2","TCP","53998 → 4433 [SYN] Seq=0 Win=64240 Len=0 MSS=1460 SACK_PERM TSval=2169087094 TSecr=0 WS=128"
"77","2.001491316","42","a6:ec:86:63:9b:d9","ff:ff:ff:ff:ff:ff",,,"ARP","ARP Announcement for 172.20.0.3"
"78","2.551280904","74","a6:ec:86:63:9b:d9","aa:bf:7e:41:c0:92","172.20.0.3","172.20.0.2","TCP","[TCP Retransmission] 53998 → 4433 [SYN] Seq=0 Win=64240 Len=0 MSS=1460 SACK_PERM TSval=2169088157 TSecr=0 WS=128"
"79","2.551295970","74","aa:bf:7e:41:c0:92","a6:ec:86:63:9b:d9","172.20.0.2","172.20.0.3","TCP","4433 → 53998 [SYN, ACK] Seq=0 Ack=1 Win=65160 Len=0 MSS=1460 SACK_PERM TSval=2863659087 TSecr=2169087094 WS=128"
"80","2.551329426","66","a6:ec:86:63:9b:d9","aa:bf:7e:41:c0:92","172.20.0.3","172.20.0.2","TCP","53998 → 4433 [ACK] Seq=1 Ack=1 Win=64256 Len=0 TSval=2169088157 TSecr=2863659087"
"81","2.551409074","1769","a6:ec:86:63:9b:d9","aa:bf:7e:41:c0:92","172.20.0.3","172.20.0.2","TLSv1.2","Client Hello"
"82","2.551416825","66","aa:bf:7e:41:c0:92","a6:ec:86:63:9b:d9","172.20.0.2","172.20.0.3","TCP","4433 → 53998 [ACK] Seq=1 Ack=1704 Win=64128 Len=0 TSval=2863659087 TSecr=2169088157"
"83","2.759237376","605","aa:bf:7e:41:c0:92","a6:ec:86:63:9b:d9","172.20.0.2","172.20.0.3","SSL","[TCP Previous segment not captured] , Continuation Data"
"84","2.759325853","78","a6:ec:86:63:9b:d9","aa:bf:7e:41:c0:92","172.20.0.3","172.20.0.2","TCP","[TCP Dup ACK 80#1] 53998 → 4433 [ACK] Seq=1704 Ack=1 Win=64256 Len=0 TSval=2169088365 TSecr=2863659087 SLE=1449 SRE=1988"
"85","2.967241330","1514","aa:bf:7e:41:c0:92","a6:ec:86:63:9b:d9","172.20.0.2","172.20.0.3","TCP","[TCP Retransmission] 4433 → 53998 [ACK] Seq=1 Ack=1704 Win=64128 Len=1448 TSval=2863659503 TSecr=2169088365"
"86","2.967312982","66","a6:ec:86:63:9b:d9","aa:bf:7e:41:c0:92","172.20.0.3","172.20.0.2","TCP","53998 → 4433 [ACK] Seq=1704 Ack=1988 Win=64128 Len=0 TSval=2169088573 TSecr=2863659503"
"87","2.973007461","146","a6:ec:86:63:9b:d9","aa:bf:7e:41:c0:92","172.20.0.3","172.20.0.2","TLSv1.2","Change Cipher Spec, Application Data"
"88","2.973077813","66","a6:ec:86:63:9b:d9","aa:bf:7e:41:c0:92","172.20.0.3","172.20.0.2","TCP","53998 → 4433 [RST, ACK] Seq=1784 Ack=1988 Win=64128 Len=0 TSval=2169088578 TSecr=2863659503"
"89","2.988893420","74","a6:ec:86:63:9b:d9","aa:bf:7e:41:c0:92","172.20.0.3","172.20.0.2","TCP","54014 → 4433 [SYN] Seq=0 Win=64240 Len=0 MSS=1460 SACK_PERM TSval=2169088594 TSecr=0 WS=128"
"90","2.988922497","74","aa:bf:7e:41:c0:92","a6:ec:86:63:9b:d9","172.20.0.2","172.20.0.3","TCP","4433 → 54014 [SYN, ACK] Seq=0 Ack=1 Win=65160 Len=0 MSS=1460 SACK_PERM TSval=2863659524 TSecr=2169088594 WS=128"
"91","2.988942076","66","a6:ec:86:63:9b:d9","aa:bf:7e:41:c0:92","172.20.0.3","172.20.0.2","TCP","54014 → 4433 [ACK] Seq=1 Ack=1 Win=64256 Len=0 TSval=2169088594 TSecr=2863659524"
"92","2.988986623","1769","a6:ec:86:63:9b:d9","aa:bf:7e:41:c0:92","172.20.0.3","172.20.0.2","TLSv1.2","Client Hello"
"93","2.988993735","66","aa:bf:7e:41:c0:92","a6:ec:86:63:9b:d9","172.20.0.2","172.20.0.3","TCP","4433 → 54014 [ACK] Seq=1 Ack=1704 Win=64128 Len=0 TSval=2863659524 TSecr=2169088594"
"94","2.995559761","2053","aa:bf:7e:41:c0:92","a6:ec:86:63:9b:d9","172.20.0.2","172.20.0.3","TLSv1.3","Server Hello, Change Cipher Spec, Application Data, Application Data, Application Data, Application Data"
"95","2.995603841","66","a6:ec:86:63:9b:d9","aa:bf:7e:41:c0:92","172.20.0.3","172.20.0.2","TCP","54014 → 4433 [ACK] Seq=1704 Ack=1988 Win=64128 Len=0 TSval=2169088601 TSecr=2863659531"
"96","3.000994117","146","a6:ec:86:63:9b:d9","aa:bf:7e:41:c0:92","172.20.0.3","172.20.0.2","TLSv1.3","Change Cipher Spec, Application Data"
"97","3.001060387","66","a6:ec:86:63:9b:d9","aa:bf:7e:41:c0:92","172.20.0.3","172.20.0.2","TCP","54014 → 4433 [RST, ACK] Seq=1784 Ack=1988 Win=64128 Len=0 TSval=2169088606 TSecr=2863659531"
"98","3.017301123","74","a6:ec:86:63:9b:d9","aa:bf:7e:41:c0:92","172.20.0.3","172.20.0.2","TCP","54026 → 4433 [SYN] Seq=0 Win=64240 Len=0 MSS=1460 SACK_PERM TSval=2169088623 TSecr=0 WS=128"
"99","3.017330248","74","aa:bf:7e:41:c0:92","a6:ec:86:63:9b:d9","172.20.0.2","172.20.0.3","TCP","4433 → 54026 [SYN, ACK] Seq=0 Ack=1 Win=65160 Len=0 MSS=1460 SACK_PERM TSval=2863659553 TSecr=2169088623 WS=128"
"100","3.017350505","66","a6:ec:86:63:9b:d9","aa:bf:7e:41:c0:92","172.20.0.3","172.20.0.2","TCP","54026 → 4433 [ACK] Seq=1 Ack=1 Win=64256 Len=0 TSval=2169088623 TSecr=2863659553"
"101","3.017410789","1769","a6:ec:86:63:9b:d9","aa:bf:7e:41:c0:92","172.20.0.3","172.20.0.2","TLSv1.2","Client Hello"
"102","3.017415909","66","aa:bf:7e:41:c0:92","a6:ec:86:63:9b:d9","172.20.0.2","172.20.0.3","TCP","4433 → 54026 [ACK] Seq=1 Ack=1704 Win=64128 Len=0 TSval=2863659553 TSecr=2169088623"
"103","3.023621636","2052","aa:bf:7e:41:c0:92","a6:ec:86:63:9b:d9","172.20.0.2","172.20.0.3","TLSv1.3","Server Hello, Change Cipher Spec, Application Data, Application Data, Application Data, Application Data"
"104","3.023663416","66","a6:ec:86:63:9b:d9","aa:bf:7e:41:c0:92","172.20.0.3","172.20.0.2","TCP","54026 → 4433 [ACK] Seq=1704 Ack=1987 Win=64128 Len=0 TSval=2169088629 TSecr=2863659559"
"105","3.029059903","146","a6:ec:86:63:9b:d9","aa:bf:7e:41:c0:92","172.20.0.3","172.20.0.2","TLSv1.3","Change Cipher Spec, Application Data"
"106","3.029147180","66","a6:ec:86:63:9b:d9","aa:bf:7e:41:c0:92","172.20.0.3","172.20.0.2","TCP","54026 → 4433 [RST, ACK] Seq=1784 Ack=1987 Win=64128 Len=0 TSval=2169088634 TSecr=2863659559"
"107","3.044656889","74","a6:ec:86:63:9b:d9","aa:bf:7e:41:c0:92","172.20.0.3","172.20.0.2","TCP","54036 → 4433 [SYN] Seq=0 Win=64240 Len=0 MSS=1460 SACK_PERM TSval=2169088650 TSecr=0 WS=128"
"108","4.087307511","74","a6:ec:86:63:9b:d9","aa:bf:7e:41:c0:92","172.20.0.3","172.20.0.2","TCP","[TCP Retransmission] 54036 → 4433 [SYN] Seq=0 Win=64240 Len=0 MSS=1460 SACK_PERM TSval=2169089693 TSecr=0 WS=128"
"109","5.111275154","74","a6:ec:86:63:9b:d9","aa:bf:7e:41:c0:92","172.20.0.3","172.20.0.2","TCP","[TCP Retransmission] 54036 → 4433 [SYN] Seq=0 Win=64240 Len=0 MSS=1460 SACK_PERM TSval=2169090717 TSecr=0 WS=128"
"110","5.111311147","74","aa:bf:7e:41:c0:92","a6:ec:86:63:9b:d9","172.20.0.2","172.20.0.3","TCP","4433 → 54036 [SYN, ACK] Seq=0 Ack=1 Win=65160 Len=0 MSS=1460 SACK_PERM TSval=2863661647 TSecr=2169088650 WS=128"
"111","5.111356892","66","a6:ec:86:63:9b:d9","aa:bf:7e:41:c0:92","172.20.0.3","172.20.0.2","TCP","54036 → 4433 [ACK] Seq=1 Ack=1 Win=64256 Len=0 TSval=2169090717 TSecr=2863661647"
"112","5.111463761","1769","a6:ec:86:63:9b:d9","aa:bf:7e:41:c0:92","172.20.0.3","172.20.0.2","TLSv1.2","Client Hello"
"113","5.111471499","66","aa:bf:7e:41:c0:92","a6:ec:86:63:9b:d9","172.20.0.2","172.20.0.3","TCP","4433 → 54036 [ACK] Seq=1 Ack=1704 Win=64128 Len=0 TSval=2863661647 TSecr=2169090717"
"114","5.117565899","1514","aa:bf:7e:41:c0:92","a6:ec:86:63:9b:d9","172.20.0.2","172.20.0.3","TLSv1.3","Server Hello, Change Cipher Spec, Application Data"
"115","5.117606009","66","a6:ec:86:63:9b:d9","aa:bf:7e:41:c0:92","172.20.0.3","172.20.0.2","TCP","54036 → 4433 [ACK] Seq=1704 Ack=1449 Win=64128 Len=0 TSval=2169090723 TSecr=2863661653"
"116","5.527242373","605","aa:bf:7e:41:c0:92","a6:ec:86:63:9b:d9","172.20.0.2","172.20.0.3","TLSv1.3","Application Data, Application Data, Application Data"
"117","5.527334670","66","a6:ec:86:63:9b:d9","aa:bf:7e:41:c0:92","172.20.0.3","172.20.0.2","TCP","54036 → 4433 [ACK] Seq=1704 Ack=1988 Win=64128 Len=0 TSval=2169091133 TSecr=2863662063"
"118","5.529854908","146","a6:ec:86:63:9b:d9","aa:bf:7e:41:c0:92","172.20.0.3","172.20.0.2","TLSv1.3","Change Cipher Spec, Application Data"
"119","5.529923258","66","a6:ec:86:63:9b:d9","aa:bf:7e:41:c0:92","172.20.0.3","172.20.0.2","TCP","54036 → 4433 [RST, ACK] Seq=1784 Ack=1988 Win=64128 Len=0 TSval=2169091135 TSecr=2863662063"
"120","5.546224983","74","a6:ec:86:63:9b:d9","aa:bf:7e:41:c0:92","172.20.0.3","172.20.0.2","TCP","54050 → 4433 [SYN] Seq=0 Win=64240 Len=0 MSS=1460 SACK_PERM TSval=2169091151 TSecr=0 WS=128"
"121","6.583254795","74","aa:bf:7e:41:c0:92","a6:ec:86:63:9b:d9","172.20.0.2","172.20.0.3","TCP","4433 → 54050 [SYN, ACK] Seq=0 Ack=1 Win=65160 Len=0 MSS=1460 SACK_PERM TSval=2863663119 TSecr=2169091151 WS=128"
"122","6.583282942","74","a6:ec:86:63:9b:d9","aa:bf:7e:41:c0:92","172.20.0.3","172.20.0.2","TCP","[TCP Retransmission] 54050 → 4433 [SYN] Seq=0 Win=64240 Len=0 MSS=1460 SACK_PERM TSval=2169092189 TSecr=0 WS=128"
"123","6.583300476","74","aa:bf:7e:41:c0:92","a6:ec:86:63:9b:d9","172.20.0.2","172.20.0.3","TCP","[TCP Retransmission] 4433 → 54050 [SYN, ACK] Seq=0 Ack=1 Win=65160 Len=0 MSS=1460 SACK_PERM TSval=2863663119 TSecr=2169091151 WS=128"
"124","6.583332684","66","a6:ec:86:63:9b:d9","aa:bf:7e:41:c0:92","172.20.0.3","172.20.0.2","TCP","54050 → 4433 [ACK] Seq=1 Ack=1 Win=64256 Len=0 TSval=2169092189 TSecr=2863663119"
"125","6.583363518","66","a6:ec:86:63:9b:d9","aa:bf:7e:41:c0:92","172.20.0.3","172.20.0.2","TCP","[TCP Dup ACK 124#1] 54050 → 4433 [ACK] Seq=1 Ack=1 Win=64256 Len=0 TSval=2169092189 TSecr=2863663119"
"126","6.583417823","1769","a6:ec:86:63:9b:d9","aa:bf:7e:41:c0:92","172.20.0.3","172.20.0.2","TLSv1.2","Client Hello"
"127","6.583425394","66","aa:bf:7e:41:c0:92","a6:ec:86:63:9b:d9","172.20.0.2","172.20.0.3","TCP","4433 → 54050 [ACK] Seq=1 Ack=1704 Win=64128 Len=0 TSval=2863663119 TSecr=2169092189"
"128","6.589435777","1514","aa:bf:7e:41:c0:92","a6:ec:86:63:9b:d9","172.20.0.2","172.20.0.3","TLSv1.3","Server Hello, Change Cipher Spec, Application Data"
"129","6.589466999","66","a6:ec:86:63:9b:d9","aa:bf:7e:41:c0:92","172.20.0.3","172.20.0.2","TCP","54050 → 4433 [ACK] Seq=1704 Ack=1449 Win=64128 Len=0 TSval=2169092195 TSecr=2863663125"
"130","6.589475484","604","aa:bf:7e:41:c0:92","a6:ec:86:63:9b:d9","172.20.0.2","172.20.0.3","TLSv1.3","Application Data, Application Data, Application Data"
"131","6.589480499","66","a6:ec:86:63:9b:d9","aa:bf:7e:41:c0:92","172.20.0.3","172.20.0.2","TCP","54050 → 4433 [ACK] Seq=1704 Ack=1987 Win=64128 Len=0 TSval=2169092195 TSecr=2863663125"
"132","6.594927925","146","a6:ec:86:63:9b:d9","aa:bf:7e:41:c0:92","172.20.0.3","172.20.0.2","TLSv1.3","Change Cipher Spec, Application Data"
"133","6.594989586","66","a6:ec:86:63:9b:d9","aa:bf:7e:41:c0:92","172.20.0.3","172.20.0.2","TCP","54050 → 4433 [RST, ACK] Seq=1784 Ack=1987 Win=64128 Len=0 TSval=2169092200 TSecr=2863663125"
"134","6.611110900","74","a6:ec:86:63:9b:d9","aa:bf:7e:41:c0:92","172.20.0.3","172.20.0.2","TCP","54066 → 4433 [SYN] Seq=0 Win=64240 Len=0 MSS=1460 SACK_PERM TSval=2169092216 TSecr=0 WS=128"
"135","6.611140850","74","aa:bf:7e:41:c0:92","a6:ec:86:63:9b:d9","172.20.0.2","172.20.0.3","TCP","4433 → 54066 [SYN, ACK] Seq=0 Ack=1 Win=65160 Len=0 MSS=1460 SACK_PERM TSval=2863663146 TSecr=2169092216 WS=128"
"136","6.611161331","66","a6:ec:86:63:9b:d9","aa:bf:7e:41:c0:92","172.20.0.3","172.20.0.2","TCP","54066 → 4433 [ACK] Seq=1 Ack=1 Win=64256 Len=0 TSval=2169092216 TSecr=2863663146"
"137","6.611235143","1769","a6:ec:86:63:9b:d9","aa:bf:7e:41:c0:92","172.20.0.3","172.20.0.2","TLSv1.2","Client Hello"
"138","6.611242130","66","aa:bf:7e:41:c0:92","a6:ec:86:63:9b:d9","172.20.0.2","172.20.0.3","TCP","4433 → 54066 [ACK] Seq=1 Ack=1704 Win=64128 Len=0 TSval=2863663147 TSecr=2169092217"
"139","6.617339237","2054","aa:bf:7e:41:c0:92","a6:ec:86:63:9b:d9","172.20.0.2","172.20.0.3","TLSv1.3","Server Hello, Change Cipher Spec, Application Data, Application Data, Application Data, Application Data"
"140","6.617380625","66","a6:ec:86:63:9b:d9","aa:bf:7e:41:c0:92","172.20.0.3","172.20.0.2","TCP","54066 → 4433 [ACK] Seq=1704 Ack=1989 Win=64128 Len=0 TSval=2169092223 TSecr=2863663153"
"141","6.623042035","146","a6:ec:86:63:9b:d9","aa:bf:7e:41:c0:92","172.20.0.3","172.20.0.2","TLSv1.3","Change Cipher Spec, Application Data"
"142","6.623127248","66","a6:ec:86:63:9b:d9","aa:bf:7e:41:c0:92","172.20.0.3","172.20.0.2","TCP","54066 → 4433 [RST, ACK] Seq=1784 Ack=1989 Win=64128 Len=0 TSval=2169092228 TSecr=2863663153"
"143","6.638655897","74","a6:ec:86:63:9b:d9","aa:bf:7e:41:c0:92","172.20.0.3","172.20.0.2","TCP","54072 → 4433 [SYN] Seq=0 Win=64240 Len=0 MSS=1460 SACK_PERM TSval=2169092244 TSecr=0 WS=128"
"144","6.638688256","74","aa:bf:7e:41:c0:92","a6:ec:86:63:9b:d9","172.20.0.2","172.20.0.3","TCP","4433 → 54072 [SYN, ACK] Seq=0 Ack=1 Win=65160 Len=0 MSS=1460 SACK_PERM TSval=2863663174 TSecr=2169092244 WS=128"
"145","6.638710042","66","a6:ec:86:63:9b:d9","aa:bf:7e:41:c0:92","172.20.0.3","172.20.0.2","TCP","54072 → 4433 [ACK] Seq=1 Ack=1 Win=64256 Len=0 TSval=2169092244 TSecr=2863663174"
"146","6.638764304","1769","a6:ec:86:63:9b:d9","aa:bf:7e:41:c0:92","172.20.0.3","172.20.0.2","TLSv1.2","Client Hello"
"147","6.642212260","321","a6:ec:86:63:9b:d9","aa:bf:7e:41:c0:92","172.20.0.3","172.20.0.2","TCP","[TCP Retransmission] 54072 → 4433 [PSH, ACK] Seq=1449 Ack=1 Win=64256 Len=255 TSval=2169092248 TSecr=2863663174"
"148","6.642219426","78","aa:bf:7e:41:c0:92","a6:ec:86:63:9b:d9","172.20.0.2","172.20.0.3","TCP","4433 → 54072 [ACK] Seq=1 Ack=1704 Win=64128 Len=0 TSval=2863663178 TSecr=2169092248 SLE=1449 SRE=1704"
"149","6.644833027","2053","aa:bf:7e:41:c0:92","a6:ec:86:63:9b:d9","172.20.0.2","172.20.0.3","TLSv1.3","Server Hello, Change Cipher Spec, Application Data, Application Data, Application Data, Application Data"
"150","6.644863464","66","a6:ec:86:63:9b:d9","aa:bf:7e:41:c0:92","172.20.0.3","172.20.0.2","TCP","54072 → 4433 [ACK] Seq=1704 Ack=1988 Win=64128 Len=0 TSval=2169092250 TSecr=2863663180"
"151","6.649987456","146","a6:ec:86:63:9b:d9","aa:bf:7e:41:c0:92","172.20.0.3","172.20.0.2","TLSv1.3","Change Cipher Spec, Application Data"
"152","6.650044728","66","a6:ec:86:63:9b:d9","aa:bf:7e:41:c0:92","172.20.0.3","172.20.0.2","TCP","54072 → 4433 [RST, ACK] Seq=1784 Ack=1988 Win=64128 Len=0 TSval=2169092255 TSecr=2863663180"
"153","6.664565193","74","a6:ec:86:63:9b:d9","aa:bf:7e:41:c0:92","172.20.0.3","172.20.0.2","TCP","54080 → 4433 [SYN] Seq=0 Win=64240 Len=0 MSS=1460 SACK_PERM TSval=2169092270 TSecr=0 WS=128"
"154","6.664589595","74","aa:bf:7e:41:c0:92","a6:ec:86:63:9b:d9","172.20.0.2","172.20.0.3","TCP","4433 → 54080 [SYN, ACK] Seq=0 Ack=1 Win=65160 Len=0 MSS=1460 SACK_PERM TSval=2863663200 TSecr=2169092270 WS=128"
"155","6.664605658","66","a6:ec:86:63:9b:d9","aa:bf:7e:41:c0:92","172.20.0.3","172.20.0.2","TCP","54080 → 4433 [ACK] Seq=1 Ack=1 Win=64256 Len=0 TSval=2169092270 TSecr=2863663200"
"156","6.664644122","1769","a6:ec:86:63:9b:d9","aa:bf:7e:41:c0:92","172.20.0.3","172.20.0.2","TLSv1.2","Client Hello"
"157","6.664659741","66","aa:bf:7e:41:c0:92","a6:ec:86:63:9b:d9","172.20.0.2","172.20.0.3","TCP","4433 → 54080 [ACK] Seq=1 Ack=1704 Win=64128 Len=0 TSval=2863663200 TSecr=2169092270"
"158","6.879234552","1514","aa:bf:7e:41:c0:92","a6:ec:86:63:9b:d9","172.20.0.2","172.20.0.3","TLSv1.3","Server Hello, Change Cipher Spec, Application Data"
"159","6.879302390","66","a6:ec:86:63:9b:d9","aa:bf:7e:41:c0:92","172.20.0.3","172.20.0.2","TCP","54080 → 4433 [ACK] Seq=1704 Ack=1449 Win=64128 Len=0 TSval=2169092485 TSecr=2863663415"
"160","6.879315263","605","aa:bf:7e:41:c0:92","a6:ec:86:63:9b:d9","172.20.0.2","172.20.0.3","TLSv1.3","Application Data, Application Data, Application Data"
"161","6.879322311","66","a6:ec:86:63:9b:d9","aa:bf:7e:41:c0:92","172.20.0.3","172.20.0.2","TCP","54080 → 4433 [ACK] Seq=1704 Ack=1988 Win=64128 Len=0 TSval=2169092485 TSecr=2863663415"
"162","6.884911070","146","a6:ec:86:63:9b:d9","aa:bf:7e:41:c0:92","172.20.0.3","172.20.0.2","TLSv1.3","Change Cipher Spec, Application Data"
"163","6.884982361","66","a6:ec:86:63:9b:d9","aa:bf:7e:41:c0:92","172.20.0.3","172.20.0.2","TCP","54080 → 4433 [RST, ACK] Seq=1784 Ack=1988 Win=64128 Len=0 TSval=2169092490 TSecr=2863663415"
"164","6.899756633","74","a6:ec:86:63:9b:d9","aa:bf:7e:41:c0:92","172.20.0.3","172.20.0.2","TCP","54092 → 4433 [SYN] Seq=0 Win=64240 Len=0 MSS=1460 SACK_PERM TSval=2169092505 TSecr=0 WS=128"
"165","7.928272654","74","aa:bf:7e:41:c0:92","a6:ec:86:63:9b:d9","172.20.0.2","172.20.0.3","TCP","4433 → 54092 [SYN, ACK] Seq=0 Ack=1 Win=65160 Len=0 MSS=1460 SACK_PERM TSval=2863664464 TSecr=2169092505 WS=128"
"166","7.928295312","74","a6:ec:86:63:9b:d9","aa:bf:7e:41:c0:92","172.20.0.3","172.20.0.2","TCP","[TCP Retransmission] 54092 → 4433 [SYN] Seq=0 Win=64240 Len=0 MSS=1460 SACK_PERM TSval=2169093534 TSecr=0 WS=128"
"167","7.928319429","74","aa:bf:7e:41:c0:92","a6:ec:86:63:9b:d9","172.20.0.2","172.20.0.3","TCP","[TCP Out-Of-Order] 4433 → 54092 [SYN, ACK] Seq=0 Ack=1 Win=65160 Len=0 MSS=1460 SACK_PERM TSval=2863664464 TSecr=2169092505 WS=128"
"168","7.928363120","66","a6:ec:86:63:9b:d9","aa:bf:7e:41:c0:92","172.20.0.3","172.20.0.2","TCP","54092 → 4433 [ACK] Seq=1 Ack=1 Win=64256 Len=0 TSval=2169093534 TSecr=2863664464"
"169","7.928391262","66","a6:ec:86:63:9b:d9","aa:bf:7e:41:c0:92","172.20.0.3","172.20.0.2","TCP","[TCP Dup ACK 168#1] 54092 → 4433 [ACK] Seq=1 Ack=1 Win=64256 Len=0 TSval=2169093534 TSecr=2863664464"
"170","7.928424411","1769","a6:ec:86:63:9b:d9","aa:bf:7e:41:c0:92","172.20.0.3","172.20.0.2","TLSv1.2","Client Hello"
"171","7.928442951","66","aa:bf:7e:41:c0:92","a6:ec:86:63:9b:d9","172.20.0.2","172.20.0.3","TCP","4433 → 54092 [ACK] Seq=1 Ack=1704 Win=64128 Len=0 TSval=2863664464 TSecr=2169093534"
"172","7.934406344","1514","aa:bf:7e:41:c0:92","a6:ec:86:63:9b:d9","172.20.0.2","172.20.0.3","TLSv1.3","Server Hello, Change Cipher Spec, Application Data"
"173","7.934442778","66","a6:ec:86:63:9b:d9","aa:bf:7e:41:c0:92","172.20.0.3","172.20.0.2","TCP","54092 → 4433 [ACK] Seq=1704 Ack=1449 Win=64128 Len=0 TSval=2169093540 TSecr=2863664470"
"174","7.934451303","605","aa:bf:7e:41:c0:92","a6:ec:86:63:9b:d9","172.20.0.2","172.20.0.3","TLSv1.3","Application Data, Application Data, Application Data"
"175","7.934456163","66","a6:ec:86:63:9b:d9","aa:bf:7e:41:c0:92","172.20.0.3","172.20.0.2","TCP","54092 → 4433 [ACK] Seq=1704 Ack=1988 Win=64128 Len=0 TSval=2169093540 TSecr=2863664470"
"176","7.939954044","146","a6:ec:86:63:9b:d9","aa:bf:7e:41:c0:92","172.20.0.3","172.20.0.2","TLSv1.3","Change Cipher Spec, Application Data"
"177","7.940033477","66","a6:ec:86:63:9b:d9","aa:bf:7e:41:c0:92","172.20.0.3","172.20.0.2","TCP","54092 → 4433 [RST, ACK] Seq=1784 Ack=1988 Win=64128 Len=0 TSval=2169093545 TSecr=2863664470"
"178","7.955554361","74","a6:ec:86:63:9b:d9","aa:bf:7e:41:c0:92","172.20.0.3","172.20.0.2","TCP","54104 → 4433 [SYN] Seq=0 Win=64240 Len=0 MSS=1460 SACK_PERM TSval=2169093561 TSecr=0 WS=128"
"179","7.955583315","74","aa:bf:7e:41:c0:92","a6:ec:86:63:9b:d9","172.20.0.2","172.20.0.3","TCP","4433 → 54104 [SYN, ACK] Seq=0 Ack=1 Win=65160 Len=0 MSS=1460 SACK_PERM TSval=2863664491 TSecr=2169093561 WS=128"
"180","7.955603753","66","a6:ec:86:63:9b:d9","aa:bf:7e:41:c0:92","172.20.0.3","172.20.0.2","TCP","54104 → 4433 [ACK] Seq=1 Ack=1 Win=64256 Len=0 TSval=2169093561 TSecr=2863664491"
"181","7.955646516","1769","a6:ec:86:63:9b:d9","aa:bf:7e:41:c0:92","172.20.0.3","172.20.0.2","TLSv1.2","Client Hello"
"182","7.955652307","66","aa:bf:7e:41:c0:92","a6:ec:86:63:9b:d9","172.20.0.2","172.20.0.3","TCP","4433 → 54104 [ACK] Seq=1 Ack=1704 Win=64128 Len=0 TSval=2863664491 TSecr=2169093561"
"183","7.961773396","2053","aa:bf:7e:41:c0:92","a6:ec:86:63:9b:d9","172.20.0.2","172.20.0.3","TLSv1.3","Server Hello, Change Cipher Spec, Application Data, Application Data, Application Data, Application Data"
"184","7.961814785","66","a6:ec:86:63:9b:d9","aa:bf:7e:41:c0:92","172.20.0.3","172.20.0.2","TCP","54104 → 4433 [ACK] Seq=1704 Ack=1988 Win=64128 Len=0 TSval=2169093567 TSecr=2863664497"
"185","7.967054350","146","a6:ec:86:63:9b:d9","aa:bf:7e:41:c0:92","172.20.0.3","172.20.0.2","TLSv1.3","Change Cipher Spec, Application Data"
"186","7.967121632","66","a6:ec:86:63:9b:d9","aa:bf:7e:41:c0:92","172.20.0.3","172.20.0.2","TCP","54104 → 4433 [RST, ACK] Seq=1784 Ack=1988 Win=64128 Len=0 TSval=2169093572 TSecr=2863664497"
"187","7.982267537","74","a6:ec:86:63:9b:d9","aa:bf:7e:41:c0:92","172.20.0.3","172.20.0.2","TCP","54116 → 4433 [SYN] Seq=0 Win=64240 Len=0 MSS=1460 SACK_PERM TSval=2169093588 TSecr=0 WS=128"
"188","7.982298951","74","aa:bf:7e:41:c0:92","a6:ec:86:63:9b:d9","172.20.0.2","172.20.0.3","TCP","4433 → 54116 [SYN, ACK] Seq=0 Ack=1 Win=65160 Len=0 MSS=1460 SACK_PERM TSval=2863664518 TSecr=2169093588 WS=128"
"189","7.982319252","66","a6:ec:86:63:9b:d9","aa:bf:7e:41:c0:92","172.20.0.3","172.20.0.2","TCP","54116 → 4433 [ACK] Seq=1 Ack=1 Win=64256 Len=0 TSval=2169093588 TSecr=2863664518"
"190","7.982360666","1769","a6:ec:86:63:9b:d9","aa:bf:7e:41:c0:92","172.20.0.3","172.20.0.2","TLSv1.2","Client Hello"
"191","7.986216495","321","a6:ec:86:63:9b:d9","aa:bf:7e:41:c0:92","172.20.0.3","172.20.0.2","TCP","[TCP Retransmission] 54116 → 4433 [PSH, ACK] Seq=1449 Ack=1 Win=64256 Len=255 TSval=2169093592 TSecr=2863664518"
"192","7.992214031","605","aa:bf:7e:41:c0:92","a6:ec:86:63:9b:d9","172.20.0.2","172.20.0.3","SSL","[TCP Previous segment not captured] , Continuation Data"
"193","7.992247546","78","a6:ec:86:63:9b:d9","aa:bf:7e:41:c0:92","172.20.0.3","172.20.0.2","TCP","[TCP Dup ACK 189#1] 54116 → 4433 [ACK] Seq=1704 Ack=1 Win=64256 Len=0 TSval=2169093598 TSecr=2863664518 SLE=1449 SRE=1988"
"194","7.992255793","1514","aa:bf:7e:41:c0:92","a6:ec:86:63:9b:d9","172.20.0.2","172.20.0.3","TCP","[TCP Out-Of-Order] 4433 → 54116 [ACK] Seq=1 Ack=1704 Win=64128 Len=1448 TSval=2863664528 TSecr=2169093598"
"195","7.992266490","66","a6:ec:86:63:9b:d9","aa:bf:7e:41:c0:92","172.20.0.3","172.20.0.2","TCP","54116 → 4433 [ACK] Seq=1704 Ack=1988 Win=64128 Len=0 TSval=2169093598 TSecr=2863664528"
"196","7.997462632","146","a6:ec:86:63:9b:d9","aa:bf:7e:41:c0:92","172.20.0.3","172.20.0.2","TLSv1.2","Change Cipher Spec, Application Data"
"197","7.997523973","66","a6:ec:86:63:9b:d9","aa:bf:7e:41:c0:92","172.20.0.3","172.20.0.2","TCP","54116 → 4433 [RST, ACK] Seq=1784 Ack=1988 Win=64128 Len=0 TSval=2169093603 TSecr=2863664528"
"198","8.012748418","74","a6:ec:86:63:9b:d9","aa:bf:7e:41:c0:92","172.20.0.3","172.20.0.2","TCP","54128 → 4433 [SYN] Seq=0 Win=64240 Len=0 MSS=1460 SACK_PERM TSval=2169093618 TSecr=0 WS=128"
"199","9.015273935","74","a6:ec:86:63:9b:d9","aa:bf:7e:41:c0:92","172.20.0.3","172.20.0.2","TCP","[TCP Retransmission] 54128 → 4433 [SYN] Seq=0 Win=64240 Len=0 MSS=1460 SACK_PERM TSval=2169094621 TSecr=0 WS=128"
"200","10.039245761","74","a6:ec:86:63:9b:d9","aa:bf:7e:41:c0:92","172.20.0.3","172.20.0.2","TCP","[TCP Retransmission] 54128 → 4433 [SYN] Seq=0 Win=64240 Len=0 MSS=1460 SACK_PERM TSval=2169095645 TSecr=0 WS=128"
"201","10.039278900","74","aa:bf:7e:41:c0:92","a6:ec:86:63:9b:d9","172.20.0.2","172.20.0.3","TCP","4433 → 54128 [SYN, ACK] Seq=0 Ack=1 Win=65160 Len=0 MSS=1460 SACK_PERM TSval=2863666575 TSecr=2169093618 WS=128"
"202","10.039314677","66","a6:ec:86:63:9b:d9","aa:bf:7e:41:c0:92","172.20.0.3","172.20.0.2","TCP","54128 → 4433 [ACK] Seq=1 Ack=1 Win=64256 Len=0 TSval=2169095645 TSecr=2863666575"
"203","10.039390922","1769","a6:ec:86:63:9b:d9","aa:bf:7e:41:c0:92","172.20.0.3","172.20.0.2","TLSv1.2","Client Hello"
"204","10.039399005","66","aa:bf:7e:41:c0:92","a6:ec:86:63:9b:d9","172.20.0.2","172.20.0.3","TCP","4433 → 54128 [ACK] Seq=1 Ack=1704 Win=64128 Len=0 TSval=2863666575 TSecr=2169095645"
"205","10.045518778","1514","aa:bf:7e:41:c0:92","a6:ec:86:63:9b:d9","172.20.0.2","172.20.0.3","TLSv1.3","Server Hello, Change Cipher Spec, Application Data"
"206","10.045551975","66","a6:ec:86:63:9b:d9","aa:bf:7e:41:c0:92","172.20.0.3","172.20.0.2","TCP","54128 → 4433 [ACK] Seq=1704 Ack=1449 Win=64128 Len=0 TSval=2169095651 TSecr=2863666581"
"207","10.045560499","606","aa:bf:7e:41:c0:92","a6:ec:86:63:9b:d9","172.20.0.2","172.20.0.3","TLSv1.3","Application Data, Application Data, Application Data"
"208","10.045564972","66","a6:ec:86:63:9b:d9","aa:bf:7e:41:c0:92","172.20.0.3","172.20.0.2","TCP","54128 → 4433 [ACK] Seq=1704 Ack=1989 Win=64128 Len=0 TSval=2169095651 TSecr=2863666581"
"209","10.051032633","146","a6:ec:86:63:9b:d9","aa:bf:7e:41:c0:92","172.20.0.3","172.20.0.2","TLSv1.3","Change Cipher Spec, Application Data"
"210","10.051092813","66","a6:ec:86:63:9b:d9","aa:bf:7e:41:c0:92","172.20.0.3","172.20.0.2","TCP","54128 → 4433 [RST, ACK] Seq=1784 Ack=1989 Win=64128 Len=0 TSval=2169095656 TSecr=2863666581"
"211","10.068229859","74","a6:ec:86:63:9b:d9","aa:bf:7e:41:c0:92","172.20.0.3","172.20.0.2","TCP","54142 → 4433 [SYN] Seq=0 Win=64240 Len=0 MSS=1460 SACK_PERM TSval=2169095673 TSecr=0 WS=128"
"212","10.068260220","74","aa:bf:7e:41:c0:92","a6:ec:86:63:9b:d9","172.20.0.2","172.20.0.3","TCP","4433 → 54142 [SYN, ACK] Seq=0 Ack=1 Win=65160 Len=0 MSS=1460 SACK_PERM TSval=2863666604 TSecr=2169095673 WS=128"
"213","10.068280817","66","a6:ec:86:63:9b:d9","aa:bf:7e:41:c0:92","172.20.0.3","172.20.0.2","TCP","54142 → 4433 [ACK] Seq=1 Ack=1 Win=64256 Len=0 TSval=2169095674 TSecr=2863666604"
"214","10.068334291","1769","a6:ec:86:63:9b:d9","aa:bf:7e:41:c0:92","172.20.0.3","172.20.0.2","TLSv1.2","Client Hello"
"215","10.068340310","66","aa:bf:7e:41:c0:92","a6:ec:86:63:9b:d9","172.20.0.2","172.20.0.3","TCP","4433 → 54142 [ACK] Seq=1 Ack=1704 Win=64128 Len=0 TSval=2863666604 TSecr=2169095674"
"216","10.082241139","605","aa:bf:7e:41:c0:92","a6:ec:86:63:9b:d9","172.20.0.2","172.20.0.3","SSL","[TCP Previous segment not captured] , Continuation Data"
"217","10.082307522","78","a6:ec:86:63:9b:d9","aa:bf:7e:41:c0:92","172.20.0.3","172.20.0.2","TCP","[TCP Dup ACK 213#1] 54142 → 4433 [ACK] Seq=1704 Ack=1 Win=64256 Len=0 TSval=2169095688 TSecr=2863666604 SLE=1449 SRE=1988"
"218","10.082322676","1514","aa:bf:7e:41:c0:92","a6:ec:86:63:9b:d9","172.20.0.2","172.20.0.3","TCP","[TCP Retransmission] 4433 → 54142 [ACK] Seq=1 Ack=1704 Win=64128 Len=1448 TSval=2863666618 TSecr=2169095688"
"219","10.082343940","66","a6:ec:86:63:9b:d9","aa:bf:7e:41:c0:92","172.20.0.3","172.20.0.2","TCP","54142 → 4433 [ACK] Seq=1704 Ack=1988 Win=64128 Len=0 TSval=2169095688 TSecr=2863666618"
"220","10.088364682","146","a6:ec:86:63:9b:d9","aa:bf:7e:41:c0:92","172.20.0.3","172.20.0.2","TLSv1.2","Change Cipher Spec, Application Data"
"221","10.088459084","66","a6:ec:86:63:9b:d9","aa:bf:7e:41:c0:92","172.20.0.3","172.20.0.2","TCP","54142 → 4433 [RST, ACK] Seq=1784 Ack=1988 Win=64128 Len=0 TSval=2169095694 TSecr=2863666618"
"222","10.104162622","74","a6:ec:86:63:9b:d9","aa:bf:7e:41:c0:92","172.20.0.3","172.20.0.2","TCP","54156 → 4433 [SYN] Seq=0 Win=64240 Len=0 MSS=1460 SACK_PERM TSval=2169095709 TSecr=0 WS=128"
"223","10.104215262","74","aa:bf:7e:41:c0:92","a6:ec:86:63:9b:d9","172.20.0.2","172.20.0.3","TCP","4433 → 54156 [SYN, ACK] Seq=0 Ack=1 Win=65160 Len=0 MSS=1460 SACK_PERM TSval=2863666639 TSecr=2169095709 WS=128"
