frame.number,frame.time_relative,frame.len,eth.src,eth.dst,ip.src,ip.dst,_ws.col.protocol,_ws.col.info
"1","0.000000000","70","c2:05:a2:cc:9d:cc","33:33:00:00:00:02",,,"ICMPv6","Router Solicitation from c2:05:a2:cc:9d:cc"
"2","7.621026849","239","c2:05:a2:cc:9d:cc","33:33:00:00:00:fb",,,"MDNS","Standard query 0x0000 PTR _ipps._tcp.local, ""QM"" question PTR _ftp._tcp.local, ""QM"" question PTR _webdav._tcp.local, ""QM"" question PTR _webdavs._tcp.local, ""QM"" question PTR _sftp-ssh._tcp.local, ""QM"" question PTR _smb._tcp.local, ""QM"" question PTR _afpovertcp._tcp.local, ""QM"" question PTR _nfs._tcp.local, ""QM"" question PTR _ipp._tcp.local, ""QM"" question PTR MONTE-VIRTUAL-MACHINE._smb._tcp.local"
"3","13.867337378","42","ae:ce:e5:68:ac:e7","ff:ff:ff:ff:ff:ff",,,"ARP","ARP Announcement for 172.20.0.3"
"4","13.897511422","42","ae:ce:e5:68:ac:e7","ff:ff:ff:ff:ff:ff",,,"ARP","Who has 172.20.0.2? Tell 172.20.0.3"
"5","13.897535984","42","1e:63:40:13:30:bc","ae:ce:e5:68:ac:e7",,,"ARP","172.20.0.2 is at 1e:63:40:13:30:bc"
"6","13.897543390","74","ae:ce:e5:68:ac:e7","1e:63:40:13:30:bc","172.20.0.3","172.20.0.2","TCP","57080 → 4433 [SYN] Seq=0 Win=64240 Len=0 MSS=1460 SACK_PERM TSval=2169274982 TSecr=0 WS=128"
"7","14.868364929","42","ae:ce:e5:68:ac:e7","ff:ff:ff:ff:ff:ff",,,"ARP","ARP Announcement for 172.20.0.3"
"8","14.911522851","74","1e:63:40:13:30:bc","ae:ce:e5:68:ac:e7","172.20.0.2","172.20.0.3","TCP","4433 → 57080 [SYN, ACK] Seq=0 Ack=1 Win=65160 Len=0 MSS=1460 SACK_PERM TSval=2863846927 TSecr=2169274982 WS=128"
"9","14.911551422","74","ae:ce:e5:68:ac:e7","1e:63:40:13:30:bc","172.20.0.3","172.20.0.2","TCP","[TCP Retransmission] 57080 → 4433 [SYN] Seq=0 Win=64240 Len=0 MSS=1460 SACK_PERM TSval=2169275997 TSecr=0 WS=128"
"10","14.911565949","74","1e:63:40:13:30:bc","ae:ce:e5:68:ac:e7","172.20.0.2","172.20.0.3","TCP","[TCP Out-Of-Order] 4433 → 57080 [SYN, ACK] Seq=0 Ack=1 Win=65160 Len=0 MSS=1460 SACK_PERM TSval=2863846927 TSecr=2169274982 WS=128"
"11","14.911603120","66","ae:ce:e5:68:ac:e7","1e:63:40:13:30:bc","172.20.0.3","172.20.0.2","TCP","57080 → 4433 [ACK] Seq=1 Ack=1 Win=64256 Len=0 TSval=2169275997 TSecr=2863846927"
"12","14.911629934","66","ae:ce:e5:68:ac:e7","1e:63:40:13:30:bc","172.20.0.3","172.20.0.2","TCP","[TCP Dup ACK 11#1] 57080 → 4433 [ACK] Seq=1 Ack=1 Win=64256 Len=0 TSval=2169275997 TSecr=2863846927"
"13","14.911699187","1728","ae:ce:e5:68:ac:e7","1e:63:40:13:30:bc","172.20.0.3","172.20.0.2","TLSv1.2","Client Hello"
"14","14.911707392","66","1e:63:40:13:30:bc","ae:ce:e5:68:ac:e7","172.20.0.2","172.20.0.3","TCP","4433 → 57080 [ACK] Seq=1 Ack=1663 Win=64128 Len=0 TSval=2863846927 TSecr=2169275997"
"15","15.119500119","565","1e:63:40:13:30:bc","ae:ce:e5:68:ac:e7","172.20.0.2","172.20.0.3","SSL","[TCP Previous segment not captured] , Continuation Data"
"16","15.119548296","78","ae:ce:e5:68:ac:e7","1e:63:40:13:30:bc","172.20.0.3","172.20.0.2","TCP","[TCP Dup ACK 11#2] 57080 → 4433 [ACK] Seq=1663 Ack=1 Win=64256 Len=0 TSval=2169276205 TSecr=2863846927 SLE=1449 SRE=1948"
"17","15.119560991","1514","1e:63:40:13:30:bc","ae:ce:e5:68:ac:e7","172.20.0.2","172.20.0.3","TLSv1.3","[TCP Fast Retransmission] , Server Hello, Change Cipher Spec, Application Data"
"18","15.119578402","66","ae:ce:e5:68:ac:e7","1e:63:40:13:30:bc","172.20.0.3","172.20.0.2","TCP","57080 → 4433 [ACK] Seq=1663 Ack=1948 Win=64128 Len=0 TSval=2169276205 TSecr=2863847135"
"19","15.122990687","146","ae:ce:e5:68:ac:e7","1e:63:40:13:30:bc","172.20.0.3","172.20.0.2","TLSv1.3","Change Cipher Spec, Application Data"
"20","15.123060376","66","ae:ce:e5:68:ac:e7","1e:63:40:13:30:bc","172.20.0.3","172.20.0.2","TCP","57080 → 4433 [RST, ACK] Seq=1743 Ack=1948 Win=64128 Len=0 TSval=2169276208 TSecr=2863847135"
"21","15.134425733","74","ae:ce:e5:68:ac:e7","1e:63:40:13:30:bc","172.20.0.3","172.20.0.2","TCP","57084 → 4433 [SYN] Seq=0 Win=64240 Len=0 MSS=1460 SACK_PERM TSval=2169276219 TSecr=0 WS=128"
"22","15.134454217","74","1e:63:40:13:30:bc","ae:ce:e5:68:ac:e7","172.20.0.2","172.20.0.3","TCP","4433 → 57084 [SYN, ACK] Seq=0 Ack=1 Win=65160 Len=0 MSS=1460 SACK_PERM TSval=2863847149 TSecr=2169276219 WS=128"
"23","15.134486066","66","ae:ce:e5:68:ac:e7","1e:63:40:13:30:bc","172.20.0.3","172.20.0.2","TCP","57084 → 4433 [ACK] Seq=1 Ack=1 Win=64256 Len=0 TSval=2169276220 TSecr=2863847149"
"24","15.134531362","1728","ae:ce:e5:68:ac:e7","1e:63:40:13:30:bc","172.20.0.3","172.20.0.2","TLSv1.2","Client Hello"
"25","15.134538168","66","1e:63:40:13:30:bc","ae:ce:e5:68:ac:e7","172.20.0.2","172.20.0.3","TCP","4433 → 57084 [ACK] Seq=1 Ack=1663 Win=64128 Len=0 TSval=2863847150 TSecr=2169276220"
"26","15.137012904","2012","1e:63:40:13:30:bc","ae:ce:e5:68:ac:e7","172.20.0.2","172.20.0.3","TLSv1.3","Server Hello, Change Cipher Spec, Application Data, Application Data, Application Data, Application Data"
"27","15.137060829","66","ae:ce:e5:68:ac:e7","1e:63:40:13:30:bc","172.20.0.3","172.20.0.2","TCP","57084 → 4433 [ACK] Seq=1663 Ack=1947 Win=64128 Len=0 TSval=2169276222 TSecr=2863847152"
"28","15.140344855","146","ae:ce:e5:68:ac:e7","1e:63:40:13:30:bc","172.20.0.3","172.20.0.2","TLSv1.3","Change Cipher Spec, Application Data"
"29","15.140415652","66","ae:ce:e5:68:ac:e7","1e:63:40:13:30:bc","172.20.0.3","172.20.0.2","TCP","57084 → 4433 [RST, ACK] Seq=1743 Ack=1947 Win=64128 Len=0 TSval=2169276225 TSecr=2863847152"
"30","15.151579868","74","ae:ce:e5:68:ac:e7","1e:63:40:13:30:bc","172.20.0.3","172.20.0.2","TCP","57096 → 4433 [SYN] Seq=0 Win=64240 Len=0 MSS=1460 SACK_PERM TSval=2169276237 TSecr=0 WS=128"
"31","15.151609306","74","1e:63:40:13:30:bc","ae:ce:e5:68:ac:e7","172.20.0.2","172.20.0.3","TCP","4433 → 57096 [SYN, ACK] Seq=0 Ack=1 Win=65160 Len=0 MSS=1460 SACK_PERM TSval=2863847167 TSecr=2169276237 WS=128"
"32","15.151628302","66","ae:ce:e5:68:ac:e7","1e:63:40:13:30:bc","172.20.0.3","172.20.0.2","TCP","57096 → 4433 [ACK] Seq=1 Ack=1 Win=64256 Len=0 TSval=2169276237 TSecr=2863847167"
"33","15.151681104","1728","ae:ce:e5:68:ac:e7","1e:63:40:13:30:bc","172.20.0.3","172.20.0.2","TLSv1.2","Client Hello"
"34","15.151687181","66","1e:63:40:13:30:bc","ae:ce:e5:68:ac:e7","172.20.0.2","172.20.0.3","TCP","4433 → 57096 [ACK] Seq=1 Ack=1663 Win=64128 Len=0 TSval=2863847167 TSecr=2169276237"
"35","15.154136707","2013","1e:63:40:13:30:bc","ae:ce:e5:68:ac:e7","172.20.0.2","172.20.0.3","TLSv1.3","Server Hello, Change Cipher Spec, Application Data, Application Data, Application Data, Application Data"
"36","15.154166093","66","ae:ce:e5:68:ac:e7","1e:63:40:13:30:bc","172.20.0.3","172.20.0.2","TCP","57096 → 4433 [ACK] Seq=1663 Ack=1948 Win=64128 Len=0 TSval=2169276239 TSecr=2863847169"
"37","15.157359038","146","ae:ce:e5:68:ac:e7","1e:63:40:13:30:bc","172.20.0.3","172.20.0.2","TLSv1.3","Change Cipher Spec, Application Data"
"38","15.157423030","66","ae:ce:e5:68:ac:e7","1e:63:40:13:30:bc","172.20.0.3","172.20.0.2","TCP","57096 → 4433 [RST, ACK] Seq=1743 Ack=1948 Win=64128 Len=0 TSval=2169276242 TSecr=2863847169"
"39","15.168483280","74","ae:ce:e5:68:ac:e7","1e:63:40:13:30:bc","172.20.0.3","172.20.0.2","TCP","35204 → 4433 [SYN] Seq=0 Win=64240 Len=0 MSS=1460 SACK_PERM TSval=2169276253 TSecr=0 WS=128"
"40","15.168513836","74","1e:63:40:13:30:bc","ae:ce:e5:68:ac:e7","172.20.0.2","172.20.0.3","TCP","4433 → 35204 [SYN, ACK] Seq=0 Ack=1 Win=65160 Len=0 MSS=1460 SACK_PERM TSval=2863847184 TSecr=2169276253 WS=128"
"41","15.168534488","66","ae:ce:e5:68:ac:e7","1e:63:40:13:30:bc","172.20.0.3","172.20.0.2","TCP","35204 → 4433 [ACK] Seq=1 Ack=1 Win=64256 Len=0 TSval=2169276254 TSecr=2863847184"
"42","15.168593510","1728","ae:ce:e5:68:ac:e7","1e:63:40:13:30:bc","172.20.0.3","172.20.0.2","TLSv1.2","Client Hello"
"43","15.172485224","280","ae:ce:e5:68:ac:e7","1e:63:40:13:30:bc","172.20.0.3","172.20.0.2","TCP","[TCP Retransmission] 35204 → 4433 [PSH, ACK] Seq=1449 Ack=1 Win=64256 Len=214 TSval=2169276258 TSecr=2863847184"
"44","15.172493968","78","1e:63:40:13:30:bc","ae:ce:e5:68:ac:e7","172.20.0.2","172.20.0.3","TCP","[TCP Previous segment not captured] 4433 → 35204 [ACK] Seq=1947 Ack=1663 Win=64128 Len=0 TSval=2863847188 TSecr=2169276258 SLE=1449 SRE=1663"
"45","15.174490256","564","1e:63:40:13:30:bc","ae:ce:e5:68:ac:e7","172.20.0.2","172.20.0.3","TCP","[TCP Retransmission] 4433 → 35204 [PSH, ACK] Seq=1449 Ack=1663 Win=64128 Len=498 TSval=2863847190 TSecr=2169276258"
"46","15.174515935","78","ae:ce:e5:68:ac:e7","1e:63:40:13:30:bc","172.20.0.3","172.20.0.2","TCP","[TCP Dup ACK 41#1] 35204 → 4433 [ACK] Seq=1663 Ack=1 Win=64256 Len=0 TSval=2169276260 TSecr=2863847184 SLE=1449 SRE=1947"
"47","15.791505673","1514","1e:63:40:13:30:bc","ae:ce:e5:68:ac:e7","172.20.0.2","172.20.0.3","TCP","[TCP Retransmission] 4433 → 35204 [ACK] Seq=1 Ack=1663 Win=64128 Len=1448 TSval=2863847807 TSecr=2169276260"
"48","15.791592217","66","ae:ce:e5:68:ac:e7","1e:63:40:13:30:bc","172.20.0.3","172.20.0.2","TCP","35204 → 4433 [ACK] Seq=1663 Ack=1947 Win=64128 Len=0 TSval=2169276877 TSecr=2863847807"
"49","15.795071906","146","ae:ce:e5:68:ac:e7","1e:63:40:13:30:bc","172.20.0.3","172.20.0.2","TLSv1.2","Change Cipher Spec, Application Data"
"50","15.795140772","66","ae:ce:e5:68:ac:e7","1e:63:40:13:30:bc","172.20.0.3","172.20.0.2","TCP","35204 → 4433 [RST, ACK] Seq=1743 Ack=1947 Win=64128 Len=0 TSval=2169276880 TSecr=2863847807"
"51","15.806584889","74","ae:ce:e5:68:ac:e7","1e:63:40:13:30:bc","172.20.0.3","172.20.0.2","TCP","35216 → 4433 [SYN] Seq=0 Win=64240 Len=0 MSS=1460 SACK_PERM TSval=2169276892 TSecr=0 WS=128"
"52","15.806612528","74","1e:63:40:13:30:bc","ae:ce:e5:68:ac:e7","172.20.0.2","172.20.0.3","TCP","4433 → 35216 [SYN, ACK] Seq=0 Ack=1 Win=65160 Len=0 MSS=1460 SACK_PERM TSval=2863847822 TSecr=2169276892 WS=128"
"53","15.806631032","66","ae:ce:e5:68:ac:e7","1e:63:40:13:30:bc","172.20.0.3","172.20.0.2","TCP","35216 → 4433 [ACK] Seq=1 Ack=1 Win=64256 Len=0 TSval=2169276892 TSecr=2863847822"
"54","15.806677768","1728","ae:ce:e5:68:ac:e7","1e:63:40:13:30:bc","172.20.0.3","172.20.0.2","TLSv1.2","Client Hello"
"55","15.810489521","280","ae:ce:e5:68:ac:e7","1e:63:40:13:30:bc","172.20.0.3","172.20.0.2","TCP","[TCP Retransmission] 35216 → 4433 [PSH, ACK] Seq=1449 Ack=1 Win=64256 Len=214 TSval=2169276896 TSecr=2863847822"
"56","15.812484446","564","1e:63:40:13:30:bc","ae:ce:e5:68:ac:e7","172.20.0.2","172.20.0.3","SSL","[TCP Previous segment not captured] , Continuation Data"
"57","15.812521410","78","ae:ce:e5:68:ac:e7","1e:63:40:13:30:bc","172.20.0.3","172.20.0.2","TCP","[TCP Dup ACK 53#1] 35216 → 4433 [ACK] Seq=1663 Ack=1 Win=64256 Len=0 TSval=2169276898 TSecr=2863847822 SLE=1449 SRE=1947"
"58","15.812529813","1514","1e:63:40:13:30:bc","ae:ce:e5:68:ac:e7","172.20.0.2","172.20.0.3","TCP","[TCP Out-Of-Order] 4433 → 35216 [ACK] Seq=1 Ack=1663 Win=64128 Len=1448 TSval=2863847828 TSecr=2169276898"
"59","15.812541433","66","ae:ce:e5:68:ac:e7","1e:63:40:13:30:bc","172.20.0.3","172.20.0.2","TCP","35216 → 4433 [ACK] Seq=1663 Ack=1947 Win=64128 Len=0 TSval=2169276898 TSecr=2863847828"
"60","15.816295942","146","ae:ce:e5:68:ac:e7","1e:63:40:13:30:bc","172.20.0.3","172.20.0.2","TLSv1.2","Change Cipher Spec, Application Data"
"61","15.816358855","66","ae:ce:e5:68:ac:e7","1e:63:40:13:30:bc","172.20.0.3","172.20.0.2","TCP","35216 → 4433 [RST, ACK] Seq=1743 Ack=1947 Win=64128 Len=0 TSval=2169276901 TSecr=2863847828"
"62","15.827270409","74","ae:ce:e5:68:ac:e7","1e:63:40:13:30:bc","172.20.0.3","172.20.0.2","TCP","35228 → 4433 [SYN] Seq=0 Win=64240 Len=0 MSS=1460 SACK_PERM TSval=2169276912 TSecr=0 WS=128"
"63","15.868758805","42","ae:ce:e5:68:ac:e7","ff:ff:ff:ff:ff:ff",,,"ARP","ARP Announcement for 172.20.0.3"
"64","16.831532191","74","1e:63:40:13:30:bc","ae:ce:e5:68:ac:e7","172.20.0.2","172.20.0.3","TCP","4433 → 35228 [SYN, ACK] Seq=0 Ack=1 Win=65160 Len=0 MSS=1460 SACK_PERM TSval=2863848847 TSecr=2169276912 WS=128"
"65","16.831558931","74","ae:ce:e5:68:ac:e7","1e:63:40:13:30:bc","172.20.0.3","172.20.0.2","TCP","[TCP Retransmission] 35228 → 4433 [SYN] Seq=0 Win=64240 Len=0 MSS=1460 SACK_PERM TSval=2169277917 TSecr=0 WS=128"
"66","16.831573833","74","1e:63:40:13:30:bc","ae:ce:e5:68:ac:e7","172.20.0.2","172.20.0.3","TCP","[TCP Out-Of-Order] 4433 → 35228 [SYN, ACK] Seq=0 Ack=1 Win=65160 Len=0 MSS=1460 SACK_PERM TSval=2863848847 TSecr=2169276912 WS=128"
"67","16.831609145","66","ae:ce:e5:68:ac:e7","1e:63:40:13:30:bc","172.20.0.3","172.20.0.2","TCP","35228 → 4433 [ACK] Seq=1 Ack=1 Win=64256 Len=0 TSval=2169277917 TSecr=2863848847"
"68","16.831639757","66","ae:ce:e5:68:ac:e7","1e:63:40:13:30:bc","172.20.0.3","172.20.0.2","TCP","[TCP Dup ACK 67#1] 35228 → 4433 [ACK] Seq=1 Ack=1 Win=64256 Len=0 TSval=2169277917 TSecr=2863848847"
"69","16.831700667","1728","ae:ce:e5:68:ac:e7","1e:63:40:13:30:bc","172.20.0.3","172.20.0.2","TLSv1.2","Client Hello"
"70","16.831708144","66","1e:63:40:13:30:bc","ae:ce:e5:68:ac:e7","172.20.0.2","172.20.0.3","TCP","4433 → 35228 [ACK] Seq=1 Ack=1663 Win=64128 Len=0 TSval=2863848847 TSecr=2169277917"
"71","17.039501775","564","1e:63:40:13:30:bc","ae:ce:e5:68:ac:e7","172.20.0.2","172.20.0.3","SSL","[TCP Previous segment not captured] , Continuation Data"
"72","17.039572336","78","ae:ce:e5:68:ac:e7","1e:63:40:13:30:bc","172.20.0.3","172.20.0.2","TCP","[TCP Dup ACK 67#2] 35228 → 4433 [ACK] Seq=1663 Ack=1 Win=64256 Len=0 TSval=2169278125 TSecr=2863848847 SLE=1449 SRE=1947"
"73","17.039584297","1514","1e:63:40:13:30:bc","ae:ce:e5:68:ac:e7","172.20.0.2","172.20.0.3","TLSv1.3","[TCP Fast Retransmission] , Server Hello, Change Cipher Spec, Application Data"
"74","17.039607809","66","ae:ce:e5:68:ac:e7","1e:63:40:13:30:bc","172.20.0.3","172.20.0.2","TCP","35228 → 4433 [ACK] Seq=1663 Ack=1947 Win=64128 Len=0 TSval=2169278125 TSecr=2863849055"
"75","17.043117835","146","ae:ce:e5:68:ac:e7","1e:63:40:13:30:bc","172.20.0.3","172.20.0.2","TLSv1.3","Change Cipher Spec, Application Data"
"76","17.043185770","66","ae:ce:e5:68:ac:e7","1e:63:40:13:30:bc","172.20.0.3","172.20.0.2","TCP","35228 → 4433 [RST, ACK] Seq=1743 Ack=1947 Win=64128 Len=0 TSval=2169278128 TSecr=2863849055"
"77","17.054483512","74","ae:ce:e5:68:ac:e7","1e:63:40:13:30:bc","172.20.0.3","172.20.0.2","TCP","35232 → 4433 [SYN] Seq=0 Win=64240 Len=0 MSS=1460 SACK_PERM TSval=2169278139 TSecr=0 WS=128"
"78","17.054513161","74","1e:63:40:13:30:bc","ae:ce:e5:68:ac:e7","172.20.0.2","172.20.0.3","TCP","4433 → 35232 [SYN, ACK] Seq=0 Ack=1 Win=65160 Len=0 MSS=1460 SACK_PERM TSval=2863849070 TSecr=2169278139 WS=128"
"79","17.054532173","66","ae:ce:e5:68:ac:e7","1e:63:40:13:30:bc","172.20.0.3","172.20.0.2","TCP","35232 → 4433 [ACK] Seq=1 Ack=1 Win=64256 Len=0 TSval=2169278140 TSecr=2863849070"
"80","17.054579480","1728","ae:ce:e5:68:ac:e7","1e:63:40:13:30:bc","172.20.0.3","172.20.0.2","TLSv1.2","Client Hello"
"81","17.054586189","66","1e:63:40:13:30:bc","ae:ce:e5:68:ac:e7","172.20.0.2","172.20.0.3","TCP","4433 → 35232 [ACK] Seq=1 Ack=1663 Win=64128 Len=0 TSval=2863849070 TSecr=2169278140"
"82","17.263505927","1514","1e:63:40:13:30:bc","ae:ce:e5:68:ac:e7","172.20.0.2","172.20.0.3","TLSv1.3","Server Hello, Change Cipher Spec, Application Data"
"83","17.263596523","66","ae:ce:e5:68:ac:e7","1e:63:40:13:30:bc","172.20.0.3","172.20.0.2","TCP","35232 → 4433 [ACK] Seq=1663 Ack=1449 Win=64128 Len=0 TSval=2169278349 TSecr=2863849279"
"84","17.263609534","563","1e:63:40:13:30:bc","ae:ce:e5:68:ac:e7","172.20.0.2","172.20.0.3","TLSv1.3","Application Data, Application Data, Application Data"
"85","17.263616022","66","ae:ce:e5:68:ac:e7","1e:63:40:13:30:bc","172.20.0.3","172.20.0.2","TCP","35232 → 4433 [ACK] Seq=1663 Ack=1946 Win=64128 Len=0 TSval=2169278349 TSecr=2863849279"
"86","17.267046167","146","ae:ce:e5:68:ac:e7","1e:63:40:13:30:bc","172.20.0.3","172.20.0.2","TLSv1.3","Change Cipher Spec, Application Data"
"87","17.267114966","66","ae:ce:e5:68:ac:e7","1e:63:40:13:30:bc","172.20.0.3","172.20.0.2","TCP","35232 → 4433 [RST, ACK] Seq=1743 Ack=1946 Win=64128 Len=0 TSval=2169278352 TSecr=2863849279"
"88","17.278404874","74","ae:ce:e5:68:ac:e7","1e:63:40:13:30:bc","172.20.0.3","172.20.0.2","TCP","35246 → 4433 [SYN] Seq=0 Win=64240 Len=0 MSS=1460 SACK_PERM TSval=2169278363 TSecr=0 WS=128"
"89","17.278434537","74","1e:63:40:13:30:bc","ae:ce:e5:68:ac:e7","172.20.0.2","172.20.0.3","TCP","4433 → 35246 [SYN, ACK] Seq=0 Ack=1 Win=65160 Len=0 MSS=1460 SACK_PERM TSval=2863849293 TSecr=2169278363 WS=128"
"90","17.278454365","66","ae:ce:e5:68:ac:e7","1e:63:40:13:30:bc","172.20.0.3","172.20.0.2","TCP","35246 → 4433 [ACK] Seq=1 Ack=1 Win=64256 Len=0 TSval=2169278363 TSecr=2863849293"
"91","17.278557296","1728","ae:ce:e5:68:ac:e7","1e:63:40:13:30:bc","172.20.0.3","172.20.0.2","TLSv1.2","Client Hello"
"92","17.281027875","2012","1e:63:40:13:30:bc","ae:ce:e5:68:ac:e7","172.20.0.2","172.20.0.3","TLSv1.3","Server Hello, Change Cipher Spec, Application Data, Application Data, Application Data, Application Data"
"93","17.281068906","66","ae:ce:e5:68:ac:e7","1e:63:40:13:30:bc","172.20.0.3","172.20.0.2","TCP","35246 → 4433 [ACK] Seq=1663 Ack=1947 Win=64128 Len=0 TSval=2169278366 TSecr=2863849296"
"94","17.284290719","146","ae:ce:e5:68:ac:e7","1e:63:40:13:30:bc","172.20.0.3","172.20.0.2","TLSv1.3","Change Cipher Spec, Application Data"
"95","17.284360017","66","ae:ce:e5:68:ac:e7","1e:63:40:13:30:bc","172.20.0.3","172.20.0.2","TCP","35246 → 4433 [RST, ACK] Seq=1743 Ack=1947 Win=64128 Len=0 TSval=2169278369 TSecr=2863849296"
"96","17.295672556","74","ae:ce:e5:68:ac:e7","1e:63:40:13:30:bc","172.20.0.3","172.20.0.2","TCP","35258 → 4433 [SYN] Seq=0 Win=64240 Len=0 MSS=1460 SACK_PERM TSval=2169278381 TSecr=0 WS=128"
"97","18.303520462","74","1e:63:40:13:30:bc","ae:ce:e5:68:ac:e7","172.20.0.2","172.20.0.3","TCP","4433 → 35258 [SYN, ACK] Seq=0 Ack=1 Win=65160 Len=0 MSS=1460 SACK_PERM TSval=2863850319 TSecr=2169278381 WS=128"
"98","18.303557097","74","ae:ce:e5:68:ac:e7","1e:63:40:13:30:bc","172.20.0.3","172.20.0.2","TCP","[TCP Retransmission] 35258 → 4433 [SYN] Seq=0 Win=64240 Len=0 MSS=1460 SACK_PERM TSval=2169279389 TSecr=0 WS=128"
"99","18.303572397","74","1e:63:40:13:30:bc","ae:ce:e5:68:ac:e7","172.20.0.2","172.20.0.3","TCP","[TCP Out-Of-Order] 4433 → 35258 [SYN, ACK] Seq=0 Ack=1 Win=65160 Len=0 MSS=1460 SACK_PERM TSval=2863850319 TSecr=2169278381 WS=128"
"100","18.303609046","66","ae:ce:e5:68:ac:e7","1e:63:40:13:30:bc","172.20.0.3","172.20.0.2","TCP","35258 → 4433 [ACK] Seq=1 Ack=1 Win=64256 Len=0 TSval=2169279389 TSecr=2863850319"
"101","18.303641295","66","ae:ce:e5:68:ac:e7","1e:63:40:13:30:bc","172.20.0.3","172.20.0.2","TCP","[TCP Dup ACK 100#1] 35258 → 4433 [ACK] Seq=1 Ack=1 Win=64256 Len=0 TSval=2169279389 TSecr=2863850319"
"102","18.303677272","1728","ae:ce:e5:68:ac:e7","1e:63:40:13:30:bc","172.20.0.3","172.20.0.2","TLSv1.2","Client Hello"
"103","18.303692070","66","1e:63:40:13:30:bc","ae:ce:e5:68:ac:e7","172.20.0.2","172.20.0.3","TCP","4433 → 35258 [ACK] Seq=1 Ack=1663 Win=64128 Len=0 TSval=2863850319 TSecr=2169279389"
"104","18.306237222","1514","1e:63:40:13:30:bc","ae:ce:e5:68:ac:e7","172.20.0.2","172.20.0.3","TLSv1.3","Server Hello, Change Cipher Spec, Application Data"
"105","18.306271228","66","ae:ce:e5:68:ac:e7","1e:63:40:13:30:bc","172.20.0.3","172.20.0.2","TCP","35258 → 4433 [ACK] Seq=1663 Ack=1449 Win=64128 Len=0 TSval=2169279391 TSecr=2863850321"
"106","18.306278803","563","1e:63:40:13:30:bc","ae:ce:e5:68:ac:e7","172.20.0.2","172.20.0.3","TLSv1.3","Application Data, Application Data, Application Data"
"107","18.306284101","66","ae:ce:e5:68:ac:e7","1e:63:40:13:30:bc","172.20.0.3","172.20.0.2","TCP","35258 → 4433 [ACK] Seq=1663 Ack=1946 Win=64128 Len=0 TSval=2169279391 TSecr=2863850321"
"108","18.309588160","146","ae:ce:e5:68:ac:e7","1e:63:40:13:30:bc","172.20.0.3","172.20.0.2","TLSv1.3","Change Cipher Spec, Application Data"
"109","18.309651160","66","ae:ce:e5:68:ac:e7","1e:63:40:13:30:bc","172.20.0.3","172.20.0.2","TCP","35258 → 4433 [RST, ACK] Seq=1743 Ack=1946 Win=64128 Len=0 TSval=2169279395 TSecr=2863850321"
"110","18.320887363","74","ae:ce:e5:68:ac:e7","1e:63:40:13:30:bc","172.20.0.3","172.20.0.2","TCP","35262 → 4433 [SYN] Seq=0 Win=64240 Len=0 MSS=1460 SACK_PERM TSval=2169279406 TSecr=0 WS=128"
"111","18.320914344","74","1e:63:40:13:30:bc","ae:ce:e5:68:ac:e7","172.20.0.2","172.20.0.3","TCP","4433 → 35262 [SYN, ACK] Seq=0 Ack=1 Win=65160 Len=0 MSS=1460 SACK_PERM TSval=2863850336 TSecr=2169279406 WS=128"
"112","18.320933885","66","ae:ce:e5:68:ac:e7","1e:63:40:13:30:bc","172.20.0.3","172.20.0.2","TCP","35262 → 4433 [ACK] Seq=1 Ack=1 Win=64256 Len=0 TSval=2169279406 TSecr=2863850336"
"113","18.320974439","1728","ae:ce:e5:68:ac:e7","1e:63:40:13:30:bc","172.20.0.3","172.20.0.2","TLSv1.2","Client Hello"
"114","18.320980987","66","1e:63:40:13:30:bc","ae:ce:e5:68:ac:e7","172.20.0.2","172.20.0.3","TCP","4433 → 35262 [ACK] Seq=1 Ack=1663 Win=64128 Len=0 TSval=2863850336 TSecr=2169279406"
"115","18.323677004","2011","1e:63:40:13:30:bc","ae:ce:e5:68:ac:e7","172.20.0.2","172.20.0.3","TLSv1.3","Server Hello, Change Cipher Spec, Application Data, Application Data, Application Data, Application Data"
"116","18.323711110","66","ae:ce:e5:68:ac:e7","1e:63:40:13:30:bc","172.20.0.3","172.20.0.2","TCP","35262 → 4433 [ACK] Seq=1663 Ack=1946 Win=64128 Len=0 TSval=2169279409 TSecr=2863850339"
"117","18.326885427","146","ae:ce:e5:68:ac:e7","1e:63:40:13:30:bc","172.20.0.3","172.20.0.2","TLSv1.3","Change Cipher Spec, Application Data"
"118","18.326949161","66","ae:ce:e5:68:ac:e7","1e:63:40:13:30:bc","172.20.0.3","172.20.0.2","TCP","35262 → 4433 [RST, ACK] Seq=1743 Ack=1946 Win=64128 Len=0 TSval=2169279412 TSecr=2863850339"
"119","18.337942359","74","ae:ce:e5:68:ac:e7","1e:63:40:13:30:bc","172.20.0.3","172.20.0.2","TCP","35266 → 4433 [SYN] Seq=0 Win=64240 Len=0 MSS=1460 SACK_PERM TSval=2169279423 TSecr=0 WS=128"
"120","18.337966077","74","1e:63:40:13:30:bc","ae:ce:e5:68:ac:e7","172.20.0.2","172.20.0.3","TCP","4433 → 35266 [SYN, ACK] Seq=0 Ack=1 Win=65160 Len=0 MSS=1460 SACK_PERM TSval=2863850353 TSecr=2169279423 WS=128"
"121","18.337982831","66","ae:ce:e5:68:ac:e7","1e:63:40:13:30:bc","172.20.0.3","172.20.0.2","TCP","35266 → 4433 [ACK] Seq=1 Ack=1 Win=64256 Len=0 TSval=2169279423 TSecr=2863850353"
"122","18.338025612","1728","ae:ce:e5:68:ac:e7","1e:63:40:13:30:bc","172.20.0.3","172.20.0.2","TLSv1.2","Client Hello"
"123","18.338031690","66","1e:63:40:13:30:bc","ae:ce:e5:68:ac:e7","172.20.0.2","172.20.0.3","TCP","4433 → 35266 [ACK] Seq=1 Ack=1663 Win=64128 Len=0 TSval=2863850353 TSecr=2169279423"
"124","18.340421854","2012","1e:63:40:13:30:bc","ae:ce:e5:68:ac:e7","172.20.0.2","172.20.0.3","TLSv1.3","Server Hello, Change Cipher Spec, Application Data, Application Data, Application Data, Application Data"
"125","18.340452643","66","ae:ce:e5:68:ac:e7","1e:63:40:13:30:bc","172.20.0.3","172.20.0.2","TCP","35266 → 4433 [ACK] Seq=1663 Ack=1947 Win=64128 Len=0 TSval=2169279425 TSecr=2863850355"
"126","18.343556735","146","ae:ce:e5:68:ac:e7","1e:63:40:13:30:bc","172.20.0.3","172.20.0.2","TLSv1.3","Change Cipher Spec, Application Data"
"127","18.343617377","66","ae:ce:e5:68:ac:e7","1e:63:40:13:30:bc","172.20.0.3","172.20.0.2","TCP","35266 → 4433 [RST, ACK] Seq=1743 Ack=1947 Win=64128 Len=0 TSval=2169279429 TSecr=2863850355"
"128","18.354375314","74","ae:ce:e5:68:ac:e7","1e:63:40:13:30:bc","172.20.0.3","172.20.0.2","TCP","35268 → 4433 [SYN] Seq=0 Win=64240 Len=0 MSS=1460 SACK_PERM TSval=2169279439 TSecr=0 WS=128"
"129","18.354400195","74","1e:63:40:13:30:bc","ae:ce:e5:68:ac:e7","172.20.0.2","172.20.0.3","TCP","4433 → 35268 [SYN, ACK] Seq=0 Ack=1 Win=65160 Len=0 MSS=1460 SACK_PERM TSval=2863850369 TSecr=2169279439 WS=128"
"130","18.354418444","66","ae:ce:e5:68:ac:e7","1e:63:40:13:30:bc","172.20.0.3","172.20.0.2","TCP","35268 → 4433 [ACK] Seq=1 Ack=1 Win=64256 Len=0 TSval=2169279439 TSecr=2863850369"
"131","18.354474632","1728","ae:ce:e5:68:ac:e7","1e:63:40:13:30:bc","172.20.0.3","172.20.0.2","TLSv1.2","Client Hello"
"132","18.356945756","2011","1e:63:40:13:30:bc","ae:ce:e5:68:ac:e7","172.20.0.2","172.20.0.3","TLSv1.3","Server Hello, Change Cipher Spec, Application Data, Application Data, Application Data, Application Data"
"133","18.356977429","66","ae:ce:e5:68:ac:e7","1e:63:40:13:30:bc","172.20.0.3","172.20.0.2","TCP","35268 → 4433 [ACK] Seq=1663 Ack=1946 Win=64128 Len=0 TSval=2169279442 TSecr=2863850372"
"134","18.360179815","146","ae:ce:e5:68:ac:e7","1e:63:40:13:30:bc","172.20.0.3","172.20.0.2","TLSv1.3","Change Cipher Spec, Application Data"
"135","18.360236886","66","ae:ce:e5:68:ac:e7","1e:63:40:13:30:bc","172.20.0.3","172.20.0.2","TCP","35268 → 4433 [RST, ACK] Seq=1743 Ack=1946 Win=64128 Len=0 TSval=2169279445 TSecr=2863850372"
"136","18.371536505","74","ae:ce:e5:68:ac:e7","1e:63:40:13:30:bc","172.20.0.3","172.20.0.2","TCP","35272 → 4433 [SYN] Seq=0 Win=64240 Len=0 MSS=1460 SACK_PERM TSval=2169279457 TSecr=0 WS=128"
"137","18.371569160","74","1e:63:40:13:30:bc","ae:ce:e5:68:ac:e7","172.20.0.2","172.20.0.3","TCP","4433 → 35272 [SYN, ACK] Seq=0 Ack=1 Win=65160 Len=0 MSS=1460 SACK_PERM TSval=2863850387 TSecr=2169279457 WS=128"
"138","18.371588356","66","ae:ce:e5:68:ac:e7","1e:63:40:13:30:bc","172.20.0.3","172.20.0.2","TCP","35272 → 4433 [ACK] Seq=1 Ack=1 Win=64256 Len=0 TSval=2169279457 TSecr=2863850387"
"139","18.371638068","1728","ae:ce:e5:68:ac:e7","1e:63:40:13:30:bc","172.20.0.3","172.20.0.2","TLSv1.2","Client Hello"
"140","18.371658371","66","1e:63:40:13:30:bc","ae:ce:e5:68:ac:e7","172.20.0.2","172.20.0.3","TCP","4433 → 35272 [ACK] Seq=1 Ack=1663 Win=64128 Len=0 TSval=2863850387 TSecr=2169279457"
"141","18.374202129","2012","1e:63:40:13:30:bc","ae:ce:e5:68:ac:e7","172.20.0.2","172.20.0.3","TLSv1.3","Server Hello, Change Cipher Spec, Application Data, Application Data, Application Data, Application Data"
"142","18.374226512","66","ae:ce:e5:68:ac:e7","1e:63:40:13:30:bc","172.20.0.3","172.20.0.2","TCP","35272 → 4433 [ACK] Seq=1663 Ack=1947 Win=64128 Len=0 TSval=2169279459 TSecr=2863850389"
"143","18.377349862","146","ae:ce:e5:68:ac:e7","1e:63:40:13:30:bc","172.20.0.3","172.20.0.2","TLSv1.3","Change Cipher Spec, Application Data"
"144","18.377425562","66","ae:ce:e5:68:ac:e7","1e:63:40:13:30:bc","172.20.0.3","172.20.0.2","TCP","35272 → 4433 [RST, ACK] Seq=1743 Ack=1947 Win=64128 Len=0 TSval=2169279462 TSecr=2863850389"
"145","18.392557073","74","ae:ce:e5:68:ac:e7","1e:63:40:13:30:bc","172.20.0.3","172.20.0.2","TCP","35288 → 4433 [SYN] Seq=0 Win=64240 Len=0 MSS=1460 SACK_PERM TSval=2169279478 TSecr=0 WS=128"
"146","18.392592129","74","1e:63:40:13:30:bc","ae:ce:e5:68:ac:e7","172.20.0.2","172.20.0.3","TCP","4433 → 35288 [SYN, ACK] Seq=0 Ack=1 Win=65160 Len=0 MSS=1460 SACK_PERM TSval=2863850408 TSecr=2169279478 WS=128"
"147","18.392617130","66","ae:ce:e5:68:ac:e7","1e:63:40:13:30:bc","172.20.0.3","172.20.0.2","TCP","35288 → 4433 [ACK] Seq=1 Ack=1 Win=64256 Len=0 TSval=2169279478 TSecr=2863850408"
"148","18.392675489","1728","ae:ce:e5:68:ac:e7","1e:63:40:13:30:bc","172.20.0.3","172.20.0.2","TLSv1.2","Client Hello"
"149","18.395166417","2013","1e:63:40:13:30:bc","ae:ce:e5:68:ac:e7","172.20.0.2","172.20.0.3","TLSv1.3","Server Hello, Change Cipher Spec, Application Data, Application Data, Application Data, Application Data"
"150","18.395199703","66","ae:ce:e5:68:ac:e7","1e:63:40:13:30:bc","172.20.0.3","172.20.0.2","TCP","35288 → 4433 [ACK] Seq=1663 Ack=1948 Win=64128 Len=0 TSval=2169279480 TSecr=2863850410"
"151","18.400655865","146","ae:ce:e5:68:ac:e7","1e:63:40:13:30:bc","172.20.0.3","172.20.0.2","TLSv1.3","Change Cipher Spec, Application Data"
"152","18.400737791","66","ae:ce:e5:68:ac:e7","1e:63:40:13:30:bc","172.20.0.3","172.20.0.2","TCP","35288 → 4433 [RST, ACK] Seq=1743 Ack=1948 Win=64128 Len=0 TSval=2169279486 TSecr=2863850410"
"153","18.416041664","74","ae:ce:e5:68:ac:e7","1e:63:40:13:30:bc","172.20.0.3","172.20.0.2","TCP","35296 → 4433 [SYN] Seq=0 Win=64240 Len=0 MSS=1460 SACK_PERM TSval=2169279501 TSecr=0 WS=128"
"154","18.416075276","74","1e:63:40:13:30:bc","ae:ce:e5:68:ac:e7","172.20.0.2","172.20.0.3","TCP","4433 → 35296 [SYN, ACK] Seq=0 Ack=1 Win=65160 Len=0 MSS=1460 SACK_PERM TSval=2863850431 TSecr=2169279501 WS=128"
"155","18.416099409","66","ae:ce:e5:68:ac:e7","1e:63:40:13:30:bc","172.20.0.3","172.20.0.2","TCP","35296 → 4433 [ACK] Seq=1 Ack=1 Win=64256 Len=0 TSval=2169279501 TSecr=2863850431"
"156","18.416149646","1728","ae:ce:e5:68:ac:e7","1e:63:40:13:30:bc","172.20.0.3","172.20.0.2","TLSv1.2","Client Hello"
"157","18.416158169","66","1e:63:40:13:30:bc","ae:ce:e5:68:ac:e7","172.20.0.2","172.20.0.3","TCP","4433 → 35296 [ACK] Seq=1 Ack=1663 Win=64128 Len=0 TSval=2863850431 TSecr=2169279501"
"158","18.422478886","563","1e:63:40:13:30:bc","ae:ce:e5:68:ac:e7","172.20.0.2","172.20.0.3","SSL","[TCP Previous segment not captured] "
"159","18.422510599","78","ae:ce:e5:68:ac:e7","1e:63:40:13:30:bc","172.20.0.3","172.20.0.2","TCP","[TCP Dup ACK 155#1] 35296 → 4433 [ACK] Seq=1663 Ack=1 Win=64256 Len=0 TSval=2169279508 TSecr=2863850431 SLE=1449 SRE=1946"
"160","18.631498157","1514","1e:63:40:13:30:bc","ae:ce:e5:68:ac:e7","172.20.0.2","172.20.0.3","TCP","[TCP Retransmission] 4433 → 35296 [ACK] Seq=1 Ack=1663 Win=64128 Len=1448 TSval=2863850647 TSecr=2169279508"
"161","18.631560169","66","ae:ce:e5:68:ac:e7","1e:63:40:13:30:bc","172.20.0.3","172.20.0.2","TCP","35296 → 4433 [ACK] Seq=1663 Ack=1946 Win=64128 Len=0 TSval=2169279717 TSecr=2863850647"
"162","18.634954435","146","ae:ce:e5:68:ac:e7","1e:63:40:13:30:bc","172.20.0.3","172.20.0.2","TLSv1.2","Change Cipher Spec, Application Data"
"163","18.635025240","66","ae:ce:e5:68:ac:e7","1e:63:40:13:30:bc","172.20.0.3","172.20.0.2","TCP","35296 → 4433 [RST, ACK] Seq=1743 Ack=1946 Win=64128 Len=0 TSval=2169279720 TSecr=2863850647"
"164","18.646380836","74","ae:ce:e5:68:ac:e7","1e:63:40:13:30:bc","172.20.0.3","172.20.0.2","TCP","35302 → 4433 [SYN] Seq=0 Win=64240 Len=0 MSS=1460 SACK_PERM TSval=2169279731 TSecr=0 WS=128"
"165","19.647551426","74","ae:ce:e5:68:ac:e7","1e:63:40:13:30:bc","172.20.0.3","172.20.0.2","TCP","[TCP Retransmission] 35302 → 4433 [SYN] Seq=0 Win=64240 Len=0 MSS=1460 SACK_PERM TSval=2169280733 TSecr=0 WS=128"
"166","20.671533263","74","ae:ce:e5:68:ac:e7","1e:63:40:13:30:bc","172.20.0.3","172.20.0.2","TCP","[TCP Retransmission] 35302 → 4433 [SYN] Seq=0 Win=64240 Len=0 MSS=1460 SACK_PERM TSval=2169281757 TSecr=0 WS=128"
"167","20.671559656","74","1e:63:40:13:30:bc","ae:ce:e5:68:ac:e7","172.20.0.2","172.20.0.3","TCP","4433 → 35302 [SYN, ACK] Seq=0 Ack=1 Win=65160 Len=0 MSS=1460 SACK_PERM TSval=2863852687 TSecr=2169279731 WS=128"
"168","20.671595624","66","ae:ce:e5:68:ac:e7","1e:63:40:13:30:bc","172.20.0.3","172.20.0.2","TCP","35302 → 4433 [ACK] Seq=1 Ack=1 Win=64256 Len=0 TSval=2169281757 TSecr=2863852687"
"169","20.671686452","1728","ae:ce:e5:68:ac:e7","1e:63:40:13:30:bc","172.20.0.3","172.20.0.2","TLSv1.2","Client Hello"
"170","20.671694815","66","1e:63:40:13:30:bc","ae:ce:e5:68:ac:e7","172.20.0.2","172.20.0.3","TCP","4433 → 35302 [ACK] Seq=1 Ack=1663 Win=64128 Len=0 TSval=2863852687 TSecr=2169281757"
"171","20.674280814","1514","1e:63:40:13:30:bc","ae:ce:e5:68:ac:e7","172.20.0.2","172.20.0.3","TLSv1.3","Server Hello, Change Cipher Spec, Application Data"
"172","20.674312543","66","ae:ce:e5:68:ac:e7","1e:63:40:13:30:bc","172.20.0.3","172.20.0.2","TCP","35302 → 4433 [ACK] Seq=1663 Ack=1449 Win=64128 Len=0 TSval=2169281759 TSecr=2863852689"
"173","20.674320563","563","1e:63:40:13:30:bc","ae:ce:e5:68:ac:e7","172.20.0.2","172.20.0.3","TLSv1.3","Application Data, Application Data, Application Data"
"174","20.674334906","66","ae:ce:e5:68:ac:e7","1e:63:40:13:30:bc","172.20.0.3","172.20.0.2","TCP","35302 → 4433 [ACK] Seq=1663 Ack=1946 Win=64128 Len=0 TSval=2169281759 TSecr=2863852689"
"175","20.677644029","146","ae:ce:e5:68:ac:e7","1e:63:40:13:30:bc","172.20.0.3","172.20.0.2","TLSv1.3","Change Cipher Spec, Application Data"
"176","20.677704845","66","ae:ce:e5:68:ac:e7","1e:63:40:13:30:bc","172.20.0.3","172.20.0.2","TCP","35302 → 4433 [RST, ACK] Seq=1743 Ack=1946 Win=64128 Len=0 TSval=2169281763 TSecr=2863852689"
"177","20.689430176","74","ae:ce:e5:68:ac:e7","1e:63:40:13:30:bc","172.20.0.3","172.20.0.2","TCP","35308 → 4433 [SYN] Seq=0 Win=64240 Len=0 MSS=1460 SACK_PERM TSval=2169281774 TSecr=0 WS=128"
"178","21.695522205","74","1e:63:40:13:30:bc","ae:ce:e5:68:ac:e7","172.20.0.2","172.20.0.3","TCP","4433 → 35308 [SYN, ACK] Seq=0 Ack=1 Win=65160 Len=0 MSS=1460 SACK_PERM TSval=2863853711 TSecr=2169281774 WS=128"
"179","21.695545774","74","ae:ce:e5:68:ac:e7","1e:63:40:13:30:bc","172.20.0.3","172.20.0.2","TCP","[TCP Retransmission] 35308 → 4433 [SYN] Seq=0 Win=64240 Len=0 MSS=1460 SACK_PERM TSval=2169282781 TSecr=0 WS=128"
"180","21.695595513","66","ae:ce:e5:68:ac:e7","1e:63:40:13:30:bc","172.20.0.3","172.20.0.2","TCP","35308 → 4433 [ACK] Seq=1 Ack=1 Win=64256 Len=0 TSval=2169282781 TSecr=2863853711"
"181","21.695671537","1728","ae:ce:e5:68:ac:e7","1e:63:40:13:30:bc","172.20.0.3","172.20.0.2","TLSv1.2","Client Hello"
"182","21.695680896","66","1e:63:40:13:30:bc","ae:ce:e5:68:ac:e7","172.20.0.2","172.20.0.3","TCP","4433 → 35308 [ACK] Seq=1 Ack=1663 Win=64128 Len=0 TSval=2863853711 TSecr=2169282781"
"183","21.698288815","1514","1e:63:40:13:30:bc","ae:ce:e5:68:ac:e7","172.20.0.2","172.20.0.3","TLSv1.3","Server Hello, Change Cipher Spec, Application Data"
"184","21.698319059","66","ae:ce:e5:68:ac:e7","1e:63:40:13:30:bc","172.20.0.3","172.20.0.2","TCP","35308 → 4433 [ACK] Seq=1663 Ack=1449 Win=64128 Len=0 TSval=2169282783 TSecr=2863853713"
"185","21.903525042","565","1e:63:40:13:30:bc","ae:ce:e5:68:ac:e7","172.20.0.2","172.20.0.3","TLSv1.3","Application Data, Application Data, Application Data"
"186","21.903592603","66","ae:ce:e5:68:ac:e7","1e:63:40:13:30:bc","172.20.0.3","172.20.0.2","TCP","35308 → 4433 [ACK] Seq=1663 Ack=1948 Win=64128 Len=0 TSval=2169282989 TSecr=2863853919"
"187","21.906175758","146","ae:ce:e5:68:ac:e7","1e:63:40:13:30:bc","172.20.0.3","172.20.0.2","TLSv1.3","Change Cipher Spec, Application Data"
"188","21.906279144","66","ae:ce:e5:68:ac:e7","1e:63:40:13:30:bc","172.20.0.3","172.20.0.2","TCP","35308 → 4433 [RST, ACK] Seq=1743 Ack=1948 Win=64128 Len=0 TSval=2169282991 TSecr=2863853919"
"189","21.918060345","74","ae:ce:e5:68:ac:e7","1e:63:40:13:30:bc","172.20.0.3","172.20.0.2","TCP","35316 → 4433 [SYN] Seq=0 Win=64240 Len=0 MSS=1460 SACK_PERM TSval=2169283003 TSecr=0 WS=128"
"190","22.975526299","74","1e:63:40:13:30:bc","ae:ce:e5:68:ac:e7","172.20.0.2","172.20.0.3","TCP","4433 → 35316 [SYN, ACK] Seq=0 Ack=1 Win=65160 Len=0 MSS=1460 SACK_PERM TSval=2863854991 TSecr=2169283003 WS=128"
"191","22.975574044","74","ae:ce:e5:68:ac:e7","1e:63:40:13:30:bc","172.20.0.3","172.20.0.2","TCP","[TCP Retransmission] 35316 → 4433 [SYN] Seq=0 Win=64240 Len=0 MSS=1460 SACK_PERM TSval=2169284061 TSecr=0 WS=128"
"192","22.975593420","74","1e:63:40:13:30:bc","ae:ce:e5:68:ac:e7","172.20.0.2","172.20.0.3","TCP","[TCP Out-Of-Order] 4433 → 35316 [SYN, ACK] Seq=0 Ack=1 Win=65160 Len=0 MSS=1460 SACK_PERM TSval=2863854991 TSecr=2169283003 WS=128"
"193","22.975624991","66","ae:ce:e5:68:ac:e7","1e:63:40:13:30:bc","172.20.0.3","172.20.0.2","TCP","35316 → 4433 [ACK] Seq=1 Ack=1 Win=64256 Len=0 TSval=2169284061 TSecr=2863854991"
"194","22.975655791","66","ae:ce:e5:68:ac:e7","1e:63:40:13:30:bc","172.20.0.3","172.20.0.2","TCP","[TCP Dup ACK 193#1] 35316 → 4433 [ACK] Seq=1 Ack=1 Win=64256 Len=0 TSval=2169284061 TSecr=2863854991"
"195","22.975691898","1728","ae:ce:e5:68:ac:e7","1e:63:40:13:30:bc","172.20.0.3","172.20.0.2","TLSv1.2","Client Hello"
"196","22.978382676","1514","1e:63:40:13:30:bc","ae:ce:e5:68:ac:e7","172.20.0.2","172.20.0.3","TLSv1.3","Server Hello, Change Cipher Spec, Application Data"
"197","22.978417510","66","ae:ce:e5:68:ac:e7","1e:63:40:13:30:bc","172.20.0.3","172.20.0.2","TCP","35316 → 4433 [ACK] Seq=1663 Ack=1449 Win=64128 Len=0 TSval=2169284063 TSecr=2863854993"
"198","23.183494039","563","1e:63:40:13:30:bc","ae:ce:e5:68:ac:e7","172.20.0.2","172.20.0.3","TLSv1.3","Application Data, Application Data, Application Data"
"199","23.183566401","66","ae:ce:e5:68:ac:e7","1e:63:40:13:30:bc","172.20.0.3","172.20.0.2","TCP","35316 → 4433 [ACK] Seq=1663 Ack=1946 Win=64128 Len=0 TSval=2169284269 TSecr=2863855199"
"200","23.186033436","146","ae:ce:e5:68:ac:e7","1e:63:40:13:30:bc","172.20.0.3","172.20.0.2","TLSv1.3","Change Cipher Spec, Application Data"
"201","23.186102832","66","ae:ce:e5:68:ac:e7","1e:63:40:13:30:bc","172.20.0.3","172.20.0.2","TCP","35316 → 4433 [RST, ACK] Seq=1743 Ack=1946 Win=64128 Len=0 TSval=2169284271 TSecr=2863855199"
"202","23.197937072","74","ae:ce:e5:68:ac:e7","1e:63:40:13:30:bc","172.20.0.3","172.20.0.2","TCP","35330 → 4433 [SYN] Seq=0 Win=64240 Len=0 MSS=1460 SACK_PERM TSval=2169284283 TSecr=0 WS=128"
"203","23.197969948","74","1e:63:40:13:30:bc","ae:ce:e5:68:ac:e7","172.20.0.2","172.20.0.3","TCP","4433 → 35330 [SYN, ACK] Seq=0 Ack=1 Win=65160 Len=0 MSS=1460 SACK_PERM TSval=2863855213 TSecr=2169284283 WS=128"
"204","23.197989688","66","ae:ce:e5:68:ac:e7","1e:63:40:13:30:bc","172.20.0.3","172.20.0.2","TCP","35330 → 4433 [ACK] Seq=1 Ack=1 Win=64256 Len=0 TSval=2169284283 TSecr=2863855213"
"205","23.198043430","1728","ae:ce:e5:68:ac:e7","1e:63:40:13:30:bc","172.20.0.3","172.20.0.2","TLSv1.2","Client Hello"
"206","23.198049266","66","1e:63:40:13:30:bc","ae:ce:e5:68:ac:e7","172.20.0.2","172.20.0.3","TCP","4433 → 35330 [ACK] Seq=1 Ack=1663 Win=64128 Len=0 TSval=2863855213 TSecr=2169284283"
"207","23.200708743","2012","1e:63:40:13:30:bc","ae:ce:e5:68:ac:e7","172.20.0.2","172.20.0.3","TLSv1.3","Server Hello, Change Cipher Spec, Application Data, Application Data, Application Data, Application Data"
"208","23.200745249","66","ae:ce:e5:68:ac:e7","1e:63:40:13:30:bc","172.20.0.3","172.20.0.2","TCP","35330 → 4433 [ACK] Seq=1663 Ack=1947 Win=64128 Len=0 TSval=2169284286 TSecr=2863855216"
"209","23.203846835","146","ae:ce:e5:68:ac:e7","1e:63:40:13:30:bc","172.20.0.3","172.20.0.2","TLSv1.3","Change Cipher Spec, Application Data"
"210","23.203902573","66","ae:ce:e5:68:ac:e7","1e:63:40:13:30:bc","172.20.0.3","172.20.0.2","TCP","35330 → 4433 [RST, ACK] Seq=1743 Ack=1947 Win=64128 Len=0 TSval=2169284289 TSecr=2863855216"
"211","23.216912672","74","ae:ce:e5:68:ac:e7","1e:63:40:13:30:bc","172.20.0.3","172.20.0.2","TCP","35332 → 4433 [SYN] Seq=0 Win=64240 Len=0 MSS=1460 SACK_PERM TSval=2169284302 TSecr=0 WS=128"
"212","24.255584513","74","ae:ce:e5:68:ac:e7","1e:63:40:13:30:bc","172.20.0.3","172.20.0.2","TCP","[TCP Retransmission] 35332 → 4433 [SYN] Seq=0 Win=64240 Len=0 MSS=1460 SACK_PERM TSval=2169285341 TSecr=0 WS=128"
"213","25.279510941","74","ae:ce:e5:68:ac:e7","1e:63:40:13:30:bc","172.20.0.3","172.20.0.2","TCP","[TCP Retransmission] 35332 → 4433 [SYN] Seq=0 Win=64240 Len=0 MSS=1460 SACK_PERM TSval=2169286365 TSecr=0 WS=128"
"214","26.303535964","74","ae:ce:e5:68:ac:e7","1e:63:40:13:30:bc","172.20.0.3","172.20.0.2","TCP","[TCP Retransmission] 35332 → 4433 [SYN] Seq=0 Win=64240 Len=0 MSS=1460 SACK_PERM TSval=2169287389 TSecr=0 WS=128"
"215","26.303562536","74","1e:63:40:13:30:bc","ae:ce:e5:68:ac:e7","172.20.0.2","172.20.0.3","TCP","4433 → 35332 [SYN, ACK] Seq=0 Ack=1 Win=65160 Len=0 MSS=1460 SACK_PERM TSval=2863858319 TSecr=2169284302 WS=128"
"216","26.303598255","66","ae:ce:e5:68:ac:e7","1e:63:40:13:30:bc","172.20.0.3","172.20.0.2","TCP","35332 → 4433 [ACK] Seq=1 Ack=1 Win=64256 Len=0 TSval=2169287389 TSecr=2863858319"
"217","26.303692232","1728","ae:ce:e5:68:ac:e7","1e:63:40:13:30:bc","172.20.0.3","172.20.0.2","TLSv1.2","Client Hello"
"218","26.303699852","66","1e:63:40:13:30:bc","ae:ce:e5:68:ac:e7","172.20.0.2","172.20.0.3","TCP","4433 → 35332 [ACK] Seq=1 Ack=1663 Win=64128 Len=0 TSval=2863858319 TSecr=2169287389"
"219","26.306264391","1514","1e:63:40:13:30:bc","ae:ce:e5:68:ac:e7","172.20.0.2","172.20.0.3","TLSv1.3","Server Hello, Change Cipher Spec, Application Data"
"220","26.306297105","66","ae:ce:e5:68:ac:e7","1e:63:40:13:30:bc","172.20.0.3","172.20.0.2","TCP","35332 → 4433 [ACK] Seq=1663 Ack=1449 Win=64128 Len=0 TSval=2169287391 TSecr=2863858321"
