frame.number,frame.time_relative,frame.len,eth.src,eth.dst,ip.src,ip.dst,_ws.col.protocol,_ws.col.info
"1","0.000000000","70","02:23:5f:cc:56:81","33:33:00:00:00:02",,,"ICMPv6","Router Solicitation from 02:23:5f:cc:56:81"
"2","8.914078078","239","02:23:5f:cc:56:81","33:33:00:00:00:fb",,,"MDNS","Standard query 0x0000 PTR _ipps._tcp.local, ""QM"" question PTR _ftp._tcp.local, ""QM"" question PTR _webdav._tcp.local, ""QM"" question PTR _webdavs._tcp.local, ""QM"" question PTR _sftp-ssh._tcp.local, ""QM"" question PTR _smb._tcp.local, ""QM"" question PTR _afpovertcp._tcp.local, ""QM"" question PTR _nfs._tcp.local, ""QM"" question PTR _ipp._tcp.local, ""QM"" question PTR MONTE-VIRTUAL-MACHINE._smb._tcp.local"
"3","14.548631291","42","42:ea:98:93:ff:4e","ff:ff:ff:ff:ff:ff",,,"ARP","ARP Announcement for 172.20.0.3"
"4","14.579017805","42","42:ea:98:93:ff:4e","ff:ff:ff:ff:ff:ff",,,"ARP","Who has 172.20.0.2? Tell 172.20.0.3"
"5","14.579044372","42","fa:f5:f2:31:06:1d","42:ea:98:93:ff:4e",,,"ARP","172.20.0.2 is at fa:f5:f2:31:06:1d"
"6","14.579052057","74","42:ea:98:93:ff:4e","fa:f5:f2:31:06:1d","172.20.0.3","172.20.0.2","TCP","36948 → 4433 [SYN] Seq=0 Win=64240 Len=0 MSS=1460 SACK_PERM TSval=2167783695 TSecr=0 WS=128"
"7","14.579072035","74","fa:f5:f2:31:06:1d","42:ea:98:93:ff:4e","172.20.0.2","172.20.0.3","TCP","4433 → 36948 [SYN, ACK] Seq=0 Ack=1 Win=65160 Len=0 MSS=1460 SACK_PERM TSval=2862354625 TSecr=2167783695 WS=128"
"8","14.579088717","66","42:ea:98:93:ff:4e","fa:f5:f2:31:06:1d","172.20.0.3","172.20.0.2","TCP","36948 → 4433 [ACK] Seq=1 Ack=1 Win=64256 Len=0 TSval=2167783695 TSecr=2862354625"
"9","14.579127728","528","42:ea:98:93:ff:4e","fa:f5:f2:31:06:1d","172.20.0.3","172.20.0.2","TLSv1.2","Client Hello"
"10","14.579133774","66","fa:f5:f2:31:06:1d","42:ea:98:93:ff:4e","172.20.0.2","172.20.0.3","TCP","4433 → 36948 [ACK] Seq=1 Ack=463 Win=64768 Len=0 TSval=2862354625 TSecr=2167783695"
"11","14.579856243","736","fa:f5:f2:31:06:1d","42:ea:98:93:ff:4e","172.20.0.2","172.20.0.3","TLSv1.3","Server Hello, Change Cipher Spec, Application Data, Application Data, Application Data, Application Data"
"12","14.579885859","66","42:ea:98:93:ff:4e","fa:f5:f2:31:06:1d","172.20.0.3","172.20.0.2","TCP","36948 → 4433 [ACK] Seq=463 Ack=671 Win=63616 Len=0 TSval=2167783696 TSecr=2862354626"
"13","14.580638243","146","42:ea:98:93:ff:4e","fa:f5:f2:31:06:1d","172.20.0.3","172.20.0.2","TLSv1.3","Change Cipher Spec, Application Data"
"14","14.580699558","66","42:ea:98:93:ff:4e","fa:f5:f2:31:06:1d","172.20.0.3","172.20.0.2","TCP","36948 → 4433 [RST, ACK] Seq=543 Ack=671 Win=63616 Len=0 TSval=2167783696 TSecr=2862354626"
"15","14.591828505","74","42:ea:98:93:ff:4e","fa:f5:f2:31:06:1d","172.20.0.3","172.20.0.2","TCP","36954 → 4433 [SYN] Seq=0 Win=64240 Len=0 MSS=1460 SACK_PERM TSval=2167783707 TSecr=0 WS=128"
"16","14.591855653","74","fa:f5:f2:31:06:1d","42:ea:98:93:ff:4e","172.20.0.2","172.20.0.3","TCP","4433 → 36954 [SYN, ACK] Seq=0 Ack=1 Win=65160 Len=0 MSS=1460 SACK_PERM TSval=2862354638 TSecr=2167783707 WS=128"
"17","14.591873210","66","42:ea:98:93:ff:4e","fa:f5:f2:31:06:1d","172.20.0.3","172.20.0.2","TCP","36954 → 4433 [ACK] Seq=1 Ack=1 Win=64256 Len=0 TSval=2167783708 TSecr=2862354638"
"18","14.591914675","528","42:ea:98:93:ff:4e","fa:f5:f2:31:06:1d","172.20.0.3","172.20.0.2","TLSv1.2","Client Hello"
"19","14.591919935","66","fa:f5:f2:31:06:1d","42:ea:98:93:ff:4e","172.20.0.2","172.20.0.3","TCP","4433 → 36954 [ACK] Seq=1 Ack=463 Win=64768 Len=0 TSval=2862354638 TSecr=2167783708"
"20","14.592415512","736","fa:f5:f2:31:06:1d","42:ea:98:93:ff:4e","172.20.0.2","172.20.0.3","TLSv1.3","Server Hello, Change Cipher Spec, Application Data, Application Data, Application Data, Application Data"
"21","14.592458012","66","42:ea:98:93:ff:4e","fa:f5:f2:31:06:1d","172.20.0.3","172.20.0.2","TCP","36954 → 4433 [ACK] Seq=463 Ack=671 Win=63616 Len=0 TSval=2167783708 TSecr=2862354638"
"22","14.593270524","146","42:ea:98:93:ff:4e","fa:f5:f2:31:06:1d","172.20.0.3","172.20.0.2","TLSv1.3","Change Cipher Spec, Application Data"
"23","14.593328555","66","42:ea:98:93:ff:4e","fa:f5:f2:31:06:1d","172.20.0.3","172.20.0.2","TCP","36954 → 4433 [RST, ACK] Seq=543 Ack=671 Win=63616 Len=0 TSval=2167783709 TSecr=2862354638"
"24","14.604590380","74","42:ea:98:93:ff:4e","fa:f5:f2:31:06:1d","172.20.0.3","172.20.0.2","TCP","36962 → 4433 [SYN] Seq=0 Win=64240 Len=0 MSS=1460 SACK_PERM TSval=2167783720 TSecr=0 WS=128"
"25","14.604613547","74","fa:f5:f2:31:06:1d","42:ea:98:93:ff:4e","172.20.0.2","172.20.0.3","TCP","4433 → 36962 [SYN, ACK] Seq=0 Ack=1 Win=65160 Len=0 MSS=1460 SACK_PERM TSval=2862354650 TSecr=2167783720 WS=128"
"26","14.604629673","66","42:ea:98:93:ff:4e","fa:f5:f2:31:06:1d","172.20.0.3","172.20.0.2","TCP","36962 → 4433 [ACK] Seq=1 Ack=1 Win=64256 Len=0 TSval=2167783720 TSecr=2862354650"
"27","14.604672058","528","42:ea:98:93:ff:4e","fa:f5:f2:31:06:1d","172.20.0.3","172.20.0.2","TLSv1.2","Client Hello"
"28","14.605173974","736","fa:f5:f2:31:06:1d","42:ea:98:93:ff:4e","172.20.0.2","172.20.0.3","TLSv1.3","Server Hello, Change Cipher Spec, Application Data, Application Data, Application Data, Application Data"
"29","14.605205171","66","42:ea:98:93:ff:4e","fa:f5:f2:31:06:1d","172.20.0.3","172.20.0.2","TCP","36962 → 4433 [ACK] Seq=463 Ack=671 Win=63616 Len=0 TSval=2167783721 TSecr=2862354651"
"30","14.606035874","146","42:ea:98:93:ff:4e","fa:f5:f2:31:06:1d","172.20.0.3","172.20.0.2","TLSv1.3","Change Cipher Spec, Application Data"
"31","14.606098492","66","42:ea:98:93:ff:4e","fa:f5:f2:31:06:1d","172.20.0.3","172.20.0.2","TCP","36962 → 4433 [RST, ACK] Seq=543 Ack=671 Win=63616 Len=0 TSval=2167783722 TSecr=2862354651"
"32","14.617369593","74","42:ea:98:93:ff:4e","fa:f5:f2:31:06:1d","172.20.0.3","172.20.0.2","TCP","36978 → 4433 [SYN] Seq=0 Win=64240 Len=0 MSS=1460 SACK_PERM TSval=2167783733 TSecr=0 WS=128"
"33","14.617395614","74","fa:f5:f2:31:06:1d","42:ea:98:93:ff:4e","172.20.0.2","172.20.0.3","TCP","4433 → 36978 [SYN, ACK] Seq=0 Ack=1 Win=65160 Len=0 MSS=1460 SACK_PERM TSval=2862354663 TSecr=2167783733 WS=128"
"34","14.617413709","66","42:ea:98:93:ff:4e","fa:f5:f2:31:06:1d","172.20.0.3","172.20.0.2","TCP","36978 → 4433 [ACK] Seq=1 Ack=1 Win=64256 Len=0 TSval=2167783733 TSecr=2862354663"
"35","14.617467268","528","42:ea:98:93:ff:4e","fa:f5:f2:31:06:1d","172.20.0.3","172.20.0.2","TLSv1.2","Client Hello"
"36","14.617472768","66","fa:f5:f2:31:06:1d","42:ea:98:93:ff:4e","172.20.0.2","172.20.0.3","TCP","4433 → 36978 [ACK] Seq=1 Ack=463 Win=64768 Len=0 TSval=2862354663 TSecr=2167783733"
"37","14.617999848","736","fa:f5:f2:31:06:1d","42:ea:98:93:ff:4e","172.20.0.2","172.20.0.3","TLSv1.3","Server Hello, Change Cipher Spec, Application Data, Application Data, Application Data, Application Data"
"38","14.618032559","66","42:ea:98:93:ff:4e","fa:f5:f2:31:06:1d","172.20.0.3","172.20.0.2","TCP","36978 → 4433 [ACK] Seq=463 Ack=671 Win=63616 Len=0 TSval=2167783734 TSecr=2862354664"
"39","14.618877842","146","42:ea:98:93:ff:4e","fa:f5:f2:31:06:1d","172.20.0.3","172.20.0.2","TLSv1.3","Change Cipher Spec, Application Data"
"40","14.618940544","66","42:ea:98:93:ff:4e","fa:f5:f2:31:06:1d","172.20.0.3","172.20.0.2","TCP","36978 → 4433 [RST, ACK] Seq=543 Ack=671 Win=63616 Len=0 TSval=2167783735 TSecr=2862354664"
"41","14.630580508","74","42:ea:98:93:ff:4e","fa:f5:f2:31:06:1d","172.20.0.3","172.20.0.2","TCP","36988 → 4433 [SYN] Seq=0 Win=64240 Len=0 MSS=1460 SACK_PERM TSval=2167783746 TSecr=0 WS=128"
"42","15.549626781","42","42:ea:98:93:ff:4e","ff:ff:ff:ff:ff:ff",,,"ARP","ARP Announcement for 172.20.0.3"
"43","15.680859481","74","fa:f5:f2:31:06:1d","42:ea:98:93:ff:4e","172.20.0.2","172.20.0.3","TCP","4433 → 36988 [SYN, ACK] Seq=0 Ack=1 Win=65160 Len=0 MSS=1460 SACK_PERM TSval=2862355727 TSecr=2167783746 WS=128"
"44","15.680889515","74","42:ea:98:93:ff:4e","fa:f5:f2:31:06:1d","172.20.0.3","172.20.0.2","TCP","[TCP Retransmission] 36988 → 4433 [SYN] Seq=0 Win=64240 Len=0 MSS=1460 SACK_PERM TSval=2167784797 TSecr=0 WS=128"
"45","15.680903225","74","fa:f5:f2:31:06:1d","42:ea:98:93:ff:4e","172.20.0.2","172.20.0.3","TCP","[TCP Retransmission] 4433 → 36988 [SYN, ACK] Seq=0 Ack=1 Win=65160 Len=0 MSS=1460 SACK_PERM TSval=2862355727 TSecr=2167783746 WS=128"
"46","15.680939357","66","42:ea:98:93:ff:4e","fa:f5:f2:31:06:1d","172.20.0.3","172.20.0.2","TCP","36988 → 4433 [ACK] Seq=1 Ack=1 Win=64256 Len=0 TSval=2167784797 TSecr=2862355727"
"47","15.680969511","66","42:ea:98:93:ff:4e","fa:f5:f2:31:06:1d","172.20.0.3","172.20.0.2","TCP","[TCP Dup ACK 46#1] 36988 → 4433 [ACK] Seq=1 Ack=1 Win=64256 Len=0 TSval=2167784797 TSecr=2862355727"
"48","15.681026977","528","42:ea:98:93:ff:4e","fa:f5:f2:31:06:1d","172.20.0.3","172.20.0.2","TLSv1.2","Client Hello"
"49","15.681041125","66","fa:f5:f2:31:06:1d","42:ea:98:93:ff:4e","172.20.0.2","172.20.0.3","TCP","4433 → 36988 [ACK] Seq=1 Ack=463 Win=64768 Len=0 TSval=2862355727 TSecr=2167784797"
"50","15.681555922","736","fa:f5:f2:31:06:1d","42:ea:98:93:ff:4e","172.20.0.2","172.20.0.3","TLSv1.3","Server Hello, Change Cipher Spec, Application Data, Application Data, Application Data, Application Data"
"51","15.681583717","66","42:ea:98:93:ff:4e","fa:f5:f2:31:06:1d","172.20.0.3","172.20.0.2","TCP","36988 → 4433 [ACK] Seq=463 Ack=671 Win=63616 Len=0 TSval=2167784797 TSecr=2862355727"
"52","15.682507478","146","42:ea:98:93:ff:4e","fa:f5:f2:31:06:1d","172.20.0.3","172.20.0.2","TLSv1.3","Change Cipher Spec, Application Data"
"53","15.682572509","66","42:ea:98:93:ff:4e","fa:f5:f2:31:06:1d","172.20.0.3","172.20.0.2","TCP","36988 → 4433 [RST, ACK] Seq=543 Ack=671 Win=63616 Len=0 TSval=2167784798 TSecr=2862355727"
"54","15.694568010","74","42:ea:98:93:ff:4e","fa:f5:f2:31:06:1d","172.20.0.3","172.20.0.2","TCP","36996 → 4433 [SYN] Seq=0 Win=64240 Len=0 MSS=1460 SACK_PERM TSval=2167784810 TSecr=0 WS=128"
"55","15.694600903","74","fa:f5:f2:31:06:1d","42:ea:98:93:ff:4e","172.20.0.2","172.20.0.3","TCP","4433 → 36996 [SYN, ACK] Seq=0 Ack=1 Win=65160 Len=0 MSS=1460 SACK_PERM TSval=2862355740 TSecr=2167784810 WS=128"
"56","15.694625614","66","42:ea:98:93:ff:4e","fa:f5:f2:31:06:1d","172.20.0.3","172.20.0.2","TCP","36996 → 4433 [ACK] Seq=1 Ack=1 Win=64256 Len=0 TSval=2167784810 TSecr=2862355740"
"57","15.694681352","528","42:ea:98:93:ff:4e","fa:f5:f2:31:06:1d","172.20.0.3","172.20.0.2","TLSv1.2","Client Hello"
"58","15.694690837","66","fa:f5:f2:31:06:1d","42:ea:98:93:ff:4e","172.20.0.2","172.20.0.3","TCP","4433 → 36996 [ACK] Seq=1 Ack=463 Win=64768 Len=0 TSval=2862355740 TSecr=2167784810"
"59","15.695384608","736","fa:f5:f2:31:06:1d","42:ea:98:93:ff:4e","172.20.0.2","172.20.0.3","TLSv1.3","Server Hello, Change Cipher Spec, Application Data, Application Data, Application Data, Application Data"
"60","15.695422886","66","42:ea:98:93:ff:4e","fa:f5:f2:31:06:1d","172.20.0.3","172.20.0.2","TCP","36996 → 4433 [ACK] Seq=463 Ack=671 Win=63616 Len=0 TSval=2167784811 TSecr=2862355741"
"61","15.696223483","146","42:ea:98:93:ff:4e","fa:f5:f2:31:06:1d","172.20.0.3","172.20.0.2","TLSv1.3","Change Cipher Spec, Application Data"
"62","15.696279926","66","42:ea:98:93:ff:4e","fa:f5:f2:31:06:1d","172.20.0.3","172.20.0.2","TCP","36996 → 4433 [RST, ACK] Seq=543 Ack=671 Win=63616 Len=0 TSval=2167784812 TSecr=2862355741"
"63","15.707512088","74","42:ea:98:93:ff:4e","fa:f5:f2:31:06:1d","172.20.0.3","172.20.0.2","TCP","37010 → 4433 [SYN] Seq=0 Win=64240 Len=0 MSS=1460 SACK_PERM TSval=2167784823 TSecr=0 WS=128"
"64","15.707538040","74","fa:f5:f2:31:06:1d","42:ea:98:93:ff:4e","172.20.0.2","172.20.0.3","TCP","4433 → 37010 [SYN, ACK] Seq=0 Ack=1 Win=65160 Len=0 MSS=1460 SACK_PERM TSval=2862355753 TSecr=2167784823 WS=128"
"65","15.707555677","66","42:ea:98:93:ff:4e","fa:f5:f2:31:06:1d","172.20.0.3","172.20.0.2","TCP","37010 → 4433 [ACK] Seq=1 Ack=1 Win=64256 Len=0 TSval=2167784823 TSecr=2862355753"
"66","15.707606305","528","42:ea:98:93:ff:4e","fa:f5:f2:31:06:1d","172.20.0.3","172.20.0.2","TLSv1.2","Client Hello"
"67","15.912840623","528","42:ea:98:93:ff:4e","fa:f5:f2:31:06:1d","172.20.0.3","172.20.0.2","TCP","[TCP Retransmission] 37010 → 4433 [PSH, ACK] Seq=1 Ack=1 Win=64256 Len=462 TSval=2167785029 TSecr=2862355753"
"68","16.120850360","528","42:ea:98:93:ff:4e","fa:f5:f2:31:06:1d","172.20.0.3","172.20.0.2","TCP","[TCP Retransmission] 37010 → 4433 [PSH, ACK] Seq=1 Ack=1 Win=64256 Len=462 TSval=2167785237 TSecr=2862355753"
"69","16.120871867","78","fa:f5:f2:31:06:1d","42:ea:98:93:ff:4e","172.20.0.2","172.20.0.3","TCP","[TCP Previous segment not captured] 4433 → 37010 [ACK] Seq=671 Ack=463 Win=64768 Len=0 TSval=2862356167 TSecr=2167785237 SLE=1 SRE=463"
"70","16.528830615","736","fa:f5:f2:31:06:1d","42:ea:98:93:ff:4e","172.20.0.2","172.20.0.3","TCP","[TCP Retransmission] 4433 → 37010 [PSH, ACK] Seq=1 Ack=463 Win=64768 Len=670 TSval=2862356575 TSecr=2167785237"
"71","16.528886852","66","42:ea:98:93:ff:4e","fa:f5:f2:31:06:1d","172.20.0.3","172.20.0.2","TCP","37010 → 4433 [ACK] Seq=463 Ack=671 Win=63616 Len=0 TSval=2167785645 TSecr=2862356575"
"72","16.529922779","146","42:ea:98:93:ff:4e","fa:f5:f2:31:06:1d","172.20.0.3","172.20.0.2","TLSv1.2","Change Cipher Spec, Application Data"
"73","16.529944695","66","fa:f5:f2:31:06:1d","42:ea:98:93:ff:4e","172.20.0.2","172.20.0.3","TCP","4433 → 37010 [ACK] Seq=671 Ack=543 Win=64768 Len=0 TSval=2862356576 TSecr=2167785646"
"74","16.530007219","66","42:ea:98:93:ff:4e","fa:f5:f2:31:06:1d","172.20.0.3","172.20.0.2","TCP","37010 → 4433 [RST, ACK] Seq=543 Ack=671 Win=63616 Len=0 TSval=2167785646 TSecr=2862356576"
"75","16.542508336","74","42:ea:98:93:ff:4e","fa:f5:f2:31:06:1d","172.20.0.3","172.20.0.2","TCP","37018 → 4433 [SYN] Seq=0 Win=64240 Len=0 MSS=1460 SACK_PERM TSval=2167785658 TSecr=0 WS=128"
"76","16.542537369","74","fa:f5:f2:31:06:1d","42:ea:98:93:ff:4e","172.20.0.2","172.20.0.3","TCP","4433 → 37018 [SYN, ACK] Seq=0 Ack=1 Win=65160 Len=0 MSS=1460 SACK_PERM TSval=2862356588 TSecr=2167785658 WS=128"
"77","16.542556209","66","42:ea:98:93:ff:4e","fa:f5:f2:31:06:1d","172.20.0.3","172.20.0.2","TCP","37018 → 4433 [ACK] Seq=1 Ack=1 Win=64256 Len=0 TSval=2167785658 TSecr=2862356588"
"78","16.542603182","528","42:ea:98:93:ff:4e","fa:f5:f2:31:06:1d","172.20.0.3","172.20.0.2","TLSv1.2","Client Hello"
"79","16.542622602","66","fa:f5:f2:31:06:1d","42:ea:98:93:ff:4e","172.20.0.2","172.20.0.3","TCP","4433 → 37018 [ACK] Seq=1 Ack=463 Win=64768 Len=0 TSval=2862356588 TSecr=2167785658"
"80","16.543147132","736","fa:f5:f2:31:06:1d","42:ea:98:93:ff:4e","172.20.0.2","172.20.0.3","TLSv1.3","Server Hello, Change Cipher Spec, Application Data, Application Data, Application Data, Application Data"
"81","16.543168211","66","42:ea:98:93:ff:4e","fa:f5:f2:31:06:1d","172.20.0.3","172.20.0.2","TCP","37018 → 4433 [ACK] Seq=463 Ack=671 Win=63616 Len=0 TSval=2167785659 TSecr=2862356589"
"82","16.544089680","146","42:ea:98:93:ff:4e","fa:f5:f2:31:06:1d","172.20.0.3","172.20.0.2","TLSv1.3","Change Cipher Spec, Application Data"
"83","16.544148657","66","42:ea:98:93:ff:4e","fa:f5:f2:31:06:1d","172.20.0.3","172.20.0.2","TCP","37018 → 4433 [RST, ACK] Seq=543 Ack=671 Win=63616 Len=0 TSval=2167785660 TSecr=2862356589"
"84","16.549090354","42","42:ea:98:93:ff:4e","ff:ff:ff:ff:ff:ff",,,"ARP","ARP Announcement for 172.20.0.3"
"85","16.555917884","74","42:ea:98:93:ff:4e","fa:f5:f2:31:06:1d","172.20.0.3","172.20.0.2","TCP","37020 → 4433 [SYN] Seq=0 Win=64240 Len=0 MSS=1460 SACK_PERM TSval=2167785672 TSecr=0 WS=128"
"86","16.555952313","74","fa:f5:f2:31:06:1d","42:ea:98:93:ff:4e","172.20.0.2","172.20.0.3","TCP","4433 → 37020 [SYN, ACK] Seq=0 Ack=1 Win=65160 Len=0 MSS=1460 SACK_PERM TSval=2862356602 TSecr=2167785672 WS=128"
"87","16.555977963","66","42:ea:98:93:ff:4e","fa:f5:f2:31:06:1d","172.20.0.3","172.20.0.2","TCP","37020 → 4433 [ACK] Seq=1 Ack=1 Win=64256 Len=0 TSval=2167785672 TSecr=2862356602"
"88","16.556031810","528","42:ea:98:93:ff:4e","fa:f5:f2:31:06:1d","172.20.0.3","172.20.0.2","TLSv1.2","Client Hello"
"89","16.556511219","736","fa:f5:f2:31:06:1d","42:ea:98:93:ff:4e","172.20.0.2","172.20.0.3","TLSv1.3","Server Hello, Change Cipher Spec, Application Data, Application Data, Application Data, Application Data"
"90","16.556547934","66","42:ea:98:93:ff:4e","fa:f5:f2:31:06:1d","172.20.0.3","172.20.0.2","TCP","37020 → 4433 [ACK] Seq=463 Ack=671 Win=63616 Len=0 TSval=2167785672 TSecr=2862356602"
"91","16.557366860","146","42:ea:98:93:ff:4e","fa:f5:f2:31:06:1d","172.20.0.3","172.20.0.2","TLSv1.3","Change Cipher Spec, Application Data"
"92","16.557424950","66","42:ea:98:93:ff:4e","fa:f5:f2:31:06:1d","172.20.0.3","172.20.0.2","TCP","37020 → 4433 [RST, ACK] Seq=543 Ack=671 Win=63616 Len=0 TSval=2167785673 TSecr=2862356602"
"93","16.568891138","74","42:ea:98:93:ff:4e","fa:f5:f2:31:06:1d","172.20.0.3","172.20.0.2","TCP","37032 → 4433 [SYN] Seq=0 Win=64240 Len=0 MSS=1460 SACK_PERM TSval=2167785685 TSecr=0 WS=128"
"94","17.600893747","74","42:ea:98:93:ff:4e","fa:f5:f2:31:06:1d","172.20.0.3","172.20.0.2","TCP","[TCP Retransmission] 37032 → 4433 [SYN] Seq=0 Win=64240 Len=0 MSS=1460 SACK_PERM TSval=2167786717 TSecr=0 WS=128"
"95","17.600908380","74","fa:f5:f2:31:06:1d","42:ea:98:93:ff:4e","172.20.0.2","172.20.0.3","TCP","4433 → 37032 [SYN, ACK] Seq=0 Ack=1 Win=65160 Len=0 MSS=1460 SACK_PERM TSval=2862357647 TSecr=2167785685 WS=128"
"96","17.600944918","66","42:ea:98:93:ff:4e","fa:f5:f2:31:06:1d","172.20.0.3","172.20.0.2","TCP","37032 → 4433 [ACK] Seq=1 Ack=1 Win=64256 Len=0 TSval=2167786717 TSecr=2862357647"
"97","17.601038646","528","42:ea:98:93:ff:4e","fa:f5:f2:31:06:1d","172.20.0.3","172.20.0.2","TLSv1.2","Client Hello"
"98","17.808833846","736","fa:f5:f2:31:06:1d","42:ea:98:93:ff:4e","172.20.0.2","172.20.0.3","TLSv1.3","Server Hello, Change Cipher Spec, Application Data, Application Data, Application Data, Application Data"
"99","17.808930724","66","42:ea:98:93:ff:4e","fa:f5:f2:31:06:1d","172.20.0.3","172.20.0.2","TCP","37032 → 4433 [ACK] Seq=463 Ack=671 Win=63616 Len=0 TSval=2167786925 TSecr=2862357855"
"100","17.810037435","146","42:ea:98:93:ff:4e","fa:f5:f2:31:06:1d","172.20.0.3","172.20.0.2","TLSv1.3","Change Cipher Spec, Application Data"
"101","17.810132514","66","42:ea:98:93:ff:4e","fa:f5:f2:31:06:1d","172.20.0.3","172.20.0.2","TCP","37032 → 4433 [RST, ACK] Seq=543 Ack=671 Win=63616 Len=0 TSval=2167786926 TSecr=2862357855"
"102","17.822725810","74","42:ea:98:93:ff:4e","fa:f5:f2:31:06:1d","172.20.0.3","172.20.0.2","TCP","39668 → 4433 [SYN] Seq=0 Win=64240 Len=0 MSS=1460 SACK_PERM TSval=2167786938 TSecr=0 WS=128"
"103","17.822753258","74","fa:f5:f2:31:06:1d","42:ea:98:93:ff:4e","172.20.0.2","172.20.0.3","TCP","4433 → 39668 [SYN, ACK] Seq=0 Ack=1 Win=65160 Len=0 MSS=1460 SACK_PERM TSval=2862357868 TSecr=2167786938 WS=128"
"104","17.822770994","66","42:ea:98:93:ff:4e","fa:f5:f2:31:06:1d","172.20.0.3","172.20.0.2","TCP","39668 → 4433 [ACK] Seq=1 Ack=1 Win=64256 Len=0 TSval=2167786938 TSecr=2862357868"
"105","17.822822769","528","42:ea:98:93:ff:4e","fa:f5:f2:31:06:1d","172.20.0.3","172.20.0.2","TLSv1.2","Client Hello"
"106","17.822829778","66","fa:f5:f2:31:06:1d","42:ea:98:93:ff:4e","172.20.0.2","172.20.0.3","TCP","4433 → 39668 [ACK] Seq=1 Ack=463 Win=64768 Len=0 TSval=2862357869 TSecr=2167786939"
"107","17.823319688","736","fa:f5:f2:31:06:1d","42:ea:98:93:ff:4e","172.20.0.2","172.20.0.3","TLSv1.3","Server Hello, Change Cipher Spec, Application Data, Application Data, Application Data, Application Data"
"108","17.823371776","66","42:ea:98:93:ff:4e","fa:f5:f2:31:06:1d","172.20.0.3","172.20.0.2","TCP","39668 → 4433 [ACK] Seq=463 Ack=671 Win=63616 Len=0 TSval=2167786939 TSecr=2862357869"
"109","17.824198813","146","42:ea:98:93:ff:4e","fa:f5:f2:31:06:1d","172.20.0.3","172.20.0.2","TLSv1.3","Change Cipher Spec, Application Data"
"110","17.824260955","66","42:ea:98:93:ff:4e","fa:f5:f2:31:06:1d","172.20.0.3","172.20.0.2","TCP","39668 → 4433 [RST, ACK] Seq=543 Ack=671 Win=63616 Len=0 TSval=2167786940 TSecr=2862357869"
"111","17.836286598","74","42:ea:98:93:ff:4e","fa:f5:f2:31:06:1d","172.20.0.3","172.20.0.2","TCP","39672 → 4433 [SYN] Seq=0 Win=64240 Len=0 MSS=1460 SACK_PERM TSval=2167786952 TSecr=0 WS=128"
"112","18.880882108","74","fa:f5:f2:31:06:1d","42:ea:98:93:ff:4e","172.20.0.2","172.20.0.3","TCP","4433 → 39672 [SYN, ACK] Seq=0 Ack=1 Win=65160 Len=0 MSS=1460 SACK_PERM TSval=2862358927 TSecr=2167786952 WS=128"
"113","18.880925183","74","42:ea:98:93:ff:4e","fa:f5:f2:31:06:1d","172.20.0.3","172.20.0.2","TCP","[TCP Retransmission] 39672 → 4433 [SYN] Seq=0 Win=64240 Len=0 MSS=1460 SACK_PERM TSval=2167787997 TSecr=0 WS=128"
"114","18.880946558","74","fa:f5:f2:31:06:1d","42:ea:98:93:ff:4e","172.20.0.2","172.20.0.3","TCP","[TCP Retransmission] 4433 → 39672 [SYN, ACK] Seq=0 Ack=1 Win=65160 Len=0 MSS=1460 SACK_PERM TSval=2862358927 TSecr=2167786952 WS=128"
"115","18.880997689","66","42:ea:98:93:ff:4e","fa:f5:f2:31:06:1d","172.20.0.3","172.20.0.2","TCP","39672 → 4433 [ACK] Seq=1 Ack=1 Win=64256 Len=0 TSval=2167787997 TSecr=2862358927"
"116","18.881053642","66","42:ea:98:93:ff:4e","fa:f5:f2:31:06:1d","172.20.0.3","172.20.0.2","TCP","[TCP Dup ACK 115#1] 39672 → 4433 [ACK] Seq=1 Ack=1 Win=64256 Len=0 TSval=2167787997 TSecr=2862358927"
"117","18.881135277","528","42:ea:98:93:ff:4e","fa:f5:f2:31:06:1d","172.20.0.3","172.20.0.2","TLSv1.2","Client Hello"
"118","18.881145716","66","fa:f5:f2:31:06:1d","42:ea:98:93:ff:4e","172.20.0.2","172.20.0.3","TCP","4433 → 39672 [ACK] Seq=1 Ack=463 Win=64768 Len=0 TSval=2862358927 TSecr=2167787997"
"119","18.881644990","736","fa:f5:f2:31:06:1d","42:ea:98:93:ff:4e","172.20.0.2","172.20.0.3","TLSv1.3","Server Hello, Change Cipher Spec, Application Data, Application Data, Application Data, Application Data"
"120","18.881681279","66","42:ea:98:93:ff:4e","fa:f5:f2:31:06:1d","172.20.0.3","172.20.0.2","TCP","39672 → 4433 [ACK] Seq=463 Ack=671 Win=63616 Len=0 TSval=2167787997 TSecr=2862358927"
"121","18.883363597","146","42:ea:98:93:ff:4e","fa:f5:f2:31:06:1d","172.20.0.3","172.20.0.2","TLSv1.3","Change Cipher Spec, Application Data"
"122","18.883463448","66","42:ea:98:93:ff:4e","fa:f5:f2:31:06:1d","172.20.0.3","172.20.0.2","TCP","39672 → 4433 [RST, ACK] Seq=543 Ack=671 Win=63616 Len=0 TSval=2167787999 TSecr=2862358927"
"123","18.895589041","74","42:ea:98:93:ff:4e","fa:f5:f2:31:06:1d","172.20.0.3","172.20.0.2","TCP","39676 → 4433 [SYN] Seq=0 Win=64240 Len=0 MSS=1460 SACK_PERM TSval=2167788011 TSecr=0 WS=128"
"124","18.895616584","74","fa:f5:f2:31:06:1d","42:ea:98:93:ff:4e","172.20.0.2","172.20.0.3","TCP","4433 → 39676 [SYN, ACK] Seq=0 Ack=1 Win=65160 Len=0 MSS=1460 SACK_PERM TSval=2862358941 TSecr=2167788011 WS=128"
"125","18.895633884","66","42:ea:98:93:ff:4e","fa:f5:f2:31:06:1d","172.20.0.3","172.20.0.2","TCP","39676 → 4433 [ACK] Seq=1 Ack=1 Win=64256 Len=0 TSval=2167788011 TSecr=2862358941"
"126","18.895681223","528","42:ea:98:93:ff:4e","fa:f5:f2:31:06:1d","172.20.0.3","172.20.0.2","TLSv1.2","Client Hello"
"127","18.895698496","66","fa:f5:f2:31:06:1d","42:ea:98:93:ff:4e","172.20.0.2","172.20.0.3","TCP","4433 → 39676 [ACK] Seq=1 Ack=463 Win=64768 Len=0 TSval=2862358941 TSecr=2167788011"
"128","19.104832475","736","fa:f5:f2:31:06:1d","42:ea:98:93:ff:4e","172.20.0.2","172.20.0.3","TLSv1.3","Server Hello, Change Cipher Spec, Application Data, Application Data, Application Data, Application Data"
"129","19.104904048","66","42:ea:98:93:ff:4e","fa:f5:f2:31:06:1d","172.20.0.3","172.20.0.2","TCP","39676 → 4433 [ACK] Seq=463 Ack=671 Win=63616 Len=0 TSval=2167788221 TSecr=2862359151"
"130","19.105956507","146","42:ea:98:93:ff:4e","fa:f5:f2:31:06:1d","172.20.0.3","172.20.0.2","TLSv1.3","Change Cipher Spec, Application Data"
"131","19.106030731","66","42:ea:98:93:ff:4e","fa:f5:f2:31:06:1d","172.20.0.3","172.20.0.2","TCP","39676 → 4433 [RST, ACK] Seq=543 Ack=671 Win=63616 Len=0 TSval=2167788222 TSecr=2862359151"
"132","19.117837980","74","42:ea:98:93:ff:4e","fa:f5:f2:31:06:1d","172.20.0.3","172.20.0.2","TCP","39682 → 4433 [SYN] Seq=0 Win=64240 Len=0 MSS=1460 SACK_PERM TSval=2167788233 TSecr=0 WS=128"
"133","19.117866607","74","fa:f5:f2:31:06:1d","42:ea:98:93:ff:4e","172.20.0.2","172.20.0.3","TCP","4433 → 39682 [SYN, ACK] Seq=0 Ack=1 Win=65160 Len=0 MSS=1460 SACK_PERM TSval=2862359164 TSecr=2167788233 WS=128"
"134","19.117884085","66","42:ea:98:93:ff:4e","fa:f5:f2:31:06:1d","172.20.0.3","172.20.0.2","TCP","39682 → 4433 [ACK] Seq=1 Ack=1 Win=64256 Len=0 TSval=2167788234 TSecr=2862359164"
"135","19.117935244","528","42:ea:98:93:ff:4e","fa:f5:f2:31:06:1d","172.20.0.3","172.20.0.2","TLSv1.2","Client Hello"
"136","19.118420154","736","fa:f5:f2:31:06:1d","42:ea:98:93:ff:4e","172.20.0.2","172.20.0.3","TLSv1.3","Server Hello, Change Cipher Spec, Application Data, Application Data, Application Data, Application Data"
"137","19.118453429","66","42:ea:98:93:ff:4e","fa:f5:f2:31:06:1d","172.20.0.3","172.20.0.2","TCP","39682 → 4433 [ACK] Seq=463 Ack=671 Win=63616 Len=0 TSval=2167788234 TSecr=2862359164"
"138","19.119260024","146","42:ea:98:93:ff:4e","fa:f5:f2:31:06:1d","172.20.0.3","172.20.0.2","TLSv1.3","Change Cipher Spec, Application Data"
"139","19.119319885","66","42:ea:98:93:ff:4e","fa:f5:f2:31:06:1d","172.20.0.3","172.20.0.2","TCP","39682 → 4433 [RST, ACK] Seq=543 Ack=671 Win=63616 Len=0 TSval=2167788235 TSecr=2862359164"
"140","19.130390721","74","42:ea:98:93:ff:4e","fa:f5:f2:31:06:1d","172.20.0.3","172.20.0.2","TCP","39688 → 4433 [SYN] Seq=0 Win=64240 Len=0 MSS=1460 SACK_PERM TSval=2167788246 TSecr=0 WS=128"
"141","19.130418119","74","fa:f5:f2:31:06:1d","42:ea:98:93:ff:4e","172.20.0.2","172.20.0.3","TCP","4433 → 39688 [SYN, ACK] Seq=0 Ack=1 Win=65160 Len=0 MSS=1460 SACK_PERM TSval=2862359176 TSecr=2167788246 WS=128"
"142","19.130435112","66","42:ea:98:93:ff:4e","fa:f5:f2:31:06:1d","172.20.0.3","172.20.0.2","TCP","39688 → 4433 [ACK] Seq=1 Ack=1 Win=64256 Len=0 TSval=2167788246 TSecr=2862359176"
"143","19.130478830","528","42:ea:98:93:ff:4e","fa:f5:f2:31:06:1d","172.20.0.3","172.20.0.2","TLSv1.2","Client Hello"
"144","19.130484809","66","fa:f5:f2:31:06:1d","42:ea:98:93:ff:4e","172.20.0.2","172.20.0.3","TCP","4433 → 39688 [ACK] Seq=1 Ack=463 Win=64768 Len=0 TSval=2862359176 TSecr=2167788246"
"145","19.130965811","736","fa:f5:f2:31:06:1d","42:ea:98:93:ff:4e","172.20.0.2","172.20.0.3","TLSv1.3","Server Hello, Change Cipher Spec, Application Data, Application Data, Application Data, Application Data"
"146","19.130994890","66","42:ea:98:93:ff:4e","fa:f5:f2:31:06:1d","172.20.0.3","172.20.0.2","TCP","39688 → 4433 [ACK] Seq=463 Ack=671 Win=63616 Len=0 TSval=2167788247 TSecr=2862359177"
"147","19.131835018","146","42:ea:98:93:ff:4e","fa:f5:f2:31:06:1d","172.20.0.3","172.20.0.2","TLSv1.3","Change Cipher Spec, Application Data"
"148","19.131893299","66","42:ea:98:93:ff:4e","fa:f5:f2:31:06:1d","172.20.0.3","172.20.0.2","TCP","39688 → 4433 [RST, ACK] Seq=543 Ack=671 Win=63616 Len=0 TSval=2167788248 TSecr=2862359177"
"149","19.143006898","74","42:ea:98:93:ff:4e","fa:f5:f2:31:06:1d","172.20.0.3","172.20.0.2","TCP","39698 → 4433 [SYN] Seq=0 Win=64240 Len=0 MSS=1460 SACK_PERM TSval=2167788259 TSecr=0 WS=128"
"150","19.143036448","74","fa:f5:f2:31:06:1d","42:ea:98:93:ff:4e","172.20.0.2","172.20.0.3","TCP","4433 → 39698 [SYN, ACK] Seq=0 Ack=1 Win=65160 Len=0 MSS=1460 SACK_PERM TSval=2862359189 TSecr=2167788259 WS=128"
"151","19.143055915","66","42:ea:98:93:ff:4e","fa:f5:f2:31:06:1d","172.20.0.3","172.20.0.2","TCP","39698 → 4433 [ACK] Seq=1 Ack=1 Win=64256 Len=0 TSval=2167788259 TSecr=2862359189"
"152","19.143098815","528","42:ea:98:93:ff:4e","fa:f5:f2:31:06:1d","172.20.0.3","172.20.0.2","TLSv1.2","Client Hello"
"153","19.143524144","736","fa:f5:f2:31:06:1d","42:ea:98:93:ff:4e","172.20.0.2","172.20.0.3","TLSv1.3","Server Hello, Change Cipher Spec, Application Data, Application Data, Application Data, Application Data"
"154","19.143553028","66","42:ea:98:93:ff:4e","fa:f5:f2:31:06:1d","172.20.0.3","172.20.0.2","TCP","39698 → 4433 [ACK] Seq=463 Ack=671 Win=63616 Len=0 TSval=2167788259 TSecr=2862359189"
"155","19.144391518","146","42:ea:98:93:ff:4e","fa:f5:f2:31:06:1d","172.20.0.3","172.20.0.2","TLSv1.3","Change Cipher Spec, Application Data"
"156","19.144453698","66","42:ea:98:93:ff:4e","fa:f5:f2:31:06:1d","172.20.0.3","172.20.0.2","TCP","39698 → 4433 [RST, ACK] Seq=543 Ack=671 Win=63616 Len=0 TSval=2167788260 TSecr=2862359189"
"157","19.155708118","74","42:ea:98:93:ff:4e","fa:f5:f2:31:06:1d","172.20.0.3","172.20.0.2","TCP","39710 → 4433 [SYN] Seq=0 Win=64240 Len=0 MSS=1460 SACK_PERM TSval=2167788271 TSecr=0 WS=128"
"158","20.160896042","74","42:ea:98:93:ff:4e","fa:f5:f2:31:06:1d","172.20.0.3","172.20.0.2","TCP","[TCP Retransmission] 39710 → 4433 [SYN] Seq=0 Win=64240 Len=0 MSS=1460 SACK_PERM TSval=2167789277 TSecr=0 WS=128"
"159","20.160910251","74","fa:f5:f2:31:06:1d","42:ea:98:93:ff:4e","172.20.0.2","172.20.0.3","TCP","4433 → 39710 [SYN, ACK] Seq=0 Ack=1 Win=65160 Len=0 MSS=1460 SACK_PERM TSval=2862360207 TSecr=2167788271 WS=128"
"160","20.160945371","66","42:ea:98:93:ff:4e","fa:f5:f2:31:06:1d","172.20.0.3","172.20.0.2","TCP","39710 → 4433 [ACK] Seq=1 Ack=1 Win=64256 Len=0 TSval=2167789277 TSecr=2862360207"
"161","20.161041331","528","42:ea:98:93:ff:4e","fa:f5:f2:31:06:1d","172.20.0.3","172.20.0.2","TLSv1.2","Client Hello"
"162","20.161049076","66","fa:f5:f2:31:06:1d","42:ea:98:93:ff:4e","172.20.0.2","172.20.0.3","TCP","4433 → 39710 [ACK] Seq=1 Ack=463 Win=64768 Len=0 TSval=2862360207 TSecr=2167789277"
"163","20.161607296","736","fa:f5:f2:31:06:1d","42:ea:98:93:ff:4e","172.20.0.2","172.20.0.3","TLSv1.3","Server Hello, Change Cipher Spec, Application Data, Application Data, Application Data, Application Data"
"164","20.161669551","66","42:ea:98:93:ff:4e","fa:f5:f2:31:06:1d","172.20.0.3","172.20.0.2","TCP","39710 → 4433 [ACK] Seq=463 Ack=671 Win=63616 Len=0 TSval=2167789277 TSecr=2862360207"
"165","20.162607642","146","42:ea:98:93:ff:4e","fa:f5:f2:31:06:1d","172.20.0.3","172.20.0.2","TLSv1.3","Change Cipher Spec, Application Data"
"166","20.162673064","66","42:ea:98:93:ff:4e","fa:f5:f2:31:06:1d","172.20.0.3","172.20.0.2","TCP","39710 → 4433 [RST, ACK] Seq=543 Ack=671 Win=63616 Len=0 TSval=2167789278 TSecr=2862360207"
"167","20.174017697","74","42:ea:98:93:ff:4e","fa:f5:f2:31:06:1d","172.20.0.3","172.20.0.2","TCP","39718 → 4433 [SYN] Seq=0 Win=64240 Len=0 MSS=1460 SACK_PERM TSval=2167789290 TSecr=0 WS=128"
"168","20.174046726","74","fa:f5:f2:31:06:1d","42:ea:98:93:ff:4e","172.20.0.2","172.20.0.3","TCP","4433 → 39718 [SYN, ACK] Seq=0 Ack=1 Win=65160 Len=0 MSS=1460 SACK_PERM TSval=2862360220 TSecr=2167789290 WS=128"
"169","20.174063835","66","42:ea:98:93:ff:4e","fa:f5:f2:31:06:1d","172.20.0.3","172.20.0.2","TCP","39718 → 4433 [ACK] Seq=1 Ack=1 Win=64256 Len=0 TSval=2167789290 TSecr=2862360220"
"170","20.174106083","528","42:ea:98:93:ff:4e","fa:f5:f2:31:06:1d","172.20.0.3","172.20.0.2","TLSv1.2","Client Hello"
"171","20.174572961","736","fa:f5:f2:31:06:1d","42:ea:98:93:ff:4e","172.20.0.2","172.20.0.3","TLSv1.3","Server Hello, Change Cipher Spec, Application Data, Application Data, Application Data, Application Data"
"172","20.174605926","66","42:ea:98:93:ff:4e","fa:f5:f2:31:06:1d","172.20.0.3","172.20.0.2","TCP","39718 → 4433 [ACK] Seq=463 Ack=671 Win=63616 Len=0 TSval=2167789290 TSecr=2862360220"
"173","20.175446356","146","42:ea:98:93:ff:4e","fa:f5:f2:31:06:1d","172.20.0.3","172.20.0.2","TLSv1.3","Change Cipher Spec, Application Data"
"174","20.175524858","66","42:ea:98:93:ff:4e","fa:f5:f2:31:06:1d","172.20.0.3","172.20.0.2","TCP","39718 → 4433 [RST, ACK] Seq=543 Ack=671 Win=63616 Len=0 TSval=2167789291 TSecr=2862360220"
"175","20.186418425","74","42:ea:98:93:ff:4e","fa:f5:f2:31:06:1d","172.20.0.3","172.20.0.2","TCP","39730 → 4433 [SYN] Seq=0 Win=64240 Len=0 MSS=1460 SACK_PERM TSval=2167789302 TSecr=0 WS=128"
"176","20.186444243","74","fa:f5:f2:31:06:1d","42:ea:98:93:ff:4e","172.20.0.2","172.20.0.3","TCP","4433 → 39730 [SYN, ACK] Seq=0 Ack=1 Win=65160 Len=0 MSS=1460 SACK_PERM TSval=2862360232 TSecr=2167789302 WS=128"
"177","20.186460572","66","42:ea:98:93:ff:4e","fa:f5:f2:31:06:1d","172.20.0.3","172.20.0.2","TCP","39730 → 4433 [ACK] Seq=1 Ack=1 Win=64256 Len=0 TSval=2167789302 TSecr=2862360232"
"178","20.186500439","528","42:ea:98:93:ff:4e","fa:f5:f2:31:06:1d","172.20.0.3","172.20.0.2","TLSv1.2","Client Hello"
"179","20.186506603","66","fa:f5:f2:31:06:1d","42:ea:98:93:ff:4e","172.20.0.2","172.20.0.3","TCP","4433 → 39730 [ACK] Seq=1 Ack=463 Win=64768 Len=0 TSval=2862360232 TSecr=2167789302"
"180","20.600844130","736","fa:f5:f2:31:06:1d","42:ea:98:93:ff:4e","172.20.0.2","172.20.0.3","TLSv1.3","Server Hello, Change Cipher Spec, Application Data, Application Data, Application Data, Application Data"
"181","20.600926713","66","42:ea:98:93:ff:4e","fa:f5:f2:31:06:1d","172.20.0.3","172.20.0.2","TCP","39730 → 4433 [ACK] Seq=463 Ack=671 Win=63616 Len=0 TSval=2167789717 TSecr=2862360647"
"182","20.601988085","146","42:ea:98:93:ff:4e","fa:f5:f2:31:06:1d","172.20.0.3","172.20.0.2","TLSv1.3","Change Cipher Spec, Application Data"
"183","20.602061640","66","42:ea:98:93:ff:4e","fa:f5:f2:31:06:1d","172.20.0.3","172.20.0.2","TCP","39730 → 4433 [RST, ACK] Seq=543 Ack=671 Win=63616 Len=0 TSval=2167789718 TSecr=2862360647"
"184","20.612841888","74","42:ea:98:93:ff:4e","fa:f5:f2:31:06:1d","172.20.0.3","172.20.0.2","TCP","39744 → 4433 [SYN] Seq=0 Win=64240 Len=0 MSS=1460 SACK_PERM TSval=2167789729 TSecr=0 WS=128"
"185","20.612867514","74","fa:f5:f2:31:06:1d","42:ea:98:93:ff:4e","172.20.0.2","172.20.0.3","TCP","4433 → 39744 [SYN, ACK] Seq=0 Ack=1 Win=65160 Len=0 MSS=1460 SACK_PERM TSval=2862360659 TSecr=2167789729 WS=128"
"186","20.612884738","66","42:ea:98:93:ff:4e","fa:f5:f2:31:06:1d","172.20.0.3","172.20.0.2","TCP","39744 → 4433 [ACK] Seq=1 Ack=1 Win=64256 Len=0 TSval=2167789729 TSecr=2862360659"
"187","20.612929322","528","42:ea:98:93:ff:4e","fa:f5:f2:31:06:1d","172.20.0.3","172.20.0.2","TLSv1.2","Client Hello"
"188","20.612933552","66","fa:f5:f2:31:06:1d","42:ea:98:93:ff:4e","172.20.0.2","172.20.0.3","TCP","4433 → 39744 [ACK] Seq=1 Ack=463 Win=64768 Len=0 TSval=2862360659 TSecr=2167789729"
"189","20.613487380","736","fa:f5:f2:31:06:1d","42:ea:98:93:ff:4e","172.20.0.2","172.20.0.3","TLSv1.3","Server Hello, Change Cipher Spec, Application Data, Application Data, Application Data, Application Data"
"190","20.613522200","66","42:ea:98:93:ff:4e","fa:f5:f2:31:06:1d","172.20.0.3","172.20.0.2","TCP","39744 → 4433 [ACK] Seq=463 Ack=671 Win=63616 Len=0 TSval=2167789729 TSecr=2862360659"
"191","20.614320620","146","42:ea:98:93:ff:4e","fa:f5:f2:31:06:1d","172.20.0.3","172.20.0.2","TLSv1.3","Change Cipher Spec, Application Data"
"192","20.614379367","66","42:ea:98:93:ff:4e","fa:f5:f2:31:06:1d","172.20.0.3","172.20.0.2","TCP","39744 → 4433 [RST, ACK] Seq=543 Ack=671 Win=63616 Len=0 TSval=2167789730 TSecr=2862360659"
"193","20.625186646","74","42:ea:98:93:ff:4e","fa:f5:f2:31:06:1d","172.20.0.3","172.20.0.2","TCP","39756 → 4433 [SYN] Seq=0 Win=64240 Len=0 MSS=1460 SACK_PERM TSval=2167789741 TSecr=0 WS=128"
"194","20.625216382","74","fa:f5:f2:31:06:1d","42:ea:98:93:ff:4e","172.20.0.2","172.20.0.3","TCP","4433 → 39756 [SYN, ACK] Seq=0 Ack=1 Win=65160 Len=0 MSS=1460 SACK_PERM TSval=2862360671 TSecr=2167789741 WS=128"
"195","20.625234376","66","42:ea:98:93:ff:4e","fa:f5:f2:31:06:1d","172.20.0.3","172.20.0.2","TCP","39756 → 4433 [ACK] Seq=1 Ack=1 Win=64256 Len=0 TSval=2167789741 TSecr=2862360671"
"196","20.625278385","528","42:ea:98:93:ff:4e","fa:f5:f2:31:06:1d","172.20.0.3","172.20.0.2","TLSv1.2","Client Hello"
"197","20.625283719","66","fa:f5:f2:31:06:1d","42:ea:98:93:ff:4e","172.20.0.2","172.20.0.3","TCP","4433 → 39756 [ACK] Seq=1 Ack=463 Win=64768 Len=0 TSval=2862360671 TSecr=2167789741"
"198","20.832838677","736","fa:f5:f2:31:06:1d","42:ea:98:93:ff:4e","172.20.0.2","172.20.0.3","TLSv1.3","Server Hello, Change Cipher Spec, Application Data, Application Data, Application Data, Application Data"
"199","20.832919873","66","42:ea:98:93:ff:4e","fa:f5:f2:31:06:1d","172.20.0.3","172.20.0.2","TCP","39756 → 4433 [ACK] Seq=463 Ack=671 Win=63616 Len=0 TSval=2167789949 TSecr=2862360879"
"200","20.834334090","146","42:ea:98:93:ff:4e","fa:f5:f2:31:06:1d","172.20.0.3","172.20.0.2","TLSv1.3","Change Cipher Spec, Application Data"
"201","20.834417587","66","42:ea:98:93:ff:4e","fa:f5:f2:31:06:1d","172.20.0.3","172.20.0.2","TCP","39756 → 4433 [RST, ACK] Seq=543 Ack=671 Win=63616 Len=0 TSval=2167789950 TSecr=2862360879"
"202","20.846504958","74","42:ea:98:93:ff:4e","fa:f5:f2:31:06:1d","172.20.0.3","172.20.0.2","TCP","39770 → 4433 [SYN] Seq=0 Win=64240 Len=0 MSS=1460 SACK_PERM TSval=2167789962 TSecr=0 WS=128"
"203","20.846531473","74","fa:f5:f2:31:06:1d","42:ea:98:93:ff:4e","172.20.0.2","172.20.0.3","TCP","4433 → 39770 [SYN, ACK] Seq=0 Ack=1 Win=65160 Len=0 MSS=1460 SACK_PERM TSval=2862360892 TSecr=2167789962 WS=128"
"204","20.846549153","66","42:ea:98:93:ff:4e","fa:f5:f2:31:06:1d","172.20.0.3","172.20.0.2","TCP","39770 → 4433 [ACK] Seq=1 Ack=1 Win=64256 Len=0 TSval=2167789962 TSecr=2862360892"
"205","20.846604771","528","42:ea:98:93:ff:4e","fa:f5:f2:31:06:1d","172.20.0.3","172.20.0.2","TLSv1.2","Client Hello"
"206","20.846609089","66","fa:f5:f2:31:06:1d","42:ea:98:93:ff:4e","172.20.0.2","172.20.0.3","TCP","4433 → 39770 [ACK] Seq=1 Ack=463 Win=64768 Len=0 TSval=2862360892 TSecr=2167789962"
"207","20.847131900","736","fa:f5:f2:31:06:1d","42:ea:98:93:ff:4e","172.20.0.2","172.20.0.3","TLSv1.3","Server Hello, Change Cipher Spec, Application Data, Application Data, Application Data, Application Data"
"208","20.847163584","66","42:ea:98:93:ff:4e","fa:f5:f2:31:06:1d","172.20.0.3","172.20.0.2","TCP","39770 → 4433 [ACK] Seq=463 Ack=671 Win=63616 Len=0 TSval=2167789963 TSecr=2862360893"
"209","20.848016996","146","42:ea:98:93:ff:4e","fa:f5:f2:31:06:1d","172.20.0.3","172.20.0.2","TLSv1.3","Change Cipher Spec, Application Data"
"210","20.848078628","66","42:ea:98:93:ff:4e","fa:f5:f2:31:06:1d","172.20.0.3","172.20.0.2","TCP","39770 → 4433 [RST, ACK] Seq=543 Ack=671 Win=63616 Len=0 TSval=2167789964 TSecr=2862360893"
"211","20.859688995","74","42:ea:98:93:ff:4e","fa:f5:f2:31:06:1d","172.20.0.3","172.20.0.2","TCP","39774 → 4433 [SYN] Seq=0 Win=64240 Len=0 MSS=1460 SACK_PERM TSval=2167789975 TSecr=0 WS=128"
"212","20.859724624","74","fa:f5:f2:31:06:1d","42:ea:98:93:ff:4e","172.20.0.2","172.20.0.3","TCP","4433 → 39774 [SYN, ACK] Seq=0 Ack=1 Win=65160 Len=0 MSS=1460 SACK_PERM TSval=2862360905 TSecr=2167789975 WS=128"
"213","20.859743190","66","42:ea:98:93:ff:4e","fa:f5:f2:31:06:1d","172.20.0.3","172.20.0.2","TCP","39774 → 4433 [ACK] Seq=1 Ack=1 Win=64256 Len=0 TSval=2167789975 TSecr=2862360905"
"214","20.859791059","528","42:ea:98:93:ff:4e","fa:f5:f2:31:06:1d","172.20.0.3","172.20.0.2","TLSv1.2","Client Hello"
"215","20.859803472","66","fa:f5:f2:31:06:1d","42:ea:98:93:ff:4e","172.20.0.2","172.20.0.3","TCP","4433 → 39774 [ACK] Seq=1 Ack=463 Win=64768 Len=0 TSval=2862360906 TSecr=2167789975"
"216","20.860261284","736","fa:f5:f2:31:06:1d","42:ea:98:93:ff:4e","172.20.0.2","172.20.0.3","TLSv1.3","Server Hello, Change Cipher Spec, Application Data, Application Data, Application Data, Application Data"
"217","20.860292021","66","42:ea:98:93:ff:4e","fa:f5:f2:31:06:1d","172.20.0.3","172.20.0.2","TCP","39774 → 4433 [ACK] Seq=463 Ack=671 Win=63616 Len=0 TSval=2167789976 TSecr=2862360906"
"218","20.861134008","146","42:ea:98:93:ff:4e","fa:f5:f2:31:06:1d","172.20.0.3","172.20.0.2","TLSv1.3","Change Cipher Spec, Application Data"
"219","20.861194053","66","42:ea:98:93:ff:4e","fa:f5:f2:31:06:1d","172.20.0.3","172.20.0.2","TCP","39774 → 4433 [RST, ACK] Seq=543 Ack=671 Win=63616 Len=0 TSval=2167789977 TSecr=2862360906"
"220","20.872498301","74","42:ea:98:93:ff:4e","fa:f5:f2:31:06:1d","172.20.0.3","172.20.0.2","TCP","39776 → 4433 [SYN] Seq=0 Win=64240 Len=0 MSS=1460 SACK_PERM TSval=2167789988 TSecr=0 WS=128"
"221","20.872527223","74","fa:f5:f2:31:06:1d","42:ea:98:93:ff:4e","172.20.0.2","172.20.0.3","TCP","4433 → 39776 [SYN, ACK] Seq=0 Ack=1 Win=65160 Len=0 MSS=1460 SACK_PERM TSval=2862360918 TSecr=2167789988 WS=128"
