frame.number,frame.time_relative,frame.len,eth.src,eth.dst,ip.src,ip.dst,_ws.col.protocol,_ws.col.info
"1","0.000000000","239","06:43:0b:6e:44:46","33:33:00:00:00:fb",,,"MDNS","Standard query 0x0000 PTR _ipps._tcp.local, ""QM"" question PTR _ftp._tcp.local, ""QM"" question PTR _webdav._tcp.local, ""QM"" question PTR _webdavs._tcp.local, ""QM"" question PTR _sftp-ssh._tcp.local, ""QM"" question PTR _smb._tcp.local, ""QM"" question PTR _afpovertcp._tcp.local, ""QM"" question PTR _nfs._tcp.local, ""QM"" question PTR _ipp._tcp.local, ""QM"" question PTR MONTE-VIRTUAL-MACHINE._smb._tcp.local"
"2","6.714730312","42","56:e3:10:36:ce:21","ff:ff:ff:ff:ff:ff",,,"ARP","ARP Announcement for 172.20.0.3"
"3","6.753864449","42","56:e3:10:36:ce:21","ff:ff:ff:ff:ff:ff",,,"ARP","Who has 172.20.0.2? Tell 172.20.0.3"
"4","6.753918682","42","ba:07:bc:f3:16:7a","56:e3:10:36:ce:21",,,"ARP","172.20.0.2 is at ba:07:bc:f3:16:7a"
"5","6.753928577","74","56:e3:10:36:ce:21","ba:07:bc:f3:16:7a","172.20.0.3","172.20.0.2","TCP","48550 → 4433 [SYN] Seq=0 Win=64240 Len=0 MSS=1460 SACK_PERM TSval=2167998055 TSecr=0 WS=128"
"6","7.715272947","42","56:e3:10:36:ce:21","ff:ff:ff:ff:ff:ff",,,"ARP","ARP Announcement for 172.20.0.3"
"7","7.767028805","74","ba:07:bc:f3:16:7a","56:e3:10:36:ce:21","172.20.0.2","172.20.0.3","TCP","4433 → 48550 [SYN, ACK] Seq=0 Ack=1 Win=65160 Len=0 MSS=1460 SACK_PERM TSval=2862569999 TSecr=2167998055 WS=128"
"8","7.767059621","74","56:e3:10:36:ce:21","ba:07:bc:f3:16:7a","172.20.0.3","172.20.0.2","TCP","[TCP Retransmission] 48550 → 4433 [SYN] Seq=0 Win=64240 Len=0 MSS=1460 SACK_PERM TSval=2167999069 TSecr=0 WS=128"
"9","7.767105548","66","56:e3:10:36:ce:21","ba:07:bc:f3:16:7a","172.20.0.3","172.20.0.2","TCP","48550 → 4433 [ACK] Seq=1 Ack=1 Win=64256 Len=0 TSval=2167999069 TSecr=2862569999"
"10","7.767197366","1353","56:e3:10:36:ce:21","ba:07:bc:f3:16:7a","172.20.0.3","172.20.0.2","TLSv1.2","Client Hello"
"11","7.767205967","66","ba:07:bc:f3:16:7a","56:e3:10:36:ce:21","172.20.0.2","172.20.0.3","TCP","4433 → 48550 [ACK] Seq=1 Ack=1288 Win=64128 Len=0 TSval=2862569999 TSecr=2167999069"
"12","7.771731983","1514","ba:07:bc:f3:16:7a","56:e3:10:36:ce:21","172.20.0.2","172.20.0.3","TLSv1.3","Server Hello, Change Cipher Spec, Application Data, Application Data, Application Data"
"13","7.771785941","66","56:e3:10:36:ce:21","ba:07:bc:f3:16:7a","172.20.0.3","172.20.0.2","TCP","48550 → 4433 [ACK] Seq=1288 Ack=1449 Win=64128 Len=0 TSval=2167999073 TSecr=2862570003"
"14","7.771797125","89","ba:07:bc:f3:16:7a","56:e3:10:36:ce:21","172.20.0.2","172.20.0.3","TLSv1.3","Application Data"
"15","7.771802861","66","56:e3:10:36:ce:21","ba:07:bc:f3:16:7a","172.20.0.3","172.20.0.2","TCP","48550 → 4433 [ACK] Seq=1288 Ack=1472 Win=64128 Len=0 TSval=2167999073 TSecr=2862570003"
"16","7.776241690","146","56:e3:10:36:ce:21","ba:07:bc:f3:16:7a","172.20.0.3","172.20.0.2","TLSv1.3","Change Cipher Spec, Application Data"
"17","7.776352813","66","56:e3:10:36:ce:21","ba:07:bc:f3:16:7a","172.20.0.3","172.20.0.2","TCP","48550 → 4433 [RST, ACK] Seq=1368 Ack=1472 Win=64128 Len=0 TSval=2167999078 TSecr=2862570003"
"18","7.793090890","74","56:e3:10:36:ce:21","ba:07:bc:f3:16:7a","172.20.0.3","172.20.0.2","TCP","48566 → 4433 [SYN] Seq=0 Win=64240 Len=0 MSS=1460 SACK_PERM TSval=2167999095 TSecr=0 WS=128"
"19","7.793119788","74","ba:07:bc:f3:16:7a","56:e3:10:36:ce:21","172.20.0.2","172.20.0.3","TCP","4433 → 48566 [SYN, ACK] Seq=0 Ack=1 Win=65160 Len=0 MSS=1460 SACK_PERM TSval=2862570025 TSecr=2167999095 WS=128"
"20","7.793140461","66","56:e3:10:36:ce:21","ba:07:bc:f3:16:7a","172.20.0.3","172.20.0.2","TCP","48566 → 4433 [ACK] Seq=1 Ack=1 Win=64256 Len=0 TSval=2167999095 TSecr=2862570025"
"21","7.793198377","1353","56:e3:10:36:ce:21","ba:07:bc:f3:16:7a","172.20.0.3","172.20.0.2","TLSv1.2","Client Hello"
"22","7.795131057","1537","ba:07:bc:f3:16:7a","56:e3:10:36:ce:21","172.20.0.2","172.20.0.3","TLSv1.3","Server Hello, Change Cipher Spec, Application Data, Application Data, Application Data, Application Data"
"23","7.795182372","66","56:e3:10:36:ce:21","ba:07:bc:f3:16:7a","172.20.0.3","172.20.0.2","TCP","48566 → 4433 [ACK] Seq=1288 Ack=1472 Win=64128 Len=0 TSval=2167999097 TSecr=2862570027"
"24","7.798250302","146","56:e3:10:36:ce:21","ba:07:bc:f3:16:7a","172.20.0.3","172.20.0.2","TLSv1.3","Change Cipher Spec, Application Data"
"25","7.798337058","66","56:e3:10:36:ce:21","ba:07:bc:f3:16:7a","172.20.0.3","172.20.0.2","TCP","48566 → 4433 [RST, ACK] Seq=1368 Ack=1472 Win=64128 Len=0 TSval=2167999100 TSecr=2862570027"
"26","7.814132716","74","56:e3:10:36:ce:21","ba:07:bc:f3:16:7a","172.20.0.3","172.20.0.2","TCP","48568 → 4433 [SYN] Seq=0 Win=64240 Len=0 MSS=1460 SACK_PERM TSval=2167999116 TSecr=0 WS=128"
"27","7.814160264","74","ba:07:bc:f3:16:7a","56:e3:10:36:ce:21","172.20.0.2","172.20.0.3","TCP","4433 → 48568 [SYN, ACK] Seq=0 Ack=1 Win=65160 Len=0 MSS=1460 SACK_PERM TSval=2862570046 TSecr=2167999116 WS=128"
"28","7.814178958","66","56:e3:10:36:ce:21","ba:07:bc:f3:16:7a","172.20.0.3","172.20.0.2","TCP","48568 → 4433 [ACK] Seq=1 Ack=1 Win=64256 Len=0 TSval=2167999116 TSecr=2862570046"
"29","7.814227533","1353","56:e3:10:36:ce:21","ba:07:bc:f3:16:7a","172.20.0.3","172.20.0.2","TLSv1.2","Client Hello"
"30","7.814233175","66","ba:07:bc:f3:16:7a","56:e3:10:36:ce:21","172.20.0.2","172.20.0.3","TCP","4433 → 48568 [ACK] Seq=1 Ack=1288 Win=64128 Len=0 TSval=2862570046 TSecr=2167999116"
"31","7.816233072","1537","ba:07:bc:f3:16:7a","56:e3:10:36:ce:21","172.20.0.2","172.20.0.3","TLSv1.3","Server Hello, Change Cipher Spec, Application Data, Application Data, Application Data, Application Data"
"32","7.816277696","66","56:e3:10:36:ce:21","ba:07:bc:f3:16:7a","172.20.0.3","172.20.0.2","TCP","48568 → 4433 [ACK] Seq=1288 Ack=1472 Win=64128 Len=0 TSval=2167999118 TSecr=2862570048"
"33","7.819270564","146","56:e3:10:36:ce:21","ba:07:bc:f3:16:7a","172.20.0.3","172.20.0.2","TLSv1.3","Change Cipher Spec, Application Data"
"34","7.819341707","66","56:e3:10:36:ce:21","ba:07:bc:f3:16:7a","172.20.0.3","172.20.0.2","TCP","48568 → 4433 [RST, ACK] Seq=1368 Ack=1472 Win=64128 Len=0 TSval=2167999121 TSecr=2862570048"
"35","7.834981002","74","56:e3:10:36:ce:21","ba:07:bc:f3:16:7a","172.20.0.3","172.20.0.2","TCP","48570 → 4433 [SYN] Seq=0 Win=64240 Len=0 MSS=1460 SACK_PERM TSval=2167999137 TSecr=0 WS=128"
"36","8.715468546","42","56:e3:10:36:ce:21","ff:ff:ff:ff:ff:ff",,,"ARP","ARP Announcement for 172.20.0.3"
"37","8.854989202","74","56:e3:10:36:ce:21","ba:07:bc:f3:16:7a","172.20.0.3","172.20.0.2","TCP","[TCP Retransmission] 48570 → 4433 [SYN] Seq=0 Win=64240 Len=0 MSS=1460 SACK_PERM TSval=2168000157 TSecr=0 WS=128"
"38","9.878950542","74","56:e3:10:36:ce:21","ba:07:bc:f3:16:7a","172.20.0.3","172.20.0.2","TCP","[TCP Retransmission] 48570 → 4433 [SYN] Seq=0 Win=64240 Len=0 MSS=1460 SACK_PERM TSval=2168001181 TSecr=0 WS=128"
"39","9.878983687","74","ba:07:bc:f3:16:7a","56:e3:10:36:ce:21","172.20.0.2","172.20.0.3","TCP","4433 → 48570 [SYN, ACK] Seq=0 Ack=1 Win=65160 Len=0 MSS=1460 SACK_PERM TSval=2862572111 TSecr=2167999137 WS=128"
"40","9.879026408","66","56:e3:10:36:ce:21","ba:07:bc:f3:16:7a","172.20.0.3","172.20.0.2","TCP","48570 → 4433 [ACK] Seq=1 Ack=1 Win=64256 Len=0 TSval=2168001181 TSecr=2862572111"
"41","9.879122947","1353","56:e3:10:36:ce:21","ba:07:bc:f3:16:7a","172.20.0.3","172.20.0.2","TLSv1.2","Client Hello"
"42","9.879129512","66","ba:07:bc:f3:16:7a","56:e3:10:36:ce:21","172.20.0.2","172.20.0.3","TCP","4433 → 48570 [ACK] Seq=1 Ack=1288 Win=64128 Len=0 TSval=2862572111 TSecr=2168001181"
"43","11.542929462","1514","ba:07:bc:f3:16:7a","56:e3:10:36:ce:21","172.20.0.2","172.20.0.3","TLSv1.3","Server Hello, Change Cipher Spec, Application Data, Application Data, Application Data"
"44","11.543012631","66","56:e3:10:36:ce:21","ba:07:bc:f3:16:7a","172.20.0.3","172.20.0.2","TCP","48570 → 4433 [ACK] Seq=1288 Ack=1449 Win=64128 Len=0 TSval=2168002845 TSecr=2862573775"
"45","11.543027365","89","ba:07:bc:f3:16:7a","56:e3:10:36:ce:21","172.20.0.2","172.20.0.3","TLSv1.3","Application Data"
"46","11.543034176","66","56:e3:10:36:ce:21","ba:07:bc:f3:16:7a","172.20.0.3","172.20.0.2","TCP","48570 → 4433 [ACK] Seq=1288 Ack=1472 Win=64128 Len=0 TSval=2168002845 TSecr=2862573775"
"47","11.546096045","146","56:e3:10:36:ce:21","ba:07:bc:f3:16:7a","172.20.0.3","172.20.0.2","TLSv1.3","Change Cipher Spec, Application Data"
"48","11.546175812","66","56:e3:10:36:ce:21","ba:07:bc:f3:16:7a","172.20.0.3","172.20.0.2","TCP","48570 → 4433 [RST, ACK] Seq=1368 Ack=1472 Win=64128 Len=0 TSval=2168002848 TSecr=2862573775"
"49","11.561806164","74","56:e3:10:36:ce:21","ba:07:bc:f3:16:7a","172.20.0.3","172.20.0.2","TCP","48572 → 4433 [SYN] Seq=0 Win=64240 Len=0 MSS=1460 SACK_PERM TSval=2168002863 TSecr=0 WS=128"
"50","12.566939814","74","ba:07:bc:f3:16:7a","56:e3:10:36:ce:21","172.20.0.2","172.20.0.3","TCP","4433 → 48572 [SYN, ACK] Seq=0 Ack=1 Win=65160 Len=0 MSS=1460 SACK_PERM TSval=2862574799 TSecr=2168002863 WS=128"
"51","12.566968351","74","56:e3:10:36:ce:21","ba:07:bc:f3:16:7a","172.20.0.3","172.20.0.2","TCP","[TCP Retransmission] 48572 → 4433 [SYN] Seq=0 Win=64240 Len=0 MSS=1460 SACK_PERM TSval=2168003869 TSecr=0 WS=128"
"52","12.566982646","74","ba:07:bc:f3:16:7a","56:e3:10:36:ce:21","172.20.0.2","172.20.0.3","TCP","[TCP Out-Of-Order] 4433 → 48572 [SYN, ACK] Seq=0 Ack=1 Win=65160 Len=0 MSS=1460 SACK_PERM TSval=2862574799 TSecr=2168002863 WS=128"
"53","12.567018051","66","56:e3:10:36:ce:21","ba:07:bc:f3:16:7a","172.20.0.3","172.20.0.2","TCP","48572 → 4433 [ACK] Seq=1 Ack=1 Win=64256 Len=0 TSval=2168003869 TSecr=2862574799"
"54","12.567049482","66","56:e3:10:36:ce:21","ba:07:bc:f3:16:7a","172.20.0.3","172.20.0.2","TCP","[TCP Dup ACK 53#1] 48572 → 4433 [ACK] Seq=1 Ack=1 Win=64256 Len=0 TSval=2168003869 TSecr=2862574799"
"55","12.567110093","1353","56:e3:10:36:ce:21","ba:07:bc:f3:16:7a","172.20.0.3","172.20.0.2","TLSv1.2","Client Hello"
"56","12.567117039","66","ba:07:bc:f3:16:7a","56:e3:10:36:ce:21","172.20.0.2","172.20.0.3","TCP","4433 → 48572 [ACK] Seq=1 Ack=1288 Win=64128 Len=0 TSval=2862574799 TSecr=2168003869"
"57","12.568980499","1514","ba:07:bc:f3:16:7a","56:e3:10:36:ce:21","172.20.0.2","172.20.0.3","TLSv1.3","Server Hello, Change Cipher Spec, Application Data, Application Data, Application Data"
"58","12.569017339","66","56:e3:10:36:ce:21","ba:07:bc:f3:16:7a","172.20.0.3","172.20.0.2","TCP","48572 → 4433 [ACK] Seq=1288 Ack=1449 Win=64128 Len=0 TSval=2168003871 TSecr=2862574801"
"59","12.569028562","89","ba:07:bc:f3:16:7a","56:e3:10:36:ce:21","172.20.0.2","172.20.0.3","TLSv1.3","Application Data"
"60","12.569034522","66","56:e3:10:36:ce:21","ba:07:bc:f3:16:7a","172.20.0.3","172.20.0.2","TCP","48572 → 4433 [ACK] Seq=1288 Ack=1472 Win=64128 Len=0 TSval=2168003871 TSecr=2862574801"
"61","12.571962679","146","56:e3:10:36:ce:21","ba:07:bc:f3:16:7a","172.20.0.3","172.20.0.2","TLSv1.3","Change Cipher Spec, Application Data"
"62","12.572036263","66","56:e3:10:36:ce:21","ba:07:bc:f3:16:7a","172.20.0.3","172.20.0.2","TCP","48572 → 4433 [RST, ACK] Seq=1368 Ack=1472 Win=64128 Len=0 TSval=2168003874 TSecr=2862574801"
"63","12.586608518","74","56:e3:10:36:ce:21","ba:07:bc:f3:16:7a","172.20.0.3","172.20.0.2","TCP","48588 → 4433 [SYN] Seq=0 Win=64240 Len=0 MSS=1460 SACK_PERM TSval=2168003888 TSecr=0 WS=128"
"64","13.590936630","74","ba:07:bc:f3:16:7a","56:e3:10:36:ce:21","172.20.0.2","172.20.0.3","TCP","4433 → 48588 [SYN, ACK] Seq=0 Ack=1 Win=65160 Len=0 MSS=1460 SACK_PERM TSval=2862575823 TSecr=2168003888 WS=128"
"65","13.590970087","74","56:e3:10:36:ce:21","ba:07:bc:f3:16:7a","172.20.0.3","172.20.0.2","TCP","[TCP Retransmission] 48588 → 4433 [SYN] Seq=0 Win=64240 Len=0 MSS=1460 SACK_PERM TSval=2168004893 TSecr=0 WS=128"
"66","13.591013216","66","56:e3:10:36:ce:21","ba:07:bc:f3:16:7a","172.20.0.3","172.20.0.2","TCP","48588 → 4433 [ACK] Seq=1 Ack=1 Win=64256 Len=0 TSval=2168004893 TSecr=2862575823"
"67","13.591102681","1353","56:e3:10:36:ce:21","ba:07:bc:f3:16:7a","172.20.0.3","172.20.0.2","TLSv1.2","Client Hello"
"68","13.593520761","1514","ba:07:bc:f3:16:7a","56:e3:10:36:ce:21","172.20.0.2","172.20.0.3","TLSv1.3","Server Hello, Change Cipher Spec, Application Data, Application Data, Application Data"
"69","13.593565819","66","56:e3:10:36:ce:21","ba:07:bc:f3:16:7a","172.20.0.3","172.20.0.2","TCP","48588 → 4433 [ACK] Seq=1288 Ack=1449 Win=64128 Len=0 TSval=2168004895 TSecr=2862575825"
"70","13.593573754","89","ba:07:bc:f3:16:7a","56:e3:10:36:ce:21","172.20.0.2","172.20.0.3","TLSv1.3","Application Data"
"71","13.593579157","66","56:e3:10:36:ce:21","ba:07:bc:f3:16:7a","172.20.0.3","172.20.0.2","TCP","48588 → 4433 [ACK] Seq=1288 Ack=1472 Win=64128 Len=0 TSval=2168004895 TSecr=2862575825"
"72","13.596350231","146","56:e3:10:36:ce:21","ba:07:bc:f3:16:7a","172.20.0.3","172.20.0.2","TLSv1.3","Change Cipher Spec, Application Data"
"73","13.596430933","66","56:e3:10:36:ce:21","ba:07:bc:f3:16:7a","172.20.0.3","172.20.0.2","TCP","48588 → 4433 [RST, ACK] Seq=1368 Ack=1472 Win=64128 Len=0 TSval=2168004898 TSecr=2862575825"
"74","13.611621632","74","56:e3:10:36:ce:21","ba:07:bc:f3:16:7a","172.20.0.3","172.20.0.2","TCP","48590 → 4433 [SYN] Seq=0 Win=64240 Len=0 MSS=1460 SACK_PERM TSval=2168004913 TSecr=0 WS=128"
"75","13.611652388","74","ba:07:bc:f3:16:7a","56:e3:10:36:ce:21","172.20.0.2","172.20.0.3","TCP","4433 → 48590 [SYN, ACK] Seq=0 Ack=1 Win=65160 Len=0 MSS=1460 SACK_PERM TSval=2862575843 TSecr=2168004913 WS=128"
"76","13.611672442","66","56:e3:10:36:ce:21","ba:07:bc:f3:16:7a","172.20.0.3","172.20.0.2","TCP","48590 → 4433 [ACK] Seq=1 Ack=1 Win=64256 Len=0 TSval=2168004913 TSecr=2862575843"
"77","13.611732210","1353","56:e3:10:36:ce:21","ba:07:bc:f3:16:7a","172.20.0.3","172.20.0.2","TLSv1.2","Client Hello"
"78","13.613484164","1537","ba:07:bc:f3:16:7a","56:e3:10:36:ce:21","172.20.0.2","172.20.0.3","TLSv1.3","Server Hello, Change Cipher Spec, Application Data, Application Data, Application Data, Application Data"
"79","13.613524164","66","56:e3:10:36:ce:21","ba:07:bc:f3:16:7a","172.20.0.3","172.20.0.2","TCP","48590 → 4433 [ACK] Seq=1288 Ack=1472 Win=64128 Len=0 TSval=2168004915 TSecr=2862575845"
"80","13.616394729","146","56:e3:10:36:ce:21","ba:07:bc:f3:16:7a","172.20.0.3","172.20.0.2","TLSv1.3","Change Cipher Spec, Application Data"
"81","13.616463136","66","56:e3:10:36:ce:21","ba:07:bc:f3:16:7a","172.20.0.3","172.20.0.2","TCP","48590 → 4433 [RST, ACK] Seq=1368 Ack=1472 Win=64128 Len=0 TSval=2168004918 TSecr=2862575845"
"82","13.630866490","74","56:e3:10:36:ce:21","ba:07:bc:f3:16:7a","172.20.0.3","172.20.0.2","TCP","48604 → 4433 [SYN] Seq=0 Win=64240 Len=0 MSS=1460 SACK_PERM TSval=2168004932 TSecr=0 WS=128"
"83","13.630919490","74","ba:07:bc:f3:16:7a","56:e3:10:36:ce:21","172.20.0.2","172.20.0.3","TCP","4433 → 48604 [SYN, ACK] Seq=0 Ack=1 Win=65160 Len=0 MSS=1460 SACK_PERM TSval=2862575863 TSecr=2168004932 WS=128"
"84","13.630941648","66","56:e3:10:36:ce:21","ba:07:bc:f3:16:7a","172.20.0.3","172.20.0.2","TCP","48604 → 4433 [ACK] Seq=1 Ack=1 Win=64256 Len=0 TSval=2168004933 TSecr=2862575863"
"85","13.630987472","1353","56:e3:10:36:ce:21","ba:07:bc:f3:16:7a","172.20.0.3","172.20.0.2","TLSv1.2","Client Hello"
"86","13.632687408","1537","ba:07:bc:f3:16:7a","56:e3:10:36:ce:21","172.20.0.2","172.20.0.3","TLSv1.3","Server Hello, Change Cipher Spec, Application Data, Application Data, Application Data, Application Data"
"87","13.632725640","66","56:e3:10:36:ce:21","ba:07:bc:f3:16:7a","172.20.0.3","172.20.0.2","TCP","48604 → 4433 [ACK] Seq=1288 Ack=1472 Win=64128 Len=0 TSval=2168004934 TSecr=2862575864"
"88","13.635188443","146","56:e3:10:36:ce:21","ba:07:bc:f3:16:7a","172.20.0.3","172.20.0.2","TLSv1.3","Change Cipher Spec, Application Data"
"89","13.635243629","66","56:e3:10:36:ce:21","ba:07:bc:f3:16:7a","172.20.0.3","172.20.0.2","TCP","48604 → 4433 [RST, ACK] Seq=1368 Ack=1472 Win=64128 Len=0 TSval=2168004937 TSecr=2862575864"
"90","13.650617743","74","56:e3:10:36:ce:21","ba:07:bc:f3:16:7a","172.20.0.3","172.20.0.2","TCP","48618 → 4433 [SYN] Seq=0 Win=64240 Len=0 MSS=1460 SACK_PERM TSval=2168004952 TSecr=0 WS=128"
"91","13.650651124","74","ba:07:bc:f3:16:7a","56:e3:10:36:ce:21","172.20.0.2","172.20.0.3","TCP","4433 → 48618 [SYN, ACK] Seq=0 Ack=1 Win=65160 Len=0 MSS=1460 SACK_PERM TSval=2862575882 TSecr=2168004952 WS=128"
"92","13.650671773","66","56:e3:10:36:ce:21","ba:07:bc:f3:16:7a","172.20.0.3","172.20.0.2","TCP","48618 → 4433 [ACK] Seq=1 Ack=1 Win=64256 Len=0 TSval=2168004952 TSecr=2862575882"
"93","13.650726745","1353","56:e3:10:36:ce:21","ba:07:bc:f3:16:7a","172.20.0.3","172.20.0.2","TLSv1.2","Client Hello"
"94","13.650732159","66","ba:07:bc:f3:16:7a","56:e3:10:36:ce:21","172.20.0.2","172.20.0.3","TCP","4433 → 48618 [ACK] Seq=1 Ack=1288 Win=64128 Len=0 TSval=2862575882 TSecr=2168004952"
"95","13.652524190","1537","ba:07:bc:f3:16:7a","56:e3:10:36:ce:21","172.20.0.2","172.20.0.3","TLSv1.3","Server Hello, Change Cipher Spec, Application Data, Application Data, Application Data, Application Data"
"96","13.652564136","66","56:e3:10:36:ce:21","ba:07:bc:f3:16:7a","172.20.0.3","172.20.0.2","TCP","48618 → 4433 [ACK] Seq=1288 Ack=1472 Win=64128 Len=0 TSval=2168004954 TSecr=2862575884"
"97","13.655346417","146","56:e3:10:36:ce:21","ba:07:bc:f3:16:7a","172.20.0.3","172.20.0.2","TLSv1.3","Change Cipher Spec, Application Data"
"98","13.655421085","66","56:e3:10:36:ce:21","ba:07:bc:f3:16:7a","172.20.0.3","172.20.0.2","TCP","48618 → 4433 [RST, ACK] Seq=1368 Ack=1472 Win=64128 Len=0 TSval=2168004957 TSecr=2862575884"
"99","13.669590866","74","56:e3:10:36:ce:21","ba:07:bc:f3:16:7a","172.20.0.3","172.20.0.2","TCP","48622 → 4433 [SYN] Seq=0 Win=64240 Len=0 MSS=1460 SACK_PERM TSval=2168004971 TSecr=0 WS=128"
"100","13.669617721","74","ba:07:bc:f3:16:7a","56:e3:10:36:ce:21","172.20.0.2","172.20.0.3","TCP","4433 → 48622 [SYN, ACK] Seq=0 Ack=1 Win=65160 Len=0 MSS=1460 SACK_PERM TSval=2862575901 TSecr=2168004971 WS=128"
"101","13.669638918","66","56:e3:10:36:ce:21","ba:07:bc:f3:16:7a","172.20.0.3","172.20.0.2","TCP","48622 → 4433 [ACK] Seq=1 Ack=1 Win=64256 Len=0 TSval=2168004971 TSecr=2862575901"
"102","13.669684260","1353","56:e3:10:36:ce:21","ba:07:bc:f3:16:7a","172.20.0.3","172.20.0.2","TLSv1.2","Client Hello"
"103","13.669690868","66","ba:07:bc:f3:16:7a","56:e3:10:36:ce:21","172.20.0.2","172.20.0.3","TCP","4433 → 48622 [ACK] Seq=1 Ack=1288 Win=64128 Len=0 TSval=2862575901 TSecr=2168004971"
"104","13.671401278","1537","ba:07:bc:f3:16:7a","56:e3:10:36:ce:21","172.20.0.2","172.20.0.3","TLSv1.3","Server Hello, Change Cipher Spec, Application Data, Application Data, Application Data, Application Data"
"105","13.671441481","66","56:e3:10:36:ce:21","ba:07:bc:f3:16:7a","172.20.0.3","172.20.0.2","TCP","48622 → 4433 [ACK] Seq=1288 Ack=1472 Win=64128 Len=0 TSval=2168004973 TSecr=2862575903"
"106","13.673865276","146","56:e3:10:36:ce:21","ba:07:bc:f3:16:7a","172.20.0.3","172.20.0.2","TLSv1.3","Change Cipher Spec, Application Data"
"107","13.673928886","66","56:e3:10:36:ce:21","ba:07:bc:f3:16:7a","172.20.0.3","172.20.0.2","TCP","48622 → 4433 [RST, ACK] Seq=1368 Ack=1472 Win=64128 Len=0 TSval=2168004976 TSecr=2862575903"
"108","13.688526113","74","56:e3:10:36:ce:21","ba:07:bc:f3:16:7a","172.20.0.3","172.20.0.2","TCP","48638 → 4433 [SYN] Seq=0 Win=64240 Len=0 MSS=1460 SACK_PERM TSval=2168004990 TSecr=0 WS=128"
"109","13.688553756","74","ba:07:bc:f3:16:7a","56:e3:10:36:ce:21","172.20.0.2","172.20.0.3","TCP","4433 → 48638 [SYN, ACK] Seq=0 Ack=1 Win=65160 Len=0 MSS=1460 SACK_PERM TSval=2862575920 TSecr=2168004990 WS=128"
"110","13.688573520","66","56:e3:10:36:ce:21","ba:07:bc:f3:16:7a","172.20.0.3","172.20.0.2","TCP","48638 → 4433 [ACK] Seq=1 Ack=1 Win=64256 Len=0 TSval=2168004990 TSecr=2862575920"
"111","13.688636182","1353","56:e3:10:36:ce:21","ba:07:bc:f3:16:7a","172.20.0.3","172.20.0.2","TLSv1.2","Client Hello"
"112","13.688656737","66","ba:07:bc:f3:16:7a","56:e3:10:36:ce:21","172.20.0.2","172.20.0.3","TCP","4433 → 48638 [ACK] Seq=1 Ack=1288 Win=64128 Len=0 TSval=2862575920 TSecr=2168004990"
"113","13.690390088","1537","ba:07:bc:f3:16:7a","56:e3:10:36:ce:21","172.20.0.2","172.20.0.3","TLSv1.3","Server Hello, Change Cipher Spec, Application Data, Application Data, Application Data, Application Data"
"114","13.690422442","66","56:e3:10:36:ce:21","ba:07:bc:f3:16:7a","172.20.0.3","172.20.0.2","TCP","48638 → 4433 [ACK] Seq=1288 Ack=1472 Win=64128 Len=0 TSval=2168004992 TSecr=2862575922"
"115","13.693143566","146","56:e3:10:36:ce:21","ba:07:bc:f3:16:7a","172.20.0.3","172.20.0.2","TLSv1.3","Change Cipher Spec, Application Data"
"116","13.693228551","66","56:e3:10:36:ce:21","ba:07:bc:f3:16:7a","172.20.0.3","172.20.0.2","TCP","48638 → 4433 [RST, ACK] Seq=1368 Ack=1472 Win=64128 Len=0 TSval=2168004995 TSecr=2862575922"
"117","13.707108113","74","56:e3:10:36:ce:21","ba:07:bc:f3:16:7a","172.20.0.3","172.20.0.2","TCP","48652 → 4433 [SYN] Seq=0 Win=64240 Len=0 MSS=1460 SACK_PERM TSval=2168005009 TSecr=0 WS=128"
"118","13.707134630","74","ba:07:bc:f3:16:7a","56:e3:10:36:ce:21","172.20.0.2","172.20.0.3","TCP","4433 → 48652 [SYN, ACK] Seq=0 Ack=1 Win=65160 Len=0 MSS=1460 SACK_PERM TSval=2862575939 TSecr=2168005009 WS=128"
"119","13.707153210","66","56:e3:10:36:ce:21","ba:07:bc:f3:16:7a","172.20.0.3","172.20.0.2","TCP","48652 → 4433 [ACK] Seq=1 Ack=1 Win=64256 Len=0 TSval=2168005009 TSecr=2862575939"
"120","13.707196137","1353","56:e3:10:36:ce:21","ba:07:bc:f3:16:7a","172.20.0.3","172.20.0.2","TLSv1.2","Client Hello"
"121","13.708914304","1537","ba:07:bc:f3:16:7a","56:e3:10:36:ce:21","172.20.0.2","172.20.0.3","TLSv1.3","Server Hello, Change Cipher Spec, Application Data, Application Data, Application Data, Application Data"
"122","13.708948582","66","56:e3:10:36:ce:21","ba:07:bc:f3:16:7a","172.20.0.3","172.20.0.2","TCP","48652 → 4433 [ACK] Seq=1288 Ack=1472 Win=64128 Len=0 TSval=2168005011 TSecr=2862575941"
"123","13.711357125","146","56:e3:10:36:ce:21","ba:07:bc:f3:16:7a","172.20.0.3","172.20.0.2","TLSv1.3","Change Cipher Spec, Application Data"
"124","13.711412889","66","56:e3:10:36:ce:21","ba:07:bc:f3:16:7a","172.20.0.3","172.20.0.2","TCP","48652 → 4433 [RST, ACK] Seq=1368 Ack=1472 Win=64128 Len=0 TSval=2168005013 TSecr=2862575941"
"125","13.725874323","74","56:e3:10:36:ce:21","ba:07:bc:f3:16:7a","172.20.0.3","172.20.0.2","TCP","48664 → 4433 [SYN] Seq=0 Win=64240 Len=0 MSS=1460 SACK_PERM TSval=2168005027 TSecr=0 WS=128"
"126","14.742989696","74","56:e3:10:36:ce:21","ba:07:bc:f3:16:7a","172.20.0.3","172.20.0.2","TCP","[TCP Retransmission] 48664 → 4433 [SYN] Seq=0 Win=64240 Len=0 MSS=1460 SACK_PERM TSval=2168006045 TSecr=0 WS=128"
"127","14.870910276","70","06:43:0b:6e:44:46","33:33:00:00:00:02",,,"ICMPv6","Router Solicitation from 06:43:0b:6e:44:46"
"128","15.766955106","74","56:e3:10:36:ce:21","ba:07:bc:f3:16:7a","172.20.0.3","172.20.0.2","TCP","[TCP Retransmission] 48664 → 4433 [SYN] Seq=0 Win=64240 Len=0 MSS=1460 SACK_PERM TSval=2168007069 TSecr=0 WS=128"
"129","20.374366882","74","56:e3:10:36:ce:21","ba:07:bc:f3:16:7a","172.20.0.3","172.20.0.2","TCP","[TCP Retransmission] 48664 → 4433 [SYN] Seq=0 Win=64240 Len=0 MSS=1460 SACK_PERM TSval=2168008093 TSecr=0 WS=128"
"130","21.398371149","74","56:e3:10:36:ce:21","ba:07:bc:f3:16:7a","172.20.0.3","172.20.0.2","TCP","[TCP Retransmission] 48664 → 4433 [SYN] Seq=0 Win=64240 Len=0 MSS=1460 SACK_PERM TSval=2168009117 TSecr=0 WS=128"
"131","21.398403269","74","ba:07:bc:f3:16:7a","56:e3:10:36:ce:21","172.20.0.2","172.20.0.3","TCP","4433 → 48664 [SYN, ACK] Seq=0 Ack=1 Win=65160 Len=0 MSS=1460 SACK_PERM TSval=2862580047 TSecr=2168005027 WS=128"
"132","21.398441896","66","56:e3:10:36:ce:21","ba:07:bc:f3:16:7a","172.20.0.3","172.20.0.2","TCP","48664 → 4433 [ACK] Seq=1 Ack=1 Win=64256 Len=0 TSval=2168009117 TSecr=2862580047"
"133","21.398544520","1353","56:e3:10:36:ce:21","ba:07:bc:f3:16:7a","172.20.0.3","172.20.0.2","TLSv1.2","Client Hello"
"134","21.398552697","66","ba:07:bc:f3:16:7a","56:e3:10:36:ce:21","172.20.0.2","172.20.0.3","TCP","4433 → 48664 [ACK] Seq=1 Ack=1288 Win=64128 Len=0 TSval=2862580047 TSecr=2168009117"
"135","21.400376751","1514","ba:07:bc:f3:16:7a","56:e3:10:36:ce:21","172.20.0.2","172.20.0.3","TLSv1.3","Server Hello, Change Cipher Spec, Application Data, Application Data, Application Data"
"136","21.400413413","66","56:e3:10:36:ce:21","ba:07:bc:f3:16:7a","172.20.0.3","172.20.0.2","TCP","48664 → 4433 [ACK] Seq=1288 Ack=1449 Win=64128 Len=0 TSval=2168009119 TSecr=2862580049"
"137","21.400423293","89","ba:07:bc:f3:16:7a","56:e3:10:36:ce:21","172.20.0.2","172.20.0.3","TLSv1.3","Application Data"
"138","21.400428578","66","56:e3:10:36:ce:21","ba:07:bc:f3:16:7a","172.20.0.3","172.20.0.2","TCP","48664 → 4433 [ACK] Seq=1288 Ack=1472 Win=64128 Len=0 TSval=2168009119 TSecr=2862580049"
"139","21.403446185","146","56:e3:10:36:ce:21","ba:07:bc:f3:16:7a","172.20.0.3","172.20.0.2","TLSv1.3","Change Cipher Spec, Application Data"
"140","21.403533738","66","56:e3:10:36:ce:21","ba:07:bc:f3:16:7a","172.20.0.3","172.20.0.2","TCP","48664 → 4433 [RST, ACK] Seq=1368 Ack=1472 Win=64128 Len=0 TSval=2168009122 TSecr=2862580049"
"141","21.418921696","74","56:e3:10:36:ce:21","ba:07:bc:f3:16:7a","172.20.0.3","172.20.0.2","TCP","57048 → 4433 [SYN] Seq=0 Win=64240 Len=0 MSS=1460 SACK_PERM TSval=2168009137 TSecr=0 WS=128"
"142","21.418954798","74","ba:07:bc:f3:16:7a","56:e3:10:36:ce:21","172.20.0.2","172.20.0.3","TCP","4433 → 57048 [SYN, ACK] Seq=0 Ack=1 Win=65160 Len=0 MSS=1460 SACK_PERM TSval=2862580067 TSecr=2168009137 WS=128"
"143","21.418976652","66","56:e3:10:36:ce:21","ba:07:bc:f3:16:7a","172.20.0.3","172.20.0.2","TCP","57048 → 4433 [ACK] Seq=1 Ack=1 Win=64256 Len=0 TSval=2168009137 TSecr=2862580067"
"144","21.419037188","1353","56:e3:10:36:ce:21","ba:07:bc:f3:16:7a","172.20.0.3","172.20.0.2","TLSv1.2","Client Hello"
"145","21.419042627","66","ba:07:bc:f3:16:7a","56:e3:10:36:ce:21","172.20.0.2","172.20.0.3","TCP","4433 → 57048 [ACK] Seq=1 Ack=1288 Win=64128 Len=0 TSval=2862580067 TSecr=2168009137"
"146","21.420717243","1537","ba:07:bc:f3:16:7a","56:e3:10:36:ce:21","172.20.0.2","172.20.0.3","TLSv1.3","Server Hello, Change Cipher Spec, Application Data, Application Data, Application Data, Application Data"
"147","21.420756485","66","56:e3:10:36:ce:21","ba:07:bc:f3:16:7a","172.20.0.3","172.20.0.2","TCP","57048 → 4433 [ACK] Seq=1288 Ack=1472 Win=64128 Len=0 TSval=2168009139 TSecr=2862580069"
"148","21.423588733","146","56:e3:10:36:ce:21","ba:07:bc:f3:16:7a","172.20.0.3","172.20.0.2","TLSv1.3","Change Cipher Spec, Application Data"
"149","21.423658203","66","56:e3:10:36:ce:21","ba:07:bc:f3:16:7a","172.20.0.3","172.20.0.2","TCP","57048 → 4433 [RST, ACK] Seq=1368 Ack=1472 Win=64128 Len=0 TSval=2168009142 TSecr=2862580069"
"150","21.438466038","74","56:e3:10:36:ce:21","ba:07:bc:f3:16:7a","172.20.0.3","172.20.0.2","TCP","57060 → 4433 [SYN] Seq=0 Win=64240 Len=0 MSS=1460 SACK_PERM TSval=2168009157 TSecr=0 WS=128"
"151","21.438495234","74","ba:07:bc:f3:16:7a","56:e3:10:36:ce:21","172.20.0.2","172.20.0.3","TCP","4433 → 57060 [SYN, ACK] Seq=0 Ack=1 Win=65160 Len=0 MSS=1460 SACK_PERM TSval=2862580087 TSecr=2168009157 WS=128"
"152","21.438513496","66","56:e3:10:36:ce:21","ba:07:bc:f3:16:7a","172.20.0.3","172.20.0.2","TCP","57060 → 4433 [ACK] Seq=1 Ack=1 Win=64256 Len=0 TSval=2168009157 TSecr=2862580087"
"153","21.438563944","1353","56:e3:10:36:ce:21","ba:07:bc:f3:16:7a","172.20.0.3","172.20.0.2","TLSv1.2","Client Hello"
"154","21.440259190","1537","ba:07:bc:f3:16:7a","56:e3:10:36:ce:21","172.20.0.2","172.20.0.3","TLSv1.3","Server Hello, Change Cipher Spec, Application Data, Application Data, Application Data, Application Data"
"155","21.440326708","66","56:e3:10:36:ce:21","ba:07:bc:f3:16:7a","172.20.0.3","172.20.0.2","TCP","57060 → 4433 [ACK] Seq=1288 Ack=1472 Win=64128 Len=0 TSval=2168009158 TSecr=2862580088"
"156","21.442982261","146","56:e3:10:36:ce:21","ba:07:bc:f3:16:7a","172.20.0.3","172.20.0.2","TLSv1.3","Change Cipher Spec, Application Data"
"157","21.443050282","66","56:e3:10:36:ce:21","ba:07:bc:f3:16:7a","172.20.0.3","172.20.0.2","TCP","57060 → 4433 [RST, ACK] Seq=1368 Ack=1472 Win=64128 Len=0 TSval=2168009161 TSecr=2862580088"
"158","21.458054549","74","56:e3:10:36:ce:21","ba:07:bc:f3:16:7a","172.20.0.3","172.20.0.2","TCP","57062 → 4433 [SYN] Seq=0 Win=64240 Len=0 MSS=1460 SACK_PERM TSval=2168009176 TSecr=0 WS=128"
"159","21.458080982","74","ba:07:bc:f3:16:7a","56:e3:10:36:ce:21","172.20.0.2","172.20.0.3","TCP","4433 → 57062 [SYN, ACK] Seq=0 Ack=1 Win=65160 Len=0 MSS=1460 SACK_PERM TSval=2862580106 TSecr=2168009176 WS=128"
"160","21.458099487","66","56:e3:10:36:ce:21","ba:07:bc:f3:16:7a","172.20.0.3","172.20.0.2","TCP","57062 → 4433 [ACK] Seq=1 Ack=1 Win=64256 Len=0 TSval=2168009176 TSecr=2862580106"
"161","21.458142932","1353","56:e3:10:36:ce:21","ba:07:bc:f3:16:7a","172.20.0.3","172.20.0.2","TLSv1.2","Client Hello"
"162","21.458147409","66","ba:07:bc:f3:16:7a","56:e3:10:36:ce:21","172.20.0.2","172.20.0.3","TCP","4433 → 57062 [ACK] Seq=1 Ack=1288 Win=64128 Len=0 TSval=2862580106 TSecr=2168009176"
"163","21.463323577","89","ba:07:bc:f3:16:7a","56:e3:10:36:ce:21","172.20.0.2","172.20.0.3","SSL","[TCP Previous segment not captured] , Continuation Data"
"164","21.463370641","78","56:e3:10:36:ce:21","ba:07:bc:f3:16:7a","172.20.0.3","172.20.0.2","TCP","[TCP Dup ACK 160#1] 57062 → 4433 [ACK] Seq=1288 Ack=1 Win=64256 Len=0 TSval=2168009182 TSecr=2862580106 SLE=1449 SRE=1472"
"165","21.463381532","1514","ba:07:bc:f3:16:7a","56:e3:10:36:ce:21","172.20.0.2","172.20.0.3","TCP","[TCP Retransmission] 4433 → 57062 [ACK] Seq=1 Ack=1288 Win=64128 Len=1448 TSval=2862580112 TSecr=2168009182"
"166","21.463398877","66","56:e3:10:36:ce:21","ba:07:bc:f3:16:7a","172.20.0.3","172.20.0.2","TCP","57062 → 4433 [ACK] Seq=1288 Ack=1472 Win=64128 Len=0 TSval=2168009182 TSecr=2862580112"
"167","21.466546869","146","56:e3:10:36:ce:21","ba:07:bc:f3:16:7a","172.20.0.3","172.20.0.2","TLSv1.2","Change Cipher Spec, Application Data"
"168","21.466630978","66","56:e3:10:36:ce:21","ba:07:bc:f3:16:7a","172.20.0.3","172.20.0.2","TCP","57062 → 4433 [RST, ACK] Seq=1368 Ack=1472 Win=64128 Len=0 TSval=2168009185 TSecr=2862580112"
"169","21.481619931","74","56:e3:10:36:ce:21","ba:07:bc:f3:16:7a","172.20.0.3","172.20.0.2","TCP","57066 → 4433 [SYN] Seq=0 Win=64240 Len=0 MSS=1460 SACK_PERM TSval=2168009200 TSecr=0 WS=128"
"170","21.481648129","74","ba:07:bc:f3:16:7a","56:e3:10:36:ce:21","172.20.0.2","172.20.0.3","TCP","4433 → 57066 [SYN, ACK] Seq=0 Ack=1 Win=65160 Len=0 MSS=1460 SACK_PERM TSval=2862580130 TSecr=2168009200 WS=128"
"171","21.481669333","66","56:e3:10:36:ce:21","ba:07:bc:f3:16:7a","172.20.0.3","172.20.0.2","TCP","57066 → 4433 [ACK] Seq=1 Ack=1 Win=64256 Len=0 TSval=2168009200 TSecr=2862580130"
"172","21.481727771","1353","56:e3:10:36:ce:21","ba:07:bc:f3:16:7a","172.20.0.3","172.20.0.2","TLSv1.2","Client Hello"
"173","21.481733177","66","ba:07:bc:f3:16:7a","56:e3:10:36:ce:21","172.20.0.2","172.20.0.3","TCP","4433 → 57066 [ACK] Seq=1 Ack=1288 Win=64128 Len=0 TSval=2862580130 TSecr=2168009200"
"174","21.483514203","1537","ba:07:bc:f3:16:7a","56:e3:10:36:ce:21","172.20.0.2","172.20.0.3","TLSv1.3","Server Hello, Change Cipher Spec, Application Data, Application Data, Application Data, Application Data"
"175","21.483548066","66","56:e3:10:36:ce:21","ba:07:bc:f3:16:7a","172.20.0.3","172.20.0.2","TCP","57066 → 4433 [ACK] Seq=1288 Ack=1472 Win=64128 Len=0 TSval=2168009202 TSecr=2862580132"
"176","21.486106746","146","56:e3:10:36:ce:21","ba:07:bc:f3:16:7a","172.20.0.3","172.20.0.2","TLSv1.3","Change Cipher Spec, Application Data"
"177","21.486168945","66","56:e3:10:36:ce:21","ba:07:bc:f3:16:7a","172.20.0.3","172.20.0.2","TCP","57066 → 4433 [RST, ACK] Seq=1368 Ack=1472 Win=64128 Len=0 TSval=2168009204 TSecr=2862580132"
"178","21.501028929","74","56:e3:10:36:ce:21","ba:07:bc:f3:16:7a","172.20.0.3","172.20.0.2","TCP","57074 → 4433 [SYN] Seq=0 Win=64240 Len=0 MSS=1460 SACK_PERM TSval=2168009219 TSecr=0 WS=128"
"179","22.550355473","74","ba:07:bc:f3:16:7a","56:e3:10:36:ce:21","172.20.0.2","172.20.0.3","TCP","4433 → 57074 [SYN, ACK] Seq=0 Ack=1 Win=65160 Len=0 MSS=1460 SACK_PERM TSval=2862581199 TSecr=2168009219 WS=128"
"180","22.550395894","74","56:e3:10:36:ce:21","ba:07:bc:f3:16:7a","172.20.0.3","172.20.0.2","TCP","[TCP Retransmission] 57074 → 4433 [SYN] Seq=0 Win=64240 Len=0 MSS=1460 SACK_PERM TSval=2168010269 TSecr=0 WS=128"
"181","22.550449626","66","56:e3:10:36:ce:21","ba:07:bc:f3:16:7a","172.20.0.3","172.20.0.2","TCP","57074 → 4433 [ACK] Seq=1 Ack=1 Win=64256 Len=0 TSval=2168010269 TSecr=2862581199"
"182","22.550542157","1353","56:e3:10:36:ce:21","ba:07:bc:f3:16:7a","172.20.0.3","172.20.0.2","TLSv1.2","Client Hello"
"183","22.550556352","66","ba:07:bc:f3:16:7a","56:e3:10:36:ce:21","172.20.0.2","172.20.0.3","TCP","4433 → 57074 [ACK] Seq=1 Ack=1288 Win=64128 Len=0 TSval=2862581199 TSecr=2168010269"
"184","22.552364821","1514","ba:07:bc:f3:16:7a","56:e3:10:36:ce:21","172.20.0.2","172.20.0.3","TLSv1.3","Server Hello, Change Cipher Spec, Application Data, Application Data, Application Data"
"185","22.552420529","66","56:e3:10:36:ce:21","ba:07:bc:f3:16:7a","172.20.0.3","172.20.0.2","TCP","57074 → 4433 [ACK] Seq=1288 Ack=1449 Win=64128 Len=0 TSval=2168010271 TSecr=2862581201"
"186","22.552431929","89","ba:07:bc:f3:16:7a","56:e3:10:36:ce:21","172.20.0.2","172.20.0.3","TLSv1.3","Application Data"
"187","22.552437527","66","56:e3:10:36:ce:21","ba:07:bc:f3:16:7a","172.20.0.3","172.20.0.2","TCP","57074 → 4433 [ACK] Seq=1288 Ack=1472 Win=64128 Len=0 TSval=2168010271 TSecr=2862581201"
"188","22.555333338","146","56:e3:10:36:ce:21","ba:07:bc:f3:16:7a","172.20.0.3","172.20.0.2","TLSv1.3","Change Cipher Spec, Application Data"
"189","22.555408704","66","56:e3:10:36:ce:21","ba:07:bc:f3:16:7a","172.20.0.3","172.20.0.2","TCP","57074 → 4433 [RST, ACK] Seq=1368 Ack=1472 Win=64128 Len=0 TSval=2168010274 TSecr=2862581201"
"190","22.570086733","74","56:e3:10:36:ce:21","ba:07:bc:f3:16:7a","172.20.0.3","172.20.0.2","TCP","57080 → 4433 [SYN] Seq=0 Win=64240 Len=0 MSS=1460 SACK_PERM TSval=2168010288 TSecr=0 WS=128"
"191","22.570114550","74","ba:07:bc:f3:16:7a","56:e3:10:36:ce:21","172.20.0.2","172.20.0.3","TCP","4433 → 57080 [SYN, ACK] Seq=0 Ack=1 Win=65160 Len=0 MSS=1460 SACK_PERM TSval=2862581218 TSecr=2168010288 WS=128"
"192","22.570134026","66","56:e3:10:36:ce:21","ba:07:bc:f3:16:7a","172.20.0.3","172.20.0.2","TCP","57080 → 4433 [ACK] Seq=1 Ack=1 Win=64256 Len=0 TSval=2168010288 TSecr=2862581218"
"193","22.570192843","1353","56:e3:10:36:ce:21","ba:07:bc:f3:16:7a","172.20.0.3","172.20.0.2","TLSv1.2","Client Hello"
"194","22.570205265","66","ba:07:bc:f3:16:7a","56:e3:10:36:ce:21","172.20.0.2","172.20.0.3","TCP","4433 → 57080 [ACK] Seq=1 Ack=1288 Win=64128 Len=0 TSval=2862581218 TSecr=2168010288"
"195","22.571941749","1537","ba:07:bc:f3:16:7a","56:e3:10:36:ce:21","172.20.0.2","172.20.0.3","TLSv1.3","Server Hello, Change Cipher Spec, Application Data, Application Data, Application Data, Application Data"
"196","22.571990898","66","56:e3:10:36:ce:21","ba:07:bc:f3:16:7a","172.20.0.3","172.20.0.2","TCP","57080 → 4433 [ACK] Seq=1288 Ack=1472 Win=64128 Len=0 TSval=2168010290 TSecr=2862581220"
"197","22.575106787","146","56:e3:10:36:ce:21","ba:07:bc:f3:16:7a","172.20.0.3","172.20.0.2","TLSv1.3","Change Cipher Spec, Application Data"
"198","22.575203644","66","56:e3:10:36:ce:21","ba:07:bc:f3:16:7a","172.20.0.3","172.20.0.2","TCP","57080 → 4433 [RST, ACK] Seq=1368 Ack=1472 Win=64128 Len=0 TSval=2168010293 TSecr=2862581220"
"199","22.589617287","74","56:e3:10:36:ce:21","ba:07:bc:f3:16:7a","172.20.0.3","172.20.0.2","TCP","57082 → 4433 [SYN] Seq=0 Win=64240 Len=0 MSS=1460 SACK_PERM TSval=2168010308 TSecr=0 WS=128"
"200","22.589647017","74","ba:07:bc:f3:16:7a","56:e3:10:36:ce:21","172.20.0.2","172.20.0.3","TCP","4433 → 57082 [SYN, ACK] Seq=0 Ack=1 Win=65160 Len=0 MSS=1460 SACK_PERM TSval=2862581238 TSecr=2168010308 WS=128"
"201","22.589666943","66","56:e3:10:36:ce:21","ba:07:bc:f3:16:7a","172.20.0.3","172.20.0.2","TCP","57082 → 4433 [ACK] Seq=1 Ack=1 Win=64256 Len=0 TSval=2168010308 TSecr=2862581238"
"202","22.589724843","1353","56:e3:10:36:ce:21","ba:07:bc:f3:16:7a","172.20.0.3","172.20.0.2","TLSv1.2","Client Hello"
"203","22.589732467","66","ba:07:bc:f3:16:7a","56:e3:10:36:ce:21","172.20.0.2","172.20.0.3","TCP","4433 → 57082 [ACK] Seq=1 Ack=1288 Win=64128 Len=0 TSval=2862581238 TSecr=2168010308"
"204","22.591459097","1537","ba:07:bc:f3:16:7a","56:e3:10:36:ce:21","172.20.0.2","172.20.0.3","TLSv1.3","Server Hello, Change Cipher Spec, Application Data, Application Data, Application Data, Application Data"
"205","22.591490844","66","56:e3:10:36:ce:21","ba:07:bc:f3:16:7a","172.20.0.3","172.20.0.2","TCP","57082 → 4433 [ACK] Seq=1288 Ack=1472 Win=64128 Len=0 TSval=2168010310 TSecr=2862581240"
"206","22.594002451","146","56:e3:10:36:ce:21","ba:07:bc:f3:16:7a","172.20.0.3","172.20.0.2","TLSv1.3","Change Cipher Spec, Application Data"
"207","22.594062751","66","56:e3:10:36:ce:21","ba:07:bc:f3:16:7a","172.20.0.3","172.20.0.2","TCP","57082 → 4433 [RST, ACK] Seq=1368 Ack=1472 Win=64128 Len=0 TSval=2168010312 TSecr=2862581240"
"208","22.607922439","74","56:e3:10:36:ce:21","ba:07:bc:f3:16:7a","172.20.0.3","172.20.0.2","TCP","57084 → 4433 [SYN] Seq=0 Win=64240 Len=0 MSS=1460 SACK_PERM TSval=2168010326 TSecr=0 WS=128"
"209","22.607948732","74","ba:07:bc:f3:16:7a","56:e3:10:36:ce:21","172.20.0.2","172.20.0.3","TCP","4433 → 57084 [SYN, ACK] Seq=0 Ack=1 Win=65160 Len=0 MSS=1460 SACK_PERM TSval=2862581256 TSecr=2168010326 WS=128"
"210","22.607967419","66","56:e3:10:36:ce:21","ba:07:bc:f3:16:7a","172.20.0.3","172.20.0.2","TCP","57084 → 4433 [ACK] Seq=1 Ack=1 Win=64256 Len=0 TSval=2168010326 TSecr=2862581256"
"211","22.608008678","1353","56:e3:10:36:ce:21","ba:07:bc:f3:16:7a","172.20.0.3","172.20.0.2","TLSv1.2","Client Hello"
"212","22.608015141","66","ba:07:bc:f3:16:7a","56:e3:10:36:ce:21","172.20.0.2","172.20.0.3","TCP","4433 → 57084 [ACK] Seq=1 Ack=1288 Win=64128 Len=0 TSval=2862581256 TSecr=2168010326"
"213","22.613317152","89","ba:07:bc:f3:16:7a","56:e3:10:36:ce:21","172.20.0.2","172.20.0.3","SSL","[TCP Previous segment not captured] , Continuation Data"
"214","22.613350472","78","56:e3:10:36:ce:21","ba:07:bc:f3:16:7a","172.20.0.3","172.20.0.2","TCP","[TCP Dup ACK 210#1] 57084 → 4433 [ACK] Seq=1288 Ack=1 Win=64256 Len=0 TSval=2168010332 TSecr=2862581256 SLE=1449 SRE=1472"
"215","22.822333849","1514","ba:07:bc:f3:16:7a","56:e3:10:36:ce:21","172.20.0.2","172.20.0.3","TCP","[TCP Retransmission] 4433 → 57084 [ACK] Seq=1 Ack=1288 Win=64128 Len=1448 TSval=2862581471 TSecr=2168010332"
"216","22.822393951","66","56:e3:10:36:ce:21","ba:07:bc:f3:16:7a","172.20.0.3","172.20.0.2","TCP","57084 → 4433 [ACK] Seq=1288 Ack=1472 Win=64128 Len=0 TSval=2168010541 TSecr=2862581471"
"217","22.825506921","146","56:e3:10:36:ce:21","ba:07:bc:f3:16:7a","172.20.0.3","172.20.0.2","TLSv1.2","Change Cipher Spec, Application Data"
"218","22.825582114","66","56:e3:10:36:ce:21","ba:07:bc:f3:16:7a","172.20.0.3","172.20.0.2","TCP","57084 → 4433 [RST, ACK] Seq=1368 Ack=1472 Win=64128 Len=0 TSval=2168010544 TSecr=2862581471"
"219","22.840105915","74","56:e3:10:36:ce:21","ba:07:bc:f3:16:7a","172.20.0.3","172.20.0.2","TCP","57094 → 4433 [SYN] Seq=0 Win=64240 Len=0 MSS=1460 SACK_PERM TSval=2168010558 TSecr=0 WS=128"
"220","22.840140600","74","ba:07:bc:f3:16:7a","56:e3:10:36:ce:21","172.20.0.2","172.20.0.3","TCP","4433 → 57094 [SYN, ACK] Seq=0 Ack=1 Win=65160 Len=0 MSS=1460 SACK_PERM TSval=2862581488 TSecr=2168010558 WS=128"
"221","22.840164956","66","56:e3:10:36:ce:21","ba:07:bc:f3:16:7a","172.20.0.3","172.20.0.2","TCP","57094 → 4433 [ACK] Seq=1 Ack=1 Win=64256 Len=0 TSval=2168010558 TSecr=2862581488"
"222","22.840241512","1353","56:e3:10:36:ce:21","ba:07:bc:f3:16:7a","172.20.0.3","172.20.0.2","TLSv1.2","Client Hello"
"223","22.840246866","66","ba:07:bc:f3:16:7a","56:e3:10:36:ce:21","172.20.0.2","172.20.0.3","TCP","4433 → 57094 [ACK] Seq=1 Ack=1288 Win=64128 Len=0 TSval=2862581488 TSecr=2168010558"
