frame.number,frame.time_relative,frame.len,eth.src,eth.dst,ip.src,ip.dst,_ws.col.protocol,_ws.col.info
"1","0.000000000","42","86:9a:63:33:da:40","ff:ff:ff:ff:ff:ff",,,"ARP","ARP Announcement for 172.20.0.3"
"2","0.030423536","42","86:9a:63:33:da:40","ff:ff:ff:ff:ff:ff",,,"ARP","Who has 172.20.0.2? Tell 172.20.0.3"
"3","0.030450535","42","0a:4e:2e:b0:80:99","86:9a:63:33:da:40",,,"ARP","172.20.0.2 is at 0a:4e:2e:b0:80:99"
"4","0.030456477","74","86:9a:63:33:da:40","0a:4e:2e:b0:80:99","172.20.0.3","172.20.0.2","TCP","55654 → 4433 [SYN] Seq=0 Win=64240 Len=0 MSS=1460 SACK_PERM TSval=2168850807 TSecr=0 WS=128"
"5","0.030472910","74","0a:4e:2e:b0:80:99","86:9a:63:33:da:40","172.20.0.2","172.20.0.3","TCP","4433 → 55654 [SYN, ACK] Seq=0 Ack=1 Win=65160 Len=0 MSS=1460 SACK_PERM TSval=2863421737 TSecr=2168850807 WS=128"
"6","0.030487640","66","86:9a:63:33:da:40","0a:4e:2e:b0:80:99","172.20.0.3","172.20.0.2","TCP","55654 → 4433 [ACK] Seq=1 Ack=1 Win=64256 Len=0 TSval=2168850807 TSecr=2863421737"
"7","0.030529502","552","86:9a:63:33:da:40","0a:4e:2e:b0:80:99","172.20.0.3","172.20.0.2","TLSv1.2","Client Hello"
"8","0.030535777","66","0a:4e:2e:b0:80:99","86:9a:63:33:da:40","172.20.0.2","172.20.0.3","TCP","4433 → 55654 [ACK] Seq=1 Ack=487 Win=64768 Len=0 TSval=2863421737 TSecr=2168850807"
"9","0.032778463","925","0a:4e:2e:b0:80:99","86:9a:63:33:da:40","172.20.0.2","172.20.0.3","TLSv1.3","Server Hello, Change Cipher Spec, Application Data, Application Data, Application Data, Application Data"
"10","0.032809562","66","86:9a:63:33:da:40","0a:4e:2e:b0:80:99","172.20.0.3","172.20.0.2","TCP","55654 → 4433 [ACK] Seq=487 Ack=860 Win=63488 Len=0 TSval=2168850809 TSecr=2863421739"
"11","0.035419021","146","86:9a:63:33:da:40","0a:4e:2e:b0:80:99","172.20.0.3","172.20.0.2","TLSv1.3","Change Cipher Spec, Application Data"
"12","0.035470829","66","86:9a:63:33:da:40","0a:4e:2e:b0:80:99","172.20.0.3","172.20.0.2","TCP","55654 → 4433 [RST, ACK] Seq=567 Ack=860 Win=64000 Len=0 TSval=2168850812 TSecr=2863421739"
"13","0.046851904","74","86:9a:63:33:da:40","0a:4e:2e:b0:80:99","172.20.0.3","172.20.0.2","TCP","55662 → 4433 [SYN] Seq=0 Win=64240 Len=0 MSS=1460 SACK_PERM TSval=2168850823 TSecr=0 WS=128"
"14","0.046879240","74","0a:4e:2e:b0:80:99","86:9a:63:33:da:40","172.20.0.2","172.20.0.3","TCP","4433 → 55662 [SYN, ACK] Seq=0 Ack=1 Win=65160 Len=0 MSS=1460 SACK_PERM TSval=2863421753 TSecr=2168850823 WS=128"
"15","0.046896996","66","86:9a:63:33:da:40","0a:4e:2e:b0:80:99","172.20.0.3","172.20.0.2","TCP","55662 → 4433 [ACK] Seq=1 Ack=1 Win=64256 Len=0 TSval=2168850823 TSecr=2863421753"
"16","0.046945317","552","86:9a:63:33:da:40","0a:4e:2e:b0:80:99","172.20.0.3","172.20.0.2","TLSv1.2","Client Hello"
"17","0.046952707","66","0a:4e:2e:b0:80:99","86:9a:63:33:da:40","172.20.0.2","172.20.0.3","TCP","4433 → 55662 [ACK] Seq=1 Ack=487 Win=64768 Len=0 TSval=2863421753 TSecr=2168850823"
"18","0.048970233","923","0a:4e:2e:b0:80:99","86:9a:63:33:da:40","172.20.0.2","172.20.0.3","TLSv1.3","Server Hello, Change Cipher Spec, Application Data, Application Data, Application Data, Application Data"
"19","0.049007500","66","86:9a:63:33:da:40","0a:4e:2e:b0:80:99","172.20.0.3","172.20.0.2","TCP","55662 → 4433 [ACK] Seq=487 Ack=858 Win=63488 Len=0 TSval=2168850825 TSecr=2863421755"
"20","0.051739521","146","86:9a:63:33:da:40","0a:4e:2e:b0:80:99","172.20.0.3","172.20.0.2","TLSv1.3","Change Cipher Spec, Application Data"
"21","0.051816922","66","86:9a:63:33:da:40","0a:4e:2e:b0:80:99","172.20.0.3","172.20.0.2","TCP","55662 → 4433 [RST, ACK] Seq=567 Ack=858 Win=64000 Len=0 TSval=2168850828 TSecr=2863421755"
"22","0.063230696","74","86:9a:63:33:da:40","0a:4e:2e:b0:80:99","172.20.0.3","172.20.0.2","TCP","55672 → 4433 [SYN] Seq=0 Win=64240 Len=0 MSS=1460 SACK_PERM TSval=2168850840 TSecr=0 WS=128"
"23","0.063257988","74","0a:4e:2e:b0:80:99","86:9a:63:33:da:40","172.20.0.2","172.20.0.3","TCP","4433 → 55672 [SYN, ACK] Seq=0 Ack=1 Win=65160 Len=0 MSS=1460 SACK_PERM TSval=2863421770 TSecr=2168850840 WS=128"
"24","0.063274707","66","86:9a:63:33:da:40","0a:4e:2e:b0:80:99","172.20.0.3","172.20.0.2","TCP","55672 → 4433 [ACK] Seq=1 Ack=1 Win=64256 Len=0 TSval=2168850840 TSecr=2863421770"
"25","0.063313914","552","86:9a:63:33:da:40","0a:4e:2e:b0:80:99","172.20.0.3","172.20.0.2","TLSv1.2","Client Hello"
"26","0.063319053","66","0a:4e:2e:b0:80:99","86:9a:63:33:da:40","172.20.0.2","172.20.0.3","TCP","4433 → 55672 [ACK] Seq=1 Ack=487 Win=64768 Len=0 TSval=2863421770 TSecr=2168850840"
"27","0.065370201","924","0a:4e:2e:b0:80:99","86:9a:63:33:da:40","172.20.0.2","172.20.0.3","TLSv1.3","Server Hello, Change Cipher Spec, Application Data, Application Data, Application Data, Application Data"
"28","0.065405509","66","86:9a:63:33:da:40","0a:4e:2e:b0:80:99","172.20.0.3","172.20.0.2","TCP","55672 → 4433 [ACK] Seq=487 Ack=859 Win=63488 Len=0 TSval=2168850842 TSecr=2863421772"
"29","0.069023469","146","86:9a:63:33:da:40","0a:4e:2e:b0:80:99","172.20.0.3","172.20.0.2","TLSv1.3","Change Cipher Spec, Application Data"
"30","0.069105148","66","86:9a:63:33:da:40","0a:4e:2e:b0:80:99","172.20.0.3","172.20.0.2","TCP","55672 → 4433 [RST, ACK] Seq=567 Ack=859 Win=64000 Len=0 TSval=2168850845 TSecr=2863421772"
"31","0.080308193","74","86:9a:63:33:da:40","0a:4e:2e:b0:80:99","172.20.0.3","172.20.0.2","TCP","55678 → 4433 [SYN] Seq=0 Win=64240 Len=0 MSS=1460 SACK_PERM TSval=2168850857 TSecr=0 WS=128"
"32","1.001138463","42","86:9a:63:33:da:40","ff:ff:ff:ff:ff:ff",,,"ARP","ARP Announcement for 172.20.0.3"
"33","1.092211496","74","0a:4e:2e:b0:80:99","86:9a:63:33:da:40","172.20.0.2","172.20.0.3","TCP","4433 → 55678 [SYN, ACK] Seq=0 Ack=1 Win=65160 Len=0 MSS=1460 SACK_PERM TSval=2863422799 TSecr=2168850857 WS=128"
"34","1.092229254","74","86:9a:63:33:da:40","0a:4e:2e:b0:80:99","172.20.0.3","172.20.0.2","TCP","[TCP Retransmission] 55678 → 4433 [SYN] Seq=0 Win=64240 Len=0 MSS=1460 SACK_PERM TSval=2168851869 TSecr=0 WS=128"
"35","1.092244090","74","0a:4e:2e:b0:80:99","86:9a:63:33:da:40","172.20.0.2","172.20.0.3","TCP","[TCP Out-Of-Order] 4433 → 55678 [SYN, ACK] Seq=0 Ack=1 Win=65160 Len=0 MSS=1460 SACK_PERM TSval=2863422799 TSecr=2168850857 WS=128"
"36","1.092280924","66","86:9a:63:33:da:40","0a:4e:2e:b0:80:99","172.20.0.3","172.20.0.2","TCP","55678 → 4433 [ACK] Seq=1 Ack=1 Win=64256 Len=0 TSval=2168851869 TSecr=2863422799"
"37","1.092312339","66","86:9a:63:33:da:40","0a:4e:2e:b0:80:99","172.20.0.3","172.20.0.2","TCP","[TCP Dup ACK 36#1] 55678 → 4433 [ACK] Seq=1 Ack=1 Win=64256 Len=0 TSval=2168851869 TSecr=2863422799"
"38","1.092379943","552","86:9a:63:33:da:40","0a:4e:2e:b0:80:99","172.20.0.3","172.20.0.2","TLSv1.2","Client Hello"
"39","1.094546915","924","0a:4e:2e:b0:80:99","86:9a:63:33:da:40","172.20.0.2","172.20.0.3","TLSv1.3","Server Hello, Change Cipher Spec, Application Data, Application Data, Application Data, Application Data"
"40","1.094584482","66","86:9a:63:33:da:40","0a:4e:2e:b0:80:99","172.20.0.3","172.20.0.2","TCP","55678 → 4433 [ACK] Seq=487 Ack=859 Win=63488 Len=0 TSval=2168851871 TSecr=2863422801"
"41","1.097371975","146","86:9a:63:33:da:40","0a:4e:2e:b0:80:99","172.20.0.3","172.20.0.2","TLSv1.3","Change Cipher Spec, Application Data"
"42","1.097437681","66","86:9a:63:33:da:40","0a:4e:2e:b0:80:99","172.20.0.3","172.20.0.2","TCP","55678 → 4433 [RST, ACK] Seq=567 Ack=859 Win=64000 Len=0 TSval=2168851874 TSecr=2863422801"
"43","1.108443835","74","86:9a:63:33:da:40","0a:4e:2e:b0:80:99","172.20.0.3","172.20.0.2","TCP","55692 → 4433 [SYN] Seq=0 Win=64240 Len=0 MSS=1460 SACK_PERM TSval=2168851885 TSecr=0 WS=128"
"44","2.000754708","42","86:9a:63:33:da:40","ff:ff:ff:ff:ff:ff",,,"ARP","ARP Announcement for 172.20.0.3"
"45","2.116240524","74","86:9a:63:33:da:40","0a:4e:2e:b0:80:99","172.20.0.3","172.20.0.2","TCP","[TCP Retransmission] 55692 → 4433 [SYN] Seq=0 Win=64240 Len=0 MSS=1460 SACK_PERM TSval=2168852893 TSecr=0 WS=128"
"46","2.116257940","74","0a:4e:2e:b0:80:99","86:9a:63:33:da:40","172.20.0.2","172.20.0.3","TCP","4433 → 55692 [SYN, ACK] Seq=0 Ack=1 Win=65160 Len=0 MSS=1460 SACK_PERM TSval=2863423823 TSecr=2168851885 WS=128"
"47","2.116299256","66","86:9a:63:33:da:40","0a:4e:2e:b0:80:99","172.20.0.3","172.20.0.2","TCP","55692 → 4433 [ACK] Seq=1 Ack=1 Win=64256 Len=0 TSval=2168852893 TSecr=2863423823"
"48","2.116407596","552","86:9a:63:33:da:40","0a:4e:2e:b0:80:99","172.20.0.3","172.20.0.2","TLSv1.2","Client Hello"
"49","2.118444367","925","0a:4e:2e:b0:80:99","86:9a:63:33:da:40","172.20.0.2","172.20.0.3","TLSv1.3","Server Hello, Change Cipher Spec, Application Data, Application Data, Application Data, Application Data"
"50","2.118473910","66","86:9a:63:33:da:40","0a:4e:2e:b0:80:99","172.20.0.3","172.20.0.2","TCP","55692 → 4433 [ACK] Seq=487 Ack=860 Win=63488 Len=0 TSval=2168852895 TSecr=2863423825"
"51","2.121236667","146","86:9a:63:33:da:40","0a:4e:2e:b0:80:99","172.20.0.3","172.20.0.2","TLSv1.3","Change Cipher Spec, Application Data"
"52","2.121314337","66","86:9a:63:33:da:40","0a:4e:2e:b0:80:99","172.20.0.3","172.20.0.2","TCP","55692 → 4433 [RST, ACK] Seq=567 Ack=860 Win=64000 Len=0 TSval=2168852898 TSecr=2863423825"
"53","2.133072952","74","86:9a:63:33:da:40","0a:4e:2e:b0:80:99","172.20.0.3","172.20.0.2","TCP","55708 → 4433 [SYN] Seq=0 Win=64240 Len=0 MSS=1460 SACK_PERM TSval=2168852909 TSecr=0 WS=128"
"54","2.133101171","74","0a:4e:2e:b0:80:99","86:9a:63:33:da:40","172.20.0.2","172.20.0.3","TCP","4433 → 55708 [SYN, ACK] Seq=0 Ack=1 Win=65160 Len=0 MSS=1460 SACK_PERM TSval=2863423839 TSecr=2168852909 WS=128"
"55","2.133121644","66","86:9a:63:33:da:40","0a:4e:2e:b0:80:99","172.20.0.3","172.20.0.2","TCP","55708 → 4433 [ACK] Seq=1 Ack=1 Win=64256 Len=0 TSval=2168852909 TSecr=2863423839"
"56","2.133172675","552","86:9a:63:33:da:40","0a:4e:2e:b0:80:99","172.20.0.3","172.20.0.2","TLSv1.2","Client Hello"
"57","2.135179846","923","0a:4e:2e:b0:80:99","86:9a:63:33:da:40","172.20.0.2","172.20.0.3","TLSv1.3","Server Hello, Change Cipher Spec, Application Data, Application Data, Application Data, Application Data"
"58","2.135211892","66","86:9a:63:33:da:40","0a:4e:2e:b0:80:99","172.20.0.3","172.20.0.2","TCP","55708 → 4433 [ACK] Seq=487 Ack=858 Win=63488 Len=0 TSval=2168852912 TSecr=2863423842"
"59","2.137766755","146","86:9a:63:33:da:40","0a:4e:2e:b0:80:99","172.20.0.3","172.20.0.2","TLSv1.3","Change Cipher Spec, Application Data"
"60","2.137816562","66","86:9a:63:33:da:40","0a:4e:2e:b0:80:99","172.20.0.3","172.20.0.2","TCP","55708 → 4433 [RST, ACK] Seq=567 Ack=858 Win=64000 Len=0 TSval=2168852914 TSecr=2863423842"
"61","2.150240870","74","86:9a:63:33:da:40","0a:4e:2e:b0:80:99","172.20.0.3","172.20.0.2","TCP","55724 → 4433 [SYN] Seq=0 Win=64240 Len=0 MSS=1460 SACK_PERM TSval=2168852927 TSecr=0 WS=128"
"62","2.150269398","74","0a:4e:2e:b0:80:99","86:9a:63:33:da:40","172.20.0.2","172.20.0.3","TCP","4433 → 55724 [SYN, ACK] Seq=0 Ack=1 Win=65160 Len=0 MSS=1460 SACK_PERM TSval=2863423857 TSecr=2168852927 WS=128"
"63","2.150286687","66","86:9a:63:33:da:40","0a:4e:2e:b0:80:99","172.20.0.3","172.20.0.2","TCP","55724 → 4433 [ACK] Seq=1 Ack=1 Win=64256 Len=0 TSval=2168852927 TSecr=2863423857"
"64","2.150340557","552","86:9a:63:33:da:40","0a:4e:2e:b0:80:99","172.20.0.3","172.20.0.2","TLSv1.2","Client Hello"
"65","2.356212966","552","86:9a:63:33:da:40","0a:4e:2e:b0:80:99","172.20.0.3","172.20.0.2","TCP","[TCP Retransmission] 55724 → 4433 [PSH, ACK] Seq=1 Ack=1 Win=64256 Len=486 TSval=2168853133 TSecr=2863423857"
"66","2.356235099","78","0a:4e:2e:b0:80:99","86:9a:63:33:da:40","172.20.0.2","172.20.0.3","TCP","[TCP Previous segment not captured] 4433 → 55724 [ACK] Seq=858 Ack=487 Win=64768 Len=0 TSval=2863424063 TSecr=2168853133 SLE=1 SRE=487"
"67","2.564193510","923","0a:4e:2e:b0:80:99","86:9a:63:33:da:40","172.20.0.2","172.20.0.3","TCP","[TCP Retransmission] 4433 → 55724 [PSH, ACK] Seq=1 Ack=487 Win=64768 Len=857 TSval=2863424271 TSecr=2168853133"
"68","2.564276304","66","86:9a:63:33:da:40","0a:4e:2e:b0:80:99","172.20.0.3","172.20.0.2","TCP","55724 → 4433 [ACK] Seq=487 Ack=858 Win=63488 Len=0 TSval=2168853341 TSecr=2863424271"
"69","2.567160102","146","86:9a:63:33:da:40","0a:4e:2e:b0:80:99","172.20.0.3","172.20.0.2","TLSv1.2","Change Cipher Spec, Application Data"
"70","2.567187224","66","0a:4e:2e:b0:80:99","86:9a:63:33:da:40","172.20.0.2","172.20.0.3","TCP","4433 → 55724 [ACK] Seq=858 Ack=567 Win=64768 Len=0 TSval=2863424274 TSecr=2168853343"
"71","2.567251057","66","86:9a:63:33:da:40","0a:4e:2e:b0:80:99","172.20.0.3","172.20.0.2","TCP","55724 → 4433 [RST, ACK] Seq=567 Ack=858 Win=64000 Len=0 TSval=2168853344 TSecr=2863424274"
"72","2.579202032","74","86:9a:63:33:da:40","0a:4e:2e:b0:80:99","172.20.0.3","172.20.0.2","TCP","55736 → 4433 [SYN] Seq=0 Win=64240 Len=0 MSS=1460 SACK_PERM TSval=2168853356 TSecr=0 WS=128"
"73","2.579234016","74","0a:4e:2e:b0:80:99","86:9a:63:33:da:40","172.20.0.2","172.20.0.3","TCP","4433 → 55736 [SYN, ACK] Seq=0 Ack=1 Win=65160 Len=0 MSS=1460 SACK_PERM TSval=2863424286 TSecr=2168853356 WS=128"
"74","2.579254850","66","86:9a:63:33:da:40","0a:4e:2e:b0:80:99","172.20.0.3","172.20.0.2","TCP","55736 → 4433 [ACK] Seq=1 Ack=1 Win=64256 Len=0 TSval=2168853356 TSecr=2863424286"
"75","2.579315586","552","86:9a:63:33:da:40","0a:4e:2e:b0:80:99","172.20.0.3","172.20.0.2","TLSv1.2","Client Hello"
"76","2.579321659","66","0a:4e:2e:b0:80:99","86:9a:63:33:da:40","172.20.0.2","172.20.0.3","TCP","4433 → 55736 [ACK] Seq=1 Ack=487 Win=64768 Len=0 TSval=2863424286 TSecr=2168853356"
"77","2.581277429","925","0a:4e:2e:b0:80:99","86:9a:63:33:da:40","172.20.0.2","172.20.0.3","TLSv1.3","Server Hello, Change Cipher Spec, Application Data, Application Data, Application Data, Application Data"
"78","2.581310863","66","86:9a:63:33:da:40","0a:4e:2e:b0:80:99","172.20.0.3","172.20.0.2","TCP","55736 → 4433 [ACK] Seq=487 Ack=860 Win=63488 Len=0 TSval=2168853358 TSecr=2863424288"
"79","2.583971241","146","86:9a:63:33:da:40","0a:4e:2e:b0:80:99","172.20.0.3","172.20.0.2","TLSv1.3","Change Cipher Spec, Application Data"
"80","2.584040373","66","86:9a:63:33:da:40","0a:4e:2e:b0:80:99","172.20.0.3","172.20.0.2","TCP","55736 → 4433 [RST, ACK] Seq=567 Ack=860 Win=64000 Len=0 TSval=2168853360 TSecr=2863424288"
"81","2.599925809","74","86:9a:63:33:da:40","0a:4e:2e:b0:80:99","172.20.0.3","172.20.0.2","TCP","55748 → 4433 [SYN] Seq=0 Win=64240 Len=0 MSS=1460 SACK_PERM TSval=2168853376 TSecr=0 WS=128"
"82","3.652236755","74","86:9a:63:33:da:40","0a:4e:2e:b0:80:99","172.20.0.3","172.20.0.2","TCP","[TCP Retransmission] 55748 → 4433 [SYN] Seq=0 Win=64240 Len=0 MSS=1460 SACK_PERM TSval=2168854429 TSecr=0 WS=128"
"83","3.652255252","74","0a:4e:2e:b0:80:99","86:9a:63:33:da:40","172.20.0.2","172.20.0.3","TCP","4433 → 55748 [SYN, ACK] Seq=0 Ack=1 Win=65160 Len=0 MSS=1460 SACK_PERM TSval=2863425359 TSecr=2168853376 WS=128"
"84","3.652290813","66","86:9a:63:33:da:40","0a:4e:2e:b0:80:99","172.20.0.3","172.20.0.2","TCP","55748 → 4433 [ACK] Seq=1 Ack=1 Win=64256 Len=0 TSval=2168854429 TSecr=2863425359"
"85","3.652381422","552","86:9a:63:33:da:40","0a:4e:2e:b0:80:99","172.20.0.3","172.20.0.2","TLSv1.2","Client Hello"
"86","3.652389327","66","0a:4e:2e:b0:80:99","86:9a:63:33:da:40","172.20.0.2","172.20.0.3","TCP","4433 → 55748 [ACK] Seq=1 Ack=487 Win=64768 Len=0 TSval=2863425359 TSecr=2168854429"
"87","3.654476351","923","0a:4e:2e:b0:80:99","86:9a:63:33:da:40","172.20.0.2","172.20.0.3","TLSv1.3","Server Hello, Change Cipher Spec, Application Data, Application Data, Application Data, Application Data"
"88","3.654509085","66","86:9a:63:33:da:40","0a:4e:2e:b0:80:99","172.20.0.3","172.20.0.2","TCP","55748 → 4433 [ACK] Seq=487 Ack=858 Win=63488 Len=0 TSval=2168854431 TSecr=2863425361"
"89","3.657394162","146","86:9a:63:33:da:40","0a:4e:2e:b0:80:99","172.20.0.3","172.20.0.2","TLSv1.3","Change Cipher Spec, Application Data"
"90","3.657465168","66","86:9a:63:33:da:40","0a:4e:2e:b0:80:99","172.20.0.3","172.20.0.2","TCP","55748 → 4433 [RST, ACK] Seq=567 Ack=858 Win=64000 Len=0 TSval=2168854434 TSecr=2863425361"
"91","3.669125966","74","86:9a:63:33:da:40","0a:4e:2e:b0:80:99","172.20.0.3","172.20.0.2","TCP","55762 → 4433 [SYN] Seq=0 Win=64240 Len=0 MSS=1460 SACK_PERM TSval=2168854445 TSecr=0 WS=128"
"92","3.669165964","74","0a:4e:2e:b0:80:99","86:9a:63:33:da:40","172.20.0.2","172.20.0.3","TCP","4433 → 55762 [SYN, ACK] Seq=0 Ack=1 Win=65160 Len=0 MSS=1460 SACK_PERM TSval=2863425376 TSecr=2168854445 WS=128"
"93","3.669183592","66","86:9a:63:33:da:40","0a:4e:2e:b0:80:99","172.20.0.3","172.20.0.2","TCP","55762 → 4433 [ACK] Seq=1 Ack=1 Win=64256 Len=0 TSval=2168854446 TSecr=2863425376"
"94","3.669228258","552","86:9a:63:33:da:40","0a:4e:2e:b0:80:99","172.20.0.3","172.20.0.2","TLSv1.2","Client Hello"
"95","3.669232234","66","0a:4e:2e:b0:80:99","86:9a:63:33:da:40","172.20.0.2","172.20.0.3","TCP","4433 → 55762 [ACK] Seq=1 Ack=487 Win=64768 Len=0 TSval=2863425376 TSecr=2168854446"
"96","3.671268974","923","0a:4e:2e:b0:80:99","86:9a:63:33:da:40","172.20.0.2","172.20.0.3","TLSv1.3","Server Hello, Change Cipher Spec, Application Data, Application Data, Application Data, Application Data"
"97","3.671299366","66","86:9a:63:33:da:40","0a:4e:2e:b0:80:99","172.20.0.3","172.20.0.2","TCP","55762 → 4433 [ACK] Seq=487 Ack=858 Win=63488 Len=0 TSval=2168854448 TSecr=2863425378"
"98","3.674015376","146","86:9a:63:33:da:40","0a:4e:2e:b0:80:99","172.20.0.3","172.20.0.2","TLSv1.3","Change Cipher Spec, Application Data"
"99","3.674092688","66","86:9a:63:33:da:40","0a:4e:2e:b0:80:99","172.20.0.3","172.20.0.2","TCP","55762 → 4433 [RST, ACK] Seq=567 Ack=858 Win=64000 Len=0 TSval=2168854450 TSecr=2863425378"
"100","3.685007200","74","86:9a:63:33:da:40","0a:4e:2e:b0:80:99","172.20.0.3","172.20.0.2","TCP","55764 → 4433 [SYN] Seq=0 Win=64240 Len=0 MSS=1460 SACK_PERM TSval=2168854461 TSecr=0 WS=128"
"101","4.740267292","74","86:9a:63:33:da:40","0a:4e:2e:b0:80:99","172.20.0.3","172.20.0.2","TCP","[TCP Retransmission] 55764 → 4433 [SYN] Seq=0 Win=64240 Len=0 MSS=1460 SACK_PERM TSval=2168855517 TSecr=0 WS=128"
"102","4.740282557","74","0a:4e:2e:b0:80:99","86:9a:63:33:da:40","172.20.0.2","172.20.0.3","TCP","4433 → 55764 [SYN, ACK] Seq=0 Ack=1 Win=65160 Len=0 MSS=1460 SACK_PERM TSval=2863426447 TSecr=2168854461 WS=128"
"103","4.740331023","66","86:9a:63:33:da:40","0a:4e:2e:b0:80:99","172.20.0.3","172.20.0.2","TCP","55764 → 4433 [ACK] Seq=1 Ack=1 Win=64256 Len=0 TSval=2168855517 TSecr=2863426447"
"104","4.740438457","552","86:9a:63:33:da:40","0a:4e:2e:b0:80:99","172.20.0.3","172.20.0.2","TLSv1.2","Client Hello"
"105","4.740452570","66","0a:4e:2e:b0:80:99","86:9a:63:33:da:40","172.20.0.2","172.20.0.3","TCP","4433 → 55764 [ACK] Seq=1 Ack=487 Win=64768 Len=0 TSval=2863426447 TSecr=2168855517"
"106","4.742504273","924","0a:4e:2e:b0:80:99","86:9a:63:33:da:40","172.20.0.2","172.20.0.3","TLSv1.3","Server Hello, Change Cipher Spec, Application Data, Application Data, Application Data, Application Data"
"107","4.742538147","66","86:9a:63:33:da:40","0a:4e:2e:b0:80:99","172.20.0.3","172.20.0.2","TCP","55764 → 4433 [ACK] Seq=487 Ack=859 Win=63488 Len=0 TSval=2168855519 TSecr=2863426449"
"108","4.745293746","146","86:9a:63:33:da:40","0a:4e:2e:b0:80:99","172.20.0.3","172.20.0.2","TLSv1.3","Change Cipher Spec, Application Data"
"109","4.745357825","66","86:9a:63:33:da:40","0a:4e:2e:b0:80:99","172.20.0.3","172.20.0.2","TCP","55764 → 4433 [RST, ACK] Seq=567 Ack=859 Win=64000 Len=0 TSval=2168855522 TSecr=2863426449"
"110","4.756785709","74","86:9a:63:33:da:40","0a:4e:2e:b0:80:99","172.20.0.3","172.20.0.2","TCP","55776 → 4433 [SYN] Seq=0 Win=64240 Len=0 MSS=1460 SACK_PERM TSval=2168855533 TSecr=0 WS=128"
"111","4.756813050","74","0a:4e:2e:b0:80:99","86:9a:63:33:da:40","172.20.0.2","172.20.0.3","TCP","4433 → 55776 [SYN, ACK] Seq=0 Ack=1 Win=65160 Len=0 MSS=1460 SACK_PERM TSval=2863426463 TSecr=2168855533 WS=128"
"112","4.756829704","66","86:9a:63:33:da:40","0a:4e:2e:b0:80:99","172.20.0.3","172.20.0.2","TCP","55776 → 4433 [ACK] Seq=1 Ack=1 Win=64256 Len=0 TSval=2168855533 TSecr=2863426463"
"113","4.756872875","552","86:9a:63:33:da:40","0a:4e:2e:b0:80:99","172.20.0.3","172.20.0.2","TLSv1.2","Client Hello"
"114","4.756878063","66","0a:4e:2e:b0:80:99","86:9a:63:33:da:40","172.20.0.2","172.20.0.3","TCP","4433 → 55776 [ACK] Seq=1 Ack=487 Win=64768 Len=0 TSval=2863426463 TSecr=2168855533"
"115","4.758864493","924","0a:4e:2e:b0:80:99","86:9a:63:33:da:40","172.20.0.2","172.20.0.3","TLSv1.3","Server Hello, Change Cipher Spec, Application Data, Application Data, Application Data, Application Data"
"116","4.758897234","66","86:9a:63:33:da:40","0a:4e:2e:b0:80:99","172.20.0.3","172.20.0.2","TCP","55776 → 4433 [ACK] Seq=487 Ack=859 Win=63488 Len=0 TSval=2168855535 TSecr=2863426465"
"117","4.761730994","146","86:9a:63:33:da:40","0a:4e:2e:b0:80:99","172.20.0.3","172.20.0.2","TLSv1.3","Change Cipher Spec, Application Data"
"118","4.761798826","66","86:9a:63:33:da:40","0a:4e:2e:b0:80:99","172.20.0.3","172.20.0.2","TCP","55776 → 4433 [RST, ACK] Seq=567 Ack=859 Win=64000 Len=0 TSval=2168855538 TSecr=2863426465"
"119","4.773093676","74","86:9a:63:33:da:40","0a:4e:2e:b0:80:99","172.20.0.3","172.20.0.2","TCP","55784 → 4433 [SYN] Seq=0 Win=64240 Len=0 MSS=1460 SACK_PERM TSval=2168855549 TSecr=0 WS=128"
"120","4.773122015","74","0a:4e:2e:b0:80:99","86:9a:63:33:da:40","172.20.0.2","172.20.0.3","TCP","4433 → 55784 [SYN, ACK] Seq=0 Ack=1 Win=65160 Len=0 MSS=1460 SACK_PERM TSval=2863426479 TSecr=2168855549 WS=128"
"121","4.773144237","66","86:9a:63:33:da:40","0a:4e:2e:b0:80:99","172.20.0.3","172.20.0.2","TCP","55784 → 4433 [ACK] Seq=1 Ack=1 Win=64256 Len=0 TSval=2168855549 TSecr=2863426479"
"122","4.773193464","552","86:9a:63:33:da:40","0a:4e:2e:b0:80:99","172.20.0.3","172.20.0.2","TLSv1.2","Client Hello"
"123","4.775273193","925","0a:4e:2e:b0:80:99","86:9a:63:33:da:40","172.20.0.2","172.20.0.3","TLSv1.3","Server Hello, Change Cipher Spec, Application Data, Application Data, Application Data, Application Data"
"124","4.775307786","66","86:9a:63:33:da:40","0a:4e:2e:b0:80:99","172.20.0.3","172.20.0.2","TCP","55784 → 4433 [ACK] Seq=487 Ack=860 Win=63488 Len=0 TSval=2168855552 TSecr=2863426482"
"125","4.778131861","146","86:9a:63:33:da:40","0a:4e:2e:b0:80:99","172.20.0.3","172.20.0.2","TLSv1.3","Change Cipher Spec, Application Data"
"126","4.778225220","66","86:9a:63:33:da:40","0a:4e:2e:b0:80:99","172.20.0.3","172.20.0.2","TCP","55784 → 4433 [RST, ACK] Seq=567 Ack=860 Win=64000 Len=0 TSval=2168855555 TSecr=2863426482"
"127","4.789375884","74","86:9a:63:33:da:40","0a:4e:2e:b0:80:99","172.20.0.3","172.20.0.2","TCP","55798 → 4433 [SYN] Seq=0 Win=64240 Len=0 MSS=1460 SACK_PERM TSval=2168855566 TSecr=0 WS=128"
"128","4.789400647","74","0a:4e:2e:b0:80:99","86:9a:63:33:da:40","172.20.0.2","172.20.0.3","TCP","4433 → 55798 [SYN, ACK] Seq=0 Ack=1 Win=65160 Len=0 MSS=1460 SACK_PERM TSval=2863426496 TSecr=2168855566 WS=128"
"129","4.789416649","66","86:9a:63:33:da:40","0a:4e:2e:b0:80:99","172.20.0.3","172.20.0.2","TCP","55798 → 4433 [ACK] Seq=1 Ack=1 Win=64256 Len=0 TSval=2168855566 TSecr=2863426496"
"130","4.789459019","552","86:9a:63:33:da:40","0a:4e:2e:b0:80:99","172.20.0.3","172.20.0.2","TLSv1.2","Client Hello"
"131","4.789475128","66","0a:4e:2e:b0:80:99","86:9a:63:33:da:40","172.20.0.2","172.20.0.3","TCP","4433 → 55798 [ACK] Seq=1 Ack=487 Win=64768 Len=0 TSval=2863426496 TSecr=2168855566"
"132","4.791473776","923","0a:4e:2e:b0:80:99","86:9a:63:33:da:40","172.20.0.2","172.20.0.3","TLSv1.3","Server Hello, Change Cipher Spec, Application Data, Application Data, Application Data, Application Data"
"133","4.791500989","66","86:9a:63:33:da:40","0a:4e:2e:b0:80:99","172.20.0.3","172.20.0.2","TCP","55798 → 4433 [ACK] Seq=487 Ack=858 Win=63488 Len=0 TSval=2168855568 TSecr=2863426498"
"134","4.794222372","146","86:9a:63:33:da:40","0a:4e:2e:b0:80:99","172.20.0.3","172.20.0.2","TLSv1.3","Change Cipher Spec, Application Data"
"135","4.794286533","66","86:9a:63:33:da:40","0a:4e:2e:b0:80:99","172.20.0.3","172.20.0.2","TCP","55798 → 4433 [RST, ACK] Seq=567 Ack=858 Win=64000 Len=0 TSval=2168855571 TSecr=2863426498"
"136","4.805759635","74","86:9a:63:33:da:40","0a:4e:2e:b0:80:99","172.20.0.3","172.20.0.2","TCP","55808 → 4433 [SYN] Seq=0 Win=64240 Len=0 MSS=1460 SACK_PERM TSval=2168855582 TSecr=0 WS=128"
"137","4.805791474","74","0a:4e:2e:b0:80:99","86:9a:63:33:da:40","172.20.0.2","172.20.0.3","TCP","4433 → 55808 [SYN, ACK] Seq=0 Ack=1 Win=65160 Len=0 MSS=1460 SACK_PERM TSval=2863426512 TSecr=2168855582 WS=128"
"138","4.805811040","66","86:9a:63:33:da:40","0a:4e:2e:b0:80:99","172.20.0.3","172.20.0.2","TCP","55808 → 4433 [ACK] Seq=1 Ack=1 Win=64256 Len=0 TSval=2168855582 TSecr=2863426512"
"139","4.805857892","552","86:9a:63:33:da:40","0a:4e:2e:b0:80:99","172.20.0.3","172.20.0.2","TLSv1.2","Client Hello"
"140","4.805865146","66","0a:4e:2e:b0:80:99","86:9a:63:33:da:40","172.20.0.2","172.20.0.3","TCP","4433 → 55808 [ACK] Seq=1 Ack=487 Win=64768 Len=0 TSval=2863426512 TSecr=2168855582"
"141","5.220200624","925","0a:4e:2e:b0:80:99","86:9a:63:33:da:40","172.20.0.2","172.20.0.3","TLSv1.3","Server Hello, Change Cipher Spec, Application Data, Application Data, Application Data, Application Data"
"142","5.220330091","66","86:9a:63:33:da:40","0a:4e:2e:b0:80:99","172.20.0.3","172.20.0.2","TCP","55808 → 4433 [ACK] Seq=487 Ack=860 Win=63488 Len=0 TSval=2168855997 TSecr=2863426927"
"143","5.223278610","146","86:9a:63:33:da:40","0a:4e:2e:b0:80:99","172.20.0.3","172.20.0.2","TLSv1.3","Change Cipher Spec, Application Data"
"144","5.223348475","66","86:9a:63:33:da:40","0a:4e:2e:b0:80:99","172.20.0.3","172.20.0.2","TCP","55808 → 4433 [RST, ACK] Seq=567 Ack=860 Win=64000 Len=0 TSval=2168856000 TSecr=2863426927"
"145","5.234838125","74","86:9a:63:33:da:40","0a:4e:2e:b0:80:99","172.20.0.3","172.20.0.2","TCP","55818 → 4433 [SYN] Seq=0 Win=64240 Len=0 MSS=1460 SACK_PERM TSval=2168856011 TSecr=0 WS=128"
"146","5.234863776","74","0a:4e:2e:b0:80:99","86:9a:63:33:da:40","172.20.0.2","172.20.0.3","TCP","4433 → 55818 [SYN, ACK] Seq=0 Ack=1 Win=65160 Len=0 MSS=1460 SACK_PERM TSval=2863426941 TSecr=2168856011 WS=128"
"147","5.234882368","66","86:9a:63:33:da:40","0a:4e:2e:b0:80:99","172.20.0.3","172.20.0.2","TCP","55818 → 4433 [ACK] Seq=1 Ack=1 Win=64256 Len=0 TSval=2168856011 TSecr=2863426941"
"148","5.234926808","552","86:9a:63:33:da:40","0a:4e:2e:b0:80:99","172.20.0.3","172.20.0.2","TLSv1.2","Client Hello"
"149","5.236968171","924","0a:4e:2e:b0:80:99","86:9a:63:33:da:40","172.20.0.2","172.20.0.3","TLSv1.3","Server Hello, Change Cipher Spec, Application Data, Application Data, Application Data, Application Data"
"150","5.236997984","66","86:9a:63:33:da:40","0a:4e:2e:b0:80:99","172.20.0.3","172.20.0.2","TCP","55818 → 4433 [ACK] Seq=487 Ack=859 Win=63488 Len=0 TSval=2168856013 TSecr=2863426943"
"151","5.239579259","146","86:9a:63:33:da:40","0a:4e:2e:b0:80:99","172.20.0.3","172.20.0.2","TLSv1.3","Change Cipher Spec, Application Data"
"152","5.239629915","66","86:9a:63:33:da:40","0a:4e:2e:b0:80:99","172.20.0.3","172.20.0.2","TCP","55818 → 4433 [RST, ACK] Seq=567 Ack=859 Win=64000 Len=0 TSval=2168856016 TSecr=2863426943"
"153","5.253434129","74","86:9a:63:33:da:40","0a:4e:2e:b0:80:99","172.20.0.3","172.20.0.2","TCP","55824 → 4433 [SYN] Seq=0 Win=64240 Len=0 MSS=1460 SACK_PERM TSval=2168856030 TSecr=0 WS=128"
"154","5.253468344","74","0a:4e:2e:b0:80:99","86:9a:63:33:da:40","172.20.0.2","172.20.0.3","TCP","4433 → 55824 [SYN, ACK] Seq=0 Ack=1 Win=65160 Len=0 MSS=1460 SACK_PERM TSval=2863426960 TSecr=2168856030 WS=128"
"155","5.253486726","66","86:9a:63:33:da:40","0a:4e:2e:b0:80:99","172.20.0.3","172.20.0.2","TCP","55824 → 4433 [ACK] Seq=1 Ack=1 Win=64256 Len=0 TSval=2168856030 TSecr=2863426960"
"156","5.253544318","552","86:9a:63:33:da:40","0a:4e:2e:b0:80:99","172.20.0.3","172.20.0.2","TLSv1.2","Client Hello"
"157","5.253548955","66","0a:4e:2e:b0:80:99","86:9a:63:33:da:40","172.20.0.2","172.20.0.3","TCP","4433 → 55824 [ACK] Seq=1 Ack=487 Win=64768 Len=0 TSval=2863426960 TSecr=2168856030"
"158","5.255833358","924","0a:4e:2e:b0:80:99","86:9a:63:33:da:40","172.20.0.2","172.20.0.3","TLSv1.3","Server Hello, Change Cipher Spec, Application Data, Application Data, Application Data, Application Data"
"159","5.255867438","66","86:9a:63:33:da:40","0a:4e:2e:b0:80:99","172.20.0.3","172.20.0.2","TCP","55824 → 4433 [ACK] Seq=487 Ack=859 Win=63488 Len=0 TSval=2168856032 TSecr=2863426962"
"160","5.258534320","146","86:9a:63:33:da:40","0a:4e:2e:b0:80:99","172.20.0.3","172.20.0.2","TLSv1.3","Change Cipher Spec, Application Data"
"161","5.258600808","66","86:9a:63:33:da:40","0a:4e:2e:b0:80:99","172.20.0.3","172.20.0.2","TCP","55824 → 4433 [RST, ACK] Seq=567 Ack=859 Win=64000 Len=0 TSval=2168856035 TSecr=2863426962"
"162","5.269744396","74","86:9a:63:33:da:40","0a:4e:2e:b0:80:99","172.20.0.3","172.20.0.2","TCP","55830 → 4433 [SYN] Seq=0 Win=64240 Len=0 MSS=1460 SACK_PERM TSval=2168856046 TSecr=0 WS=128"
"163","5.269774566","74","0a:4e:2e:b0:80:99","86:9a:63:33:da:40","172.20.0.2","172.20.0.3","TCP","4433 → 55830 [SYN, ACK] Seq=0 Ack=1 Win=65160 Len=0 MSS=1460 SACK_PERM TSval=2863426976 TSecr=2168856046 WS=128"
"164","5.269791774","66","86:9a:63:33:da:40","0a:4e:2e:b0:80:99","172.20.0.3","172.20.0.2","TCP","55830 → 4433 [ACK] Seq=1 Ack=1 Win=64256 Len=0 TSval=2168856046 TSecr=2863426976"
"165","5.269833342","552","86:9a:63:33:da:40","0a:4e:2e:b0:80:99","172.20.0.3","172.20.0.2","TLSv1.2","Client Hello"
"166","5.476185569","924","0a:4e:2e:b0:80:99","86:9a:63:33:da:40","172.20.0.2","172.20.0.3","TLSv1.3","Server Hello, Change Cipher Spec, Application Data, Application Data, Application Data, Application Data"
"167","5.476222822","552","86:9a:63:33:da:40","0a:4e:2e:b0:80:99","172.20.0.3","172.20.0.2","TCP","[TCP Spurious Retransmission] 55830 → 4433 [PSH, ACK] Seq=1 Ack=1 Win=64256 Len=486 TSval=2168856253 TSecr=2863426976"
"168","5.476241567","78","0a:4e:2e:b0:80:99","86:9a:63:33:da:40","172.20.0.2","172.20.0.3","TCP","[TCP Dup ACK 166#1] 4433 → 55830 [ACK] Seq=859 Ack=487 Win=64768 Len=0 TSval=2863427183 TSecr=2168856253 SLE=1 SRE=487"
"169","5.476267433","66","86:9a:63:33:da:40","0a:4e:2e:b0:80:99","172.20.0.3","172.20.0.2","TCP","55830 → 4433 [ACK] Seq=487 Ack=859 Win=63488 Len=0 TSval=2168856253 TSecr=2863427183"
"170","5.479357599","146","86:9a:63:33:da:40","0a:4e:2e:b0:80:99","172.20.0.3","172.20.0.2","TLSv1.3","Change Cipher Spec, Application Data"
"171","5.479442732","66","86:9a:63:33:da:40","0a:4e:2e:b0:80:99","172.20.0.3","172.20.0.2","TCP","55830 → 4433 [RST, ACK] Seq=567 Ack=859 Win=64000 Len=0 TSval=2168856256 TSecr=2863427183"
"172","5.491422915","74","86:9a:63:33:da:40","0a:4e:2e:b0:80:99","172.20.0.3","172.20.0.2","TCP","56566 → 4433 [SYN] Seq=0 Win=64240 Len=0 MSS=1460 SACK_PERM TSval=2168856268 TSecr=0 WS=128"
"173","6.532261744","74","86:9a:63:33:da:40","0a:4e:2e:b0:80:99","172.20.0.3","172.20.0.2","TCP","[TCP Retransmission] 56566 → 4433 [SYN] Seq=0 Win=64240 Len=0 MSS=1460 SACK_PERM TSval=2168857309 TSecr=0 WS=128"
"174","6.532278616","74","0a:4e:2e:b0:80:99","86:9a:63:33:da:40","172.20.0.2","172.20.0.3","TCP","4433 → 56566 [SYN, ACK] Seq=0 Ack=1 Win=65160 Len=0 MSS=1460 SACK_PERM TSval=2863428239 TSecr=2168856268 WS=128"
"175","6.532330539","66","86:9a:63:33:da:40","0a:4e:2e:b0:80:99","172.20.0.3","172.20.0.2","TCP","56566 → 4433 [ACK] Seq=1 Ack=1 Win=64256 Len=0 TSval=2168857309 TSecr=2863428239"
"176","6.532438931","552","86:9a:63:33:da:40","0a:4e:2e:b0:80:99","172.20.0.3","172.20.0.2","TLSv1.2","Client Hello"
"177","6.948187004","925","0a:4e:2e:b0:80:99","86:9a:63:33:da:40","172.20.0.2","172.20.0.3","TLSv1.3","Server Hello, Change Cipher Spec, Application Data, Application Data, Application Data, Application Data"
"178","6.948246427","66","86:9a:63:33:da:40","0a:4e:2e:b0:80:99","172.20.0.3","172.20.0.2","TCP","56566 → 4433 [ACK] Seq=487 Ack=860 Win=63488 Len=0 TSval=2168857725 TSecr=2863428655"
"179","6.951030146","146","86:9a:63:33:da:40","0a:4e:2e:b0:80:99","172.20.0.3","172.20.0.2","TLSv1.3","Change Cipher Spec, Application Data"
"180","6.951103010","66","86:9a:63:33:da:40","0a:4e:2e:b0:80:99","172.20.0.3","172.20.0.2","TCP","56566 → 4433 [RST, ACK] Seq=567 Ack=860 Win=64000 Len=0 TSval=2168857727 TSecr=2863428655"
"181","6.962458302","74","86:9a:63:33:da:40","0a:4e:2e:b0:80:99","172.20.0.3","172.20.0.2","TCP","56580 → 4433 [SYN] Seq=0 Win=64240 Len=0 MSS=1460 SACK_PERM TSval=2168857739 TSecr=0 WS=128"
"182","6.962491661","74","0a:4e:2e:b0:80:99","86:9a:63:33:da:40","172.20.0.2","172.20.0.3","TCP","4433 → 56580 [SYN, ACK] Seq=0 Ack=1 Win=65160 Len=0 MSS=1460 SACK_PERM TSval=2863428669 TSecr=2168857739 WS=128"
"183","6.962510749","66","86:9a:63:33:da:40","0a:4e:2e:b0:80:99","172.20.0.3","172.20.0.2","TCP","56580 → 4433 [ACK] Seq=1 Ack=1 Win=64256 Len=0 TSval=2168857739 TSecr=2863428669"
"184","6.962553215","552","86:9a:63:33:da:40","0a:4e:2e:b0:80:99","172.20.0.3","172.20.0.2","TLSv1.2","Client Hello"
"185","6.962558381","66","0a:4e:2e:b0:80:99","86:9a:63:33:da:40","172.20.0.2","172.20.0.3","TCP","4433 → 56580 [ACK] Seq=1 Ack=487 Win=64768 Len=0 TSval=2863428669 TSecr=2168857739"
"186","6.964549479","924","0a:4e:2e:b0:80:99","86:9a:63:33:da:40","172.20.0.2","172.20.0.3","TLSv1.3","Server Hello, Change Cipher Spec, Application Data, Application Data, Application Data, Application Data"
"187","6.964578724","66","86:9a:63:33:da:40","0a:4e:2e:b0:80:99","172.20.0.3","172.20.0.2","TCP","56580 → 4433 [ACK] Seq=487 Ack=859 Win=63488 Len=0 TSval=2168857741 TSecr=2863428671"
"188","6.967535253","146","86:9a:63:33:da:40","0a:4e:2e:b0:80:99","172.20.0.3","172.20.0.2","TLSv1.3","Change Cipher Spec, Application Data"
"189","6.967599059","66","86:9a:63:33:da:40","0a:4e:2e:b0:80:99","172.20.0.3","172.20.0.2","TCP","56580 → 4433 [RST, ACK] Seq=567 Ack=859 Win=64000 Len=0 TSval=2168857744 TSecr=2863428671"
"190","6.979338641","74","86:9a:63:33:da:40","0a:4e:2e:b0:80:99","172.20.0.3","172.20.0.2","TCP","56588 → 4433 [SYN] Seq=0 Win=64240 Len=0 MSS=1460 SACK_PERM TSval=2168857756 TSecr=0 WS=128"
"191","6.979371380","74","0a:4e:2e:b0:80:99","86:9a:63:33:da:40","172.20.0.2","172.20.0.3","TCP","4433 → 56588 [SYN, ACK] Seq=0 Ack=1 Win=65160 Len=0 MSS=1460 SACK_PERM TSval=2863428686 TSecr=2168857756 WS=128"
"192","6.979389173","66","86:9a:63:33:da:40","0a:4e:2e:b0:80:99","172.20.0.3","172.20.0.2","TCP","56588 → 4433 [ACK] Seq=1 Ack=1 Win=64256 Len=0 TSval=2168857756 TSecr=2863428686"
"193","6.979430779","552","86:9a:63:33:da:40","0a:4e:2e:b0:80:99","172.20.0.3","172.20.0.2","TLSv1.2","Client Hello"
"194","6.979436493","66","0a:4e:2e:b0:80:99","86:9a:63:33:da:40","172.20.0.2","172.20.0.3","TCP","4433 → 56588 [ACK] Seq=1 Ack=487 Win=64768 Len=0 TSval=2863428686 TSecr=2168857756"
"195","6.981438504","924","0a:4e:2e:b0:80:99","86:9a:63:33:da:40","172.20.0.2","172.20.0.3","TLSv1.3","Server Hello, Change Cipher Spec, Application Data, Application Data, Application Data, Application Data"
"196","6.981472198","66","86:9a:63:33:da:40","0a:4e:2e:b0:80:99","172.20.0.3","172.20.0.2","TCP","56588 → 4433 [ACK] Seq=487 Ack=859 Win=63488 Len=0 TSval=2168857758 TSecr=2863428688"
"197","6.984280545","146","86:9a:63:33:da:40","0a:4e:2e:b0:80:99","172.20.0.3","172.20.0.2","TLSv1.3","Change Cipher Spec, Application Data"
"198","6.984344049","66","86:9a:63:33:da:40","0a:4e:2e:b0:80:99","172.20.0.3","172.20.0.2","TCP","56588 → 4433 [RST, ACK] Seq=567 Ack=859 Win=64000 Len=0 TSval=2168857761 TSecr=2863428688"
"199","6.995656264","74","86:9a:63:33:da:40","0a:4e:2e:b0:80:99","172.20.0.3","172.20.0.2","TCP","56598 → 4433 [SYN] Seq=0 Win=64240 Len=0 MSS=1460 SACK_PERM TSval=2168857772 TSecr=0 WS=128"
"200","6.995682837","74","0a:4e:2e:b0:80:99","86:9a:63:33:da:40","172.20.0.2","172.20.0.3","TCP","4433 → 56598 [SYN, ACK] Seq=0 Ack=1 Win=65160 Len=0 MSS=1460 SACK_PERM TSval=2863428702 TSecr=2168857772 WS=128"
"201","6.995701211","66","86:9a:63:33:da:40","0a:4e:2e:b0:80:99","172.20.0.3","172.20.0.2","TCP","56598 → 4433 [ACK] Seq=1 Ack=1 Win=64256 Len=0 TSval=2168857772 TSecr=2863428702"
"202","6.995742128","552","86:9a:63:33:da:40","0a:4e:2e:b0:80:99","172.20.0.3","172.20.0.2","TLSv1.2","Client Hello"
"203","6.995747884","66","0a:4e:2e:b0:80:99","86:9a:63:33:da:40","172.20.0.2","172.20.0.3","TCP","4433 → 56598 [ACK] Seq=1 Ack=487 Win=64768 Len=0 TSval=2863428702 TSecr=2168857772"
"204","7.204209408","924","0a:4e:2e:b0:80:99","86:9a:63:33:da:40","172.20.0.2","172.20.0.3","TLSv1.3","Server Hello, Change Cipher Spec, Application Data, Application Data, Application Data, Application Data"
"205","7.204271659","66","86:9a:63:33:da:40","0a:4e:2e:b0:80:99","172.20.0.3","172.20.0.2","TCP","56598 → 4433 [ACK] Seq=487 Ack=859 Win=63488 Len=0 TSval=2168857981 TSecr=2863428911"
"206","7.207337559","146","86:9a:63:33:da:40","0a:4e:2e:b0:80:99","172.20.0.3","172.20.0.2","TLSv1.3","Change Cipher Spec, Application Data"
"207","7.207410863","66","86:9a:63:33:da:40","0a:4e:2e:b0:80:99","172.20.0.3","172.20.0.2","TCP","56598 → 4433 [RST, ACK] Seq=567 Ack=859 Win=64000 Len=0 TSval=2168857984 TSecr=2863428911"
"208","7.219341572","74","86:9a:63:33:da:40","0a:4e:2e:b0:80:99","172.20.0.3","172.20.0.2","TCP","56602 → 4433 [SYN] Seq=0 Win=64240 Len=0 MSS=1460 SACK_PERM TSval=2168857996 TSecr=0 WS=128"
"209","8.260211703","74","0a:4e:2e:b0:80:99","86:9a:63:33:da:40","172.20.0.2","172.20.0.3","TCP","4433 → 56602 [SYN, ACK] Seq=0 Ack=1 Win=65160 Len=0 MSS=1460 SACK_PERM TSval=2863429967 TSecr=2168857996 WS=128"
"210","8.260239694","74","86:9a:63:33:da:40","0a:4e:2e:b0:80:99","172.20.0.3","172.20.0.2","TCP","[TCP Retransmission] 56602 → 4433 [SYN] Seq=0 Win=64240 Len=0 MSS=1460 SACK_PERM TSval=2168859037 TSecr=0 WS=128"
"211","8.260256489","74","0a:4e:2e:b0:80:99","86:9a:63:33:da:40","172.20.0.2","172.20.0.3","TCP","[TCP Retransmission] 4433 → 56602 [SYN, ACK] Seq=0 Ack=1 Win=65160 Len=0 MSS=1460 SACK_PERM TSval=2863429967 TSecr=2168857996 WS=128"
"212","8.260292795","66","86:9a:63:33:da:40","0a:4e:2e:b0:80:99","172.20.0.3","172.20.0.2","TCP","56602 → 4433 [ACK] Seq=1 Ack=1 Win=64256 Len=0 TSval=2168859037 TSecr=2863429967"
"213","8.260328619","66","86:9a:63:33:da:40","0a:4e:2e:b0:80:99","172.20.0.3","172.20.0.2","TCP","[TCP Dup ACK 212#1] 56602 → 4433 [ACK] Seq=1 Ack=1 Win=64256 Len=0 TSval=2168859037 TSecr=2863429967"
"214","8.260377478","552","86:9a:63:33:da:40","0a:4e:2e:b0:80:99","172.20.0.3","172.20.0.2","TLSv1.2","Client Hello"
"215","8.260385426","66","0a:4e:2e:b0:80:99","86:9a:63:33:da:40","172.20.0.2","172.20.0.3","TCP","4433 → 56602 [ACK] Seq=1 Ack=487 Win=64768 Len=0 TSval=2863429967 TSecr=2168859037"
"216","8.262618774","925","0a:4e:2e:b0:80:99","86:9a:63:33:da:40","172.20.0.2","172.20.0.3","TLSv1.3","Server Hello, Change Cipher Spec, Application Data, Application Data, Application Data, Application Data"
"217","8.262655376","66","86:9a:63:33:da:40","0a:4e:2e:b0:80:99","172.20.0.3","172.20.0.2","TCP","56602 → 4433 [ACK] Seq=487 Ack=860 Win=63488 Len=0 TSval=2168859039 TSecr=2863429969"
"218","8.265493142","146","86:9a:63:33:da:40","0a:4e:2e:b0:80:99","172.20.0.3","172.20.0.2","TLSv1.3","Change Cipher Spec, Application Data"
"219","8.265560537","66","86:9a:63:33:da:40","0a:4e:2e:b0:80:99","172.20.0.3","172.20.0.2","TCP","56602 → 4433 [RST, ACK] Seq=567 Ack=860 Win=64000 Len=0 TSval=2168859042 TSecr=2863429969"
"220","8.278586324","74","86:9a:63:33:da:40","0a:4e:2e:b0:80:99","172.20.0.3","172.20.0.2","TCP","56614 → 4433 [SYN] Seq=0 Win=64240 Len=0 MSS=1460 SACK_PERM TSval=2168859055 TSecr=0 WS=128"
"221","8.278617288","74","0a:4e:2e:b0:80:99","86:9a:63:33:da:40","172.20.0.2","172.20.0.3","TCP","4433 → 56614 [SYN, ACK] Seq=0 Ack=1 Win=65160 Len=0 MSS=1460 SACK_PERM TSval=2863429985 TSecr=2168859055 WS=128"
"222","8.278637122","66","86:9a:63:33:da:40","0a:4e:2e:b0:80:99","172.20.0.3","172.20.0.2","TCP","56614 → 4433 [ACK] Seq=1 Ack=1 Win=64256 Len=0 TSval=2168859055 TSecr=2863429985"
"223","8.278704661","552","86:9a:63:33:da:40","0a:4e:2e:b0:80:99","172.20.0.3","172.20.0.2","TLSv1.2","Client Hello"
