frame.number,frame.time_relative,frame.len,eth.src,eth.dst,ip.src,ip.dst,_ws.col.protocol,_ws.col.info
"1","0.000000000","287","12:45:1f:7d:ab:ba","ff:ff:ff:ff:ff:ff","172.20.0.1","172.20.255.255","BROWSER","Local Master Announcement , Workstation, Server, Print Queue Server, Xenix Server, NT Workstation, NT Server, Master Browser, DFS server"
"2","0.000031501","264","12:45:1f:7d:ab:ba","ff:ff:ff:ff:ff:ff","172.20.0.1","172.20.255.255","BROWSER","Domain/Workgroup Announcement WORKGROUP, NT Workstation, Domain Enum"
"3","9.523982658","42","4e:56:5b:5c:5d:7f","ff:ff:ff:ff:ff:ff",,,"ARP","ARP Announcement for 172.20.0.3"
"4","9.558947775","42","4e:56:5b:5c:5d:7f","ff:ff:ff:ff:ff:ff",,,"ARP","Who has 172.20.0.2? Tell 172.20.0.3"
"5","9.558972454","42","0e:fd:53:11:5f:2a","4e:56:5b:5c:5d:7f",,,"ARP","172.20.0.2 is at 0e:fd:53:11:5f:2a"
"6","9.558979555","74","4e:56:5b:5c:5d:7f","0e:fd:53:11:5f:2a","172.20.0.3","172.20.0.2","TCP","53612 → 4433 [SYN] Seq=0 Win=64240 Len=0 MSS=1460 SACK_PERM TSval=2168217514 TSecr=0 WS=128"
"7","9.559002157","74","0e:fd:53:11:5f:2a","4e:56:5b:5c:5d:7f","172.20.0.2","172.20.0.3","TCP","4433 → 53612 [SYN, ACK] Seq=0 Ack=1 Win=65160 Len=0 MSS=1460 SACK_PERM TSval=2862788444 TSecr=2168217514 WS=128"
"8","9.559017781","66","4e:56:5b:5c:5d:7f","0e:fd:53:11:5f:2a","172.20.0.3","172.20.0.2","TCP","53612 → 4433 [ACK] Seq=1 Ack=1 Win=64256 Len=0 TSval=2168217514 TSecr=2862788444"
"9","9.559067557","1320","4e:56:5b:5c:5d:7f","0e:fd:53:11:5f:2a","172.20.0.3","172.20.0.2","TLSv1.2","Client Hello"
"10","9.559076854","66","0e:fd:53:11:5f:2a","4e:56:5b:5c:5d:7f","172.20.0.2","172.20.0.3","TCP","4433 → 53612 [ACK] Seq=1 Ack=1255 Win=64128 Len=0 TSval=2862788444 TSecr=2168217514"
"11","9.761607041","1504","0e:fd:53:11:5f:2a","4e:56:5b:5c:5d:7f","172.20.0.2","172.20.0.3","TLSv1.3","Server Hello, Change Cipher Spec, Application Data, Application Data, Application Data, Application Data"
"12","9.761668116","66","4e:56:5b:5c:5d:7f","0e:fd:53:11:5f:2a","172.20.0.3","172.20.0.2","TCP","53612 → 4433 [ACK] Seq=1255 Ack=1439 Win=64128 Len=0 TSval=2168217717 TSecr=2862788647"
"13","9.762970599","146","4e:56:5b:5c:5d:7f","0e:fd:53:11:5f:2a","172.20.0.3","172.20.0.2","TLSv1.3","Change Cipher Spec, Application Data"
"14","9.763043818","66","4e:56:5b:5c:5d:7f","0e:fd:53:11:5f:2a","172.20.0.3","172.20.0.2","TCP","53612 → 4433 [RST, ACK] Seq=1335 Ack=1439 Win=64128 Len=0 TSval=2168217718 TSecr=2862788647"
"15","9.774487720","74","4e:56:5b:5c:5d:7f","0e:fd:53:11:5f:2a","172.20.0.3","172.20.0.2","TCP","53620 → 4433 [SYN] Seq=0 Win=64240 Len=0 MSS=1460 SACK_PERM TSval=2168217729 TSecr=0 WS=128"
"16","9.774523754","74","0e:fd:53:11:5f:2a","4e:56:5b:5c:5d:7f","172.20.0.2","172.20.0.3","TCP","4433 → 53620 [SYN, ACK] Seq=0 Ack=1 Win=65160 Len=0 MSS=1460 SACK_PERM TSval=2862788659 TSecr=2168217729 WS=128"
"17","9.774543628","66","4e:56:5b:5c:5d:7f","0e:fd:53:11:5f:2a","172.20.0.3","172.20.0.2","TCP","53620 → 4433 [ACK] Seq=1 Ack=1 Win=64256 Len=0 TSval=2168217729 TSecr=2862788659"
"18","9.774605108","1320","4e:56:5b:5c:5d:7f","0e:fd:53:11:5f:2a","172.20.0.3","172.20.0.2","TLSv1.2","Client Hello"
"19","9.774612778","66","0e:fd:53:11:5f:2a","4e:56:5b:5c:5d:7f","172.20.0.2","172.20.0.3","TCP","4433 → 53620 [ACK] Seq=1 Ack=1255 Win=64128 Len=0 TSval=2862788660 TSecr=2168217730"
"20","9.775252674","1504","0e:fd:53:11:5f:2a","4e:56:5b:5c:5d:7f","172.20.0.2","172.20.0.3","TLSv1.3","Server Hello, Change Cipher Spec, Application Data, Application Data, Application Data, Application Data"
"21","9.775287367","66","4e:56:5b:5c:5d:7f","0e:fd:53:11:5f:2a","172.20.0.3","172.20.0.2","TCP","53620 → 4433 [ACK] Seq=1255 Ack=1439 Win=64128 Len=0 TSval=2168217730 TSecr=2862788660"
"22","9.776442500","146","4e:56:5b:5c:5d:7f","0e:fd:53:11:5f:2a","172.20.0.3","172.20.0.2","TLSv1.3","Change Cipher Spec, Application Data"
"23","9.776519589","66","4e:56:5b:5c:5d:7f","0e:fd:53:11:5f:2a","172.20.0.3","172.20.0.2","TCP","53620 → 4433 [RST, ACK] Seq=1335 Ack=1439 Win=64128 Len=0 TSval=2168217731 TSecr=2862788660"
"24","9.787517951","74","4e:56:5b:5c:5d:7f","0e:fd:53:11:5f:2a","172.20.0.3","172.20.0.2","TCP","53622 → 4433 [SYN] Seq=0 Win=64240 Len=0 MSS=1460 SACK_PERM TSval=2168217742 TSecr=0 WS=128"
"25","9.787552759","74","0e:fd:53:11:5f:2a","4e:56:5b:5c:5d:7f","172.20.0.2","172.20.0.3","TCP","4433 → 53622 [SYN, ACK] Seq=0 Ack=1 Win=65160 Len=0 MSS=1460 SACK_PERM TSval=2862788672 TSecr=2168217742 WS=128"
"26","9.787596032","66","4e:56:5b:5c:5d:7f","0e:fd:53:11:5f:2a","172.20.0.3","172.20.0.2","TCP","53622 → 4433 [ACK] Seq=1 Ack=1 Win=64256 Len=0 TSval=2168217743 TSecr=2862788672"
"27","9.787638991","1320","4e:56:5b:5c:5d:7f","0e:fd:53:11:5f:2a","172.20.0.3","172.20.0.2","TLSv1.2","Client Hello"
"28","9.787659124","66","0e:fd:53:11:5f:2a","4e:56:5b:5c:5d:7f","172.20.0.2","172.20.0.3","TCP","4433 → 53622 [ACK] Seq=1 Ack=1255 Win=64128 Len=0 TSval=2862788673 TSecr=2168217743"
"29","9.788323059","1504","0e:fd:53:11:5f:2a","4e:56:5b:5c:5d:7f","172.20.0.2","172.20.0.3","TLSv1.3","Server Hello, Change Cipher Spec, Application Data, Application Data, Application Data, Application Data"
"30","9.788354221","66","4e:56:5b:5c:5d:7f","0e:fd:53:11:5f:2a","172.20.0.3","172.20.0.2","TCP","53622 → 4433 [ACK] Seq=1255 Ack=1439 Win=64128 Len=0 TSval=2168217743 TSecr=2862788673"
"31","9.789421666","146","4e:56:5b:5c:5d:7f","0e:fd:53:11:5f:2a","172.20.0.3","172.20.0.2","TLSv1.3","Change Cipher Spec, Application Data"
"32","9.789487316","66","4e:56:5b:5c:5d:7f","0e:fd:53:11:5f:2a","172.20.0.3","172.20.0.2","TCP","53622 → 4433 [RST, ACK] Seq=1335 Ack=1439 Win=64128 Len=0 TSval=2168217744 TSecr=2862788673"
"33","9.800106973","74","4e:56:5b:5c:5d:7f","0e:fd:53:11:5f:2a","172.20.0.3","172.20.0.2","TCP","53630 → 4433 [SYN] Seq=0 Win=64240 Len=0 MSS=1460 SACK_PERM TSval=2168217755 TSecr=0 WS=128"
"34","9.800131747","74","0e:fd:53:11:5f:2a","4e:56:5b:5c:5d:7f","172.20.0.2","172.20.0.3","TCP","4433 → 53630 [SYN, ACK] Seq=0 Ack=1 Win=65160 Len=0 MSS=1460 SACK_PERM TSval=2862788685 TSecr=2168217755 WS=128"
"35","9.800148811","66","4e:56:5b:5c:5d:7f","0e:fd:53:11:5f:2a","172.20.0.3","172.20.0.2","TCP","53630 → 4433 [ACK] Seq=1 Ack=1 Win=64256 Len=0 TSval=2168217755 TSecr=2862788685"
"36","9.800187745","1320","4e:56:5b:5c:5d:7f","0e:fd:53:11:5f:2a","172.20.0.3","172.20.0.2","TLSv1.2","Client Hello"
"37","9.800193790","66","0e:fd:53:11:5f:2a","4e:56:5b:5c:5d:7f","172.20.0.2","172.20.0.3","TCP","4433 → 53630 [ACK] Seq=1 Ack=1255 Win=64128 Len=0 TSval=2862788685 TSecr=2168217755"
"38","9.800770188","1504","0e:fd:53:11:5f:2a","4e:56:5b:5c:5d:7f","172.20.0.2","172.20.0.3","TLSv1.3","Server Hello, Change Cipher Spec, Application Data, Application Data, Application Data, Application Data"
"39","9.800800995","66","4e:56:5b:5c:5d:7f","0e:fd:53:11:5f:2a","172.20.0.3","172.20.0.2","TCP","53630 → 4433 [ACK] Seq=1255 Ack=1439 Win=64128 Len=0 TSval=2168217756 TSecr=2862788686"
"40","9.801875387","146","4e:56:5b:5c:5d:7f","0e:fd:53:11:5f:2a","172.20.0.3","172.20.0.2","TLSv1.3","Change Cipher Spec, Application Data"
"41","9.801936730","66","4e:56:5b:5c:5d:7f","0e:fd:53:11:5f:2a","172.20.0.3","172.20.0.2","TCP","53630 → 4433 [RST, ACK] Seq=1335 Ack=1439 Win=64128 Len=0 TSval=2168217757 TSecr=2862788686"
"42","9.812370464","74","4e:56:5b:5c:5d:7f","0e:fd:53:11:5f:2a","172.20.0.3","172.20.0.2","TCP","53638 → 4433 [SYN] Seq=0 Win=64240 Len=0 MSS=1460 SACK_PERM TSval=2168217767 TSecr=0 WS=128"
"43","9.812394785","74","0e:fd:53:11:5f:2a","4e:56:5b:5c:5d:7f","172.20.0.2","172.20.0.3","TCP","4433 → 53638 [SYN, ACK] Seq=0 Ack=1 Win=65160 Len=0 MSS=1460 SACK_PERM TSval=2862788697 TSecr=2168217767 WS=128"
"44","9.812413393","66","4e:56:5b:5c:5d:7f","0e:fd:53:11:5f:2a","172.20.0.3","172.20.0.2","TCP","53638 → 4433 [ACK] Seq=1 Ack=1 Win=64256 Len=0 TSval=2168217767 TSecr=2862788697"
"45","9.812453912","1320","4e:56:5b:5c:5d:7f","0e:fd:53:11:5f:2a","172.20.0.3","172.20.0.2","TLSv1.2","Client Hello"
"46","9.812469703","66","0e:fd:53:11:5f:2a","4e:56:5b:5c:5d:7f","172.20.0.2","172.20.0.3","TCP","4433 → 53638 [ACK] Seq=1 Ack=1255 Win=64128 Len=0 TSval=2862788697 TSecr=2168217767"
"47","9.813048142","1504","0e:fd:53:11:5f:2a","4e:56:5b:5c:5d:7f","172.20.0.2","172.20.0.3","TLSv1.3","Server Hello, Change Cipher Spec, Application Data, Application Data, Application Data, Application Data"
"48","9.813068299","66","4e:56:5b:5c:5d:7f","0e:fd:53:11:5f:2a","172.20.0.3","172.20.0.2","TCP","53638 → 4433 [ACK] Seq=1255 Ack=1439 Win=64128 Len=0 TSval=2168217768 TSecr=2862788698"
"49","9.814097718","146","4e:56:5b:5c:5d:7f","0e:fd:53:11:5f:2a","172.20.0.3","172.20.0.2","TLSv1.3","Change Cipher Spec, Application Data"
"50","9.814154341","66","4e:56:5b:5c:5d:7f","0e:fd:53:11:5f:2a","172.20.0.3","172.20.0.2","TCP","53638 → 4433 [RST, ACK] Seq=1335 Ack=1439 Win=64128 Len=0 TSval=2168217769 TSecr=2862788698"
"51","9.825145458","74","4e:56:5b:5c:5d:7f","0e:fd:53:11:5f:2a","172.20.0.3","172.20.0.2","TCP","53652 → 4433 [SYN] Seq=0 Win=64240 Len=0 MSS=1460 SACK_PERM TSval=2168217780 TSecr=0 WS=128"
"52","10.525311788","42","4e:56:5b:5c:5d:7f","ff:ff:ff:ff:ff:ff",,,"ARP","ARP Announcement for 172.20.0.3"
"53","10.825629735","74","0e:fd:53:11:5f:2a","4e:56:5b:5c:5d:7f","172.20.0.2","172.20.0.3","TCP","4433 → 53652 [SYN, ACK] Seq=0 Ack=1 Win=65160 Len=0 MSS=1460 SACK_PERM TSval=2862789711 TSecr=2168217780 WS=128"
"54","10.825647045","74","4e:56:5b:5c:5d:7f","0e:fd:53:11:5f:2a","172.20.0.3","172.20.0.2","TCP","[TCP Retransmission] 53652 → 4433 [SYN] Seq=0 Win=64240 Len=0 MSS=1460 SACK_PERM TSval=2168218781 TSecr=0 WS=128"
"55","10.825661497","74","0e:fd:53:11:5f:2a","4e:56:5b:5c:5d:7f","172.20.0.2","172.20.0.3","TCP","[TCP Out-Of-Order] 4433 → 53652 [SYN, ACK] Seq=0 Ack=1 Win=65160 Len=0 MSS=1460 SACK_PERM TSval=2862789711 TSecr=2168217780 WS=128"
"56","10.825697699","66","4e:56:5b:5c:5d:7f","0e:fd:53:11:5f:2a","172.20.0.3","172.20.0.2","TCP","53652 → 4433 [ACK] Seq=1 Ack=1 Win=64256 Len=0 TSval=2168218781 TSecr=2862789711"
"57","10.825721069","66","4e:56:5b:5c:5d:7f","0e:fd:53:11:5f:2a","172.20.0.3","172.20.0.2","TCP","[TCP Dup ACK 56#1] 53652 → 4433 [ACK] Seq=1 Ack=1 Win=64256 Len=0 TSval=2168218781 TSecr=2862789711"
"58","10.825771258","1320","4e:56:5b:5c:5d:7f","0e:fd:53:11:5f:2a","172.20.0.3","172.20.0.2","TLSv1.2","Client Hello"
"59","10.825778215","66","0e:fd:53:11:5f:2a","4e:56:5b:5c:5d:7f","172.20.0.2","172.20.0.3","TCP","4433 → 53652 [ACK] Seq=1 Ack=1255 Win=64128 Len=0 TSval=2862789711 TSecr=2168218781"
"60","10.826459078","1504","0e:fd:53:11:5f:2a","4e:56:5b:5c:5d:7f","172.20.0.2","172.20.0.3","TLSv1.3","Server Hello, Change Cipher Spec, Application Data, Application Data, Application Data, Application Data"
"61","10.826499216","66","4e:56:5b:5c:5d:7f","0e:fd:53:11:5f:2a","172.20.0.3","172.20.0.2","TCP","53652 → 4433 [ACK] Seq=1255 Ack=1439 Win=64128 Len=0 TSval=2168218781 TSecr=2862789711"
"62","10.827694845","146","4e:56:5b:5c:5d:7f","0e:fd:53:11:5f:2a","172.20.0.3","172.20.0.2","TLSv1.3","Change Cipher Spec, Application Data"
"63","10.827756752","66","4e:56:5b:5c:5d:7f","0e:fd:53:11:5f:2a","172.20.0.3","172.20.0.2","TCP","53652 → 4433 [RST, ACK] Seq=1335 Ack=1439 Win=64128 Len=0 TSval=2168218783 TSecr=2862789711"
"64","10.839311703","74","4e:56:5b:5c:5d:7f","0e:fd:53:11:5f:2a","172.20.0.3","172.20.0.2","TCP","53656 → 4433 [SYN] Seq=0 Win=64240 Len=0 MSS=1460 SACK_PERM TSval=2168218794 TSecr=0 WS=128"
"65","10.839342959","74","0e:fd:53:11:5f:2a","4e:56:5b:5c:5d:7f","172.20.0.2","172.20.0.3","TCP","4433 → 53656 [SYN, ACK] Seq=0 Ack=1 Win=65160 Len=0 MSS=1460 SACK_PERM TSval=2862789724 TSecr=2168218794 WS=128"
"66","10.839363604","66","4e:56:5b:5c:5d:7f","0e:fd:53:11:5f:2a","172.20.0.3","172.20.0.2","TCP","53656 → 4433 [ACK] Seq=1 Ack=1 Win=64256 Len=0 TSval=2168218794 TSecr=2862789724"
"67","10.839412443","1320","4e:56:5b:5c:5d:7f","0e:fd:53:11:5f:2a","172.20.0.3","172.20.0.2","TLSv1.2","Client Hello"
"68","10.839419575","66","0e:fd:53:11:5f:2a","4e:56:5b:5c:5d:7f","172.20.0.2","172.20.0.3","TCP","4433 → 53656 [ACK] Seq=1 Ack=1255 Win=64128 Len=0 TSval=2862789724 TSecr=2168218794"
"69","11.524464826","42","4e:56:5b:5c:5d:7f","ff:ff:ff:ff:ff:ff",,,"ARP","ARP Announcement for 172.20.0.3"
"70","12.489612267","1504","0e:fd:53:11:5f:2a","4e:56:5b:5c:5d:7f","172.20.0.2","172.20.0.3","TLSv1.3","Server Hello, Change Cipher Spec, Application Data, Application Data, Application Data, Application Data"
"71","12.489708360","66","4e:56:5b:5c:5d:7f","0e:fd:53:11:5f:2a","172.20.0.3","172.20.0.2","TCP","53656 → 4433 [ACK] Seq=1255 Ack=1439 Win=64128 Len=0 TSval=2168220445 TSecr=2862791375"
"72","12.491121916","146","4e:56:5b:5c:5d:7f","0e:fd:53:11:5f:2a","172.20.0.3","172.20.0.2","TLSv1.3","Change Cipher Spec, Application Data"
"73","12.491199319","66","4e:56:5b:5c:5d:7f","0e:fd:53:11:5f:2a","172.20.0.3","172.20.0.2","TCP","53656 → 4433 [RST, ACK] Seq=1335 Ack=1439 Win=64128 Len=0 TSval=2168220446 TSecr=2862791375"
"74","12.502724834","74","4e:56:5b:5c:5d:7f","0e:fd:53:11:5f:2a","172.20.0.3","172.20.0.2","TCP","53662 → 4433 [SYN] Seq=0 Win=64240 Len=0 MSS=1460 SACK_PERM TSval=2168220458 TSecr=0 WS=128"
"75","12.502755997","74","0e:fd:53:11:5f:2a","4e:56:5b:5c:5d:7f","172.20.0.2","172.20.0.3","TCP","4433 → 53662 [SYN, ACK] Seq=0 Ack=1 Win=65160 Len=0 MSS=1460 SACK_PERM TSval=2862791388 TSecr=2168220458 WS=128"
"76","12.502777989","66","4e:56:5b:5c:5d:7f","0e:fd:53:11:5f:2a","172.20.0.3","172.20.0.2","TCP","53662 → 4433 [ACK] Seq=1 Ack=1 Win=64256 Len=0 TSval=2168220458 TSecr=2862791388"
"77","12.502819749","1320","4e:56:5b:5c:5d:7f","0e:fd:53:11:5f:2a","172.20.0.3","172.20.0.2","TLSv1.2","Client Hello"
"78","12.503453203","1504","0e:fd:53:11:5f:2a","4e:56:5b:5c:5d:7f","172.20.0.2","172.20.0.3","TLSv1.3","Server Hello, Change Cipher Spec, Application Data, Application Data, Application Data, Application Data"
"79","12.503490779","66","4e:56:5b:5c:5d:7f","0e:fd:53:11:5f:2a","172.20.0.3","172.20.0.2","TCP","53662 → 4433 [ACK] Seq=1255 Ack=1439 Win=64128 Len=0 TSval=2168220458 TSecr=2862791388"
"80","12.504622049","146","4e:56:5b:5c:5d:7f","0e:fd:53:11:5f:2a","172.20.0.3","172.20.0.2","TLSv1.3","Change Cipher Spec, Application Data"
"81","12.504676302","66","4e:56:5b:5c:5d:7f","0e:fd:53:11:5f:2a","172.20.0.3","172.20.0.2","TCP","53662 → 4433 [RST, ACK] Seq=1335 Ack=1439 Win=64128 Len=0 TSval=2168220460 TSecr=2862791388"
"82","12.515332084","74","4e:56:5b:5c:5d:7f","0e:fd:53:11:5f:2a","172.20.0.3","172.20.0.2","TCP","53664 → 4433 [SYN] Seq=0 Win=64240 Len=0 MSS=1460 SACK_PERM TSval=2168220470 TSecr=0 WS=128"
"83","12.515358999","74","0e:fd:53:11:5f:2a","4e:56:5b:5c:5d:7f","172.20.0.2","172.20.0.3","TCP","4433 → 53664 [SYN, ACK] Seq=0 Ack=1 Win=65160 Len=0 MSS=1460 SACK_PERM TSval=2862791400 TSecr=2168220470 WS=128"
"84","12.515378092","66","4e:56:5b:5c:5d:7f","0e:fd:53:11:5f:2a","172.20.0.3","172.20.0.2","TCP","53664 → 4433 [ACK] Seq=1 Ack=1 Win=64256 Len=0 TSval=2168220470 TSecr=2862791400"
"85","12.515419466","1320","4e:56:5b:5c:5d:7f","0e:fd:53:11:5f:2a","172.20.0.3","172.20.0.2","TLSv1.2","Client Hello"
"86","12.515424423","66","0e:fd:53:11:5f:2a","4e:56:5b:5c:5d:7f","172.20.0.2","172.20.0.3","TCP","4433 → 53664 [ACK] Seq=1 Ack=1255 Win=64128 Len=0 TSval=2862791400 TSecr=2168220470"
"87","12.745610783","70","2a:f3:d5:ae:2e:a2","33:33:00:00:00:02",,,"ICMPv6","Router Solicitation from 2a:f3:d5:ae:2e:a2"
"88","12.929610854","1504","0e:fd:53:11:5f:2a","4e:56:5b:5c:5d:7f","172.20.0.2","172.20.0.3","TLSv1.3","Server Hello, Change Cipher Spec, Application Data, Application Data, Application Data, Application Data"
"89","12.929707628","66","4e:56:5b:5c:5d:7f","0e:fd:53:11:5f:2a","172.20.0.3","172.20.0.2","TCP","53664 → 4433 [ACK] Seq=1255 Ack=1439 Win=64128 Len=0 TSval=2168220885 TSecr=2862791815"
"90","12.931099008","146","4e:56:5b:5c:5d:7f","0e:fd:53:11:5f:2a","172.20.0.3","172.20.0.2","TLSv1.3","Change Cipher Spec, Application Data"
"91","12.931168877","66","4e:56:5b:5c:5d:7f","0e:fd:53:11:5f:2a","172.20.0.3","172.20.0.2","TCP","53664 → 4433 [RST, ACK] Seq=1335 Ack=1439 Win=64128 Len=0 TSval=2168220886 TSecr=2862791815"
"92","12.942602312","74","4e:56:5b:5c:5d:7f","0e:fd:53:11:5f:2a","172.20.0.3","172.20.0.2","TCP","53666 → 4433 [SYN] Seq=0 Win=64240 Len=0 MSS=1460 SACK_PERM TSval=2168220897 TSecr=0 WS=128"
"93","13.961634750","74","0e:fd:53:11:5f:2a","4e:56:5b:5c:5d:7f","172.20.0.2","172.20.0.3","TCP","4433 → 53666 [SYN, ACK] Seq=0 Ack=1 Win=65160 Len=0 MSS=1460 SACK_PERM TSval=2862792847 TSecr=2168220897 WS=128"
"94","13.961678411","74","4e:56:5b:5c:5d:7f","0e:fd:53:11:5f:2a","172.20.0.3","172.20.0.2","TCP","[TCP Retransmission] 53666 → 4433 [SYN] Seq=0 Win=64240 Len=0 MSS=1460 SACK_PERM TSval=2168221917 TSecr=0 WS=128"
"95","13.961694287","74","0e:fd:53:11:5f:2a","4e:56:5b:5c:5d:7f","172.20.0.2","172.20.0.3","TCP","[TCP Out-Of-Order] 4433 → 53666 [SYN, ACK] Seq=0 Ack=1 Win=65160 Len=0 MSS=1460 SACK_PERM TSval=2862792847 TSecr=2168220897 WS=128"
"96","13.961744449","66","4e:56:5b:5c:5d:7f","0e:fd:53:11:5f:2a","172.20.0.3","172.20.0.2","TCP","53666 → 4433 [ACK] Seq=1 Ack=1 Win=64256 Len=0 TSval=2168221917 TSecr=2862792847"
"97","13.961773922","66","4e:56:5b:5c:5d:7f","0e:fd:53:11:5f:2a","172.20.0.3","172.20.0.2","TCP","[TCP Dup ACK 96#1] 53666 → 4433 [ACK] Seq=1 Ack=1 Win=64256 Len=0 TSval=2168221917 TSecr=2862792847"
"98","13.961839582","1320","4e:56:5b:5c:5d:7f","0e:fd:53:11:5f:2a","172.20.0.3","172.20.0.2","TLSv1.2","Client Hello"
"99","14.169608690","1504","0e:fd:53:11:5f:2a","4e:56:5b:5c:5d:7f","172.20.0.2","172.20.0.3","TLSv1.3","Server Hello, Change Cipher Spec, Application Data, Application Data, Application Data, Application Data"
"100","14.169704391","66","4e:56:5b:5c:5d:7f","0e:fd:53:11:5f:2a","172.20.0.3","172.20.0.2","TCP","53666 → 4433 [ACK] Seq=1255 Ack=1439 Win=64128 Len=0 TSval=2168222125 TSecr=2862793055"
"101","14.171104466","146","4e:56:5b:5c:5d:7f","0e:fd:53:11:5f:2a","172.20.0.3","172.20.0.2","TLSv1.3","Change Cipher Spec, Application Data"
"102","14.171173554","66","4e:56:5b:5c:5d:7f","0e:fd:53:11:5f:2a","172.20.0.3","172.20.0.2","TCP","53666 → 4433 [RST, ACK] Seq=1335 Ack=1439 Win=64128 Len=0 TSval=2168222126 TSecr=2862793055"
"103","14.182756904","74","4e:56:5b:5c:5d:7f","0e:fd:53:11:5f:2a","172.20.0.3","172.20.0.2","TCP","53680 → 4433 [SYN] Seq=0 Win=64240 Len=0 MSS=1460 SACK_PERM TSval=2168222138 TSecr=0 WS=128"
"104","14.182785598","74","0e:fd:53:11:5f:2a","4e:56:5b:5c:5d:7f","172.20.0.2","172.20.0.3","TCP","4433 → 53680 [SYN, ACK] Seq=0 Ack=1 Win=65160 Len=0 MSS=1460 SACK_PERM TSval=2862793068 TSecr=2168222138 WS=128"
"105","14.182806122","66","4e:56:5b:5c:5d:7f","0e:fd:53:11:5f:2a","172.20.0.3","172.20.0.2","TCP","53680 → 4433 [ACK] Seq=1 Ack=1 Win=64256 Len=0 TSval=2168222138 TSecr=2862793068"
"106","14.182858046","1320","4e:56:5b:5c:5d:7f","0e:fd:53:11:5f:2a","172.20.0.3","172.20.0.2","TLSv1.2","Client Hello"
"107","14.182865842","66","0e:fd:53:11:5f:2a","4e:56:5b:5c:5d:7f","172.20.0.2","172.20.0.3","TCP","4433 → 53680 [ACK] Seq=1 Ack=1255 Win=64128 Len=0 TSval=2862793068 TSecr=2168222138"
"108","14.183481913","1504","0e:fd:53:11:5f:2a","4e:56:5b:5c:5d:7f","172.20.0.2","172.20.0.3","TLSv1.3","Server Hello, Change Cipher Spec, Application Data, Application Data, Application Data, Application Data"
"109","14.183519585","66","4e:56:5b:5c:5d:7f","0e:fd:53:11:5f:2a","172.20.0.3","172.20.0.2","TCP","53680 → 4433 [ACK] Seq=1255 Ack=1439 Win=64128 Len=0 TSval=2168222138 TSecr=2862793068"
"110","14.184689514","146","4e:56:5b:5c:5d:7f","0e:fd:53:11:5f:2a","172.20.0.3","172.20.0.2","TLSv1.3","Change Cipher Spec, Application Data"
"111","14.184759576","66","4e:56:5b:5c:5d:7f","0e:fd:53:11:5f:2a","172.20.0.3","172.20.0.2","TCP","53680 → 4433 [RST, ACK] Seq=1335 Ack=1439 Win=64128 Len=0 TSval=2168222140 TSecr=2862793068"
"112","14.195484840","74","4e:56:5b:5c:5d:7f","0e:fd:53:11:5f:2a","172.20.0.3","172.20.0.2","TCP","53690 → 4433 [SYN] Seq=0 Win=64240 Len=0 MSS=1460 SACK_PERM TSval=2168222150 TSecr=0 WS=128"
"113","14.195509932","74","0e:fd:53:11:5f:2a","4e:56:5b:5c:5d:7f","172.20.0.2","172.20.0.3","TCP","4433 → 53690 [SYN, ACK] Seq=0 Ack=1 Win=65160 Len=0 MSS=1460 SACK_PERM TSval=2862793080 TSecr=2168222150 WS=128"
"114","14.195527782","66","4e:56:5b:5c:5d:7f","0e:fd:53:11:5f:2a","172.20.0.3","172.20.0.2","TCP","53690 → 4433 [ACK] Seq=1 Ack=1 Win=64256 Len=0 TSval=2168222150 TSecr=2862793080"
"115","14.195587566","1320","4e:56:5b:5c:5d:7f","0e:fd:53:11:5f:2a","172.20.0.3","172.20.0.2","TLSv1.2","Client Hello"
"116","14.195594638","66","0e:fd:53:11:5f:2a","4e:56:5b:5c:5d:7f","172.20.0.2","172.20.0.3","TCP","4433 → 53690 [ACK] Seq=1 Ack=1255 Win=64128 Len=0 TSval=2862793081 TSecr=2168222150"
"117","14.196192586","1504","0e:fd:53:11:5f:2a","4e:56:5b:5c:5d:7f","172.20.0.2","172.20.0.3","TLSv1.3","Server Hello, Change Cipher Spec, Application Data, Application Data, Application Data, Application Data"
"118","14.196224994","66","4e:56:5b:5c:5d:7f","0e:fd:53:11:5f:2a","172.20.0.3","172.20.0.2","TCP","53690 → 4433 [ACK] Seq=1255 Ack=1439 Win=64128 Len=0 TSval=2168222151 TSecr=2862793081"
"119","14.197358173","146","4e:56:5b:5c:5d:7f","0e:fd:53:11:5f:2a","172.20.0.3","172.20.0.2","TLSv1.3","Change Cipher Spec, Application Data"
"120","14.197419423","66","4e:56:5b:5c:5d:7f","0e:fd:53:11:5f:2a","172.20.0.3","172.20.0.2","TCP","53690 → 4433 [RST, ACK] Seq=1335 Ack=1439 Win=64128 Len=0 TSval=2168222152 TSecr=2862793081"
"121","14.208075000","74","4e:56:5b:5c:5d:7f","0e:fd:53:11:5f:2a","172.20.0.3","172.20.0.2","TCP","53706 → 4433 [SYN] Seq=0 Win=64240 Len=0 MSS=1460 SACK_PERM TSval=2168222163 TSecr=0 WS=128"
"122","14.208100115","74","0e:fd:53:11:5f:2a","4e:56:5b:5c:5d:7f","172.20.0.2","172.20.0.3","TCP","4433 → 53706 [SYN, ACK] Seq=0 Ack=1 Win=65160 Len=0 MSS=1460 SACK_PERM TSval=2862793093 TSecr=2168222163 WS=128"
"123","14.208119444","66","4e:56:5b:5c:5d:7f","0e:fd:53:11:5f:2a","172.20.0.3","172.20.0.2","TCP","53706 → 4433 [ACK] Seq=1 Ack=1 Win=64256 Len=0 TSval=2168222163 TSecr=2862793093"
"124","14.208160560","1320","4e:56:5b:5c:5d:7f","0e:fd:53:11:5f:2a","172.20.0.3","172.20.0.2","TLSv1.2","Client Hello"
"125","14.208167279","66","0e:fd:53:11:5f:2a","4e:56:5b:5c:5d:7f","172.20.0.2","172.20.0.3","TCP","4433 → 53706 [ACK] Seq=1 Ack=1255 Win=64128 Len=0 TSval=2862793093 TSecr=2168222163"
"126","14.208754767","1504","0e:fd:53:11:5f:2a","4e:56:5b:5c:5d:7f","172.20.0.2","172.20.0.3","TLSv1.3","Server Hello, Change Cipher Spec, Application Data, Application Data, Application Data, Application Data"
"127","14.208782699","66","4e:56:5b:5c:5d:7f","0e:fd:53:11:5f:2a","172.20.0.3","172.20.0.2","TCP","53706 → 4433 [ACK] Seq=1255 Ack=1439 Win=64128 Len=0 TSval=2168222164 TSecr=2862793094"
"128","14.209833506","146","4e:56:5b:5c:5d:7f","0e:fd:53:11:5f:2a","172.20.0.3","172.20.0.2","TLSv1.3","Change Cipher Spec, Application Data"
"129","14.209891826","66","4e:56:5b:5c:5d:7f","0e:fd:53:11:5f:2a","172.20.0.3","172.20.0.2","TCP","53706 → 4433 [RST, ACK] Seq=1335 Ack=1439 Win=64128 Len=0 TSval=2168222165 TSecr=2862793094"
"130","14.221150620","74","4e:56:5b:5c:5d:7f","0e:fd:53:11:5f:2a","172.20.0.3","172.20.0.2","TCP","53712 → 4433 [SYN] Seq=0 Win=64240 Len=0 MSS=1460 SACK_PERM TSval=2168222176 TSecr=0 WS=128"
"131","14.221176879","74","0e:fd:53:11:5f:2a","4e:56:5b:5c:5d:7f","172.20.0.2","172.20.0.3","TCP","4433 → 53712 [SYN, ACK] Seq=0 Ack=1 Win=65160 Len=0 MSS=1460 SACK_PERM TSval=2862793106 TSecr=2168222176 WS=128"
"132","14.221202025","66","4e:56:5b:5c:5d:7f","0e:fd:53:11:5f:2a","172.20.0.3","172.20.0.2","TCP","53712 → 4433 [ACK] Seq=1 Ack=1 Win=64256 Len=0 TSval=2168222176 TSecr=2862793106"
"133","14.221247187","1320","4e:56:5b:5c:5d:7f","0e:fd:53:11:5f:2a","172.20.0.3","172.20.0.2","TLSv1.2","Client Hello"
"134","14.221253970","66","0e:fd:53:11:5f:2a","4e:56:5b:5c:5d:7f","172.20.0.2","172.20.0.3","TCP","4433 → 53712 [ACK] Seq=1 Ack=1255 Win=64128 Len=0 TSval=2862793106 TSecr=2168222176"
"135","14.221851757","1504","0e:fd:53:11:5f:2a","4e:56:5b:5c:5d:7f","172.20.0.2","172.20.0.3","TLSv1.3","Server Hello, Change Cipher Spec, Application Data, Application Data, Application Data, Application Data"
"136","14.221883655","66","4e:56:5b:5c:5d:7f","0e:fd:53:11:5f:2a","172.20.0.3","172.20.0.2","TCP","53712 → 4433 [ACK] Seq=1255 Ack=1439 Win=64128 Len=0 TSval=2168222177 TSecr=2862793107"
"137","14.223010422","146","4e:56:5b:5c:5d:7f","0e:fd:53:11:5f:2a","172.20.0.3","172.20.0.2","TLSv1.3","Change Cipher Spec, Application Data"
"138","14.223064820","66","4e:56:5b:5c:5d:7f","0e:fd:53:11:5f:2a","172.20.0.3","172.20.0.2","TCP","53712 → 4433 [RST, ACK] Seq=1335 Ack=1439 Win=64128 Len=0 TSval=2168222178 TSecr=2862793107"
"139","14.234305099","74","4e:56:5b:5c:5d:7f","0e:fd:53:11:5f:2a","172.20.0.3","172.20.0.2","TCP","53728 → 4433 [SYN] Seq=0 Win=64240 Len=0 MSS=1460 SACK_PERM TSval=2168222189 TSecr=0 WS=128"
"140","14.234332802","74","0e:fd:53:11:5f:2a","4e:56:5b:5c:5d:7f","172.20.0.2","172.20.0.3","TCP","4433 → 53728 [SYN, ACK] Seq=0 Ack=1 Win=65160 Len=0 MSS=1460 SACK_PERM TSval=2862793119 TSecr=2168222189 WS=128"
"141","14.234353323","66","4e:56:5b:5c:5d:7f","0e:fd:53:11:5f:2a","172.20.0.3","172.20.0.2","TCP","53728 → 4433 [ACK] Seq=1 Ack=1 Win=64256 Len=0 TSval=2168222189 TSecr=2862793119"
"142","14.234392702","1320","4e:56:5b:5c:5d:7f","0e:fd:53:11:5f:2a","172.20.0.3","172.20.0.2","TLSv1.2","Client Hello"
"143","14.234399739","66","0e:fd:53:11:5f:2a","4e:56:5b:5c:5d:7f","172.20.0.2","172.20.0.3","TCP","4433 → 53728 [ACK] Seq=1 Ack=1255 Win=64128 Len=0 TSval=2862793119 TSecr=2168222189"
"144","14.234991165","1504","0e:fd:53:11:5f:2a","4e:56:5b:5c:5d:7f","172.20.0.2","172.20.0.3","TLSv1.3","Server Hello, Change Cipher Spec, Application Data, Application Data, Application Data, Application Data"
"145","14.235045786","66","4e:56:5b:5c:5d:7f","0e:fd:53:11:5f:2a","172.20.0.3","172.20.0.2","TCP","53728 → 4433 [ACK] Seq=1255 Ack=1439 Win=64128 Len=0 TSval=2168222190 TSecr=2862793120"
"146","14.236062605","146","4e:56:5b:5c:5d:7f","0e:fd:53:11:5f:2a","172.20.0.3","172.20.0.2","TLSv1.3","Change Cipher Spec, Application Data"
"147","14.236135188","66","4e:56:5b:5c:5d:7f","0e:fd:53:11:5f:2a","172.20.0.3","172.20.0.2","TCP","53728 → 4433 [RST, ACK] Seq=1335 Ack=1439 Win=64128 Len=0 TSval=2168222191 TSecr=2862793120"
"148","14.246626411","74","4e:56:5b:5c:5d:7f","0e:fd:53:11:5f:2a","172.20.0.3","172.20.0.2","TCP","53742 → 4433 [SYN] Seq=0 Win=64240 Len=0 MSS=1460 SACK_PERM TSval=2168222202 TSecr=0 WS=128"
"149","14.246658582","74","0e:fd:53:11:5f:2a","4e:56:5b:5c:5d:7f","172.20.0.2","172.20.0.3","TCP","4433 → 53742 [SYN, ACK] Seq=0 Ack=1 Win=65160 Len=0 MSS=1460 SACK_PERM TSval=2862793132 TSecr=2168222202 WS=128"
"150","14.246677761","66","4e:56:5b:5c:5d:7f","0e:fd:53:11:5f:2a","172.20.0.3","172.20.0.2","TCP","53742 → 4433 [ACK] Seq=1 Ack=1 Win=64256 Len=0 TSval=2168222202 TSecr=2862793132"
"151","14.246721229","1320","4e:56:5b:5c:5d:7f","0e:fd:53:11:5f:2a","172.20.0.3","172.20.0.2","TLSv1.2","Client Hello"
"152","14.246726055","66","0e:fd:53:11:5f:2a","4e:56:5b:5c:5d:7f","172.20.0.2","172.20.0.3","TCP","4433 → 53742 [ACK] Seq=1 Ack=1255 Win=64128 Len=0 TSval=2862793132 TSecr=2168222202"
"153","14.247331202","1504","0e:fd:53:11:5f:2a","4e:56:5b:5c:5d:7f","172.20.0.2","172.20.0.3","TLSv1.3","Server Hello, Change Cipher Spec, Application Data, Application Data, Application Data, Application Data"
"154","14.247368954","66","4e:56:5b:5c:5d:7f","0e:fd:53:11:5f:2a","172.20.0.3","172.20.0.2","TCP","53742 → 4433 [ACK] Seq=1255 Ack=1439 Win=64128 Len=0 TSval=2168222202 TSecr=2862793132"
"155","14.248380366","146","4e:56:5b:5c:5d:7f","0e:fd:53:11:5f:2a","172.20.0.3","172.20.0.2","TLSv1.3","Change Cipher Spec, Application Data"
"156","14.248435816","66","4e:56:5b:5c:5d:7f","0e:fd:53:11:5f:2a","172.20.0.3","172.20.0.2","TCP","53742 → 4433 [RST, ACK] Seq=1335 Ack=1439 Win=64128 Len=0 TSval=2168222203 TSecr=2862793132"
"157","14.259122896","74","4e:56:5b:5c:5d:7f","0e:fd:53:11:5f:2a","172.20.0.3","172.20.0.2","TCP","53750 → 4433 [SYN] Seq=0 Win=64240 Len=0 MSS=1460 SACK_PERM TSval=2168222214 TSecr=0 WS=128"
"158","14.259149630","74","0e:fd:53:11:5f:2a","4e:56:5b:5c:5d:7f","172.20.0.2","172.20.0.3","TCP","4433 → 53750 [SYN, ACK] Seq=0 Ack=1 Win=65160 Len=0 MSS=1460 SACK_PERM TSval=2862793144 TSecr=2168222214 WS=128"
"159","14.259170619","66","4e:56:5b:5c:5d:7f","0e:fd:53:11:5f:2a","172.20.0.3","172.20.0.2","TCP","53750 → 4433 [ACK] Seq=1 Ack=1 Win=64256 Len=0 TSval=2168222214 TSecr=2862793144"
"160","14.259210629","1320","4e:56:5b:5c:5d:7f","0e:fd:53:11:5f:2a","172.20.0.3","172.20.0.2","TLSv1.2","Client Hello"
"161","14.259771614","1504","0e:fd:53:11:5f:2a","4e:56:5b:5c:5d:7f","172.20.0.2","172.20.0.3","TLSv1.3","Server Hello, Change Cipher Spec, Application Data, Application Data, Application Data, Application Data"
"162","14.259803756","66","4e:56:5b:5c:5d:7f","0e:fd:53:11:5f:2a","172.20.0.3","172.20.0.2","TCP","53750 → 4433 [ACK] Seq=1255 Ack=1439 Win=64128 Len=0 TSval=2168222215 TSecr=2862793145"
"163","14.260906492","146","4e:56:5b:5c:5d:7f","0e:fd:53:11:5f:2a","172.20.0.3","172.20.0.2","TLSv1.3","Change Cipher Spec, Application Data"
"164","14.260962442","66","4e:56:5b:5c:5d:7f","0e:fd:53:11:5f:2a","172.20.0.3","172.20.0.2","TCP","53750 → 4433 [RST, ACK] Seq=1335 Ack=1439 Win=64128 Len=0 TSval=2168222216 TSecr=2862793145"
"165","14.271519572","74","4e:56:5b:5c:5d:7f","0e:fd:53:11:5f:2a","172.20.0.3","172.20.0.2","TCP","53756 → 4433 [SYN] Seq=0 Win=64240 Len=0 MSS=1460 SACK_PERM TSval=2168222226 TSecr=0 WS=128"
"166","14.271548879","74","0e:fd:53:11:5f:2a","4e:56:5b:5c:5d:7f","172.20.0.2","172.20.0.3","TCP","4433 → 53756 [SYN, ACK] Seq=0 Ack=1 Win=65160 Len=0 MSS=1460 SACK_PERM TSval=2862793156 TSecr=2168222226 WS=128"
"167","14.271584485","66","4e:56:5b:5c:5d:7f","0e:fd:53:11:5f:2a","172.20.0.3","172.20.0.2","TCP","53756 → 4433 [ACK] Seq=1 Ack=1 Win=64256 Len=0 TSval=2168222227 TSecr=2862793156"
"168","14.271630950","1320","4e:56:5b:5c:5d:7f","0e:fd:53:11:5f:2a","172.20.0.3","172.20.0.2","TLSv1.2","Client Hello"
"169","14.271647081","66","0e:fd:53:11:5f:2a","4e:56:5b:5c:5d:7f","172.20.0.2","172.20.0.3","TCP","4433 → 53756 [ACK] Seq=1 Ack=1255 Win=64128 Len=0 TSval=2862793157 TSecr=2168222227"
"170","14.272248762","1504","0e:fd:53:11:5f:2a","4e:56:5b:5c:5d:7f","172.20.0.2","172.20.0.3","TLSv1.3","Server Hello, Change Cipher Spec, Application Data, Application Data, Application Data, Application Data"
"171","14.272272377","66","4e:56:5b:5c:5d:7f","0e:fd:53:11:5f:2a","172.20.0.3","172.20.0.2","TCP","53756 → 4433 [ACK] Seq=1255 Ack=1439 Win=64128 Len=0 TSval=2168222227 TSecr=2862793157"
"172","14.273351222","146","4e:56:5b:5c:5d:7f","0e:fd:53:11:5f:2a","172.20.0.3","172.20.0.2","TLSv1.3","Change Cipher Spec, Application Data"
"173","14.273408805","66","4e:56:5b:5c:5d:7f","0e:fd:53:11:5f:2a","172.20.0.3","172.20.0.2","TCP","53756 → 4433 [RST, ACK] Seq=1335 Ack=1439 Win=64128 Len=0 TSval=2168222228 TSecr=2862793157"
"174","14.284022822","74","4e:56:5b:5c:5d:7f","0e:fd:53:11:5f:2a","172.20.0.3","172.20.0.2","TCP","53758 → 4433 [SYN] Seq=0 Win=64240 Len=0 MSS=1460 SACK_PERM TSval=2168222239 TSecr=0 WS=128"
"175","14.284045727","74","0e:fd:53:11:5f:2a","4e:56:5b:5c:5d:7f","172.20.0.2","172.20.0.3","TCP","4433 → 53758 [SYN, ACK] Seq=0 Ack=1 Win=65160 Len=0 MSS=1460 SACK_PERM TSval=2862793169 TSecr=2168222239 WS=128"
"176","14.284063246","66","4e:56:5b:5c:5d:7f","0e:fd:53:11:5f:2a","172.20.0.3","172.20.0.2","TCP","53758 → 4433 [ACK] Seq=1 Ack=1 Win=64256 Len=0 TSval=2168222239 TSecr=2862793169"
"177","14.284104303","1320","4e:56:5b:5c:5d:7f","0e:fd:53:11:5f:2a","172.20.0.3","172.20.0.2","TLSv1.2","Client Hello"
"178","14.284111084","66","0e:fd:53:11:5f:2a","4e:56:5b:5c:5d:7f","172.20.0.2","172.20.0.3","TCP","4433 → 53758 [ACK] Seq=1 Ack=1255 Win=64128 Len=0 TSval=2862793169 TSecr=2168222239"
"179","14.284750832","1504","0e:fd:53:11:5f:2a","4e:56:5b:5c:5d:7f","172.20.0.2","172.20.0.3","TLSv1.3","Server Hello, Change Cipher Spec, Application Data, Application Data, Application Data, Application Data"
"180","14.284783646","66","4e:56:5b:5c:5d:7f","0e:fd:53:11:5f:2a","172.20.0.3","172.20.0.2","TCP","53758 → 4433 [ACK] Seq=1255 Ack=1439 Win=64128 Len=0 TSval=2168222240 TSecr=2862793170"
"181","14.285828238","146","4e:56:5b:5c:5d:7f","0e:fd:53:11:5f:2a","172.20.0.3","172.20.0.2","TLSv1.3","Change Cipher Spec, Application Data"
"182","14.285888877","66","4e:56:5b:5c:5d:7f","0e:fd:53:11:5f:2a","172.20.0.3","172.20.0.2","TCP","53758 → 4433 [RST, ACK] Seq=1335 Ack=1439 Win=64128 Len=0 TSval=2168222241 TSecr=2862793170"
"183","14.296905331","74","4e:56:5b:5c:5d:7f","0e:fd:53:11:5f:2a","172.20.0.3","172.20.0.2","TCP","53766 → 4433 [SYN] Seq=0 Win=64240 Len=0 MSS=1460 SACK_PERM TSval=2168222252 TSecr=0 WS=128"
"184","14.296934336","74","0e:fd:53:11:5f:2a","4e:56:5b:5c:5d:7f","172.20.0.2","172.20.0.3","TCP","4433 → 53766 [SYN, ACK] Seq=0 Ack=1 Win=65160 Len=0 MSS=1460 SACK_PERM TSval=2862793182 TSecr=2168222252 WS=128"
"185","14.296954748","66","4e:56:5b:5c:5d:7f","0e:fd:53:11:5f:2a","172.20.0.3","172.20.0.2","TCP","53766 → 4433 [ACK] Seq=1 Ack=1 Win=64256 Len=0 TSval=2168222252 TSecr=2862793182"
"186","14.296998448","1320","4e:56:5b:5c:5d:7f","0e:fd:53:11:5f:2a","172.20.0.3","172.20.0.2","TLSv1.2","Client Hello"
"187","14.297556683","1504","0e:fd:53:11:5f:2a","4e:56:5b:5c:5d:7f","172.20.0.2","172.20.0.3","TLSv1.3","Server Hello, Change Cipher Spec, Application Data, Application Data, Application Data, Application Data"
"188","14.297601378","66","4e:56:5b:5c:5d:7f","0e:fd:53:11:5f:2a","172.20.0.3","172.20.0.2","TCP","53766 → 4433 [ACK] Seq=1255 Ack=1439 Win=64128 Len=0 TSval=2168222253 TSecr=2862793182"
"189","14.298675739","146","4e:56:5b:5c:5d:7f","0e:fd:53:11:5f:2a","172.20.0.3","172.20.0.2","TLSv1.3","Change Cipher Spec, Application Data"
"190","14.298730726","66","4e:56:5b:5c:5d:7f","0e:fd:53:11:5f:2a","172.20.0.3","172.20.0.2","TCP","53766 → 4433 [RST, ACK] Seq=1335 Ack=1439 Win=64128 Len=0 TSval=2168222254 TSecr=2862793182"
"191","14.309323381","74","4e:56:5b:5c:5d:7f","0e:fd:53:11:5f:2a","172.20.0.3","172.20.0.2","TCP","53774 → 4433 [SYN] Seq=0 Win=64240 Len=0 MSS=1460 SACK_PERM TSval=2168222264 TSecr=0 WS=128"
"192","14.309353728","74","0e:fd:53:11:5f:2a","4e:56:5b:5c:5d:7f","172.20.0.2","172.20.0.3","TCP","4433 → 53774 [SYN, ACK] Seq=0 Ack=1 Win=65160 Len=0 MSS=1460 SACK_PERM TSval=2862793194 TSecr=2168222264 WS=128"
"193","14.309374326","66","4e:56:5b:5c:5d:7f","0e:fd:53:11:5f:2a","172.20.0.3","172.20.0.2","TCP","53774 → 4433 [ACK] Seq=1 Ack=1 Win=64256 Len=0 TSval=2168222264 TSecr=2862793194"
"194","14.309416835","1320","4e:56:5b:5c:5d:7f","0e:fd:53:11:5f:2a","172.20.0.3","172.20.0.2","TLSv1.2","Client Hello"
"195","14.309423381","66","0e:fd:53:11:5f:2a","4e:56:5b:5c:5d:7f","172.20.0.2","172.20.0.3","TCP","4433 → 53774 [ACK] Seq=1 Ack=1255 Win=64128 Len=0 TSval=2862793194 TSecr=2168222264"
"196","14.310011462","1504","0e:fd:53:11:5f:2a","4e:56:5b:5c:5d:7f","172.20.0.2","172.20.0.3","TLSv1.3","Server Hello, Change Cipher Spec, Application Data, Application Data, Application Data, Application Data"
"197","14.310042828","66","4e:56:5b:5c:5d:7f","0e:fd:53:11:5f:2a","172.20.0.3","172.20.0.2","TCP","53774 → 4433 [ACK] Seq=1255 Ack=1439 Win=64128 Len=0 TSval=2168222265 TSecr=2862793195"
"198","14.311077140","146","4e:56:5b:5c:5d:7f","0e:fd:53:11:5f:2a","172.20.0.3","172.20.0.2","TLSv1.3","Change Cipher Spec, Application Data"
"199","14.311131768","66","4e:56:5b:5c:5d:7f","0e:fd:53:11:5f:2a","172.20.0.3","172.20.0.2","TCP","53774 → 4433 [RST, ACK] Seq=1335 Ack=1439 Win=64128 Len=0 TSval=2168222266 TSecr=2862793195"
"200","14.322469664","74","4e:56:5b:5c:5d:7f","0e:fd:53:11:5f:2a","172.20.0.3","172.20.0.2","TCP","53788 → 4433 [SYN] Seq=0 Win=64240 Len=0 MSS=1460 SACK_PERM TSval=2168222277 TSecr=0 WS=128"
"201","15.369703595","74","4e:56:5b:5c:5d:7f","0e:fd:53:11:5f:2a","172.20.0.3","172.20.0.2","TCP","[TCP Retransmission] 53788 → 4433 [SYN] Seq=0 Win=64240 Len=0 MSS=1460 SACK_PERM TSval=2168223325 TSecr=0 WS=128"
"202","15.695660639","239","2a:f3:d5:ae:2e:a2","33:33:00:00:00:fb",,,"MDNS","Standard query 0x0000 PTR _ipps._tcp.local, ""QM"" question PTR _ftp._tcp.local, ""QM"" question PTR _webdav._tcp.local, ""QM"" question PTR _webdavs._tcp.local, ""QM"" question PTR _sftp-ssh._tcp.local, ""QM"" question PTR _smb._tcp.local, ""QM"" question PTR _afpovertcp._tcp.local, ""QM"" question PTR _nfs._tcp.local, ""QM"" question PTR _ipp._tcp.local, ""QM"" question PTR MONTE-VIRTUAL-MACHINE._smb._tcp.local"
"203","16.393648410","74","4e:56:5b:5c:5d:7f","0e:fd:53:11:5f:2a","172.20.0.3","172.20.0.2","TCP","[TCP Retransmission] 53788 → 4433 [SYN] Seq=0 Win=64240 Len=0 MSS=1460 SACK_PERM TSval=2168224349 TSecr=0 WS=128"
"204","16.393683599","74","0e:fd:53:11:5f:2a","4e:56:5b:5c:5d:7f","172.20.0.2","172.20.0.3","TCP","4433 → 53788 [SYN, ACK] Seq=0 Ack=1 Win=65160 Len=0 MSS=1460 SACK_PERM TSval=2862795279 TSecr=2168222277 WS=128"
"205","16.393735134","66","4e:56:5b:5c:5d:7f","0e:fd:53:11:5f:2a","172.20.0.3","172.20.0.2","TCP","53788 → 4433 [ACK] Seq=1 Ack=1 Win=64256 Len=0 TSval=2168224349 TSecr=2862795279"
"206","16.393833223","1320","4e:56:5b:5c:5d:7f","0e:fd:53:11:5f:2a","172.20.0.3","172.20.0.2","TLSv1.2","Client Hello"
"207","16.393848227","66","0e:fd:53:11:5f:2a","4e:56:5b:5c:5d:7f","172.20.0.2","172.20.0.3","TCP","4433 → 53788 [ACK] Seq=1 Ack=1255 Win=64128 Len=0 TSval=2862795279 TSecr=2168224349"
"208","16.394506556","1504","0e:fd:53:11:5f:2a","4e:56:5b:5c:5d:7f","172.20.0.2","172.20.0.3","TLSv1.3","Server Hello, Change Cipher Spec, Application Data, Application Data, Application Data, Application Data"
"209","16.394535942","66","4e:56:5b:5c:5d:7f","0e:fd:53:11:5f:2a","172.20.0.3","172.20.0.2","TCP","53788 → 4433 [ACK] Seq=1255 Ack=1439 Win=64128 Len=0 TSval=2168224349 TSecr=2862795279"
"210","16.395761326","146","4e:56:5b:5c:5d:7f","0e:fd:53:11:5f:2a","172.20.0.3","172.20.0.2","TLSv1.3","Change Cipher Spec, Application Data"
"211","16.395825072","66","4e:56:5b:5c:5d:7f","0e:fd:53:11:5f:2a","172.20.0.3","172.20.0.2","TCP","53788 → 4433 [RST, ACK] Seq=1335 Ack=1439 Win=64128 Len=0 TSval=2168224351 TSecr=2862795279"
"212","16.407079680","74","4e:56:5b:5c:5d:7f","0e:fd:53:11:5f:2a","172.20.0.3","172.20.0.2","TCP","53792 → 4433 [SYN] Seq=0 Win=64240 Len=0 MSS=1460 SACK_PERM TSval=2168224362 TSecr=0 WS=128"
"213","16.407102527","74","0e:fd:53:11:5f:2a","4e:56:5b:5c:5d:7f","172.20.0.2","172.20.0.3","TCP","4433 → 53792 [SYN, ACK] Seq=0 Ack=1 Win=65160 Len=0 MSS=1460 SACK_PERM TSval=2862795292 TSecr=2168224362 WS=128"
"214","16.407119452","66","4e:56:5b:5c:5d:7f","0e:fd:53:11:5f:2a","172.20.0.3","172.20.0.2","TCP","53792 → 4433 [ACK] Seq=1 Ack=1 Win=64256 Len=0 TSval=2168224362 TSecr=2862795292"
"215","16.407159048","1320","4e:56:5b:5c:5d:7f","0e:fd:53:11:5f:2a","172.20.0.3","172.20.0.2","TLSv1.2","Client Hello"
"216","16.407765896","1504","0e:fd:53:11:5f:2a","4e:56:5b:5c:5d:7f","172.20.0.2","172.20.0.3","TLSv1.3","Server Hello, Change Cipher Spec, Application Data, Application Data, Application Data, Application Data"
"217","16.407798923","66","4e:56:5b:5c:5d:7f","0e:fd:53:11:5f:2a","172.20.0.3","172.20.0.2","TCP","53792 → 4433 [ACK] Seq=1255 Ack=1439 Win=64128 Len=0 TSval=2168224363 TSecr=2862795293"
"218","16.408806547","146","4e:56:5b:5c:5d:7f","0e:fd:53:11:5f:2a","172.20.0.3","172.20.0.2","TLSv1.3","Change Cipher Spec, Application Data"
"219","16.408856985","66","4e:56:5b:5c:5d:7f","0e:fd:53:11:5f:2a","172.20.0.3","172.20.0.2","TCP","53792 → 4433 [RST, ACK] Seq=1335 Ack=1439 Win=64128 Len=0 TSval=2168224364 TSecr=2862795293"
"220","16.419256687","74","4e:56:5b:5c:5d:7f","0e:fd:53:11:5f:2a","172.20.0.3","172.20.0.2","TCP","53798 → 4433 [SYN] Seq=0 Win=64240 Len=0 MSS=1460 SACK_PERM TSval=2168224374 TSecr=0 WS=128"
"221","16.419284431","74","0e:fd:53:11:5f:2a","4e:56:5b:5c:5d:7f","172.20.0.2","172.20.0.3","TCP","4433 → 53798 [SYN, ACK] Seq=0 Ack=1 Win=65160 Len=0 MSS=1460 SACK_PERM TSval=2862795304 TSecr=2168224374 WS=128"
