frame.number,frame.time_relative,frame.len,eth.src,eth.dst,ip.src,ip.dst,_ws.col.protocol,_ws.col.info
"1","0.000000000","42","6a:9c:d9:3e:a0:6f","ff:ff:ff:ff:ff:ff",,,"ARP","ARP Announcement for 172.20.0.3"
"2","0.036474638","42","6a:9c:d9:3e:a0:6f","ff:ff:ff:ff:ff:ff",,,"ARP","Who has 172.20.0.2? Tell 172.20.0.3"
"3","0.036501449","42","b2:e0:01:5d:34:46","6a:9c:d9:3e:a0:6f",,,"ARP","172.20.0.2 is at b2:e0:01:5d:34:46"
"4","0.036507374","74","6a:9c:d9:3e:a0:6f","b2:e0:01:5d:34:46","172.20.0.3","172.20.0.2","TCP","45944 → 4433 [SYN] Seq=0 Win=64240 Len=0 MSS=1460 SACK_PERM TSval=2169756228 TSecr=0 WS=128"
"5","0.036527439","74","b2:e0:01:5d:34:46","6a:9c:d9:3e:a0:6f","172.20.0.2","172.20.0.3","TCP","4433 → 45944 [SYN, ACK] Seq=0 Ack=1 Win=65160 Len=0 MSS=1460 SACK_PERM TSval=2864327158 TSecr=2169756228 WS=128"
"6","0.036542983","66","6a:9c:d9:3e:a0:6f","b2:e0:01:5d:34:46","172.20.0.3","172.20.0.2","TCP","45944 → 4433 [ACK] Seq=1 Ack=1 Win=64256 Len=0 TSval=2169756228 TSecr=2864327158"
"7","0.036583580","629","6a:9c:d9:3e:a0:6f","b2:e0:01:5d:34:46","172.20.0.3","172.20.0.2","TLSv1.2","Client Hello"
"8","0.036588613","66","b2:e0:01:5d:34:46","6a:9c:d9:3e:a0:6f","172.20.0.2","172.20.0.3","TCP","4433 → 45944 [ACK] Seq=1 Ack=564 Win=64640 Len=0 TSval=2864327158 TSecr=2169756228"
"9","0.045424723","1110","b2:e0:01:5d:34:46","6a:9c:d9:3e:a0:6f","172.20.0.2","172.20.0.3","TLSv1.3","Server Hello, Change Cipher Spec, Application Data, Application Data, Application Data, Application Data"
"10","0.045477359","66","6a:9c:d9:3e:a0:6f","b2:e0:01:5d:34:46","172.20.0.3","172.20.0.2","TCP","45944 → 4433 [ACK] Seq=564 Ack=1045 Win=64128 Len=0 TSval=2169756237 TSecr=2864327167"
"11","0.052852805","146","6a:9c:d9:3e:a0:6f","b2:e0:01:5d:34:46","172.20.0.3","172.20.0.2","TLSv1.3","Change Cipher Spec, Application Data"
"12","0.052954637","66","6a:9c:d9:3e:a0:6f","b2:e0:01:5d:34:46","172.20.0.3","172.20.0.2","TCP","45944 → 4433 [RST, ACK] Seq=644 Ack=1045 Win=64128 Len=0 TSval=2169756245 TSecr=2864327167"
"13","0.066847696","74","6a:9c:d9:3e:a0:6f","b2:e0:01:5d:34:46","172.20.0.3","172.20.0.2","TCP","35800 → 4433 [SYN] Seq=0 Win=64240 Len=0 MSS=1460 SACK_PERM TSval=2169756258 TSecr=0 WS=128"
"14","0.066884237","74","b2:e0:01:5d:34:46","6a:9c:d9:3e:a0:6f","172.20.0.2","172.20.0.3","TCP","4433 → 35800 [SYN, ACK] Seq=0 Ack=1 Win=65160 Len=0 MSS=1460 SACK_PERM TSval=2864327188 TSecr=2169756258 WS=128"
"15","0.066919351","66","6a:9c:d9:3e:a0:6f","b2:e0:01:5d:34:46","172.20.0.3","172.20.0.2","TCP","35800 → 4433 [ACK] Seq=1 Ack=1 Win=64256 Len=0 TSval=2169756259 TSecr=2864327188"
"16","0.066961941","629","6a:9c:d9:3e:a0:6f","b2:e0:01:5d:34:46","172.20.0.3","172.20.0.2","TLSv1.2","Client Hello"
"17","0.075407231","1110","b2:e0:01:5d:34:46","6a:9c:d9:3e:a0:6f","172.20.0.2","172.20.0.3","TLSv1.3","Server Hello, Change Cipher Spec, Application Data, Application Data, Application Data, Application Data"
"18","0.075457386","66","6a:9c:d9:3e:a0:6f","b2:e0:01:5d:34:46","172.20.0.3","172.20.0.2","TCP","35800 → 4433 [ACK] Seq=564 Ack=1045 Win=64128 Len=0 TSval=2169756267 TSecr=2864327197"
"19","0.083215509","146","6a:9c:d9:3e:a0:6f","b2:e0:01:5d:34:46","172.20.0.3","172.20.0.2","TLSv1.3","Change Cipher Spec, Application Data"
"20","0.083293691","66","6a:9c:d9:3e:a0:6f","b2:e0:01:5d:34:46","172.20.0.3","172.20.0.2","TCP","35800 → 4433 [RST, ACK] Seq=644 Ack=1045 Win=64128 Len=0 TSval=2169756275 TSecr=2864327197"
"21","0.096956144","74","6a:9c:d9:3e:a0:6f","b2:e0:01:5d:34:46","172.20.0.3","172.20.0.2","TCP","35808 → 4433 [SYN] Seq=0 Win=64240 Len=0 MSS=1460 SACK_PERM TSval=2169756289 TSecr=0 WS=128"
"22","0.096980260","74","b2:e0:01:5d:34:46","6a:9c:d9:3e:a0:6f","172.20.0.2","172.20.0.3","TCP","4433 → 35808 [SYN, ACK] Seq=0 Ack=1 Win=65160 Len=0 MSS=1460 SACK_PERM TSval=2864327219 TSecr=2169756289 WS=128"
"23","0.096997552","66","6a:9c:d9:3e:a0:6f","b2:e0:01:5d:34:46","172.20.0.3","172.20.0.2","TCP","35808 → 4433 [ACK] Seq=1 Ack=1 Win=64256 Len=0 TSval=2169756289 TSecr=2864327219"
"24","0.097033968","629","6a:9c:d9:3e:a0:6f","b2:e0:01:5d:34:46","172.20.0.3","172.20.0.2","TLSv1.2","Client Hello"
"25","0.300938297","629","6a:9c:d9:3e:a0:6f","b2:e0:01:5d:34:46","172.20.0.3","172.20.0.2","TCP","[TCP Retransmission] 35808 → 4433 [PSH, ACK] Seq=1 Ack=1 Win=64256 Len=563 TSval=2169756493 TSecr=2864327219"
"26","0.300962985","78","b2:e0:01:5d:34:46","6a:9c:d9:3e:a0:6f","172.20.0.2","172.20.0.3","TCP","[TCP Previous segment not captured] 4433 → 35808 [ACK] Seq=1045 Ack=564 Win=64640 Len=0 TSval=2864327423 TSecr=2169756493 SLE=1 SRE=564"
"27","0.308911920","1110","b2:e0:01:5d:34:46","6a:9c:d9:3e:a0:6f","172.20.0.2","172.20.0.3","TCP","[TCP Retransmission] 4433 → 35808 [PSH, ACK] Seq=1 Ack=564 Win=64640 Len=1044 TSval=2864327431 TSecr=2169756493"
"28","0.308951969","66","6a:9c:d9:3e:a0:6f","b2:e0:01:5d:34:46","172.20.0.3","172.20.0.2","TCP","35808 → 4433 [ACK] Seq=564 Ack=1045 Win=64128 Len=0 TSval=2169756501 TSecr=2864327431"
"29","0.316426444","146","6a:9c:d9:3e:a0:6f","b2:e0:01:5d:34:46","172.20.0.3","172.20.0.2","TLSv1.2","Change Cipher Spec, Application Data"
"30","0.316449984","66","b2:e0:01:5d:34:46","6a:9c:d9:3e:a0:6f","172.20.0.2","172.20.0.3","TCP","4433 → 35808 [ACK] Seq=1045 Ack=644 Win=64640 Len=0 TSval=2864327438 TSecr=2169756508"
"31","0.316512294","66","6a:9c:d9:3e:a0:6f","b2:e0:01:5d:34:46","172.20.0.3","172.20.0.2","TCP","35808 → 4433 [RST, ACK] Seq=644 Ack=1045 Win=64128 Len=0 TSval=2169756508 TSecr=2864327438"
"32","0.329797278","74","6a:9c:d9:3e:a0:6f","b2:e0:01:5d:34:46","172.20.0.3","172.20.0.2","TCP","35816 → 4433 [SYN] Seq=0 Win=64240 Len=0 MSS=1460 SACK_PERM TSval=2169756521 TSecr=0 WS=128"
"33","0.329826309","74","b2:e0:01:5d:34:46","6a:9c:d9:3e:a0:6f","172.20.0.2","172.20.0.3","TCP","4433 → 35816 [SYN, ACK] Seq=0 Ack=1 Win=65160 Len=0 MSS=1460 SACK_PERM TSval=2864327451 TSecr=2169756521 WS=128"
"34","0.329843399","66","6a:9c:d9:3e:a0:6f","b2:e0:01:5d:34:46","172.20.0.3","172.20.0.2","TCP","35816 → 4433 [ACK] Seq=1 Ack=1 Win=64256 Len=0 TSval=2169756521 TSecr=2864327451"
"35","0.329883475","629","6a:9c:d9:3e:a0:6f","b2:e0:01:5d:34:46","172.20.0.3","172.20.0.2","TLSv1.2","Client Hello"
"36","0.329896703","66","b2:e0:01:5d:34:46","6a:9c:d9:3e:a0:6f","172.20.0.2","172.20.0.3","TCP","4433 → 35816 [ACK] Seq=1 Ack=564 Win=64640 Len=0 TSval=2864327451 TSecr=2169756521"
"37","0.338561118","1110","b2:e0:01:5d:34:46","6a:9c:d9:3e:a0:6f","172.20.0.2","172.20.0.3","TLSv1.3","Server Hello, Change Cipher Spec, Application Data, Application Data, Application Data, Application Data"
"38","0.338596101","66","6a:9c:d9:3e:a0:6f","b2:e0:01:5d:34:46","172.20.0.3","172.20.0.2","TCP","35816 → 4433 [ACK] Seq=564 Ack=1045 Win=64128 Len=0 TSval=2169756530 TSecr=2864327460"
"39","0.345715626","146","6a:9c:d9:3e:a0:6f","b2:e0:01:5d:34:46","172.20.0.3","172.20.0.2","TLSv1.3","Change Cipher Spec, Application Data"
"40","0.345780463","66","6a:9c:d9:3e:a0:6f","b2:e0:01:5d:34:46","172.20.0.3","172.20.0.2","TCP","35816 → 4433 [RST, ACK] Seq=644 Ack=1045 Win=64128 Len=0 TSval=2169756537 TSecr=2864327460"
"41","0.358818068","74","6a:9c:d9:3e:a0:6f","b2:e0:01:5d:34:46","172.20.0.3","172.20.0.2","TCP","35826 → 4433 [SYN] Seq=0 Win=64240 Len=0 MSS=1460 SACK_PERM TSval=2169756550 TSecr=0 WS=128"
"42","0.358843488","74","b2:e0:01:5d:34:46","6a:9c:d9:3e:a0:6f","172.20.0.2","172.20.0.3","TCP","4433 → 35826 [SYN, ACK] Seq=0 Ack=1 Win=65160 Len=0 MSS=1460 SACK_PERM TSval=2864327480 TSecr=2169756550 WS=128"
"43","0.358858663","66","6a:9c:d9:3e:a0:6f","b2:e0:01:5d:34:46","172.20.0.3","172.20.0.2","TCP","35826 → 4433 [ACK] Seq=1 Ack=1 Win=64256 Len=0 TSval=2169756550 TSecr=2864327480"
"44","0.358905381","629","6a:9c:d9:3e:a0:6f","b2:e0:01:5d:34:46","172.20.0.3","172.20.0.2","TLSv1.2","Client Hello"
"45","0.358912194","66","b2:e0:01:5d:34:46","6a:9c:d9:3e:a0:6f","172.20.0.2","172.20.0.3","TCP","4433 → 35826 [ACK] Seq=1 Ack=564 Win=64640 Len=0 TSval=2864327481 TSecr=2169756551"
"46","0.367845434","1109","b2:e0:01:5d:34:46","6a:9c:d9:3e:a0:6f","172.20.0.2","172.20.0.3","TLSv1.3","Server Hello, Change Cipher Spec, Application Data, Application Data, Application Data, Application Data"
"47","0.367874681","66","6a:9c:d9:3e:a0:6f","b2:e0:01:5d:34:46","172.20.0.3","172.20.0.2","TCP","35826 → 4433 [ACK] Seq=564 Ack=1044 Win=64128 Len=0 TSval=2169756559 TSecr=2864327489"
"48","0.375034555","146","6a:9c:d9:3e:a0:6f","b2:e0:01:5d:34:46","172.20.0.3","172.20.0.2","TLSv1.3","Change Cipher Spec, Application Data"
"49","0.375109822","66","6a:9c:d9:3e:a0:6f","b2:e0:01:5d:34:46","172.20.0.3","172.20.0.2","TCP","35826 → 4433 [RST, ACK] Seq=644 Ack=1044 Win=64128 Len=0 TSval=2169756567 TSecr=2864327489"
"50","0.389458398","74","6a:9c:d9:3e:a0:6f","b2:e0:01:5d:34:46","172.20.0.3","172.20.0.2","TCP","35842 → 4433 [SYN] Seq=0 Win=64240 Len=0 MSS=1460 SACK_PERM TSval=2169756581 TSecr=0 WS=128"
"51","1.001094533","42","6a:9c:d9:3e:a0:6f","ff:ff:ff:ff:ff:ff",,,"ARP","ARP Announcement for 172.20.0.3"
"52","1.404961683","74","6a:9c:d9:3e:a0:6f","b2:e0:01:5d:34:46","172.20.0.3","172.20.0.2","TCP","[TCP Retransmission] 35842 → 4433 [SYN] Seq=0 Win=64240 Len=0 MSS=1460 SACK_PERM TSval=2169757597 TSecr=0 WS=128"
"53","2.000426521","42","6a:9c:d9:3e:a0:6f","ff:ff:ff:ff:ff:ff",,,"ARP","ARP Announcement for 172.20.0.3"
"54","2.428946982","74","6a:9c:d9:3e:a0:6f","b2:e0:01:5d:34:46","172.20.0.3","172.20.0.2","TCP","[TCP Retransmission] 35842 → 4433 [SYN] Seq=0 Win=64240 Len=0 MSS=1460 SACK_PERM TSval=2169758621 TSecr=0 WS=128"
"55","2.428977409","74","b2:e0:01:5d:34:46","6a:9c:d9:3e:a0:6f","172.20.0.2","172.20.0.3","TCP","4433 → 35842 [SYN, ACK] Seq=0 Ack=1 Win=65160 Len=0 MSS=1460 SACK_PERM TSval=2864329551 TSecr=2169756581 WS=128"
"56","2.429010942","66","6a:9c:d9:3e:a0:6f","b2:e0:01:5d:34:46","172.20.0.3","172.20.0.2","TCP","35842 → 4433 [ACK] Seq=1 Ack=1 Win=64256 Len=0 TSval=2169758621 TSecr=2864329551"
"57","2.429079611","629","6a:9c:d9:3e:a0:6f","b2:e0:01:5d:34:46","172.20.0.3","172.20.0.2","TLSv1.2","Client Hello"
"58","2.429086642","66","b2:e0:01:5d:34:46","6a:9c:d9:3e:a0:6f","172.20.0.2","172.20.0.3","TCP","4433 → 35842 [ACK] Seq=1 Ack=564 Win=64640 Len=0 TSval=2864329551 TSecr=2169758621"
"59","2.437290169","1109","b2:e0:01:5d:34:46","6a:9c:d9:3e:a0:6f","172.20.0.2","172.20.0.3","TLSv1.3","Server Hello, Change Cipher Spec, Application Data, Application Data, Application Data, Application Data"
"60","2.437330329","66","6a:9c:d9:3e:a0:6f","b2:e0:01:5d:34:46","172.20.0.3","172.20.0.2","TCP","35842 → 4433 [ACK] Seq=564 Ack=1044 Win=64128 Len=0 TSval=2169758629 TSecr=2864329559"
"61","2.444853795","146","6a:9c:d9:3e:a0:6f","b2:e0:01:5d:34:46","172.20.0.3","172.20.0.2","TLSv1.3","Change Cipher Spec, Application Data"
"62","2.444947599","66","6a:9c:d9:3e:a0:6f","b2:e0:01:5d:34:46","172.20.0.3","172.20.0.2","TCP","35842 → 4433 [RST, ACK] Seq=644 Ack=1044 Win=64128 Len=0 TSval=2169758637 TSecr=2864329559"
"63","2.460689002","74","6a:9c:d9:3e:a0:6f","b2:e0:01:5d:34:46","172.20.0.3","172.20.0.2","TCP","35846 → 4433 [SYN] Seq=0 Win=64240 Len=0 MSS=1460 SACK_PERM TSval=2169758652 TSecr=0 WS=128"
"64","2.460717754","74","b2:e0:01:5d:34:46","6a:9c:d9:3e:a0:6f","172.20.0.2","172.20.0.3","TCP","4433 → 35846 [SYN, ACK] Seq=0 Ack=1 Win=65160 Len=0 MSS=1460 SACK_PERM TSval=2864329582 TSecr=2169758652 WS=128"
"65","2.460736399","66","6a:9c:d9:3e:a0:6f","b2:e0:01:5d:34:46","172.20.0.3","172.20.0.2","TCP","35846 → 4433 [ACK] Seq=1 Ack=1 Win=64256 Len=0 TSval=2169758652 TSecr=2864329582"
"66","2.460776666","629","6a:9c:d9:3e:a0:6f","b2:e0:01:5d:34:46","172.20.0.3","172.20.0.2","TLSv1.2","Client Hello"
"67","2.460783215","66","b2:e0:01:5d:34:46","6a:9c:d9:3e:a0:6f","172.20.0.2","172.20.0.3","TCP","4433 → 35846 [ACK] Seq=1 Ack=564 Win=64640 Len=0 TSval=2864329582 TSecr=2169758652"
"68","2.468976665","1109","b2:e0:01:5d:34:46","6a:9c:d9:3e:a0:6f","172.20.0.2","172.20.0.3","TLSv1.3","Server Hello, Change Cipher Spec, Application Data, Application Data, Application Data, Application Data"
"69","2.469026849","66","6a:9c:d9:3e:a0:6f","b2:e0:01:5d:34:46","172.20.0.3","172.20.0.2","TCP","35846 → 4433 [ACK] Seq=564 Ack=1044 Win=64128 Len=0 TSval=2169758661 TSecr=2864329591"
"70","2.476470447","146","6a:9c:d9:3e:a0:6f","b2:e0:01:5d:34:46","172.20.0.3","172.20.0.2","TLSv1.3","Change Cipher Spec, Application Data"
"71","2.476547728","66","6a:9c:d9:3e:a0:6f","b2:e0:01:5d:34:46","172.20.0.3","172.20.0.2","TCP","35846 → 4433 [RST, ACK] Seq=644 Ack=1044 Win=64128 Len=0 TSval=2169758668 TSecr=2864329591"
"72","2.495566550","74","6a:9c:d9:3e:a0:6f","b2:e0:01:5d:34:46","172.20.0.3","172.20.0.2","TCP","35848 → 4433 [SYN] Seq=0 Win=64240 Len=0 MSS=1460 SACK_PERM TSval=2169758687 TSecr=0 WS=128"
"73","2.495604979","74","b2:e0:01:5d:34:46","6a:9c:d9:3e:a0:6f","172.20.0.2","172.20.0.3","TCP","4433 → 35848 [SYN, ACK] Seq=0 Ack=1 Win=65160 Len=0 MSS=1460 SACK_PERM TSval=2864329617 TSecr=2169758687 WS=128"
"74","2.495629856","66","6a:9c:d9:3e:a0:6f","b2:e0:01:5d:34:46","172.20.0.3","172.20.0.2","TCP","35848 → 4433 [ACK] Seq=1 Ack=1 Win=64256 Len=0 TSval=2169758687 TSecr=2864329617"
"75","2.495688402","629","6a:9c:d9:3e:a0:6f","b2:e0:01:5d:34:46","172.20.0.3","172.20.0.2","TLSv1.2","Client Hello"
"76","2.495697481","66","b2:e0:01:5d:34:46","6a:9c:d9:3e:a0:6f","172.20.0.2","172.20.0.3","TCP","4433 → 35848 [ACK] Seq=1 Ack=564 Win=64640 Len=0 TSval=2864329617 TSecr=2169758687"
"77","2.503978961","1109","b2:e0:01:5d:34:46","6a:9c:d9:3e:a0:6f","172.20.0.2","172.20.0.3","TLSv1.3","Server Hello, Change Cipher Spec, Application Data, Application Data, Application Data, Application Data"
"78","2.504032759","66","6a:9c:d9:3e:a0:6f","b2:e0:01:5d:34:46","172.20.0.3","172.20.0.2","TCP","35848 → 4433 [ACK] Seq=564 Ack=1044 Win=64128 Len=0 TSval=2169758696 TSecr=2864329626"
"79","2.511569128","146","6a:9c:d9:3e:a0:6f","b2:e0:01:5d:34:46","172.20.0.3","172.20.0.2","TLSv1.3","Change Cipher Spec, Application Data"
"80","2.511646105","66","6a:9c:d9:3e:a0:6f","b2:e0:01:5d:34:46","172.20.0.3","172.20.0.2","TCP","35848 → 4433 [RST, ACK] Seq=644 Ack=1044 Win=64128 Len=0 TSval=2169758703 TSecr=2864329626"
"81","2.525555627","74","6a:9c:d9:3e:a0:6f","b2:e0:01:5d:34:46","172.20.0.3","172.20.0.2","TCP","35858 → 4433 [SYN] Seq=0 Win=64240 Len=0 MSS=1460 SACK_PERM TSval=2169758717 TSecr=0 WS=128"
"82","2.525583927","74","b2:e0:01:5d:34:46","6a:9c:d9:3e:a0:6f","172.20.0.2","172.20.0.3","TCP","4433 → 35858 [SYN, ACK] Seq=0 Ack=1 Win=65160 Len=0 MSS=1460 SACK_PERM TSval=2864329647 TSecr=2169758717 WS=128"
"83","2.525601776","66","6a:9c:d9:3e:a0:6f","b2:e0:01:5d:34:46","172.20.0.3","172.20.0.2","TCP","35858 → 4433 [ACK] Seq=1 Ack=1 Win=64256 Len=0 TSval=2169758717 TSecr=2864329647"
"84","2.525639221","629","6a:9c:d9:3e:a0:6f","b2:e0:01:5d:34:46","172.20.0.3","172.20.0.2","TLSv1.2","Client Hello"
"85","2.534036043","1110","b2:e0:01:5d:34:46","6a:9c:d9:3e:a0:6f","172.20.0.2","172.20.0.3","TLSv1.3","Server Hello, Change Cipher Spec, Application Data, Application Data, Application Data, Application Data"
"86","2.534078406","66","6a:9c:d9:3e:a0:6f","b2:e0:01:5d:34:46","172.20.0.3","172.20.0.2","TCP","35858 → 4433 [ACK] Seq=564 Ack=1045 Win=64128 Len=0 TSval=2169758726 TSecr=2864329656"
"87","2.541393411","146","6a:9c:d9:3e:a0:6f","b2:e0:01:5d:34:46","172.20.0.3","172.20.0.2","TLSv1.3","Change Cipher Spec, Application Data"
"88","2.541456494","66","6a:9c:d9:3e:a0:6f","b2:e0:01:5d:34:46","172.20.0.3","172.20.0.2","TCP","35858 → 4433 [RST, ACK] Seq=644 Ack=1045 Win=64128 Len=0 TSval=2169758733 TSecr=2864329656"
"89","2.554609824","74","6a:9c:d9:3e:a0:6f","b2:e0:01:5d:34:46","172.20.0.3","172.20.0.2","TCP","35874 → 4433 [SYN] Seq=0 Win=64240 Len=0 MSS=1460 SACK_PERM TSval=2169758746 TSecr=0 WS=128"
"90","2.554633163","74","b2:e0:01:5d:34:46","6a:9c:d9:3e:a0:6f","172.20.0.2","172.20.0.3","TCP","4433 → 35874 [SYN, ACK] Seq=0 Ack=1 Win=65160 Len=0 MSS=1460 SACK_PERM TSval=2864329676 TSecr=2169758746 WS=128"
"91","2.554647369","66","6a:9c:d9:3e:a0:6f","b2:e0:01:5d:34:46","172.20.0.3","172.20.0.2","TCP","35874 → 4433 [ACK] Seq=1 Ack=1 Win=64256 Len=0 TSval=2169758746 TSecr=2864329676"
"92","2.554683678","629","6a:9c:d9:3e:a0:6f","b2:e0:01:5d:34:46","172.20.0.3","172.20.0.2","TLSv1.2","Client Hello"
"93","2.554688829","66","b2:e0:01:5d:34:46","6a:9c:d9:3e:a0:6f","172.20.0.2","172.20.0.3","TCP","4433 → 35874 [ACK] Seq=1 Ack=564 Win=64640 Len=0 TSval=2864329676 TSecr=2169758746"
"94","2.972928669","1110","b2:e0:01:5d:34:46","6a:9c:d9:3e:a0:6f","172.20.0.2","172.20.0.3","TLSv1.3","Server Hello, Change Cipher Spec, Application Data, Application Data, Application Data, Application Data"
"95","2.972998952","66","6a:9c:d9:3e:a0:6f","b2:e0:01:5d:34:46","172.20.0.3","172.20.0.2","TCP","35874 → 4433 [ACK] Seq=564 Ack=1045 Win=64128 Len=0 TSval=2169759165 TSecr=2864330095"
"96","2.984256900","146","6a:9c:d9:3e:a0:6f","b2:e0:01:5d:34:46","172.20.0.3","172.20.0.2","TLSv1.3","Change Cipher Spec, Application Data"
"97","2.984379347","66","6a:9c:d9:3e:a0:6f","b2:e0:01:5d:34:46","172.20.0.3","172.20.0.2","TCP","35874 → 4433 [RST, ACK] Seq=644 Ack=1045 Win=64128 Len=0 TSval=2169759176 TSecr=2864330095"
"98","2.999736297","74","6a:9c:d9:3e:a0:6f","b2:e0:01:5d:34:46","172.20.0.3","172.20.0.2","TCP","35890 → 4433 [SYN] Seq=0 Win=64240 Len=0 MSS=1460 SACK_PERM TSval=2169759191 TSecr=0 WS=128"
"99","2.999767357","74","b2:e0:01:5d:34:46","6a:9c:d9:3e:a0:6f","172.20.0.2","172.20.0.3","TCP","4433 → 35890 [SYN, ACK] Seq=0 Ack=1 Win=65160 Len=0 MSS=1460 SACK_PERM TSval=2864330121 TSecr=2169759191 WS=128"
"100","2.999786942","66","6a:9c:d9:3e:a0:6f","b2:e0:01:5d:34:46","172.20.0.3","172.20.0.2","TCP","35890 → 4433 [ACK] Seq=1 Ack=1 Win=64256 Len=0 TSval=2169759191 TSecr=2864330121"
"101","2.999835554","629","6a:9c:d9:3e:a0:6f","b2:e0:01:5d:34:46","172.20.0.3","172.20.0.2","TLSv1.2","Client Hello"
"102","2.999840521","66","b2:e0:01:5d:34:46","6a:9c:d9:3e:a0:6f","172.20.0.2","172.20.0.3","TCP","4433 → 35890 [ACK] Seq=1 Ack=564 Win=64640 Len=0 TSval=2864330121 TSecr=2169759191"
"103","3.010455954","1109","b2:e0:01:5d:34:46","6a:9c:d9:3e:a0:6f","172.20.0.2","172.20.0.3","TLSv1.3","Server Hello, Change Cipher Spec, Application Data, Application Data, Application Data, Application Data"
"104","3.010510951","66","6a:9c:d9:3e:a0:6f","b2:e0:01:5d:34:46","172.20.0.3","172.20.0.2","TCP","35890 → 4433 [ACK] Seq=564 Ack=1044 Win=64128 Len=0 TSval=2169759202 TSecr=2864330132"
"105","3.018367036","146","6a:9c:d9:3e:a0:6f","b2:e0:01:5d:34:46","172.20.0.3","172.20.0.2","TLSv1.3","Change Cipher Spec, Application Data"
"106","3.018448667","66","6a:9c:d9:3e:a0:6f","b2:e0:01:5d:34:46","172.20.0.3","172.20.0.2","TCP","35890 → 4433 [RST, ACK] Seq=644 Ack=1044 Win=64128 Len=0 TSval=2169759210 TSecr=2864330132"
"107","3.032558564","74","6a:9c:d9:3e:a0:6f","b2:e0:01:5d:34:46","172.20.0.3","172.20.0.2","TCP","35896 → 4433 [SYN] Seq=0 Win=64240 Len=0 MSS=1460 SACK_PERM TSval=2169759224 TSecr=0 WS=128"
"108","3.032588777","74","b2:e0:01:5d:34:46","6a:9c:d9:3e:a0:6f","172.20.0.2","172.20.0.3","TCP","4433 → 35896 [SYN, ACK] Seq=0 Ack=1 Win=65160 Len=0 MSS=1460 SACK_PERM TSval=2864330154 TSecr=2169759224 WS=128"
"109","3.032608686","66","6a:9c:d9:3e:a0:6f","b2:e0:01:5d:34:46","172.20.0.3","172.20.0.2","TCP","35896 → 4433 [ACK] Seq=1 Ack=1 Win=64256 Len=0 TSval=2169759224 TSecr=2864330154"
"110","3.032653759","629","6a:9c:d9:3e:a0:6f","b2:e0:01:5d:34:46","172.20.0.3","172.20.0.2","TLSv1.2","Client Hello"
"111","3.032659795","66","b2:e0:01:5d:34:46","6a:9c:d9:3e:a0:6f","172.20.0.2","172.20.0.3","TCP","4433 → 35896 [ACK] Seq=1 Ack=564 Win=64640 Len=0 TSval=2864330154 TSecr=2169759224"
"112","3.452934746","1110","b2:e0:01:5d:34:46","6a:9c:d9:3e:a0:6f","172.20.0.2","172.20.0.3","TLSv1.3","Server Hello, Change Cipher Spec, Application Data, Application Data, Application Data, Application Data"
"113","3.452998017","66","6a:9c:d9:3e:a0:6f","b2:e0:01:5d:34:46","172.20.0.3","172.20.0.2","TCP","35896 → 4433 [ACK] Seq=564 Ack=1045 Win=64128 Len=0 TSval=2169759645 TSecr=2864330575"
"114","3.460992413","146","6a:9c:d9:3e:a0:6f","b2:e0:01:5d:34:46","172.20.0.3","172.20.0.2","TLSv1.3","Change Cipher Spec, Application Data"
"115","3.461088017","66","6a:9c:d9:3e:a0:6f","b2:e0:01:5d:34:46","172.20.0.3","172.20.0.2","TCP","35896 → 4433 [RST, ACK] Seq=644 Ack=1045 Win=64128 Len=0 TSval=2169759653 TSecr=2864330575"
"116","3.476160531","74","6a:9c:d9:3e:a0:6f","b2:e0:01:5d:34:46","172.20.0.3","172.20.0.2","TCP","35908 → 4433 [SYN] Seq=0 Win=64240 Len=0 MSS=1460 SACK_PERM TSval=2169759668 TSecr=0 WS=128"
"117","3.476188674","74","b2:e0:01:5d:34:46","6a:9c:d9:3e:a0:6f","172.20.0.2","172.20.0.3","TCP","4433 → 35908 [SYN, ACK] Seq=0 Ack=1 Win=65160 Len=0 MSS=1460 SACK_PERM TSval=2864330598 TSecr=2169759668 WS=128"
"118","3.476208489","66","6a:9c:d9:3e:a0:6f","b2:e0:01:5d:34:46","172.20.0.3","172.20.0.2","TCP","35908 → 4433 [ACK] Seq=1 Ack=1 Win=64256 Len=0 TSval=2169759668 TSecr=2864330598"
"119","3.476248382","629","6a:9c:d9:3e:a0:6f","b2:e0:01:5d:34:46","172.20.0.3","172.20.0.2","TLSv1.2","Client Hello"
"120","3.484493306","1110","b2:e0:01:5d:34:46","6a:9c:d9:3e:a0:6f","172.20.0.2","172.20.0.3","TLSv1.3","Server Hello, Change Cipher Spec, Application Data, Application Data, Application Data, Application Data"
"121","3.484529289","66","6a:9c:d9:3e:a0:6f","b2:e0:01:5d:34:46","172.20.0.3","172.20.0.2","TCP","35908 → 4433 [ACK] Seq=564 Ack=1045 Win=64128 Len=0 TSval=2169759676 TSecr=2864330606"
"122","3.491692339","146","6a:9c:d9:3e:a0:6f","b2:e0:01:5d:34:46","172.20.0.3","172.20.0.2","TLSv1.3","Change Cipher Spec, Application Data"
"123","3.491750977","66","6a:9c:d9:3e:a0:6f","b2:e0:01:5d:34:46","172.20.0.3","172.20.0.2","TCP","35908 → 4433 [RST, ACK] Seq=644 Ack=1045 Win=64128 Len=0 TSval=2169759683 TSecr=2864330606"
"124","3.505324411","74","6a:9c:d9:3e:a0:6f","b2:e0:01:5d:34:46","172.20.0.3","172.20.0.2","TCP","35920 → 4433 [SYN] Seq=0 Win=64240 Len=0 MSS=1460 SACK_PERM TSval=2169759697 TSecr=0 WS=128"
"125","3.505349673","74","b2:e0:01:5d:34:46","6a:9c:d9:3e:a0:6f","172.20.0.2","172.20.0.3","TCP","4433 → 35920 [SYN, ACK] Seq=0 Ack=1 Win=65160 Len=0 MSS=1460 SACK_PERM TSval=2864330627 TSecr=2169759697 WS=128"
"126","3.505365615","66","6a:9c:d9:3e:a0:6f","b2:e0:01:5d:34:46","172.20.0.3","172.20.0.2","TCP","35920 → 4433 [ACK] Seq=1 Ack=1 Win=64256 Len=0 TSval=2169759697 TSecr=2864330627"
"127","3.505407655","629","6a:9c:d9:3e:a0:6f","b2:e0:01:5d:34:46","172.20.0.3","172.20.0.2","TLSv1.2","Client Hello"
"128","3.505422647","66","b2:e0:01:5d:34:46","6a:9c:d9:3e:a0:6f","172.20.0.2","172.20.0.3","TCP","4433 → 35920 [ACK] Seq=1 Ack=564 Win=64640 Len=0 TSval=2864330627 TSecr=2169759697"
"129","3.513667968","1110","b2:e0:01:5d:34:46","6a:9c:d9:3e:a0:6f","172.20.0.2","172.20.0.3","TLSv1.3","Server Hello, Change Cipher Spec, Application Data, Application Data, Application Data, Application Data"
"130","3.513695584","66","6a:9c:d9:3e:a0:6f","b2:e0:01:5d:34:46","172.20.0.3","172.20.0.2","TCP","35920 → 4433 [ACK] Seq=564 Ack=1045 Win=64128 Len=0 TSval=2169759705 TSecr=2864330635"
"131","3.521334581","146","6a:9c:d9:3e:a0:6f","b2:e0:01:5d:34:46","172.20.0.3","172.20.0.2","TLSv1.3","Change Cipher Spec, Application Data"
"132","3.521410009","66","6a:9c:d9:3e:a0:6f","b2:e0:01:5d:34:46","172.20.0.3","172.20.0.2","TCP","35920 → 4433 [RST, ACK] Seq=644 Ack=1045 Win=64128 Len=0 TSval=2169759713 TSecr=2864330635"
"133","3.534831533","74","6a:9c:d9:3e:a0:6f","b2:e0:01:5d:34:46","172.20.0.3","172.20.0.2","TCP","35934 → 4433 [SYN] Seq=0 Win=64240 Len=0 MSS=1460 SACK_PERM TSval=2169759726 TSecr=0 WS=128"
"134","3.534858954","74","b2:e0:01:5d:34:46","6a:9c:d9:3e:a0:6f","172.20.0.2","172.20.0.3","TCP","4433 → 35934 [SYN, ACK] Seq=0 Ack=1 Win=65160 Len=0 MSS=1460 SACK_PERM TSval=2864330656 TSecr=2169759726 WS=128"
"135","3.534881459","66","6a:9c:d9:3e:a0:6f","b2:e0:01:5d:34:46","172.20.0.3","172.20.0.2","TCP","35934 → 4433 [ACK] Seq=1 Ack=1 Win=64256 Len=0 TSval=2169759726 TSecr=2864330656"
"136","3.534926317","629","6a:9c:d9:3e:a0:6f","b2:e0:01:5d:34:46","172.20.0.3","172.20.0.2","TLSv1.2","Client Hello"
"137","3.543211775","1110","b2:e0:01:5d:34:46","6a:9c:d9:3e:a0:6f","172.20.0.2","172.20.0.3","TLSv1.3","Server Hello, Change Cipher Spec, Application Data, Application Data, Application Data, Application Data"
"138","3.543250830","66","6a:9c:d9:3e:a0:6f","b2:e0:01:5d:34:46","172.20.0.3","172.20.0.2","TCP","35934 → 4433 [ACK] Seq=564 Ack=1045 Win=64128 Len=0 TSval=2169759735 TSecr=2864330665"
"139","3.551193352","146","6a:9c:d9:3e:a0:6f","b2:e0:01:5d:34:46","172.20.0.3","172.20.0.2","TLSv1.3","Change Cipher Spec, Application Data"
"140","3.551278916","66","6a:9c:d9:3e:a0:6f","b2:e0:01:5d:34:46","172.20.0.3","172.20.0.2","TCP","35934 → 4433 [RST, ACK] Seq=644 Ack=1045 Win=64128 Len=0 TSval=2169759743 TSecr=2864330665"
"141","3.564515372","74","6a:9c:d9:3e:a0:6f","b2:e0:01:5d:34:46","172.20.0.3","172.20.0.2","TCP","35946 → 4433 [SYN] Seq=0 Win=64240 Len=0 MSS=1460 SACK_PERM TSval=2169759756 TSecr=0 WS=128"
"142","3.564538874","74","b2:e0:01:5d:34:46","6a:9c:d9:3e:a0:6f","172.20.0.2","172.20.0.3","TCP","4433 → 35946 [SYN, ACK] Seq=0 Ack=1 Win=65160 Len=0 MSS=1460 SACK_PERM TSval=2864330686 TSecr=2169759756 WS=128"
"143","3.564556140","66","6a:9c:d9:3e:a0:6f","b2:e0:01:5d:34:46","172.20.0.3","172.20.0.2","TCP","35946 → 4433 [ACK] Seq=1 Ack=1 Win=64256 Len=0 TSval=2169759756 TSecr=2864330686"
"144","3.564590383","629","6a:9c:d9:3e:a0:6f","b2:e0:01:5d:34:46","172.20.0.3","172.20.0.2","TLSv1.2","Client Hello"
"145","3.564595067","66","b2:e0:01:5d:34:46","6a:9c:d9:3e:a0:6f","172.20.0.2","172.20.0.3","TCP","4433 → 35946 [ACK] Seq=1 Ack=564 Win=64640 Len=0 TSval=2864330686 TSecr=2169759756"
"146","3.572665885","1110","b2:e0:01:5d:34:46","6a:9c:d9:3e:a0:6f","172.20.0.2","172.20.0.3","TLSv1.3","Server Hello, Change Cipher Spec, Application Data, Application Data, Application Data, Application Data"
"147","3.572700362","66","6a:9c:d9:3e:a0:6f","b2:e0:01:5d:34:46","172.20.0.3","172.20.0.2","TCP","35946 → 4433 [ACK] Seq=564 Ack=1045 Win=64128 Len=0 TSval=2169759764 TSecr=2864330694"
"148","3.580009172","146","6a:9c:d9:3e:a0:6f","b2:e0:01:5d:34:46","172.20.0.3","172.20.0.2","TLSv1.3","Change Cipher Spec, Application Data"
"149","3.580071498","66","6a:9c:d9:3e:a0:6f","b2:e0:01:5d:34:46","172.20.0.3","172.20.0.2","TCP","35946 → 4433 [RST, ACK] Seq=644 Ack=1045 Win=64128 Len=0 TSval=2169759772 TSecr=2864330694"
"150","3.593234380","74","6a:9c:d9:3e:a0:6f","b2:e0:01:5d:34:46","172.20.0.3","172.20.0.2","TCP","35952 → 4433 [SYN] Seq=0 Win=64240 Len=0 MSS=1460 SACK_PERM TSval=2169759785 TSecr=0 WS=128"
"151","4.604953535","74","b2:e0:01:5d:34:46","6a:9c:d9:3e:a0:6f","172.20.0.2","172.20.0.3","TCP","4433 → 35952 [SYN, ACK] Seq=0 Ack=1 Win=65160 Len=0 MSS=1460 SACK_PERM TSval=2864331727 TSecr=2169759785 WS=128"
"152","4.604979385","74","6a:9c:d9:3e:a0:6f","b2:e0:01:5d:34:46","172.20.0.3","172.20.0.2","TCP","[TCP Retransmission] 35952 → 4433 [SYN] Seq=0 Win=64240 Len=0 MSS=1460 SACK_PERM TSval=2169760797 TSecr=0 WS=128"
"153","4.604994868","74","b2:e0:01:5d:34:46","6a:9c:d9:3e:a0:6f","172.20.0.2","172.20.0.3","TCP","[TCP Retransmission] 4433 → 35952 [SYN, ACK] Seq=0 Ack=1 Win=65160 Len=0 MSS=1460 SACK_PERM TSval=2864331727 TSecr=2169759785 WS=128"
"154","4.605028965","66","6a:9c:d9:3e:a0:6f","b2:e0:01:5d:34:46","172.20.0.3","172.20.0.2","TCP","35952 → 4433 [ACK] Seq=1 Ack=1 Win=64256 Len=0 TSval=2169760797 TSecr=2864331727"
"155","4.605058346","66","6a:9c:d9:3e:a0:6f","b2:e0:01:5d:34:46","172.20.0.3","172.20.0.2","TCP","[TCP Dup ACK 154#1] 35952 → 4433 [ACK] Seq=1 Ack=1 Win=64256 Len=0 TSval=2169760797 TSecr=2864331727"
"156","4.605109918","629","6a:9c:d9:3e:a0:6f","b2:e0:01:5d:34:46","172.20.0.3","172.20.0.2","TLSv1.2","Client Hello"
"157","5.028925329","1110","b2:e0:01:5d:34:46","6a:9c:d9:3e:a0:6f","172.20.0.2","172.20.0.3","TLSv1.3","Server Hello, Change Cipher Spec, Application Data, Application Data, Application Data, Application Data"
"158","5.028991339","66","6a:9c:d9:3e:a0:6f","b2:e0:01:5d:34:46","172.20.0.3","172.20.0.2","TCP","35952 → 4433 [ACK] Seq=564 Ack=1045 Win=64128 Len=0 TSval=2169761221 TSecr=2864332151"
"159","5.036492552","146","6a:9c:d9:3e:a0:6f","b2:e0:01:5d:34:46","172.20.0.3","172.20.0.2","TLSv1.3","Change Cipher Spec, Application Data"
"160","5.036567064","66","6a:9c:d9:3e:a0:6f","b2:e0:01:5d:34:46","172.20.0.3","172.20.0.2","TCP","35952 → 4433 [RST, ACK] Seq=644 Ack=1045 Win=64128 Len=0 TSval=2169761228 TSecr=2864332151"
"161","5.049803780","74","6a:9c:d9:3e:a0:6f","b2:e0:01:5d:34:46","172.20.0.3","172.20.0.2","TCP","35966 → 4433 [SYN] Seq=0 Win=64240 Len=0 MSS=1460 SACK_PERM TSval=2169761241 TSecr=0 WS=128"
"162","5.049827664","74","b2:e0:01:5d:34:46","6a:9c:d9:3e:a0:6f","172.20.0.2","172.20.0.3","TCP","4433 → 35966 [SYN, ACK] Seq=0 Ack=1 Win=65160 Len=0 MSS=1460 SACK_PERM TSval=2864332171 TSecr=2169761241 WS=128"
"163","5.049844544","66","6a:9c:d9:3e:a0:6f","b2:e0:01:5d:34:46","172.20.0.3","172.20.0.2","TCP","35966 → 4433 [ACK] Seq=1 Ack=1 Win=64256 Len=0 TSval=2169761241 TSecr=2864332171"
"164","5.049886311","629","6a:9c:d9:3e:a0:6f","b2:e0:01:5d:34:46","172.20.0.3","172.20.0.2","TLSv1.2","Client Hello"
"165","5.049899914","66","b2:e0:01:5d:34:46","6a:9c:d9:3e:a0:6f","172.20.0.2","172.20.0.3","TCP","4433 → 35966 [ACK] Seq=1 Ack=564 Win=64640 Len=0 TSval=2864332172 TSecr=2169761241"
"166","5.260921643","1109","b2:e0:01:5d:34:46","6a:9c:d9:3e:a0:6f","172.20.0.2","172.20.0.3","TLSv1.3","Server Hello, Change Cipher Spec, Application Data, Application Data, Application Data, Application Data"
"167","5.260982515","66","6a:9c:d9:3e:a0:6f","b2:e0:01:5d:34:46","172.20.0.3","172.20.0.2","TCP","35966 → 4433 [ACK] Seq=564 Ack=1044 Win=64128 Len=0 TSval=2169761453 TSecr=2864332383"
"168","5.268636003","146","6a:9c:d9:3e:a0:6f","b2:e0:01:5d:34:46","172.20.0.3","172.20.0.2","TLSv1.3","Change Cipher Spec, Application Data"
"169","5.268716550","66","6a:9c:d9:3e:a0:6f","b2:e0:01:5d:34:46","172.20.0.3","172.20.0.2","TCP","35966 → 4433 [RST, ACK] Seq=644 Ack=1044 Win=64128 Len=0 TSval=2169761460 TSecr=2864332383"
"170","5.282252033","74","6a:9c:d9:3e:a0:6f","b2:e0:01:5d:34:46","172.20.0.3","172.20.0.2","TCP","35974 → 4433 [SYN] Seq=0 Win=64240 Len=0 MSS=1460 SACK_PERM TSval=2169761474 TSecr=0 WS=128"
"171","5.282279199","74","b2:e0:01:5d:34:46","6a:9c:d9:3e:a0:6f","172.20.0.2","172.20.0.3","TCP","4433 → 35974 [SYN, ACK] Seq=0 Ack=1 Win=65160 Len=0 MSS=1460 SACK_PERM TSval=2864332404 TSecr=2169761474 WS=128"
"172","5.282298168","66","6a:9c:d9:3e:a0:6f","b2:e0:01:5d:34:46","172.20.0.3","172.20.0.2","TCP","35974 → 4433 [ACK] Seq=1 Ack=1 Win=64256 Len=0 TSval=2169761474 TSecr=2864332404"
"173","5.282340349","629","6a:9c:d9:3e:a0:6f","b2:e0:01:5d:34:46","172.20.0.3","172.20.0.2","TLSv1.2","Client Hello"
"174","5.282345380","66","b2:e0:01:5d:34:46","6a:9c:d9:3e:a0:6f","172.20.0.2","172.20.0.3","TCP","4433 → 35974 [ACK] Seq=1 Ack=564 Win=64640 Len=0 TSval=2864332404 TSecr=2169761474"
"175","5.290394981","1110","b2:e0:01:5d:34:46","6a:9c:d9:3e:a0:6f","172.20.0.2","172.20.0.3","TLSv1.3","Server Hello, Change Cipher Spec, Application Data, Application Data, Application Data, Application Data"
"176","5.290441752","66","6a:9c:d9:3e:a0:6f","b2:e0:01:5d:34:46","172.20.0.3","172.20.0.2","TCP","35974 → 4433 [ACK] Seq=564 Ack=1045 Win=64128 Len=0 TSval=2169761482 TSecr=2864332412"
"177","5.297832903","146","6a:9c:d9:3e:a0:6f","b2:e0:01:5d:34:46","172.20.0.3","172.20.0.2","TLSv1.3","Change Cipher Spec, Application Data"
"178","5.297909828","66","6a:9c:d9:3e:a0:6f","b2:e0:01:5d:34:46","172.20.0.3","172.20.0.2","TCP","35974 → 4433 [RST, ACK] Seq=644 Ack=1045 Win=64128 Len=0 TSval=2169761490 TSecr=2864332412"
"179","5.311680532","74","6a:9c:d9:3e:a0:6f","b2:e0:01:5d:34:46","172.20.0.3","172.20.0.2","TCP","35980 → 4433 [SYN] Seq=0 Win=64240 Len=0 MSS=1460 SACK_PERM TSval=2169761503 TSecr=0 WS=128"
"180","5.311707234","74","b2:e0:01:5d:34:46","6a:9c:d9:3e:a0:6f","172.20.0.2","172.20.0.3","TCP","4433 → 35980 [SYN, ACK] Seq=0 Ack=1 Win=65160 Len=0 MSS=1460 SACK_PERM TSval=2864332433 TSecr=2169761503 WS=128"
"181","5.311726749","66","6a:9c:d9:3e:a0:6f","b2:e0:01:5d:34:46","172.20.0.3","172.20.0.2","TCP","35980 → 4433 [ACK] Seq=1 Ack=1 Win=64256 Len=0 TSval=2169761503 TSecr=2864332433"
"182","5.311765620","629","6a:9c:d9:3e:a0:6f","b2:e0:01:5d:34:46","172.20.0.3","172.20.0.2","TLSv1.2","Client Hello"
"183","5.311770660","66","b2:e0:01:5d:34:46","6a:9c:d9:3e:a0:6f","172.20.0.2","172.20.0.3","TCP","4433 → 35980 [ACK] Seq=1 Ack=564 Win=64640 Len=0 TSval=2864332433 TSecr=2169761503"
"184","5.524923032","1110","b2:e0:01:5d:34:46","6a:9c:d9:3e:a0:6f","172.20.0.2","172.20.0.3","TLSv1.3","Server Hello, Change Cipher Spec, Application Data, Application Data, Application Data, Application Data"
"185","5.524981542","66","6a:9c:d9:3e:a0:6f","b2:e0:01:5d:34:46","172.20.0.3","172.20.0.2","TCP","35980 → 4433 [ACK] Seq=564 Ack=1045 Win=64128 Len=0 TSval=2169761717 TSecr=2864332647"
"186","5.532529911","146","6a:9c:d9:3e:a0:6f","b2:e0:01:5d:34:46","172.20.0.3","172.20.0.2","TLSv1.3","Change Cipher Spec, Application Data"
"187","5.532603062","66","6a:9c:d9:3e:a0:6f","b2:e0:01:5d:34:46","172.20.0.3","172.20.0.2","TCP","35980 → 4433 [RST, ACK] Seq=644 Ack=1045 Win=64128 Len=0 TSval=2169761724 TSecr=2864332647"
"188","5.546286823","74","6a:9c:d9:3e:a0:6f","b2:e0:01:5d:34:46","172.20.0.3","172.20.0.2","TCP","35986 → 4433 [SYN] Seq=0 Win=64240 Len=0 MSS=1460 SACK_PERM TSval=2169761738 TSecr=0 WS=128"
"189","5.546316718","74","b2:e0:01:5d:34:46","6a:9c:d9:3e:a0:6f","172.20.0.2","172.20.0.3","TCP","4433 → 35986 [SYN, ACK] Seq=0 Ack=1 Win=65160 Len=0 MSS=1460 SACK_PERM TSval=2864332668 TSecr=2169761738 WS=128"
"190","5.546337835","66","6a:9c:d9:3e:a0:6f","b2:e0:01:5d:34:46","172.20.0.3","172.20.0.2","TCP","35986 → 4433 [ACK] Seq=1 Ack=1 Win=64256 Len=0 TSval=2169761738 TSecr=2864332668"
"191","5.546384974","629","6a:9c:d9:3e:a0:6f","b2:e0:01:5d:34:46","172.20.0.3","172.20.0.2","TLSv1.2","Client Hello"
"192","5.546392186","66","b2:e0:01:5d:34:46","6a:9c:d9:3e:a0:6f","172.20.0.2","172.20.0.3","TCP","4433 → 35986 [ACK] Seq=1 Ack=564 Win=64640 Len=0 TSval=2864332668 TSecr=2169761738"
"193","5.554488323","1110","b2:e0:01:5d:34:46","6a:9c:d9:3e:a0:6f","172.20.0.2","172.20.0.3","TLSv1.3","Server Hello, Change Cipher Spec, Application Data, Application Data, Application Data, Application Data"
"194","5.554519452","66","6a:9c:d9:3e:a0:6f","b2:e0:01:5d:34:46","172.20.0.3","172.20.0.2","TCP","35986 → 4433 [ACK] Seq=564 Ack=1045 Win=64128 Len=0 TSval=2169761746 TSecr=2864332676"
"195","5.561704705","146","6a:9c:d9:3e:a0:6f","b2:e0:01:5d:34:46","172.20.0.3","172.20.0.2","TLSv1.3","Change Cipher Spec, Application Data"
"196","5.561763524","66","6a:9c:d9:3e:a0:6f","b2:e0:01:5d:34:46","172.20.0.3","172.20.0.2","TCP","35986 → 4433 [RST, ACK] Seq=644 Ack=1045 Win=64128 Len=0 TSval=2169761753 TSecr=2864332676"
"197","5.574544669","74","6a:9c:d9:3e:a0:6f","b2:e0:01:5d:34:46","172.20.0.3","172.20.0.2","TCP","35990 → 4433 [SYN] Seq=0 Win=64240 Len=0 MSS=1460 SACK_PERM TSval=2169761766 TSecr=0 WS=128"
"198","5.574567971","74","b2:e0:01:5d:34:46","6a:9c:d9:3e:a0:6f","172.20.0.2","172.20.0.3","TCP","4433 → 35990 [SYN, ACK] Seq=0 Ack=1 Win=65160 Len=0 MSS=1460 SACK_PERM TSval=2864332696 TSecr=2169761766 WS=128"
"199","5.574584080","66","6a:9c:d9:3e:a0:6f","b2:e0:01:5d:34:46","172.20.0.3","172.20.0.2","TCP","35990 → 4433 [ACK] Seq=1 Ack=1 Win=64256 Len=0 TSval=2169761766 TSecr=2864332696"
"200","5.574620779","629","6a:9c:d9:3e:a0:6f","b2:e0:01:5d:34:46","172.20.0.3","172.20.0.2","TLSv1.2","Client Hello"
"201","5.574625589","66","b2:e0:01:5d:34:46","6a:9c:d9:3e:a0:6f","172.20.0.2","172.20.0.3","TCP","4433 → 35990 [ACK] Seq=1 Ack=564 Win=64640 Len=0 TSval=2864332696 TSecr=2169761766"
"202","5.582644884","1110","b2:e0:01:5d:34:46","6a:9c:d9:3e:a0:6f","172.20.0.2","172.20.0.3","TLSv1.3","Server Hello, Change Cipher Spec, Application Data, Application Data, Application Data, Application Data"
"203","5.582671743","66","6a:9c:d9:3e:a0:6f","b2:e0:01:5d:34:46","172.20.0.3","172.20.0.2","TCP","35990 → 4433 [ACK] Seq=564 Ack=1045 Win=64128 Len=0 TSval=2169761774 TSecr=2864332704"
"204","5.589709018","146","6a:9c:d9:3e:a0:6f","b2:e0:01:5d:34:46","172.20.0.3","172.20.0.2","TLSv1.3","Change Cipher Spec, Application Data"
"205","5.589771641","66","6a:9c:d9:3e:a0:6f","b2:e0:01:5d:34:46","172.20.0.3","172.20.0.2","TCP","35990 → 4433 [RST, ACK] Seq=644 Ack=1045 Win=64128 Len=0 TSval=2169761781 TSecr=2864332704"
"206","5.602468902","74","6a:9c:d9:3e:a0:6f","b2:e0:01:5d:34:46","172.20.0.3","172.20.0.2","TCP","36002 → 4433 [SYN] Seq=0 Win=64240 Len=0 MSS=1460 SACK_PERM TSval=2169761794 TSecr=0 WS=128"
"207","5.602490231","74","b2:e0:01:5d:34:46","6a:9c:d9:3e:a0:6f","172.20.0.2","172.20.0.3","TCP","4433 → 36002 [SYN, ACK] Seq=0 Ack=1 Win=65160 Len=0 MSS=1460 SACK_PERM TSval=2864332724 TSecr=2169761794 WS=128"
"208","5.602503980","66","6a:9c:d9:3e:a0:6f","b2:e0:01:5d:34:46","172.20.0.3","172.20.0.2","TCP","36002 → 4433 [ACK] Seq=1 Ack=1 Win=64256 Len=0 TSval=2169761794 TSecr=2864332724"
"209","5.602540758","629","6a:9c:d9:3e:a0:6f","b2:e0:01:5d:34:46","172.20.0.3","172.20.0.2","TLSv1.2","Client Hello"
"210","5.602546461","66","b2:e0:01:5d:34:46","6a:9c:d9:3e:a0:6f","172.20.0.2","172.20.0.3","TCP","4433 → 36002 [ACK] Seq=1 Ack=564 Win=64640 Len=0 TSval=2864332724 TSecr=2169761794"
"211","5.610444559","1110","b2:e0:01:5d:34:46","6a:9c:d9:3e:a0:6f","172.20.0.2","172.20.0.3","TLSv1.3","Server Hello, Change Cipher Spec, Application Data, Application Data, Application Data, Application Data"
"212","5.610471984","66","6a:9c:d9:3e:a0:6f","b2:e0:01:5d:34:46","172.20.0.3","172.20.0.2","TCP","36002 → 4433 [ACK] Seq=564 Ack=1045 Win=64128 Len=0 TSval=2169761802 TSecr=2864332732"
"213","5.617536232","146","6a:9c:d9:3e:a0:6f","b2:e0:01:5d:34:46","172.20.0.3","172.20.0.2","TLSv1.3","Change Cipher Spec, Application Data"
"214","5.617600436","66","6a:9c:d9:3e:a0:6f","b2:e0:01:5d:34:46","172.20.0.3","172.20.0.2","TCP","36002 → 4433 [RST, ACK] Seq=644 Ack=1045 Win=64128 Len=0 TSval=2169761809 TSecr=2864332732"
"215","5.630000863","74","6a:9c:d9:3e:a0:6f","b2:e0:01:5d:34:46","172.20.0.3","172.20.0.2","TCP","36008 → 4433 [SYN] Seq=0 Win=64240 Len=0 MSS=1460 SACK_PERM TSval=2169761822 TSecr=0 WS=128"
"216","5.630021198","74","b2:e0:01:5d:34:46","6a:9c:d9:3e:a0:6f","172.20.0.2","172.20.0.3","TCP","4433 → 36008 [SYN, ACK] Seq=0 Ack=1 Win=65160 Len=0 MSS=1460 SACK_PERM TSval=2864332752 TSecr=2169761822 WS=128"
"217","5.630034997","66","6a:9c:d9:3e:a0:6f","b2:e0:01:5d:34:46","172.20.0.3","172.20.0.2","TCP","36008 → 4433 [ACK] Seq=1 Ack=1 Win=64256 Len=0 TSval=2169761822 TSecr=2864332752"
"218","5.630067342","629","6a:9c:d9:3e:a0:6f","b2:e0:01:5d:34:46","172.20.0.3","172.20.0.2","TLSv1.2","Client Hello"
"219","5.630079475","66","b2:e0:01:5d:34:46","6a:9c:d9:3e:a0:6f","172.20.0.2","172.20.0.3","TCP","4433 → 36008 [ACK] Seq=1 Ack=564 Win=64640 Len=0 TSval=2864332752 TSecr=2169761822"
"220","5.637912208","1110","b2:e0:01:5d:34:46","6a:9c:d9:3e:a0:6f","172.20.0.2","172.20.0.3","TLSv1.3","Server Hello, Change Cipher Spec, Application Data, Application Data, Application Data, Application Data"
"221","5.637931180","66","6a:9c:d9:3e:a0:6f","b2:e0:01:5d:34:46","172.20.0.3","172.20.0.2","TCP","36008 → 4433 [ACK] Seq=564 Ack=1045 Win=64128 Len=0 TSval=2169761830 TSecr=2864332760"
"222","5.645115523","146","6a:9c:d9:3e:a0:6f","b2:e0:01:5d:34:46","172.20.0.3","172.20.0.2","TLSv1.3","Change Cipher Spec, Application Data"
"223","5.645173088","66","6a:9c:d9:3e:a0:6f","b2:e0:01:5d:34:46","172.20.0.3","172.20.0.2","TCP","36008 → 4433 [RST, ACK] Seq=644 Ack=1045 Win=64128 Len=0 TSval=2169761837 TSecr=2864332760"
"224","5.657863491","74","6a:9c:d9:3e:a0:6f","b2:e0:01:5d:34:46","172.20.0.3","172.20.0.2","TCP","36020 → 4433 [SYN] Seq=0 Win=64240 Len=0 MSS=1460 SACK_PERM TSval=2169761849 TSecr=0 WS=128"
