frame.number,frame.time_relative,frame.len,eth.src,eth.dst,ip.src,ip.dst,_ws.col.protocol,_ws.col.info
"1","0.000000000","42","fa:35:21:08:95:e1","ff:ff:ff:ff:ff:ff",,,"ARP","ARP Announcement for 172.20.0.3"
"2","0.034778416","42","fa:35:21:08:95:e1","ff:ff:ff:ff:ff:ff",,,"ARP","Who has 172.20.0.2? Tell 172.20.0.3"
"3","0.034802190","42","36:5d:bc:ac:12:b1","fa:35:21:08:95:e1",,,"ARP","172.20.0.2 is at 36:5d:bc:ac:12:b1"
"4","0.034810188","74","fa:35:21:08:95:e1","36:5d:bc:ac:12:b1","172.20.0.3","172.20.0.2","TCP","47204 → 4433 [SYN] Seq=0 Win=64240 Len=0 MSS=1460 SACK_PERM TSval=1143342714 TSecr=0 WS=128"
"5","0.034831644","74","36:5d:bc:ac:12:b1","fa:35:21:08:95:e1","172.20.0.2","172.20.0.3","TCP","4433 → 47204 [SYN, ACK] Seq=0 Ack=1 Win=65160 Len=0 MSS=1460 SACK_PERM TSval=1334258509 TSecr=1143342714 WS=128"
"6","0.034847033","66","fa:35:21:08:95:e1","36:5d:bc:ac:12:b1","172.20.0.3","172.20.0.2","TCP","47204 → 4433 [ACK] Seq=1 Ack=1 Win=64256 Len=0 TSval=1143342714 TSecr=1334258509"
"7","0.034896965","2189","fa:35:21:08:95:e1","36:5d:bc:ac:12:b1","172.20.0.3","172.20.0.2","TLSv1.2","Client Hello"
"8","0.034901823","66","36:5d:bc:ac:12:b1","fa:35:21:08:95:e1","172.20.0.2","172.20.0.3","TCP","4433 → 47204 [ACK] Seq=1 Ack=2124 Win=64128 Len=0 TSval=1334258509 TSecr=1143342714"
"9","0.049584220","2677","36:5d:bc:ac:12:b1","fa:35:21:08:95:e1","172.20.0.2","172.20.0.3","TLSv1.3","Server Hello, Change Cipher Spec, Application Data, Application Data, Application Data, Application Data"
"10","0.049634924","66","fa:35:21:08:95:e1","36:5d:bc:ac:12:b1","172.20.0.3","172.20.0.2","TCP","47204 → 4433 [ACK] Seq=2124 Ack=2612 Win=64128 Len=0 TSval=1143342729 TSecr=1334258524"
"11","0.059228732","146","fa:35:21:08:95:e1","36:5d:bc:ac:12:b1","172.20.0.3","172.20.0.2","TLSv1.3","Change Cipher Spec, Application Data"
"12","0.059330124","66","fa:35:21:08:95:e1","36:5d:bc:ac:12:b1","172.20.0.3","172.20.0.2","TCP","47204 → 4433 [RST, ACK] Seq=2204 Ack=2612 Win=64128 Len=0 TSval=1143342739 TSecr=1334258524"
"13","0.075405905","74","fa:35:21:08:95:e1","36:5d:bc:ac:12:b1","172.20.0.3","172.20.0.2","TCP","47206 → 4433 [SYN] Seq=0 Win=64240 Len=0 MSS=1460 SACK_PERM TSval=1143342755 TSecr=0 WS=128"
"14","0.075433069","74","36:5d:bc:ac:12:b1","fa:35:21:08:95:e1","172.20.0.2","172.20.0.3","TCP","4433 → 47206 [SYN, ACK] Seq=0 Ack=1 Win=65160 Len=0 MSS=1460 SACK_PERM TSval=1334258550 TSecr=1143342755 WS=128"
"15","0.075455203","66","fa:35:21:08:95:e1","36:5d:bc:ac:12:b1","172.20.0.3","172.20.0.2","TCP","47206 → 4433 [ACK] Seq=1 Ack=1 Win=64256 Len=0 TSval=1143342755 TSecr=1334258550"
"16","0.075501162","2189","fa:35:21:08:95:e1","36:5d:bc:ac:12:b1","172.20.0.3","172.20.0.2","TLSv1.2","Client Hello"
"17","0.075507029","66","36:5d:bc:ac:12:b1","fa:35:21:08:95:e1","172.20.0.2","172.20.0.3","TCP","4433 → 47206 [ACK] Seq=1 Ack=2124 Win=64128 Len=0 TSval=1334258550 TSecr=1143342755"
"18","0.087595324","2676","36:5d:bc:ac:12:b1","fa:35:21:08:95:e1","172.20.0.2","172.20.0.3","TLSv1.3","Server Hello, Change Cipher Spec, Application Data, Application Data, Application Data, Application Data"
"19","0.087633686","66","fa:35:21:08:95:e1","36:5d:bc:ac:12:b1","172.20.0.3","172.20.0.2","TCP","47206 → 4433 [ACK] Seq=2124 Ack=2611 Win=64128 Len=0 TSval=1143342767 TSecr=1334258562"
"20","0.096738010","146","fa:35:21:08:95:e1","36:5d:bc:ac:12:b1","172.20.0.3","172.20.0.2","TLSv1.3","Change Cipher Spec, Application Data"
"21","0.096815035","66","fa:35:21:08:95:e1","36:5d:bc:ac:12:b1","172.20.0.3","172.20.0.2","TCP","47206 → 4433 [RST, ACK] Seq=2204 Ack=2611 Win=64128 Len=0 TSval=1143342776 TSecr=1334258562"
"22","0.112885917","74","fa:35:21:08:95:e1","36:5d:bc:ac:12:b1","172.20.0.3","172.20.0.2","TCP","47208 → 4433 [SYN] Seq=0 Win=64240 Len=0 MSS=1460 SACK_PERM TSval=1143342792 TSecr=0 WS=128"
"23","0.112909657","74","36:5d:bc:ac:12:b1","fa:35:21:08:95:e1","172.20.0.2","172.20.0.3","TCP","4433 → 47208 [SYN, ACK] Seq=0 Ack=1 Win=65160 Len=0 MSS=1460 SACK_PERM TSval=1334258587 TSecr=1143342792 WS=128"
"24","0.112928273","66","fa:35:21:08:95:e1","36:5d:bc:ac:12:b1","172.20.0.3","172.20.0.2","TCP","47208 → 4433 [ACK] Seq=1 Ack=1 Win=64256 Len=0 TSval=1143342792 TSecr=1334258587"
"25","0.112974486","2189","fa:35:21:08:95:e1","36:5d:bc:ac:12:b1","172.20.0.3","172.20.0.2","TLSv1.2","Client Hello"
"26","0.112980407","66","36:5d:bc:ac:12:b1","fa:35:21:08:95:e1","172.20.0.2","172.20.0.3","TCP","4433 → 47208 [ACK] Seq=1 Ack=2124 Win=64128 Len=0 TSval=1334258587 TSecr=1143342792"
"27","0.124680932","2676","36:5d:bc:ac:12:b1","fa:35:21:08:95:e1","172.20.0.2","172.20.0.3","TLSv1.3","Server Hello, Change Cipher Spec, Application Data, Application Data, Application Data, Application Data"
"28","0.124714497","66","fa:35:21:08:95:e1","36:5d:bc:ac:12:b1","172.20.0.3","172.20.0.2","TCP","47208 → 4433 [ACK] Seq=2124 Ack=2611 Win=64128 Len=0 TSval=1143342804 TSecr=1334258599"
"29","0.133571563","146","fa:35:21:08:95:e1","36:5d:bc:ac:12:b1","172.20.0.3","172.20.0.2","TLSv1.3","Change Cipher Spec, Application Data"
"30","0.133638343","66","fa:35:21:08:95:e1","36:5d:bc:ac:12:b1","172.20.0.3","172.20.0.2","TCP","47208 → 4433 [RST, ACK] Seq=2204 Ack=2611 Win=64128 Len=0 TSval=1143342813 TSecr=1334258599"
"31","0.149072297","74","fa:35:21:08:95:e1","36:5d:bc:ac:12:b1","172.20.0.3","172.20.0.2","TCP","47224 → 4433 [SYN] Seq=0 Win=64240 Len=0 MSS=1460 SACK_PERM TSval=1143342828 TSecr=0 WS=128"
"32","0.149097902","74","36:5d:bc:ac:12:b1","fa:35:21:08:95:e1","172.20.0.2","172.20.0.3","TCP","4433 → 47224 [SYN, ACK] Seq=0 Ack=1 Win=65160 Len=0 MSS=1460 SACK_PERM TSval=1334258623 TSecr=1143342828 WS=128"
"33","0.149115288","66","fa:35:21:08:95:e1","36:5d:bc:ac:12:b1","172.20.0.3","172.20.0.2","TCP","47224 → 4433 [ACK] Seq=1 Ack=1 Win=64256 Len=0 TSval=1143342828 TSecr=1334258623"
"34","0.149154604","2189","fa:35:21:08:95:e1","36:5d:bc:ac:12:b1","172.20.0.3","172.20.0.2","TLSv1.2","Client Hello"
"35","0.149160119","66","36:5d:bc:ac:12:b1","fa:35:21:08:95:e1","172.20.0.2","172.20.0.3","TCP","4433 → 47224 [ACK] Seq=1 Ack=2124 Win=64128 Len=0 TSval=1334258623 TSecr=1143342828"
"36","0.160951230","2677","36:5d:bc:ac:12:b1","fa:35:21:08:95:e1","172.20.0.2","172.20.0.3","TLSv1.3","Server Hello, Change Cipher Spec, Application Data, Application Data, Application Data, Application Data"
"37","0.160996224","66","fa:35:21:08:95:e1","36:5d:bc:ac:12:b1","172.20.0.3","172.20.0.2","TCP","47224 → 4433 [ACK] Seq=2124 Ack=2612 Win=64128 Len=0 TSval=1143342840 TSecr=1334258635"
"38","0.170083323","146","fa:35:21:08:95:e1","36:5d:bc:ac:12:b1","172.20.0.3","172.20.0.2","TLSv1.3","Change Cipher Spec, Application Data"
"39","0.170153079","66","fa:35:21:08:95:e1","36:5d:bc:ac:12:b1","172.20.0.3","172.20.0.2","TCP","47224 → 4433 [RST, ACK] Seq=2204 Ack=2612 Win=64128 Len=0 TSval=1143342849 TSecr=1334258635"
"40","0.186212719","74","fa:35:21:08:95:e1","36:5d:bc:ac:12:b1","172.20.0.3","172.20.0.2","TCP","47232 → 4433 [SYN] Seq=0 Win=64240 Len=0 MSS=1460 SACK_PERM TSval=1143342865 TSecr=0 WS=128"
"41","0.186242558","74","36:5d:bc:ac:12:b1","fa:35:21:08:95:e1","172.20.0.2","172.20.0.3","TCP","4433 → 47232 [SYN, ACK] Seq=0 Ack=1 Win=65160 Len=0 MSS=1460 SACK_PERM TSval=1334258660 TSecr=1143342865 WS=128"
"42","0.186278590","66","fa:35:21:08:95:e1","36:5d:bc:ac:12:b1","172.20.0.3","172.20.0.2","TCP","47232 → 4433 [ACK] Seq=1 Ack=1 Win=64256 Len=0 TSval=1143342865 TSecr=1334258660"
"43","0.186330363","2189","fa:35:21:08:95:e1","36:5d:bc:ac:12:b1","172.20.0.3","172.20.0.2","TLSv1.2","Client Hello"
"44","0.186336772","66","36:5d:bc:ac:12:b1","fa:35:21:08:95:e1","172.20.0.2","172.20.0.3","TCP","4433 → 47232 [ACK] Seq=1 Ack=2124 Win=64128 Len=0 TSval=1334258661 TSecr=1143342866"
"45","0.198044638","2676","36:5d:bc:ac:12:b1","fa:35:21:08:95:e1","172.20.0.2","172.20.0.3","TLSv1.3","Server Hello, Change Cipher Spec, Application Data, Application Data, Application Data, Application Data"
"46","0.198084175","66","fa:35:21:08:95:e1","36:5d:bc:ac:12:b1","172.20.0.3","172.20.0.2","TCP","47232 → 4433 [ACK] Seq=2124 Ack=2611 Win=64128 Len=0 TSval=1143342877 TSecr=1334258672"
"47","0.207306250","146","fa:35:21:08:95:e1","36:5d:bc:ac:12:b1","172.20.0.3","172.20.0.2","TLSv1.3","Change Cipher Spec, Application Data"
"48","0.207399173","66","fa:35:21:08:95:e1","36:5d:bc:ac:12:b1","172.20.0.3","172.20.0.2","TCP","47232 → 4433 [RST, ACK] Seq=2204 Ack=2611 Win=64128 Len=0 TSval=1143342887 TSecr=1334258672"
"49","0.223301544","74","fa:35:21:08:95:e1","36:5d:bc:ac:12:b1","172.20.0.3","172.20.0.2","TCP","47242 → 4433 [SYN] Seq=0 Win=64240 Len=0 MSS=1460 SACK_PERM TSval=1143342902 TSecr=0 WS=128"
"50","0.223327045","74","36:5d:bc:ac:12:b1","fa:35:21:08:95:e1","172.20.0.2","172.20.0.3","TCP","4433 → 47242 [SYN, ACK] Seq=0 Ack=1 Win=65160 Len=0 MSS=1460 SACK_PERM TSval=1334258698 TSecr=1143342902 WS=128"
"51","0.223346053","66","fa:35:21:08:95:e1","36:5d:bc:ac:12:b1","172.20.0.3","172.20.0.2","TCP","47242 → 4433 [ACK] Seq=1 Ack=1 Win=64256 Len=0 TSval=1143342903 TSecr=1334258698"
"52","0.223389109","2189","fa:35:21:08:95:e1","36:5d:bc:ac:12:b1","172.20.0.3","172.20.0.2","TLSv1.2","Client Hello"
"53","0.223394990","66","36:5d:bc:ac:12:b1","fa:35:21:08:95:e1","172.20.0.2","172.20.0.3","TCP","4433 → 47242 [ACK] Seq=1 Ack=2124 Win=64128 Len=0 TSval=1334258698 TSecr=1143342903"
"54","0.235167483","2677","36:5d:bc:ac:12:b1","fa:35:21:08:95:e1","172.20.0.2","172.20.0.3","TLSv1.3","Server Hello, Change Cipher Spec, Application Data, Application Data, Application Data, Application Data"
"55","0.235218515","66","fa:35:21:08:95:e1","36:5d:bc:ac:12:b1","172.20.0.3","172.20.0.2","TCP","47242 → 4433 [ACK] Seq=2124 Ack=2612 Win=64128 Len=0 TSval=1143342914 TSecr=1334258709"
"56","0.244090414","146","fa:35:21:08:95:e1","36:5d:bc:ac:12:b1","172.20.0.3","172.20.0.2","TLSv1.3","Change Cipher Spec, Application Data"
"57","0.244191322","66","fa:35:21:08:95:e1","36:5d:bc:ac:12:b1","172.20.0.3","172.20.0.2","TCP","47242 → 4433 [RST, ACK] Seq=2204 Ack=2612 Win=64128 Len=0 TSval=1143342923 TSecr=1334258709"
"58","0.260066164","74","fa:35:21:08:95:e1","36:5d:bc:ac:12:b1","172.20.0.3","172.20.0.2","TCP","47246 → 4433 [SYN] Seq=0 Win=64240 Len=0 MSS=1460 SACK_PERM TSval=1143342939 TSecr=0 WS=128"
"59","0.260092838","74","36:5d:bc:ac:12:b1","fa:35:21:08:95:e1","172.20.0.2","172.20.0.3","TCP","4433 → 47246 [SYN, ACK] Seq=0 Ack=1 Win=65160 Len=0 MSS=1460 SACK_PERM TSval=1334258734 TSecr=1143342939 WS=128"
"60","0.260110629","66","fa:35:21:08:95:e1","36:5d:bc:ac:12:b1","172.20.0.3","172.20.0.2","TCP","47246 → 4433 [ACK] Seq=1 Ack=1 Win=64256 Len=0 TSval=1143342939 TSecr=1334258734"
"61","0.260151823","2189","fa:35:21:08:95:e1","36:5d:bc:ac:12:b1","172.20.0.3","172.20.0.2","TLSv1.2","Client Hello"
"62","0.260158221","66","36:5d:bc:ac:12:b1","fa:35:21:08:95:e1","172.20.0.2","172.20.0.3","TCP","4433 → 47246 [ACK] Seq=1 Ack=2124 Win=64128 Len=0 TSval=1334258734 TSecr=1143342939"
"63","0.271912104","2676","36:5d:bc:ac:12:b1","fa:35:21:08:95:e1","172.20.0.2","172.20.0.3","TLSv1.3","Server Hello, Change Cipher Spec, Application Data, Application Data, Application Data, Application Data"
"64","0.271950141","66","fa:35:21:08:95:e1","36:5d:bc:ac:12:b1","172.20.0.3","172.20.0.2","TCP","47246 → 4433 [ACK] Seq=2124 Ack=2611 Win=64128 Len=0 TSval=1143342951 TSecr=1334258746"
"65","0.280920142","146","fa:35:21:08:95:e1","36:5d:bc:ac:12:b1","172.20.0.3","172.20.0.2","TLSv1.3","Change Cipher Spec, Application Data"
"66","0.280997044","66","fa:35:21:08:95:e1","36:5d:bc:ac:12:b1","172.20.0.3","172.20.0.2","TCP","47246 → 4433 [RST, ACK] Seq=2204 Ack=2611 Win=64128 Len=0 TSval=1143342960 TSecr=1334258746"
"67","0.297109311","74","fa:35:21:08:95:e1","36:5d:bc:ac:12:b1","172.20.0.3","172.20.0.2","TCP","47254 → 4433 [SYN] Seq=0 Win=64240 Len=0 MSS=1460 SACK_PERM TSval=1143342976 TSecr=0 WS=128"
"68","0.297144130","74","36:5d:bc:ac:12:b1","fa:35:21:08:95:e1","172.20.0.2","172.20.0.3","TCP","4433 → 47254 [SYN, ACK] Seq=0 Ack=1 Win=65160 Len=0 MSS=1460 SACK_PERM TSval=1334258771 TSecr=1143342976 WS=128"
"69","0.297179204","66","fa:35:21:08:95:e1","36:5d:bc:ac:12:b1","172.20.0.3","172.20.0.2","TCP","47254 → 4433 [ACK] Seq=1 Ack=1 Win=64256 Len=0 TSval=1143342976 TSecr=1334258771"
"70","0.297236587","2189","fa:35:21:08:95:e1","36:5d:bc:ac:12:b1","172.20.0.3","172.20.0.2","TLSv1.2","Client Hello"
"71","0.297246243","66","36:5d:bc:ac:12:b1","fa:35:21:08:95:e1","172.20.0.2","172.20.0.3","TCP","4433 → 47254 [ACK] Seq=1 Ack=2124 Win=64128 Len=0 TSval=1334258771 TSecr=1143342976"
"72","0.309118926","2677","36:5d:bc:ac:12:b1","fa:35:21:08:95:e1","172.20.0.2","172.20.0.3","TLSv1.3","Server Hello, Change Cipher Spec, Application Data, Application Data, Application Data, Application Data"
"73","0.309163139","66","fa:35:21:08:95:e1","36:5d:bc:ac:12:b1","172.20.0.3","172.20.0.2","TCP","47254 → 4433 [ACK] Seq=2124 Ack=2612 Win=64128 Len=0 TSval=1143342988 TSecr=1334258783"
"74","0.323615052","146","fa:35:21:08:95:e1","36:5d:bc:ac:12:b1","172.20.0.3","172.20.0.2","TLSv1.3","Change Cipher Spec, Application Data"
"75","0.323734876","66","fa:35:21:08:95:e1","36:5d:bc:ac:12:b1","172.20.0.3","172.20.0.2","TCP","47254 → 4433 [RST, ACK] Seq=2204 Ack=2612 Win=64128 Len=0 TSval=1143343003 TSecr=1334258783"
"76","0.342164470","74","fa:35:21:08:95:e1","36:5d:bc:ac:12:b1","172.20.0.3","172.20.0.2","TCP","47258 → 4433 [SYN] Seq=0 Win=64240 Len=0 MSS=1460 SACK_PERM TSval=1143343021 TSecr=0 WS=128"
"77","0.342198352","74","36:5d:bc:ac:12:b1","fa:35:21:08:95:e1","172.20.0.2","172.20.0.3","TCP","4433 → 47258 [SYN, ACK] Seq=0 Ack=1 Win=65160 Len=0 MSS=1460 SACK_PERM TSval=1334258816 TSecr=1143343021 WS=128"
"78","0.342218490","66","fa:35:21:08:95:e1","36:5d:bc:ac:12:b1","172.20.0.3","172.20.0.2","TCP","47258 → 4433 [ACK] Seq=1 Ack=1 Win=64256 Len=0 TSval=1143343021 TSecr=1334258816"
"79","0.342317973","2189","fa:35:21:08:95:e1","36:5d:bc:ac:12:b1","172.20.0.3","172.20.0.2","TLSv1.2","Client Hello"
"80","0.342327593","66","36:5d:bc:ac:12:b1","fa:35:21:08:95:e1","172.20.0.2","172.20.0.3","TCP","4433 → 47258 [ACK] Seq=1 Ack=2124 Win=64128 Len=0 TSval=1334258817 TSecr=1143343022"
"81","0.354469251","2677","36:5d:bc:ac:12:b1","fa:35:21:08:95:e1","172.20.0.2","172.20.0.3","TLSv1.3","Server Hello, Change Cipher Spec, Application Data, Application Data, Application Data, Application Data"
"82","0.354519913","66","fa:35:21:08:95:e1","36:5d:bc:ac:12:b1","172.20.0.3","172.20.0.2","TCP","47258 → 4433 [ACK] Seq=2124 Ack=2612 Win=64128 Len=0 TSval=1143343034 TSecr=1334258829"
"83","0.363984772","146","fa:35:21:08:95:e1","36:5d:bc:ac:12:b1","172.20.0.3","172.20.0.2","TLSv1.3","Change Cipher Spec, Application Data"
"84","0.364077166","66","fa:35:21:08:95:e1","36:5d:bc:ac:12:b1","172.20.0.3","172.20.0.2","TCP","47258 → 4433 [RST, ACK] Seq=2204 Ack=2612 Win=64128 Len=0 TSval=1143343043 TSecr=1334258829"
"85","0.380631011","74","fa:35:21:08:95:e1","36:5d:bc:ac:12:b1","172.20.0.3","172.20.0.2","TCP","47268 → 4433 [SYN] Seq=0 Win=64240 Len=0 MSS=1460 SACK_PERM TSval=1143343060 TSecr=0 WS=128"
"86","0.380657273","74","36:5d:bc:ac:12:b1","fa:35:21:08:95:e1","172.20.0.2","172.20.0.3","TCP","4433 → 47268 [SYN, ACK] Seq=0 Ack=1 Win=65160 Len=0 MSS=1460 SACK_PERM TSval=1334258855 TSecr=1143343060 WS=128"
"87","0.380675707","66","fa:35:21:08:95:e1","36:5d:bc:ac:12:b1","172.20.0.3","172.20.0.2","TCP","47268 → 4433 [ACK] Seq=1 Ack=1 Win=64256 Len=0 TSval=1143343060 TSecr=1334258855"
"88","0.380726337","2189","fa:35:21:08:95:e1","36:5d:bc:ac:12:b1","172.20.0.3","172.20.0.2","TLSv1.2","Client Hello"
"89","0.380731277","66","36:5d:bc:ac:12:b1","fa:35:21:08:95:e1","172.20.0.2","172.20.0.3","TCP","4433 → 47268 [ACK] Seq=1 Ack=2124 Win=64128 Len=0 TSval=1334258855 TSecr=1143343060"
"90","0.392903991","2677","36:5d:bc:ac:12:b1","fa:35:21:08:95:e1","172.20.0.2","172.20.0.3","TLSv1.3","Server Hello, Change Cipher Spec, Application Data, Application Data, Application Data, Application Data"
"91","0.392942627","66","fa:35:21:08:95:e1","36:5d:bc:ac:12:b1","172.20.0.3","172.20.0.2","TCP","47268 → 4433 [ACK] Seq=2124 Ack=2612 Win=64128 Len=0 TSval=1143343072 TSecr=1334258867"
"92","0.402316126","146","fa:35:21:08:95:e1","36:5d:bc:ac:12:b1","172.20.0.3","172.20.0.2","TLSv1.3","Change Cipher Spec, Application Data"
"93","0.402400426","66","fa:35:21:08:95:e1","36:5d:bc:ac:12:b1","172.20.0.3","172.20.0.2","TCP","47268 → 4433 [RST, ACK] Seq=2204 Ack=2612 Win=64128 Len=0 TSval=1143343082 TSecr=1334258867"
"94","0.418968230","74","fa:35:21:08:95:e1","36:5d:bc:ac:12:b1","172.20.0.3","172.20.0.2","TCP","47282 → 4433 [SYN] Seq=0 Win=64240 Len=0 MSS=1460 SACK_PERM TSval=1143343098 TSecr=0 WS=128"
"95","0.418993889","74","36:5d:bc:ac:12:b1","fa:35:21:08:95:e1","172.20.0.2","172.20.0.3","TCP","4433 → 47282 [SYN, ACK] Seq=0 Ack=1 Win=65160 Len=0 MSS=1460 SACK_PERM TSval=1334258893 TSecr=1143343098 WS=128"
"96","0.419012653","66","fa:35:21:08:95:e1","36:5d:bc:ac:12:b1","172.20.0.3","172.20.0.2","TCP","47282 → 4433 [ACK] Seq=1 Ack=1 Win=64256 Len=0 TSval=1143343098 TSecr=1334258893"
"97","0.419056843","2189","fa:35:21:08:95:e1","36:5d:bc:ac:12:b1","172.20.0.3","172.20.0.2","TLSv1.2","Client Hello"
"98","0.419062239","66","36:5d:bc:ac:12:b1","fa:35:21:08:95:e1","172.20.0.2","172.20.0.3","TCP","4433 → 47282 [ACK] Seq=1 Ack=2124 Win=64128 Len=0 TSval=1334258893 TSecr=1143343098"
"99","0.430999625","2677","36:5d:bc:ac:12:b1","fa:35:21:08:95:e1","172.20.0.2","172.20.0.3","TLSv1.3","Server Hello, Change Cipher Spec, Application Data, Application Data, Application Data, Application Data"
"100","0.431051006","66","fa:35:21:08:95:e1","36:5d:bc:ac:12:b1","172.20.0.3","172.20.0.2","TCP","47282 → 4433 [ACK] Seq=2124 Ack=2612 Win=64128 Len=0 TSval=1143343110 TSecr=1334258905"
"101","0.440247208","146","fa:35:21:08:95:e1","36:5d:bc:ac:12:b1","172.20.0.3","172.20.0.2","TLSv1.3","Change Cipher Spec, Application Data"
"102","0.440338403","66","fa:35:21:08:95:e1","36:5d:bc:ac:12:b1","172.20.0.3","172.20.0.2","TCP","47282 → 4433 [RST, ACK] Seq=2204 Ack=2612 Win=64128 Len=0 TSval=1143343120 TSecr=1334258905"
"103","0.456854548","74","fa:35:21:08:95:e1","36:5d:bc:ac:12:b1","172.20.0.3","172.20.0.2","TCP","47296 → 4433 [SYN] Seq=0 Win=64240 Len=0 MSS=1460 SACK_PERM TSval=1143343136 TSecr=0 WS=128"
"104","0.456883321","74","36:5d:bc:ac:12:b1","fa:35:21:08:95:e1","172.20.0.2","172.20.0.3","TCP","4433 → 47296 [SYN, ACK] Seq=0 Ack=1 Win=65160 Len=0 MSS=1460 SACK_PERM TSval=1334258931 TSecr=1143343136 WS=128"
"105","0.456904251","66","fa:35:21:08:95:e1","36:5d:bc:ac:12:b1","172.20.0.3","172.20.0.2","TCP","47296 → 4433 [ACK] Seq=1 Ack=1 Win=64256 Len=0 TSval=1143343136 TSecr=1334258931"
"106","0.456963165","2189","fa:35:21:08:95:e1","36:5d:bc:ac:12:b1","172.20.0.3","172.20.0.2","TLSv1.2","Client Hello"
"107","0.456967858","66","36:5d:bc:ac:12:b1","fa:35:21:08:95:e1","172.20.0.2","172.20.0.3","TCP","4433 → 47296 [ACK] Seq=1 Ack=2124 Win=64128 Len=0 TSval=1334258931 TSecr=1143343136"
"108","0.468993963","2677","36:5d:bc:ac:12:b1","fa:35:21:08:95:e1","172.20.0.2","172.20.0.3","TLSv1.3","Server Hello, Change Cipher Spec, Application Data, Application Data, Application Data, Application Data"
"109","0.469052563","66","fa:35:21:08:95:e1","36:5d:bc:ac:12:b1","172.20.0.3","172.20.0.2","TCP","47296 → 4433 [ACK] Seq=2124 Ack=2612 Win=64128 Len=0 TSval=1143343148 TSecr=1334258943"
"110","0.478419985","146","fa:35:21:08:95:e1","36:5d:bc:ac:12:b1","172.20.0.3","172.20.0.2","TLSv1.3","Change Cipher Spec, Application Data"
"111","0.478516474","66","fa:35:21:08:95:e1","36:5d:bc:ac:12:b1","172.20.0.3","172.20.0.2","TCP","47296 → 4433 [RST, ACK] Seq=2204 Ack=2612 Win=64128 Len=0 TSval=1143343158 TSecr=1334258943"
"112","0.495372881","74","fa:35:21:08:95:e1","36:5d:bc:ac:12:b1","172.20.0.3","172.20.0.2","TCP","47302 → 4433 [SYN] Seq=0 Win=64240 Len=0 MSS=1460 SACK_PERM TSval=1143343175 TSecr=0 WS=128"
"113","0.495398723","74","36:5d:bc:ac:12:b1","fa:35:21:08:95:e1","172.20.0.2","172.20.0.3","TCP","4433 → 47302 [SYN, ACK] Seq=0 Ack=1 Win=65160 Len=0 MSS=1460 SACK_PERM TSval=1334258970 TSecr=1143343175 WS=128"
"114","0.495418133","66","fa:35:21:08:95:e1","36:5d:bc:ac:12:b1","172.20.0.3","172.20.0.2","TCP","47302 → 4433 [ACK] Seq=1 Ack=1 Win=64256 Len=0 TSval=1143343175 TSecr=1334258970"
"115","0.495463839","2189","fa:35:21:08:95:e1","36:5d:bc:ac:12:b1","172.20.0.3","172.20.0.2","TLSv1.2","Client Hello"
"116","0.495470357","66","36:5d:bc:ac:12:b1","fa:35:21:08:95:e1","172.20.0.2","172.20.0.3","TCP","4433 → 47302 [ACK] Seq=1 Ack=2124 Win=64128 Len=0 TSval=1334258970 TSecr=1143343175"
"117","0.507751636","2677","36:5d:bc:ac:12:b1","fa:35:21:08:95:e1","172.20.0.2","172.20.0.3","TLSv1.3","Server Hello, Change Cipher Spec, Application Data, Application Data, Application Data, Application Data"
"118","0.507805402","66","fa:35:21:08:95:e1","36:5d:bc:ac:12:b1","172.20.0.3","172.20.0.2","TCP","47302 → 4433 [ACK] Seq=2124 Ack=2612 Win=64128 Len=0 TSval=1143343187 TSecr=1334258982"
"119","0.517132960","146","fa:35:21:08:95:e1","36:5d:bc:ac:12:b1","172.20.0.3","172.20.0.2","TLSv1.3","Change Cipher Spec, Application Data"
"120","0.517232109","66","fa:35:21:08:95:e1","36:5d:bc:ac:12:b1","172.20.0.3","172.20.0.2","TCP","47302 → 4433 [RST, ACK] Seq=2204 Ack=2612 Win=64128 Len=0 TSval=1143343196 TSecr=1334258982"
"121","0.533185123","74","fa:35:21:08:95:e1","36:5d:bc:ac:12:b1","172.20.0.3","172.20.0.2","TCP","47310 → 4433 [SYN] Seq=0 Win=64240 Len=0 MSS=1460 SACK_PERM TSval=1143343212 TSecr=0 WS=128"
"122","0.533210364","74","36:5d:bc:ac:12:b1","fa:35:21:08:95:e1","172.20.0.2","172.20.0.3","TCP","4433 → 47310 [SYN, ACK] Seq=0 Ack=1 Win=65160 Len=0 MSS=1460 SACK_PERM TSval=1334259007 TSecr=1143343212 WS=128"
"123","0.533230819","66","fa:35:21:08:95:e1","36:5d:bc:ac:12:b1","172.20.0.3","172.20.0.2","TCP","47310 → 4433 [ACK] Seq=1 Ack=1 Win=64256 Len=0 TSval=1143343212 TSecr=1334259007"
"124","0.533288800","2189","fa:35:21:08:95:e1","36:5d:bc:ac:12:b1","172.20.0.3","172.20.0.2","TLSv1.2","Client Hello"
"125","0.533293359","66","36:5d:bc:ac:12:b1","fa:35:21:08:95:e1","172.20.0.2","172.20.0.3","TCP","4433 → 47310 [ACK] Seq=1 Ack=2124 Win=64128 Len=0 TSval=1334259008 TSecr=1143343213"
"126","0.546122685","2677","36:5d:bc:ac:12:b1","fa:35:21:08:95:e1","172.20.0.2","172.20.0.3","TLSv1.3","Server Hello, Change Cipher Spec, Application Data, Application Data, Application Data, Application Data"
"127","0.546158100","66","fa:35:21:08:95:e1","36:5d:bc:ac:12:b1","172.20.0.3","172.20.0.2","TCP","47310 → 4433 [ACK] Seq=2124 Ack=2612 Win=64128 Len=0 TSval=1143343225 TSecr=1334259020"
"128","0.554954586","146","fa:35:21:08:95:e1","36:5d:bc:ac:12:b1","172.20.0.3","172.20.0.2","TLSv1.3","Change Cipher Spec, Application Data"
"129","0.555018790","66","fa:35:21:08:95:e1","36:5d:bc:ac:12:b1","172.20.0.3","172.20.0.2","TCP","47310 → 4433 [RST, ACK] Seq=2204 Ack=2612 Win=64128 Len=0 TSval=1143343234 TSecr=1334259020"
"130","0.571736621","74","fa:35:21:08:95:e1","36:5d:bc:ac:12:b1","172.20.0.3","172.20.0.2","TCP","47312 → 4433 [SYN] Seq=0 Win=64240 Len=0 MSS=1460 SACK_PERM TSval=1143343251 TSecr=0 WS=128"
"131","0.571763289","74","36:5d:bc:ac:12:b1","fa:35:21:08:95:e1","172.20.0.2","172.20.0.3","TCP","4433 → 47312 [SYN, ACK] Seq=0 Ack=1 Win=65160 Len=0 MSS=1460 SACK_PERM TSval=1334259046 TSecr=1143343251 WS=128"
"132","0.571782515","66","fa:35:21:08:95:e1","36:5d:bc:ac:12:b1","172.20.0.3","172.20.0.2","TCP","47312 → 4433 [ACK] Seq=1 Ack=1 Win=64256 Len=0 TSval=1143343251 TSecr=1334259046"
"133","0.571833283","2189","fa:35:21:08:95:e1","36:5d:bc:ac:12:b1","172.20.0.3","172.20.0.2","TLSv1.2","Client Hello"
"134","0.571838969","66","36:5d:bc:ac:12:b1","fa:35:21:08:95:e1","172.20.0.2","172.20.0.3","TCP","4433 → 47312 [ACK] Seq=1 Ack=2124 Win=64128 Len=0 TSval=1334259046 TSecr=1143343251"
"135","0.583832131","2676","36:5d:bc:ac:12:b1","fa:35:21:08:95:e1","172.20.0.2","172.20.0.3","TLSv1.3","Server Hello, Change Cipher Spec, Application Data, Application Data, Application Data, Application Data"
"136","0.583884200","66","fa:35:21:08:95:e1","36:5d:bc:ac:12:b1","172.20.0.3","172.20.0.2","TCP","47312 → 4433 [ACK] Seq=2124 Ack=2611 Win=64128 Len=0 TSval=1143343263 TSecr=1334259058"
"137","0.592894093","146","fa:35:21:08:95:e1","36:5d:bc:ac:12:b1","172.20.0.3","172.20.0.2","TLSv1.3","Change Cipher Spec, Application Data"
"138","0.592962764","66","fa:35:21:08:95:e1","36:5d:bc:ac:12:b1","172.20.0.3","172.20.0.2","TCP","47312 → 4433 [RST, ACK] Seq=2204 Ack=2611 Win=64128 Len=0 TSval=1143343272 TSecr=1334259058"
"139","0.608827096","74","fa:35:21:08:95:e1","36:5d:bc:ac:12:b1","172.20.0.3","172.20.0.2","TCP","47320 → 4433 [SYN] Seq=0 Win=64240 Len=0 MSS=1460 SACK_PERM TSval=1143343288 TSecr=0 WS=128"
"140","0.608852007","74","36:5d:bc:ac:12:b1","fa:35:21:08:95:e1","172.20.0.2","172.20.0.3","TCP","4433 → 47320 [SYN, ACK] Seq=0 Ack=1 Win=65160 Len=0 MSS=1460 SACK_PERM TSval=1334259083 TSecr=1143343288 WS=128"
"141","0.608870888","66","fa:35:21:08:95:e1","36:5d:bc:ac:12:b1","172.20.0.3","172.20.0.2","TCP","47320 → 4433 [ACK] Seq=1 Ack=1 Win=64256 Len=0 TSval=1143343288 TSecr=1334259083"
"142","0.608922974","2189","fa:35:21:08:95:e1","36:5d:bc:ac:12:b1","172.20.0.3","172.20.0.2","TLSv1.2","Client Hello"
"143","0.608927466","66","36:5d:bc:ac:12:b1","fa:35:21:08:95:e1","172.20.0.2","172.20.0.3","TCP","4433 → 47320 [ACK] Seq=1 Ack=2124 Win=64128 Len=0 TSval=1334259083 TSecr=1143343288"
"144","0.620695484","2676","36:5d:bc:ac:12:b1","fa:35:21:08:95:e1","172.20.0.2","172.20.0.3","TLSv1.3","Server Hello, Change Cipher Spec, Application Data, Application Data, Application Data, Application Data"
"145","0.620737984","66","fa:35:21:08:95:e1","36:5d:bc:ac:12:b1","172.20.0.3","172.20.0.2","TCP","47320 → 4433 [ACK] Seq=2124 Ack=2611 Win=64128 Len=0 TSval=1143343300 TSecr=1334259095"
"146","0.630012352","146","fa:35:21:08:95:e1","36:5d:bc:ac:12:b1","172.20.0.3","172.20.0.2","TLSv1.3","Change Cipher Spec, Application Data"
"147","0.630080262","66","fa:35:21:08:95:e1","36:5d:bc:ac:12:b1","172.20.0.3","172.20.0.2","TCP","47320 → 4433 [RST, ACK] Seq=2204 Ack=2611 Win=64128 Len=0 TSval=1143343309 TSecr=1334259095"
"148","0.646004870","74","fa:35:21:08:95:e1","36:5d:bc:ac:12:b1","172.20.0.3","172.20.0.2","TCP","47324 → 4433 [SYN] Seq=0 Win=64240 Len=0 MSS=1460 SACK_PERM TSval=1143343325 TSecr=0 WS=128"
"149","0.646029423","74","36:5d:bc:ac:12:b1","fa:35:21:08:95:e1","172.20.0.2","172.20.0.3","TCP","4433 → 47324 [SYN, ACK] Seq=0 Ack=1 Win=65160 Len=0 MSS=1460 SACK_PERM TSval=1334259120 TSecr=1143343325 WS=128"
"150","0.646046040","66","fa:35:21:08:95:e1","36:5d:bc:ac:12:b1","172.20.0.3","172.20.0.2","TCP","47324 → 4433 [ACK] Seq=1 Ack=1 Win=64256 Len=0 TSval=1143343325 TSecr=1334259120"
"151","0.646088366","2189","fa:35:21:08:95:e1","36:5d:bc:ac:12:b1","172.20.0.3","172.20.0.2","TLSv1.2","Client Hello"
"152","0.646094136","66","36:5d:bc:ac:12:b1","fa:35:21:08:95:e1","172.20.0.2","172.20.0.3","TCP","4433 → 47324 [ACK] Seq=1 Ack=2124 Win=64128 Len=0 TSval=1334259120 TSecr=1143343325"
"153","0.657799901","2677","36:5d:bc:ac:12:b1","fa:35:21:08:95:e1","172.20.0.2","172.20.0.3","TLSv1.3","Server Hello, Change Cipher Spec, Application Data, Application Data, Application Data, Application Data"
"154","0.657839588","66","fa:35:21:08:95:e1","36:5d:bc:ac:12:b1","172.20.0.3","172.20.0.2","TCP","47324 → 4433 [ACK] Seq=2124 Ack=2612 Win=64128 Len=0 TSval=1143343337 TSecr=1334259132"
"155","0.666942733","146","fa:35:21:08:95:e1","36:5d:bc:ac:12:b1","172.20.0.3","172.20.0.2","TLSv1.3","Change Cipher Spec, Application Data"
"156","0.667012764","66","fa:35:21:08:95:e1","36:5d:bc:ac:12:b1","172.20.0.3","172.20.0.2","TCP","47324 → 4433 [RST, ACK] Seq=2204 Ack=2612 Win=64128 Len=0 TSval=1143343346 TSecr=1334259132"
"157","0.684104878","74","fa:35:21:08:95:e1","36:5d:bc:ac:12:b1","172.20.0.3","172.20.0.2","TCP","47340 → 4433 [SYN] Seq=0 Win=64240 Len=0 MSS=1460 SACK_PERM TSval=1143343363 TSecr=0 WS=128"
"158","0.684133421","74","36:5d:bc:ac:12:b1","fa:35:21:08:95:e1","172.20.0.2","172.20.0.3","TCP","4433 → 47340 [SYN, ACK] Seq=0 Ack=1 Win=65160 Len=0 MSS=1460 SACK_PERM TSval=1334259158 TSecr=1143343363 WS=128"
"159","0.684154308","66","fa:35:21:08:95:e1","36:5d:bc:ac:12:b1","172.20.0.3","172.20.0.2","TCP","47340 → 4433 [ACK] Seq=1 Ack=1 Win=64256 Len=0 TSval=1143343363 TSecr=1334259158"
"160","0.684205125","2189","fa:35:21:08:95:e1","36:5d:bc:ac:12:b1","172.20.0.3","172.20.0.2","TLSv1.2","Client Hello"
"161","0.684211118","66","36:5d:bc:ac:12:b1","fa:35:21:08:95:e1","172.20.0.2","172.20.0.3","TCP","4433 → 47340 [ACK] Seq=1 Ack=2124 Win=64128 Len=0 TSval=1334259158 TSecr=1143343363"
"162","0.696164663","2677","36:5d:bc:ac:12:b1","fa:35:21:08:95:e1","172.20.0.2","172.20.0.3","TLSv1.3","Server Hello, Change Cipher Spec, Application Data, Application Data, Application Data, Application Data"
"163","0.696223215","66","fa:35:21:08:95:e1","36:5d:bc:ac:12:b1","172.20.0.3","172.20.0.2","TCP","47340 → 4433 [ACK] Seq=2124 Ack=2612 Win=64128 Len=0 TSval=1143343375 TSecr=1334259170"
"164","0.710871604","146","fa:35:21:08:95:e1","36:5d:bc:ac:12:b1","172.20.0.3","172.20.0.2","TLSv1.3","Change Cipher Spec, Application Data"
"165","0.711004046","66","fa:35:21:08:95:e1","36:5d:bc:ac:12:b1","172.20.0.3","172.20.0.2","TCP","47340 → 4433 [RST, ACK] Seq=2204 Ack=2612 Win=64128 Len=0 TSval=1143343390 TSecr=1334259170"
"166","0.728092973","74","fa:35:21:08:95:e1","36:5d:bc:ac:12:b1","172.20.0.3","172.20.0.2","TCP","47346 → 4433 [SYN] Seq=0 Win=64240 Len=0 MSS=1460 SACK_PERM TSval=1143343407 TSecr=0 WS=128"
"167","0.728125570","74","36:5d:bc:ac:12:b1","fa:35:21:08:95:e1","172.20.0.2","172.20.0.3","TCP","4433 → 47346 [SYN, ACK] Seq=0 Ack=1 Win=65160 Len=0 MSS=1460 SACK_PERM TSval=1334259202 TSecr=1143343407 WS=128"
"168","0.728153111","66","fa:35:21:08:95:e1","36:5d:bc:ac:12:b1","172.20.0.3","172.20.0.2","TCP","47346 → 4433 [ACK] Seq=1 Ack=1 Win=64256 Len=0 TSval=1143343407 TSecr=1334259202"
"169","0.728206007","2189","fa:35:21:08:95:e1","36:5d:bc:ac:12:b1","172.20.0.3","172.20.0.2","TLSv1.2","Client Hello"
"170","0.728212835","66","36:5d:bc:ac:12:b1","fa:35:21:08:95:e1","172.20.0.2","172.20.0.3","TCP","4433 → 47346 [ACK] Seq=1 Ack=2124 Win=64128 Len=0 TSval=1334259202 TSecr=1143343407"
"171","0.740406386","2677","36:5d:bc:ac:12:b1","fa:35:21:08:95:e1","172.20.0.2","172.20.0.3","TLSv1.3","Server Hello, Change Cipher Spec, Application Data, Application Data, Application Data, Application Data"
"172","0.740458525","66","fa:35:21:08:95:e1","36:5d:bc:ac:12:b1","172.20.0.3","172.20.0.2","TCP","47346 → 4433 [ACK] Seq=2124 Ack=2612 Win=64128 Len=0 TSval=1143343420 TSecr=1334259215"
"173","0.749848336","146","fa:35:21:08:95:e1","36:5d:bc:ac:12:b1","172.20.0.3","172.20.0.2","TLSv1.3","Change Cipher Spec, Application Data"
"174","0.749935211","66","fa:35:21:08:95:e1","36:5d:bc:ac:12:b1","172.20.0.3","172.20.0.2","TCP","47346 → 4433 [RST, ACK] Seq=2204 Ack=2612 Win=64128 Len=0 TSval=1143343429 TSecr=1334259215"
"175","0.772608262","74","fa:35:21:08:95:e1","36:5d:bc:ac:12:b1","172.20.0.3","172.20.0.2","TCP","47356 → 4433 [SYN] Seq=0 Win=64240 Len=0 MSS=1460 SACK_PERM TSval=1143343452 TSecr=0 WS=128"
"176","0.772651470","74","36:5d:bc:ac:12:b1","fa:35:21:08:95:e1","172.20.0.2","172.20.0.3","TCP","4433 → 47356 [SYN, ACK] Seq=0 Ack=1 Win=65160 Len=0 MSS=1460 SACK_PERM TSval=1334259247 TSecr=1143343452 WS=128"
"177","0.772679597","66","fa:35:21:08:95:e1","36:5d:bc:ac:12:b1","172.20.0.3","172.20.0.2","TCP","47356 → 4433 [ACK] Seq=1 Ack=1 Win=64256 Len=0 TSval=1143343452 TSecr=1334259247"
"178","0.772748341","2189","fa:35:21:08:95:e1","36:5d:bc:ac:12:b1","172.20.0.3","172.20.0.2","TLSv1.2","Client Hello"
"179","0.772759511","66","36:5d:bc:ac:12:b1","fa:35:21:08:95:e1","172.20.0.2","172.20.0.3","TCP","4433 → 47356 [ACK] Seq=1 Ack=2124 Win=64128 Len=0 TSval=1334259247 TSecr=1143343452"
"180","0.784843853","2676","36:5d:bc:ac:12:b1","fa:35:21:08:95:e1","172.20.0.2","172.20.0.3","TLSv1.3","Server Hello, Change Cipher Spec, Application Data, Application Data, Application Data, Application Data"
"181","0.784895299","66","fa:35:21:08:95:e1","36:5d:bc:ac:12:b1","172.20.0.3","172.20.0.2","TCP","47356 → 4433 [ACK] Seq=2124 Ack=2611 Win=64128 Len=0 TSval=1143343464 TSecr=1334259259"
"182","0.794524133","146","fa:35:21:08:95:e1","36:5d:bc:ac:12:b1","172.20.0.3","172.20.0.2","TLSv1.3","Change Cipher Spec, Application Data"
"183","0.794602128","66","fa:35:21:08:95:e1","36:5d:bc:ac:12:b1","172.20.0.3","172.20.0.2","TCP","47356 → 4433 [RST, ACK] Seq=2204 Ack=2611 Win=64128 Len=0 TSval=1143343474 TSecr=1334259259"
"184","0.812539595","74","fa:35:21:08:95:e1","36:5d:bc:ac:12:b1","172.20.0.3","172.20.0.2","TCP","47370 → 4433 [SYN] Seq=0 Win=64240 Len=0 MSS=1460 SACK_PERM TSval=1143343492 TSecr=0 WS=128"
"185","0.812567863","74","36:5d:bc:ac:12:b1","fa:35:21:08:95:e1","172.20.0.2","172.20.0.3","TCP","4433 → 47370 [SYN, ACK] Seq=0 Ack=1 Win=65160 Len=0 MSS=1460 SACK_PERM TSval=1334259287 TSecr=1143343492 WS=128"
"186","0.812585589","66","fa:35:21:08:95:e1","36:5d:bc:ac:12:b1","172.20.0.3","172.20.0.2","TCP","47370 → 4433 [ACK] Seq=1 Ack=1 Win=64256 Len=0 TSval=1143343492 TSecr=1334259287"
"187","0.812635217","2189","fa:35:21:08:95:e1","36:5d:bc:ac:12:b1","172.20.0.3","172.20.0.2","TLSv1.2","Client Hello"
"188","0.812641061","66","36:5d:bc:ac:12:b1","fa:35:21:08:95:e1","172.20.0.2","172.20.0.3","TCP","4433 → 47370 [ACK] Seq=1 Ack=2124 Win=64128 Len=0 TSval=1334259287 TSecr=1143343492"
"189","0.824959924","2675","36:5d:bc:ac:12:b1","fa:35:21:08:95:e1","172.20.0.2","172.20.0.3","TLSv1.3","Server Hello, Change Cipher Spec, Application Data, Application Data, Application Data, Application Data"
"190","0.825017993","66","fa:35:21:08:95:e1","36:5d:bc:ac:12:b1","172.20.0.3","172.20.0.2","TCP","47370 → 4433 [ACK] Seq=2124 Ack=2610 Win=64128 Len=0 TSval=1143343504 TSecr=1334259299"
"191","0.834424811","146","fa:35:21:08:95:e1","36:5d:bc:ac:12:b1","172.20.0.3","172.20.0.2","TLSv1.3","Change Cipher Spec, Application Data"
"192","0.834512276","66","fa:35:21:08:95:e1","36:5d:bc:ac:12:b1","172.20.0.3","172.20.0.2","TCP","47370 → 4433 [RST, ACK] Seq=2204 Ack=2610 Win=64128 Len=0 TSval=1143343514 TSecr=1334259299"
"193","0.850789494","74","fa:35:21:08:95:e1","36:5d:bc:ac:12:b1","172.20.0.3","172.20.0.2","TCP","47374 → 4433 [SYN] Seq=0 Win=64240 Len=0 MSS=1460 SACK_PERM TSval=1143343530 TSecr=0 WS=128"
"194","0.850820206","74","36:5d:bc:ac:12:b1","fa:35:21:08:95:e1","172.20.0.2","172.20.0.3","TCP","4433 → 47374 [SYN, ACK] Seq=0 Ack=1 Win=65160 Len=0 MSS=1460 SACK_PERM TSval=1334259325 TSecr=1143343530 WS=128"
"195","0.850839450","66","fa:35:21:08:95:e1","36:5d:bc:ac:12:b1","172.20.0.3","172.20.0.2","TCP","47374 → 4433 [ACK] Seq=1 Ack=1 Win=64256 Len=0 TSval=1143343530 TSecr=1334259325"
"196","0.850886451","2189","fa:35:21:08:95:e1","36:5d:bc:ac:12:b1","172.20.0.3","172.20.0.2","TLSv1.2","Client Hello"
"197","0.854293057","741","fa:35:21:08:95:e1","36:5d:bc:ac:12:b1","172.20.0.3","172.20.0.2","TCP","[TCP Retransmission] 47374 → 4433 [PSH, ACK] Seq=1449 Ack=1 Win=64256 Len=675 TSval=1143343534 TSecr=1334259325"
"198","0.854300781","78","36:5d:bc:ac:12:b1","fa:35:21:08:95:e1","172.20.0.2","172.20.0.3","TCP","4433 → 47374 [ACK] Seq=1 Ack=2124 Win=64128 Len=0 TSval=1334259329 TSecr=1143343534 SLE=1449 SRE=2124"
"199","0.863578430","2677","36:5d:bc:ac:12:b1","fa:35:21:08:95:e1","172.20.0.2","172.20.0.3","TLSv1.3","Server Hello, Change Cipher Spec, Application Data, Application Data, Application Data, Application Data"
"200","0.863610554","66","fa:35:21:08:95:e1","36:5d:bc:ac:12:b1","172.20.0.3","172.20.0.2","TCP","47374 → 4433 [ACK] Seq=2124 Ack=2612 Win=64128 Len=0 TSval=1143343543 TSecr=1334259338"
"201","0.872697922","146","fa:35:21:08:95:e1","36:5d:bc:ac:12:b1","172.20.0.3","172.20.0.2","TLSv1.3","Change Cipher Spec, Application Data"
"202","0.872771078","66","fa:35:21:08:95:e1","36:5d:bc:ac:12:b1","172.20.0.3","172.20.0.2","TCP","47374 → 4433 [RST, ACK] Seq=2204 Ack=2612 Win=64128 Len=0 TSval=1143343552 TSecr=1334259338"
"203","0.888458269","74","fa:35:21:08:95:e1","36:5d:bc:ac:12:b1","172.20.0.3","172.20.0.2","TCP","47376 → 4433 [SYN] Seq=0 Win=64240 Len=0 MSS=1460 SACK_PERM TSval=1143343568 TSecr=0 WS=128"
"204","0.888486513","74","36:5d:bc:ac:12:b1","fa:35:21:08:95:e1","172.20.0.2","172.20.0.3","TCP","4433 → 47376 [SYN, ACK] Seq=0 Ack=1 Win=65160 Len=0 MSS=1460 SACK_PERM TSval=1334259363 TSecr=1143343568 WS=128"
"205","0.888504194","66","fa:35:21:08:95:e1","36:5d:bc:ac:12:b1","172.20.0.3","172.20.0.2","TCP","47376 → 4433 [ACK] Seq=1 Ack=1 Win=64256 Len=0 TSval=1143343568 TSecr=1334259363"
"206","0.888543602","2189","fa:35:21:08:95:e1","36:5d:bc:ac:12:b1","172.20.0.3","172.20.0.2","TLSv1.2","Client Hello"
"207","0.892295011","741","fa:35:21:08:95:e1","36:5d:bc:ac:12:b1","172.20.0.3","172.20.0.2","TCP","[TCP Retransmission] 47376 → 4433 [PSH, ACK] Seq=1449 Ack=1 Win=64256 Len=675 TSval=1143343572 TSecr=1334259363"
"208","0.892306307","78","36:5d:bc:ac:12:b1","fa:35:21:08:95:e1","172.20.0.2","172.20.0.3","TCP","4433 → 47376 [ACK] Seq=1 Ack=2124 Win=64128 Len=0 TSval=1334259367 TSecr=1143343572 SLE=1449 SRE=2124"
"209","0.900922678","2676","36:5d:bc:ac:12:b1","fa:35:21:08:95:e1","172.20.0.2","172.20.0.3","TLSv1.3","Server Hello, Change Cipher Spec, Application Data, Application Data, Application Data, Application Data"
"210","0.900965660","66","fa:35:21:08:95:e1","36:5d:bc:ac:12:b1","172.20.0.3","172.20.0.2","TCP","47376 → 4433 [ACK] Seq=2124 Ack=2611 Win=64128 Len=0 TSval=1143343580 TSecr=1334259375"
"211","0.910043409","146","fa:35:21:08:95:e1","36:5d:bc:ac:12:b1","172.20.0.3","172.20.0.2","TLSv1.3","Change Cipher Spec, Application Data"
"212","0.910120409","66","fa:35:21:08:95:e1","36:5d:bc:ac:12:b1","172.20.0.3","172.20.0.2","TCP","47376 → 4433 [RST, ACK] Seq=2204 Ack=2611 Win=64128 Len=0 TSval=1143343589 TSecr=1334259375"
"213","0.925830180","74","fa:35:21:08:95:e1","36:5d:bc:ac:12:b1","172.20.0.3","172.20.0.2","TCP","47390 → 4433 [SYN] Seq=0 Win=64240 Len=0 MSS=1460 SACK_PERM TSval=1143343605 TSecr=0 WS=128"
"214","1.000476678","42","fa:35:21:08:95:e1","ff:ff:ff:ff:ff:ff",,,"ARP","ARP Announcement for 172.20.0.3"
"215","1.973359640","74","36:5d:bc:ac:12:b1","fa:35:21:08:95:e1","172.20.0.2","172.20.0.3","TCP","4433 → 47390 [SYN, ACK] Seq=0 Ack=1 Win=65160 Len=0 MSS=1460 SACK_PERM TSval=1334260448 TSecr=1143343605 WS=128"
"216","1.973394544","74","fa:35:21:08:95:e1","36:5d:bc:ac:12:b1","172.20.0.3","172.20.0.2","TCP","[TCP Retransmission] 47390 → 4433 [SYN] Seq=0 Win=64240 Len=0 MSS=1460 SACK_PERM TSval=1143344653 TSecr=0 WS=128"
"217","1.973468678","66","fa:35:21:08:95:e1","36:5d:bc:ac:12:b1","172.20.0.3","172.20.0.2","TCP","47390 → 4433 [ACK] Seq=1 Ack=1 Win=64256 Len=0 TSval=1143344653 TSecr=1334260448"
"218","1.973609324","2189","fa:35:21:08:95:e1","36:5d:bc:ac:12:b1","172.20.0.3","172.20.0.2","TLSv1.2","Client Hello"
"219","1.973622779","66","36:5d:bc:ac:12:b1","fa:35:21:08:95:e1","172.20.0.2","172.20.0.3","TCP","4433 → 47390 [ACK] Seq=1 Ack=2124 Win=64128 Len=0 TSval=1334260448 TSecr=1143344653"
"220","1.985657699","1514","36:5d:bc:ac:12:b1","fa:35:21:08:95:e1","172.20.0.2","172.20.0.3","SSL",""
"221","1.985696193","66","fa:35:21:08:95:e1","36:5d:bc:ac:12:b1","172.20.0.3","172.20.0.2","TCP","47390 → 4433 [ACK] Seq=2124 Ack=1449 Win=64128 Len=0 TSval=1143344665 TSecr=1334260460"
"222","1.985705654","1229","36:5d:bc:ac:12:b1","fa:35:21:08:95:e1","172.20.0.2","172.20.0.3","TLSv1.3","Server Hello, Change Cipher Spec, Application Data, Application Data, Application Data, Application Data"
"223","1.985711640","66","fa:35:21:08:95:e1","36:5d:bc:ac:12:b1","172.20.0.3","172.20.0.2","TCP","47390 → 4433 [ACK] Seq=2124 Ack=2612 Win=64128 Len=0 TSval=1143344665 TSecr=1334260460"
"224","1.995647127","146","fa:35:21:08:95:e1","36:5d:bc:ac:12:b1","172.20.0.3","172.20.0.2","TLSv1.3","Change Cipher Spec, Application Data"
