frame.number,frame.time_relative,frame.len,eth.src,eth.dst,ip.src,ip.dst,_ws.col.protocol,_ws.col.info
"1","0.000000000","42","2e:4c:04:eb:dd:8e","ff:ff:ff:ff:ff:ff",,,"ARP","ARP Announcement for 172.20.0.3"
"2","0.034739125","42","2e:4c:04:eb:dd:8e","ff:ff:ff:ff:ff:ff",,,"ARP","Who has 172.20.0.2? Tell 172.20.0.3"
"3","0.034772088","42","32:43:dd:69:a3:8b","2e:4c:04:eb:dd:8e",,,"ARP","172.20.0.2 is at 32:43:dd:69:a3:8b"
"4","0.034780961","74","2e:4c:04:eb:dd:8e","32:43:dd:69:a3:8b","172.20.0.3","172.20.0.2","TCP","57838 → 4433 [SYN] Seq=0 Win=64240 Len=0 MSS=1460 SACK_PERM TSval=1142902286 TSecr=0 WS=128"
"5","0.034811765","74","32:43:dd:69:a3:8b","2e:4c:04:eb:dd:8e","172.20.0.2","172.20.0.3","TCP","4433 → 57838 [SYN, ACK] Seq=0 Ack=1 Win=65160 Len=0 MSS=1460 SACK_PERM TSval=1333818081 TSecr=1142902286 WS=128"
"6","0.034836808","66","2e:4c:04:eb:dd:8e","32:43:dd:69:a3:8b","172.20.0.3","172.20.0.2","TCP","57838 → 4433 [ACK] Seq=1 Ack=1 Win=64256 Len=0 TSval=1142902286 TSecr=1333818081"
"7","0.034899563","1769","2e:4c:04:eb:dd:8e","32:43:dd:69:a3:8b","172.20.0.3","172.20.0.2","TLSv1.2","Client Hello"
"8","0.034907274","66","32:43:dd:69:a3:8b","2e:4c:04:eb:dd:8e","172.20.0.2","172.20.0.3","TCP","4433 → 57838 [ACK] Seq=1 Ack=1704 Win=64128 Len=0 TSval=1333818081 TSecr=1142902286"
"9","0.043952458","2054","32:43:dd:69:a3:8b","2e:4c:04:eb:dd:8e","172.20.0.2","172.20.0.3","TLSv1.3","Server Hello, Change Cipher Spec, Application Data, Application Data, Application Data, Application Data"
"10","0.044011306","66","2e:4c:04:eb:dd:8e","32:43:dd:69:a3:8b","172.20.0.3","172.20.0.2","TCP","57838 → 4433 [ACK] Seq=1704 Ack=1989 Win=64128 Len=0 TSval=1142902295 TSecr=1333818090"
"11","0.049442576","146","2e:4c:04:eb:dd:8e","32:43:dd:69:a3:8b","172.20.0.3","172.20.0.2","TLSv1.3","Change Cipher Spec, Application Data"
"12","0.049509679","66","2e:4c:04:eb:dd:8e","32:43:dd:69:a3:8b","172.20.0.3","172.20.0.2","TCP","57838 → 4433 [RST, ACK] Seq=1784 Ack=1989 Win=64128 Len=0 TSval=1142902301 TSecr=1333818090"
"13","0.064407943","74","2e:4c:04:eb:dd:8e","32:43:dd:69:a3:8b","172.20.0.3","172.20.0.2","TCP","57854 → 4433 [SYN] Seq=0 Win=64240 Len=0 MSS=1460 SACK_PERM TSval=1142902316 TSecr=0 WS=128"
"14","0.064436130","74","32:43:dd:69:a3:8b","2e:4c:04:eb:dd:8e","172.20.0.2","172.20.0.3","TCP","4433 → 57854 [SYN, ACK] Seq=0 Ack=1 Win=65160 Len=0 MSS=1460 SACK_PERM TSval=1333818111 TSecr=1142902316 WS=128"
"15","0.064455070","66","2e:4c:04:eb:dd:8e","32:43:dd:69:a3:8b","172.20.0.3","172.20.0.2","TCP","57854 → 4433 [ACK] Seq=1 Ack=1 Win=64256 Len=0 TSval=1142902316 TSecr=1333818111"
"16","0.064495326","1769","2e:4c:04:eb:dd:8e","32:43:dd:69:a3:8b","172.20.0.3","172.20.0.2","TLSv1.2","Client Hello"
"17","0.064501477","66","32:43:dd:69:a3:8b","2e:4c:04:eb:dd:8e","172.20.0.2","172.20.0.3","TCP","4433 → 57854 [ACK] Seq=1 Ack=1704 Win=64128 Len=0 TSval=1333818111 TSecr=1142902316"
"18","0.070499924","2053","32:43:dd:69:a3:8b","2e:4c:04:eb:dd:8e","172.20.0.2","172.20.0.3","TLSv1.3","Server Hello, Change Cipher Spec, Application Data, Application Data, Application Data, Application Data"
"19","0.070548508","66","2e:4c:04:eb:dd:8e","32:43:dd:69:a3:8b","172.20.0.3","172.20.0.2","TCP","57854 → 4433 [ACK] Seq=1704 Ack=1988 Win=64128 Len=0 TSval=1142902322 TSecr=1333818117"
"20","0.075766628","146","2e:4c:04:eb:dd:8e","32:43:dd:69:a3:8b","172.20.0.3","172.20.0.2","TLSv1.3","Change Cipher Spec, Application Data"
"21","0.075825455","66","2e:4c:04:eb:dd:8e","32:43:dd:69:a3:8b","172.20.0.3","172.20.0.2","TCP","57854 → 4433 [RST, ACK] Seq=1784 Ack=1988 Win=64128 Len=0 TSval=1142902327 TSecr=1333818117"
"22","0.090087039","74","2e:4c:04:eb:dd:8e","32:43:dd:69:a3:8b","172.20.0.3","172.20.0.2","TCP","57858 → 4433 [SYN] Seq=0 Win=64240 Len=0 MSS=1460 SACK_PERM TSval=1142902341 TSecr=0 WS=128"
"23","0.090117220","74","32:43:dd:69:a3:8b","2e:4c:04:eb:dd:8e","172.20.0.2","172.20.0.3","TCP","4433 → 57858 [SYN, ACK] Seq=0 Ack=1 Win=65160 Len=0 MSS=1460 SACK_PERM TSval=1333818136 TSecr=1142902341 WS=128"
"24","0.090134444","66","2e:4c:04:eb:dd:8e","32:43:dd:69:a3:8b","172.20.0.3","172.20.0.2","TCP","57858 → 4433 [ACK] Seq=1 Ack=1 Win=64256 Len=0 TSval=1142902341 TSecr=1333818136"
"25","0.090173874","1769","2e:4c:04:eb:dd:8e","32:43:dd:69:a3:8b","172.20.0.3","172.20.0.2","TLSv1.2","Client Hello"
"26","0.090179260","66","32:43:dd:69:a3:8b","2e:4c:04:eb:dd:8e","172.20.0.2","172.20.0.3","TCP","4433 → 57858 [ACK] Seq=1 Ack=1704 Win=64128 Len=0 TSval=1333818136 TSecr=1142902341"
"27","0.096125122","2052","32:43:dd:69:a3:8b","2e:4c:04:eb:dd:8e","172.20.0.2","172.20.0.3","TLSv1.3","Server Hello, Change Cipher Spec, Application Data, Application Data, Application Data, Application Data"
"28","0.096154203","66","2e:4c:04:eb:dd:8e","32:43:dd:69:a3:8b","172.20.0.3","172.20.0.2","TCP","57858 → 4433 [ACK] Seq=1704 Ack=1987 Win=64128 Len=0 TSval=1142902347 TSecr=1333818142"
"29","0.101601340","146","2e:4c:04:eb:dd:8e","32:43:dd:69:a3:8b","172.20.0.3","172.20.0.2","TLSv1.3","Change Cipher Spec, Application Data"
"30","0.101667291","66","2e:4c:04:eb:dd:8e","32:43:dd:69:a3:8b","172.20.0.3","172.20.0.2","TCP","57858 → 4433 [RST, ACK] Seq=1784 Ack=1987 Win=64128 Len=0 TSval=1142902353 TSecr=1333818142"
"31","0.116275910","74","2e:4c:04:eb:dd:8e","32:43:dd:69:a3:8b","172.20.0.3","172.20.0.2","TCP","57874 → 4433 [SYN] Seq=0 Win=64240 Len=0 MSS=1460 SACK_PERM TSval=1142902368 TSecr=0 WS=128"
"32","0.116303096","74","32:43:dd:69:a3:8b","2e:4c:04:eb:dd:8e","172.20.0.2","172.20.0.3","TCP","4433 → 57874 [SYN, ACK] Seq=0 Ack=1 Win=65160 Len=0 MSS=1460 SACK_PERM TSval=1333818163 TSecr=1142902368 WS=128"
"33","0.116323252","66","2e:4c:04:eb:dd:8e","32:43:dd:69:a3:8b","172.20.0.3","172.20.0.2","TCP","57874 → 4433 [ACK] Seq=1 Ack=1 Win=64256 Len=0 TSval=1142902368 TSecr=1333818163"
"34","0.116368376","1769","2e:4c:04:eb:dd:8e","32:43:dd:69:a3:8b","172.20.0.3","172.20.0.2","TLSv1.2","Client Hello"
"35","0.116372644","66","32:43:dd:69:a3:8b","2e:4c:04:eb:dd:8e","172.20.0.2","172.20.0.3","TCP","4433 → 57874 [ACK] Seq=1 Ack=1704 Win=64128 Len=0 TSval=1333818163 TSecr=1142902368"
"36","0.122592911","2053","32:43:dd:69:a3:8b","2e:4c:04:eb:dd:8e","172.20.0.2","172.20.0.3","TLSv1.3","Server Hello, Change Cipher Spec, Application Data, Application Data, Application Data, Application Data"
"37","0.122635041","66","2e:4c:04:eb:dd:8e","32:43:dd:69:a3:8b","172.20.0.3","172.20.0.2","TCP","57874 → 4433 [ACK] Seq=1704 Ack=1988 Win=64128 Len=0 TSval=1142902374 TSecr=1333818169"
"38","0.128852576","146","2e:4c:04:eb:dd:8e","32:43:dd:69:a3:8b","172.20.0.3","172.20.0.2","TLSv1.3","Change Cipher Spec, Application Data"
"39","0.128922684","66","2e:4c:04:eb:dd:8e","32:43:dd:69:a3:8b","172.20.0.3","172.20.0.2","TCP","57874 → 4433 [RST, ACK] Seq=1784 Ack=1988 Win=64128 Len=0 TSval=1142902380 TSecr=1333818169"
"40","0.143795047","74","2e:4c:04:eb:dd:8e","32:43:dd:69:a3:8b","172.20.0.3","172.20.0.2","TCP","57876 → 4433 [SYN] Seq=0 Win=64240 Len=0 MSS=1460 SACK_PERM TSval=1142902395 TSecr=0 WS=128"
"41","0.143819607","74","32:43:dd:69:a3:8b","2e:4c:04:eb:dd:8e","172.20.0.2","172.20.0.3","TCP","4433 → 57876 [SYN, ACK] Seq=0 Ack=1 Win=65160 Len=0 MSS=1460 SACK_PERM TSval=1333818190 TSecr=1142902395 WS=128"
"42","0.143837453","66","2e:4c:04:eb:dd:8e","32:43:dd:69:a3:8b","172.20.0.3","172.20.0.2","TCP","57876 → 4433 [ACK] Seq=1 Ack=1 Win=64256 Len=0 TSval=1142902395 TSecr=1333818190"
"43","0.143879813","1769","2e:4c:04:eb:dd:8e","32:43:dd:69:a3:8b","172.20.0.3","172.20.0.2","TLSv1.2","Client Hello"
"44","0.143885915","66","32:43:dd:69:a3:8b","2e:4c:04:eb:dd:8e","172.20.0.2","172.20.0.3","TCP","4433 → 57876 [ACK] Seq=1 Ack=1704 Win=64128 Len=0 TSval=1333818190 TSecr=1142902395"
"45","0.149955943","2053","32:43:dd:69:a3:8b","2e:4c:04:eb:dd:8e","172.20.0.2","172.20.0.3","TLSv1.3","Server Hello, Change Cipher Spec, Application Data, Application Data, Application Data, Application Data"
"46","0.149990873","66","2e:4c:04:eb:dd:8e","32:43:dd:69:a3:8b","172.20.0.3","172.20.0.2","TCP","57876 → 4433 [ACK] Seq=1704 Ack=1988 Win=64128 Len=0 TSval=1142902401 TSecr=1333818196"
"47","0.155161103","146","2e:4c:04:eb:dd:8e","32:43:dd:69:a3:8b","172.20.0.3","172.20.0.2","TLSv1.3","Change Cipher Spec, Application Data"
"48","0.155237429","66","2e:4c:04:eb:dd:8e","32:43:dd:69:a3:8b","172.20.0.3","172.20.0.2","TCP","57876 → 4433 [RST, ACK] Seq=1784 Ack=1988 Win=64128 Len=0 TSval=1142902407 TSecr=1333818196"
"49","0.169495737","74","2e:4c:04:eb:dd:8e","32:43:dd:69:a3:8b","172.20.0.3","172.20.0.2","TCP","57884 → 4433 [SYN] Seq=0 Win=64240 Len=0 MSS=1460 SACK_PERM TSval=1142902421 TSecr=0 WS=128"
"50","0.169518264","74","32:43:dd:69:a3:8b","2e:4c:04:eb:dd:8e","172.20.0.2","172.20.0.3","TCP","4433 → 57884 [SYN, ACK] Seq=0 Ack=1 Win=65160 Len=0 MSS=1460 SACK_PERM TSval=1333818216 TSecr=1142902421 WS=128"
"51","0.169536091","66","2e:4c:04:eb:dd:8e","32:43:dd:69:a3:8b","172.20.0.3","172.20.0.2","TCP","57884 → 4433 [ACK] Seq=1 Ack=1 Win=64256 Len=0 TSval=1142902421 TSecr=1333818216"
"52","0.169579389","1769","2e:4c:04:eb:dd:8e","32:43:dd:69:a3:8b","172.20.0.3","172.20.0.2","TLSv1.2","Client Hello"
"53","0.169583748","66","32:43:dd:69:a3:8b","2e:4c:04:eb:dd:8e","172.20.0.2","172.20.0.3","TCP","4433 → 57884 [ACK] Seq=1 Ack=1704 Win=64128 Len=0 TSval=1333818216 TSecr=1142902421"
"54","0.175538814","2053","32:43:dd:69:a3:8b","2e:4c:04:eb:dd:8e","172.20.0.2","172.20.0.3","TLSv1.3","Server Hello, Change Cipher Spec, Application Data, Application Data, Application Data, Application Data"
"55","0.175576793","66","2e:4c:04:eb:dd:8e","32:43:dd:69:a3:8b","172.20.0.3","172.20.0.2","TCP","57884 → 4433 [ACK] Seq=1704 Ack=1988 Win=64128 Len=0 TSval=1142902427 TSecr=1333818222"
"56","0.180772850","146","2e:4c:04:eb:dd:8e","32:43:dd:69:a3:8b","172.20.0.3","172.20.0.2","TLSv1.3","Change Cipher Spec, Application Data"
"57","0.180831775","66","2e:4c:04:eb:dd:8e","32:43:dd:69:a3:8b","172.20.0.3","172.20.0.2","TCP","57884 → 4433 [RST, ACK] Seq=1784 Ack=1988 Win=64128 Len=0 TSval=1142902432 TSecr=1333818222"
"58","0.194849120","74","2e:4c:04:eb:dd:8e","32:43:dd:69:a3:8b","172.20.0.3","172.20.0.2","TCP","57896 → 4433 [SYN] Seq=0 Win=64240 Len=0 MSS=1460 SACK_PERM TSval=1142902446 TSecr=0 WS=128"
"59","0.194875664","74","32:43:dd:69:a3:8b","2e:4c:04:eb:dd:8e","172.20.0.2","172.20.0.3","TCP","4433 → 57896 [SYN, ACK] Seq=0 Ack=1 Win=65160 Len=0 MSS=1460 SACK_PERM TSval=1333818241 TSecr=1142902446 WS=128"
"60","0.194894590","66","2e:4c:04:eb:dd:8e","32:43:dd:69:a3:8b","172.20.0.3","172.20.0.2","TCP","57896 → 4433 [ACK] Seq=1 Ack=1 Win=64256 Len=0 TSval=1142902446 TSecr=1333818241"
"61","0.194938703","1769","2e:4c:04:eb:dd:8e","32:43:dd:69:a3:8b","172.20.0.3","172.20.0.2","TLSv1.2","Client Hello"
"62","0.194943573","66","32:43:dd:69:a3:8b","2e:4c:04:eb:dd:8e","172.20.0.2","172.20.0.3","TCP","4433 → 57896 [ACK] Seq=1 Ack=1704 Win=64128 Len=0 TSval=1333818241 TSecr=1142902446"
"63","0.200803257","2053","32:43:dd:69:a3:8b","2e:4c:04:eb:dd:8e","172.20.0.2","172.20.0.3","TLSv1.3","Server Hello, Change Cipher Spec, Application Data, Application Data, Application Data, Application Data"
"64","0.200831509","66","2e:4c:04:eb:dd:8e","32:43:dd:69:a3:8b","172.20.0.3","172.20.0.2","TCP","57896 → 4433 [ACK] Seq=1704 Ack=1988 Win=64128 Len=0 TSval=1142902452 TSecr=1333818247"
"65","0.205959441","146","2e:4c:04:eb:dd:8e","32:43:dd:69:a3:8b","172.20.0.3","172.20.0.2","TLSv1.3","Change Cipher Spec, Application Data"
"66","0.206039569","66","2e:4c:04:eb:dd:8e","32:43:dd:69:a3:8b","172.20.0.3","172.20.0.2","TCP","57896 → 4433 [RST, ACK] Seq=1784 Ack=1988 Win=64128 Len=0 TSval=1142902457 TSecr=1333818247"
"67","0.220951144","74","2e:4c:04:eb:dd:8e","32:43:dd:69:a3:8b","172.20.0.3","172.20.0.2","TCP","57904 → 4433 [SYN] Seq=0 Win=64240 Len=0 MSS=1460 SACK_PERM TSval=1142902472 TSecr=0 WS=128"
"68","0.220978945","74","32:43:dd:69:a3:8b","2e:4c:04:eb:dd:8e","172.20.0.2","172.20.0.3","TCP","4433 → 57904 [SYN, ACK] Seq=0 Ack=1 Win=65160 Len=0 MSS=1460 SACK_PERM TSval=1333818267 TSecr=1142902472 WS=128"
"69","0.221002779","66","2e:4c:04:eb:dd:8e","32:43:dd:69:a3:8b","172.20.0.3","172.20.0.2","TCP","57904 → 4433 [ACK] Seq=1 Ack=1 Win=64256 Len=0 TSval=1142902472 TSecr=1333818267"
"70","0.221054107","1769","2e:4c:04:eb:dd:8e","32:43:dd:69:a3:8b","172.20.0.3","172.20.0.2","TLSv1.2","Client Hello"
"71","0.221061494","66","32:43:dd:69:a3:8b","2e:4c:04:eb:dd:8e","172.20.0.2","172.20.0.3","TCP","4433 → 57904 [ACK] Seq=1 Ack=1704 Win=64128 Len=0 TSval=1333818267 TSecr=1142902472"
"72","0.226979135","2053","32:43:dd:69:a3:8b","2e:4c:04:eb:dd:8e","172.20.0.2","172.20.0.3","TLSv1.3","Server Hello, Change Cipher Spec, Application Data, Application Data, Application Data, Application Data"
"73","0.227008820","66","2e:4c:04:eb:dd:8e","32:43:dd:69:a3:8b","172.20.0.3","172.20.0.2","TCP","57904 → 4433 [ACK] Seq=1704 Ack=1988 Win=64128 Len=0 TSval=1142902478 TSecr=1333818273"
"74","0.232413296","146","2e:4c:04:eb:dd:8e","32:43:dd:69:a3:8b","172.20.0.3","172.20.0.2","TLSv1.3","Change Cipher Spec, Application Data"
"75","0.232465465","66","2e:4c:04:eb:dd:8e","32:43:dd:69:a3:8b","172.20.0.3","172.20.0.2","TCP","57904 → 4433 [RST, ACK] Seq=1784 Ack=1988 Win=64128 Len=0 TSval=1142902484 TSecr=1333818273"
"76","0.246991622","74","2e:4c:04:eb:dd:8e","32:43:dd:69:a3:8b","172.20.0.3","172.20.0.2","TCP","57906 → 4433 [SYN] Seq=0 Win=64240 Len=0 MSS=1460 SACK_PERM TSval=1142902498 TSecr=0 WS=128"
"77","0.247017148","74","32:43:dd:69:a3:8b","2e:4c:04:eb:dd:8e","172.20.0.2","172.20.0.3","TCP","4433 → 57906 [SYN, ACK] Seq=0 Ack=1 Win=65160 Len=0 MSS=1460 SACK_PERM TSval=1333818293 TSecr=1142902498 WS=128"
"78","0.247035419","66","2e:4c:04:eb:dd:8e","32:43:dd:69:a3:8b","172.20.0.3","172.20.0.2","TCP","57906 → 4433 [ACK] Seq=1 Ack=1 Win=64256 Len=0 TSval=1142902498 TSecr=1333818293"
"79","0.247078237","1769","2e:4c:04:eb:dd:8e","32:43:dd:69:a3:8b","172.20.0.3","172.20.0.2","TLSv1.2","Client Hello"
"80","0.247083408","66","32:43:dd:69:a3:8b","2e:4c:04:eb:dd:8e","172.20.0.2","172.20.0.3","TCP","4433 → 57906 [ACK] Seq=1 Ack=1704 Win=64128 Len=0 TSval=1333818293 TSecr=1142902498"
"81","0.253375683","2053","32:43:dd:69:a3:8b","2e:4c:04:eb:dd:8e","172.20.0.2","172.20.0.3","TLSv1.3","Server Hello, Change Cipher Spec, Application Data, Application Data, Application Data, Application Data"
"82","0.253412094","66","2e:4c:04:eb:dd:8e","32:43:dd:69:a3:8b","172.20.0.3","172.20.0.2","TCP","57906 → 4433 [ACK] Seq=1704 Ack=1988 Win=64128 Len=0 TSval=1142902505 TSecr=1333818300"
"83","0.258550315","146","2e:4c:04:eb:dd:8e","32:43:dd:69:a3:8b","172.20.0.3","172.20.0.2","TLSv1.3","Change Cipher Spec, Application Data"
"84","0.258607106","66","2e:4c:04:eb:dd:8e","32:43:dd:69:a3:8b","172.20.0.3","172.20.0.2","TCP","57906 → 4433 [RST, ACK] Seq=1784 Ack=1988 Win=64128 Len=0 TSval=1142902510 TSecr=1333818300"
"85","0.272787895","74","2e:4c:04:eb:dd:8e","32:43:dd:69:a3:8b","172.20.0.3","172.20.0.2","TCP","57920 → 4433 [SYN] Seq=0 Win=64240 Len=0 MSS=1460 SACK_PERM TSval=1142902524 TSecr=0 WS=128"
"86","0.272812168","74","32:43:dd:69:a3:8b","2e:4c:04:eb:dd:8e","172.20.0.2","172.20.0.3","TCP","4433 → 57920 [SYN, ACK] Seq=0 Ack=1 Win=65160 Len=0 MSS=1460 SACK_PERM TSval=1333818319 TSecr=1142902524 WS=128"
"87","0.272828475","66","2e:4c:04:eb:dd:8e","32:43:dd:69:a3:8b","172.20.0.3","172.20.0.2","TCP","57920 → 4433 [ACK] Seq=1 Ack=1 Win=64256 Len=0 TSval=1142902524 TSecr=1333818319"
"88","0.272868894","1769","2e:4c:04:eb:dd:8e","32:43:dd:69:a3:8b","172.20.0.3","172.20.0.2","TLSv1.2","Client Hello"
"89","0.272874140","66","32:43:dd:69:a3:8b","2e:4c:04:eb:dd:8e","172.20.0.2","172.20.0.3","TCP","4433 → 57920 [ACK] Seq=1 Ack=1704 Win=64128 Len=0 TSval=1333818319 TSecr=1142902524"
"90","0.278682434","2053","32:43:dd:69:a3:8b","2e:4c:04:eb:dd:8e","172.20.0.2","172.20.0.3","TLSv1.3","Server Hello, Change Cipher Spec, Application Data, Application Data, Application Data, Application Data"
"91","0.278711396","66","2e:4c:04:eb:dd:8e","32:43:dd:69:a3:8b","172.20.0.3","172.20.0.2","TCP","57920 → 4433 [ACK] Seq=1704 Ack=1988 Win=64128 Len=0 TSval=1142902530 TSecr=1333818325"
"92","0.283828246","146","2e:4c:04:eb:dd:8e","32:43:dd:69:a3:8b","172.20.0.3","172.20.0.2","TLSv1.3","Change Cipher Spec, Application Data"
"93","0.283886490","66","2e:4c:04:eb:dd:8e","32:43:dd:69:a3:8b","172.20.0.3","172.20.0.2","TCP","57920 → 4433 [RST, ACK] Seq=1784 Ack=1988 Win=64128 Len=0 TSval=1142902535 TSecr=1333818325"
"94","0.298099598","74","2e:4c:04:eb:dd:8e","32:43:dd:69:a3:8b","172.20.0.3","172.20.0.2","TCP","57930 → 4433 [SYN] Seq=0 Win=64240 Len=0 MSS=1460 SACK_PERM TSval=1142902549 TSecr=0 WS=128"
"95","0.298131297","74","32:43:dd:69:a3:8b","2e:4c:04:eb:dd:8e","172.20.0.2","172.20.0.3","TCP","4433 → 57930 [SYN, ACK] Seq=0 Ack=1 Win=65160 Len=0 MSS=1460 SACK_PERM TSval=1333818344 TSecr=1142902549 WS=128"
"96","0.298149715","66","2e:4c:04:eb:dd:8e","32:43:dd:69:a3:8b","172.20.0.3","172.20.0.2","TCP","57930 → 4433 [ACK] Seq=1 Ack=1 Win=64256 Len=0 TSval=1142902549 TSecr=1333818344"
"97","0.298195893","1769","2e:4c:04:eb:dd:8e","32:43:dd:69:a3:8b","172.20.0.3","172.20.0.2","TLSv1.2","Client Hello"
"98","0.298205507","66","32:43:dd:69:a3:8b","2e:4c:04:eb:dd:8e","172.20.0.2","172.20.0.3","TCP","4433 → 57930 [ACK] Seq=1 Ack=1704 Win=64128 Len=0 TSval=1333818344 TSecr=1142902549"
"99","0.303981258","2053","32:43:dd:69:a3:8b","2e:4c:04:eb:dd:8e","172.20.0.2","172.20.0.3","TLSv1.3","Server Hello, Change Cipher Spec, Application Data, Application Data, Application Data, Application Data"
"100","0.304009414","66","2e:4c:04:eb:dd:8e","32:43:dd:69:a3:8b","172.20.0.3","172.20.0.2","TCP","57930 → 4433 [ACK] Seq=1704 Ack=1988 Win=64128 Len=0 TSval=1142902555 TSecr=1333818350"
"101","0.309182307","146","2e:4c:04:eb:dd:8e","32:43:dd:69:a3:8b","172.20.0.3","172.20.0.2","TLSv1.3","Change Cipher Spec, Application Data"
"102","0.309257344","66","2e:4c:04:eb:dd:8e","32:43:dd:69:a3:8b","172.20.0.3","172.20.0.2","TCP","57930 → 4433 [RST, ACK] Seq=1784 Ack=1988 Win=64128 Len=0 TSval=1142902561 TSecr=1333818350"
"103","0.323265455","74","2e:4c:04:eb:dd:8e","32:43:dd:69:a3:8b","172.20.0.3","172.20.0.2","TCP","57942 → 4433 [SYN] Seq=0 Win=64240 Len=0 MSS=1460 SACK_PERM TSval=1142902575 TSecr=0 WS=128"
"104","0.323300567","74","32:43:dd:69:a3:8b","2e:4c:04:eb:dd:8e","172.20.0.2","172.20.0.3","TCP","4433 → 57942 [SYN, ACK] Seq=0 Ack=1 Win=65160 Len=0 MSS=1460 SACK_PERM TSval=1333818370 TSecr=1142902575 WS=128"
"105","0.323319278","66","2e:4c:04:eb:dd:8e","32:43:dd:69:a3:8b","172.20.0.3","172.20.0.2","TCP","57942 → 4433 [ACK] Seq=1 Ack=1 Win=64256 Len=0 TSval=1142902575 TSecr=1333818370"
"106","0.323359786","1769","2e:4c:04:eb:dd:8e","32:43:dd:69:a3:8b","172.20.0.3","172.20.0.2","TLSv1.2","Client Hello"
"107","0.323371384","66","32:43:dd:69:a3:8b","2e:4c:04:eb:dd:8e","172.20.0.2","172.20.0.3","TCP","4433 → 57942 [ACK] Seq=1 Ack=1704 Win=64128 Len=0 TSval=1333818370 TSecr=1142902575"
"108","0.329260618","2053","32:43:dd:69:a3:8b","2e:4c:04:eb:dd:8e","172.20.0.2","172.20.0.3","TLSv1.3","Server Hello, Change Cipher Spec, Application Data, Application Data, Application Data, Application Data"
"109","0.329287986","66","2e:4c:04:eb:dd:8e","32:43:dd:69:a3:8b","172.20.0.3","172.20.0.2","TCP","57942 → 4433 [ACK] Seq=1704 Ack=1988 Win=64128 Len=0 TSval=1142902581 TSecr=1333818376"
"110","0.334416920","146","2e:4c:04:eb:dd:8e","32:43:dd:69:a3:8b","172.20.0.3","172.20.0.2","TLSv1.3","Change Cipher Spec, Application Data"
"111","0.334476059","66","2e:4c:04:eb:dd:8e","32:43:dd:69:a3:8b","172.20.0.3","172.20.0.2","TCP","57942 → 4433 [RST, ACK] Seq=1784 Ack=1988 Win=64128 Len=0 TSval=1142902586 TSecr=1333818376"
"112","0.348738618","74","2e:4c:04:eb:dd:8e","32:43:dd:69:a3:8b","172.20.0.3","172.20.0.2","TCP","57956 → 4433 [SYN] Seq=0 Win=64240 Len=0 MSS=1460 SACK_PERM TSval=1142902600 TSecr=0 WS=128"
"113","0.348763536","74","32:43:dd:69:a3:8b","2e:4c:04:eb:dd:8e","172.20.0.2","172.20.0.3","TCP","4433 → 57956 [SYN, ACK] Seq=0 Ack=1 Win=65160 Len=0 MSS=1460 SACK_PERM TSval=1333818395 TSecr=1142902600 WS=128"
"114","0.348783724","66","2e:4c:04:eb:dd:8e","32:43:dd:69:a3:8b","172.20.0.3","172.20.0.2","TCP","57956 → 4433 [ACK] Seq=1 Ack=1 Win=64256 Len=0 TSval=1142902600 TSecr=1333818395"
"115","0.348827862","1769","2e:4c:04:eb:dd:8e","32:43:dd:69:a3:8b","172.20.0.3","172.20.0.2","TLSv1.2","Client Hello"
"116","0.348833761","66","32:43:dd:69:a3:8b","2e:4c:04:eb:dd:8e","172.20.0.2","172.20.0.3","TCP","4433 → 57956 [ACK] Seq=1 Ack=1704 Win=64128 Len=0 TSval=1333818395 TSecr=1142902600"
"117","0.355596076","2053","32:43:dd:69:a3:8b","2e:4c:04:eb:dd:8e","172.20.0.2","172.20.0.3","TLSv1.3","Server Hello, Change Cipher Spec, Application Data, Application Data, Application Data, Application Data"
"118","0.355667902","66","2e:4c:04:eb:dd:8e","32:43:dd:69:a3:8b","172.20.0.3","172.20.0.2","TCP","57956 → 4433 [ACK] Seq=1704 Ack=1988 Win=64128 Len=0 TSval=1142902607 TSecr=1333818402"
"119","0.362362162","146","2e:4c:04:eb:dd:8e","32:43:dd:69:a3:8b","172.20.0.3","172.20.0.2","TLSv1.3","Change Cipher Spec, Application Data"
"120","0.362451585","66","2e:4c:04:eb:dd:8e","32:43:dd:69:a3:8b","172.20.0.3","172.20.0.2","TCP","57956 → 4433 [RST, ACK] Seq=1784 Ack=1988 Win=64128 Len=0 TSval=1142902614 TSecr=1333818402"
"121","0.382364803","74","2e:4c:04:eb:dd:8e","32:43:dd:69:a3:8b","172.20.0.3","172.20.0.2","TCP","57960 → 4433 [SYN] Seq=0 Win=64240 Len=0 MSS=1460 SACK_PERM TSval=1142902634 TSecr=0 WS=128"
"122","0.382400304","74","32:43:dd:69:a3:8b","2e:4c:04:eb:dd:8e","172.20.0.2","172.20.0.3","TCP","4433 → 57960 [SYN, ACK] Seq=0 Ack=1 Win=65160 Len=0 MSS=1460 SACK_PERM TSval=1333818429 TSecr=1142902634 WS=128"
"123","0.382425600","66","2e:4c:04:eb:dd:8e","32:43:dd:69:a3:8b","172.20.0.3","172.20.0.2","TCP","57960 → 4433 [ACK] Seq=1 Ack=1 Win=64256 Len=0 TSval=1142902634 TSecr=1333818429"
"124","0.382488606","1769","2e:4c:04:eb:dd:8e","32:43:dd:69:a3:8b","172.20.0.3","172.20.0.2","TLSv1.2","Client Hello"
"125","0.382497093","66","32:43:dd:69:a3:8b","2e:4c:04:eb:dd:8e","172.20.0.2","172.20.0.3","TCP","4433 → 57960 [ACK] Seq=1 Ack=1704 Win=64128 Len=0 TSval=1333818429 TSecr=1142902634"
"126","0.388669997","2054","32:43:dd:69:a3:8b","2e:4c:04:eb:dd:8e","172.20.0.2","172.20.0.3","TLSv1.3","Server Hello, Change Cipher Spec, Application Data, Application Data, Application Data, Application Data"
"127","0.388712553","66","2e:4c:04:eb:dd:8e","32:43:dd:69:a3:8b","172.20.0.3","172.20.0.2","TCP","57960 → 4433 [ACK] Seq=1704 Ack=1989 Win=64128 Len=0 TSval=1142902640 TSecr=1333818435"
"128","0.393903240","146","2e:4c:04:eb:dd:8e","32:43:dd:69:a3:8b","172.20.0.3","172.20.0.2","TLSv1.3","Change Cipher Spec, Application Data"
"129","0.393962582","66","2e:4c:04:eb:dd:8e","32:43:dd:69:a3:8b","172.20.0.3","172.20.0.2","TCP","57960 → 4433 [RST, ACK] Seq=1784 Ack=1989 Win=64128 Len=0 TSval=1142902645 TSecr=1333818435"
"130","0.410080619","74","2e:4c:04:eb:dd:8e","32:43:dd:69:a3:8b","172.20.0.3","172.20.0.2","TCP","57968 → 4433 [SYN] Seq=0 Win=64240 Len=0 MSS=1460 SACK_PERM TSval=1142902661 TSecr=0 WS=128"
"131","0.410105254","74","32:43:dd:69:a3:8b","2e:4c:04:eb:dd:8e","172.20.0.2","172.20.0.3","TCP","4433 → 57968 [SYN, ACK] Seq=0 Ack=1 Win=65160 Len=0 MSS=1460 SACK_PERM TSval=1333818456 TSecr=1142902661 WS=128"
"132","0.410130820","66","2e:4c:04:eb:dd:8e","32:43:dd:69:a3:8b","172.20.0.3","172.20.0.2","TCP","57968 → 4433 [ACK] Seq=1 Ack=1 Win=64256 Len=0 TSval=1142902661 TSecr=1333818456"
"133","0.410170854","1769","2e:4c:04:eb:dd:8e","32:43:dd:69:a3:8b","172.20.0.3","172.20.0.2","TLSv1.2","Client Hello"
"134","0.410176712","66","32:43:dd:69:a3:8b","2e:4c:04:eb:dd:8e","172.20.0.2","172.20.0.3","TCP","4433 → 57968 [ACK] Seq=1 Ack=1704 Win=64128 Len=0 TSval=1333818456 TSecr=1142902661"
"135","0.415960129","2053","32:43:dd:69:a3:8b","2e:4c:04:eb:dd:8e","172.20.0.2","172.20.0.3","TLSv1.3","Server Hello, Change Cipher Spec, Application Data, Application Data, Application Data, Application Data"
"136","0.415988512","66","2e:4c:04:eb:dd:8e","32:43:dd:69:a3:8b","172.20.0.3","172.20.0.2","TCP","57968 → 4433 [ACK] Seq=1704 Ack=1988 Win=64128 Len=0 TSval=1142902667 TSecr=1333818462"
"137","0.421072765","146","2e:4c:04:eb:dd:8e","32:43:dd:69:a3:8b","172.20.0.3","172.20.0.2","TLSv1.3","Change Cipher Spec, Application Data"
"138","0.421133224","66","2e:4c:04:eb:dd:8e","32:43:dd:69:a3:8b","172.20.0.3","172.20.0.2","TCP","57968 → 4433 [RST, ACK] Seq=1784 Ack=1988 Win=64128 Len=0 TSval=1142902672 TSecr=1333818462"
"139","0.435562121","74","2e:4c:04:eb:dd:8e","32:43:dd:69:a3:8b","172.20.0.3","172.20.0.2","TCP","57976 → 4433 [SYN] Seq=0 Win=64240 Len=0 MSS=1460 SACK_PERM TSval=1142902687 TSecr=0 WS=128"
"140","0.435585404","74","32:43:dd:69:a3:8b","2e:4c:04:eb:dd:8e","172.20.0.2","172.20.0.3","TCP","4433 → 57976 [SYN, ACK] Seq=0 Ack=1 Win=65160 Len=0 MSS=1460 SACK_PERM TSval=1333818482 TSecr=1142902687 WS=128"
"141","0.435603557","66","2e:4c:04:eb:dd:8e","32:43:dd:69:a3:8b","172.20.0.3","172.20.0.2","TCP","57976 → 4433 [ACK] Seq=1 Ack=1 Win=64256 Len=0 TSval=1142902687 TSecr=1333818482"
"142","0.435643737","1769","2e:4c:04:eb:dd:8e","32:43:dd:69:a3:8b","172.20.0.3","172.20.0.2","TLSv1.2","Client Hello"
"143","0.435657794","66","32:43:dd:69:a3:8b","2e:4c:04:eb:dd:8e","172.20.0.2","172.20.0.3","TCP","4433 → 57976 [ACK] Seq=1 Ack=1704 Win=64128 Len=0 TSval=1333818482 TSecr=1142902687"
"144","0.442863283","2053","32:43:dd:69:a3:8b","2e:4c:04:eb:dd:8e","172.20.0.2","172.20.0.3","TLSv1.3","Server Hello, Change Cipher Spec, Application Data, Application Data, Application Data, Application Data"
"145","0.442918103","66","2e:4c:04:eb:dd:8e","32:43:dd:69:a3:8b","172.20.0.3","172.20.0.2","TCP","57976 → 4433 [ACK] Seq=1704 Ack=1988 Win=64128 Len=0 TSval=1142902694 TSecr=1333818489"
"146","0.448655782","146","2e:4c:04:eb:dd:8e","32:43:dd:69:a3:8b","172.20.0.3","172.20.0.2","TLSv1.3","Change Cipher Spec, Application Data"
"147","0.448729028","66","2e:4c:04:eb:dd:8e","32:43:dd:69:a3:8b","172.20.0.3","172.20.0.2","TCP","57976 → 4433 [RST, ACK] Seq=1784 Ack=1988 Win=64128 Len=0 TSval=1142902700 TSecr=1333818489"
"148","0.463860554","74","2e:4c:04:eb:dd:8e","32:43:dd:69:a3:8b","172.20.0.3","172.20.0.2","TCP","57984 → 4433 [SYN] Seq=0 Win=64240 Len=0 MSS=1460 SACK_PERM TSval=1142902715 TSecr=0 WS=128"
"149","0.463883413","74","32:43:dd:69:a3:8b","2e:4c:04:eb:dd:8e","172.20.0.2","172.20.0.3","TCP","4433 → 57984 [SYN, ACK] Seq=0 Ack=1 Win=65160 Len=0 MSS=1460 SACK_PERM TSval=1333818510 TSecr=1142902715 WS=128"
"150","0.463902079","66","2e:4c:04:eb:dd:8e","32:43:dd:69:a3:8b","172.20.0.3","172.20.0.2","TCP","57984 → 4433 [ACK] Seq=1 Ack=1 Win=64256 Len=0 TSval=1142902715 TSecr=1333818510"
"151","0.463953708","1769","2e:4c:04:eb:dd:8e","32:43:dd:69:a3:8b","172.20.0.3","172.20.0.2","TLSv1.2","Client Hello"
"152","0.463958934","66","32:43:dd:69:a3:8b","2e:4c:04:eb:dd:8e","172.20.0.2","172.20.0.3","TCP","4433 → 57984 [ACK] Seq=1 Ack=1704 Win=64128 Len=0 TSval=1333818510 TSecr=1142902715"
"153","0.470075425","2053","32:43:dd:69:a3:8b","2e:4c:04:eb:dd:8e","172.20.0.2","172.20.0.3","TLSv1.3","Server Hello, Change Cipher Spec, Application Data, Application Data, Application Data, Application Data"
"154","0.470118480","66","2e:4c:04:eb:dd:8e","32:43:dd:69:a3:8b","172.20.0.3","172.20.0.2","TCP","57984 → 4433 [ACK] Seq=1704 Ack=1988 Win=64128 Len=0 TSval=1142902721 TSecr=1333818516"
"155","0.475298566","146","2e:4c:04:eb:dd:8e","32:43:dd:69:a3:8b","172.20.0.3","172.20.0.2","TLSv1.3","Change Cipher Spec, Application Data"
"156","0.475382047","66","2e:4c:04:eb:dd:8e","32:43:dd:69:a3:8b","172.20.0.3","172.20.0.2","TCP","57984 → 4433 [RST, ACK] Seq=1784 Ack=1988 Win=64128 Len=0 TSval=1142902727 TSecr=1333818516"
"157","0.490420494","74","2e:4c:04:eb:dd:8e","32:43:dd:69:a3:8b","172.20.0.3","172.20.0.2","TCP","57986 → 4433 [SYN] Seq=0 Win=64240 Len=0 MSS=1460 SACK_PERM TSval=1142902742 TSecr=0 WS=128"
"158","0.490454002","74","32:43:dd:69:a3:8b","2e:4c:04:eb:dd:8e","172.20.0.2","172.20.0.3","TCP","4433 → 57986 [SYN, ACK] Seq=0 Ack=1 Win=65160 Len=0 MSS=1460 SACK_PERM TSval=1333818537 TSecr=1142902742 WS=128"
"159","0.490482664","66","2e:4c:04:eb:dd:8e","32:43:dd:69:a3:8b","172.20.0.3","172.20.0.2","TCP","57986 → 4433 [ACK] Seq=1 Ack=1 Win=64256 Len=0 TSval=1142902742 TSecr=1333818537"
"160","0.490543827","1769","2e:4c:04:eb:dd:8e","32:43:dd:69:a3:8b","172.20.0.3","172.20.0.2","TLSv1.2","Client Hello"
"161","0.490552172","66","32:43:dd:69:a3:8b","2e:4c:04:eb:dd:8e","172.20.0.2","172.20.0.3","TCP","4433 → 57986 [ACK] Seq=1 Ack=1704 Win=64128 Len=0 TSval=1333818537 TSecr=1142902742"
"162","0.496584827","2053","32:43:dd:69:a3:8b","2e:4c:04:eb:dd:8e","172.20.0.2","172.20.0.3","TLSv1.3","Server Hello, Change Cipher Spec, Application Data, Application Data, Application Data, Application Data"
"163","0.496615294","66","2e:4c:04:eb:dd:8e","32:43:dd:69:a3:8b","172.20.0.3","172.20.0.2","TCP","57986 → 4433 [ACK] Seq=1704 Ack=1988 Win=64128 Len=0 TSval=1142902748 TSecr=1333818543"
"164","0.501928493","146","2e:4c:04:eb:dd:8e","32:43:dd:69:a3:8b","172.20.0.3","172.20.0.2","TLSv1.3","Change Cipher Spec, Application Data"
"165","0.501986659","66","2e:4c:04:eb:dd:8e","32:43:dd:69:a3:8b","172.20.0.3","172.20.0.2","TCP","57986 → 4433 [RST, ACK] Seq=1784 Ack=1988 Win=64128 Len=0 TSval=1142902753 TSecr=1333818543"
"166","0.516612586","74","2e:4c:04:eb:dd:8e","32:43:dd:69:a3:8b","172.20.0.3","172.20.0.2","TCP","57992 → 4433 [SYN] Seq=0 Win=64240 Len=0 MSS=1460 SACK_PERM TSval=1142902768 TSecr=0 WS=128"
"167","0.516636146","74","32:43:dd:69:a3:8b","2e:4c:04:eb:dd:8e","172.20.0.2","172.20.0.3","TCP","4433 → 57992 [SYN, ACK] Seq=0 Ack=1 Win=65160 Len=0 MSS=1460 SACK_PERM TSval=1333818563 TSecr=1142902768 WS=128"
"168","0.516654704","66","2e:4c:04:eb:dd:8e","32:43:dd:69:a3:8b","172.20.0.3","172.20.0.2","TCP","57992 → 4433 [ACK] Seq=1 Ack=1 Win=64256 Len=0 TSval=1142902768 TSecr=1333818563"
"169","0.516699174","1769","2e:4c:04:eb:dd:8e","32:43:dd:69:a3:8b","172.20.0.3","172.20.0.2","TLSv1.2","Client Hello"
"170","0.516704059","66","32:43:dd:69:a3:8b","2e:4c:04:eb:dd:8e","172.20.0.2","172.20.0.3","TCP","4433 → 57992 [ACK] Seq=1 Ack=1704 Win=64128 Len=0 TSval=1333818563 TSecr=1142902768"
"171","0.522892650","2054","32:43:dd:69:a3:8b","2e:4c:04:eb:dd:8e","172.20.0.2","172.20.0.3","TLSv1.3","Server Hello, Change Cipher Spec, Application Data, Application Data, Application Data, Application Data"
"172","0.522931262","66","2e:4c:04:eb:dd:8e","32:43:dd:69:a3:8b","172.20.0.3","172.20.0.2","TCP","57992 → 4433 [ACK] Seq=1704 Ack=1989 Win=64128 Len=0 TSval=1142902774 TSecr=1333818569"
"173","0.528131375","146","2e:4c:04:eb:dd:8e","32:43:dd:69:a3:8b","172.20.0.3","172.20.0.2","TLSv1.3","Change Cipher Spec, Application Data"
"174","0.528190323","66","2e:4c:04:eb:dd:8e","32:43:dd:69:a3:8b","172.20.0.3","172.20.0.2","TCP","57992 → 4433 [RST, ACK] Seq=1784 Ack=1989 Win=64128 Len=0 TSval=1142902779 TSecr=1333818569"
"175","0.542344237","74","2e:4c:04:eb:dd:8e","32:43:dd:69:a3:8b","172.20.0.3","172.20.0.2","TCP","58000 → 4433 [SYN] Seq=0 Win=64240 Len=0 MSS=1460 SACK_PERM TSval=1142902794 TSecr=0 WS=128"
"176","0.542368959","74","32:43:dd:69:a3:8b","2e:4c:04:eb:dd:8e","172.20.0.2","172.20.0.3","TCP","4433 → 58000 [SYN, ACK] Seq=0 Ack=1 Win=65160 Len=0 MSS=1460 SACK_PERM TSval=1333818589 TSecr=1142902794 WS=128"
"177","0.542388259","66","2e:4c:04:eb:dd:8e","32:43:dd:69:a3:8b","172.20.0.3","172.20.0.2","TCP","58000 → 4433 [ACK] Seq=1 Ack=1 Win=64256 Len=0 TSval=1142902794 TSecr=1333818589"
"178","0.542430024","1769","2e:4c:04:eb:dd:8e","32:43:dd:69:a3:8b","172.20.0.3","172.20.0.2","TLSv1.2","Client Hello"
"179","0.542436111","66","32:43:dd:69:a3:8b","2e:4c:04:eb:dd:8e","172.20.0.2","172.20.0.3","TCP","4433 → 58000 [ACK] Seq=1 Ack=1704 Win=64128 Len=0 TSval=1333818589 TSecr=1142902794"
"180","0.548291216","2053","32:43:dd:69:a3:8b","2e:4c:04:eb:dd:8e","172.20.0.2","172.20.0.3","TLSv1.3","Server Hello, Change Cipher Spec, Application Data, Application Data, Application Data, Application Data"
"181","0.548320572","66","2e:4c:04:eb:dd:8e","32:43:dd:69:a3:8b","172.20.0.3","172.20.0.2","TCP","58000 → 4433 [ACK] Seq=1704 Ack=1988 Win=64128 Len=0 TSval=1142902800 TSecr=1333818595"
"182","0.553424557","146","2e:4c:04:eb:dd:8e","32:43:dd:69:a3:8b","172.20.0.3","172.20.0.2","TLSv1.3","Change Cipher Spec, Application Data"
"183","0.553492323","66","2e:4c:04:eb:dd:8e","32:43:dd:69:a3:8b","172.20.0.3","172.20.0.2","TCP","58000 → 4433 [RST, ACK] Seq=1784 Ack=1988 Win=64128 Len=0 TSval=1142902805 TSecr=1333818595"
"184","0.567562315","74","2e:4c:04:eb:dd:8e","32:43:dd:69:a3:8b","172.20.0.3","172.20.0.2","TCP","58006 → 4433 [SYN] Seq=0 Win=64240 Len=0 MSS=1460 SACK_PERM TSval=1142902819 TSecr=0 WS=128"
"185","0.567586131","74","32:43:dd:69:a3:8b","2e:4c:04:eb:dd:8e","172.20.0.2","172.20.0.3","TCP","4433 → 58006 [SYN, ACK] Seq=0 Ack=1 Win=65160 Len=0 MSS=1460 SACK_PERM TSval=1333818614 TSecr=1142902819 WS=128"
"186","0.567602750","66","2e:4c:04:eb:dd:8e","32:43:dd:69:a3:8b","172.20.0.3","172.20.0.2","TCP","58006 → 4433 [ACK] Seq=1 Ack=1 Win=64256 Len=0 TSval=1142902819 TSecr=1333818614"
"187","0.567644902","1769","2e:4c:04:eb:dd:8e","32:43:dd:69:a3:8b","172.20.0.3","172.20.0.2","TLSv1.2","Client Hello"
"188","0.567650714","66","32:43:dd:69:a3:8b","2e:4c:04:eb:dd:8e","172.20.0.2","172.20.0.3","TCP","4433 → 58006 [ACK] Seq=1 Ack=1704 Win=64128 Len=0 TSval=1333818614 TSecr=1142902819"
"189","0.573495233","2054","32:43:dd:69:a3:8b","2e:4c:04:eb:dd:8e","172.20.0.2","172.20.0.3","TLSv1.3","Server Hello, Change Cipher Spec, Application Data, Application Data, Application Data, Application Data"
"190","0.573522381","66","2e:4c:04:eb:dd:8e","32:43:dd:69:a3:8b","172.20.0.3","172.20.0.2","TCP","58006 → 4433 [ACK] Seq=1704 Ack=1989 Win=64128 Len=0 TSval=1142902825 TSecr=1333818620"
"191","0.578587031","146","2e:4c:04:eb:dd:8e","32:43:dd:69:a3:8b","172.20.0.3","172.20.0.2","TLSv1.3","Change Cipher Spec, Application Data"
"192","0.578646454","66","2e:4c:04:eb:dd:8e","32:43:dd:69:a3:8b","172.20.0.3","172.20.0.2","TCP","58006 → 4433 [RST, ACK] Seq=1784 Ack=1989 Win=64128 Len=0 TSval=1142902830 TSecr=1333818620"
"193","0.595018169","74","2e:4c:04:eb:dd:8e","32:43:dd:69:a3:8b","172.20.0.3","172.20.0.2","TCP","58020 → 4433 [SYN] Seq=0 Win=64240 Len=0 MSS=1460 SACK_PERM TSval=1142902846 TSecr=0 WS=128"
"194","0.595051639","74","32:43:dd:69:a3:8b","2e:4c:04:eb:dd:8e","172.20.0.2","172.20.0.3","TCP","4433 → 58020 [SYN, ACK] Seq=0 Ack=1 Win=65160 Len=0 MSS=1460 SACK_PERM TSval=1333818641 TSecr=1142902846 WS=128"
"195","0.595074757","66","2e:4c:04:eb:dd:8e","32:43:dd:69:a3:8b","172.20.0.3","172.20.0.2","TCP","58020 → 4433 [ACK] Seq=1 Ack=1 Win=64256 Len=0 TSval=1142902846 TSecr=1333818641"
"196","0.595122330","1769","2e:4c:04:eb:dd:8e","32:43:dd:69:a3:8b","172.20.0.3","172.20.0.2","TLSv1.2","Client Hello"
"197","0.595126812","66","32:43:dd:69:a3:8b","2e:4c:04:eb:dd:8e","172.20.0.2","172.20.0.3","TCP","4433 → 58020 [ACK] Seq=1 Ack=1704 Win=64128 Len=0 TSval=1333818641 TSecr=1142902846"
"198","0.601336620","2054","32:43:dd:69:a3:8b","2e:4c:04:eb:dd:8e","172.20.0.2","172.20.0.3","TLSv1.3","Server Hello, Change Cipher Spec, Application Data, Application Data, Application Data, Application Data"
"199","0.601374263","66","2e:4c:04:eb:dd:8e","32:43:dd:69:a3:8b","172.20.0.3","172.20.0.2","TCP","58020 → 4433 [ACK] Seq=1704 Ack=1989 Win=64128 Len=0 TSval=1142902853 TSecr=1333818648"
"200","0.606923666","146","2e:4c:04:eb:dd:8e","32:43:dd:69:a3:8b","172.20.0.3","172.20.0.2","TLSv1.3","Change Cipher Spec, Application Data"
"201","0.606993821","66","2e:4c:04:eb:dd:8e","32:43:dd:69:a3:8b","172.20.0.3","172.20.0.2","TCP","58020 → 4433 [RST, ACK] Seq=1784 Ack=1989 Win=64128 Len=0 TSval=1142902858 TSecr=1333818648"
"202","0.627878245","74","2e:4c:04:eb:dd:8e","32:43:dd:69:a3:8b","172.20.0.3","172.20.0.2","TCP","58030 → 4433 [SYN] Seq=0 Win=64240 Len=0 MSS=1460 SACK_PERM TSval=1142902879 TSecr=0 WS=128"
"203","0.627911360","74","32:43:dd:69:a3:8b","2e:4c:04:eb:dd:8e","172.20.0.2","172.20.0.3","TCP","4433 → 58030 [SYN, ACK] Seq=0 Ack=1 Win=65160 Len=0 MSS=1460 SACK_PERM TSval=1333818674 TSecr=1142902879 WS=128"
"204","0.627937167","66","2e:4c:04:eb:dd:8e","32:43:dd:69:a3:8b","172.20.0.3","172.20.0.2","TCP","58030 → 4433 [ACK] Seq=1 Ack=1 Win=64256 Len=0 TSval=1142902879 TSecr=1333818674"
"205","0.627993356","1769","2e:4c:04:eb:dd:8e","32:43:dd:69:a3:8b","172.20.0.3","172.20.0.2","TLSv1.2","Client Hello"
"206","0.628001262","66","32:43:dd:69:a3:8b","2e:4c:04:eb:dd:8e","172.20.0.2","172.20.0.3","TCP","4433 → 58030 [ACK] Seq=1 Ack=1704 Win=64128 Len=0 TSval=1333818674 TSecr=1142902879"
"207","0.634080029","2054","32:43:dd:69:a3:8b","2e:4c:04:eb:dd:8e","172.20.0.2","172.20.0.3","TLSv1.3","Server Hello, Change Cipher Spec, Application Data, Application Data, Application Data, Application Data"
"208","0.634121795","66","2e:4c:04:eb:dd:8e","32:43:dd:69:a3:8b","172.20.0.3","172.20.0.2","TCP","58030 → 4433 [ACK] Seq=1704 Ack=1989 Win=64128 Len=0 TSval=1142902885 TSecr=1333818680"
"209","0.643380172","146","2e:4c:04:eb:dd:8e","32:43:dd:69:a3:8b","172.20.0.3","172.20.0.2","TLSv1.3","Change Cipher Spec, Application Data"
"210","0.643487028","66","2e:4c:04:eb:dd:8e","32:43:dd:69:a3:8b","172.20.0.3","172.20.0.2","TCP","58030 → 4433 [RST, ACK] Seq=1784 Ack=1989 Win=64128 Len=0 TSval=1142902895 TSecr=1333818680"
"211","0.658675610","74","2e:4c:04:eb:dd:8e","32:43:dd:69:a3:8b","172.20.0.3","172.20.0.2","TCP","58036 → 4433 [SYN] Seq=0 Win=64240 Len=0 MSS=1460 SACK_PERM TSval=1142902910 TSecr=0 WS=128"
"212","0.658700166","74","32:43:dd:69:a3:8b","2e:4c:04:eb:dd:8e","172.20.0.2","172.20.0.3","TCP","4433 → 58036 [SYN, ACK] Seq=0 Ack=1 Win=65160 Len=0 MSS=1460 SACK_PERM TSval=1333818705 TSecr=1142902910 WS=128"
"213","0.658720067","66","2e:4c:04:eb:dd:8e","32:43:dd:69:a3:8b","172.20.0.3","172.20.0.2","TCP","58036 → 4433 [ACK] Seq=1 Ack=1 Win=64256 Len=0 TSval=1142902910 TSecr=1333818705"
"214","0.658764105","1769","2e:4c:04:eb:dd:8e","32:43:dd:69:a3:8b","172.20.0.3","172.20.0.2","TLSv1.2","Client Hello"
"215","0.658770043","66","32:43:dd:69:a3:8b","2e:4c:04:eb:dd:8e","172.20.0.2","172.20.0.3","TCP","4433 → 58036 [ACK] Seq=1 Ack=1704 Win=64128 Len=0 TSval=1333818705 TSecr=1142902910"
"216","0.664795858","2053","32:43:dd:69:a3:8b","2e:4c:04:eb:dd:8e","172.20.0.2","172.20.0.3","TLSv1.3","Server Hello, Change Cipher Spec, Application Data, Application Data, Application Data, Application Data"
"217","0.664832006","66","2e:4c:04:eb:dd:8e","32:43:dd:69:a3:8b","172.20.0.3","172.20.0.2","TCP","58036 → 4433 [ACK] Seq=1704 Ack=1988 Win=64128 Len=0 TSval=1142902916 TSecr=1333818711"
"218","0.669888247","146","2e:4c:04:eb:dd:8e","32:43:dd:69:a3:8b","172.20.0.3","172.20.0.2","TLSv1.3","Change Cipher Spec, Application Data"
"219","0.669961965","66","2e:4c:04:eb:dd:8e","32:43:dd:69:a3:8b","172.20.0.3","172.20.0.2","TCP","58036 → 4433 [RST, ACK] Seq=1784 Ack=1988 Win=64128 Len=0 TSval=1142902921 TSecr=1333818711"
"220","0.684723762","74","2e:4c:04:eb:dd:8e","32:43:dd:69:a3:8b","172.20.0.3","172.20.0.2","TCP","58050 → 4433 [SYN] Seq=0 Win=64240 Len=0 MSS=1460 SACK_PERM TSval=1142902936 TSecr=0 WS=128"
"221","0.684752330","74","32:43:dd:69:a3:8b","2e:4c:04:eb:dd:8e","172.20.0.2","172.20.0.3","TCP","4433 → 58050 [SYN, ACK] Seq=0 Ack=1 Win=65160 Len=0 MSS=1460 SACK_PERM TSval=1333818731 TSecr=1142902936 WS=128"
"222","0.684772892","66","2e:4c:04:eb:dd:8e","32:43:dd:69:a3:8b","172.20.0.3","172.20.0.2","TCP","58050 → 4433 [ACK] Seq=1 Ack=1 Win=64256 Len=0 TSval=1142902936 TSecr=1333818731"
"223","0.684818634","1769","2e:4c:04:eb:dd:8e","32:43:dd:69:a3:8b","172.20.0.3","172.20.0.2","TLSv1.2","Client Hello"
"224","0.684824531","66","32:43:dd:69:a3:8b","2e:4c:04:eb:dd:8e","172.20.0.2","172.20.0.3","TCP","4433 → 58050 [ACK] Seq=1 Ack=1704 Win=64128 Len=0 TSval=1333818731 TSecr=1142902936"
