frame.number,frame.time_relative,frame.len,eth.src,eth.dst,ip.src,ip.dst,_ws.col.protocol,_ws.col.info
"1","0.000000000","42","1e:8d:cf:9a:31:54","ff:ff:ff:ff:ff:ff",,,"ARP","ARP Announcement for 172.20.0.3"
"2","0.031115233","42","1e:8d:cf:9a:31:54","ff:ff:ff:ff:ff:ff",,,"ARP","Who has 172.20.0.2? Tell 172.20.0.3"
"3","0.031141219","42","fa:04:9b:37:81:d4","1e:8d:cf:9a:31:54",,,"ARP","172.20.0.2 is at fa:04:9b:37:81:d4"
"4","0.031151222","74","1e:8d:cf:9a:31:54","fa:04:9b:37:81:d4","172.20.0.3","172.20.0.2","TCP","56758 → 4433 [SYN] Seq=0 Win=64240 Len=0 MSS=1460 SACK_PERM TSval=1143009014 TSecr=0 WS=128"
"5","0.031174017","74","fa:04:9b:37:81:d4","1e:8d:cf:9a:31:54","172.20.0.2","172.20.0.3","TCP","4433 → 56758 [SYN, ACK] Seq=0 Ack=1 Win=65160 Len=0 MSS=1460 SACK_PERM TSval=1333924809 TSecr=1143009014 WS=128"
"6","0.031226377","66","1e:8d:cf:9a:31:54","fa:04:9b:37:81:d4","172.20.0.3","172.20.0.2","TCP","56758 → 4433 [ACK] Seq=1 Ack=1 Win=64256 Len=0 TSval=1143009015 TSecr=1333924809"
"7","0.031268850","1728","1e:8d:cf:9a:31:54","fa:04:9b:37:81:d4","172.20.0.3","172.20.0.2","TLSv1.2","Client Hello"
"8","0.031275582","66","fa:04:9b:37:81:d4","1e:8d:cf:9a:31:54","172.20.0.2","172.20.0.3","TCP","4433 → 56758 [ACK] Seq=1 Ack=1663 Win=64128 Len=0 TSval=1333924810 TSecr=1143009015"
"9","0.034353245","2012","fa:04:9b:37:81:d4","1e:8d:cf:9a:31:54","172.20.0.2","172.20.0.3","TLSv1.3","Server Hello, Change Cipher Spec, Application Data, Application Data, Application Data, Application Data"
"10","0.034392830","66","1e:8d:cf:9a:31:54","fa:04:9b:37:81:d4","172.20.0.3","172.20.0.2","TCP","56758 → 4433 [ACK] Seq=1663 Ack=1947 Win=64128 Len=0 TSval=1143009018 TSecr=1333924813"
"11","0.037637719","146","1e:8d:cf:9a:31:54","fa:04:9b:37:81:d4","172.20.0.3","172.20.0.2","TLSv1.3","Change Cipher Spec, Application Data"
"12","0.037699664","66","1e:8d:cf:9a:31:54","fa:04:9b:37:81:d4","172.20.0.3","172.20.0.2","TCP","56758 → 4433 [RST, ACK] Seq=1743 Ack=1947 Win=64128 Len=0 TSval=1143009021 TSecr=1333924813"
"13","0.048423431","74","1e:8d:cf:9a:31:54","fa:04:9b:37:81:d4","172.20.0.3","172.20.0.2","TCP","56768 → 4433 [SYN] Seq=0 Win=64240 Len=0 MSS=1460 SACK_PERM TSval=1143009032 TSecr=0 WS=128"
"14","0.048450953","74","fa:04:9b:37:81:d4","1e:8d:cf:9a:31:54","172.20.0.2","172.20.0.3","TCP","4433 → 56768 [SYN, ACK] Seq=0 Ack=1 Win=65160 Len=0 MSS=1460 SACK_PERM TSval=1333924827 TSecr=1143009032 WS=128"
"15","0.048470776","66","1e:8d:cf:9a:31:54","fa:04:9b:37:81:d4","172.20.0.3","172.20.0.2","TCP","56768 → 4433 [ACK] Seq=1 Ack=1 Win=64256 Len=0 TSval=1143009032 TSecr=1333924827"
"16","0.048513632","1728","1e:8d:cf:9a:31:54","fa:04:9b:37:81:d4","172.20.0.3","172.20.0.2","TLSv1.2","Client Hello"
"17","0.048518459","66","fa:04:9b:37:81:d4","1e:8d:cf:9a:31:54","172.20.0.2","172.20.0.3","TCP","4433 → 56768 [ACK] Seq=1 Ack=1663 Win=64128 Len=0 TSval=1333924827 TSecr=1143009032"
"18","0.051256859","2012","fa:04:9b:37:81:d4","1e:8d:cf:9a:31:54","172.20.0.2","172.20.0.3","TLSv1.3","Server Hello, Change Cipher Spec, Application Data, Application Data, Application Data, Application Data"
"19","0.051285100","66","1e:8d:cf:9a:31:54","fa:04:9b:37:81:d4","172.20.0.3","172.20.0.2","TCP","56768 → 4433 [ACK] Seq=1663 Ack=1947 Win=64128 Len=0 TSval=1143009035 TSecr=1333924830"
"20","0.054373389","146","1e:8d:cf:9a:31:54","fa:04:9b:37:81:d4","172.20.0.3","172.20.0.2","TLSv1.3","Change Cipher Spec, Application Data"
"21","0.054425495","66","1e:8d:cf:9a:31:54","fa:04:9b:37:81:d4","172.20.0.3","172.20.0.2","TCP","56768 → 4433 [RST, ACK] Seq=1743 Ack=1947 Win=64128 Len=0 TSval=1143009038 TSecr=1333924830"
"22","0.069626917","74","1e:8d:cf:9a:31:54","fa:04:9b:37:81:d4","172.20.0.3","172.20.0.2","TCP","56778 → 4433 [SYN] Seq=0 Win=64240 Len=0 MSS=1460 SACK_PERM TSval=1143009053 TSecr=0 WS=128"
"23","0.069658550","74","fa:04:9b:37:81:d4","1e:8d:cf:9a:31:54","172.20.0.2","172.20.0.3","TCP","4433 → 56778 [SYN, ACK] Seq=0 Ack=1 Win=65160 Len=0 MSS=1460 SACK_PERM TSval=1333924848 TSecr=1143009053 WS=128"
"24","0.069684691","66","1e:8d:cf:9a:31:54","fa:04:9b:37:81:d4","172.20.0.3","172.20.0.2","TCP","56778 → 4433 [ACK] Seq=1 Ack=1 Win=64256 Len=0 TSval=1143009053 TSecr=1333924848"
"25","0.069755814","1728","1e:8d:cf:9a:31:54","fa:04:9b:37:81:d4","172.20.0.3","172.20.0.2","TLSv1.2","Client Hello"
"26","0.069762277","66","fa:04:9b:37:81:d4","1e:8d:cf:9a:31:54","172.20.0.2","172.20.0.3","TCP","4433 → 56778 [ACK] Seq=1 Ack=1663 Win=64128 Len=0 TSval=1333924848 TSecr=1143009053"
"27","0.074143184","2013","fa:04:9b:37:81:d4","1e:8d:cf:9a:31:54","172.20.0.2","172.20.0.3","TLSv1.3","Server Hello, Change Cipher Spec, Application Data, Application Data, Application Data, Application Data"
"28","0.074231014","66","1e:8d:cf:9a:31:54","fa:04:9b:37:81:d4","172.20.0.3","172.20.0.2","TCP","56778 → 4433 [ACK] Seq=1663 Ack=1948 Win=64128 Len=0 TSval=1143009058 TSecr=1333924852"
"29","0.079784715","146","1e:8d:cf:9a:31:54","fa:04:9b:37:81:d4","172.20.0.3","172.20.0.2","TLSv1.3","Change Cipher Spec, Application Data"
"30","0.079876532","66","1e:8d:cf:9a:31:54","fa:04:9b:37:81:d4","172.20.0.3","172.20.0.2","TCP","56778 → 4433 [RST, ACK] Seq=1743 Ack=1948 Win=64128 Len=0 TSval=1143009063 TSecr=1333924852"
"31","0.095457010","74","1e:8d:cf:9a:31:54","fa:04:9b:37:81:d4","172.20.0.3","172.20.0.2","TCP","56794 → 4433 [SYN] Seq=0 Win=64240 Len=0 MSS=1460 SACK_PERM TSval=1143009079 TSecr=0 WS=128"
"32","0.095486380","74","fa:04:9b:37:81:d4","1e:8d:cf:9a:31:54","172.20.0.2","172.20.0.3","TCP","4433 → 56794 [SYN, ACK] Seq=0 Ack=1 Win=65160 Len=0 MSS=1460 SACK_PERM TSval=1333924874 TSecr=1143009079 WS=128"
"33","0.095508279","66","1e:8d:cf:9a:31:54","fa:04:9b:37:81:d4","172.20.0.3","172.20.0.2","TCP","56794 → 4433 [ACK] Seq=1 Ack=1 Win=64256 Len=0 TSval=1143009079 TSecr=1333924874"
"34","0.095558891","1728","1e:8d:cf:9a:31:54","fa:04:9b:37:81:d4","172.20.0.3","172.20.0.2","TLSv1.2","Client Hello"
"35","0.095567942","66","fa:04:9b:37:81:d4","1e:8d:cf:9a:31:54","172.20.0.2","172.20.0.3","TCP","4433 → 56794 [ACK] Seq=1 Ack=1663 Win=64128 Len=0 TSval=1333924874 TSecr=1143009079"
"36","0.098034237","2011","fa:04:9b:37:81:d4","1e:8d:cf:9a:31:54","172.20.0.2","172.20.0.3","TLSv1.3","Server Hello, Change Cipher Spec, Application Data, Application Data, Application Data, Application Data"
"37","0.098073241","66","1e:8d:cf:9a:31:54","fa:04:9b:37:81:d4","172.20.0.3","172.20.0.2","TCP","56794 → 4433 [ACK] Seq=1663 Ack=1946 Win=64128 Len=0 TSval=1143009081 TSecr=1333924876"
"38","0.103652855","146","1e:8d:cf:9a:31:54","fa:04:9b:37:81:d4","172.20.0.3","172.20.0.2","TLSv1.3","Change Cipher Spec, Application Data"
"39","0.103794946","66","1e:8d:cf:9a:31:54","fa:04:9b:37:81:d4","172.20.0.3","172.20.0.2","TCP","56794 → 4433 [RST, ACK] Seq=1743 Ack=1946 Win=64128 Len=0 TSval=1143009087 TSecr=1333924876"
"40","0.116905501","74","1e:8d:cf:9a:31:54","fa:04:9b:37:81:d4","172.20.0.3","172.20.0.2","TCP","56806 → 4433 [SYN] Seq=0 Win=64240 Len=0 MSS=1460 SACK_PERM TSval=1143009100 TSecr=0 WS=128"
"41","0.116938353","74","fa:04:9b:37:81:d4","1e:8d:cf:9a:31:54","172.20.0.2","172.20.0.3","TCP","4433 → 56806 [SYN, ACK] Seq=0 Ack=1 Win=65160 Len=0 MSS=1460 SACK_PERM TSval=1333924895 TSecr=1143009100 WS=128"
"42","0.116963700","66","1e:8d:cf:9a:31:54","fa:04:9b:37:81:d4","172.20.0.3","172.20.0.2","TCP","56806 → 4433 [ACK] Seq=1 Ack=1 Win=64256 Len=0 TSval=1143009100 TSecr=1333924895"
"43","0.117019312","1728","1e:8d:cf:9a:31:54","fa:04:9b:37:81:d4","172.20.0.3","172.20.0.2","TLSv1.2","Client Hello"
"44","0.117027635","66","fa:04:9b:37:81:d4","1e:8d:cf:9a:31:54","172.20.0.2","172.20.0.3","TCP","4433 → 56806 [ACK] Seq=1 Ack=1663 Win=64128 Len=0 TSval=1333924895 TSecr=1143009100"
"45","0.119881876","2012","fa:04:9b:37:81:d4","1e:8d:cf:9a:31:54","172.20.0.2","172.20.0.3","TLSv1.3","Server Hello, Change Cipher Spec, Application Data, Application Data, Application Data, Application Data"
"46","0.119925765","66","1e:8d:cf:9a:31:54","fa:04:9b:37:81:d4","172.20.0.3","172.20.0.2","TCP","56806 → 4433 [ACK] Seq=1663 Ack=1947 Win=64128 Len=0 TSval=1143009103 TSecr=1333924898"
"47","0.123511599","146","1e:8d:cf:9a:31:54","fa:04:9b:37:81:d4","172.20.0.3","172.20.0.2","TLSv1.3","Change Cipher Spec, Application Data"
"48","0.123579789","66","1e:8d:cf:9a:31:54","fa:04:9b:37:81:d4","172.20.0.3","172.20.0.2","TCP","56806 → 4433 [RST, ACK] Seq=1743 Ack=1947 Win=64128 Len=0 TSval=1143009107 TSecr=1333924898"
"49","0.134831034","74","1e:8d:cf:9a:31:54","fa:04:9b:37:81:d4","172.20.0.3","172.20.0.2","TCP","56808 → 4433 [SYN] Seq=0 Win=64240 Len=0 MSS=1460 SACK_PERM TSval=1143009118 TSecr=0 WS=128"
"50","0.134855341","74","fa:04:9b:37:81:d4","1e:8d:cf:9a:31:54","172.20.0.2","172.20.0.3","TCP","4433 → 56808 [SYN, ACK] Seq=0 Ack=1 Win=65160 Len=0 MSS=1460 SACK_PERM TSval=1333924913 TSecr=1143009118 WS=128"
"51","0.134873578","66","1e:8d:cf:9a:31:54","fa:04:9b:37:81:d4","172.20.0.3","172.20.0.2","TCP","56808 → 4433 [ACK] Seq=1 Ack=1 Win=64256 Len=0 TSval=1143009118 TSecr=1333924913"
"52","0.134919972","1728","1e:8d:cf:9a:31:54","fa:04:9b:37:81:d4","172.20.0.3","172.20.0.2","TLSv1.2","Client Hello"
"53","0.134924576","66","fa:04:9b:37:81:d4","1e:8d:cf:9a:31:54","172.20.0.2","172.20.0.3","TCP","4433 → 56808 [ACK] Seq=1 Ack=1663 Win=64128 Len=0 TSval=1333924913 TSecr=1143009118"
"54","0.137931692","2013","fa:04:9b:37:81:d4","1e:8d:cf:9a:31:54","172.20.0.2","172.20.0.3","TLSv1.3","Server Hello, Change Cipher Spec, Application Data, Application Data, Application Data, Application Data"
"55","0.137966630","66","1e:8d:cf:9a:31:54","fa:04:9b:37:81:d4","172.20.0.3","172.20.0.2","TCP","56808 → 4433 [ACK] Seq=1663 Ack=1948 Win=64128 Len=0 TSval=1143009121 TSecr=1333924916"
"56","0.141804489","146","1e:8d:cf:9a:31:54","fa:04:9b:37:81:d4","172.20.0.3","172.20.0.2","TLSv1.3","Change Cipher Spec, Application Data"
"57","0.141878767","66","1e:8d:cf:9a:31:54","fa:04:9b:37:81:d4","172.20.0.3","172.20.0.2","TCP","56808 → 4433 [RST, ACK] Seq=1743 Ack=1948 Win=64128 Len=0 TSval=1143009125 TSecr=1333924916"
"58","0.152957774","74","1e:8d:cf:9a:31:54","fa:04:9b:37:81:d4","172.20.0.3","172.20.0.2","TCP","56816 → 4433 [SYN] Seq=0 Win=64240 Len=0 MSS=1460 SACK_PERM TSval=1143009136 TSecr=0 WS=128"
"59","0.152979789","74","fa:04:9b:37:81:d4","1e:8d:cf:9a:31:54","172.20.0.2","172.20.0.3","TCP","4433 → 56816 [SYN, ACK] Seq=0 Ack=1 Win=65160 Len=0 MSS=1460 SACK_PERM TSval=1333924931 TSecr=1143009136 WS=128"
"60","0.152997436","66","1e:8d:cf:9a:31:54","fa:04:9b:37:81:d4","172.20.0.3","172.20.0.2","TCP","56816 → 4433 [ACK] Seq=1 Ack=1 Win=64256 Len=0 TSval=1143009136 TSecr=1333924931"
"61","0.153042079","1728","1e:8d:cf:9a:31:54","fa:04:9b:37:81:d4","172.20.0.3","172.20.0.2","TLSv1.2","Client Hello"
"62","0.153061654","66","fa:04:9b:37:81:d4","1e:8d:cf:9a:31:54","172.20.0.2","172.20.0.3","TCP","4433 → 56816 [ACK] Seq=1 Ack=1663 Win=64128 Len=0 TSval=1333924931 TSecr=1143009136"
"63","0.155962081","2012","fa:04:9b:37:81:d4","1e:8d:cf:9a:31:54","172.20.0.2","172.20.0.3","TLSv1.3","Server Hello, Change Cipher Spec, Application Data, Application Data, Application Data, Application Data"
"64","0.156007217","66","1e:8d:cf:9a:31:54","fa:04:9b:37:81:d4","172.20.0.3","172.20.0.2","TCP","56816 → 4433 [ACK] Seq=1663 Ack=1947 Win=64128 Len=0 TSval=1143009139 TSecr=1333924934"
"65","0.159315350","146","1e:8d:cf:9a:31:54","fa:04:9b:37:81:d4","172.20.0.3","172.20.0.2","TLSv1.3","Change Cipher Spec, Application Data"
"66","0.159397063","66","1e:8d:cf:9a:31:54","fa:04:9b:37:81:d4","172.20.0.3","172.20.0.2","TCP","56816 → 4433 [RST, ACK] Seq=1743 Ack=1947 Win=64128 Len=0 TSval=1143009143 TSecr=1333924934"
"67","0.170122126","74","1e:8d:cf:9a:31:54","fa:04:9b:37:81:d4","172.20.0.3","172.20.0.2","TCP","56820 → 4433 [SYN] Seq=0 Win=64240 Len=0 MSS=1460 SACK_PERM TSval=1143009153 TSecr=0 WS=128"
"68","0.170147017","74","fa:04:9b:37:81:d4","1e:8d:cf:9a:31:54","172.20.0.2","172.20.0.3","TCP","4433 → 56820 [SYN, ACK] Seq=0 Ack=1 Win=65160 Len=0 MSS=1460 SACK_PERM TSval=1333924948 TSecr=1143009153 WS=128"
"69","0.170166689","66","1e:8d:cf:9a:31:54","fa:04:9b:37:81:d4","172.20.0.3","172.20.0.2","TCP","56820 → 4433 [ACK] Seq=1 Ack=1 Win=64256 Len=0 TSval=1143009153 TSecr=1333924948"
"70","0.170222242","1728","1e:8d:cf:9a:31:54","fa:04:9b:37:81:d4","172.20.0.3","172.20.0.2","TLSv1.2","Client Hello"
"71","0.170227338","66","fa:04:9b:37:81:d4","1e:8d:cf:9a:31:54","172.20.0.2","172.20.0.3","TCP","4433 → 56820 [ACK] Seq=1 Ack=1663 Win=64128 Len=0 TSval=1333924949 TSecr=1143009154"
"72","0.174339728","2013","fa:04:9b:37:81:d4","1e:8d:cf:9a:31:54","172.20.0.2","172.20.0.3","TLSv1.3","Server Hello, Change Cipher Spec, Application Data, Application Data, Application Data, Application Data"
"73","0.174379076","66","1e:8d:cf:9a:31:54","fa:04:9b:37:81:d4","172.20.0.3","172.20.0.2","TCP","56820 → 4433 [ACK] Seq=1663 Ack=1948 Win=64128 Len=0 TSval=1143009158 TSecr=1333924953"
"74","0.177546591","146","1e:8d:cf:9a:31:54","fa:04:9b:37:81:d4","172.20.0.3","172.20.0.2","TLSv1.3","Change Cipher Spec, Application Data"
"75","0.177613671","66","1e:8d:cf:9a:31:54","fa:04:9b:37:81:d4","172.20.0.3","172.20.0.2","TCP","56820 → 4433 [RST, ACK] Seq=1743 Ack=1948 Win=64128 Len=0 TSval=1143009161 TSecr=1333924953"
"76","0.188376432","74","1e:8d:cf:9a:31:54","fa:04:9b:37:81:d4","172.20.0.3","172.20.0.2","TCP","56830 → 4433 [SYN] Seq=0 Win=64240 Len=0 MSS=1460 SACK_PERM TSval=1143009172 TSecr=0 WS=128"
"77","0.188400773","74","fa:04:9b:37:81:d4","1e:8d:cf:9a:31:54","172.20.0.2","172.20.0.3","TCP","4433 → 56830 [SYN, ACK] Seq=0 Ack=1 Win=65160 Len=0 MSS=1460 SACK_PERM TSval=1333924967 TSecr=1143009172 WS=128"
"78","0.188419873","66","1e:8d:cf:9a:31:54","fa:04:9b:37:81:d4","172.20.0.3","172.20.0.2","TCP","56830 → 4433 [ACK] Seq=1 Ack=1 Win=64256 Len=0 TSval=1143009172 TSecr=1333924967"
"79","0.188461209","1728","1e:8d:cf:9a:31:54","fa:04:9b:37:81:d4","172.20.0.3","172.20.0.2","TLSv1.2","Client Hello"
"80","0.188467294","66","fa:04:9b:37:81:d4","1e:8d:cf:9a:31:54","172.20.0.2","172.20.0.3","TCP","4433 → 56830 [ACK] Seq=1 Ack=1663 Win=64128 Len=0 TSval=1333924967 TSecr=1143009172"
"81","0.192256769","2012","fa:04:9b:37:81:d4","1e:8d:cf:9a:31:54","172.20.0.2","172.20.0.3","TLSv1.3","Server Hello, Change Cipher Spec, Application Data, Application Data, Application Data, Application Data"
"82","0.192295771","66","1e:8d:cf:9a:31:54","fa:04:9b:37:81:d4","172.20.0.3","172.20.0.2","TCP","56830 → 4433 [ACK] Seq=1663 Ack=1947 Win=64128 Len=0 TSval=1143009176 TSecr=1333924971"
"83","0.195432640","146","1e:8d:cf:9a:31:54","fa:04:9b:37:81:d4","172.20.0.3","172.20.0.2","TLSv1.3","Change Cipher Spec, Application Data"
"84","0.195489398","66","1e:8d:cf:9a:31:54","fa:04:9b:37:81:d4","172.20.0.3","172.20.0.2","TCP","56830 → 4433 [RST, ACK] Seq=1743 Ack=1947 Win=64128 Len=0 TSval=1143009179 TSecr=1333924971"
"85","0.206480314","74","1e:8d:cf:9a:31:54","fa:04:9b:37:81:d4","172.20.0.3","172.20.0.2","TCP","56846 → 4433 [SYN] Seq=0 Win=64240 Len=0 MSS=1460 SACK_PERM TSval=1143009190 TSecr=0 WS=128"
"86","0.206508456","74","fa:04:9b:37:81:d4","1e:8d:cf:9a:31:54","172.20.0.2","172.20.0.3","TCP","4433 → 56846 [SYN, ACK] Seq=0 Ack=1 Win=65160 Len=0 MSS=1460 SACK_PERM TSval=1333924985 TSecr=1143009190 WS=128"
"87","0.206527669","66","1e:8d:cf:9a:31:54","fa:04:9b:37:81:d4","172.20.0.3","172.20.0.2","TCP","56846 → 4433 [ACK] Seq=1 Ack=1 Win=64256 Len=0 TSval=1143009190 TSecr=1333924985"
"88","0.206574380","1728","1e:8d:cf:9a:31:54","fa:04:9b:37:81:d4","172.20.0.3","172.20.0.2","TLSv1.2","Client Hello"
"89","0.206580356","66","fa:04:9b:37:81:d4","1e:8d:cf:9a:31:54","172.20.0.2","172.20.0.3","TCP","4433 → 56846 [ACK] Seq=1 Ack=1663 Win=64128 Len=0 TSval=1333924985 TSecr=1143009190"
"90","0.210287896","2013","fa:04:9b:37:81:d4","1e:8d:cf:9a:31:54","172.20.0.2","172.20.0.3","TLSv1.3","Server Hello, Change Cipher Spec, Application Data, Application Data, Application Data, Application Data"
"91","0.210333839","66","1e:8d:cf:9a:31:54","fa:04:9b:37:81:d4","172.20.0.3","172.20.0.2","TCP","56846 → 4433 [ACK] Seq=1663 Ack=1948 Win=64128 Len=0 TSval=1143009194 TSecr=1333924989"
"92","0.213949212","146","1e:8d:cf:9a:31:54","fa:04:9b:37:81:d4","172.20.0.3","172.20.0.2","TLSv1.3","Change Cipher Spec, Application Data"
"93","0.214020326","66","1e:8d:cf:9a:31:54","fa:04:9b:37:81:d4","172.20.0.3","172.20.0.2","TCP","56846 → 4433 [RST, ACK] Seq=1743 Ack=1948 Win=64128 Len=0 TSval=1143009197 TSecr=1333924989"
"94","0.225327823","74","1e:8d:cf:9a:31:54","fa:04:9b:37:81:d4","172.20.0.3","172.20.0.2","TCP","56860 → 4433 [SYN] Seq=0 Win=64240 Len=0 MSS=1460 SACK_PERM TSval=1143009209 TSecr=0 WS=128"
"95","0.225354868","74","fa:04:9b:37:81:d4","1e:8d:cf:9a:31:54","172.20.0.2","172.20.0.3","TCP","4433 → 56860 [SYN, ACK] Seq=0 Ack=1 Win=65160 Len=0 MSS=1460 SACK_PERM TSval=1333925004 TSecr=1143009209 WS=128"
"96","0.225375127","66","1e:8d:cf:9a:31:54","fa:04:9b:37:81:d4","172.20.0.3","172.20.0.2","TCP","56860 → 4433 [ACK] Seq=1 Ack=1 Win=64256 Len=0 TSval=1143009209 TSecr=1333925004"
"97","0.225418260","1728","1e:8d:cf:9a:31:54","fa:04:9b:37:81:d4","172.20.0.3","172.20.0.2","TLSv1.2","Client Hello"
"98","0.225424164","66","fa:04:9b:37:81:d4","1e:8d:cf:9a:31:54","172.20.0.2","172.20.0.3","TCP","4433 → 56860 [ACK] Seq=1 Ack=1663 Win=64128 Len=0 TSval=1333925004 TSecr=1143009209"
"99","0.228013040","2012","fa:04:9b:37:81:d4","1e:8d:cf:9a:31:54","172.20.0.2","172.20.0.3","TLSv1.3","Server Hello, Change Cipher Spec, Application Data, Application Data, Application Data, Application Data"
"100","0.228067081","66","1e:8d:cf:9a:31:54","fa:04:9b:37:81:d4","172.20.0.3","172.20.0.2","TCP","56860 → 4433 [ACK] Seq=1663 Ack=1947 Win=64128 Len=0 TSval=1143009211 TSecr=1333925006"
"101","0.231950663","146","1e:8d:cf:9a:31:54","fa:04:9b:37:81:d4","172.20.0.3","172.20.0.2","TLSv1.3","Change Cipher Spec, Application Data"
"102","0.232027552","66","1e:8d:cf:9a:31:54","fa:04:9b:37:81:d4","172.20.0.3","172.20.0.2","TCP","56860 → 4433 [RST, ACK] Seq=1743 Ack=1947 Win=64128 Len=0 TSval=1143009215 TSecr=1333925006"
"103","0.243724399","74","1e:8d:cf:9a:31:54","fa:04:9b:37:81:d4","172.20.0.3","172.20.0.2","TCP","56868 → 4433 [SYN] Seq=0 Win=64240 Len=0 MSS=1460 SACK_PERM TSval=1143009227 TSecr=0 WS=128"
"104","0.243751392","74","fa:04:9b:37:81:d4","1e:8d:cf:9a:31:54","172.20.0.2","172.20.0.3","TCP","4433 → 56868 [SYN, ACK] Seq=0 Ack=1 Win=65160 Len=0 MSS=1460 SACK_PERM TSval=1333925022 TSecr=1143009227 WS=128"
"105","0.243771090","66","1e:8d:cf:9a:31:54","fa:04:9b:37:81:d4","172.20.0.3","172.20.0.2","TCP","56868 → 4433 [ACK] Seq=1 Ack=1 Win=64256 Len=0 TSval=1143009227 TSecr=1333925022"
"106","0.243823042","1728","1e:8d:cf:9a:31:54","fa:04:9b:37:81:d4","172.20.0.3","172.20.0.2","TLSv1.2","Client Hello"
"107","0.243829564","66","fa:04:9b:37:81:d4","1e:8d:cf:9a:31:54","172.20.0.2","172.20.0.3","TCP","4433 → 56868 [ACK] Seq=1 Ack=1663 Win=64128 Len=0 TSval=1333925022 TSecr=1143009227"
"108","0.246318746","2012","fa:04:9b:37:81:d4","1e:8d:cf:9a:31:54","172.20.0.2","172.20.0.3","TLSv1.3","Server Hello, Change Cipher Spec, Application Data, Application Data, Application Data, Application Data"
"109","0.246347276","66","1e:8d:cf:9a:31:54","fa:04:9b:37:81:d4","172.20.0.3","172.20.0.2","TCP","56868 → 4433 [ACK] Seq=1663 Ack=1947 Win=64128 Len=0 TSval=1143009230 TSecr=1333925025"
"110","0.249576463","146","1e:8d:cf:9a:31:54","fa:04:9b:37:81:d4","172.20.0.3","172.20.0.2","TLSv1.3","Change Cipher Spec, Application Data"
"111","0.249637065","66","1e:8d:cf:9a:31:54","fa:04:9b:37:81:d4","172.20.0.3","172.20.0.2","TCP","56868 → 4433 [RST, ACK] Seq=1743 Ack=1947 Win=64128 Len=0 TSval=1143009233 TSecr=1333925025"
"112","0.261613260","74","1e:8d:cf:9a:31:54","fa:04:9b:37:81:d4","172.20.0.3","172.20.0.2","TCP","56880 → 4433 [SYN] Seq=0 Win=64240 Len=0 MSS=1460 SACK_PERM TSval=1143009245 TSecr=0 WS=128"
"113","0.261638338","74","fa:04:9b:37:81:d4","1e:8d:cf:9a:31:54","172.20.0.2","172.20.0.3","TCP","4433 → 56880 [SYN, ACK] Seq=0 Ack=1 Win=65160 Len=0 MSS=1460 SACK_PERM TSval=1333925040 TSecr=1143009245 WS=128"
"114","0.261658873","66","1e:8d:cf:9a:31:54","fa:04:9b:37:81:d4","172.20.0.3","172.20.0.2","TCP","56880 → 4433 [ACK] Seq=1 Ack=1 Win=64256 Len=0 TSval=1143009245 TSecr=1333925040"
"115","0.261704671","1728","1e:8d:cf:9a:31:54","fa:04:9b:37:81:d4","172.20.0.3","172.20.0.2","TLSv1.2","Client Hello"
"116","0.261711150","66","fa:04:9b:37:81:d4","1e:8d:cf:9a:31:54","172.20.0.2","172.20.0.3","TCP","4433 → 56880 [ACK] Seq=1 Ack=1663 Win=64128 Len=0 TSval=1333925040 TSecr=1143009245"
"117","0.264150670","2011","fa:04:9b:37:81:d4","1e:8d:cf:9a:31:54","172.20.0.2","172.20.0.3","TLSv1.3","Server Hello, Change Cipher Spec, Application Data, Application Data, Application Data, Application Data"
"118","0.264182206","66","1e:8d:cf:9a:31:54","fa:04:9b:37:81:d4","172.20.0.3","172.20.0.2","TCP","56880 → 4433 [ACK] Seq=1663 Ack=1946 Win=64128 Len=0 TSval=1143009247 TSecr=1333925042"
"119","0.267325341","146","1e:8d:cf:9a:31:54","fa:04:9b:37:81:d4","172.20.0.3","172.20.0.2","TLSv1.3","Change Cipher Spec, Application Data"
"120","0.267386399","66","1e:8d:cf:9a:31:54","fa:04:9b:37:81:d4","172.20.0.3","172.20.0.2","TCP","56880 → 4433 [RST, ACK] Seq=1743 Ack=1946 Win=64128 Len=0 TSval=1143009251 TSecr=1333925042"
"121","0.278648265","74","1e:8d:cf:9a:31:54","fa:04:9b:37:81:d4","172.20.0.3","172.20.0.2","TCP","56888 → 4433 [SYN] Seq=0 Win=64240 Len=0 MSS=1460 SACK_PERM TSval=1143009262 TSecr=0 WS=128"
"122","0.278670440","74","fa:04:9b:37:81:d4","1e:8d:cf:9a:31:54","172.20.0.2","172.20.0.3","TCP","4433 → 56888 [SYN, ACK] Seq=0 Ack=1 Win=65160 Len=0 MSS=1460 SACK_PERM TSval=1333925057 TSecr=1143009262 WS=128"
"123","0.278686005","66","1e:8d:cf:9a:31:54","fa:04:9b:37:81:d4","172.20.0.3","172.20.0.2","TCP","56888 → 4433 [ACK] Seq=1 Ack=1 Win=64256 Len=0 TSval=1143009262 TSecr=1333925057"
"124","0.278736838","1728","1e:8d:cf:9a:31:54","fa:04:9b:37:81:d4","172.20.0.3","172.20.0.2","TLSv1.2","Client Hello"
"125","0.278741031","66","fa:04:9b:37:81:d4","1e:8d:cf:9a:31:54","172.20.0.2","172.20.0.3","TCP","4433 → 56888 [ACK] Seq=1 Ack=1663 Win=64128 Len=0 TSval=1333925057 TSecr=1143009262"
"126","0.281261037","2013","fa:04:9b:37:81:d4","1e:8d:cf:9a:31:54","172.20.0.2","172.20.0.3","TLSv1.3","Server Hello, Change Cipher Spec, Application Data, Application Data, Application Data, Application Data"
"127","0.281306659","66","1e:8d:cf:9a:31:54","fa:04:9b:37:81:d4","172.20.0.3","172.20.0.2","TCP","56888 → 4433 [ACK] Seq=1663 Ack=1948 Win=64128 Len=0 TSval=1143009265 TSecr=1333925060"
"128","0.284745519","146","1e:8d:cf:9a:31:54","fa:04:9b:37:81:d4","172.20.0.3","172.20.0.2","TLSv1.3","Change Cipher Spec, Application Data"
"129","0.284813810","66","1e:8d:cf:9a:31:54","fa:04:9b:37:81:d4","172.20.0.3","172.20.0.2","TCP","56888 → 4433 [RST, ACK] Seq=1743 Ack=1948 Win=64128 Len=0 TSval=1143009268 TSecr=1333925060"
"130","0.296442385","74","1e:8d:cf:9a:31:54","fa:04:9b:37:81:d4","172.20.0.3","172.20.0.2","TCP","56890 → 4433 [SYN] Seq=0 Win=64240 Len=0 MSS=1460 SACK_PERM TSval=1143009280 TSecr=0 WS=128"
"131","0.296471293","74","fa:04:9b:37:81:d4","1e:8d:cf:9a:31:54","172.20.0.2","172.20.0.3","TCP","4433 → 56890 [SYN, ACK] Seq=0 Ack=1 Win=65160 Len=0 MSS=1460 SACK_PERM TSval=1333925075 TSecr=1143009280 WS=128"
"132","0.296491665","66","1e:8d:cf:9a:31:54","fa:04:9b:37:81:d4","172.20.0.3","172.20.0.2","TCP","56890 → 4433 [ACK] Seq=1 Ack=1 Win=64256 Len=0 TSval=1143009280 TSecr=1333925075"
"133","0.296540601","1728","1e:8d:cf:9a:31:54","fa:04:9b:37:81:d4","172.20.0.3","172.20.0.2","TLSv1.2","Client Hello"
"134","0.296546965","66","fa:04:9b:37:81:d4","1e:8d:cf:9a:31:54","172.20.0.2","172.20.0.3","TCP","4433 → 56890 [ACK] Seq=1 Ack=1663 Win=64128 Len=0 TSval=1333925075 TSecr=1143009280"
"135","0.299430794","2012","fa:04:9b:37:81:d4","1e:8d:cf:9a:31:54","172.20.0.2","172.20.0.3","TLSv1.3","Server Hello, Change Cipher Spec, Application Data, Application Data, Application Data, Application Data"
"136","0.299461604","66","1e:8d:cf:9a:31:54","fa:04:9b:37:81:d4","172.20.0.3","172.20.0.2","TCP","56890 → 4433 [ACK] Seq=1663 Ack=1947 Win=64128 Len=0 TSval=1143009283 TSecr=1333925078"
"137","0.302770899","146","1e:8d:cf:9a:31:54","fa:04:9b:37:81:d4","172.20.0.3","172.20.0.2","TLSv1.3","Change Cipher Spec, Application Data"
"138","0.302829476","66","1e:8d:cf:9a:31:54","fa:04:9b:37:81:d4","172.20.0.3","172.20.0.2","TCP","56890 → 4433 [RST, ACK] Seq=1743 Ack=1947 Win=64128 Len=0 TSval=1143009286 TSecr=1333925078"
"139","0.317153837","74","1e:8d:cf:9a:31:54","fa:04:9b:37:81:d4","172.20.0.3","172.20.0.2","TCP","56902 → 4433 [SYN] Seq=0 Win=64240 Len=0 MSS=1460 SACK_PERM TSval=1143009300 TSecr=0 WS=128"
"140","0.317183156","74","fa:04:9b:37:81:d4","1e:8d:cf:9a:31:54","172.20.0.2","172.20.0.3","TCP","4433 → 56902 [SYN, ACK] Seq=0 Ack=1 Win=65160 Len=0 MSS=1460 SACK_PERM TSval=1333925095 TSecr=1143009300 WS=128"
"141","0.317224743","66","1e:8d:cf:9a:31:54","fa:04:9b:37:81:d4","172.20.0.3","172.20.0.2","TCP","56902 → 4433 [ACK] Seq=1 Ack=1 Win=64256 Len=0 TSval=1143009301 TSecr=1333925095"
"142","0.317267083","1728","1e:8d:cf:9a:31:54","fa:04:9b:37:81:d4","172.20.0.3","172.20.0.2","TLSv1.2","Client Hello"
"143","0.317271895","66","fa:04:9b:37:81:d4","1e:8d:cf:9a:31:54","172.20.0.2","172.20.0.3","TCP","4433 → 56902 [ACK] Seq=1 Ack=1663 Win=64128 Len=0 TSval=1333925096 TSecr=1143009301"
"144","0.320005909","2011","fa:04:9b:37:81:d4","1e:8d:cf:9a:31:54","172.20.0.2","172.20.0.3","TLSv1.3","Server Hello, Change Cipher Spec, Application Data, Application Data, Application Data, Application Data"
"145","0.320033437","66","1e:8d:cf:9a:31:54","fa:04:9b:37:81:d4","172.20.0.3","172.20.0.2","TCP","56902 → 4433 [ACK] Seq=1663 Ack=1946 Win=64128 Len=0 TSval=1143009303 TSecr=1333925098"
"146","0.323200403","146","1e:8d:cf:9a:31:54","fa:04:9b:37:81:d4","172.20.0.3","172.20.0.2","TLSv1.3","Change Cipher Spec, Application Data"
"147","0.323256601","66","1e:8d:cf:9a:31:54","fa:04:9b:37:81:d4","172.20.0.3","172.20.0.2","TCP","56902 → 4433 [RST, ACK] Seq=1743 Ack=1946 Win=64128 Len=0 TSval=1143009307 TSecr=1333925098"
"148","0.333643979","74","1e:8d:cf:9a:31:54","fa:04:9b:37:81:d4","172.20.0.3","172.20.0.2","TCP","56908 → 4433 [SYN] Seq=0 Win=64240 Len=0 MSS=1460 SACK_PERM TSval=1143009317 TSecr=0 WS=128"
"149","0.333668010","74","fa:04:9b:37:81:d4","1e:8d:cf:9a:31:54","172.20.0.2","172.20.0.3","TCP","4433 → 56908 [SYN, ACK] Seq=0 Ack=1 Win=65160 Len=0 MSS=1460 SACK_PERM TSval=1333925112 TSecr=1143009317 WS=128"
"150","0.333686715","66","1e:8d:cf:9a:31:54","fa:04:9b:37:81:d4","172.20.0.3","172.20.0.2","TCP","56908 → 4433 [ACK] Seq=1 Ack=1 Win=64256 Len=0 TSval=1143009317 TSecr=1333925112"
"151","0.333727436","1728","1e:8d:cf:9a:31:54","fa:04:9b:37:81:d4","172.20.0.3","172.20.0.2","TLSv1.2","Client Hello"
"152","0.333732858","66","fa:04:9b:37:81:d4","1e:8d:cf:9a:31:54","172.20.0.2","172.20.0.3","TCP","4433 → 56908 [ACK] Seq=1 Ack=1663 Win=64128 Len=0 TSval=1333925112 TSecr=1143009317"
"153","0.336566598","2013","fa:04:9b:37:81:d4","1e:8d:cf:9a:31:54","172.20.0.2","172.20.0.3","TLSv1.3","Server Hello, Change Cipher Spec, Application Data, Application Data, Application Data, Application Data"
"154","0.336596122","66","1e:8d:cf:9a:31:54","fa:04:9b:37:81:d4","172.20.0.3","172.20.0.2","TCP","56908 → 4433 [ACK] Seq=1663 Ack=1948 Win=64128 Len=0 TSval=1143009320 TSecr=1333925115"
"155","0.339705426","146","1e:8d:cf:9a:31:54","fa:04:9b:37:81:d4","172.20.0.3","172.20.0.2","TLSv1.3","Change Cipher Spec, Application Data"
"156","0.339763682","66","1e:8d:cf:9a:31:54","fa:04:9b:37:81:d4","172.20.0.3","172.20.0.2","TCP","56908 → 4433 [RST, ACK] Seq=1743 Ack=1948 Win=64128 Len=0 TSval=1143009323 TSecr=1333925115"
"157","0.350284553","74","1e:8d:cf:9a:31:54","fa:04:9b:37:81:d4","172.20.0.3","172.20.0.2","TCP","56916 → 4433 [SYN] Seq=0 Win=64240 Len=0 MSS=1460 SACK_PERM TSval=1143009334 TSecr=0 WS=128"
"158","0.350308234","74","fa:04:9b:37:81:d4","1e:8d:cf:9a:31:54","172.20.0.2","172.20.0.3","TCP","4433 → 56916 [SYN, ACK] Seq=0 Ack=1 Win=65160 Len=0 MSS=1460 SACK_PERM TSval=1333925129 TSecr=1143009334 WS=128"
"159","0.350324067","66","1e:8d:cf:9a:31:54","fa:04:9b:37:81:d4","172.20.0.3","172.20.0.2","TCP","56916 → 4433 [ACK] Seq=1 Ack=1 Win=64256 Len=0 TSval=1143009334 TSecr=1333925129"
"160","0.350363245","1728","1e:8d:cf:9a:31:54","fa:04:9b:37:81:d4","172.20.0.3","172.20.0.2","TLSv1.2","Client Hello"
"161","0.350368886","66","fa:04:9b:37:81:d4","1e:8d:cf:9a:31:54","172.20.0.2","172.20.0.3","TCP","4433 → 56916 [ACK] Seq=1 Ack=1663 Win=64128 Len=0 TSval=1333925129 TSecr=1143009334"
"162","0.353172681","2012","fa:04:9b:37:81:d4","1e:8d:cf:9a:31:54","172.20.0.2","172.20.0.3","TLSv1.3","Server Hello, Change Cipher Spec, Application Data, Application Data, Application Data, Application Data"
"163","0.353224801","66","1e:8d:cf:9a:31:54","fa:04:9b:37:81:d4","172.20.0.3","172.20.0.2","TCP","56916 → 4433 [ACK] Seq=1663 Ack=1947 Win=64128 Len=0 TSval=1143009337 TSecr=1333925131"
"164","0.356634548","146","1e:8d:cf:9a:31:54","fa:04:9b:37:81:d4","172.20.0.3","172.20.0.2","TLSv1.3","Change Cipher Spec, Application Data"
"165","0.356722369","66","1e:8d:cf:9a:31:54","fa:04:9b:37:81:d4","172.20.0.3","172.20.0.2","TCP","56916 → 4433 [RST, ACK] Seq=1743 Ack=1947 Win=64128 Len=0 TSval=1143009340 TSecr=1333925131"
"166","0.368711349","74","1e:8d:cf:9a:31:54","fa:04:9b:37:81:d4","172.20.0.3","172.20.0.2","TCP","56920 → 4433 [SYN] Seq=0 Win=64240 Len=0 MSS=1460 SACK_PERM TSval=1143009352 TSecr=0 WS=128"
"167","0.368733644","74","fa:04:9b:37:81:d4","1e:8d:cf:9a:31:54","172.20.0.2","172.20.0.3","TCP","4433 → 56920 [SYN, ACK] Seq=0 Ack=1 Win=65160 Len=0 MSS=1460 SACK_PERM TSval=1333925147 TSecr=1143009352 WS=128"
"168","0.368751467","66","1e:8d:cf:9a:31:54","fa:04:9b:37:81:d4","172.20.0.3","172.20.0.2","TCP","56920 → 4433 [ACK] Seq=1 Ack=1 Win=64256 Len=0 TSval=1143009352 TSecr=1333925147"
"169","0.368796014","1728","1e:8d:cf:9a:31:54","fa:04:9b:37:81:d4","172.20.0.3","172.20.0.2","TLSv1.2","Client Hello"
"170","0.368801343","66","fa:04:9b:37:81:d4","1e:8d:cf:9a:31:54","172.20.0.2","172.20.0.3","TCP","4433 → 56920 [ACK] Seq=1 Ack=1663 Win=64128 Len=0 TSval=1333925147 TSecr=1143009352"
"171","0.372583834","2012","fa:04:9b:37:81:d4","1e:8d:cf:9a:31:54","172.20.0.2","172.20.0.3","TLSv1.3","Server Hello, Change Cipher Spec, Application Data, Application Data, Application Data, Application Data"
"172","0.372655504","66","1e:8d:cf:9a:31:54","fa:04:9b:37:81:d4","172.20.0.3","172.20.0.2","TCP","56920 → 4433 [ACK] Seq=1663 Ack=1947 Win=64128 Len=0 TSval=1143009356 TSecr=1333925151"
"173","0.375858879","146","1e:8d:cf:9a:31:54","fa:04:9b:37:81:d4","172.20.0.3","172.20.0.2","TLSv1.3","Change Cipher Spec, Application Data"
"174","0.375923594","66","1e:8d:cf:9a:31:54","fa:04:9b:37:81:d4","172.20.0.3","172.20.0.2","TCP","56920 → 4433 [RST, ACK] Seq=1743 Ack=1947 Win=64128 Len=0 TSval=1143009359 TSecr=1333925151"
"175","0.387813321","74","1e:8d:cf:9a:31:54","fa:04:9b:37:81:d4","172.20.0.3","172.20.0.2","TCP","56930 → 4433 [SYN] Seq=0 Win=64240 Len=0 MSS=1460 SACK_PERM TSval=1143009371 TSecr=0 WS=128"
"176","0.387843261","74","fa:04:9b:37:81:d4","1e:8d:cf:9a:31:54","172.20.0.2","172.20.0.3","TCP","4433 → 56930 [SYN, ACK] Seq=0 Ack=1 Win=65160 Len=0 MSS=1460 SACK_PERM TSval=1333925166 TSecr=1143009371 WS=128"
"177","0.387864981","66","1e:8d:cf:9a:31:54","fa:04:9b:37:81:d4","172.20.0.3","172.20.0.2","TCP","56930 → 4433 [ACK] Seq=1 Ack=1 Win=64256 Len=0 TSval=1143009371 TSecr=1333925166"
"178","0.387918567","1728","1e:8d:cf:9a:31:54","fa:04:9b:37:81:d4","172.20.0.3","172.20.0.2","TLSv1.2","Client Hello"
"179","0.387923731","66","fa:04:9b:37:81:d4","1e:8d:cf:9a:31:54","172.20.0.2","172.20.0.3","TCP","4433 → 56930 [ACK] Seq=1 Ack=1663 Win=64128 Len=0 TSval=1333925166 TSecr=1143009371"
"180","0.390519827","2012","fa:04:9b:37:81:d4","1e:8d:cf:9a:31:54","172.20.0.2","172.20.0.3","TLSv1.3","Server Hello, Change Cipher Spec, Application Data, Application Data, Application Data, Application Data"
"181","0.390551473","66","1e:8d:cf:9a:31:54","fa:04:9b:37:81:d4","172.20.0.3","172.20.0.2","TCP","56930 → 4433 [ACK] Seq=1663 Ack=1947 Win=64128 Len=0 TSval=1143009374 TSecr=1333925169"
"182","0.393691334","146","1e:8d:cf:9a:31:54","fa:04:9b:37:81:d4","172.20.0.3","172.20.0.2","TLSv1.3","Change Cipher Spec, Application Data"
"183","0.393756485","66","1e:8d:cf:9a:31:54","fa:04:9b:37:81:d4","172.20.0.3","172.20.0.2","TCP","56930 → 4433 [RST, ACK] Seq=1743 Ack=1947 Win=64128 Len=0 TSval=1143009377 TSecr=1333925169"
"184","0.404407199","74","1e:8d:cf:9a:31:54","fa:04:9b:37:81:d4","172.20.0.3","172.20.0.2","TCP","56942 → 4433 [SYN] Seq=0 Win=64240 Len=0 MSS=1460 SACK_PERM TSval=1143009388 TSecr=0 WS=128"
"185","0.404428306","74","fa:04:9b:37:81:d4","1e:8d:cf:9a:31:54","172.20.0.2","172.20.0.3","TCP","4433 → 56942 [SYN, ACK] Seq=0 Ack=1 Win=65160 Len=0 MSS=1460 SACK_PERM TSval=1333925183 TSecr=1143009388 WS=128"
"186","0.404445809","66","1e:8d:cf:9a:31:54","fa:04:9b:37:81:d4","172.20.0.3","172.20.0.2","TCP","56942 → 4433 [ACK] Seq=1 Ack=1 Win=64256 Len=0 TSval=1143009388 TSecr=1333925183"
"187","0.404484413","1728","1e:8d:cf:9a:31:54","fa:04:9b:37:81:d4","172.20.0.3","172.20.0.2","TLSv1.2","Client Hello"
"188","0.404489817","66","fa:04:9b:37:81:d4","1e:8d:cf:9a:31:54","172.20.0.2","172.20.0.3","TCP","4433 → 56942 [ACK] Seq=1 Ack=1663 Win=64128 Len=0 TSval=1333925183 TSecr=1143009388"
"189","0.407411173","2012","fa:04:9b:37:81:d4","1e:8d:cf:9a:31:54","172.20.0.2","172.20.0.3","TLSv1.3","Server Hello, Change Cipher Spec, Application Data, Application Data, Application Data, Application Data"
"190","0.407475204","66","1e:8d:cf:9a:31:54","fa:04:9b:37:81:d4","172.20.0.3","172.20.0.2","TCP","56942 → 4433 [ACK] Seq=1663 Ack=1947 Win=64128 Len=0 TSval=1143009391 TSecr=1333925186"
"191","0.410633931","146","1e:8d:cf:9a:31:54","fa:04:9b:37:81:d4","172.20.0.3","172.20.0.2","TLSv1.3","Change Cipher Spec, Application Data"
"192","0.410691549","66","1e:8d:cf:9a:31:54","fa:04:9b:37:81:d4","172.20.0.3","172.20.0.2","TCP","56942 → 4433 [RST, ACK] Seq=1743 Ack=1947 Win=64128 Len=0 TSval=1143009394 TSecr=1333925186"
"193","0.422430525","74","1e:8d:cf:9a:31:54","fa:04:9b:37:81:d4","172.20.0.3","172.20.0.2","TCP","56946 → 4433 [SYN] Seq=0 Win=64240 Len=0 MSS=1460 SACK_PERM TSval=1143009406 TSecr=0 WS=128"
"194","0.422457939","74","fa:04:9b:37:81:d4","1e:8d:cf:9a:31:54","172.20.0.2","172.20.0.3","TCP","4433 → 56946 [SYN, ACK] Seq=0 Ack=1 Win=65160 Len=0 MSS=1460 SACK_PERM TSval=1333925201 TSecr=1143009406 WS=128"
"195","0.422477954","66","1e:8d:cf:9a:31:54","fa:04:9b:37:81:d4","172.20.0.3","172.20.0.2","TCP","56946 → 4433 [ACK] Seq=1 Ack=1 Win=64256 Len=0 TSval=1143009406 TSecr=1333925201"
"196","0.422520403","1728","1e:8d:cf:9a:31:54","fa:04:9b:37:81:d4","172.20.0.3","172.20.0.2","TLSv1.2","Client Hello"
"197","0.422538840","66","fa:04:9b:37:81:d4","1e:8d:cf:9a:31:54","172.20.0.2","172.20.0.3","TCP","4433 → 56946 [ACK] Seq=1 Ack=1663 Win=64128 Len=0 TSval=1333925201 TSecr=1143009406"
"198","0.425300170","2012","fa:04:9b:37:81:d4","1e:8d:cf:9a:31:54","172.20.0.2","172.20.0.3","TLSv1.3","Server Hello, Change Cipher Spec, Application Data, Application Data, Application Data, Application Data"
"199","0.425329349","66","1e:8d:cf:9a:31:54","fa:04:9b:37:81:d4","172.20.0.3","172.20.0.2","TCP","56946 → 4433 [ACK] Seq=1663 Ack=1947 Win=64128 Len=0 TSval=1143009409 TSecr=1333925204"
"200","0.428416968","146","1e:8d:cf:9a:31:54","fa:04:9b:37:81:d4","172.20.0.3","172.20.0.2","TLSv1.3","Change Cipher Spec, Application Data"
"201","0.428483428","66","1e:8d:cf:9a:31:54","fa:04:9b:37:81:d4","172.20.0.3","172.20.0.2","TCP","56946 → 4433 [RST, ACK] Seq=1743 Ack=1947 Win=64128 Len=0 TSval=1143009412 TSecr=1333925204"
"202","0.439111455","74","1e:8d:cf:9a:31:54","fa:04:9b:37:81:d4","172.20.0.3","172.20.0.2","TCP","56954 → 4433 [SYN] Seq=0 Win=64240 Len=0 MSS=1460 SACK_PERM TSval=1143009422 TSecr=0 WS=128"
"203","0.439135223","74","fa:04:9b:37:81:d4","1e:8d:cf:9a:31:54","172.20.0.2","172.20.0.3","TCP","4433 → 56954 [SYN, ACK] Seq=0 Ack=1 Win=65160 Len=0 MSS=1460 SACK_PERM TSval=1333925217 TSecr=1143009422 WS=128"
"204","0.439155512","66","1e:8d:cf:9a:31:54","fa:04:9b:37:81:d4","172.20.0.3","172.20.0.2","TCP","56954 → 4433 [ACK] Seq=1 Ack=1 Win=64256 Len=0 TSval=1143009422 TSecr=1333925217"
"205","0.439213608","1728","1e:8d:cf:9a:31:54","fa:04:9b:37:81:d4","172.20.0.3","172.20.0.2","TLSv1.2","Client Hello"
"206","0.439219103","66","fa:04:9b:37:81:d4","1e:8d:cf:9a:31:54","172.20.0.2","172.20.0.3","TCP","4433 → 56954 [ACK] Seq=1 Ack=1663 Win=64128 Len=0 TSval=1333925218 TSecr=1143009423"
"207","0.441802859","2013","fa:04:9b:37:81:d4","1e:8d:cf:9a:31:54","172.20.0.2","172.20.0.3","TLSv1.3","Server Hello, Change Cipher Spec, Application Data, Application Data, Application Data, Application Data"
"208","0.441830975","66","1e:8d:cf:9a:31:54","fa:04:9b:37:81:d4","172.20.0.3","172.20.0.2","TCP","56954 → 4433 [ACK] Seq=1663 Ack=1948 Win=64128 Len=0 TSval=1143009425 TSecr=1333925220"
"209","0.445072982","146","1e:8d:cf:9a:31:54","fa:04:9b:37:81:d4","172.20.0.3","172.20.0.2","TLSv1.3","Change Cipher Spec, Application Data"
"210","0.445145220","66","1e:8d:cf:9a:31:54","fa:04:9b:37:81:d4","172.20.0.3","172.20.0.2","TCP","56954 → 4433 [RST, ACK] Seq=1743 Ack=1948 Win=64128 Len=0 TSval=1143009428 TSecr=1333925220"
"211","0.455942648","74","1e:8d:cf:9a:31:54","fa:04:9b:37:81:d4","172.20.0.3","172.20.0.2","TCP","56970 → 4433 [SYN] Seq=0 Win=64240 Len=0 MSS=1460 SACK_PERM TSval=1143009439 TSecr=0 WS=128"
"212","0.455965161","74","fa:04:9b:37:81:d4","1e:8d:cf:9a:31:54","172.20.0.2","172.20.0.3","TCP","4433 → 56970 [SYN, ACK] Seq=0 Ack=1 Win=65160 Len=0 MSS=1460 SACK_PERM TSval=1333925234 TSecr=1143009439 WS=128"
"213","0.455982938","66","1e:8d:cf:9a:31:54","fa:04:9b:37:81:d4","172.20.0.3","172.20.0.2","TCP","56970 → 4433 [ACK] Seq=1 Ack=1 Win=64256 Len=0 TSval=1143009439 TSecr=1333925234"
"214","0.456020561","1728","1e:8d:cf:9a:31:54","fa:04:9b:37:81:d4","172.20.0.3","172.20.0.2","TLSv1.2","Client Hello"
"215","0.456026442","66","fa:04:9b:37:81:d4","1e:8d:cf:9a:31:54","172.20.0.2","172.20.0.3","TCP","4433 → 56970 [ACK] Seq=1 Ack=1663 Win=64128 Len=0 TSval=1333925234 TSecr=1143009439"
"216","0.458719975","2012","fa:04:9b:37:81:d4","1e:8d:cf:9a:31:54","172.20.0.2","172.20.0.3","TLSv1.3","Server Hello, Change Cipher Spec, Application Data, Application Data, Application Data, Application Data"
"217","0.458748908","66","1e:8d:cf:9a:31:54","fa:04:9b:37:81:d4","172.20.0.3","172.20.0.2","TCP","56970 → 4433 [ACK] Seq=1663 Ack=1947 Win=64128 Len=0 TSval=1143009442 TSecr=1333925237"
"218","0.462040324","146","1e:8d:cf:9a:31:54","fa:04:9b:37:81:d4","172.20.0.3","172.20.0.2","TLSv1.3","Change Cipher Spec, Application Data"
"219","0.462117921","66","1e:8d:cf:9a:31:54","fa:04:9b:37:81:d4","172.20.0.3","172.20.0.2","TCP","56970 → 4433 [RST, ACK] Seq=1743 Ack=1947 Win=64128 Len=0 TSval=1143009445 TSecr=1333925237"
"220","0.472672792","74","1e:8d:cf:9a:31:54","fa:04:9b:37:81:d4","172.20.0.3","172.20.0.2","TCP","56980 → 4433 [SYN] Seq=0 Win=64240 Len=0 MSS=1460 SACK_PERM TSval=1143009456 TSecr=0 WS=128"
"221","0.472696763","74","fa:04:9b:37:81:d4","1e:8d:cf:9a:31:54","172.20.0.2","172.20.0.3","TCP","4433 → 56980 [SYN, ACK] Seq=0 Ack=1 Win=65160 Len=0 MSS=1460 SACK_PERM TSval=1333925251 TSecr=1143009456 WS=128"
"222","0.472717230","66","1e:8d:cf:9a:31:54","fa:04:9b:37:81:d4","172.20.0.3","172.20.0.2","TCP","56980 → 4433 [ACK] Seq=1 Ack=1 Win=64256 Len=0 TSval=1143009456 TSecr=1333925251"
"223","0.472758948","1728","1e:8d:cf:9a:31:54","fa:04:9b:37:81:d4","172.20.0.3","172.20.0.2","TLSv1.2","Client Hello"
"224","0.472764721","66","fa:04:9b:37:81:d4","1e:8d:cf:9a:31:54","172.20.0.2","172.20.0.3","TCP","4433 → 56980 [ACK] Seq=1 Ack=1663 Win=64128 Len=0 TSval=1333925251 TSecr=1143009456"
