frame.number,frame.time_relative,frame.len,eth.src,eth.dst,ip.src,ip.dst,_ws.col.protocol,_ws.col.info
"1","0.000000000","70","ae:30:fe:02:75:4c","33:33:00:00:00:02",,,"ICMPv6","Router Solicitation from ae:30:fe:02:75:4c"
"2","1.745701607","42","9e:b3:64:49:44:da","ff:ff:ff:ff:ff:ff",,,"ARP","ARP Announcement for 172.20.0.3"
"3","1.777572986","42","9e:b3:64:49:44:da","ff:ff:ff:ff:ff:ff",,,"ARP","Who has 172.20.0.2? Tell 172.20.0.3"
"4","1.777599073","42","f6:c2:5b:29:82:f0","9e:b3:64:49:44:da",,,"ARP","172.20.0.2 is at f6:c2:5b:29:82:f0"
"5","1.777605731","74","9e:b3:64:49:44:da","f6:c2:5b:29:82:f0","172.20.0.3","172.20.0.2","TCP","60994 → 4433 [SYN] Seq=0 Win=64240 Len=0 MSS=1460 SACK_PERM TSval=1143103294 TSecr=0 WS=128"
"6","1.777635272","74","f6:c2:5b:29:82:f0","9e:b3:64:49:44:da","172.20.0.2","172.20.0.3","TCP","4433 → 60994 [SYN, ACK] Seq=0 Ack=1 Win=65160 Len=0 MSS=1460 SACK_PERM TSval=1334019089 TSecr=1143103294 WS=128"
"7","1.777653817","66","9e:b3:64:49:44:da","f6:c2:5b:29:82:f0","172.20.0.3","172.20.0.2","TCP","60994 → 4433 [ACK] Seq=1 Ack=1 Win=64256 Len=0 TSval=1143103294 TSecr=1334019089"
"8","1.777699829","1672","9e:b3:64:49:44:da","f6:c2:5b:29:82:f0","172.20.0.3","172.20.0.2","TLSv1.2","Client Hello"
"9","1.777706259","66","f6:c2:5b:29:82:f0","9e:b3:64:49:44:da","172.20.0.2","172.20.0.3","TCP","4433 → 60994 [ACK] Seq=1 Ack=1607 Win=64128 Len=0 TSval=1334019089 TSecr=1143103294"
"10","1.779969754","1955","f6:c2:5b:29:82:f0","9e:b3:64:49:44:da","172.20.0.2","172.20.0.3","TLSv1.3","Server Hello, Change Cipher Spec, Application Data, Application Data, Application Data, Application Data"
"11","1.780039156","66","9e:b3:64:49:44:da","f6:c2:5b:29:82:f0","172.20.0.3","172.20.0.2","TCP","60994 → 4433 [ACK] Seq=1607 Ack=1890 Win=64128 Len=0 TSval=1143103297 TSecr=1334019091"
"12","1.783117380","146","9e:b3:64:49:44:da","f6:c2:5b:29:82:f0","172.20.0.3","172.20.0.2","TLSv1.3","Change Cipher Spec, Application Data"
"13","1.783187690","66","9e:b3:64:49:44:da","f6:c2:5b:29:82:f0","172.20.0.3","172.20.0.2","TCP","60994 → 4433 [RST, ACK] Seq=1687 Ack=1890 Win=64128 Len=0 TSval=1143103300 TSecr=1334019091"
"14","1.797234715","74","9e:b3:64:49:44:da","f6:c2:5b:29:82:f0","172.20.0.3","172.20.0.2","TCP","32774 → 4433 [SYN] Seq=0 Win=64240 Len=0 MSS=1460 SACK_PERM TSval=1143103314 TSecr=0 WS=128"
"15","1.797270667","74","f6:c2:5b:29:82:f0","9e:b3:64:49:44:da","172.20.0.2","172.20.0.3","TCP","4433 → 32774 [SYN, ACK] Seq=0 Ack=1 Win=65160 Len=0 MSS=1460 SACK_PERM TSval=1334019109 TSecr=1143103314 WS=128"
"16","1.797297184","66","9e:b3:64:49:44:da","f6:c2:5b:29:82:f0","172.20.0.3","172.20.0.2","TCP","32774 → 4433 [ACK] Seq=1 Ack=1 Win=64256 Len=0 TSval=1143103314 TSecr=1334019109"
"17","1.797353125","1672","9e:b3:64:49:44:da","f6:c2:5b:29:82:f0","172.20.0.3","172.20.0.2","TLSv1.2","Client Hello"
"18","1.797362468","66","f6:c2:5b:29:82:f0","9e:b3:64:49:44:da","172.20.0.2","172.20.0.3","TCP","4433 → 32774 [ACK] Seq=1 Ack=1607 Win=64128 Len=0 TSval=1334019109 TSecr=1143103314"
"19","1.799032563","1956","f6:c2:5b:29:82:f0","9e:b3:64:49:44:da","172.20.0.2","172.20.0.3","TLSv1.3","Server Hello, Change Cipher Spec, Application Data, Application Data, Application Data, Application Data"
"20","1.799069997","66","9e:b3:64:49:44:da","f6:c2:5b:29:82:f0","172.20.0.3","172.20.0.2","TCP","32774 → 4433 [ACK] Seq=1607 Ack=1891 Win=64128 Len=0 TSval=1143103316 TSecr=1334019111"
"21","1.803469949","146","9e:b3:64:49:44:da","f6:c2:5b:29:82:f0","172.20.0.3","172.20.0.2","TLSv1.3","Change Cipher Spec, Application Data"
"22","1.803572730","66","9e:b3:64:49:44:da","f6:c2:5b:29:82:f0","172.20.0.3","172.20.0.2","TCP","32774 → 4433 [RST, ACK] Seq=1687 Ack=1891 Win=64128 Len=0 TSval=1143103320 TSecr=1334019111"
"23","1.815579833","74","9e:b3:64:49:44:da","f6:c2:5b:29:82:f0","172.20.0.3","172.20.0.2","TCP","32790 → 4433 [SYN] Seq=0 Win=64240 Len=0 MSS=1460 SACK_PERM TSval=1143103332 TSecr=0 WS=128"
"24","1.815606517","74","f6:c2:5b:29:82:f0","9e:b3:64:49:44:da","172.20.0.2","172.20.0.3","TCP","4433 → 32790 [SYN, ACK] Seq=0 Ack=1 Win=65160 Len=0 MSS=1460 SACK_PERM TSval=1334019127 TSecr=1143103332 WS=128"
"25","1.815625040","66","9e:b3:64:49:44:da","f6:c2:5b:29:82:f0","172.20.0.3","172.20.0.2","TCP","32790 → 4433 [ACK] Seq=1 Ack=1 Win=64256 Len=0 TSval=1143103332 TSecr=1334019127"
"26","1.815675759","1672","9e:b3:64:49:44:da","f6:c2:5b:29:82:f0","172.20.0.3","172.20.0.2","TLSv1.2","Client Hello"
"27","1.815683779","66","f6:c2:5b:29:82:f0","9e:b3:64:49:44:da","172.20.0.2","172.20.0.3","TCP","4433 → 32790 [ACK] Seq=1 Ack=1607 Win=64128 Len=0 TSval=1334019127 TSecr=1143103332"
"28","1.817579365","1956","f6:c2:5b:29:82:f0","9e:b3:64:49:44:da","172.20.0.2","172.20.0.3","TLSv1.3","Server Hello, Change Cipher Spec, Application Data, Application Data, Application Data, Application Data"
"29","1.817658891","66","9e:b3:64:49:44:da","f6:c2:5b:29:82:f0","172.20.0.3","172.20.0.2","TCP","32790 → 4433 [ACK] Seq=1607 Ack=1891 Win=64128 Len=0 TSval=1143103334 TSecr=1334019129"
"30","1.820666151","146","9e:b3:64:49:44:da","f6:c2:5b:29:82:f0","172.20.0.3","172.20.0.2","TLSv1.3","Change Cipher Spec, Application Data"
"31","1.820734055","66","9e:b3:64:49:44:da","f6:c2:5b:29:82:f0","172.20.0.3","172.20.0.2","TCP","32790 → 4433 [RST, ACK] Seq=1687 Ack=1891 Win=64128 Len=0 TSval=1143103337 TSecr=1334019129"
"32","1.835656661","74","9e:b3:64:49:44:da","f6:c2:5b:29:82:f0","172.20.0.3","172.20.0.2","TCP","32794 → 4433 [SYN] Seq=0 Win=64240 Len=0 MSS=1460 SACK_PERM TSval=1143103352 TSecr=0 WS=128"
"33","1.835693184","74","f6:c2:5b:29:82:f0","9e:b3:64:49:44:da","172.20.0.2","172.20.0.3","TCP","4433 → 32794 [SYN, ACK] Seq=0 Ack=1 Win=65160 Len=0 MSS=1460 SACK_PERM TSval=1334019147 TSecr=1143103352 WS=128"
"34","1.835720918","66","9e:b3:64:49:44:da","f6:c2:5b:29:82:f0","172.20.0.3","172.20.0.2","TCP","32794 → 4433 [ACK] Seq=1 Ack=1 Win=64256 Len=0 TSval=1143103352 TSecr=1334019147"
"35","1.835783782","1672","9e:b3:64:49:44:da","f6:c2:5b:29:82:f0","172.20.0.3","172.20.0.2","TLSv1.2","Client Hello"
"36","1.835792916","66","f6:c2:5b:29:82:f0","9e:b3:64:49:44:da","172.20.0.2","172.20.0.3","TCP","4433 → 32794 [ACK] Seq=1 Ack=1607 Win=64128 Len=0 TSval=1334019147 TSecr=1143103352"
"37","1.837526737","1956","f6:c2:5b:29:82:f0","9e:b3:64:49:44:da","172.20.0.2","172.20.0.3","TLSv1.3","Server Hello, Change Cipher Spec, Application Data, Application Data, Application Data, Application Data"
"38","1.837558033","66","9e:b3:64:49:44:da","f6:c2:5b:29:82:f0","172.20.0.3","172.20.0.2","TCP","32794 → 4433 [ACK] Seq=1607 Ack=1891 Win=64128 Len=0 TSval=1143103354 TSecr=1334019149"
"39","1.842256137","146","9e:b3:64:49:44:da","f6:c2:5b:29:82:f0","172.20.0.3","172.20.0.2","TLSv1.3","Change Cipher Spec, Application Data"
"40","1.842356730","66","9e:b3:64:49:44:da","f6:c2:5b:29:82:f0","172.20.0.3","172.20.0.2","TCP","32794 → 4433 [RST, ACK] Seq=1687 Ack=1891 Win=64128 Len=0 TSval=1143103359 TSecr=1334019149"
"41","1.853919249","74","9e:b3:64:49:44:da","f6:c2:5b:29:82:f0","172.20.0.3","172.20.0.2","TCP","32800 → 4433 [SYN] Seq=0 Win=64240 Len=0 MSS=1460 SACK_PERM TSval=1143103370 TSecr=0 WS=128"
"42","1.853944494","74","f6:c2:5b:29:82:f0","9e:b3:64:49:44:da","172.20.0.2","172.20.0.3","TCP","4433 → 32800 [SYN, ACK] Seq=0 Ack=1 Win=65160 Len=0 MSS=1460 SACK_PERM TSval=1334019165 TSecr=1143103370 WS=128"
"43","1.853967473","66","9e:b3:64:49:44:da","f6:c2:5b:29:82:f0","172.20.0.3","172.20.0.2","TCP","32800 → 4433 [ACK] Seq=1 Ack=1 Win=64256 Len=0 TSval=1143103370 TSecr=1334019165"
"44","1.854026503","1672","9e:b3:64:49:44:da","f6:c2:5b:29:82:f0","172.20.0.3","172.20.0.2","TLSv1.2","Client Hello"
"45","1.854034131","66","f6:c2:5b:29:82:f0","9e:b3:64:49:44:da","172.20.0.2","172.20.0.3","TCP","4433 → 32800 [ACK] Seq=1 Ack=1607 Win=64128 Len=0 TSval=1334019166 TSecr=1143103371"
"46","1.855679683","1957","f6:c2:5b:29:82:f0","9e:b3:64:49:44:da","172.20.0.2","172.20.0.3","TLSv1.3","Server Hello, Change Cipher Spec, Application Data, Application Data, Application Data, Application Data"
"47","1.855709277","66","9e:b3:64:49:44:da","f6:c2:5b:29:82:f0","172.20.0.3","172.20.0.2","TCP","32800 → 4433 [ACK] Seq=1607 Ack=1892 Win=64128 Len=0 TSval=1143103372 TSecr=1334019167"
"48","1.858492128","146","9e:b3:64:49:44:da","f6:c2:5b:29:82:f0","172.20.0.3","172.20.0.2","TLSv1.3","Change Cipher Spec, Application Data"
"49","1.858560583","66","9e:b3:64:49:44:da","f6:c2:5b:29:82:f0","172.20.0.3","172.20.0.2","TCP","32800 → 4433 [RST, ACK] Seq=1687 Ack=1892 Win=64128 Len=0 TSval=1143103375 TSecr=1334019167"
"50","1.870406654","74","9e:b3:64:49:44:da","f6:c2:5b:29:82:f0","172.20.0.3","172.20.0.2","TCP","32806 → 4433 [SYN] Seq=0 Win=64240 Len=0 MSS=1460 SACK_PERM TSval=1143103387 TSecr=0 WS=128"
"51","1.870428530","74","f6:c2:5b:29:82:f0","9e:b3:64:49:44:da","172.20.0.2","172.20.0.3","TCP","4433 → 32806 [SYN, ACK] Seq=0 Ack=1 Win=65160 Len=0 MSS=1460 SACK_PERM TSval=1334019182 TSecr=1143103387 WS=128"
"52","1.870448314","66","9e:b3:64:49:44:da","f6:c2:5b:29:82:f0","172.20.0.3","172.20.0.2","TCP","32806 → 4433 [ACK] Seq=1 Ack=1 Win=64256 Len=0 TSval=1143103387 TSecr=1334019182"
"53","1.870501229","1672","9e:b3:64:49:44:da","f6:c2:5b:29:82:f0","172.20.0.3","172.20.0.2","TLSv1.2","Client Hello"
"54","1.870519332","66","f6:c2:5b:29:82:f0","9e:b3:64:49:44:da","172.20.0.2","172.20.0.3","TCP","4433 → 32806 [ACK] Seq=1 Ack=1607 Win=64128 Len=0 TSval=1334019182 TSecr=1143103387"
"55","1.872343409","1956","f6:c2:5b:29:82:f0","9e:b3:64:49:44:da","172.20.0.2","172.20.0.3","TLSv1.3","Server Hello, Change Cipher Spec, Application Data, Application Data, Application Data, Application Data"
"56","1.872373764","66","9e:b3:64:49:44:da","f6:c2:5b:29:82:f0","172.20.0.3","172.20.0.2","TCP","32806 → 4433 [ACK] Seq=1607 Ack=1891 Win=64128 Len=0 TSval=1143103389 TSecr=1334019184"
"57","1.875067034","146","9e:b3:64:49:44:da","f6:c2:5b:29:82:f0","172.20.0.3","172.20.0.2","TLSv1.3","Change Cipher Spec, Application Data"
"58","1.875134021","66","9e:b3:64:49:44:da","f6:c2:5b:29:82:f0","172.20.0.3","172.20.0.2","TCP","32806 → 4433 [RST, ACK] Seq=1687 Ack=1891 Win=64128 Len=0 TSval=1143103392 TSecr=1334019184"
"59","1.886332121","74","9e:b3:64:49:44:da","f6:c2:5b:29:82:f0","172.20.0.3","172.20.0.2","TCP","32818 → 4433 [SYN] Seq=0 Win=64240 Len=0 MSS=1460 SACK_PERM TSval=1143103403 TSecr=0 WS=128"
"60","1.886357578","74","f6:c2:5b:29:82:f0","9e:b3:64:49:44:da","172.20.0.2","172.20.0.3","TCP","4433 → 32818 [SYN, ACK] Seq=0 Ack=1 Win=65160 Len=0 MSS=1460 SACK_PERM TSval=1334019198 TSecr=1143103403 WS=128"
"61","1.886377180","66","9e:b3:64:49:44:da","f6:c2:5b:29:82:f0","172.20.0.3","172.20.0.2","TCP","32818 → 4433 [ACK] Seq=1 Ack=1 Win=64256 Len=0 TSval=1143103403 TSecr=1334019198"
"62","1.886424726","1672","9e:b3:64:49:44:da","f6:c2:5b:29:82:f0","172.20.0.3","172.20.0.2","TLSv1.2","Client Hello"
"63","1.886430614","66","f6:c2:5b:29:82:f0","9e:b3:64:49:44:da","172.20.0.2","172.20.0.3","TCP","4433 → 32818 [ACK] Seq=1 Ack=1607 Win=64128 Len=0 TSval=1334019198 TSecr=1143103403"
"64","1.888229671","1956","f6:c2:5b:29:82:f0","9e:b3:64:49:44:da","172.20.0.2","172.20.0.3","TLSv1.3","Server Hello, Change Cipher Spec, Application Data, Application Data, Application Data, Application Data"
"65","1.888265119","66","9e:b3:64:49:44:da","f6:c2:5b:29:82:f0","172.20.0.3","172.20.0.2","TCP","32818 → 4433 [ACK] Seq=1607 Ack=1891 Win=64128 Len=0 TSval=1143103405 TSecr=1334019200"
"66","1.891032325","146","9e:b3:64:49:44:da","f6:c2:5b:29:82:f0","172.20.0.3","172.20.0.2","TLSv1.3","Change Cipher Spec, Application Data"
"67","1.891103104","66","9e:b3:64:49:44:da","f6:c2:5b:29:82:f0","172.20.0.3","172.20.0.2","TCP","32818 → 4433 [RST, ACK] Seq=1687 Ack=1891 Win=64128 Len=0 TSval=1143103408 TSecr=1334019200"
"68","1.901905294","74","9e:b3:64:49:44:da","f6:c2:5b:29:82:f0","172.20.0.3","172.20.0.2","TCP","32828 → 4433 [SYN] Seq=0 Win=64240 Len=0 MSS=1460 SACK_PERM TSval=1143103418 TSecr=0 WS=128"
"69","1.901928890","74","f6:c2:5b:29:82:f0","9e:b3:64:49:44:da","172.20.0.2","172.20.0.3","TCP","4433 → 32828 [SYN, ACK] Seq=0 Ack=1 Win=65160 Len=0 MSS=1460 SACK_PERM TSval=1334019213 TSecr=1143103418 WS=128"
"70","1.901948662","66","9e:b3:64:49:44:da","f6:c2:5b:29:82:f0","172.20.0.3","172.20.0.2","TCP","32828 → 4433 [ACK] Seq=1 Ack=1 Win=64256 Len=0 TSval=1143103418 TSecr=1334019213"
"71","1.901999830","1672","9e:b3:64:49:44:da","f6:c2:5b:29:82:f0","172.20.0.3","172.20.0.2","TLSv1.2","Client Hello"
"72","1.902006288","66","f6:c2:5b:29:82:f0","9e:b3:64:49:44:da","172.20.0.2","172.20.0.3","TCP","4433 → 32828 [ACK] Seq=1 Ack=1607 Win=64128 Len=0 TSval=1334019214 TSecr=1143103419"
"73","1.903646794","1956","f6:c2:5b:29:82:f0","9e:b3:64:49:44:da","172.20.0.2","172.20.0.3","TLSv1.3","Server Hello, Change Cipher Spec, Application Data, Application Data, Application Data, Application Data"
"74","1.903680669","66","9e:b3:64:49:44:da","f6:c2:5b:29:82:f0","172.20.0.3","172.20.0.2","TCP","32828 → 4433 [ACK] Seq=1607 Ack=1891 Win=64128 Len=0 TSval=1143103420 TSecr=1334019215"
"75","1.906395266","146","9e:b3:64:49:44:da","f6:c2:5b:29:82:f0","172.20.0.3","172.20.0.2","TLSv1.3","Change Cipher Spec, Application Data"
"76","1.906471782","66","9e:b3:64:49:44:da","f6:c2:5b:29:82:f0","172.20.0.3","172.20.0.2","TCP","32828 → 4433 [RST, ACK] Seq=1687 Ack=1891 Win=64128 Len=0 TSval=1143103423 TSecr=1334019215"
"77","1.918145669","74","9e:b3:64:49:44:da","f6:c2:5b:29:82:f0","172.20.0.3","172.20.0.2","TCP","32840 → 4433 [SYN] Seq=0 Win=64240 Len=0 MSS=1460 SACK_PERM TSval=1143103435 TSecr=0 WS=128"
"78","1.918171093","74","f6:c2:5b:29:82:f0","9e:b3:64:49:44:da","172.20.0.2","172.20.0.3","TCP","4433 → 32840 [SYN, ACK] Seq=0 Ack=1 Win=65160 Len=0 MSS=1460 SACK_PERM TSval=1334019230 TSecr=1143103435 WS=128"
"79","1.918190071","66","9e:b3:64:49:44:da","f6:c2:5b:29:82:f0","172.20.0.3","172.20.0.2","TCP","32840 → 4433 [ACK] Seq=1 Ack=1 Win=64256 Len=0 TSval=1143103435 TSecr=1334019230"
"80","1.918226901","1672","9e:b3:64:49:44:da","f6:c2:5b:29:82:f0","172.20.0.3","172.20.0.2","TLSv1.2","Client Hello"
"81","1.918231323","66","f6:c2:5b:29:82:f0","9e:b3:64:49:44:da","172.20.0.2","172.20.0.3","TCP","4433 → 32840 [ACK] Seq=1 Ack=1607 Win=64128 Len=0 TSval=1334019230 TSecr=1143103435"
"82","1.920274600","1955","f6:c2:5b:29:82:f0","9e:b3:64:49:44:da","172.20.0.2","172.20.0.3","TLSv1.3","Server Hello, Change Cipher Spec, Application Data, Application Data, Application Data, Application Data"
"83","1.920316308","66","9e:b3:64:49:44:da","f6:c2:5b:29:82:f0","172.20.0.3","172.20.0.2","TCP","32840 → 4433 [ACK] Seq=1607 Ack=1890 Win=64128 Len=0 TSval=1143103437 TSecr=1334019232"
"84","1.923706707","146","9e:b3:64:49:44:da","f6:c2:5b:29:82:f0","172.20.0.3","172.20.0.2","TLSv1.3","Change Cipher Spec, Application Data"
"85","1.923812518","66","9e:b3:64:49:44:da","f6:c2:5b:29:82:f0","172.20.0.3","172.20.0.2","TCP","32840 → 4433 [RST, ACK] Seq=1687 Ack=1890 Win=64128 Len=0 TSval=1143103440 TSecr=1334019232"
"86","1.934917638","74","9e:b3:64:49:44:da","f6:c2:5b:29:82:f0","172.20.0.3","172.20.0.2","TCP","32844 → 4433 [SYN] Seq=0 Win=64240 Len=0 MSS=1460 SACK_PERM TSval=1143103451 TSecr=0 WS=128"
"87","1.934943408","74","f6:c2:5b:29:82:f0","9e:b3:64:49:44:da","172.20.0.2","172.20.0.3","TCP","4433 → 32844 [SYN, ACK] Seq=0 Ack=1 Win=65160 Len=0 MSS=1460 SACK_PERM TSval=1334019246 TSecr=1143103451 WS=128"
"88","1.934962753","66","9e:b3:64:49:44:da","f6:c2:5b:29:82:f0","172.20.0.3","172.20.0.2","TCP","32844 → 4433 [ACK] Seq=1 Ack=1 Win=64256 Len=0 TSval=1143103451 TSecr=1334019246"
"89","1.935025463","1672","9e:b3:64:49:44:da","f6:c2:5b:29:82:f0","172.20.0.3","172.20.0.2","TLSv1.2","Client Hello"
"90","1.935031877","66","f6:c2:5b:29:82:f0","9e:b3:64:49:44:da","172.20.0.2","172.20.0.3","TCP","4433 → 32844 [ACK] Seq=1 Ack=1607 Win=64128 Len=0 TSval=1334019247 TSecr=1143103452"
"91","1.936683257","1956","f6:c2:5b:29:82:f0","9e:b3:64:49:44:da","172.20.0.2","172.20.0.3","TLSv1.3","Server Hello, Change Cipher Spec, Application Data, Application Data, Application Data, Application Data"
"92","1.936717464","66","9e:b3:64:49:44:da","f6:c2:5b:29:82:f0","172.20.0.3","172.20.0.2","TCP","32844 → 4433 [ACK] Seq=1607 Ack=1891 Win=64128 Len=0 TSval=1143103453 TSecr=1334019248"
"93","1.939435598","146","9e:b3:64:49:44:da","f6:c2:5b:29:82:f0","172.20.0.3","172.20.0.2","TLSv1.3","Change Cipher Spec, Application Data"
"94","1.939505249","66","9e:b3:64:49:44:da","f6:c2:5b:29:82:f0","172.20.0.3","172.20.0.2","TCP","32844 → 4433 [RST, ACK] Seq=1687 Ack=1891 Win=64128 Len=0 TSval=1143103456 TSecr=1334019248"
"95","1.950514563","74","9e:b3:64:49:44:da","f6:c2:5b:29:82:f0","172.20.0.3","172.20.0.2","TCP","32856 → 4433 [SYN] Seq=0 Win=64240 Len=0 MSS=1460 SACK_PERM TSval=1143103467 TSecr=0 WS=128"
"96","1.950540899","74","f6:c2:5b:29:82:f0","9e:b3:64:49:44:da","172.20.0.2","172.20.0.3","TCP","4433 → 32856 [SYN, ACK] Seq=0 Ack=1 Win=65160 Len=0 MSS=1460 SACK_PERM TSval=1334019262 TSecr=1143103467 WS=128"
"97","1.950558553","66","9e:b3:64:49:44:da","f6:c2:5b:29:82:f0","172.20.0.3","172.20.0.2","TCP","32856 → 4433 [ACK] Seq=1 Ack=1 Win=64256 Len=0 TSval=1143103467 TSecr=1334019262"
"98","1.950603253","1672","9e:b3:64:49:44:da","f6:c2:5b:29:82:f0","172.20.0.3","172.20.0.2","TLSv1.2","Client Hello"
"99","1.950609324","66","f6:c2:5b:29:82:f0","9e:b3:64:49:44:da","172.20.0.2","172.20.0.3","TCP","4433 → 32856 [ACK] Seq=1 Ack=1607 Win=64128 Len=0 TSval=1334019262 TSecr=1143103467"
"100","1.953045071","1956","f6:c2:5b:29:82:f0","9e:b3:64:49:44:da","172.20.0.2","172.20.0.3","TLSv1.3","Server Hello, Change Cipher Spec, Application Data, Application Data, Application Data, Application Data"
"101","1.953081665","66","9e:b3:64:49:44:da","f6:c2:5b:29:82:f0","172.20.0.3","172.20.0.2","TCP","32856 → 4433 [ACK] Seq=1607 Ack=1891 Win=64128 Len=0 TSval=1143103470 TSecr=1334019265"
"102","1.955783541","146","9e:b3:64:49:44:da","f6:c2:5b:29:82:f0","172.20.0.3","172.20.0.2","TLSv1.3","Change Cipher Spec, Application Data"
"103","1.955843478","66","9e:b3:64:49:44:da","f6:c2:5b:29:82:f0","172.20.0.3","172.20.0.2","TCP","32856 → 4433 [RST, ACK] Seq=1687 Ack=1891 Win=64128 Len=0 TSval=1143103472 TSecr=1334019265"
"104","1.967076557","74","9e:b3:64:49:44:da","f6:c2:5b:29:82:f0","172.20.0.3","172.20.0.2","TCP","32860 → 4433 [SYN] Seq=0 Win=64240 Len=0 MSS=1460 SACK_PERM TSval=1143103484 TSecr=0 WS=128"
"105","1.967103148","74","f6:c2:5b:29:82:f0","9e:b3:64:49:44:da","172.20.0.2","172.20.0.3","TCP","4433 → 32860 [SYN, ACK] Seq=0 Ack=1 Win=65160 Len=0 MSS=1460 SACK_PERM TSval=1334019279 TSecr=1143103484 WS=128"
"106","1.967121681","66","9e:b3:64:49:44:da","f6:c2:5b:29:82:f0","172.20.0.3","172.20.0.2","TCP","32860 → 4433 [ACK] Seq=1 Ack=1 Win=64256 Len=0 TSval=1143103484 TSecr=1334019279"
"107","1.967174037","1672","9e:b3:64:49:44:da","f6:c2:5b:29:82:f0","172.20.0.3","172.20.0.2","TLSv1.2","Client Hello"
"108","1.967181898","66","f6:c2:5b:29:82:f0","9e:b3:64:49:44:da","172.20.0.2","172.20.0.3","TCP","4433 → 32860 [ACK] Seq=1 Ack=1607 Win=64128 Len=0 TSval=1334019279 TSecr=1143103484"
"109","1.969008142","1957","f6:c2:5b:29:82:f0","9e:b3:64:49:44:da","172.20.0.2","172.20.0.3","TLSv1.3","Server Hello, Change Cipher Spec, Application Data, Application Data, Application Data, Application Data"
"110","1.969051477","66","9e:b3:64:49:44:da","f6:c2:5b:29:82:f0","172.20.0.3","172.20.0.2","TCP","32860 → 4433 [ACK] Seq=1607 Ack=1892 Win=64128 Len=0 TSval=1143103486 TSecr=1334019280"
"111","1.971930865","146","9e:b3:64:49:44:da","f6:c2:5b:29:82:f0","172.20.0.3","172.20.0.2","TLSv1.3","Change Cipher Spec, Application Data"
"112","1.972019212","66","9e:b3:64:49:44:da","f6:c2:5b:29:82:f0","172.20.0.3","172.20.0.2","TCP","32860 → 4433 [RST, ACK] Seq=1687 Ack=1892 Win=64128 Len=0 TSval=1143103489 TSecr=1334019280"
"113","1.983074368","74","9e:b3:64:49:44:da","f6:c2:5b:29:82:f0","172.20.0.3","172.20.0.2","TCP","32872 → 4433 [SYN] Seq=0 Win=64240 Len=0 MSS=1460 SACK_PERM TSval=1143103500 TSecr=0 WS=128"
"114","1.983103867","74","f6:c2:5b:29:82:f0","9e:b3:64:49:44:da","172.20.0.2","172.20.0.3","TCP","4433 → 32872 [SYN, ACK] Seq=0 Ack=1 Win=65160 Len=0 MSS=1460 SACK_PERM TSval=1334019295 TSecr=1143103500 WS=128"
"115","1.983123283","66","9e:b3:64:49:44:da","f6:c2:5b:29:82:f0","172.20.0.3","172.20.0.2","TCP","32872 → 4433 [ACK] Seq=1 Ack=1 Win=64256 Len=0 TSval=1143103500 TSecr=1334019295"
"116","1.983166301","1672","9e:b3:64:49:44:da","f6:c2:5b:29:82:f0","172.20.0.3","172.20.0.2","TLSv1.2","Client Hello"
"117","1.983173114","66","f6:c2:5b:29:82:f0","9e:b3:64:49:44:da","172.20.0.2","172.20.0.3","TCP","4433 → 32872 [ACK] Seq=1 Ack=1607 Win=64128 Len=0 TSval=1334019295 TSecr=1143103500"
"118","1.984898319","1956","f6:c2:5b:29:82:f0","9e:b3:64:49:44:da","172.20.0.2","172.20.0.3","TLSv1.3","Server Hello, Change Cipher Spec, Application Data, Application Data, Application Data, Application Data"
"119","1.984927596","66","9e:b3:64:49:44:da","f6:c2:5b:29:82:f0","172.20.0.3","172.20.0.2","TCP","32872 → 4433 [ACK] Seq=1607 Ack=1891 Win=64128 Len=0 TSval=1143103501 TSecr=1334019296"
"120","1.987647804","146","9e:b3:64:49:44:da","f6:c2:5b:29:82:f0","172.20.0.3","172.20.0.2","TLSv1.3","Change Cipher Spec, Application Data"
"121","1.987712079","66","9e:b3:64:49:44:da","f6:c2:5b:29:82:f0","172.20.0.3","172.20.0.2","TCP","32872 → 4433 [RST, ACK] Seq=1687 Ack=1891 Win=64128 Len=0 TSval=1143103504 TSecr=1334019296"
"122","1.999296931","74","9e:b3:64:49:44:da","f6:c2:5b:29:82:f0","172.20.0.3","172.20.0.2","TCP","32874 → 4433 [SYN] Seq=0 Win=64240 Len=0 MSS=1460 SACK_PERM TSval=1143103516 TSecr=0 WS=128"
"123","1.999331062","74","f6:c2:5b:29:82:f0","9e:b3:64:49:44:da","172.20.0.2","172.20.0.3","TCP","4433 → 32874 [SYN, ACK] Seq=0 Ack=1 Win=65160 Len=0 MSS=1460 SACK_PERM TSval=1334019311 TSecr=1143103516 WS=128"
"124","1.999352904","66","9e:b3:64:49:44:da","f6:c2:5b:29:82:f0","172.20.0.3","172.20.0.2","TCP","32874 → 4433 [ACK] Seq=1 Ack=1 Win=64256 Len=0 TSval=1143103516 TSecr=1334019311"
"125","1.999400785","1672","9e:b3:64:49:44:da","f6:c2:5b:29:82:f0","172.20.0.3","172.20.0.2","TLSv1.2","Client Hello"
"126","1.999407476","66","f6:c2:5b:29:82:f0","9e:b3:64:49:44:da","172.20.0.2","172.20.0.3","TCP","4433 → 32874 [ACK] Seq=1 Ack=1607 Win=64128 Len=0 TSval=1334019311 TSecr=1143103516"
"127","2.001045914","1957","f6:c2:5b:29:82:f0","9e:b3:64:49:44:da","172.20.0.2","172.20.0.3","TLSv1.3","Server Hello, Change Cipher Spec, Application Data, Application Data, Application Data, Application Data"
"128","2.001075869","66","9e:b3:64:49:44:da","f6:c2:5b:29:82:f0","172.20.0.3","172.20.0.2","TCP","32874 → 4433 [ACK] Seq=1607 Ack=1892 Win=64128 Len=0 TSval=1143103518 TSecr=1334019313"
"129","2.003715028","146","9e:b3:64:49:44:da","f6:c2:5b:29:82:f0","172.20.0.3","172.20.0.2","TLSv1.3","Change Cipher Spec, Application Data"
"130","2.003775928","66","9e:b3:64:49:44:da","f6:c2:5b:29:82:f0","172.20.0.3","172.20.0.2","TCP","32874 → 4433 [RST, ACK] Seq=1687 Ack=1892 Win=64128 Len=0 TSval=1143103520 TSecr=1334019313"
"131","2.014622929","74","9e:b3:64:49:44:da","f6:c2:5b:29:82:f0","172.20.0.3","172.20.0.2","TCP","32886 → 4433 [SYN] Seq=0 Win=64240 Len=0 MSS=1460 SACK_PERM TSval=1143103531 TSecr=0 WS=128"
"132","2.014648146","74","f6:c2:5b:29:82:f0","9e:b3:64:49:44:da","172.20.0.2","172.20.0.3","TCP","4433 → 32886 [SYN, ACK] Seq=0 Ack=1 Win=65160 Len=0 MSS=1460 SACK_PERM TSval=1334019326 TSecr=1143103531 WS=128"
"133","2.014667095","66","9e:b3:64:49:44:da","f6:c2:5b:29:82:f0","172.20.0.3","172.20.0.2","TCP","32886 → 4433 [ACK] Seq=1 Ack=1 Win=64256 Len=0 TSval=1143103531 TSecr=1334019326"
"134","2.014716396","1672","9e:b3:64:49:44:da","f6:c2:5b:29:82:f0","172.20.0.3","172.20.0.2","TLSv1.2","Client Hello"
"135","2.014722879","66","f6:c2:5b:29:82:f0","9e:b3:64:49:44:da","172.20.0.2","172.20.0.3","TCP","4433 → 32886 [ACK] Seq=1 Ack=1607 Win=64128 Len=0 TSval=1334019326 TSecr=1143103531"
"136","2.016471143","1955","f6:c2:5b:29:82:f0","9e:b3:64:49:44:da","172.20.0.2","172.20.0.3","TLSv1.3","Server Hello, Change Cipher Spec, Application Data, Application Data, Application Data, Application Data"
"137","2.016500259","66","9e:b3:64:49:44:da","f6:c2:5b:29:82:f0","172.20.0.3","172.20.0.2","TCP","32886 → 4433 [ACK] Seq=1607 Ack=1890 Win=64128 Len=0 TSval=1143103533 TSecr=1334019328"
"138","2.019233441","146","9e:b3:64:49:44:da","f6:c2:5b:29:82:f0","172.20.0.3","172.20.0.2","TLSv1.3","Change Cipher Spec, Application Data"
"139","2.019307483","66","9e:b3:64:49:44:da","f6:c2:5b:29:82:f0","172.20.0.3","172.20.0.2","TCP","32886 → 4433 [RST, ACK] Seq=1687 Ack=1890 Win=64128 Len=0 TSval=1143103536 TSecr=1334019328"
"140","2.030273174","74","9e:b3:64:49:44:da","f6:c2:5b:29:82:f0","172.20.0.3","172.20.0.2","TCP","32888 → 4433 [SYN] Seq=0 Win=64240 Len=0 MSS=1460 SACK_PERM TSval=1143103547 TSecr=0 WS=128"
"141","2.030298431","74","f6:c2:5b:29:82:f0","9e:b3:64:49:44:da","172.20.0.2","172.20.0.3","TCP","4433 → 32888 [SYN, ACK] Seq=0 Ack=1 Win=65160 Len=0 MSS=1460 SACK_PERM TSval=1334019342 TSecr=1143103547 WS=128"
"142","2.030317846","66","9e:b3:64:49:44:da","f6:c2:5b:29:82:f0","172.20.0.3","172.20.0.2","TCP","32888 → 4433 [ACK] Seq=1 Ack=1 Win=64256 Len=0 TSval=1143103547 TSecr=1334019342"
"143","2.030365659","1672","9e:b3:64:49:44:da","f6:c2:5b:29:82:f0","172.20.0.3","172.20.0.2","TLSv1.2","Client Hello"
"144","2.030371874","66","f6:c2:5b:29:82:f0","9e:b3:64:49:44:da","172.20.0.2","172.20.0.3","TCP","4433 → 32888 [ACK] Seq=1 Ack=1607 Win=64128 Len=0 TSval=1334019342 TSecr=1143103547"
"145","2.032146441","1956","f6:c2:5b:29:82:f0","9e:b3:64:49:44:da","172.20.0.2","172.20.0.3","TLSv1.3","Server Hello, Change Cipher Spec, Application Data, Application Data, Application Data, Application Data"
"146","2.032175343","66","9e:b3:64:49:44:da","f6:c2:5b:29:82:f0","172.20.0.3","172.20.0.2","TCP","32888 → 4433 [ACK] Seq=1607 Ack=1891 Win=64128 Len=0 TSval=1143103549 TSecr=1334019344"
"147","2.034889493","146","9e:b3:64:49:44:da","f6:c2:5b:29:82:f0","172.20.0.3","172.20.0.2","TLSv1.3","Change Cipher Spec, Application Data"
"148","2.034959902","66","9e:b3:64:49:44:da","f6:c2:5b:29:82:f0","172.20.0.3","172.20.0.2","TCP","32888 → 4433 [RST, ACK] Seq=1687 Ack=1891 Win=64128 Len=0 TSval=1143103551 TSecr=1334019344"
"149","2.045916720","74","9e:b3:64:49:44:da","f6:c2:5b:29:82:f0","172.20.0.3","172.20.0.2","TCP","32892 → 4433 [SYN] Seq=0 Win=64240 Len=0 MSS=1460 SACK_PERM TSval=1143103562 TSecr=0 WS=128"
"150","2.045940028","74","f6:c2:5b:29:82:f0","9e:b3:64:49:44:da","172.20.0.2","172.20.0.3","TCP","4433 → 32892 [SYN, ACK] Seq=0 Ack=1 Win=65160 Len=0 MSS=1460 SACK_PERM TSval=1334019357 TSecr=1143103562 WS=128"
"151","2.045958797","66","9e:b3:64:49:44:da","f6:c2:5b:29:82:f0","172.20.0.3","172.20.0.2","TCP","32892 → 4433 [ACK] Seq=1 Ack=1 Win=64256 Len=0 TSval=1143103562 TSecr=1334019357"
"152","2.046018247","1672","9e:b3:64:49:44:da","f6:c2:5b:29:82:f0","172.20.0.3","172.20.0.2","TLSv1.2","Client Hello"
"153","2.046025158","66","f6:c2:5b:29:82:f0","9e:b3:64:49:44:da","172.20.0.2","172.20.0.3","TCP","4433 → 32892 [ACK] Seq=1 Ack=1607 Win=64128 Len=0 TSval=1334019358 TSecr=1143103563"
"154","2.047677553","1955","f6:c2:5b:29:82:f0","9e:b3:64:49:44:da","172.20.0.2","172.20.0.3","TLSv1.3","Server Hello, Change Cipher Spec, Application Data, Application Data, Application Data, Application Data"
"155","2.047732007","66","9e:b3:64:49:44:da","f6:c2:5b:29:82:f0","172.20.0.3","172.20.0.2","TCP","32892 → 4433 [ACK] Seq=1607 Ack=1890 Win=64128 Len=0 TSval=1143103564 TSecr=1334019359"
"156","2.050372998","146","9e:b3:64:49:44:da","f6:c2:5b:29:82:f0","172.20.0.3","172.20.0.2","TLSv1.3","Change Cipher Spec, Application Data"
"157","2.050432228","66","9e:b3:64:49:44:da","f6:c2:5b:29:82:f0","172.20.0.3","172.20.0.2","TCP","32892 → 4433 [RST, ACK] Seq=1687 Ack=1890 Win=64128 Len=0 TSval=1143103567 TSecr=1334019359"
"158","2.062180296","74","9e:b3:64:49:44:da","f6:c2:5b:29:82:f0","172.20.0.3","172.20.0.2","TCP","32908 → 4433 [SYN] Seq=0 Win=64240 Len=0 MSS=1460 SACK_PERM TSval=1143103579 TSecr=0 WS=128"
"159","2.062205831","74","f6:c2:5b:29:82:f0","9e:b3:64:49:44:da","172.20.0.2","172.20.0.3","TCP","4433 → 32908 [SYN, ACK] Seq=0 Ack=1 Win=65160 Len=0 MSS=1460 SACK_PERM TSval=1334019374 TSecr=1143103579 WS=128"
"160","2.062225324","66","9e:b3:64:49:44:da","f6:c2:5b:29:82:f0","172.20.0.3","172.20.0.2","TCP","32908 → 4433 [ACK] Seq=1 Ack=1 Win=64256 Len=0 TSval=1143103579 TSecr=1334019374"
"161","2.062267508","1672","9e:b3:64:49:44:da","f6:c2:5b:29:82:f0","172.20.0.3","172.20.0.2","TLSv1.2","Client Hello"
"162","2.062273626","66","f6:c2:5b:29:82:f0","9e:b3:64:49:44:da","172.20.0.2","172.20.0.3","TCP","4433 → 32908 [ACK] Seq=1 Ack=1607 Win=64128 Len=0 TSval=1334019374 TSecr=1143103579"
"163","2.063940943","1957","f6:c2:5b:29:82:f0","9e:b3:64:49:44:da","172.20.0.2","172.20.0.3","TLSv1.3","Server Hello, Change Cipher Spec, Application Data, Application Data, Application Data, Application Data"
"164","2.063982011","66","9e:b3:64:49:44:da","f6:c2:5b:29:82:f0","172.20.0.3","172.20.0.2","TCP","32908 → 4433 [ACK] Seq=1607 Ack=1892 Win=64128 Len=0 TSval=1143103580 TSecr=1334019375"
"165","2.067113587","146","9e:b3:64:49:44:da","f6:c2:5b:29:82:f0","172.20.0.3","172.20.0.2","TLSv1.3","Change Cipher Spec, Application Data"
"166","2.067191315","66","9e:b3:64:49:44:da","f6:c2:5b:29:82:f0","172.20.0.3","172.20.0.2","TCP","32908 → 4433 [RST, ACK] Seq=1687 Ack=1892 Win=64128 Len=0 TSval=1143103584 TSecr=1334019375"
"167","2.079086602","74","9e:b3:64:49:44:da","f6:c2:5b:29:82:f0","172.20.0.3","172.20.0.2","TCP","32912 → 4433 [SYN] Seq=0 Win=64240 Len=0 MSS=1460 SACK_PERM TSval=1143103596 TSecr=0 WS=128"
"168","2.079122657","74","f6:c2:5b:29:82:f0","9e:b3:64:49:44:da","172.20.0.2","172.20.0.3","TCP","4433 → 32912 [SYN, ACK] Seq=0 Ack=1 Win=65160 Len=0 MSS=1460 SACK_PERM TSval=1334019391 TSecr=1143103596 WS=128"
"169","2.079145538","66","9e:b3:64:49:44:da","f6:c2:5b:29:82:f0","172.20.0.3","172.20.0.2","TCP","32912 → 4433 [ACK] Seq=1 Ack=1 Win=64256 Len=0 TSval=1143103596 TSecr=1334019391"
"170","2.079192492","1672","9e:b3:64:49:44:da","f6:c2:5b:29:82:f0","172.20.0.3","172.20.0.2","TLSv1.2","Client Hello"
"171","2.079199318","66","f6:c2:5b:29:82:f0","9e:b3:64:49:44:da","172.20.0.2","172.20.0.3","TCP","4433 → 32912 [ACK] Seq=1 Ack=1607 Win=64128 Len=0 TSval=1334019391 TSecr=1143103596"
"172","2.080834944","1957","f6:c2:5b:29:82:f0","9e:b3:64:49:44:da","172.20.0.2","172.20.0.3","TLSv1.3","Server Hello, Change Cipher Spec, Application Data, Application Data, Application Data, Application Data"
"173","2.080868133","66","9e:b3:64:49:44:da","f6:c2:5b:29:82:f0","172.20.0.3","172.20.0.2","TCP","32912 → 4433 [ACK] Seq=1607 Ack=1892 Win=64128 Len=0 TSval=1143103597 TSecr=1334019392"
"174","2.083723545","146","9e:b3:64:49:44:da","f6:c2:5b:29:82:f0","172.20.0.3","172.20.0.2","TLSv1.3","Change Cipher Spec, Application Data"
"175","2.083948929","321","f6:c2:5b:29:82:f0","9e:b3:64:49:44:da","172.20.0.2","172.20.0.3","TLSv1.3","Application Data"
"176","2.084029819","321","f6:c2:5b:29:82:f0","9e:b3:64:49:44:da","172.20.0.2","172.20.0.3","TLSv1.3","Application Data"
"177","2.084125624","66","9e:b3:64:49:44:da","f6:c2:5b:29:82:f0","172.20.0.3","172.20.0.2","TCP","32912 → 4433 [RST, ACK] Seq=1687 Ack=2402 Win=64128 Len=0 TSval=1143103601 TSecr=1334019395"
"178","2.096022295","74","9e:b3:64:49:44:da","f6:c2:5b:29:82:f0","172.20.0.3","172.20.0.2","TCP","32928 → 4433 [SYN] Seq=0 Win=64240 Len=0 MSS=1460 SACK_PERM TSval=1143103613 TSecr=0 WS=128"
"179","2.096048916","74","f6:c2:5b:29:82:f0","9e:b3:64:49:44:da","172.20.0.2","172.20.0.3","TCP","4433 → 32928 [SYN, ACK] Seq=0 Ack=1 Win=65160 Len=0 MSS=1460 SACK_PERM TSval=1334019408 TSecr=1143103613 WS=128"
"180","2.096072691","66","9e:b3:64:49:44:da","f6:c2:5b:29:82:f0","172.20.0.3","172.20.0.2","TCP","32928 → 4433 [ACK] Seq=1 Ack=1 Win=64256 Len=0 TSval=1143103613 TSecr=1334019408"
"181","2.096124281","1672","9e:b3:64:49:44:da","f6:c2:5b:29:82:f0","172.20.0.3","172.20.0.2","TLSv1.2","Client Hello"
"182","2.096129034","66","f6:c2:5b:29:82:f0","9e:b3:64:49:44:da","172.20.0.2","172.20.0.3","TCP","4433 → 32928 [ACK] Seq=1 Ack=1607 Win=64128 Len=0 TSval=1334019408 TSecr=1143103613"
"183","2.097920356","1956","f6:c2:5b:29:82:f0","9e:b3:64:49:44:da","172.20.0.2","172.20.0.3","TLSv1.3","Server Hello, Change Cipher Spec, Application Data, Application Data, Application Data, Application Data"
"184","2.097953162","66","9e:b3:64:49:44:da","f6:c2:5b:29:82:f0","172.20.0.3","172.20.0.2","TCP","32928 → 4433 [ACK] Seq=1607 Ack=1891 Win=64128 Len=0 TSval=1143103614 TSecr=1334019409"
"185","2.100738826","146","9e:b3:64:49:44:da","f6:c2:5b:29:82:f0","172.20.0.3","172.20.0.2","TLSv1.3","Change Cipher Spec, Application Data"
"186","2.100816164","66","9e:b3:64:49:44:da","f6:c2:5b:29:82:f0","172.20.0.3","172.20.0.2","TCP","32928 → 4433 [RST, ACK] Seq=1687 Ack=1891 Win=64128 Len=0 TSval=1143103617 TSecr=1334019409"
"187","2.111525041","74","9e:b3:64:49:44:da","f6:c2:5b:29:82:f0","172.20.0.3","172.20.0.2","TCP","32944 → 4433 [SYN] Seq=0 Win=64240 Len=0 MSS=1460 SACK_PERM TSval=1143103628 TSecr=0 WS=128"
"188","2.111548206","74","f6:c2:5b:29:82:f0","9e:b3:64:49:44:da","172.20.0.2","172.20.0.3","TCP","4433 → 32944 [SYN, ACK] Seq=0 Ack=1 Win=65160 Len=0 MSS=1460 SACK_PERM TSval=1334019423 TSecr=1143103628 WS=128"
"189","2.111566499","66","9e:b3:64:49:44:da","f6:c2:5b:29:82:f0","172.20.0.3","172.20.0.2","TCP","32944 → 4433 [ACK] Seq=1 Ack=1 Win=64256 Len=0 TSval=1143103628 TSecr=1334019423"
"190","2.111620683","1672","9e:b3:64:49:44:da","f6:c2:5b:29:82:f0","172.20.0.3","172.20.0.2","TLSv1.2","Client Hello"
"191","2.111636642","66","f6:c2:5b:29:82:f0","9e:b3:64:49:44:da","172.20.0.2","172.20.0.3","TCP","4433 → 32944 [ACK] Seq=1 Ack=1607 Win=64128 Len=0 TSval=1334019423 TSecr=1143103628"
"192","2.113478346","1957","f6:c2:5b:29:82:f0","9e:b3:64:49:44:da","172.20.0.2","172.20.0.3","TLSv1.3","Server Hello, Change Cipher Spec, Application Data, Application Data, Application Data, Application Data"
"193","2.113512216","66","9e:b3:64:49:44:da","f6:c2:5b:29:82:f0","172.20.0.3","172.20.0.2","TCP","32944 → 4433 [ACK] Seq=1607 Ack=1892 Win=64128 Len=0 TSval=1143103630 TSecr=1334019425"
"194","2.116334412","146","9e:b3:64:49:44:da","f6:c2:5b:29:82:f0","172.20.0.3","172.20.0.2","TLSv1.3","Change Cipher Spec, Application Data"
"195","2.116420434","66","9e:b3:64:49:44:da","f6:c2:5b:29:82:f0","172.20.0.3","172.20.0.2","TCP","32944 → 4433 [RST, ACK] Seq=1687 Ack=1892 Win=64128 Len=0 TSval=1143103633 TSecr=1334019425"
"196","2.127835842","74","9e:b3:64:49:44:da","f6:c2:5b:29:82:f0","172.20.0.3","172.20.0.2","TCP","32950 → 4433 [SYN] Seq=0 Win=64240 Len=0 MSS=1460 SACK_PERM TSval=1143103644 TSecr=0 WS=128"
"197","2.127862121","74","f6:c2:5b:29:82:f0","9e:b3:64:49:44:da","172.20.0.2","172.20.0.3","TCP","4433 → 32950 [SYN, ACK] Seq=0 Ack=1 Win=65160 Len=0 MSS=1460 SACK_PERM TSval=1334019439 TSecr=1143103644 WS=128"
"198","2.127888553","66","9e:b3:64:49:44:da","f6:c2:5b:29:82:f0","172.20.0.3","172.20.0.2","TCP","32950 → 4433 [ACK] Seq=1 Ack=1 Win=64256 Len=0 TSval=1143103644 TSecr=1334019439"
"199","2.127931988","1672","9e:b3:64:49:44:da","f6:c2:5b:29:82:f0","172.20.0.3","172.20.0.2","TLSv1.2","Client Hello"
"200","2.127937571","66","f6:c2:5b:29:82:f0","9e:b3:64:49:44:da","172.20.0.2","172.20.0.3","TCP","4433 → 32950 [ACK] Seq=1 Ack=1607 Win=64128 Len=0 TSval=1334019439 TSecr=1143103644"
"201","2.129661079","1955","f6:c2:5b:29:82:f0","9e:b3:64:49:44:da","172.20.0.2","172.20.0.3","TLSv1.3","Server Hello, Change Cipher Spec, Application Data, Application Data, Application Data, Application Data"
"202","2.129693933","66","9e:b3:64:49:44:da","f6:c2:5b:29:82:f0","172.20.0.3","172.20.0.2","TCP","32950 → 4433 [ACK] Seq=1607 Ack=1890 Win=64128 Len=0 TSval=1143103646 TSecr=1334019441"
"203","2.132658336","146","9e:b3:64:49:44:da","f6:c2:5b:29:82:f0","172.20.0.3","172.20.0.2","TLSv1.3","Change Cipher Spec, Application Data"
"204","2.132728890","66","9e:b3:64:49:44:da","f6:c2:5b:29:82:f0","172.20.0.3","172.20.0.2","TCP","32950 → 4433 [RST, ACK] Seq=1687 Ack=1890 Win=64128 Len=0 TSval=1143103649 TSecr=1334019441"
"205","2.143409006","74","9e:b3:64:49:44:da","f6:c2:5b:29:82:f0","172.20.0.3","172.20.0.2","TCP","32966 → 4433 [SYN] Seq=0 Win=64240 Len=0 MSS=1460 SACK_PERM TSval=1143103660 TSecr=0 WS=128"
"206","2.143431008","74","f6:c2:5b:29:82:f0","9e:b3:64:49:44:da","172.20.0.2","172.20.0.3","TCP","4433 → 32966 [SYN, ACK] Seq=0 Ack=1 Win=65160 Len=0 MSS=1460 SACK_PERM TSval=1334019455 TSecr=1143103660 WS=128"
"207","2.143448262","66","9e:b3:64:49:44:da","f6:c2:5b:29:82:f0","172.20.0.3","172.20.0.2","TCP","32966 → 4433 [ACK] Seq=1 Ack=1 Win=64256 Len=0 TSval=1143103660 TSecr=1334019455"
"208","2.143490986","1672","9e:b3:64:49:44:da","f6:c2:5b:29:82:f0","172.20.0.3","172.20.0.2","TLSv1.2","Client Hello"
"209","2.143496358","66","f6:c2:5b:29:82:f0","9e:b3:64:49:44:da","172.20.0.2","172.20.0.3","TCP","4433 → 32966 [ACK] Seq=1 Ack=1607 Win=64128 Len=0 TSval=1334019455 TSecr=1143103660"
"210","2.145216106","1955","f6:c2:5b:29:82:f0","9e:b3:64:49:44:da","172.20.0.2","172.20.0.3","TLSv1.3","Server Hello, Change Cipher Spec, Application Data, Application Data, Application Data, Application Data"
"211","2.145252489","66","9e:b3:64:49:44:da","f6:c2:5b:29:82:f0","172.20.0.3","172.20.0.2","TCP","32966 → 4433 [ACK] Seq=1607 Ack=1890 Win=64128 Len=0 TSval=1143103662 TSecr=1334019457"
"212","2.148255846","146","9e:b3:64:49:44:da","f6:c2:5b:29:82:f0","172.20.0.3","172.20.0.2","TLSv1.3","Change Cipher Spec, Application Data"
"213","2.148329367","66","9e:b3:64:49:44:da","f6:c2:5b:29:82:f0","172.20.0.3","172.20.0.2","TCP","32966 → 4433 [RST, ACK] Seq=1687 Ack=1890 Win=64128 Len=0 TSval=1143103665 TSecr=1334019457"
"214","2.158969353","74","9e:b3:64:49:44:da","f6:c2:5b:29:82:f0","172.20.0.3","172.20.0.2","TCP","32968 → 4433 [SYN] Seq=0 Win=64240 Len=0 MSS=1460 SACK_PERM TSval=1143103675 TSecr=0 WS=128"
"215","2.159003148","74","f6:c2:5b:29:82:f0","9e:b3:64:49:44:da","172.20.0.2","172.20.0.3","TCP","4433 → 32968 [SYN, ACK] Seq=0 Ack=1 Win=65160 Len=0 MSS=1460 SACK_PERM TSval=1334019471 TSecr=1143103675 WS=128"
"216","2.159022686","66","9e:b3:64:49:44:da","f6:c2:5b:29:82:f0","172.20.0.3","172.20.0.2","TCP","32968 → 4433 [ACK] Seq=1 Ack=1 Win=64256 Len=0 TSval=1143103676 TSecr=1334019471"
"217","2.159057865","1672","9e:b3:64:49:44:da","f6:c2:5b:29:82:f0","172.20.0.3","172.20.0.2","TLSv1.2","Client Hello"
"218","2.159063419","66","f6:c2:5b:29:82:f0","9e:b3:64:49:44:da","172.20.0.2","172.20.0.3","TCP","4433 → 32968 [ACK] Seq=1 Ack=1607 Win=64128 Len=0 TSval=1334019471 TSecr=1143103676"
"219","2.160691960","1955","f6:c2:5b:29:82:f0","9e:b3:64:49:44:da","172.20.0.2","172.20.0.3","TLSv1.3","Server Hello, Change Cipher Spec, Application Data, Application Data, Application Data, Application Data"
"220","2.160722930","66","9e:b3:64:49:44:da","f6:c2:5b:29:82:f0","172.20.0.3","172.20.0.2","TCP","32968 → 4433 [ACK] Seq=1607 Ack=1890 Win=64128 Len=0 TSval=1143103677 TSecr=1334019472"
"221","2.163653963","146","9e:b3:64:49:44:da","f6:c2:5b:29:82:f0","172.20.0.3","172.20.0.2","TLSv1.3","Change Cipher Spec, Application Data"
"222","2.163720175","66","9e:b3:64:49:44:da","f6:c2:5b:29:82:f0","172.20.0.3","172.20.0.2","TCP","32968 → 4433 [RST, ACK] Seq=1687 Ack=1890 Win=64128 Len=0 TSval=1143103680 TSecr=1334019472"
"223","2.174448188","74","9e:b3:64:49:44:da","f6:c2:5b:29:82:f0","172.20.0.3","172.20.0.2","TCP","32976 → 4433 [SYN] Seq=0 Win=64240 Len=0 MSS=1460 SACK_PERM TSval=1143103691 TSecr=0 WS=128"
"224","2.174472271","74","f6:c2:5b:29:82:f0","9e:b3:64:49:44:da","172.20.0.2","172.20.0.3","TCP","4433 → 32976 [SYN, ACK] Seq=0 Ack=1 Win=65160 Len=0 MSS=1460 SACK_PERM TSval=1334019486 TSecr=1143103691 WS=128"
"225","2.174489484","66","9e:b3:64:49:44:da","f6:c2:5b:29:82:f0","172.20.0.3","172.20.0.2","TCP","32976 → 4433 [ACK] Seq=1 Ack=1 Win=64256 Len=0 TSval=1143103691 TSecr=1334019486"
