frame.number,frame.time_relative,frame.len,eth.src,eth.dst,ip.src,ip.dst,_ws.col.protocol,_ws.col.info
"1","0.000000000","42","fe:71:62:34:47:3b","ff:ff:ff:ff:ff:ff",,,"ARP","ARP Announcement for 172.20.0.3"
"2","0.031596884","42","fe:71:62:34:47:3b","ff:ff:ff:ff:ff:ff",,,"ARP","Who has 172.20.0.2? Tell 172.20.0.3"
"3","0.031620561","42","d2:70:80:a4:39:07","fe:71:62:34:47:3b",,,"ARP","172.20.0.2 is at d2:70:80:a4:39:07"
"4","0.031627848","74","fe:71:62:34:47:3b","d2:70:80:a4:39:07","172.20.0.3","172.20.0.2","TCP","59376 → 4433 [SYN] Seq=0 Win=64240 Len=0 MSS=1460 SACK_PERM TSval=1139154817 TSecr=0 WS=128"
"5","0.031647775","74","d2:70:80:a4:39:07","fe:71:62:34:47:3b","172.20.0.2","172.20.0.3","TCP","4433 → 59376 [SYN, ACK] Seq=0 Ack=1 Win=65160 Len=0 MSS=1460 SACK_PERM TSval=1330070612 TSecr=1139154817 WS=128"
"6","0.031671072","66","fe:71:62:34:47:3b","d2:70:80:a4:39:07","172.20.0.3","172.20.0.2","TCP","59376 → 4433 [ACK] Seq=1 Ack=1 Win=64256 Len=0 TSval=1139154817 TSecr=1330070612"
"7","0.031713327","1320","fe:71:62:34:47:3b","d2:70:80:a4:39:07","172.20.0.3","172.20.0.2","TLSv1.2","Client Hello"
"8","0.031717949","66","d2:70:80:a4:39:07","fe:71:62:34:47:3b","172.20.0.2","172.20.0.3","TCP","4433 → 59376 [ACK] Seq=1 Ack=1255 Win=64128 Len=0 TSval=1330070612 TSecr=1139154817"
"9","0.033340537","1504","d2:70:80:a4:39:07","fe:71:62:34:47:3b","172.20.0.2","172.20.0.3","TLSv1.3","Server Hello, Change Cipher Spec, Application Data, Application Data, Application Data, Application Data"
"10","0.033387705","66","fe:71:62:34:47:3b","d2:70:80:a4:39:07","172.20.0.3","172.20.0.2","TCP","59376 → 4433 [ACK] Seq=1255 Ack=1439 Win=64128 Len=0 TSval=1139154819 TSecr=1330070614"
"11","0.034457828","146","fe:71:62:34:47:3b","d2:70:80:a4:39:07","172.20.0.3","172.20.0.2","TLSv1.3","Change Cipher Spec, Application Data"
"12","0.034516336","66","fe:71:62:34:47:3b","d2:70:80:a4:39:07","172.20.0.3","172.20.0.2","TCP","59376 → 4433 [RST, ACK] Seq=1335 Ack=1439 Win=64128 Len=0 TSval=1139154820 TSecr=1330070614"
"13","0.046455348","74","fe:71:62:34:47:3b","d2:70:80:a4:39:07","172.20.0.3","172.20.0.2","TCP","59390 → 4433 [SYN] Seq=0 Win=64240 Len=0 MSS=1460 SACK_PERM TSval=1139154832 TSecr=0 WS=128"
"14","0.046479913","74","d2:70:80:a4:39:07","fe:71:62:34:47:3b","172.20.0.2","172.20.0.3","TCP","4433 → 59390 [SYN, ACK] Seq=0 Ack=1 Win=65160 Len=0 MSS=1460 SACK_PERM TSval=1330070627 TSecr=1139154832 WS=128"
"15","0.046497627","66","fe:71:62:34:47:3b","d2:70:80:a4:39:07","172.20.0.3","172.20.0.2","TCP","59390 → 4433 [ACK] Seq=1 Ack=1 Win=64256 Len=0 TSval=1139154832 TSecr=1330070627"
"16","0.046538639","1320","fe:71:62:34:47:3b","d2:70:80:a4:39:07","172.20.0.3","172.20.0.2","TLSv1.2","Client Hello"
"17","0.046544817","66","d2:70:80:a4:39:07","fe:71:62:34:47:3b","172.20.0.2","172.20.0.3","TCP","4433 → 59390 [ACK] Seq=1 Ack=1255 Win=64128 Len=0 TSval=1330070627 TSecr=1139154832"
"18","0.047516730","1504","d2:70:80:a4:39:07","fe:71:62:34:47:3b","172.20.0.2","172.20.0.3","TLSv1.3","Server Hello, Change Cipher Spec, Application Data, Application Data, Application Data, Application Data"
"19","0.047558931","66","fe:71:62:34:47:3b","d2:70:80:a4:39:07","172.20.0.3","172.20.0.2","TCP","59390 → 4433 [ACK] Seq=1255 Ack=1439 Win=64128 Len=0 TSval=1139154833 TSecr=1330070628"
"20","0.048628899","146","fe:71:62:34:47:3b","d2:70:80:a4:39:07","172.20.0.3","172.20.0.2","TLSv1.3","Change Cipher Spec, Application Data"
"21","0.048695466","66","fe:71:62:34:47:3b","d2:70:80:a4:39:07","172.20.0.3","172.20.0.2","TCP","59390 → 4433 [RST, ACK] Seq=1335 Ack=1439 Win=64128 Len=0 TSval=1139154834 TSecr=1330070628"
"22","0.063487665","74","fe:71:62:34:47:3b","d2:70:80:a4:39:07","172.20.0.3","172.20.0.2","TCP","59392 → 4433 [SYN] Seq=0 Win=64240 Len=0 MSS=1460 SACK_PERM TSval=1139154849 TSecr=0 WS=128"
"23","0.063520634","74","d2:70:80:a4:39:07","fe:71:62:34:47:3b","172.20.0.2","172.20.0.3","TCP","4433 → 59392 [SYN, ACK] Seq=0 Ack=1 Win=65160 Len=0 MSS=1460 SACK_PERM TSval=1330070644 TSecr=1139154849 WS=128"
"24","0.063545157","66","fe:71:62:34:47:3b","d2:70:80:a4:39:07","172.20.0.3","172.20.0.2","TCP","59392 → 4433 [ACK] Seq=1 Ack=1 Win=64256 Len=0 TSval=1139154849 TSecr=1330070644"
"25","0.063602056","1320","fe:71:62:34:47:3b","d2:70:80:a4:39:07","172.20.0.3","172.20.0.2","TLSv1.2","Client Hello"
"26","0.063607939","66","d2:70:80:a4:39:07","fe:71:62:34:47:3b","172.20.0.2","172.20.0.3","TCP","4433 → 59392 [ACK] Seq=1 Ack=1255 Win=64128 Len=0 TSval=1330070644 TSecr=1139154849"
"27","0.064234412","1504","d2:70:80:a4:39:07","fe:71:62:34:47:3b","172.20.0.2","172.20.0.3","TLSv1.3","Server Hello, Change Cipher Spec, Application Data, Application Data, Application Data, Application Data"
"28","0.064264800","66","fe:71:62:34:47:3b","d2:70:80:a4:39:07","172.20.0.3","172.20.0.2","TCP","59392 → 4433 [ACK] Seq=1255 Ack=1439 Win=64128 Len=0 TSval=1139154850 TSecr=1330070645"
"29","0.065848419","146","fe:71:62:34:47:3b","d2:70:80:a4:39:07","172.20.0.3","172.20.0.2","TLSv1.3","Change Cipher Spec, Application Data"
"30","0.065937523","66","fe:71:62:34:47:3b","d2:70:80:a4:39:07","172.20.0.3","172.20.0.2","TCP","59392 → 4433 [RST, ACK] Seq=1335 Ack=1439 Win=64128 Len=0 TSval=1139154852 TSecr=1330070645"
"31","0.079992692","74","fe:71:62:34:47:3b","d2:70:80:a4:39:07","172.20.0.3","172.20.0.2","TCP","59406 → 4433 [SYN] Seq=0 Win=64240 Len=0 MSS=1460 SACK_PERM TSval=1139154866 TSecr=0 WS=128"
"32","0.080023421","74","d2:70:80:a4:39:07","fe:71:62:34:47:3b","172.20.0.2","172.20.0.3","TCP","4433 → 59406 [SYN, ACK] Seq=0 Ack=1 Win=65160 Len=0 MSS=1460 SACK_PERM TSval=1330070661 TSecr=1139154866 WS=128"
"33","0.080048153","66","fe:71:62:34:47:3b","d2:70:80:a4:39:07","172.20.0.3","172.20.0.2","TCP","59406 → 4433 [ACK] Seq=1 Ack=1 Win=64256 Len=0 TSval=1139154866 TSecr=1330070661"
"34","0.080101827","1320","fe:71:62:34:47:3b","d2:70:80:a4:39:07","172.20.0.3","172.20.0.2","TLSv1.2","Client Hello"
"35","0.080109919","66","d2:70:80:a4:39:07","fe:71:62:34:47:3b","172.20.0.2","172.20.0.3","TCP","4433 → 59406 [ACK] Seq=1 Ack=1255 Win=64128 Len=0 TSval=1330070661 TSecr=1139154866"
"36","0.080689146","1504","d2:70:80:a4:39:07","fe:71:62:34:47:3b","172.20.0.2","172.20.0.3","TLSv1.3","Server Hello, Change Cipher Spec, Application Data, Application Data, Application Data, Application Data"
"37","0.080725995","66","fe:71:62:34:47:3b","d2:70:80:a4:39:07","172.20.0.3","172.20.0.2","TCP","59406 → 4433 [ACK] Seq=1255 Ack=1439 Win=64128 Len=0 TSval=1139154866 TSecr=1330070661"
"38","0.082211576","146","fe:71:62:34:47:3b","d2:70:80:a4:39:07","172.20.0.3","172.20.0.2","TLSv1.3","Change Cipher Spec, Application Data"
"39","0.082288216","66","fe:71:62:34:47:3b","d2:70:80:a4:39:07","172.20.0.3","172.20.0.2","TCP","59406 → 4433 [RST, ACK] Seq=1335 Ack=1439 Win=64128 Len=0 TSval=1139154868 TSecr=1330070661"
"40","0.094138020","74","fe:71:62:34:47:3b","d2:70:80:a4:39:07","172.20.0.3","172.20.0.2","TCP","59418 → 4433 [SYN] Seq=0 Win=64240 Len=0 MSS=1460 SACK_PERM TSval=1139154880 TSecr=0 WS=128"
"41","0.094174070","74","d2:70:80:a4:39:07","fe:71:62:34:47:3b","172.20.0.2","172.20.0.3","TCP","4433 → 59418 [SYN, ACK] Seq=0 Ack=1 Win=65160 Len=0 MSS=1460 SACK_PERM TSval=1330070675 TSecr=1139154880 WS=128"
"42","0.094197692","66","fe:71:62:34:47:3b","d2:70:80:a4:39:07","172.20.0.3","172.20.0.2","TCP","59418 → 4433 [ACK] Seq=1 Ack=1 Win=64256 Len=0 TSval=1139154880 TSecr=1330070675"
"43","0.094255916","1320","fe:71:62:34:47:3b","d2:70:80:a4:39:07","172.20.0.3","172.20.0.2","TLSv1.2","Client Hello"
"44","0.094260190","66","d2:70:80:a4:39:07","fe:71:62:34:47:3b","172.20.0.2","172.20.0.3","TCP","4433 → 59418 [ACK] Seq=1 Ack=1255 Win=64128 Len=0 TSval=1330070675 TSecr=1139154880"
"45","0.095075495","1504","d2:70:80:a4:39:07","fe:71:62:34:47:3b","172.20.0.2","172.20.0.3","TLSv1.3","Server Hello, Change Cipher Spec, Application Data, Application Data, Application Data, Application Data"
"46","0.095108251","66","fe:71:62:34:47:3b","d2:70:80:a4:39:07","172.20.0.3","172.20.0.2","TCP","59418 → 4433 [ACK] Seq=1255 Ack=1439 Win=64128 Len=0 TSval=1139154881 TSecr=1330070676"
"47","0.096222009","146","fe:71:62:34:47:3b","d2:70:80:a4:39:07","172.20.0.3","172.20.0.2","TLSv1.3","Change Cipher Spec, Application Data"
"48","0.096282514","66","fe:71:62:34:47:3b","d2:70:80:a4:39:07","172.20.0.3","172.20.0.2","TCP","59418 → 4433 [RST, ACK] Seq=1335 Ack=1439 Win=64128 Len=0 TSval=1139154882 TSecr=1330070676"
"49","0.107464775","74","fe:71:62:34:47:3b","d2:70:80:a4:39:07","172.20.0.3","172.20.0.2","TCP","59420 → 4433 [SYN] Seq=0 Win=64240 Len=0 MSS=1460 SACK_PERM TSval=1139154893 TSecr=0 WS=128"
"50","0.107499593","74","d2:70:80:a4:39:07","fe:71:62:34:47:3b","172.20.0.2","172.20.0.3","TCP","4433 → 59420 [SYN, ACK] Seq=0 Ack=1 Win=65160 Len=0 MSS=1460 SACK_PERM TSval=1330070688 TSecr=1139154893 WS=128"
"51","0.107525391","66","fe:71:62:34:47:3b","d2:70:80:a4:39:07","172.20.0.3","172.20.0.2","TCP","59420 → 4433 [ACK] Seq=1 Ack=1 Win=64256 Len=0 TSval=1139154893 TSecr=1330070688"
"52","0.107576334","1320","fe:71:62:34:47:3b","d2:70:80:a4:39:07","172.20.0.3","172.20.0.2","TLSv1.2","Client Hello"
"53","0.107592033","66","d2:70:80:a4:39:07","fe:71:62:34:47:3b","172.20.0.2","172.20.0.3","TCP","4433 → 59420 [ACK] Seq=1 Ack=1255 Win=64128 Len=0 TSval=1330070688 TSecr=1139154893"
"54","0.108372472","1504","d2:70:80:a4:39:07","fe:71:62:34:47:3b","172.20.0.2","172.20.0.3","TLSv1.3","Server Hello, Change Cipher Spec, Application Data, Application Data, Application Data, Application Data"
"55","0.108405313","66","fe:71:62:34:47:3b","d2:70:80:a4:39:07","172.20.0.3","172.20.0.2","TCP","59420 → 4433 [ACK] Seq=1255 Ack=1439 Win=64128 Len=0 TSval=1139154894 TSecr=1330070689"
"56","0.109535520","146","fe:71:62:34:47:3b","d2:70:80:a4:39:07","172.20.0.3","172.20.0.2","TLSv1.3","Change Cipher Spec, Application Data"
"57","0.109595548","66","fe:71:62:34:47:3b","d2:70:80:a4:39:07","172.20.0.3","172.20.0.2","TCP","59420 → 4433 [RST, ACK] Seq=1335 Ack=1439 Win=64128 Len=0 TSval=1139154895 TSecr=1330070689"
"58","0.120772406","74","fe:71:62:34:47:3b","d2:70:80:a4:39:07","172.20.0.3","172.20.0.2","TCP","59436 → 4433 [SYN] Seq=0 Win=64240 Len=0 MSS=1460 SACK_PERM TSval=1139154906 TSecr=0 WS=128"
"59","0.120798179","74","d2:70:80:a4:39:07","fe:71:62:34:47:3b","172.20.0.2","172.20.0.3","TCP","4433 → 59436 [SYN, ACK] Seq=0 Ack=1 Win=65160 Len=0 MSS=1460 SACK_PERM TSval=1330070702 TSecr=1139154906 WS=128"
"60","0.120813649","66","fe:71:62:34:47:3b","d2:70:80:a4:39:07","172.20.0.3","172.20.0.2","TCP","59436 → 4433 [ACK] Seq=1 Ack=1 Win=64256 Len=0 TSval=1139154907 TSecr=1330070702"
"61","0.120856567","1320","fe:71:62:34:47:3b","d2:70:80:a4:39:07","172.20.0.3","172.20.0.2","TLSv1.2","Client Hello"
"62","0.120861017","66","d2:70:80:a4:39:07","fe:71:62:34:47:3b","172.20.0.2","172.20.0.3","TCP","4433 → 59436 [ACK] Seq=1 Ack=1255 Win=64128 Len=0 TSval=1330070702 TSecr=1139154907"
"63","0.121487182","1504","d2:70:80:a4:39:07","fe:71:62:34:47:3b","172.20.0.2","172.20.0.3","TLSv1.3","Server Hello, Change Cipher Spec, Application Data, Application Data, Application Data, Application Data"
"64","0.121520619","66","fe:71:62:34:47:3b","d2:70:80:a4:39:07","172.20.0.3","172.20.0.2","TCP","59436 → 4433 [ACK] Seq=1255 Ack=1439 Win=64128 Len=0 TSval=1139154907 TSecr=1330070702"
"65","0.122547099","146","fe:71:62:34:47:3b","d2:70:80:a4:39:07","172.20.0.3","172.20.0.2","TLSv1.3","Change Cipher Spec, Application Data"
"66","0.122599542","66","fe:71:62:34:47:3b","d2:70:80:a4:39:07","172.20.0.3","172.20.0.2","TCP","59436 → 4433 [RST, ACK] Seq=1335 Ack=1439 Win=64128 Len=0 TSval=1139154908 TSecr=1330070702"
"67","0.134359521","74","fe:71:62:34:47:3b","d2:70:80:a4:39:07","172.20.0.3","172.20.0.2","TCP","59450 → 4433 [SYN] Seq=0 Win=64240 Len=0 MSS=1460 SACK_PERM TSval=1139154920 TSecr=0 WS=128"
"68","0.134391348","74","d2:70:80:a4:39:07","fe:71:62:34:47:3b","172.20.0.2","172.20.0.3","TCP","4433 → 59450 [SYN, ACK] Seq=0 Ack=1 Win=65160 Len=0 MSS=1460 SACK_PERM TSval=1330070715 TSecr=1139154920 WS=128"
"69","0.134412279","66","fe:71:62:34:47:3b","d2:70:80:a4:39:07","172.20.0.3","172.20.0.2","TCP","59450 → 4433 [ACK] Seq=1 Ack=1 Win=64256 Len=0 TSval=1139154920 TSecr=1330070715"
"70","0.134466219","1320","fe:71:62:34:47:3b","d2:70:80:a4:39:07","172.20.0.3","172.20.0.2","TLSv1.2","Client Hello"
"71","0.134470802","66","d2:70:80:a4:39:07","fe:71:62:34:47:3b","172.20.0.2","172.20.0.3","TCP","4433 → 59450 [ACK] Seq=1 Ack=1255 Win=64128 Len=0 TSval=1330070715 TSecr=1139154920"
"72","0.135304545","1504","d2:70:80:a4:39:07","fe:71:62:34:47:3b","172.20.0.2","172.20.0.3","TLSv1.3","Server Hello, Change Cipher Spec, Application Data, Application Data, Application Data, Application Data"
"73","0.135347210","66","fe:71:62:34:47:3b","d2:70:80:a4:39:07","172.20.0.3","172.20.0.2","TCP","59450 → 4433 [ACK] Seq=1255 Ack=1439 Win=64128 Len=0 TSval=1139154921 TSecr=1330070716"
"74","0.136492224","146","fe:71:62:34:47:3b","d2:70:80:a4:39:07","172.20.0.3","172.20.0.2","TLSv1.3","Change Cipher Spec, Application Data"
"75","0.136554139","66","fe:71:62:34:47:3b","d2:70:80:a4:39:07","172.20.0.3","172.20.0.2","TCP","59450 → 4433 [RST, ACK] Seq=1335 Ack=1439 Win=64128 Len=0 TSval=1139154922 TSecr=1330070716"
"76","0.147084667","74","fe:71:62:34:47:3b","d2:70:80:a4:39:07","172.20.0.3","172.20.0.2","TCP","59456 → 4433 [SYN] Seq=0 Win=64240 Len=0 MSS=1460 SACK_PERM TSval=1139154933 TSecr=0 WS=128"
"77","0.147109205","74","d2:70:80:a4:39:07","fe:71:62:34:47:3b","172.20.0.2","172.20.0.3","TCP","4433 → 59456 [SYN, ACK] Seq=0 Ack=1 Win=65160 Len=0 MSS=1460 SACK_PERM TSval=1330070728 TSecr=1139154933 WS=128"
"78","0.147128177","66","fe:71:62:34:47:3b","d2:70:80:a4:39:07","172.20.0.3","172.20.0.2","TCP","59456 → 4433 [ACK] Seq=1 Ack=1 Win=64256 Len=0 TSval=1139154933 TSecr=1330070728"
"79","0.147170619","1320","fe:71:62:34:47:3b","d2:70:80:a4:39:07","172.20.0.3","172.20.0.2","TLSv1.2","Client Hello"
"80","0.147176198","66","d2:70:80:a4:39:07","fe:71:62:34:47:3b","172.20.0.2","172.20.0.3","TCP","4433 → 59456 [ACK] Seq=1 Ack=1255 Win=64128 Len=0 TSval=1330070728 TSecr=1139154933"
"81","0.147868518","1504","d2:70:80:a4:39:07","fe:71:62:34:47:3b","172.20.0.2","172.20.0.3","TLSv1.3","Server Hello, Change Cipher Spec, Application Data, Application Data, Application Data, Application Data"
"82","0.147903195","66","fe:71:62:34:47:3b","d2:70:80:a4:39:07","172.20.0.3","172.20.0.2","TCP","59456 → 4433 [ACK] Seq=1255 Ack=1439 Win=64128 Len=0 TSval=1139154934 TSecr=1330070729"
"83","0.149021056","146","fe:71:62:34:47:3b","d2:70:80:a4:39:07","172.20.0.3","172.20.0.2","TLSv1.3","Change Cipher Spec, Application Data"
"84","0.149078278","66","fe:71:62:34:47:3b","d2:70:80:a4:39:07","172.20.0.3","172.20.0.2","TCP","59456 → 4433 [RST, ACK] Seq=1335 Ack=1439 Win=64128 Len=0 TSval=1139154935 TSecr=1330070729"
"85","0.160219763","74","fe:71:62:34:47:3b","d2:70:80:a4:39:07","172.20.0.3","172.20.0.2","TCP","59458 → 4433 [SYN] Seq=0 Win=64240 Len=0 MSS=1460 SACK_PERM TSval=1139154946 TSecr=0 WS=128"
"86","0.160249312","74","d2:70:80:a4:39:07","fe:71:62:34:47:3b","172.20.0.2","172.20.0.3","TCP","4433 → 59458 [SYN, ACK] Seq=0 Ack=1 Win=65160 Len=0 MSS=1460 SACK_PERM TSval=1330070741 TSecr=1139154946 WS=128"
"87","0.160268801","66","fe:71:62:34:47:3b","d2:70:80:a4:39:07","172.20.0.3","172.20.0.2","TCP","59458 → 4433 [ACK] Seq=1 Ack=1 Win=64256 Len=0 TSval=1139154946 TSecr=1330070741"
"88","0.160317211","1320","fe:71:62:34:47:3b","d2:70:80:a4:39:07","172.20.0.3","172.20.0.2","TLSv1.2","Client Hello"
"89","0.160321526","66","d2:70:80:a4:39:07","fe:71:62:34:47:3b","172.20.0.2","172.20.0.3","TCP","4433 → 59458 [ACK] Seq=1 Ack=1255 Win=64128 Len=0 TSval=1330070741 TSecr=1139154946"
"90","0.160995078","1504","d2:70:80:a4:39:07","fe:71:62:34:47:3b","172.20.0.2","172.20.0.3","TLSv1.3","Server Hello, Change Cipher Spec, Application Data, Application Data, Application Data, Application Data"
"91","0.161028400","66","fe:71:62:34:47:3b","d2:70:80:a4:39:07","172.20.0.3","172.20.0.2","TCP","59458 → 4433 [ACK] Seq=1255 Ack=1439 Win=64128 Len=0 TSval=1139154947 TSecr=1330070742"
"92","0.162104897","146","fe:71:62:34:47:3b","d2:70:80:a4:39:07","172.20.0.3","172.20.0.2","TLSv1.3","Change Cipher Spec, Application Data"
"93","0.162167951","66","fe:71:62:34:47:3b","d2:70:80:a4:39:07","172.20.0.3","172.20.0.2","TCP","59458 → 4433 [RST, ACK] Seq=1335 Ack=1439 Win=64128 Len=0 TSval=1139154948 TSecr=1330070742"
"94","0.172902481","74","fe:71:62:34:47:3b","d2:70:80:a4:39:07","172.20.0.3","172.20.0.2","TCP","59468 → 4433 [SYN] Seq=0 Win=64240 Len=0 MSS=1460 SACK_PERM TSval=1139154959 TSecr=0 WS=128"
"95","0.172924921","74","d2:70:80:a4:39:07","fe:71:62:34:47:3b","172.20.0.2","172.20.0.3","TCP","4433 → 59468 [SYN, ACK] Seq=0 Ack=1 Win=65160 Len=0 MSS=1460 SACK_PERM TSval=1330070754 TSecr=1139154959 WS=128"
"96","0.172940502","66","fe:71:62:34:47:3b","d2:70:80:a4:39:07","172.20.0.3","172.20.0.2","TCP","59468 → 4433 [ACK] Seq=1 Ack=1 Win=64256 Len=0 TSval=1139154959 TSecr=1330070754"
"97","0.172979733","1320","fe:71:62:34:47:3b","d2:70:80:a4:39:07","172.20.0.3","172.20.0.2","TLSv1.2","Client Hello"
"98","0.172985157","66","d2:70:80:a4:39:07","fe:71:62:34:47:3b","172.20.0.2","172.20.0.3","TCP","4433 → 59468 [ACK] Seq=1 Ack=1255 Win=64128 Len=0 TSval=1330070754 TSecr=1139154959"
"99","0.173563322","1504","d2:70:80:a4:39:07","fe:71:62:34:47:3b","172.20.0.2","172.20.0.3","TLSv1.3","Server Hello, Change Cipher Spec, Application Data, Application Data, Application Data, Application Data"
"100","0.173596822","66","fe:71:62:34:47:3b","d2:70:80:a4:39:07","172.20.0.3","172.20.0.2","TCP","59468 → 4433 [ACK] Seq=1255 Ack=1439 Win=64128 Len=0 TSval=1139154959 TSecr=1330070754"
"101","0.174785234","146","fe:71:62:34:47:3b","d2:70:80:a4:39:07","172.20.0.3","172.20.0.2","TLSv1.3","Change Cipher Spec, Application Data"
"102","0.174844670","66","fe:71:62:34:47:3b","d2:70:80:a4:39:07","172.20.0.3","172.20.0.2","TCP","59468 → 4433 [RST, ACK] Seq=1335 Ack=1439 Win=64128 Len=0 TSval=1139154961 TSecr=1330070754"
"103","0.185401225","74","fe:71:62:34:47:3b","d2:70:80:a4:39:07","172.20.0.3","172.20.0.2","TCP","59470 → 4433 [SYN] Seq=0 Win=64240 Len=0 MSS=1460 SACK_PERM TSval=1139154971 TSecr=0 WS=128"
"104","0.185422864","74","d2:70:80:a4:39:07","fe:71:62:34:47:3b","172.20.0.2","172.20.0.3","TCP","4433 → 59470 [SYN, ACK] Seq=0 Ack=1 Win=65160 Len=0 MSS=1460 SACK_PERM TSval=1330070766 TSecr=1139154971 WS=128"
"105","0.185439664","66","fe:71:62:34:47:3b","d2:70:80:a4:39:07","172.20.0.3","172.20.0.2","TCP","59470 → 4433 [ACK] Seq=1 Ack=1 Win=64256 Len=0 TSval=1139154971 TSecr=1330070766"
"106","0.185478552","1320","fe:71:62:34:47:3b","d2:70:80:a4:39:07","172.20.0.3","172.20.0.2","TLSv1.2","Client Hello"
"107","0.185482271","66","d2:70:80:a4:39:07","fe:71:62:34:47:3b","172.20.0.2","172.20.0.3","TCP","4433 → 59470 [ACK] Seq=1 Ack=1255 Win=64128 Len=0 TSval=1330070766 TSecr=1139154971"
"108","0.186073410","1504","d2:70:80:a4:39:07","fe:71:62:34:47:3b","172.20.0.2","172.20.0.3","TLSv1.3","Server Hello, Change Cipher Spec, Application Data, Application Data, Application Data, Application Data"
"109","0.186102866","66","fe:71:62:34:47:3b","d2:70:80:a4:39:07","172.20.0.3","172.20.0.2","TCP","59470 → 4433 [ACK] Seq=1255 Ack=1439 Win=64128 Len=0 TSval=1139154972 TSecr=1330070767"
"110","0.187105433","146","fe:71:62:34:47:3b","d2:70:80:a4:39:07","172.20.0.3","172.20.0.2","TLSv1.3","Change Cipher Spec, Application Data"
"111","0.187158886","66","fe:71:62:34:47:3b","d2:70:80:a4:39:07","172.20.0.3","172.20.0.2","TCP","59470 → 4433 [RST, ACK] Seq=1335 Ack=1439 Win=64128 Len=0 TSval=1139154973 TSecr=1330070767"
"112","0.198249795","74","fe:71:62:34:47:3b","d2:70:80:a4:39:07","172.20.0.3","172.20.0.2","TCP","59474 → 4433 [SYN] Seq=0 Win=64240 Len=0 MSS=1460 SACK_PERM TSval=1139154984 TSecr=0 WS=128"
"113","0.198277806","74","d2:70:80:a4:39:07","fe:71:62:34:47:3b","172.20.0.2","172.20.0.3","TCP","4433 → 59474 [SYN, ACK] Seq=0 Ack=1 Win=65160 Len=0 MSS=1460 SACK_PERM TSval=1330070779 TSecr=1139154984 WS=128"
"114","0.198297791","66","fe:71:62:34:47:3b","d2:70:80:a4:39:07","172.20.0.3","172.20.0.2","TCP","59474 → 4433 [ACK] Seq=1 Ack=1 Win=64256 Len=0 TSval=1139154984 TSecr=1330070779"
"115","0.198354754","1320","fe:71:62:34:47:3b","d2:70:80:a4:39:07","172.20.0.3","172.20.0.2","TLSv1.2","Client Hello"
"116","0.198359683","66","d2:70:80:a4:39:07","fe:71:62:34:47:3b","172.20.0.2","172.20.0.3","TCP","4433 → 59474 [ACK] Seq=1 Ack=1255 Win=64128 Len=0 TSval=1330070779 TSecr=1139154984"
"117","0.199094220","1504","d2:70:80:a4:39:07","fe:71:62:34:47:3b","172.20.0.2","172.20.0.3","TLSv1.3","Server Hello, Change Cipher Spec, Application Data, Application Data, Application Data, Application Data"
"118","0.199126878","66","fe:71:62:34:47:3b","d2:70:80:a4:39:07","172.20.0.3","172.20.0.2","TCP","59474 → 4433 [ACK] Seq=1255 Ack=1439 Win=64128 Len=0 TSval=1139154985 TSecr=1330070780"
"119","0.200181236","146","fe:71:62:34:47:3b","d2:70:80:a4:39:07","172.20.0.3","172.20.0.2","TLSv1.3","Change Cipher Spec, Application Data"
"120","0.200240069","66","fe:71:62:34:47:3b","d2:70:80:a4:39:07","172.20.0.3","172.20.0.2","TCP","59474 → 4433 [RST, ACK] Seq=1335 Ack=1439 Win=64128 Len=0 TSval=1139154986 TSecr=1330070780"
"121","0.210737168","74","fe:71:62:34:47:3b","d2:70:80:a4:39:07","172.20.0.3","172.20.0.2","TCP","59480 → 4433 [SYN] Seq=0 Win=64240 Len=0 MSS=1460 SACK_PERM TSval=1139154996 TSecr=0 WS=128"
"122","0.210773784","74","d2:70:80:a4:39:07","fe:71:62:34:47:3b","172.20.0.2","172.20.0.3","TCP","4433 → 59480 [SYN, ACK] Seq=0 Ack=1 Win=65160 Len=0 MSS=1460 SACK_PERM TSval=1330070792 TSecr=1139154996 WS=128"
"123","0.210813254","66","fe:71:62:34:47:3b","d2:70:80:a4:39:07","172.20.0.3","172.20.0.2","TCP","59480 → 4433 [ACK] Seq=1 Ack=1 Win=64256 Len=0 TSval=1139154997 TSecr=1330070792"
"124","0.210859234","1320","fe:71:62:34:47:3b","d2:70:80:a4:39:07","172.20.0.3","172.20.0.2","TLSv1.2","Client Hello"
"125","0.210864589","66","d2:70:80:a4:39:07","fe:71:62:34:47:3b","172.20.0.2","172.20.0.3","TCP","4433 → 59480 [ACK] Seq=1 Ack=1255 Win=64128 Len=0 TSval=1330070792 TSecr=1139154997"
"126","0.211463443","1504","d2:70:80:a4:39:07","fe:71:62:34:47:3b","172.20.0.2","172.20.0.3","TLSv1.3","Server Hello, Change Cipher Spec, Application Data, Application Data, Application Data, Application Data"
"127","0.211502879","66","fe:71:62:34:47:3b","d2:70:80:a4:39:07","172.20.0.3","172.20.0.2","TCP","59480 → 4433 [ACK] Seq=1255 Ack=1439 Win=64128 Len=0 TSval=1139154997 TSecr=1330070792"
"128","0.212605385","146","fe:71:62:34:47:3b","d2:70:80:a4:39:07","172.20.0.3","172.20.0.2","TLSv1.3","Change Cipher Spec, Application Data"
"129","0.212659861","66","fe:71:62:34:47:3b","d2:70:80:a4:39:07","172.20.0.3","172.20.0.2","TCP","59480 → 4433 [RST, ACK] Seq=1335 Ack=1439 Win=64128 Len=0 TSval=1139154998 TSecr=1330070792"
"130","0.224705744","74","fe:71:62:34:47:3b","d2:70:80:a4:39:07","172.20.0.3","172.20.0.2","TCP","59484 → 4433 [SYN] Seq=0 Win=64240 Len=0 MSS=1460 SACK_PERM TSval=1139155010 TSecr=0 WS=128"
"131","0.224731578","74","d2:70:80:a4:39:07","fe:71:62:34:47:3b","172.20.0.2","172.20.0.3","TCP","4433 → 59484 [SYN, ACK] Seq=0 Ack=1 Win=65160 Len=0 MSS=1460 SACK_PERM TSval=1330070805 TSecr=1139155010 WS=128"
"132","0.224748312","66","fe:71:62:34:47:3b","d2:70:80:a4:39:07","172.20.0.3","172.20.0.2","TCP","59484 → 4433 [ACK] Seq=1 Ack=1 Win=64256 Len=0 TSval=1139155010 TSecr=1330070805"
"133","0.224800904","1320","fe:71:62:34:47:3b","d2:70:80:a4:39:07","172.20.0.3","172.20.0.2","TLSv1.2","Client Hello"
"134","0.224807808","66","d2:70:80:a4:39:07","fe:71:62:34:47:3b","172.20.0.2","172.20.0.3","TCP","4433 → 59484 [ACK] Seq=1 Ack=1255 Win=64128 Len=0 TSval=1330070806 TSecr=1139155011"
"135","0.225372325","1504","d2:70:80:a4:39:07","fe:71:62:34:47:3b","172.20.0.2","172.20.0.3","TLSv1.3","Server Hello, Change Cipher Spec, Application Data, Application Data, Application Data, Application Data"
"136","0.225405179","66","fe:71:62:34:47:3b","d2:70:80:a4:39:07","172.20.0.3","172.20.0.2","TCP","59484 → 4433 [ACK] Seq=1255 Ack=1439 Win=64128 Len=0 TSval=1139155011 TSecr=1330070806"
"137","0.226508643","146","fe:71:62:34:47:3b","d2:70:80:a4:39:07","172.20.0.3","172.20.0.2","TLSv1.3","Change Cipher Spec, Application Data"
"138","0.226564317","66","fe:71:62:34:47:3b","d2:70:80:a4:39:07","172.20.0.3","172.20.0.2","TCP","59484 → 4433 [RST, ACK] Seq=1335 Ack=1439 Win=64128 Len=0 TSval=1139155012 TSecr=1330070806"
"139","0.241451817","74","fe:71:62:34:47:3b","d2:70:80:a4:39:07","172.20.0.3","172.20.0.2","TCP","59492 → 4433 [SYN] Seq=0 Win=64240 Len=0 MSS=1460 SACK_PERM TSval=1139155027 TSecr=0 WS=128"
"140","0.241480831","74","d2:70:80:a4:39:07","fe:71:62:34:47:3b","172.20.0.2","172.20.0.3","TCP","4433 → 59492 [SYN, ACK] Seq=0 Ack=1 Win=65160 Len=0 MSS=1460 SACK_PERM TSval=1330070822 TSecr=1139155027 WS=128"
"141","0.241511851","66","fe:71:62:34:47:3b","d2:70:80:a4:39:07","172.20.0.3","172.20.0.2","TCP","59492 → 4433 [ACK] Seq=1 Ack=1 Win=64256 Len=0 TSval=1139155027 TSecr=1330070822"
"142","0.241559992","1320","fe:71:62:34:47:3b","d2:70:80:a4:39:07","172.20.0.3","172.20.0.2","TLSv1.2","Client Hello"
"143","0.241565269","66","d2:70:80:a4:39:07","fe:71:62:34:47:3b","172.20.0.2","172.20.0.3","TCP","4433 → 59492 [ACK] Seq=1 Ack=1255 Win=64128 Len=0 TSval=1330070822 TSecr=1139155027"
"144","0.242441934","1504","d2:70:80:a4:39:07","fe:71:62:34:47:3b","172.20.0.2","172.20.0.3","TLSv1.3","Server Hello, Change Cipher Spec, Application Data, Application Data, Application Data, Application Data"
"145","0.242505168","66","fe:71:62:34:47:3b","d2:70:80:a4:39:07","172.20.0.3","172.20.0.2","TCP","59492 → 4433 [ACK] Seq=1255 Ack=1439 Win=64128 Len=0 TSval=1139155028 TSecr=1330070823"
"146","0.244021483","146","fe:71:62:34:47:3b","d2:70:80:a4:39:07","172.20.0.3","172.20.0.2","TLSv1.3","Change Cipher Spec, Application Data"
"147","0.244099002","66","fe:71:62:34:47:3b","d2:70:80:a4:39:07","172.20.0.3","172.20.0.2","TCP","59492 → 4433 [RST, ACK] Seq=1335 Ack=1439 Win=64128 Len=0 TSval=1139155030 TSecr=1330070823"
"148","0.258996628","74","fe:71:62:34:47:3b","d2:70:80:a4:39:07","172.20.0.3","172.20.0.2","TCP","59498 → 4433 [SYN] Seq=0 Win=64240 Len=0 MSS=1460 SACK_PERM TSval=1139155045 TSecr=0 WS=128"
"149","0.259027873","74","d2:70:80:a4:39:07","fe:71:62:34:47:3b","172.20.0.2","172.20.0.3","TCP","4433 → 59498 [SYN, ACK] Seq=0 Ack=1 Win=65160 Len=0 MSS=1460 SACK_PERM TSval=1330070840 TSecr=1139155045 WS=128"
"150","0.259050515","66","fe:71:62:34:47:3b","d2:70:80:a4:39:07","172.20.0.3","172.20.0.2","TCP","59498 → 4433 [ACK] Seq=1 Ack=1 Win=64256 Len=0 TSval=1139155045 TSecr=1330070840"
"151","0.259103063","1320","fe:71:62:34:47:3b","d2:70:80:a4:39:07","172.20.0.3","172.20.0.2","TLSv1.2","Client Hello"
"152","0.259111742","66","d2:70:80:a4:39:07","fe:71:62:34:47:3b","172.20.0.2","172.20.0.3","TCP","4433 → 59498 [ACK] Seq=1 Ack=1255 Win=64128 Len=0 TSval=1330070840 TSecr=1139155045"
"153","0.259666509","1504","d2:70:80:a4:39:07","fe:71:62:34:47:3b","172.20.0.2","172.20.0.3","TLSv1.3","Server Hello, Change Cipher Spec, Application Data, Application Data, Application Data, Application Data"
"154","0.259705598","66","fe:71:62:34:47:3b","d2:70:80:a4:39:07","172.20.0.3","172.20.0.2","TCP","59498 → 4433 [ACK] Seq=1255 Ack=1439 Win=64128 Len=0 TSval=1139155045 TSecr=1330070840"
"155","0.261216892","146","fe:71:62:34:47:3b","d2:70:80:a4:39:07","172.20.0.3","172.20.0.2","TLSv1.3","Change Cipher Spec, Application Data"
"156","0.261292193","66","fe:71:62:34:47:3b","d2:70:80:a4:39:07","172.20.0.3","172.20.0.2","TCP","59498 → 4433 [RST, ACK] Seq=1335 Ack=1439 Win=64128 Len=0 TSval=1139155047 TSecr=1330070840"
"157","0.272050796","74","fe:71:62:34:47:3b","d2:70:80:a4:39:07","172.20.0.3","172.20.0.2","TCP","59502 → 4433 [SYN] Seq=0 Win=64240 Len=0 MSS=1460 SACK_PERM TSval=1139155058 TSecr=0 WS=128"
"158","0.272074731","74","d2:70:80:a4:39:07","fe:71:62:34:47:3b","172.20.0.2","172.20.0.3","TCP","4433 → 59502 [SYN, ACK] Seq=0 Ack=1 Win=65160 Len=0 MSS=1460 SACK_PERM TSval=1330070853 TSecr=1139155058 WS=128"
"159","0.272091737","66","fe:71:62:34:47:3b","d2:70:80:a4:39:07","172.20.0.3","172.20.0.2","TCP","59502 → 4433 [ACK] Seq=1 Ack=1 Win=64256 Len=0 TSval=1139155058 TSecr=1330070853"
"160","0.272133412","1320","fe:71:62:34:47:3b","d2:70:80:a4:39:07","172.20.0.3","172.20.0.2","TLSv1.2","Client Hello"
"161","0.272138826","66","d2:70:80:a4:39:07","fe:71:62:34:47:3b","172.20.0.2","172.20.0.3","TCP","4433 → 59502 [ACK] Seq=1 Ack=1255 Win=64128 Len=0 TSval=1330070853 TSecr=1139155058"
"162","0.272685021","1504","d2:70:80:a4:39:07","fe:71:62:34:47:3b","172.20.0.2","172.20.0.3","TLSv1.3","Server Hello, Change Cipher Spec, Application Data, Application Data, Application Data, Application Data"
"163","0.272721040","66","fe:71:62:34:47:3b","d2:70:80:a4:39:07","172.20.0.3","172.20.0.2","TCP","59502 → 4433 [ACK] Seq=1255 Ack=1439 Win=64128 Len=0 TSval=1139155058 TSecr=1330070853"
"164","0.273738234","146","fe:71:62:34:47:3b","d2:70:80:a4:39:07","172.20.0.3","172.20.0.2","TLSv1.3","Change Cipher Spec, Application Data"
"165","0.273805322","66","fe:71:62:34:47:3b","d2:70:80:a4:39:07","172.20.0.3","172.20.0.2","TCP","59502 → 4433 [RST, ACK] Seq=1335 Ack=1439 Win=64128 Len=0 TSval=1139155060 TSecr=1330070853"
"166","0.284089828","74","fe:71:62:34:47:3b","d2:70:80:a4:39:07","172.20.0.3","172.20.0.2","TCP","59506 → 4433 [SYN] Seq=0 Win=64240 Len=0 MSS=1460 SACK_PERM TSval=1139155070 TSecr=0 WS=128"
"167","0.284114408","74","d2:70:80:a4:39:07","fe:71:62:34:47:3b","172.20.0.2","172.20.0.3","TCP","4433 → 59506 [SYN, ACK] Seq=0 Ack=1 Win=65160 Len=0 MSS=1460 SACK_PERM TSval=1330070865 TSecr=1139155070 WS=128"
"168","0.284133174","66","fe:71:62:34:47:3b","d2:70:80:a4:39:07","172.20.0.3","172.20.0.2","TCP","59506 → 4433 [ACK] Seq=1 Ack=1 Win=64256 Len=0 TSval=1139155070 TSecr=1330070865"
"169","0.284173051","1320","fe:71:62:34:47:3b","d2:70:80:a4:39:07","172.20.0.3","172.20.0.2","TLSv1.2","Client Hello"
"170","0.284178684","66","d2:70:80:a4:39:07","fe:71:62:34:47:3b","172.20.0.2","172.20.0.3","TCP","4433 → 59506 [ACK] Seq=1 Ack=1255 Win=64128 Len=0 TSval=1330070865 TSecr=1139155070"
"171","0.284758185","1504","d2:70:80:a4:39:07","fe:71:62:34:47:3b","172.20.0.2","172.20.0.3","TLSv1.3","Server Hello, Change Cipher Spec, Application Data, Application Data, Application Data, Application Data"
"172","0.284796741","66","fe:71:62:34:47:3b","d2:70:80:a4:39:07","172.20.0.3","172.20.0.2","TCP","59506 → 4433 [ACK] Seq=1255 Ack=1439 Win=64128 Len=0 TSval=1139155071 TSecr=1330070865"
"173","0.285839624","146","fe:71:62:34:47:3b","d2:70:80:a4:39:07","172.20.0.3","172.20.0.2","TLSv1.3","Change Cipher Spec, Application Data"
"174","0.285900732","66","fe:71:62:34:47:3b","d2:70:80:a4:39:07","172.20.0.3","172.20.0.2","TCP","59506 → 4433 [RST, ACK] Seq=1335 Ack=1439 Win=64128 Len=0 TSval=1139155072 TSecr=1330070865"
"175","0.296351163","74","fe:71:62:34:47:3b","d2:70:80:a4:39:07","172.20.0.3","172.20.0.2","TCP","59522 → 4433 [SYN] Seq=0 Win=64240 Len=0 MSS=1460 SACK_PERM TSval=1139155082 TSecr=0 WS=128"
"176","0.296374716","74","d2:70:80:a4:39:07","fe:71:62:34:47:3b","172.20.0.2","172.20.0.3","TCP","4433 → 59522 [SYN, ACK] Seq=0 Ack=1 Win=65160 Len=0 MSS=1460 SACK_PERM TSval=1330070877 TSecr=1139155082 WS=128"
"177","0.296394341","66","fe:71:62:34:47:3b","d2:70:80:a4:39:07","172.20.0.3","172.20.0.2","TCP","59522 → 4433 [ACK] Seq=1 Ack=1 Win=64256 Len=0 TSval=1139155082 TSecr=1330070877"
"178","0.296433400","1320","fe:71:62:34:47:3b","d2:70:80:a4:39:07","172.20.0.3","172.20.0.2","TLSv1.2","Client Hello"
"179","0.296438644","66","d2:70:80:a4:39:07","fe:71:62:34:47:3b","172.20.0.2","172.20.0.3","TCP","4433 → 59522 [ACK] Seq=1 Ack=1255 Win=64128 Len=0 TSval=1330070877 TSecr=1139155082"
"180","0.297008115","1504","d2:70:80:a4:39:07","fe:71:62:34:47:3b","172.20.0.2","172.20.0.3","TLSv1.3","Server Hello, Change Cipher Spec, Application Data, Application Data, Application Data, Application Data"
"181","0.297037016","66","fe:71:62:34:47:3b","d2:70:80:a4:39:07","172.20.0.3","172.20.0.2","TCP","59522 → 4433 [ACK] Seq=1255 Ack=1439 Win=64128 Len=0 TSval=1139155083 TSecr=1330070878"
"182","0.298096921","146","fe:71:62:34:47:3b","d2:70:80:a4:39:07","172.20.0.3","172.20.0.2","TLSv1.3","Change Cipher Spec, Application Data"
"183","0.298154383","66","fe:71:62:34:47:3b","d2:70:80:a4:39:07","172.20.0.3","172.20.0.2","TCP","59522 → 4433 [RST, ACK] Seq=1335 Ack=1439 Win=64128 Len=0 TSval=1139155084 TSecr=1330070878"
"184","0.308283523","74","fe:71:62:34:47:3b","d2:70:80:a4:39:07","172.20.0.3","172.20.0.2","TCP","59526 → 4433 [SYN] Seq=0 Win=64240 Len=0 MSS=1460 SACK_PERM TSval=1139155094 TSecr=0 WS=128"
"185","0.308303339","74","d2:70:80:a4:39:07","fe:71:62:34:47:3b","172.20.0.2","172.20.0.3","TCP","4433 → 59526 [SYN, ACK] Seq=0 Ack=1 Win=65160 Len=0 MSS=1460 SACK_PERM TSval=1330070889 TSecr=1139155094 WS=128"
"186","0.308319751","66","fe:71:62:34:47:3b","d2:70:80:a4:39:07","172.20.0.3","172.20.0.2","TCP","59526 → 4433 [ACK] Seq=1 Ack=1 Win=64256 Len=0 TSval=1139155094 TSecr=1330070889"
"187","0.308357691","1320","fe:71:62:34:47:3b","d2:70:80:a4:39:07","172.20.0.3","172.20.0.2","TLSv1.2","Client Hello"
"188","0.308362587","66","d2:70:80:a4:39:07","fe:71:62:34:47:3b","172.20.0.2","172.20.0.3","TCP","4433 → 59526 [ACK] Seq=1 Ack=1255 Win=64128 Len=0 TSval=1330070889 TSecr=1139155094"
"189","0.308892886","1504","d2:70:80:a4:39:07","fe:71:62:34:47:3b","172.20.0.2","172.20.0.3","TLSv1.3","Server Hello, Change Cipher Spec, Application Data, Application Data, Application Data, Application Data"
"190","0.308918636","66","fe:71:62:34:47:3b","d2:70:80:a4:39:07","172.20.0.3","172.20.0.2","TCP","59526 → 4433 [ACK] Seq=1255 Ack=1439 Win=64128 Len=0 TSval=1139155095 TSecr=1330070890"
"191","0.310001969","146","fe:71:62:34:47:3b","d2:70:80:a4:39:07","172.20.0.3","172.20.0.2","TLSv1.3","Change Cipher Spec, Application Data"
"192","0.310054507","66","fe:71:62:34:47:3b","d2:70:80:a4:39:07","172.20.0.3","172.20.0.2","TCP","59526 → 4433 [RST, ACK] Seq=1335 Ack=1439 Win=64128 Len=0 TSval=1139155096 TSecr=1330070890"
"193","0.321020890","74","fe:71:62:34:47:3b","d2:70:80:a4:39:07","172.20.0.3","172.20.0.2","TCP","59536 → 4433 [SYN] Seq=0 Win=64240 Len=0 MSS=1460 SACK_PERM TSval=1139155107 TSecr=0 WS=128"
"194","0.321051499","74","d2:70:80:a4:39:07","fe:71:62:34:47:3b","172.20.0.2","172.20.0.3","TCP","4433 → 59536 [SYN, ACK] Seq=0 Ack=1 Win=65160 Len=0 MSS=1460 SACK_PERM TSval=1330070902 TSecr=1139155107 WS=128"
"195","0.321072039","66","fe:71:62:34:47:3b","d2:70:80:a4:39:07","172.20.0.3","172.20.0.2","TCP","59536 → 4433 [ACK] Seq=1 Ack=1 Win=64256 Len=0 TSval=1139155107 TSecr=1330070902"
"196","0.321118920","1320","fe:71:62:34:47:3b","d2:70:80:a4:39:07","172.20.0.3","172.20.0.2","TLSv1.2","Client Hello"
"197","0.321123751","66","d2:70:80:a4:39:07","fe:71:62:34:47:3b","172.20.0.2","172.20.0.3","TCP","4433 → 59536 [ACK] Seq=1 Ack=1255 Win=64128 Len=0 TSval=1330070902 TSecr=1139155107"
"198","0.321864291","1504","d2:70:80:a4:39:07","fe:71:62:34:47:3b","172.20.0.2","172.20.0.3","TLSv1.3","Server Hello, Change Cipher Spec, Application Data, Application Data, Application Data, Application Data"
"199","0.321898440","66","fe:71:62:34:47:3b","d2:70:80:a4:39:07","172.20.0.3","172.20.0.2","TCP","59536 → 4433 [ACK] Seq=1255 Ack=1439 Win=64128 Len=0 TSval=1139155108 TSecr=1330070903"
"200","0.323041866","146","fe:71:62:34:47:3b","d2:70:80:a4:39:07","172.20.0.3","172.20.0.2","TLSv1.3","Change Cipher Spec, Application Data"
"201","0.323103799","66","fe:71:62:34:47:3b","d2:70:80:a4:39:07","172.20.0.3","172.20.0.2","TCP","59536 → 4433 [RST, ACK] Seq=1335 Ack=1439 Win=64128 Len=0 TSval=1139155109 TSecr=1330070903"
"202","0.334116081","74","fe:71:62:34:47:3b","d2:70:80:a4:39:07","172.20.0.3","172.20.0.2","TCP","59550 → 4433 [SYN] Seq=0 Win=64240 Len=0 MSS=1460 SACK_PERM TSval=1139155120 TSecr=0 WS=128"
"203","0.334139405","74","d2:70:80:a4:39:07","fe:71:62:34:47:3b","172.20.0.2","172.20.0.3","TCP","4433 → 59550 [SYN, ACK] Seq=0 Ack=1 Win=65160 Len=0 MSS=1460 SACK_PERM TSval=1330070915 TSecr=1139155120 WS=128"
"204","0.334155838","66","fe:71:62:34:47:3b","d2:70:80:a4:39:07","172.20.0.3","172.20.0.2","TCP","59550 → 4433 [ACK] Seq=1 Ack=1 Win=64256 Len=0 TSval=1139155120 TSecr=1330070915"
"205","0.334199400","1320","fe:71:62:34:47:3b","d2:70:80:a4:39:07","172.20.0.3","172.20.0.2","TLSv1.2","Client Hello"
"206","0.334203526","66","d2:70:80:a4:39:07","fe:71:62:34:47:3b","172.20.0.2","172.20.0.3","TCP","4433 → 59550 [ACK] Seq=1 Ack=1255 Win=64128 Len=0 TSval=1330070915 TSecr=1139155120"
"207","0.335132535","1504","d2:70:80:a4:39:07","fe:71:62:34:47:3b","172.20.0.2","172.20.0.3","TLSv1.3","Server Hello, Change Cipher Spec, Application Data, Application Data, Application Data, Application Data"
"208","0.335170343","66","fe:71:62:34:47:3b","d2:70:80:a4:39:07","172.20.0.3","172.20.0.2","TCP","59550 → 4433 [ACK] Seq=1255 Ack=1439 Win=64128 Len=0 TSval=1139155121 TSecr=1330070916"
"209","0.336340868","146","fe:71:62:34:47:3b","d2:70:80:a4:39:07","172.20.0.3","172.20.0.2","TLSv1.3","Change Cipher Spec, Application Data"
"210","0.336402801","66","fe:71:62:34:47:3b","d2:70:80:a4:39:07","172.20.0.3","172.20.0.2","TCP","59550 → 4433 [RST, ACK] Seq=1335 Ack=1439 Win=64128 Len=0 TSval=1139155122 TSecr=1330070916"
"211","0.350803802","74","fe:71:62:34:47:3b","d2:70:80:a4:39:07","172.20.0.3","172.20.0.2","TCP","59556 → 4433 [SYN] Seq=0 Win=64240 Len=0 MSS=1460 SACK_PERM TSval=1139155136 TSecr=0 WS=128"
"212","0.350866390","74","d2:70:80:a4:39:07","fe:71:62:34:47:3b","172.20.0.2","172.20.0.3","TCP","4433 → 59556 [SYN, ACK] Seq=0 Ack=1 Win=65160 Len=0 MSS=1460 SACK_PERM TSval=1330070932 TSecr=1139155136 WS=128"
"213","0.350888631","66","fe:71:62:34:47:3b","d2:70:80:a4:39:07","172.20.0.3","172.20.0.2","TCP","59556 → 4433 [ACK] Seq=1 Ack=1 Win=64256 Len=0 TSval=1139155137 TSecr=1330070932"
"214","0.350931849","1320","fe:71:62:34:47:3b","d2:70:80:a4:39:07","172.20.0.3","172.20.0.2","TLSv1.2","Client Hello"
"215","0.350939676","66","d2:70:80:a4:39:07","fe:71:62:34:47:3b","172.20.0.2","172.20.0.3","TCP","4433 → 59556 [ACK] Seq=1 Ack=1255 Win=64128 Len=0 TSval=1330070932 TSecr=1139155137"
"216","0.351607957","1504","d2:70:80:a4:39:07","fe:71:62:34:47:3b","172.20.0.2","172.20.0.3","TLSv1.3","Server Hello, Change Cipher Spec, Application Data, Application Data, Application Data, Application Data"
"217","0.351648984","66","fe:71:62:34:47:3b","d2:70:80:a4:39:07","172.20.0.3","172.20.0.2","TCP","59556 → 4433 [ACK] Seq=1255 Ack=1439 Win=64128 Len=0 TSval=1139155137 TSecr=1330070932"
"218","0.352759020","146","fe:71:62:34:47:3b","d2:70:80:a4:39:07","172.20.0.3","172.20.0.2","TLSv1.3","Change Cipher Spec, Application Data"
"219","0.352834046","66","fe:71:62:34:47:3b","d2:70:80:a4:39:07","172.20.0.3","172.20.0.2","TCP","59556 → 4433 [RST, ACK] Seq=1335 Ack=1439 Win=64128 Len=0 TSval=1139155139 TSecr=1330070932"
"220","0.363602739","74","fe:71:62:34:47:3b","d2:70:80:a4:39:07","172.20.0.3","172.20.0.2","TCP","59566 → 4433 [SYN] Seq=0 Win=64240 Len=0 MSS=1460 SACK_PERM TSval=1139155149 TSecr=0 WS=128"
"221","0.363626955","74","d2:70:80:a4:39:07","fe:71:62:34:47:3b","172.20.0.2","172.20.0.3","TCP","4433 → 59566 [SYN, ACK] Seq=0 Ack=1 Win=65160 Len=0 MSS=1460 SACK_PERM TSval=1330070944 TSecr=1139155149 WS=128"
"222","0.363645032","66","fe:71:62:34:47:3b","d2:70:80:a4:39:07","172.20.0.3","172.20.0.2","TCP","59566 → 4433 [ACK] Seq=1 Ack=1 Win=64256 Len=0 TSval=1139155149 TSecr=1330070944"
"223","0.363692178","1320","fe:71:62:34:47:3b","d2:70:80:a4:39:07","172.20.0.3","172.20.0.2","TLSv1.2","Client Hello"
"224","0.363698146","66","d2:70:80:a4:39:07","fe:71:62:34:47:3b","172.20.0.2","172.20.0.3","TCP","4433 → 59566 [ACK] Seq=1 Ack=1255 Win=64128 Len=0 TSval=1330070944 TSecr=1139155149"
