frame.number,frame.time_relative,frame.len,eth.src,eth.dst,ip.src,ip.dst,_ws.col.protocol,_ws.col.info
"1","0.000000000","42","9a:de:8f:45:63:e9","ff:ff:ff:ff:ff:ff",,,"ARP","ARP Announcement for 172.20.0.3"
"2","0.032132713","42","9a:de:8f:45:63:e9","ff:ff:ff:ff:ff:ff",,,"ARP","Who has 172.20.0.2? Tell 172.20.0.3"
"3","0.032156214","42","86:fa:ea:be:32:28","9a:de:8f:45:63:e9",,,"ARP","172.20.0.2 is at 86:fa:ea:be:32:28"
"4","0.032166361","74","9a:de:8f:45:63:e9","86:fa:ea:be:32:28","172.20.0.3","172.20.0.2","TCP","37310 → 4433 [SYN] Seq=0 Win=64240 Len=0 MSS=1460 SACK_PERM TSval=1140594811 TSecr=0 WS=128"
"5","0.032184007","74","86:fa:ea:be:32:28","9a:de:8f:45:63:e9","172.20.0.2","172.20.0.3","TCP","4433 → 37310 [SYN, ACK] Seq=0 Ack=1 Win=65160 Len=0 MSS=1460 SACK_PERM TSval=1331510606 TSecr=1140594811 WS=128"
"6","0.032198425","66","9a:de:8f:45:63:e9","86:fa:ea:be:32:28","172.20.0.3","172.20.0.2","TCP","37310 → 4433 [ACK] Seq=1 Ack=1 Win=64256 Len=0 TSval=1140594811 TSecr=1331510606"
"7","0.032237002","593","9a:de:8f:45:63:e9","86:fa:ea:be:32:28","172.20.0.3","172.20.0.2","TLSv1.2","Client Hello"
"8","0.032240482","66","86:fa:ea:be:32:28","9a:de:8f:45:63:e9","172.20.0.2","172.20.0.3","TCP","4433 → 37310 [ACK] Seq=1 Ack=528 Win=64640 Len=0 TSval=1331510606 TSecr=1140594811"
"9","0.036567815","966","86:fa:ea:be:32:28","9a:de:8f:45:63:e9","172.20.0.2","172.20.0.3","TLSv1.3","Server Hello, Change Cipher Spec, Application Data, Application Data, Application Data, Application Data"
"10","0.036623065","66","9a:de:8f:45:63:e9","86:fa:ea:be:32:28","172.20.0.3","172.20.0.2","TCP","37310 → 4433 [ACK] Seq=528 Ack=901 Win=64128 Len=0 TSval=1140594815 TSecr=1331510610"
"11","0.040306892","146","9a:de:8f:45:63:e9","86:fa:ea:be:32:28","172.20.0.3","172.20.0.2","TLSv1.3","Change Cipher Spec, Application Data"
"12","0.040370367","66","9a:de:8f:45:63:e9","86:fa:ea:be:32:28","172.20.0.3","172.20.0.2","TCP","37310 → 4433 [RST, ACK] Seq=608 Ack=901 Win=64128 Len=0 TSval=1140594819 TSecr=1331510610"
"13","0.052384891","74","9a:de:8f:45:63:e9","86:fa:ea:be:32:28","172.20.0.3","172.20.0.2","TCP","37320 → 4433 [SYN] Seq=0 Win=64240 Len=0 MSS=1460 SACK_PERM TSval=1140594831 TSecr=0 WS=128"
"14","0.052414152","74","86:fa:ea:be:32:28","9a:de:8f:45:63:e9","172.20.0.2","172.20.0.3","TCP","4433 → 37320 [SYN, ACK] Seq=0 Ack=1 Win=65160 Len=0 MSS=1460 SACK_PERM TSval=1331510626 TSecr=1140594831 WS=128"
"15","0.052432840","66","9a:de:8f:45:63:e9","86:fa:ea:be:32:28","172.20.0.3","172.20.0.2","TCP","37320 → 4433 [ACK] Seq=1 Ack=1 Win=64256 Len=0 TSval=1140594831 TSecr=1331510626"
"16","0.052476448","593","9a:de:8f:45:63:e9","86:fa:ea:be:32:28","172.20.0.3","172.20.0.2","TLSv1.2","Client Hello"
"17","0.052480989","66","86:fa:ea:be:32:28","9a:de:8f:45:63:e9","172.20.0.2","172.20.0.3","TCP","4433 → 37320 [ACK] Seq=1 Ack=528 Win=64640 Len=0 TSval=1331510626 TSecr=1140594831"
"18","0.056173107","965","86:fa:ea:be:32:28","9a:de:8f:45:63:e9","172.20.0.2","172.20.0.3","TLSv1.3","Server Hello, Change Cipher Spec, Application Data, Application Data, Application Data, Application Data"
"19","0.056203009","66","9a:de:8f:45:63:e9","86:fa:ea:be:32:28","172.20.0.3","172.20.0.2","TCP","37320 → 4433 [ACK] Seq=528 Ack=900 Win=64128 Len=0 TSval=1140594835 TSecr=1331510630"
"20","0.060155476","146","9a:de:8f:45:63:e9","86:fa:ea:be:32:28","172.20.0.3","172.20.0.2","TLSv1.3","Change Cipher Spec, Application Data"
"21","0.060231139","66","9a:de:8f:45:63:e9","86:fa:ea:be:32:28","172.20.0.3","172.20.0.2","TCP","37320 → 4433 [RST, ACK] Seq=608 Ack=900 Win=64128 Len=0 TSval=1140594839 TSecr=1331510630"
"22","0.072198074","74","9a:de:8f:45:63:e9","86:fa:ea:be:32:28","172.20.0.3","172.20.0.2","TCP","37324 → 4433 [SYN] Seq=0 Win=64240 Len=0 MSS=1460 SACK_PERM TSval=1140594851 TSecr=0 WS=128"
"23","0.072223852","74","86:fa:ea:be:32:28","9a:de:8f:45:63:e9","172.20.0.2","172.20.0.3","TCP","4433 → 37324 [SYN, ACK] Seq=0 Ack=1 Win=65160 Len=0 MSS=1460 SACK_PERM TSval=1331510646 TSecr=1140594851 WS=128"
"24","0.072242456","66","9a:de:8f:45:63:e9","86:fa:ea:be:32:28","172.20.0.3","172.20.0.2","TCP","37324 → 4433 [ACK] Seq=1 Ack=1 Win=64256 Len=0 TSval=1140594851 TSecr=1331510646"
"25","0.072281583","593","9a:de:8f:45:63:e9","86:fa:ea:be:32:28","172.20.0.3","172.20.0.2","TLSv1.2","Client Hello"
"26","0.072286298","66","86:fa:ea:be:32:28","9a:de:8f:45:63:e9","172.20.0.2","172.20.0.3","TCP","4433 → 37324 [ACK] Seq=1 Ack=528 Win=64640 Len=0 TSval=1331510646 TSecr=1140594851"
"27","0.075882316","964","86:fa:ea:be:32:28","9a:de:8f:45:63:e9","172.20.0.2","172.20.0.3","TLSv1.3","Server Hello, Change Cipher Spec, Application Data, Application Data, Application Data, Application Data"
"28","0.075916149","66","9a:de:8f:45:63:e9","86:fa:ea:be:32:28","172.20.0.3","172.20.0.2","TCP","37324 → 4433 [ACK] Seq=528 Ack=899 Win=64128 Len=0 TSval=1140594854 TSecr=1331510649"
"29","0.079492275","146","9a:de:8f:45:63:e9","86:fa:ea:be:32:28","172.20.0.3","172.20.0.2","TLSv1.3","Change Cipher Spec, Application Data"
"30","0.079558653","66","9a:de:8f:45:63:e9","86:fa:ea:be:32:28","172.20.0.3","172.20.0.2","TCP","37324 → 4433 [RST, ACK] Seq=608 Ack=899 Win=64128 Len=0 TSval=1140594858 TSecr=1331510649"
"31","0.093870809","74","9a:de:8f:45:63:e9","86:fa:ea:be:32:28","172.20.0.3","172.20.0.2","TCP","37332 → 4433 [SYN] Seq=0 Win=64240 Len=0 MSS=1460 SACK_PERM TSval=1140594872 TSecr=0 WS=128"
"32","0.093897043","74","86:fa:ea:be:32:28","9a:de:8f:45:63:e9","172.20.0.2","172.20.0.3","TCP","4433 → 37332 [SYN, ACK] Seq=0 Ack=1 Win=65160 Len=0 MSS=1460 SACK_PERM TSval=1331510667 TSecr=1140594872 WS=128"
"33","0.093914597","66","9a:de:8f:45:63:e9","86:fa:ea:be:32:28","172.20.0.3","172.20.0.2","TCP","37332 → 4433 [ACK] Seq=1 Ack=1 Win=64256 Len=0 TSval=1140594872 TSecr=1331510667"
"34","0.093952004","593","9a:de:8f:45:63:e9","86:fa:ea:be:32:28","172.20.0.3","172.20.0.2","TLSv1.2","Client Hello"
"35","0.093956064","66","86:fa:ea:be:32:28","9a:de:8f:45:63:e9","172.20.0.2","172.20.0.3","TCP","4433 → 37332 [ACK] Seq=1 Ack=528 Win=64640 Len=0 TSval=1331510667 TSecr=1140594872"
"36","0.097840168","964","86:fa:ea:be:32:28","9a:de:8f:45:63:e9","172.20.0.2","172.20.0.3","TLSv1.3","Server Hello, Change Cipher Spec, Application Data, Application Data, Application Data, Application Data"
"37","0.097873131","66","9a:de:8f:45:63:e9","86:fa:ea:be:32:28","172.20.0.3","172.20.0.2","TCP","37332 → 4433 [ACK] Seq=528 Ack=899 Win=64128 Len=0 TSval=1140594876 TSecr=1331510671"
"38","0.101369327","146","9a:de:8f:45:63:e9","86:fa:ea:be:32:28","172.20.0.3","172.20.0.2","TLSv1.3","Change Cipher Spec, Application Data"
"39","0.101435693","66","9a:de:8f:45:63:e9","86:fa:ea:be:32:28","172.20.0.3","172.20.0.2","TCP","37332 → 4433 [RST, ACK] Seq=608 Ack=899 Win=64128 Len=0 TSval=1140594880 TSecr=1331510671"
"40","0.112833251","74","9a:de:8f:45:63:e9","86:fa:ea:be:32:28","172.20.0.3","172.20.0.2","TCP","37338 → 4433 [SYN] Seq=0 Win=64240 Len=0 MSS=1460 SACK_PERM TSval=1140594891 TSecr=0 WS=128"
"41","0.112857068","74","86:fa:ea:be:32:28","9a:de:8f:45:63:e9","172.20.0.2","172.20.0.3","TCP","4433 → 37338 [SYN, ACK] Seq=0 Ack=1 Win=65160 Len=0 MSS=1460 SACK_PERM TSval=1331510686 TSecr=1140594891 WS=128"
"42","0.112875301","66","9a:de:8f:45:63:e9","86:fa:ea:be:32:28","172.20.0.3","172.20.0.2","TCP","37338 → 4433 [ACK] Seq=1 Ack=1 Win=64256 Len=0 TSval=1140594891 TSecr=1331510686"
"43","0.112916547","593","9a:de:8f:45:63:e9","86:fa:ea:be:32:28","172.20.0.3","172.20.0.2","TLSv1.2","Client Hello"
"44","0.112922991","66","86:fa:ea:be:32:28","9a:de:8f:45:63:e9","172.20.0.2","172.20.0.3","TCP","4433 → 37338 [ACK] Seq=1 Ack=528 Win=64640 Len=0 TSval=1331510686 TSecr=1140594891"
"45","0.117476609","965","86:fa:ea:be:32:28","9a:de:8f:45:63:e9","172.20.0.2","172.20.0.3","TLSv1.3","Server Hello, Change Cipher Spec, Application Data, Application Data, Application Data, Application Data"
"46","0.117519753","66","9a:de:8f:45:63:e9","86:fa:ea:be:32:28","172.20.0.3","172.20.0.2","TCP","37338 → 4433 [ACK] Seq=528 Ack=900 Win=64128 Len=0 TSval=1140594896 TSecr=1331510691"
"47","0.121110158","146","9a:de:8f:45:63:e9","86:fa:ea:be:32:28","172.20.0.3","172.20.0.2","TLSv1.3","Change Cipher Spec, Application Data"
"48","0.121178694","66","9a:de:8f:45:63:e9","86:fa:ea:be:32:28","172.20.0.3","172.20.0.2","TCP","37338 → 4433 [RST, ACK] Seq=608 Ack=900 Win=64128 Len=0 TSval=1140594900 TSecr=1331510691"
"49","0.133500726","74","9a:de:8f:45:63:e9","86:fa:ea:be:32:28","172.20.0.3","172.20.0.2","TCP","37352 → 4433 [SYN] Seq=0 Win=64240 Len=0 MSS=1460 SACK_PERM TSval=1140594912 TSecr=0 WS=128"
"50","0.133524894","74","86:fa:ea:be:32:28","9a:de:8f:45:63:e9","172.20.0.2","172.20.0.3","TCP","4433 → 37352 [SYN, ACK] Seq=0 Ack=1 Win=65160 Len=0 MSS=1460 SACK_PERM TSval=1331510707 TSecr=1140594912 WS=128"
"51","0.133541544","66","9a:de:8f:45:63:e9","86:fa:ea:be:32:28","172.20.0.3","172.20.0.2","TCP","37352 → 4433 [ACK] Seq=1 Ack=1 Win=64256 Len=0 TSval=1140594912 TSecr=1331510707"
"52","0.133589476","593","9a:de:8f:45:63:e9","86:fa:ea:be:32:28","172.20.0.3","172.20.0.2","TLSv1.2","Client Hello"
"53","0.133593445","66","86:fa:ea:be:32:28","9a:de:8f:45:63:e9","172.20.0.2","172.20.0.3","TCP","4433 → 37352 [ACK] Seq=1 Ack=528 Win=64640 Len=0 TSval=1331510707 TSecr=1140594912"
"54","0.137975621","964","86:fa:ea:be:32:28","9a:de:8f:45:63:e9","172.20.0.2","172.20.0.3","TLSv1.3","Server Hello, Change Cipher Spec, Application Data, Application Data, Application Data, Application Data"
"55","0.138026935","66","9a:de:8f:45:63:e9","86:fa:ea:be:32:28","172.20.0.3","172.20.0.2","TCP","37352 → 4433 [ACK] Seq=528 Ack=899 Win=64128 Len=0 TSval=1140594916 TSecr=1331510711"
"56","0.141795035","146","9a:de:8f:45:63:e9","86:fa:ea:be:32:28","172.20.0.3","172.20.0.2","TLSv1.3","Change Cipher Spec, Application Data"
"57","0.141888494","66","9a:de:8f:45:63:e9","86:fa:ea:be:32:28","172.20.0.3","172.20.0.2","TCP","37352 → 4433 [RST, ACK] Seq=608 Ack=899 Win=64128 Len=0 TSval=1140594920 TSecr=1331510711"
"58","0.153855934","74","9a:de:8f:45:63:e9","86:fa:ea:be:32:28","172.20.0.3","172.20.0.2","TCP","37354 → 4433 [SYN] Seq=0 Win=64240 Len=0 MSS=1460 SACK_PERM TSval=1140594932 TSecr=0 WS=128"
"59","0.153892959","74","86:fa:ea:be:32:28","9a:de:8f:45:63:e9","172.20.0.2","172.20.0.3","TCP","4433 → 37354 [SYN, ACK] Seq=0 Ack=1 Win=65160 Len=0 MSS=1460 SACK_PERM TSval=1331510727 TSecr=1140594932 WS=128"
"60","0.153917070","66","9a:de:8f:45:63:e9","86:fa:ea:be:32:28","172.20.0.3","172.20.0.2","TCP","37354 → 4433 [ACK] Seq=1 Ack=1 Win=64256 Len=0 TSval=1140594932 TSecr=1331510727"
"61","0.153980695","593","9a:de:8f:45:63:e9","86:fa:ea:be:32:28","172.20.0.3","172.20.0.2","TLSv1.2","Client Hello"
"62","0.153997948","66","86:fa:ea:be:32:28","9a:de:8f:45:63:e9","172.20.0.2","172.20.0.3","TCP","4433 → 37354 [ACK] Seq=1 Ack=528 Win=64640 Len=0 TSval=1331510727 TSecr=1140594932"
"63","0.157984348","964","86:fa:ea:be:32:28","9a:de:8f:45:63:e9","172.20.0.2","172.20.0.3","TLSv1.3","Server Hello, Change Cipher Spec, Application Data, Application Data, Application Data, Application Data"
"64","0.158020587","66","9a:de:8f:45:63:e9","86:fa:ea:be:32:28","172.20.0.3","172.20.0.2","TCP","37354 → 4433 [ACK] Seq=528 Ack=899 Win=64128 Len=0 TSval=1140594936 TSecr=1331510731"
"65","0.161699695","146","9a:de:8f:45:63:e9","86:fa:ea:be:32:28","172.20.0.3","172.20.0.2","TLSv1.3","Change Cipher Spec, Application Data"
"66","0.161760857","66","9a:de:8f:45:63:e9","86:fa:ea:be:32:28","172.20.0.3","172.20.0.2","TCP","37354 → 4433 [RST, ACK] Seq=608 Ack=899 Win=64128 Len=0 TSval=1140594940 TSecr=1331510731"
"67","0.174359935","74","9a:de:8f:45:63:e9","86:fa:ea:be:32:28","172.20.0.3","172.20.0.2","TCP","37358 → 4433 [SYN] Seq=0 Win=64240 Len=0 MSS=1460 SACK_PERM TSval=1140594953 TSecr=0 WS=128"
"68","0.174390719","74","86:fa:ea:be:32:28","9a:de:8f:45:63:e9","172.20.0.2","172.20.0.3","TCP","4433 → 37358 [SYN, ACK] Seq=0 Ack=1 Win=65160 Len=0 MSS=1460 SACK_PERM TSval=1331510748 TSecr=1140594953 WS=128"
"69","0.174417434","66","9a:de:8f:45:63:e9","86:fa:ea:be:32:28","172.20.0.3","172.20.0.2","TCP","37358 → 4433 [ACK] Seq=1 Ack=1 Win=64256 Len=0 TSval=1140594953 TSecr=1331510748"
"70","0.174467456","593","9a:de:8f:45:63:e9","86:fa:ea:be:32:28","172.20.0.3","172.20.0.2","TLSv1.2","Client Hello"
"71","0.174473630","66","86:fa:ea:be:32:28","9a:de:8f:45:63:e9","172.20.0.2","172.20.0.3","TCP","4433 → 37358 [ACK] Seq=1 Ack=528 Win=64640 Len=0 TSval=1331510748 TSecr=1140594953"
"72","0.178455786","964","86:fa:ea:be:32:28","9a:de:8f:45:63:e9","172.20.0.2","172.20.0.3","TLSv1.3","Server Hello, Change Cipher Spec, Application Data, Application Data, Application Data, Application Data"
"73","0.178492813","66","9a:de:8f:45:63:e9","86:fa:ea:be:32:28","172.20.0.3","172.20.0.2","TCP","37358 → 4433 [ACK] Seq=528 Ack=899 Win=64128 Len=0 TSval=1140594957 TSecr=1331510752"
"74","0.182488185","146","9a:de:8f:45:63:e9","86:fa:ea:be:32:28","172.20.0.3","172.20.0.2","TLSv1.3","Change Cipher Spec, Application Data"
"75","0.182556550","66","9a:de:8f:45:63:e9","86:fa:ea:be:32:28","172.20.0.3","172.20.0.2","TCP","37358 → 4433 [RST, ACK] Seq=608 Ack=899 Win=64128 Len=0 TSval=1140594961 TSecr=1331510752"
"76","0.195126650","74","9a:de:8f:45:63:e9","86:fa:ea:be:32:28","172.20.0.3","172.20.0.2","TCP","37372 → 4433 [SYN] Seq=0 Win=64240 Len=0 MSS=1460 SACK_PERM TSval=1140594974 TSecr=0 WS=128"
"77","0.195162560","74","86:fa:ea:be:32:28","9a:de:8f:45:63:e9","172.20.0.2","172.20.0.3","TCP","4433 → 37372 [SYN, ACK] Seq=0 Ack=1 Win=65160 Len=0 MSS=1460 SACK_PERM TSval=1331510769 TSecr=1140594974 WS=128"
"78","0.195177794","66","9a:de:8f:45:63:e9","86:fa:ea:be:32:28","172.20.0.3","172.20.0.2","TCP","37372 → 4433 [ACK] Seq=1 Ack=1 Win=64256 Len=0 TSval=1140594974 TSecr=1331510769"
"79","0.195211895","593","9a:de:8f:45:63:e9","86:fa:ea:be:32:28","172.20.0.3","172.20.0.2","TLSv1.2","Client Hello"
"80","0.195215327","66","86:fa:ea:be:32:28","9a:de:8f:45:63:e9","172.20.0.2","172.20.0.3","TCP","4433 → 37372 [ACK] Seq=1 Ack=528 Win=64640 Len=0 TSval=1331510769 TSecr=1140594974"
"81","0.198969114","965","86:fa:ea:be:32:28","9a:de:8f:45:63:e9","172.20.0.2","172.20.0.3","TLSv1.3","Server Hello, Change Cipher Spec, Application Data, Application Data, Application Data, Application Data"
"82","0.199005675","66","9a:de:8f:45:63:e9","86:fa:ea:be:32:28","172.20.0.3","172.20.0.2","TCP","37372 → 4433 [ACK] Seq=528 Ack=900 Win=64128 Len=0 TSval=1140594977 TSecr=1331510772"
"83","0.202545885","146","9a:de:8f:45:63:e9","86:fa:ea:be:32:28","172.20.0.3","172.20.0.2","TLSv1.3","Change Cipher Spec, Application Data"
"84","0.202609485","66","9a:de:8f:45:63:e9","86:fa:ea:be:32:28","172.20.0.3","172.20.0.2","TCP","37372 → 4433 [RST, ACK] Seq=608 Ack=900 Win=64128 Len=0 TSval=1140594981 TSecr=1331510772"
"85","0.214019023","74","9a:de:8f:45:63:e9","86:fa:ea:be:32:28","172.20.0.3","172.20.0.2","TCP","37386 → 4433 [SYN] Seq=0 Win=64240 Len=0 MSS=1460 SACK_PERM TSval=1140594992 TSecr=0 WS=128"
"86","0.214042463","74","86:fa:ea:be:32:28","9a:de:8f:45:63:e9","172.20.0.2","172.20.0.3","TCP","4433 → 37386 [SYN, ACK] Seq=0 Ack=1 Win=65160 Len=0 MSS=1460 SACK_PERM TSval=1331510787 TSecr=1140594992 WS=128"
"87","0.214070619","66","9a:de:8f:45:63:e9","86:fa:ea:be:32:28","172.20.0.3","172.20.0.2","TCP","37386 → 4433 [ACK] Seq=1 Ack=1 Win=64256 Len=0 TSval=1140594993 TSecr=1331510787"
"88","0.214108992","593","9a:de:8f:45:63:e9","86:fa:ea:be:32:28","172.20.0.3","172.20.0.2","TLSv1.2","Client Hello"
"89","0.214114545","66","86:fa:ea:be:32:28","9a:de:8f:45:63:e9","172.20.0.2","172.20.0.3","TCP","4433 → 37386 [ACK] Seq=1 Ack=528 Win=64640 Len=0 TSval=1331510788 TSecr=1140594993"
"90","0.217889053","965","86:fa:ea:be:32:28","9a:de:8f:45:63:e9","172.20.0.2","172.20.0.3","TLSv1.3","Server Hello, Change Cipher Spec, Application Data, Application Data, Application Data, Application Data"
"91","0.217921570","66","9a:de:8f:45:63:e9","86:fa:ea:be:32:28","172.20.0.3","172.20.0.2","TCP","37386 → 4433 [ACK] Seq=528 Ack=900 Win=64128 Len=0 TSval=1140594996 TSecr=1331510791"
"92","0.221468841","146","9a:de:8f:45:63:e9","86:fa:ea:be:32:28","172.20.0.3","172.20.0.2","TLSv1.3","Change Cipher Spec, Application Data"
"93","0.221526220","66","9a:de:8f:45:63:e9","86:fa:ea:be:32:28","172.20.0.3","172.20.0.2","TCP","37386 → 4433 [RST, ACK] Seq=608 Ack=900 Win=64128 Len=0 TSval=1140595000 TSecr=1331510791"
"94","0.232881563","74","9a:de:8f:45:63:e9","86:fa:ea:be:32:28","172.20.0.3","172.20.0.2","TCP","37396 → 4433 [SYN] Seq=0 Win=64240 Len=0 MSS=1460 SACK_PERM TSval=1140595011 TSecr=0 WS=128"
"95","0.232904601","74","86:fa:ea:be:32:28","9a:de:8f:45:63:e9","172.20.0.2","172.20.0.3","TCP","4433 → 37396 [SYN, ACK] Seq=0 Ack=1 Win=65160 Len=0 MSS=1460 SACK_PERM TSval=1331510806 TSecr=1140595011 WS=128"
"96","0.232919975","66","9a:de:8f:45:63:e9","86:fa:ea:be:32:28","172.20.0.3","172.20.0.2","TCP","37396 → 4433 [ACK] Seq=1 Ack=1 Win=64256 Len=0 TSval=1140595011 TSecr=1331510806"
"97","0.232955897","593","9a:de:8f:45:63:e9","86:fa:ea:be:32:28","172.20.0.3","172.20.0.2","TLSv1.2","Client Hello"
"98","0.232960790","66","86:fa:ea:be:32:28","9a:de:8f:45:63:e9","172.20.0.2","172.20.0.3","TCP","4433 → 37396 [ACK] Seq=1 Ack=528 Win=64640 Len=0 TSval=1331510806 TSecr=1140595011"
"99","0.236762063","965","86:fa:ea:be:32:28","9a:de:8f:45:63:e9","172.20.0.2","172.20.0.3","TLSv1.3","Server Hello, Change Cipher Spec, Application Data, Application Data, Application Data, Application Data"
"100","0.236787734","66","9a:de:8f:45:63:e9","86:fa:ea:be:32:28","172.20.0.3","172.20.0.2","TCP","37396 → 4433 [ACK] Seq=528 Ack=900 Win=64128 Len=0 TSval=1140595015 TSecr=1331510810"
"101","0.240357990","146","9a:de:8f:45:63:e9","86:fa:ea:be:32:28","172.20.0.3","172.20.0.2","TLSv1.3","Change Cipher Spec, Application Data"
"102","0.240416640","66","9a:de:8f:45:63:e9","86:fa:ea:be:32:28","172.20.0.3","172.20.0.2","TCP","37396 → 4433 [RST, ACK] Seq=608 Ack=900 Win=64128 Len=0 TSval=1140595019 TSecr=1331510810"
"103","0.250842335","74","9a:de:8f:45:63:e9","86:fa:ea:be:32:28","172.20.0.3","172.20.0.2","TCP","37402 → 4433 [SYN] Seq=0 Win=64240 Len=0 MSS=1460 SACK_PERM TSval=1140595029 TSecr=0 WS=128"
"104","0.250860185","74","86:fa:ea:be:32:28","9a:de:8f:45:63:e9","172.20.0.2","172.20.0.3","TCP","4433 → 37402 [SYN, ACK] Seq=0 Ack=1 Win=65160 Len=0 MSS=1460 SACK_PERM TSval=1331510824 TSecr=1140595029 WS=128"
"105","0.250874313","66","9a:de:8f:45:63:e9","86:fa:ea:be:32:28","172.20.0.3","172.20.0.2","TCP","37402 → 4433 [ACK] Seq=1 Ack=1 Win=64256 Len=0 TSval=1140595029 TSecr=1331510824"
"106","0.250909025","593","9a:de:8f:45:63:e9","86:fa:ea:be:32:28","172.20.0.3","172.20.0.2","TLSv1.2","Client Hello"
"107","0.250913303","66","86:fa:ea:be:32:28","9a:de:8f:45:63:e9","172.20.0.2","172.20.0.3","TCP","4433 → 37402 [ACK] Seq=1 Ack=528 Win=64640 Len=0 TSval=1331510824 TSecr=1140595029"
"108","0.254559525","965","86:fa:ea:be:32:28","9a:de:8f:45:63:e9","172.20.0.2","172.20.0.3","TLSv1.3","Server Hello, Change Cipher Spec, Application Data, Application Data, Application Data, Application Data"
"109","0.254585998","66","9a:de:8f:45:63:e9","86:fa:ea:be:32:28","172.20.0.3","172.20.0.2","TCP","37402 → 4433 [ACK] Seq=528 Ack=900 Win=64128 Len=0 TSval=1140595033 TSecr=1331510828"
"110","0.257978723","146","9a:de:8f:45:63:e9","86:fa:ea:be:32:28","172.20.0.3","172.20.0.2","TLSv1.3","Change Cipher Spec, Application Data"
"111","0.258026488","66","9a:de:8f:45:63:e9","86:fa:ea:be:32:28","172.20.0.3","172.20.0.2","TCP","37402 → 4433 [RST, ACK] Seq=608 Ack=900 Win=64128 Len=0 TSval=1140595036 TSecr=1331510828"
"112","0.268288849","74","9a:de:8f:45:63:e9","86:fa:ea:be:32:28","172.20.0.3","172.20.0.2","TCP","37418 → 4433 [SYN] Seq=0 Win=64240 Len=0 MSS=1460 SACK_PERM TSval=1140595047 TSecr=0 WS=128"
"113","0.268322347","74","86:fa:ea:be:32:28","9a:de:8f:45:63:e9","172.20.0.2","172.20.0.3","TCP","4433 → 37418 [SYN, ACK] Seq=0 Ack=1 Win=65160 Len=0 MSS=1460 SACK_PERM TSval=1331510842 TSecr=1140595047 WS=128"
"114","0.268336766","66","9a:de:8f:45:63:e9","86:fa:ea:be:32:28","172.20.0.3","172.20.0.2","TCP","37418 → 4433 [ACK] Seq=1 Ack=1 Win=64256 Len=0 TSval=1140595047 TSecr=1331510842"
"115","0.268368250","593","9a:de:8f:45:63:e9","86:fa:ea:be:32:28","172.20.0.3","172.20.0.2","TLSv1.2","Client Hello"
"116","0.268372515","66","86:fa:ea:be:32:28","9a:de:8f:45:63:e9","172.20.0.2","172.20.0.3","TCP","4433 → 37418 [ACK] Seq=1 Ack=528 Win=64640 Len=0 TSval=1331510842 TSecr=1140595047"
"117","0.271862469","966","86:fa:ea:be:32:28","9a:de:8f:45:63:e9","172.20.0.2","172.20.0.3","TLSv1.3","Server Hello, Change Cipher Spec, Application Data, Application Data, Application Data, Application Data"
"118","0.271887980","66","9a:de:8f:45:63:e9","86:fa:ea:be:32:28","172.20.0.3","172.20.0.2","TCP","37418 → 4433 [ACK] Seq=528 Ack=901 Win=64128 Len=0 TSval=1140595050 TSecr=1331510845"
"119","0.275435004","146","9a:de:8f:45:63:e9","86:fa:ea:be:32:28","172.20.0.3","172.20.0.2","TLSv1.3","Change Cipher Spec, Application Data"
"120","0.275491456","66","9a:de:8f:45:63:e9","86:fa:ea:be:32:28","172.20.0.3","172.20.0.2","TCP","37418 → 4433 [RST, ACK] Seq=608 Ack=901 Win=64128 Len=0 TSval=1140595054 TSecr=1331510845"
"121","0.286270806","74","9a:de:8f:45:63:e9","86:fa:ea:be:32:28","172.20.0.3","172.20.0.2","TCP","37420 → 4433 [SYN] Seq=0 Win=64240 Len=0 MSS=1460 SACK_PERM TSval=1140595065 TSecr=0 WS=128"
"122","0.286290862","74","86:fa:ea:be:32:28","9a:de:8f:45:63:e9","172.20.0.2","172.20.0.3","TCP","4433 → 37420 [SYN, ACK] Seq=0 Ack=1 Win=65160 Len=0 MSS=1460 SACK_PERM TSval=1331510860 TSecr=1140595065 WS=128"
"123","0.286309643","66","9a:de:8f:45:63:e9","86:fa:ea:be:32:28","172.20.0.3","172.20.0.2","TCP","37420 → 4433 [ACK] Seq=1 Ack=1 Win=64256 Len=0 TSval=1140595065 TSecr=1331510860"
"124","0.286352738","593","9a:de:8f:45:63:e9","86:fa:ea:be:32:28","172.20.0.3","172.20.0.2","TLSv1.2","Client Hello"
"125","0.286357207","66","86:fa:ea:be:32:28","9a:de:8f:45:63:e9","172.20.0.2","172.20.0.3","TCP","4433 → 37420 [ACK] Seq=1 Ack=528 Win=64640 Len=0 TSval=1331510860 TSecr=1140595065"
"126","0.289909900","965","86:fa:ea:be:32:28","9a:de:8f:45:63:e9","172.20.0.2","172.20.0.3","TLSv1.3","Server Hello, Change Cipher Spec, Application Data, Application Data, Application Data, Application Data"
"127","0.289934009","66","9a:de:8f:45:63:e9","86:fa:ea:be:32:28","172.20.0.3","172.20.0.2","TCP","37420 → 4433 [ACK] Seq=528 Ack=900 Win=64128 Len=0 TSval=1140595068 TSecr=1331510863"
"128","0.293461438","146","9a:de:8f:45:63:e9","86:fa:ea:be:32:28","172.20.0.3","172.20.0.2","TLSv1.3","Change Cipher Spec, Application Data"
"129","0.293511679","66","9a:de:8f:45:63:e9","86:fa:ea:be:32:28","172.20.0.3","172.20.0.2","TCP","37420 → 4433 [RST, ACK] Seq=608 Ack=900 Win=64128 Len=0 TSval=1140595072 TSecr=1331510863"
"130","0.307444631","74","9a:de:8f:45:63:e9","86:fa:ea:be:32:28","172.20.0.3","172.20.0.2","TCP","37434 → 4433 [SYN] Seq=0 Win=64240 Len=0 MSS=1460 SACK_PERM TSval=1140595086 TSecr=0 WS=128"
"131","0.307474724","74","86:fa:ea:be:32:28","9a:de:8f:45:63:e9","172.20.0.2","172.20.0.3","TCP","4433 → 37434 [SYN, ACK] Seq=0 Ack=1 Win=65160 Len=0 MSS=1460 SACK_PERM TSval=1331510881 TSecr=1140595086 WS=128"
"132","0.307490173","66","9a:de:8f:45:63:e9","86:fa:ea:be:32:28","172.20.0.3","172.20.0.2","TCP","37434 → 4433 [ACK] Seq=1 Ack=1 Win=64256 Len=0 TSval=1140595086 TSecr=1331510881"
"133","0.307536742","593","9a:de:8f:45:63:e9","86:fa:ea:be:32:28","172.20.0.3","172.20.0.2","TLSv1.2","Client Hello"
"134","0.307540780","66","86:fa:ea:be:32:28","9a:de:8f:45:63:e9","172.20.0.2","172.20.0.3","TCP","4433 → 37434 [ACK] Seq=1 Ack=528 Win=64640 Len=0 TSval=1331510881 TSecr=1140595086"
"135","0.311203279","965","86:fa:ea:be:32:28","9a:de:8f:45:63:e9","172.20.0.2","172.20.0.3","TLSv1.3","Server Hello, Change Cipher Spec, Application Data, Application Data, Application Data, Application Data"
"136","0.311233580","66","9a:de:8f:45:63:e9","86:fa:ea:be:32:28","172.20.0.3","172.20.0.2","TCP","37434 → 4433 [ACK] Seq=528 Ack=900 Win=64128 Len=0 TSval=1140595090 TSecr=1331510885"
"137","0.314728648","146","9a:de:8f:45:63:e9","86:fa:ea:be:32:28","172.20.0.3","172.20.0.2","TLSv1.3","Change Cipher Spec, Application Data"
"138","0.314787246","66","9a:de:8f:45:63:e9","86:fa:ea:be:32:28","172.20.0.3","172.20.0.2","TCP","37434 → 4433 [RST, ACK] Seq=608 Ack=900 Win=64128 Len=0 TSval=1140595093 TSecr=1331510885"
"139","0.326788289","74","9a:de:8f:45:63:e9","86:fa:ea:be:32:28","172.20.0.3","172.20.0.2","TCP","37444 → 4433 [SYN] Seq=0 Win=64240 Len=0 MSS=1460 SACK_PERM TSval=1140595105 TSecr=0 WS=128"
"140","0.326808636","74","86:fa:ea:be:32:28","9a:de:8f:45:63:e9","172.20.0.2","172.20.0.3","TCP","4433 → 37444 [SYN, ACK] Seq=0 Ack=1 Win=65160 Len=0 MSS=1460 SACK_PERM TSval=1331510900 TSecr=1140595105 WS=128"
"141","0.326826479","66","9a:de:8f:45:63:e9","86:fa:ea:be:32:28","172.20.0.3","172.20.0.2","TCP","37444 → 4433 [ACK] Seq=1 Ack=1 Win=64256 Len=0 TSval=1140595105 TSecr=1331510900"
"142","0.326869772","593","9a:de:8f:45:63:e9","86:fa:ea:be:32:28","172.20.0.3","172.20.0.2","TLSv1.2","Client Hello"
"143","0.326877500","66","86:fa:ea:be:32:28","9a:de:8f:45:63:e9","172.20.0.2","172.20.0.3","TCP","4433 → 37444 [ACK] Seq=1 Ack=528 Win=64640 Len=0 TSval=1331510900 TSecr=1140595105"
"144","0.330458062","964","86:fa:ea:be:32:28","9a:de:8f:45:63:e9","172.20.0.2","172.20.0.3","TLSv1.3","Server Hello, Change Cipher Spec, Application Data, Application Data, Application Data, Application Data"
"145","0.330483448","66","9a:de:8f:45:63:e9","86:fa:ea:be:32:28","172.20.0.3","172.20.0.2","TCP","37444 → 4433 [ACK] Seq=528 Ack=899 Win=64128 Len=0 TSval=1140595109 TSecr=1331510904"
"146","0.334094015","146","9a:de:8f:45:63:e9","86:fa:ea:be:32:28","172.20.0.3","172.20.0.2","TLSv1.3","Change Cipher Spec, Application Data"
"147","0.334145282","66","9a:de:8f:45:63:e9","86:fa:ea:be:32:28","172.20.0.3","172.20.0.2","TCP","37444 → 4433 [RST, ACK] Seq=608 Ack=899 Win=64128 Len=0 TSval=1140595113 TSecr=1331510904"
"148","0.344745311","74","9a:de:8f:45:63:e9","86:fa:ea:be:32:28","172.20.0.3","172.20.0.2","TCP","37452 → 4433 [SYN] Seq=0 Win=64240 Len=0 MSS=1460 SACK_PERM TSval=1140595123 TSecr=0 WS=128"
"149","0.344764705","74","86:fa:ea:be:32:28","9a:de:8f:45:63:e9","172.20.0.2","172.20.0.3","TCP","4433 → 37452 [SYN, ACK] Seq=0 Ack=1 Win=65160 Len=0 MSS=1460 SACK_PERM TSval=1331510918 TSecr=1140595123 WS=128"
"150","0.344779111","66","9a:de:8f:45:63:e9","86:fa:ea:be:32:28","172.20.0.3","172.20.0.2","TCP","37452 → 4433 [ACK] Seq=1 Ack=1 Win=64256 Len=0 TSval=1140595123 TSecr=1331510918"
"151","0.344820902","593","9a:de:8f:45:63:e9","86:fa:ea:be:32:28","172.20.0.3","172.20.0.2","TLSv1.2","Client Hello"
"152","0.344824845","66","86:fa:ea:be:32:28","9a:de:8f:45:63:e9","172.20.0.2","172.20.0.3","TCP","4433 → 37452 [ACK] Seq=1 Ack=528 Win=64640 Len=0 TSval=1331510918 TSecr=1140595123"
"153","0.348360116","965","86:fa:ea:be:32:28","9a:de:8f:45:63:e9","172.20.0.2","172.20.0.3","TLSv1.3","Server Hello, Change Cipher Spec, Application Data, Application Data, Application Data, Application Data"
"154","0.348383595","66","9a:de:8f:45:63:e9","86:fa:ea:be:32:28","172.20.0.3","172.20.0.2","TCP","37452 → 4433 [ACK] Seq=528 Ack=900 Win=64128 Len=0 TSval=1140595127 TSecr=1331510922"
"155","0.351722158","146","9a:de:8f:45:63:e9","86:fa:ea:be:32:28","172.20.0.3","172.20.0.2","TLSv1.3","Change Cipher Spec, Application Data"
"156","0.351768989","66","9a:de:8f:45:63:e9","86:fa:ea:be:32:28","172.20.0.3","172.20.0.2","TCP","37452 → 4433 [RST, ACK] Seq=608 Ack=900 Win=64128 Len=0 TSval=1140595130 TSecr=1331510922"
"157","0.362194945","74","9a:de:8f:45:63:e9","86:fa:ea:be:32:28","172.20.0.3","172.20.0.2","TCP","37454 → 4433 [SYN] Seq=0 Win=64240 Len=0 MSS=1460 SACK_PERM TSval=1140595141 TSecr=0 WS=128"
"158","0.362213172","74","86:fa:ea:be:32:28","9a:de:8f:45:63:e9","172.20.0.2","172.20.0.3","TCP","4433 → 37454 [SYN, ACK] Seq=0 Ack=1 Win=65160 Len=0 MSS=1460 SACK_PERM TSval=1331510936 TSecr=1140595141 WS=128"
"159","0.362227212","66","9a:de:8f:45:63:e9","86:fa:ea:be:32:28","172.20.0.3","172.20.0.2","TCP","37454 → 4433 [ACK] Seq=1 Ack=1 Win=64256 Len=0 TSval=1140595141 TSecr=1331510936"
"160","0.362259653","593","9a:de:8f:45:63:e9","86:fa:ea:be:32:28","172.20.0.3","172.20.0.2","TLSv1.2","Client Hello"
"161","0.362264222","66","86:fa:ea:be:32:28","9a:de:8f:45:63:e9","172.20.0.2","172.20.0.3","TCP","4433 → 37454 [ACK] Seq=1 Ack=528 Win=64640 Len=0 TSval=1331510936 TSecr=1140595141"
"162","0.365725371","965","86:fa:ea:be:32:28","9a:de:8f:45:63:e9","172.20.0.2","172.20.0.3","TLSv1.3","Server Hello, Change Cipher Spec, Application Data, Application Data, Application Data, Application Data"
"163","0.365749229","66","9a:de:8f:45:63:e9","86:fa:ea:be:32:28","172.20.0.3","172.20.0.2","TCP","37454 → 4433 [ACK] Seq=528 Ack=900 Win=64128 Len=0 TSval=1140595144 TSecr=1331510939"
"164","0.369170984","146","9a:de:8f:45:63:e9","86:fa:ea:be:32:28","172.20.0.3","172.20.0.2","TLSv1.3","Change Cipher Spec, Application Data"
"165","0.369220082","66","9a:de:8f:45:63:e9","86:fa:ea:be:32:28","172.20.0.3","172.20.0.2","TCP","37454 → 4433 [RST, ACK] Seq=608 Ack=900 Win=64128 Len=0 TSval=1140595148 TSecr=1331510939"
"166","0.380026827","74","9a:de:8f:45:63:e9","86:fa:ea:be:32:28","172.20.0.3","172.20.0.2","TCP","37456 → 4433 [SYN] Seq=0 Win=64240 Len=0 MSS=1460 SACK_PERM TSval=1140595158 TSecr=0 WS=128"
"167","0.380046493","74","86:fa:ea:be:32:28","9a:de:8f:45:63:e9","172.20.0.2","172.20.0.3","TCP","4433 → 37456 [SYN, ACK] Seq=0 Ack=1 Win=65160 Len=0 MSS=1460 SACK_PERM TSval=1331510953 TSecr=1140595158 WS=128"
"168","0.380084167","66","9a:de:8f:45:63:e9","86:fa:ea:be:32:28","172.20.0.3","172.20.0.2","TCP","37456 → 4433 [ACK] Seq=1 Ack=1 Win=64256 Len=0 TSval=1140595159 TSecr=1331510953"
"169","0.380118030","593","9a:de:8f:45:63:e9","86:fa:ea:be:32:28","172.20.0.3","172.20.0.2","TLSv1.2","Client Hello"
"170","0.380123774","66","86:fa:ea:be:32:28","9a:de:8f:45:63:e9","172.20.0.2","172.20.0.3","TCP","4433 → 37456 [ACK] Seq=1 Ack=528 Win=64640 Len=0 TSval=1331510954 TSecr=1140595159"
"171","0.383611707","964","86:fa:ea:be:32:28","9a:de:8f:45:63:e9","172.20.0.2","172.20.0.3","TLSv1.3","Server Hello, Change Cipher Spec, Application Data, Application Data, Application Data, Application Data"
"172","0.383633940","66","9a:de:8f:45:63:e9","86:fa:ea:be:32:28","172.20.0.3","172.20.0.2","TCP","37456 → 4433 [ACK] Seq=528 Ack=899 Win=64128 Len=0 TSval=1140595162 TSecr=1331510957"
"173","0.387252934","146","9a:de:8f:45:63:e9","86:fa:ea:be:32:28","172.20.0.3","172.20.0.2","TLSv1.3","Change Cipher Spec, Application Data"
"174","0.387306745","66","9a:de:8f:45:63:e9","86:fa:ea:be:32:28","172.20.0.3","172.20.0.2","TCP","37456 → 4433 [RST, ACK] Seq=608 Ack=899 Win=64128 Len=0 TSval=1140595166 TSecr=1331510957"
"175","0.403152347","74","9a:de:8f:45:63:e9","86:fa:ea:be:32:28","172.20.0.3","172.20.0.2","TCP","37462 → 4433 [SYN] Seq=0 Win=64240 Len=0 MSS=1460 SACK_PERM TSval=1140595182 TSecr=0 WS=128"
"176","0.403182496","74","86:fa:ea:be:32:28","9a:de:8f:45:63:e9","172.20.0.2","172.20.0.3","TCP","4433 → 37462 [SYN, ACK] Seq=0 Ack=1 Win=65160 Len=0 MSS=1460 SACK_PERM TSval=1331510977 TSecr=1140595182 WS=128"
"177","0.403204742","66","9a:de:8f:45:63:e9","86:fa:ea:be:32:28","172.20.0.3","172.20.0.2","TCP","37462 → 4433 [ACK] Seq=1 Ack=1 Win=64256 Len=0 TSval=1140595182 TSecr=1331510977"
"178","0.403263702","593","9a:de:8f:45:63:e9","86:fa:ea:be:32:28","172.20.0.3","172.20.0.2","TLSv1.2","Client Hello"
"179","0.403269672","66","86:fa:ea:be:32:28","9a:de:8f:45:63:e9","172.20.0.2","172.20.0.3","TCP","4433 → 37462 [ACK] Seq=1 Ack=528 Win=64640 Len=0 TSval=1331510977 TSecr=1140595182"
"180","0.407293477","966","86:fa:ea:be:32:28","9a:de:8f:45:63:e9","172.20.0.2","172.20.0.3","TLSv1.3","Server Hello, Change Cipher Spec, Application Data, Application Data, Application Data, Application Data"
"181","0.407330090","66","9a:de:8f:45:63:e9","86:fa:ea:be:32:28","172.20.0.3","172.20.0.2","TCP","37462 → 4433 [ACK] Seq=528 Ack=901 Win=64128 Len=0 TSval=1140595186 TSecr=1331510981"
"182","0.413552804","146","9a:de:8f:45:63:e9","86:fa:ea:be:32:28","172.20.0.3","172.20.0.2","TLSv1.3","Change Cipher Spec, Application Data"
"183","0.413634581","66","9a:de:8f:45:63:e9","86:fa:ea:be:32:28","172.20.0.3","172.20.0.2","TCP","37462 → 4433 [RST, ACK] Seq=608 Ack=901 Win=64128 Len=0 TSval=1140595192 TSecr=1331510981"
"184","0.430188750","74","9a:de:8f:45:63:e9","86:fa:ea:be:32:28","172.20.0.3","172.20.0.2","TCP","37472 → 4433 [SYN] Seq=0 Win=64240 Len=0 MSS=1460 SACK_PERM TSval=1140595209 TSecr=0 WS=128"
"185","0.430220559","74","86:fa:ea:be:32:28","9a:de:8f:45:63:e9","172.20.0.2","172.20.0.3","TCP","4433 → 37472 [SYN, ACK] Seq=0 Ack=1 Win=65160 Len=0 MSS=1460 SACK_PERM TSval=1331511004 TSecr=1140595209 WS=128"
"186","0.430246033","66","9a:de:8f:45:63:e9","86:fa:ea:be:32:28","172.20.0.3","172.20.0.2","TCP","37472 → 4433 [ACK] Seq=1 Ack=1 Win=64256 Len=0 TSval=1140595209 TSecr=1331511004"
"187","0.430311512","593","9a:de:8f:45:63:e9","86:fa:ea:be:32:28","172.20.0.3","172.20.0.2","TLSv1.2","Client Hello"
"188","0.430320087","66","86:fa:ea:be:32:28","9a:de:8f:45:63:e9","172.20.0.2","172.20.0.3","TCP","4433 → 37472 [ACK] Seq=1 Ack=528 Win=64640 Len=0 TSval=1331511004 TSecr=1140595209"
"189","0.434014388","965","86:fa:ea:be:32:28","9a:de:8f:45:63:e9","172.20.0.2","172.20.0.3","TLSv1.3","Server Hello, Change Cipher Spec, Application Data, Application Data, Application Data, Application Data"
"190","0.434047164","66","9a:de:8f:45:63:e9","86:fa:ea:be:32:28","172.20.0.3","172.20.0.2","TCP","37472 → 4433 [ACK] Seq=528 Ack=900 Win=64128 Len=0 TSval=1140595212 TSecr=1331511007"
"191","0.439613193","146","9a:de:8f:45:63:e9","86:fa:ea:be:32:28","172.20.0.3","172.20.0.2","TLSv1.3","Change Cipher Spec, Application Data"
"192","0.439703996","66","9a:de:8f:45:63:e9","86:fa:ea:be:32:28","172.20.0.3","172.20.0.2","TCP","37472 → 4433 [RST, ACK] Seq=608 Ack=900 Win=64128 Len=0 TSval=1140595218 TSecr=1331511007"
"193","0.451664473","74","9a:de:8f:45:63:e9","86:fa:ea:be:32:28","172.20.0.3","172.20.0.2","TCP","37482 → 4433 [SYN] Seq=0 Win=64240 Len=0 MSS=1460 SACK_PERM TSval=1140595230 TSecr=0 WS=128"
"194","0.451684121","74","86:fa:ea:be:32:28","9a:de:8f:45:63:e9","172.20.0.2","172.20.0.3","TCP","4433 → 37482 [SYN, ACK] Seq=0 Ack=1 Win=65160 Len=0 MSS=1460 SACK_PERM TSval=1331511025 TSecr=1140595230 WS=128"
"195","0.451697075","66","9a:de:8f:45:63:e9","86:fa:ea:be:32:28","172.20.0.3","172.20.0.2","TCP","37482 → 4433 [ACK] Seq=1 Ack=1 Win=64256 Len=0 TSval=1140595230 TSecr=1331511025"
"196","0.451735317","593","9a:de:8f:45:63:e9","86:fa:ea:be:32:28","172.20.0.3","172.20.0.2","TLSv1.2","Client Hello"
"197","0.451739870","66","86:fa:ea:be:32:28","9a:de:8f:45:63:e9","172.20.0.2","172.20.0.3","TCP","4433 → 37482 [ACK] Seq=1 Ack=528 Win=64640 Len=0 TSval=1331511025 TSecr=1140595230"
"198","0.455405599","965","86:fa:ea:be:32:28","9a:de:8f:45:63:e9","172.20.0.2","172.20.0.3","TLSv1.3","Server Hello, Change Cipher Spec, Application Data, Application Data, Application Data, Application Data"
"199","0.455430363","66","9a:de:8f:45:63:e9","86:fa:ea:be:32:28","172.20.0.3","172.20.0.2","TCP","37482 → 4433 [ACK] Seq=528 Ack=900 Win=64128 Len=0 TSval=1140595234 TSecr=1331511029"
"200","0.458899266","146","9a:de:8f:45:63:e9","86:fa:ea:be:32:28","172.20.0.3","172.20.0.2","TLSv1.3","Change Cipher Spec, Application Data"
"201","0.458955869","66","9a:de:8f:45:63:e9","86:fa:ea:be:32:28","172.20.0.3","172.20.0.2","TCP","37482 → 4433 [RST, ACK] Seq=608 Ack=900 Win=64128 Len=0 TSval=1140595237 TSecr=1331511029"
"202","0.469988977","74","9a:de:8f:45:63:e9","86:fa:ea:be:32:28","172.20.0.3","172.20.0.2","TCP","37492 → 4433 [SYN] Seq=0 Win=64240 Len=0 MSS=1460 SACK_PERM TSval=1140595248 TSecr=0 WS=128"
"203","0.470013516","74","86:fa:ea:be:32:28","9a:de:8f:45:63:e9","172.20.0.2","172.20.0.3","TCP","4433 → 37492 [SYN, ACK] Seq=0 Ack=1 Win=65160 Len=0 MSS=1460 SACK_PERM TSval=1331511043 TSecr=1140595248 WS=128"
"204","0.470032353","66","9a:de:8f:45:63:e9","86:fa:ea:be:32:28","172.20.0.3","172.20.0.2","TCP","37492 → 4433 [ACK] Seq=1 Ack=1 Win=64256 Len=0 TSval=1140595248 TSecr=1331511043"
"205","0.470086214","593","9a:de:8f:45:63:e9","86:fa:ea:be:32:28","172.20.0.3","172.20.0.2","TLSv1.2","Client Hello"
"206","0.470091916","66","86:fa:ea:be:32:28","9a:de:8f:45:63:e9","172.20.0.2","172.20.0.3","TCP","4433 → 37492 [ACK] Seq=1 Ack=528 Win=64640 Len=0 TSval=1331511044 TSecr=1140595249"
"207","0.473693021","966","86:fa:ea:be:32:28","9a:de:8f:45:63:e9","172.20.0.2","172.20.0.3","TLSv1.3","Server Hello, Change Cipher Spec, Application Data, Application Data, Application Data, Application Data"
"208","0.473741566","66","9a:de:8f:45:63:e9","86:fa:ea:be:32:28","172.20.0.3","172.20.0.2","TCP","37492 → 4433 [ACK] Seq=528 Ack=901 Win=64128 Len=0 TSval=1140595252 TSecr=1331511047"
"209","0.477386135","146","9a:de:8f:45:63:e9","86:fa:ea:be:32:28","172.20.0.3","172.20.0.2","TLSv1.3","Change Cipher Spec, Application Data"
"210","0.477470376","66","9a:de:8f:45:63:e9","86:fa:ea:be:32:28","172.20.0.3","172.20.0.2","TCP","37492 → 4433 [RST, ACK] Seq=608 Ack=901 Win=64128 Len=0 TSval=1140595256 TSecr=1331511047"
"211","0.489152296","74","9a:de:8f:45:63:e9","86:fa:ea:be:32:28","172.20.0.3","172.20.0.2","TCP","37502 → 4433 [SYN] Seq=0 Win=64240 Len=0 MSS=1460 SACK_PERM TSval=1140595268 TSecr=0 WS=128"
"212","0.489174260","74","86:fa:ea:be:32:28","9a:de:8f:45:63:e9","172.20.0.2","172.20.0.3","TCP","4433 → 37502 [SYN, ACK] Seq=0 Ack=1 Win=65160 Len=0 MSS=1460 SACK_PERM TSval=1331511063 TSecr=1140595268 WS=128"
"213","0.489190977","66","9a:de:8f:45:63:e9","86:fa:ea:be:32:28","172.20.0.3","172.20.0.2","TCP","37502 → 4433 [ACK] Seq=1 Ack=1 Win=64256 Len=0 TSval=1140595268 TSecr=1331511063"
"214","0.489226648","593","9a:de:8f:45:63:e9","86:fa:ea:be:32:28","172.20.0.3","172.20.0.2","TLSv1.2","Client Hello"
"215","0.489231992","66","86:fa:ea:be:32:28","9a:de:8f:45:63:e9","172.20.0.2","172.20.0.3","TCP","4433 → 37502 [ACK] Seq=1 Ack=528 Win=64640 Len=0 TSval=1331511063 TSecr=1140595268"
"216","0.492815540","965","86:fa:ea:be:32:28","9a:de:8f:45:63:e9","172.20.0.2","172.20.0.3","TLSv1.3","Server Hello, Change Cipher Spec, Application Data, Application Data, Application Data, Application Data"
"217","0.492842302","66","9a:de:8f:45:63:e9","86:fa:ea:be:32:28","172.20.0.3","172.20.0.2","TCP","37502 → 4433 [ACK] Seq=528 Ack=900 Win=64128 Len=0 TSval=1140595271 TSecr=1331511066"
"218","0.496377603","146","9a:de:8f:45:63:e9","86:fa:ea:be:32:28","172.20.0.3","172.20.0.2","TLSv1.3","Change Cipher Spec, Application Data"
"219","0.496432014","66","9a:de:8f:45:63:e9","86:fa:ea:be:32:28","172.20.0.3","172.20.0.2","TCP","37502 → 4433 [RST, ACK] Seq=608 Ack=900 Win=64128 Len=0 TSval=1140595275 TSecr=1331511066"
"220","0.507521897","74","9a:de:8f:45:63:e9","86:fa:ea:be:32:28","172.20.0.3","172.20.0.2","TCP","37510 → 4433 [SYN] Seq=0 Win=64240 Len=0 MSS=1460 SACK_PERM TSval=1140595286 TSecr=0 WS=128"
"221","0.507541726","74","86:fa:ea:be:32:28","9a:de:8f:45:63:e9","172.20.0.2","172.20.0.3","TCP","4433 → 37510 [SYN, ACK] Seq=0 Ack=1 Win=65160 Len=0 MSS=1460 SACK_PERM TSval=1331511081 TSecr=1140595286 WS=128"
"222","0.507562067","66","9a:de:8f:45:63:e9","86:fa:ea:be:32:28","172.20.0.3","172.20.0.2","TCP","37510 → 4433 [ACK] Seq=1 Ack=1 Win=64256 Len=0 TSval=1140595286 TSecr=1331511081"
"223","0.507602138","593","9a:de:8f:45:63:e9","86:fa:ea:be:32:28","172.20.0.3","172.20.0.2","TLSv1.2","Client Hello"
"224","0.507607438","66","86:fa:ea:be:32:28","9a:de:8f:45:63:e9","172.20.0.2","172.20.0.3","TCP","4433 → 37510 [ACK] Seq=1 Ack=528 Win=64640 Len=0 TSval=1331511081 TSecr=1140595286"
"225","0.511114966","965","86:fa:ea:be:32:28","9a:de:8f:45:63:e9","172.20.0.2","172.20.0.3","TLSv1.3","Server Hello, Change Cipher Spec, Application Data, Application Data, Application Data, Application Data"
