frame.number,frame.time_relative,frame.len,eth.src,eth.dst,ip.src,ip.dst,_ws.col.protocol,_ws.col.info
"1","0.000000000","42","d6:92:6b:39:40:16","ff:ff:ff:ff:ff:ff",,,"ARP","ARP Announcement for 172.20.0.3"
"2","0.033183652","42","d6:92:6b:39:40:16","ff:ff:ff:ff:ff:ff",,,"ARP","Who has 172.20.0.2? Tell 172.20.0.3"
"3","0.033206557","42","22:77:05:09:fa:00","d6:92:6b:39:40:16",,,"ARP","172.20.0.2 is at 22:77:05:09:fa:00"
"4","0.033213136","74","d6:92:6b:39:40:16","22:77:05:09:fa:00","172.20.0.3","172.20.0.2","TCP","49904 → 4433 [SYN] Seq=0 Win=64240 Len=0 MSS=1460 SACK_PERM TSval=1139004084 TSecr=0 WS=128"
"5","0.033235212","74","22:77:05:09:fa:00","d6:92:6b:39:40:16","172.20.0.2","172.20.0.3","TCP","4433 → 49904 [SYN, ACK] Seq=0 Ack=1 Win=65160 Len=0 MSS=1460 SACK_PERM TSval=1329919879 TSecr=1139004084 WS=128"
"6","0.033251969","66","d6:92:6b:39:40:16","22:77:05:09:fa:00","172.20.0.3","172.20.0.2","TCP","49904 → 4433 [ACK] Seq=1 Ack=1 Win=64256 Len=0 TSval=1139004084 TSecr=1329919879"
"7","0.033295705","1353","d6:92:6b:39:40:16","22:77:05:09:fa:00","172.20.0.3","172.20.0.2","TLSv1.2","Client Hello"
"8","0.033301487","66","22:77:05:09:fa:00","d6:92:6b:39:40:16","172.20.0.2","172.20.0.3","TCP","4433 → 49904 [ACK] Seq=1 Ack=1288 Win=64128 Len=0 TSval=1329919879 TSecr=1139004084"
"9","0.037736834","1537","22:77:05:09:fa:00","d6:92:6b:39:40:16","172.20.0.2","172.20.0.3","TLSv1.3","Server Hello, Change Cipher Spec, Application Data, Application Data, Application Data, Application Data"
"10","0.037778562","66","d6:92:6b:39:40:16","22:77:05:09:fa:00","172.20.0.3","172.20.0.2","TCP","49904 → 4433 [ACK] Seq=1288 Ack=1472 Win=64128 Len=0 TSval=1139004088 TSecr=1329919883"
"11","0.040468715","146","d6:92:6b:39:40:16","22:77:05:09:fa:00","172.20.0.3","172.20.0.2","TLSv1.3","Change Cipher Spec, Application Data"
"12","0.040538418","66","d6:92:6b:39:40:16","22:77:05:09:fa:00","172.20.0.3","172.20.0.2","TCP","49904 → 4433 [RST, ACK] Seq=1368 Ack=1472 Win=64128 Len=0 TSval=1139004091 TSecr=1329919883"
"13","0.054115060","74","d6:92:6b:39:40:16","22:77:05:09:fa:00","172.20.0.3","172.20.0.2","TCP","49916 → 4433 [SYN] Seq=0 Win=64240 Len=0 MSS=1460 SACK_PERM TSval=1139004105 TSecr=0 WS=128"
"14","0.054140313","74","22:77:05:09:fa:00","d6:92:6b:39:40:16","172.20.0.2","172.20.0.3","TCP","4433 → 49916 [SYN, ACK] Seq=0 Ack=1 Win=65160 Len=0 MSS=1460 SACK_PERM TSval=1329919900 TSecr=1139004105 WS=128"
"15","0.054158185","66","d6:92:6b:39:40:16","22:77:05:09:fa:00","172.20.0.3","172.20.0.2","TCP","49916 → 4433 [ACK] Seq=1 Ack=1 Win=64256 Len=0 TSval=1139004105 TSecr=1329919900"
"16","0.054198565","1353","d6:92:6b:39:40:16","22:77:05:09:fa:00","172.20.0.3","172.20.0.2","TLSv1.2","Client Hello"
"17","0.054202599","66","22:77:05:09:fa:00","d6:92:6b:39:40:16","172.20.0.2","172.20.0.3","TCP","4433 → 49916 [ACK] Seq=1 Ack=1288 Win=64128 Len=0 TSval=1329919900 TSecr=1139004105"
"18","0.055851116","1537","22:77:05:09:fa:00","d6:92:6b:39:40:16","172.20.0.2","172.20.0.3","TLSv1.3","Server Hello, Change Cipher Spec, Application Data, Application Data, Application Data, Application Data"
"19","0.055885115","66","d6:92:6b:39:40:16","22:77:05:09:fa:00","172.20.0.3","172.20.0.2","TCP","49916 → 4433 [ACK] Seq=1288 Ack=1472 Win=64128 Len=0 TSval=1139004106 TSecr=1329919901"
"20","0.058444785","146","d6:92:6b:39:40:16","22:77:05:09:fa:00","172.20.0.3","172.20.0.2","TLSv1.3","Change Cipher Spec, Application Data"
"21","0.058513610","66","d6:92:6b:39:40:16","22:77:05:09:fa:00","172.20.0.3","172.20.0.2","TCP","49916 → 4433 [RST, ACK] Seq=1368 Ack=1472 Win=64128 Len=0 TSval=1139004109 TSecr=1329919901"
"22","0.072640525","74","d6:92:6b:39:40:16","22:77:05:09:fa:00","172.20.0.3","172.20.0.2","TCP","49922 → 4433 [SYN] Seq=0 Win=64240 Len=0 MSS=1460 SACK_PERM TSval=1139004123 TSecr=0 WS=128"
"23","0.072667598","74","22:77:05:09:fa:00","d6:92:6b:39:40:16","172.20.0.2","172.20.0.3","TCP","4433 → 49922 [SYN, ACK] Seq=0 Ack=1 Win=65160 Len=0 MSS=1460 SACK_PERM TSval=1329919918 TSecr=1139004123 WS=128"
"24","0.072688387","66","d6:92:6b:39:40:16","22:77:05:09:fa:00","172.20.0.3","172.20.0.2","TCP","49922 → 4433 [ACK] Seq=1 Ack=1 Win=64256 Len=0 TSval=1139004123 TSecr=1329919918"
"25","0.072740540","1353","d6:92:6b:39:40:16","22:77:05:09:fa:00","172.20.0.3","172.20.0.2","TLSv1.2","Client Hello"
"26","0.072746816","66","22:77:05:09:fa:00","d6:92:6b:39:40:16","172.20.0.2","172.20.0.3","TCP","4433 → 49922 [ACK] Seq=1 Ack=1288 Win=64128 Len=0 TSval=1329919918 TSecr=1139004123"
"27","0.074511171","1537","22:77:05:09:fa:00","d6:92:6b:39:40:16","172.20.0.2","172.20.0.3","TLSv1.3","Server Hello, Change Cipher Spec, Application Data, Application Data, Application Data, Application Data"
"28","0.074547557","66","d6:92:6b:39:40:16","22:77:05:09:fa:00","172.20.0.3","172.20.0.2","TCP","49922 → 4433 [ACK] Seq=1288 Ack=1472 Win=64128 Len=0 TSval=1139004125 TSecr=1329919920"
"29","0.077116051","146","d6:92:6b:39:40:16","22:77:05:09:fa:00","172.20.0.3","172.20.0.2","TLSv1.3","Change Cipher Spec, Application Data"
"30","0.077173556","66","d6:92:6b:39:40:16","22:77:05:09:fa:00","172.20.0.3","172.20.0.2","TCP","49922 → 4433 [RST, ACK] Seq=1368 Ack=1472 Win=64128 Len=0 TSval=1139004128 TSecr=1329919920"
"31","0.090483106","74","d6:92:6b:39:40:16","22:77:05:09:fa:00","172.20.0.3","172.20.0.2","TCP","49934 → 4433 [SYN] Seq=0 Win=64240 Len=0 MSS=1460 SACK_PERM TSval=1139004141 TSecr=0 WS=128"
"32","0.090508516","74","22:77:05:09:fa:00","d6:92:6b:39:40:16","172.20.0.2","172.20.0.3","TCP","4433 → 49934 [SYN, ACK] Seq=0 Ack=1 Win=65160 Len=0 MSS=1460 SACK_PERM TSval=1329919936 TSecr=1139004141 WS=128"
"33","0.090525472","66","d6:92:6b:39:40:16","22:77:05:09:fa:00","172.20.0.3","172.20.0.2","TCP","49934 → 4433 [ACK] Seq=1 Ack=1 Win=64256 Len=0 TSval=1139004141 TSecr=1329919936"
"34","0.090569325","1353","d6:92:6b:39:40:16","22:77:05:09:fa:00","172.20.0.3","172.20.0.2","TLSv1.2","Client Hello"
"35","0.090573463","66","22:77:05:09:fa:00","d6:92:6b:39:40:16","172.20.0.2","172.20.0.3","TCP","4433 → 49934 [ACK] Seq=1 Ack=1288 Win=64128 Len=0 TSval=1329919936 TSecr=1139004141"
"36","0.092426259","1537","22:77:05:09:fa:00","d6:92:6b:39:40:16","172.20.0.2","172.20.0.3","TLSv1.3","Server Hello, Change Cipher Spec, Application Data, Application Data, Application Data, Application Data"
"37","0.092460197","66","d6:92:6b:39:40:16","22:77:05:09:fa:00","172.20.0.3","172.20.0.2","TCP","49934 → 4433 [ACK] Seq=1288 Ack=1472 Win=64128 Len=0 TSval=1139004143 TSecr=1329919938"
"38","0.095012017","146","d6:92:6b:39:40:16","22:77:05:09:fa:00","172.20.0.3","172.20.0.2","TLSv1.3","Change Cipher Spec, Application Data"
"39","0.095094088","66","d6:92:6b:39:40:16","22:77:05:09:fa:00","172.20.0.3","172.20.0.2","TCP","49934 → 4433 [RST, ACK] Seq=1368 Ack=1472 Win=64128 Len=0 TSval=1139004146 TSecr=1329919938"
"40","0.108449518","74","d6:92:6b:39:40:16","22:77:05:09:fa:00","172.20.0.3","172.20.0.2","TCP","49936 → 4433 [SYN] Seq=0 Win=64240 Len=0 MSS=1460 SACK_PERM TSval=1139004159 TSecr=0 WS=128"
"41","0.108474565","74","22:77:05:09:fa:00","d6:92:6b:39:40:16","172.20.0.2","172.20.0.3","TCP","4433 → 49936 [SYN, ACK] Seq=0 Ack=1 Win=65160 Len=0 MSS=1460 SACK_PERM TSval=1329919954 TSecr=1139004159 WS=128"
"42","0.108493747","66","d6:92:6b:39:40:16","22:77:05:09:fa:00","172.20.0.3","172.20.0.2","TCP","49936 → 4433 [ACK] Seq=1 Ack=1 Win=64256 Len=0 TSval=1139004159 TSecr=1329919954"
"43","0.108533375","1353","d6:92:6b:39:40:16","22:77:05:09:fa:00","172.20.0.3","172.20.0.2","TLSv1.2","Client Hello"
"44","0.108538833","66","22:77:05:09:fa:00","d6:92:6b:39:40:16","172.20.0.2","172.20.0.3","TCP","4433 → 49936 [ACK] Seq=1 Ack=1288 Win=64128 Len=0 TSval=1329919954 TSecr=1139004159"
"45","0.110245262","1537","22:77:05:09:fa:00","d6:92:6b:39:40:16","172.20.0.2","172.20.0.3","TLSv1.3","Server Hello, Change Cipher Spec, Application Data, Application Data, Application Data, Application Data"
"46","0.110276462","66","d6:92:6b:39:40:16","22:77:05:09:fa:00","172.20.0.3","172.20.0.2","TCP","49936 → 4433 [ACK] Seq=1288 Ack=1472 Win=64128 Len=0 TSval=1139004161 TSecr=1329919956"
"47","0.112755362","146","d6:92:6b:39:40:16","22:77:05:09:fa:00","172.20.0.3","172.20.0.2","TLSv1.3","Change Cipher Spec, Application Data"
"48","0.112815883","66","d6:92:6b:39:40:16","22:77:05:09:fa:00","172.20.0.3","172.20.0.2","TCP","49936 → 4433 [RST, ACK] Seq=1368 Ack=1472 Win=64128 Len=0 TSval=1139004163 TSecr=1329919956"
"49","0.126163857","74","d6:92:6b:39:40:16","22:77:05:09:fa:00","172.20.0.3","172.20.0.2","TCP","49944 → 4433 [SYN] Seq=0 Win=64240 Len=0 MSS=1460 SACK_PERM TSval=1139004177 TSecr=0 WS=128"
"50","0.126187773","74","22:77:05:09:fa:00","d6:92:6b:39:40:16","172.20.0.2","172.20.0.3","TCP","4433 → 49944 [SYN, ACK] Seq=0 Ack=1 Win=65160 Len=0 MSS=1460 SACK_PERM TSval=1329919972 TSecr=1139004177 WS=128"
"51","0.126203910","66","d6:92:6b:39:40:16","22:77:05:09:fa:00","172.20.0.3","172.20.0.2","TCP","49944 → 4433 [ACK] Seq=1 Ack=1 Win=64256 Len=0 TSval=1139004177 TSecr=1329919972"
"52","0.126247383","1353","d6:92:6b:39:40:16","22:77:05:09:fa:00","172.20.0.3","172.20.0.2","TLSv1.2","Client Hello"
"53","0.126253092","66","22:77:05:09:fa:00","d6:92:6b:39:40:16","172.20.0.2","172.20.0.3","TCP","4433 → 49944 [ACK] Seq=1 Ack=1288 Win=64128 Len=0 TSval=1329919972 TSecr=1139004177"
"54","0.127881772","1537","22:77:05:09:fa:00","d6:92:6b:39:40:16","172.20.0.2","172.20.0.3","TLSv1.3","Server Hello, Change Cipher Spec, Application Data, Application Data, Application Data, Application Data"
"55","0.127922664","66","d6:92:6b:39:40:16","22:77:05:09:fa:00","172.20.0.3","172.20.0.2","TCP","49944 → 4433 [ACK] Seq=1288 Ack=1472 Win=64128 Len=0 TSval=1139004178 TSecr=1329919973"
"56","0.130479526","146","d6:92:6b:39:40:16","22:77:05:09:fa:00","172.20.0.3","172.20.0.2","TLSv1.3","Change Cipher Spec, Application Data"
"57","0.130536066","66","d6:92:6b:39:40:16","22:77:05:09:fa:00","172.20.0.3","172.20.0.2","TCP","49944 → 4433 [RST, ACK] Seq=1368 Ack=1472 Win=64128 Len=0 TSval=1139004181 TSecr=1329919973"
"58","0.143753426","74","d6:92:6b:39:40:16","22:77:05:09:fa:00","172.20.0.3","172.20.0.2","TCP","49946 → 4433 [SYN] Seq=0 Win=64240 Len=0 MSS=1460 SACK_PERM TSval=1139004194 TSecr=0 WS=128"
"59","0.143776167","74","22:77:05:09:fa:00","d6:92:6b:39:40:16","172.20.0.2","172.20.0.3","TCP","4433 → 49946 [SYN, ACK] Seq=0 Ack=1 Win=65160 Len=0 MSS=1460 SACK_PERM TSval=1329919989 TSecr=1139004194 WS=128"
"60","0.143798066","66","d6:92:6b:39:40:16","22:77:05:09:fa:00","172.20.0.3","172.20.0.2","TCP","49946 → 4433 [ACK] Seq=1 Ack=1 Win=64256 Len=0 TSval=1139004194 TSecr=1329919989"
"61","0.143844689","1353","d6:92:6b:39:40:16","22:77:05:09:fa:00","172.20.0.3","172.20.0.2","TLSv1.2","Client Hello"
"62","0.143851161","66","22:77:05:09:fa:00","d6:92:6b:39:40:16","172.20.0.2","172.20.0.3","TCP","4433 → 49946 [ACK] Seq=1 Ack=1288 Win=64128 Len=0 TSval=1329919989 TSecr=1139004194"
"63","0.145506414","1537","22:77:05:09:fa:00","d6:92:6b:39:40:16","172.20.0.2","172.20.0.3","TLSv1.3","Server Hello, Change Cipher Spec, Application Data, Application Data, Application Data, Application Data"
"64","0.145537434","66","d6:92:6b:39:40:16","22:77:05:09:fa:00","172.20.0.3","172.20.0.2","TCP","49946 → 4433 [ACK] Seq=1288 Ack=1472 Win=64128 Len=0 TSval=1139004196 TSecr=1329919991"
"65","0.148244211","146","d6:92:6b:39:40:16","22:77:05:09:fa:00","172.20.0.3","172.20.0.2","TLSv1.3","Change Cipher Spec, Application Data"
"66","0.148314400","66","d6:92:6b:39:40:16","22:77:05:09:fa:00","172.20.0.3","172.20.0.2","TCP","49946 → 4433 [RST, ACK] Seq=1368 Ack=1472 Win=64128 Len=0 TSval=1139004199 TSecr=1329919991"
"67","0.162315251","74","d6:92:6b:39:40:16","22:77:05:09:fa:00","172.20.0.3","172.20.0.2","TCP","49956 → 4433 [SYN] Seq=0 Win=64240 Len=0 MSS=1460 SACK_PERM TSval=1139004213 TSecr=0 WS=128"
"68","0.162343671","74","22:77:05:09:fa:00","d6:92:6b:39:40:16","172.20.0.2","172.20.0.3","TCP","4433 → 49956 [SYN, ACK] Seq=0 Ack=1 Win=65160 Len=0 MSS=1460 SACK_PERM TSval=1329920008 TSecr=1139004213 WS=128"
"69","0.162365727","66","d6:92:6b:39:40:16","22:77:05:09:fa:00","172.20.0.3","172.20.0.2","TCP","49956 → 4433 [ACK] Seq=1 Ack=1 Win=64256 Len=0 TSval=1139004213 TSecr=1329920008"
"70","0.162414508","1353","d6:92:6b:39:40:16","22:77:05:09:fa:00","172.20.0.3","172.20.0.2","TLSv1.2","Client Hello"
"71","0.162429715","66","22:77:05:09:fa:00","d6:92:6b:39:40:16","172.20.0.2","172.20.0.3","TCP","4433 → 49956 [ACK] Seq=1 Ack=1288 Win=64128 Len=0 TSval=1329920008 TSecr=1139004213"
"72","0.164104004","1537","22:77:05:09:fa:00","d6:92:6b:39:40:16","172.20.0.2","172.20.0.3","TLSv1.3","Server Hello, Change Cipher Spec, Application Data, Application Data, Application Data, Application Data"
"73","0.164128694","66","d6:92:6b:39:40:16","22:77:05:09:fa:00","172.20.0.3","172.20.0.2","TCP","49956 → 4433 [ACK] Seq=1288 Ack=1472 Win=64128 Len=0 TSval=1139004215 TSecr=1329920010"
"74","0.166673615","146","d6:92:6b:39:40:16","22:77:05:09:fa:00","172.20.0.3","172.20.0.2","TLSv1.3","Change Cipher Spec, Application Data"
"75","0.166739171","66","d6:92:6b:39:40:16","22:77:05:09:fa:00","172.20.0.3","172.20.0.2","TCP","49956 → 4433 [RST, ACK] Seq=1368 Ack=1472 Win=64128 Len=0 TSval=1139004217 TSecr=1329920010"
"76","0.180093474","74","d6:92:6b:39:40:16","22:77:05:09:fa:00","172.20.0.3","172.20.0.2","TCP","49962 → 4433 [SYN] Seq=0 Win=64240 Len=0 MSS=1460 SACK_PERM TSval=1139004230 TSecr=0 WS=128"
"77","0.180118454","74","22:77:05:09:fa:00","d6:92:6b:39:40:16","172.20.0.2","172.20.0.3","TCP","4433 → 49962 [SYN, ACK] Seq=0 Ack=1 Win=65160 Len=0 MSS=1460 SACK_PERM TSval=1329920026 TSecr=1139004230 WS=128"
"78","0.180134892","66","d6:92:6b:39:40:16","22:77:05:09:fa:00","172.20.0.3","172.20.0.2","TCP","49962 → 4433 [ACK] Seq=1 Ack=1 Win=64256 Len=0 TSval=1139004231 TSecr=1329920026"
"79","0.180171945","1353","d6:92:6b:39:40:16","22:77:05:09:fa:00","172.20.0.3","172.20.0.2","TLSv1.2","Client Hello"
"80","0.180175766","66","22:77:05:09:fa:00","d6:92:6b:39:40:16","172.20.0.2","172.20.0.3","TCP","4433 → 49962 [ACK] Seq=1 Ack=1288 Win=64128 Len=0 TSval=1329920026 TSecr=1139004231"
"81","0.181876337","1537","22:77:05:09:fa:00","d6:92:6b:39:40:16","172.20.0.2","172.20.0.3","TLSv1.3","Server Hello, Change Cipher Spec, Application Data, Application Data, Application Data, Application Data"
"82","0.181913997","66","d6:92:6b:39:40:16","22:77:05:09:fa:00","172.20.0.3","172.20.0.2","TCP","49962 → 4433 [ACK] Seq=1288 Ack=1472 Win=64128 Len=0 TSval=1139004232 TSecr=1329920027"
"83","0.184370922","146","d6:92:6b:39:40:16","22:77:05:09:fa:00","172.20.0.3","172.20.0.2","TLSv1.3","Change Cipher Spec, Application Data"
"84","0.184432450","66","d6:92:6b:39:40:16","22:77:05:09:fa:00","172.20.0.3","172.20.0.2","TCP","49962 → 4433 [RST, ACK] Seq=1368 Ack=1472 Win=64128 Len=0 TSval=1139004235 TSecr=1329920027"
"85","0.197789218","74","d6:92:6b:39:40:16","22:77:05:09:fa:00","172.20.0.3","172.20.0.2","TCP","49978 → 4433 [SYN] Seq=0 Win=64240 Len=0 MSS=1460 SACK_PERM TSval=1139004248 TSecr=0 WS=128"
"86","0.197815940","74","22:77:05:09:fa:00","d6:92:6b:39:40:16","172.20.0.2","172.20.0.3","TCP","4433 → 49978 [SYN, ACK] Seq=0 Ack=1 Win=65160 Len=0 MSS=1460 SACK_PERM TSval=1329920043 TSecr=1139004248 WS=128"
"87","0.197838395","66","d6:92:6b:39:40:16","22:77:05:09:fa:00","172.20.0.3","172.20.0.2","TCP","49978 → 4433 [ACK] Seq=1 Ack=1 Win=64256 Len=0 TSval=1139004248 TSecr=1329920043"
"88","0.197894402","1353","d6:92:6b:39:40:16","22:77:05:09:fa:00","172.20.0.3","172.20.0.2","TLSv1.2","Client Hello"
"89","0.197900452","66","22:77:05:09:fa:00","d6:92:6b:39:40:16","172.20.0.2","172.20.0.3","TCP","4433 → 49978 [ACK] Seq=1 Ack=1288 Win=64128 Len=0 TSval=1329920043 TSecr=1139004248"
"90","0.199702638","1537","22:77:05:09:fa:00","d6:92:6b:39:40:16","172.20.0.2","172.20.0.3","TLSv1.3","Server Hello, Change Cipher Spec, Application Data, Application Data, Application Data, Application Data"
"91","0.199738296","66","d6:92:6b:39:40:16","22:77:05:09:fa:00","172.20.0.3","172.20.0.2","TCP","49978 → 4433 [ACK] Seq=1288 Ack=1472 Win=64128 Len=0 TSval=1139004250 TSecr=1329920045"
"92","0.202322024","146","d6:92:6b:39:40:16","22:77:05:09:fa:00","172.20.0.3","172.20.0.2","TLSv1.3","Change Cipher Spec, Application Data"
"93","0.202380742","66","d6:92:6b:39:40:16","22:77:05:09:fa:00","172.20.0.3","172.20.0.2","TCP","49978 → 4433 [RST, ACK] Seq=1368 Ack=1472 Win=64128 Len=0 TSval=1139004253 TSecr=1329920045"
"94","0.216150767","74","d6:92:6b:39:40:16","22:77:05:09:fa:00","172.20.0.3","172.20.0.2","TCP","49992 → 4433 [SYN] Seq=0 Win=64240 Len=0 MSS=1460 SACK_PERM TSval=1139004267 TSecr=0 WS=128"
"95","0.216176386","74","22:77:05:09:fa:00","d6:92:6b:39:40:16","172.20.0.2","172.20.0.3","TCP","4433 → 49992 [SYN, ACK] Seq=0 Ack=1 Win=65160 Len=0 MSS=1460 SACK_PERM TSval=1329920062 TSecr=1139004267 WS=128"
"96","0.216196169","66","d6:92:6b:39:40:16","22:77:05:09:fa:00","172.20.0.3","172.20.0.2","TCP","49992 → 4433 [ACK] Seq=1 Ack=1 Win=64256 Len=0 TSval=1139004267 TSecr=1329920062"
"97","0.216244074","1353","d6:92:6b:39:40:16","22:77:05:09:fa:00","172.20.0.3","172.20.0.2","TLSv1.2","Client Hello"
"98","0.216248577","66","22:77:05:09:fa:00","d6:92:6b:39:40:16","172.20.0.2","172.20.0.3","TCP","4433 → 49992 [ACK] Seq=1 Ack=1288 Win=64128 Len=0 TSval=1329920062 TSecr=1139004267"
"99","0.217985725","1537","22:77:05:09:fa:00","d6:92:6b:39:40:16","172.20.0.2","172.20.0.3","TLSv1.3","Server Hello, Change Cipher Spec, Application Data, Application Data, Application Data, Application Data"
"100","0.218017771","66","d6:92:6b:39:40:16","22:77:05:09:fa:00","172.20.0.3","172.20.0.2","TCP","49992 → 4433 [ACK] Seq=1288 Ack=1472 Win=64128 Len=0 TSval=1139004268 TSecr=1329920063"
"101","0.220571270","146","d6:92:6b:39:40:16","22:77:05:09:fa:00","172.20.0.3","172.20.0.2","TLSv1.3","Change Cipher Spec, Application Data"
"102","0.220630001","66","d6:92:6b:39:40:16","22:77:05:09:fa:00","172.20.0.3","172.20.0.2","TCP","49992 → 4433 [RST, ACK] Seq=1368 Ack=1472 Win=64128 Len=0 TSval=1139004271 TSecr=1329920063"
"103","0.234227135","74","d6:92:6b:39:40:16","22:77:05:09:fa:00","172.20.0.3","172.20.0.2","TCP","49998 → 4433 [SYN] Seq=0 Win=64240 Len=0 MSS=1460 SACK_PERM TSval=1139004285 TSecr=0 WS=128"
"104","0.234252409","74","22:77:05:09:fa:00","d6:92:6b:39:40:16","172.20.0.2","172.20.0.3","TCP","4433 → 49998 [SYN, ACK] Seq=0 Ack=1 Win=65160 Len=0 MSS=1460 SACK_PERM TSval=1329920080 TSecr=1139004285 WS=128"
"105","0.234269942","66","d6:92:6b:39:40:16","22:77:05:09:fa:00","172.20.0.3","172.20.0.2","TCP","49998 → 4433 [ACK] Seq=1 Ack=1 Win=64256 Len=0 TSval=1139004285 TSecr=1329920080"
"106","0.234313276","1353","d6:92:6b:39:40:16","22:77:05:09:fa:00","172.20.0.3","172.20.0.2","TLSv1.2","Client Hello"
"107","0.234317220","66","22:77:05:09:fa:00","d6:92:6b:39:40:16","172.20.0.2","172.20.0.3","TCP","4433 → 49998 [ACK] Seq=1 Ack=1288 Win=64128 Len=0 TSval=1329920080 TSecr=1139004285"
"108","0.236609132","1537","22:77:05:09:fa:00","d6:92:6b:39:40:16","172.20.0.2","172.20.0.3","TLSv1.3","Server Hello, Change Cipher Spec, Application Data, Application Data, Application Data, Application Data"
"109","0.236654098","66","d6:92:6b:39:40:16","22:77:05:09:fa:00","172.20.0.3","172.20.0.2","TCP","49998 → 4433 [ACK] Seq=1288 Ack=1472 Win=64128 Len=0 TSval=1139004287 TSecr=1329920082"
"110","0.239526018","146","d6:92:6b:39:40:16","22:77:05:09:fa:00","172.20.0.3","172.20.0.2","TLSv1.3","Change Cipher Spec, Application Data"
"111","0.239599998","66","d6:92:6b:39:40:16","22:77:05:09:fa:00","172.20.0.3","172.20.0.2","TCP","49998 → 4433 [RST, ACK] Seq=1368 Ack=1472 Win=64128 Len=0 TSval=1139004290 TSecr=1329920082"
"112","0.253521934","74","d6:92:6b:39:40:16","22:77:05:09:fa:00","172.20.0.3","172.20.0.2","TCP","50006 → 4433 [SYN] Seq=0 Win=64240 Len=0 MSS=1460 SACK_PERM TSval=1139004304 TSecr=0 WS=128"
"113","0.253547877","74","22:77:05:09:fa:00","d6:92:6b:39:40:16","172.20.0.2","172.20.0.3","TCP","4433 → 50006 [SYN, ACK] Seq=0 Ack=1 Win=65160 Len=0 MSS=1460 SACK_PERM TSval=1329920099 TSecr=1139004304 WS=128"
"114","0.253564970","66","d6:92:6b:39:40:16","22:77:05:09:fa:00","172.20.0.3","172.20.0.2","TCP","50006 → 4433 [ACK] Seq=1 Ack=1 Win=64256 Len=0 TSval=1139004304 TSecr=1329920099"
"115","0.253612700","1353","d6:92:6b:39:40:16","22:77:05:09:fa:00","172.20.0.3","172.20.0.2","TLSv1.2","Client Hello"
"116","0.253617006","66","22:77:05:09:fa:00","d6:92:6b:39:40:16","172.20.0.2","172.20.0.3","TCP","4433 → 50006 [ACK] Seq=1 Ack=1288 Win=64128 Len=0 TSval=1329920099 TSecr=1139004304"
"117","0.255530441","1537","22:77:05:09:fa:00","d6:92:6b:39:40:16","172.20.0.2","172.20.0.3","TLSv1.3","Server Hello, Change Cipher Spec, Application Data, Application Data, Application Data, Application Data"
"118","0.255571081","66","d6:92:6b:39:40:16","22:77:05:09:fa:00","172.20.0.3","172.20.0.2","TCP","50006 → 4433 [ACK] Seq=1288 Ack=1472 Win=64128 Len=0 TSval=1139004306 TSecr=1329920101"
"119","0.258589449","146","d6:92:6b:39:40:16","22:77:05:09:fa:00","172.20.0.3","172.20.0.2","TLSv1.3","Change Cipher Spec, Application Data"
"120","0.258664279","66","d6:92:6b:39:40:16","22:77:05:09:fa:00","172.20.0.3","172.20.0.2","TCP","50006 → 4433 [RST, ACK] Seq=1368 Ack=1472 Win=64128 Len=0 TSval=1139004309 TSecr=1329920101"
"121","0.272157935","74","d6:92:6b:39:40:16","22:77:05:09:fa:00","172.20.0.3","172.20.0.2","TCP","50016 → 4433 [SYN] Seq=0 Win=64240 Len=0 MSS=1460 SACK_PERM TSval=1139004323 TSecr=0 WS=128"
"122","0.272182316","74","22:77:05:09:fa:00","d6:92:6b:39:40:16","172.20.0.2","172.20.0.3","TCP","4433 → 50016 [SYN, ACK] Seq=0 Ack=1 Win=65160 Len=0 MSS=1460 SACK_PERM TSval=1329920118 TSecr=1139004323 WS=128"
"123","0.272199998","66","d6:92:6b:39:40:16","22:77:05:09:fa:00","172.20.0.3","172.20.0.2","TCP","50016 → 4433 [ACK] Seq=1 Ack=1 Win=64256 Len=0 TSval=1139004323 TSecr=1329920118"
"124","0.272241719","1353","d6:92:6b:39:40:16","22:77:05:09:fa:00","172.20.0.3","172.20.0.2","TLSv1.2","Client Hello"
"125","0.272248487","66","22:77:05:09:fa:00","d6:92:6b:39:40:16","172.20.0.2","172.20.0.3","TCP","4433 → 50016 [ACK] Seq=1 Ack=1288 Win=64128 Len=0 TSval=1329920118 TSecr=1139004323"
"126","0.273871499","1537","22:77:05:09:fa:00","d6:92:6b:39:40:16","172.20.0.2","172.20.0.3","TLSv1.3","Server Hello, Change Cipher Spec, Application Data, Application Data, Application Data, Application Data"
"127","0.273908117","66","d6:92:6b:39:40:16","22:77:05:09:fa:00","172.20.0.3","172.20.0.2","TCP","50016 → 4433 [ACK] Seq=1288 Ack=1472 Win=64128 Len=0 TSval=1139004324 TSecr=1329920119"
"128","0.276453715","146","d6:92:6b:39:40:16","22:77:05:09:fa:00","172.20.0.3","172.20.0.2","TLSv1.3","Change Cipher Spec, Application Data"
"129","0.276518882","66","d6:92:6b:39:40:16","22:77:05:09:fa:00","172.20.0.3","172.20.0.2","TCP","50016 → 4433 [RST, ACK] Seq=1368 Ack=1472 Win=64128 Len=0 TSval=1139004327 TSecr=1329920119"
"130","0.289472953","74","d6:92:6b:39:40:16","22:77:05:09:fa:00","172.20.0.3","172.20.0.2","TCP","50028 → 4433 [SYN] Seq=0 Win=64240 Len=0 MSS=1460 SACK_PERM TSval=1139004340 TSecr=0 WS=128"
"131","0.289498076","74","22:77:05:09:fa:00","d6:92:6b:39:40:16","172.20.0.2","172.20.0.3","TCP","4433 → 50028 [SYN, ACK] Seq=0 Ack=1 Win=65160 Len=0 MSS=1460 SACK_PERM TSval=1329920135 TSecr=1139004340 WS=128"
"132","0.289514301","66","d6:92:6b:39:40:16","22:77:05:09:fa:00","172.20.0.3","172.20.0.2","TCP","50028 → 4433 [ACK] Seq=1 Ack=1 Win=64256 Len=0 TSval=1139004340 TSecr=1329920135"
"133","0.289564490","1353","d6:92:6b:39:40:16","22:77:05:09:fa:00","172.20.0.3","172.20.0.2","TLSv1.2","Client Hello"
"134","0.289570182","66","22:77:05:09:fa:00","d6:92:6b:39:40:16","172.20.0.2","172.20.0.3","TCP","4433 → 50028 [ACK] Seq=1 Ack=1288 Win=64128 Len=0 TSval=1329920135 TSecr=1139004340"
"135","0.291233662","1537","22:77:05:09:fa:00","d6:92:6b:39:40:16","172.20.0.2","172.20.0.3","TLSv1.3","Server Hello, Change Cipher Spec, Application Data, Application Data, Application Data, Application Data"
"136","0.291265939","66","d6:92:6b:39:40:16","22:77:05:09:fa:00","172.20.0.3","172.20.0.2","TCP","50028 → 4433 [ACK] Seq=1288 Ack=1472 Win=64128 Len=0 TSval=1139004342 TSecr=1329920137"
"137","0.293770293","146","d6:92:6b:39:40:16","22:77:05:09:fa:00","172.20.0.3","172.20.0.2","TLSv1.3","Change Cipher Spec, Application Data"
"138","0.293832349","66","d6:92:6b:39:40:16","22:77:05:09:fa:00","172.20.0.3","172.20.0.2","TCP","50028 → 4433 [RST, ACK] Seq=1368 Ack=1472 Win=64128 Len=0 TSval=1139004344 TSecr=1329920137"
"139","0.307422554","74","d6:92:6b:39:40:16","22:77:05:09:fa:00","172.20.0.3","172.20.0.2","TCP","50038 → 4433 [SYN] Seq=0 Win=64240 Len=0 MSS=1460 SACK_PERM TSval=1139004358 TSecr=0 WS=128"
"140","0.307449342","74","22:77:05:09:fa:00","d6:92:6b:39:40:16","172.20.0.2","172.20.0.3","TCP","4433 → 50038 [SYN, ACK] Seq=0 Ack=1 Win=65160 Len=0 MSS=1460 SACK_PERM TSval=1329920153 TSecr=1139004358 WS=128"
"141","0.307469578","66","d6:92:6b:39:40:16","22:77:05:09:fa:00","172.20.0.3","172.20.0.2","TCP","50038 → 4433 [ACK] Seq=1 Ack=1 Win=64256 Len=0 TSval=1139004358 TSecr=1329920153"
"142","0.307522329","1353","d6:92:6b:39:40:16","22:77:05:09:fa:00","172.20.0.3","172.20.0.2","TLSv1.2","Client Hello"
"143","0.307527957","66","22:77:05:09:fa:00","d6:92:6b:39:40:16","172.20.0.2","172.20.0.3","TCP","4433 → 50038 [ACK] Seq=1 Ack=1288 Win=64128 Len=0 TSval=1329920153 TSecr=1139004358"
"144","0.309278890","1537","22:77:05:09:fa:00","d6:92:6b:39:40:16","172.20.0.2","172.20.0.3","TLSv1.3","Server Hello, Change Cipher Spec, Application Data, Application Data, Application Data, Application Data"
"145","0.309311320","66","d6:92:6b:39:40:16","22:77:05:09:fa:00","172.20.0.3","172.20.0.2","TCP","50038 → 4433 [ACK] Seq=1288 Ack=1472 Win=64128 Len=0 TSval=1139004360 TSecr=1329920155"
"146","0.311764786","146","d6:92:6b:39:40:16","22:77:05:09:fa:00","172.20.0.3","172.20.0.2","TLSv1.3","Change Cipher Spec, Application Data"
"147","0.311831196","66","d6:92:6b:39:40:16","22:77:05:09:fa:00","172.20.0.3","172.20.0.2","TCP","50038 → 4433 [RST, ACK] Seq=1368 Ack=1472 Win=64128 Len=0 TSval=1139004362 TSecr=1329920155"
"148","0.325642028","74","d6:92:6b:39:40:16","22:77:05:09:fa:00","172.20.0.3","172.20.0.2","TCP","50054 → 4433 [SYN] Seq=0 Win=64240 Len=0 MSS=1460 SACK_PERM TSval=1139004376 TSecr=0 WS=128"
"149","0.325666630","74","22:77:05:09:fa:00","d6:92:6b:39:40:16","172.20.0.2","172.20.0.3","TCP","4433 → 50054 [SYN, ACK] Seq=0 Ack=1 Win=65160 Len=0 MSS=1460 SACK_PERM TSval=1329920171 TSecr=1139004376 WS=128"
"150","0.325685825","66","d6:92:6b:39:40:16","22:77:05:09:fa:00","172.20.0.3","172.20.0.2","TCP","50054 → 4433 [ACK] Seq=1 Ack=1 Win=64256 Len=0 TSval=1139004376 TSecr=1329920171"
"151","0.325734139","1353","d6:92:6b:39:40:16","22:77:05:09:fa:00","172.20.0.3","172.20.0.2","TLSv1.2","Client Hello"
"152","0.325740027","66","22:77:05:09:fa:00","d6:92:6b:39:40:16","172.20.0.2","172.20.0.3","TCP","4433 → 50054 [ACK] Seq=1 Ack=1288 Win=64128 Len=0 TSval=1329920171 TSecr=1139004376"
"153","0.327663062","1537","22:77:05:09:fa:00","d6:92:6b:39:40:16","172.20.0.2","172.20.0.3","TLSv1.3","Server Hello, Change Cipher Spec, Application Data, Application Data, Application Data, Application Data"
"154","0.327709054","66","d6:92:6b:39:40:16","22:77:05:09:fa:00","172.20.0.3","172.20.0.2","TCP","50054 → 4433 [ACK] Seq=1288 Ack=1472 Win=64128 Len=0 TSval=1139004378 TSecr=1329920173"
"155","0.330553936","146","d6:92:6b:39:40:16","22:77:05:09:fa:00","172.20.0.3","172.20.0.2","TLSv1.3","Change Cipher Spec, Application Data"
"156","0.330623063","66","d6:92:6b:39:40:16","22:77:05:09:fa:00","172.20.0.3","172.20.0.2","TCP","50054 → 4433 [RST, ACK] Seq=1368 Ack=1472 Win=64128 Len=0 TSval=1139004381 TSecr=1329920173"
"157","0.344137898","74","d6:92:6b:39:40:16","22:77:05:09:fa:00","172.20.0.3","172.20.0.2","TCP","50062 → 4433 [SYN] Seq=0 Win=64240 Len=0 MSS=1460 SACK_PERM TSval=1139004395 TSecr=0 WS=128"
"158","0.344161562","74","22:77:05:09:fa:00","d6:92:6b:39:40:16","172.20.0.2","172.20.0.3","TCP","4433 → 50062 [SYN, ACK] Seq=0 Ack=1 Win=65160 Len=0 MSS=1460 SACK_PERM TSval=1329920190 TSecr=1139004395 WS=128"
"159","0.344180363","66","d6:92:6b:39:40:16","22:77:05:09:fa:00","172.20.0.3","172.20.0.2","TCP","50062 → 4433 [ACK] Seq=1 Ack=1 Win=64256 Len=0 TSval=1139004395 TSecr=1329920190"
"160","0.344230371","1353","d6:92:6b:39:40:16","22:77:05:09:fa:00","172.20.0.3","172.20.0.2","TLSv1.2","Client Hello"
"161","0.344235881","66","22:77:05:09:fa:00","d6:92:6b:39:40:16","172.20.0.2","172.20.0.3","TCP","4433 → 50062 [ACK] Seq=1 Ack=1288 Win=64128 Len=0 TSval=1329920190 TSecr=1139004395"
"162","0.345941295","1537","22:77:05:09:fa:00","d6:92:6b:39:40:16","172.20.0.2","172.20.0.3","TLSv1.3","Server Hello, Change Cipher Spec, Application Data, Application Data, Application Data, Application Data"
"163","0.345989235","66","d6:92:6b:39:40:16","22:77:05:09:fa:00","172.20.0.3","172.20.0.2","TCP","50062 → 4433 [ACK] Seq=1288 Ack=1472 Win=64128 Len=0 TSval=1139004396 TSecr=1329920191"
"164","0.348421351","146","d6:92:6b:39:40:16","22:77:05:09:fa:00","172.20.0.3","172.20.0.2","TLSv1.3","Change Cipher Spec, Application Data"
"165","0.348477177","66","d6:92:6b:39:40:16","22:77:05:09:fa:00","172.20.0.3","172.20.0.2","TCP","50062 → 4433 [RST, ACK] Seq=1368 Ack=1472 Win=64128 Len=0 TSval=1139004399 TSecr=1329920191"
"166","0.361387542","74","d6:92:6b:39:40:16","22:77:05:09:fa:00","172.20.0.3","172.20.0.2","TCP","50072 → 4433 [SYN] Seq=0 Win=64240 Len=0 MSS=1460 SACK_PERM TSval=1139004412 TSecr=0 WS=128"
"167","0.361407492","74","22:77:05:09:fa:00","d6:92:6b:39:40:16","172.20.0.2","172.20.0.3","TCP","4433 → 50072 [SYN, ACK] Seq=0 Ack=1 Win=65160 Len=0 MSS=1460 SACK_PERM TSval=1329920207 TSecr=1139004412 WS=128"
"168","0.361423257","66","d6:92:6b:39:40:16","22:77:05:09:fa:00","172.20.0.3","172.20.0.2","TCP","50072 → 4433 [ACK] Seq=1 Ack=1 Win=64256 Len=0 TSval=1139004412 TSecr=1329920207"
"169","0.361458165","1353","d6:92:6b:39:40:16","22:77:05:09:fa:00","172.20.0.3","172.20.0.2","TLSv1.2","Client Hello"
"170","0.361463473","66","22:77:05:09:fa:00","d6:92:6b:39:40:16","172.20.0.2","172.20.0.3","TCP","4433 → 50072 [ACK] Seq=1 Ack=1288 Win=64128 Len=0 TSval=1329920207 TSecr=1139004412"
"171","0.363114000","1537","22:77:05:09:fa:00","d6:92:6b:39:40:16","172.20.0.2","172.20.0.3","TLSv1.3","Server Hello, Change Cipher Spec, Application Data, Application Data, Application Data, Application Data"
"172","0.363140670","66","d6:92:6b:39:40:16","22:77:05:09:fa:00","172.20.0.3","172.20.0.2","TCP","50072 → 4433 [ACK] Seq=1288 Ack=1472 Win=64128 Len=0 TSval=1139004414 TSecr=1329920209"
"173","0.365568563","146","d6:92:6b:39:40:16","22:77:05:09:fa:00","172.20.0.3","172.20.0.2","TLSv1.3","Change Cipher Spec, Application Data"
"174","0.365634820","66","d6:92:6b:39:40:16","22:77:05:09:fa:00","172.20.0.3","172.20.0.2","TCP","50072 → 4433 [RST, ACK] Seq=1368 Ack=1472 Win=64128 Len=0 TSval=1139004416 TSecr=1329920209"
"175","0.378719542","74","d6:92:6b:39:40:16","22:77:05:09:fa:00","172.20.0.3","172.20.0.2","TCP","50074 → 4433 [SYN] Seq=0 Win=64240 Len=0 MSS=1460 SACK_PERM TSval=1139004429 TSecr=0 WS=128"
"176","0.378742107","74","22:77:05:09:fa:00","d6:92:6b:39:40:16","172.20.0.2","172.20.0.3","TCP","4433 → 50074 [SYN, ACK] Seq=0 Ack=1 Win=65160 Len=0 MSS=1460 SACK_PERM TSval=1329920224 TSecr=1139004429 WS=128"
"177","0.378758987","66","d6:92:6b:39:40:16","22:77:05:09:fa:00","172.20.0.3","172.20.0.2","TCP","50074 → 4433 [ACK] Seq=1 Ack=1 Win=64256 Len=0 TSval=1139004429 TSecr=1329920224"
"178","0.378803477","1353","d6:92:6b:39:40:16","22:77:05:09:fa:00","172.20.0.3","172.20.0.2","TLSv1.2","Client Hello"
"179","0.378807543","66","22:77:05:09:fa:00","d6:92:6b:39:40:16","172.20.0.2","172.20.0.3","TCP","4433 → 50074 [ACK] Seq=1 Ack=1288 Win=64128 Len=0 TSval=1329920224 TSecr=1139004429"
"180","0.380583835","1537","22:77:05:09:fa:00","d6:92:6b:39:40:16","172.20.0.2","172.20.0.3","TLSv1.3","Server Hello, Change Cipher Spec, Application Data, Application Data, Application Data, Application Data"
"181","0.380617409","66","d6:92:6b:39:40:16","22:77:05:09:fa:00","172.20.0.3","172.20.0.2","TCP","50074 → 4433 [ACK] Seq=1288 Ack=1472 Win=64128 Len=0 TSval=1139004431 TSecr=1329920226"
"182","0.383197119","146","d6:92:6b:39:40:16","22:77:05:09:fa:00","172.20.0.3","172.20.0.2","TLSv1.3","Change Cipher Spec, Application Data"
"183","0.383262561","66","d6:92:6b:39:40:16","22:77:05:09:fa:00","172.20.0.3","172.20.0.2","TCP","50074 → 4433 [RST, ACK] Seq=1368 Ack=1472 Win=64128 Len=0 TSval=1139004434 TSecr=1329920226"
"184","0.396460816","74","d6:92:6b:39:40:16","22:77:05:09:fa:00","172.20.0.3","172.20.0.2","TCP","50090 → 4433 [SYN] Seq=0 Win=64240 Len=0 MSS=1460 SACK_PERM TSval=1139004447 TSecr=0 WS=128"
"185","0.396485043","74","22:77:05:09:fa:00","d6:92:6b:39:40:16","172.20.0.2","172.20.0.3","TCP","4433 → 50090 [SYN, ACK] Seq=0 Ack=1 Win=65160 Len=0 MSS=1460 SACK_PERM TSval=1329920242 TSecr=1139004447 WS=128"
"186","0.396504527","66","d6:92:6b:39:40:16","22:77:05:09:fa:00","172.20.0.3","172.20.0.2","TCP","50090 → 4433 [ACK] Seq=1 Ack=1 Win=64256 Len=0 TSval=1139004447 TSecr=1329920242"
"187","0.396547746","1353","d6:92:6b:39:40:16","22:77:05:09:fa:00","172.20.0.3","172.20.0.2","TLSv1.2","Client Hello"
"188","0.396552958","66","22:77:05:09:fa:00","d6:92:6b:39:40:16","172.20.0.2","172.20.0.3","TCP","4433 → 50090 [ACK] Seq=1 Ack=1288 Win=64128 Len=0 TSval=1329920242 TSecr=1139004447"
"189","0.398271048","1537","22:77:05:09:fa:00","d6:92:6b:39:40:16","172.20.0.2","172.20.0.3","TLSv1.3","Server Hello, Change Cipher Spec, Application Data, Application Data, Application Data, Application Data"
"190","0.398299908","66","d6:92:6b:39:40:16","22:77:05:09:fa:00","172.20.0.3","172.20.0.2","TCP","50090 → 4433 [ACK] Seq=1288 Ack=1472 Win=64128 Len=0 TSval=1139004449 TSecr=1329920244"
"191","0.400720102","146","d6:92:6b:39:40:16","22:77:05:09:fa:00","172.20.0.3","172.20.0.2","TLSv1.3","Change Cipher Spec, Application Data"
"192","0.400778656","66","d6:92:6b:39:40:16","22:77:05:09:fa:00","172.20.0.3","172.20.0.2","TCP","50090 → 4433 [RST, ACK] Seq=1368 Ack=1472 Win=64128 Len=0 TSval=1139004451 TSecr=1329920244"
"193","0.413108881","74","d6:92:6b:39:40:16","22:77:05:09:fa:00","172.20.0.3","172.20.0.2","TCP","50096 → 4433 [SYN] Seq=0 Win=64240 Len=0 MSS=1460 SACK_PERM TSval=1139004464 TSecr=0 WS=128"
"194","0.413130366","74","22:77:05:09:fa:00","d6:92:6b:39:40:16","172.20.0.2","172.20.0.3","TCP","4433 → 50096 [SYN, ACK] Seq=0 Ack=1 Win=65160 Len=0 MSS=1460 SACK_PERM TSval=1329920259 TSecr=1139004464 WS=128"
"195","0.413147667","66","d6:92:6b:39:40:16","22:77:05:09:fa:00","172.20.0.3","172.20.0.2","TCP","50096 → 4433 [ACK] Seq=1 Ack=1 Win=64256 Len=0 TSval=1139004464 TSecr=1329920259"
"196","0.413183474","1353","d6:92:6b:39:40:16","22:77:05:09:fa:00","172.20.0.3","172.20.0.2","TLSv1.2","Client Hello"
"197","0.413189050","66","22:77:05:09:fa:00","d6:92:6b:39:40:16","172.20.0.2","172.20.0.3","TCP","4433 → 50096 [ACK] Seq=1 Ack=1288 Win=64128 Len=0 TSval=1329920259 TSecr=1139004464"
"198","0.414789278","1537","22:77:05:09:fa:00","d6:92:6b:39:40:16","172.20.0.2","172.20.0.3","TLSv1.3","Server Hello, Change Cipher Spec, Application Data, Application Data, Application Data, Application Data"
"199","0.414818041","66","d6:92:6b:39:40:16","22:77:05:09:fa:00","172.20.0.3","172.20.0.2","TCP","50096 → 4433 [ACK] Seq=1288 Ack=1472 Win=64128 Len=0 TSval=1139004465 TSecr=1329920260"
"200","0.417157253","146","d6:92:6b:39:40:16","22:77:05:09:fa:00","172.20.0.3","172.20.0.2","TLSv1.3","Change Cipher Spec, Application Data"
"201","0.417210221","66","d6:92:6b:39:40:16","22:77:05:09:fa:00","172.20.0.3","172.20.0.2","TCP","50096 → 4433 [RST, ACK] Seq=1368 Ack=1472 Win=64128 Len=0 TSval=1139004468 TSecr=1329920260"
"202","0.430924302","74","d6:92:6b:39:40:16","22:77:05:09:fa:00","172.20.0.3","172.20.0.2","TCP","50106 → 4433 [SYN] Seq=0 Win=64240 Len=0 MSS=1460 SACK_PERM TSval=1139004481 TSecr=0 WS=128"
"203","0.430947211","74","22:77:05:09:fa:00","d6:92:6b:39:40:16","172.20.0.2","172.20.0.3","TCP","4433 → 50106 [SYN, ACK] Seq=0 Ack=1 Win=65160 Len=0 MSS=1460 SACK_PERM TSval=1329920276 TSecr=1139004481 WS=128"
"204","0.430971497","66","d6:92:6b:39:40:16","22:77:05:09:fa:00","172.20.0.3","172.20.0.2","TCP","50106 → 4433 [ACK] Seq=1 Ack=1 Win=64256 Len=0 TSval=1139004481 TSecr=1329920276"
"205","0.431013152","1353","d6:92:6b:39:40:16","22:77:05:09:fa:00","172.20.0.3","172.20.0.2","TLSv1.2","Client Hello"
"206","0.431016910","66","22:77:05:09:fa:00","d6:92:6b:39:40:16","172.20.0.2","172.20.0.3","TCP","4433 → 50106 [ACK] Seq=1 Ack=1288 Win=64128 Len=0 TSval=1329920276 TSecr=1139004481"
"207","0.432798550","1537","22:77:05:09:fa:00","d6:92:6b:39:40:16","172.20.0.2","172.20.0.3","TLSv1.3","Server Hello, Change Cipher Spec, Application Data, Application Data, Application Data, Application Data"
"208","0.432834951","66","d6:92:6b:39:40:16","22:77:05:09:fa:00","172.20.0.3","172.20.0.2","TCP","50106 → 4433 [ACK] Seq=1288 Ack=1472 Win=64128 Len=0 TSval=1139004483 TSecr=1329920278"
"209","0.435840127","146","d6:92:6b:39:40:16","22:77:05:09:fa:00","172.20.0.3","172.20.0.2","TLSv1.3","Change Cipher Spec, Application Data"
"210","0.435907220","66","d6:92:6b:39:40:16","22:77:05:09:fa:00","172.20.0.3","172.20.0.2","TCP","50106 → 4433 [RST, ACK] Seq=1368 Ack=1472 Win=64128 Len=0 TSval=1139004486 TSecr=1329920278"
"211","0.449699968","74","d6:92:6b:39:40:16","22:77:05:09:fa:00","172.20.0.3","172.20.0.2","TCP","50108 → 4433 [SYN] Seq=0 Win=64240 Len=0 MSS=1460 SACK_PERM TSval=1139004500 TSecr=0 WS=128"
"212","0.449726320","74","22:77:05:09:fa:00","d6:92:6b:39:40:16","172.20.0.2","172.20.0.3","TCP","4433 → 50108 [SYN, ACK] Seq=0 Ack=1 Win=65160 Len=0 MSS=1460 SACK_PERM TSval=1329920295 TSecr=1139004500 WS=128"
"213","0.449745388","66","d6:92:6b:39:40:16","22:77:05:09:fa:00","172.20.0.3","172.20.0.2","TCP","50108 → 4433 [ACK] Seq=1 Ack=1 Win=64256 Len=0 TSval=1139004500 TSecr=1329920295"
"214","0.449788225","1353","d6:92:6b:39:40:16","22:77:05:09:fa:00","172.20.0.3","172.20.0.2","TLSv1.2","Client Hello"
"215","0.449793765","66","22:77:05:09:fa:00","d6:92:6b:39:40:16","172.20.0.2","172.20.0.3","TCP","4433 → 50108 [ACK] Seq=1 Ack=1288 Win=64128 Len=0 TSval=1329920295 TSecr=1139004500"
"216","0.451591339","1537","22:77:05:09:fa:00","d6:92:6b:39:40:16","172.20.0.2","172.20.0.3","TLSv1.3","Server Hello, Change Cipher Spec, Application Data, Application Data, Application Data, Application Data"
"217","0.451629131","66","d6:92:6b:39:40:16","22:77:05:09:fa:00","172.20.0.3","172.20.0.2","TCP","50108 → 4433 [ACK] Seq=1288 Ack=1472 Win=64128 Len=0 TSval=1139004502 TSecr=1329920297"
"218","0.454602260","146","d6:92:6b:39:40:16","22:77:05:09:fa:00","172.20.0.3","172.20.0.2","TLSv1.3","Change Cipher Spec, Application Data"
"219","0.454682905","66","d6:92:6b:39:40:16","22:77:05:09:fa:00","172.20.0.3","172.20.0.2","TCP","50108 → 4433 [RST, ACK] Seq=1368 Ack=1472 Win=64128 Len=0 TSval=1139004505 TSecr=1329920297"
"220","0.468821429","74","d6:92:6b:39:40:16","22:77:05:09:fa:00","172.20.0.3","172.20.0.2","TCP","50124 → 4433 [SYN] Seq=0 Win=64240 Len=0 MSS=1460 SACK_PERM TSval=1139004519 TSecr=0 WS=128"
"221","0.468845438","74","22:77:05:09:fa:00","d6:92:6b:39:40:16","172.20.0.2","172.20.0.3","TCP","4433 → 50124 [SYN, ACK] Seq=0 Ack=1 Win=65160 Len=0 MSS=1460 SACK_PERM TSval=1329920314 TSecr=1139004519 WS=128"
"222","0.468861321","66","d6:92:6b:39:40:16","22:77:05:09:fa:00","172.20.0.3","172.20.0.2","TCP","50124 → 4433 [ACK] Seq=1 Ack=1 Win=64256 Len=0 TSval=1139004519 TSecr=1329920314"
"223","0.468903764","1353","d6:92:6b:39:40:16","22:77:05:09:fa:00","172.20.0.3","172.20.0.2","TLSv1.2","Client Hello"
"224","0.468908760","66","22:77:05:09:fa:00","d6:92:6b:39:40:16","172.20.0.2","172.20.0.3","TCP","4433 → 50124 [ACK] Seq=1 Ack=1288 Win=64128 Len=0 TSval=1329920314 TSecr=1139004519"
