frame.number,frame.time_relative,frame.len,eth.src,eth.dst,ip.src,ip.dst,_ws.col.protocol,_ws.col.info
"1","0.000000000","42","f2:7a:ed:6c:fa:7d","ff:ff:ff:ff:ff:ff",,,"ARP","ARP Announcement for 172.20.0.3"
"2","0.032332803","42","f2:7a:ed:6c:fa:7d","ff:ff:ff:ff:ff:ff",,,"ARP","Who has 172.20.0.2? Tell 172.20.0.3"
"3","0.032368836","42","4a:48:67:35:9c:d2","f2:7a:ed:6c:fa:7d",,,"ARP","172.20.0.2 is at 4a:48:67:35:9c:d2"
"4","0.032378125","74","f2:7a:ed:6c:fa:7d","4a:48:67:35:9c:d2","172.20.0.3","172.20.0.2","TCP","47876 → 4433 [SYN] Seq=0 Win=64240 Len=0 MSS=1460 SACK_PERM TSval=1142606873 TSecr=0 WS=128"
"5","0.032399105","74","4a:48:67:35:9c:d2","f2:7a:ed:6c:fa:7d","172.20.0.2","172.20.0.3","TCP","4433 → 47876 [SYN, ACK] Seq=0 Ack=1 Win=65160 Len=0 MSS=1460 SACK_PERM TSval=1333522669 TSecr=1142606873 WS=128"
"6","0.032414699","66","f2:7a:ed:6c:fa:7d","4a:48:67:35:9c:d2","172.20.0.3","172.20.0.2","TCP","47876 → 4433 [ACK] Seq=1 Ack=1 Win=64256 Len=0 TSval=1142606874 TSecr=1333522669"
"7","0.032460812","552","f2:7a:ed:6c:fa:7d","4a:48:67:35:9c:d2","172.20.0.3","172.20.0.2","TLSv1.2","Client Hello"
"8","0.032465976","66","4a:48:67:35:9c:d2","f2:7a:ed:6c:fa:7d","172.20.0.2","172.20.0.3","TCP","4433 → 47876 [ACK] Seq=1 Ack=487 Win=64768 Len=0 TSval=1333522669 TSecr=1142606874"
"9","0.035054835","924","4a:48:67:35:9c:d2","f2:7a:ed:6c:fa:7d","172.20.0.2","172.20.0.3","TLSv1.3","Server Hello, Change Cipher Spec, Application Data, Application Data, Application Data, Application Data"
"10","0.035089909","66","f2:7a:ed:6c:fa:7d","4a:48:67:35:9c:d2","172.20.0.3","172.20.0.2","TCP","47876 → 4433 [ACK] Seq=487 Ack=859 Win=63488 Len=0 TSval=1142606876 TSecr=1333522671"
"11","0.037756335","146","f2:7a:ed:6c:fa:7d","4a:48:67:35:9c:d2","172.20.0.3","172.20.0.2","TLSv1.3","Change Cipher Spec, Application Data"
"12","0.037833866","66","f2:7a:ed:6c:fa:7d","4a:48:67:35:9c:d2","172.20.0.3","172.20.0.2","TCP","47876 → 4433 [RST, ACK] Seq=567 Ack=859 Win=64000 Len=0 TSval=1142606879 TSecr=1333522671"
"13","0.050033621","74","f2:7a:ed:6c:fa:7d","4a:48:67:35:9c:d2","172.20.0.3","172.20.0.2","TCP","47884 → 4433 [SYN] Seq=0 Win=64240 Len=0 MSS=1460 SACK_PERM TSval=1142606891 TSecr=0 WS=128"
"14","0.050060592","74","4a:48:67:35:9c:d2","f2:7a:ed:6c:fa:7d","172.20.0.2","172.20.0.3","TCP","4433 → 47884 [SYN, ACK] Seq=0 Ack=1 Win=65160 Len=0 MSS=1460 SACK_PERM TSval=1333522686 TSecr=1142606891 WS=128"
"15","0.050080156","66","f2:7a:ed:6c:fa:7d","4a:48:67:35:9c:d2","172.20.0.3","172.20.0.2","TCP","47884 → 4433 [ACK] Seq=1 Ack=1 Win=64256 Len=0 TSval=1142606891 TSecr=1333522686"
"16","0.050129174","552","f2:7a:ed:6c:fa:7d","4a:48:67:35:9c:d2","172.20.0.3","172.20.0.2","TLSv1.2","Client Hello"
"17","0.050133725","66","4a:48:67:35:9c:d2","f2:7a:ed:6c:fa:7d","172.20.0.2","172.20.0.3","TCP","4433 → 47884 [ACK] Seq=1 Ack=487 Win=64768 Len=0 TSval=1333522686 TSecr=1142606891"
"18","0.052463876","924","4a:48:67:35:9c:d2","f2:7a:ed:6c:fa:7d","172.20.0.2","172.20.0.3","TLSv1.3","Server Hello, Change Cipher Spec, Application Data, Application Data, Application Data, Application Data"
"19","0.052506731","66","f2:7a:ed:6c:fa:7d","4a:48:67:35:9c:d2","172.20.0.3","172.20.0.2","TCP","47884 → 4433 [ACK] Seq=487 Ack=859 Win=63488 Len=0 TSval=1142606894 TSecr=1333522689"
"20","0.055385859","146","f2:7a:ed:6c:fa:7d","4a:48:67:35:9c:d2","172.20.0.3","172.20.0.2","TLSv1.3","Change Cipher Spec, Application Data"
"21","0.055457084","66","f2:7a:ed:6c:fa:7d","4a:48:67:35:9c:d2","172.20.0.3","172.20.0.2","TCP","47884 → 4433 [RST, ACK] Seq=567 Ack=859 Win=64000 Len=0 TSval=1142606897 TSecr=1333522689"
"22","0.067565800","74","f2:7a:ed:6c:fa:7d","4a:48:67:35:9c:d2","172.20.0.3","172.20.0.2","TCP","47898 → 4433 [SYN] Seq=0 Win=64240 Len=0 MSS=1460 SACK_PERM TSval=1142606909 TSecr=0 WS=128"
"23","0.067590078","74","4a:48:67:35:9c:d2","f2:7a:ed:6c:fa:7d","172.20.0.2","172.20.0.3","TCP","4433 → 47898 [SYN, ACK] Seq=0 Ack=1 Win=65160 Len=0 MSS=1460 SACK_PERM TSval=1333522704 TSecr=1142606909 WS=128"
"24","0.067607449","66","f2:7a:ed:6c:fa:7d","4a:48:67:35:9c:d2","172.20.0.3","172.20.0.2","TCP","47898 → 4433 [ACK] Seq=1 Ack=1 Win=64256 Len=0 TSval=1142606909 TSecr=1333522704"
"25","0.067667679","552","f2:7a:ed:6c:fa:7d","4a:48:67:35:9c:d2","172.20.0.3","172.20.0.2","TLSv1.2","Client Hello"
"26","0.067673379","66","4a:48:67:35:9c:d2","f2:7a:ed:6c:fa:7d","172.20.0.2","172.20.0.3","TCP","4433 → 47898 [ACK] Seq=1 Ack=487 Win=64768 Len=0 TSval=1333522704 TSecr=1142606909"
"27","0.070531507","923","4a:48:67:35:9c:d2","f2:7a:ed:6c:fa:7d","172.20.0.2","172.20.0.3","TLSv1.3","Server Hello, Change Cipher Spec, Application Data, Application Data, Application Data, Application Data"
"28","0.070590452","66","f2:7a:ed:6c:fa:7d","4a:48:67:35:9c:d2","172.20.0.3","172.20.0.2","TCP","47898 → 4433 [ACK] Seq=487 Ack=858 Win=63488 Len=0 TSval=1142606912 TSecr=1333522707"
"29","0.074267155","146","f2:7a:ed:6c:fa:7d","4a:48:67:35:9c:d2","172.20.0.3","172.20.0.2","TLSv1.3","Change Cipher Spec, Application Data"
"30","0.074347591","66","f2:7a:ed:6c:fa:7d","4a:48:67:35:9c:d2","172.20.0.3","172.20.0.2","TCP","47898 → 4433 [RST, ACK] Seq=567 Ack=858 Win=64000 Len=0 TSval=1142606915 TSecr=1333522707"
"31","0.085974118","74","f2:7a:ed:6c:fa:7d","4a:48:67:35:9c:d2","172.20.0.3","172.20.0.2","TCP","47906 → 4433 [SYN] Seq=0 Win=64240 Len=0 MSS=1460 SACK_PERM TSval=1142606927 TSecr=0 WS=128"
"32","0.086000888","74","4a:48:67:35:9c:d2","f2:7a:ed:6c:fa:7d","172.20.0.2","172.20.0.3","TCP","4433 → 47906 [SYN, ACK] Seq=0 Ack=1 Win=65160 Len=0 MSS=1460 SACK_PERM TSval=1333522722 TSecr=1142606927 WS=128"
"33","0.086020467","66","f2:7a:ed:6c:fa:7d","4a:48:67:35:9c:d2","172.20.0.3","172.20.0.2","TCP","47906 → 4433 [ACK] Seq=1 Ack=1 Win=64256 Len=0 TSval=1142606927 TSecr=1333522722"
"34","0.086074628","552","f2:7a:ed:6c:fa:7d","4a:48:67:35:9c:d2","172.20.0.3","172.20.0.2","TLSv1.2","Client Hello"
"35","0.086078746","66","4a:48:67:35:9c:d2","f2:7a:ed:6c:fa:7d","172.20.0.2","172.20.0.3","TCP","4433 → 47906 [ACK] Seq=1 Ack=487 Win=64768 Len=0 TSval=1333522722 TSecr=1142606927"
"36","0.088231361","925","4a:48:67:35:9c:d2","f2:7a:ed:6c:fa:7d","172.20.0.2","172.20.0.3","TLSv1.3","Server Hello, Change Cipher Spec, Application Data, Application Data, Application Data, Application Data"
"37","0.088270853","66","f2:7a:ed:6c:fa:7d","4a:48:67:35:9c:d2","172.20.0.3","172.20.0.2","TCP","47906 → 4433 [ACK] Seq=487 Ack=860 Win=63488 Len=0 TSval=1142606929 TSecr=1333522724"
"38","0.091389127","146","f2:7a:ed:6c:fa:7d","4a:48:67:35:9c:d2","172.20.0.3","172.20.0.2","TLSv1.3","Change Cipher Spec, Application Data"
"39","0.091452831","66","f2:7a:ed:6c:fa:7d","4a:48:67:35:9c:d2","172.20.0.3","172.20.0.2","TCP","47906 → 4433 [RST, ACK] Seq=567 Ack=860 Win=64000 Len=0 TSval=1142606933 TSecr=1333522724"
"40","0.102711254","74","f2:7a:ed:6c:fa:7d","4a:48:67:35:9c:d2","172.20.0.3","172.20.0.2","TCP","47908 → 4433 [SYN] Seq=0 Win=64240 Len=0 MSS=1460 SACK_PERM TSval=1142606944 TSecr=0 WS=128"
"41","0.102739094","74","4a:48:67:35:9c:d2","f2:7a:ed:6c:fa:7d","172.20.0.2","172.20.0.3","TCP","4433 → 47908 [SYN, ACK] Seq=0 Ack=1 Win=65160 Len=0 MSS=1460 SACK_PERM TSval=1333522739 TSecr=1142606944 WS=128"
"42","0.102759344","66","f2:7a:ed:6c:fa:7d","4a:48:67:35:9c:d2","172.20.0.3","172.20.0.2","TCP","47908 → 4433 [ACK] Seq=1 Ack=1 Win=64256 Len=0 TSval=1142606944 TSecr=1333522739"
"43","0.102812668","552","f2:7a:ed:6c:fa:7d","4a:48:67:35:9c:d2","172.20.0.3","172.20.0.2","TLSv1.2","Client Hello"
"44","0.102817917","66","4a:48:67:35:9c:d2","f2:7a:ed:6c:fa:7d","172.20.0.2","172.20.0.3","TCP","4433 → 47908 [ACK] Seq=1 Ack=487 Win=64768 Len=0 TSval=1333522739 TSecr=1142606944"
"45","0.104933575","924","4a:48:67:35:9c:d2","f2:7a:ed:6c:fa:7d","172.20.0.2","172.20.0.3","TLSv1.3","Server Hello, Change Cipher Spec, Application Data, Application Data, Application Data, Application Data"
"46","0.104969677","66","f2:7a:ed:6c:fa:7d","4a:48:67:35:9c:d2","172.20.0.3","172.20.0.2","TCP","47908 → 4433 [ACK] Seq=487 Ack=859 Win=63488 Len=0 TSval=1142606946 TSecr=1333522741"
"47","0.107771507","146","f2:7a:ed:6c:fa:7d","4a:48:67:35:9c:d2","172.20.0.3","172.20.0.2","TLSv1.3","Change Cipher Spec, Application Data"
"48","0.107836033","66","f2:7a:ed:6c:fa:7d","4a:48:67:35:9c:d2","172.20.0.3","172.20.0.2","TCP","47908 → 4433 [RST, ACK] Seq=567 Ack=859 Win=64000 Len=0 TSval=1142606949 TSecr=1333522741"
"49","0.120520308","74","f2:7a:ed:6c:fa:7d","4a:48:67:35:9c:d2","172.20.0.3","172.20.0.2","TCP","47916 → 4433 [SYN] Seq=0 Win=64240 Len=0 MSS=1460 SACK_PERM TSval=1142606962 TSecr=0 WS=128"
"50","0.120547312","74","4a:48:67:35:9c:d2","f2:7a:ed:6c:fa:7d","172.20.0.2","172.20.0.3","TCP","4433 → 47916 [SYN, ACK] Seq=0 Ack=1 Win=65160 Len=0 MSS=1460 SACK_PERM TSval=1333522757 TSecr=1142606962 WS=128"
"51","0.120567553","66","f2:7a:ed:6c:fa:7d","4a:48:67:35:9c:d2","172.20.0.3","172.20.0.2","TCP","47916 → 4433 [ACK] Seq=1 Ack=1 Win=64256 Len=0 TSval=1142606962 TSecr=1333522757"
"52","0.120618533","552","f2:7a:ed:6c:fa:7d","4a:48:67:35:9c:d2","172.20.0.3","172.20.0.2","TLSv1.2","Client Hello"
"53","0.120623786","66","4a:48:67:35:9c:d2","f2:7a:ed:6c:fa:7d","172.20.0.2","172.20.0.3","TCP","4433 → 47916 [ACK] Seq=1 Ack=487 Win=64768 Len=0 TSval=1333522757 TSecr=1142606962"
"54","0.122884507","924","4a:48:67:35:9c:d2","f2:7a:ed:6c:fa:7d","172.20.0.2","172.20.0.3","TLSv1.3","Server Hello, Change Cipher Spec, Application Data, Application Data, Application Data, Application Data"
"55","0.122926868","66","f2:7a:ed:6c:fa:7d","4a:48:67:35:9c:d2","172.20.0.3","172.20.0.2","TCP","47916 → 4433 [ACK] Seq=487 Ack=859 Win=63488 Len=0 TSval=1142606964 TSecr=1333522759"
"56","0.125985315","146","f2:7a:ed:6c:fa:7d","4a:48:67:35:9c:d2","172.20.0.3","172.20.0.2","TLSv1.3","Change Cipher Spec, Application Data"
"57","0.126068609","66","f2:7a:ed:6c:fa:7d","4a:48:67:35:9c:d2","172.20.0.3","172.20.0.2","TCP","47916 → 4433 [RST, ACK] Seq=567 Ack=859 Win=64000 Len=0 TSval=1142606967 TSecr=1333522759"
"58","0.141613429","74","f2:7a:ed:6c:fa:7d","4a:48:67:35:9c:d2","172.20.0.3","172.20.0.2","TCP","47924 → 4433 [SYN] Seq=0 Win=64240 Len=0 MSS=1460 SACK_PERM TSval=1142606983 TSecr=0 WS=128"
"59","0.141649161","74","4a:48:67:35:9c:d2","f2:7a:ed:6c:fa:7d","172.20.0.2","172.20.0.3","TCP","4433 → 47924 [SYN, ACK] Seq=0 Ack=1 Win=65160 Len=0 MSS=1460 SACK_PERM TSval=1333522778 TSecr=1142606983 WS=128"
"60","0.141673227","66","f2:7a:ed:6c:fa:7d","4a:48:67:35:9c:d2","172.20.0.3","172.20.0.2","TCP","47924 → 4433 [ACK] Seq=1 Ack=1 Win=64256 Len=0 TSval=1142606983 TSecr=1333522778"
"61","0.141729750","552","f2:7a:ed:6c:fa:7d","4a:48:67:35:9c:d2","172.20.0.3","172.20.0.2","TLSv1.2","Client Hello"
"62","0.141736324","66","4a:48:67:35:9c:d2","f2:7a:ed:6c:fa:7d","172.20.0.2","172.20.0.3","TCP","4433 → 47924 [ACK] Seq=1 Ack=487 Win=64768 Len=0 TSval=1333522778 TSecr=1142606983"
"63","0.144122637","924","4a:48:67:35:9c:d2","f2:7a:ed:6c:fa:7d","172.20.0.2","172.20.0.3","TLSv1.3","Server Hello, Change Cipher Spec, Application Data, Application Data, Application Data, Application Data"
"64","0.144168766","66","f2:7a:ed:6c:fa:7d","4a:48:67:35:9c:d2","172.20.0.3","172.20.0.2","TCP","47924 → 4433 [ACK] Seq=487 Ack=859 Win=63488 Len=0 TSval=1142606985 TSecr=1333522780"
"65","0.147847458","146","f2:7a:ed:6c:fa:7d","4a:48:67:35:9c:d2","172.20.0.3","172.20.0.2","TLSv1.3","Change Cipher Spec, Application Data"
"66","0.147929990","66","f2:7a:ed:6c:fa:7d","4a:48:67:35:9c:d2","172.20.0.3","172.20.0.2","TCP","47924 → 4433 [RST, ACK] Seq=567 Ack=859 Win=64000 Len=0 TSval=1142606989 TSecr=1333522780"
"67","0.159882277","74","f2:7a:ed:6c:fa:7d","4a:48:67:35:9c:d2","172.20.0.3","172.20.0.2","TCP","47938 → 4433 [SYN] Seq=0 Win=64240 Len=0 MSS=1460 SACK_PERM TSval=1142607001 TSecr=0 WS=128"
"68","0.159909883","74","4a:48:67:35:9c:d2","f2:7a:ed:6c:fa:7d","172.20.0.2","172.20.0.3","TCP","4433 → 47938 [SYN, ACK] Seq=0 Ack=1 Win=65160 Len=0 MSS=1460 SACK_PERM TSval=1333522796 TSecr=1142607001 WS=128"
"69","0.159930303","66","f2:7a:ed:6c:fa:7d","4a:48:67:35:9c:d2","172.20.0.3","172.20.0.2","TCP","47938 → 4433 [ACK] Seq=1 Ack=1 Win=64256 Len=0 TSval=1142607001 TSecr=1333522796"
"70","0.159998317","552","f2:7a:ed:6c:fa:7d","4a:48:67:35:9c:d2","172.20.0.3","172.20.0.2","TLSv1.2","Client Hello"
"71","0.160004101","66","4a:48:67:35:9c:d2","f2:7a:ed:6c:fa:7d","172.20.0.2","172.20.0.3","TCP","4433 → 47938 [ACK] Seq=1 Ack=487 Win=64768 Len=0 TSval=1333522796 TSecr=1142607001"
"72","0.162228995","924","4a:48:67:35:9c:d2","f2:7a:ed:6c:fa:7d","172.20.0.2","172.20.0.3","TLSv1.3","Server Hello, Change Cipher Spec, Application Data, Application Data, Application Data, Application Data"
"73","0.162279988","66","f2:7a:ed:6c:fa:7d","4a:48:67:35:9c:d2","172.20.0.3","172.20.0.2","TCP","47938 → 4433 [ACK] Seq=487 Ack=859 Win=63488 Len=0 TSval=1142607003 TSecr=1333522798"
"74","0.165158843","146","f2:7a:ed:6c:fa:7d","4a:48:67:35:9c:d2","172.20.0.3","172.20.0.2","TLSv1.3","Change Cipher Spec, Application Data"
"75","0.165228608","66","f2:7a:ed:6c:fa:7d","4a:48:67:35:9c:d2","172.20.0.3","172.20.0.2","TCP","47938 → 4433 [RST, ACK] Seq=567 Ack=859 Win=64000 Len=0 TSval=1142607006 TSecr=1333522798"
"76","0.177917266","74","f2:7a:ed:6c:fa:7d","4a:48:67:35:9c:d2","172.20.0.3","172.20.0.2","TCP","47954 → 4433 [SYN] Seq=0 Win=64240 Len=0 MSS=1460 SACK_PERM TSval=1142607019 TSecr=0 WS=128"
"77","0.177942437","74","4a:48:67:35:9c:d2","f2:7a:ed:6c:fa:7d","172.20.0.2","172.20.0.3","TCP","4433 → 47954 [SYN, ACK] Seq=0 Ack=1 Win=65160 Len=0 MSS=1460 SACK_PERM TSval=1333522814 TSecr=1142607019 WS=128"
"78","0.177961412","66","f2:7a:ed:6c:fa:7d","4a:48:67:35:9c:d2","172.20.0.3","172.20.0.2","TCP","47954 → 4433 [ACK] Seq=1 Ack=1 Win=64256 Len=0 TSval=1142607019 TSecr=1333522814"
"79","0.178018505","552","f2:7a:ed:6c:fa:7d","4a:48:67:35:9c:d2","172.20.0.3","172.20.0.2","TLSv1.2","Client Hello"
"80","0.178023514","66","4a:48:67:35:9c:d2","f2:7a:ed:6c:fa:7d","172.20.0.2","172.20.0.3","TCP","4433 → 47954 [ACK] Seq=1 Ack=487 Win=64768 Len=0 TSval=1333522814 TSecr=1142607019"
"81","0.180049860","925","4a:48:67:35:9c:d2","f2:7a:ed:6c:fa:7d","172.20.0.2","172.20.0.3","TLSv1.3","Server Hello, Change Cipher Spec, Application Data, Application Data, Application Data, Application Data"
"82","0.180087003","66","f2:7a:ed:6c:fa:7d","4a:48:67:35:9c:d2","172.20.0.3","172.20.0.2","TCP","47954 → 4433 [ACK] Seq=487 Ack=860 Win=63488 Len=0 TSval=1142607021 TSecr=1333522816"
"83","0.183209849","146","f2:7a:ed:6c:fa:7d","4a:48:67:35:9c:d2","172.20.0.3","172.20.0.2","TLSv1.3","Change Cipher Spec, Application Data"
"84","0.183280725","66","f2:7a:ed:6c:fa:7d","4a:48:67:35:9c:d2","172.20.0.3","172.20.0.2","TCP","47954 → 4433 [RST, ACK] Seq=567 Ack=860 Win=64000 Len=0 TSval=1142607024 TSecr=1333522816"
"85","0.195170479","74","f2:7a:ed:6c:fa:7d","4a:48:67:35:9c:d2","172.20.0.3","172.20.0.2","TCP","47962 → 4433 [SYN] Seq=0 Win=64240 Len=0 MSS=1460 SACK_PERM TSval=1142607036 TSecr=0 WS=128"
"86","0.195198739","74","4a:48:67:35:9c:d2","f2:7a:ed:6c:fa:7d","172.20.0.2","172.20.0.3","TCP","4433 → 47962 [SYN, ACK] Seq=0 Ack=1 Win=65160 Len=0 MSS=1460 SACK_PERM TSval=1333522831 TSecr=1142607036 WS=128"
"87","0.195219755","66","f2:7a:ed:6c:fa:7d","4a:48:67:35:9c:d2","172.20.0.3","172.20.0.2","TCP","47962 → 4433 [ACK] Seq=1 Ack=1 Win=64256 Len=0 TSval=1142607036 TSecr=1333522831"
"88","0.195274939","552","f2:7a:ed:6c:fa:7d","4a:48:67:35:9c:d2","172.20.0.3","172.20.0.2","TLSv1.2","Client Hello"
"89","0.195279008","66","4a:48:67:35:9c:d2","f2:7a:ed:6c:fa:7d","172.20.0.2","172.20.0.3","TCP","4433 → 47962 [ACK] Seq=1 Ack=487 Win=64768 Len=0 TSval=1333522831 TSecr=1142607036"
"90","0.197368441","924","4a:48:67:35:9c:d2","f2:7a:ed:6c:fa:7d","172.20.0.2","172.20.0.3","TLSv1.3","Server Hello, Change Cipher Spec, Application Data, Application Data, Application Data, Application Data"
"91","0.197410359","66","f2:7a:ed:6c:fa:7d","4a:48:67:35:9c:d2","172.20.0.3","172.20.0.2","TCP","47962 → 4433 [ACK] Seq=487 Ack=859 Win=63488 Len=0 TSval=1142607039 TSecr=1333522833"
"92","0.200547050","146","f2:7a:ed:6c:fa:7d","4a:48:67:35:9c:d2","172.20.0.3","172.20.0.2","TLSv1.3","Change Cipher Spec, Application Data"
"93","0.200629836","66","f2:7a:ed:6c:fa:7d","4a:48:67:35:9c:d2","172.20.0.3","172.20.0.2","TCP","47962 → 4433 [RST, ACK] Seq=567 Ack=859 Win=64000 Len=0 TSval=1142607042 TSecr=1333522833"
"94","0.215849329","74","f2:7a:ed:6c:fa:7d","4a:48:67:35:9c:d2","172.20.0.3","172.20.0.2","TCP","47966 → 4433 [SYN] Seq=0 Win=64240 Len=0 MSS=1460 SACK_PERM TSval=1142607057 TSecr=0 WS=128"
"95","0.215879178","74","4a:48:67:35:9c:d2","f2:7a:ed:6c:fa:7d","172.20.0.2","172.20.0.3","TCP","4433 → 47966 [SYN, ACK] Seq=0 Ack=1 Win=65160 Len=0 MSS=1460 SACK_PERM TSval=1333522852 TSecr=1142607057 WS=128"
"96","0.215903284","66","f2:7a:ed:6c:fa:7d","4a:48:67:35:9c:d2","172.20.0.3","172.20.0.2","TCP","47966 → 4433 [ACK] Seq=1 Ack=1 Win=64256 Len=0 TSval=1142607057 TSecr=1333522852"
"97","0.215956742","552","f2:7a:ed:6c:fa:7d","4a:48:67:35:9c:d2","172.20.0.3","172.20.0.2","TLSv1.2","Client Hello"
"98","0.215963312","66","4a:48:67:35:9c:d2","f2:7a:ed:6c:fa:7d","172.20.0.2","172.20.0.3","TCP","4433 → 47966 [ACK] Seq=1 Ack=487 Win=64768 Len=0 TSval=1333522852 TSecr=1142607057"
"99","0.217955608","925","4a:48:67:35:9c:d2","f2:7a:ed:6c:fa:7d","172.20.0.2","172.20.0.3","TLSv1.3","Server Hello, Change Cipher Spec, Application Data, Application Data, Application Data, Application Data"
"100","0.217989454","66","f2:7a:ed:6c:fa:7d","4a:48:67:35:9c:d2","172.20.0.3","172.20.0.2","TCP","47966 → 4433 [ACK] Seq=487 Ack=860 Win=63488 Len=0 TSval=1142607059 TSecr=1333522854"
"101","0.222792292","146","f2:7a:ed:6c:fa:7d","4a:48:67:35:9c:d2","172.20.0.3","172.20.0.2","TLSv1.3","Change Cipher Spec, Application Data"
"102","0.222894282","66","f2:7a:ed:6c:fa:7d","4a:48:67:35:9c:d2","172.20.0.3","172.20.0.2","TCP","47966 → 4433 [RST, ACK] Seq=567 Ack=860 Win=64000 Len=0 TSval=1142607064 TSecr=1333522854"
"103","0.235541757","74","f2:7a:ed:6c:fa:7d","4a:48:67:35:9c:d2","172.20.0.3","172.20.0.2","TCP","47968 → 4433 [SYN] Seq=0 Win=64240 Len=0 MSS=1460 SACK_PERM TSval=1142607077 TSecr=0 WS=128"
"104","0.235579535","74","4a:48:67:35:9c:d2","f2:7a:ed:6c:fa:7d","172.20.0.2","172.20.0.3","TCP","4433 → 47968 [SYN, ACK] Seq=0 Ack=1 Win=65160 Len=0 MSS=1460 SACK_PERM TSval=1333522872 TSecr=1142607077 WS=128"
"105","0.235608073","66","f2:7a:ed:6c:fa:7d","4a:48:67:35:9c:d2","172.20.0.3","172.20.0.2","TCP","47968 → 4433 [ACK] Seq=1 Ack=1 Win=64256 Len=0 TSval=1142607077 TSecr=1333522872"
"106","0.235679813","552","f2:7a:ed:6c:fa:7d","4a:48:67:35:9c:d2","172.20.0.3","172.20.0.2","TLSv1.2","Client Hello"
"107","0.235685993","66","4a:48:67:35:9c:d2","f2:7a:ed:6c:fa:7d","172.20.0.2","172.20.0.3","TCP","4433 → 47968 [ACK] Seq=1 Ack=487 Win=64768 Len=0 TSval=1333522872 TSecr=1142607077"
"108","0.237939852","923","4a:48:67:35:9c:d2","f2:7a:ed:6c:fa:7d","172.20.0.2","172.20.0.3","TLSv1.3","Server Hello, Change Cipher Spec, Application Data, Application Data, Application Data, Application Data"
"109","0.237977688","66","f2:7a:ed:6c:fa:7d","4a:48:67:35:9c:d2","172.20.0.3","172.20.0.2","TCP","47968 → 4433 [ACK] Seq=487 Ack=858 Win=63488 Len=0 TSval=1142607079 TSecr=1333522874"
"110","0.241032502","146","f2:7a:ed:6c:fa:7d","4a:48:67:35:9c:d2","172.20.0.3","172.20.0.2","TLSv1.3","Change Cipher Spec, Application Data"
"111","0.241104669","66","f2:7a:ed:6c:fa:7d","4a:48:67:35:9c:d2","172.20.0.3","172.20.0.2","TCP","47968 → 4433 [RST, ACK] Seq=567 Ack=858 Win=64000 Len=0 TSval=1142607082 TSecr=1333522874"
"112","0.253619821","74","f2:7a:ed:6c:fa:7d","4a:48:67:35:9c:d2","172.20.0.3","172.20.0.2","TCP","47982 → 4433 [SYN] Seq=0 Win=64240 Len=0 MSS=1460 SACK_PERM TSval=1142607095 TSecr=0 WS=128"
"113","0.253648417","74","4a:48:67:35:9c:d2","f2:7a:ed:6c:fa:7d","172.20.0.2","172.20.0.3","TCP","4433 → 47982 [SYN, ACK] Seq=0 Ack=1 Win=65160 Len=0 MSS=1460 SACK_PERM TSval=1333522890 TSecr=1142607095 WS=128"
"114","0.253667596","66","f2:7a:ed:6c:fa:7d","4a:48:67:35:9c:d2","172.20.0.3","172.20.0.2","TCP","47982 → 4433 [ACK] Seq=1 Ack=1 Win=64256 Len=0 TSval=1142607095 TSecr=1333522890"
"115","0.253717283","552","f2:7a:ed:6c:fa:7d","4a:48:67:35:9c:d2","172.20.0.3","172.20.0.2","TLSv1.2","Client Hello"
"116","0.253722123","66","4a:48:67:35:9c:d2","f2:7a:ed:6c:fa:7d","172.20.0.2","172.20.0.3","TCP","4433 → 47982 [ACK] Seq=1 Ack=487 Win=64768 Len=0 TSval=1333522890 TSecr=1142607095"
"117","0.255975472","924","4a:48:67:35:9c:d2","f2:7a:ed:6c:fa:7d","172.20.0.2","172.20.0.3","TLSv1.3","Server Hello, Change Cipher Spec, Application Data, Application Data, Application Data, Application Data"
"118","0.256018324","66","f2:7a:ed:6c:fa:7d","4a:48:67:35:9c:d2","172.20.0.3","172.20.0.2","TCP","47982 → 4433 [ACK] Seq=487 Ack=859 Win=63488 Len=0 TSval=1142607097 TSecr=1333522892"
"119","0.258942626","146","f2:7a:ed:6c:fa:7d","4a:48:67:35:9c:d2","172.20.0.3","172.20.0.2","TLSv1.3","Change Cipher Spec, Application Data"
"120","0.259028146","66","f2:7a:ed:6c:fa:7d","4a:48:67:35:9c:d2","172.20.0.3","172.20.0.2","TCP","47982 → 4433 [RST, ACK] Seq=567 Ack=859 Win=64000 Len=0 TSval=1142607100 TSecr=1333522892"
"121","0.271734031","74","f2:7a:ed:6c:fa:7d","4a:48:67:35:9c:d2","172.20.0.3","172.20.0.2","TCP","47992 → 4433 [SYN] Seq=0 Win=64240 Len=0 MSS=1460 SACK_PERM TSval=1142607113 TSecr=0 WS=128"
"122","0.271759566","74","4a:48:67:35:9c:d2","f2:7a:ed:6c:fa:7d","172.20.0.2","172.20.0.3","TCP","4433 → 47992 [SYN, ACK] Seq=0 Ack=1 Win=65160 Len=0 MSS=1460 SACK_PERM TSval=1333522908 TSecr=1142607113 WS=128"
"123","0.271778418","66","f2:7a:ed:6c:fa:7d","4a:48:67:35:9c:d2","172.20.0.3","172.20.0.2","TCP","47992 → 4433 [ACK] Seq=1 Ack=1 Win=64256 Len=0 TSval=1142607113 TSecr=1333522908"
"124","0.271829705","552","f2:7a:ed:6c:fa:7d","4a:48:67:35:9c:d2","172.20.0.3","172.20.0.2","TLSv1.2","Client Hello"
"125","0.271834587","66","4a:48:67:35:9c:d2","f2:7a:ed:6c:fa:7d","172.20.0.2","172.20.0.3","TCP","4433 → 47992 [ACK] Seq=1 Ack=487 Win=64768 Len=0 TSval=1333522908 TSecr=1142607113"
"126","0.274097303","923","4a:48:67:35:9c:d2","f2:7a:ed:6c:fa:7d","172.20.0.2","172.20.0.3","TLSv1.3","Server Hello, Change Cipher Spec, Application Data, Application Data, Application Data, Application Data"
"127","0.274134252","66","f2:7a:ed:6c:fa:7d","4a:48:67:35:9c:d2","172.20.0.3","172.20.0.2","TCP","47992 → 4433 [ACK] Seq=487 Ack=858 Win=63488 Len=0 TSval=1142607115 TSecr=1333522910"
"128","0.276834697","146","f2:7a:ed:6c:fa:7d","4a:48:67:35:9c:d2","172.20.0.3","172.20.0.2","TLSv1.3","Change Cipher Spec, Application Data"
"129","0.276904404","66","f2:7a:ed:6c:fa:7d","4a:48:67:35:9c:d2","172.20.0.3","172.20.0.2","TCP","47992 → 4433 [RST, ACK] Seq=567 Ack=858 Win=64000 Len=0 TSval=1142607118 TSecr=1333522910"
"130","0.288986774","74","f2:7a:ed:6c:fa:7d","4a:48:67:35:9c:d2","172.20.0.3","172.20.0.2","TCP","47998 → 4433 [SYN] Seq=0 Win=64240 Len=0 MSS=1460 SACK_PERM TSval=1142607130 TSecr=0 WS=128"
"131","0.289017959","74","4a:48:67:35:9c:d2","f2:7a:ed:6c:fa:7d","172.20.0.2","172.20.0.3","TCP","4433 → 47998 [SYN, ACK] Seq=0 Ack=1 Win=65160 Len=0 MSS=1460 SACK_PERM TSval=1333522925 TSecr=1142607130 WS=128"
"132","0.289038662","66","f2:7a:ed:6c:fa:7d","4a:48:67:35:9c:d2","172.20.0.3","172.20.0.2","TCP","47998 → 4433 [ACK] Seq=1 Ack=1 Win=64256 Len=0 TSval=1142607130 TSecr=1333522925"
"133","0.289088205","552","f2:7a:ed:6c:fa:7d","4a:48:67:35:9c:d2","172.20.0.3","172.20.0.2","TLSv1.2","Client Hello"
"134","0.289093556","66","4a:48:67:35:9c:d2","f2:7a:ed:6c:fa:7d","172.20.0.2","172.20.0.3","TCP","4433 → 47998 [ACK] Seq=1 Ack=487 Win=64768 Len=0 TSval=1333522925 TSecr=1142607130"
"135","0.292243263","923","4a:48:67:35:9c:d2","f2:7a:ed:6c:fa:7d","172.20.0.2","172.20.0.3","TLSv1.3","Server Hello, Change Cipher Spec, Application Data, Application Data, Application Data, Application Data"
"136","0.292295129","66","f2:7a:ed:6c:fa:7d","4a:48:67:35:9c:d2","172.20.0.3","172.20.0.2","TCP","47998 → 4433 [ACK] Seq=487 Ack=858 Win=63488 Len=0 TSval=1142607133 TSecr=1333522928"
"137","0.295553362","146","f2:7a:ed:6c:fa:7d","4a:48:67:35:9c:d2","172.20.0.3","172.20.0.2","TLSv1.3","Change Cipher Spec, Application Data"
"138","0.295635162","66","f2:7a:ed:6c:fa:7d","4a:48:67:35:9c:d2","172.20.0.3","172.20.0.2","TCP","47998 → 4433 [RST, ACK] Seq=567 Ack=858 Win=64000 Len=0 TSval=1142607137 TSecr=1333522928"
"139","0.306568057","74","f2:7a:ed:6c:fa:7d","4a:48:67:35:9c:d2","172.20.0.3","172.20.0.2","TCP","48012 → 4433 [SYN] Seq=0 Win=64240 Len=0 MSS=1460 SACK_PERM TSval=1142607148 TSecr=0 WS=128"
"140","0.306590883","74","4a:48:67:35:9c:d2","f2:7a:ed:6c:fa:7d","172.20.0.2","172.20.0.3","TCP","4433 → 48012 [SYN, ACK] Seq=0 Ack=1 Win=65160 Len=0 MSS=1460 SACK_PERM TSval=1333522943 TSecr=1142607148 WS=128"
"141","0.306608202","66","f2:7a:ed:6c:fa:7d","4a:48:67:35:9c:d2","172.20.0.3","172.20.0.2","TCP","48012 → 4433 [ACK] Seq=1 Ack=1 Win=64256 Len=0 TSval=1142607148 TSecr=1333522943"
"142","0.306648381","552","f2:7a:ed:6c:fa:7d","4a:48:67:35:9c:d2","172.20.0.3","172.20.0.2","TLSv1.2","Client Hello"
"143","0.306653456","66","4a:48:67:35:9c:d2","f2:7a:ed:6c:fa:7d","172.20.0.2","172.20.0.3","TCP","4433 → 48012 [ACK] Seq=1 Ack=487 Win=64768 Len=0 TSval=1333522943 TSecr=1142607148"
"144","0.308590991","924","4a:48:67:35:9c:d2","f2:7a:ed:6c:fa:7d","172.20.0.2","172.20.0.3","TLSv1.3","Server Hello, Change Cipher Spec, Application Data, Application Data, Application Data, Application Data"
"145","0.308625381","66","f2:7a:ed:6c:fa:7d","4a:48:67:35:9c:d2","172.20.0.3","172.20.0.2","TCP","48012 → 4433 [ACK] Seq=487 Ack=859 Win=63488 Len=0 TSval=1142607150 TSecr=1333522945"
"146","0.311330883","146","f2:7a:ed:6c:fa:7d","4a:48:67:35:9c:d2","172.20.0.3","172.20.0.2","TLSv1.3","Change Cipher Spec, Application Data"
"147","0.311412478","66","f2:7a:ed:6c:fa:7d","4a:48:67:35:9c:d2","172.20.0.3","172.20.0.2","TCP","48012 → 4433 [RST, ACK] Seq=567 Ack=859 Win=64000 Len=0 TSval=1142607153 TSecr=1333522945"
"148","0.322683897","74","f2:7a:ed:6c:fa:7d","4a:48:67:35:9c:d2","172.20.0.3","172.20.0.2","TCP","48020 → 4433 [SYN] Seq=0 Win=64240 Len=0 MSS=1460 SACK_PERM TSval=1142607164 TSecr=0 WS=128"
"149","0.322705381","74","4a:48:67:35:9c:d2","f2:7a:ed:6c:fa:7d","172.20.0.2","172.20.0.3","TCP","4433 → 48020 [SYN, ACK] Seq=0 Ack=1 Win=65160 Len=0 MSS=1460 SACK_PERM TSval=1333522959 TSecr=1142607164 WS=128"
"150","0.322722628","66","f2:7a:ed:6c:fa:7d","4a:48:67:35:9c:d2","172.20.0.3","172.20.0.2","TCP","48020 → 4433 [ACK] Seq=1 Ack=1 Win=64256 Len=0 TSval=1142607164 TSecr=1333522959"
"151","0.322765409","552","f2:7a:ed:6c:fa:7d","4a:48:67:35:9c:d2","172.20.0.3","172.20.0.2","TLSv1.2","Client Hello"
"152","0.322772629","66","4a:48:67:35:9c:d2","f2:7a:ed:6c:fa:7d","172.20.0.2","172.20.0.3","TCP","4433 → 48020 [ACK] Seq=1 Ack=487 Win=64768 Len=0 TSval=1333522959 TSecr=1142607164"
"153","0.324883347","923","4a:48:67:35:9c:d2","f2:7a:ed:6c:fa:7d","172.20.0.2","172.20.0.3","TLSv1.3","Server Hello, Change Cipher Spec, Application Data, Application Data, Application Data, Application Data"
"154","0.324942648","66","f2:7a:ed:6c:fa:7d","4a:48:67:35:9c:d2","172.20.0.3","172.20.0.2","TCP","48020 → 4433 [ACK] Seq=487 Ack=858 Win=63488 Len=0 TSval=1142607166 TSecr=1333522961"
"155","0.327779892","146","f2:7a:ed:6c:fa:7d","4a:48:67:35:9c:d2","172.20.0.3","172.20.0.2","TLSv1.3","Change Cipher Spec, Application Data"
"156","0.327846891","66","f2:7a:ed:6c:fa:7d","4a:48:67:35:9c:d2","172.20.0.3","172.20.0.2","TCP","48020 → 4433 [RST, ACK] Seq=567 Ack=858 Win=64000 Len=0 TSval=1142607169 TSecr=1333522961"
"157","0.339013499","74","f2:7a:ed:6c:fa:7d","4a:48:67:35:9c:d2","172.20.0.3","172.20.0.2","TCP","48026 → 4433 [SYN] Seq=0 Win=64240 Len=0 MSS=1460 SACK_PERM TSval=1142607180 TSecr=0 WS=128"
"158","0.339043171","74","4a:48:67:35:9c:d2","f2:7a:ed:6c:fa:7d","172.20.0.2","172.20.0.3","TCP","4433 → 48026 [SYN, ACK] Seq=0 Ack=1 Win=65160 Len=0 MSS=1460 SACK_PERM TSval=1333522975 TSecr=1142607180 WS=128"
"159","0.339067336","66","f2:7a:ed:6c:fa:7d","4a:48:67:35:9c:d2","172.20.0.3","172.20.0.2","TCP","48026 → 4433 [ACK] Seq=1 Ack=1 Win=64256 Len=0 TSval=1142607180 TSecr=1333522975"
"160","0.339122396","552","f2:7a:ed:6c:fa:7d","4a:48:67:35:9c:d2","172.20.0.3","172.20.0.2","TLSv1.2","Client Hello"
"161","0.339137905","66","4a:48:67:35:9c:d2","f2:7a:ed:6c:fa:7d","172.20.0.2","172.20.0.3","TCP","4433 → 48026 [ACK] Seq=1 Ack=487 Win=64768 Len=0 TSval=1333522975 TSecr=1142607180"
"162","0.341314691","925","4a:48:67:35:9c:d2","f2:7a:ed:6c:fa:7d","172.20.0.2","172.20.0.3","TLSv1.3","Server Hello, Change Cipher Spec, Application Data, Application Data, Application Data, Application Data"
"163","0.341336273","66","f2:7a:ed:6c:fa:7d","4a:48:67:35:9c:d2","172.20.0.3","172.20.0.2","TCP","48026 → 4433 [ACK] Seq=487 Ack=860 Win=63488 Len=0 TSval=1142607182 TSecr=1333522977"
"164","0.344011610","146","f2:7a:ed:6c:fa:7d","4a:48:67:35:9c:d2","172.20.0.3","172.20.0.2","TLSv1.3","Change Cipher Spec, Application Data"
"165","0.344067244","66","f2:7a:ed:6c:fa:7d","4a:48:67:35:9c:d2","172.20.0.3","172.20.0.2","TCP","48026 → 4433 [RST, ACK] Seq=567 Ack=860 Win=64000 Len=0 TSval=1142607185 TSecr=1333522977"
"166","0.354827861","74","f2:7a:ed:6c:fa:7d","4a:48:67:35:9c:d2","172.20.0.3","172.20.0.2","TCP","48030 → 4433 [SYN] Seq=0 Win=64240 Len=0 MSS=1460 SACK_PERM TSval=1142607196 TSecr=0 WS=128"
"167","0.354853366","74","4a:48:67:35:9c:d2","f2:7a:ed:6c:fa:7d","172.20.0.2","172.20.0.3","TCP","4433 → 48030 [SYN, ACK] Seq=0 Ack=1 Win=65160 Len=0 MSS=1460 SACK_PERM TSval=1333522991 TSecr=1142607196 WS=128"
"168","0.354870616","66","f2:7a:ed:6c:fa:7d","4a:48:67:35:9c:d2","172.20.0.3","172.20.0.2","TCP","48030 → 4433 [ACK] Seq=1 Ack=1 Win=64256 Len=0 TSval=1142607196 TSecr=1333522991"
"169","0.354906828","552","f2:7a:ed:6c:fa:7d","4a:48:67:35:9c:d2","172.20.0.3","172.20.0.2","TLSv1.2","Client Hello"
"170","0.354921772","66","4a:48:67:35:9c:d2","f2:7a:ed:6c:fa:7d","172.20.0.2","172.20.0.3","TCP","4433 → 48030 [ACK] Seq=1 Ack=487 Win=64768 Len=0 TSval=1333522991 TSecr=1142607196"
"171","0.357549855","924","4a:48:67:35:9c:d2","f2:7a:ed:6c:fa:7d","172.20.0.2","172.20.0.3","TLSv1.3","Server Hello, Change Cipher Spec, Application Data, Application Data, Application Data, Application Data"
"172","0.357590628","66","f2:7a:ed:6c:fa:7d","4a:48:67:35:9c:d2","172.20.0.3","172.20.0.2","TCP","48030 → 4433 [ACK] Seq=487 Ack=859 Win=63488 Len=0 TSval=1142607199 TSecr=1333522994"
"173","0.360836338","146","f2:7a:ed:6c:fa:7d","4a:48:67:35:9c:d2","172.20.0.3","172.20.0.2","TLSv1.3","Change Cipher Spec, Application Data"
"174","0.360901315","66","f2:7a:ed:6c:fa:7d","4a:48:67:35:9c:d2","172.20.0.3","172.20.0.2","TCP","48030 → 4433 [RST, ACK] Seq=567 Ack=859 Win=64000 Len=0 TSval=1142607202 TSecr=1333522994"
"175","0.371882241","74","f2:7a:ed:6c:fa:7d","4a:48:67:35:9c:d2","172.20.0.3","172.20.0.2","TCP","48034 → 4433 [SYN] Seq=0 Win=64240 Len=0 MSS=1460 SACK_PERM TSval=1142607213 TSecr=0 WS=128"
"176","0.371908302","74","4a:48:67:35:9c:d2","f2:7a:ed:6c:fa:7d","172.20.0.2","172.20.0.3","TCP","4433 → 48034 [SYN, ACK] Seq=0 Ack=1 Win=65160 Len=0 MSS=1460 SACK_PERM TSval=1333523008 TSecr=1142607213 WS=128"
"177","0.371926793","66","f2:7a:ed:6c:fa:7d","4a:48:67:35:9c:d2","172.20.0.3","172.20.0.2","TCP","48034 → 4433 [ACK] Seq=1 Ack=1 Win=64256 Len=0 TSval=1142607213 TSecr=1333523008"
"178","0.371974422","552","f2:7a:ed:6c:fa:7d","4a:48:67:35:9c:d2","172.20.0.3","172.20.0.2","TLSv1.2","Client Hello"
"179","0.371979436","66","4a:48:67:35:9c:d2","f2:7a:ed:6c:fa:7d","172.20.0.2","172.20.0.3","TCP","4433 → 48034 [ACK] Seq=1 Ack=487 Win=64768 Len=0 TSval=1333523008 TSecr=1142607213"
"180","0.374159063","924","4a:48:67:35:9c:d2","f2:7a:ed:6c:fa:7d","172.20.0.2","172.20.0.3","TLSv1.3","Server Hello, Change Cipher Spec, Application Data, Application Data, Application Data, Application Data"
"181","0.374193146","66","f2:7a:ed:6c:fa:7d","4a:48:67:35:9c:d2","172.20.0.3","172.20.0.2","TCP","48034 → 4433 [ACK] Seq=487 Ack=859 Win=63488 Len=0 TSval=1142607215 TSecr=1333523010"
"182","0.377173280","146","f2:7a:ed:6c:fa:7d","4a:48:67:35:9c:d2","172.20.0.3","172.20.0.2","TLSv1.3","Change Cipher Spec, Application Data"
"183","0.377250442","66","f2:7a:ed:6c:fa:7d","4a:48:67:35:9c:d2","172.20.0.3","172.20.0.2","TCP","48034 → 4433 [RST, ACK] Seq=567 Ack=859 Win=64000 Len=0 TSval=1142607218 TSecr=1333523010"
"184","0.387919718","74","f2:7a:ed:6c:fa:7d","4a:48:67:35:9c:d2","172.20.0.3","172.20.0.2","TCP","48044 → 4433 [SYN] Seq=0 Win=64240 Len=0 MSS=1460 SACK_PERM TSval=1142607229 TSecr=0 WS=128"
"185","0.387938735","74","4a:48:67:35:9c:d2","f2:7a:ed:6c:fa:7d","172.20.0.2","172.20.0.3","TCP","4433 → 48044 [SYN, ACK] Seq=0 Ack=1 Win=65160 Len=0 MSS=1460 SACK_PERM TSval=1333523024 TSecr=1142607229 WS=128"
"186","0.387954973","66","f2:7a:ed:6c:fa:7d","4a:48:67:35:9c:d2","172.20.0.3","172.20.0.2","TCP","48044 → 4433 [ACK] Seq=1 Ack=1 Win=64256 Len=0 TSval=1142607229 TSecr=1333523024"
"187","0.387993107","552","f2:7a:ed:6c:fa:7d","4a:48:67:35:9c:d2","172.20.0.3","172.20.0.2","TLSv1.2","Client Hello"
"188","0.387997180","66","4a:48:67:35:9c:d2","f2:7a:ed:6c:fa:7d","172.20.0.2","172.20.0.3","TCP","4433 → 48044 [ACK] Seq=1 Ack=487 Win=64768 Len=0 TSval=1333523024 TSecr=1142607229"
"189","0.390287557","923","4a:48:67:35:9c:d2","f2:7a:ed:6c:fa:7d","172.20.0.2","172.20.0.3","TLSv1.3","Server Hello, Change Cipher Spec, Application Data, Application Data, Application Data, Application Data"
"190","0.390322747","66","f2:7a:ed:6c:fa:7d","4a:48:67:35:9c:d2","172.20.0.3","172.20.0.2","TCP","48044 → 4433 [ACK] Seq=487 Ack=858 Win=63488 Len=0 TSval=1142607231 TSecr=1333523026"
"191","0.392948302","146","f2:7a:ed:6c:fa:7d","4a:48:67:35:9c:d2","172.20.0.3","172.20.0.2","TLSv1.3","Change Cipher Spec, Application Data"
"192","0.393013980","66","f2:7a:ed:6c:fa:7d","4a:48:67:35:9c:d2","172.20.0.3","172.20.0.2","TCP","48044 → 4433 [RST, ACK] Seq=567 Ack=858 Win=64000 Len=0 TSval=1142607234 TSecr=1333523026"
"193","0.404521642","74","f2:7a:ed:6c:fa:7d","4a:48:67:35:9c:d2","172.20.0.3","172.20.0.2","TCP","48046 → 4433 [SYN] Seq=0 Win=64240 Len=0 MSS=1460 SACK_PERM TSval=1142607246 TSecr=0 WS=128"
"194","0.404552655","74","4a:48:67:35:9c:d2","f2:7a:ed:6c:fa:7d","172.20.0.2","172.20.0.3","TCP","4433 → 48046 [SYN, ACK] Seq=0 Ack=1 Win=65160 Len=0 MSS=1460 SACK_PERM TSval=1333523041 TSecr=1142607246 WS=128"
"195","0.404581624","66","f2:7a:ed:6c:fa:7d","4a:48:67:35:9c:d2","172.20.0.3","172.20.0.2","TCP","48046 → 4433 [ACK] Seq=1 Ack=1 Win=64256 Len=0 TSval=1142607246 TSecr=1333523041"
"196","0.404644593","552","f2:7a:ed:6c:fa:7d","4a:48:67:35:9c:d2","172.20.0.3","172.20.0.2","TLSv1.2","Client Hello"
"197","0.404650359","66","4a:48:67:35:9c:d2","f2:7a:ed:6c:fa:7d","172.20.0.2","172.20.0.3","TCP","4433 → 48046 [ACK] Seq=1 Ack=487 Win=64768 Len=0 TSval=1333523041 TSecr=1142607246"
"198","0.407394130","925","4a:48:67:35:9c:d2","f2:7a:ed:6c:fa:7d","172.20.0.2","172.20.0.3","TLSv1.3","Server Hello, Change Cipher Spec, Application Data, Application Data, Application Data, Application Data"
"199","0.407437379","66","f2:7a:ed:6c:fa:7d","4a:48:67:35:9c:d2","172.20.0.3","172.20.0.2","TCP","48046 → 4433 [ACK] Seq=487 Ack=860 Win=63488 Len=0 TSval=1142607249 TSecr=1333523044"
"200","0.410220291","146","f2:7a:ed:6c:fa:7d","4a:48:67:35:9c:d2","172.20.0.3","172.20.0.2","TLSv1.3","Change Cipher Spec, Application Data"
"201","0.410292268","66","f2:7a:ed:6c:fa:7d","4a:48:67:35:9c:d2","172.20.0.3","172.20.0.2","TCP","48046 → 4433 [RST, ACK] Seq=567 Ack=860 Win=64000 Len=0 TSval=1142607251 TSecr=1333523044"
"202","0.421468917","74","f2:7a:ed:6c:fa:7d","4a:48:67:35:9c:d2","172.20.0.3","172.20.0.2","TCP","48048 → 4433 [SYN] Seq=0 Win=64240 Len=0 MSS=1460 SACK_PERM TSval=1142607263 TSecr=0 WS=128"
"203","0.421494876","74","4a:48:67:35:9c:d2","f2:7a:ed:6c:fa:7d","172.20.0.2","172.20.0.3","TCP","4433 → 48048 [SYN, ACK] Seq=0 Ack=1 Win=65160 Len=0 MSS=1460 SACK_PERM TSval=1333523058 TSecr=1142607263 WS=128"
"204","0.421518980","66","f2:7a:ed:6c:fa:7d","4a:48:67:35:9c:d2","172.20.0.3","172.20.0.2","TCP","48048 → 4433 [ACK] Seq=1 Ack=1 Win=64256 Len=0 TSval=1142607263 TSecr=1333523058"
"205","0.421589792","552","f2:7a:ed:6c:fa:7d","4a:48:67:35:9c:d2","172.20.0.3","172.20.0.2","TLSv1.2","Client Hello"
"206","0.421595987","66","4a:48:67:35:9c:d2","f2:7a:ed:6c:fa:7d","172.20.0.2","172.20.0.3","TCP","4433 → 48048 [ACK] Seq=1 Ack=487 Win=64768 Len=0 TSval=1333523058 TSecr=1142607263"
"207","0.423847764","924","4a:48:67:35:9c:d2","f2:7a:ed:6c:fa:7d","172.20.0.2","172.20.0.3","TLSv1.3","Server Hello, Change Cipher Spec, Application Data, Application Data, Application Data, Application Data"
"208","0.423888142","66","f2:7a:ed:6c:fa:7d","4a:48:67:35:9c:d2","172.20.0.3","172.20.0.2","TCP","48048 → 4433 [ACK] Seq=487 Ack=859 Win=63488 Len=0 TSval=1142607265 TSecr=1333523060"
"209","0.426832138","146","f2:7a:ed:6c:fa:7d","4a:48:67:35:9c:d2","172.20.0.3","172.20.0.2","TLSv1.3","Change Cipher Spec, Application Data"
"210","0.426906640","66","f2:7a:ed:6c:fa:7d","4a:48:67:35:9c:d2","172.20.0.3","172.20.0.2","TCP","48048 → 4433 [RST, ACK] Seq=567 Ack=859 Win=64000 Len=0 TSval=1142607268 TSecr=1333523060"
"211","0.441535714","74","f2:7a:ed:6c:fa:7d","4a:48:67:35:9c:d2","172.20.0.3","172.20.0.2","TCP","48056 → 4433 [SYN] Seq=0 Win=64240 Len=0 MSS=1460 SACK_PERM TSval=1142607283 TSecr=0 WS=128"
"212","0.441562626","74","4a:48:67:35:9c:d2","f2:7a:ed:6c:fa:7d","172.20.0.2","172.20.0.3","TCP","4433 → 48056 [SYN, ACK] Seq=0 Ack=1 Win=65160 Len=0 MSS=1460 SACK_PERM TSval=1333523078 TSecr=1142607283 WS=128"
"213","0.441583602","66","f2:7a:ed:6c:fa:7d","4a:48:67:35:9c:d2","172.20.0.3","172.20.0.2","TCP","48056 → 4433 [ACK] Seq=1 Ack=1 Win=64256 Len=0 TSval=1142607283 TSecr=1333523078"
"214","0.441634891","552","f2:7a:ed:6c:fa:7d","4a:48:67:35:9c:d2","172.20.0.3","172.20.0.2","TLSv1.2","Client Hello"
"215","0.441641481","66","4a:48:67:35:9c:d2","f2:7a:ed:6c:fa:7d","172.20.0.2","172.20.0.3","TCP","4433 → 48056 [ACK] Seq=1 Ack=487 Win=64768 Len=0 TSval=1333523078 TSecr=1142607283"
"216","0.443696420","923","4a:48:67:35:9c:d2","f2:7a:ed:6c:fa:7d","172.20.0.2","172.20.0.3","TLSv1.3","Server Hello, Change Cipher Spec, Application Data, Application Data, Application Data, Application Data"
"217","0.443728202","66","f2:7a:ed:6c:fa:7d","4a:48:67:35:9c:d2","172.20.0.3","172.20.0.2","TCP","48056 → 4433 [ACK] Seq=487 Ack=858 Win=63488 Len=0 TSval=1142607285 TSecr=1333523080"
"218","0.446880056","146","f2:7a:ed:6c:fa:7d","4a:48:67:35:9c:d2","172.20.0.3","172.20.0.2","TLSv1.3","Change Cipher Spec, Application Data"
"219","0.446942647","66","f2:7a:ed:6c:fa:7d","4a:48:67:35:9c:d2","172.20.0.3","172.20.0.2","TCP","48056 → 4433 [RST, ACK] Seq=567 Ack=858 Win=64000 Len=0 TSval=1142607288 TSecr=1333523080"
"220","0.460110533","74","f2:7a:ed:6c:fa:7d","4a:48:67:35:9c:d2","172.20.0.3","172.20.0.2","TCP","48060 → 4433 [SYN] Seq=0 Win=64240 Len=0 MSS=1460 SACK_PERM TSval=1142607301 TSecr=0 WS=128"
"221","0.460143197","74","4a:48:67:35:9c:d2","f2:7a:ed:6c:fa:7d","172.20.0.2","172.20.0.3","TCP","4433 → 48060 [SYN, ACK] Seq=0 Ack=1 Win=65160 Len=0 MSS=1460 SACK_PERM TSval=1333523096 TSecr=1142607301 WS=128"
"222","0.460167139","66","f2:7a:ed:6c:fa:7d","4a:48:67:35:9c:d2","172.20.0.3","172.20.0.2","TCP","48060 → 4433 [ACK] Seq=1 Ack=1 Win=64256 Len=0 TSval=1142607301 TSecr=1333523096"
"223","0.460218785","552","f2:7a:ed:6c:fa:7d","4a:48:67:35:9c:d2","172.20.0.3","172.20.0.2","TLSv1.2","Client Hello"
"224","0.460236318","66","4a:48:67:35:9c:d2","f2:7a:ed:6c:fa:7d","172.20.0.2","172.20.0.3","TCP","4433 → 48060 [ACK] Seq=1 Ack=487 Win=64768 Len=0 TSval=1333523096 TSecr=1142607301"
"225","0.463588598","924","4a:48:67:35:9c:d2","f2:7a:ed:6c:fa:7d","172.20.0.2","172.20.0.3","TLSv1.3","Server Hello, Change Cipher Spec, Application Data, Application Data, Application Data, Application Data"
