frame.number,frame.time_relative,frame.len,eth.src,eth.dst,ip.src,ip.dst,_ws.col.protocol,_ws.col.info
"1","0.000000000","42","f2:28:26:04:7d:98","ff:ff:ff:ff:ff:ff",,,"ARP","ARP Announcement for 172.20.0.3"
"2","0.029524160","42","f2:28:26:04:7d:98","ff:ff:ff:ff:ff:ff",,,"ARP","Who has 172.20.0.2? Tell 172.20.0.3"
"3","0.029546796","42","92:2c:a9:fd:c2:f1","f2:28:26:04:7d:98",,,"ARP","172.20.0.2 is at 92:2c:a9:fd:c2:f1"
"4","0.029553806","74","f2:28:26:04:7d:98","92:2c:a9:fd:c2:f1","172.20.0.3","172.20.0.2","TCP","60298 → 4433 [SYN] Seq=0 Win=64240 Len=0 MSS=1460 SACK_PERM TSval=1138632519 TSecr=0 WS=128"
"5","0.029573657","74","92:2c:a9:fd:c2:f1","f2:28:26:04:7d:98","172.20.0.2","172.20.0.3","TCP","4433 → 60298 [SYN, ACK] Seq=0 Ack=1 Win=65160 Len=0 MSS=1460 SACK_PERM TSval=1329548314 TSecr=1138632519 WS=128"
"6","0.029590078","66","f2:28:26:04:7d:98","92:2c:a9:fd:c2:f1","172.20.0.3","172.20.0.2","TCP","60298 → 4433 [ACK] Seq=1 Ack=1 Win=64256 Len=0 TSval=1138632519 TSecr=1329548314"
"7","0.029624045","561","f2:28:26:04:7d:98","92:2c:a9:fd:c2:f1","172.20.0.3","172.20.0.2","TLSv1.2","Client Hello"
"8","0.029629704","66","92:2c:a9:fd:c2:f1","f2:28:26:04:7d:98","172.20.0.2","172.20.0.3","TCP","4433 → 60298 [ACK] Seq=1 Ack=496 Win=64768 Len=0 TSval=1329548314 TSecr=1138632519"
"9","0.030438538","769","92:2c:a9:fd:c2:f1","f2:28:26:04:7d:98","172.20.0.2","172.20.0.3","TLSv1.3","Server Hello, Change Cipher Spec, Application Data, Application Data, Application Data, Application Data"
"10","0.030467144","66","f2:28:26:04:7d:98","92:2c:a9:fd:c2:f1","172.20.0.3","172.20.0.2","TCP","60298 → 4433 [ACK] Seq=496 Ack=704 Win=63616 Len=0 TSval=1138632520 TSecr=1329548315"
"11","0.031243235","146","f2:28:26:04:7d:98","92:2c:a9:fd:c2:f1","172.20.0.3","172.20.0.2","TLSv1.3","Change Cipher Spec, Application Data"
"12","0.031307597","66","f2:28:26:04:7d:98","92:2c:a9:fd:c2:f1","172.20.0.3","172.20.0.2","TCP","60298 → 4433 [RST, ACK] Seq=576 Ack=704 Win=63616 Len=0 TSval=1138632520 TSecr=1329548315"
"13","0.041050085","74","f2:28:26:04:7d:98","92:2c:a9:fd:c2:f1","172.20.0.3","172.20.0.2","TCP","60300 → 4433 [SYN] Seq=0 Win=64240 Len=0 MSS=1460 SACK_PERM TSval=1138632530 TSecr=0 WS=128"
"14","0.041071787","74","92:2c:a9:fd:c2:f1","f2:28:26:04:7d:98","172.20.0.2","172.20.0.3","TCP","4433 → 60300 [SYN, ACK] Seq=0 Ack=1 Win=65160 Len=0 MSS=1460 SACK_PERM TSval=1329548325 TSecr=1138632530 WS=128"
"15","0.041088439","66","f2:28:26:04:7d:98","92:2c:a9:fd:c2:f1","172.20.0.3","172.20.0.2","TCP","60300 → 4433 [ACK] Seq=1 Ack=1 Win=64256 Len=0 TSval=1138632530 TSecr=1329548325"
"16","0.041125326","561","f2:28:26:04:7d:98","92:2c:a9:fd:c2:f1","172.20.0.3","172.20.0.2","TLSv1.2","Client Hello"
"17","0.041130434","66","92:2c:a9:fd:c2:f1","f2:28:26:04:7d:98","172.20.0.2","172.20.0.3","TCP","4433 → 60300 [ACK] Seq=1 Ack=496 Win=64768 Len=0 TSval=1329548325 TSecr=1138632530"
"18","0.041597458","769","92:2c:a9:fd:c2:f1","f2:28:26:04:7d:98","172.20.0.2","172.20.0.3","TLSv1.3","Server Hello, Change Cipher Spec, Application Data, Application Data, Application Data, Application Data"
"19","0.041622524","66","f2:28:26:04:7d:98","92:2c:a9:fd:c2:f1","172.20.0.3","172.20.0.2","TCP","60300 → 4433 [ACK] Seq=496 Ack=704 Win=63616 Len=0 TSval=1138632531 TSecr=1329548326"
"20","0.042401705","146","f2:28:26:04:7d:98","92:2c:a9:fd:c2:f1","172.20.0.3","172.20.0.2","TLSv1.3","Change Cipher Spec, Application Data"
"21","0.042452577","66","f2:28:26:04:7d:98","92:2c:a9:fd:c2:f1","172.20.0.3","172.20.0.2","TCP","60300 → 4433 [RST, ACK] Seq=576 Ack=704 Win=63616 Len=0 TSval=1138632532 TSecr=1329548326"
"22","0.051956294","74","f2:28:26:04:7d:98","92:2c:a9:fd:c2:f1","172.20.0.3","172.20.0.2","TCP","60312 → 4433 [SYN] Seq=0 Win=64240 Len=0 MSS=1460 SACK_PERM TSval=1138632541 TSecr=0 WS=128"
"23","0.051977271","74","92:2c:a9:fd:c2:f1","f2:28:26:04:7d:98","172.20.0.2","172.20.0.3","TCP","4433 → 60312 [SYN, ACK] Seq=0 Ack=1 Win=65160 Len=0 MSS=1460 SACK_PERM TSval=1329548336 TSecr=1138632541 WS=128"
"24","0.051990887","66","f2:28:26:04:7d:98","92:2c:a9:fd:c2:f1","172.20.0.3","172.20.0.2","TCP","60312 → 4433 [ACK] Seq=1 Ack=1 Win=64256 Len=0 TSval=1138632541 TSecr=1329548336"
"25","0.052025475","561","f2:28:26:04:7d:98","92:2c:a9:fd:c2:f1","172.20.0.3","172.20.0.2","TLSv1.2","Client Hello"
"26","0.052030145","66","92:2c:a9:fd:c2:f1","f2:28:26:04:7d:98","172.20.0.2","172.20.0.3","TCP","4433 → 60312 [ACK] Seq=1 Ack=496 Win=64768 Len=0 TSval=1329548336 TSecr=1138632541"
"27","0.052493195","769","92:2c:a9:fd:c2:f1","f2:28:26:04:7d:98","172.20.0.2","172.20.0.3","TLSv1.3","Server Hello, Change Cipher Spec, Application Data, Application Data, Application Data, Application Data"
"28","0.052522095","66","f2:28:26:04:7d:98","92:2c:a9:fd:c2:f1","172.20.0.3","172.20.0.2","TCP","60312 → 4433 [ACK] Seq=496 Ack=704 Win=63616 Len=0 TSval=1138632542 TSecr=1329548337"
"29","0.053253352","146","f2:28:26:04:7d:98","92:2c:a9:fd:c2:f1","172.20.0.3","172.20.0.2","TLSv1.3","Change Cipher Spec, Application Data"
"30","0.053310230","66","f2:28:26:04:7d:98","92:2c:a9:fd:c2:f1","172.20.0.3","172.20.0.2","TCP","60312 → 4433 [RST, ACK] Seq=576 Ack=704 Win=63616 Len=0 TSval=1138632542 TSecr=1329548337"
"31","0.063582367","74","f2:28:26:04:7d:98","92:2c:a9:fd:c2:f1","172.20.0.3","172.20.0.2","TCP","60320 → 4433 [SYN] Seq=0 Win=64240 Len=0 MSS=1460 SACK_PERM TSval=1138632553 TSecr=0 WS=128"
"32","0.063606047","74","92:2c:a9:fd:c2:f1","f2:28:26:04:7d:98","172.20.0.2","172.20.0.3","TCP","4433 → 60320 [SYN, ACK] Seq=0 Ack=1 Win=65160 Len=0 MSS=1460 SACK_PERM TSval=1329548348 TSecr=1138632553 WS=128"
"33","0.063623715","66","f2:28:26:04:7d:98","92:2c:a9:fd:c2:f1","172.20.0.3","172.20.0.2","TCP","60320 → 4433 [ACK] Seq=1 Ack=1 Win=64256 Len=0 TSval=1138632553 TSecr=1329548348"
"34","0.063664343","561","f2:28:26:04:7d:98","92:2c:a9:fd:c2:f1","172.20.0.3","172.20.0.2","TLSv1.2","Client Hello"
"35","0.063668395","66","92:2c:a9:fd:c2:f1","f2:28:26:04:7d:98","172.20.0.2","172.20.0.3","TCP","4433 → 60320 [ACK] Seq=1 Ack=496 Win=64768 Len=0 TSval=1329548348 TSecr=1138632553"
"36","0.064161041","769","92:2c:a9:fd:c2:f1","f2:28:26:04:7d:98","172.20.0.2","172.20.0.3","TLSv1.3","Server Hello, Change Cipher Spec, Application Data, Application Data, Application Data, Application Data"
"37","0.064192131","66","f2:28:26:04:7d:98","92:2c:a9:fd:c2:f1","172.20.0.3","172.20.0.2","TCP","60320 → 4433 [ACK] Seq=496 Ack=704 Win=63616 Len=0 TSval=1138632553 TSecr=1329548348"
"38","0.065030131","146","f2:28:26:04:7d:98","92:2c:a9:fd:c2:f1","172.20.0.3","172.20.0.2","TLSv1.3","Change Cipher Spec, Application Data"
"39","0.065084703","66","f2:28:26:04:7d:98","92:2c:a9:fd:c2:f1","172.20.0.3","172.20.0.2","TCP","60320 → 4433 [RST, ACK] Seq=576 Ack=704 Win=63616 Len=0 TSval=1138632554 TSecr=1329548348"
"40","0.074802447","74","f2:28:26:04:7d:98","92:2c:a9:fd:c2:f1","172.20.0.3","172.20.0.2","TCP","60328 → 4433 [SYN] Seq=0 Win=64240 Len=0 MSS=1460 SACK_PERM TSval=1138632564 TSecr=0 WS=128"
"41","0.074823732","74","92:2c:a9:fd:c2:f1","f2:28:26:04:7d:98","172.20.0.2","172.20.0.3","TCP","4433 → 60328 [SYN, ACK] Seq=0 Ack=1 Win=65160 Len=0 MSS=1460 SACK_PERM TSval=1329548359 TSecr=1138632564 WS=128"
"42","0.074840455","66","f2:28:26:04:7d:98","92:2c:a9:fd:c2:f1","172.20.0.3","172.20.0.2","TCP","60328 → 4433 [ACK] Seq=1 Ack=1 Win=64256 Len=0 TSval=1138632564 TSecr=1329548359"
"43","0.074884464","561","f2:28:26:04:7d:98","92:2c:a9:fd:c2:f1","172.20.0.3","172.20.0.2","TLSv1.2","Client Hello"
"44","0.074889320","66","92:2c:a9:fd:c2:f1","f2:28:26:04:7d:98","172.20.0.2","172.20.0.3","TCP","4433 → 60328 [ACK] Seq=1 Ack=496 Win=64768 Len=0 TSval=1329548359 TSecr=1138632564"
"45","0.075391799","769","92:2c:a9:fd:c2:f1","f2:28:26:04:7d:98","172.20.0.2","172.20.0.3","TLSv1.3","Server Hello, Change Cipher Spec, Application Data, Application Data, Application Data, Application Data"
"46","0.075417950","66","f2:28:26:04:7d:98","92:2c:a9:fd:c2:f1","172.20.0.3","172.20.0.2","TCP","60328 → 4433 [ACK] Seq=496 Ack=704 Win=63616 Len=0 TSval=1138632565 TSecr=1329548360"
"47","0.076219802","146","f2:28:26:04:7d:98","92:2c:a9:fd:c2:f1","172.20.0.3","172.20.0.2","TLSv1.3","Change Cipher Spec, Application Data"
"48","0.076281594","66","f2:28:26:04:7d:98","92:2c:a9:fd:c2:f1","172.20.0.3","172.20.0.2","TCP","60328 → 4433 [RST, ACK] Seq=576 Ack=704 Win=63616 Len=0 TSval=1138632565 TSecr=1329548360"
"49","0.085752589","74","f2:28:26:04:7d:98","92:2c:a9:fd:c2:f1","172.20.0.3","172.20.0.2","TCP","60334 → 4433 [SYN] Seq=0 Win=64240 Len=0 MSS=1460 SACK_PERM TSval=1138632575 TSecr=0 WS=128"
"50","0.085770751","74","92:2c:a9:fd:c2:f1","f2:28:26:04:7d:98","172.20.0.2","172.20.0.3","TCP","4433 → 60334 [SYN, ACK] Seq=0 Ack=1 Win=65160 Len=0 MSS=1460 SACK_PERM TSval=1329548370 TSecr=1138632575 WS=128"
"51","0.085784944","66","f2:28:26:04:7d:98","92:2c:a9:fd:c2:f1","172.20.0.3","172.20.0.2","TCP","60334 → 4433 [ACK] Seq=1 Ack=1 Win=64256 Len=0 TSval=1138632575 TSecr=1329548370"
"52","0.085819011","561","f2:28:26:04:7d:98","92:2c:a9:fd:c2:f1","172.20.0.3","172.20.0.2","TLSv1.2","Client Hello"
"53","0.085823351","66","92:2c:a9:fd:c2:f1","f2:28:26:04:7d:98","172.20.0.2","172.20.0.3","TCP","4433 → 60334 [ACK] Seq=1 Ack=496 Win=64768 Len=0 TSval=1329548370 TSecr=1138632575"
"54","0.086280418","769","92:2c:a9:fd:c2:f1","f2:28:26:04:7d:98","172.20.0.2","172.20.0.3","TLSv1.3","Server Hello, Change Cipher Spec, Application Data, Application Data, Application Data, Application Data"
"55","0.086306067","66","f2:28:26:04:7d:98","92:2c:a9:fd:c2:f1","172.20.0.3","172.20.0.2","TCP","60334 → 4433 [ACK] Seq=496 Ack=704 Win=63616 Len=0 TSval=1138632575 TSecr=1329548370"
"56","0.087071226","146","f2:28:26:04:7d:98","92:2c:a9:fd:c2:f1","172.20.0.3","172.20.0.2","TLSv1.3","Change Cipher Spec, Application Data"
"57","0.087122242","66","f2:28:26:04:7d:98","92:2c:a9:fd:c2:f1","172.20.0.3","172.20.0.2","TCP","60334 → 4433 [RST, ACK] Seq=576 Ack=704 Win=63616 Len=0 TSval=1138632576 TSecr=1329548370"
"58","0.096785480","74","f2:28:26:04:7d:98","92:2c:a9:fd:c2:f1","172.20.0.3","172.20.0.2","TCP","60340 → 4433 [SYN] Seq=0 Win=64240 Len=0 MSS=1460 SACK_PERM TSval=1138632586 TSecr=0 WS=128"
"59","0.096804032","74","92:2c:a9:fd:c2:f1","f2:28:26:04:7d:98","172.20.0.2","172.20.0.3","TCP","4433 → 60340 [SYN, ACK] Seq=0 Ack=1 Win=65160 Len=0 MSS=1460 SACK_PERM TSval=1329548381 TSecr=1138632586 WS=128"
"60","0.096821339","66","f2:28:26:04:7d:98","92:2c:a9:fd:c2:f1","172.20.0.3","172.20.0.2","TCP","60340 → 4433 [ACK] Seq=1 Ack=1 Win=64256 Len=0 TSval=1138632586 TSecr=1329548381"
"61","0.096859930","561","f2:28:26:04:7d:98","92:2c:a9:fd:c2:f1","172.20.0.3","172.20.0.2","TLSv1.2","Client Hello"
"62","0.096864585","66","92:2c:a9:fd:c2:f1","f2:28:26:04:7d:98","172.20.0.2","172.20.0.3","TCP","4433 → 60340 [ACK] Seq=1 Ack=496 Win=64768 Len=0 TSval=1329548381 TSecr=1138632586"
"63","0.097293718","769","92:2c:a9:fd:c2:f1","f2:28:26:04:7d:98","172.20.0.2","172.20.0.3","TLSv1.3","Server Hello, Change Cipher Spec, Application Data, Application Data, Application Data, Application Data"
"64","0.097323838","66","f2:28:26:04:7d:98","92:2c:a9:fd:c2:f1","172.20.0.3","172.20.0.2","TCP","60340 → 4433 [ACK] Seq=496 Ack=704 Win=63616 Len=0 TSval=1138632586 TSecr=1329548381"
"65","0.098193917","146","f2:28:26:04:7d:98","92:2c:a9:fd:c2:f1","172.20.0.3","172.20.0.2","TLSv1.3","Change Cipher Spec, Application Data"
"66","0.098253804","66","f2:28:26:04:7d:98","92:2c:a9:fd:c2:f1","172.20.0.3","172.20.0.2","TCP","60340 → 4433 [RST, ACK] Seq=576 Ack=704 Win=63616 Len=0 TSval=1138632587 TSecr=1329548381"
"67","0.108052163","74","f2:28:26:04:7d:98","92:2c:a9:fd:c2:f1","172.20.0.3","172.20.0.2","TCP","60346 → 4433 [SYN] Seq=0 Win=64240 Len=0 MSS=1460 SACK_PERM TSval=1138632597 TSecr=0 WS=128"
"68","0.108072717","74","92:2c:a9:fd:c2:f1","f2:28:26:04:7d:98","172.20.0.2","172.20.0.3","TCP","4433 → 60346 [SYN, ACK] Seq=0 Ack=1 Win=65160 Len=0 MSS=1460 SACK_PERM TSval=1329548392 TSecr=1138632597 WS=128"
"69","0.108088699","66","f2:28:26:04:7d:98","92:2c:a9:fd:c2:f1","172.20.0.3","172.20.0.2","TCP","60346 → 4433 [ACK] Seq=1 Ack=1 Win=64256 Len=0 TSval=1138632597 TSecr=1329548392"
"70","0.108124023","561","f2:28:26:04:7d:98","92:2c:a9:fd:c2:f1","172.20.0.3","172.20.0.2","TLSv1.2","Client Hello"
"71","0.108128368","66","92:2c:a9:fd:c2:f1","f2:28:26:04:7d:98","172.20.0.2","172.20.0.3","TCP","4433 → 60346 [ACK] Seq=1 Ack=496 Win=64768 Len=0 TSval=1329548392 TSecr=1138632597"
"72","0.108727209","769","92:2c:a9:fd:c2:f1","f2:28:26:04:7d:98","172.20.0.2","172.20.0.3","TLSv1.3","Server Hello, Change Cipher Spec, Application Data, Application Data, Application Data, Application Data"
"73","0.108761902","66","f2:28:26:04:7d:98","92:2c:a9:fd:c2:f1","172.20.0.3","172.20.0.2","TCP","60346 → 4433 [ACK] Seq=496 Ack=704 Win=63616 Len=0 TSval=1138632598 TSecr=1329548393"
"74","0.109553308","146","f2:28:26:04:7d:98","92:2c:a9:fd:c2:f1","172.20.0.3","172.20.0.2","TLSv1.3","Change Cipher Spec, Application Data"
"75","0.109608656","66","f2:28:26:04:7d:98","92:2c:a9:fd:c2:f1","172.20.0.3","172.20.0.2","TCP","60346 → 4433 [RST, ACK] Seq=576 Ack=704 Win=63616 Len=0 TSval=1138632599 TSecr=1329548393"
"76","0.120338574","74","f2:28:26:04:7d:98","92:2c:a9:fd:c2:f1","172.20.0.3","172.20.0.2","TCP","60350 → 4433 [SYN] Seq=0 Win=64240 Len=0 MSS=1460 SACK_PERM TSval=1138632609 TSecr=0 WS=128"
"77","0.120363525","74","92:2c:a9:fd:c2:f1","f2:28:26:04:7d:98","172.20.0.2","172.20.0.3","TCP","4433 → 60350 [SYN, ACK] Seq=0 Ack=1 Win=65160 Len=0 MSS=1460 SACK_PERM TSval=1329548404 TSecr=1138632609 WS=128"
"78","0.120396652","66","f2:28:26:04:7d:98","92:2c:a9:fd:c2:f1","172.20.0.3","172.20.0.2","TCP","60350 → 4433 [ACK] Seq=1 Ack=1 Win=64256 Len=0 TSval=1138632610 TSecr=1329548404"
"79","0.120439402","561","f2:28:26:04:7d:98","92:2c:a9:fd:c2:f1","172.20.0.3","172.20.0.2","TLSv1.2","Client Hello"
"80","0.120443140","66","92:2c:a9:fd:c2:f1","f2:28:26:04:7d:98","172.20.0.2","172.20.0.3","TCP","4433 → 60350 [ACK] Seq=1 Ack=496 Win=64768 Len=0 TSval=1329548405 TSecr=1138632610"
"81","0.120948555","769","92:2c:a9:fd:c2:f1","f2:28:26:04:7d:98","172.20.0.2","172.20.0.3","TLSv1.3","Server Hello, Change Cipher Spec, Application Data, Application Data, Application Data, Application Data"
"82","0.120979390","66","f2:28:26:04:7d:98","92:2c:a9:fd:c2:f1","172.20.0.3","172.20.0.2","TCP","60350 → 4433 [ACK] Seq=496 Ack=704 Win=63616 Len=0 TSval=1138632610 TSecr=1329548405"
"83","0.121810198","146","f2:28:26:04:7d:98","92:2c:a9:fd:c2:f1","172.20.0.3","172.20.0.2","TLSv1.3","Change Cipher Spec, Application Data"
"84","0.121875234","66","f2:28:26:04:7d:98","92:2c:a9:fd:c2:f1","172.20.0.3","172.20.0.2","TCP","60350 → 4433 [RST, ACK] Seq=576 Ack=704 Win=63616 Len=0 TSval=1138632611 TSecr=1329548405"
"85","0.132338412","74","f2:28:26:04:7d:98","92:2c:a9:fd:c2:f1","172.20.0.3","172.20.0.2","TCP","60354 → 4433 [SYN] Seq=0 Win=64240 Len=0 MSS=1460 SACK_PERM TSval=1138632621 TSecr=0 WS=128"
"86","0.132374110","74","92:2c:a9:fd:c2:f1","f2:28:26:04:7d:98","172.20.0.2","172.20.0.3","TCP","4433 → 60354 [SYN, ACK] Seq=0 Ack=1 Win=65160 Len=0 MSS=1460 SACK_PERM TSval=1329548416 TSecr=1138632621 WS=128"
"87","0.132394256","66","f2:28:26:04:7d:98","92:2c:a9:fd:c2:f1","172.20.0.3","172.20.0.2","TCP","60354 → 4433 [ACK] Seq=1 Ack=1 Win=64256 Len=0 TSval=1138632622 TSecr=1329548416"
"88","0.132433292","561","f2:28:26:04:7d:98","92:2c:a9:fd:c2:f1","172.20.0.3","172.20.0.2","TLSv1.2","Client Hello"
"89","0.132438916","66","92:2c:a9:fd:c2:f1","f2:28:26:04:7d:98","172.20.0.2","172.20.0.3","TCP","4433 → 60354 [ACK] Seq=1 Ack=496 Win=64768 Len=0 TSval=1329548417 TSecr=1138632622"
"90","0.132954901","769","92:2c:a9:fd:c2:f1","f2:28:26:04:7d:98","172.20.0.2","172.20.0.3","TLSv1.3","Server Hello, Change Cipher Spec, Application Data, Application Data, Application Data, Application Data"
"91","0.132982103","66","f2:28:26:04:7d:98","92:2c:a9:fd:c2:f1","172.20.0.3","172.20.0.2","TCP","60354 → 4433 [ACK] Seq=496 Ack=704 Win=63616 Len=0 TSval=1138632622 TSecr=1329548417"
"92","0.133775230","146","f2:28:26:04:7d:98","92:2c:a9:fd:c2:f1","172.20.0.3","172.20.0.2","TLSv1.3","Change Cipher Spec, Application Data"
"93","0.133827314","66","f2:28:26:04:7d:98","92:2c:a9:fd:c2:f1","172.20.0.3","172.20.0.2","TCP","60354 → 4433 [RST, ACK] Seq=576 Ack=704 Win=63616 Len=0 TSval=1138632623 TSecr=1329548417"
"94","0.147285362","74","f2:28:26:04:7d:98","92:2c:a9:fd:c2:f1","172.20.0.3","172.20.0.2","TCP","60370 → 4433 [SYN] Seq=0 Win=64240 Len=0 MSS=1460 SACK_PERM TSval=1138632636 TSecr=0 WS=128"
"95","0.147309737","74","92:2c:a9:fd:c2:f1","f2:28:26:04:7d:98","172.20.0.2","172.20.0.3","TCP","4433 → 60370 [SYN, ACK] Seq=0 Ack=1 Win=65160 Len=0 MSS=1460 SACK_PERM TSval=1329548431 TSecr=1138632636 WS=128"
"96","0.147330805","66","f2:28:26:04:7d:98","92:2c:a9:fd:c2:f1","172.20.0.3","172.20.0.2","TCP","60370 → 4433 [ACK] Seq=1 Ack=1 Win=64256 Len=0 TSval=1138632636 TSecr=1329548431"
"97","0.147389772","561","f2:28:26:04:7d:98","92:2c:a9:fd:c2:f1","172.20.0.3","172.20.0.2","TLSv1.2","Client Hello"
"98","0.147396848","66","92:2c:a9:fd:c2:f1","f2:28:26:04:7d:98","172.20.0.2","172.20.0.3","TCP","4433 → 60370 [ACK] Seq=1 Ack=496 Win=64768 Len=0 TSval=1329548432 TSecr=1138632637"
"99","0.147782197","769","92:2c:a9:fd:c2:f1","f2:28:26:04:7d:98","172.20.0.2","172.20.0.3","TLSv1.3","Server Hello, Change Cipher Spec, Application Data, Application Data, Application Data, Application Data"
"100","0.147806645","66","f2:28:26:04:7d:98","92:2c:a9:fd:c2:f1","172.20.0.3","172.20.0.2","TCP","60370 → 4433 [ACK] Seq=496 Ack=704 Win=63616 Len=0 TSval=1138632637 TSecr=1329548432"
"101","0.149053687","146","f2:28:26:04:7d:98","92:2c:a9:fd:c2:f1","172.20.0.3","172.20.0.2","TLSv1.3","Change Cipher Spec, Application Data"
"102","0.149123780","66","f2:28:26:04:7d:98","92:2c:a9:fd:c2:f1","172.20.0.3","172.20.0.2","TCP","60370 → 4433 [RST, ACK] Seq=576 Ack=704 Win=63616 Len=0 TSval=1138632638 TSecr=1329548432"
"103","0.158978303","74","f2:28:26:04:7d:98","92:2c:a9:fd:c2:f1","172.20.0.3","172.20.0.2","TCP","60374 → 4433 [SYN] Seq=0 Win=64240 Len=0 MSS=1460 SACK_PERM TSval=1138632648 TSecr=0 WS=128"
"104","0.159004126","74","92:2c:a9:fd:c2:f1","f2:28:26:04:7d:98","172.20.0.2","172.20.0.3","TCP","4433 → 60374 [SYN, ACK] Seq=0 Ack=1 Win=65160 Len=0 MSS=1460 SACK_PERM TSval=1329548443 TSecr=1138632648 WS=128"
"105","0.159018771","66","f2:28:26:04:7d:98","92:2c:a9:fd:c2:f1","172.20.0.3","172.20.0.2","TCP","60374 → 4433 [ACK] Seq=1 Ack=1 Win=64256 Len=0 TSval=1138632648 TSecr=1329548443"
"106","0.159048328","561","f2:28:26:04:7d:98","92:2c:a9:fd:c2:f1","172.20.0.3","172.20.0.2","TLSv1.2","Client Hello"
"107","0.159051422","66","92:2c:a9:fd:c2:f1","f2:28:26:04:7d:98","172.20.0.2","172.20.0.3","TCP","4433 → 60374 [ACK] Seq=1 Ack=496 Win=64768 Len=0 TSval=1329548443 TSecr=1138632648"
"108","0.159707671","769","92:2c:a9:fd:c2:f1","f2:28:26:04:7d:98","172.20.0.2","172.20.0.3","TLSv1.3","Server Hello, Change Cipher Spec, Application Data, Application Data, Application Data, Application Data"
"109","0.159735247","66","f2:28:26:04:7d:98","92:2c:a9:fd:c2:f1","172.20.0.3","172.20.0.2","TCP","60374 → 4433 [ACK] Seq=496 Ack=704 Win=63616 Len=0 TSval=1138632649 TSecr=1329548444"
"110","0.160494856","146","f2:28:26:04:7d:98","92:2c:a9:fd:c2:f1","172.20.0.3","172.20.0.2","TLSv1.3","Change Cipher Spec, Application Data"
"111","0.160544532","66","f2:28:26:04:7d:98","92:2c:a9:fd:c2:f1","172.20.0.3","172.20.0.2","TCP","60374 → 4433 [RST, ACK] Seq=576 Ack=704 Win=63616 Len=0 TSval=1138632650 TSecr=1329548444"
"112","0.170617776","74","f2:28:26:04:7d:98","92:2c:a9:fd:c2:f1","172.20.0.3","172.20.0.2","TCP","60386 → 4433 [SYN] Seq=0 Win=64240 Len=0 MSS=1460 SACK_PERM TSval=1138632660 TSecr=0 WS=128"
"113","0.170637531","74","92:2c:a9:fd:c2:f1","f2:28:26:04:7d:98","172.20.0.2","172.20.0.3","TCP","4433 → 60386 [SYN, ACK] Seq=0 Ack=1 Win=65160 Len=0 MSS=1460 SACK_PERM TSval=1329548455 TSecr=1138632660 WS=128"
"114","0.170653804","66","f2:28:26:04:7d:98","92:2c:a9:fd:c2:f1","172.20.0.3","172.20.0.2","TCP","60386 → 4433 [ACK] Seq=1 Ack=1 Win=64256 Len=0 TSval=1138632660 TSecr=1329548455"
"115","0.170705569","561","f2:28:26:04:7d:98","92:2c:a9:fd:c2:f1","172.20.0.3","172.20.0.2","TLSv1.2","Client Hello"
"116","0.170709662","66","92:2c:a9:fd:c2:f1","f2:28:26:04:7d:98","172.20.0.2","172.20.0.3","TCP","4433 → 60386 [ACK] Seq=1 Ack=496 Win=64768 Len=0 TSval=1329548455 TSecr=1138632660"
"117","0.171202847","769","92:2c:a9:fd:c2:f1","f2:28:26:04:7d:98","172.20.0.2","172.20.0.3","TLSv1.3","Server Hello, Change Cipher Spec, Application Data, Application Data, Application Data, Application Data"
"118","0.171235308","66","f2:28:26:04:7d:98","92:2c:a9:fd:c2:f1","172.20.0.3","172.20.0.2","TCP","60386 → 4433 [ACK] Seq=496 Ack=704 Win=63616 Len=0 TSval=1138632660 TSecr=1329548455"
"119","0.172064040","146","f2:28:26:04:7d:98","92:2c:a9:fd:c2:f1","172.20.0.3","172.20.0.2","TLSv1.3","Change Cipher Spec, Application Data"
"120","0.172122308","66","f2:28:26:04:7d:98","92:2c:a9:fd:c2:f1","172.20.0.3","172.20.0.2","TCP","60386 → 4433 [RST, ACK] Seq=576 Ack=704 Win=63616 Len=0 TSval=1138632661 TSecr=1329548455"
"121","0.182025367","74","f2:28:26:04:7d:98","92:2c:a9:fd:c2:f1","172.20.0.3","172.20.0.2","TCP","60396 → 4433 [SYN] Seq=0 Win=64240 Len=0 MSS=1460 SACK_PERM TSval=1138632671 TSecr=0 WS=128"
"122","0.182049786","74","92:2c:a9:fd:c2:f1","f2:28:26:04:7d:98","172.20.0.2","172.20.0.3","TCP","4433 → 60396 [SYN, ACK] Seq=0 Ack=1 Win=65160 Len=0 MSS=1460 SACK_PERM TSval=1329548466 TSecr=1138632671 WS=128"
"123","0.182066341","66","f2:28:26:04:7d:98","92:2c:a9:fd:c2:f1","172.20.0.3","172.20.0.2","TCP","60396 → 4433 [ACK] Seq=1 Ack=1 Win=64256 Len=0 TSval=1138632671 TSecr=1329548466"
"124","0.182103384","561","f2:28:26:04:7d:98","92:2c:a9:fd:c2:f1","172.20.0.3","172.20.0.2","TLSv1.2","Client Hello"
"125","0.182108441","66","92:2c:a9:fd:c2:f1","f2:28:26:04:7d:98","172.20.0.2","172.20.0.3","TCP","4433 → 60396 [ACK] Seq=1 Ack=496 Win=64768 Len=0 TSval=1329548466 TSecr=1138632671"
"126","0.182590118","769","92:2c:a9:fd:c2:f1","f2:28:26:04:7d:98","172.20.0.2","172.20.0.3","TLSv1.3","Server Hello, Change Cipher Spec, Application Data, Application Data, Application Data, Application Data"
"127","0.182613188","66","f2:28:26:04:7d:98","92:2c:a9:fd:c2:f1","172.20.0.3","172.20.0.2","TCP","60396 → 4433 [ACK] Seq=496 Ack=704 Win=63616 Len=0 TSval=1138632672 TSecr=1329548467"
"128","0.183389962","146","f2:28:26:04:7d:98","92:2c:a9:fd:c2:f1","172.20.0.3","172.20.0.2","TLSv1.3","Change Cipher Spec, Application Data"
"129","0.183440245","66","f2:28:26:04:7d:98","92:2c:a9:fd:c2:f1","172.20.0.3","172.20.0.2","TCP","60396 → 4433 [RST, ACK] Seq=576 Ack=704 Win=63616 Len=0 TSval=1138632673 TSecr=1329548467"
"130","0.193574476","74","f2:28:26:04:7d:98","92:2c:a9:fd:c2:f1","172.20.0.3","172.20.0.2","TCP","60402 → 4433 [SYN] Seq=0 Win=64240 Len=0 MSS=1460 SACK_PERM TSval=1138632683 TSecr=0 WS=128"
"131","0.193596692","74","92:2c:a9:fd:c2:f1","f2:28:26:04:7d:98","172.20.0.2","172.20.0.3","TCP","4433 → 60402 [SYN, ACK] Seq=0 Ack=1 Win=65160 Len=0 MSS=1460 SACK_PERM TSval=1329548478 TSecr=1138632683 WS=128"
"132","0.193614997","66","f2:28:26:04:7d:98","92:2c:a9:fd:c2:f1","172.20.0.3","172.20.0.2","TCP","60402 → 4433 [ACK] Seq=1 Ack=1 Win=64256 Len=0 TSval=1138632683 TSecr=1329548478"
"133","0.193666460","561","f2:28:26:04:7d:98","92:2c:a9:fd:c2:f1","172.20.0.3","172.20.0.2","TLSv1.2","Client Hello"
"134","0.193670196","66","92:2c:a9:fd:c2:f1","f2:28:26:04:7d:98","172.20.0.2","172.20.0.3","TCP","4433 → 60402 [ACK] Seq=1 Ack=496 Win=64768 Len=0 TSval=1329548478 TSecr=1138632683"
"135","0.194156747","769","92:2c:a9:fd:c2:f1","f2:28:26:04:7d:98","172.20.0.2","172.20.0.3","TLSv1.3","Server Hello, Change Cipher Spec, Application Data, Application Data, Application Data, Application Data"
"136","0.194187017","66","f2:28:26:04:7d:98","92:2c:a9:fd:c2:f1","172.20.0.3","172.20.0.2","TCP","60402 → 4433 [ACK] Seq=496 Ack=704 Win=63616 Len=0 TSval=1138632683 TSecr=1329548478"
"137","0.195018994","146","f2:28:26:04:7d:98","92:2c:a9:fd:c2:f1","172.20.0.3","172.20.0.2","TLSv1.3","Change Cipher Spec, Application Data"
"138","0.195074213","66","f2:28:26:04:7d:98","92:2c:a9:fd:c2:f1","172.20.0.3","172.20.0.2","TCP","60402 → 4433 [RST, ACK] Seq=576 Ack=704 Win=63616 Len=0 TSval=1138632684 TSecr=1329548478"
"139","0.204883522","74","f2:28:26:04:7d:98","92:2c:a9:fd:c2:f1","172.20.0.3","172.20.0.2","TCP","60414 → 4433 [SYN] Seq=0 Win=64240 Len=0 MSS=1460 SACK_PERM TSval=1138632694 TSecr=0 WS=128"
"140","0.204907284","74","92:2c:a9:fd:c2:f1","f2:28:26:04:7d:98","172.20.0.2","172.20.0.3","TCP","4433 → 60414 [SYN, ACK] Seq=0 Ack=1 Win=65160 Len=0 MSS=1460 SACK_PERM TSval=1329548489 TSecr=1138632694 WS=128"
"141","0.204923949","66","f2:28:26:04:7d:98","92:2c:a9:fd:c2:f1","172.20.0.3","172.20.0.2","TCP","60414 → 4433 [ACK] Seq=1 Ack=1 Win=64256 Len=0 TSval=1138632694 TSecr=1329548489"
"142","0.204965084","561","f2:28:26:04:7d:98","92:2c:a9:fd:c2:f1","172.20.0.3","172.20.0.2","TLSv1.2","Client Hello"
"143","0.204970097","66","92:2c:a9:fd:c2:f1","f2:28:26:04:7d:98","172.20.0.2","172.20.0.3","TCP","4433 → 60414 [ACK] Seq=1 Ack=496 Win=64768 Len=0 TSval=1329548489 TSecr=1138632694"
"144","0.205487643","769","92:2c:a9:fd:c2:f1","f2:28:26:04:7d:98","172.20.0.2","172.20.0.3","TLSv1.3","Server Hello, Change Cipher Spec, Application Data, Application Data, Application Data, Application Data"
"145","0.205515405","66","f2:28:26:04:7d:98","92:2c:a9:fd:c2:f1","172.20.0.3","172.20.0.2","TCP","60414 → 4433 [ACK] Seq=496 Ack=704 Win=63616 Len=0 TSval=1138632695 TSecr=1329548490"
"146","0.206292612","146","f2:28:26:04:7d:98","92:2c:a9:fd:c2:f1","172.20.0.3","172.20.0.2","TLSv1.3","Change Cipher Spec, Application Data"
"147","0.206345537","66","f2:28:26:04:7d:98","92:2c:a9:fd:c2:f1","172.20.0.3","172.20.0.2","TCP","60414 → 4433 [RST, ACK] Seq=576 Ack=704 Win=63616 Len=0 TSval=1138632695 TSecr=1329548490"
"148","0.217093123","74","f2:28:26:04:7d:98","92:2c:a9:fd:c2:f1","172.20.0.3","172.20.0.2","TCP","60426 → 4433 [SYN] Seq=0 Win=64240 Len=0 MSS=1460 SACK_PERM TSval=1138632706 TSecr=0 WS=128"
"149","0.217116270","74","92:2c:a9:fd:c2:f1","f2:28:26:04:7d:98","172.20.0.2","172.20.0.3","TCP","4433 → 60426 [SYN, ACK] Seq=0 Ack=1 Win=65160 Len=0 MSS=1460 SACK_PERM TSval=1329548501 TSecr=1138632706 WS=128"
"150","0.217132414","66","f2:28:26:04:7d:98","92:2c:a9:fd:c2:f1","172.20.0.3","172.20.0.2","TCP","60426 → 4433 [ACK] Seq=1 Ack=1 Win=64256 Len=0 TSval=1138632706 TSecr=1329548501"
"151","0.217172756","561","f2:28:26:04:7d:98","92:2c:a9:fd:c2:f1","172.20.0.3","172.20.0.2","TLSv1.2","Client Hello"
"152","0.217176546","66","92:2c:a9:fd:c2:f1","f2:28:26:04:7d:98","172.20.0.2","172.20.0.3","TCP","4433 → 60426 [ACK] Seq=1 Ack=496 Win=64768 Len=0 TSval=1329548501 TSecr=1138632706"
"153","0.217697303","769","92:2c:a9:fd:c2:f1","f2:28:26:04:7d:98","172.20.0.2","172.20.0.3","TLSv1.3","Server Hello, Change Cipher Spec, Application Data, Application Data, Application Data, Application Data"
"154","0.217728430","66","f2:28:26:04:7d:98","92:2c:a9:fd:c2:f1","172.20.0.3","172.20.0.2","TCP","60426 → 4433 [ACK] Seq=496 Ack=704 Win=63616 Len=0 TSval=1138632707 TSecr=1329548502"
"155","0.218534833","146","f2:28:26:04:7d:98","92:2c:a9:fd:c2:f1","172.20.0.3","172.20.0.2","TLSv1.3","Change Cipher Spec, Application Data"
"156","0.218587144","66","f2:28:26:04:7d:98","92:2c:a9:fd:c2:f1","172.20.0.3","172.20.0.2","TCP","60426 → 4433 [RST, ACK] Seq=576 Ack=704 Win=63616 Len=0 TSval=1138632708 TSecr=1329548502"
"157","0.228349004","74","f2:28:26:04:7d:98","92:2c:a9:fd:c2:f1","172.20.0.3","172.20.0.2","TCP","60436 → 4433 [SYN] Seq=0 Win=64240 Len=0 MSS=1460 SACK_PERM TSval=1138632717 TSecr=0 WS=128"
"158","0.228380425","74","92:2c:a9:fd:c2:f1","f2:28:26:04:7d:98","172.20.0.2","172.20.0.3","TCP","4433 → 60436 [SYN, ACK] Seq=0 Ack=1 Win=65160 Len=0 MSS=1460 SACK_PERM TSval=1329548513 TSecr=1138632717 WS=128"
"159","0.228401044","66","f2:28:26:04:7d:98","92:2c:a9:fd:c2:f1","172.20.0.3","172.20.0.2","TCP","60436 → 4433 [ACK] Seq=1 Ack=1 Win=64256 Len=0 TSval=1138632718 TSecr=1329548513"
"160","0.228435108","561","f2:28:26:04:7d:98","92:2c:a9:fd:c2:f1","172.20.0.3","172.20.0.2","TLSv1.2","Client Hello"
"161","0.228439740","66","92:2c:a9:fd:c2:f1","f2:28:26:04:7d:98","172.20.0.2","172.20.0.3","TCP","4433 → 60436 [ACK] Seq=1 Ack=496 Win=64768 Len=0 TSval=1329548513 TSecr=1138632718"
"162","0.228838390","769","92:2c:a9:fd:c2:f1","f2:28:26:04:7d:98","172.20.0.2","172.20.0.3","TLSv1.3","Server Hello, Change Cipher Spec, Application Data, Application Data, Application Data, Application Data"
"163","0.228864361","66","f2:28:26:04:7d:98","92:2c:a9:fd:c2:f1","172.20.0.3","172.20.0.2","TCP","60436 → 4433 [ACK] Seq=496 Ack=704 Win=63616 Len=0 TSval=1138632718 TSecr=1329548513"
"164","0.229637405","146","f2:28:26:04:7d:98","92:2c:a9:fd:c2:f1","172.20.0.3","172.20.0.2","TLSv1.3","Change Cipher Spec, Application Data"
"165","0.229688014","66","f2:28:26:04:7d:98","92:2c:a9:fd:c2:f1","172.20.0.3","172.20.0.2","TCP","60436 → 4433 [RST, ACK] Seq=576 Ack=704 Win=63616 Len=0 TSval=1138632719 TSecr=1329548513"
"166","0.239168054","74","f2:28:26:04:7d:98","92:2c:a9:fd:c2:f1","172.20.0.3","172.20.0.2","TCP","60448 → 4433 [SYN] Seq=0 Win=64240 Len=0 MSS=1460 SACK_PERM TSval=1138632728 TSecr=0 WS=128"
"167","0.239186851","74","92:2c:a9:fd:c2:f1","f2:28:26:04:7d:98","172.20.0.2","172.20.0.3","TCP","4433 → 60448 [SYN, ACK] Seq=0 Ack=1 Win=65160 Len=0 MSS=1460 SACK_PERM TSval=1329548523 TSecr=1138632728 WS=128"
"168","0.239201912","66","f2:28:26:04:7d:98","92:2c:a9:fd:c2:f1","172.20.0.3","172.20.0.2","TCP","60448 → 4433 [ACK] Seq=1 Ack=1 Win=64256 Len=0 TSval=1138632728 TSecr=1329548523"
"169","0.239236258","561","f2:28:26:04:7d:98","92:2c:a9:fd:c2:f1","172.20.0.3","172.20.0.2","TLSv1.2","Client Hello"
"170","0.239241011","66","92:2c:a9:fd:c2:f1","f2:28:26:04:7d:98","172.20.0.2","172.20.0.3","TCP","4433 → 60448 [ACK] Seq=1 Ack=496 Win=64768 Len=0 TSval=1329548523 TSecr=1138632728"
"171","0.239675972","769","92:2c:a9:fd:c2:f1","f2:28:26:04:7d:98","172.20.0.2","172.20.0.3","TLSv1.3","Server Hello, Change Cipher Spec, Application Data, Application Data, Application Data, Application Data"
"172","0.239703084","66","f2:28:26:04:7d:98","92:2c:a9:fd:c2:f1","172.20.0.3","172.20.0.2","TCP","60448 → 4433 [ACK] Seq=496 Ack=704 Win=63616 Len=0 TSval=1138632729 TSecr=1329548524"
"173","0.240487766","146","f2:28:26:04:7d:98","92:2c:a9:fd:c2:f1","172.20.0.3","172.20.0.2","TLSv1.3","Change Cipher Spec, Application Data"
"174","0.240537412","66","f2:28:26:04:7d:98","92:2c:a9:fd:c2:f1","172.20.0.3","172.20.0.2","TCP","60448 → 4433 [RST, ACK] Seq=576 Ack=704 Win=63616 Len=0 TSval=1138632730 TSecr=1329548524"
"175","0.250016248","74","f2:28:26:04:7d:98","92:2c:a9:fd:c2:f1","172.20.0.3","172.20.0.2","TCP","60460 → 4433 [SYN] Seq=0 Win=64240 Len=0 MSS=1460 SACK_PERM TSval=1138632739 TSecr=0 WS=128"
"176","0.250033790","74","92:2c:a9:fd:c2:f1","f2:28:26:04:7d:98","172.20.0.2","172.20.0.3","TCP","4433 → 60460 [SYN, ACK] Seq=0 Ack=1 Win=65160 Len=0 MSS=1460 SACK_PERM TSval=1329548534 TSecr=1138632739 WS=128"
"177","0.250047541","66","f2:28:26:04:7d:98","92:2c:a9:fd:c2:f1","172.20.0.3","172.20.0.2","TCP","60460 → 4433 [ACK] Seq=1 Ack=1 Win=64256 Len=0 TSval=1138632739 TSecr=1329548534"
"178","0.250086084","561","f2:28:26:04:7d:98","92:2c:a9:fd:c2:f1","172.20.0.3","172.20.0.2","TLSv1.2","Client Hello"
"179","0.250090138","66","92:2c:a9:fd:c2:f1","f2:28:26:04:7d:98","172.20.0.2","172.20.0.3","TCP","4433 → 60460 [ACK] Seq=1 Ack=496 Win=64768 Len=0 TSval=1329548534 TSecr=1138632739"
"180","0.250553507","769","92:2c:a9:fd:c2:f1","f2:28:26:04:7d:98","172.20.0.2","172.20.0.3","TLSv1.3","Server Hello, Change Cipher Spec, Application Data, Application Data, Application Data, Application Data"
"181","0.250579245","66","f2:28:26:04:7d:98","92:2c:a9:fd:c2:f1","172.20.0.3","172.20.0.2","TCP","60460 → 4433 [ACK] Seq=496 Ack=704 Win=63616 Len=0 TSval=1138632740 TSecr=1329548535"
"182","0.251316908","146","f2:28:26:04:7d:98","92:2c:a9:fd:c2:f1","172.20.0.3","172.20.0.2","TLSv1.3","Change Cipher Spec, Application Data"
"183","0.251382868","66","f2:28:26:04:7d:98","92:2c:a9:fd:c2:f1","172.20.0.3","172.20.0.2","TCP","60460 → 4433 [RST, ACK] Seq=576 Ack=704 Win=63616 Len=0 TSval=1138632741 TSecr=1329548535"
"184","0.260383408","74","f2:28:26:04:7d:98","92:2c:a9:fd:c2:f1","172.20.0.3","172.20.0.2","TCP","60464 → 4433 [SYN] Seq=0 Win=64240 Len=0 MSS=1460 SACK_PERM TSval=1138632749 TSecr=0 WS=128"
"185","0.260401867","74","92:2c:a9:fd:c2:f1","f2:28:26:04:7d:98","172.20.0.2","172.20.0.3","TCP","4433 → 60464 [SYN, ACK] Seq=0 Ack=1 Win=65160 Len=0 MSS=1460 SACK_PERM TSval=1329548545 TSecr=1138632749 WS=128"
"186","0.260415203","66","f2:28:26:04:7d:98","92:2c:a9:fd:c2:f1","172.20.0.3","172.20.0.2","TCP","60464 → 4433 [ACK] Seq=1 Ack=1 Win=64256 Len=0 TSval=1138632750 TSecr=1329548545"
"187","0.260446181","561","f2:28:26:04:7d:98","92:2c:a9:fd:c2:f1","172.20.0.3","172.20.0.2","TLSv1.2","Client Hello"
"188","0.260450520","66","92:2c:a9:fd:c2:f1","f2:28:26:04:7d:98","172.20.0.2","172.20.0.3","TCP","4433 → 60464 [ACK] Seq=1 Ack=496 Win=64768 Len=0 TSval=1329548545 TSecr=1138632750"
"189","0.260838228","769","92:2c:a9:fd:c2:f1","f2:28:26:04:7d:98","172.20.0.2","172.20.0.3","TLSv1.3","Server Hello, Change Cipher Spec, Application Data, Application Data, Application Data, Application Data"
"190","0.260861078","66","f2:28:26:04:7d:98","92:2c:a9:fd:c2:f1","172.20.0.3","172.20.0.2","TCP","60464 → 4433 [ACK] Seq=496 Ack=704 Win=63616 Len=0 TSval=1138632750 TSecr=1329548545"
"191","0.261602929","146","f2:28:26:04:7d:98","92:2c:a9:fd:c2:f1","172.20.0.3","172.20.0.2","TLSv1.3","Change Cipher Spec, Application Data"
"192","0.261653192","66","f2:28:26:04:7d:98","92:2c:a9:fd:c2:f1","172.20.0.3","172.20.0.2","TCP","60464 → 4433 [RST, ACK] Seq=576 Ack=704 Win=63616 Len=0 TSval=1138632751 TSecr=1329548545"
"193","0.270742792","74","f2:28:26:04:7d:98","92:2c:a9:fd:c2:f1","172.20.0.3","172.20.0.2","TCP","60478 → 4433 [SYN] Seq=0 Win=64240 Len=0 MSS=1460 SACK_PERM TSval=1138632760 TSecr=0 WS=128"
"194","0.270760630","74","92:2c:a9:fd:c2:f1","f2:28:26:04:7d:98","172.20.0.2","172.20.0.3","TCP","4433 → 60478 [SYN, ACK] Seq=0 Ack=1 Win=65160 Len=0 MSS=1460 SACK_PERM TSval=1329548555 TSecr=1138632760 WS=128"
"195","0.270774278","66","f2:28:26:04:7d:98","92:2c:a9:fd:c2:f1","172.20.0.3","172.20.0.2","TCP","60478 → 4433 [ACK] Seq=1 Ack=1 Win=64256 Len=0 TSval=1138632760 TSecr=1329548555"
"196","0.270805453","561","f2:28:26:04:7d:98","92:2c:a9:fd:c2:f1","172.20.0.3","172.20.0.2","TLSv1.2","Client Hello"
"197","0.270809806","66","92:2c:a9:fd:c2:f1","f2:28:26:04:7d:98","172.20.0.2","172.20.0.3","TCP","4433 → 60478 [ACK] Seq=1 Ack=496 Win=64768 Len=0 TSval=1329548555 TSecr=1138632760"
"198","0.271215051","769","92:2c:a9:fd:c2:f1","f2:28:26:04:7d:98","172.20.0.2","172.20.0.3","TLSv1.3","Server Hello, Change Cipher Spec, Application Data, Application Data, Application Data, Application Data"
"199","0.271242772","66","f2:28:26:04:7d:98","92:2c:a9:fd:c2:f1","172.20.0.3","172.20.0.2","TCP","60478 → 4433 [ACK] Seq=496 Ack=704 Win=63616 Len=0 TSval=1138632760 TSecr=1329548555"
"200","0.272018834","146","f2:28:26:04:7d:98","92:2c:a9:fd:c2:f1","172.20.0.3","172.20.0.2","TLSv1.3","Change Cipher Spec, Application Data"
"201","0.272068027","66","f2:28:26:04:7d:98","92:2c:a9:fd:c2:f1","172.20.0.3","172.20.0.2","TCP","60478 → 4433 [RST, ACK] Seq=576 Ack=704 Win=63616 Len=0 TSval=1138632761 TSecr=1329548555"
"202","0.282486115","74","f2:28:26:04:7d:98","92:2c:a9:fd:c2:f1","172.20.0.3","172.20.0.2","TCP","60482 → 4433 [SYN] Seq=0 Win=64240 Len=0 MSS=1460 SACK_PERM TSval=1138632772 TSecr=0 WS=128"
"203","0.282512541","74","92:2c:a9:fd:c2:f1","f2:28:26:04:7d:98","172.20.0.2","172.20.0.3","TCP","4433 → 60482 [SYN, ACK] Seq=0 Ack=1 Win=65160 Len=0 MSS=1460 SACK_PERM TSval=1329548567 TSecr=1138632772 WS=128"
"204","0.282532458","66","f2:28:26:04:7d:98","92:2c:a9:fd:c2:f1","172.20.0.3","172.20.0.2","TCP","60482 → 4433 [ACK] Seq=1 Ack=1 Win=64256 Len=0 TSval=1138632772 TSecr=1329548567"
"205","0.282569817","561","f2:28:26:04:7d:98","92:2c:a9:fd:c2:f1","172.20.0.3","172.20.0.2","TLSv1.2","Client Hello"
"206","0.282576555","66","92:2c:a9:fd:c2:f1","f2:28:26:04:7d:98","172.20.0.2","172.20.0.3","TCP","4433 → 60482 [ACK] Seq=1 Ack=496 Win=64768 Len=0 TSval=1329548567 TSecr=1138632772"
"207","0.283042005","769","92:2c:a9:fd:c2:f1","f2:28:26:04:7d:98","172.20.0.2","172.20.0.3","TLSv1.3","Server Hello, Change Cipher Spec, Application Data, Application Data, Application Data, Application Data"
"208","0.283072727","66","f2:28:26:04:7d:98","92:2c:a9:fd:c2:f1","172.20.0.3","172.20.0.2","TCP","60482 → 4433 [ACK] Seq=496 Ack=704 Win=63616 Len=0 TSval=1138632772 TSecr=1329548567"
"209","0.283904886","146","f2:28:26:04:7d:98","92:2c:a9:fd:c2:f1","172.20.0.3","172.20.0.2","TLSv1.3","Change Cipher Spec, Application Data"
"210","0.283962453","66","f2:28:26:04:7d:98","92:2c:a9:fd:c2:f1","172.20.0.3","172.20.0.2","TCP","60482 → 4433 [RST, ACK] Seq=576 Ack=704 Win=63616 Len=0 TSval=1138632773 TSecr=1329548567"
"211","0.294450921","74","f2:28:26:04:7d:98","92:2c:a9:fd:c2:f1","172.20.0.3","172.20.0.2","TCP","60494 → 4433 [SYN] Seq=0 Win=64240 Len=0 MSS=1460 SACK_PERM TSval=1138632784 TSecr=0 WS=128"
"212","0.294478254","74","92:2c:a9:fd:c2:f1","f2:28:26:04:7d:98","172.20.0.2","172.20.0.3","TCP","4433 → 60494 [SYN, ACK] Seq=0 Ack=1 Win=65160 Len=0 MSS=1460 SACK_PERM TSval=1329548579 TSecr=1138632784 WS=128"
"213","0.294496390","66","f2:28:26:04:7d:98","92:2c:a9:fd:c2:f1","172.20.0.3","172.20.0.2","TCP","60494 → 4433 [ACK] Seq=1 Ack=1 Win=64256 Len=0 TSval=1138632784 TSecr=1329548579"
"214","0.294533150","561","f2:28:26:04:7d:98","92:2c:a9:fd:c2:f1","172.20.0.3","172.20.0.2","TLSv1.2","Client Hello"
"215","0.294537933","66","92:2c:a9:fd:c2:f1","f2:28:26:04:7d:98","172.20.0.2","172.20.0.3","TCP","4433 → 60494 [ACK] Seq=1 Ack=496 Win=64768 Len=0 TSval=1329548579 TSecr=1138632784"
"216","0.295018868","769","92:2c:a9:fd:c2:f1","f2:28:26:04:7d:98","172.20.0.2","172.20.0.3","TLSv1.3","Server Hello, Change Cipher Spec, Application Data, Application Data, Application Data, Application Data"
"217","0.295056403","66","f2:28:26:04:7d:98","92:2c:a9:fd:c2:f1","172.20.0.3","172.20.0.2","TCP","60494 → 4433 [ACK] Seq=496 Ack=704 Win=63616 Len=0 TSval=1138632784 TSecr=1329548579"
"218","0.295875771","146","f2:28:26:04:7d:98","92:2c:a9:fd:c2:f1","172.20.0.3","172.20.0.2","TLSv1.3","Change Cipher Spec, Application Data"
"219","0.295929979","66","f2:28:26:04:7d:98","92:2c:a9:fd:c2:f1","172.20.0.3","172.20.0.2","TCP","60494 → 4433 [RST, ACK] Seq=576 Ack=704 Win=63616 Len=0 TSval=1138632785 TSecr=1329548579"
"220","0.306036185","74","f2:28:26:04:7d:98","92:2c:a9:fd:c2:f1","172.20.0.3","172.20.0.2","TCP","60498 → 4433 [SYN] Seq=0 Win=64240 Len=0 MSS=1460 SACK_PERM TSval=1138632795 TSecr=0 WS=128"
"221","0.306061153","74","92:2c:a9:fd:c2:f1","f2:28:26:04:7d:98","172.20.0.2","172.20.0.3","TCP","4433 → 60498 [SYN, ACK] Seq=0 Ack=1 Win=65160 Len=0 MSS=1460 SACK_PERM TSval=1329548590 TSecr=1138632795 WS=128"
"222","0.306078819","66","f2:28:26:04:7d:98","92:2c:a9:fd:c2:f1","172.20.0.3","172.20.0.2","TCP","60498 → 4433 [ACK] Seq=1 Ack=1 Win=64256 Len=0 TSval=1138632795 TSecr=1329548590"
"223","0.306118917","561","f2:28:26:04:7d:98","92:2c:a9:fd:c2:f1","172.20.0.3","172.20.0.2","TLSv1.2","Client Hello"
"224","0.306124313","66","92:2c:a9:fd:c2:f1","f2:28:26:04:7d:98","172.20.0.2","172.20.0.3","TCP","4433 → 60498 [ACK] Seq=1 Ack=496 Win=64768 Len=0 TSval=1329548590 TSecr=1138632795"
"225","0.306662977","769","92:2c:a9:fd:c2:f1","f2:28:26:04:7d:98","172.20.0.2","172.20.0.3","TLSv1.3","Server Hello, Change Cipher Spec, Application Data, Application Data, Application Data, Application Data"
