frame.number,frame.time_relative,frame.len,eth.src,eth.dst,ip.src,ip.dst,_ws.col.protocol,_ws.col.info
"1","0.000000000","42","22:39:0c:a7:7b:00","ff:ff:ff:ff:ff:ff",,,"ARP","ARP Announcement for 172.20.0.3"
"2","0.032506655","42","22:39:0c:a7:7b:00","ff:ff:ff:ff:ff:ff",,,"ARP","Who has 172.20.0.2? Tell 172.20.0.3"
"3","0.032533322","42","6e:3e:36:ee:11:64","22:39:0c:a7:7b:00",,,"ARP","172.20.0.2 is at 6e:3e:36:ee:11:64"
"4","0.032542720","74","22:39:0c:a7:7b:00","6e:3e:36:ee:11:64","172.20.0.3","172.20.0.2","TCP","46968 → 4433 [SYN] Seq=0 Win=64240 Len=0 MSS=1460 SACK_PERM TSval=1305911162 TSecr=0 WS=128"
"5","0.032563721","74","6e:3e:36:ee:11:64","22:39:0c:a7:7b:00","172.20.0.2","172.20.0.3","TCP","4433 → 46968 [SYN, ACK] Seq=0 Ack=1 Win=65160 Len=0 MSS=1460 SACK_PERM TSval=1496826957 TSecr=1305911162 WS=128"
"6","0.032578996","66","22:39:0c:a7:7b:00","6e:3e:36:ee:11:64","172.20.0.3","172.20.0.2","TCP","46968 → 4433 [ACK] Seq=1 Ack=1 Win=64256 Len=0 TSval=1305911162 TSecr=1496826957"
"7","0.032624827","1320","22:39:0c:a7:7b:00","6e:3e:36:ee:11:64","172.20.0.3","172.20.0.2","TLSv1.2","Client Hello"
"8","0.032631023","66","6e:3e:36:ee:11:64","22:39:0c:a7:7b:00","172.20.0.2","172.20.0.3","TCP","4433 → 46968 [ACK] Seq=1 Ack=1255 Win=64128 Len=0 TSval=1496826957 TSecr=1305911162"
"9","0.034045385","1504","6e:3e:36:ee:11:64","22:39:0c:a7:7b:00","172.20.0.2","172.20.0.3","TLSv1.3","Server Hello, Change Cipher Spec, Application Data, Application Data, Application Data, Application Data"
"10","0.034089810","66","22:39:0c:a7:7b:00","6e:3e:36:ee:11:64","172.20.0.3","172.20.0.2","TCP","46968 → 4433 [ACK] Seq=1255 Ack=1439 Win=64128 Len=0 TSval=1305911163 TSecr=1496826958"
"11","0.035322373","146","22:39:0c:a7:7b:00","6e:3e:36:ee:11:64","172.20.0.3","172.20.0.2","TLSv1.3","Change Cipher Spec, Application Data"
"12","0.035409274","66","22:39:0c:a7:7b:00","6e:3e:36:ee:11:64","172.20.0.3","172.20.0.2","TCP","46968 → 4433 [RST, ACK] Seq=1335 Ack=1439 Win=64128 Len=0 TSval=1305911164 TSecr=1496826958"
"13","0.049724331","74","22:39:0c:a7:7b:00","6e:3e:36:ee:11:64","172.20.0.3","172.20.0.2","TCP","46972 → 4433 [SYN] Seq=0 Win=64240 Len=0 MSS=1460 SACK_PERM TSval=1305911179 TSecr=0 WS=128"
"14","0.049760694","74","6e:3e:36:ee:11:64","22:39:0c:a7:7b:00","172.20.0.2","172.20.0.3","TCP","4433 → 46972 [SYN, ACK] Seq=0 Ack=1 Win=65160 Len=0 MSS=1460 SACK_PERM TSval=1496826974 TSecr=1305911179 WS=128"
"15","0.049787681","66","22:39:0c:a7:7b:00","6e:3e:36:ee:11:64","172.20.0.3","172.20.0.2","TCP","46972 → 4433 [ACK] Seq=1 Ack=1 Win=64256 Len=0 TSval=1305911179 TSecr=1496826974"
"16","0.049850472","1320","22:39:0c:a7:7b:00","6e:3e:36:ee:11:64","172.20.0.3","172.20.0.2","TLSv1.2","Client Hello"
"17","0.049858595","66","6e:3e:36:ee:11:64","22:39:0c:a7:7b:00","172.20.0.2","172.20.0.3","TCP","4433 → 46972 [ACK] Seq=1 Ack=1255 Win=64128 Len=0 TSval=1496826974 TSecr=1305911179"
"18","0.050497885","1504","6e:3e:36:ee:11:64","22:39:0c:a7:7b:00","172.20.0.2","172.20.0.3","TLSv1.3","Server Hello, Change Cipher Spec, Application Data, Application Data, Application Data, Application Data"
"19","0.050528669","66","22:39:0c:a7:7b:00","6e:3e:36:ee:11:64","172.20.0.3","172.20.0.2","TCP","46972 → 4433 [ACK] Seq=1255 Ack=1439 Win=64128 Len=0 TSval=1305911180 TSecr=1496826975"
"20","0.052058806","146","22:39:0c:a7:7b:00","6e:3e:36:ee:11:64","172.20.0.3","172.20.0.2","TLSv1.3","Change Cipher Spec, Application Data"
"21","0.052142993","66","22:39:0c:a7:7b:00","6e:3e:36:ee:11:64","172.20.0.3","172.20.0.2","TCP","46972 → 4433 [RST, ACK] Seq=1335 Ack=1439 Win=64128 Len=0 TSval=1305911181 TSecr=1496826975"
"22","0.063348866","74","22:39:0c:a7:7b:00","6e:3e:36:ee:11:64","172.20.0.3","172.20.0.2","TCP","46986 → 4433 [SYN] Seq=0 Win=64240 Len=0 MSS=1460 SACK_PERM TSval=1305911192 TSecr=0 WS=128"
"23","0.063373094","74","6e:3e:36:ee:11:64","22:39:0c:a7:7b:00","172.20.0.2","172.20.0.3","TCP","4433 → 46986 [SYN, ACK] Seq=0 Ack=1 Win=65160 Len=0 MSS=1460 SACK_PERM TSval=1496826987 TSecr=1305911192 WS=128"
"24","0.063391120","66","22:39:0c:a7:7b:00","6e:3e:36:ee:11:64","172.20.0.3","172.20.0.2","TCP","46986 → 4433 [ACK] Seq=1 Ack=1 Win=64256 Len=0 TSval=1305911192 TSecr=1496826987"
"25","0.063452992","1320","22:39:0c:a7:7b:00","6e:3e:36:ee:11:64","172.20.0.3","172.20.0.2","TLSv1.2","Client Hello"
"26","0.063461912","66","6e:3e:36:ee:11:64","22:39:0c:a7:7b:00","172.20.0.2","172.20.0.3","TCP","4433 → 46986 [ACK] Seq=1 Ack=1255 Win=64128 Len=0 TSval=1496826988 TSecr=1305911193"
"27","0.064050893","1504","6e:3e:36:ee:11:64","22:39:0c:a7:7b:00","172.20.0.2","172.20.0.3","TLSv1.3","Server Hello, Change Cipher Spec, Application Data, Application Data, Application Data, Application Data"
"28","0.064087149","66","22:39:0c:a7:7b:00","6e:3e:36:ee:11:64","172.20.0.3","172.20.0.2","TCP","46986 → 4433 [ACK] Seq=1255 Ack=1439 Win=64128 Len=0 TSval=1305911193 TSecr=1496826988"
"29","0.065115287","146","22:39:0c:a7:7b:00","6e:3e:36:ee:11:64","172.20.0.3","172.20.0.2","TLSv1.3","Change Cipher Spec, Application Data"
"30","0.065168983","66","22:39:0c:a7:7b:00","6e:3e:36:ee:11:64","172.20.0.3","172.20.0.2","TCP","46986 → 4433 [RST, ACK] Seq=1335 Ack=1439 Win=64128 Len=0 TSval=1305911194 TSecr=1496826988"
"31","0.075970118","74","22:39:0c:a7:7b:00","6e:3e:36:ee:11:64","172.20.0.3","172.20.0.2","TCP","46990 → 4433 [SYN] Seq=0 Win=64240 Len=0 MSS=1460 SACK_PERM TSval=1305911205 TSecr=0 WS=128"
"32","0.075997322","74","6e:3e:36:ee:11:64","22:39:0c:a7:7b:00","172.20.0.2","172.20.0.3","TCP","4433 → 46990 [SYN, ACK] Seq=0 Ack=1 Win=65160 Len=0 MSS=1460 SACK_PERM TSval=1496827000 TSecr=1305911205 WS=128"
"33","0.076017023","66","22:39:0c:a7:7b:00","6e:3e:36:ee:11:64","172.20.0.3","172.20.0.2","TCP","46990 → 4433 [ACK] Seq=1 Ack=1 Win=64256 Len=0 TSval=1305911205 TSecr=1496827000"
"34","0.076077078","1320","22:39:0c:a7:7b:00","6e:3e:36:ee:11:64","172.20.0.3","172.20.0.2","TLSv1.2","Client Hello"
"35","0.076081763","66","6e:3e:36:ee:11:64","22:39:0c:a7:7b:00","172.20.0.2","172.20.0.3","TCP","4433 → 46990 [ACK] Seq=1 Ack=1255 Win=64128 Len=0 TSval=1496827000 TSecr=1305911205"
"36","0.076760054","1504","6e:3e:36:ee:11:64","22:39:0c:a7:7b:00","172.20.0.2","172.20.0.3","TLSv1.3","Server Hello, Change Cipher Spec, Application Data, Application Data, Application Data, Application Data"
"37","0.076790405","66","22:39:0c:a7:7b:00","6e:3e:36:ee:11:64","172.20.0.3","172.20.0.2","TCP","46990 → 4433 [ACK] Seq=1255 Ack=1439 Win=64128 Len=0 TSval=1305911206 TSecr=1496827001"
"38","0.077883482","146","22:39:0c:a7:7b:00","6e:3e:36:ee:11:64","172.20.0.3","172.20.0.2","TLSv1.3","Change Cipher Spec, Application Data"
"39","0.077942102","66","22:39:0c:a7:7b:00","6e:3e:36:ee:11:64","172.20.0.3","172.20.0.2","TCP","46990 → 4433 [RST, ACK] Seq=1335 Ack=1439 Win=64128 Len=0 TSval=1305911207 TSecr=1496827001"
"40","0.089105736","74","22:39:0c:a7:7b:00","6e:3e:36:ee:11:64","172.20.0.3","172.20.0.2","TCP","47000 → 4433 [SYN] Seq=0 Win=64240 Len=0 MSS=1460 SACK_PERM TSval=1305911218 TSecr=0 WS=128"
"41","0.089131144","74","6e:3e:36:ee:11:64","22:39:0c:a7:7b:00","172.20.0.2","172.20.0.3","TCP","4433 → 47000 [SYN, ACK] Seq=0 Ack=1 Win=65160 Len=0 MSS=1460 SACK_PERM TSval=1496827013 TSecr=1305911218 WS=128"
"42","0.089148634","66","22:39:0c:a7:7b:00","6e:3e:36:ee:11:64","172.20.0.3","172.20.0.2","TCP","47000 → 4433 [ACK] Seq=1 Ack=1 Win=64256 Len=0 TSval=1305911218 TSecr=1496827013"
"43","0.089201814","1320","22:39:0c:a7:7b:00","6e:3e:36:ee:11:64","172.20.0.3","172.20.0.2","TLSv1.2","Client Hello"
"44","0.089205937","66","6e:3e:36:ee:11:64","22:39:0c:a7:7b:00","172.20.0.2","172.20.0.3","TCP","4433 → 47000 [ACK] Seq=1 Ack=1255 Win=64128 Len=0 TSval=1496827013 TSecr=1305911218"
"45","0.089974735","1504","6e:3e:36:ee:11:64","22:39:0c:a7:7b:00","172.20.0.2","172.20.0.3","TLSv1.3","Server Hello, Change Cipher Spec, Application Data, Application Data, Application Data, Application Data"
"46","0.090006317","66","22:39:0c:a7:7b:00","6e:3e:36:ee:11:64","172.20.0.3","172.20.0.2","TCP","47000 → 4433 [ACK] Seq=1255 Ack=1439 Win=64128 Len=0 TSval=1305911219 TSecr=1496827014"
"47","0.091035368","146","22:39:0c:a7:7b:00","6e:3e:36:ee:11:64","172.20.0.3","172.20.0.2","TLSv1.3","Change Cipher Spec, Application Data"
"48","0.091093056","66","22:39:0c:a7:7b:00","6e:3e:36:ee:11:64","172.20.0.3","172.20.0.2","TCP","47000 → 4433 [RST, ACK] Seq=1335 Ack=1439 Win=64128 Len=0 TSval=1305911220 TSecr=1496827014"
"49","0.101974904","74","22:39:0c:a7:7b:00","6e:3e:36:ee:11:64","172.20.0.3","172.20.0.2","TCP","47016 → 4433 [SYN] Seq=0 Win=64240 Len=0 MSS=1460 SACK_PERM TSval=1305911231 TSecr=0 WS=128"
"50","0.101998418","74","6e:3e:36:ee:11:64","22:39:0c:a7:7b:00","172.20.0.2","172.20.0.3","TCP","4433 → 47016 [SYN, ACK] Seq=0 Ack=1 Win=65160 Len=0 MSS=1460 SACK_PERM TSval=1496827026 TSecr=1305911231 WS=128"
"51","0.102015038","66","22:39:0c:a7:7b:00","6e:3e:36:ee:11:64","172.20.0.3","172.20.0.2","TCP","47016 → 4433 [ACK] Seq=1 Ack=1 Win=64256 Len=0 TSval=1305911231 TSecr=1496827026"
"52","0.102057157","1320","22:39:0c:a7:7b:00","6e:3e:36:ee:11:64","172.20.0.3","172.20.0.2","TLSv1.2","Client Hello"
"53","0.102061237","66","6e:3e:36:ee:11:64","22:39:0c:a7:7b:00","172.20.0.2","172.20.0.3","TCP","4433 → 47016 [ACK] Seq=1 Ack=1255 Win=64128 Len=0 TSval=1496827026 TSecr=1305911231"
"54","0.103016765","1504","6e:3e:36:ee:11:64","22:39:0c:a7:7b:00","172.20.0.2","172.20.0.3","TLSv1.3","Server Hello, Change Cipher Spec, Application Data, Application Data, Application Data, Application Data"
"55","0.103050468","66","22:39:0c:a7:7b:00","6e:3e:36:ee:11:64","172.20.0.3","172.20.0.2","TCP","47016 → 4433 [ACK] Seq=1255 Ack=1439 Win=64128 Len=0 TSval=1305911232 TSecr=1496827027"
"56","0.104158130","146","22:39:0c:a7:7b:00","6e:3e:36:ee:11:64","172.20.0.3","172.20.0.2","TLSv1.3","Change Cipher Spec, Application Data"
"57","0.104217921","66","22:39:0c:a7:7b:00","6e:3e:36:ee:11:64","172.20.0.3","172.20.0.2","TCP","47016 → 4433 [RST, ACK] Seq=1335 Ack=1439 Win=64128 Len=0 TSval=1305911233 TSecr=1496827027"
"58","0.115585373","74","22:39:0c:a7:7b:00","6e:3e:36:ee:11:64","172.20.0.3","172.20.0.2","TCP","47026 → 4433 [SYN] Seq=0 Win=64240 Len=0 MSS=1460 SACK_PERM TSval=1305911245 TSecr=0 WS=128"
"59","0.115612951","74","6e:3e:36:ee:11:64","22:39:0c:a7:7b:00","172.20.0.2","172.20.0.3","TCP","4433 → 47026 [SYN, ACK] Seq=0 Ack=1 Win=65160 Len=0 MSS=1460 SACK_PERM TSval=1496827040 TSecr=1305911245 WS=128"
"60","0.115634071","66","22:39:0c:a7:7b:00","6e:3e:36:ee:11:64","172.20.0.3","172.20.0.2","TCP","47026 → 4433 [ACK] Seq=1 Ack=1 Win=64256 Len=0 TSval=1305911245 TSecr=1496827040"
"61","0.115680557","1320","22:39:0c:a7:7b:00","6e:3e:36:ee:11:64","172.20.0.3","172.20.0.2","TLSv1.2","Client Hello"
"62","0.115684946","66","6e:3e:36:ee:11:64","22:39:0c:a7:7b:00","172.20.0.2","172.20.0.3","TCP","4433 → 47026 [ACK] Seq=1 Ack=1255 Win=64128 Len=0 TSval=1496827040 TSecr=1305911245"
"63","0.116417867","1504","6e:3e:36:ee:11:64","22:39:0c:a7:7b:00","172.20.0.2","172.20.0.3","TLSv1.3","Server Hello, Change Cipher Spec, Application Data, Application Data, Application Data, Application Data"
"64","0.116461340","66","22:39:0c:a7:7b:00","6e:3e:36:ee:11:64","172.20.0.3","172.20.0.2","TCP","47026 → 4433 [ACK] Seq=1255 Ack=1439 Win=64128 Len=0 TSval=1305911246 TSecr=1496827040"
"65","0.117637639","146","22:39:0c:a7:7b:00","6e:3e:36:ee:11:64","172.20.0.3","172.20.0.2","TLSv1.3","Change Cipher Spec, Application Data"
"66","0.117704470","66","22:39:0c:a7:7b:00","6e:3e:36:ee:11:64","172.20.0.3","172.20.0.2","TCP","47026 → 4433 [RST, ACK] Seq=1335 Ack=1439 Win=64128 Len=0 TSval=1305911247 TSecr=1496827040"
"67","0.128571485","74","22:39:0c:a7:7b:00","6e:3e:36:ee:11:64","172.20.0.3","172.20.0.2","TCP","47042 → 4433 [SYN] Seq=0 Win=64240 Len=0 MSS=1460 SACK_PERM TSval=1305911258 TSecr=0 WS=128"
"68","0.128602525","74","6e:3e:36:ee:11:64","22:39:0c:a7:7b:00","172.20.0.2","172.20.0.3","TCP","4433 → 47042 [SYN, ACK] Seq=0 Ack=1 Win=65160 Len=0 MSS=1460 SACK_PERM TSval=1496827053 TSecr=1305911258 WS=128"
"69","0.128622435","66","22:39:0c:a7:7b:00","6e:3e:36:ee:11:64","172.20.0.3","172.20.0.2","TCP","47042 → 4433 [ACK] Seq=1 Ack=1 Win=64256 Len=0 TSval=1305911258 TSecr=1496827053"
"70","0.128677465","1320","22:39:0c:a7:7b:00","6e:3e:36:ee:11:64","172.20.0.3","172.20.0.2","TLSv1.2","Client Hello"
"71","0.128681348","66","6e:3e:36:ee:11:64","22:39:0c:a7:7b:00","172.20.0.2","172.20.0.3","TCP","4433 → 47042 [ACK] Seq=1 Ack=1255 Win=64128 Len=0 TSval=1496827053 TSecr=1305911258"
"72","0.129506582","1504","6e:3e:36:ee:11:64","22:39:0c:a7:7b:00","172.20.0.2","172.20.0.3","TLSv1.3","Server Hello, Change Cipher Spec, Application Data, Application Data, Application Data, Application Data"
"73","0.129537087","66","22:39:0c:a7:7b:00","6e:3e:36:ee:11:64","172.20.0.3","172.20.0.2","TCP","47042 → 4433 [ACK] Seq=1255 Ack=1439 Win=64128 Len=0 TSval=1305911259 TSecr=1496827054"
"74","0.130654866","146","22:39:0c:a7:7b:00","6e:3e:36:ee:11:64","172.20.0.3","172.20.0.2","TLSv1.3","Change Cipher Spec, Application Data"
"75","0.130712208","66","22:39:0c:a7:7b:00","6e:3e:36:ee:11:64","172.20.0.3","172.20.0.2","TCP","47042 → 4433 [RST, ACK] Seq=1335 Ack=1439 Win=64128 Len=0 TSval=1305911260 TSecr=1496827054"
"76","0.141358884","74","22:39:0c:a7:7b:00","6e:3e:36:ee:11:64","172.20.0.3","172.20.0.2","TCP","47058 → 4433 [SYN] Seq=0 Win=64240 Len=0 MSS=1460 SACK_PERM TSval=1305911270 TSecr=0 WS=128"
"77","0.141387085","74","6e:3e:36:ee:11:64","22:39:0c:a7:7b:00","172.20.0.2","172.20.0.3","TCP","4433 → 47058 [SYN, ACK] Seq=0 Ack=1 Win=65160 Len=0 MSS=1460 SACK_PERM TSval=1496827065 TSecr=1305911270 WS=128"
"78","0.141405383","66","22:39:0c:a7:7b:00","6e:3e:36:ee:11:64","172.20.0.3","172.20.0.2","TCP","47058 → 4433 [ACK] Seq=1 Ack=1 Win=64256 Len=0 TSval=1305911270 TSecr=1496827065"
"79","0.141469980","1320","22:39:0c:a7:7b:00","6e:3e:36:ee:11:64","172.20.0.3","172.20.0.2","TLSv1.2","Client Hello"
"80","0.141475883","66","6e:3e:36:ee:11:64","22:39:0c:a7:7b:00","172.20.0.2","172.20.0.3","TCP","4433 → 47058 [ACK] Seq=1 Ack=1255 Win=64128 Len=0 TSval=1496827066 TSecr=1305911271"
"81","0.142327387","1504","6e:3e:36:ee:11:64","22:39:0c:a7:7b:00","172.20.0.2","172.20.0.3","TLSv1.3","Server Hello, Change Cipher Spec, Application Data, Application Data, Application Data, Application Data"
"82","0.142377754","66","22:39:0c:a7:7b:00","6e:3e:36:ee:11:64","172.20.0.3","172.20.0.2","TCP","47058 → 4433 [ACK] Seq=1255 Ack=1439 Win=64128 Len=0 TSval=1305911271 TSecr=1496827066"
"83","0.143588152","146","22:39:0c:a7:7b:00","6e:3e:36:ee:11:64","172.20.0.3","172.20.0.2","TLSv1.3","Change Cipher Spec, Application Data"
"84","0.143648141","66","22:39:0c:a7:7b:00","6e:3e:36:ee:11:64","172.20.0.3","172.20.0.2","TCP","47058 → 4433 [RST, ACK] Seq=1335 Ack=1439 Win=64128 Len=0 TSval=1305911273 TSecr=1496827066"
"85","0.157967356","74","22:39:0c:a7:7b:00","6e:3e:36:ee:11:64","172.20.0.3","172.20.0.2","TCP","47060 → 4433 [SYN] Seq=0 Win=64240 Len=0 MSS=1460 SACK_PERM TSval=1305911287 TSecr=0 WS=128"
"86","0.158001901","74","6e:3e:36:ee:11:64","22:39:0c:a7:7b:00","172.20.0.2","172.20.0.3","TCP","4433 → 47060 [SYN, ACK] Seq=0 Ack=1 Win=65160 Len=0 MSS=1460 SACK_PERM TSval=1496827082 TSecr=1305911287 WS=128"
"87","0.158025462","66","22:39:0c:a7:7b:00","6e:3e:36:ee:11:64","172.20.0.3","172.20.0.2","TCP","47060 → 4433 [ACK] Seq=1 Ack=1 Win=64256 Len=0 TSval=1305911287 TSecr=1496827082"
"88","0.158079008","1320","22:39:0c:a7:7b:00","6e:3e:36:ee:11:64","172.20.0.3","172.20.0.2","TLSv1.2","Client Hello"
"89","0.158085608","66","6e:3e:36:ee:11:64","22:39:0c:a7:7b:00","172.20.0.2","172.20.0.3","TCP","4433 → 47060 [ACK] Seq=1 Ack=1255 Win=64128 Len=0 TSval=1496827082 TSecr=1305911287"
"90","0.158910741","1504","6e:3e:36:ee:11:64","22:39:0c:a7:7b:00","172.20.0.2","172.20.0.3","TLSv1.3","Server Hello, Change Cipher Spec, Application Data, Application Data, Application Data, Application Data"
"91","0.158954905","66","22:39:0c:a7:7b:00","6e:3e:36:ee:11:64","172.20.0.3","172.20.0.2","TCP","47060 → 4433 [ACK] Seq=1255 Ack=1439 Win=64128 Len=0 TSval=1305911288 TSecr=1496827083"
"92","0.160614306","146","22:39:0c:a7:7b:00","6e:3e:36:ee:11:64","172.20.0.3","172.20.0.2","TLSv1.3","Change Cipher Spec, Application Data"
"93","0.160691645","66","22:39:0c:a7:7b:00","6e:3e:36:ee:11:64","172.20.0.3","172.20.0.2","TCP","47060 → 4433 [RST, ACK] Seq=1335 Ack=1439 Win=64128 Len=0 TSval=1305911290 TSecr=1496827083"
"94","0.172652394","74","22:39:0c:a7:7b:00","6e:3e:36:ee:11:64","172.20.0.3","172.20.0.2","TCP","47074 → 4433 [SYN] Seq=0 Win=64240 Len=0 MSS=1460 SACK_PERM TSval=1305911302 TSecr=0 WS=128"
"95","0.172674321","74","6e:3e:36:ee:11:64","22:39:0c:a7:7b:00","172.20.0.2","172.20.0.3","TCP","4433 → 47074 [SYN, ACK] Seq=0 Ack=1 Win=65160 Len=0 MSS=1460 SACK_PERM TSval=1496827097 TSecr=1305911302 WS=128"
"96","0.172690266","66","22:39:0c:a7:7b:00","6e:3e:36:ee:11:64","172.20.0.3","172.20.0.2","TCP","47074 → 4433 [ACK] Seq=1 Ack=1 Win=64256 Len=0 TSval=1305911302 TSecr=1496827097"
"97","0.172726800","1320","22:39:0c:a7:7b:00","6e:3e:36:ee:11:64","172.20.0.3","172.20.0.2","TLSv1.2","Client Hello"
"98","0.172731859","66","6e:3e:36:ee:11:64","22:39:0c:a7:7b:00","172.20.0.2","172.20.0.3","TCP","4433 → 47074 [ACK] Seq=1 Ack=1255 Win=64128 Len=0 TSval=1496827097 TSecr=1305911302"
"99","0.173383468","1504","6e:3e:36:ee:11:64","22:39:0c:a7:7b:00","172.20.0.2","172.20.0.3","TLSv1.3","Server Hello, Change Cipher Spec, Application Data, Application Data, Application Data, Application Data"
"100","0.173412998","66","22:39:0c:a7:7b:00","6e:3e:36:ee:11:64","172.20.0.3","172.20.0.2","TCP","47074 → 4433 [ACK] Seq=1255 Ack=1439 Win=64128 Len=0 TSval=1305911302 TSecr=1496827097"
"101","0.174549521","146","22:39:0c:a7:7b:00","6e:3e:36:ee:11:64","172.20.0.3","172.20.0.2","TLSv1.3","Change Cipher Spec, Application Data"
"102","0.174608013","66","22:39:0c:a7:7b:00","6e:3e:36:ee:11:64","172.20.0.3","172.20.0.2","TCP","47074 → 4433 [RST, ACK] Seq=1335 Ack=1439 Win=64128 Len=0 TSval=1305911304 TSecr=1496827097"
"103","0.186507163","74","22:39:0c:a7:7b:00","6e:3e:36:ee:11:64","172.20.0.3","172.20.0.2","TCP","47080 → 4433 [SYN] Seq=0 Win=64240 Len=0 MSS=1460 SACK_PERM TSval=1305911316 TSecr=0 WS=128"
"104","0.186534792","74","6e:3e:36:ee:11:64","22:39:0c:a7:7b:00","172.20.0.2","172.20.0.3","TCP","4433 → 47080 [SYN, ACK] Seq=0 Ack=1 Win=65160 Len=0 MSS=1460 SACK_PERM TSval=1496827111 TSecr=1305911316 WS=128"
"105","0.186558206","66","22:39:0c:a7:7b:00","6e:3e:36:ee:11:64","172.20.0.3","172.20.0.2","TCP","47080 → 4433 [ACK] Seq=1 Ack=1 Win=64256 Len=0 TSval=1305911316 TSecr=1496827111"
"106","0.186602600","1320","22:39:0c:a7:7b:00","6e:3e:36:ee:11:64","172.20.0.3","172.20.0.2","TLSv1.2","Client Hello"
"107","0.186607438","66","6e:3e:36:ee:11:64","22:39:0c:a7:7b:00","172.20.0.2","172.20.0.3","TCP","4433 → 47080 [ACK] Seq=1 Ack=1255 Win=64128 Len=0 TSval=1496827111 TSecr=1305911316"
"108","0.187588331","1504","6e:3e:36:ee:11:64","22:39:0c:a7:7b:00","172.20.0.2","172.20.0.3","TLSv1.3","Server Hello, Change Cipher Spec, Application Data, Application Data, Application Data, Application Data"
"109","0.187627485","66","22:39:0c:a7:7b:00","6e:3e:36:ee:11:64","172.20.0.3","172.20.0.2","TCP","47080 → 4433 [ACK] Seq=1255 Ack=1439 Win=64128 Len=0 TSval=1305911317 TSecr=1496827112"
"110","0.188834503","146","22:39:0c:a7:7b:00","6e:3e:36:ee:11:64","172.20.0.3","172.20.0.2","TLSv1.3","Change Cipher Spec, Application Data"
"111","0.188896549","66","22:39:0c:a7:7b:00","6e:3e:36:ee:11:64","172.20.0.3","172.20.0.2","TCP","47080 → 4433 [RST, ACK] Seq=1335 Ack=1439 Win=64128 Len=0 TSval=1305911318 TSecr=1496827112"
"112","0.200509996","74","22:39:0c:a7:7b:00","6e:3e:36:ee:11:64","172.20.0.3","172.20.0.2","TCP","47092 → 4433 [SYN] Seq=0 Win=64240 Len=0 MSS=1460 SACK_PERM TSval=1305911330 TSecr=0 WS=128"
"113","0.200553480","74","6e:3e:36:ee:11:64","22:39:0c:a7:7b:00","172.20.0.2","172.20.0.3","TCP","4433 → 47092 [SYN, ACK] Seq=0 Ack=1 Win=65160 Len=0 MSS=1460 SACK_PERM TSval=1496827125 TSecr=1305911330 WS=128"
"114","0.200572594","66","22:39:0c:a7:7b:00","6e:3e:36:ee:11:64","172.20.0.3","172.20.0.2","TCP","47092 → 4433 [ACK] Seq=1 Ack=1 Win=64256 Len=0 TSval=1305911330 TSecr=1496827125"
"115","0.200625165","1320","22:39:0c:a7:7b:00","6e:3e:36:ee:11:64","172.20.0.3","172.20.0.2","TLSv1.2","Client Hello"
"116","0.200630211","66","6e:3e:36:ee:11:64","22:39:0c:a7:7b:00","172.20.0.2","172.20.0.3","TCP","4433 → 47092 [ACK] Seq=1 Ack=1255 Win=64128 Len=0 TSval=1496827125 TSecr=1305911330"
"117","0.201327128","1504","6e:3e:36:ee:11:64","22:39:0c:a7:7b:00","172.20.0.2","172.20.0.3","TLSv1.3","Server Hello, Change Cipher Spec, Application Data, Application Data, Application Data, Application Data"
"118","0.201368405","66","22:39:0c:a7:7b:00","6e:3e:36:ee:11:64","172.20.0.3","172.20.0.2","TCP","47092 → 4433 [ACK] Seq=1255 Ack=1439 Win=64128 Len=0 TSval=1305911330 TSecr=1496827125"
"119","0.202546146","146","22:39:0c:a7:7b:00","6e:3e:36:ee:11:64","172.20.0.3","172.20.0.2","TLSv1.3","Change Cipher Spec, Application Data"
"120","0.202604432","66","22:39:0c:a7:7b:00","6e:3e:36:ee:11:64","172.20.0.3","172.20.0.2","TCP","47092 → 4433 [RST, ACK] Seq=1335 Ack=1439 Win=64128 Len=0 TSval=1305911332 TSecr=1496827125"
"121","0.214598041","74","22:39:0c:a7:7b:00","6e:3e:36:ee:11:64","172.20.0.3","172.20.0.2","TCP","47104 → 4433 [SYN] Seq=0 Win=64240 Len=0 MSS=1460 SACK_PERM TSval=1305911344 TSecr=0 WS=128"
"122","0.214623788","74","6e:3e:36:ee:11:64","22:39:0c:a7:7b:00","172.20.0.2","172.20.0.3","TCP","4433 → 47104 [SYN, ACK] Seq=0 Ack=1 Win=65160 Len=0 MSS=1460 SACK_PERM TSval=1496827139 TSecr=1305911344 WS=128"
"123","0.214646447","66","22:39:0c:a7:7b:00","6e:3e:36:ee:11:64","172.20.0.3","172.20.0.2","TCP","47104 → 4433 [ACK] Seq=1 Ack=1 Win=64256 Len=0 TSval=1305911344 TSecr=1496827139"
"124","0.214697703","1320","22:39:0c:a7:7b:00","6e:3e:36:ee:11:64","172.20.0.3","172.20.0.2","TLSv1.2","Client Hello"
"125","0.214704699","66","6e:3e:36:ee:11:64","22:39:0c:a7:7b:00","172.20.0.2","172.20.0.3","TCP","4433 → 47104 [ACK] Seq=1 Ack=1255 Win=64128 Len=0 TSval=1496827139 TSecr=1305911344"
"126","0.215392675","1504","6e:3e:36:ee:11:64","22:39:0c:a7:7b:00","172.20.0.2","172.20.0.3","TLSv1.3","Server Hello, Change Cipher Spec, Application Data, Application Data, Application Data, Application Data"
"127","0.215422925","66","22:39:0c:a7:7b:00","6e:3e:36:ee:11:64","172.20.0.3","172.20.0.2","TCP","47104 → 4433 [ACK] Seq=1255 Ack=1439 Win=64128 Len=0 TSval=1305911344 TSecr=1496827139"
"128","0.216647470","146","22:39:0c:a7:7b:00","6e:3e:36:ee:11:64","172.20.0.3","172.20.0.2","TLSv1.3","Change Cipher Spec, Application Data"
"129","0.216706101","66","22:39:0c:a7:7b:00","6e:3e:36:ee:11:64","172.20.0.3","172.20.0.2","TCP","47104 → 4433 [RST, ACK] Seq=1335 Ack=1439 Win=64128 Len=0 TSval=1305911346 TSecr=1496827139"
"130","0.227560636","74","22:39:0c:a7:7b:00","6e:3e:36:ee:11:64","172.20.0.3","172.20.0.2","TCP","47112 → 4433 [SYN] Seq=0 Win=64240 Len=0 MSS=1460 SACK_PERM TSval=1305911357 TSecr=0 WS=128"
"131","0.227583476","74","6e:3e:36:ee:11:64","22:39:0c:a7:7b:00","172.20.0.2","172.20.0.3","TCP","4433 → 47112 [SYN, ACK] Seq=0 Ack=1 Win=65160 Len=0 MSS=1460 SACK_PERM TSval=1496827152 TSecr=1305911357 WS=128"
"132","0.227600518","66","22:39:0c:a7:7b:00","6e:3e:36:ee:11:64","172.20.0.3","172.20.0.2","TCP","47112 → 4433 [ACK] Seq=1 Ack=1 Win=64256 Len=0 TSval=1305911357 TSecr=1496827152"
"133","0.227638608","1320","22:39:0c:a7:7b:00","6e:3e:36:ee:11:64","172.20.0.3","172.20.0.2","TLSv1.2","Client Hello"
"134","0.227643135","66","6e:3e:36:ee:11:64","22:39:0c:a7:7b:00","172.20.0.2","172.20.0.3","TCP","4433 → 47112 [ACK] Seq=1 Ack=1255 Win=64128 Len=0 TSval=1496827152 TSecr=1305911357"
"135","0.228559436","1504","6e:3e:36:ee:11:64","22:39:0c:a7:7b:00","172.20.0.2","172.20.0.3","TLSv1.3","Server Hello, Change Cipher Spec, Application Data, Application Data, Application Data, Application Data"
"136","0.228612175","66","22:39:0c:a7:7b:00","6e:3e:36:ee:11:64","172.20.0.3","172.20.0.2","TCP","47112 → 4433 [ACK] Seq=1255 Ack=1439 Win=64128 Len=0 TSval=1305911358 TSecr=1496827153"
"137","0.229763278","146","22:39:0c:a7:7b:00","6e:3e:36:ee:11:64","172.20.0.3","172.20.0.2","TLSv1.3","Change Cipher Spec, Application Data"
"138","0.229819811","66","22:39:0c:a7:7b:00","6e:3e:36:ee:11:64","172.20.0.3","172.20.0.2","TCP","47112 → 4433 [RST, ACK] Seq=1335 Ack=1439 Win=64128 Len=0 TSval=1305911359 TSecr=1496827153"
"139","0.241202952","74","22:39:0c:a7:7b:00","6e:3e:36:ee:11:64","172.20.0.3","172.20.0.2","TCP","47114 → 4433 [SYN] Seq=0 Win=64240 Len=0 MSS=1460 SACK_PERM TSval=1305911370 TSecr=0 WS=128"
"140","0.241232134","74","6e:3e:36:ee:11:64","22:39:0c:a7:7b:00","172.20.0.2","172.20.0.3","TCP","4433 → 47114 [SYN, ACK] Seq=0 Ack=1 Win=65160 Len=0 MSS=1460 SACK_PERM TSval=1496827165 TSecr=1305911370 WS=128"
"141","0.241251795","66","22:39:0c:a7:7b:00","6e:3e:36:ee:11:64","172.20.0.3","172.20.0.2","TCP","47114 → 4433 [ACK] Seq=1 Ack=1 Win=64256 Len=0 TSval=1305911370 TSecr=1496827165"
"142","0.241299448","1320","22:39:0c:a7:7b:00","6e:3e:36:ee:11:64","172.20.0.3","172.20.0.2","TLSv1.2","Client Hello"
"143","0.241303552","66","6e:3e:36:ee:11:64","22:39:0c:a7:7b:00","172.20.0.2","172.20.0.3","TCP","4433 → 47114 [ACK] Seq=1 Ack=1255 Win=64128 Len=0 TSval=1496827165 TSecr=1305911370"
"144","0.242312908","1504","6e:3e:36:ee:11:64","22:39:0c:a7:7b:00","172.20.0.2","172.20.0.3","TLSv1.3","Server Hello, Change Cipher Spec, Application Data, Application Data, Application Data, Application Data"
"145","0.242366083","66","22:39:0c:a7:7b:00","6e:3e:36:ee:11:64","172.20.0.3","172.20.0.2","TCP","47114 → 4433 [ACK] Seq=1255 Ack=1439 Win=64128 Len=0 TSval=1305911371 TSecr=1496827166"
"146","0.243540600","146","22:39:0c:a7:7b:00","6e:3e:36:ee:11:64","172.20.0.3","172.20.0.2","TLSv1.3","Change Cipher Spec, Application Data"
"147","0.243621236","66","22:39:0c:a7:7b:00","6e:3e:36:ee:11:64","172.20.0.3","172.20.0.2","TCP","47114 → 4433 [RST, ACK] Seq=1335 Ack=1439 Win=64128 Len=0 TSval=1305911373 TSecr=1496827166"
"148","0.255038509","74","22:39:0c:a7:7b:00","6e:3e:36:ee:11:64","172.20.0.3","172.20.0.2","TCP","47124 → 4433 [SYN] Seq=0 Win=64240 Len=0 MSS=1460 SACK_PERM TSval=1305911384 TSecr=0 WS=128"
"149","0.255063495","74","6e:3e:36:ee:11:64","22:39:0c:a7:7b:00","172.20.0.2","172.20.0.3","TCP","4433 → 47124 [SYN, ACK] Seq=0 Ack=1 Win=65160 Len=0 MSS=1460 SACK_PERM TSval=1496827179 TSecr=1305911384 WS=128"
"150","0.255081481","66","22:39:0c:a7:7b:00","6e:3e:36:ee:11:64","172.20.0.3","172.20.0.2","TCP","47124 → 4433 [ACK] Seq=1 Ack=1 Win=64256 Len=0 TSval=1305911384 TSecr=1496827179"
"151","0.255137133","1320","22:39:0c:a7:7b:00","6e:3e:36:ee:11:64","172.20.0.3","172.20.0.2","TLSv1.2","Client Hello"
"152","0.255140869","66","6e:3e:36:ee:11:64","22:39:0c:a7:7b:00","172.20.0.2","172.20.0.3","TCP","4433 → 47124 [ACK] Seq=1 Ack=1255 Win=64128 Len=0 TSval=1496827179 TSecr=1305911384"
"153","0.255788010","1504","6e:3e:36:ee:11:64","22:39:0c:a7:7b:00","172.20.0.2","172.20.0.3","TLSv1.3","Server Hello, Change Cipher Spec, Application Data, Application Data, Application Data, Application Data"
"154","0.255820733","66","22:39:0c:a7:7b:00","6e:3e:36:ee:11:64","172.20.0.3","172.20.0.2","TCP","47124 → 4433 [ACK] Seq=1255 Ack=1439 Win=64128 Len=0 TSval=1305911385 TSecr=1496827180"
"155","0.257033207","146","22:39:0c:a7:7b:00","6e:3e:36:ee:11:64","172.20.0.3","172.20.0.2","TLSv1.3","Change Cipher Spec, Application Data"
"156","0.257090289","66","22:39:0c:a7:7b:00","6e:3e:36:ee:11:64","172.20.0.3","172.20.0.2","TCP","47124 → 4433 [RST, ACK] Seq=1335 Ack=1439 Win=64128 Len=0 TSval=1305911386 TSecr=1496827180"
"157","0.268675338","74","22:39:0c:a7:7b:00","6e:3e:36:ee:11:64","172.20.0.3","172.20.0.2","TCP","47126 → 4433 [SYN] Seq=0 Win=64240 Len=0 MSS=1460 SACK_PERM TSval=1305911398 TSecr=0 WS=128"
"158","0.268708286","74","6e:3e:36:ee:11:64","22:39:0c:a7:7b:00","172.20.0.2","172.20.0.3","TCP","4433 → 47126 [SYN, ACK] Seq=0 Ack=1 Win=65160 Len=0 MSS=1460 SACK_PERM TSval=1496827193 TSecr=1305911398 WS=128"
"159","0.268732162","66","22:39:0c:a7:7b:00","6e:3e:36:ee:11:64","172.20.0.3","172.20.0.2","TCP","47126 → 4433 [ACK] Seq=1 Ack=1 Win=64256 Len=0 TSval=1305911398 TSecr=1496827193"
"160","0.268785086","1320","22:39:0c:a7:7b:00","6e:3e:36:ee:11:64","172.20.0.3","172.20.0.2","TLSv1.2","Client Hello"
"161","0.268791764","66","6e:3e:36:ee:11:64","22:39:0c:a7:7b:00","172.20.0.2","172.20.0.3","TCP","4433 → 47126 [ACK] Seq=1 Ack=1255 Win=64128 Len=0 TSval=1496827193 TSecr=1305911398"
"162","0.269406563","1504","6e:3e:36:ee:11:64","22:39:0c:a7:7b:00","172.20.0.2","172.20.0.3","TLSv1.3","Server Hello, Change Cipher Spec, Application Data, Application Data, Application Data, Application Data"
"163","0.269445376","66","22:39:0c:a7:7b:00","6e:3e:36:ee:11:64","172.20.0.3","172.20.0.2","TCP","47126 → 4433 [ACK] Seq=1255 Ack=1439 Win=64128 Len=0 TSval=1305911398 TSecr=1496827193"
"164","0.270716027","146","22:39:0c:a7:7b:00","6e:3e:36:ee:11:64","172.20.0.3","172.20.0.2","TLSv1.3","Change Cipher Spec, Application Data"
"165","0.270773222","66","22:39:0c:a7:7b:00","6e:3e:36:ee:11:64","172.20.0.3","172.20.0.2","TCP","47126 → 4433 [RST, ACK] Seq=1335 Ack=1439 Win=64128 Len=0 TSval=1305911400 TSecr=1496827193"
"166","0.284864327","74","22:39:0c:a7:7b:00","6e:3e:36:ee:11:64","172.20.0.3","172.20.0.2","TCP","47140 → 4433 [SYN] Seq=0 Win=64240 Len=0 MSS=1460 SACK_PERM TSval=1305911414 TSecr=0 WS=128"
"167","0.284906878","74","6e:3e:36:ee:11:64","22:39:0c:a7:7b:00","172.20.0.2","172.20.0.3","TCP","4433 → 47140 [SYN, ACK] Seq=0 Ack=1 Win=65160 Len=0 MSS=1460 SACK_PERM TSval=1496827209 TSecr=1305911414 WS=128"
"168","0.284932138","66","22:39:0c:a7:7b:00","6e:3e:36:ee:11:64","172.20.0.3","172.20.0.2","TCP","47140 → 4433 [ACK] Seq=1 Ack=1 Win=64256 Len=0 TSval=1305911414 TSecr=1496827209"
"169","0.284983414","1320","22:39:0c:a7:7b:00","6e:3e:36:ee:11:64","172.20.0.3","172.20.0.2","TLSv1.2","Client Hello"
"170","0.284990059","66","6e:3e:36:ee:11:64","22:39:0c:a7:7b:00","172.20.0.2","172.20.0.3","TCP","4433 → 47140 [ACK] Seq=1 Ack=1255 Win=64128 Len=0 TSval=1496827209 TSecr=1305911414"
"171","0.285841393","1504","6e:3e:36:ee:11:64","22:39:0c:a7:7b:00","172.20.0.2","172.20.0.3","TLSv1.3","Server Hello, Change Cipher Spec, Application Data, Application Data, Application Data, Application Data"
"172","0.285881090","66","22:39:0c:a7:7b:00","6e:3e:36:ee:11:64","172.20.0.3","172.20.0.2","TCP","47140 → 4433 [ACK] Seq=1255 Ack=1439 Win=64128 Len=0 TSval=1305911415 TSecr=1496827210"
"173","0.287296361","146","22:39:0c:a7:7b:00","6e:3e:36:ee:11:64","172.20.0.3","172.20.0.2","TLSv1.3","Change Cipher Spec, Application Data"
"174","0.287380646","66","22:39:0c:a7:7b:00","6e:3e:36:ee:11:64","172.20.0.3","172.20.0.2","TCP","47140 → 4433 [RST, ACK] Seq=1335 Ack=1439 Win=64128 Len=0 TSval=1305911416 TSecr=1496827210"
"175","0.299528350","74","22:39:0c:a7:7b:00","6e:3e:36:ee:11:64","172.20.0.3","172.20.0.2","TCP","47156 → 4433 [SYN] Seq=0 Win=64240 Len=0 MSS=1460 SACK_PERM TSval=1305911429 TSecr=0 WS=128"
"176","0.299552034","74","6e:3e:36:ee:11:64","22:39:0c:a7:7b:00","172.20.0.2","172.20.0.3","TCP","4433 → 47156 [SYN, ACK] Seq=0 Ack=1 Win=65160 Len=0 MSS=1460 SACK_PERM TSval=1496827224 TSecr=1305911429 WS=128"
"177","0.299569992","66","22:39:0c:a7:7b:00","6e:3e:36:ee:11:64","172.20.0.3","172.20.0.2","TCP","47156 → 4433 [ACK] Seq=1 Ack=1 Win=64256 Len=0 TSval=1305911429 TSecr=1496827224"
"178","0.299615039","1320","22:39:0c:a7:7b:00","6e:3e:36:ee:11:64","172.20.0.3","172.20.0.2","TLSv1.2","Client Hello"
"179","0.299619894","66","6e:3e:36:ee:11:64","22:39:0c:a7:7b:00","172.20.0.2","172.20.0.3","TCP","4433 → 47156 [ACK] Seq=1 Ack=1255 Win=64128 Len=0 TSval=1496827224 TSecr=1305911429"
"180","0.300486105","1504","6e:3e:36:ee:11:64","22:39:0c:a7:7b:00","172.20.0.2","172.20.0.3","TLSv1.3","Server Hello, Change Cipher Spec, Application Data, Application Data, Application Data, Application Data"
"181","0.300529701","66","22:39:0c:a7:7b:00","6e:3e:36:ee:11:64","172.20.0.3","172.20.0.2","TCP","47156 → 4433 [ACK] Seq=1255 Ack=1439 Win=64128 Len=0 TSval=1305911430 TSecr=1496827225"
"182","0.301883822","146","22:39:0c:a7:7b:00","6e:3e:36:ee:11:64","172.20.0.3","172.20.0.2","TLSv1.3","Change Cipher Spec, Application Data"
"183","0.301945284","66","22:39:0c:a7:7b:00","6e:3e:36:ee:11:64","172.20.0.3","172.20.0.2","TCP","47156 → 4433 [RST, ACK] Seq=1335 Ack=1439 Win=64128 Len=0 TSval=1305911431 TSecr=1496827225"
"184","0.313078956","74","22:39:0c:a7:7b:00","6e:3e:36:ee:11:64","172.20.0.3","172.20.0.2","TCP","47160 → 4433 [SYN] Seq=0 Win=64240 Len=0 MSS=1460 SACK_PERM TSval=1305911442 TSecr=0 WS=128"
"185","0.313102847","74","6e:3e:36:ee:11:64","22:39:0c:a7:7b:00","172.20.0.2","172.20.0.3","TCP","4433 → 47160 [SYN, ACK] Seq=0 Ack=1 Win=65160 Len=0 MSS=1460 SACK_PERM TSval=1496827237 TSecr=1305911442 WS=128"
"186","0.313120442","66","22:39:0c:a7:7b:00","6e:3e:36:ee:11:64","172.20.0.3","172.20.0.2","TCP","47160 → 4433 [ACK] Seq=1 Ack=1 Win=64256 Len=0 TSval=1305911442 TSecr=1496827237"
"187","0.313166771","1320","22:39:0c:a7:7b:00","6e:3e:36:ee:11:64","172.20.0.3","172.20.0.2","TLSv1.2","Client Hello"
"188","0.313173621","66","6e:3e:36:ee:11:64","22:39:0c:a7:7b:00","172.20.0.2","172.20.0.3","TCP","4433 → 47160 [ACK] Seq=1 Ack=1255 Win=64128 Len=0 TSval=1496827237 TSecr=1305911442"
"189","0.313881983","1504","6e:3e:36:ee:11:64","22:39:0c:a7:7b:00","172.20.0.2","172.20.0.3","TLSv1.3","Server Hello, Change Cipher Spec, Application Data, Application Data, Application Data, Application Data"
"190","0.313913361","66","22:39:0c:a7:7b:00","6e:3e:36:ee:11:64","172.20.0.3","172.20.0.2","TCP","47160 → 4433 [ACK] Seq=1255 Ack=1439 Win=64128 Len=0 TSval=1305911443 TSecr=1496827238"
"191","0.315132948","146","22:39:0c:a7:7b:00","6e:3e:36:ee:11:64","172.20.0.3","172.20.0.2","TLSv1.3","Change Cipher Spec, Application Data"
"192","0.315194144","66","22:39:0c:a7:7b:00","6e:3e:36:ee:11:64","172.20.0.3","172.20.0.2","TCP","47160 → 4433 [RST, ACK] Seq=1335 Ack=1439 Win=64128 Len=0 TSval=1305911444 TSecr=1496827238"
"193","0.326256468","74","22:39:0c:a7:7b:00","6e:3e:36:ee:11:64","172.20.0.3","172.20.0.2","TCP","47162 → 4433 [SYN] Seq=0 Win=64240 Len=0 MSS=1460 SACK_PERM TSval=1305911455 TSecr=0 WS=128"
"194","0.326286189","74","6e:3e:36:ee:11:64","22:39:0c:a7:7b:00","172.20.0.2","172.20.0.3","TCP","4433 → 47162 [SYN, ACK] Seq=0 Ack=1 Win=65160 Len=0 MSS=1460 SACK_PERM TSval=1496827250 TSecr=1305911455 WS=128"
"195","0.326309718","66","22:39:0c:a7:7b:00","6e:3e:36:ee:11:64","172.20.0.3","172.20.0.2","TCP","47162 → 4433 [ACK] Seq=1 Ack=1 Win=64256 Len=0 TSval=1305911455 TSecr=1496827250"
"196","0.326373384","1320","22:39:0c:a7:7b:00","6e:3e:36:ee:11:64","172.20.0.3","172.20.0.2","TLSv1.2","Client Hello"
"197","0.326380028","66","6e:3e:36:ee:11:64","22:39:0c:a7:7b:00","172.20.0.2","172.20.0.3","TCP","4433 → 47162 [ACK] Seq=1 Ack=1255 Win=64128 Len=0 TSval=1496827250 TSecr=1305911455"
"198","0.327270605","1504","6e:3e:36:ee:11:64","22:39:0c:a7:7b:00","172.20.0.2","172.20.0.3","TLSv1.3","Server Hello, Change Cipher Spec, Application Data, Application Data, Application Data, Application Data"
"199","0.327312409","66","22:39:0c:a7:7b:00","6e:3e:36:ee:11:64","172.20.0.3","172.20.0.2","TCP","47162 → 4433 [ACK] Seq=1255 Ack=1439 Win=64128 Len=0 TSval=1305911456 TSecr=1496827251"
"200","0.328463630","146","22:39:0c:a7:7b:00","6e:3e:36:ee:11:64","172.20.0.3","172.20.0.2","TLSv1.3","Change Cipher Spec, Application Data"
"201","0.328521417","66","22:39:0c:a7:7b:00","6e:3e:36:ee:11:64","172.20.0.3","172.20.0.2","TCP","47162 → 4433 [RST, ACK] Seq=1335 Ack=1439 Win=64128 Len=0 TSval=1305911458 TSecr=1496827251"
"202","0.339499672","74","22:39:0c:a7:7b:00","6e:3e:36:ee:11:64","172.20.0.3","172.20.0.2","TCP","47170 → 4433 [SYN] Seq=0 Win=64240 Len=0 MSS=1460 SACK_PERM TSval=1305911469 TSecr=0 WS=128"
"203","0.339532523","74","6e:3e:36:ee:11:64","22:39:0c:a7:7b:00","172.20.0.2","172.20.0.3","TCP","4433 → 47170 [SYN, ACK] Seq=0 Ack=1 Win=65160 Len=0 MSS=1460 SACK_PERM TSval=1496827264 TSecr=1305911469 WS=128"
"204","0.339550102","66","22:39:0c:a7:7b:00","6e:3e:36:ee:11:64","172.20.0.3","172.20.0.2","TCP","47170 → 4433 [ACK] Seq=1 Ack=1 Win=64256 Len=0 TSval=1305911469 TSecr=1496827264"
"205","0.339596311","1320","22:39:0c:a7:7b:00","6e:3e:36:ee:11:64","172.20.0.3","172.20.0.2","TLSv1.2","Client Hello"
"206","0.339600486","66","6e:3e:36:ee:11:64","22:39:0c:a7:7b:00","172.20.0.2","172.20.0.3","TCP","4433 → 47170 [ACK] Seq=1 Ack=1255 Win=64128 Len=0 TSval=1496827264 TSecr=1305911469"
"207","0.340327890","1504","6e:3e:36:ee:11:64","22:39:0c:a7:7b:00","172.20.0.2","172.20.0.3","TLSv1.3","Server Hello, Change Cipher Spec, Application Data, Application Data, Application Data, Application Data"
"208","0.340355869","66","22:39:0c:a7:7b:00","6e:3e:36:ee:11:64","172.20.0.3","172.20.0.2","TCP","47170 → 4433 [ACK] Seq=1255 Ack=1439 Win=64128 Len=0 TSval=1305911469 TSecr=1496827264"
"209","0.341466790","146","22:39:0c:a7:7b:00","6e:3e:36:ee:11:64","172.20.0.3","172.20.0.2","TLSv1.3","Change Cipher Spec, Application Data"
"210","0.341543729","66","22:39:0c:a7:7b:00","6e:3e:36:ee:11:64","172.20.0.3","172.20.0.2","TCP","47170 → 4433 [RST, ACK] Seq=1335 Ack=1439 Win=64128 Len=0 TSval=1305911471 TSecr=1496827264"
"211","0.352546155","74","22:39:0c:a7:7b:00","6e:3e:36:ee:11:64","172.20.0.3","172.20.0.2","TCP","47172 → 4433 [SYN] Seq=0 Win=64240 Len=0 MSS=1460 SACK_PERM TSval=1305911482 TSecr=0 WS=128"
"212","0.352570221","74","6e:3e:36:ee:11:64","22:39:0c:a7:7b:00","172.20.0.2","172.20.0.3","TCP","4433 → 47172 [SYN, ACK] Seq=0 Ack=1 Win=65160 Len=0 MSS=1460 SACK_PERM TSval=1496827277 TSecr=1305911482 WS=128"
"213","0.352586247","66","22:39:0c:a7:7b:00","6e:3e:36:ee:11:64","172.20.0.3","172.20.0.2","TCP","47172 → 4433 [ACK] Seq=1 Ack=1 Win=64256 Len=0 TSval=1305911482 TSecr=1496827277"
"214","0.352627100","1320","22:39:0c:a7:7b:00","6e:3e:36:ee:11:64","172.20.0.3","172.20.0.2","TLSv1.2","Client Hello"
"215","0.352631554","66","6e:3e:36:ee:11:64","22:39:0c:a7:7b:00","172.20.0.2","172.20.0.3","TCP","4433 → 47172 [ACK] Seq=1 Ack=1255 Win=64128 Len=0 TSval=1496827277 TSecr=1305911482"
"216","0.353225744","1504","6e:3e:36:ee:11:64","22:39:0c:a7:7b:00","172.20.0.2","172.20.0.3","TLSv1.3","Server Hello, Change Cipher Spec, Application Data, Application Data, Application Data, Application Data"
"217","0.353255804","66","22:39:0c:a7:7b:00","6e:3e:36:ee:11:64","172.20.0.3","172.20.0.2","TCP","47172 → 4433 [ACK] Seq=1255 Ack=1439 Win=64128 Len=0 TSval=1305911482 TSecr=1496827277"
"218","0.354323721","146","22:39:0c:a7:7b:00","6e:3e:36:ee:11:64","172.20.0.3","172.20.0.2","TLSv1.3","Change Cipher Spec, Application Data"
"219","0.354405408","66","22:39:0c:a7:7b:00","6e:3e:36:ee:11:64","172.20.0.3","172.20.0.2","TCP","47172 → 4433 [RST, ACK] Seq=1335 Ack=1439 Win=64128 Len=0 TSval=1305911483 TSecr=1496827277"
"220","0.365185459","74","22:39:0c:a7:7b:00","6e:3e:36:ee:11:64","172.20.0.3","172.20.0.2","TCP","47182 → 4433 [SYN] Seq=0 Win=64240 Len=0 MSS=1460 SACK_PERM TSval=1305911494 TSecr=0 WS=128"
"221","0.365210600","74","6e:3e:36:ee:11:64","22:39:0c:a7:7b:00","172.20.0.2","172.20.0.3","TCP","4433 → 47182 [SYN, ACK] Seq=0 Ack=1 Win=65160 Len=0 MSS=1460 SACK_PERM TSval=1496827289 TSecr=1305911494 WS=128"
"222","0.365226236","66","22:39:0c:a7:7b:00","6e:3e:36:ee:11:64","172.20.0.3","172.20.0.2","TCP","47182 → 4433 [ACK] Seq=1 Ack=1 Win=64256 Len=0 TSval=1305911494 TSecr=1496827289"
"223","0.365266734","1320","22:39:0c:a7:7b:00","6e:3e:36:ee:11:64","172.20.0.3","172.20.0.2","TLSv1.2","Client Hello"
"224","0.365271936","66","6e:3e:36:ee:11:64","22:39:0c:a7:7b:00","172.20.0.2","172.20.0.3","TCP","4433 → 47182 [ACK] Seq=1 Ack=1255 Win=64128 Len=0 TSval=1496827289 TSecr=1305911494"
