frame.number,frame.time_relative,frame.len,eth.src,eth.dst,ip.src,ip.dst,_ws.col.protocol,_ws.col.info
"1","0.000000000","42","ee:ae:37:14:76:d2","ff:ff:ff:ff:ff:ff",,,"ARP","ARP Announcement for 172.20.0.3"
"2","0.038204623","42","ee:ae:37:14:76:d2","ff:ff:ff:ff:ff:ff",,,"ARP","Who has 172.20.0.2? Tell 172.20.0.3"
"3","0.038228810","42","ba:7d:c6:88:c0:c9","ee:ae:37:14:76:d2",,,"ARP","172.20.0.2 is at ba:7d:c6:88:c0:c9"
"4","0.038239105","74","ee:ae:37:14:76:d2","ba:7d:c6:88:c0:c9","172.20.0.3","172.20.0.2","TCP","59426 → 4433 [SYN] Seq=0 Win=64240 Len=0 MSS=1460 SACK_PERM TSval=1320803227 TSecr=0 WS=128"
"5","0.038259470","74","ba:7d:c6:88:c0:c9","ee:ae:37:14:76:d2","172.20.0.2","172.20.0.3","TCP","4433 → 59426 [SYN, ACK] Seq=0 Ack=1 Win=65160 Len=0 MSS=1460 SACK_PERM TSval=1511719022 TSecr=1320803227 WS=128"
"6","0.038285473","66","ee:ae:37:14:76:d2","ba:7d:c6:88:c0:c9","172.20.0.3","172.20.0.2","TCP","59426 → 4433 [ACK] Seq=1 Ack=1 Win=64256 Len=0 TSval=1320803227 TSecr=1511719022"
"7","0.038335951","2189","ee:ae:37:14:76:d2","ba:7d:c6:88:c0:c9","172.20.0.3","172.20.0.2","TLSv1.2","Client Hello"
"8","0.038340300","66","ba:7d:c6:88:c0:c9","ee:ae:37:14:76:d2","172.20.0.2","172.20.0.3","TCP","4433 → 59426 [ACK] Seq=1 Ack=2124 Win=64128 Len=0 TSval=1511719022 TSecr=1320803227"
"9","0.052991527","2676","ba:7d:c6:88:c0:c9","ee:ae:37:14:76:d2","172.20.0.2","172.20.0.3","TLSv1.3","Server Hello, Change Cipher Spec, Application Data, Application Data, Application Data, Application Data"
"10","0.053068761","66","ee:ae:37:14:76:d2","ba:7d:c6:88:c0:c9","172.20.0.3","172.20.0.2","TCP","59426 → 4433 [ACK] Seq=2124 Ack=2611 Win=64128 Len=0 TSval=1320803242 TSecr=1511719037"
"11","0.062397529","146","ee:ae:37:14:76:d2","ba:7d:c6:88:c0:c9","172.20.0.3","172.20.0.2","TLSv1.3","Change Cipher Spec, Application Data"
"12","0.062473635","66","ee:ae:37:14:76:d2","ba:7d:c6:88:c0:c9","172.20.0.3","172.20.0.2","TCP","59426 → 4433 [RST, ACK] Seq=2204 Ack=2611 Win=64128 Len=0 TSval=1320803251 TSecr=1511719037"
"13","0.079193303","74","ee:ae:37:14:76:d2","ba:7d:c6:88:c0:c9","172.20.0.3","172.20.0.2","TCP","59428 → 4433 [SYN] Seq=0 Win=64240 Len=0 MSS=1460 SACK_PERM TSval=1320803268 TSecr=0 WS=128"
"14","0.079215190","74","ba:7d:c6:88:c0:c9","ee:ae:37:14:76:d2","172.20.0.2","172.20.0.3","TCP","4433 → 59428 [SYN, ACK] Seq=0 Ack=1 Win=65160 Len=0 MSS=1460 SACK_PERM TSval=1511719063 TSecr=1320803268 WS=128"
"15","0.079231908","66","ee:ae:37:14:76:d2","ba:7d:c6:88:c0:c9","172.20.0.3","172.20.0.2","TCP","59428 → 4433 [ACK] Seq=1 Ack=1 Win=64256 Len=0 TSval=1320803268 TSecr=1511719063"
"16","0.079286065","2189","ee:ae:37:14:76:d2","ba:7d:c6:88:c0:c9","172.20.0.3","172.20.0.2","TLSv1.2","Client Hello"
"17","0.079290846","66","ba:7d:c6:88:c0:c9","ee:ae:37:14:76:d2","172.20.0.2","172.20.0.3","TCP","4433 → 59428 [ACK] Seq=1 Ack=2124 Win=64128 Len=0 TSval=1511719063 TSecr=1320803268"
"18","0.092043030","2677","ba:7d:c6:88:c0:c9","ee:ae:37:14:76:d2","172.20.0.2","172.20.0.3","TLSv1.3","Server Hello, Change Cipher Spec, Application Data, Application Data, Application Data, Application Data"
"19","0.092089708","66","ee:ae:37:14:76:d2","ba:7d:c6:88:c0:c9","172.20.0.3","172.20.0.2","TCP","59428 → 4433 [ACK] Seq=2124 Ack=2612 Win=64128 Len=0 TSval=1320803281 TSecr=1511719076"
"20","0.101311214","146","ee:ae:37:14:76:d2","ba:7d:c6:88:c0:c9","172.20.0.3","172.20.0.2","TLSv1.3","Change Cipher Spec, Application Data"
"21","0.101396414","66","ee:ae:37:14:76:d2","ba:7d:c6:88:c0:c9","172.20.0.3","172.20.0.2","TCP","59428 → 4433 [RST, ACK] Seq=2204 Ack=2612 Win=64128 Len=0 TSval=1320803290 TSecr=1511719076"
"22","0.117753002","74","ee:ae:37:14:76:d2","ba:7d:c6:88:c0:c9","172.20.0.3","172.20.0.2","TCP","59432 → 4433 [SYN] Seq=0 Win=64240 Len=0 MSS=1460 SACK_PERM TSval=1320803306 TSecr=0 WS=128"
"23","0.117779420","74","ba:7d:c6:88:c0:c9","ee:ae:37:14:76:d2","172.20.0.2","172.20.0.3","TCP","4433 → 59432 [SYN, ACK] Seq=0 Ack=1 Win=65160 Len=0 MSS=1460 SACK_PERM TSval=1511719101 TSecr=1320803306 WS=128"
"24","0.117795985","66","ee:ae:37:14:76:d2","ba:7d:c6:88:c0:c9","172.20.0.3","172.20.0.2","TCP","59432 → 4433 [ACK] Seq=1 Ack=1 Win=64256 Len=0 TSval=1320803306 TSecr=1511719101"
"25","0.117842374","2189","ee:ae:37:14:76:d2","ba:7d:c6:88:c0:c9","172.20.0.3","172.20.0.2","TLSv1.2","Client Hello"
"26","0.117848082","66","ba:7d:c6:88:c0:c9","ee:ae:37:14:76:d2","172.20.0.2","172.20.0.3","TCP","4433 → 59432 [ACK] Seq=1 Ack=2124 Win=64128 Len=0 TSval=1511719101 TSecr=1320803306"
"27","0.129597846","2678","ba:7d:c6:88:c0:c9","ee:ae:37:14:76:d2","172.20.0.2","172.20.0.3","TLSv1.3","Server Hello, Change Cipher Spec, Application Data, Application Data, Application Data, Application Data"
"28","0.129642513","66","ee:ae:37:14:76:d2","ba:7d:c6:88:c0:c9","172.20.0.3","172.20.0.2","TCP","59432 → 4433 [ACK] Seq=2124 Ack=2613 Win=64128 Len=0 TSval=1320803318 TSecr=1511719113"
"29","0.138698081","146","ee:ae:37:14:76:d2","ba:7d:c6:88:c0:c9","172.20.0.3","172.20.0.2","TLSv1.3","Change Cipher Spec, Application Data"
"30","0.138769392","66","ee:ae:37:14:76:d2","ba:7d:c6:88:c0:c9","172.20.0.3","172.20.0.2","TCP","59432 → 4433 [RST, ACK] Seq=2204 Ack=2613 Win=64128 Len=0 TSval=1320803327 TSecr=1511719113"
"31","0.154979942","74","ee:ae:37:14:76:d2","ba:7d:c6:88:c0:c9","172.20.0.3","172.20.0.2","TCP","59438 → 4433 [SYN] Seq=0 Win=64240 Len=0 MSS=1460 SACK_PERM TSval=1320803343 TSecr=0 WS=128"
"32","0.155005693","74","ba:7d:c6:88:c0:c9","ee:ae:37:14:76:d2","172.20.0.2","172.20.0.3","TCP","4433 → 59438 [SYN, ACK] Seq=0 Ack=1 Win=65160 Len=0 MSS=1460 SACK_PERM TSval=1511719139 TSecr=1320803343 WS=128"
"33","0.155025745","66","ee:ae:37:14:76:d2","ba:7d:c6:88:c0:c9","172.20.0.3","172.20.0.2","TCP","59438 → 4433 [ACK] Seq=1 Ack=1 Win=64256 Len=0 TSval=1320803344 TSecr=1511719139"
"34","0.155072149","2189","ee:ae:37:14:76:d2","ba:7d:c6:88:c0:c9","172.20.0.3","172.20.0.2","TLSv1.2","Client Hello"
"35","0.155077417","66","ba:7d:c6:88:c0:c9","ee:ae:37:14:76:d2","172.20.0.2","172.20.0.3","TCP","4433 → 59438 [ACK] Seq=1 Ack=2124 Win=64128 Len=0 TSval=1511719139 TSecr=1320803344"
"36","0.167177982","2677","ba:7d:c6:88:c0:c9","ee:ae:37:14:76:d2","172.20.0.2","172.20.0.3","TLSv1.3","Server Hello, Change Cipher Spec, Application Data, Application Data, Application Data, Application Data"
"37","0.167213071","66","ee:ae:37:14:76:d2","ba:7d:c6:88:c0:c9","172.20.0.3","172.20.0.2","TCP","59438 → 4433 [ACK] Seq=2124 Ack=2612 Win=64128 Len=0 TSval=1320803356 TSecr=1511719151"
"38","0.176201988","146","ee:ae:37:14:76:d2","ba:7d:c6:88:c0:c9","172.20.0.3","172.20.0.2","TLSv1.3","Change Cipher Spec, Application Data"
"39","0.176271067","66","ee:ae:37:14:76:d2","ba:7d:c6:88:c0:c9","172.20.0.3","172.20.0.2","TCP","59438 → 4433 [RST, ACK] Seq=2204 Ack=2612 Win=64128 Len=0 TSval=1320803365 TSecr=1511719151"
"40","0.192915987","74","ee:ae:37:14:76:d2","ba:7d:c6:88:c0:c9","172.20.0.3","172.20.0.2","TCP","59444 → 4433 [SYN] Seq=0 Win=64240 Len=0 MSS=1460 SACK_PERM TSval=1320803381 TSecr=0 WS=128"
"41","0.192940649","74","ba:7d:c6:88:c0:c9","ee:ae:37:14:76:d2","172.20.0.2","172.20.0.3","TCP","4433 → 59444 [SYN, ACK] Seq=0 Ack=1 Win=65160 Len=0 MSS=1460 SACK_PERM TSval=1511719176 TSecr=1320803381 WS=128"
"42","0.192972188","66","ee:ae:37:14:76:d2","ba:7d:c6:88:c0:c9","172.20.0.3","172.20.0.2","TCP","59444 → 4433 [ACK] Seq=1 Ack=1 Win=64256 Len=0 TSval=1320803382 TSecr=1511719176"
"43","0.193020332","2189","ee:ae:37:14:76:d2","ba:7d:c6:88:c0:c9","172.20.0.3","172.20.0.2","TLSv1.2","Client Hello"
"44","0.193027322","66","ba:7d:c6:88:c0:c9","ee:ae:37:14:76:d2","172.20.0.2","172.20.0.3","TCP","4433 → 59444 [ACK] Seq=1 Ack=2124 Win=64128 Len=0 TSval=1511719177 TSecr=1320803382"
"45","0.204984331","2678","ba:7d:c6:88:c0:c9","ee:ae:37:14:76:d2","172.20.0.2","172.20.0.3","TLSv1.3","Server Hello, Change Cipher Spec, Application Data, Application Data, Application Data, Application Data"
"46","0.205038278","66","ee:ae:37:14:76:d2","ba:7d:c6:88:c0:c9","172.20.0.3","172.20.0.2","TCP","59444 → 4433 [ACK] Seq=2124 Ack=2613 Win=64128 Len=0 TSval=1320803394 TSecr=1511719189"
"47","0.214438775","146","ee:ae:37:14:76:d2","ba:7d:c6:88:c0:c9","172.20.0.3","172.20.0.2","TLSv1.3","Change Cipher Spec, Application Data"
"48","0.214513616","66","ee:ae:37:14:76:d2","ba:7d:c6:88:c0:c9","172.20.0.3","172.20.0.2","TCP","59444 → 4433 [RST, ACK] Seq=2204 Ack=2613 Win=64128 Len=0 TSval=1320803403 TSecr=1511719189"
"49","0.230352757","74","ee:ae:37:14:76:d2","ba:7d:c6:88:c0:c9","172.20.0.3","172.20.0.2","TCP","59458 → 4433 [SYN] Seq=0 Win=64240 Len=0 MSS=1460 SACK_PERM TSval=1320803419 TSecr=0 WS=128"
"50","0.230373826","74","ba:7d:c6:88:c0:c9","ee:ae:37:14:76:d2","172.20.0.2","172.20.0.3","TCP","4433 → 59458 [SYN, ACK] Seq=0 Ack=1 Win=65160 Len=0 MSS=1460 SACK_PERM TSval=1511719214 TSecr=1320803419 WS=128"
"51","0.230390556","66","ee:ae:37:14:76:d2","ba:7d:c6:88:c0:c9","172.20.0.3","172.20.0.2","TCP","59458 → 4433 [ACK] Seq=1 Ack=1 Win=64256 Len=0 TSval=1320803419 TSecr=1511719214"
"52","0.230433937","2189","ee:ae:37:14:76:d2","ba:7d:c6:88:c0:c9","172.20.0.3","172.20.0.2","TLSv1.2","Client Hello"
"53","0.230440356","66","ba:7d:c6:88:c0:c9","ee:ae:37:14:76:d2","172.20.0.2","172.20.0.3","TCP","4433 → 59458 [ACK] Seq=1 Ack=2124 Win=64128 Len=0 TSval=1511719214 TSecr=1320803419"
"54","0.242320491","2677","ba:7d:c6:88:c0:c9","ee:ae:37:14:76:d2","172.20.0.2","172.20.0.3","TLSv1.3","Server Hello, Change Cipher Spec, Application Data, Application Data, Application Data, Application Data"
"55","0.242372697","66","ee:ae:37:14:76:d2","ba:7d:c6:88:c0:c9","172.20.0.3","172.20.0.2","TCP","59458 → 4433 [ACK] Seq=2124 Ack=2612 Win=64128 Len=0 TSval=1320803431 TSecr=1511719226"
"56","0.251482924","146","ee:ae:37:14:76:d2","ba:7d:c6:88:c0:c9","172.20.0.3","172.20.0.2","TLSv1.3","Change Cipher Spec, Application Data"
"57","0.251555065","66","ee:ae:37:14:76:d2","ba:7d:c6:88:c0:c9","172.20.0.3","172.20.0.2","TCP","59458 → 4433 [RST, ACK] Seq=2204 Ack=2612 Win=64128 Len=0 TSval=1320803440 TSecr=1511719226"
"58","0.267911289","74","ee:ae:37:14:76:d2","ba:7d:c6:88:c0:c9","172.20.0.3","172.20.0.2","TCP","59468 → 4433 [SYN] Seq=0 Win=64240 Len=0 MSS=1460 SACK_PERM TSval=1320803456 TSecr=0 WS=128"
"59","0.267936261","74","ba:7d:c6:88:c0:c9","ee:ae:37:14:76:d2","172.20.0.2","172.20.0.3","TCP","4433 → 59468 [SYN, ACK] Seq=0 Ack=1 Win=65160 Len=0 MSS=1460 SACK_PERM TSval=1511719251 TSecr=1320803456 WS=128"
"60","0.267965737","66","ee:ae:37:14:76:d2","ba:7d:c6:88:c0:c9","172.20.0.3","172.20.0.2","TCP","59468 → 4433 [ACK] Seq=1 Ack=1 Win=64256 Len=0 TSval=1320803457 TSecr=1511719251"
"61","0.268008849","2189","ee:ae:37:14:76:d2","ba:7d:c6:88:c0:c9","172.20.0.3","172.20.0.2","TLSv1.2","Client Hello"
"62","0.268014793","66","ba:7d:c6:88:c0:c9","ee:ae:37:14:76:d2","172.20.0.2","172.20.0.3","TCP","4433 → 59468 [ACK] Seq=1 Ack=2124 Win=64128 Len=0 TSval=1511719252 TSecr=1320803457"
"63","0.281294350","2677","ba:7d:c6:88:c0:c9","ee:ae:37:14:76:d2","172.20.0.2","172.20.0.3","TLSv1.3","Server Hello, Change Cipher Spec, Application Data, Application Data, Application Data, Application Data"
"64","0.281340396","66","ee:ae:37:14:76:d2","ba:7d:c6:88:c0:c9","172.20.0.3","172.20.0.2","TCP","59468 → 4433 [ACK] Seq=2124 Ack=2612 Win=64128 Len=0 TSval=1320803470 TSecr=1511719265"
"65","0.290590442","146","ee:ae:37:14:76:d2","ba:7d:c6:88:c0:c9","172.20.0.3","172.20.0.2","TLSv1.3","Change Cipher Spec, Application Data"
"66","0.290678166","66","ee:ae:37:14:76:d2","ba:7d:c6:88:c0:c9","172.20.0.3","172.20.0.2","TCP","59468 → 4433 [RST, ACK] Seq=2204 Ack=2612 Win=64128 Len=0 TSval=1320803479 TSecr=1511719265"
"67","0.306897096","74","ee:ae:37:14:76:d2","ba:7d:c6:88:c0:c9","172.20.0.3","172.20.0.2","TCP","59480 → 4433 [SYN] Seq=0 Win=64240 Len=0 MSS=1460 SACK_PERM TSval=1320803495 TSecr=0 WS=128"
"68","0.306917665","74","ba:7d:c6:88:c0:c9","ee:ae:37:14:76:d2","172.20.0.2","172.20.0.3","TCP","4433 → 59480 [SYN, ACK] Seq=0 Ack=1 Win=65160 Len=0 MSS=1460 SACK_PERM TSval=1511719290 TSecr=1320803495 WS=128"
"69","0.306934626","66","ee:ae:37:14:76:d2","ba:7d:c6:88:c0:c9","172.20.0.3","172.20.0.2","TCP","59480 → 4433 [ACK] Seq=1 Ack=1 Win=64256 Len=0 TSval=1320803495 TSecr=1511719290"
"70","0.306984441","2189","ee:ae:37:14:76:d2","ba:7d:c6:88:c0:c9","172.20.0.3","172.20.0.2","TLSv1.2","Client Hello"
"71","0.306990010","66","ba:7d:c6:88:c0:c9","ee:ae:37:14:76:d2","172.20.0.2","172.20.0.3","TCP","4433 → 59480 [ACK] Seq=1 Ack=2124 Win=64128 Len=0 TSval=1511719291 TSecr=1320803496"
"72","0.318867580","2677","ba:7d:c6:88:c0:c9","ee:ae:37:14:76:d2","172.20.0.2","172.20.0.3","TLSv1.3","Server Hello, Change Cipher Spec, Application Data, Application Data, Application Data, Application Data"
"73","0.318918276","66","ee:ae:37:14:76:d2","ba:7d:c6:88:c0:c9","172.20.0.3","172.20.0.2","TCP","59480 → 4433 [ACK] Seq=2124 Ack=2612 Win=64128 Len=0 TSval=1320803507 TSecr=1511719302"
"74","0.332532041","146","ee:ae:37:14:76:d2","ba:7d:c6:88:c0:c9","172.20.0.3","172.20.0.2","TLSv1.3","Change Cipher Spec, Application Data"
"75","0.332641270","66","ee:ae:37:14:76:d2","ba:7d:c6:88:c0:c9","172.20.0.3","172.20.0.2","TCP","59480 → 4433 [RST, ACK] Seq=2204 Ack=2612 Win=64128 Len=0 TSval=1320803521 TSecr=1511719302"
"76","0.349284453","74","ee:ae:37:14:76:d2","ba:7d:c6:88:c0:c9","172.20.0.3","172.20.0.2","TCP","59492 → 4433 [SYN] Seq=0 Win=64240 Len=0 MSS=1460 SACK_PERM TSval=1320803538 TSecr=0 WS=128"
"77","0.349304291","74","ba:7d:c6:88:c0:c9","ee:ae:37:14:76:d2","172.20.0.2","172.20.0.3","TCP","4433 → 59492 [SYN, ACK] Seq=0 Ack=1 Win=65160 Len=0 MSS=1460 SACK_PERM TSval=1511719333 TSecr=1320803538 WS=128"
"78","0.349320989","66","ee:ae:37:14:76:d2","ba:7d:c6:88:c0:c9","172.20.0.3","172.20.0.2","TCP","59492 → 4433 [ACK] Seq=1 Ack=1 Win=64256 Len=0 TSval=1320803538 TSecr=1511719333"
"79","0.349362505","2189","ee:ae:37:14:76:d2","ba:7d:c6:88:c0:c9","172.20.0.3","172.20.0.2","TLSv1.2","Client Hello"
"80","0.349368243","66","ba:7d:c6:88:c0:c9","ee:ae:37:14:76:d2","172.20.0.2","172.20.0.3","TCP","4433 → 59492 [ACK] Seq=1 Ack=2124 Win=64128 Len=0 TSval=1511719333 TSecr=1320803538"
"81","0.361112031","2676","ba:7d:c6:88:c0:c9","ee:ae:37:14:76:d2","172.20.0.2","172.20.0.3","TLSv1.3","Server Hello, Change Cipher Spec, Application Data, Application Data, Application Data, Application Data"
"82","0.361158396","66","ee:ae:37:14:76:d2","ba:7d:c6:88:c0:c9","172.20.0.3","172.20.0.2","TCP","59492 → 4433 [ACK] Seq=2124 Ack=2611 Win=64128 Len=0 TSval=1320803550 TSecr=1511719345"
"83","0.370421232","146","ee:ae:37:14:76:d2","ba:7d:c6:88:c0:c9","172.20.0.3","172.20.0.2","TLSv1.3","Change Cipher Spec, Application Data"
"84","0.370497348","66","ee:ae:37:14:76:d2","ba:7d:c6:88:c0:c9","172.20.0.3","172.20.0.2","TCP","59492 → 4433 [RST, ACK] Seq=2204 Ack=2611 Win=64128 Len=0 TSval=1320803559 TSecr=1511719345"
"85","0.386382489","74","ee:ae:37:14:76:d2","ba:7d:c6:88:c0:c9","172.20.0.3","172.20.0.2","TCP","59494 → 4433 [SYN] Seq=0 Win=64240 Len=0 MSS=1460 SACK_PERM TSval=1320803575 TSecr=0 WS=128"
"86","0.386406266","74","ba:7d:c6:88:c0:c9","ee:ae:37:14:76:d2","172.20.0.2","172.20.0.3","TCP","4433 → 59494 [SYN, ACK] Seq=0 Ack=1 Win=65160 Len=0 MSS=1460 SACK_PERM TSval=1511719370 TSecr=1320803575 WS=128"
"87","0.386424492","66","ee:ae:37:14:76:d2","ba:7d:c6:88:c0:c9","172.20.0.3","172.20.0.2","TCP","59494 → 4433 [ACK] Seq=1 Ack=1 Win=64256 Len=0 TSval=1320803575 TSecr=1511719370"
"88","0.386469989","2189","ee:ae:37:14:76:d2","ba:7d:c6:88:c0:c9","172.20.0.3","172.20.0.2","TLSv1.2","Client Hello"
"89","0.386473949","66","ba:7d:c6:88:c0:c9","ee:ae:37:14:76:d2","172.20.0.2","172.20.0.3","TCP","4433 → 59494 [ACK] Seq=1 Ack=2124 Win=64128 Len=0 TSval=1511719370 TSecr=1320803575"
"90","0.399666992","2677","ba:7d:c6:88:c0:c9","ee:ae:37:14:76:d2","172.20.0.2","172.20.0.3","TLSv1.3","Server Hello, Change Cipher Spec, Application Data, Application Data, Application Data, Application Data"
"91","0.399712829","66","ee:ae:37:14:76:d2","ba:7d:c6:88:c0:c9","172.20.0.3","172.20.0.2","TCP","59494 → 4433 [ACK] Seq=2124 Ack=2612 Win=64128 Len=0 TSval=1320803588 TSecr=1511719383"
"92","0.408899765","146","ee:ae:37:14:76:d2","ba:7d:c6:88:c0:c9","172.20.0.3","172.20.0.2","TLSv1.3","Change Cipher Spec, Application Data"
"93","0.408989386","66","ee:ae:37:14:76:d2","ba:7d:c6:88:c0:c9","172.20.0.3","172.20.0.2","TCP","59494 → 4433 [RST, ACK] Seq=2204 Ack=2612 Win=64128 Len=0 TSval=1320803598 TSecr=1511719383"
"94","0.425126528","74","ee:ae:37:14:76:d2","ba:7d:c6:88:c0:c9","172.20.0.3","172.20.0.2","TCP","59500 → 4433 [SYN] Seq=0 Win=64240 Len=0 MSS=1460 SACK_PERM TSval=1320803614 TSecr=0 WS=128"
"95","0.425152066","74","ba:7d:c6:88:c0:c9","ee:ae:37:14:76:d2","172.20.0.2","172.20.0.3","TCP","4433 → 59500 [SYN, ACK] Seq=0 Ack=1 Win=65160 Len=0 MSS=1460 SACK_PERM TSval=1511719409 TSecr=1320803614 WS=128"
"96","0.425172612","66","ee:ae:37:14:76:d2","ba:7d:c6:88:c0:c9","172.20.0.3","172.20.0.2","TCP","59500 → 4433 [ACK] Seq=1 Ack=1 Win=64256 Len=0 TSval=1320803614 TSecr=1511719409"
"97","0.425227341","2189","ee:ae:37:14:76:d2","ba:7d:c6:88:c0:c9","172.20.0.3","172.20.0.2","TLSv1.2","Client Hello"
"98","0.425231903","66","ba:7d:c6:88:c0:c9","ee:ae:37:14:76:d2","172.20.0.2","172.20.0.3","TCP","4433 → 59500 [ACK] Seq=1 Ack=2124 Win=64128 Len=0 TSval=1511719409 TSecr=1320803614"
"99","0.438967535","2678","ba:7d:c6:88:c0:c9","ee:ae:37:14:76:d2","172.20.0.2","172.20.0.3","TLSv1.3","Server Hello, Change Cipher Spec, Application Data, Application Data, Application Data, Application Data"
"100","0.439019521","66","ee:ae:37:14:76:d2","ba:7d:c6:88:c0:c9","172.20.0.3","172.20.0.2","TCP","59500 → 4433 [ACK] Seq=2124 Ack=2613 Win=64128 Len=0 TSval=1320803628 TSecr=1511719422"
"101","0.449154967","146","ee:ae:37:14:76:d2","ba:7d:c6:88:c0:c9","172.20.0.3","172.20.0.2","TLSv1.3","Change Cipher Spec, Application Data"
"102","0.449253122","66","ee:ae:37:14:76:d2","ba:7d:c6:88:c0:c9","172.20.0.3","172.20.0.2","TCP","59500 → 4433 [RST, ACK] Seq=2204 Ack=2613 Win=64128 Len=0 TSval=1320803638 TSecr=1511719422"
"103","0.466696502","74","ee:ae:37:14:76:d2","ba:7d:c6:88:c0:c9","172.20.0.3","172.20.0.2","TCP","59506 → 4433 [SYN] Seq=0 Win=64240 Len=0 MSS=1460 SACK_PERM TSval=1320803655 TSecr=0 WS=128"
"104","0.466730125","74","ba:7d:c6:88:c0:c9","ee:ae:37:14:76:d2","172.20.0.2","172.20.0.3","TCP","4433 → 59506 [SYN, ACK] Seq=0 Ack=1 Win=65160 Len=0 MSS=1460 SACK_PERM TSval=1511719450 TSecr=1320803655 WS=128"
"105","0.466759549","66","ee:ae:37:14:76:d2","ba:7d:c6:88:c0:c9","172.20.0.3","172.20.0.2","TCP","59506 → 4433 [ACK] Seq=1 Ack=1 Win=64256 Len=0 TSval=1320803655 TSecr=1511719450"
"106","0.466835408","2189","ee:ae:37:14:76:d2","ba:7d:c6:88:c0:c9","172.20.0.3","172.20.0.2","TLSv1.2","Client Hello"
"107","0.466843343","66","ba:7d:c6:88:c0:c9","ee:ae:37:14:76:d2","172.20.0.2","172.20.0.3","TCP","4433 → 59506 [ACK] Seq=1 Ack=2124 Win=64128 Len=0 TSval=1511719450 TSecr=1320803655"
"108","0.480214908","2678","ba:7d:c6:88:c0:c9","ee:ae:37:14:76:d2","172.20.0.2","172.20.0.3","TLSv1.3","Server Hello, Change Cipher Spec, Application Data, Application Data, Application Data, Application Data"
"109","0.480268603","66","ee:ae:37:14:76:d2","ba:7d:c6:88:c0:c9","172.20.0.3","172.20.0.2","TCP","59506 → 4433 [ACK] Seq=2124 Ack=2613 Win=64128 Len=0 TSval=1320803669 TSecr=1511719464"
"110","0.489650168","146","ee:ae:37:14:76:d2","ba:7d:c6:88:c0:c9","172.20.0.3","172.20.0.2","TLSv1.3","Change Cipher Spec, Application Data"
"111","0.489740871","66","ee:ae:37:14:76:d2","ba:7d:c6:88:c0:c9","172.20.0.3","172.20.0.2","TCP","59506 → 4433 [RST, ACK] Seq=2204 Ack=2613 Win=64128 Len=0 TSval=1320803678 TSecr=1511719464"
"112","0.505994755","74","ee:ae:37:14:76:d2","ba:7d:c6:88:c0:c9","172.20.0.3","172.20.0.2","TCP","59514 → 4433 [SYN] Seq=0 Win=64240 Len=0 MSS=1460 SACK_PERM TSval=1320803694 TSecr=0 WS=128"
"113","0.506018331","74","ba:7d:c6:88:c0:c9","ee:ae:37:14:76:d2","172.20.0.2","172.20.0.3","TCP","4433 → 59514 [SYN, ACK] Seq=0 Ack=1 Win=65160 Len=0 MSS=1460 SACK_PERM TSval=1511719490 TSecr=1320803694 WS=128"
"114","0.506036718","66","ee:ae:37:14:76:d2","ba:7d:c6:88:c0:c9","172.20.0.3","172.20.0.2","TCP","59514 → 4433 [ACK] Seq=1 Ack=1 Win=64256 Len=0 TSval=1320803695 TSecr=1511719490"
"115","0.506090502","2189","ee:ae:37:14:76:d2","ba:7d:c6:88:c0:c9","172.20.0.3","172.20.0.2","TLSv1.2","Client Hello"
"116","0.506095564","66","ba:7d:c6:88:c0:c9","ee:ae:37:14:76:d2","172.20.0.2","172.20.0.3","TCP","4433 → 59514 [ACK] Seq=1 Ack=2124 Win=64128 Len=0 TSval=1511719490 TSecr=1320803695"
"117","0.518219712","2678","ba:7d:c6:88:c0:c9","ee:ae:37:14:76:d2","172.20.0.2","172.20.0.3","TLSv1.3","Server Hello, Change Cipher Spec, Application Data, Application Data, Application Data, Application Data"
"118","0.518265773","66","ee:ae:37:14:76:d2","ba:7d:c6:88:c0:c9","172.20.0.3","172.20.0.2","TCP","59514 → 4433 [ACK] Seq=2124 Ack=2613 Win=64128 Len=0 TSval=1320803707 TSecr=1511719502"
"119","0.527941834","146","ee:ae:37:14:76:d2","ba:7d:c6:88:c0:c9","172.20.0.3","172.20.0.2","TLSv1.3","Change Cipher Spec, Application Data"
"120","0.528026810","66","ee:ae:37:14:76:d2","ba:7d:c6:88:c0:c9","172.20.0.3","172.20.0.2","TCP","59514 → 4433 [RST, ACK] Seq=2204 Ack=2613 Win=64128 Len=0 TSval=1320803717 TSecr=1511719502"
"121","0.545013654","74","ee:ae:37:14:76:d2","ba:7d:c6:88:c0:c9","172.20.0.3","172.20.0.2","TCP","59520 → 4433 [SYN] Seq=0 Win=64240 Len=0 MSS=1460 SACK_PERM TSval=1320803734 TSecr=0 WS=128"
"122","0.545046261","74","ba:7d:c6:88:c0:c9","ee:ae:37:14:76:d2","172.20.0.2","172.20.0.3","TCP","4433 → 59520 [SYN, ACK] Seq=0 Ack=1 Win=65160 Len=0 MSS=1460 SACK_PERM TSval=1511719529 TSecr=1320803734 WS=128"
"123","0.545071423","66","ee:ae:37:14:76:d2","ba:7d:c6:88:c0:c9","172.20.0.3","172.20.0.2","TCP","59520 → 4433 [ACK] Seq=1 Ack=1 Win=64256 Len=0 TSval=1320803734 TSecr=1511719529"
"124","0.545127124","2189","ee:ae:37:14:76:d2","ba:7d:c6:88:c0:c9","172.20.0.3","172.20.0.2","TLSv1.2","Client Hello"
"125","0.545133846","66","ba:7d:c6:88:c0:c9","ee:ae:37:14:76:d2","172.20.0.2","172.20.0.3","TCP","4433 → 59520 [ACK] Seq=1 Ack=2124 Win=64128 Len=0 TSval=1511719529 TSecr=1320803734"
"126","0.558116161","2677","ba:7d:c6:88:c0:c9","ee:ae:37:14:76:d2","172.20.0.2","172.20.0.3","TLSv1.3","Server Hello, Change Cipher Spec, Application Data, Application Data, Application Data, Application Data"
"127","0.558175199","66","ee:ae:37:14:76:d2","ba:7d:c6:88:c0:c9","172.20.0.3","172.20.0.2","TCP","59520 → 4433 [ACK] Seq=2124 Ack=2612 Win=64128 Len=0 TSval=1320803747 TSecr=1511719542"
"128","0.573734311","146","ee:ae:37:14:76:d2","ba:7d:c6:88:c0:c9","172.20.0.3","172.20.0.2","TLSv1.3","Change Cipher Spec, Application Data"
"129","0.573845198","66","ee:ae:37:14:76:d2","ba:7d:c6:88:c0:c9","172.20.0.3","172.20.0.2","TCP","59520 → 4433 [RST, ACK] Seq=2204 Ack=2612 Win=64128 Len=0 TSval=1320803762 TSecr=1511719542"
"130","0.591014244","74","ee:ae:37:14:76:d2","ba:7d:c6:88:c0:c9","172.20.0.3","172.20.0.2","TCP","59532 → 4433 [SYN] Seq=0 Win=64240 Len=0 MSS=1460 SACK_PERM TSval=1320803780 TSecr=0 WS=128"
"131","0.591038040","74","ba:7d:c6:88:c0:c9","ee:ae:37:14:76:d2","172.20.0.2","172.20.0.3","TCP","4433 → 59532 [SYN, ACK] Seq=0 Ack=1 Win=65160 Len=0 MSS=1460 SACK_PERM TSval=1511719575 TSecr=1320803780 WS=128"
"132","0.591058650","66","ee:ae:37:14:76:d2","ba:7d:c6:88:c0:c9","172.20.0.3","172.20.0.2","TCP","59532 → 4433 [ACK] Seq=1 Ack=1 Win=64256 Len=0 TSval=1320803780 TSecr=1511719575"
"133","0.591110931","2189","ee:ae:37:14:76:d2","ba:7d:c6:88:c0:c9","172.20.0.3","172.20.0.2","TLSv1.2","Client Hello"
"134","0.591117042","66","ba:7d:c6:88:c0:c9","ee:ae:37:14:76:d2","172.20.0.2","172.20.0.3","TCP","4433 → 59532 [ACK] Seq=1 Ack=2124 Win=64128 Len=0 TSval=1511719575 TSecr=1320803780"
"135","0.604808333","2676","ba:7d:c6:88:c0:c9","ee:ae:37:14:76:d2","172.20.0.2","172.20.0.3","TLSv1.3","Server Hello, Change Cipher Spec, Application Data, Application Data, Application Data, Application Data"
"136","0.604873975","66","ee:ae:37:14:76:d2","ba:7d:c6:88:c0:c9","172.20.0.3","172.20.0.2","TCP","59532 → 4433 [ACK] Seq=2124 Ack=2611 Win=64128 Len=0 TSval=1320803793 TSecr=1511719588"
"137","0.614750855","146","ee:ae:37:14:76:d2","ba:7d:c6:88:c0:c9","172.20.0.3","172.20.0.2","TLSv1.3","Change Cipher Spec, Application Data"
"138","0.614849325","66","ee:ae:37:14:76:d2","ba:7d:c6:88:c0:c9","172.20.0.3","172.20.0.2","TCP","59532 → 4433 [RST, ACK] Seq=2204 Ack=2611 Win=64128 Len=0 TSval=1320803803 TSecr=1511719588"
"139","0.631367385","74","ee:ae:37:14:76:d2","ba:7d:c6:88:c0:c9","172.20.0.3","172.20.0.2","TCP","59548 → 4433 [SYN] Seq=0 Win=64240 Len=0 MSS=1460 SACK_PERM TSval=1320803820 TSecr=0 WS=128"
"140","0.631393644","74","ba:7d:c6:88:c0:c9","ee:ae:37:14:76:d2","172.20.0.2","172.20.0.3","TCP","4433 → 59548 [SYN, ACK] Seq=0 Ack=1 Win=65160 Len=0 MSS=1460 SACK_PERM TSval=1511719615 TSecr=1320803820 WS=128"
"141","0.631413438","66","ee:ae:37:14:76:d2","ba:7d:c6:88:c0:c9","172.20.0.3","172.20.0.2","TCP","59548 → 4433 [ACK] Seq=1 Ack=1 Win=64256 Len=0 TSval=1320803820 TSecr=1511719615"
"142","0.631454646","2189","ee:ae:37:14:76:d2","ba:7d:c6:88:c0:c9","172.20.0.3","172.20.0.2","TLSv1.2","Client Hello"
"143","0.631460766","66","ba:7d:c6:88:c0:c9","ee:ae:37:14:76:d2","172.20.0.2","172.20.0.3","TCP","4433 → 59548 [ACK] Seq=1 Ack=2124 Win=64128 Len=0 TSval=1511719615 TSecr=1320803820"
"144","0.643588395","2677","ba:7d:c6:88:c0:c9","ee:ae:37:14:76:d2","172.20.0.2","172.20.0.3","TLSv1.3","Server Hello, Change Cipher Spec, Application Data, Application Data, Application Data, Application Data"
"145","0.643639372","66","ee:ae:37:14:76:d2","ba:7d:c6:88:c0:c9","172.20.0.3","172.20.0.2","TCP","59548 → 4433 [ACK] Seq=2124 Ack=2612 Win=64128 Len=0 TSval=1320803832 TSecr=1511719627"
"146","0.653393021","146","ee:ae:37:14:76:d2","ba:7d:c6:88:c0:c9","172.20.0.3","172.20.0.2","TLSv1.3","Change Cipher Spec, Application Data"
"147","0.653482006","66","ee:ae:37:14:76:d2","ba:7d:c6:88:c0:c9","172.20.0.3","172.20.0.2","TCP","59548 → 4433 [RST, ACK] Seq=2204 Ack=2612 Win=64128 Len=0 TSval=1320803842 TSecr=1511719627"
"148","0.669540537","74","ee:ae:37:14:76:d2","ba:7d:c6:88:c0:c9","172.20.0.3","172.20.0.2","TCP","59562 → 4433 [SYN] Seq=0 Win=64240 Len=0 MSS=1460 SACK_PERM TSval=1320803858 TSecr=0 WS=128"
"149","0.669567819","74","ba:7d:c6:88:c0:c9","ee:ae:37:14:76:d2","172.20.0.2","172.20.0.3","TCP","4433 → 59562 [SYN, ACK] Seq=0 Ack=1 Win=65160 Len=0 MSS=1460 SACK_PERM TSval=1511719653 TSecr=1320803858 WS=128"
"150","0.669587991","66","ee:ae:37:14:76:d2","ba:7d:c6:88:c0:c9","172.20.0.3","172.20.0.2","TCP","59562 → 4433 [ACK] Seq=1 Ack=1 Win=64256 Len=0 TSval=1320803858 TSecr=1511719653"
"151","0.669635450","2189","ee:ae:37:14:76:d2","ba:7d:c6:88:c0:c9","172.20.0.3","172.20.0.2","TLSv1.2","Client Hello"
"152","0.669641582","66","ba:7d:c6:88:c0:c9","ee:ae:37:14:76:d2","172.20.0.2","172.20.0.3","TCP","4433 → 59562 [ACK] Seq=1 Ack=2124 Win=64128 Len=0 TSval=1511719653 TSecr=1320803858"
"153","0.681672726","2678","ba:7d:c6:88:c0:c9","ee:ae:37:14:76:d2","172.20.0.2","172.20.0.3","TLSv1.3","Server Hello, Change Cipher Spec, Application Data, Application Data, Application Data, Application Data"
"154","0.681710182","66","ee:ae:37:14:76:d2","ba:7d:c6:88:c0:c9","172.20.0.3","172.20.0.2","TCP","59562 → 4433 [ACK] Seq=2124 Ack=2613 Win=64128 Len=0 TSval=1320803870 TSecr=1511719665"
"155","0.690886826","146","ee:ae:37:14:76:d2","ba:7d:c6:88:c0:c9","172.20.0.3","172.20.0.2","TLSv1.3","Change Cipher Spec, Application Data"
"156","0.690982171","66","ee:ae:37:14:76:d2","ba:7d:c6:88:c0:c9","172.20.0.3","172.20.0.2","TCP","59562 → 4433 [RST, ACK] Seq=2204 Ack=2613 Win=64128 Len=0 TSval=1320803880 TSecr=1511719665"
"157","0.707493492","74","ee:ae:37:14:76:d2","ba:7d:c6:88:c0:c9","172.20.0.3","172.20.0.2","TCP","59570 → 4433 [SYN] Seq=0 Win=64240 Len=0 MSS=1460 SACK_PERM TSval=1320803896 TSecr=0 WS=128"
"158","0.707518454","74","ba:7d:c6:88:c0:c9","ee:ae:37:14:76:d2","172.20.0.2","172.20.0.3","TCP","4433 → 59570 [SYN, ACK] Seq=0 Ack=1 Win=65160 Len=0 MSS=1460 SACK_PERM TSval=1511719691 TSecr=1320803896 WS=128"
"159","0.707538037","66","ee:ae:37:14:76:d2","ba:7d:c6:88:c0:c9","172.20.0.3","172.20.0.2","TCP","59570 → 4433 [ACK] Seq=1 Ack=1 Win=64256 Len=0 TSval=1320803896 TSecr=1511719691"
"160","0.707583425","2189","ee:ae:37:14:76:d2","ba:7d:c6:88:c0:c9","172.20.0.3","172.20.0.2","TLSv1.2","Client Hello"
"161","0.707589339","66","ba:7d:c6:88:c0:c9","ee:ae:37:14:76:d2","172.20.0.2","172.20.0.3","TCP","4433 → 59570 [ACK] Seq=1 Ack=2124 Win=64128 Len=0 TSval=1511719691 TSecr=1320803896"
"162","0.719674565","2678","ba:7d:c6:88:c0:c9","ee:ae:37:14:76:d2","172.20.0.2","172.20.0.3","TLSv1.3","Server Hello, Change Cipher Spec, Application Data, Application Data, Application Data, Application Data"
"163","0.719728321","66","ee:ae:37:14:76:d2","ba:7d:c6:88:c0:c9","172.20.0.3","172.20.0.2","TCP","59570 → 4433 [ACK] Seq=2124 Ack=2613 Win=64128 Len=0 TSval=1320803908 TSecr=1511719703"
"164","0.729346685","146","ee:ae:37:14:76:d2","ba:7d:c6:88:c0:c9","172.20.0.3","172.20.0.2","TLSv1.3","Change Cipher Spec, Application Data"
"165","0.729430098","66","ee:ae:37:14:76:d2","ba:7d:c6:88:c0:c9","172.20.0.3","172.20.0.2","TCP","59570 → 4433 [RST, ACK] Seq=2204 Ack=2613 Win=64128 Len=0 TSval=1320803918 TSecr=1511719703"
"166","0.746599003","74","ee:ae:37:14:76:d2","ba:7d:c6:88:c0:c9","172.20.0.3","172.20.0.2","TCP","59574 → 4433 [SYN] Seq=0 Win=64240 Len=0 MSS=1460 SACK_PERM TSval=1320803935 TSecr=0 WS=128"
"167","0.746627826","74","ba:7d:c6:88:c0:c9","ee:ae:37:14:76:d2","172.20.0.2","172.20.0.3","TCP","4433 → 59574 [SYN, ACK] Seq=0 Ack=1 Win=65160 Len=0 MSS=1460 SACK_PERM TSval=1511719730 TSecr=1320803935 WS=128"
"168","0.746648432","66","ee:ae:37:14:76:d2","ba:7d:c6:88:c0:c9","172.20.0.3","172.20.0.2","TCP","59574 → 4433 [ACK] Seq=1 Ack=1 Win=64256 Len=0 TSval=1320803935 TSecr=1511719730"
"169","0.746710336","2189","ee:ae:37:14:76:d2","ba:7d:c6:88:c0:c9","172.20.0.3","172.20.0.2","TLSv1.2","Client Hello"
"170","0.746716948","66","ba:7d:c6:88:c0:c9","ee:ae:37:14:76:d2","172.20.0.2","172.20.0.3","TCP","4433 → 59574 [ACK] Seq=1 Ack=2124 Win=64128 Len=0 TSval=1511719730 TSecr=1320803935"
"171","0.758732572","2678","ba:7d:c6:88:c0:c9","ee:ae:37:14:76:d2","172.20.0.2","172.20.0.3","TLSv1.3","Server Hello, Change Cipher Spec, Application Data, Application Data, Application Data, Application Data"
"172","0.758787684","66","ee:ae:37:14:76:d2","ba:7d:c6:88:c0:c9","172.20.0.3","172.20.0.2","TCP","59574 → 4433 [ACK] Seq=2124 Ack=2613 Win=64128 Len=0 TSval=1320803947 TSecr=1511719742"
"173","0.768705035","146","ee:ae:37:14:76:d2","ba:7d:c6:88:c0:c9","172.20.0.3","172.20.0.2","TLSv1.3","Change Cipher Spec, Application Data"
"174","0.768798604","66","ee:ae:37:14:76:d2","ba:7d:c6:88:c0:c9","172.20.0.3","172.20.0.2","TCP","59574 → 4433 [RST, ACK] Seq=2204 Ack=2613 Win=64128 Len=0 TSval=1320803957 TSecr=1511719742"
"175","0.786625257","74","ee:ae:37:14:76:d2","ba:7d:c6:88:c0:c9","172.20.0.3","172.20.0.2","TCP","59586 → 4433 [SYN] Seq=0 Win=64240 Len=0 MSS=1460 SACK_PERM TSval=1320803975 TSecr=0 WS=128"
"176","0.786654912","74","ba:7d:c6:88:c0:c9","ee:ae:37:14:76:d2","172.20.0.2","172.20.0.3","TCP","4433 → 59586 [SYN, ACK] Seq=0 Ack=1 Win=65160 Len=0 MSS=1460 SACK_PERM TSval=1511719770 TSecr=1320803975 WS=128"
"177","0.786674973","66","ee:ae:37:14:76:d2","ba:7d:c6:88:c0:c9","172.20.0.3","172.20.0.2","TCP","59586 → 4433 [ACK] Seq=1 Ack=1 Win=64256 Len=0 TSval=1320803975 TSecr=1511719770"
"178","0.786719895","2189","ee:ae:37:14:76:d2","ba:7d:c6:88:c0:c9","172.20.0.3","172.20.0.2","TLSv1.2","Client Hello"
"179","0.790979311","741","ee:ae:37:14:76:d2","ba:7d:c6:88:c0:c9","172.20.0.3","172.20.0.2","TCP","[TCP Retransmission] 59586 → 4433 [PSH, ACK] Seq=1449 Ack=1 Win=64256 Len=675 TSval=1320803980 TSecr=1511719770"
"180","0.803988579","1229","ba:7d:c6:88:c0:c9","ee:ae:37:14:76:d2","172.20.0.2","172.20.0.3","SSL","[TCP Previous segment not captured] , Continuation Data"
"181","0.804039727","78","ee:ae:37:14:76:d2","ba:7d:c6:88:c0:c9","172.20.0.3","172.20.0.2","TCP","[TCP Dup ACK 177#1] 59586 → 4433 [ACK] Seq=2124 Ack=1 Win=64256 Len=0 TSval=1320803993 TSecr=1511719770 SLE=1449 SRE=2612"
"182","0.804049836","1514","ba:7d:c6:88:c0:c9","ee:ae:37:14:76:d2","172.20.0.2","172.20.0.3","TCP","[TCP Retransmission] 4433 → 59586 [ACK] Seq=1 Ack=2124 Win=64128 Len=1448 TSval=1511719788 TSecr=1320803993"
"183","0.804066525","66","ee:ae:37:14:76:d2","ba:7d:c6:88:c0:c9","172.20.0.3","172.20.0.2","TCP","59586 → 4433 [ACK] Seq=2124 Ack=2612 Win=64128 Len=0 TSval=1320803993 TSecr=1511719788"
"184","0.813571146","146","ee:ae:37:14:76:d2","ba:7d:c6:88:c0:c9","172.20.0.3","172.20.0.2","TLSv1.2","Change Cipher Spec, Application Data"
"185","0.813645132","66","ee:ae:37:14:76:d2","ba:7d:c6:88:c0:c9","172.20.0.3","172.20.0.2","TCP","59586 → 4433 [RST, ACK] Seq=2204 Ack=2612 Win=64128 Len=0 TSval=1320804002 TSecr=1511719788"
"186","0.829582979","74","ee:ae:37:14:76:d2","ba:7d:c6:88:c0:c9","172.20.0.3","172.20.0.2","TCP","59596 → 4433 [SYN] Seq=0 Win=64240 Len=0 MSS=1460 SACK_PERM TSval=1320804018 TSecr=0 WS=128"
"187","1.000541712","42","ee:ae:37:14:76:d2","ff:ff:ff:ff:ff:ff",,,"ARP","ARP Announcement for 172.20.0.3"
"188","1.880021042","74","ba:7d:c6:88:c0:c9","ee:ae:37:14:76:d2","172.20.0.2","172.20.0.3","TCP","4433 → 59596 [SYN, ACK] Seq=0 Ack=1 Win=65160 Len=0 MSS=1460 SACK_PERM TSval=1511720864 TSecr=1320804018 WS=128"
"189","1.880070621","74","ee:ae:37:14:76:d2","ba:7d:c6:88:c0:c9","172.20.0.3","172.20.0.2","TCP","[TCP Retransmission] 59596 → 4433 [SYN] Seq=0 Win=64240 Len=0 MSS=1460 SACK_PERM TSval=1320805069 TSecr=0 WS=128"
"190","1.880091742","74","ba:7d:c6:88:c0:c9","ee:ae:37:14:76:d2","172.20.0.2","172.20.0.3","TCP","[TCP Out-Of-Order] 4433 → 59596 [SYN, ACK] Seq=0 Ack=1 Win=65160 Len=0 MSS=1460 SACK_PERM TSval=1511720864 TSecr=1320804018 WS=128"
"191","1.880162077","66","ee:ae:37:14:76:d2","ba:7d:c6:88:c0:c9","172.20.0.3","172.20.0.2","TCP","59596 → 4433 [ACK] Seq=1 Ack=1 Win=64256 Len=0 TSval=1320805069 TSecr=1511720864"
"192","1.880204608","66","ee:ae:37:14:76:d2","ba:7d:c6:88:c0:c9","172.20.0.3","172.20.0.2","TCP","[TCP Dup ACK 191#1] 59596 → 4433 [ACK] Seq=1 Ack=1 Win=64256 Len=0 TSval=1320805069 TSecr=1511720864"
"193","1.880247160","2189","ee:ae:37:14:76:d2","ba:7d:c6:88:c0:c9","172.20.0.3","172.20.0.2","TLSv1.2","Client Hello"
"194","1.892533176","1514","ba:7d:c6:88:c0:c9","ee:ae:37:14:76:d2","172.20.0.2","172.20.0.3","SSL",""
"195","1.892588054","66","ee:ae:37:14:76:d2","ba:7d:c6:88:c0:c9","172.20.0.3","172.20.0.2","TCP","59596 → 4433 [ACK] Seq=2124 Ack=1449 Win=64128 Len=0 TSval=1320805081 TSecr=1511720876"
"196","1.892598318","1229","ba:7d:c6:88:c0:c9","ee:ae:37:14:76:d2","172.20.0.2","172.20.0.3","TLSv1.3","Server Hello, Change Cipher Spec, Application Data, Application Data, Application Data, Application Data"
"197","1.892604491","66","ee:ae:37:14:76:d2","ba:7d:c6:88:c0:c9","172.20.0.3","172.20.0.2","TCP","59596 → 4433 [ACK] Seq=2124 Ack=2612 Win=64128 Len=0 TSval=1320805081 TSecr=1511720876"
"198","1.902252069","146","ee:ae:37:14:76:d2","ba:7d:c6:88:c0:c9","172.20.0.3","172.20.0.2","TLSv1.3","Change Cipher Spec, Application Data"
"199","1.902349992","66","ee:ae:37:14:76:d2","ba:7d:c6:88:c0:c9","172.20.0.3","172.20.0.2","TCP","59596 → 4433 [RST, ACK] Seq=2204 Ack=2612 Win=64128 Len=0 TSval=1320805091 TSecr=1511720876"
"200","1.918966320","74","ee:ae:37:14:76:d2","ba:7d:c6:88:c0:c9","172.20.0.3","172.20.0.2","TCP","59610 → 4433 [SYN] Seq=0 Win=64240 Len=0 MSS=1460 SACK_PERM TSval=1320805107 TSecr=0 WS=128"
"201","1.918997352","74","ba:7d:c6:88:c0:c9","ee:ae:37:14:76:d2","172.20.0.2","172.20.0.3","TCP","4433 → 59610 [SYN, ACK] Seq=0 Ack=1 Win=65160 Len=0 MSS=1460 SACK_PERM TSval=1511720903 TSecr=1320805107 WS=128"
"202","1.919019570","66","ee:ae:37:14:76:d2","ba:7d:c6:88:c0:c9","172.20.0.3","172.20.0.2","TCP","59610 → 4433 [ACK] Seq=1 Ack=1 Win=64256 Len=0 TSval=1320805108 TSecr=1511720903"
"203","1.919083734","2189","ee:ae:37:14:76:d2","ba:7d:c6:88:c0:c9","172.20.0.3","172.20.0.2","TLSv1.2","Client Hello"
"204","1.919090353","66","ba:7d:c6:88:c0:c9","ee:ae:37:14:76:d2","172.20.0.2","172.20.0.3","TCP","4433 → 59610 [ACK] Seq=1 Ack=2124 Win=64128 Len=0 TSval=1511720903 TSecr=1320805108"
"205","1.930987707","2677","ba:7d:c6:88:c0:c9","ee:ae:37:14:76:d2","172.20.0.2","172.20.0.3","TLSv1.3","Server Hello, Change Cipher Spec, Application Data, Application Data, Application Data, Application Data"
"206","1.931048183","66","ee:ae:37:14:76:d2","ba:7d:c6:88:c0:c9","172.20.0.3","172.20.0.2","TCP","59610 → 4433 [ACK] Seq=2124 Ack=2612 Win=64128 Len=0 TSval=1320805120 TSecr=1511720915"
"207","1.940408831","146","ee:ae:37:14:76:d2","ba:7d:c6:88:c0:c9","172.20.0.3","172.20.0.2","TLSv1.3","Change Cipher Spec, Application Data"
"208","1.940490160","66","ee:ae:37:14:76:d2","ba:7d:c6:88:c0:c9","172.20.0.3","172.20.0.2","TCP","59610 → 4433 [RST, ACK] Seq=2204 Ack=2612 Win=64128 Len=0 TSval=1320805129 TSecr=1511720915"
"209","1.956822297","74","ee:ae:37:14:76:d2","ba:7d:c6:88:c0:c9","172.20.0.3","172.20.0.2","TCP","59616 → 4433 [SYN] Seq=0 Win=64240 Len=0 MSS=1460 SACK_PERM TSval=1320805145 TSecr=0 WS=128"
"210","1.956860809","74","ba:7d:c6:88:c0:c9","ee:ae:37:14:76:d2","172.20.0.2","172.20.0.3","TCP","4433 → 59616 [SYN, ACK] Seq=0 Ack=1 Win=65160 Len=0 MSS=1460 SACK_PERM TSval=1511720940 TSecr=1320805145 WS=128"
"211","1.956883735","66","ee:ae:37:14:76:d2","ba:7d:c6:88:c0:c9","172.20.0.3","172.20.0.2","TCP","59616 → 4433 [ACK] Seq=1 Ack=1 Win=64256 Len=0 TSval=1320805145 TSecr=1511720940"
"212","1.956932790","2189","ee:ae:37:14:76:d2","ba:7d:c6:88:c0:c9","172.20.0.3","172.20.0.2","TLSv1.2","Client Hello"
"213","1.956963758","66","ba:7d:c6:88:c0:c9","ee:ae:37:14:76:d2","172.20.0.2","172.20.0.3","TCP","4433 → 59616 [ACK] Seq=1 Ack=2124 Win=64128 Len=0 TSval=1511720940 TSecr=1320805145"
"214","1.972969978","1230","ba:7d:c6:88:c0:c9","ee:ae:37:14:76:d2","172.20.0.2","172.20.0.3","SSL","[TCP Previous segment not captured] , Continuation Data"
"215","1.973017703","78","ee:ae:37:14:76:d2","ba:7d:c6:88:c0:c9","172.20.0.3","172.20.0.2","TCP","[TCP Dup ACK 211#1] 59616 → 4433 [ACK] Seq=2124 Ack=1 Win=64256 Len=0 TSval=1320805162 TSecr=1511720940 SLE=1449 SRE=2613"
"216","2.001121880","42","ee:ae:37:14:76:d2","ff:ff:ff:ff:ff:ff",,,"ARP","ARP Announcement for 172.20.0.3"
"217","2.175998063","1514","ba:7d:c6:88:c0:c9","ee:ae:37:14:76:d2","172.20.0.2","172.20.0.3","TCP","[TCP Retransmission] 4433 → 59616 [ACK] Seq=1 Ack=2124 Win=64128 Len=1448 TSval=1511721160 TSecr=1320805162"
"218","2.176064959","66","ee:ae:37:14:76:d2","ba:7d:c6:88:c0:c9","172.20.0.3","172.20.0.2","TCP","59616 → 4433 [ACK] Seq=2124 Ack=2613 Win=64128 Len=0 TSval=1320805365 TSecr=1511721160"
"219","2.185384384","146","ee:ae:37:14:76:d2","ba:7d:c6:88:c0:c9","172.20.0.3","172.20.0.2","TLSv1.2","Change Cipher Spec, Application Data"
"220","2.185479284","66","ee:ae:37:14:76:d2","ba:7d:c6:88:c0:c9","172.20.0.3","172.20.0.2","TCP","59616 → 4433 [RST, ACK] Seq=2204 Ack=2613 Win=64128 Len=0 TSval=1320805374 TSecr=1511721160"
"221","2.201798781","74","ee:ae:37:14:76:d2","ba:7d:c6:88:c0:c9","172.20.0.3","172.20.0.2","TCP","59622 → 4433 [SYN] Seq=0 Win=64240 Len=0 MSS=1460 SACK_PERM TSval=1320805390 TSecr=0 WS=128"
"222","2.201831448","74","ba:7d:c6:88:c0:c9","ee:ae:37:14:76:d2","172.20.0.2","172.20.0.3","TCP","4433 → 59622 [SYN, ACK] Seq=0 Ack=1 Win=65160 Len=0 MSS=1460 SACK_PERM TSval=1511721185 TSecr=1320805390 WS=128"
"223","2.201852899","66","ee:ae:37:14:76:d2","ba:7d:c6:88:c0:c9","172.20.0.3","172.20.0.2","TCP","59622 → 4433 [ACK] Seq=1 Ack=1 Win=64256 Len=0 TSval=1320805390 TSecr=1511721185"
"224","2.201914590","2189","ee:ae:37:14:76:d2","ba:7d:c6:88:c0:c9","172.20.0.3","172.20.0.2","TLSv1.2","Client Hello"
