frame.number,frame.time_relative,frame.len,eth.src,eth.dst,ip.src,ip.dst,_ws.col.protocol,_ws.col.info
"1","0.000000000","42","96:7c:b6:e2:ef:b0","ff:ff:ff:ff:ff:ff",,,"ARP","ARP Announcement for 172.20.0.3"
"2","0.029340663","42","96:7c:b6:e2:ef:b0","ff:ff:ff:ff:ff:ff",,,"ARP","Who has 172.20.0.2? Tell 172.20.0.3"
"3","0.029364811","42","02:bf:04:cd:22:e3","96:7c:b6:e2:ef:b0",,,"ARP","172.20.0.2 is at 02:bf:04:cd:22:e3"
"4","0.029372044","74","96:7c:b6:e2:ef:b0","02:bf:04:cd:22:e3","172.20.0.3","172.20.0.2","TCP","57864 → 4433 [SYN] Seq=0 Win=64240 Len=0 MSS=1460 SACK_PERM TSval=1321679860 TSecr=0 WS=128"
"5","0.029391904","74","02:bf:04:cd:22:e3","96:7c:b6:e2:ef:b0","172.20.0.2","172.20.0.3","TCP","4433 → 57864 [SYN, ACK] Seq=0 Ack=1 Win=65160 Len=0 MSS=1460 SACK_PERM TSval=1512595655 TSecr=1321679860 WS=128"
"6","0.029410873","66","96:7c:b6:e2:ef:b0","02:bf:04:cd:22:e3","172.20.0.3","172.20.0.2","TCP","57864 → 4433 [ACK] Seq=1 Ack=1 Win=64256 Len=0 TSval=1321679860 TSecr=1512595655"
"7","0.029450238","2056","96:7c:b6:e2:ef:b0","02:bf:04:cd:22:e3","172.20.0.3","172.20.0.2","TLSv1.2","Client Hello"
"8","0.029456451","66","02:bf:04:cd:22:e3","96:7c:b6:e2:ef:b0","172.20.0.2","172.20.0.3","TCP","4433 → 57864 [ACK] Seq=1 Ack=1991 Win=64128 Len=0 TSval=1512595655 TSecr=1321679860"
"9","0.033015695","2545","02:bf:04:cd:22:e3","96:7c:b6:e2:ef:b0","172.20.0.2","172.20.0.3","TLSv1.3","Server Hello, Change Cipher Spec, Application Data, Application Data, Application Data, Application Data"
"10","0.033048883","66","96:7c:b6:e2:ef:b0","02:bf:04:cd:22:e3","172.20.0.3","172.20.0.2","TCP","57864 → 4433 [ACK] Seq=1991 Ack=2480 Win=64128 Len=0 TSval=1321679864 TSecr=1512595659"
"11","0.037935939","146","96:7c:b6:e2:ef:b0","02:bf:04:cd:22:e3","172.20.0.3","172.20.0.2","TLSv1.3","Change Cipher Spec, Application Data"
"12","0.038002490","66","96:7c:b6:e2:ef:b0","02:bf:04:cd:22:e3","172.20.0.3","172.20.0.2","TCP","57864 → 4433 [RST, ACK] Seq=2071 Ack=2480 Win=64128 Len=0 TSval=1321679869 TSecr=1512595659"
"13","0.048010326","74","96:7c:b6:e2:ef:b0","02:bf:04:cd:22:e3","172.20.0.3","172.20.0.2","TCP","57872 → 4433 [SYN] Seq=0 Win=64240 Len=0 MSS=1460 SACK_PERM TSval=1321679879 TSecr=0 WS=128"
"14","0.048036202","74","02:bf:04:cd:22:e3","96:7c:b6:e2:ef:b0","172.20.0.2","172.20.0.3","TCP","4433 → 57872 [SYN, ACK] Seq=0 Ack=1 Win=65160 Len=0 MSS=1460 SACK_PERM TSval=1512595674 TSecr=1321679879 WS=128"
"15","0.048053750","66","96:7c:b6:e2:ef:b0","02:bf:04:cd:22:e3","172.20.0.3","172.20.0.2","TCP","57872 → 4433 [ACK] Seq=1 Ack=1 Win=64256 Len=0 TSval=1321679879 TSecr=1512595674"
"16","0.048091562","2056","96:7c:b6:e2:ef:b0","02:bf:04:cd:22:e3","172.20.0.3","172.20.0.2","TLSv1.2","Client Hello"
"17","0.048096633","66","02:bf:04:cd:22:e3","96:7c:b6:e2:ef:b0","172.20.0.2","172.20.0.3","TCP","4433 → 57872 [ACK] Seq=1 Ack=1991 Win=64128 Len=0 TSval=1512595674 TSecr=1321679879"
"18","0.051182287","2544","02:bf:04:cd:22:e3","96:7c:b6:e2:ef:b0","172.20.0.2","172.20.0.3","TLSv1.3","Server Hello, Change Cipher Spec, Application Data, Application Data, Application Data, Application Data"
"19","0.051211175","66","96:7c:b6:e2:ef:b0","02:bf:04:cd:22:e3","172.20.0.3","172.20.0.2","TCP","57872 → 4433 [ACK] Seq=1991 Ack=2479 Win=64128 Len=0 TSval=1321679882 TSecr=1512595677"
"20","0.056124919","146","96:7c:b6:e2:ef:b0","02:bf:04:cd:22:e3","172.20.0.3","172.20.0.2","TLSv1.3","Change Cipher Spec, Application Data"
"21","0.056185842","66","96:7c:b6:e2:ef:b0","02:bf:04:cd:22:e3","172.20.0.3","172.20.0.2","TCP","57872 → 4433 [RST, ACK] Seq=2071 Ack=2479 Win=64128 Len=0 TSval=1321679887 TSecr=1512595677"
"22","0.067360316","74","96:7c:b6:e2:ef:b0","02:bf:04:cd:22:e3","172.20.0.3","172.20.0.2","TCP","57888 → 4433 [SYN] Seq=0 Win=64240 Len=0 MSS=1460 SACK_PERM TSval=1321679898 TSecr=0 WS=128"
"23","0.067386445","74","02:bf:04:cd:22:e3","96:7c:b6:e2:ef:b0","172.20.0.2","172.20.0.3","TCP","4433 → 57888 [SYN, ACK] Seq=0 Ack=1 Win=65160 Len=0 MSS=1460 SACK_PERM TSval=1512595693 TSecr=1321679898 WS=128"
"24","0.067404424","66","96:7c:b6:e2:ef:b0","02:bf:04:cd:22:e3","172.20.0.3","172.20.0.2","TCP","57888 → 4433 [ACK] Seq=1 Ack=1 Win=64256 Len=0 TSval=1321679898 TSecr=1512595693"
"25","0.067456040","2056","96:7c:b6:e2:ef:b0","02:bf:04:cd:22:e3","172.20.0.3","172.20.0.2","TLSv1.2","Client Hello"
"26","0.067461443","66","02:bf:04:cd:22:e3","96:7c:b6:e2:ef:b0","172.20.0.2","172.20.0.3","TCP","4433 → 57888 [ACK] Seq=1 Ack=1991 Win=64128 Len=0 TSval=1512595693 TSecr=1321679898"
"27","0.070740907","2544","02:bf:04:cd:22:e3","96:7c:b6:e2:ef:b0","172.20.0.2","172.20.0.3","TLSv1.3","Server Hello, Change Cipher Spec, Application Data, Application Data, Application Data, Application Data"
"28","0.070775904","66","96:7c:b6:e2:ef:b0","02:bf:04:cd:22:e3","172.20.0.3","172.20.0.2","TCP","57888 → 4433 [ACK] Seq=1991 Ack=2479 Win=64128 Len=0 TSval=1321679902 TSecr=1512595697"
"29","0.075726717","146","96:7c:b6:e2:ef:b0","02:bf:04:cd:22:e3","172.20.0.3","172.20.0.2","TLSv1.3","Change Cipher Spec, Application Data"
"30","0.075794244","66","96:7c:b6:e2:ef:b0","02:bf:04:cd:22:e3","172.20.0.3","172.20.0.2","TCP","57888 → 4433 [RST, ACK] Seq=2071 Ack=2479 Win=64128 Len=0 TSval=1321679907 TSecr=1512595697"
"31","0.086415378","74","96:7c:b6:e2:ef:b0","02:bf:04:cd:22:e3","172.20.0.3","172.20.0.2","TCP","57896 → 4433 [SYN] Seq=0 Win=64240 Len=0 MSS=1460 SACK_PERM TSval=1321679917 TSecr=0 WS=128"
"32","0.086445077","74","02:bf:04:cd:22:e3","96:7c:b6:e2:ef:b0","172.20.0.2","172.20.0.3","TCP","4433 → 57896 [SYN, ACK] Seq=0 Ack=1 Win=65160 Len=0 MSS=1460 SACK_PERM TSval=1512595712 TSecr=1321679917 WS=128"
"33","0.086464814","66","96:7c:b6:e2:ef:b0","02:bf:04:cd:22:e3","172.20.0.3","172.20.0.2","TCP","57896 → 4433 [ACK] Seq=1 Ack=1 Win=64256 Len=0 TSval=1321679917 TSecr=1512595712"
"34","0.086519270","2056","96:7c:b6:e2:ef:b0","02:bf:04:cd:22:e3","172.20.0.3","172.20.0.2","TLSv1.2","Client Hello"
"35","0.086527140","66","02:bf:04:cd:22:e3","96:7c:b6:e2:ef:b0","172.20.0.2","172.20.0.3","TCP","4433 → 57896 [ACK] Seq=1 Ack=1991 Win=64128 Len=0 TSval=1512595712 TSecr=1321679917"
"36","0.089716710","2545","02:bf:04:cd:22:e3","96:7c:b6:e2:ef:b0","172.20.0.2","172.20.0.3","TLSv1.3","Server Hello, Change Cipher Spec, Application Data, Application Data, Application Data, Application Data"
"37","0.089762640","66","96:7c:b6:e2:ef:b0","02:bf:04:cd:22:e3","172.20.0.3","172.20.0.2","TCP","57896 → 4433 [ACK] Seq=1991 Ack=2480 Win=64128 Len=0 TSval=1321679921 TSecr=1512595716"
"38","0.094758292","146","96:7c:b6:e2:ef:b0","02:bf:04:cd:22:e3","172.20.0.3","172.20.0.2","TLSv1.3","Change Cipher Spec, Application Data"
"39","0.094821254","66","96:7c:b6:e2:ef:b0","02:bf:04:cd:22:e3","172.20.0.3","172.20.0.2","TCP","57896 → 4433 [RST, ACK] Seq=2071 Ack=2480 Win=64128 Len=0 TSval=1321679926 TSecr=1512595716"
"40","0.105372948","74","96:7c:b6:e2:ef:b0","02:bf:04:cd:22:e3","172.20.0.3","172.20.0.2","TCP","57906 → 4433 [SYN] Seq=0 Win=64240 Len=0 MSS=1460 SACK_PERM TSval=1321679936 TSecr=0 WS=128"
"41","0.105411831","74","02:bf:04:cd:22:e3","96:7c:b6:e2:ef:b0","172.20.0.2","172.20.0.3","TCP","4433 → 57906 [SYN, ACK] Seq=0 Ack=1 Win=65160 Len=0 MSS=1460 SACK_PERM TSval=1512595731 TSecr=1321679936 WS=128"
"42","0.105437183","66","96:7c:b6:e2:ef:b0","02:bf:04:cd:22:e3","172.20.0.3","172.20.0.2","TCP","57906 → 4433 [ACK] Seq=1 Ack=1 Win=64256 Len=0 TSval=1321679936 TSecr=1512595731"
"43","0.105479539","2056","96:7c:b6:e2:ef:b0","02:bf:04:cd:22:e3","172.20.0.3","172.20.0.2","TLSv1.2","Client Hello"
"44","0.105486703","66","02:bf:04:cd:22:e3","96:7c:b6:e2:ef:b0","172.20.0.2","172.20.0.3","TCP","4433 → 57906 [ACK] Seq=1 Ack=1991 Win=64128 Len=0 TSval=1512595731 TSecr=1321679936"
"45","0.108610720","2545","02:bf:04:cd:22:e3","96:7c:b6:e2:ef:b0","172.20.0.2","172.20.0.3","TLSv1.3","Server Hello, Change Cipher Spec, Application Data, Application Data, Application Data, Application Data"
"46","0.108642957","66","96:7c:b6:e2:ef:b0","02:bf:04:cd:22:e3","172.20.0.3","172.20.0.2","TCP","57906 → 4433 [ACK] Seq=1991 Ack=2480 Win=64128 Len=0 TSval=1321679940 TSecr=1512595734"
"47","0.113612253","146","96:7c:b6:e2:ef:b0","02:bf:04:cd:22:e3","172.20.0.3","172.20.0.2","TLSv1.3","Change Cipher Spec, Application Data"
"48","0.113699360","66","96:7c:b6:e2:ef:b0","02:bf:04:cd:22:e3","172.20.0.3","172.20.0.2","TCP","57906 → 4433 [RST, ACK] Seq=2071 Ack=2480 Win=64128 Len=0 TSval=1321679945 TSecr=1512595734"
"49","0.124238282","74","96:7c:b6:e2:ef:b0","02:bf:04:cd:22:e3","172.20.0.3","172.20.0.2","TCP","57918 → 4433 [SYN] Seq=0 Win=64240 Len=0 MSS=1460 SACK_PERM TSval=1321679955 TSecr=0 WS=128"
"50","0.124261515","74","02:bf:04:cd:22:e3","96:7c:b6:e2:ef:b0","172.20.0.2","172.20.0.3","TCP","4433 → 57918 [SYN, ACK] Seq=0 Ack=1 Win=65160 Len=0 MSS=1460 SACK_PERM TSval=1512595750 TSecr=1321679955 WS=128"
"51","0.124279199","66","96:7c:b6:e2:ef:b0","02:bf:04:cd:22:e3","172.20.0.3","172.20.0.2","TCP","57918 → 4433 [ACK] Seq=1 Ack=1 Win=64256 Len=0 TSval=1321679955 TSecr=1512595750"
"52","0.124328455","2056","96:7c:b6:e2:ef:b0","02:bf:04:cd:22:e3","172.20.0.3","172.20.0.2","TLSv1.2","Client Hello"
"53","0.124333693","66","02:bf:04:cd:22:e3","96:7c:b6:e2:ef:b0","172.20.0.2","172.20.0.3","TCP","4433 → 57918 [ACK] Seq=1 Ack=1991 Win=64128 Len=0 TSval=1512595750 TSecr=1321679955"
"54","0.127840532","2544","02:bf:04:cd:22:e3","96:7c:b6:e2:ef:b0","172.20.0.2","172.20.0.3","TLSv1.3","Server Hello, Change Cipher Spec, Application Data, Application Data, Application Data, Application Data"
"55","0.127872683","66","96:7c:b6:e2:ef:b0","02:bf:04:cd:22:e3","172.20.0.3","172.20.0.2","TCP","57918 → 4433 [ACK] Seq=1991 Ack=2479 Win=64128 Len=0 TSval=1321679959 TSecr=1512595754"
"56","0.132848328","146","96:7c:b6:e2:ef:b0","02:bf:04:cd:22:e3","172.20.0.3","172.20.0.2","TLSv1.3","Change Cipher Spec, Application Data"
"57","0.132917654","66","96:7c:b6:e2:ef:b0","02:bf:04:cd:22:e3","172.20.0.3","172.20.0.2","TCP","57918 → 4433 [RST, ACK] Seq=2071 Ack=2479 Win=64128 Len=0 TSval=1321679964 TSecr=1512595754"
"58","0.143554520","74","96:7c:b6:e2:ef:b0","02:bf:04:cd:22:e3","172.20.0.3","172.20.0.2","TCP","57924 → 4433 [SYN] Seq=0 Win=64240 Len=0 MSS=1460 SACK_PERM TSval=1321679974 TSecr=0 WS=128"
"59","0.143580591","74","02:bf:04:cd:22:e3","96:7c:b6:e2:ef:b0","172.20.0.2","172.20.0.3","TCP","4433 → 57924 [SYN, ACK] Seq=0 Ack=1 Win=65160 Len=0 MSS=1460 SACK_PERM TSval=1512595769 TSecr=1321679974 WS=128"
"60","0.143611229","66","96:7c:b6:e2:ef:b0","02:bf:04:cd:22:e3","172.20.0.3","172.20.0.2","TCP","57924 → 4433 [ACK] Seq=1 Ack=1 Win=64256 Len=0 TSval=1321679974 TSecr=1512595769"
"61","0.143659032","2056","96:7c:b6:e2:ef:b0","02:bf:04:cd:22:e3","172.20.0.3","172.20.0.2","TLSv1.2","Client Hello"
"62","0.143663371","66","02:bf:04:cd:22:e3","96:7c:b6:e2:ef:b0","172.20.0.2","172.20.0.3","TCP","4433 → 57924 [ACK] Seq=1 Ack=1991 Win=64128 Len=0 TSval=1512595770 TSecr=1321679975"
"63","0.146888790","2543","02:bf:04:cd:22:e3","96:7c:b6:e2:ef:b0","172.20.0.2","172.20.0.3","TLSv1.3","Server Hello, Change Cipher Spec, Application Data, Application Data, Application Data, Application Data"
"64","0.146919656","66","96:7c:b6:e2:ef:b0","02:bf:04:cd:22:e3","172.20.0.3","172.20.0.2","TCP","57924 → 4433 [ACK] Seq=1991 Ack=2478 Win=64128 Len=0 TSval=1321679978 TSecr=1512595773"
"65","0.152139110","146","96:7c:b6:e2:ef:b0","02:bf:04:cd:22:e3","172.20.0.3","172.20.0.2","TLSv1.3","Change Cipher Spec, Application Data"
"66","0.152204409","66","96:7c:b6:e2:ef:b0","02:bf:04:cd:22:e3","172.20.0.3","172.20.0.2","TCP","57924 → 4433 [RST, ACK] Seq=2071 Ack=2478 Win=64128 Len=0 TSval=1321679983 TSecr=1512595773"
"67","0.162334976","74","96:7c:b6:e2:ef:b0","02:bf:04:cd:22:e3","172.20.0.3","172.20.0.2","TCP","57926 → 4433 [SYN] Seq=0 Win=64240 Len=0 MSS=1460 SACK_PERM TSval=1321679993 TSecr=0 WS=128"
"68","0.162362022","74","02:bf:04:cd:22:e3","96:7c:b6:e2:ef:b0","172.20.0.2","172.20.0.3","TCP","4433 → 57926 [SYN, ACK] Seq=0 Ack=1 Win=65160 Len=0 MSS=1460 SACK_PERM TSval=1512595788 TSecr=1321679993 WS=128"
"69","0.162380759","66","96:7c:b6:e2:ef:b0","02:bf:04:cd:22:e3","172.20.0.3","172.20.0.2","TCP","57926 → 4433 [ACK] Seq=1 Ack=1 Win=64256 Len=0 TSval=1321679993 TSecr=1512595788"
"70","0.162419597","2056","96:7c:b6:e2:ef:b0","02:bf:04:cd:22:e3","172.20.0.3","172.20.0.2","TLSv1.2","Client Hello"
"71","0.162425024","66","02:bf:04:cd:22:e3","96:7c:b6:e2:ef:b0","172.20.0.2","172.20.0.3","TCP","4433 → 57926 [ACK] Seq=1 Ack=1991 Win=64128 Len=0 TSval=1512595788 TSecr=1321679993"
"72","0.165741422","2545","02:bf:04:cd:22:e3","96:7c:b6:e2:ef:b0","172.20.0.2","172.20.0.3","TLSv1.3","Server Hello, Change Cipher Spec, Application Data, Application Data, Application Data, Application Data"
"73","0.165772448","66","96:7c:b6:e2:ef:b0","02:bf:04:cd:22:e3","172.20.0.3","172.20.0.2","TCP","57926 → 4433 [ACK] Seq=1991 Ack=2480 Win=64128 Len=0 TSval=1321679997 TSecr=1512595792"
"74","0.170666805","146","96:7c:b6:e2:ef:b0","02:bf:04:cd:22:e3","172.20.0.3","172.20.0.2","TLSv1.3","Change Cipher Spec, Application Data"
"75","0.170753297","66","96:7c:b6:e2:ef:b0","02:bf:04:cd:22:e3","172.20.0.3","172.20.0.2","TCP","57926 → 4433 [RST, ACK] Seq=2071 Ack=2480 Win=64128 Len=0 TSval=1321680002 TSecr=1512595792"
"76","0.181740159","74","96:7c:b6:e2:ef:b0","02:bf:04:cd:22:e3","172.20.0.3","172.20.0.2","TCP","57934 → 4433 [SYN] Seq=0 Win=64240 Len=0 MSS=1460 SACK_PERM TSval=1321680013 TSecr=0 WS=128"
"77","0.181767296","74","02:bf:04:cd:22:e3","96:7c:b6:e2:ef:b0","172.20.0.2","172.20.0.3","TCP","4433 → 57934 [SYN, ACK] Seq=0 Ack=1 Win=65160 Len=0 MSS=1460 SACK_PERM TSval=1512595808 TSecr=1321680013 WS=128"
"78","0.181786334","66","96:7c:b6:e2:ef:b0","02:bf:04:cd:22:e3","172.20.0.3","172.20.0.2","TCP","57934 → 4433 [ACK] Seq=1 Ack=1 Win=64256 Len=0 TSval=1321680013 TSecr=1512595808"
"79","0.181833840","2056","96:7c:b6:e2:ef:b0","02:bf:04:cd:22:e3","172.20.0.3","172.20.0.2","TLSv1.2","Client Hello"
"80","0.181841245","66","02:bf:04:cd:22:e3","96:7c:b6:e2:ef:b0","172.20.0.2","172.20.0.3","TCP","4433 → 57934 [ACK] Seq=1 Ack=1991 Win=64128 Len=0 TSval=1512595808 TSecr=1321680013"
"81","0.184996209","2545","02:bf:04:cd:22:e3","96:7c:b6:e2:ef:b0","172.20.0.2","172.20.0.3","TLSv1.3","Server Hello, Change Cipher Spec, Application Data, Application Data, Application Data, Application Data"
"82","0.185040853","66","96:7c:b6:e2:ef:b0","02:bf:04:cd:22:e3","172.20.0.3","172.20.0.2","TCP","57934 → 4433 [ACK] Seq=1991 Ack=2480 Win=64128 Len=0 TSval=1321680016 TSecr=1512595811"
"83","0.190068840","146","96:7c:b6:e2:ef:b0","02:bf:04:cd:22:e3","172.20.0.3","172.20.0.2","TLSv1.3","Change Cipher Spec, Application Data"
"84","0.190146687","66","96:7c:b6:e2:ef:b0","02:bf:04:cd:22:e3","172.20.0.3","172.20.0.2","TCP","57934 → 4433 [RST, ACK] Seq=2071 Ack=2480 Win=64128 Len=0 TSval=1321680021 TSecr=1512595811"
"85","0.200823629","74","96:7c:b6:e2:ef:b0","02:bf:04:cd:22:e3","172.20.0.3","172.20.0.2","TCP","57946 → 4433 [SYN] Seq=0 Win=64240 Len=0 MSS=1460 SACK_PERM TSval=1321680032 TSecr=0 WS=128"
"86","0.200848683","74","02:bf:04:cd:22:e3","96:7c:b6:e2:ef:b0","172.20.0.2","172.20.0.3","TCP","4433 → 57946 [SYN, ACK] Seq=0 Ack=1 Win=65160 Len=0 MSS=1460 SACK_PERM TSval=1512595827 TSecr=1321680032 WS=128"
"87","0.200866587","66","96:7c:b6:e2:ef:b0","02:bf:04:cd:22:e3","172.20.0.3","172.20.0.2","TCP","57946 → 4433 [ACK] Seq=1 Ack=1 Win=64256 Len=0 TSval=1321680032 TSecr=1512595827"
"88","0.200911623","2056","96:7c:b6:e2:ef:b0","02:bf:04:cd:22:e3","172.20.0.3","172.20.0.2","TLSv1.2","Client Hello"
"89","0.200917545","66","02:bf:04:cd:22:e3","96:7c:b6:e2:ef:b0","172.20.0.2","172.20.0.3","TCP","4433 → 57946 [ACK] Seq=1 Ack=1991 Win=64128 Len=0 TSval=1512595827 TSecr=1321680032"
"90","0.204181315","2545","02:bf:04:cd:22:e3","96:7c:b6:e2:ef:b0","172.20.0.2","172.20.0.3","TLSv1.3","Server Hello, Change Cipher Spec, Application Data, Application Data, Application Data, Application Data"
"91","0.204213685","66","96:7c:b6:e2:ef:b0","02:bf:04:cd:22:e3","172.20.0.3","172.20.0.2","TCP","57946 → 4433 [ACK] Seq=1991 Ack=2480 Win=64128 Len=0 TSval=1321680035 TSecr=1512595830"
"92","0.209087105","146","96:7c:b6:e2:ef:b0","02:bf:04:cd:22:e3","172.20.0.3","172.20.0.2","TLSv1.3","Change Cipher Spec, Application Data"
"93","0.209153241","66","96:7c:b6:e2:ef:b0","02:bf:04:cd:22:e3","172.20.0.3","172.20.0.2","TCP","57946 → 4433 [RST, ACK] Seq=2071 Ack=2480 Win=64128 Len=0 TSval=1321680040 TSecr=1512595830"
"94","0.219410490","74","96:7c:b6:e2:ef:b0","02:bf:04:cd:22:e3","172.20.0.3","172.20.0.2","TCP","57956 → 4433 [SYN] Seq=0 Win=64240 Len=0 MSS=1460 SACK_PERM TSval=1321680050 TSecr=0 WS=128"
"95","0.219436150","74","02:bf:04:cd:22:e3","96:7c:b6:e2:ef:b0","172.20.0.2","172.20.0.3","TCP","4433 → 57956 [SYN, ACK] Seq=0 Ack=1 Win=65160 Len=0 MSS=1460 SACK_PERM TSval=1512595845 TSecr=1321680050 WS=128"
"96","0.219454892","66","96:7c:b6:e2:ef:b0","02:bf:04:cd:22:e3","172.20.0.3","172.20.0.2","TCP","57956 → 4433 [ACK] Seq=1 Ack=1 Win=64256 Len=0 TSval=1321680050 TSecr=1512595845"
"97","0.219498311","2056","96:7c:b6:e2:ef:b0","02:bf:04:cd:22:e3","172.20.0.3","172.20.0.2","TLSv1.2","Client Hello"
"98","0.219510330","66","02:bf:04:cd:22:e3","96:7c:b6:e2:ef:b0","172.20.0.2","172.20.0.3","TCP","4433 → 57956 [ACK] Seq=1 Ack=1991 Win=64128 Len=0 TSval=1512595845 TSecr=1321680050"
"99","0.223436349","2545","02:bf:04:cd:22:e3","96:7c:b6:e2:ef:b0","172.20.0.2","172.20.0.3","TLSv1.3","Server Hello, Change Cipher Spec, Application Data, Application Data, Application Data, Application Data"
"100","0.223485524","66","96:7c:b6:e2:ef:b0","02:bf:04:cd:22:e3","172.20.0.3","172.20.0.2","TCP","57956 → 4433 [ACK] Seq=1991 Ack=2480 Win=64128 Len=0 TSval=1321680054 TSecr=1512595849"
"101","0.228428996","146","96:7c:b6:e2:ef:b0","02:bf:04:cd:22:e3","172.20.0.3","172.20.0.2","TLSv1.3","Change Cipher Spec, Application Data"
"102","0.228495920","66","96:7c:b6:e2:ef:b0","02:bf:04:cd:22:e3","172.20.0.3","172.20.0.2","TCP","57956 → 4433 [RST, ACK] Seq=2071 Ack=2480 Win=64128 Len=0 TSval=1321680059 TSecr=1512595849"
"103","0.239617953","74","96:7c:b6:e2:ef:b0","02:bf:04:cd:22:e3","172.20.0.3","172.20.0.2","TCP","57962 → 4433 [SYN] Seq=0 Win=64240 Len=0 MSS=1460 SACK_PERM TSval=1321680070 TSecr=0 WS=128"
"104","0.239648112","74","02:bf:04:cd:22:e3","96:7c:b6:e2:ef:b0","172.20.0.2","172.20.0.3","TCP","4433 → 57962 [SYN, ACK] Seq=0 Ack=1 Win=65160 Len=0 MSS=1460 SACK_PERM TSval=1512595866 TSecr=1321680070 WS=128"
"105","0.239668997","66","96:7c:b6:e2:ef:b0","02:bf:04:cd:22:e3","172.20.0.3","172.20.0.2","TCP","57962 → 4433 [ACK] Seq=1 Ack=1 Win=64256 Len=0 TSval=1321680071 TSecr=1512595866"
"106","0.239710243","2056","96:7c:b6:e2:ef:b0","02:bf:04:cd:22:e3","172.20.0.3","172.20.0.2","TLSv1.2","Client Hello"
"107","0.239716964","66","02:bf:04:cd:22:e3","96:7c:b6:e2:ef:b0","172.20.0.2","172.20.0.3","TCP","4433 → 57962 [ACK] Seq=1 Ack=1991 Win=64128 Len=0 TSval=1512595866 TSecr=1321680071"
"108","0.242978791","2545","02:bf:04:cd:22:e3","96:7c:b6:e2:ef:b0","172.20.0.2","172.20.0.3","TLSv1.3","Server Hello, Change Cipher Spec, Application Data, Application Data, Application Data, Application Data"
"109","0.243016157","66","96:7c:b6:e2:ef:b0","02:bf:04:cd:22:e3","172.20.0.3","172.20.0.2","TCP","57962 → 4433 [ACK] Seq=1991 Ack=2480 Win=64128 Len=0 TSval=1321680074 TSecr=1512595869"
"110","0.250913651","146","96:7c:b6:e2:ef:b0","02:bf:04:cd:22:e3","172.20.0.3","172.20.0.2","TLSv1.3","Change Cipher Spec, Application Data"
"111","0.251018398","66","96:7c:b6:e2:ef:b0","02:bf:04:cd:22:e3","172.20.0.3","172.20.0.2","TCP","57962 → 4433 [RST, ACK] Seq=2071 Ack=2480 Win=64128 Len=0 TSval=1321680082 TSecr=1512595869"
"112","0.262189418","74","96:7c:b6:e2:ef:b0","02:bf:04:cd:22:e3","172.20.0.3","172.20.0.2","TCP","57976 → 4433 [SYN] Seq=0 Win=64240 Len=0 MSS=1460 SACK_PERM TSval=1321680093 TSecr=0 WS=128"
"113","0.262215983","74","02:bf:04:cd:22:e3","96:7c:b6:e2:ef:b0","172.20.0.2","172.20.0.3","TCP","4433 → 57976 [SYN, ACK] Seq=0 Ack=1 Win=65160 Len=0 MSS=1460 SACK_PERM TSval=1512595888 TSecr=1321680093 WS=128"
"114","0.262234583","66","96:7c:b6:e2:ef:b0","02:bf:04:cd:22:e3","172.20.0.3","172.20.0.2","TCP","57976 → 4433 [ACK] Seq=1 Ack=1 Win=64256 Len=0 TSval=1321680093 TSecr=1512595888"
"115","0.262274149","2056","96:7c:b6:e2:ef:b0","02:bf:04:cd:22:e3","172.20.0.3","172.20.0.2","TLSv1.2","Client Hello"
"116","0.262279997","66","02:bf:04:cd:22:e3","96:7c:b6:e2:ef:b0","172.20.0.2","172.20.0.3","TCP","4433 → 57976 [ACK] Seq=1 Ack=1991 Win=64128 Len=0 TSval=1512595888 TSecr=1321680093"
"117","0.265397610","2544","02:bf:04:cd:22:e3","96:7c:b6:e2:ef:b0","172.20.0.2","172.20.0.3","TLSv1.3","Server Hello, Change Cipher Spec, Application Data, Application Data, Application Data, Application Data"
"118","0.265429288","66","96:7c:b6:e2:ef:b0","02:bf:04:cd:22:e3","172.20.0.3","172.20.0.2","TCP","57976 → 4433 [ACK] Seq=1991 Ack=2479 Win=64128 Len=0 TSval=1321680096 TSecr=1512595891"
"119","0.270461590","146","96:7c:b6:e2:ef:b0","02:bf:04:cd:22:e3","172.20.0.3","172.20.0.2","TLSv1.3","Change Cipher Spec, Application Data"
"120","0.270542206","66","96:7c:b6:e2:ef:b0","02:bf:04:cd:22:e3","172.20.0.3","172.20.0.2","TCP","57976 → 4433 [RST, ACK] Seq=2071 Ack=2479 Win=64128 Len=0 TSval=1321680101 TSecr=1512595891"
"121","0.282379613","74","96:7c:b6:e2:ef:b0","02:bf:04:cd:22:e3","172.20.0.3","172.20.0.2","TCP","57990 → 4433 [SYN] Seq=0 Win=64240 Len=0 MSS=1460 SACK_PERM TSval=1321680113 TSecr=0 WS=128"
"122","0.282403084","74","02:bf:04:cd:22:e3","96:7c:b6:e2:ef:b0","172.20.0.2","172.20.0.3","TCP","4433 → 57990 [SYN, ACK] Seq=0 Ack=1 Win=65160 Len=0 MSS=1460 SACK_PERM TSval=1512595908 TSecr=1321680113 WS=128"
"123","0.282420557","66","96:7c:b6:e2:ef:b0","02:bf:04:cd:22:e3","172.20.0.3","172.20.0.2","TCP","57990 → 4433 [ACK] Seq=1 Ack=1 Win=64256 Len=0 TSval=1321680113 TSecr=1512595908"
"124","0.282465867","2056","96:7c:b6:e2:ef:b0","02:bf:04:cd:22:e3","172.20.0.3","172.20.0.2","TLSv1.2","Client Hello"
"125","0.282471235","66","02:bf:04:cd:22:e3","96:7c:b6:e2:ef:b0","172.20.0.2","172.20.0.3","TCP","4433 → 57990 [ACK] Seq=1 Ack=1991 Win=64128 Len=0 TSval=1512595908 TSecr=1321680113"
"126","0.286299486","2545","02:bf:04:cd:22:e3","96:7c:b6:e2:ef:b0","172.20.0.2","172.20.0.3","TLSv1.3","Server Hello, Change Cipher Spec, Application Data, Application Data, Application Data, Application Data"
"127","0.286344203","66","96:7c:b6:e2:ef:b0","02:bf:04:cd:22:e3","172.20.0.3","172.20.0.2","TCP","57990 → 4433 [ACK] Seq=1991 Ack=2480 Win=64128 Len=0 TSval=1321680117 TSecr=1512595912"
"128","0.291979994","146","96:7c:b6:e2:ef:b0","02:bf:04:cd:22:e3","172.20.0.3","172.20.0.2","TLSv1.3","Change Cipher Spec, Application Data"
"129","0.292055792","66","96:7c:b6:e2:ef:b0","02:bf:04:cd:22:e3","172.20.0.3","172.20.0.2","TCP","57990 → 4433 [RST, ACK] Seq=2071 Ack=2480 Win=64128 Len=0 TSval=1321680123 TSecr=1512595912"
"130","0.303002653","74","96:7c:b6:e2:ef:b0","02:bf:04:cd:22:e3","172.20.0.3","172.20.0.2","TCP","58000 → 4433 [SYN] Seq=0 Win=64240 Len=0 MSS=1460 SACK_PERM TSval=1321680134 TSecr=0 WS=128"
"131","0.303031466","74","02:bf:04:cd:22:e3","96:7c:b6:e2:ef:b0","172.20.0.2","172.20.0.3","TCP","4433 → 58000 [SYN, ACK] Seq=0 Ack=1 Win=65160 Len=0 MSS=1460 SACK_PERM TSval=1512595929 TSecr=1321680134 WS=128"
"132","0.303050085","66","96:7c:b6:e2:ef:b0","02:bf:04:cd:22:e3","172.20.0.3","172.20.0.2","TCP","58000 → 4433 [ACK] Seq=1 Ack=1 Win=64256 Len=0 TSval=1321680134 TSecr=1512595929"
"133","0.303096099","2056","96:7c:b6:e2:ef:b0","02:bf:04:cd:22:e3","172.20.0.3","172.20.0.2","TLSv1.2","Client Hello"
"134","0.303103882","66","02:bf:04:cd:22:e3","96:7c:b6:e2:ef:b0","172.20.0.2","172.20.0.3","TCP","4433 → 58000 [ACK] Seq=1 Ack=1991 Win=64128 Len=0 TSval=1512595929 TSecr=1321680134"
"135","0.306683329","2545","02:bf:04:cd:22:e3","96:7c:b6:e2:ef:b0","172.20.0.2","172.20.0.3","TLSv1.3","Server Hello, Change Cipher Spec, Application Data, Application Data, Application Data, Application Data"
"136","0.306736758","66","96:7c:b6:e2:ef:b0","02:bf:04:cd:22:e3","172.20.0.3","172.20.0.2","TCP","58000 → 4433 [ACK] Seq=1991 Ack=2480 Win=64128 Len=0 TSval=1321680138 TSecr=1512595933"
"137","0.311813659","146","96:7c:b6:e2:ef:b0","02:bf:04:cd:22:e3","172.20.0.3","172.20.0.2","TLSv1.3","Change Cipher Spec, Application Data"
"138","0.311884740","66","96:7c:b6:e2:ef:b0","02:bf:04:cd:22:e3","172.20.0.3","172.20.0.2","TCP","58000 → 4433 [RST, ACK] Seq=2071 Ack=2480 Win=64128 Len=0 TSval=1321680143 TSecr=1512595933"
"139","0.322683176","74","96:7c:b6:e2:ef:b0","02:bf:04:cd:22:e3","172.20.0.3","172.20.0.2","TCP","58010 → 4433 [SYN] Seq=0 Win=64240 Len=0 MSS=1460 SACK_PERM TSval=1321680154 TSecr=0 WS=128"
"140","0.322716151","74","02:bf:04:cd:22:e3","96:7c:b6:e2:ef:b0","172.20.0.2","172.20.0.3","TCP","4433 → 58010 [SYN, ACK] Seq=0 Ack=1 Win=65160 Len=0 MSS=1460 SACK_PERM TSval=1512595949 TSecr=1321680154 WS=128"
"141","0.322741189","66","96:7c:b6:e2:ef:b0","02:bf:04:cd:22:e3","172.20.0.3","172.20.0.2","TCP","58010 → 4433 [ACK] Seq=1 Ack=1 Win=64256 Len=0 TSval=1321680154 TSecr=1512595949"
"142","0.322788989","2056","96:7c:b6:e2:ef:b0","02:bf:04:cd:22:e3","172.20.0.3","172.20.0.2","TLSv1.2","Client Hello"
"143","0.322797263","66","02:bf:04:cd:22:e3","96:7c:b6:e2:ef:b0","172.20.0.2","172.20.0.3","TCP","4433 → 58010 [ACK] Seq=1 Ack=1991 Win=64128 Len=0 TSval=1512595949 TSecr=1321680154"
"144","0.325962185","2544","02:bf:04:cd:22:e3","96:7c:b6:e2:ef:b0","172.20.0.2","172.20.0.3","TLSv1.3","Server Hello, Change Cipher Spec, Application Data, Application Data, Application Data, Application Data"
"145","0.326004945","66","96:7c:b6:e2:ef:b0","02:bf:04:cd:22:e3","172.20.0.3","172.20.0.2","TCP","58010 → 4433 [ACK] Seq=1991 Ack=2479 Win=64128 Len=0 TSval=1321680157 TSecr=1512595952"
"146","0.331296074","146","96:7c:b6:e2:ef:b0","02:bf:04:cd:22:e3","172.20.0.3","172.20.0.2","TLSv1.3","Change Cipher Spec, Application Data"
"147","0.331370583","66","96:7c:b6:e2:ef:b0","02:bf:04:cd:22:e3","172.20.0.3","172.20.0.2","TCP","58010 → 4433 [RST, ACK] Seq=2071 Ack=2479 Win=64128 Len=0 TSval=1321680162 TSecr=1512595952"
"148","0.342152739","74","96:7c:b6:e2:ef:b0","02:bf:04:cd:22:e3","172.20.0.3","172.20.0.2","TCP","58014 → 4433 [SYN] Seq=0 Win=64240 Len=0 MSS=1460 SACK_PERM TSval=1321680173 TSecr=0 WS=128"
"149","0.342182202","74","02:bf:04:cd:22:e3","96:7c:b6:e2:ef:b0","172.20.0.2","172.20.0.3","TCP","4433 → 58014 [SYN, ACK] Seq=0 Ack=1 Win=65160 Len=0 MSS=1460 SACK_PERM TSval=1512595968 TSecr=1321680173 WS=128"
"150","0.342201858","66","96:7c:b6:e2:ef:b0","02:bf:04:cd:22:e3","172.20.0.3","172.20.0.2","TCP","58014 → 4433 [ACK] Seq=1 Ack=1 Win=64256 Len=0 TSval=1321680173 TSecr=1512595968"
"151","0.342246066","2056","96:7c:b6:e2:ef:b0","02:bf:04:cd:22:e3","172.20.0.3","172.20.0.2","TLSv1.2","Client Hello"
"152","0.342252083","66","02:bf:04:cd:22:e3","96:7c:b6:e2:ef:b0","172.20.0.2","172.20.0.3","TCP","4433 → 58014 [ACK] Seq=1 Ack=1991 Win=64128 Len=0 TSval=1512595968 TSecr=1321680173"
"153","0.345488822","2543","02:bf:04:cd:22:e3","96:7c:b6:e2:ef:b0","172.20.0.2","172.20.0.3","TLSv1.3","Server Hello, Change Cipher Spec, Application Data, Application Data, Application Data, Application Data"
"154","0.345522786","66","96:7c:b6:e2:ef:b0","02:bf:04:cd:22:e3","172.20.0.3","172.20.0.2","TCP","58014 → 4433 [ACK] Seq=1991 Ack=2478 Win=64128 Len=0 TSval=1321680176 TSecr=1512595971"
"155","0.350710751","146","96:7c:b6:e2:ef:b0","02:bf:04:cd:22:e3","172.20.0.3","172.20.0.2","TLSv1.3","Change Cipher Spec, Application Data"
"156","0.350801399","66","96:7c:b6:e2:ef:b0","02:bf:04:cd:22:e3","172.20.0.3","172.20.0.2","TCP","58014 → 4433 [RST, ACK] Seq=2071 Ack=2478 Win=64128 Len=0 TSval=1321680182 TSecr=1512595971"
"157","0.361819806","74","96:7c:b6:e2:ef:b0","02:bf:04:cd:22:e3","172.20.0.3","172.20.0.2","TCP","58030 → 4433 [SYN] Seq=0 Win=64240 Len=0 MSS=1460 SACK_PERM TSval=1321680193 TSecr=0 WS=128"
"158","0.361846039","74","02:bf:04:cd:22:e3","96:7c:b6:e2:ef:b0","172.20.0.2","172.20.0.3","TCP","4433 → 58030 [SYN, ACK] Seq=0 Ack=1 Win=65160 Len=0 MSS=1460 SACK_PERM TSval=1512595988 TSecr=1321680193 WS=128"
"159","0.361865699","66","96:7c:b6:e2:ef:b0","02:bf:04:cd:22:e3","172.20.0.3","172.20.0.2","TCP","58030 → 4433 [ACK] Seq=1 Ack=1 Win=64256 Len=0 TSval=1321680193 TSecr=1512595988"
"160","0.361908134","2056","96:7c:b6:e2:ef:b0","02:bf:04:cd:22:e3","172.20.0.3","172.20.0.2","TLSv1.2","Client Hello"
"161","0.361913738","66","02:bf:04:cd:22:e3","96:7c:b6:e2:ef:b0","172.20.0.2","172.20.0.3","TCP","4433 → 58030 [ACK] Seq=1 Ack=1991 Win=64128 Len=0 TSval=1512595988 TSecr=1321680193"
"162","0.365048610","2545","02:bf:04:cd:22:e3","96:7c:b6:e2:ef:b0","172.20.0.2","172.20.0.3","TLSv1.3","Server Hello, Change Cipher Spec, Application Data, Application Data, Application Data, Application Data"
"163","0.365082271","66","96:7c:b6:e2:ef:b0","02:bf:04:cd:22:e3","172.20.0.3","172.20.0.2","TCP","58030 → 4433 [ACK] Seq=1991 Ack=2480 Win=64128 Len=0 TSval=1321680196 TSecr=1512595991"
"164","0.370325444","146","96:7c:b6:e2:ef:b0","02:bf:04:cd:22:e3","172.20.0.3","172.20.0.2","TLSv1.3","Change Cipher Spec, Application Data"
"165","0.370404073","66","96:7c:b6:e2:ef:b0","02:bf:04:cd:22:e3","172.20.0.3","172.20.0.2","TCP","58030 → 4433 [RST, ACK] Seq=2071 Ack=2480 Win=64128 Len=0 TSval=1321680201 TSecr=1512595991"
"166","0.381036718","74","96:7c:b6:e2:ef:b0","02:bf:04:cd:22:e3","172.20.0.3","172.20.0.2","TCP","58046 → 4433 [SYN] Seq=0 Win=64240 Len=0 MSS=1460 SACK_PERM TSval=1321680212 TSecr=0 WS=128"
"167","0.381066332","74","02:bf:04:cd:22:e3","96:7c:b6:e2:ef:b0","172.20.0.2","172.20.0.3","TCP","4433 → 58046 [SYN, ACK] Seq=0 Ack=1 Win=65160 Len=0 MSS=1460 SACK_PERM TSval=1512596007 TSecr=1321680212 WS=128"
"168","0.381085289","66","96:7c:b6:e2:ef:b0","02:bf:04:cd:22:e3","172.20.0.3","172.20.0.2","TCP","58046 → 4433 [ACK] Seq=1 Ack=1 Win=64256 Len=0 TSval=1321680212 TSecr=1512596007"
"169","0.381129626","2056","96:7c:b6:e2:ef:b0","02:bf:04:cd:22:e3","172.20.0.3","172.20.0.2","TLSv1.2","Client Hello"
"170","0.381135535","66","02:bf:04:cd:22:e3","96:7c:b6:e2:ef:b0","172.20.0.2","172.20.0.3","TCP","4433 → 58046 [ACK] Seq=1 Ack=1991 Win=64128 Len=0 TSval=1512596007 TSecr=1321680212"
"171","0.384292852","2543","02:bf:04:cd:22:e3","96:7c:b6:e2:ef:b0","172.20.0.2","172.20.0.3","TLSv1.3","Server Hello, Change Cipher Spec, Application Data, Application Data, Application Data, Application Data"
"172","0.384328912","66","96:7c:b6:e2:ef:b0","02:bf:04:cd:22:e3","172.20.0.3","172.20.0.2","TCP","58046 → 4433 [ACK] Seq=1991 Ack=2478 Win=64128 Len=0 TSval=1321680215 TSecr=1512596010"
"173","0.389272779","146","96:7c:b6:e2:ef:b0","02:bf:04:cd:22:e3","172.20.0.3","172.20.0.2","TLSv1.3","Change Cipher Spec, Application Data"
"174","0.389336648","66","96:7c:b6:e2:ef:b0","02:bf:04:cd:22:e3","172.20.0.3","172.20.0.2","TCP","58046 → 4433 [RST, ACK] Seq=2071 Ack=2478 Win=64128 Len=0 TSval=1321680220 TSecr=1512596010"
"175","0.399765476","74","96:7c:b6:e2:ef:b0","02:bf:04:cd:22:e3","172.20.0.3","172.20.0.2","TCP","58058 → 4433 [SYN] Seq=0 Win=64240 Len=0 MSS=1460 SACK_PERM TSval=1321680231 TSecr=0 WS=128"
"176","0.399792626","74","02:bf:04:cd:22:e3","96:7c:b6:e2:ef:b0","172.20.0.2","172.20.0.3","TCP","4433 → 58058 [SYN, ACK] Seq=0 Ack=1 Win=65160 Len=0 MSS=1460 SACK_PERM TSval=1512596026 TSecr=1321680231 WS=128"
"177","0.399811381","66","96:7c:b6:e2:ef:b0","02:bf:04:cd:22:e3","172.20.0.3","172.20.0.2","TCP","58058 → 4433 [ACK] Seq=1 Ack=1 Win=64256 Len=0 TSval=1321680231 TSecr=1512596026"
"178","0.399866345","2056","96:7c:b6:e2:ef:b0","02:bf:04:cd:22:e3","172.20.0.3","172.20.0.2","TLSv1.2","Client Hello"
"179","0.399881498","66","02:bf:04:cd:22:e3","96:7c:b6:e2:ef:b0","172.20.0.2","172.20.0.3","TCP","4433 → 58058 [ACK] Seq=1 Ack=1991 Win=64128 Len=0 TSval=1512596026 TSecr=1321680231"
"180","0.403108555","2545","02:bf:04:cd:22:e3","96:7c:b6:e2:ef:b0","172.20.0.2","172.20.0.3","TLSv1.3","Server Hello, Change Cipher Spec, Application Data, Application Data, Application Data, Application Data"
"181","0.403146953","66","96:7c:b6:e2:ef:b0","02:bf:04:cd:22:e3","172.20.0.3","172.20.0.2","TCP","58058 → 4433 [ACK] Seq=1991 Ack=2480 Win=64128 Len=0 TSval=1321680234 TSecr=1512596029"
"182","0.408278538","146","96:7c:b6:e2:ef:b0","02:bf:04:cd:22:e3","172.20.0.3","172.20.0.2","TLSv1.3","Change Cipher Spec, Application Data"
"183","0.408342837","66","96:7c:b6:e2:ef:b0","02:bf:04:cd:22:e3","172.20.0.3","172.20.0.2","TCP","58058 → 4433 [RST, ACK] Seq=2071 Ack=2480 Win=64128 Len=0 TSval=1321680239 TSecr=1512596029"
"184","0.418805542","74","96:7c:b6:e2:ef:b0","02:bf:04:cd:22:e3","172.20.0.3","172.20.0.2","TCP","58062 → 4433 [SYN] Seq=0 Win=64240 Len=0 MSS=1460 SACK_PERM TSval=1321680250 TSecr=0 WS=128"
"185","0.418841425","74","02:bf:04:cd:22:e3","96:7c:b6:e2:ef:b0","172.20.0.2","172.20.0.3","TCP","4433 → 58062 [SYN, ACK] Seq=0 Ack=1 Win=65160 Len=0 MSS=1460 SACK_PERM TSval=1512596045 TSecr=1321680250 WS=128"
"186","0.418867316","66","96:7c:b6:e2:ef:b0","02:bf:04:cd:22:e3","172.20.0.3","172.20.0.2","TCP","58062 → 4433 [ACK] Seq=1 Ack=1 Win=64256 Len=0 TSval=1321680250 TSecr=1512596045"
"187","0.418922484","2056","96:7c:b6:e2:ef:b0","02:bf:04:cd:22:e3","172.20.0.3","172.20.0.2","TLSv1.2","Client Hello"
"188","0.418928494","66","02:bf:04:cd:22:e3","96:7c:b6:e2:ef:b0","172.20.0.2","172.20.0.3","TCP","4433 → 58062 [ACK] Seq=1 Ack=1991 Win=64128 Len=0 TSval=1512596045 TSecr=1321680250"
"189","0.422130994","2545","02:bf:04:cd:22:e3","96:7c:b6:e2:ef:b0","172.20.0.2","172.20.0.3","TLSv1.3","Server Hello, Change Cipher Spec, Application Data, Application Data, Application Data, Application Data"
"190","0.422161953","66","96:7c:b6:e2:ef:b0","02:bf:04:cd:22:e3","172.20.0.3","172.20.0.2","TCP","58062 → 4433 [ACK] Seq=1991 Ack=2480 Win=64128 Len=0 TSval=1321680253 TSecr=1512596048"
"191","0.427113676","146","96:7c:b6:e2:ef:b0","02:bf:04:cd:22:e3","172.20.0.3","172.20.0.2","TLSv1.3","Change Cipher Spec, Application Data"
"192","0.427198237","66","96:7c:b6:e2:ef:b0","02:bf:04:cd:22:e3","172.20.0.3","172.20.0.2","TCP","58062 → 4433 [RST, ACK] Seq=2071 Ack=2480 Win=64128 Len=0 TSval=1321680258 TSecr=1512596048"
"193","0.438002404","74","96:7c:b6:e2:ef:b0","02:bf:04:cd:22:e3","172.20.0.3","172.20.0.2","TCP","58078 → 4433 [SYN] Seq=0 Win=64240 Len=0 MSS=1460 SACK_PERM TSval=1321680269 TSecr=0 WS=128"
"194","0.438030281","74","02:bf:04:cd:22:e3","96:7c:b6:e2:ef:b0","172.20.0.2","172.20.0.3","TCP","4433 → 58078 [SYN, ACK] Seq=0 Ack=1 Win=65160 Len=0 MSS=1460 SACK_PERM TSval=1512596064 TSecr=1321680269 WS=128"
"195","0.438049653","66","96:7c:b6:e2:ef:b0","02:bf:04:cd:22:e3","172.20.0.3","172.20.0.2","TCP","58078 → 4433 [ACK] Seq=1 Ack=1 Win=64256 Len=0 TSval=1321680269 TSecr=1512596064"
"196","0.438088861","2056","96:7c:b6:e2:ef:b0","02:bf:04:cd:22:e3","172.20.0.3","172.20.0.2","TLSv1.2","Client Hello"
"197","0.438094664","66","02:bf:04:cd:22:e3","96:7c:b6:e2:ef:b0","172.20.0.2","172.20.0.3","TCP","4433 → 58078 [ACK] Seq=1 Ack=1991 Win=64128 Len=0 TSval=1512596064 TSecr=1321680269"
"198","0.441243042","2545","02:bf:04:cd:22:e3","96:7c:b6:e2:ef:b0","172.20.0.2","172.20.0.3","TLSv1.3","Server Hello, Change Cipher Spec, Application Data, Application Data, Application Data, Application Data"
"199","0.441273646","66","96:7c:b6:e2:ef:b0","02:bf:04:cd:22:e3","172.20.0.3","172.20.0.2","TCP","58078 → 4433 [ACK] Seq=1991 Ack=2480 Win=64128 Len=0 TSval=1321680272 TSecr=1512596067"
"200","0.446368931","146","96:7c:b6:e2:ef:b0","02:bf:04:cd:22:e3","172.20.0.3","172.20.0.2","TLSv1.3","Change Cipher Spec, Application Data"
"201","0.446444686","66","96:7c:b6:e2:ef:b0","02:bf:04:cd:22:e3","172.20.0.3","172.20.0.2","TCP","58078 → 4433 [RST, ACK] Seq=2071 Ack=2480 Win=64128 Len=0 TSval=1321680277 TSecr=1512596067"
"202","0.456960143","74","96:7c:b6:e2:ef:b0","02:bf:04:cd:22:e3","172.20.0.3","172.20.0.2","TCP","58088 → 4433 [SYN] Seq=0 Win=64240 Len=0 MSS=1460 SACK_PERM TSval=1321680288 TSecr=0 WS=128"
"203","0.456986069","74","02:bf:04:cd:22:e3","96:7c:b6:e2:ef:b0","172.20.0.2","172.20.0.3","TCP","4433 → 58088 [SYN, ACK] Seq=0 Ack=1 Win=65160 Len=0 MSS=1460 SACK_PERM TSval=1512596083 TSecr=1321680288 WS=128"
"204","0.457003590","66","96:7c:b6:e2:ef:b0","02:bf:04:cd:22:e3","172.20.0.3","172.20.0.2","TCP","58088 → 4433 [ACK] Seq=1 Ack=1 Win=64256 Len=0 TSval=1321680288 TSecr=1512596083"
"205","0.457048554","2056","96:7c:b6:e2:ef:b0","02:bf:04:cd:22:e3","172.20.0.3","172.20.0.2","TLSv1.2","Client Hello"
"206","0.457067421","66","02:bf:04:cd:22:e3","96:7c:b6:e2:ef:b0","172.20.0.2","172.20.0.3","TCP","4433 → 58088 [ACK] Seq=1 Ack=1991 Win=64128 Len=0 TSval=1512596083 TSecr=1321680288"
"207","0.460263028","2544","02:bf:04:cd:22:e3","96:7c:b6:e2:ef:b0","172.20.0.2","172.20.0.3","TLSv1.3","Server Hello, Change Cipher Spec, Application Data, Application Data, Application Data, Application Data"
"208","0.460291501","66","96:7c:b6:e2:ef:b0","02:bf:04:cd:22:e3","172.20.0.3","172.20.0.2","TCP","58088 → 4433 [ACK] Seq=1991 Ack=2479 Win=64128 Len=0 TSval=1321680291 TSecr=1512596086"
"209","0.465261531","146","96:7c:b6:e2:ef:b0","02:bf:04:cd:22:e3","172.20.0.3","172.20.0.2","TLSv1.3","Change Cipher Spec, Application Data"
"210","0.465332403","66","96:7c:b6:e2:ef:b0","02:bf:04:cd:22:e3","172.20.0.3","172.20.0.2","TCP","58088 → 4433 [RST, ACK] Seq=2071 Ack=2479 Win=64128 Len=0 TSval=1321680296 TSecr=1512596086"
"211","0.475598818","74","96:7c:b6:e2:ef:b0","02:bf:04:cd:22:e3","172.20.0.3","172.20.0.2","TCP","58092 → 4433 [SYN] Seq=0 Win=64240 Len=0 MSS=1460 SACK_PERM TSval=1321680306 TSecr=0 WS=128"
"212","0.475631833","74","02:bf:04:cd:22:e3","96:7c:b6:e2:ef:b0","172.20.0.2","172.20.0.3","TCP","4433 → 58092 [SYN, ACK] Seq=0 Ack=1 Win=65160 Len=0 MSS=1460 SACK_PERM TSval=1512596102 TSecr=1321680306 WS=128"
"213","0.475651323","66","96:7c:b6:e2:ef:b0","02:bf:04:cd:22:e3","172.20.0.3","172.20.0.2","TCP","58092 → 4433 [ACK] Seq=1 Ack=1 Win=64256 Len=0 TSval=1321680307 TSecr=1512596102"
"214","0.475699252","2056","96:7c:b6:e2:ef:b0","02:bf:04:cd:22:e3","172.20.0.3","172.20.0.2","TLSv1.2","Client Hello"
"215","0.475705637","66","02:bf:04:cd:22:e3","96:7c:b6:e2:ef:b0","172.20.0.2","172.20.0.3","TCP","4433 → 58092 [ACK] Seq=1 Ack=1991 Win=64128 Len=0 TSval=1512596102 TSecr=1321680307"
"216","0.478972098","2544","02:bf:04:cd:22:e3","96:7c:b6:e2:ef:b0","172.20.0.2","172.20.0.3","TLSv1.3","Server Hello, Change Cipher Spec, Application Data, Application Data, Application Data, Application Data"
"217","0.479002351","66","96:7c:b6:e2:ef:b0","02:bf:04:cd:22:e3","172.20.0.3","172.20.0.2","TCP","58092 → 4433 [ACK] Seq=1991 Ack=2479 Win=64128 Len=0 TSval=1321680310 TSecr=1512596105"
"218","0.483927759","146","96:7c:b6:e2:ef:b0","02:bf:04:cd:22:e3","172.20.0.3","172.20.0.2","TLSv1.3","Change Cipher Spec, Application Data"
"219","0.484004210","66","96:7c:b6:e2:ef:b0","02:bf:04:cd:22:e3","172.20.0.3","172.20.0.2","TCP","58092 → 4433 [RST, ACK] Seq=2071 Ack=2479 Win=64128 Len=0 TSval=1321680315 TSecr=1512596105"
"220","0.494401188","74","96:7c:b6:e2:ef:b0","02:bf:04:cd:22:e3","172.20.0.3","172.20.0.2","TCP","58098 → 4433 [SYN] Seq=0 Win=64240 Len=0 MSS=1460 SACK_PERM TSval=1321680325 TSecr=0 WS=128"
"221","0.494424432","74","02:bf:04:cd:22:e3","96:7c:b6:e2:ef:b0","172.20.0.2","172.20.0.3","TCP","4433 → 58098 [SYN, ACK] Seq=0 Ack=1 Win=65160 Len=0 MSS=1460 SACK_PERM TSval=1512596120 TSecr=1321680325 WS=128"
"222","0.494440742","66","96:7c:b6:e2:ef:b0","02:bf:04:cd:22:e3","172.20.0.3","172.20.0.2","TCP","58098 → 4433 [ACK] Seq=1 Ack=1 Win=64256 Len=0 TSval=1321680325 TSecr=1512596120"
"223","0.494482976","2056","96:7c:b6:e2:ef:b0","02:bf:04:cd:22:e3","172.20.0.3","172.20.0.2","TLSv1.2","Client Hello"
"224","0.494488106","66","02:bf:04:cd:22:e3","96:7c:b6:e2:ef:b0","172.20.0.2","172.20.0.3","TCP","4433 → 58098 [ACK] Seq=1 Ack=1991 Win=64128 Len=0 TSval=1512596120 TSecr=1321680325"
