frame.number,frame.time_relative,frame.len,eth.src,eth.dst,ip.src,ip.dst,_ws.col.protocol,_ws.col.info
"1","0.000000000","42","b6:4b:cf:c8:33:f4","ff:ff:ff:ff:ff:ff",,,"ARP","ARP Announcement for 172.20.0.3"
"2","0.032089068","42","b6:4b:cf:c8:33:f4","ff:ff:ff:ff:ff:ff",,,"ARP","Who has 172.20.0.2? Tell 172.20.0.3"
"3","0.032112671","42","3a:dc:c1:a7:03:b1","b6:4b:cf:c8:33:f4",,,"ARP","172.20.0.2 is at 3a:dc:c1:a7:03:b1"
"4","0.032119207","74","b6:4b:cf:c8:33:f4","3a:dc:c1:a7:03:b1","172.20.0.3","172.20.0.2","TCP","59318 → 4433 [SYN] Seq=0 Win=64240 Len=0 MSS=1460 SACK_PERM TSval=1314554981 TSecr=0 WS=128"
"5","0.032139667","74","3a:dc:c1:a7:03:b1","b6:4b:cf:c8:33:f4","172.20.0.2","172.20.0.3","TCP","4433 → 59318 [SYN, ACK] Seq=0 Ack=1 Win=65160 Len=0 MSS=1460 SACK_PERM TSval=1505470776 TSecr=1314554981 WS=128"
"6","0.032156724","66","b6:4b:cf:c8:33:f4","3a:dc:c1:a7:03:b1","172.20.0.3","172.20.0.2","TCP","59318 → 4433 [ACK] Seq=1 Ack=1 Win=64256 Len=0 TSval=1314554981 TSecr=1505470776"
"7","0.032198938","629","b6:4b:cf:c8:33:f4","3a:dc:c1:a7:03:b1","172.20.0.3","172.20.0.2","TLSv1.2","Client Hello"
"8","0.032208804","66","3a:dc:c1:a7:03:b1","b6:4b:cf:c8:33:f4","172.20.0.2","172.20.0.3","TCP","4433 → 59318 [ACK] Seq=1 Ack=564 Win=64640 Len=0 TSval=1505470776 TSecr=1314554981"
"9","0.040997933","1110","3a:dc:c1:a7:03:b1","b6:4b:cf:c8:33:f4","172.20.0.2","172.20.0.3","TLSv1.3","Server Hello, Change Cipher Spec, Application Data, Application Data, Application Data, Application Data"
"10","0.041050407","66","b6:4b:cf:c8:33:f4","3a:dc:c1:a7:03:b1","172.20.0.3","172.20.0.2","TCP","59318 → 4433 [ACK] Seq=564 Ack=1045 Win=64128 Len=0 TSval=1314554990 TSecr=1505470785"
"11","0.048664015","146","b6:4b:cf:c8:33:f4","3a:dc:c1:a7:03:b1","172.20.0.3","172.20.0.2","TLSv1.3","Change Cipher Spec, Application Data"
"12","0.048745104","66","b6:4b:cf:c8:33:f4","3a:dc:c1:a7:03:b1","172.20.0.3","172.20.0.2","TCP","59318 → 4433 [RST, ACK] Seq=644 Ack=1045 Win=64128 Len=0 TSval=1314554998 TSecr=1505470785"
"13","0.063247503","74","b6:4b:cf:c8:33:f4","3a:dc:c1:a7:03:b1","172.20.0.3","172.20.0.2","TCP","59326 → 4433 [SYN] Seq=0 Win=64240 Len=0 MSS=1460 SACK_PERM TSval=1314555012 TSecr=0 WS=128"
"14","0.063274327","74","3a:dc:c1:a7:03:b1","b6:4b:cf:c8:33:f4","172.20.0.2","172.20.0.3","TCP","4433 → 59326 [SYN, ACK] Seq=0 Ack=1 Win=65160 Len=0 MSS=1460 SACK_PERM TSval=1505470807 TSecr=1314555012 WS=128"
"15","0.063295358","66","b6:4b:cf:c8:33:f4","3a:dc:c1:a7:03:b1","172.20.0.3","172.20.0.2","TCP","59326 → 4433 [ACK] Seq=1 Ack=1 Win=64256 Len=0 TSval=1314555012 TSecr=1505470807"
"16","0.063360453","629","b6:4b:cf:c8:33:f4","3a:dc:c1:a7:03:b1","172.20.0.3","172.20.0.2","TLSv1.2","Client Hello"
"17","0.063364610","66","3a:dc:c1:a7:03:b1","b6:4b:cf:c8:33:f4","172.20.0.2","172.20.0.3","TCP","4433 → 59326 [ACK] Seq=1 Ack=564 Win=64640 Len=0 TSval=1505470808 TSecr=1314555013"
"18","0.071856291","1110","3a:dc:c1:a7:03:b1","b6:4b:cf:c8:33:f4","172.20.0.2","172.20.0.3","TLSv1.3","Server Hello, Change Cipher Spec, Application Data, Application Data, Application Data, Application Data"
"19","0.071895926","66","b6:4b:cf:c8:33:f4","3a:dc:c1:a7:03:b1","172.20.0.3","172.20.0.2","TCP","59326 → 4433 [ACK] Seq=564 Ack=1045 Win=64128 Len=0 TSval=1314555021 TSecr=1505470816"
"20","0.079340998","146","b6:4b:cf:c8:33:f4","3a:dc:c1:a7:03:b1","172.20.0.3","172.20.0.2","TLSv1.3","Change Cipher Spec, Application Data"
"21","0.079421799","66","b6:4b:cf:c8:33:f4","3a:dc:c1:a7:03:b1","172.20.0.3","172.20.0.2","TCP","59326 → 4433 [RST, ACK] Seq=644 Ack=1045 Win=64128 Len=0 TSval=1314555029 TSecr=1505470816"
"22","0.093134307","74","b6:4b:cf:c8:33:f4","3a:dc:c1:a7:03:b1","172.20.0.3","172.20.0.2","TCP","59334 → 4433 [SYN] Seq=0 Win=64240 Len=0 MSS=1460 SACK_PERM TSval=1314555042 TSecr=0 WS=128"
"23","0.093160642","74","3a:dc:c1:a7:03:b1","b6:4b:cf:c8:33:f4","172.20.0.2","172.20.0.3","TCP","4433 → 59334 [SYN, ACK] Seq=0 Ack=1 Win=65160 Len=0 MSS=1460 SACK_PERM TSval=1505470837 TSecr=1314555042 WS=128"
"24","0.093181301","66","b6:4b:cf:c8:33:f4","3a:dc:c1:a7:03:b1","172.20.0.3","172.20.0.2","TCP","59334 → 4433 [ACK] Seq=1 Ack=1 Win=64256 Len=0 TSval=1314555042 TSecr=1505470837"
"25","0.093239183","629","b6:4b:cf:c8:33:f4","3a:dc:c1:a7:03:b1","172.20.0.3","172.20.0.2","TLSv1.2","Client Hello"
"26","0.093243957","66","3a:dc:c1:a7:03:b1","b6:4b:cf:c8:33:f4","172.20.0.2","172.20.0.3","TCP","4433 → 59334 [ACK] Seq=1 Ack=564 Win=64640 Len=0 TSval=1505470837 TSecr=1314555042"
"27","0.101374704","1109","3a:dc:c1:a7:03:b1","b6:4b:cf:c8:33:f4","172.20.0.2","172.20.0.3","TLSv1.3","Server Hello, Change Cipher Spec, Application Data, Application Data, Application Data, Application Data"
"28","0.101418395","66","b6:4b:cf:c8:33:f4","3a:dc:c1:a7:03:b1","172.20.0.3","172.20.0.2","TCP","59334 → 4433 [ACK] Seq=564 Ack=1044 Win=64128 Len=0 TSval=1314555051 TSecr=1505470846"
"29","0.108858625","146","b6:4b:cf:c8:33:f4","3a:dc:c1:a7:03:b1","172.20.0.3","172.20.0.2","TLSv1.3","Change Cipher Spec, Application Data"
"30","0.108929126","66","b6:4b:cf:c8:33:f4","3a:dc:c1:a7:03:b1","172.20.0.3","172.20.0.2","TCP","59334 → 4433 [RST, ACK] Seq=644 Ack=1044 Win=64128 Len=0 TSval=1314555058 TSecr=1505470846"
"31","0.122213210","74","b6:4b:cf:c8:33:f4","3a:dc:c1:a7:03:b1","172.20.0.3","172.20.0.2","TCP","59336 → 4433 [SYN] Seq=0 Win=64240 Len=0 MSS=1460 SACK_PERM TSval=1314555071 TSecr=0 WS=128"
"32","0.122237730","74","3a:dc:c1:a7:03:b1","b6:4b:cf:c8:33:f4","172.20.0.2","172.20.0.3","TCP","4433 → 59336 [SYN, ACK] Seq=0 Ack=1 Win=65160 Len=0 MSS=1460 SACK_PERM TSval=1505470866 TSecr=1314555071 WS=128"
"33","0.122254700","66","b6:4b:cf:c8:33:f4","3a:dc:c1:a7:03:b1","172.20.0.3","172.20.0.2","TCP","59336 → 4433 [ACK] Seq=1 Ack=1 Win=64256 Len=0 TSval=1314555071 TSecr=1505470866"
"34","0.122309595","629","b6:4b:cf:c8:33:f4","3a:dc:c1:a7:03:b1","172.20.0.3","172.20.0.2","TLSv1.2","Client Hello"
"35","0.122315286","66","3a:dc:c1:a7:03:b1","b6:4b:cf:c8:33:f4","172.20.0.2","172.20.0.3","TCP","4433 → 59336 [ACK] Seq=1 Ack=564 Win=64640 Len=0 TSval=1505470867 TSecr=1314555071"
"36","0.130591414","1109","3a:dc:c1:a7:03:b1","b6:4b:cf:c8:33:f4","172.20.0.2","172.20.0.3","TLSv1.3","Server Hello, Change Cipher Spec, Application Data, Application Data, Application Data, Application Data"
"37","0.130626115","66","b6:4b:cf:c8:33:f4","3a:dc:c1:a7:03:b1","172.20.0.3","172.20.0.2","TCP","59336 → 4433 [ACK] Seq=564 Ack=1044 Win=64128 Len=0 TSval=1314555080 TSecr=1505470875"
"38","0.138268901","146","b6:4b:cf:c8:33:f4","3a:dc:c1:a7:03:b1","172.20.0.3","172.20.0.2","TLSv1.3","Change Cipher Spec, Application Data"
"39","0.138360264","66","b6:4b:cf:c8:33:f4","3a:dc:c1:a7:03:b1","172.20.0.3","172.20.0.2","TCP","59336 → 4433 [RST, ACK] Seq=644 Ack=1044 Win=64128 Len=0 TSval=1314555088 TSecr=1505470875"
"40","0.151748644","74","b6:4b:cf:c8:33:f4","3a:dc:c1:a7:03:b1","172.20.0.3","172.20.0.2","TCP","59352 → 4433 [SYN] Seq=0 Win=64240 Len=0 MSS=1460 SACK_PERM TSval=1314555101 TSecr=0 WS=128"
"41","0.151780633","74","3a:dc:c1:a7:03:b1","b6:4b:cf:c8:33:f4","172.20.0.2","172.20.0.3","TCP","4433 → 59352 [SYN, ACK] Seq=0 Ack=1 Win=65160 Len=0 MSS=1460 SACK_PERM TSval=1505470896 TSecr=1314555101 WS=128"
"42","0.151799984","66","b6:4b:cf:c8:33:f4","3a:dc:c1:a7:03:b1","172.20.0.3","172.20.0.2","TCP","59352 → 4433 [ACK] Seq=1 Ack=1 Win=64256 Len=0 TSval=1314555101 TSecr=1505470896"
"43","0.151850031","629","b6:4b:cf:c8:33:f4","3a:dc:c1:a7:03:b1","172.20.0.3","172.20.0.2","TLSv1.2","Client Hello"
"44","0.151854498","66","3a:dc:c1:a7:03:b1","b6:4b:cf:c8:33:f4","172.20.0.2","172.20.0.3","TCP","4433 → 59352 [ACK] Seq=1 Ack=564 Win=64640 Len=0 TSval=1505470896 TSecr=1314555101"
"45","0.160120685","1109","3a:dc:c1:a7:03:b1","b6:4b:cf:c8:33:f4","172.20.0.2","172.20.0.3","TLSv1.3","Server Hello, Change Cipher Spec, Application Data, Application Data, Application Data, Application Data"
"46","0.160176190","66","b6:4b:cf:c8:33:f4","3a:dc:c1:a7:03:b1","172.20.0.3","172.20.0.2","TCP","59352 → 4433 [ACK] Seq=564 Ack=1044 Win=64128 Len=0 TSval=1314555109 TSecr=1505470904"
"47","0.167631979","146","b6:4b:cf:c8:33:f4","3a:dc:c1:a7:03:b1","172.20.0.3","172.20.0.2","TLSv1.3","Change Cipher Spec, Application Data"
"48","0.167708807","66","b6:4b:cf:c8:33:f4","3a:dc:c1:a7:03:b1","172.20.0.3","172.20.0.2","TCP","59352 → 4433 [RST, ACK] Seq=644 Ack=1044 Win=64128 Len=0 TSval=1314555117 TSecr=1505470904"
"49","0.186668974","74","b6:4b:cf:c8:33:f4","3a:dc:c1:a7:03:b1","172.20.0.3","172.20.0.2","TCP","59366 → 4433 [SYN] Seq=0 Win=64240 Len=0 MSS=1460 SACK_PERM TSval=1314555136 TSecr=0 WS=128"
"50","0.186701480","74","3a:dc:c1:a7:03:b1","b6:4b:cf:c8:33:f4","172.20.0.2","172.20.0.3","TCP","4433 → 59366 [SYN, ACK] Seq=0 Ack=1 Win=65160 Len=0 MSS=1460 SACK_PERM TSval=1505470931 TSecr=1314555136 WS=128"
"51","0.186723635","66","b6:4b:cf:c8:33:f4","3a:dc:c1:a7:03:b1","172.20.0.3","172.20.0.2","TCP","59366 → 4433 [ACK] Seq=1 Ack=1 Win=64256 Len=0 TSval=1314555136 TSecr=1505470931"
"52","0.186787396","629","b6:4b:cf:c8:33:f4","3a:dc:c1:a7:03:b1","172.20.0.3","172.20.0.2","TLSv1.2","Client Hello"
"53","0.186792863","66","3a:dc:c1:a7:03:b1","b6:4b:cf:c8:33:f4","172.20.0.2","172.20.0.3","TCP","4433 → 59366 [ACK] Seq=1 Ack=564 Win=64640 Len=0 TSval=1505470931 TSecr=1314555136"
"54","0.194948200","1110","3a:dc:c1:a7:03:b1","b6:4b:cf:c8:33:f4","172.20.0.2","172.20.0.3","TLSv1.3","Server Hello, Change Cipher Spec, Application Data, Application Data, Application Data, Application Data"
"55","0.194999949","66","b6:4b:cf:c8:33:f4","3a:dc:c1:a7:03:b1","172.20.0.3","172.20.0.2","TCP","59366 → 4433 [ACK] Seq=564 Ack=1045 Win=64128 Len=0 TSval=1314555144 TSecr=1505470939"
"56","0.207521135","146","b6:4b:cf:c8:33:f4","3a:dc:c1:a7:03:b1","172.20.0.3","172.20.0.2","TLSv1.3","Change Cipher Spec, Application Data"
"57","0.207631031","66","b6:4b:cf:c8:33:f4","3a:dc:c1:a7:03:b1","172.20.0.3","172.20.0.2","TCP","59366 → 4433 [RST, ACK] Seq=644 Ack=1045 Win=64128 Len=0 TSval=1314555157 TSecr=1505470939"
"58","0.221780767","74","b6:4b:cf:c8:33:f4","3a:dc:c1:a7:03:b1","172.20.0.3","172.20.0.2","TCP","59374 → 4433 [SYN] Seq=0 Win=64240 Len=0 MSS=1460 SACK_PERM TSval=1314555171 TSecr=0 WS=128"
"59","0.221805071","74","3a:dc:c1:a7:03:b1","b6:4b:cf:c8:33:f4","172.20.0.2","172.20.0.3","TCP","4433 → 59374 [SYN, ACK] Seq=0 Ack=1 Win=65160 Len=0 MSS=1460 SACK_PERM TSval=1505470966 TSecr=1314555171 WS=128"
"60","0.221820431","66","b6:4b:cf:c8:33:f4","3a:dc:c1:a7:03:b1","172.20.0.3","172.20.0.2","TCP","59374 → 4433 [ACK] Seq=1 Ack=1 Win=64256 Len=0 TSval=1314555171 TSecr=1505470966"
"61","0.221860488","629","b6:4b:cf:c8:33:f4","3a:dc:c1:a7:03:b1","172.20.0.3","172.20.0.2","TLSv1.2","Client Hello"
"62","0.221865982","66","3a:dc:c1:a7:03:b1","b6:4b:cf:c8:33:f4","172.20.0.2","172.20.0.3","TCP","4433 → 59374 [ACK] Seq=1 Ack=564 Win=64640 Len=0 TSval=1505470966 TSecr=1314555171"
"63","0.231482229","1110","3a:dc:c1:a7:03:b1","b6:4b:cf:c8:33:f4","172.20.0.2","172.20.0.3","TLSv1.3","Server Hello, Change Cipher Spec, Application Data, Application Data, Application Data, Application Data"
"64","0.231534702","66","b6:4b:cf:c8:33:f4","3a:dc:c1:a7:03:b1","172.20.0.3","172.20.0.2","TCP","59374 → 4433 [ACK] Seq=564 Ack=1045 Win=64128 Len=0 TSval=1314555181 TSecr=1505470976"
"65","0.239674975","146","b6:4b:cf:c8:33:f4","3a:dc:c1:a7:03:b1","172.20.0.3","172.20.0.2","TLSv1.3","Change Cipher Spec, Application Data"
"66","0.239753112","66","b6:4b:cf:c8:33:f4","3a:dc:c1:a7:03:b1","172.20.0.3","172.20.0.2","TCP","59374 → 4433 [RST, ACK] Seq=644 Ack=1045 Win=64128 Len=0 TSval=1314555189 TSecr=1505470976"
"67","0.254264061","74","b6:4b:cf:c8:33:f4","3a:dc:c1:a7:03:b1","172.20.0.3","172.20.0.2","TCP","59390 → 4433 [SYN] Seq=0 Win=64240 Len=0 MSS=1460 SACK_PERM TSval=1314555203 TSecr=0 WS=128"
"68","0.254289416","74","3a:dc:c1:a7:03:b1","b6:4b:cf:c8:33:f4","172.20.0.2","172.20.0.3","TCP","4433 → 59390 [SYN, ACK] Seq=0 Ack=1 Win=65160 Len=0 MSS=1460 SACK_PERM TSval=1505470998 TSecr=1314555203 WS=128"
"69","0.254333506","66","b6:4b:cf:c8:33:f4","3a:dc:c1:a7:03:b1","172.20.0.3","172.20.0.2","TCP","59390 → 4433 [ACK] Seq=1 Ack=1 Win=64256 Len=0 TSval=1314555204 TSecr=1505470998"
"70","0.254372993","629","b6:4b:cf:c8:33:f4","3a:dc:c1:a7:03:b1","172.20.0.3","172.20.0.2","TLSv1.2","Client Hello"
"71","0.254378464","66","3a:dc:c1:a7:03:b1","b6:4b:cf:c8:33:f4","172.20.0.2","172.20.0.3","TCP","4433 → 59390 [ACK] Seq=1 Ack=564 Win=64640 Len=0 TSval=1505470999 TSecr=1314555204"
"72","0.262714669","1110","3a:dc:c1:a7:03:b1","b6:4b:cf:c8:33:f4","172.20.0.2","172.20.0.3","TLSv1.3","Server Hello, Change Cipher Spec, Application Data, Application Data, Application Data, Application Data"
"73","0.262767990","66","b6:4b:cf:c8:33:f4","3a:dc:c1:a7:03:b1","172.20.0.3","172.20.0.2","TCP","59390 → 4433 [ACK] Seq=564 Ack=1045 Win=64128 Len=0 TSval=1314555212 TSecr=1505471007"
"74","0.270151271","146","b6:4b:cf:c8:33:f4","3a:dc:c1:a7:03:b1","172.20.0.3","172.20.0.2","TLSv1.3","Change Cipher Spec, Application Data"
"75","0.270240115","66","b6:4b:cf:c8:33:f4","3a:dc:c1:a7:03:b1","172.20.0.3","172.20.0.2","TCP","59390 → 4433 [RST, ACK] Seq=644 Ack=1045 Win=64128 Len=0 TSval=1314555219 TSecr=1505471007"
"76","0.283408137","74","b6:4b:cf:c8:33:f4","3a:dc:c1:a7:03:b1","172.20.0.3","172.20.0.2","TCP","59404 → 4433 [SYN] Seq=0 Win=64240 Len=0 MSS=1460 SACK_PERM TSval=1314555233 TSecr=0 WS=128"
"77","0.283435942","74","3a:dc:c1:a7:03:b1","b6:4b:cf:c8:33:f4","172.20.0.2","172.20.0.3","TCP","4433 → 59404 [SYN, ACK] Seq=0 Ack=1 Win=65160 Len=0 MSS=1460 SACK_PERM TSval=1505471028 TSecr=1314555233 WS=128"
"78","0.283455323","66","b6:4b:cf:c8:33:f4","3a:dc:c1:a7:03:b1","172.20.0.3","172.20.0.2","TCP","59404 → 4433 [ACK] Seq=1 Ack=1 Win=64256 Len=0 TSval=1314555233 TSecr=1505471028"
"79","0.283497338","629","b6:4b:cf:c8:33:f4","3a:dc:c1:a7:03:b1","172.20.0.3","172.20.0.2","TLSv1.2","Client Hello"
"80","0.283503973","66","3a:dc:c1:a7:03:b1","b6:4b:cf:c8:33:f4","172.20.0.2","172.20.0.3","TCP","4433 → 59404 [ACK] Seq=1 Ack=564 Win=64640 Len=0 TSval=1505471028 TSecr=1314555233"
"81","0.291712415","1109","3a:dc:c1:a7:03:b1","b6:4b:cf:c8:33:f4","172.20.0.2","172.20.0.3","TLSv1.3","Server Hello, Change Cipher Spec, Application Data, Application Data, Application Data, Application Data"
"82","0.291771330","66","b6:4b:cf:c8:33:f4","3a:dc:c1:a7:03:b1","172.20.0.3","172.20.0.2","TCP","59404 → 4433 [ACK] Seq=564 Ack=1044 Win=64128 Len=0 TSval=1314555241 TSecr=1505471036"
"83","0.299229341","146","b6:4b:cf:c8:33:f4","3a:dc:c1:a7:03:b1","172.20.0.3","172.20.0.2","TLSv1.3","Change Cipher Spec, Application Data"
"84","0.299312471","66","b6:4b:cf:c8:33:f4","3a:dc:c1:a7:03:b1","172.20.0.3","172.20.0.2","TCP","59404 → 4433 [RST, ACK] Seq=644 Ack=1044 Win=64128 Len=0 TSval=1314555249 TSecr=1505471036"
"85","0.318274375","74","b6:4b:cf:c8:33:f4","3a:dc:c1:a7:03:b1","172.20.0.3","172.20.0.2","TCP","59418 → 4433 [SYN] Seq=0 Win=64240 Len=0 MSS=1460 SACK_PERM TSval=1314555267 TSecr=0 WS=128"
"86","0.318329985","74","3a:dc:c1:a7:03:b1","b6:4b:cf:c8:33:f4","172.20.0.2","172.20.0.3","TCP","4433 → 59418 [SYN, ACK] Seq=0 Ack=1 Win=65160 Len=0 MSS=1460 SACK_PERM TSval=1505471063 TSecr=1314555267 WS=128"
"87","0.318352865","66","b6:4b:cf:c8:33:f4","3a:dc:c1:a7:03:b1","172.20.0.3","172.20.0.2","TCP","59418 → 4433 [ACK] Seq=1 Ack=1 Win=64256 Len=0 TSval=1314555268 TSecr=1505471063"
"88","0.318406335","629","b6:4b:cf:c8:33:f4","3a:dc:c1:a7:03:b1","172.20.0.3","172.20.0.2","TLSv1.2","Client Hello"
"89","0.318414050","66","3a:dc:c1:a7:03:b1","b6:4b:cf:c8:33:f4","172.20.0.2","172.20.0.3","TCP","4433 → 59418 [ACK] Seq=1 Ack=564 Win=64640 Len=0 TSval=1505471063 TSecr=1314555268"
"90","0.326578635","1110","3a:dc:c1:a7:03:b1","b6:4b:cf:c8:33:f4","172.20.0.2","172.20.0.3","TLSv1.3","Server Hello, Change Cipher Spec, Application Data, Application Data, Application Data, Application Data"
"91","0.326627216","66","b6:4b:cf:c8:33:f4","3a:dc:c1:a7:03:b1","172.20.0.3","172.20.0.2","TCP","59418 → 4433 [ACK] Seq=564 Ack=1045 Win=64128 Len=0 TSval=1314555276 TSecr=1505471071"
"92","0.338846928","146","b6:4b:cf:c8:33:f4","3a:dc:c1:a7:03:b1","172.20.0.3","172.20.0.2","TLSv1.3","Change Cipher Spec, Application Data"
"93","0.338956470","66","b6:4b:cf:c8:33:f4","3a:dc:c1:a7:03:b1","172.20.0.3","172.20.0.2","TCP","59418 → 4433 [RST, ACK] Seq=644 Ack=1045 Win=64128 Len=0 TSval=1314555288 TSecr=1505471071"
"94","0.353181507","74","b6:4b:cf:c8:33:f4","3a:dc:c1:a7:03:b1","172.20.0.3","172.20.0.2","TCP","59434 → 4433 [SYN] Seq=0 Win=64240 Len=0 MSS=1460 SACK_PERM TSval=1314555302 TSecr=0 WS=128"
"95","0.353212228","74","3a:dc:c1:a7:03:b1","b6:4b:cf:c8:33:f4","172.20.0.2","172.20.0.3","TCP","4433 → 59434 [SYN, ACK] Seq=0 Ack=1 Win=65160 Len=0 MSS=1460 SACK_PERM TSval=1505471097 TSecr=1314555302 WS=128"
"96","0.353229013","66","b6:4b:cf:c8:33:f4","3a:dc:c1:a7:03:b1","172.20.0.3","172.20.0.2","TCP","59434 → 4433 [ACK] Seq=1 Ack=1 Win=64256 Len=0 TSval=1314555302 TSecr=1505471097"
"97","0.353268899","629","b6:4b:cf:c8:33:f4","3a:dc:c1:a7:03:b1","172.20.0.3","172.20.0.2","TLSv1.2","Client Hello"
"98","0.353273288","66","3a:dc:c1:a7:03:b1","b6:4b:cf:c8:33:f4","172.20.0.2","172.20.0.3","TCP","4433 → 59434 [ACK] Seq=1 Ack=564 Win=64640 Len=0 TSval=1505471097 TSecr=1314555302"
"99","0.361343710","1108","3a:dc:c1:a7:03:b1","b6:4b:cf:c8:33:f4","172.20.0.2","172.20.0.3","TLSv1.3","Server Hello, Change Cipher Spec, Application Data, Application Data, Application Data, Application Data"
"100","0.361379319","66","b6:4b:cf:c8:33:f4","3a:dc:c1:a7:03:b1","172.20.0.3","172.20.0.2","TCP","59434 → 4433 [ACK] Seq=564 Ack=1043 Win=64128 Len=0 TSval=1314555311 TSecr=1505471106"
"101","0.368887116","146","b6:4b:cf:c8:33:f4","3a:dc:c1:a7:03:b1","172.20.0.3","172.20.0.2","TLSv1.3","Change Cipher Spec, Application Data"
"102","0.368953807","66","b6:4b:cf:c8:33:f4","3a:dc:c1:a7:03:b1","172.20.0.3","172.20.0.2","TCP","59434 → 4433 [RST, ACK] Seq=644 Ack=1043 Win=64128 Len=0 TSval=1314555318 TSecr=1505471106"
"103","0.382549575","74","b6:4b:cf:c8:33:f4","3a:dc:c1:a7:03:b1","172.20.0.3","172.20.0.2","TCP","59438 → 4433 [SYN] Seq=0 Win=64240 Len=0 MSS=1460 SACK_PERM TSval=1314555332 TSecr=0 WS=128"
"104","0.382573938","74","3a:dc:c1:a7:03:b1","b6:4b:cf:c8:33:f4","172.20.0.2","172.20.0.3","TCP","4433 → 59438 [SYN, ACK] Seq=0 Ack=1 Win=65160 Len=0 MSS=1460 SACK_PERM TSval=1505471127 TSecr=1314555332 WS=128"
"105","0.382592063","66","b6:4b:cf:c8:33:f4","3a:dc:c1:a7:03:b1","172.20.0.3","172.20.0.2","TCP","59438 → 4433 [ACK] Seq=1 Ack=1 Win=64256 Len=0 TSval=1314555332 TSecr=1505471127"
"106","0.382634396","629","b6:4b:cf:c8:33:f4","3a:dc:c1:a7:03:b1","172.20.0.3","172.20.0.2","TLSv1.2","Client Hello"
"107","0.382639846","66","3a:dc:c1:a7:03:b1","b6:4b:cf:c8:33:f4","172.20.0.2","172.20.0.3","TCP","4433 → 59438 [ACK] Seq=1 Ack=564 Win=64640 Len=0 TSval=1505471127 TSecr=1314555332"
"108","0.391061589","1109","3a:dc:c1:a7:03:b1","b6:4b:cf:c8:33:f4","172.20.0.2","172.20.0.3","TLSv1.3","Server Hello, Change Cipher Spec, Application Data, Application Data, Application Data, Application Data"
"109","0.391114228","66","b6:4b:cf:c8:33:f4","3a:dc:c1:a7:03:b1","172.20.0.3","172.20.0.2","TCP","59438 → 4433 [ACK] Seq=564 Ack=1044 Win=64128 Len=0 TSval=1314555340 TSecr=1505471135"
"110","0.398957266","146","b6:4b:cf:c8:33:f4","3a:dc:c1:a7:03:b1","172.20.0.3","172.20.0.2","TLSv1.3","Change Cipher Spec, Application Data"
"111","0.399032568","66","b6:4b:cf:c8:33:f4","3a:dc:c1:a7:03:b1","172.20.0.3","172.20.0.2","TCP","59438 → 4433 [RST, ACK] Seq=644 Ack=1044 Win=64128 Len=0 TSval=1314555348 TSecr=1505471135"
"112","0.412333384","74","b6:4b:cf:c8:33:f4","3a:dc:c1:a7:03:b1","172.20.0.3","172.20.0.2","TCP","59440 → 4433 [SYN] Seq=0 Win=64240 Len=0 MSS=1460 SACK_PERM TSval=1314555361 TSecr=0 WS=128"
"113","0.412365724","74","3a:dc:c1:a7:03:b1","b6:4b:cf:c8:33:f4","172.20.0.2","172.20.0.3","TCP","4433 → 59440 [SYN, ACK] Seq=0 Ack=1 Win=65160 Len=0 MSS=1460 SACK_PERM TSval=1505471157 TSecr=1314555361 WS=128"
"114","0.412385908","66","b6:4b:cf:c8:33:f4","3a:dc:c1:a7:03:b1","172.20.0.3","172.20.0.2","TCP","59440 → 4433 [ACK] Seq=1 Ack=1 Win=64256 Len=0 TSval=1314555362 TSecr=1505471157"
"115","0.412422839","629","b6:4b:cf:c8:33:f4","3a:dc:c1:a7:03:b1","172.20.0.3","172.20.0.2","TLSv1.2","Client Hello"
"116","0.412428888","66","3a:dc:c1:a7:03:b1","b6:4b:cf:c8:33:f4","172.20.0.2","172.20.0.3","TCP","4433 → 59440 [ACK] Seq=1 Ack=564 Win=64640 Len=0 TSval=1505471157 TSecr=1314555362"
"117","0.421018476","1109","3a:dc:c1:a7:03:b1","b6:4b:cf:c8:33:f4","172.20.0.2","172.20.0.3","TLSv1.3","Server Hello, Change Cipher Spec, Application Data, Application Data, Application Data, Application Data"
"118","0.421076890","66","b6:4b:cf:c8:33:f4","3a:dc:c1:a7:03:b1","172.20.0.3","172.20.0.2","TCP","59440 → 4433 [ACK] Seq=564 Ack=1044 Win=64128 Len=0 TSval=1314555370 TSecr=1505471165"
"119","0.428972240","146","b6:4b:cf:c8:33:f4","3a:dc:c1:a7:03:b1","172.20.0.3","172.20.0.2","TLSv1.3","Change Cipher Spec, Application Data"
"120","0.429067760","66","b6:4b:cf:c8:33:f4","3a:dc:c1:a7:03:b1","172.20.0.3","172.20.0.2","TCP","59440 → 4433 [RST, ACK] Seq=644 Ack=1044 Win=64128 Len=0 TSval=1314555378 TSecr=1505471165"
"121","0.442667037","74","b6:4b:cf:c8:33:f4","3a:dc:c1:a7:03:b1","172.20.0.3","172.20.0.2","TCP","59454 → 4433 [SYN] Seq=0 Win=64240 Len=0 MSS=1460 SACK_PERM TSval=1314555392 TSecr=0 WS=128"
"122","0.442691725","74","3a:dc:c1:a7:03:b1","b6:4b:cf:c8:33:f4","172.20.0.2","172.20.0.3","TCP","4433 → 59454 [SYN, ACK] Seq=0 Ack=1 Win=65160 Len=0 MSS=1460 SACK_PERM TSval=1505471187 TSecr=1314555392 WS=128"
"123","0.442708968","66","b6:4b:cf:c8:33:f4","3a:dc:c1:a7:03:b1","172.20.0.3","172.20.0.2","TCP","59454 → 4433 [ACK] Seq=1 Ack=1 Win=64256 Len=0 TSval=1314555392 TSecr=1505471187"
"124","0.442745918","629","b6:4b:cf:c8:33:f4","3a:dc:c1:a7:03:b1","172.20.0.3","172.20.0.2","TLSv1.2","Client Hello"
"125","0.442750577","66","3a:dc:c1:a7:03:b1","b6:4b:cf:c8:33:f4","172.20.0.2","172.20.0.3","TCP","4433 → 59454 [ACK] Seq=1 Ack=564 Win=64640 Len=0 TSval=1505471187 TSecr=1314555392"
"126","0.450953961","1110","3a:dc:c1:a7:03:b1","b6:4b:cf:c8:33:f4","172.20.0.2","172.20.0.3","TLSv1.3","Server Hello, Change Cipher Spec, Application Data, Application Data, Application Data, Application Data"
"127","0.450990070","66","b6:4b:cf:c8:33:f4","3a:dc:c1:a7:03:b1","172.20.0.3","172.20.0.2","TCP","59454 → 4433 [ACK] Seq=564 Ack=1045 Win=64128 Len=0 TSval=1314555400 TSecr=1505471195"
"128","0.458236445","146","b6:4b:cf:c8:33:f4","3a:dc:c1:a7:03:b1","172.20.0.3","172.20.0.2","TLSv1.3","Change Cipher Spec, Application Data"
"129","0.458335122","66","b6:4b:cf:c8:33:f4","3a:dc:c1:a7:03:b1","172.20.0.3","172.20.0.2","TCP","59454 → 4433 [RST, ACK] Seq=644 Ack=1045 Win=64128 Len=0 TSval=1314555408 TSecr=1505471195"
"130","4.036133451","74","b6:4b:cf:c8:33:f4","3a:dc:c1:a7:03:b1","172.20.0.3","172.20.0.2","TCP","59464 → 4433 [SYN] Seq=0 Win=64240 Len=0 MSS=1460 SACK_PERM TSval=1314555421 TSecr=0 WS=128"
"131","4.036156807","74","3a:dc:c1:a7:03:b1","b6:4b:cf:c8:33:f4","172.20.0.2","172.20.0.3","TCP","4433 → 59464 [SYN, ACK] Seq=0 Ack=1 Win=65160 Len=0 MSS=1460 SACK_PERM TSval=1505471216 TSecr=1314555421 WS=128"
"132","4.036175567","66","b6:4b:cf:c8:33:f4","3a:dc:c1:a7:03:b1","172.20.0.3","172.20.0.2","TCP","59464 → 4433 [ACK] Seq=1 Ack=1 Win=64256 Len=0 TSval=1314555421 TSecr=1505471216"
"133","4.036214943","629","b6:4b:cf:c8:33:f4","3a:dc:c1:a7:03:b1","172.20.0.3","172.20.0.2","TLSv1.2","Client Hello"
"134","4.036220762","66","3a:dc:c1:a7:03:b1","b6:4b:cf:c8:33:f4","172.20.0.2","172.20.0.3","TCP","4433 → 59464 [ACK] Seq=1 Ack=564 Win=64640 Len=0 TSval=1505471216 TSecr=1314555421"
"135","4.044336521","1110","3a:dc:c1:a7:03:b1","b6:4b:cf:c8:33:f4","172.20.0.2","172.20.0.3","TLSv1.3","Server Hello, Change Cipher Spec, Application Data, Application Data, Application Data, Application Data"
"136","4.044379278","66","b6:4b:cf:c8:33:f4","3a:dc:c1:a7:03:b1","172.20.0.3","172.20.0.2","TCP","59464 → 4433 [ACK] Seq=564 Ack=1045 Win=64128 Len=0 TSval=1314555429 TSecr=1505471224"
"137","4.051976514","146","b6:4b:cf:c8:33:f4","3a:dc:c1:a7:03:b1","172.20.0.3","172.20.0.2","TLSv1.3","Change Cipher Spec, Application Data"
"138","4.052049027","66","b6:4b:cf:c8:33:f4","3a:dc:c1:a7:03:b1","172.20.0.3","172.20.0.2","TCP","59464 → 4433 [RST, ACK] Seq=644 Ack=1045 Win=64128 Len=0 TSval=1314555437 TSecr=1505471224"
"139","4.065176181","74","b6:4b:cf:c8:33:f4","3a:dc:c1:a7:03:b1","172.20.0.3","172.20.0.2","TCP","59470 → 4433 [SYN] Seq=0 Win=64240 Len=0 MSS=1460 SACK_PERM TSval=1314555450 TSecr=0 WS=128"
"140","4.065197083","74","3a:dc:c1:a7:03:b1","b6:4b:cf:c8:33:f4","172.20.0.2","172.20.0.3","TCP","4433 → 59470 [SYN, ACK] Seq=0 Ack=1 Win=65160 Len=0 MSS=1460 SACK_PERM TSval=1505471245 TSecr=1314555450 WS=128"
"141","4.065213074","66","b6:4b:cf:c8:33:f4","3a:dc:c1:a7:03:b1","172.20.0.3","172.20.0.2","TCP","59470 → 4433 [ACK] Seq=1 Ack=1 Win=64256 Len=0 TSval=1314555450 TSecr=1505471245"
"142","4.065251226","629","b6:4b:cf:c8:33:f4","3a:dc:c1:a7:03:b1","172.20.0.3","172.20.0.2","TLSv1.2","Client Hello"
"143","4.065254750","66","3a:dc:c1:a7:03:b1","b6:4b:cf:c8:33:f4","172.20.0.2","172.20.0.3","TCP","4433 → 59470 [ACK] Seq=1 Ack=564 Win=64640 Len=0 TSval=1505471245 TSecr=1314555450"
"144","4.078304999","1110","3a:dc:c1:a7:03:b1","b6:4b:cf:c8:33:f4","172.20.0.2","172.20.0.3","TLSv1.3","Server Hello, Change Cipher Spec, Application Data, Application Data, Application Data, Application Data"
"145","4.078370020","66","b6:4b:cf:c8:33:f4","3a:dc:c1:a7:03:b1","172.20.0.3","172.20.0.2","TCP","59470 → 4433 [ACK] Seq=564 Ack=1045 Win=64128 Len=0 TSval=1314555463 TSecr=1505471258"
"146","4.085665921","146","b6:4b:cf:c8:33:f4","3a:dc:c1:a7:03:b1","172.20.0.3","172.20.0.2","TLSv1.3","Change Cipher Spec, Application Data"
"147","4.085746060","66","b6:4b:cf:c8:33:f4","3a:dc:c1:a7:03:b1","172.20.0.3","172.20.0.2","TCP","59470 → 4433 [RST, ACK] Seq=644 Ack=1045 Win=64128 Len=0 TSval=1314555470 TSecr=1505471258"
"148","4.099197768","74","b6:4b:cf:c8:33:f4","3a:dc:c1:a7:03:b1","172.20.0.3","172.20.0.2","TCP","59486 → 4433 [SYN] Seq=0 Win=64240 Len=0 MSS=1460 SACK_PERM TSval=1314555484 TSecr=0 WS=128"
"149","4.099226157","74","3a:dc:c1:a7:03:b1","b6:4b:cf:c8:33:f4","172.20.0.2","172.20.0.3","TCP","4433 → 59486 [SYN, ACK] Seq=0 Ack=1 Win=65160 Len=0 MSS=1460 SACK_PERM TSval=1505471279 TSecr=1314555484 WS=128"
"150","4.099242476","66","b6:4b:cf:c8:33:f4","3a:dc:c1:a7:03:b1","172.20.0.3","172.20.0.2","TCP","59486 → 4433 [ACK] Seq=1 Ack=1 Win=64256 Len=0 TSval=1314555484 TSecr=1505471279"
"151","4.099279768","629","b6:4b:cf:c8:33:f4","3a:dc:c1:a7:03:b1","172.20.0.3","172.20.0.2","TLSv1.2","Client Hello"
"152","4.099294412","66","3a:dc:c1:a7:03:b1","b6:4b:cf:c8:33:f4","172.20.0.2","172.20.0.3","TCP","4433 → 59486 [ACK] Seq=1 Ack=564 Win=64640 Len=0 TSval=1505471279 TSecr=1314555484"
"153","4.107221364","1110","3a:dc:c1:a7:03:b1","b6:4b:cf:c8:33:f4","172.20.0.2","172.20.0.3","TLSv1.3","Server Hello, Change Cipher Spec, Application Data, Application Data, Application Data, Application Data"
"154","4.107258371","66","b6:4b:cf:c8:33:f4","3a:dc:c1:a7:03:b1","172.20.0.3","172.20.0.2","TCP","59486 → 4433 [ACK] Seq=564 Ack=1045 Win=64128 Len=0 TSval=1314555492 TSecr=1505471287"
"155","4.114803612","146","b6:4b:cf:c8:33:f4","3a:dc:c1:a7:03:b1","172.20.0.3","172.20.0.2","TLSv1.3","Change Cipher Spec, Application Data"
"156","4.114876724","66","b6:4b:cf:c8:33:f4","3a:dc:c1:a7:03:b1","172.20.0.3","172.20.0.2","TCP","59486 → 4433 [RST, ACK] Seq=644 Ack=1045 Win=64128 Len=0 TSval=1314555500 TSecr=1505471287"
"157","4.128258233","74","b6:4b:cf:c8:33:f4","3a:dc:c1:a7:03:b1","172.20.0.3","172.20.0.2","TCP","59498 → 4433 [SYN] Seq=0 Win=64240 Len=0 MSS=1460 SACK_PERM TSval=1314555513 TSecr=0 WS=128"
"158","4.128284913","74","3a:dc:c1:a7:03:b1","b6:4b:cf:c8:33:f4","172.20.0.2","172.20.0.3","TCP","4433 → 59498 [SYN, ACK] Seq=0 Ack=1 Win=65160 Len=0 MSS=1460 SACK_PERM TSval=1505471308 TSecr=1314555513 WS=128"
"159","4.128303500","66","b6:4b:cf:c8:33:f4","3a:dc:c1:a7:03:b1","172.20.0.3","172.20.0.2","TCP","59498 → 4433 [ACK] Seq=1 Ack=1 Win=64256 Len=0 TSval=1314555513 TSecr=1505471308"
"160","4.128346103","629","b6:4b:cf:c8:33:f4","3a:dc:c1:a7:03:b1","172.20.0.3","172.20.0.2","TLSv1.2","Client Hello"
"161","4.128351185","66","3a:dc:c1:a7:03:b1","b6:4b:cf:c8:33:f4","172.20.0.2","172.20.0.3","TCP","4433 → 59498 [ACK] Seq=1 Ack=564 Win=64640 Len=0 TSval=1505471308 TSecr=1314555513"
"162","4.136750047","1109","3a:dc:c1:a7:03:b1","b6:4b:cf:c8:33:f4","172.20.0.2","172.20.0.3","TLSv1.3","Server Hello, Change Cipher Spec, Application Data, Application Data, Application Data, Application Data"
"163","4.136801319","66","b6:4b:cf:c8:33:f4","3a:dc:c1:a7:03:b1","172.20.0.3","172.20.0.2","TCP","59498 → 4433 [ACK] Seq=564 Ack=1044 Win=64128 Len=0 TSval=1314555521 TSecr=1505471316"
"164","4.144689789","146","b6:4b:cf:c8:33:f4","3a:dc:c1:a7:03:b1","172.20.0.3","172.20.0.2","TLSv1.3","Change Cipher Spec, Application Data"
"165","4.144776866","66","b6:4b:cf:c8:33:f4","3a:dc:c1:a7:03:b1","172.20.0.3","172.20.0.2","TCP","59498 → 4433 [RST, ACK] Seq=644 Ack=1044 Win=64128 Len=0 TSval=1314555529 TSecr=1505471316"
"166","4.157910852","74","b6:4b:cf:c8:33:f4","3a:dc:c1:a7:03:b1","172.20.0.3","172.20.0.2","TCP","59502 → 4433 [SYN] Seq=0 Win=64240 Len=0 MSS=1460 SACK_PERM TSval=1314555543 TSecr=0 WS=128"
"167","4.157933566","74","3a:dc:c1:a7:03:b1","b6:4b:cf:c8:33:f4","172.20.0.2","172.20.0.3","TCP","4433 → 59502 [SYN, ACK] Seq=0 Ack=1 Win=65160 Len=0 MSS=1460 SACK_PERM TSval=1505471338 TSecr=1314555543 WS=128"
"168","4.157950660","66","b6:4b:cf:c8:33:f4","3a:dc:c1:a7:03:b1","172.20.0.3","172.20.0.2","TCP","59502 → 4433 [ACK] Seq=1 Ack=1 Win=64256 Len=0 TSval=1314555543 TSecr=1505471338"
"169","4.157995635","629","b6:4b:cf:c8:33:f4","3a:dc:c1:a7:03:b1","172.20.0.3","172.20.0.2","TLSv1.2","Client Hello"
"170","4.158002036","66","3a:dc:c1:a7:03:b1","b6:4b:cf:c8:33:f4","172.20.0.2","172.20.0.3","TCP","4433 → 59502 [ACK] Seq=1 Ack=564 Win=64640 Len=0 TSval=1505471338 TSecr=1314555543"
"171","4.166255347","1109","3a:dc:c1:a7:03:b1","b6:4b:cf:c8:33:f4","172.20.0.2","172.20.0.3","TLSv1.3","Server Hello, Change Cipher Spec, Application Data, Application Data, Application Data, Application Data"
"172","4.166296650","66","b6:4b:cf:c8:33:f4","3a:dc:c1:a7:03:b1","172.20.0.3","172.20.0.2","TCP","59502 → 4433 [ACK] Seq=564 Ack=1044 Win=64128 Len=0 TSval=1314555551 TSecr=1505471346"
"173","4.173731080","146","b6:4b:cf:c8:33:f4","3a:dc:c1:a7:03:b1","172.20.0.3","172.20.0.2","TLSv1.3","Change Cipher Spec, Application Data"
"174","4.173822845","66","b6:4b:cf:c8:33:f4","3a:dc:c1:a7:03:b1","172.20.0.3","172.20.0.2","TCP","59502 → 4433 [RST, ACK] Seq=644 Ack=1044 Win=64128 Len=0 TSval=1314555559 TSecr=1505471346"
"175","4.187061013","74","b6:4b:cf:c8:33:f4","3a:dc:c1:a7:03:b1","172.20.0.3","172.20.0.2","TCP","59506 → 4433 [SYN] Seq=0 Win=64240 Len=0 MSS=1460 SACK_PERM TSval=1314555572 TSecr=0 WS=128"
"176","4.187087491","74","3a:dc:c1:a7:03:b1","b6:4b:cf:c8:33:f4","172.20.0.2","172.20.0.3","TCP","4433 → 59506 [SYN, ACK] Seq=0 Ack=1 Win=65160 Len=0 MSS=1460 SACK_PERM TSval=1505471367 TSecr=1314555572 WS=128"
"177","4.187103680","66","b6:4b:cf:c8:33:f4","3a:dc:c1:a7:03:b1","172.20.0.3","172.20.0.2","TCP","59506 → 4433 [ACK] Seq=1 Ack=1 Win=64256 Len=0 TSval=1314555572 TSecr=1505471367"
"178","4.187140733","629","b6:4b:cf:c8:33:f4","3a:dc:c1:a7:03:b1","172.20.0.3","172.20.0.2","TLSv1.2","Client Hello"
"179","4.187146731","66","3a:dc:c1:a7:03:b1","b6:4b:cf:c8:33:f4","172.20.0.2","172.20.0.3","TCP","4433 → 59506 [ACK] Seq=1 Ack=564 Win=64640 Len=0 TSval=1505471367 TSecr=1314555572"
"180","4.196067351","1108","3a:dc:c1:a7:03:b1","b6:4b:cf:c8:33:f4","172.20.0.2","172.20.0.3","TLSv1.3","Server Hello, Change Cipher Spec, Application Data, Application Data, Application Data, Application Data"
"181","4.196102222","66","b6:4b:cf:c8:33:f4","3a:dc:c1:a7:03:b1","172.20.0.3","172.20.0.2","TCP","59506 → 4433 [ACK] Seq=564 Ack=1043 Win=64128 Len=0 TSval=1314555581 TSecr=1505471376"
"182","4.203472911","146","b6:4b:cf:c8:33:f4","3a:dc:c1:a7:03:b1","172.20.0.3","172.20.0.2","TLSv1.3","Change Cipher Spec, Application Data"
"183","4.203538843","66","b6:4b:cf:c8:33:f4","3a:dc:c1:a7:03:b1","172.20.0.3","172.20.0.2","TCP","59506 → 4433 [RST, ACK] Seq=644 Ack=1043 Win=64128 Len=0 TSval=1314555588 TSecr=1505471376"
"184","4.216448768","74","b6:4b:cf:c8:33:f4","3a:dc:c1:a7:03:b1","172.20.0.3","172.20.0.2","TCP","59512 → 4433 [SYN] Seq=0 Win=64240 Len=0 MSS=1460 SACK_PERM TSval=1314555601 TSecr=0 WS=128"
"185","4.216476051","74","3a:dc:c1:a7:03:b1","b6:4b:cf:c8:33:f4","172.20.0.2","172.20.0.3","TCP","4433 → 59512 [SYN, ACK] Seq=0 Ack=1 Win=65160 Len=0 MSS=1460 SACK_PERM TSval=1505471396 TSecr=1314555601 WS=128"
"186","4.216491423","66","b6:4b:cf:c8:33:f4","3a:dc:c1:a7:03:b1","172.20.0.3","172.20.0.2","TCP","59512 → 4433 [ACK] Seq=1 Ack=1 Win=64256 Len=0 TSval=1314555601 TSecr=1505471396"
"187","4.216528149","629","b6:4b:cf:c8:33:f4","3a:dc:c1:a7:03:b1","172.20.0.3","172.20.0.2","TLSv1.2","Client Hello"
"188","4.216533156","66","3a:dc:c1:a7:03:b1","b6:4b:cf:c8:33:f4","172.20.0.2","172.20.0.3","TCP","4433 → 59512 [ACK] Seq=1 Ack=564 Win=64640 Len=0 TSval=1505471396 TSecr=1314555601"
"189","4.224773858","1109","3a:dc:c1:a7:03:b1","b6:4b:cf:c8:33:f4","172.20.0.2","172.20.0.3","TLSv1.3","Server Hello, Change Cipher Spec, Application Data, Application Data, Application Data, Application Data"
"190","4.224829632","66","b6:4b:cf:c8:33:f4","3a:dc:c1:a7:03:b1","172.20.0.3","172.20.0.2","TCP","59512 → 4433 [ACK] Seq=564 Ack=1044 Win=64128 Len=0 TSval=1314555610 TSecr=1505471404"
"191","4.232101180","146","b6:4b:cf:c8:33:f4","3a:dc:c1:a7:03:b1","172.20.0.3","172.20.0.2","TLSv1.3","Change Cipher Spec, Application Data"
"192","4.232172150","66","b6:4b:cf:c8:33:f4","3a:dc:c1:a7:03:b1","172.20.0.3","172.20.0.2","TCP","59512 → 4433 [RST, ACK] Seq=644 Ack=1044 Win=64128 Len=0 TSval=1314555617 TSecr=1505471404"
"193","4.244821503","74","b6:4b:cf:c8:33:f4","3a:dc:c1:a7:03:b1","172.20.0.3","172.20.0.2","TCP","59520 → 4433 [SYN] Seq=0 Win=64240 Len=0 MSS=1460 SACK_PERM TSval=1314555629 TSecr=0 WS=128"
"194","4.244847181","74","3a:dc:c1:a7:03:b1","b6:4b:cf:c8:33:f4","172.20.0.2","172.20.0.3","TCP","4433 → 59520 [SYN, ACK] Seq=0 Ack=1 Win=65160 Len=0 MSS=1460 SACK_PERM TSval=1505471425 TSecr=1314555629 WS=128"
"195","4.244864389","66","b6:4b:cf:c8:33:f4","3a:dc:c1:a7:03:b1","172.20.0.3","172.20.0.2","TCP","59520 → 4433 [ACK] Seq=1 Ack=1 Win=64256 Len=0 TSval=1314555630 TSecr=1505471425"
"196","4.244905309","629","b6:4b:cf:c8:33:f4","3a:dc:c1:a7:03:b1","172.20.0.3","172.20.0.2","TLSv1.2","Client Hello"
"197","4.244911057","66","3a:dc:c1:a7:03:b1","b6:4b:cf:c8:33:f4","172.20.0.2","172.20.0.3","TCP","4433 → 59520 [ACK] Seq=1 Ack=564 Win=64640 Len=0 TSval=1505471425 TSecr=1314555630"
"198","4.254639608","1109","3a:dc:c1:a7:03:b1","b6:4b:cf:c8:33:f4","172.20.0.2","172.20.0.3","TLSv1.3","Server Hello, Change Cipher Spec, Application Data, Application Data, Application Data, Application Data"
"199","4.254686325","66","b6:4b:cf:c8:33:f4","3a:dc:c1:a7:03:b1","172.20.0.3","172.20.0.2","TCP","59520 → 4433 [ACK] Seq=564 Ack=1044 Win=64128 Len=0 TSval=1314555639 TSecr=1505471434"
"200","4.262075693","146","b6:4b:cf:c8:33:f4","3a:dc:c1:a7:03:b1","172.20.0.3","172.20.0.2","TLSv1.3","Change Cipher Spec, Application Data"
"201","4.262152488","66","b6:4b:cf:c8:33:f4","3a:dc:c1:a7:03:b1","172.20.0.3","172.20.0.2","TCP","59520 → 4433 [RST, ACK] Seq=644 Ack=1044 Win=64128 Len=0 TSval=1314555647 TSecr=1505471434"
"202","4.275738447","74","b6:4b:cf:c8:33:f4","3a:dc:c1:a7:03:b1","172.20.0.3","172.20.0.2","TCP","59522 → 4433 [SYN] Seq=0 Win=64240 Len=0 MSS=1460 SACK_PERM TSval=1314555660 TSecr=0 WS=128"
"203","4.275766479","74","3a:dc:c1:a7:03:b1","b6:4b:cf:c8:33:f4","172.20.0.2","172.20.0.3","TCP","4433 → 59522 [SYN, ACK] Seq=0 Ack=1 Win=65160 Len=0 MSS=1460 SACK_PERM TSval=1505471455 TSecr=1314555660 WS=128"
"204","4.275788298","66","b6:4b:cf:c8:33:f4","3a:dc:c1:a7:03:b1","172.20.0.3","172.20.0.2","TCP","59522 → 4433 [ACK] Seq=1 Ack=1 Win=64256 Len=0 TSval=1314555660 TSecr=1505471455"
"205","4.275856511","629","b6:4b:cf:c8:33:f4","3a:dc:c1:a7:03:b1","172.20.0.3","172.20.0.2","TLSv1.2","Client Hello"
"206","4.275862740","66","3a:dc:c1:a7:03:b1","b6:4b:cf:c8:33:f4","172.20.0.2","172.20.0.3","TCP","4433 → 59522 [ACK] Seq=1 Ack=564 Win=64640 Len=0 TSval=1505471456 TSecr=1314555661"
"207","4.283980235","1110","3a:dc:c1:a7:03:b1","b6:4b:cf:c8:33:f4","172.20.0.2","172.20.0.3","TLSv1.3","Server Hello, Change Cipher Spec, Application Data, Application Data, Application Data, Application Data"
"208","4.284024943","66","b6:4b:cf:c8:33:f4","3a:dc:c1:a7:03:b1","172.20.0.3","172.20.0.2","TCP","59522 → 4433 [ACK] Seq=564 Ack=1045 Win=64128 Len=0 TSval=1314555669 TSecr=1505471464"
"209","4.291789825","146","b6:4b:cf:c8:33:f4","3a:dc:c1:a7:03:b1","172.20.0.3","172.20.0.2","TLSv1.3","Change Cipher Spec, Application Data"
"210","4.291873348","66","b6:4b:cf:c8:33:f4","3a:dc:c1:a7:03:b1","172.20.0.3","172.20.0.2","TCP","59522 → 4433 [RST, ACK] Seq=644 Ack=1045 Win=64128 Len=0 TSval=1314555677 TSecr=1505471464"
"211","4.305380665","74","b6:4b:cf:c8:33:f4","3a:dc:c1:a7:03:b1","172.20.0.3","172.20.0.2","TCP","59538 → 4433 [SYN] Seq=0 Win=64240 Len=0 MSS=1460 SACK_PERM TSval=1314555690 TSecr=0 WS=128"
"212","4.305408022","74","3a:dc:c1:a7:03:b1","b6:4b:cf:c8:33:f4","172.20.0.2","172.20.0.3","TCP","4433 → 59538 [SYN, ACK] Seq=0 Ack=1 Win=65160 Len=0 MSS=1460 SACK_PERM TSval=1505471485 TSecr=1314555690 WS=128"
"213","4.305424855","66","b6:4b:cf:c8:33:f4","3a:dc:c1:a7:03:b1","172.20.0.3","172.20.0.2","TCP","59538 → 4433 [ACK] Seq=1 Ack=1 Win=64256 Len=0 TSval=1314555690 TSecr=1505471485"
"214","4.305477316","629","b6:4b:cf:c8:33:f4","3a:dc:c1:a7:03:b1","172.20.0.3","172.20.0.2","TLSv1.2","Client Hello"
"215","4.305481436","66","3a:dc:c1:a7:03:b1","b6:4b:cf:c8:33:f4","172.20.0.2","172.20.0.3","TCP","4433 → 59538 [ACK] Seq=1 Ack=564 Win=64640 Len=0 TSval=1505471485 TSecr=1314555690"
"216","4.313653959","1110","3a:dc:c1:a7:03:b1","b6:4b:cf:c8:33:f4","172.20.0.2","172.20.0.3","TLSv1.3","Server Hello, Change Cipher Spec, Application Data, Application Data, Application Data, Application Data"
"217","4.313700088","66","b6:4b:cf:c8:33:f4","3a:dc:c1:a7:03:b1","172.20.0.3","172.20.0.2","TCP","59538 → 4433 [ACK] Seq=564 Ack=1045 Win=64128 Len=0 TSval=1314555698 TSecr=1505471493"
"218","4.321175029","146","b6:4b:cf:c8:33:f4","3a:dc:c1:a7:03:b1","172.20.0.3","172.20.0.2","TLSv1.3","Change Cipher Spec, Application Data"
"219","4.321248876","66","b6:4b:cf:c8:33:f4","3a:dc:c1:a7:03:b1","172.20.0.3","172.20.0.2","TCP","59538 → 4433 [RST, ACK] Seq=644 Ack=1045 Win=64128 Len=0 TSval=1314555706 TSecr=1505471493"
"220","4.334276713","74","b6:4b:cf:c8:33:f4","3a:dc:c1:a7:03:b1","172.20.0.3","172.20.0.2","TCP","59540 → 4433 [SYN] Seq=0 Win=64240 Len=0 MSS=1460 SACK_PERM TSval=1314555719 TSecr=0 WS=128"
"221","4.334305669","74","3a:dc:c1:a7:03:b1","b6:4b:cf:c8:33:f4","172.20.0.2","172.20.0.3","TCP","4433 → 59540 [SYN, ACK] Seq=0 Ack=1 Win=65160 Len=0 MSS=1460 SACK_PERM TSval=1505471514 TSecr=1314555719 WS=128"
"222","4.334321933","66","b6:4b:cf:c8:33:f4","3a:dc:c1:a7:03:b1","172.20.0.3","172.20.0.2","TCP","59540 → 4433 [ACK] Seq=1 Ack=1 Win=64256 Len=0 TSval=1314555719 TSecr=1505471514"
"223","4.334363125","629","b6:4b:cf:c8:33:f4","3a:dc:c1:a7:03:b1","172.20.0.3","172.20.0.2","TLSv1.2","Client Hello"
"224","4.334368646","66","3a:dc:c1:a7:03:b1","b6:4b:cf:c8:33:f4","172.20.0.2","172.20.0.3","TCP","4433 → 59540 [ACK] Seq=1 Ack=564 Win=64640 Len=0 TSval=1505471514 TSecr=1314555719"
"225","4.548823260","1110","3a:dc:c1:a7:03:b1","b6:4b:cf:c8:33:f4","172.20.0.2","172.20.0.3","TLSv1.3","Server Hello, Change Cipher Spec, Application Data, Application Data, Application Data, Application Data"
