frame.number,frame.time_relative,frame.len,eth.src,eth.dst,ip.src,ip.dst,_ws.col.protocol,_ws.col.info
"1","0.000000000","42","26:8d:93:14:88:cf","ff:ff:ff:ff:ff:ff",,,"ARP","ARP Announcement for 172.20.0.3"
"2","0.030860159","42","26:8d:93:14:88:cf","ff:ff:ff:ff:ff:ff",,,"ARP","Who has 172.20.0.2? Tell 172.20.0.3"
"3","0.030883866","42","e2:38:fd:43:7f:4a","26:8d:93:14:88:cf",,,"ARP","172.20.0.2 is at e2:38:fd:43:7f:4a"
"4","0.030890184","74","26:8d:93:14:88:cf","e2:38:fd:43:7f:4a","172.20.0.3","172.20.0.2","TCP","46128 → 4433 [SYN] Seq=0 Win=64240 Len=0 MSS=1460 SACK_PERM TSval=1287705183 TSecr=0 WS=128"
"5","0.030908022","74","e2:38:fd:43:7f:4a","26:8d:93:14:88:cf","172.20.0.2","172.20.0.3","TCP","4433 → 46128 [SYN, ACK] Seq=0 Ack=1 Win=65160 Len=0 MSS=1460 SACK_PERM TSval=1478620978 TSecr=1287705183 WS=128"
"6","0.030923810","66","26:8d:93:14:88:cf","e2:38:fd:43:7f:4a","172.20.0.3","172.20.0.2","TCP","46128 → 4433 [ACK] Seq=1 Ack=1 Win=64256 Len=0 TSval=1287705183 TSecr=1478620978"
"7","0.030972126","561","26:8d:93:14:88:cf","e2:38:fd:43:7f:4a","172.20.0.3","172.20.0.2","TLSv1.2","Client Hello"
"8","0.030976554","66","e2:38:fd:43:7f:4a","26:8d:93:14:88:cf","172.20.0.2","172.20.0.3","TCP","4433 → 46128 [ACK] Seq=1 Ack=496 Win=64768 Len=0 TSval=1478620978 TSecr=1287705183"
"9","0.032152074","769","e2:38:fd:43:7f:4a","26:8d:93:14:88:cf","172.20.0.2","172.20.0.3","TLSv1.3","Server Hello, Change Cipher Spec, Application Data, Application Data, Application Data, Application Data"
"10","0.032194029","66","26:8d:93:14:88:cf","e2:38:fd:43:7f:4a","172.20.0.3","172.20.0.2","TCP","46128 → 4433 [ACK] Seq=496 Ack=704 Win=63616 Len=0 TSval=1287705184 TSecr=1478620979"
"11","0.033074937","146","26:8d:93:14:88:cf","e2:38:fd:43:7f:4a","172.20.0.3","172.20.0.2","TLSv1.3","Change Cipher Spec, Application Data"
"12","0.033138128","66","26:8d:93:14:88:cf","e2:38:fd:43:7f:4a","172.20.0.3","172.20.0.2","TCP","46128 → 4433 [RST, ACK] Seq=576 Ack=704 Win=63616 Len=0 TSval=1287705185 TSecr=1478620979"
"13","0.043585895","74","26:8d:93:14:88:cf","e2:38:fd:43:7f:4a","172.20.0.3","172.20.0.2","TCP","46130 → 4433 [SYN] Seq=0 Win=64240 Len=0 MSS=1460 SACK_PERM TSval=1287705196 TSecr=0 WS=128"
"14","0.043610962","74","e2:38:fd:43:7f:4a","26:8d:93:14:88:cf","172.20.0.2","172.20.0.3","TCP","4433 → 46130 [SYN, ACK] Seq=0 Ack=1 Win=65160 Len=0 MSS=1460 SACK_PERM TSval=1478620991 TSecr=1287705196 WS=128"
"15","0.043629357","66","26:8d:93:14:88:cf","e2:38:fd:43:7f:4a","172.20.0.3","172.20.0.2","TCP","46130 → 4433 [ACK] Seq=1 Ack=1 Win=64256 Len=0 TSval=1287705196 TSecr=1478620991"
"16","0.043671942","561","26:8d:93:14:88:cf","e2:38:fd:43:7f:4a","172.20.0.3","172.20.0.2","TLSv1.2","Client Hello"
"17","0.043677369","66","e2:38:fd:43:7f:4a","26:8d:93:14:88:cf","172.20.0.2","172.20.0.3","TCP","4433 → 46130 [ACK] Seq=1 Ack=496 Win=64768 Len=0 TSval=1478620991 TSecr=1287705196"
"18","0.044425719","769","e2:38:fd:43:7f:4a","26:8d:93:14:88:cf","172.20.0.2","172.20.0.3","TLSv1.3","Server Hello, Change Cipher Spec, Application Data, Application Data, Application Data, Application Data"
"19","0.044457281","66","26:8d:93:14:88:cf","e2:38:fd:43:7f:4a","172.20.0.3","172.20.0.2","TCP","46130 → 4433 [ACK] Seq=496 Ack=704 Win=63616 Len=0 TSval=1287705197 TSecr=1478620991"
"20","0.045256665","146","26:8d:93:14:88:cf","e2:38:fd:43:7f:4a","172.20.0.3","172.20.0.2","TLSv1.3","Change Cipher Spec, Application Data"
"21","0.045318949","66","26:8d:93:14:88:cf","e2:38:fd:43:7f:4a","172.20.0.3","172.20.0.2","TCP","46130 → 4433 [RST, ACK] Seq=576 Ack=704 Win=63616 Len=0 TSval=1287705197 TSecr=1478620991"
"22","0.055865613","74","26:8d:93:14:88:cf","e2:38:fd:43:7f:4a","172.20.0.3","172.20.0.2","TCP","46136 → 4433 [SYN] Seq=0 Win=64240 Len=0 MSS=1460 SACK_PERM TSval=1287705208 TSecr=0 WS=128"
"23","0.055888091","74","e2:38:fd:43:7f:4a","26:8d:93:14:88:cf","172.20.0.2","172.20.0.3","TCP","4433 → 46136 [SYN, ACK] Seq=0 Ack=1 Win=65160 Len=0 MSS=1460 SACK_PERM TSval=1478621003 TSecr=1287705208 WS=128"
"24","0.055905300","66","26:8d:93:14:88:cf","e2:38:fd:43:7f:4a","172.20.0.3","172.20.0.2","TCP","46136 → 4433 [ACK] Seq=1 Ack=1 Win=64256 Len=0 TSval=1287705208 TSecr=1478621003"
"25","0.055951336","561","26:8d:93:14:88:cf","e2:38:fd:43:7f:4a","172.20.0.3","172.20.0.2","TLSv1.2","Client Hello"
"26","0.055957515","66","e2:38:fd:43:7f:4a","26:8d:93:14:88:cf","172.20.0.2","172.20.0.3","TCP","4433 → 46136 [ACK] Seq=1 Ack=496 Win=64768 Len=0 TSval=1478621003 TSecr=1287705208"
"27","0.056479616","769","e2:38:fd:43:7f:4a","26:8d:93:14:88:cf","172.20.0.2","172.20.0.3","TLSv1.3","Server Hello, Change Cipher Spec, Application Data, Application Data, Application Data, Application Data"
"28","0.056509227","66","26:8d:93:14:88:cf","e2:38:fd:43:7f:4a","172.20.0.3","172.20.0.2","TCP","46136 → 4433 [ACK] Seq=496 Ack=704 Win=63616 Len=0 TSval=1287705209 TSecr=1478621004"
"29","0.057409314","146","26:8d:93:14:88:cf","e2:38:fd:43:7f:4a","172.20.0.3","172.20.0.2","TLSv1.3","Change Cipher Spec, Application Data"
"30","0.057468923","66","26:8d:93:14:88:cf","e2:38:fd:43:7f:4a","172.20.0.3","172.20.0.2","TCP","46136 → 4433 [RST, ACK] Seq=576 Ack=704 Win=63616 Len=0 TSval=1287705210 TSecr=1478621004"
"31","0.067847025","74","26:8d:93:14:88:cf","e2:38:fd:43:7f:4a","172.20.0.3","172.20.0.2","TCP","46152 → 4433 [SYN] Seq=0 Win=64240 Len=0 MSS=1460 SACK_PERM TSval=1287705220 TSecr=0 WS=128"
"32","0.067869547","74","e2:38:fd:43:7f:4a","26:8d:93:14:88:cf","172.20.0.2","172.20.0.3","TCP","4433 → 46152 [SYN, ACK] Seq=0 Ack=1 Win=65160 Len=0 MSS=1460 SACK_PERM TSval=1478621015 TSecr=1287705220 WS=128"
"33","0.067886793","66","26:8d:93:14:88:cf","e2:38:fd:43:7f:4a","172.20.0.3","172.20.0.2","TCP","46152 → 4433 [ACK] Seq=1 Ack=1 Win=64256 Len=0 TSval=1287705220 TSecr=1478621015"
"34","0.067926957","561","26:8d:93:14:88:cf","e2:38:fd:43:7f:4a","172.20.0.3","172.20.0.2","TLSv1.2","Client Hello"
"35","0.067931613","66","e2:38:fd:43:7f:4a","26:8d:93:14:88:cf","172.20.0.2","172.20.0.3","TCP","4433 → 46152 [ACK] Seq=1 Ack=496 Win=64768 Len=0 TSval=1478621015 TSecr=1287705220"
"36","0.068461136","769","e2:38:fd:43:7f:4a","26:8d:93:14:88:cf","172.20.0.2","172.20.0.3","TLSv1.3","Server Hello, Change Cipher Spec, Application Data, Application Data, Application Data, Application Data"
"37","0.068489864","66","26:8d:93:14:88:cf","e2:38:fd:43:7f:4a","172.20.0.3","172.20.0.2","TCP","46152 → 4433 [ACK] Seq=496 Ack=704 Win=63616 Len=0 TSval=1287705221 TSecr=1478621016"
"38","0.069347204","146","26:8d:93:14:88:cf","e2:38:fd:43:7f:4a","172.20.0.3","172.20.0.2","TLSv1.3","Change Cipher Spec, Application Data"
"39","0.069416461","66","26:8d:93:14:88:cf","e2:38:fd:43:7f:4a","172.20.0.3","172.20.0.2","TCP","46152 → 4433 [RST, ACK] Seq=576 Ack=704 Win=63616 Len=0 TSval=1287705222 TSecr=1478621016"
"40","0.084901518","74","26:8d:93:14:88:cf","e2:38:fd:43:7f:4a","172.20.0.3","172.20.0.2","TCP","46166 → 4433 [SYN] Seq=0 Win=64240 Len=0 MSS=1460 SACK_PERM TSval=1287705237 TSecr=0 WS=128"
"41","0.084940195","74","e2:38:fd:43:7f:4a","26:8d:93:14:88:cf","172.20.0.2","172.20.0.3","TCP","4433 → 46166 [SYN, ACK] Seq=0 Ack=1 Win=65160 Len=0 MSS=1460 SACK_PERM TSval=1478621032 TSecr=1287705237 WS=128"
"42","0.084969964","66","26:8d:93:14:88:cf","e2:38:fd:43:7f:4a","172.20.0.3","172.20.0.2","TCP","46166 → 4433 [ACK] Seq=1 Ack=1 Win=64256 Len=0 TSval=1287705237 TSecr=1478621032"
"43","0.085030532","561","26:8d:93:14:88:cf","e2:38:fd:43:7f:4a","172.20.0.3","172.20.0.2","TLSv1.2","Client Hello"
"44","0.085038335","66","e2:38:fd:43:7f:4a","26:8d:93:14:88:cf","172.20.0.2","172.20.0.3","TCP","4433 → 46166 [ACK] Seq=1 Ack=496 Win=64768 Len=0 TSval=1478621032 TSecr=1287705237"
"45","0.085891475","769","e2:38:fd:43:7f:4a","26:8d:93:14:88:cf","172.20.0.2","172.20.0.3","TLSv1.3","Server Hello, Change Cipher Spec, Application Data, Application Data, Application Data, Application Data"
"46","0.085926052","66","26:8d:93:14:88:cf","e2:38:fd:43:7f:4a","172.20.0.3","172.20.0.2","TCP","46166 → 4433 [ACK] Seq=496 Ack=704 Win=63616 Len=0 TSval=1287705238 TSecr=1478621033"
"47","0.087366851","146","26:8d:93:14:88:cf","e2:38:fd:43:7f:4a","172.20.0.3","172.20.0.2","TLSv1.3","Change Cipher Spec, Application Data"
"48","0.087472624","66","26:8d:93:14:88:cf","e2:38:fd:43:7f:4a","172.20.0.3","172.20.0.2","TCP","46166 → 4433 [RST, ACK] Seq=576 Ack=704 Win=63616 Len=0 TSval=1287705240 TSecr=1478621033"
"49","0.099092357","74","26:8d:93:14:88:cf","e2:38:fd:43:7f:4a","172.20.0.3","172.20.0.2","TCP","46178 → 4433 [SYN] Seq=0 Win=64240 Len=0 MSS=1460 SACK_PERM TSval=1287705251 TSecr=0 WS=128"
"50","0.099117993","74","e2:38:fd:43:7f:4a","26:8d:93:14:88:cf","172.20.0.2","172.20.0.3","TCP","4433 → 46178 [SYN, ACK] Seq=0 Ack=1 Win=65160 Len=0 MSS=1460 SACK_PERM TSval=1478621046 TSecr=1287705251 WS=128"
"51","0.099135572","66","26:8d:93:14:88:cf","e2:38:fd:43:7f:4a","172.20.0.3","172.20.0.2","TCP","46178 → 4433 [ACK] Seq=1 Ack=1 Win=64256 Len=0 TSval=1287705251 TSecr=1478621046"
"52","0.099180349","561","26:8d:93:14:88:cf","e2:38:fd:43:7f:4a","172.20.0.3","172.20.0.2","TLSv1.2","Client Hello"
"53","0.099186253","66","e2:38:fd:43:7f:4a","26:8d:93:14:88:cf","172.20.0.2","172.20.0.3","TCP","4433 → 46178 [ACK] Seq=1 Ack=496 Win=64768 Len=0 TSval=1478621046 TSecr=1287705251"
"54","0.099769647","769","e2:38:fd:43:7f:4a","26:8d:93:14:88:cf","172.20.0.2","172.20.0.3","TLSv1.3","Server Hello, Change Cipher Spec, Application Data, Application Data, Application Data, Application Data"
"55","0.099800668","66","26:8d:93:14:88:cf","e2:38:fd:43:7f:4a","172.20.0.3","172.20.0.2","TCP","46178 → 4433 [ACK] Seq=496 Ack=704 Win=63616 Len=0 TSval=1287705252 TSecr=1478621047"
"56","0.100681323","146","26:8d:93:14:88:cf","e2:38:fd:43:7f:4a","172.20.0.3","172.20.0.2","TLSv1.3","Change Cipher Spec, Application Data"
"57","0.100737961","66","26:8d:93:14:88:cf","e2:38:fd:43:7f:4a","172.20.0.3","172.20.0.2","TCP","46178 → 4433 [RST, ACK] Seq=576 Ack=704 Win=63616 Len=0 TSval=1287705253 TSecr=1478621047"
"58","0.111265173","74","26:8d:93:14:88:cf","e2:38:fd:43:7f:4a","172.20.0.3","172.20.0.2","TCP","46186 → 4433 [SYN] Seq=0 Win=64240 Len=0 MSS=1460 SACK_PERM TSval=1287705263 TSecr=0 WS=128"
"59","0.111288841","74","e2:38:fd:43:7f:4a","26:8d:93:14:88:cf","172.20.0.2","172.20.0.3","TCP","4433 → 46186 [SYN, ACK] Seq=0 Ack=1 Win=65160 Len=0 MSS=1460 SACK_PERM TSval=1478621058 TSecr=1287705263 WS=128"
"60","0.111312616","66","26:8d:93:14:88:cf","e2:38:fd:43:7f:4a","172.20.0.3","172.20.0.2","TCP","46186 → 4433 [ACK] Seq=1 Ack=1 Win=64256 Len=0 TSval=1287705263 TSecr=1478621058"
"61","0.111350658","561","26:8d:93:14:88:cf","e2:38:fd:43:7f:4a","172.20.0.3","172.20.0.2","TLSv1.2","Client Hello"
"62","0.111370097","66","e2:38:fd:43:7f:4a","26:8d:93:14:88:cf","172.20.0.2","172.20.0.3","TCP","4433 → 46186 [ACK] Seq=1 Ack=496 Win=64768 Len=0 TSval=1478621058 TSecr=1287705263"
"63","0.111914760","769","e2:38:fd:43:7f:4a","26:8d:93:14:88:cf","172.20.0.2","172.20.0.3","TLSv1.3","Server Hello, Change Cipher Spec, Application Data, Application Data, Application Data, Application Data"
"64","0.111935446","66","26:8d:93:14:88:cf","e2:38:fd:43:7f:4a","172.20.0.3","172.20.0.2","TCP","46186 → 4433 [ACK] Seq=496 Ack=704 Win=63616 Len=0 TSval=1287705264 TSecr=1478621059"
"65","0.112791017","146","26:8d:93:14:88:cf","e2:38:fd:43:7f:4a","172.20.0.3","172.20.0.2","TLSv1.3","Change Cipher Spec, Application Data"
"66","0.112848448","66","26:8d:93:14:88:cf","e2:38:fd:43:7f:4a","172.20.0.3","172.20.0.2","TCP","46186 → 4433 [RST, ACK] Seq=576 Ack=704 Win=63616 Len=0 TSval=1287705265 TSecr=1478621059"
"67","0.127412588","74","26:8d:93:14:88:cf","e2:38:fd:43:7f:4a","172.20.0.3","172.20.0.2","TCP","46188 → 4433 [SYN] Seq=0 Win=64240 Len=0 MSS=1460 SACK_PERM TSval=1287705279 TSecr=0 WS=128"
"68","0.127448117","74","e2:38:fd:43:7f:4a","26:8d:93:14:88:cf","172.20.0.2","172.20.0.3","TCP","4433 → 46188 [SYN, ACK] Seq=0 Ack=1 Win=65160 Len=0 MSS=1460 SACK_PERM TSval=1478621075 TSecr=1287705279 WS=128"
"69","0.127472759","66","26:8d:93:14:88:cf","e2:38:fd:43:7f:4a","172.20.0.3","172.20.0.2","TCP","46188 → 4433 [ACK] Seq=1 Ack=1 Win=64256 Len=0 TSval=1287705280 TSecr=1478621075"
"70","0.127529164","561","26:8d:93:14:88:cf","e2:38:fd:43:7f:4a","172.20.0.3","172.20.0.2","TLSv1.2","Client Hello"
"71","0.127536048","66","e2:38:fd:43:7f:4a","26:8d:93:14:88:cf","172.20.0.2","172.20.0.3","TCP","4433 → 46188 [ACK] Seq=1 Ack=496 Win=64768 Len=0 TSval=1478621075 TSecr=1287705280"
"72","0.128104898","769","e2:38:fd:43:7f:4a","26:8d:93:14:88:cf","172.20.0.2","172.20.0.3","TLSv1.3","Server Hello, Change Cipher Spec, Application Data, Application Data, Application Data, Application Data"
"73","0.128139185","66","26:8d:93:14:88:cf","e2:38:fd:43:7f:4a","172.20.0.3","172.20.0.2","TCP","46188 → 4433 [ACK] Seq=496 Ack=704 Win=63616 Len=0 TSval=1287705280 TSecr=1478621075"
"74","0.129527951","146","26:8d:93:14:88:cf","e2:38:fd:43:7f:4a","172.20.0.3","172.20.0.2","TLSv1.3","Change Cipher Spec, Application Data"
"75","0.129618221","66","26:8d:93:14:88:cf","e2:38:fd:43:7f:4a","172.20.0.3","172.20.0.2","TCP","46188 → 4433 [RST, ACK] Seq=576 Ack=704 Win=63616 Len=0 TSval=1287705282 TSecr=1478621075"
"76","0.140471987","74","26:8d:93:14:88:cf","e2:38:fd:43:7f:4a","172.20.0.3","172.20.0.2","TCP","46196 → 4433 [SYN] Seq=0 Win=64240 Len=0 MSS=1460 SACK_PERM TSval=1287705293 TSecr=0 WS=128"
"77","0.140495663","74","e2:38:fd:43:7f:4a","26:8d:93:14:88:cf","172.20.0.2","172.20.0.3","TCP","4433 → 46196 [SYN, ACK] Seq=0 Ack=1 Win=65160 Len=0 MSS=1460 SACK_PERM TSval=1478621088 TSecr=1287705293 WS=128"
"78","0.140511721","66","26:8d:93:14:88:cf","e2:38:fd:43:7f:4a","172.20.0.3","172.20.0.2","TCP","46196 → 4433 [ACK] Seq=1 Ack=1 Win=64256 Len=0 TSval=1287705293 TSecr=1478621088"
"79","0.140552793","561","26:8d:93:14:88:cf","e2:38:fd:43:7f:4a","172.20.0.3","172.20.0.2","TLSv1.2","Client Hello"
"80","0.140557237","66","e2:38:fd:43:7f:4a","26:8d:93:14:88:cf","172.20.0.2","172.20.0.3","TCP","4433 → 46196 [ACK] Seq=1 Ack=496 Win=64768 Len=0 TSval=1478621088 TSecr=1287705293"
"81","0.141120818","769","e2:38:fd:43:7f:4a","26:8d:93:14:88:cf","172.20.0.2","172.20.0.3","TLSv1.3","Server Hello, Change Cipher Spec, Application Data, Application Data, Application Data, Application Data"
"82","0.141155615","66","26:8d:93:14:88:cf","e2:38:fd:43:7f:4a","172.20.0.3","172.20.0.2","TCP","46196 → 4433 [ACK] Seq=496 Ack=704 Win=63616 Len=0 TSval=1287705293 TSecr=1478621088"
"83","0.141990184","146","26:8d:93:14:88:cf","e2:38:fd:43:7f:4a","172.20.0.3","172.20.0.2","TLSv1.3","Change Cipher Spec, Application Data"
"84","0.142044938","66","26:8d:93:14:88:cf","e2:38:fd:43:7f:4a","172.20.0.3","172.20.0.2","TCP","46196 → 4433 [RST, ACK] Seq=576 Ack=704 Win=63616 Len=0 TSval=1287705294 TSecr=1478621088"
"85","0.152346567","74","26:8d:93:14:88:cf","e2:38:fd:43:7f:4a","172.20.0.3","172.20.0.2","TCP","46212 → 4433 [SYN] Seq=0 Win=64240 Len=0 MSS=1460 SACK_PERM TSval=1287705304 TSecr=0 WS=128"
"86","0.152369656","74","e2:38:fd:43:7f:4a","26:8d:93:14:88:cf","172.20.0.2","172.20.0.3","TCP","4433 → 46212 [SYN, ACK] Seq=0 Ack=1 Win=65160 Len=0 MSS=1460 SACK_PERM TSval=1478621099 TSecr=1287705304 WS=128"
"87","0.152405154","66","26:8d:93:14:88:cf","e2:38:fd:43:7f:4a","172.20.0.3","172.20.0.2","TCP","46212 → 4433 [ACK] Seq=1 Ack=1 Win=64256 Len=0 TSval=1287705304 TSecr=1478621099"
"88","0.152447602","561","26:8d:93:14:88:cf","e2:38:fd:43:7f:4a","172.20.0.3","172.20.0.2","TLSv1.2","Client Hello"
"89","0.152451493","66","e2:38:fd:43:7f:4a","26:8d:93:14:88:cf","172.20.0.2","172.20.0.3","TCP","4433 → 46212 [ACK] Seq=1 Ack=496 Win=64768 Len=0 TSval=1478621100 TSecr=1287705305"
"90","0.153046337","769","e2:38:fd:43:7f:4a","26:8d:93:14:88:cf","172.20.0.2","172.20.0.3","TLSv1.3","Server Hello, Change Cipher Spec, Application Data, Application Data, Application Data, Application Data"
"91","0.153079939","66","26:8d:93:14:88:cf","e2:38:fd:43:7f:4a","172.20.0.3","172.20.0.2","TCP","46212 → 4433 [ACK] Seq=496 Ack=704 Win=63616 Len=0 TSval=1287705305 TSecr=1478621100"
"92","0.153959040","146","26:8d:93:14:88:cf","e2:38:fd:43:7f:4a","172.20.0.3","172.20.0.2","TLSv1.3","Change Cipher Spec, Application Data"
"93","0.154021012","66","26:8d:93:14:88:cf","e2:38:fd:43:7f:4a","172.20.0.3","172.20.0.2","TCP","46212 → 4433 [RST, ACK] Seq=576 Ack=704 Win=63616 Len=0 TSval=1287705306 TSecr=1478621100"
"94","0.164648284","74","26:8d:93:14:88:cf","e2:38:fd:43:7f:4a","172.20.0.3","172.20.0.2","TCP","46228 → 4433 [SYN] Seq=0 Win=64240 Len=0 MSS=1460 SACK_PERM TSval=1287705317 TSecr=0 WS=128"
"95","0.164672308","74","e2:38:fd:43:7f:4a","26:8d:93:14:88:cf","172.20.0.2","172.20.0.3","TCP","4433 → 46228 [SYN, ACK] Seq=0 Ack=1 Win=65160 Len=0 MSS=1460 SACK_PERM TSval=1478621112 TSecr=1287705317 WS=128"
"96","0.164689337","66","26:8d:93:14:88:cf","e2:38:fd:43:7f:4a","172.20.0.3","172.20.0.2","TCP","46228 → 4433 [ACK] Seq=1 Ack=1 Win=64256 Len=0 TSval=1287705317 TSecr=1478621112"
"97","0.164730705","561","26:8d:93:14:88:cf","e2:38:fd:43:7f:4a","172.20.0.3","172.20.0.2","TLSv1.2","Client Hello"
"98","0.164735504","66","e2:38:fd:43:7f:4a","26:8d:93:14:88:cf","172.20.0.2","172.20.0.3","TCP","4433 → 46228 [ACK] Seq=1 Ack=496 Win=64768 Len=0 TSval=1478621112 TSecr=1287705317"
"99","0.165234201","769","e2:38:fd:43:7f:4a","26:8d:93:14:88:cf","172.20.0.2","172.20.0.3","TLSv1.3","Server Hello, Change Cipher Spec, Application Data, Application Data, Application Data, Application Data"
"100","0.165276769","66","26:8d:93:14:88:cf","e2:38:fd:43:7f:4a","172.20.0.3","172.20.0.2","TCP","46228 → 4433 [ACK] Seq=496 Ack=704 Win=63616 Len=0 TSval=1287705317 TSecr=1478621112"
"101","0.166109051","146","26:8d:93:14:88:cf","e2:38:fd:43:7f:4a","172.20.0.3","172.20.0.2","TLSv1.3","Change Cipher Spec, Application Data"
"102","0.166172041","66","26:8d:93:14:88:cf","e2:38:fd:43:7f:4a","172.20.0.3","172.20.0.2","TCP","46228 → 4433 [RST, ACK] Seq=576 Ack=704 Win=63616 Len=0 TSval=1287705318 TSecr=1478621112"
"103","0.176547857","74","26:8d:93:14:88:cf","e2:38:fd:43:7f:4a","172.20.0.3","172.20.0.2","TCP","46238 → 4433 [SYN] Seq=0 Win=64240 Len=0 MSS=1460 SACK_PERM TSval=1287705329 TSecr=0 WS=128"
"104","0.176567157","74","e2:38:fd:43:7f:4a","26:8d:93:14:88:cf","172.20.0.2","172.20.0.3","TCP","4433 → 46238 [SYN, ACK] Seq=0 Ack=1 Win=65160 Len=0 MSS=1460 SACK_PERM TSval=1478621124 TSecr=1287705329 WS=128"
"105","0.176587400","66","26:8d:93:14:88:cf","e2:38:fd:43:7f:4a","172.20.0.3","172.20.0.2","TCP","46238 → 4433 [ACK] Seq=1 Ack=1 Win=64256 Len=0 TSval=1287705329 TSecr=1478621124"
"106","0.176634293","561","26:8d:93:14:88:cf","e2:38:fd:43:7f:4a","172.20.0.3","172.20.0.2","TLSv1.2","Client Hello"
"107","0.176641039","66","e2:38:fd:43:7f:4a","26:8d:93:14:88:cf","172.20.0.2","172.20.0.3","TCP","4433 → 46238 [ACK] Seq=1 Ack=496 Win=64768 Len=0 TSval=1478621124 TSecr=1287705329"
"108","0.177198536","769","e2:38:fd:43:7f:4a","26:8d:93:14:88:cf","172.20.0.2","172.20.0.3","TLSv1.3","Server Hello, Change Cipher Spec, Application Data, Application Data, Application Data, Application Data"
"109","0.177238144","66","26:8d:93:14:88:cf","e2:38:fd:43:7f:4a","172.20.0.3","172.20.0.2","TCP","46238 → 4433 [ACK] Seq=496 Ack=704 Win=63616 Len=0 TSval=1287705329 TSecr=1478621124"
"110","0.178210573","146","26:8d:93:14:88:cf","e2:38:fd:43:7f:4a","172.20.0.3","172.20.0.2","TLSv1.3","Change Cipher Spec, Application Data"
"111","0.178277107","66","26:8d:93:14:88:cf","e2:38:fd:43:7f:4a","172.20.0.3","172.20.0.2","TCP","46238 → 4433 [RST, ACK] Seq=576 Ack=704 Win=63616 Len=0 TSval=1287705330 TSecr=1478621124"
"112","0.188987658","74","26:8d:93:14:88:cf","e2:38:fd:43:7f:4a","172.20.0.3","172.20.0.2","TCP","46252 → 4433 [SYN] Seq=0 Win=64240 Len=0 MSS=1460 SACK_PERM TSval=1287705341 TSecr=0 WS=128"
"113","0.189018504","74","e2:38:fd:43:7f:4a","26:8d:93:14:88:cf","172.20.0.2","172.20.0.3","TCP","4433 → 46252 [SYN, ACK] Seq=0 Ack=1 Win=65160 Len=0 MSS=1460 SACK_PERM TSval=1478621136 TSecr=1287705341 WS=128"
"114","0.189042429","66","26:8d:93:14:88:cf","e2:38:fd:43:7f:4a","172.20.0.3","172.20.0.2","TCP","46252 → 4433 [ACK] Seq=1 Ack=1 Win=64256 Len=0 TSval=1287705341 TSecr=1478621136"
"115","0.189094657","561","26:8d:93:14:88:cf","e2:38:fd:43:7f:4a","172.20.0.3","172.20.0.2","TLSv1.2","Client Hello"
"116","0.189103015","66","e2:38:fd:43:7f:4a","26:8d:93:14:88:cf","172.20.0.2","172.20.0.3","TCP","4433 → 46252 [ACK] Seq=1 Ack=496 Win=64768 Len=0 TSval=1478621136 TSecr=1287705341"
"117","0.189643915","769","e2:38:fd:43:7f:4a","26:8d:93:14:88:cf","172.20.0.2","172.20.0.3","TLSv1.3","Server Hello, Change Cipher Spec, Application Data, Application Data, Application Data, Application Data"
"118","0.189677192","66","26:8d:93:14:88:cf","e2:38:fd:43:7f:4a","172.20.0.3","172.20.0.2","TCP","46252 → 4433 [ACK] Seq=496 Ack=704 Win=63616 Len=0 TSval=1287705342 TSecr=1478621137"
"119","0.190890526","146","26:8d:93:14:88:cf","e2:38:fd:43:7f:4a","172.20.0.3","172.20.0.2","TLSv1.3","Change Cipher Spec, Application Data"
"120","0.190975601","66","26:8d:93:14:88:cf","e2:38:fd:43:7f:4a","172.20.0.3","172.20.0.2","TCP","46252 → 4433 [RST, ACK] Seq=576 Ack=704 Win=63616 Len=0 TSval=1287705343 TSecr=1478621137"
"121","0.205617415","74","26:8d:93:14:88:cf","e2:38:fd:43:7f:4a","172.20.0.3","172.20.0.2","TCP","46254 → 4433 [SYN] Seq=0 Win=64240 Len=0 MSS=1460 SACK_PERM TSval=1287705358 TSecr=0 WS=128"
"122","0.205651605","74","e2:38:fd:43:7f:4a","26:8d:93:14:88:cf","172.20.0.2","172.20.0.3","TCP","4433 → 46254 [SYN, ACK] Seq=0 Ack=1 Win=65160 Len=0 MSS=1460 SACK_PERM TSval=1478621153 TSecr=1287705358 WS=128"
"123","0.205677798","66","26:8d:93:14:88:cf","e2:38:fd:43:7f:4a","172.20.0.3","172.20.0.2","TCP","46254 → 4433 [ACK] Seq=1 Ack=1 Win=64256 Len=0 TSval=1287705358 TSecr=1478621153"
"124","0.205741836","561","26:8d:93:14:88:cf","e2:38:fd:43:7f:4a","172.20.0.3","172.20.0.2","TLSv1.2","Client Hello"
"125","0.205748823","66","e2:38:fd:43:7f:4a","26:8d:93:14:88:cf","172.20.0.2","172.20.0.3","TCP","4433 → 46254 [ACK] Seq=1 Ack=496 Win=64768 Len=0 TSval=1478621153 TSecr=1287705358"
"126","0.206603432","769","e2:38:fd:43:7f:4a","26:8d:93:14:88:cf","172.20.0.2","172.20.0.3","TLSv1.3","Server Hello, Change Cipher Spec, Application Data, Application Data, Application Data, Application Data"
"127","0.206638855","66","26:8d:93:14:88:cf","e2:38:fd:43:7f:4a","172.20.0.3","172.20.0.2","TCP","46254 → 4433 [ACK] Seq=496 Ack=704 Win=63616 Len=0 TSval=1287705359 TSecr=1478621154"
"128","0.207979457","146","26:8d:93:14:88:cf","e2:38:fd:43:7f:4a","172.20.0.3","172.20.0.2","TLSv1.3","Change Cipher Spec, Application Data"
"129","0.208052597","66","26:8d:93:14:88:cf","e2:38:fd:43:7f:4a","172.20.0.3","172.20.0.2","TCP","46254 → 4433 [RST, ACK] Seq=576 Ack=704 Win=63616 Len=0 TSval=1287705360 TSecr=1478621154"
"130","0.218612370","74","26:8d:93:14:88:cf","e2:38:fd:43:7f:4a","172.20.0.3","172.20.0.2","TCP","46268 → 4433 [SYN] Seq=0 Win=64240 Len=0 MSS=1460 SACK_PERM TSval=1287705371 TSecr=0 WS=128"
"131","0.218638134","74","e2:38:fd:43:7f:4a","26:8d:93:14:88:cf","172.20.0.2","172.20.0.3","TCP","4433 → 46268 [SYN, ACK] Seq=0 Ack=1 Win=65160 Len=0 MSS=1460 SACK_PERM TSval=1478621166 TSecr=1287705371 WS=128"
"132","0.218655125","66","26:8d:93:14:88:cf","e2:38:fd:43:7f:4a","172.20.0.3","172.20.0.2","TCP","46268 → 4433 [ACK] Seq=1 Ack=1 Win=64256 Len=0 TSval=1287705371 TSecr=1478621166"
"133","0.218693604","561","26:8d:93:14:88:cf","e2:38:fd:43:7f:4a","172.20.0.3","172.20.0.2","TLSv1.2","Client Hello"
"134","0.218698036","66","e2:38:fd:43:7f:4a","26:8d:93:14:88:cf","172.20.0.2","172.20.0.3","TCP","4433 → 46268 [ACK] Seq=1 Ack=496 Win=64768 Len=0 TSval=1478621166 TSecr=1287705371"
"135","0.219529612","769","e2:38:fd:43:7f:4a","26:8d:93:14:88:cf","172.20.0.2","172.20.0.3","TLSv1.3","Server Hello, Change Cipher Spec, Application Data, Application Data, Application Data, Application Data"
"136","0.219566591","66","26:8d:93:14:88:cf","e2:38:fd:43:7f:4a","172.20.0.3","172.20.0.2","TCP","46268 → 4433 [ACK] Seq=496 Ack=704 Win=63616 Len=0 TSval=1287705372 TSecr=1478621167"
"137","0.220369647","146","26:8d:93:14:88:cf","e2:38:fd:43:7f:4a","172.20.0.3","172.20.0.2","TLSv1.3","Change Cipher Spec, Application Data"
"138","0.220443101","66","26:8d:93:14:88:cf","e2:38:fd:43:7f:4a","172.20.0.3","172.20.0.2","TCP","46268 → 4433 [RST, ACK] Seq=576 Ack=704 Win=63616 Len=0 TSval=1287705373 TSecr=1478621167"
"139","0.231879698","74","26:8d:93:14:88:cf","e2:38:fd:43:7f:4a","172.20.0.3","172.20.0.2","TCP","46272 → 4433 [SYN] Seq=0 Win=64240 Len=0 MSS=1460 SACK_PERM TSval=1287705384 TSecr=0 WS=128"
"140","0.231905334","74","e2:38:fd:43:7f:4a","26:8d:93:14:88:cf","172.20.0.2","172.20.0.3","TCP","4433 → 46272 [SYN, ACK] Seq=0 Ack=1 Win=65160 Len=0 MSS=1460 SACK_PERM TSval=1478621179 TSecr=1287705384 WS=128"
"141","0.231923043","66","26:8d:93:14:88:cf","e2:38:fd:43:7f:4a","172.20.0.3","172.20.0.2","TCP","46272 → 4433 [ACK] Seq=1 Ack=1 Win=64256 Len=0 TSval=1287705384 TSecr=1478621179"
"142","0.231965859","561","26:8d:93:14:88:cf","e2:38:fd:43:7f:4a","172.20.0.3","172.20.0.2","TLSv1.2","Client Hello"
"143","0.231969640","66","e2:38:fd:43:7f:4a","26:8d:93:14:88:cf","172.20.0.2","172.20.0.3","TCP","4433 → 46272 [ACK] Seq=1 Ack=496 Win=64768 Len=0 TSval=1478621179 TSecr=1287705384"
"144","0.232576262","769","e2:38:fd:43:7f:4a","26:8d:93:14:88:cf","172.20.0.2","172.20.0.3","TLSv1.3","Server Hello, Change Cipher Spec, Application Data, Application Data, Application Data, Application Data"
"145","0.232607674","66","26:8d:93:14:88:cf","e2:38:fd:43:7f:4a","172.20.0.3","172.20.0.2","TCP","46272 → 4433 [ACK] Seq=496 Ack=704 Win=63616 Len=0 TSval=1287705385 TSecr=1478621180"
"146","0.233508620","146","26:8d:93:14:88:cf","e2:38:fd:43:7f:4a","172.20.0.3","172.20.0.2","TLSv1.3","Change Cipher Spec, Application Data"
"147","0.233566381","66","26:8d:93:14:88:cf","e2:38:fd:43:7f:4a","172.20.0.3","172.20.0.2","TCP","46272 → 4433 [RST, ACK] Seq=576 Ack=704 Win=63616 Len=0 TSval=1287705386 TSecr=1478621180"
"148","0.244308334","74","26:8d:93:14:88:cf","e2:38:fd:43:7f:4a","172.20.0.3","172.20.0.2","TCP","46278 → 4433 [SYN] Seq=0 Win=64240 Len=0 MSS=1460 SACK_PERM TSval=1287705396 TSecr=0 WS=128"
"149","0.244334428","74","e2:38:fd:43:7f:4a","26:8d:93:14:88:cf","172.20.0.2","172.20.0.3","TCP","4433 → 46278 [SYN, ACK] Seq=0 Ack=1 Win=65160 Len=0 MSS=1460 SACK_PERM TSval=1478621191 TSecr=1287705396 WS=128"
"150","0.244353514","66","26:8d:93:14:88:cf","e2:38:fd:43:7f:4a","172.20.0.3","172.20.0.2","TCP","46278 → 4433 [ACK] Seq=1 Ack=1 Win=64256 Len=0 TSval=1287705396 TSecr=1478621191"
"151","0.244436858","561","26:8d:93:14:88:cf","e2:38:fd:43:7f:4a","172.20.0.3","172.20.0.2","TLSv1.2","Client Hello"
"152","0.244446048","66","e2:38:fd:43:7f:4a","26:8d:93:14:88:cf","172.20.0.2","172.20.0.3","TCP","4433 → 46278 [ACK] Seq=1 Ack=496 Win=64768 Len=0 TSval=1478621192 TSecr=1287705397"
"153","0.244932120","769","e2:38:fd:43:7f:4a","26:8d:93:14:88:cf","172.20.0.2","172.20.0.3","TLSv1.3","Server Hello, Change Cipher Spec, Application Data, Application Data, Application Data, Application Data"
"154","0.244963158","66","26:8d:93:14:88:cf","e2:38:fd:43:7f:4a","172.20.0.3","172.20.0.2","TCP","46278 → 4433 [ACK] Seq=496 Ack=704 Win=63616 Len=0 TSval=1287705397 TSecr=1478621192"
"155","0.245804129","146","26:8d:93:14:88:cf","e2:38:fd:43:7f:4a","172.20.0.3","172.20.0.2","TLSv1.3","Change Cipher Spec, Application Data"
"156","0.245864936","66","26:8d:93:14:88:cf","e2:38:fd:43:7f:4a","172.20.0.3","172.20.0.2","TCP","46278 → 4433 [RST, ACK] Seq=576 Ack=704 Win=63616 Len=0 TSval=1287705398 TSecr=1478621192"
"157","0.256327616","74","26:8d:93:14:88:cf","e2:38:fd:43:7f:4a","172.20.0.3","172.20.0.2","TCP","46282 → 4433 [SYN] Seq=0 Win=64240 Len=0 MSS=1460 SACK_PERM TSval=1287705408 TSecr=0 WS=128"
"158","0.256359798","74","e2:38:fd:43:7f:4a","26:8d:93:14:88:cf","172.20.0.2","172.20.0.3","TCP","4433 → 46282 [SYN, ACK] Seq=0 Ack=1 Win=65160 Len=0 MSS=1460 SACK_PERM TSval=1478621203 TSecr=1287705408 WS=128"
"159","0.256389254","66","26:8d:93:14:88:cf","e2:38:fd:43:7f:4a","172.20.0.3","172.20.0.2","TCP","46282 → 4433 [ACK] Seq=1 Ack=1 Win=64256 Len=0 TSval=1287705408 TSecr=1478621203"
"160","0.256462398","561","26:8d:93:14:88:cf","e2:38:fd:43:7f:4a","172.20.0.3","172.20.0.2","TLSv1.2","Client Hello"
"161","0.256469965","66","e2:38:fd:43:7f:4a","26:8d:93:14:88:cf","172.20.0.2","172.20.0.3","TCP","4433 → 46282 [ACK] Seq=1 Ack=496 Win=64768 Len=0 TSval=1478621204 TSecr=1287705409"
"162","0.257017597","769","e2:38:fd:43:7f:4a","26:8d:93:14:88:cf","172.20.0.2","172.20.0.3","TLSv1.3","Server Hello, Change Cipher Spec, Application Data, Application Data, Application Data, Application Data"
"163","0.257050758","66","26:8d:93:14:88:cf","e2:38:fd:43:7f:4a","172.20.0.3","172.20.0.2","TCP","46282 → 4433 [ACK] Seq=496 Ack=704 Win=63616 Len=0 TSval=1287705409 TSecr=1478621204"
"164","0.257886042","146","26:8d:93:14:88:cf","e2:38:fd:43:7f:4a","172.20.0.3","172.20.0.2","TLSv1.3","Change Cipher Spec, Application Data"
"165","0.257943552","66","26:8d:93:14:88:cf","e2:38:fd:43:7f:4a","172.20.0.3","172.20.0.2","TCP","46282 → 4433 [RST, ACK] Seq=576 Ack=704 Win=63616 Len=0 TSval=1287705410 TSecr=1478621204"
"166","0.269387543","74","26:8d:93:14:88:cf","e2:38:fd:43:7f:4a","172.20.0.3","172.20.0.2","TCP","46288 → 4433 [SYN] Seq=0 Win=64240 Len=0 MSS=1460 SACK_PERM TSval=1287705421 TSecr=0 WS=128"
"167","0.269429303","74","e2:38:fd:43:7f:4a","26:8d:93:14:88:cf","172.20.0.2","172.20.0.3","TCP","4433 → 46288 [SYN, ACK] Seq=0 Ack=1 Win=65160 Len=0 MSS=1460 SACK_PERM TSval=1478621217 TSecr=1287705421 WS=128"
"168","0.269448318","66","26:8d:93:14:88:cf","e2:38:fd:43:7f:4a","172.20.0.3","172.20.0.2","TCP","46288 → 4433 [ACK] Seq=1 Ack=1 Win=64256 Len=0 TSval=1287705422 TSecr=1478621217"
"169","0.269497431","561","26:8d:93:14:88:cf","e2:38:fd:43:7f:4a","172.20.0.3","172.20.0.2","TLSv1.2","Client Hello"
"170","0.269502338","66","e2:38:fd:43:7f:4a","26:8d:93:14:88:cf","172.20.0.2","172.20.0.3","TCP","4433 → 46288 [ACK] Seq=1 Ack=496 Win=64768 Len=0 TSval=1478621217 TSecr=1287705422"
"171","0.270067012","769","e2:38:fd:43:7f:4a","26:8d:93:14:88:cf","172.20.0.2","172.20.0.3","TLSv1.3","Server Hello, Change Cipher Spec, Application Data, Application Data, Application Data, Application Data"
"172","0.270096075","66","26:8d:93:14:88:cf","e2:38:fd:43:7f:4a","172.20.0.3","172.20.0.2","TCP","46288 → 4433 [ACK] Seq=496 Ack=704 Win=63616 Len=0 TSval=1287705422 TSecr=1478621217"
"173","0.270913270","146","26:8d:93:14:88:cf","e2:38:fd:43:7f:4a","172.20.0.3","172.20.0.2","TLSv1.3","Change Cipher Spec, Application Data"
"174","0.270970914","66","26:8d:93:14:88:cf","e2:38:fd:43:7f:4a","172.20.0.3","172.20.0.2","TCP","46288 → 4433 [RST, ACK] Seq=576 Ack=704 Win=63616 Len=0 TSval=1287705423 TSecr=1478621217"
"175","0.281719212","74","26:8d:93:14:88:cf","e2:38:fd:43:7f:4a","172.20.0.3","172.20.0.2","TCP","46294 → 4433 [SYN] Seq=0 Win=64240 Len=0 MSS=1460 SACK_PERM TSval=1287705434 TSecr=0 WS=128"
"176","0.281742257","74","e2:38:fd:43:7f:4a","26:8d:93:14:88:cf","172.20.0.2","172.20.0.3","TCP","4433 → 46294 [SYN, ACK] Seq=0 Ack=1 Win=65160 Len=0 MSS=1460 SACK_PERM TSval=1478621229 TSecr=1287705434 WS=128"
"177","0.281759897","66","26:8d:93:14:88:cf","e2:38:fd:43:7f:4a","172.20.0.3","172.20.0.2","TCP","46294 → 4433 [ACK] Seq=1 Ack=1 Win=64256 Len=0 TSval=1287705434 TSecr=1478621229"
"178","0.281800492","561","26:8d:93:14:88:cf","e2:38:fd:43:7f:4a","172.20.0.3","172.20.0.2","TLSv1.2","Client Hello"
"179","0.281804136","66","e2:38:fd:43:7f:4a","26:8d:93:14:88:cf","172.20.0.2","172.20.0.3","TCP","4433 → 46294 [ACK] Seq=1 Ack=496 Win=64768 Len=0 TSval=1478621229 TSecr=1287705434"
"180","0.282590867","769","e2:38:fd:43:7f:4a","26:8d:93:14:88:cf","172.20.0.2","172.20.0.3","TLSv1.3","Server Hello, Change Cipher Spec, Application Data, Application Data, Application Data, Application Data"
"181","0.282631926","66","26:8d:93:14:88:cf","e2:38:fd:43:7f:4a","172.20.0.3","172.20.0.2","TCP","46294 → 4433 [ACK] Seq=496 Ack=704 Win=63616 Len=0 TSval=1287705435 TSecr=1478621230"
"182","0.283457967","146","26:8d:93:14:88:cf","e2:38:fd:43:7f:4a","172.20.0.3","172.20.0.2","TLSv1.3","Change Cipher Spec, Application Data"
"183","0.283515265","66","26:8d:93:14:88:cf","e2:38:fd:43:7f:4a","172.20.0.3","172.20.0.2","TCP","46294 → 4433 [RST, ACK] Seq=576 Ack=704 Win=63616 Len=0 TSval=1287705436 TSecr=1478621230"
"184","0.294259436","74","26:8d:93:14:88:cf","e2:38:fd:43:7f:4a","172.20.0.3","172.20.0.2","TCP","46300 → 4433 [SYN] Seq=0 Win=64240 Len=0 MSS=1460 SACK_PERM TSval=1287705446 TSecr=0 WS=128"
"185","0.294287739","74","e2:38:fd:43:7f:4a","26:8d:93:14:88:cf","172.20.0.2","172.20.0.3","TCP","4433 → 46300 [SYN, ACK] Seq=0 Ack=1 Win=65160 Len=0 MSS=1460 SACK_PERM TSval=1478621241 TSecr=1287705446 WS=128"
"186","0.294313770","66","26:8d:93:14:88:cf","e2:38:fd:43:7f:4a","172.20.0.3","172.20.0.2","TCP","46300 → 4433 [ACK] Seq=1 Ack=1 Win=64256 Len=0 TSval=1287705446 TSecr=1478621241"
"187","0.294352187","561","26:8d:93:14:88:cf","e2:38:fd:43:7f:4a","172.20.0.3","172.20.0.2","TLSv1.2","Client Hello"
"188","0.294356191","66","e2:38:fd:43:7f:4a","26:8d:93:14:88:cf","172.20.0.2","172.20.0.3","TCP","4433 → 46300 [ACK] Seq=1 Ack=496 Win=64768 Len=0 TSval=1478621241 TSecr=1287705446"
"189","0.294931152","769","e2:38:fd:43:7f:4a","26:8d:93:14:88:cf","172.20.0.2","172.20.0.3","TLSv1.3","Server Hello, Change Cipher Spec, Application Data, Application Data, Application Data, Application Data"
"190","0.294963100","66","26:8d:93:14:88:cf","e2:38:fd:43:7f:4a","172.20.0.3","172.20.0.2","TCP","46300 → 4433 [ACK] Seq=496 Ack=704 Win=63616 Len=0 TSval=1287705447 TSecr=1478621242"
"191","0.295814124","146","26:8d:93:14:88:cf","e2:38:fd:43:7f:4a","172.20.0.3","172.20.0.2","TLSv1.3","Change Cipher Spec, Application Data"
"192","0.295869999","66","26:8d:93:14:88:cf","e2:38:fd:43:7f:4a","172.20.0.3","172.20.0.2","TCP","46300 → 4433 [RST, ACK] Seq=576 Ack=704 Win=63616 Len=0 TSval=1287705448 TSecr=1478621242"
"193","0.309842931","74","26:8d:93:14:88:cf","e2:38:fd:43:7f:4a","172.20.0.3","172.20.0.2","TCP","46302 → 4433 [SYN] Seq=0 Win=64240 Len=0 MSS=1460 SACK_PERM TSval=1287705462 TSecr=0 WS=128"
"194","0.309873831","74","e2:38:fd:43:7f:4a","26:8d:93:14:88:cf","172.20.0.2","172.20.0.3","TCP","4433 → 46302 [SYN, ACK] Seq=0 Ack=1 Win=65160 Len=0 MSS=1460 SACK_PERM TSval=1478621257 TSecr=1287705462 WS=128"
"195","0.309895954","66","26:8d:93:14:88:cf","e2:38:fd:43:7f:4a","172.20.0.3","172.20.0.2","TCP","46302 → 4433 [ACK] Seq=1 Ack=1 Win=64256 Len=0 TSval=1287705462 TSecr=1478621257"
"196","0.309949089","561","26:8d:93:14:88:cf","e2:38:fd:43:7f:4a","172.20.0.3","172.20.0.2","TLSv1.2","Client Hello"
"197","0.309957232","66","e2:38:fd:43:7f:4a","26:8d:93:14:88:cf","172.20.0.2","172.20.0.3","TCP","4433 → 46302 [ACK] Seq=1 Ack=496 Win=64768 Len=0 TSval=1478621257 TSecr=1287705462"
"198","0.310520449","769","e2:38:fd:43:7f:4a","26:8d:93:14:88:cf","172.20.0.2","172.20.0.3","TLSv1.3","Server Hello, Change Cipher Spec, Application Data, Application Data, Application Data, Application Data"
"199","0.310551037","66","26:8d:93:14:88:cf","e2:38:fd:43:7f:4a","172.20.0.3","172.20.0.2","TCP","46302 → 4433 [ACK] Seq=496 Ack=704 Win=63616 Len=0 TSval=1287705463 TSecr=1478621258"
"200","0.311852688","146","26:8d:93:14:88:cf","e2:38:fd:43:7f:4a","172.20.0.3","172.20.0.2","TLSv1.3","Change Cipher Spec, Application Data"
"201","0.311930517","66","26:8d:93:14:88:cf","e2:38:fd:43:7f:4a","172.20.0.3","172.20.0.2","TCP","46302 → 4433 [RST, ACK] Seq=576 Ack=704 Win=63616 Len=0 TSval=1287705464 TSecr=1478621258"
"202","0.322523232","74","26:8d:93:14:88:cf","e2:38:fd:43:7f:4a","172.20.0.3","172.20.0.2","TCP","46306 → 4433 [SYN] Seq=0 Win=64240 Len=0 MSS=1460 SACK_PERM TSval=1287705475 TSecr=0 WS=128"
"203","0.322541066","74","e2:38:fd:43:7f:4a","26:8d:93:14:88:cf","172.20.0.2","172.20.0.3","TCP","4433 → 46306 [SYN, ACK] Seq=0 Ack=1 Win=65160 Len=0 MSS=1460 SACK_PERM TSval=1478621270 TSecr=1287705475 WS=128"
"204","0.322557039","66","26:8d:93:14:88:cf","e2:38:fd:43:7f:4a","172.20.0.3","172.20.0.2","TCP","46306 → 4433 [ACK] Seq=1 Ack=1 Win=64256 Len=0 TSval=1287705475 TSecr=1478621270"
"205","0.322597144","561","26:8d:93:14:88:cf","e2:38:fd:43:7f:4a","172.20.0.3","172.20.0.2","TLSv1.2","Client Hello"
"206","0.322600714","66","e2:38:fd:43:7f:4a","26:8d:93:14:88:cf","172.20.0.2","172.20.0.3","TCP","4433 → 46306 [ACK] Seq=1 Ack=496 Win=64768 Len=0 TSval=1478621270 TSecr=1287705475"
"207","0.323130364","769","e2:38:fd:43:7f:4a","26:8d:93:14:88:cf","172.20.0.2","172.20.0.3","TLSv1.3","Server Hello, Change Cipher Spec, Application Data, Application Data, Application Data, Application Data"
"208","0.323158910","66","26:8d:93:14:88:cf","e2:38:fd:43:7f:4a","172.20.0.3","172.20.0.2","TCP","46306 → 4433 [ACK] Seq=496 Ack=704 Win=63616 Len=0 TSval=1287705475 TSecr=1478621270"
"209","0.324234082","146","26:8d:93:14:88:cf","e2:38:fd:43:7f:4a","172.20.0.3","172.20.0.2","TLSv1.3","Change Cipher Spec, Application Data"
"210","0.324320075","66","26:8d:93:14:88:cf","e2:38:fd:43:7f:4a","172.20.0.3","172.20.0.2","TCP","46306 → 4433 [RST, ACK] Seq=576 Ack=704 Win=63616 Len=0 TSval=1287705476 TSecr=1478621270"
"211","0.334838205","74","26:8d:93:14:88:cf","e2:38:fd:43:7f:4a","172.20.0.3","172.20.0.2","TCP","46314 → 4433 [SYN] Seq=0 Win=64240 Len=0 MSS=1460 SACK_PERM TSval=1287705487 TSecr=0 WS=128"
"212","0.334862715","74","e2:38:fd:43:7f:4a","26:8d:93:14:88:cf","172.20.0.2","172.20.0.3","TCP","4433 → 46314 [SYN, ACK] Seq=0 Ack=1 Win=65160 Len=0 MSS=1460 SACK_PERM TSval=1478621282 TSecr=1287705487 WS=128"
"213","0.334881152","66","26:8d:93:14:88:cf","e2:38:fd:43:7f:4a","172.20.0.3","172.20.0.2","TCP","46314 → 4433 [ACK] Seq=1 Ack=1 Win=64256 Len=0 TSval=1287705487 TSecr=1478621282"
"214","0.334930870","561","26:8d:93:14:88:cf","e2:38:fd:43:7f:4a","172.20.0.3","172.20.0.2","TLSv1.2","Client Hello"
"215","0.334935897","66","e2:38:fd:43:7f:4a","26:8d:93:14:88:cf","172.20.0.2","172.20.0.3","TCP","4433 → 46314 [ACK] Seq=1 Ack=496 Win=64768 Len=0 TSval=1478621282 TSecr=1287705487"
"216","0.335550946","769","e2:38:fd:43:7f:4a","26:8d:93:14:88:cf","172.20.0.2","172.20.0.3","TLSv1.3","Server Hello, Change Cipher Spec, Application Data, Application Data, Application Data, Application Data"
"217","0.335578453","66","26:8d:93:14:88:cf","e2:38:fd:43:7f:4a","172.20.0.3","172.20.0.2","TCP","46314 → 4433 [ACK] Seq=496 Ack=704 Win=63616 Len=0 TSval=1287705488 TSecr=1478621283"
"218","0.336440755","146","26:8d:93:14:88:cf","e2:38:fd:43:7f:4a","172.20.0.3","172.20.0.2","TLSv1.3","Change Cipher Spec, Application Data"
"219","0.336496561","66","26:8d:93:14:88:cf","e2:38:fd:43:7f:4a","172.20.0.3","172.20.0.2","TCP","46314 → 4433 [RST, ACK] Seq=576 Ack=704 Win=63616 Len=0 TSval=1287705489 TSecr=1478621283"
"220","0.347107533","74","26:8d:93:14:88:cf","e2:38:fd:43:7f:4a","172.20.0.3","172.20.0.2","TCP","46322 → 4433 [SYN] Seq=0 Win=64240 Len=0 MSS=1460 SACK_PERM TSval=1287705499 TSecr=0 WS=128"
"221","0.347132987","74","e2:38:fd:43:7f:4a","26:8d:93:14:88:cf","172.20.0.2","172.20.0.3","TCP","4433 → 46322 [SYN, ACK] Seq=0 Ack=1 Win=65160 Len=0 MSS=1460 SACK_PERM TSval=1478621294 TSecr=1287705499 WS=128"
"222","0.347151571","66","26:8d:93:14:88:cf","e2:38:fd:43:7f:4a","172.20.0.3","172.20.0.2","TCP","46322 → 4433 [ACK] Seq=1 Ack=1 Win=64256 Len=0 TSval=1287705499 TSecr=1478621294"
"223","0.347194625","561","26:8d:93:14:88:cf","e2:38:fd:43:7f:4a","172.20.0.3","172.20.0.2","TLSv1.2","Client Hello"
"224","0.347200697","66","e2:38:fd:43:7f:4a","26:8d:93:14:88:cf","172.20.0.2","172.20.0.3","TCP","4433 → 46322 [ACK] Seq=1 Ack=496 Win=64768 Len=0 TSval=1478621294 TSecr=1287705499"
"225","0.347841686","769","e2:38:fd:43:7f:4a","26:8d:93:14:88:cf","172.20.0.2","172.20.0.3","TLSv1.3","Server Hello, Change Cipher Spec, Application Data, Application Data, Application Data, Application Data"
