frame.number,frame.time_relative,frame.len,eth.src,eth.dst,ip.src,ip.dst,_ws.col.protocol,_ws.col.info
"1","0.000000000","42","56:fc:3d:c4:aa:55","ff:ff:ff:ff:ff:ff",,,"ARP","ARP Announcement for 172.20.0.3"
"2","0.033056964","42","56:fc:3d:c4:aa:55","ff:ff:ff:ff:ff:ff",,,"ARP","Who has 172.20.0.2? Tell 172.20.0.3"
"3","0.033083361","42","ea:0f:e5:dc:6b:e4","56:fc:3d:c4:aa:55",,,"ARP","172.20.0.2 is at ea:0f:e5:dc:6b:e4"
"4","0.033090784","74","56:fc:3d:c4:aa:55","ea:0f:e5:dc:6b:e4","172.20.0.3","172.20.0.2","TCP","55418 → 4433 [SYN] Seq=0 Win=64240 Len=0 MSS=1460 SACK_PERM TSval=1307483870 TSecr=0 WS=128"
"5","0.033112138","74","ea:0f:e5:dc:6b:e4","56:fc:3d:c4:aa:55","172.20.0.2","172.20.0.3","TCP","4433 → 55418 [SYN, ACK] Seq=0 Ack=1 Win=65160 Len=0 MSS=1460 SACK_PERM TSval=1498399665 TSecr=1307483870 WS=128"
"6","0.033130505","66","56:fc:3d:c4:aa:55","ea:0f:e5:dc:6b:e4","172.20.0.3","172.20.0.2","TCP","55418 → 4433 [ACK] Seq=1 Ack=1 Win=64256 Len=0 TSval=1307483870 TSecr=1498399665"
"7","0.033171355","593","56:fc:3d:c4:aa:55","ea:0f:e5:dc:6b:e4","172.20.0.3","172.20.0.2","TLSv1.2","Client Hello"
"8","0.033175355","66","ea:0f:e5:dc:6b:e4","56:fc:3d:c4:aa:55","172.20.0.2","172.20.0.3","TCP","4433 → 55418 [ACK] Seq=1 Ack=528 Win=64640 Len=0 TSval=1498399665 TSecr=1307483870"
"9","0.037553421","964","ea:0f:e5:dc:6b:e4","56:fc:3d:c4:aa:55","172.20.0.2","172.20.0.3","TLSv1.3","Server Hello, Change Cipher Spec, Application Data, Application Data, Application Data, Application Data"
"10","0.037595401","66","56:fc:3d:c4:aa:55","ea:0f:e5:dc:6b:e4","172.20.0.3","172.20.0.2","TCP","55418 → 4433 [ACK] Seq=528 Ack=899 Win=64128 Len=0 TSval=1307483875 TSecr=1498399670"
"11","0.041086956","146","56:fc:3d:c4:aa:55","ea:0f:e5:dc:6b:e4","172.20.0.3","172.20.0.2","TLSv1.3","Change Cipher Spec, Application Data"
"12","0.041149856","66","56:fc:3d:c4:aa:55","ea:0f:e5:dc:6b:e4","172.20.0.3","172.20.0.2","TCP","55418 → 4433 [RST, ACK] Seq=608 Ack=899 Win=64128 Len=0 TSval=1307483878 TSecr=1498399670"
"13","0.054308171","74","56:fc:3d:c4:aa:55","ea:0f:e5:dc:6b:e4","172.20.0.3","172.20.0.2","TCP","55434 → 4433 [SYN] Seq=0 Win=64240 Len=0 MSS=1460 SACK_PERM TSval=1307483891 TSecr=0 WS=128"
"14","0.054361466","74","ea:0f:e5:dc:6b:e4","56:fc:3d:c4:aa:55","172.20.0.2","172.20.0.3","TCP","4433 → 55434 [SYN, ACK] Seq=0 Ack=1 Win=65160 Len=0 MSS=1460 SACK_PERM TSval=1498399686 TSecr=1307483891 WS=128"
"15","0.054391504","66","56:fc:3d:c4:aa:55","ea:0f:e5:dc:6b:e4","172.20.0.3","172.20.0.2","TCP","55434 → 4433 [ACK] Seq=1 Ack=1 Win=64256 Len=0 TSval=1307483892 TSecr=1498399686"
"16","0.054441821","593","56:fc:3d:c4:aa:55","ea:0f:e5:dc:6b:e4","172.20.0.3","172.20.0.2","TLSv1.2","Client Hello"
"17","0.054450233","66","ea:0f:e5:dc:6b:e4","56:fc:3d:c4:aa:55","172.20.0.2","172.20.0.3","TCP","4433 → 55434 [ACK] Seq=1 Ack=528 Win=64640 Len=0 TSval=1498399687 TSecr=1307483892"
"18","0.058069338","963","ea:0f:e5:dc:6b:e4","56:fc:3d:c4:aa:55","172.20.0.2","172.20.0.3","TLSv1.3","Server Hello, Change Cipher Spec, Application Data, Application Data, Application Data, Application Data"
"19","0.058118642","66","56:fc:3d:c4:aa:55","ea:0f:e5:dc:6b:e4","172.20.0.3","172.20.0.2","TCP","55434 → 4433 [ACK] Seq=528 Ack=898 Win=64128 Len=0 TSval=1307483895 TSecr=1498399690"
"20","0.062306380","146","56:fc:3d:c4:aa:55","ea:0f:e5:dc:6b:e4","172.20.0.3","172.20.0.2","TLSv1.3","Change Cipher Spec, Application Data"
"21","0.062402159","66","56:fc:3d:c4:aa:55","ea:0f:e5:dc:6b:e4","172.20.0.3","172.20.0.2","TCP","55434 → 4433 [RST, ACK] Seq=608 Ack=898 Win=64128 Len=0 TSval=1307483900 TSecr=1498399690"
"22","0.075218991","74","56:fc:3d:c4:aa:55","ea:0f:e5:dc:6b:e4","172.20.0.3","172.20.0.2","TCP","55446 → 4433 [SYN] Seq=0 Win=64240 Len=0 MSS=1460 SACK_PERM TSval=1307483912 TSecr=0 WS=128"
"23","0.075241058","74","ea:0f:e5:dc:6b:e4","56:fc:3d:c4:aa:55","172.20.0.2","172.20.0.3","TCP","4433 → 55446 [SYN, ACK] Seq=0 Ack=1 Win=65160 Len=0 MSS=1460 SACK_PERM TSval=1498399707 TSecr=1307483912 WS=128"
"24","0.075265425","66","56:fc:3d:c4:aa:55","ea:0f:e5:dc:6b:e4","172.20.0.3","172.20.0.2","TCP","55446 → 4433 [ACK] Seq=1 Ack=1 Win=64256 Len=0 TSval=1307483912 TSecr=1498399707"
"25","0.075308685","593","56:fc:3d:c4:aa:55","ea:0f:e5:dc:6b:e4","172.20.0.3","172.20.0.2","TLSv1.2","Client Hello"
"26","0.075311988","66","ea:0f:e5:dc:6b:e4","56:fc:3d:c4:aa:55","172.20.0.2","172.20.0.3","TCP","4433 → 55446 [ACK] Seq=1 Ack=528 Win=64640 Len=0 TSval=1498399707 TSecr=1307483912"
"27","0.081342075","964","ea:0f:e5:dc:6b:e4","56:fc:3d:c4:aa:55","172.20.0.2","172.20.0.3","TLSv1.3","Server Hello, Change Cipher Spec, Application Data, Application Data, Application Data, Application Data"
"28","0.081405285","66","56:fc:3d:c4:aa:55","ea:0f:e5:dc:6b:e4","172.20.0.3","172.20.0.2","TCP","55446 → 4433 [ACK] Seq=528 Ack=899 Win=64128 Len=0 TSval=1307483919 TSecr=1498399713"
"29","0.085829045","146","56:fc:3d:c4:aa:55","ea:0f:e5:dc:6b:e4","172.20.0.3","172.20.0.2","TLSv1.3","Change Cipher Spec, Application Data"
"30","0.085913675","66","56:fc:3d:c4:aa:55","ea:0f:e5:dc:6b:e4","172.20.0.3","172.20.0.2","TCP","55446 → 4433 [RST, ACK] Seq=608 Ack=899 Win=64128 Len=0 TSval=1307483923 TSecr=1498399713"
"31","0.101287905","74","56:fc:3d:c4:aa:55","ea:0f:e5:dc:6b:e4","172.20.0.3","172.20.0.2","TCP","55458 → 4433 [SYN] Seq=0 Win=64240 Len=0 MSS=1460 SACK_PERM TSval=1307483938 TSecr=0 WS=128"
"32","0.101326011","74","ea:0f:e5:dc:6b:e4","56:fc:3d:c4:aa:55","172.20.0.2","172.20.0.3","TCP","4433 → 55458 [SYN, ACK] Seq=0 Ack=1 Win=65160 Len=0 MSS=1460 SACK_PERM TSval=1498399733 TSecr=1307483938 WS=128"
"33","0.101366048","66","56:fc:3d:c4:aa:55","ea:0f:e5:dc:6b:e4","172.20.0.3","172.20.0.2","TCP","55458 → 4433 [ACK] Seq=1 Ack=1 Win=64256 Len=0 TSval=1307483939 TSecr=1498399733"
"34","0.101428101","593","56:fc:3d:c4:aa:55","ea:0f:e5:dc:6b:e4","172.20.0.3","172.20.0.2","TLSv1.2","Client Hello"
"35","0.101433877","66","ea:0f:e5:dc:6b:e4","56:fc:3d:c4:aa:55","172.20.0.2","172.20.0.3","TCP","4433 → 55458 [ACK] Seq=1 Ack=528 Win=64640 Len=0 TSval=1498399734 TSecr=1307483939"
"36","0.105578067","963","ea:0f:e5:dc:6b:e4","56:fc:3d:c4:aa:55","172.20.0.2","172.20.0.3","TLSv1.3","Server Hello, Change Cipher Spec, Application Data, Application Data, Application Data, Application Data"
"37","0.105642316","66","56:fc:3d:c4:aa:55","ea:0f:e5:dc:6b:e4","172.20.0.3","172.20.0.2","TCP","55458 → 4433 [ACK] Seq=528 Ack=898 Win=64128 Len=0 TSval=1307483943 TSecr=1498399738"
"38","0.111259943","146","56:fc:3d:c4:aa:55","ea:0f:e5:dc:6b:e4","172.20.0.3","172.20.0.2","TLSv1.3","Change Cipher Spec, Application Data"
"39","0.111382548","66","56:fc:3d:c4:aa:55","ea:0f:e5:dc:6b:e4","172.20.0.3","172.20.0.2","TCP","55458 → 4433 [RST, ACK] Seq=608 Ack=898 Win=64128 Len=0 TSval=1307483949 TSecr=1498399738"
"40","0.123887472","74","56:fc:3d:c4:aa:55","ea:0f:e5:dc:6b:e4","172.20.0.3","172.20.0.2","TCP","55474 → 4433 [SYN] Seq=0 Win=64240 Len=0 MSS=1460 SACK_PERM TSval=1307483961 TSecr=0 WS=128"
"41","0.123908923","74","ea:0f:e5:dc:6b:e4","56:fc:3d:c4:aa:55","172.20.0.2","172.20.0.3","TCP","4433 → 55474 [SYN, ACK] Seq=0 Ack=1 Win=65160 Len=0 MSS=1460 SACK_PERM TSval=1498399756 TSecr=1307483961 WS=128"
"42","0.123925566","66","56:fc:3d:c4:aa:55","ea:0f:e5:dc:6b:e4","172.20.0.3","172.20.0.2","TCP","55474 → 4433 [ACK] Seq=1 Ack=1 Win=64256 Len=0 TSval=1307483961 TSecr=1498399756"
"43","0.123963213","593","56:fc:3d:c4:aa:55","ea:0f:e5:dc:6b:e4","172.20.0.3","172.20.0.2","TLSv1.2","Client Hello"
"44","0.123967370","66","ea:0f:e5:dc:6b:e4","56:fc:3d:c4:aa:55","172.20.0.2","172.20.0.3","TCP","4433 → 55474 [ACK] Seq=1 Ack=528 Win=64640 Len=0 TSval=1498399756 TSecr=1307483961"
"45","0.127910053","964","ea:0f:e5:dc:6b:e4","56:fc:3d:c4:aa:55","172.20.0.2","172.20.0.3","TLSv1.3","Server Hello, Change Cipher Spec, Application Data, Application Data, Application Data, Application Data"
"46","0.127948465","66","56:fc:3d:c4:aa:55","ea:0f:e5:dc:6b:e4","172.20.0.3","172.20.0.2","TCP","55474 → 4433 [ACK] Seq=528 Ack=899 Win=64128 Len=0 TSval=1307483965 TSecr=1498399760"
"47","0.131567741","146","56:fc:3d:c4:aa:55","ea:0f:e5:dc:6b:e4","172.20.0.3","172.20.0.2","TLSv1.3","Change Cipher Spec, Application Data"
"48","0.131632938","66","56:fc:3d:c4:aa:55","ea:0f:e5:dc:6b:e4","172.20.0.3","172.20.0.2","TCP","55474 → 4433 [RST, ACK] Seq=608 Ack=899 Win=64128 Len=0 TSval=1307483969 TSecr=1498399760"
"49","0.143960460","74","56:fc:3d:c4:aa:55","ea:0f:e5:dc:6b:e4","172.20.0.3","172.20.0.2","TCP","55476 → 4433 [SYN] Seq=0 Win=64240 Len=0 MSS=1460 SACK_PERM TSval=1307483981 TSecr=0 WS=128"
"50","0.143983350","74","ea:0f:e5:dc:6b:e4","56:fc:3d:c4:aa:55","172.20.0.2","172.20.0.3","TCP","4433 → 55476 [SYN, ACK] Seq=0 Ack=1 Win=65160 Len=0 MSS=1460 SACK_PERM TSval=1498399776 TSecr=1307483981 WS=128"
"51","0.144001613","66","56:fc:3d:c4:aa:55","ea:0f:e5:dc:6b:e4","172.20.0.3","172.20.0.2","TCP","55476 → 4433 [ACK] Seq=1 Ack=1 Win=64256 Len=0 TSval=1307483981 TSecr=1498399776"
"52","0.144043130","593","56:fc:3d:c4:aa:55","ea:0f:e5:dc:6b:e4","172.20.0.3","172.20.0.2","TLSv1.2","Client Hello"
"53","0.144048511","66","ea:0f:e5:dc:6b:e4","56:fc:3d:c4:aa:55","172.20.0.2","172.20.0.3","TCP","4433 → 55476 [ACK] Seq=1 Ack=528 Win=64640 Len=0 TSval=1498399776 TSecr=1307483981"
"54","0.147651423","963","ea:0f:e5:dc:6b:e4","56:fc:3d:c4:aa:55","172.20.0.2","172.20.0.3","TLSv1.3","Server Hello, Change Cipher Spec, Application Data, Application Data, Application Data, Application Data"
"55","0.147696863","66","56:fc:3d:c4:aa:55","ea:0f:e5:dc:6b:e4","172.20.0.3","172.20.0.2","TCP","55476 → 4433 [ACK] Seq=528 Ack=898 Win=64128 Len=0 TSval=1307483985 TSecr=1498399780"
"56","0.151308450","146","56:fc:3d:c4:aa:55","ea:0f:e5:dc:6b:e4","172.20.0.3","172.20.0.2","TLSv1.3","Change Cipher Spec, Application Data"
"57","0.151406831","66","56:fc:3d:c4:aa:55","ea:0f:e5:dc:6b:e4","172.20.0.3","172.20.0.2","TCP","55476 → 4433 [RST, ACK] Seq=608 Ack=898 Win=64128 Len=0 TSval=1307483989 TSecr=1498399780"
"58","0.163590554","74","56:fc:3d:c4:aa:55","ea:0f:e5:dc:6b:e4","172.20.0.3","172.20.0.2","TCP","55484 → 4433 [SYN] Seq=0 Win=64240 Len=0 MSS=1460 SACK_PERM TSval=1307484001 TSecr=0 WS=128"
"59","0.163613580","74","ea:0f:e5:dc:6b:e4","56:fc:3d:c4:aa:55","172.20.0.2","172.20.0.3","TCP","4433 → 55484 [SYN, ACK] Seq=0 Ack=1 Win=65160 Len=0 MSS=1460 SACK_PERM TSval=1498399796 TSecr=1307484001 WS=128"
"60","0.163632274","66","56:fc:3d:c4:aa:55","ea:0f:e5:dc:6b:e4","172.20.0.3","172.20.0.2","TCP","55484 → 4433 [ACK] Seq=1 Ack=1 Win=64256 Len=0 TSval=1307484001 TSecr=1498399796"
"61","0.163671130","593","56:fc:3d:c4:aa:55","ea:0f:e5:dc:6b:e4","172.20.0.3","172.20.0.2","TLSv1.2","Client Hello"
"62","0.163676222","66","ea:0f:e5:dc:6b:e4","56:fc:3d:c4:aa:55","172.20.0.2","172.20.0.3","TCP","4433 → 55484 [ACK] Seq=1 Ack=528 Win=64640 Len=0 TSval=1498399796 TSecr=1307484001"
"63","0.167823649","965","ea:0f:e5:dc:6b:e4","56:fc:3d:c4:aa:55","172.20.0.2","172.20.0.3","TLSv1.3","Server Hello, Change Cipher Spec, Application Data, Application Data, Application Data, Application Data"
"64","0.167880205","66","56:fc:3d:c4:aa:55","ea:0f:e5:dc:6b:e4","172.20.0.3","172.20.0.2","TCP","55484 → 4433 [ACK] Seq=528 Ack=900 Win=64128 Len=0 TSval=1307484005 TSecr=1498399800"
"65","0.171618085","146","56:fc:3d:c4:aa:55","ea:0f:e5:dc:6b:e4","172.20.0.3","172.20.0.2","TLSv1.3","Change Cipher Spec, Application Data"
"66","0.171680979","66","56:fc:3d:c4:aa:55","ea:0f:e5:dc:6b:e4","172.20.0.3","172.20.0.2","TCP","55484 → 4433 [RST, ACK] Seq=608 Ack=900 Win=64128 Len=0 TSval=1307484009 TSecr=1498399800"
"67","0.184540615","74","56:fc:3d:c4:aa:55","ea:0f:e5:dc:6b:e4","172.20.0.3","172.20.0.2","TCP","55488 → 4433 [SYN] Seq=0 Win=64240 Len=0 MSS=1460 SACK_PERM TSval=1307484022 TSecr=0 WS=128"
"68","0.184562682","74","ea:0f:e5:dc:6b:e4","56:fc:3d:c4:aa:55","172.20.0.2","172.20.0.3","TCP","4433 → 55488 [SYN, ACK] Seq=0 Ack=1 Win=65160 Len=0 MSS=1460 SACK_PERM TSval=1498399817 TSecr=1307484022 WS=128"
"69","0.184581801","66","56:fc:3d:c4:aa:55","ea:0f:e5:dc:6b:e4","172.20.0.3","172.20.0.2","TCP","55488 → 4433 [ACK] Seq=1 Ack=1 Win=64256 Len=0 TSval=1307484022 TSecr=1498399817"
"70","0.184624868","593","56:fc:3d:c4:aa:55","ea:0f:e5:dc:6b:e4","172.20.0.3","172.20.0.2","TLSv1.2","Client Hello"
"71","0.184629301","66","ea:0f:e5:dc:6b:e4","56:fc:3d:c4:aa:55","172.20.0.2","172.20.0.3","TCP","4433 → 55488 [ACK] Seq=1 Ack=528 Win=64640 Len=0 TSval=1498399817 TSecr=1307484022"
"72","0.188700107","963","ea:0f:e5:dc:6b:e4","56:fc:3d:c4:aa:55","172.20.0.2","172.20.0.3","TLSv1.3","Server Hello, Change Cipher Spec, Application Data, Application Data, Application Data, Application Data"
"73","0.188754365","66","56:fc:3d:c4:aa:55","ea:0f:e5:dc:6b:e4","172.20.0.3","172.20.0.2","TCP","55488 → 4433 [ACK] Seq=528 Ack=898 Win=64128 Len=0 TSval=1307484026 TSecr=1498399821"
"74","0.192472787","146","56:fc:3d:c4:aa:55","ea:0f:e5:dc:6b:e4","172.20.0.3","172.20.0.2","TLSv1.3","Change Cipher Spec, Application Data"
"75","0.192539104","66","56:fc:3d:c4:aa:55","ea:0f:e5:dc:6b:e4","172.20.0.3","172.20.0.2","TCP","55488 → 4433 [RST, ACK] Seq=608 Ack=898 Win=64128 Len=0 TSval=1307484030 TSecr=1498399821"
"76","0.204148287","74","56:fc:3d:c4:aa:55","ea:0f:e5:dc:6b:e4","172.20.0.3","172.20.0.2","TCP","55492 → 4433 [SYN] Seq=0 Win=64240 Len=0 MSS=1460 SACK_PERM TSval=1307484041 TSecr=0 WS=128"
"77","0.204175595","74","ea:0f:e5:dc:6b:e4","56:fc:3d:c4:aa:55","172.20.0.2","172.20.0.3","TCP","4433 → 55492 [SYN, ACK] Seq=0 Ack=1 Win=65160 Len=0 MSS=1460 SACK_PERM TSval=1498399836 TSecr=1307484041 WS=128"
"78","0.204195295","66","56:fc:3d:c4:aa:55","ea:0f:e5:dc:6b:e4","172.20.0.3","172.20.0.2","TCP","55492 → 4433 [ACK] Seq=1 Ack=1 Win=64256 Len=0 TSval=1307484041 TSecr=1498399836"
"79","0.204239358","593","56:fc:3d:c4:aa:55","ea:0f:e5:dc:6b:e4","172.20.0.3","172.20.0.2","TLSv1.2","Client Hello"
"80","0.204243922","66","ea:0f:e5:dc:6b:e4","56:fc:3d:c4:aa:55","172.20.0.2","172.20.0.3","TCP","4433 → 55492 [ACK] Seq=1 Ack=528 Win=64640 Len=0 TSval=1498399836 TSecr=1307484041"
"81","0.207823964","964","ea:0f:e5:dc:6b:e4","56:fc:3d:c4:aa:55","172.20.0.2","172.20.0.3","TLSv1.3","Server Hello, Change Cipher Spec, Application Data, Application Data, Application Data, Application Data"
"82","0.207855807","66","56:fc:3d:c4:aa:55","ea:0f:e5:dc:6b:e4","172.20.0.3","172.20.0.2","TCP","55492 → 4433 [ACK] Seq=528 Ack=899 Win=64128 Len=0 TSval=1307484045 TSecr=1498399840"
"83","0.211408625","146","56:fc:3d:c4:aa:55","ea:0f:e5:dc:6b:e4","172.20.0.3","172.20.0.2","TLSv1.3","Change Cipher Spec, Application Data"
"84","0.211473949","66","56:fc:3d:c4:aa:55","ea:0f:e5:dc:6b:e4","172.20.0.3","172.20.0.2","TCP","55492 → 4433 [RST, ACK] Seq=608 Ack=899 Win=64128 Len=0 TSval=1307484049 TSecr=1498399840"
"85","0.222596950","74","56:fc:3d:c4:aa:55","ea:0f:e5:dc:6b:e4","172.20.0.3","172.20.0.2","TCP","55494 → 4433 [SYN] Seq=0 Win=64240 Len=0 MSS=1460 SACK_PERM TSval=1307484060 TSecr=0 WS=128"
"86","0.222621440","74","ea:0f:e5:dc:6b:e4","56:fc:3d:c4:aa:55","172.20.0.2","172.20.0.3","TCP","4433 → 55494 [SYN, ACK] Seq=0 Ack=1 Win=65160 Len=0 MSS=1460 SACK_PERM TSval=1498399855 TSecr=1307484060 WS=128"
"87","0.222641023","66","56:fc:3d:c4:aa:55","ea:0f:e5:dc:6b:e4","172.20.0.3","172.20.0.2","TCP","55494 → 4433 [ACK] Seq=1 Ack=1 Win=64256 Len=0 TSval=1307484060 TSecr=1498399855"
"88","0.222677423","593","56:fc:3d:c4:aa:55","ea:0f:e5:dc:6b:e4","172.20.0.3","172.20.0.2","TLSv1.2","Client Hello"
"89","0.222681762","66","ea:0f:e5:dc:6b:e4","56:fc:3d:c4:aa:55","172.20.0.2","172.20.0.3","TCP","4433 → 55494 [ACK] Seq=1 Ack=528 Win=64640 Len=0 TSval=1498399855 TSecr=1307484060"
"90","0.226983697","963","ea:0f:e5:dc:6b:e4","56:fc:3d:c4:aa:55","172.20.0.2","172.20.0.3","TLSv1.3","Server Hello, Change Cipher Spec, Application Data, Application Data, Application Data, Application Data"
"91","0.227014296","66","56:fc:3d:c4:aa:55","ea:0f:e5:dc:6b:e4","172.20.0.3","172.20.0.2","TCP","55494 → 4433 [ACK] Seq=528 Ack=898 Win=64128 Len=0 TSval=1307484064 TSecr=1498399859"
"92","0.230512116","146","56:fc:3d:c4:aa:55","ea:0f:e5:dc:6b:e4","172.20.0.3","172.20.0.2","TLSv1.3","Change Cipher Spec, Application Data"
"93","0.230567237","66","56:fc:3d:c4:aa:55","ea:0f:e5:dc:6b:e4","172.20.0.3","172.20.0.2","TCP","55494 → 4433 [RST, ACK] Seq=608 Ack=898 Win=64128 Len=0 TSval=1307484068 TSecr=1498399859"
"94","0.241917350","74","56:fc:3d:c4:aa:55","ea:0f:e5:dc:6b:e4","172.20.0.3","172.20.0.2","TCP","55508 → 4433 [SYN] Seq=0 Win=64240 Len=0 MSS=1460 SACK_PERM TSval=1307484079 TSecr=0 WS=128"
"95","0.241952545","74","ea:0f:e5:dc:6b:e4","56:fc:3d:c4:aa:55","172.20.0.2","172.20.0.3","TCP","4433 → 55508 [SYN, ACK] Seq=0 Ack=1 Win=65160 Len=0 MSS=1460 SACK_PERM TSval=1498399874 TSecr=1307484079 WS=128"
"96","0.241971047","66","56:fc:3d:c4:aa:55","ea:0f:e5:dc:6b:e4","172.20.0.3","172.20.0.2","TCP","55508 → 4433 [ACK] Seq=1 Ack=1 Win=64256 Len=0 TSval=1307484079 TSecr=1498399874"
"97","0.242017265","593","56:fc:3d:c4:aa:55","ea:0f:e5:dc:6b:e4","172.20.0.3","172.20.0.2","TLSv1.2","Client Hello"
"98","0.242021148","66","ea:0f:e5:dc:6b:e4","56:fc:3d:c4:aa:55","172.20.0.2","172.20.0.3","TCP","4433 → 55508 [ACK] Seq=1 Ack=528 Win=64640 Len=0 TSval=1498399874 TSecr=1307484079"
"99","0.245621028","964","ea:0f:e5:dc:6b:e4","56:fc:3d:c4:aa:55","172.20.0.2","172.20.0.3","TLSv1.3","Server Hello, Change Cipher Spec, Application Data, Application Data, Application Data, Application Data"
"100","0.245652011","66","56:fc:3d:c4:aa:55","ea:0f:e5:dc:6b:e4","172.20.0.3","172.20.0.2","TCP","55508 → 4433 [ACK] Seq=528 Ack=899 Win=64128 Len=0 TSval=1307484083 TSecr=1498399878"
"101","0.249235016","146","56:fc:3d:c4:aa:55","ea:0f:e5:dc:6b:e4","172.20.0.3","172.20.0.2","TLSv1.3","Change Cipher Spec, Application Data"
"102","0.249314881","66","56:fc:3d:c4:aa:55","ea:0f:e5:dc:6b:e4","172.20.0.3","172.20.0.2","TCP","55508 → 4433 [RST, ACK] Seq=608 Ack=899 Win=64128 Len=0 TSval=1307484086 TSecr=1498399878"
"103","0.260384075","74","56:fc:3d:c4:aa:55","ea:0f:e5:dc:6b:e4","172.20.0.3","172.20.0.2","TCP","55524 → 4433 [SYN] Seq=0 Win=64240 Len=0 MSS=1460 SACK_PERM TSval=1307484098 TSecr=0 WS=128"
"104","0.260406626","74","ea:0f:e5:dc:6b:e4","56:fc:3d:c4:aa:55","172.20.0.2","172.20.0.3","TCP","4433 → 55524 [SYN, ACK] Seq=0 Ack=1 Win=65160 Len=0 MSS=1460 SACK_PERM TSval=1498399893 TSecr=1307484098 WS=128"
"105","0.260423798","66","56:fc:3d:c4:aa:55","ea:0f:e5:dc:6b:e4","172.20.0.3","172.20.0.2","TCP","55524 → 4433 [ACK] Seq=1 Ack=1 Win=64256 Len=0 TSval=1307484098 TSecr=1498399893"
"106","0.260456157","593","56:fc:3d:c4:aa:55","ea:0f:e5:dc:6b:e4","172.20.0.3","172.20.0.2","TLSv1.2","Client Hello"
"107","0.260460435","66","ea:0f:e5:dc:6b:e4","56:fc:3d:c4:aa:55","172.20.0.2","172.20.0.3","TCP","4433 → 55524 [ACK] Seq=1 Ack=528 Win=64640 Len=0 TSval=1498399893 TSecr=1307484098"
"108","0.264069216","964","ea:0f:e5:dc:6b:e4","56:fc:3d:c4:aa:55","172.20.0.2","172.20.0.3","TLSv1.3","Server Hello, Change Cipher Spec, Application Data, Application Data, Application Data, Application Data"
"109","0.264098335","66","56:fc:3d:c4:aa:55","ea:0f:e5:dc:6b:e4","172.20.0.3","172.20.0.2","TCP","55524 → 4433 [ACK] Seq=528 Ack=899 Win=64128 Len=0 TSval=1307484101 TSecr=1498399896"
"110","0.267558213","146","56:fc:3d:c4:aa:55","ea:0f:e5:dc:6b:e4","172.20.0.3","172.20.0.2","TLSv1.3","Change Cipher Spec, Application Data"
"111","0.267611315","66","56:fc:3d:c4:aa:55","ea:0f:e5:dc:6b:e4","172.20.0.3","172.20.0.2","TCP","55524 → 4433 [RST, ACK] Seq=608 Ack=899 Win=64128 Len=0 TSval=1307484105 TSecr=1498399896"
"112","0.279973168","74","56:fc:3d:c4:aa:55","ea:0f:e5:dc:6b:e4","172.20.0.3","172.20.0.2","TCP","55534 → 4433 [SYN] Seq=0 Win=64240 Len=0 MSS=1460 SACK_PERM TSval=1307484117 TSecr=0 WS=128"
"113","0.280000183","74","ea:0f:e5:dc:6b:e4","56:fc:3d:c4:aa:55","172.20.0.2","172.20.0.3","TCP","4433 → 55534 [SYN, ACK] Seq=0 Ack=1 Win=65160 Len=0 MSS=1460 SACK_PERM TSval=1498399912 TSecr=1307484117 WS=128"
"114","0.280019919","66","56:fc:3d:c4:aa:55","ea:0f:e5:dc:6b:e4","172.20.0.3","172.20.0.2","TCP","55534 → 4433 [ACK] Seq=1 Ack=1 Win=64256 Len=0 TSval=1307484117 TSecr=1498399912"
"115","0.280067673","593","56:fc:3d:c4:aa:55","ea:0f:e5:dc:6b:e4","172.20.0.3","172.20.0.2","TLSv1.2","Client Hello"
"116","0.280071936","66","ea:0f:e5:dc:6b:e4","56:fc:3d:c4:aa:55","172.20.0.2","172.20.0.3","TCP","4433 → 55534 [ACK] Seq=1 Ack=528 Win=64640 Len=0 TSval=1498399912 TSecr=1307484117"
"117","0.284398207","965","ea:0f:e5:dc:6b:e4","56:fc:3d:c4:aa:55","172.20.0.2","172.20.0.3","TLSv1.3","Server Hello, Change Cipher Spec, Application Data, Application Data, Application Data, Application Data"
"118","0.284441319","66","56:fc:3d:c4:aa:55","ea:0f:e5:dc:6b:e4","172.20.0.3","172.20.0.2","TCP","55534 → 4433 [ACK] Seq=528 Ack=900 Win=64128 Len=0 TSval=1307484122 TSecr=1498399917"
"119","0.288409330","146","56:fc:3d:c4:aa:55","ea:0f:e5:dc:6b:e4","172.20.0.3","172.20.0.2","TLSv1.3","Change Cipher Spec, Application Data"
"120","0.288490771","66","56:fc:3d:c4:aa:55","ea:0f:e5:dc:6b:e4","172.20.0.3","172.20.0.2","TCP","55534 → 4433 [RST, ACK] Seq=608 Ack=900 Win=64128 Len=0 TSval=1307484126 TSecr=1498399917"
"121","0.300341193","74","56:fc:3d:c4:aa:55","ea:0f:e5:dc:6b:e4","172.20.0.3","172.20.0.2","TCP","55544 → 4433 [SYN] Seq=0 Win=64240 Len=0 MSS=1460 SACK_PERM TSval=1307484137 TSecr=0 WS=128"
"122","0.300374898","74","ea:0f:e5:dc:6b:e4","56:fc:3d:c4:aa:55","172.20.0.2","172.20.0.3","TCP","4433 → 55544 [SYN, ACK] Seq=0 Ack=1 Win=65160 Len=0 MSS=1460 SACK_PERM TSval=1498399933 TSecr=1307484137 WS=128"
"123","0.300395521","66","56:fc:3d:c4:aa:55","ea:0f:e5:dc:6b:e4","172.20.0.3","172.20.0.2","TCP","55544 → 4433 [ACK] Seq=1 Ack=1 Win=64256 Len=0 TSval=1307484138 TSecr=1498399933"
"124","0.300445977","593","56:fc:3d:c4:aa:55","ea:0f:e5:dc:6b:e4","172.20.0.3","172.20.0.2","TLSv1.2","Client Hello"
"125","0.300450478","66","ea:0f:e5:dc:6b:e4","56:fc:3d:c4:aa:55","172.20.0.2","172.20.0.3","TCP","4433 → 55544 [ACK] Seq=1 Ack=528 Win=64640 Len=0 TSval=1498399933 TSecr=1307484138"
"126","0.304200592","964","ea:0f:e5:dc:6b:e4","56:fc:3d:c4:aa:55","172.20.0.2","172.20.0.3","TLSv1.3","Server Hello, Change Cipher Spec, Application Data, Application Data, Application Data, Application Data"
"127","0.304232657","66","56:fc:3d:c4:aa:55","ea:0f:e5:dc:6b:e4","172.20.0.3","172.20.0.2","TCP","55544 → 4433 [ACK] Seq=528 Ack=899 Win=64128 Len=0 TSval=1307484141 TSecr=1498399936"
"128","0.307777740","146","56:fc:3d:c4:aa:55","ea:0f:e5:dc:6b:e4","172.20.0.3","172.20.0.2","TLSv1.3","Change Cipher Spec, Application Data"
"129","0.307843695","66","56:fc:3d:c4:aa:55","ea:0f:e5:dc:6b:e4","172.20.0.3","172.20.0.2","TCP","55544 → 4433 [RST, ACK] Seq=608 Ack=899 Win=64128 Len=0 TSval=1307484145 TSecr=1498399936"
"130","0.319804552","74","56:fc:3d:c4:aa:55","ea:0f:e5:dc:6b:e4","172.20.0.3","172.20.0.2","TCP","55550 → 4433 [SYN] Seq=0 Win=64240 Len=0 MSS=1460 SACK_PERM TSval=1307484157 TSecr=0 WS=128"
"131","0.319831404","74","ea:0f:e5:dc:6b:e4","56:fc:3d:c4:aa:55","172.20.0.2","172.20.0.3","TCP","4433 → 55550 [SYN, ACK] Seq=0 Ack=1 Win=65160 Len=0 MSS=1460 SACK_PERM TSval=1498399952 TSecr=1307484157 WS=128"
"132","0.319849931","66","56:fc:3d:c4:aa:55","ea:0f:e5:dc:6b:e4","172.20.0.3","172.20.0.2","TCP","55550 → 4433 [ACK] Seq=1 Ack=1 Win=64256 Len=0 TSval=1307484157 TSecr=1498399952"
"133","0.319902255","593","56:fc:3d:c4:aa:55","ea:0f:e5:dc:6b:e4","172.20.0.3","172.20.0.2","TLSv1.2","Client Hello"
"134","0.319911016","66","ea:0f:e5:dc:6b:e4","56:fc:3d:c4:aa:55","172.20.0.2","172.20.0.3","TCP","4433 → 55550 [ACK] Seq=1 Ack=528 Win=64640 Len=0 TSval=1498399952 TSecr=1307484157"
"135","0.324255411","965","ea:0f:e5:dc:6b:e4","56:fc:3d:c4:aa:55","172.20.0.2","172.20.0.3","TLSv1.3","Server Hello, Change Cipher Spec, Application Data, Application Data, Application Data, Application Data"
"136","0.324310150","66","56:fc:3d:c4:aa:55","ea:0f:e5:dc:6b:e4","172.20.0.3","172.20.0.2","TCP","55550 → 4433 [ACK] Seq=528 Ack=900 Win=64128 Len=0 TSval=1307484161 TSecr=1498399956"
"137","0.328088279","146","56:fc:3d:c4:aa:55","ea:0f:e5:dc:6b:e4","172.20.0.3","172.20.0.2","TLSv1.3","Change Cipher Spec, Application Data"
"138","0.328161756","66","56:fc:3d:c4:aa:55","ea:0f:e5:dc:6b:e4","172.20.0.3","172.20.0.2","TCP","55550 → 4433 [RST, ACK] Seq=608 Ack=900 Win=64128 Len=0 TSval=1307484165 TSecr=1498399956"
"139","0.339802620","74","56:fc:3d:c4:aa:55","ea:0f:e5:dc:6b:e4","172.20.0.3","172.20.0.2","TCP","55560 → 4433 [SYN] Seq=0 Win=64240 Len=0 MSS=1460 SACK_PERM TSval=1307484177 TSecr=0 WS=128"
"140","0.339826388","74","ea:0f:e5:dc:6b:e4","56:fc:3d:c4:aa:55","172.20.0.2","172.20.0.3","TCP","4433 → 55560 [SYN, ACK] Seq=0 Ack=1 Win=65160 Len=0 MSS=1460 SACK_PERM TSval=1498399972 TSecr=1307484177 WS=128"
"141","0.339846099","66","56:fc:3d:c4:aa:55","ea:0f:e5:dc:6b:e4","172.20.0.3","172.20.0.2","TCP","55560 → 4433 [ACK] Seq=1 Ack=1 Win=64256 Len=0 TSval=1307484177 TSecr=1498399972"
"142","0.339885975","593","56:fc:3d:c4:aa:55","ea:0f:e5:dc:6b:e4","172.20.0.3","172.20.0.2","TLSv1.2","Client Hello"
"143","0.339891153","66","ea:0f:e5:dc:6b:e4","56:fc:3d:c4:aa:55","172.20.0.2","172.20.0.3","TCP","4433 → 55560 [ACK] Seq=1 Ack=528 Win=64640 Len=0 TSval=1498399972 TSecr=1307484177"
"144","0.343586963","964","ea:0f:e5:dc:6b:e4","56:fc:3d:c4:aa:55","172.20.0.2","172.20.0.3","TLSv1.3","Server Hello, Change Cipher Spec, Application Data, Application Data, Application Data, Application Data"
"145","0.343616228","66","56:fc:3d:c4:aa:55","ea:0f:e5:dc:6b:e4","172.20.0.3","172.20.0.2","TCP","55560 → 4433 [ACK] Seq=528 Ack=899 Win=64128 Len=0 TSval=1307484181 TSecr=1498399976"
"146","0.347101101","146","56:fc:3d:c4:aa:55","ea:0f:e5:dc:6b:e4","172.20.0.3","172.20.0.2","TLSv1.3","Change Cipher Spec, Application Data"
"147","0.347162223","66","56:fc:3d:c4:aa:55","ea:0f:e5:dc:6b:e4","172.20.0.3","172.20.0.2","TCP","55560 → 4433 [RST, ACK] Seq=608 Ack=899 Win=64128 Len=0 TSval=1307484184 TSecr=1498399976"
"148","0.359673729","74","56:fc:3d:c4:aa:55","ea:0f:e5:dc:6b:e4","172.20.0.3","172.20.0.2","TCP","55572 → 4433 [SYN] Seq=0 Win=64240 Len=0 MSS=1460 SACK_PERM TSval=1307484197 TSecr=0 WS=128"
"149","0.359700592","74","ea:0f:e5:dc:6b:e4","56:fc:3d:c4:aa:55","172.20.0.2","172.20.0.3","TCP","4433 → 55572 [SYN, ACK] Seq=0 Ack=1 Win=65160 Len=0 MSS=1460 SACK_PERM TSval=1498399992 TSecr=1307484197 WS=128"
"150","0.359719196","66","56:fc:3d:c4:aa:55","ea:0f:e5:dc:6b:e4","172.20.0.3","172.20.0.2","TCP","55572 → 4433 [ACK] Seq=1 Ack=1 Win=64256 Len=0 TSval=1307484197 TSecr=1498399992"
"151","0.359763210","593","56:fc:3d:c4:aa:55","ea:0f:e5:dc:6b:e4","172.20.0.3","172.20.0.2","TLSv1.2","Client Hello"
"152","0.359769003","66","ea:0f:e5:dc:6b:e4","56:fc:3d:c4:aa:55","172.20.0.2","172.20.0.3","TCP","4433 → 55572 [ACK] Seq=1 Ack=528 Win=64640 Len=0 TSval=1498399992 TSecr=1307484197"
"153","0.363526486","963","ea:0f:e5:dc:6b:e4","56:fc:3d:c4:aa:55","172.20.0.2","172.20.0.3","TLSv1.3","Server Hello, Change Cipher Spec, Application Data, Application Data, Application Data, Application Data"
"154","0.363566457","66","56:fc:3d:c4:aa:55","ea:0f:e5:dc:6b:e4","172.20.0.3","172.20.0.2","TCP","55572 → 4433 [ACK] Seq=528 Ack=898 Win=64128 Len=0 TSval=1307484201 TSecr=1498399996"
"155","0.367423952","146","56:fc:3d:c4:aa:55","ea:0f:e5:dc:6b:e4","172.20.0.3","172.20.0.2","TLSv1.3","Change Cipher Spec, Application Data"
"156","0.367493992","66","56:fc:3d:c4:aa:55","ea:0f:e5:dc:6b:e4","172.20.0.3","172.20.0.2","TCP","55572 → 4433 [RST, ACK] Seq=608 Ack=898 Win=64128 Len=0 TSval=1307484205 TSecr=1498399996"
"157","0.379001921","74","56:fc:3d:c4:aa:55","ea:0f:e5:dc:6b:e4","172.20.0.3","172.20.0.2","TCP","55580 → 4433 [SYN] Seq=0 Win=64240 Len=0 MSS=1460 SACK_PERM TSval=1307484216 TSecr=0 WS=128"
"158","0.379025445","74","ea:0f:e5:dc:6b:e4","56:fc:3d:c4:aa:55","172.20.0.2","172.20.0.3","TCP","4433 → 55580 [SYN, ACK] Seq=0 Ack=1 Win=65160 Len=0 MSS=1460 SACK_PERM TSval=1498400011 TSecr=1307484216 WS=128"
"159","0.379043643","66","56:fc:3d:c4:aa:55","ea:0f:e5:dc:6b:e4","172.20.0.3","172.20.0.2","TCP","55580 → 4433 [ACK] Seq=1 Ack=1 Win=64256 Len=0 TSval=1307484216 TSecr=1498400011"
"160","0.379080389","593","56:fc:3d:c4:aa:55","ea:0f:e5:dc:6b:e4","172.20.0.3","172.20.0.2","TLSv1.2","Client Hello"
"161","0.379085187","66","ea:0f:e5:dc:6b:e4","56:fc:3d:c4:aa:55","172.20.0.2","172.20.0.3","TCP","4433 → 55580 [ACK] Seq=1 Ack=528 Win=64640 Len=0 TSval=1498400011 TSecr=1307484216"
"162","0.382656706","963","ea:0f:e5:dc:6b:e4","56:fc:3d:c4:aa:55","172.20.0.2","172.20.0.3","TLSv1.3","Server Hello, Change Cipher Spec, Application Data, Application Data, Application Data, Application Data"
"163","0.382696155","66","56:fc:3d:c4:aa:55","ea:0f:e5:dc:6b:e4","172.20.0.3","172.20.0.2","TCP","55580 → 4433 [ACK] Seq=528 Ack=898 Win=64128 Len=0 TSval=1307484220 TSecr=1498400015"
"164","0.386205197","146","56:fc:3d:c4:aa:55","ea:0f:e5:dc:6b:e4","172.20.0.3","172.20.0.2","TLSv1.3","Change Cipher Spec, Application Data"
"165","0.386277064","66","56:fc:3d:c4:aa:55","ea:0f:e5:dc:6b:e4","172.20.0.3","172.20.0.2","TCP","55580 → 4433 [RST, ACK] Seq=608 Ack=898 Win=64128 Len=0 TSval=1307484223 TSecr=1498400015"
"166","0.397847049","74","56:fc:3d:c4:aa:55","ea:0f:e5:dc:6b:e4","172.20.0.3","172.20.0.2","TCP","55586 → 4433 [SYN] Seq=0 Win=64240 Len=0 MSS=1460 SACK_PERM TSval=1307484235 TSecr=0 WS=128"
"167","0.397872321","74","ea:0f:e5:dc:6b:e4","56:fc:3d:c4:aa:55","172.20.0.2","172.20.0.3","TCP","4433 → 55586 [SYN, ACK] Seq=0 Ack=1 Win=65160 Len=0 MSS=1460 SACK_PERM TSval=1498400030 TSecr=1307484235 WS=128"
"168","0.397890978","66","56:fc:3d:c4:aa:55","ea:0f:e5:dc:6b:e4","172.20.0.3","172.20.0.2","TCP","55586 → 4433 [ACK] Seq=1 Ack=1 Win=64256 Len=0 TSval=1307484235 TSecr=1498400030"
"169","0.397932943","593","56:fc:3d:c4:aa:55","ea:0f:e5:dc:6b:e4","172.20.0.3","172.20.0.2","TLSv1.2","Client Hello"
"170","0.397938931","66","ea:0f:e5:dc:6b:e4","56:fc:3d:c4:aa:55","172.20.0.2","172.20.0.3","TCP","4433 → 55586 [ACK] Seq=1 Ack=528 Win=64640 Len=0 TSval=1498400030 TSecr=1307484235"
"171","0.401701571","964","ea:0f:e5:dc:6b:e4","56:fc:3d:c4:aa:55","172.20.0.2","172.20.0.3","TLSv1.3","Server Hello, Change Cipher Spec, Application Data, Application Data, Application Data, Application Data"
"172","0.401745245","66","56:fc:3d:c4:aa:55","ea:0f:e5:dc:6b:e4","172.20.0.3","172.20.0.2","TCP","55586 → 4433 [ACK] Seq=528 Ack=899 Win=64128 Len=0 TSval=1307484239 TSecr=1498400034"
"173","0.405755786","146","56:fc:3d:c4:aa:55","ea:0f:e5:dc:6b:e4","172.20.0.3","172.20.0.2","TLSv1.3","Change Cipher Spec, Application Data"
"174","0.405833533","66","56:fc:3d:c4:aa:55","ea:0f:e5:dc:6b:e4","172.20.0.3","172.20.0.2","TCP","55586 → 4433 [RST, ACK] Seq=608 Ack=899 Win=64128 Len=0 TSval=1307484243 TSecr=1498400034"
"175","0.417728993","74","56:fc:3d:c4:aa:55","ea:0f:e5:dc:6b:e4","172.20.0.3","172.20.0.2","TCP","55600 → 4433 [SYN] Seq=0 Win=64240 Len=0 MSS=1460 SACK_PERM TSval=1307484255 TSecr=0 WS=128"
"176","0.417753760","74","ea:0f:e5:dc:6b:e4","56:fc:3d:c4:aa:55","172.20.0.2","172.20.0.3","TCP","4433 → 55600 [SYN, ACK] Seq=0 Ack=1 Win=65160 Len=0 MSS=1460 SACK_PERM TSval=1498400050 TSecr=1307484255 WS=128"
"177","0.417769897","66","56:fc:3d:c4:aa:55","ea:0f:e5:dc:6b:e4","172.20.0.3","172.20.0.2","TCP","55600 → 4433 [ACK] Seq=1 Ack=1 Win=64256 Len=0 TSval=1307484255 TSecr=1498400050"
"178","0.417809604","593","56:fc:3d:c4:aa:55","ea:0f:e5:dc:6b:e4","172.20.0.3","172.20.0.2","TLSv1.2","Client Hello"
"179","0.417821402","66","ea:0f:e5:dc:6b:e4","56:fc:3d:c4:aa:55","172.20.0.2","172.20.0.3","TCP","4433 → 55600 [ACK] Seq=1 Ack=528 Win=64640 Len=0 TSval=1498400050 TSecr=1307484255"
"180","0.421576895","965","ea:0f:e5:dc:6b:e4","56:fc:3d:c4:aa:55","172.20.0.2","172.20.0.3","TLSv1.3","Server Hello, Change Cipher Spec, Application Data, Application Data, Application Data, Application Data"
"181","0.421602848","66","56:fc:3d:c4:aa:55","ea:0f:e5:dc:6b:e4","172.20.0.3","172.20.0.2","TCP","55600 → 4433 [ACK] Seq=528 Ack=900 Win=64128 Len=0 TSval=1307484259 TSecr=1498400054"
"182","0.425105939","146","56:fc:3d:c4:aa:55","ea:0f:e5:dc:6b:e4","172.20.0.3","172.20.0.2","TLSv1.3","Change Cipher Spec, Application Data"
"183","0.425169041","66","56:fc:3d:c4:aa:55","ea:0f:e5:dc:6b:e4","172.20.0.3","172.20.0.2","TCP","55600 → 4433 [RST, ACK] Seq=608 Ack=900 Win=64128 Len=0 TSval=1307484262 TSecr=1498400054"
"184","0.436953057","74","56:fc:3d:c4:aa:55","ea:0f:e5:dc:6b:e4","172.20.0.3","172.20.0.2","TCP","55606 → 4433 [SYN] Seq=0 Win=64240 Len=0 MSS=1460 SACK_PERM TSval=1307484274 TSecr=0 WS=128"
"185","0.436979266","74","ea:0f:e5:dc:6b:e4","56:fc:3d:c4:aa:55","172.20.0.2","172.20.0.3","TCP","4433 → 55606 [SYN, ACK] Seq=0 Ack=1 Win=65160 Len=0 MSS=1460 SACK_PERM TSval=1498400069 TSecr=1307484274 WS=128"
"186","0.437000288","66","56:fc:3d:c4:aa:55","ea:0f:e5:dc:6b:e4","172.20.0.3","172.20.0.2","TCP","55606 → 4433 [ACK] Seq=1 Ack=1 Win=64256 Len=0 TSval=1307484274 TSecr=1498400069"
"187","0.437057622","593","56:fc:3d:c4:aa:55","ea:0f:e5:dc:6b:e4","172.20.0.3","172.20.0.2","TLSv1.2","Client Hello"
"188","0.437062547","66","ea:0f:e5:dc:6b:e4","56:fc:3d:c4:aa:55","172.20.0.2","172.20.0.3","TCP","4433 → 55606 [ACK] Seq=1 Ack=528 Win=64640 Len=0 TSval=1498400069 TSecr=1307484274"
"189","0.441616571","963","ea:0f:e5:dc:6b:e4","56:fc:3d:c4:aa:55","172.20.0.2","172.20.0.3","TLSv1.3","Server Hello, Change Cipher Spec, Application Data, Application Data, Application Data, Application Data"
"190","0.441680921","66","56:fc:3d:c4:aa:55","ea:0f:e5:dc:6b:e4","172.20.0.3","172.20.0.2","TCP","55606 → 4433 [ACK] Seq=528 Ack=898 Win=64128 Len=0 TSval=1307484279 TSecr=1498400074"
"191","0.445456905","146","56:fc:3d:c4:aa:55","ea:0f:e5:dc:6b:e4","172.20.0.3","172.20.0.2","TLSv1.3","Change Cipher Spec, Application Data"
"192","0.445543790","66","56:fc:3d:c4:aa:55","ea:0f:e5:dc:6b:e4","172.20.0.3","172.20.0.2","TCP","55606 → 4433 [RST, ACK] Seq=608 Ack=898 Win=64128 Len=0 TSval=1307484283 TSecr=1498400074"
"193","0.460904644","74","56:fc:3d:c4:aa:55","ea:0f:e5:dc:6b:e4","172.20.0.3","172.20.0.2","TCP","55618 → 4433 [SYN] Seq=0 Win=64240 Len=0 MSS=1460 SACK_PERM TSval=1307484298 TSecr=0 WS=128"
"194","0.460933438","74","ea:0f:e5:dc:6b:e4","56:fc:3d:c4:aa:55","172.20.0.2","172.20.0.3","TCP","4433 → 55618 [SYN, ACK] Seq=0 Ack=1 Win=65160 Len=0 MSS=1460 SACK_PERM TSval=1498400093 TSecr=1307484298 WS=128"
"195","0.460955017","66","56:fc:3d:c4:aa:55","ea:0f:e5:dc:6b:e4","172.20.0.3","172.20.0.2","TCP","55618 → 4433 [ACK] Seq=1 Ack=1 Win=64256 Len=0 TSval=1307484298 TSecr=1498400093"
"196","0.461006878","593","56:fc:3d:c4:aa:55","ea:0f:e5:dc:6b:e4","172.20.0.3","172.20.0.2","TLSv1.2","Client Hello"
"197","0.461014913","66","ea:0f:e5:dc:6b:e4","56:fc:3d:c4:aa:55","172.20.0.2","172.20.0.3","TCP","4433 → 55618 [ACK] Seq=1 Ack=528 Win=64640 Len=0 TSval=1498400093 TSecr=1307484298"
"198","0.464767465","965","ea:0f:e5:dc:6b:e4","56:fc:3d:c4:aa:55","172.20.0.2","172.20.0.3","TLSv1.3","Server Hello, Change Cipher Spec, Application Data, Application Data, Application Data, Application Data"
"199","0.464814460","66","56:fc:3d:c4:aa:55","ea:0f:e5:dc:6b:e4","172.20.0.3","172.20.0.2","TCP","55618 → 4433 [ACK] Seq=528 Ack=900 Win=64128 Len=0 TSval=1307484302 TSecr=1498400097"
"200","0.468431217","146","56:fc:3d:c4:aa:55","ea:0f:e5:dc:6b:e4","172.20.0.3","172.20.0.2","TLSv1.3","Change Cipher Spec, Application Data"
"201","0.468498360","66","56:fc:3d:c4:aa:55","ea:0f:e5:dc:6b:e4","172.20.0.3","172.20.0.2","TCP","55618 → 4433 [RST, ACK] Seq=608 Ack=900 Win=64128 Len=0 TSval=1307484306 TSecr=1498400097"
"202","0.481206554","74","56:fc:3d:c4:aa:55","ea:0f:e5:dc:6b:e4","172.20.0.3","172.20.0.2","TCP","55630 → 4433 [SYN] Seq=0 Win=64240 Len=0 MSS=1460 SACK_PERM TSval=1307484318 TSecr=0 WS=128"
"203","0.481235049","74","ea:0f:e5:dc:6b:e4","56:fc:3d:c4:aa:55","172.20.0.2","172.20.0.3","TCP","4433 → 55630 [SYN, ACK] Seq=0 Ack=1 Win=65160 Len=0 MSS=1460 SACK_PERM TSval=1498400113 TSecr=1307484318 WS=128"
"204","0.481262344","66","56:fc:3d:c4:aa:55","ea:0f:e5:dc:6b:e4","172.20.0.3","172.20.0.2","TCP","55630 → 4433 [ACK] Seq=1 Ack=1 Win=64256 Len=0 TSval=1307484318 TSecr=1498400113"
"205","0.481306446","593","56:fc:3d:c4:aa:55","ea:0f:e5:dc:6b:e4","172.20.0.3","172.20.0.2","TLSv1.2","Client Hello"
"206","0.481312645","66","ea:0f:e5:dc:6b:e4","56:fc:3d:c4:aa:55","172.20.0.2","172.20.0.3","TCP","4433 → 55630 [ACK] Seq=1 Ack=528 Win=64640 Len=0 TSval=1498400113 TSecr=1307484318"
"207","0.485006655","962","ea:0f:e5:dc:6b:e4","56:fc:3d:c4:aa:55","172.20.0.2","172.20.0.3","TLSv1.3","Server Hello, Change Cipher Spec, Application Data, Application Data, Application Data, Application Data"
"208","0.485049778","66","56:fc:3d:c4:aa:55","ea:0f:e5:dc:6b:e4","172.20.0.3","172.20.0.2","TCP","55630 → 4433 [ACK] Seq=528 Ack=897 Win=64128 Len=0 TSval=1307484322 TSecr=1498400117"
"209","0.488786469","146","56:fc:3d:c4:aa:55","ea:0f:e5:dc:6b:e4","172.20.0.3","172.20.0.2","TLSv1.3","Change Cipher Spec, Application Data"
"210","0.488849047","66","56:fc:3d:c4:aa:55","ea:0f:e5:dc:6b:e4","172.20.0.3","172.20.0.2","TCP","55630 → 4433 [RST, ACK] Seq=608 Ack=897 Win=64128 Len=0 TSval=1307484326 TSecr=1498400117"
"211","0.500210709","74","56:fc:3d:c4:aa:55","ea:0f:e5:dc:6b:e4","172.20.0.3","172.20.0.2","TCP","55634 → 4433 [SYN] Seq=0 Win=64240 Len=0 MSS=1460 SACK_PERM TSval=1307484337 TSecr=0 WS=128"
"212","0.500233859","74","ea:0f:e5:dc:6b:e4","56:fc:3d:c4:aa:55","172.20.0.2","172.20.0.3","TCP","4433 → 55634 [SYN, ACK] Seq=0 Ack=1 Win=65160 Len=0 MSS=1460 SACK_PERM TSval=1498400132 TSecr=1307484337 WS=128"
"213","0.500256992","66","56:fc:3d:c4:aa:55","ea:0f:e5:dc:6b:e4","172.20.0.3","172.20.0.2","TCP","55634 → 4433 [ACK] Seq=1 Ack=1 Win=64256 Len=0 TSval=1307484337 TSecr=1498400132"
"214","0.500294381","593","56:fc:3d:c4:aa:55","ea:0f:e5:dc:6b:e4","172.20.0.3","172.20.0.2","TLSv1.2","Client Hello"
"215","0.500299667","66","ea:0f:e5:dc:6b:e4","56:fc:3d:c4:aa:55","172.20.0.2","172.20.0.3","TCP","4433 → 55634 [ACK] Seq=1 Ack=528 Win=64640 Len=0 TSval=1498400132 TSecr=1307484337"
"216","0.503912184","963","ea:0f:e5:dc:6b:e4","56:fc:3d:c4:aa:55","172.20.0.2","172.20.0.3","TLSv1.3","Server Hello, Change Cipher Spec, Application Data, Application Data, Application Data, Application Data"
"217","0.503945891","66","56:fc:3d:c4:aa:55","ea:0f:e5:dc:6b:e4","172.20.0.3","172.20.0.2","TCP","55634 → 4433 [ACK] Seq=528 Ack=898 Win=64128 Len=0 TSval=1307484341 TSecr=1498400136"
"218","0.507480781","146","56:fc:3d:c4:aa:55","ea:0f:e5:dc:6b:e4","172.20.0.3","172.20.0.2","TLSv1.3","Change Cipher Spec, Application Data"
"219","0.507539669","66","56:fc:3d:c4:aa:55","ea:0f:e5:dc:6b:e4","172.20.0.3","172.20.0.2","TCP","55634 → 4433 [RST, ACK] Seq=608 Ack=898 Win=64128 Len=0 TSval=1307484345 TSecr=1498400136"
"220","0.520201867","74","56:fc:3d:c4:aa:55","ea:0f:e5:dc:6b:e4","172.20.0.3","172.20.0.2","TCP","55640 → 4433 [SYN] Seq=0 Win=64240 Len=0 MSS=1460 SACK_PERM TSval=1307484357 TSecr=0 WS=128"
"221","0.520227685","74","ea:0f:e5:dc:6b:e4","56:fc:3d:c4:aa:55","172.20.0.2","172.20.0.3","TCP","4433 → 55640 [SYN, ACK] Seq=0 Ack=1 Win=65160 Len=0 MSS=1460 SACK_PERM TSval=1498400152 TSecr=1307484357 WS=128"
"222","0.520244308","66","56:fc:3d:c4:aa:55","ea:0f:e5:dc:6b:e4","172.20.0.3","172.20.0.2","TCP","55640 → 4433 [ACK] Seq=1 Ack=1 Win=64256 Len=0 TSval=1307484357 TSecr=1498400152"
"223","0.520302261","593","56:fc:3d:c4:aa:55","ea:0f:e5:dc:6b:e4","172.20.0.3","172.20.0.2","TLSv1.2","Client Hello"
"224","0.520306755","66","ea:0f:e5:dc:6b:e4","56:fc:3d:c4:aa:55","172.20.0.2","172.20.0.3","TCP","4433 → 55640 [ACK] Seq=1 Ack=528 Win=64640 Len=0 TSval=1498400152 TSecr=1307484357"
"225","0.523970307","964","ea:0f:e5:dc:6b:e4","56:fc:3d:c4:aa:55","172.20.0.2","172.20.0.3","TLSv1.3","Server Hello, Change Cipher Spec, Application Data, Application Data, Application Data, Application Data"
