frame.number,frame.time_relative,frame.len,eth.src,eth.dst,ip.src,ip.dst,_ws.col.protocol,_ws.col.info
"1","0.000000000","239","36:35:88:35:a0:a5","33:33:00:00:00:fb",,,"MDNS","Standard query 0x0000 PTR _ipps._tcp.local, ""QM"" question PTR _ftp._tcp.local, ""QM"" question PTR _webdav._tcp.local, ""QM"" question PTR _webdavs._tcp.local, ""QM"" question PTR _sftp-ssh._tcp.local, ""QM"" question PTR _smb._tcp.local, ""QM"" question PTR _afpovertcp._tcp.local, ""QM"" question PTR _nfs._tcp.local, ""QM"" question PTR _ipp._tcp.local, ""QM"" question PTR MONTE-VIRTUAL-MACHINE._smb._tcp.local"
"2","1.126640836","70","36:35:88:35:a0:a5","33:33:00:00:00:02",,,"ICMPv6","Router Solicitation from 36:35:88:35:a0:a5"
"3","2.138241211","42","f2:b8:19:81:77:bf","ff:ff:ff:ff:ff:ff",,,"ARP","ARP Announcement for 172.20.0.3"
"4","2.169755092","42","f2:b8:19:81:77:bf","ff:ff:ff:ff:ff:ff",,,"ARP","Who has 172.20.0.2? Tell 172.20.0.3"
"5","2.169776187","42","9e:5d:25:47:f6:9e","f2:b8:19:81:77:bf",,,"ARP","172.20.0.2 is at 9e:5d:25:47:f6:9e"
"6","2.169781946","74","f2:b8:19:81:77:bf","9e:5d:25:47:f6:9e","172.20.0.3","172.20.0.2","TCP","37000 → 4433 [SYN] Seq=0 Win=64240 Len=0 MSS=1460 SACK_PERM TSval=1308063328 TSecr=0 WS=128"
"7","2.169800097","74","9e:5d:25:47:f6:9e","f2:b8:19:81:77:bf","172.20.0.2","172.20.0.3","TCP","4433 → 37000 [SYN, ACK] Seq=0 Ack=1 Win=65160 Len=0 MSS=1460 SACK_PERM TSval=1498979123 TSecr=1308063328 WS=128"
"8","2.169814695","66","f2:b8:19:81:77:bf","9e:5d:25:47:f6:9e","172.20.0.3","172.20.0.2","TCP","37000 → 4433 [ACK] Seq=1 Ack=1 Win=64256 Len=0 TSval=1308063328 TSecr=1498979123"
"9","2.169860874","552","f2:b8:19:81:77:bf","9e:5d:25:47:f6:9e","172.20.0.3","172.20.0.2","TLSv1.2","Client Hello"
"10","2.169865148","66","9e:5d:25:47:f6:9e","f2:b8:19:81:77:bf","172.20.0.2","172.20.0.3","TCP","4433 → 37000 [ACK] Seq=1 Ack=487 Win=64768 Len=0 TSval=1498979123 TSecr=1308063328"
"11","2.173744862","924","9e:5d:25:47:f6:9e","f2:b8:19:81:77:bf","172.20.0.2","172.20.0.3","TLSv1.3","Server Hello, Change Cipher Spec, Application Data, Application Data, Application Data, Application Data"
"12","2.173789785","66","f2:b8:19:81:77:bf","9e:5d:25:47:f6:9e","172.20.0.3","172.20.0.2","TCP","37000 → 4433 [ACK] Seq=487 Ack=859 Win=63488 Len=0 TSval=1308063332 TSecr=1498979127"
"13","2.176689226","146","f2:b8:19:81:77:bf","9e:5d:25:47:f6:9e","172.20.0.3","172.20.0.2","TLSv1.3","Change Cipher Spec, Application Data"
"14","2.176770463","66","f2:b8:19:81:77:bf","9e:5d:25:47:f6:9e","172.20.0.3","172.20.0.2","TCP","37000 → 4433 [RST, ACK] Seq=567 Ack=859 Win=64000 Len=0 TSval=1308063335 TSecr=1498979127"
"15","2.188136289","74","f2:b8:19:81:77:bf","9e:5d:25:47:f6:9e","172.20.0.3","172.20.0.2","TCP","37010 → 4433 [SYN] Seq=0 Win=64240 Len=0 MSS=1460 SACK_PERM TSval=1308063346 TSecr=0 WS=128"
"16","2.188167747","74","9e:5d:25:47:f6:9e","f2:b8:19:81:77:bf","172.20.0.2","172.20.0.3","TCP","4433 → 37010 [SYN, ACK] Seq=0 Ack=1 Win=65160 Len=0 MSS=1460 SACK_PERM TSval=1498979141 TSecr=1308063346 WS=128"
"17","2.188189628","66","f2:b8:19:81:77:bf","9e:5d:25:47:f6:9e","172.20.0.3","172.20.0.2","TCP","37010 → 4433 [ACK] Seq=1 Ack=1 Win=64256 Len=0 TSval=1308063346 TSecr=1498979141"
"18","2.188237193","552","f2:b8:19:81:77:bf","9e:5d:25:47:f6:9e","172.20.0.3","172.20.0.2","TLSv1.2","Client Hello"
"19","2.188244031","66","9e:5d:25:47:f6:9e","f2:b8:19:81:77:bf","172.20.0.2","172.20.0.3","TCP","4433 → 37010 [ACK] Seq=1 Ack=487 Win=64768 Len=0 TSval=1498979141 TSecr=1308063346"
"20","2.191299570","923","9e:5d:25:47:f6:9e","f2:b8:19:81:77:bf","172.20.0.2","172.20.0.3","TLSv1.3","Server Hello, Change Cipher Spec, Application Data, Application Data, Application Data, Application Data"
"21","2.191349489","66","f2:b8:19:81:77:bf","9e:5d:25:47:f6:9e","172.20.0.3","172.20.0.2","TCP","37010 → 4433 [ACK] Seq=487 Ack=858 Win=63488 Len=0 TSval=1308063349 TSecr=1498979144"
"22","2.194194186","146","f2:b8:19:81:77:bf","9e:5d:25:47:f6:9e","172.20.0.3","172.20.0.2","TLSv1.3","Change Cipher Spec, Application Data"
"23","2.194260153","66","f2:b8:19:81:77:bf","9e:5d:25:47:f6:9e","172.20.0.3","172.20.0.2","TCP","37010 → 4433 [RST, ACK] Seq=567 Ack=858 Win=64000 Len=0 TSval=1308063352 TSecr=1498979144"
"24","2.205491624","74","f2:b8:19:81:77:bf","9e:5d:25:47:f6:9e","172.20.0.3","172.20.0.2","TCP","37016 → 4433 [SYN] Seq=0 Win=64240 Len=0 MSS=1460 SACK_PERM TSval=1308063363 TSecr=0 WS=128"
"25","2.205530793","74","9e:5d:25:47:f6:9e","f2:b8:19:81:77:bf","172.20.0.2","172.20.0.3","TCP","4433 → 37016 [SYN, ACK] Seq=0 Ack=1 Win=65160 Len=0 MSS=1460 SACK_PERM TSval=1498979158 TSecr=1308063363 WS=128"
"26","2.205552451","66","f2:b8:19:81:77:bf","9e:5d:25:47:f6:9e","172.20.0.3","172.20.0.2","TCP","37016 → 4433 [ACK] Seq=1 Ack=1 Win=64256 Len=0 TSval=1308063363 TSecr=1498979158"
"27","2.205617810","552","f2:b8:19:81:77:bf","9e:5d:25:47:f6:9e","172.20.0.3","172.20.0.2","TLSv1.2","Client Hello"
"28","2.205641889","66","9e:5d:25:47:f6:9e","f2:b8:19:81:77:bf","172.20.0.2","172.20.0.3","TCP","4433 → 37016 [ACK] Seq=1 Ack=487 Win=64768 Len=0 TSval=1498979159 TSecr=1308063363"
"29","2.207941710","924","9e:5d:25:47:f6:9e","f2:b8:19:81:77:bf","172.20.0.2","172.20.0.3","TLSv1.3","Server Hello, Change Cipher Spec, Application Data, Application Data, Application Data, Application Data"
"30","2.207980393","66","f2:b8:19:81:77:bf","9e:5d:25:47:f6:9e","172.20.0.3","172.20.0.2","TCP","37016 → 4433 [ACK] Seq=487 Ack=859 Win=63488 Len=0 TSval=1308063366 TSecr=1498979161"
"31","2.210925860","146","f2:b8:19:81:77:bf","9e:5d:25:47:f6:9e","172.20.0.3","172.20.0.2","TLSv1.3","Change Cipher Spec, Application Data"
"32","2.210992793","66","f2:b8:19:81:77:bf","9e:5d:25:47:f6:9e","172.20.0.3","172.20.0.2","TCP","37016 → 4433 [RST, ACK] Seq=567 Ack=859 Win=64000 Len=0 TSval=1308063369 TSecr=1498979161"
"33","2.222317942","74","f2:b8:19:81:77:bf","9e:5d:25:47:f6:9e","172.20.0.3","172.20.0.2","TCP","37030 → 4433 [SYN] Seq=0 Win=64240 Len=0 MSS=1460 SACK_PERM TSval=1308063380 TSecr=0 WS=128"
"34","2.222339194","74","9e:5d:25:47:f6:9e","f2:b8:19:81:77:bf","172.20.0.2","172.20.0.3","TCP","4433 → 37030 [SYN, ACK] Seq=0 Ack=1 Win=65160 Len=0 MSS=1460 SACK_PERM TSval=1498979175 TSecr=1308063380 WS=128"
"35","2.222356365","66","f2:b8:19:81:77:bf","9e:5d:25:47:f6:9e","172.20.0.3","172.20.0.2","TCP","37030 → 4433 [ACK] Seq=1 Ack=1 Win=64256 Len=0 TSval=1308063380 TSecr=1498979175"
"36","2.222391897","552","f2:b8:19:81:77:bf","9e:5d:25:47:f6:9e","172.20.0.3","172.20.0.2","TLSv1.2","Client Hello"
"37","2.222396329","66","9e:5d:25:47:f6:9e","f2:b8:19:81:77:bf","172.20.0.2","172.20.0.3","TCP","4433 → 37030 [ACK] Seq=1 Ack=487 Win=64768 Len=0 TSval=1498979175 TSecr=1308063380"
"38","2.224557752","922","9e:5d:25:47:f6:9e","f2:b8:19:81:77:bf","172.20.0.2","172.20.0.3","TLSv1.3","Server Hello, Change Cipher Spec, Application Data, Application Data, Application Data, Application Data"
"39","2.224600003","66","f2:b8:19:81:77:bf","9e:5d:25:47:f6:9e","172.20.0.3","172.20.0.2","TCP","37030 → 4433 [ACK] Seq=487 Ack=857 Win=63488 Len=0 TSval=1308063382 TSecr=1498979177"
"40","2.227591511","146","f2:b8:19:81:77:bf","9e:5d:25:47:f6:9e","172.20.0.3","172.20.0.2","TLSv1.3","Change Cipher Spec, Application Data"
"41","2.227711321","66","f2:b8:19:81:77:bf","9e:5d:25:47:f6:9e","172.20.0.3","172.20.0.2","TCP","37030 → 4433 [RST, ACK] Seq=567 Ack=857 Win=64000 Len=0 TSval=1308063386 TSecr=1498979177"
"42","2.242658145","74","f2:b8:19:81:77:bf","9e:5d:25:47:f6:9e","172.20.0.3","172.20.0.2","TCP","37040 → 4433 [SYN] Seq=0 Win=64240 Len=0 MSS=1460 SACK_PERM TSval=1308063400 TSecr=0 WS=128"
"43","2.242691670","74","9e:5d:25:47:f6:9e","f2:b8:19:81:77:bf","172.20.0.2","172.20.0.3","TCP","4433 → 37040 [SYN, ACK] Seq=0 Ack=1 Win=65160 Len=0 MSS=1460 SACK_PERM TSval=1498979196 TSecr=1308063400 WS=128"
"44","2.242717277","66","f2:b8:19:81:77:bf","9e:5d:25:47:f6:9e","172.20.0.3","172.20.0.2","TCP","37040 → 4433 [ACK] Seq=1 Ack=1 Win=64256 Len=0 TSval=1308063401 TSecr=1498979196"
"45","2.242766461","552","f2:b8:19:81:77:bf","9e:5d:25:47:f6:9e","172.20.0.3","172.20.0.2","TLSv1.2","Client Hello"
"46","2.242774925","66","9e:5d:25:47:f6:9e","f2:b8:19:81:77:bf","172.20.0.2","172.20.0.3","TCP","4433 → 37040 [ACK] Seq=1 Ack=487 Win=64768 Len=0 TSval=1498979196 TSecr=1308063401"
"47","2.244912531","923","9e:5d:25:47:f6:9e","f2:b8:19:81:77:bf","172.20.0.2","172.20.0.3","TLSv1.3","Server Hello, Change Cipher Spec, Application Data, Application Data, Application Data, Application Data"
"48","2.244953940","66","f2:b8:19:81:77:bf","9e:5d:25:47:f6:9e","172.20.0.3","172.20.0.2","TCP","37040 → 4433 [ACK] Seq=487 Ack=858 Win=63488 Len=0 TSval=1308063403 TSecr=1498979198"
"49","2.247883698","146","f2:b8:19:81:77:bf","9e:5d:25:47:f6:9e","172.20.0.3","172.20.0.2","TLSv1.3","Change Cipher Spec, Application Data"
"50","2.247952765","66","f2:b8:19:81:77:bf","9e:5d:25:47:f6:9e","172.20.0.3","172.20.0.2","TCP","37040 → 4433 [RST, ACK] Seq=567 Ack=858 Win=64000 Len=0 TSval=1308063406 TSecr=1498979198"
"51","2.259581657","74","f2:b8:19:81:77:bf","9e:5d:25:47:f6:9e","172.20.0.3","172.20.0.2","TCP","37050 → 4433 [SYN] Seq=0 Win=64240 Len=0 MSS=1460 SACK_PERM TSval=1308063417 TSecr=0 WS=128"
"52","2.259608014","74","9e:5d:25:47:f6:9e","f2:b8:19:81:77:bf","172.20.0.2","172.20.0.3","TCP","4433 → 37050 [SYN, ACK] Seq=0 Ack=1 Win=65160 Len=0 MSS=1460 SACK_PERM TSval=1498979212 TSecr=1308063417 WS=128"
"53","2.259639497","66","f2:b8:19:81:77:bf","9e:5d:25:47:f6:9e","172.20.0.3","172.20.0.2","TCP","37050 → 4433 [ACK] Seq=1 Ack=1 Win=64256 Len=0 TSval=1308063418 TSecr=1498979212"
"54","2.259677500","552","f2:b8:19:81:77:bf","9e:5d:25:47:f6:9e","172.20.0.3","172.20.0.2","TLSv1.2","Client Hello"
"55","2.259682773","66","9e:5d:25:47:f6:9e","f2:b8:19:81:77:bf","172.20.0.2","172.20.0.3","TCP","4433 → 37050 [ACK] Seq=1 Ack=487 Win=64768 Len=0 TSval=1498979213 TSecr=1308063418"
"56","2.261749813","924","9e:5d:25:47:f6:9e","f2:b8:19:81:77:bf","172.20.0.2","172.20.0.3","TLSv1.3","Server Hello, Change Cipher Spec, Application Data, Application Data, Application Data, Application Data"
"57","2.261784323","66","f2:b8:19:81:77:bf","9e:5d:25:47:f6:9e","172.20.0.3","172.20.0.2","TCP","37050 → 4433 [ACK] Seq=487 Ack=859 Win=63488 Len=0 TSval=1308063420 TSecr=1498979215"
"58","2.264911558","146","f2:b8:19:81:77:bf","9e:5d:25:47:f6:9e","172.20.0.3","172.20.0.2","TLSv1.3","Change Cipher Spec, Application Data"
"59","2.264976474","66","f2:b8:19:81:77:bf","9e:5d:25:47:f6:9e","172.20.0.3","172.20.0.2","TCP","37050 → 4433 [RST, ACK] Seq=567 Ack=859 Win=64000 Len=0 TSval=1308063423 TSecr=1498979215"
"60","2.276236851","74","f2:b8:19:81:77:bf","9e:5d:25:47:f6:9e","172.20.0.3","172.20.0.2","TCP","37060 → 4433 [SYN] Seq=0 Win=64240 Len=0 MSS=1460 SACK_PERM TSval=1308063434 TSecr=0 WS=128"
"61","2.276260291","74","9e:5d:25:47:f6:9e","f2:b8:19:81:77:bf","172.20.0.2","172.20.0.3","TCP","4433 → 37060 [SYN, ACK] Seq=0 Ack=1 Win=65160 Len=0 MSS=1460 SACK_PERM TSval=1498979229 TSecr=1308063434 WS=128"
"62","2.276277934","66","f2:b8:19:81:77:bf","9e:5d:25:47:f6:9e","172.20.0.3","172.20.0.2","TCP","37060 → 4433 [ACK] Seq=1 Ack=1 Win=64256 Len=0 TSval=1308063434 TSecr=1498979229"
"63","2.276318457","552","f2:b8:19:81:77:bf","9e:5d:25:47:f6:9e","172.20.0.3","172.20.0.2","TLSv1.2","Client Hello"
"64","2.276323107","66","9e:5d:25:47:f6:9e","f2:b8:19:81:77:bf","172.20.0.2","172.20.0.3","TCP","4433 → 37060 [ACK] Seq=1 Ack=487 Win=64768 Len=0 TSval=1498979229 TSecr=1308063434"
"65","2.278586270","922","9e:5d:25:47:f6:9e","f2:b8:19:81:77:bf","172.20.0.2","172.20.0.3","TLSv1.3","Server Hello, Change Cipher Spec, Application Data, Application Data, Application Data, Application Data"
"66","2.278643421","66","f2:b8:19:81:77:bf","9e:5d:25:47:f6:9e","172.20.0.3","172.20.0.2","TCP","37060 → 4433 [ACK] Seq=487 Ack=857 Win=63488 Len=0 TSval=1308063436 TSecr=1498979231"
"67","2.281501558","146","f2:b8:19:81:77:bf","9e:5d:25:47:f6:9e","172.20.0.3","172.20.0.2","TLSv1.3","Change Cipher Spec, Application Data"
"68","2.281574365","66","f2:b8:19:81:77:bf","9e:5d:25:47:f6:9e","172.20.0.3","172.20.0.2","TCP","37060 → 4433 [RST, ACK] Seq=567 Ack=857 Win=64000 Len=0 TSval=1308063439 TSecr=1498979231"
"69","2.292636771","74","f2:b8:19:81:77:bf","9e:5d:25:47:f6:9e","172.20.0.3","172.20.0.2","TCP","37066 → 4433 [SYN] Seq=0 Win=64240 Len=0 MSS=1460 SACK_PERM TSval=1308063450 TSecr=0 WS=128"
"70","2.292664407","74","9e:5d:25:47:f6:9e","f2:b8:19:81:77:bf","172.20.0.2","172.20.0.3","TCP","4433 → 37066 [SYN, ACK] Seq=0 Ack=1 Win=65160 Len=0 MSS=1460 SACK_PERM TSval=1498979246 TSecr=1308063450 WS=128"
"71","2.292684046","66","f2:b8:19:81:77:bf","9e:5d:25:47:f6:9e","172.20.0.3","172.20.0.2","TCP","37066 → 4433 [ACK] Seq=1 Ack=1 Win=64256 Len=0 TSval=1308063451 TSecr=1498979246"
"72","2.292726134","552","f2:b8:19:81:77:bf","9e:5d:25:47:f6:9e","172.20.0.3","172.20.0.2","TLSv1.2","Client Hello"
"73","2.292730583","66","9e:5d:25:47:f6:9e","f2:b8:19:81:77:bf","172.20.0.2","172.20.0.3","TCP","4433 → 37066 [ACK] Seq=1 Ack=487 Win=64768 Len=0 TSval=1498979246 TSecr=1308063451"
"74","2.294824462","923","9e:5d:25:47:f6:9e","f2:b8:19:81:77:bf","172.20.0.2","172.20.0.3","TLSv1.3","Server Hello, Change Cipher Spec, Application Data, Application Data, Application Data, Application Data"
"75","2.294857614","66","f2:b8:19:81:77:bf","9e:5d:25:47:f6:9e","172.20.0.3","172.20.0.2","TCP","37066 → 4433 [ACK] Seq=487 Ack=858 Win=63488 Len=0 TSval=1308063453 TSecr=1498979248"
"76","2.297539402","146","f2:b8:19:81:77:bf","9e:5d:25:47:f6:9e","172.20.0.3","172.20.0.2","TLSv1.3","Change Cipher Spec, Application Data"
"77","2.297594629","66","f2:b8:19:81:77:bf","9e:5d:25:47:f6:9e","172.20.0.3","172.20.0.2","TCP","37066 → 4433 [RST, ACK] Seq=567 Ack=858 Win=64000 Len=0 TSval=1308063455 TSecr=1498979248"
"78","2.308957116","74","f2:b8:19:81:77:bf","9e:5d:25:47:f6:9e","172.20.0.3","172.20.0.2","TCP","37082 → 4433 [SYN] Seq=0 Win=64240 Len=0 MSS=1460 SACK_PERM TSval=1308063467 TSecr=0 WS=128"
"79","2.308981986","74","9e:5d:25:47:f6:9e","f2:b8:19:81:77:bf","172.20.0.2","172.20.0.3","TCP","4433 → 37082 [SYN, ACK] Seq=0 Ack=1 Win=65160 Len=0 MSS=1460 SACK_PERM TSval=1498979262 TSecr=1308063467 WS=128"
"80","2.308998693","66","f2:b8:19:81:77:bf","9e:5d:25:47:f6:9e","172.20.0.3","172.20.0.2","TCP","37082 → 4433 [ACK] Seq=1 Ack=1 Win=64256 Len=0 TSval=1308063467 TSecr=1498979262"
"81","2.309042570","552","f2:b8:19:81:77:bf","9e:5d:25:47:f6:9e","172.20.0.3","172.20.0.2","TLSv1.2","Client Hello"
"82","2.309046903","66","9e:5d:25:47:f6:9e","f2:b8:19:81:77:bf","172.20.0.2","172.20.0.3","TCP","4433 → 37082 [ACK] Seq=1 Ack=487 Win=64768 Len=0 TSval=1498979262 TSecr=1308063467"
"83","2.311150934","923","9e:5d:25:47:f6:9e","f2:b8:19:81:77:bf","172.20.0.2","172.20.0.3","TLSv1.3","Server Hello, Change Cipher Spec, Application Data, Application Data, Application Data, Application Data"
"84","2.311185181","66","f2:b8:19:81:77:bf","9e:5d:25:47:f6:9e","172.20.0.3","172.20.0.2","TCP","37082 → 4433 [ACK] Seq=487 Ack=858 Win=63488 Len=0 TSval=1308063469 TSecr=1498979264"
"85","2.313897470","146","f2:b8:19:81:77:bf","9e:5d:25:47:f6:9e","172.20.0.3","172.20.0.2","TLSv1.3","Change Cipher Spec, Application Data"
"86","2.313961238","66","f2:b8:19:81:77:bf","9e:5d:25:47:f6:9e","172.20.0.3","172.20.0.2","TCP","37082 → 4433 [RST, ACK] Seq=567 Ack=858 Win=64000 Len=0 TSval=1308063472 TSecr=1498979264"
"87","2.324917290","74","f2:b8:19:81:77:bf","9e:5d:25:47:f6:9e","172.20.0.3","172.20.0.2","TCP","37092 → 4433 [SYN] Seq=0 Win=64240 Len=0 MSS=1460 SACK_PERM TSval=1308063483 TSecr=0 WS=128"
"88","2.324939651","74","9e:5d:25:47:f6:9e","f2:b8:19:81:77:bf","172.20.0.2","172.20.0.3","TCP","4433 → 37092 [SYN, ACK] Seq=0 Ack=1 Win=65160 Len=0 MSS=1460 SACK_PERM TSval=1498979278 TSecr=1308063483 WS=128"
"89","2.324954920","66","f2:b8:19:81:77:bf","9e:5d:25:47:f6:9e","172.20.0.3","172.20.0.2","TCP","37092 → 4433 [ACK] Seq=1 Ack=1 Win=64256 Len=0 TSval=1308063483 TSecr=1498979278"
"90","2.324998937","552","f2:b8:19:81:77:bf","9e:5d:25:47:f6:9e","172.20.0.3","172.20.0.2","TLSv1.2","Client Hello"
"91","2.325003708","66","9e:5d:25:47:f6:9e","f2:b8:19:81:77:bf","172.20.0.2","172.20.0.3","TCP","4433 → 37092 [ACK] Seq=1 Ack=487 Win=64768 Len=0 TSval=1498979278 TSecr=1308063483"
"92","2.326903906","924","9e:5d:25:47:f6:9e","f2:b8:19:81:77:bf","172.20.0.2","172.20.0.3","TLSv1.3","Server Hello, Change Cipher Spec, Application Data, Application Data, Application Data, Application Data"
"93","2.326933118","66","f2:b8:19:81:77:bf","9e:5d:25:47:f6:9e","172.20.0.3","172.20.0.2","TCP","37092 → 4433 [ACK] Seq=487 Ack=859 Win=63488 Len=0 TSval=1308063485 TSecr=1498979280"
"94","2.329693255","146","f2:b8:19:81:77:bf","9e:5d:25:47:f6:9e","172.20.0.3","172.20.0.2","TLSv1.3","Change Cipher Spec, Application Data"
"95","2.329755163","66","f2:b8:19:81:77:bf","9e:5d:25:47:f6:9e","172.20.0.3","172.20.0.2","TCP","37092 → 4433 [RST, ACK] Seq=567 Ack=859 Win=64000 Len=0 TSval=1308063488 TSecr=1498979280"
"96","2.340809073","74","f2:b8:19:81:77:bf","9e:5d:25:47:f6:9e","172.20.0.3","172.20.0.2","TCP","37102 → 4433 [SYN] Seq=0 Win=64240 Len=0 MSS=1460 SACK_PERM TSval=1308063499 TSecr=0 WS=128"
"97","2.340834924","74","9e:5d:25:47:f6:9e","f2:b8:19:81:77:bf","172.20.0.2","172.20.0.3","TCP","4433 → 37102 [SYN, ACK] Seq=0 Ack=1 Win=65160 Len=0 MSS=1460 SACK_PERM TSval=1498979294 TSecr=1308063499 WS=128"
"98","2.340854438","66","f2:b8:19:81:77:bf","9e:5d:25:47:f6:9e","172.20.0.3","172.20.0.2","TCP","37102 → 4433 [ACK] Seq=1 Ack=1 Win=64256 Len=0 TSval=1308063499 TSecr=1498979294"
"99","2.340904371","552","f2:b8:19:81:77:bf","9e:5d:25:47:f6:9e","172.20.0.3","172.20.0.2","TLSv1.2","Client Hello"
"100","2.340909015","66","9e:5d:25:47:f6:9e","f2:b8:19:81:77:bf","172.20.0.2","172.20.0.3","TCP","4433 → 37102 [ACK] Seq=1 Ack=487 Win=64768 Len=0 TSval=1498979294 TSecr=1308063499"
"101","2.342930177","922","9e:5d:25:47:f6:9e","f2:b8:19:81:77:bf","172.20.0.2","172.20.0.3","TLSv1.3","Server Hello, Change Cipher Spec, Application Data, Application Data, Application Data, Application Data"
"102","2.342960794","66","f2:b8:19:81:77:bf","9e:5d:25:47:f6:9e","172.20.0.3","172.20.0.2","TCP","37102 → 4433 [ACK] Seq=487 Ack=857 Win=63488 Len=0 TSval=1308063501 TSecr=1498979296"
"103","2.345674059","146","f2:b8:19:81:77:bf","9e:5d:25:47:f6:9e","172.20.0.3","172.20.0.2","TLSv1.3","Change Cipher Spec, Application Data"
"104","2.345740439","66","f2:b8:19:81:77:bf","9e:5d:25:47:f6:9e","172.20.0.3","172.20.0.2","TCP","37102 → 4433 [RST, ACK] Seq=567 Ack=857 Win=64000 Len=0 TSval=1308063504 TSecr=1498979296"
"105","2.357636838","74","f2:b8:19:81:77:bf","9e:5d:25:47:f6:9e","172.20.0.3","172.20.0.2","TCP","37104 → 4433 [SYN] Seq=0 Win=64240 Len=0 MSS=1460 SACK_PERM TSval=1308063515 TSecr=0 WS=128"
"106","2.357659708","74","9e:5d:25:47:f6:9e","f2:b8:19:81:77:bf","172.20.0.2","172.20.0.3","TCP","4433 → 37104 [SYN, ACK] Seq=0 Ack=1 Win=65160 Len=0 MSS=1460 SACK_PERM TSval=1498979311 TSecr=1308063515 WS=128"
"107","2.357676510","66","f2:b8:19:81:77:bf","9e:5d:25:47:f6:9e","172.20.0.3","172.20.0.2","TCP","37104 → 4433 [ACK] Seq=1 Ack=1 Win=64256 Len=0 TSval=1308063516 TSecr=1498979311"
"108","2.357719761","552","f2:b8:19:81:77:bf","9e:5d:25:47:f6:9e","172.20.0.3","172.20.0.2","TLSv1.2","Client Hello"
"109","2.357724159","66","9e:5d:25:47:f6:9e","f2:b8:19:81:77:bf","172.20.0.2","172.20.0.3","TCP","4433 → 37104 [ACK] Seq=1 Ack=487 Win=64768 Len=0 TSval=1498979311 TSecr=1308063516"
"110","2.359681879","923","9e:5d:25:47:f6:9e","f2:b8:19:81:77:bf","172.20.0.2","172.20.0.3","TLSv1.3","Server Hello, Change Cipher Spec, Application Data, Application Data, Application Data, Application Data"
"111","2.359711059","66","f2:b8:19:81:77:bf","9e:5d:25:47:f6:9e","172.20.0.3","172.20.0.2","TCP","37104 → 4433 [ACK] Seq=487 Ack=858 Win=63488 Len=0 TSval=1308063518 TSecr=1498979313"
"112","2.362736705","146","f2:b8:19:81:77:bf","9e:5d:25:47:f6:9e","172.20.0.3","172.20.0.2","TLSv1.3","Change Cipher Spec, Application Data"
"113","2.362818146","66","f2:b8:19:81:77:bf","9e:5d:25:47:f6:9e","172.20.0.3","172.20.0.2","TCP","37104 → 4433 [RST, ACK] Seq=567 Ack=858 Win=64000 Len=0 TSval=1308063521 TSecr=1498979313"
"114","2.373553856","74","f2:b8:19:81:77:bf","9e:5d:25:47:f6:9e","172.20.0.3","172.20.0.2","TCP","37106 → 4433 [SYN] Seq=0 Win=64240 Len=0 MSS=1460 SACK_PERM TSval=1308063531 TSecr=0 WS=128"
"115","2.373574102","74","9e:5d:25:47:f6:9e","f2:b8:19:81:77:bf","172.20.0.2","172.20.0.3","TCP","4433 → 37106 [SYN, ACK] Seq=0 Ack=1 Win=65160 Len=0 MSS=1460 SACK_PERM TSval=1498979326 TSecr=1308063531 WS=128"
"116","2.373590903","66","f2:b8:19:81:77:bf","9e:5d:25:47:f6:9e","172.20.0.3","172.20.0.2","TCP","37106 → 4433 [ACK] Seq=1 Ack=1 Win=64256 Len=0 TSval=1308063531 TSecr=1498979326"
"117","2.373656808","552","f2:b8:19:81:77:bf","9e:5d:25:47:f6:9e","172.20.0.3","172.20.0.2","TLSv1.2","Client Hello"
"118","2.373661980","66","9e:5d:25:47:f6:9e","f2:b8:19:81:77:bf","172.20.0.2","172.20.0.3","TCP","4433 → 37106 [ACK] Seq=1 Ack=487 Win=64768 Len=0 TSval=1498979327 TSecr=1308063532"
"119","2.375581632","922","9e:5d:25:47:f6:9e","f2:b8:19:81:77:bf","172.20.0.2","172.20.0.3","TLSv1.3","Server Hello, Change Cipher Spec, Application Data, Application Data, Application Data, Application Data"
"120","2.375623291","66","f2:b8:19:81:77:bf","9e:5d:25:47:f6:9e","172.20.0.3","172.20.0.2","TCP","37106 → 4433 [ACK] Seq=487 Ack=857 Win=63488 Len=0 TSval=1308063533 TSecr=1498979328"
"121","2.378224436","146","f2:b8:19:81:77:bf","9e:5d:25:47:f6:9e","172.20.0.3","172.20.0.2","TLSv1.3","Change Cipher Spec, Application Data"
"122","2.378279468","66","f2:b8:19:81:77:bf","9e:5d:25:47:f6:9e","172.20.0.3","172.20.0.2","TCP","37106 → 4433 [RST, ACK] Seq=567 Ack=857 Win=64000 Len=0 TSval=1308063536 TSecr=1498979328"
"123","2.388952450","74","f2:b8:19:81:77:bf","9e:5d:25:47:f6:9e","172.20.0.3","172.20.0.2","TCP","37110 → 4433 [SYN] Seq=0 Win=64240 Len=0 MSS=1460 SACK_PERM TSval=1308063547 TSecr=0 WS=128"
"124","2.388973965","74","9e:5d:25:47:f6:9e","f2:b8:19:81:77:bf","172.20.0.2","172.20.0.3","TCP","4433 → 37110 [SYN, ACK] Seq=0 Ack=1 Win=65160 Len=0 MSS=1460 SACK_PERM TSval=1498979342 TSecr=1308063547 WS=128"
"125","2.388989189","66","f2:b8:19:81:77:bf","9e:5d:25:47:f6:9e","172.20.0.3","172.20.0.2","TCP","37110 → 4433 [ACK] Seq=1 Ack=1 Win=64256 Len=0 TSval=1308063547 TSecr=1498979342"
"126","2.389026511","552","f2:b8:19:81:77:bf","9e:5d:25:47:f6:9e","172.20.0.3","172.20.0.2","TLSv1.2","Client Hello"
"127","2.389042109","66","9e:5d:25:47:f6:9e","f2:b8:19:81:77:bf","172.20.0.2","172.20.0.3","TCP","4433 → 37110 [ACK] Seq=1 Ack=487 Win=64768 Len=0 TSval=1498979342 TSecr=1308063547"
"128","2.390987418","924","9e:5d:25:47:f6:9e","f2:b8:19:81:77:bf","172.20.0.2","172.20.0.3","TLSv1.3","Server Hello, Change Cipher Spec, Application Data, Application Data, Application Data, Application Data"
"129","2.391014959","66","f2:b8:19:81:77:bf","9e:5d:25:47:f6:9e","172.20.0.3","172.20.0.2","TCP","37110 → 4433 [ACK] Seq=487 Ack=859 Win=63488 Len=0 TSval=1308063549 TSecr=1498979344"
"130","2.393676456","146","f2:b8:19:81:77:bf","9e:5d:25:47:f6:9e","172.20.0.3","172.20.0.2","TLSv1.3","Change Cipher Spec, Application Data"
"131","2.393742578","66","f2:b8:19:81:77:bf","9e:5d:25:47:f6:9e","172.20.0.3","172.20.0.2","TCP","37110 → 4433 [RST, ACK] Seq=567 Ack=859 Win=64000 Len=0 TSval=1308063552 TSecr=1498979344"
"132","2.404189240","74","f2:b8:19:81:77:bf","9e:5d:25:47:f6:9e","172.20.0.3","172.20.0.2","TCP","37118 → 4433 [SYN] Seq=0 Win=64240 Len=0 MSS=1460 SACK_PERM TSval=1308063562 TSecr=0 WS=128"
"133","2.404208398","74","9e:5d:25:47:f6:9e","f2:b8:19:81:77:bf","172.20.0.2","172.20.0.3","TCP","4433 → 37118 [SYN, ACK] Seq=0 Ack=1 Win=65160 Len=0 MSS=1460 SACK_PERM TSval=1498979357 TSecr=1308063562 WS=128"
"134","2.404222704","66","f2:b8:19:81:77:bf","9e:5d:25:47:f6:9e","172.20.0.3","172.20.0.2","TCP","37118 → 4433 [ACK] Seq=1 Ack=1 Win=64256 Len=0 TSval=1308063562 TSecr=1498979357"
"135","2.404256927","552","f2:b8:19:81:77:bf","9e:5d:25:47:f6:9e","172.20.0.3","172.20.0.2","TLSv1.2","Client Hello"
"136","2.404261436","66","9e:5d:25:47:f6:9e","f2:b8:19:81:77:bf","172.20.0.2","172.20.0.3","TCP","4433 → 37118 [ACK] Seq=1 Ack=487 Win=64768 Len=0 TSval=1498979357 TSecr=1308063562"
"137","2.406182353","923","9e:5d:25:47:f6:9e","f2:b8:19:81:77:bf","172.20.0.2","172.20.0.3","TLSv1.3","Server Hello, Change Cipher Spec, Application Data, Application Data, Application Data, Application Data"
"138","2.406211821","66","f2:b8:19:81:77:bf","9e:5d:25:47:f6:9e","172.20.0.3","172.20.0.2","TCP","37118 → 4433 [ACK] Seq=487 Ack=858 Win=63488 Len=0 TSval=1308063564 TSecr=1498979359"
"139","2.408831772","146","f2:b8:19:81:77:bf","9e:5d:25:47:f6:9e","172.20.0.3","172.20.0.2","TLSv1.3","Change Cipher Spec, Application Data"
"140","2.408886763","66","f2:b8:19:81:77:bf","9e:5d:25:47:f6:9e","172.20.0.3","172.20.0.2","TCP","37118 → 4433 [RST, ACK] Seq=567 Ack=858 Win=64000 Len=0 TSval=1308063567 TSecr=1498979359"
"141","2.419443120","74","f2:b8:19:81:77:bf","9e:5d:25:47:f6:9e","172.20.0.3","172.20.0.2","TCP","37126 → 4433 [SYN] Seq=0 Win=64240 Len=0 MSS=1460 SACK_PERM TSval=1308063577 TSecr=0 WS=128"
"142","2.419470438","74","9e:5d:25:47:f6:9e","f2:b8:19:81:77:bf","172.20.0.2","172.20.0.3","TCP","4433 → 37126 [SYN, ACK] Seq=0 Ack=1 Win=65160 Len=0 MSS=1460 SACK_PERM TSval=1498979372 TSecr=1308063577 WS=128"
"143","2.419487294","66","f2:b8:19:81:77:bf","9e:5d:25:47:f6:9e","172.20.0.3","172.20.0.2","TCP","37126 → 4433 [ACK] Seq=1 Ack=1 Win=64256 Len=0 TSval=1308063577 TSecr=1498979372"
"144","2.419546251","552","f2:b8:19:81:77:bf","9e:5d:25:47:f6:9e","172.20.0.3","172.20.0.2","TLSv1.2","Client Hello"
"145","2.419550271","66","9e:5d:25:47:f6:9e","f2:b8:19:81:77:bf","172.20.0.2","172.20.0.3","TCP","4433 → 37126 [ACK] Seq=1 Ack=487 Win=64768 Len=0 TSval=1498979372 TSecr=1308063577"
"146","2.421475211","923","9e:5d:25:47:f6:9e","f2:b8:19:81:77:bf","172.20.0.2","172.20.0.3","TLSv1.3","Server Hello, Change Cipher Spec, Application Data, Application Data, Application Data, Application Data"
"147","2.421519278","66","f2:b8:19:81:77:bf","9e:5d:25:47:f6:9e","172.20.0.3","172.20.0.2","TCP","37126 → 4433 [ACK] Seq=487 Ack=858 Win=63488 Len=0 TSval=1308063579 TSecr=1498979374"
"148","2.424241979","146","f2:b8:19:81:77:bf","9e:5d:25:47:f6:9e","172.20.0.3","172.20.0.2","TLSv1.3","Change Cipher Spec, Application Data"
"149","2.424305873","66","f2:b8:19:81:77:bf","9e:5d:25:47:f6:9e","172.20.0.3","172.20.0.2","TCP","37126 → 4433 [RST, ACK] Seq=567 Ack=858 Win=64000 Len=0 TSval=1308063582 TSecr=1498979374"
"150","2.435328692","74","f2:b8:19:81:77:bf","9e:5d:25:47:f6:9e","172.20.0.3","172.20.0.2","TCP","37130 → 4433 [SYN] Seq=0 Win=64240 Len=0 MSS=1460 SACK_PERM TSval=1308063593 TSecr=0 WS=128"
"151","2.435350373","74","9e:5d:25:47:f6:9e","f2:b8:19:81:77:bf","172.20.0.2","172.20.0.3","TCP","4433 → 37130 [SYN, ACK] Seq=0 Ack=1 Win=65160 Len=0 MSS=1460 SACK_PERM TSval=1498979388 TSecr=1308063593 WS=128"
"152","2.435366358","66","f2:b8:19:81:77:bf","9e:5d:25:47:f6:9e","172.20.0.3","172.20.0.2","TCP","37130 → 4433 [ACK] Seq=1 Ack=1 Win=64256 Len=0 TSval=1308063593 TSecr=1498979388"
"153","2.435403494","552","f2:b8:19:81:77:bf","9e:5d:25:47:f6:9e","172.20.0.3","172.20.0.2","TLSv1.2","Client Hello"
"154","2.435407178","66","9e:5d:25:47:f6:9e","f2:b8:19:81:77:bf","172.20.0.2","172.20.0.3","TCP","4433 → 37130 [ACK] Seq=1 Ack=487 Win=64768 Len=0 TSval=1498979388 TSecr=1308063593"
"155","2.438088051","923","9e:5d:25:47:f6:9e","f2:b8:19:81:77:bf","172.20.0.2","172.20.0.3","TLSv1.3","Server Hello, Change Cipher Spec, Application Data, Application Data, Application Data, Application Data"
"156","2.438120248","66","f2:b8:19:81:77:bf","9e:5d:25:47:f6:9e","172.20.0.3","172.20.0.2","TCP","37130 → 4433 [ACK] Seq=487 Ack=858 Win=63488 Len=0 TSval=1308063596 TSecr=1498979391"
"157","2.440858520","146","f2:b8:19:81:77:bf","9e:5d:25:47:f6:9e","172.20.0.3","172.20.0.2","TLSv1.3","Change Cipher Spec, Application Data"
"158","2.440928300","66","f2:b8:19:81:77:bf","9e:5d:25:47:f6:9e","172.20.0.3","172.20.0.2","TCP","37130 → 4433 [RST, ACK] Seq=567 Ack=858 Win=64000 Len=0 TSval=1308063599 TSecr=1498979391"
"159","2.451533972","74","f2:b8:19:81:77:bf","9e:5d:25:47:f6:9e","172.20.0.3","172.20.0.2","TCP","37144 → 4433 [SYN] Seq=0 Win=64240 Len=0 MSS=1460 SACK_PERM TSval=1308063609 TSecr=0 WS=128"
"160","2.451557123","74","9e:5d:25:47:f6:9e","f2:b8:19:81:77:bf","172.20.0.2","172.20.0.3","TCP","4433 → 37144 [SYN, ACK] Seq=0 Ack=1 Win=65160 Len=0 MSS=1460 SACK_PERM TSval=1498979404 TSecr=1308063609 WS=128"
"161","2.451573358","66","f2:b8:19:81:77:bf","9e:5d:25:47:f6:9e","172.20.0.3","172.20.0.2","TCP","37144 → 4433 [ACK] Seq=1 Ack=1 Win=64256 Len=0 TSval=1308063609 TSecr=1498979404"
"162","2.451622189","552","f2:b8:19:81:77:bf","9e:5d:25:47:f6:9e","172.20.0.3","172.20.0.2","TLSv1.2","Client Hello"
"163","2.451627158","66","9e:5d:25:47:f6:9e","f2:b8:19:81:77:bf","172.20.0.2","172.20.0.3","TCP","4433 → 37144 [ACK] Seq=1 Ack=487 Win=64768 Len=0 TSval=1498979405 TSecr=1308063610"
"164","2.453510917","923","9e:5d:25:47:f6:9e","f2:b8:19:81:77:bf","172.20.0.2","172.20.0.3","TLSv1.3","Server Hello, Change Cipher Spec, Application Data, Application Data, Application Data, Application Data"
"165","2.453546625","66","f2:b8:19:81:77:bf","9e:5d:25:47:f6:9e","172.20.0.3","172.20.0.2","TCP","37144 → 4433 [ACK] Seq=487 Ack=858 Win=63488 Len=0 TSval=1308063611 TSecr=1498979406"
"166","2.456290531","146","f2:b8:19:81:77:bf","9e:5d:25:47:f6:9e","172.20.0.3","172.20.0.2","TLSv1.3","Change Cipher Spec, Application Data"
"167","2.456343007","66","f2:b8:19:81:77:bf","9e:5d:25:47:f6:9e","172.20.0.3","172.20.0.2","TCP","37144 → 4433 [RST, ACK] Seq=567 Ack=858 Win=64000 Len=0 TSval=1308063614 TSecr=1498979406"
"168","2.467002241","74","f2:b8:19:81:77:bf","9e:5d:25:47:f6:9e","172.20.0.3","172.20.0.2","TCP","37154 → 4433 [SYN] Seq=0 Win=64240 Len=0 MSS=1460 SACK_PERM TSval=1308063625 TSecr=0 WS=128"
"169","2.467024856","74","9e:5d:25:47:f6:9e","f2:b8:19:81:77:bf","172.20.0.2","172.20.0.3","TCP","4433 → 37154 [SYN, ACK] Seq=0 Ack=1 Win=65160 Len=0 MSS=1460 SACK_PERM TSval=1498979420 TSecr=1308063625 WS=128"
"170","2.467042094","66","f2:b8:19:81:77:bf","9e:5d:25:47:f6:9e","172.20.0.3","172.20.0.2","TCP","37154 → 4433 [ACK] Seq=1 Ack=1 Win=64256 Len=0 TSval=1308063625 TSecr=1498979420"
"171","2.467082814","552","f2:b8:19:81:77:bf","9e:5d:25:47:f6:9e","172.20.0.3","172.20.0.2","TLSv1.2","Client Hello"
"172","2.467087392","66","9e:5d:25:47:f6:9e","f2:b8:19:81:77:bf","172.20.0.2","172.20.0.3","TCP","4433 → 37154 [ACK] Seq=1 Ack=487 Win=64768 Len=0 TSval=1498979420 TSecr=1308063625"
"173","2.470462434","923","9e:5d:25:47:f6:9e","f2:b8:19:81:77:bf","172.20.0.2","172.20.0.3","TLSv1.3","Server Hello, Change Cipher Spec, Application Data, Application Data, Application Data, Application Data"
"174","2.470503866","66","f2:b8:19:81:77:bf","9e:5d:25:47:f6:9e","172.20.0.3","172.20.0.2","TCP","37154 → 4433 [ACK] Seq=487 Ack=858 Win=63488 Len=0 TSval=1308063628 TSecr=1498979423"
"175","2.473587769","146","f2:b8:19:81:77:bf","9e:5d:25:47:f6:9e","172.20.0.3","172.20.0.2","TLSv1.3","Change Cipher Spec, Application Data"
"176","2.473659669","66","f2:b8:19:81:77:bf","9e:5d:25:47:f6:9e","172.20.0.3","172.20.0.2","TCP","37154 → 4433 [RST, ACK] Seq=567 Ack=858 Win=64000 Len=0 TSval=1308063632 TSecr=1498979423"
"177","2.484247924","74","f2:b8:19:81:77:bf","9e:5d:25:47:f6:9e","172.20.0.3","172.20.0.2","TCP","37166 → 4433 [SYN] Seq=0 Win=64240 Len=0 MSS=1460 SACK_PERM TSval=1308063642 TSecr=0 WS=128"
"178","2.484276064","74","9e:5d:25:47:f6:9e","f2:b8:19:81:77:bf","172.20.0.2","172.20.0.3","TCP","4433 → 37166 [SYN, ACK] Seq=0 Ack=1 Win=65160 Len=0 MSS=1460 SACK_PERM TSval=1498979437 TSecr=1308063642 WS=128"
"179","2.484294328","66","f2:b8:19:81:77:bf","9e:5d:25:47:f6:9e","172.20.0.3","172.20.0.2","TCP","37166 → 4433 [ACK] Seq=1 Ack=1 Win=64256 Len=0 TSval=1308063642 TSecr=1498979437"
"180","2.484347438","552","f2:b8:19:81:77:bf","9e:5d:25:47:f6:9e","172.20.0.3","172.20.0.2","TLSv1.2","Client Hello"
"181","2.484353672","66","9e:5d:25:47:f6:9e","f2:b8:19:81:77:bf","172.20.0.2","172.20.0.3","TCP","4433 → 37166 [ACK] Seq=1 Ack=487 Win=64768 Len=0 TSval=1498979437 TSecr=1308063642"
"182","2.486245522","923","9e:5d:25:47:f6:9e","f2:b8:19:81:77:bf","172.20.0.2","172.20.0.3","TLSv1.3","Server Hello, Change Cipher Spec, Application Data, Application Data, Application Data, Application Data"
"183","2.486278490","66","f2:b8:19:81:77:bf","9e:5d:25:47:f6:9e","172.20.0.3","172.20.0.2","TCP","37166 → 4433 [ACK] Seq=487 Ack=858 Win=63488 Len=0 TSval=1308063644 TSecr=1498979439"
"184","2.489046089","146","f2:b8:19:81:77:bf","9e:5d:25:47:f6:9e","172.20.0.3","172.20.0.2","TLSv1.3","Change Cipher Spec, Application Data"
"185","2.489106140","66","f2:b8:19:81:77:bf","9e:5d:25:47:f6:9e","172.20.0.3","172.20.0.2","TCP","37166 → 4433 [RST, ACK] Seq=567 Ack=858 Win=64000 Len=0 TSval=1308063647 TSecr=1498979439"
"186","2.499843407","74","f2:b8:19:81:77:bf","9e:5d:25:47:f6:9e","172.20.0.3","172.20.0.2","TCP","37170 → 4433 [SYN] Seq=0 Win=64240 Len=0 MSS=1460 SACK_PERM TSval=1308063658 TSecr=0 WS=128"
"187","2.499863491","74","9e:5d:25:47:f6:9e","f2:b8:19:81:77:bf","172.20.0.2","172.20.0.3","TCP","4433 → 37170 [SYN, ACK] Seq=0 Ack=1 Win=65160 Len=0 MSS=1460 SACK_PERM TSval=1498979453 TSecr=1308063658 WS=128"
"188","2.499879454","66","f2:b8:19:81:77:bf","9e:5d:25:47:f6:9e","172.20.0.3","172.20.0.2","TCP","37170 → 4433 [ACK] Seq=1 Ack=1 Win=64256 Len=0 TSval=1308063658 TSecr=1498979453"
"189","2.499917969","552","f2:b8:19:81:77:bf","9e:5d:25:47:f6:9e","172.20.0.3","172.20.0.2","TLSv1.2","Client Hello"
"190","2.499922504","66","9e:5d:25:47:f6:9e","f2:b8:19:81:77:bf","172.20.0.2","172.20.0.3","TCP","4433 → 37170 [ACK] Seq=1 Ack=487 Win=64768 Len=0 TSval=1498979453 TSecr=1308063658"
"191","2.502006955","923","9e:5d:25:47:f6:9e","f2:b8:19:81:77:bf","172.20.0.2","172.20.0.3","TLSv1.3","Server Hello, Change Cipher Spec, Application Data, Application Data, Application Data, Application Data"
"192","2.502042416","66","f2:b8:19:81:77:bf","9e:5d:25:47:f6:9e","172.20.0.3","172.20.0.2","TCP","37170 → 4433 [ACK] Seq=487 Ack=858 Win=63488 Len=0 TSval=1308063660 TSecr=1498979455"
"193","2.504680470","146","f2:b8:19:81:77:bf","9e:5d:25:47:f6:9e","172.20.0.3","172.20.0.2","TLSv1.3","Change Cipher Spec, Application Data"
"194","2.504742315","66","f2:b8:19:81:77:bf","9e:5d:25:47:f6:9e","172.20.0.3","172.20.0.2","TCP","37170 → 4433 [RST, ACK] Seq=567 Ack=858 Win=64000 Len=0 TSval=1308063663 TSecr=1498979455"
"195","2.515370983","74","f2:b8:19:81:77:bf","9e:5d:25:47:f6:9e","172.20.0.3","172.20.0.2","TCP","37176 → 4433 [SYN] Seq=0 Win=64240 Len=0 MSS=1460 SACK_PERM TSval=1308063673 TSecr=0 WS=128"
"196","2.515392452","74","9e:5d:25:47:f6:9e","f2:b8:19:81:77:bf","172.20.0.2","172.20.0.3","TCP","4433 → 37176 [SYN, ACK] Seq=0 Ack=1 Win=65160 Len=0 MSS=1460 SACK_PERM TSval=1498979468 TSecr=1308063673 WS=128"
"197","2.515408679","66","f2:b8:19:81:77:bf","9e:5d:25:47:f6:9e","172.20.0.3","172.20.0.2","TCP","37176 → 4433 [ACK] Seq=1 Ack=1 Win=64256 Len=0 TSval=1308063673 TSecr=1498979468"
"198","2.515449916","552","f2:b8:19:81:77:bf","9e:5d:25:47:f6:9e","172.20.0.3","172.20.0.2","TLSv1.2","Client Hello"
"199","2.515454359","66","9e:5d:25:47:f6:9e","f2:b8:19:81:77:bf","172.20.0.2","172.20.0.3","TCP","4433 → 37176 [ACK] Seq=1 Ack=487 Win=64768 Len=0 TSval=1498979468 TSecr=1308063673"
"200","2.517693425","922","9e:5d:25:47:f6:9e","f2:b8:19:81:77:bf","172.20.0.2","172.20.0.3","TLSv1.3","Server Hello, Change Cipher Spec, Application Data, Application Data, Application Data, Application Data"
"201","2.517726336","66","f2:b8:19:81:77:bf","9e:5d:25:47:f6:9e","172.20.0.3","172.20.0.2","TCP","37176 → 4433 [ACK] Seq=487 Ack=857 Win=63488 Len=0 TSval=1308063676 TSecr=1498979471"
"202","2.520368039","146","f2:b8:19:81:77:bf","9e:5d:25:47:f6:9e","172.20.0.3","172.20.0.2","TLSv1.3","Change Cipher Spec, Application Data"
"203","2.520424967","66","f2:b8:19:81:77:bf","9e:5d:25:47:f6:9e","172.20.0.3","172.20.0.2","TCP","37176 → 4433 [RST, ACK] Seq=567 Ack=857 Win=64000 Len=0 TSval=1308063678 TSecr=1498979471"
"204","2.532272114","74","f2:b8:19:81:77:bf","9e:5d:25:47:f6:9e","172.20.0.3","172.20.0.2","TCP","37192 → 4433 [SYN] Seq=0 Win=64240 Len=0 MSS=1460 SACK_PERM TSval=1308063690 TSecr=0 WS=128"
"205","2.532295496","74","9e:5d:25:47:f6:9e","f2:b8:19:81:77:bf","172.20.0.2","172.20.0.3","TCP","4433 → 37192 [SYN, ACK] Seq=0 Ack=1 Win=65160 Len=0 MSS=1460 SACK_PERM TSval=1498979485 TSecr=1308063690 WS=128"
"206","2.532311623","66","f2:b8:19:81:77:bf","9e:5d:25:47:f6:9e","172.20.0.3","172.20.0.2","TCP","37192 → 4433 [ACK] Seq=1 Ack=1 Win=64256 Len=0 TSval=1308063690 TSecr=1498979485"
"207","2.532353406","552","f2:b8:19:81:77:bf","9e:5d:25:47:f6:9e","172.20.0.3","172.20.0.2","TLSv1.2","Client Hello"
"208","2.532358729","66","9e:5d:25:47:f6:9e","f2:b8:19:81:77:bf","172.20.0.2","172.20.0.3","TCP","4433 → 37192 [ACK] Seq=1 Ack=487 Win=64768 Len=0 TSval=1498979485 TSecr=1308063690"
"209","2.535453068","923","9e:5d:25:47:f6:9e","f2:b8:19:81:77:bf","172.20.0.2","172.20.0.3","TLSv1.3","Server Hello, Change Cipher Spec, Application Data, Application Data, Application Data, Application Data"
"210","2.535508906","66","f2:b8:19:81:77:bf","9e:5d:25:47:f6:9e","172.20.0.3","172.20.0.2","TCP","37192 → 4433 [ACK] Seq=487 Ack=858 Win=63488 Len=0 TSval=1308063693 TSecr=1498979488"
"211","2.538654623","146","f2:b8:19:81:77:bf","9e:5d:25:47:f6:9e","172.20.0.3","172.20.0.2","TLSv1.3","Change Cipher Spec, Application Data"
"212","2.538726669","66","f2:b8:19:81:77:bf","9e:5d:25:47:f6:9e","172.20.0.3","172.20.0.2","TCP","37192 → 4433 [RST, ACK] Seq=567 Ack=858 Win=64000 Len=0 TSval=1308063697 TSecr=1498979488"
"213","2.549485448","74","f2:b8:19:81:77:bf","9e:5d:25:47:f6:9e","172.20.0.3","172.20.0.2","TCP","37200 → 4433 [SYN] Seq=0 Win=64240 Len=0 MSS=1460 SACK_PERM TSval=1308063707 TSecr=0 WS=128"
"214","2.549506172","74","9e:5d:25:47:f6:9e","f2:b8:19:81:77:bf","172.20.0.2","172.20.0.3","TCP","4433 → 37200 [SYN, ACK] Seq=0 Ack=1 Win=65160 Len=0 MSS=1460 SACK_PERM TSval=1498979502 TSecr=1308063707 WS=128"
"215","2.549527677","66","f2:b8:19:81:77:bf","9e:5d:25:47:f6:9e","172.20.0.3","172.20.0.2","TCP","37200 → 4433 [ACK] Seq=1 Ack=1 Win=64256 Len=0 TSval=1308063707 TSecr=1498979502"
"216","2.549574581","552","f2:b8:19:81:77:bf","9e:5d:25:47:f6:9e","172.20.0.3","172.20.0.2","TLSv1.2","Client Hello"
"217","2.549580499","66","9e:5d:25:47:f6:9e","f2:b8:19:81:77:bf","172.20.0.2","172.20.0.3","TCP","4433 → 37200 [ACK] Seq=1 Ack=487 Win=64768 Len=0 TSval=1498979502 TSecr=1308063707"
"218","2.553035759","923","9e:5d:25:47:f6:9e","f2:b8:19:81:77:bf","172.20.0.2","172.20.0.3","TLSv1.3","Server Hello, Change Cipher Spec, Application Data, Application Data, Application Data, Application Data"
"219","2.553082399","66","f2:b8:19:81:77:bf","9e:5d:25:47:f6:9e","172.20.0.3","172.20.0.2","TCP","37200 → 4433 [ACK] Seq=487 Ack=858 Win=63488 Len=0 TSval=1308063711 TSecr=1498979506"
"220","2.555810794","146","f2:b8:19:81:77:bf","9e:5d:25:47:f6:9e","172.20.0.3","172.20.0.2","TLSv1.3","Change Cipher Spec, Application Data"
"221","2.555869796","66","f2:b8:19:81:77:bf","9e:5d:25:47:f6:9e","172.20.0.3","172.20.0.2","TCP","37200 → 4433 [RST, ACK] Seq=567 Ack=858 Win=64000 Len=0 TSval=1308063714 TSecr=1498979506"
"222","2.566878494","74","f2:b8:19:81:77:bf","9e:5d:25:47:f6:9e","172.20.0.3","172.20.0.2","TCP","37210 → 4433 [SYN] Seq=0 Win=64240 Len=0 MSS=1460 SACK_PERM TSval=1308063725 TSecr=0 WS=128"
"223","2.566900058","74","9e:5d:25:47:f6:9e","f2:b8:19:81:77:bf","172.20.0.2","172.20.0.3","TCP","4433 → 37210 [SYN, ACK] Seq=0 Ack=1 Win=65160 Len=0 MSS=1460 SACK_PERM TSval=1498979520 TSecr=1308063725 WS=128"
