frame.number,frame.time_relative,frame.len,eth.src,eth.dst,ip.src,ip.dst,_ws.col.protocol,_ws.col.info
"1","0.000000000","42","d6:93:a5:c4:ba:67","ff:ff:ff:ff:ff:ff",,,"ARP","ARP Announcement for 172.20.0.3"
"2","0.029637118","42","d6:93:a5:c4:ba:67","ff:ff:ff:ff:ff:ff",,,"ARP","Who has 172.20.0.2? Tell 172.20.0.3"
"3","0.029664373","42","66:58:69:01:7e:05","d6:93:a5:c4:ba:67",,,"ARP","172.20.0.2 is at 66:58:69:01:7e:05"
"4","0.029675092","74","d6:93:a5:c4:ba:67","66:58:69:01:7e:05","172.20.0.3","172.20.0.2","TCP","40198 → 4433 [SYN] Seq=0 Win=64240 Len=0 MSS=1460 SACK_PERM TSval=1311537034 TSecr=0 WS=128"
"5","0.029697019","74","66:58:69:01:7e:05","d6:93:a5:c4:ba:67","172.20.0.2","172.20.0.3","TCP","4433 → 40198 [SYN, ACK] Seq=0 Ack=1 Win=65160 Len=0 MSS=1460 SACK_PERM TSval=1502452829 TSecr=1311537034 WS=128"
"6","0.029714631","66","d6:93:a5:c4:ba:67","66:58:69:01:7e:05","172.20.0.3","172.20.0.2","TCP","40198 → 4433 [ACK] Seq=1 Ack=1 Win=64256 Len=0 TSval=1311537034 TSecr=1502452829"
"7","0.029768987","1728","d6:93:a5:c4:ba:67","66:58:69:01:7e:05","172.20.0.3","172.20.0.2","TLSv1.2","Client Hello"
"8","0.029773810","66","66:58:69:01:7e:05","d6:93:a5:c4:ba:67","172.20.0.2","172.20.0.3","TCP","4433 → 40198 [ACK] Seq=1 Ack=1663 Win=64128 Len=0 TSval=1502452829 TSecr=1311537034"
"9","0.032897526","2012","66:58:69:01:7e:05","d6:93:a5:c4:ba:67","172.20.0.2","172.20.0.3","TLSv1.3","Server Hello, Change Cipher Spec, Application Data, Application Data, Application Data, Application Data"
"10","0.032938069","66","d6:93:a5:c4:ba:67","66:58:69:01:7e:05","172.20.0.3","172.20.0.2","TCP","40198 → 4433 [ACK] Seq=1663 Ack=1947 Win=64128 Len=0 TSval=1311537038 TSecr=1502452833"
"11","0.036032371","146","d6:93:a5:c4:ba:67","66:58:69:01:7e:05","172.20.0.3","172.20.0.2","TLSv1.3","Change Cipher Spec, Application Data"
"12","0.036090879","66","d6:93:a5:c4:ba:67","66:58:69:01:7e:05","172.20.0.3","172.20.0.2","TCP","40198 → 4433 [RST, ACK] Seq=1743 Ack=1947 Win=64128 Len=0 TSval=1311537041 TSecr=1502452833"
"13","0.046605977","74","d6:93:a5:c4:ba:67","66:58:69:01:7e:05","172.20.0.3","172.20.0.2","TCP","40204 → 4433 [SYN] Seq=0 Win=64240 Len=0 MSS=1460 SACK_PERM TSval=1311537051 TSecr=0 WS=128"
"14","0.046633084","74","66:58:69:01:7e:05","d6:93:a5:c4:ba:67","172.20.0.2","172.20.0.3","TCP","4433 → 40204 [SYN, ACK] Seq=0 Ack=1 Win=65160 Len=0 MSS=1460 SACK_PERM TSval=1502452846 TSecr=1311537051 WS=128"
"15","0.046651787","66","d6:93:a5:c4:ba:67","66:58:69:01:7e:05","172.20.0.3","172.20.0.2","TCP","40204 → 4433 [ACK] Seq=1 Ack=1 Win=64256 Len=0 TSval=1311537051 TSecr=1502452846"
"16","0.046693777","1728","d6:93:a5:c4:ba:67","66:58:69:01:7e:05","172.20.0.3","172.20.0.2","TLSv1.2","Client Hello"
"17","0.046699602","66","66:58:69:01:7e:05","d6:93:a5:c4:ba:67","172.20.0.2","172.20.0.3","TCP","4433 → 40204 [ACK] Seq=1 Ack=1663 Win=64128 Len=0 TSval=1502452846 TSecr=1311537051"
"18","0.049210120","2010","66:58:69:01:7e:05","d6:93:a5:c4:ba:67","172.20.0.2","172.20.0.3","TLSv1.3","Server Hello, Change Cipher Spec, Application Data, Application Data, Application Data, Application Data"
"19","0.049246812","66","d6:93:a5:c4:ba:67","66:58:69:01:7e:05","172.20.0.3","172.20.0.2","TCP","40204 → 4433 [ACK] Seq=1663 Ack=1945 Win=64128 Len=0 TSval=1311537054 TSecr=1502452849"
"20","0.052470237","146","d6:93:a5:c4:ba:67","66:58:69:01:7e:05","172.20.0.3","172.20.0.2","TLSv1.3","Change Cipher Spec, Application Data"
"21","0.052531427","66","d6:93:a5:c4:ba:67","66:58:69:01:7e:05","172.20.0.3","172.20.0.2","TCP","40204 → 4433 [RST, ACK] Seq=1743 Ack=1945 Win=64128 Len=0 TSval=1311537057 TSecr=1502452849"
"22","0.063176698","74","d6:93:a5:c4:ba:67","66:58:69:01:7e:05","172.20.0.3","172.20.0.2","TCP","40206 → 4433 [SYN] Seq=0 Win=64240 Len=0 MSS=1460 SACK_PERM TSval=1311537068 TSecr=0 WS=128"
"23","0.063201803","74","66:58:69:01:7e:05","d6:93:a5:c4:ba:67","172.20.0.2","172.20.0.3","TCP","4433 → 40206 [SYN, ACK] Seq=0 Ack=1 Win=65160 Len=0 MSS=1460 SACK_PERM TSval=1502452863 TSecr=1311537068 WS=128"
"24","0.063219137","66","d6:93:a5:c4:ba:67","66:58:69:01:7e:05","172.20.0.3","172.20.0.2","TCP","40206 → 4433 [ACK] Seq=1 Ack=1 Win=64256 Len=0 TSval=1311537068 TSecr=1502452863"
"25","0.063259185","1728","d6:93:a5:c4:ba:67","66:58:69:01:7e:05","172.20.0.3","172.20.0.2","TLSv1.2","Client Hello"
"26","0.063265218","66","66:58:69:01:7e:05","d6:93:a5:c4:ba:67","172.20.0.2","172.20.0.3","TCP","4433 → 40206 [ACK] Seq=1 Ack=1663 Win=64128 Len=0 TSval=1502452863 TSecr=1311537068"
"27","0.065664647","2011","66:58:69:01:7e:05","d6:93:a5:c4:ba:67","172.20.0.2","172.20.0.3","TLSv1.3","Server Hello, Change Cipher Spec, Application Data, Application Data, Application Data, Application Data"
"28","0.065692789","66","d6:93:a5:c4:ba:67","66:58:69:01:7e:05","172.20.0.3","172.20.0.2","TCP","40206 → 4433 [ACK] Seq=1663 Ack=1946 Win=64128 Len=0 TSval=1311537070 TSecr=1502452865"
"29","0.068807555","146","d6:93:a5:c4:ba:67","66:58:69:01:7e:05","172.20.0.3","172.20.0.2","TLSv1.3","Change Cipher Spec, Application Data"
"30","0.068873032","66","d6:93:a5:c4:ba:67","66:58:69:01:7e:05","172.20.0.3","172.20.0.2","TCP","40206 → 4433 [RST, ACK] Seq=1743 Ack=1946 Win=64128 Len=0 TSval=1311537074 TSecr=1502452865"
"31","0.079293206","74","d6:93:a5:c4:ba:67","66:58:69:01:7e:05","172.20.0.3","172.20.0.2","TCP","40218 → 4433 [SYN] Seq=0 Win=64240 Len=0 MSS=1460 SACK_PERM TSval=1311537084 TSecr=0 WS=128"
"32","0.079315337","74","66:58:69:01:7e:05","d6:93:a5:c4:ba:67","172.20.0.2","172.20.0.3","TCP","4433 → 40218 [SYN, ACK] Seq=0 Ack=1 Win=65160 Len=0 MSS=1460 SACK_PERM TSval=1502452879 TSecr=1311537084 WS=128"
"33","0.079331561","66","d6:93:a5:c4:ba:67","66:58:69:01:7e:05","172.20.0.3","172.20.0.2","TCP","40218 → 4433 [ACK] Seq=1 Ack=1 Win=64256 Len=0 TSval=1311537084 TSecr=1502452879"
"34","0.079380916","1728","d6:93:a5:c4:ba:67","66:58:69:01:7e:05","172.20.0.3","172.20.0.2","TLSv1.2","Client Hello"
"35","0.079387141","66","66:58:69:01:7e:05","d6:93:a5:c4:ba:67","172.20.0.2","172.20.0.3","TCP","4433 → 40218 [ACK] Seq=1 Ack=1663 Win=64128 Len=0 TSval=1502452879 TSecr=1311537084"
"36","0.081796340","2012","66:58:69:01:7e:05","d6:93:a5:c4:ba:67","172.20.0.2","172.20.0.3","TLSv1.3","Server Hello, Change Cipher Spec, Application Data, Application Data, Application Data, Application Data"
"37","0.081826577","66","d6:93:a5:c4:ba:67","66:58:69:01:7e:05","172.20.0.3","172.20.0.2","TCP","40218 → 4433 [ACK] Seq=1663 Ack=1947 Win=64128 Len=0 TSval=1311537086 TSecr=1502452881"
"38","0.084859783","146","d6:93:a5:c4:ba:67","66:58:69:01:7e:05","172.20.0.3","172.20.0.2","TLSv1.3","Change Cipher Spec, Application Data"
"39","0.084913335","66","d6:93:a5:c4:ba:67","66:58:69:01:7e:05","172.20.0.3","172.20.0.2","TCP","40218 → 4433 [RST, ACK] Seq=1743 Ack=1947 Win=64128 Len=0 TSval=1311537090 TSecr=1502452881"
"40","0.096139023","74","d6:93:a5:c4:ba:67","66:58:69:01:7e:05","172.20.0.3","172.20.0.2","TCP","40220 → 4433 [SYN] Seq=0 Win=64240 Len=0 MSS=1460 SACK_PERM TSval=1311537101 TSecr=0 WS=128"
"41","0.096161946","74","66:58:69:01:7e:05","d6:93:a5:c4:ba:67","172.20.0.2","172.20.0.3","TCP","4433 → 40220 [SYN, ACK] Seq=0 Ack=1 Win=65160 Len=0 MSS=1460 SACK_PERM TSval=1502452896 TSecr=1311537101 WS=128"
"42","0.096176981","66","d6:93:a5:c4:ba:67","66:58:69:01:7e:05","172.20.0.3","172.20.0.2","TCP","40220 → 4433 [ACK] Seq=1 Ack=1 Win=64256 Len=0 TSval=1311537101 TSecr=1502452896"
"43","0.096232028","1728","d6:93:a5:c4:ba:67","66:58:69:01:7e:05","172.20.0.3","172.20.0.2","TLSv1.2","Client Hello"
"44","0.096235851","66","66:58:69:01:7e:05","d6:93:a5:c4:ba:67","172.20.0.2","172.20.0.3","TCP","4433 → 40220 [ACK] Seq=1 Ack=1663 Win=64128 Len=0 TSval=1502452896 TSecr=1311537101"
"45","0.098820157","2010","66:58:69:01:7e:05","d6:93:a5:c4:ba:67","172.20.0.2","172.20.0.3","TLSv1.3","Server Hello, Change Cipher Spec, Application Data, Application Data, Application Data, Application Data"
"46","0.098862500","66","d6:93:a5:c4:ba:67","66:58:69:01:7e:05","172.20.0.3","172.20.0.2","TCP","40220 → 4433 [ACK] Seq=1663 Ack=1945 Win=64128 Len=0 TSval=1311537104 TSecr=1502452898"
"47","0.102116763","146","d6:93:a5:c4:ba:67","66:58:69:01:7e:05","172.20.0.3","172.20.0.2","TLSv1.3","Change Cipher Spec, Application Data"
"48","0.102181248","66","d6:93:a5:c4:ba:67","66:58:69:01:7e:05","172.20.0.3","172.20.0.2","TCP","40220 → 4433 [RST, ACK] Seq=1743 Ack=1945 Win=64128 Len=0 TSval=1311537107 TSecr=1502452898"
"49","0.116952142","74","d6:93:a5:c4:ba:67","66:58:69:01:7e:05","172.20.0.3","172.20.0.2","TCP","40234 → 4433 [SYN] Seq=0 Win=64240 Len=0 MSS=1460 SACK_PERM TSval=1311537122 TSecr=0 WS=128"
"50","0.116987347","74","66:58:69:01:7e:05","d6:93:a5:c4:ba:67","172.20.0.2","172.20.0.3","TCP","4433 → 40234 [SYN, ACK] Seq=0 Ack=1 Win=65160 Len=0 MSS=1460 SACK_PERM TSval=1502452917 TSecr=1311537122 WS=128"
"51","0.117012722","66","d6:93:a5:c4:ba:67","66:58:69:01:7e:05","172.20.0.3","172.20.0.2","TCP","40234 → 4433 [ACK] Seq=1 Ack=1 Win=64256 Len=0 TSval=1311537122 TSecr=1502452917"
"52","0.117068093","1728","d6:93:a5:c4:ba:67","66:58:69:01:7e:05","172.20.0.3","172.20.0.2","TLSv1.2","Client Hello"
"53","0.117076109","66","66:58:69:01:7e:05","d6:93:a5:c4:ba:67","172.20.0.2","172.20.0.3","TCP","4433 → 40234 [ACK] Seq=1 Ack=1663 Win=64128 Len=0 TSval=1502452917 TSecr=1311537122"
"54","0.119627373","2012","66:58:69:01:7e:05","d6:93:a5:c4:ba:67","172.20.0.2","172.20.0.3","TLSv1.3","Server Hello, Change Cipher Spec, Application Data, Application Data, Application Data, Application Data"
"55","0.119668707","66","d6:93:a5:c4:ba:67","66:58:69:01:7e:05","172.20.0.3","172.20.0.2","TCP","40234 → 4433 [ACK] Seq=1663 Ack=1947 Win=64128 Len=0 TSval=1311537124 TSecr=1502452919"
"56","0.124724252","146","d6:93:a5:c4:ba:67","66:58:69:01:7e:05","172.20.0.3","172.20.0.2","TLSv1.3","Change Cipher Spec, Application Data"
"57","0.124818695","66","d6:93:a5:c4:ba:67","66:58:69:01:7e:05","172.20.0.3","172.20.0.2","TCP","40234 → 4433 [RST, ACK] Seq=1743 Ack=1947 Win=64128 Len=0 TSval=1311537129 TSecr=1502452919"
"58","0.135977248","74","d6:93:a5:c4:ba:67","66:58:69:01:7e:05","172.20.0.3","172.20.0.2","TCP","40246 → 4433 [SYN] Seq=0 Win=64240 Len=0 MSS=1460 SACK_PERM TSval=1311537141 TSecr=0 WS=128"
"59","0.136001023","74","66:58:69:01:7e:05","d6:93:a5:c4:ba:67","172.20.0.2","172.20.0.3","TCP","4433 → 40246 [SYN, ACK] Seq=0 Ack=1 Win=65160 Len=0 MSS=1460 SACK_PERM TSval=1502452936 TSecr=1311537141 WS=128"
"60","0.136015935","66","d6:93:a5:c4:ba:67","66:58:69:01:7e:05","172.20.0.3","172.20.0.2","TCP","40246 → 4433 [ACK] Seq=1 Ack=1 Win=64256 Len=0 TSval=1311537141 TSecr=1502452936"
"61","0.136052026","1728","d6:93:a5:c4:ba:67","66:58:69:01:7e:05","172.20.0.3","172.20.0.2","TLSv1.2","Client Hello"
"62","0.136057072","66","66:58:69:01:7e:05","d6:93:a5:c4:ba:67","172.20.0.2","172.20.0.3","TCP","4433 → 40246 [ACK] Seq=1 Ack=1663 Win=64128 Len=0 TSval=1502452936 TSecr=1311537141"
"63","0.138505659","2011","66:58:69:01:7e:05","d6:93:a5:c4:ba:67","172.20.0.2","172.20.0.3","TLSv1.3","Server Hello, Change Cipher Spec, Application Data, Application Data, Application Data, Application Data"
"64","0.138535058","66","d6:93:a5:c4:ba:67","66:58:69:01:7e:05","172.20.0.3","172.20.0.2","TCP","40246 → 4433 [ACK] Seq=1663 Ack=1946 Win=64128 Len=0 TSval=1311537143 TSecr=1502452938"
"65","0.141619402","146","d6:93:a5:c4:ba:67","66:58:69:01:7e:05","172.20.0.3","172.20.0.2","TLSv1.3","Change Cipher Spec, Application Data"
"66","0.141676463","66","d6:93:a5:c4:ba:67","66:58:69:01:7e:05","172.20.0.3","172.20.0.2","TCP","40246 → 4433 [RST, ACK] Seq=1743 Ack=1946 Win=64128 Len=0 TSval=1311537146 TSecr=1502452938"
"67","0.152302224","74","d6:93:a5:c4:ba:67","66:58:69:01:7e:05","172.20.0.3","172.20.0.2","TCP","40250 → 4433 [SYN] Seq=0 Win=64240 Len=0 MSS=1460 SACK_PERM TSval=1311537157 TSecr=0 WS=128"
"68","0.152328239","74","66:58:69:01:7e:05","d6:93:a5:c4:ba:67","172.20.0.2","172.20.0.3","TCP","4433 → 40250 [SYN, ACK] Seq=0 Ack=1 Win=65160 Len=0 MSS=1460 SACK_PERM TSval=1502452952 TSecr=1311537157 WS=128"
"69","0.152344822","66","d6:93:a5:c4:ba:67","66:58:69:01:7e:05","172.20.0.3","172.20.0.2","TCP","40250 → 4433 [ACK] Seq=1 Ack=1 Win=64256 Len=0 TSval=1311537157 TSecr=1502452952"
"70","0.152384761","1728","d6:93:a5:c4:ba:67","66:58:69:01:7e:05","172.20.0.3","172.20.0.2","TLSv1.2","Client Hello"
"71","0.152390456","66","66:58:69:01:7e:05","d6:93:a5:c4:ba:67","172.20.0.2","172.20.0.3","TCP","4433 → 40250 [ACK] Seq=1 Ack=1663 Win=64128 Len=0 TSval=1502452952 TSecr=1311537157"
"72","0.154923056","2011","66:58:69:01:7e:05","d6:93:a5:c4:ba:67","172.20.0.2","172.20.0.3","TLSv1.3","Server Hello, Change Cipher Spec, Application Data, Application Data, Application Data, Application Data"
"73","0.154950438","66","d6:93:a5:c4:ba:67","66:58:69:01:7e:05","172.20.0.3","172.20.0.2","TCP","40250 → 4433 [ACK] Seq=1663 Ack=1946 Win=64128 Len=0 TSval=1311537160 TSecr=1502452955"
"74","0.158076839","146","d6:93:a5:c4:ba:67","66:58:69:01:7e:05","172.20.0.3","172.20.0.2","TLSv1.3","Change Cipher Spec, Application Data"
"75","0.158131229","66","d6:93:a5:c4:ba:67","66:58:69:01:7e:05","172.20.0.3","172.20.0.2","TCP","40250 → 4433 [RST, ACK] Seq=1743 Ack=1946 Win=64128 Len=0 TSval=1311537163 TSecr=1502452955"
"76","0.168641186","74","d6:93:a5:c4:ba:67","66:58:69:01:7e:05","172.20.0.3","172.20.0.2","TCP","40262 → 4433 [SYN] Seq=0 Win=64240 Len=0 MSS=1460 SACK_PERM TSval=1311537173 TSecr=0 WS=128"
"77","0.168663880","74","66:58:69:01:7e:05","d6:93:a5:c4:ba:67","172.20.0.2","172.20.0.3","TCP","4433 → 40262 [SYN, ACK] Seq=0 Ack=1 Win=65160 Len=0 MSS=1460 SACK_PERM TSval=1502452968 TSecr=1311537173 WS=128"
"78","0.168682850","66","d6:93:a5:c4:ba:67","66:58:69:01:7e:05","172.20.0.3","172.20.0.2","TCP","40262 → 4433 [ACK] Seq=1 Ack=1 Win=64256 Len=0 TSval=1311537173 TSecr=1502452968"
"79","0.168725043","1728","d6:93:a5:c4:ba:67","66:58:69:01:7e:05","172.20.0.3","172.20.0.2","TLSv1.2","Client Hello"
"80","0.168730477","66","66:58:69:01:7e:05","d6:93:a5:c4:ba:67","172.20.0.2","172.20.0.3","TCP","4433 → 40262 [ACK] Seq=1 Ack=1663 Win=64128 Len=0 TSval=1502452968 TSecr=1311537173"
"81","0.171148945","2011","66:58:69:01:7e:05","d6:93:a5:c4:ba:67","172.20.0.2","172.20.0.3","TLSv1.3","Server Hello, Change Cipher Spec, Application Data, Application Data, Application Data, Application Data"
"82","0.171176614","66","d6:93:a5:c4:ba:67","66:58:69:01:7e:05","172.20.0.3","172.20.0.2","TCP","40262 → 4433 [ACK] Seq=1663 Ack=1946 Win=64128 Len=0 TSval=1311537176 TSecr=1502452971"
"83","0.174261561","146","d6:93:a5:c4:ba:67","66:58:69:01:7e:05","172.20.0.3","172.20.0.2","TLSv1.3","Change Cipher Spec, Application Data"
"84","0.174321278","66","d6:93:a5:c4:ba:67","66:58:69:01:7e:05","172.20.0.3","172.20.0.2","TCP","40262 → 4433 [RST, ACK] Seq=1743 Ack=1946 Win=64128 Len=0 TSval=1311537179 TSecr=1502452971"
"85","0.184929847","74","d6:93:a5:c4:ba:67","66:58:69:01:7e:05","172.20.0.3","172.20.0.2","TCP","40266 → 4433 [SYN] Seq=0 Win=64240 Len=0 MSS=1460 SACK_PERM TSval=1311537190 TSecr=0 WS=128"
"86","0.184953717","74","66:58:69:01:7e:05","d6:93:a5:c4:ba:67","172.20.0.2","172.20.0.3","TCP","4433 → 40266 [SYN, ACK] Seq=0 Ack=1 Win=65160 Len=0 MSS=1460 SACK_PERM TSval=1502452985 TSecr=1311537190 WS=128"
"87","0.184970171","66","d6:93:a5:c4:ba:67","66:58:69:01:7e:05","172.20.0.3","172.20.0.2","TCP","40266 → 4433 [ACK] Seq=1 Ack=1 Win=64256 Len=0 TSval=1311537190 TSecr=1502452985"
"88","0.185009579","1728","d6:93:a5:c4:ba:67","66:58:69:01:7e:05","172.20.0.3","172.20.0.2","TLSv1.2","Client Hello"
"89","0.185014951","66","66:58:69:01:7e:05","d6:93:a5:c4:ba:67","172.20.0.2","172.20.0.3","TCP","4433 → 40266 [ACK] Seq=1 Ack=1663 Win=64128 Len=0 TSval=1502452985 TSecr=1311537190"
"90","0.187452782","2010","66:58:69:01:7e:05","d6:93:a5:c4:ba:67","172.20.0.2","172.20.0.3","TLSv1.3","Server Hello, Change Cipher Spec, Application Data, Application Data, Application Data, Application Data"
"91","0.187480977","66","d6:93:a5:c4:ba:67","66:58:69:01:7e:05","172.20.0.3","172.20.0.2","TCP","40266 → 4433 [ACK] Seq=1663 Ack=1945 Win=64128 Len=0 TSval=1311537192 TSecr=1502452987"
"92","0.190533420","146","d6:93:a5:c4:ba:67","66:58:69:01:7e:05","172.20.0.3","172.20.0.2","TLSv1.3","Change Cipher Spec, Application Data"
"93","0.190586505","66","d6:93:a5:c4:ba:67","66:58:69:01:7e:05","172.20.0.3","172.20.0.2","TCP","40266 → 4433 [RST, ACK] Seq=1743 Ack=1945 Win=64128 Len=0 TSval=1311537195 TSecr=1502452987"
"94","0.205137570","74","d6:93:a5:c4:ba:67","66:58:69:01:7e:05","172.20.0.3","172.20.0.2","TCP","40278 → 4433 [SYN] Seq=0 Win=64240 Len=0 MSS=1460 SACK_PERM TSval=1311537210 TSecr=0 WS=128"
"95","0.205169732","74","66:58:69:01:7e:05","d6:93:a5:c4:ba:67","172.20.0.2","172.20.0.3","TCP","4433 → 40278 [SYN, ACK] Seq=0 Ack=1 Win=65160 Len=0 MSS=1460 SACK_PERM TSval=1502453005 TSecr=1311537210 WS=128"
"96","0.205195448","66","d6:93:a5:c4:ba:67","66:58:69:01:7e:05","172.20.0.3","172.20.0.2","TCP","40278 → 4433 [ACK] Seq=1 Ack=1 Win=64256 Len=0 TSval=1311537210 TSecr=1502453005"
"97","0.205245170","1728","d6:93:a5:c4:ba:67","66:58:69:01:7e:05","172.20.0.3","172.20.0.2","TLSv1.2","Client Hello"
"98","0.205252844","66","66:58:69:01:7e:05","d6:93:a5:c4:ba:67","172.20.0.2","172.20.0.3","TCP","4433 → 40278 [ACK] Seq=1 Ack=1663 Win=64128 Len=0 TSval=1502453005 TSecr=1311537210"
"99","0.207688627","2010","66:58:69:01:7e:05","d6:93:a5:c4:ba:67","172.20.0.2","172.20.0.3","TLSv1.3","Server Hello, Change Cipher Spec, Application Data, Application Data, Application Data, Application Data"
"100","0.207723796","66","d6:93:a5:c4:ba:67","66:58:69:01:7e:05","172.20.0.3","172.20.0.2","TCP","40278 → 4433 [ACK] Seq=1663 Ack=1945 Win=64128 Len=0 TSval=1311537212 TSecr=1502453007"
"101","0.212953242","146","d6:93:a5:c4:ba:67","66:58:69:01:7e:05","172.20.0.3","172.20.0.2","TLSv1.3","Change Cipher Spec, Application Data"
"102","0.213044703","66","d6:93:a5:c4:ba:67","66:58:69:01:7e:05","172.20.0.3","172.20.0.2","TCP","40278 → 4433 [RST, ACK] Seq=1743 Ack=1945 Win=64128 Len=0 TSval=1311537218 TSecr=1502453007"
"103","0.228005711","74","d6:93:a5:c4:ba:67","66:58:69:01:7e:05","172.20.0.3","172.20.0.2","TCP","40290 → 4433 [SYN] Seq=0 Win=64240 Len=0 MSS=1460 SACK_PERM TSval=1311537233 TSecr=0 WS=128"
"104","0.228038449","74","66:58:69:01:7e:05","d6:93:a5:c4:ba:67","172.20.0.2","172.20.0.3","TCP","4433 → 40290 [SYN, ACK] Seq=0 Ack=1 Win=65160 Len=0 MSS=1460 SACK_PERM TSval=1502453028 TSecr=1311537233 WS=128"
"105","0.228063794","66","d6:93:a5:c4:ba:67","66:58:69:01:7e:05","172.20.0.3","172.20.0.2","TCP","40290 → 4433 [ACK] Seq=1 Ack=1 Win=64256 Len=0 TSval=1311537233 TSecr=1502453028"
"106","0.228123810","1728","d6:93:a5:c4:ba:67","66:58:69:01:7e:05","172.20.0.3","172.20.0.2","TLSv1.2","Client Hello"
"107","0.228132524","66","66:58:69:01:7e:05","d6:93:a5:c4:ba:67","172.20.0.2","172.20.0.3","TCP","4433 → 40290 [ACK] Seq=1 Ack=1663 Win=64128 Len=0 TSval=1502453028 TSecr=1311537233"
"108","0.230631825","2011","66:58:69:01:7e:05","d6:93:a5:c4:ba:67","172.20.0.2","172.20.0.3","TLSv1.3","Server Hello, Change Cipher Spec, Application Data, Application Data, Application Data, Application Data"
"109","0.230675612","66","d6:93:a5:c4:ba:67","66:58:69:01:7e:05","172.20.0.3","172.20.0.2","TCP","40290 → 4433 [ACK] Seq=1663 Ack=1946 Win=64128 Len=0 TSval=1311537235 TSecr=1502453030"
"110","0.235781135","146","d6:93:a5:c4:ba:67","66:58:69:01:7e:05","172.20.0.3","172.20.0.2","TLSv1.3","Change Cipher Spec, Application Data"
"111","0.235876919","66","d6:93:a5:c4:ba:67","66:58:69:01:7e:05","172.20.0.3","172.20.0.2","TCP","40290 → 4433 [RST, ACK] Seq=1743 Ack=1946 Win=64128 Len=0 TSval=1311537241 TSecr=1502453030"
"112","0.250301550","74","d6:93:a5:c4:ba:67","66:58:69:01:7e:05","172.20.0.3","172.20.0.2","TCP","40304 → 4433 [SYN] Seq=0 Win=64240 Len=0 MSS=1460 SACK_PERM TSval=1311537255 TSecr=0 WS=128"
"113","0.250333777","74","66:58:69:01:7e:05","d6:93:a5:c4:ba:67","172.20.0.2","172.20.0.3","TCP","4433 → 40304 [SYN, ACK] Seq=0 Ack=1 Win=65160 Len=0 MSS=1460 SACK_PERM TSval=1502453050 TSecr=1311537255 WS=128"
"114","0.250358872","66","d6:93:a5:c4:ba:67","66:58:69:01:7e:05","172.20.0.3","172.20.0.2","TCP","40304 → 4433 [ACK] Seq=1 Ack=1 Win=64256 Len=0 TSval=1311537255 TSecr=1502453050"
"115","0.250412115","1728","d6:93:a5:c4:ba:67","66:58:69:01:7e:05","172.20.0.3","172.20.0.2","TLSv1.2","Client Hello"
"116","0.250420628","66","66:58:69:01:7e:05","d6:93:a5:c4:ba:67","172.20.0.2","172.20.0.3","TCP","4433 → 40304 [ACK] Seq=1 Ack=1663 Win=64128 Len=0 TSval=1502453050 TSecr=1311537255"
"117","0.252856285","2011","66:58:69:01:7e:05","d6:93:a5:c4:ba:67","172.20.0.2","172.20.0.3","TLSv1.3","Server Hello, Change Cipher Spec, Application Data, Application Data, Application Data, Application Data"
"118","0.252887752","66","d6:93:a5:c4:ba:67","66:58:69:01:7e:05","172.20.0.3","172.20.0.2","TCP","40304 → 4433 [ACK] Seq=1663 Ack=1946 Win=64128 Len=0 TSval=1311537258 TSecr=1502453053"
"119","0.258104826","146","d6:93:a5:c4:ba:67","66:58:69:01:7e:05","172.20.0.3","172.20.0.2","TLSv1.3","Change Cipher Spec, Application Data"
"120","0.258176808","66","d6:93:a5:c4:ba:67","66:58:69:01:7e:05","172.20.0.3","172.20.0.2","TCP","40304 → 4433 [RST, ACK] Seq=1743 Ack=1946 Win=64128 Len=0 TSval=1311537263 TSecr=1502453053"
"121","0.269061772","74","d6:93:a5:c4:ba:67","66:58:69:01:7e:05","172.20.0.3","172.20.0.2","TCP","40310 → 4433 [SYN] Seq=0 Win=64240 Len=0 MSS=1460 SACK_PERM TSval=1311537274 TSecr=0 WS=128"
"122","0.269086318","74","66:58:69:01:7e:05","d6:93:a5:c4:ba:67","172.20.0.2","172.20.0.3","TCP","4433 → 40310 [SYN, ACK] Seq=0 Ack=1 Win=65160 Len=0 MSS=1460 SACK_PERM TSval=1502453069 TSecr=1311537274 WS=128"
"123","0.269105754","66","d6:93:a5:c4:ba:67","66:58:69:01:7e:05","172.20.0.3","172.20.0.2","TCP","40310 → 4433 [ACK] Seq=1 Ack=1 Win=64256 Len=0 TSval=1311537274 TSecr=1502453069"
"124","0.269149359","1728","d6:93:a5:c4:ba:67","66:58:69:01:7e:05","172.20.0.3","172.20.0.2","TLSv1.2","Client Hello"
"125","0.269154707","66","66:58:69:01:7e:05","d6:93:a5:c4:ba:67","172.20.0.2","172.20.0.3","TCP","4433 → 40310 [ACK] Seq=1 Ack=1663 Win=64128 Len=0 TSval=1502453069 TSecr=1311537274"
"126","0.271573364","2012","66:58:69:01:7e:05","d6:93:a5:c4:ba:67","172.20.0.2","172.20.0.3","TLSv1.3","Server Hello, Change Cipher Spec, Application Data, Application Data, Application Data, Application Data"
"127","0.271603956","66","d6:93:a5:c4:ba:67","66:58:69:01:7e:05","172.20.0.3","172.20.0.2","TCP","40310 → 4433 [ACK] Seq=1663 Ack=1947 Win=64128 Len=0 TSval=1311537276 TSecr=1502453071"
"128","0.274717161","146","d6:93:a5:c4:ba:67","66:58:69:01:7e:05","172.20.0.3","172.20.0.2","TLSv1.3","Change Cipher Spec, Application Data"
"129","0.274782909","66","d6:93:a5:c4:ba:67","66:58:69:01:7e:05","172.20.0.3","172.20.0.2","TCP","40310 → 4433 [RST, ACK] Seq=1743 Ack=1947 Win=64128 Len=0 TSval=1311537279 TSecr=1502453071"
"130","0.285316135","74","d6:93:a5:c4:ba:67","66:58:69:01:7e:05","172.20.0.3","172.20.0.2","TCP","40316 → 4433 [SYN] Seq=0 Win=64240 Len=0 MSS=1460 SACK_PERM TSval=1311537290 TSecr=0 WS=128"
"131","0.285341623","74","66:58:69:01:7e:05","d6:93:a5:c4:ba:67","172.20.0.2","172.20.0.3","TCP","4433 → 40316 [SYN, ACK] Seq=0 Ack=1 Win=65160 Len=0 MSS=1460 SACK_PERM TSval=1502453085 TSecr=1311537290 WS=128"
"132","0.285358080","66","d6:93:a5:c4:ba:67","66:58:69:01:7e:05","172.20.0.3","172.20.0.2","TCP","40316 → 4433 [ACK] Seq=1 Ack=1 Win=64256 Len=0 TSval=1311537290 TSecr=1502453085"
"133","0.285399021","1728","d6:93:a5:c4:ba:67","66:58:69:01:7e:05","172.20.0.3","172.20.0.2","TLSv1.2","Client Hello"
"134","0.285403912","66","66:58:69:01:7e:05","d6:93:a5:c4:ba:67","172.20.0.2","172.20.0.3","TCP","4433 → 40316 [ACK] Seq=1 Ack=1663 Win=64128 Len=0 TSval=1502453085 TSecr=1311537290"
"135","0.287804379","2011","66:58:69:01:7e:05","d6:93:a5:c4:ba:67","172.20.0.2","172.20.0.3","TLSv1.3","Server Hello, Change Cipher Spec, Application Data, Application Data, Application Data, Application Data"
"136","0.287844747","66","d6:93:a5:c4:ba:67","66:58:69:01:7e:05","172.20.0.3","172.20.0.2","TCP","40316 → 4433 [ACK] Seq=1663 Ack=1946 Win=64128 Len=0 TSval=1311537292 TSecr=1502453087"
"137","0.290934326","146","d6:93:a5:c4:ba:67","66:58:69:01:7e:05","172.20.0.3","172.20.0.2","TLSv1.3","Change Cipher Spec, Application Data"
"138","0.290995723","66","d6:93:a5:c4:ba:67","66:58:69:01:7e:05","172.20.0.3","172.20.0.2","TCP","40316 → 4433 [RST, ACK] Seq=1743 Ack=1946 Win=64128 Len=0 TSval=1311537296 TSecr=1502453087"
"139","0.301398395","74","d6:93:a5:c4:ba:67","66:58:69:01:7e:05","172.20.0.3","172.20.0.2","TCP","40320 → 4433 [SYN] Seq=0 Win=64240 Len=0 MSS=1460 SACK_PERM TSval=1311537306 TSecr=0 WS=128"
"140","0.301423808","74","66:58:69:01:7e:05","d6:93:a5:c4:ba:67","172.20.0.2","172.20.0.3","TCP","4433 → 40320 [SYN, ACK] Seq=0 Ack=1 Win=65160 Len=0 MSS=1460 SACK_PERM TSval=1502453101 TSecr=1311537306 WS=128"
"141","0.301442546","66","d6:93:a5:c4:ba:67","66:58:69:01:7e:05","172.20.0.3","172.20.0.2","TCP","40320 → 4433 [ACK] Seq=1 Ack=1 Win=64256 Len=0 TSval=1311537306 TSecr=1502453101"
"142","0.301486210","1728","d6:93:a5:c4:ba:67","66:58:69:01:7e:05","172.20.0.3","172.20.0.2","TLSv1.2","Client Hello"
"143","0.301491531","66","66:58:69:01:7e:05","d6:93:a5:c4:ba:67","172.20.0.2","172.20.0.3","TCP","4433 → 40320 [ACK] Seq=1 Ack=1663 Win=64128 Len=0 TSval=1502453101 TSecr=1311537306"
"144","0.303945184","2010","66:58:69:01:7e:05","d6:93:a5:c4:ba:67","172.20.0.2","172.20.0.3","TLSv1.3","Server Hello, Change Cipher Spec, Application Data, Application Data, Application Data, Application Data"
"145","0.303973411","66","d6:93:a5:c4:ba:67","66:58:69:01:7e:05","172.20.0.3","172.20.0.2","TCP","40320 → 4433 [ACK] Seq=1663 Ack=1945 Win=64128 Len=0 TSval=1311537309 TSecr=1502453104"
"146","0.307014050","146","d6:93:a5:c4:ba:67","66:58:69:01:7e:05","172.20.0.3","172.20.0.2","TLSv1.3","Change Cipher Spec, Application Data"
"147","0.307063712","66","d6:93:a5:c4:ba:67","66:58:69:01:7e:05","172.20.0.3","172.20.0.2","TCP","40320 → 4433 [RST, ACK] Seq=1743 Ack=1945 Win=64128 Len=0 TSval=1311537312 TSecr=1502453104"
"148","0.317149372","74","d6:93:a5:c4:ba:67","66:58:69:01:7e:05","172.20.0.3","172.20.0.2","TCP","40328 → 4433 [SYN] Seq=0 Win=64240 Len=0 MSS=1460 SACK_PERM TSval=1311537322 TSecr=0 WS=128"
"149","0.317171422","74","66:58:69:01:7e:05","d6:93:a5:c4:ba:67","172.20.0.2","172.20.0.3","TCP","4433 → 40328 [SYN, ACK] Seq=0 Ack=1 Win=65160 Len=0 MSS=1460 SACK_PERM TSval=1502453117 TSecr=1311537322 WS=128"
"150","0.317186171","66","d6:93:a5:c4:ba:67","66:58:69:01:7e:05","172.20.0.3","172.20.0.2","TCP","40328 → 4433 [ACK] Seq=1 Ack=1 Win=64256 Len=0 TSval=1311537322 TSecr=1502453117"
"151","0.317221315","1728","d6:93:a5:c4:ba:67","66:58:69:01:7e:05","172.20.0.3","172.20.0.2","TLSv1.2","Client Hello"
"152","0.317226113","66","66:58:69:01:7e:05","d6:93:a5:c4:ba:67","172.20.0.2","172.20.0.3","TCP","4433 → 40328 [ACK] Seq=1 Ack=1663 Win=64128 Len=0 TSval=1502453117 TSecr=1311537322"
"153","0.319701406","2010","66:58:69:01:7e:05","d6:93:a5:c4:ba:67","172.20.0.2","172.20.0.3","TLSv1.3","Server Hello, Change Cipher Spec, Application Data, Application Data, Application Data, Application Data"
"154","0.319730365","66","d6:93:a5:c4:ba:67","66:58:69:01:7e:05","172.20.0.3","172.20.0.2","TCP","40328 → 4433 [ACK] Seq=1663 Ack=1945 Win=64128 Len=0 TSval=1311537324 TSecr=1502453119"
"155","0.322847190","146","d6:93:a5:c4:ba:67","66:58:69:01:7e:05","172.20.0.3","172.20.0.2","TLSv1.3","Change Cipher Spec, Application Data"
"156","0.322918366","66","d6:93:a5:c4:ba:67","66:58:69:01:7e:05","172.20.0.3","172.20.0.2","TCP","40328 → 4433 [RST, ACK] Seq=1743 Ack=1945 Win=64128 Len=0 TSval=1311537328 TSecr=1502453119"
"157","0.332955816","74","d6:93:a5:c4:ba:67","66:58:69:01:7e:05","172.20.0.3","172.20.0.2","TCP","40330 → 4433 [SYN] Seq=0 Win=64240 Len=0 MSS=1460 SACK_PERM TSval=1311537338 TSecr=0 WS=128"
"158","0.332978108","74","66:58:69:01:7e:05","d6:93:a5:c4:ba:67","172.20.0.2","172.20.0.3","TCP","4433 → 40330 [SYN, ACK] Seq=0 Ack=1 Win=65160 Len=0 MSS=1460 SACK_PERM TSval=1502453133 TSecr=1311537338 WS=128"
"159","0.332993407","66","d6:93:a5:c4:ba:67","66:58:69:01:7e:05","172.20.0.3","172.20.0.2","TCP","40330 → 4433 [ACK] Seq=1 Ack=1 Win=64256 Len=0 TSval=1311537338 TSecr=1502453133"
"160","0.333041300","1728","d6:93:a5:c4:ba:67","66:58:69:01:7e:05","172.20.0.3","172.20.0.2","TLSv1.2","Client Hello"
"161","0.333052916","66","66:58:69:01:7e:05","d6:93:a5:c4:ba:67","172.20.0.2","172.20.0.3","TCP","4433 → 40330 [ACK] Seq=1 Ack=1663 Win=64128 Len=0 TSval=1502453133 TSecr=1311537338"
"162","0.335514229","2010","66:58:69:01:7e:05","d6:93:a5:c4:ba:67","172.20.0.2","172.20.0.3","TLSv1.3","Server Hello, Change Cipher Spec, Application Data, Application Data, Application Data, Application Data"
"163","0.335535688","66","d6:93:a5:c4:ba:67","66:58:69:01:7e:05","172.20.0.3","172.20.0.2","TCP","40330 → 4433 [ACK] Seq=1663 Ack=1945 Win=64128 Len=0 TSval=1311537340 TSecr=1502453135"
"164","0.338597661","146","d6:93:a5:c4:ba:67","66:58:69:01:7e:05","172.20.0.3","172.20.0.2","TLSv1.3","Change Cipher Spec, Application Data"
"165","0.338645425","66","d6:93:a5:c4:ba:67","66:58:69:01:7e:05","172.20.0.3","172.20.0.2","TCP","40330 → 4433 [RST, ACK] Seq=1743 Ack=1945 Win=64128 Len=0 TSval=1311537343 TSecr=1502453135"
"166","0.348669297","74","d6:93:a5:c4:ba:67","66:58:69:01:7e:05","172.20.0.3","172.20.0.2","TCP","40340 → 4433 [SYN] Seq=0 Win=64240 Len=0 MSS=1460 SACK_PERM TSval=1311537353 TSecr=0 WS=128"
"167","0.348693680","74","66:58:69:01:7e:05","d6:93:a5:c4:ba:67","172.20.0.2","172.20.0.3","TCP","4433 → 40340 [SYN, ACK] Seq=0 Ack=1 Win=65160 Len=0 MSS=1460 SACK_PERM TSval=1502453148 TSecr=1311537353 WS=128"
"168","0.348709230","66","d6:93:a5:c4:ba:67","66:58:69:01:7e:05","172.20.0.3","172.20.0.2","TCP","40340 → 4433 [ACK] Seq=1 Ack=1 Win=64256 Len=0 TSval=1311537353 TSecr=1502453148"
"169","0.348755589","1728","d6:93:a5:c4:ba:67","66:58:69:01:7e:05","172.20.0.3","172.20.0.2","TLSv1.2","Client Hello"
"170","0.348768036","66","66:58:69:01:7e:05","d6:93:a5:c4:ba:67","172.20.0.2","172.20.0.3","TCP","4433 → 40340 [ACK] Seq=1 Ack=1663 Win=64128 Len=0 TSval=1502453148 TSecr=1311537353"
"171","0.351328494","2011","66:58:69:01:7e:05","d6:93:a5:c4:ba:67","172.20.0.2","172.20.0.3","TLSv1.3","Server Hello, Change Cipher Spec, Application Data, Application Data, Application Data, Application Data"
"172","0.351356336","66","d6:93:a5:c4:ba:67","66:58:69:01:7e:05","172.20.0.3","172.20.0.2","TCP","40340 → 4433 [ACK] Seq=1663 Ack=1946 Win=64128 Len=0 TSval=1311537356 TSecr=1502453151"
"173","0.354454591","146","d6:93:a5:c4:ba:67","66:58:69:01:7e:05","172.20.0.3","172.20.0.2","TLSv1.3","Change Cipher Spec, Application Data"
"174","0.354509300","66","d6:93:a5:c4:ba:67","66:58:69:01:7e:05","172.20.0.3","172.20.0.2","TCP","40340 → 4433 [RST, ACK] Seq=1743 Ack=1946 Win=64128 Len=0 TSval=1311537359 TSecr=1502453151"
"175","0.364904790","74","d6:93:a5:c4:ba:67","66:58:69:01:7e:05","172.20.0.3","172.20.0.2","TCP","40352 → 4433 [SYN] Seq=0 Win=64240 Len=0 MSS=1460 SACK_PERM TSval=1311537370 TSecr=0 WS=128"
"176","0.364926587","74","66:58:69:01:7e:05","d6:93:a5:c4:ba:67","172.20.0.2","172.20.0.3","TCP","4433 → 40352 [SYN, ACK] Seq=0 Ack=1 Win=65160 Len=0 MSS=1460 SACK_PERM TSval=1502453165 TSecr=1311537370 WS=128"
"177","0.364942010","66","d6:93:a5:c4:ba:67","66:58:69:01:7e:05","172.20.0.3","172.20.0.2","TCP","40352 → 4433 [ACK] Seq=1 Ack=1 Win=64256 Len=0 TSval=1311537370 TSecr=1502453165"
"178","0.364983379","1728","d6:93:a5:c4:ba:67","66:58:69:01:7e:05","172.20.0.3","172.20.0.2","TLSv1.2","Client Hello"
"179","0.364988804","66","66:58:69:01:7e:05","d6:93:a5:c4:ba:67","172.20.0.2","172.20.0.3","TCP","4433 → 40352 [ACK] Seq=1 Ack=1663 Win=64128 Len=0 TSval=1502453165 TSecr=1311537370"
"180","0.367474408","2011","66:58:69:01:7e:05","d6:93:a5:c4:ba:67","172.20.0.2","172.20.0.3","TLSv1.3","Server Hello, Change Cipher Spec, Application Data, Application Data, Application Data, Application Data"
"181","0.367512120","66","d6:93:a5:c4:ba:67","66:58:69:01:7e:05","172.20.0.3","172.20.0.2","TCP","40352 → 4433 [ACK] Seq=1663 Ack=1946 Win=64128 Len=0 TSval=1311537372 TSecr=1502453167"
"182","0.370691699","146","d6:93:a5:c4:ba:67","66:58:69:01:7e:05","172.20.0.3","172.20.0.2","TLSv1.3","Change Cipher Spec, Application Data"
"183","0.370765876","66","d6:93:a5:c4:ba:67","66:58:69:01:7e:05","172.20.0.3","172.20.0.2","TCP","40352 → 4433 [RST, ACK] Seq=1743 Ack=1946 Win=64128 Len=0 TSval=1311537375 TSecr=1502453167"
"184","0.381872493","74","d6:93:a5:c4:ba:67","66:58:69:01:7e:05","172.20.0.3","172.20.0.2","TCP","40366 → 4433 [SYN] Seq=0 Win=64240 Len=0 MSS=1460 SACK_PERM TSval=1311537386 TSecr=0 WS=128"
"185","0.381900734","74","66:58:69:01:7e:05","d6:93:a5:c4:ba:67","172.20.0.2","172.20.0.3","TCP","4433 → 40366 [SYN, ACK] Seq=0 Ack=1 Win=65160 Len=0 MSS=1460 SACK_PERM TSval=1502453182 TSecr=1311537386 WS=128"
"186","0.381918243","66","d6:93:a5:c4:ba:67","66:58:69:01:7e:05","172.20.0.3","172.20.0.2","TCP","40366 → 4433 [ACK] Seq=1 Ack=1 Win=64256 Len=0 TSval=1311537387 TSecr=1502453182"
"187","0.381964838","1728","d6:93:a5:c4:ba:67","66:58:69:01:7e:05","172.20.0.3","172.20.0.2","TLSv1.2","Client Hello"
"188","0.381970184","66","66:58:69:01:7e:05","d6:93:a5:c4:ba:67","172.20.0.2","172.20.0.3","TCP","4433 → 40366 [ACK] Seq=1 Ack=1663 Win=64128 Len=0 TSval=1502453182 TSecr=1311537387"
"189","0.384558648","2010","66:58:69:01:7e:05","d6:93:a5:c4:ba:67","172.20.0.2","172.20.0.3","TLSv1.3","Server Hello, Change Cipher Spec, Application Data, Application Data, Application Data, Application Data"
"190","0.384593860","66","d6:93:a5:c4:ba:67","66:58:69:01:7e:05","172.20.0.3","172.20.0.2","TCP","40366 → 4433 [ACK] Seq=1663 Ack=1945 Win=64128 Len=0 TSval=1311537389 TSecr=1502453184"
"191","0.387909349","146","d6:93:a5:c4:ba:67","66:58:69:01:7e:05","172.20.0.3","172.20.0.2","TLSv1.3","Change Cipher Spec, Application Data"
"192","0.387968973","66","d6:93:a5:c4:ba:67","66:58:69:01:7e:05","172.20.0.3","172.20.0.2","TCP","40366 → 4433 [RST, ACK] Seq=1743 Ack=1945 Win=64128 Len=0 TSval=1311537393 TSecr=1502453184"
"193","0.398858430","74","d6:93:a5:c4:ba:67","66:58:69:01:7e:05","172.20.0.3","172.20.0.2","TCP","40376 → 4433 [SYN] Seq=0 Win=64240 Len=0 MSS=1460 SACK_PERM TSval=1311537403 TSecr=0 WS=128"
"194","0.398884945","74","66:58:69:01:7e:05","d6:93:a5:c4:ba:67","172.20.0.2","172.20.0.3","TCP","4433 → 40376 [SYN, ACK] Seq=0 Ack=1 Win=65160 Len=0 MSS=1460 SACK_PERM TSval=1502453199 TSecr=1311537403 WS=128"
"195","0.398902687","66","d6:93:a5:c4:ba:67","66:58:69:01:7e:05","172.20.0.3","172.20.0.2","TCP","40376 → 4433 [ACK] Seq=1 Ack=1 Win=64256 Len=0 TSval=1311537404 TSecr=1502453199"
"196","0.398939921","1728","d6:93:a5:c4:ba:67","66:58:69:01:7e:05","172.20.0.3","172.20.0.2","TLSv1.2","Client Hello"
"197","0.398945000","66","66:58:69:01:7e:05","d6:93:a5:c4:ba:67","172.20.0.2","172.20.0.3","TCP","4433 → 40376 [ACK] Seq=1 Ack=1663 Win=64128 Len=0 TSval=1502453199 TSecr=1311537404"
"198","0.402038617","2010","66:58:69:01:7e:05","d6:93:a5:c4:ba:67","172.20.0.2","172.20.0.3","TLSv1.3","Server Hello, Change Cipher Spec, Application Data, Application Data, Application Data, Application Data"
"199","0.402076734","66","d6:93:a5:c4:ba:67","66:58:69:01:7e:05","172.20.0.3","172.20.0.2","TCP","40376 → 4433 [ACK] Seq=1663 Ack=1945 Win=64128 Len=0 TSval=1311537407 TSecr=1502453202"
"200","0.405578641","146","d6:93:a5:c4:ba:67","66:58:69:01:7e:05","172.20.0.3","172.20.0.2","TLSv1.3","Change Cipher Spec, Application Data"
"201","0.405650996","66","d6:93:a5:c4:ba:67","66:58:69:01:7e:05","172.20.0.3","172.20.0.2","TCP","40376 → 4433 [RST, ACK] Seq=1743 Ack=1945 Win=64128 Len=0 TSval=1311537410 TSecr=1502453202"
"202","0.416375129","74","d6:93:a5:c4:ba:67","66:58:69:01:7e:05","172.20.0.3","172.20.0.2","TCP","40388 → 4433 [SYN] Seq=0 Win=64240 Len=0 MSS=1460 SACK_PERM TSval=1311537421 TSecr=0 WS=128"
"203","0.416399054","74","66:58:69:01:7e:05","d6:93:a5:c4:ba:67","172.20.0.2","172.20.0.3","TCP","4433 → 40388 [SYN, ACK] Seq=0 Ack=1 Win=65160 Len=0 MSS=1460 SACK_PERM TSval=1502453216 TSecr=1311537421 WS=128"
"204","0.416415829","66","d6:93:a5:c4:ba:67","66:58:69:01:7e:05","172.20.0.3","172.20.0.2","TCP","40388 → 4433 [ACK] Seq=1 Ack=1 Win=64256 Len=0 TSval=1311537421 TSecr=1502453216"
"205","0.416456466","1728","d6:93:a5:c4:ba:67","66:58:69:01:7e:05","172.20.0.3","172.20.0.2","TLSv1.2","Client Hello"
"206","0.416471190","66","66:58:69:01:7e:05","d6:93:a5:c4:ba:67","172.20.0.2","172.20.0.3","TCP","4433 → 40388 [ACK] Seq=1 Ack=1663 Win=64128 Len=0 TSval=1502453216 TSecr=1311537421"
"207","0.418993966","2010","66:58:69:01:7e:05","d6:93:a5:c4:ba:67","172.20.0.2","172.20.0.3","TLSv1.3","Server Hello, Change Cipher Spec, Application Data, Application Data, Application Data, Application Data"
"208","0.419021946","66","d6:93:a5:c4:ba:67","66:58:69:01:7e:05","172.20.0.3","172.20.0.2","TCP","40388 → 4433 [ACK] Seq=1663 Ack=1945 Win=64128 Len=0 TSval=1311537424 TSecr=1502453219"
"209","0.422166996","146","d6:93:a5:c4:ba:67","66:58:69:01:7e:05","172.20.0.3","172.20.0.2","TLSv1.3","Change Cipher Spec, Application Data"
"210","0.422230013","66","d6:93:a5:c4:ba:67","66:58:69:01:7e:05","172.20.0.3","172.20.0.2","TCP","40388 → 4433 [RST, ACK] Seq=1743 Ack=1945 Win=64128 Len=0 TSval=1311537427 TSecr=1502453219"
"211","0.432441142","74","d6:93:a5:c4:ba:67","66:58:69:01:7e:05","172.20.0.3","172.20.0.2","TCP","40396 → 4433 [SYN] Seq=0 Win=64240 Len=0 MSS=1460 SACK_PERM TSval=1311537437 TSecr=0 WS=128"
"212","0.432465451","74","66:58:69:01:7e:05","d6:93:a5:c4:ba:67","172.20.0.2","172.20.0.3","TCP","4433 → 40396 [SYN, ACK] Seq=0 Ack=1 Win=65160 Len=0 MSS=1460 SACK_PERM TSval=1502453232 TSecr=1311537437 WS=128"
"213","0.432483074","66","d6:93:a5:c4:ba:67","66:58:69:01:7e:05","172.20.0.3","172.20.0.2","TCP","40396 → 4433 [ACK] Seq=1 Ack=1 Win=64256 Len=0 TSval=1311537437 TSecr=1502453232"
"214","0.432522426","1728","d6:93:a5:c4:ba:67","66:58:69:01:7e:05","172.20.0.3","172.20.0.2","TLSv1.2","Client Hello"
"215","0.432527679","66","66:58:69:01:7e:05","d6:93:a5:c4:ba:67","172.20.0.2","172.20.0.3","TCP","4433 → 40396 [ACK] Seq=1 Ack=1663 Win=64128 Len=0 TSval=1502453232 TSecr=1311537437"
"216","0.434993780","2012","66:58:69:01:7e:05","d6:93:a5:c4:ba:67","172.20.0.2","172.20.0.3","TLSv1.3","Server Hello, Change Cipher Spec, Application Data, Application Data, Application Data, Application Data"
"217","0.435024845","66","d6:93:a5:c4:ba:67","66:58:69:01:7e:05","172.20.0.3","172.20.0.2","TCP","40396 → 4433 [ACK] Seq=1663 Ack=1947 Win=64128 Len=0 TSval=1311537440 TSecr=1502453235"
"218","0.438177535","146","d6:93:a5:c4:ba:67","66:58:69:01:7e:05","172.20.0.3","172.20.0.2","TLSv1.3","Change Cipher Spec, Application Data"
"219","0.438233800","66","d6:93:a5:c4:ba:67","66:58:69:01:7e:05","172.20.0.3","172.20.0.2","TCP","40396 → 4433 [RST, ACK] Seq=1743 Ack=1947 Win=64128 Len=0 TSval=1311537443 TSecr=1502453235"
"220","0.448313997","74","d6:93:a5:c4:ba:67","66:58:69:01:7e:05","172.20.0.3","172.20.0.2","TCP","40404 → 4433 [SYN] Seq=0 Win=64240 Len=0 MSS=1460 SACK_PERM TSval=1311537453 TSecr=0 WS=128"
"221","0.448336143","74","66:58:69:01:7e:05","d6:93:a5:c4:ba:67","172.20.0.2","172.20.0.3","TCP","4433 → 40404 [SYN, ACK] Seq=0 Ack=1 Win=65160 Len=0 MSS=1460 SACK_PERM TSval=1502453248 TSecr=1311537453 WS=128"
"222","0.448351937","66","d6:93:a5:c4:ba:67","66:58:69:01:7e:05","172.20.0.3","172.20.0.2","TCP","40404 → 4433 [ACK] Seq=1 Ack=1 Win=64256 Len=0 TSval=1311537453 TSecr=1502453248"
"223","0.448391129","1728","d6:93:a5:c4:ba:67","66:58:69:01:7e:05","172.20.0.3","172.20.0.2","TLSv1.2","Client Hello"
"224","0.448396378","66","66:58:69:01:7e:05","d6:93:a5:c4:ba:67","172.20.0.2","172.20.0.3","TCP","4433 → 40404 [ACK] Seq=1 Ack=1663 Win=64128 Len=0 TSval=1502453248 TSecr=1311537453"
