frame.number,frame.time_relative,frame.len,eth.src,eth.dst,ip.src,ip.dst,_ws.col.protocol,_ws.col.info
"1","0.000000000","42","8a:05:5e:32:4d:aa","ff:ff:ff:ff:ff:ff",,,"ARP","ARP Announcement for 172.20.0.3"
"2","0.036215835","42","8a:05:5e:32:4d:aa","ff:ff:ff:ff:ff:ff",,,"ARP","Who has 172.20.0.2? Tell 172.20.0.3"
"3","0.036247779","42","5e:06:ae:be:ee:ea","8a:05:5e:32:4d:aa",,,"ARP","172.20.0.2 is at 5e:06:ae:be:ee:ea"
"4","0.036268285","74","8a:05:5e:32:4d:aa","5e:06:ae:be:ee:ea","172.20.0.3","172.20.0.2","TCP","58082 → 4433 [SYN] Seq=0 Win=64240 Len=0 MSS=1460 SACK_PERM TSval=1308689112 TSecr=0 WS=128"
"5","0.036291919","74","5e:06:ae:be:ee:ea","8a:05:5e:32:4d:aa","172.20.0.2","172.20.0.3","TCP","4433 → 58082 [SYN, ACK] Seq=0 Ack=1 Win=65160 Len=0 MSS=1460 SACK_PERM TSval=1499604908 TSecr=1308689112 WS=128"
"6","0.036313596","66","8a:05:5e:32:4d:aa","5e:06:ae:be:ee:ea","172.20.0.3","172.20.0.2","TCP","58082 → 4433 [ACK] Seq=1 Ack=1 Win=64256 Len=0 TSval=1308689113 TSecr=1499604908"
"7","0.036366769","1769","8a:05:5e:32:4d:aa","5e:06:ae:be:ee:ea","172.20.0.3","172.20.0.2","TLSv1.2","Client Hello"
"8","0.036373115","66","5e:06:ae:be:ee:ea","8a:05:5e:32:4d:aa","172.20.0.2","172.20.0.3","TCP","4433 → 58082 [ACK] Seq=1 Ack=1704 Win=64128 Len=0 TSval=1499604908 TSecr=1308689113"
"9","0.046213033","2052","5e:06:ae:be:ee:ea","8a:05:5e:32:4d:aa","172.20.0.2","172.20.0.3","TLSv1.3","Server Hello, Change Cipher Spec, Application Data, Application Data, Application Data, Application Data"
"10","0.046274925","66","8a:05:5e:32:4d:aa","5e:06:ae:be:ee:ea","172.20.0.3","172.20.0.2","TCP","58082 → 4433 [ACK] Seq=1704 Ack=1987 Win=64128 Len=0 TSval=1308689122 TSecr=1499604917"
"11","0.052062645","146","8a:05:5e:32:4d:aa","5e:06:ae:be:ee:ea","172.20.0.3","172.20.0.2","TLSv1.3","Change Cipher Spec, Application Data"
"12","0.052136042","66","8a:05:5e:32:4d:aa","5e:06:ae:be:ee:ea","172.20.0.3","172.20.0.2","TCP","58082 → 4433 [RST, ACK] Seq=1784 Ack=1987 Win=64128 Len=0 TSval=1308689128 TSecr=1499604917"
"13","0.068006888","74","8a:05:5e:32:4d:aa","5e:06:ae:be:ee:ea","172.20.0.3","172.20.0.2","TCP","58096 → 4433 [SYN] Seq=0 Win=64240 Len=0 MSS=1460 SACK_PERM TSval=1308689144 TSecr=0 WS=128"
"14","0.068028179","74","5e:06:ae:be:ee:ea","8a:05:5e:32:4d:aa","172.20.0.2","172.20.0.3","TCP","4433 → 58096 [SYN, ACK] Seq=0 Ack=1 Win=65160 Len=0 MSS=1460 SACK_PERM TSval=1499604939 TSecr=1308689144 WS=128"
"15","0.068045535","66","8a:05:5e:32:4d:aa","5e:06:ae:be:ee:ea","172.20.0.3","172.20.0.2","TCP","58096 → 4433 [ACK] Seq=1 Ack=1 Win=64256 Len=0 TSval=1308689144 TSecr=1499604939"
"16","0.068091483","1769","8a:05:5e:32:4d:aa","5e:06:ae:be:ee:ea","172.20.0.3","172.20.0.2","TLSv1.2","Client Hello"
"17","0.068097059","66","5e:06:ae:be:ee:ea","8a:05:5e:32:4d:aa","172.20.0.2","172.20.0.3","TCP","4433 → 58096 [ACK] Seq=1 Ack=1704 Win=64128 Len=0 TSval=1499604939 TSecr=1308689144"
"18","0.077143764","2052","5e:06:ae:be:ee:ea","8a:05:5e:32:4d:aa","172.20.0.2","172.20.0.3","TLSv1.3","Server Hello, Change Cipher Spec, Application Data, Application Data, Application Data, Application Data"
"19","0.077224953","66","8a:05:5e:32:4d:aa","5e:06:ae:be:ee:ea","172.20.0.3","172.20.0.2","TCP","58096 → 4433 [ACK] Seq=1704 Ack=1987 Win=64128 Len=0 TSval=1308689153 TSecr=1499604948"
"20","0.083450344","146","8a:05:5e:32:4d:aa","5e:06:ae:be:ee:ea","172.20.0.3","172.20.0.2","TLSv1.3","Change Cipher Spec, Application Data"
"21","0.083543523","66","8a:05:5e:32:4d:aa","5e:06:ae:be:ee:ea","172.20.0.3","172.20.0.2","TCP","58096 → 4433 [RST, ACK] Seq=1784 Ack=1987 Win=64128 Len=0 TSval=1308689160 TSecr=1499604948"
"22","0.100080659","74","8a:05:5e:32:4d:aa","5e:06:ae:be:ee:ea","172.20.0.3","172.20.0.2","TCP","58106 → 4433 [SYN] Seq=0 Win=64240 Len=0 MSS=1460 SACK_PERM TSval=1308689176 TSecr=0 WS=128"
"23","0.100108586","74","5e:06:ae:be:ee:ea","8a:05:5e:32:4d:aa","172.20.0.2","172.20.0.3","TCP","4433 → 58106 [SYN, ACK] Seq=0 Ack=1 Win=65160 Len=0 MSS=1460 SACK_PERM TSval=1499604971 TSecr=1308689176 WS=128"
"24","0.100131330","66","8a:05:5e:32:4d:aa","5e:06:ae:be:ee:ea","172.20.0.3","172.20.0.2","TCP","58106 → 4433 [ACK] Seq=1 Ack=1 Win=64256 Len=0 TSval=1308689176 TSecr=1499604971"
"25","0.100183332","1769","8a:05:5e:32:4d:aa","5e:06:ae:be:ee:ea","172.20.0.3","172.20.0.2","TLSv1.2","Client Hello"
"26","0.100188093","66","5e:06:ae:be:ee:ea","8a:05:5e:32:4d:aa","172.20.0.2","172.20.0.3","TCP","4433 → 58106 [ACK] Seq=1 Ack=1704 Win=64128 Len=0 TSval=1499604971 TSecr=1308689176"
"27","0.109876417","2052","5e:06:ae:be:ee:ea","8a:05:5e:32:4d:aa","172.20.0.2","172.20.0.3","TLSv1.3","Server Hello, Change Cipher Spec, Application Data, Application Data, Application Data, Application Data"
"28","0.109950916","66","8a:05:5e:32:4d:aa","5e:06:ae:be:ee:ea","172.20.0.3","172.20.0.2","TCP","58106 → 4433 [ACK] Seq=1704 Ack=1987 Win=64128 Len=0 TSval=1308689186 TSecr=1499604981"
"29","0.115777269","146","8a:05:5e:32:4d:aa","5e:06:ae:be:ee:ea","172.20.0.3","172.20.0.2","TLSv1.3","Change Cipher Spec, Application Data"
"30","0.115850725","66","8a:05:5e:32:4d:aa","5e:06:ae:be:ee:ea","172.20.0.3","172.20.0.2","TCP","58106 → 4433 [RST, ACK] Seq=1784 Ack=1987 Win=64128 Len=0 TSval=1308689192 TSecr=1499604981"
"31","0.131110309","74","8a:05:5e:32:4d:aa","5e:06:ae:be:ee:ea","172.20.0.3","172.20.0.2","TCP","58114 → 4433 [SYN] Seq=0 Win=64240 Len=0 MSS=1460 SACK_PERM TSval=1308689207 TSecr=0 WS=128"
"32","0.131136131","74","5e:06:ae:be:ee:ea","8a:05:5e:32:4d:aa","172.20.0.2","172.20.0.3","TCP","4433 → 58114 [SYN, ACK] Seq=0 Ack=1 Win=65160 Len=0 MSS=1460 SACK_PERM TSval=1499605002 TSecr=1308689207 WS=128"
"33","0.131162725","66","8a:05:5e:32:4d:aa","5e:06:ae:be:ee:ea","172.20.0.3","172.20.0.2","TCP","58114 → 4433 [ACK] Seq=1 Ack=1 Win=64256 Len=0 TSval=1308689207 TSecr=1499605002"
"34","0.131217546","1769","8a:05:5e:32:4d:aa","5e:06:ae:be:ee:ea","172.20.0.3","172.20.0.2","TLSv1.2","Client Hello"
"35","0.131221898","66","5e:06:ae:be:ee:ea","8a:05:5e:32:4d:aa","172.20.0.2","172.20.0.3","TCP","4433 → 58114 [ACK] Seq=1 Ack=1704 Win=64128 Len=0 TSval=1499605002 TSecr=1308689207"
"36","0.137423864","2052","5e:06:ae:be:ee:ea","8a:05:5e:32:4d:aa","172.20.0.2","172.20.0.3","TLSv1.3","Server Hello, Change Cipher Spec, Application Data, Application Data, Application Data, Application Data"
"37","0.137469983","66","8a:05:5e:32:4d:aa","5e:06:ae:be:ee:ea","172.20.0.3","172.20.0.2","TCP","58114 → 4433 [ACK] Seq=1704 Ack=1987 Win=64128 Len=0 TSval=1308689214 TSecr=1499605009"
"38","0.143457336","146","8a:05:5e:32:4d:aa","5e:06:ae:be:ee:ea","172.20.0.3","172.20.0.2","TLSv1.3","Change Cipher Spec, Application Data"
"39","0.143519715","66","8a:05:5e:32:4d:aa","5e:06:ae:be:ee:ea","172.20.0.3","172.20.0.2","TCP","58114 → 4433 [RST, ACK] Seq=1784 Ack=1987 Win=64128 Len=0 TSval=1308689220 TSecr=1499605009"
"40","0.158830804","74","8a:05:5e:32:4d:aa","5e:06:ae:be:ee:ea","172.20.0.3","172.20.0.2","TCP","58120 → 4433 [SYN] Seq=0 Win=64240 Len=0 MSS=1460 SACK_PERM TSval=1308689235 TSecr=0 WS=128"
"41","0.158859004","74","5e:06:ae:be:ee:ea","8a:05:5e:32:4d:aa","172.20.0.2","172.20.0.3","TCP","4433 → 58120 [SYN, ACK] Seq=0 Ack=1 Win=65160 Len=0 MSS=1460 SACK_PERM TSval=1499605030 TSecr=1308689235 WS=128"
"42","0.158880296","66","8a:05:5e:32:4d:aa","5e:06:ae:be:ee:ea","172.20.0.3","172.20.0.2","TCP","58120 → 4433 [ACK] Seq=1 Ack=1 Win=64256 Len=0 TSval=1308689235 TSecr=1499605030"
"43","0.158935620","1769","8a:05:5e:32:4d:aa","5e:06:ae:be:ee:ea","172.20.0.3","172.20.0.2","TLSv1.2","Client Hello"
"44","0.158940090","66","5e:06:ae:be:ee:ea","8a:05:5e:32:4d:aa","172.20.0.2","172.20.0.3","TCP","4433 → 58120 [ACK] Seq=1 Ack=1704 Win=64128 Len=0 TSval=1499605030 TSecr=1308689235"
"45","0.165379801","2053","5e:06:ae:be:ee:ea","8a:05:5e:32:4d:aa","172.20.0.2","172.20.0.3","TLSv1.3","Server Hello, Change Cipher Spec, Application Data, Application Data, Application Data, Application Data"
"46","0.165427302","66","8a:05:5e:32:4d:aa","5e:06:ae:be:ee:ea","172.20.0.3","172.20.0.2","TCP","58120 → 4433 [ACK] Seq=1704 Ack=1988 Win=64128 Len=0 TSval=1308689242 TSecr=1499605037"
"47","0.170847977","146","8a:05:5e:32:4d:aa","5e:06:ae:be:ee:ea","172.20.0.3","172.20.0.2","TLSv1.3","Change Cipher Spec, Application Data"
"48","0.170917325","66","8a:05:5e:32:4d:aa","5e:06:ae:be:ee:ea","172.20.0.3","172.20.0.2","TCP","58120 → 4433 [RST, ACK] Seq=1784 Ack=1988 Win=64128 Len=0 TSval=1308689247 TSecr=1499605037"
"49","0.185735313","74","8a:05:5e:32:4d:aa","5e:06:ae:be:ee:ea","172.20.0.3","172.20.0.2","TCP","58134 → 4433 [SYN] Seq=0 Win=64240 Len=0 MSS=1460 SACK_PERM TSval=1308689262 TSecr=0 WS=128"
"50","0.185759709","74","5e:06:ae:be:ee:ea","8a:05:5e:32:4d:aa","172.20.0.2","172.20.0.3","TCP","4433 → 58134 [SYN, ACK] Seq=0 Ack=1 Win=65160 Len=0 MSS=1460 SACK_PERM TSval=1499605057 TSecr=1308689262 WS=128"
"51","0.185777436","66","8a:05:5e:32:4d:aa","5e:06:ae:be:ee:ea","172.20.0.3","172.20.0.2","TCP","58134 → 4433 [ACK] Seq=1 Ack=1 Win=64256 Len=0 TSval=1308689262 TSecr=1499605057"
"52","0.185820343","1769","8a:05:5e:32:4d:aa","5e:06:ae:be:ee:ea","172.20.0.3","172.20.0.2","TLSv1.2","Client Hello"
"53","0.185826585","66","5e:06:ae:be:ee:ea","8a:05:5e:32:4d:aa","172.20.0.2","172.20.0.3","TCP","4433 → 58134 [ACK] Seq=1 Ack=1704 Win=64128 Len=0 TSval=1499605057 TSecr=1308689262"
"54","0.192569844","2053","5e:06:ae:be:ee:ea","8a:05:5e:32:4d:aa","172.20.0.2","172.20.0.3","TLSv1.3","Server Hello, Change Cipher Spec, Application Data, Application Data, Application Data, Application Data"
"55","0.192613553","66","8a:05:5e:32:4d:aa","5e:06:ae:be:ee:ea","172.20.0.3","172.20.0.2","TCP","58134 → 4433 [ACK] Seq=1704 Ack=1988 Win=64128 Len=0 TSval=1308689269 TSecr=1499605064"
"56","0.197873076","146","8a:05:5e:32:4d:aa","5e:06:ae:be:ee:ea","172.20.0.3","172.20.0.2","TLSv1.3","Change Cipher Spec, Application Data"
"57","0.197939687","66","8a:05:5e:32:4d:aa","5e:06:ae:be:ee:ea","172.20.0.3","172.20.0.2","TCP","58134 → 4433 [RST, ACK] Seq=1784 Ack=1988 Win=64128 Len=0 TSval=1308689274 TSecr=1499605064"
"58","0.213059563","74","8a:05:5e:32:4d:aa","5e:06:ae:be:ee:ea","172.20.0.3","172.20.0.2","TCP","58146 → 4433 [SYN] Seq=0 Win=64240 Len=0 MSS=1460 SACK_PERM TSval=1308689289 TSecr=0 WS=128"
"59","0.213083405","74","5e:06:ae:be:ee:ea","8a:05:5e:32:4d:aa","172.20.0.2","172.20.0.3","TCP","4433 → 58146 [SYN, ACK] Seq=0 Ack=1 Win=65160 Len=0 MSS=1460 SACK_PERM TSval=1499605084 TSecr=1308689289 WS=128"
"60","0.213102067","66","8a:05:5e:32:4d:aa","5e:06:ae:be:ee:ea","172.20.0.3","172.20.0.2","TCP","58146 → 4433 [ACK] Seq=1 Ack=1 Win=64256 Len=0 TSval=1308689289 TSecr=1499605084"
"61","0.213166911","1769","8a:05:5e:32:4d:aa","5e:06:ae:be:ee:ea","172.20.0.3","172.20.0.2","TLSv1.2","Client Hello"
"62","0.213171864","66","5e:06:ae:be:ee:ea","8a:05:5e:32:4d:aa","172.20.0.2","172.20.0.3","TCP","4433 → 58146 [ACK] Seq=1 Ack=1704 Win=64128 Len=0 TSval=1499605084 TSecr=1308689289"
"63","0.220534251","2053","5e:06:ae:be:ee:ea","8a:05:5e:32:4d:aa","172.20.0.2","172.20.0.3","TLSv1.3","Server Hello, Change Cipher Spec, Application Data, Application Data, Application Data, Application Data"
"64","0.220591685","66","8a:05:5e:32:4d:aa","5e:06:ae:be:ee:ea","172.20.0.3","172.20.0.2","TCP","58146 → 4433 [ACK] Seq=1704 Ack=1988 Win=64128 Len=0 TSval=1308689297 TSecr=1499605092"
"65","0.226750746","146","8a:05:5e:32:4d:aa","5e:06:ae:be:ee:ea","172.20.0.3","172.20.0.2","TLSv1.3","Change Cipher Spec, Application Data"
"66","0.226837849","66","8a:05:5e:32:4d:aa","5e:06:ae:be:ee:ea","172.20.0.3","172.20.0.2","TCP","58146 → 4433 [RST, ACK] Seq=1784 Ack=1988 Win=64128 Len=0 TSval=1308689303 TSecr=1499605092"
"67","0.243224017","74","8a:05:5e:32:4d:aa","5e:06:ae:be:ee:ea","172.20.0.3","172.20.0.2","TCP","58156 → 4433 [SYN] Seq=0 Win=64240 Len=0 MSS=1460 SACK_PERM TSval=1308689319 TSecr=0 WS=128"
"68","0.243260913","74","5e:06:ae:be:ee:ea","8a:05:5e:32:4d:aa","172.20.0.2","172.20.0.3","TCP","4433 → 58156 [SYN, ACK] Seq=0 Ack=1 Win=65160 Len=0 MSS=1460 SACK_PERM TSval=1499605114 TSecr=1308689319 WS=128"
"69","0.243279985","66","8a:05:5e:32:4d:aa","5e:06:ae:be:ee:ea","172.20.0.3","172.20.0.2","TCP","58156 → 4433 [ACK] Seq=1 Ack=1 Win=64256 Len=0 TSval=1308689320 TSecr=1499605114"
"70","0.243338215","1769","8a:05:5e:32:4d:aa","5e:06:ae:be:ee:ea","172.20.0.3","172.20.0.2","TLSv1.2","Client Hello"
"71","0.243342418","66","5e:06:ae:be:ee:ea","8a:05:5e:32:4d:aa","172.20.0.2","172.20.0.3","TCP","4433 → 58156 [ACK] Seq=1 Ack=1704 Win=64128 Len=0 TSval=1499605115 TSecr=1308689320"
"72","0.249491992","2052","5e:06:ae:be:ee:ea","8a:05:5e:32:4d:aa","172.20.0.2","172.20.0.3","TLSv1.3","Server Hello, Change Cipher Spec, Application Data, Application Data, Application Data, Application Data"
"73","0.249534914","66","8a:05:5e:32:4d:aa","5e:06:ae:be:ee:ea","172.20.0.3","172.20.0.2","TCP","58156 → 4433 [ACK] Seq=1704 Ack=1987 Win=64128 Len=0 TSval=1308689326 TSecr=1499605121"
"74","0.255961384","146","8a:05:5e:32:4d:aa","5e:06:ae:be:ee:ea","172.20.0.3","172.20.0.2","TLSv1.3","Change Cipher Spec, Application Data"
"75","0.256040331","66","8a:05:5e:32:4d:aa","5e:06:ae:be:ee:ea","172.20.0.3","172.20.0.2","TCP","58156 → 4433 [RST, ACK] Seq=1784 Ack=1987 Win=64128 Len=0 TSval=1308689332 TSecr=1499605121"
"76","0.271202876","74","8a:05:5e:32:4d:aa","5e:06:ae:be:ee:ea","172.20.0.3","172.20.0.2","TCP","58172 → 4433 [SYN] Seq=0 Win=64240 Len=0 MSS=1460 SACK_PERM TSval=1308689347 TSecr=0 WS=128"
"77","0.271236617","74","5e:06:ae:be:ee:ea","8a:05:5e:32:4d:aa","172.20.0.2","172.20.0.3","TCP","4433 → 58172 [SYN, ACK] Seq=0 Ack=1 Win=65160 Len=0 MSS=1460 SACK_PERM TSval=1499605142 TSecr=1308689347 WS=128"
"78","0.271270948","66","8a:05:5e:32:4d:aa","5e:06:ae:be:ee:ea","172.20.0.3","172.20.0.2","TCP","58172 → 4433 [ACK] Seq=1 Ack=1 Win=64256 Len=0 TSval=1308689348 TSecr=1499605142"
"79","0.271321783","1769","8a:05:5e:32:4d:aa","5e:06:ae:be:ee:ea","172.20.0.3","172.20.0.2","TLSv1.2","Client Hello"
"80","0.271328622","66","5e:06:ae:be:ee:ea","8a:05:5e:32:4d:aa","172.20.0.2","172.20.0.3","TCP","4433 → 58172 [ACK] Seq=1 Ack=1704 Win=64128 Len=0 TSval=1499605143 TSecr=1308689348"
"81","0.277289365","2052","5e:06:ae:be:ee:ea","8a:05:5e:32:4d:aa","172.20.0.2","172.20.0.3","TLSv1.3","Server Hello, Change Cipher Spec, Application Data, Application Data, Application Data, Application Data"
"82","0.277344244","66","8a:05:5e:32:4d:aa","5e:06:ae:be:ee:ea","172.20.0.3","172.20.0.2","TCP","58172 → 4433 [ACK] Seq=1704 Ack=1987 Win=64128 Len=0 TSval=1308689354 TSecr=1499605149"
"83","0.283245058","146","8a:05:5e:32:4d:aa","5e:06:ae:be:ee:ea","172.20.0.3","172.20.0.2","TLSv1.3","Change Cipher Spec, Application Data"
"84","0.283439670","321","5e:06:ae:be:ee:ea","8a:05:5e:32:4d:aa","172.20.0.2","172.20.0.3","TLSv1.3","Application Data"
"85","0.283491879","321","5e:06:ae:be:ee:ea","8a:05:5e:32:4d:aa","172.20.0.2","172.20.0.3","TLSv1.3","Application Data"
"86","0.283572508","66","8a:05:5e:32:4d:aa","5e:06:ae:be:ee:ea","172.20.0.3","172.20.0.2","TCP","58172 → 4433 [RST, ACK] Seq=1784 Ack=2497 Win=64128 Len=0 TSval=1308689360 TSecr=1499605155"
"87","0.300222491","74","8a:05:5e:32:4d:aa","5e:06:ae:be:ee:ea","172.20.0.3","172.20.0.2","TCP","58176 → 4433 [SYN] Seq=0 Win=64240 Len=0 MSS=1460 SACK_PERM TSval=1308689376 TSecr=0 WS=128"
"88","0.300277863","74","5e:06:ae:be:ee:ea","8a:05:5e:32:4d:aa","172.20.0.2","172.20.0.3","TCP","4433 → 58176 [SYN, ACK] Seq=0 Ack=1 Win=65160 Len=0 MSS=1460 SACK_PERM TSval=1499605172 TSecr=1308689376 WS=128"
"89","0.300332714","66","8a:05:5e:32:4d:aa","5e:06:ae:be:ee:ea","172.20.0.3","172.20.0.2","TCP","58176 → 4433 [ACK] Seq=1 Ack=1 Win=64256 Len=0 TSval=1308689377 TSecr=1499605172"
"90","0.300385949","1769","8a:05:5e:32:4d:aa","5e:06:ae:be:ee:ea","172.20.0.3","172.20.0.2","TLSv1.2","Client Hello"
"91","0.300394074","66","5e:06:ae:be:ee:ea","8a:05:5e:32:4d:aa","172.20.0.2","172.20.0.3","TCP","4433 → 58176 [ACK] Seq=1 Ack=1704 Win=64128 Len=0 TSval=1499605172 TSecr=1308689377"
"92","0.307107291","2052","5e:06:ae:be:ee:ea","8a:05:5e:32:4d:aa","172.20.0.2","172.20.0.3","TLSv1.3","Server Hello, Change Cipher Spec, Application Data, Application Data, Application Data, Application Data"
"93","0.307169440","66","8a:05:5e:32:4d:aa","5e:06:ae:be:ee:ea","172.20.0.3","172.20.0.2","TCP","58176 → 4433 [ACK] Seq=1704 Ack=1987 Win=64128 Len=0 TSval=1308689383 TSecr=1499605178"
"94","0.313119210","146","8a:05:5e:32:4d:aa","5e:06:ae:be:ee:ea","172.20.0.3","172.20.0.2","TLSv1.3","Change Cipher Spec, Application Data"
"95","0.313208165","66","8a:05:5e:32:4d:aa","5e:06:ae:be:ee:ea","172.20.0.3","172.20.0.2","TCP","58176 → 4433 [RST, ACK] Seq=1784 Ack=1987 Win=64128 Len=0 TSval=1308689389 TSecr=1499605178"
"96","0.329033553","74","8a:05:5e:32:4d:aa","5e:06:ae:be:ee:ea","172.20.0.3","172.20.0.2","TCP","58184 → 4433 [SYN] Seq=0 Win=64240 Len=0 MSS=1460 SACK_PERM TSval=1308689405 TSecr=0 WS=128"
"97","0.329060670","74","5e:06:ae:be:ee:ea","8a:05:5e:32:4d:aa","172.20.0.2","172.20.0.3","TCP","4433 → 58184 [SYN, ACK] Seq=0 Ack=1 Win=65160 Len=0 MSS=1460 SACK_PERM TSval=1499605200 TSecr=1308689405 WS=128"
"98","0.329081120","66","8a:05:5e:32:4d:aa","5e:06:ae:be:ee:ea","172.20.0.3","172.20.0.2","TCP","58184 → 4433 [ACK] Seq=1 Ack=1 Win=64256 Len=0 TSval=1308689405 TSecr=1499605200"
"99","0.329127718","1769","8a:05:5e:32:4d:aa","5e:06:ae:be:ee:ea","172.20.0.3","172.20.0.2","TLSv1.2","Client Hello"
"100","0.329132784","66","5e:06:ae:be:ee:ea","8a:05:5e:32:4d:aa","172.20.0.2","172.20.0.3","TCP","4433 → 58184 [ACK] Seq=1 Ack=1704 Win=64128 Len=0 TSval=1499605200 TSecr=1308689405"
"101","0.338476341","2052","5e:06:ae:be:ee:ea","8a:05:5e:32:4d:aa","172.20.0.2","172.20.0.3","TLSv1.3","Server Hello, Change Cipher Spec, Application Data, Application Data, Application Data, Application Data"
"102","0.338548629","66","8a:05:5e:32:4d:aa","5e:06:ae:be:ee:ea","172.20.0.3","172.20.0.2","TCP","58184 → 4433 [ACK] Seq=1704 Ack=1987 Win=64128 Len=0 TSval=1308689415 TSecr=1499605210"
"103","0.344422218","146","8a:05:5e:32:4d:aa","5e:06:ae:be:ee:ea","172.20.0.3","172.20.0.2","TLSv1.3","Change Cipher Spec, Application Data"
"104","0.344509774","66","8a:05:5e:32:4d:aa","5e:06:ae:be:ee:ea","172.20.0.3","172.20.0.2","TCP","58184 → 4433 [RST, ACK] Seq=1784 Ack=1987 Win=64128 Len=0 TSval=1308689421 TSecr=1499605210"
"105","0.361901982","74","8a:05:5e:32:4d:aa","5e:06:ae:be:ee:ea","172.20.0.3","172.20.0.2","TCP","58196 → 4433 [SYN] Seq=0 Win=64240 Len=0 MSS=1460 SACK_PERM TSval=1308689438 TSecr=0 WS=128"
"106","0.361930132","74","5e:06:ae:be:ee:ea","8a:05:5e:32:4d:aa","172.20.0.2","172.20.0.3","TCP","4433 → 58196 [SYN, ACK] Seq=0 Ack=1 Win=65160 Len=0 MSS=1460 SACK_PERM TSval=1499605233 TSecr=1308689438 WS=128"
"107","0.361951235","66","8a:05:5e:32:4d:aa","5e:06:ae:be:ee:ea","172.20.0.3","172.20.0.2","TCP","58196 → 4433 [ACK] Seq=1 Ack=1 Win=64256 Len=0 TSval=1308689438 TSecr=1499605233"
"108","0.362009581","1769","8a:05:5e:32:4d:aa","5e:06:ae:be:ee:ea","172.20.0.3","172.20.0.2","TLSv1.2","Client Hello"
"109","0.362014290","66","5e:06:ae:be:ee:ea","8a:05:5e:32:4d:aa","172.20.0.2","172.20.0.3","TCP","4433 → 58196 [ACK] Seq=1 Ack=1704 Win=64128 Len=0 TSval=1499605233 TSecr=1308689438"
"110","0.368302359","2053","5e:06:ae:be:ee:ea","8a:05:5e:32:4d:aa","172.20.0.2","172.20.0.3","TLSv1.3","Server Hello, Change Cipher Spec, Application Data, Application Data, Application Data, Application Data"
"111","0.368362551","66","8a:05:5e:32:4d:aa","5e:06:ae:be:ee:ea","172.20.0.3","172.20.0.2","TCP","58196 → 4433 [ACK] Seq=1704 Ack=1988 Win=64128 Len=0 TSval=1308689445 TSecr=1499605240"
"112","0.374069405","146","8a:05:5e:32:4d:aa","5e:06:ae:be:ee:ea","172.20.0.3","172.20.0.2","TLSv1.3","Change Cipher Spec, Application Data"
"113","0.374172110","66","8a:05:5e:32:4d:aa","5e:06:ae:be:ee:ea","172.20.0.3","172.20.0.2","TCP","58196 → 4433 [RST, ACK] Seq=1784 Ack=1988 Win=64128 Len=0 TSval=1308689450 TSecr=1499605240"
"114","0.391060506","74","8a:05:5e:32:4d:aa","5e:06:ae:be:ee:ea","172.20.0.3","172.20.0.2","TCP","58212 → 4433 [SYN] Seq=0 Win=64240 Len=0 MSS=1460 SACK_PERM TSval=1308689467 TSecr=0 WS=128"
"115","0.391084756","74","5e:06:ae:be:ee:ea","8a:05:5e:32:4d:aa","172.20.0.2","172.20.0.3","TCP","4433 → 58212 [SYN, ACK] Seq=0 Ack=1 Win=65160 Len=0 MSS=1460 SACK_PERM TSval=1499605262 TSecr=1308689467 WS=128"
"116","0.391103981","66","8a:05:5e:32:4d:aa","5e:06:ae:be:ee:ea","172.20.0.3","172.20.0.2","TCP","58212 → 4433 [ACK] Seq=1 Ack=1 Win=64256 Len=0 TSval=1308689467 TSecr=1499605262"
"117","0.391185390","1769","8a:05:5e:32:4d:aa","5e:06:ae:be:ee:ea","172.20.0.3","172.20.0.2","TLSv1.2","Client Hello"
"118","0.391191424","66","5e:06:ae:be:ee:ea","8a:05:5e:32:4d:aa","172.20.0.2","172.20.0.3","TCP","4433 → 58212 [ACK] Seq=1 Ack=1704 Win=64128 Len=0 TSval=1499605262 TSecr=1308689467"
"119","0.397637215","2052","5e:06:ae:be:ee:ea","8a:05:5e:32:4d:aa","172.20.0.2","172.20.0.3","TLSv1.3","Server Hello, Change Cipher Spec, Application Data, Application Data, Application Data, Application Data"
"120","0.397690265","66","8a:05:5e:32:4d:aa","5e:06:ae:be:ee:ea","172.20.0.3","172.20.0.2","TCP","58212 → 4433 [ACK] Seq=1704 Ack=1987 Win=64128 Len=0 TSval=1308689474 TSecr=1499605269"
"121","0.403220487","146","8a:05:5e:32:4d:aa","5e:06:ae:be:ee:ea","172.20.0.3","172.20.0.2","TLSv1.3","Change Cipher Spec, Application Data"
"122","0.403310321","66","8a:05:5e:32:4d:aa","5e:06:ae:be:ee:ea","172.20.0.3","172.20.0.2","TCP","58212 → 4433 [RST, ACK] Seq=1784 Ack=1987 Win=64128 Len=0 TSval=1308689480 TSecr=1499605269"
"123","0.419267582","74","8a:05:5e:32:4d:aa","5e:06:ae:be:ee:ea","172.20.0.3","172.20.0.2","TCP","58228 → 4433 [SYN] Seq=0 Win=64240 Len=0 MSS=1460 SACK_PERM TSval=1308689495 TSecr=0 WS=128"
"124","0.419295066","74","5e:06:ae:be:ee:ea","8a:05:5e:32:4d:aa","172.20.0.2","172.20.0.3","TCP","4433 → 58228 [SYN, ACK] Seq=0 Ack=1 Win=65160 Len=0 MSS=1460 SACK_PERM TSval=1499605291 TSecr=1308689495 WS=128"
"125","0.419314849","66","8a:05:5e:32:4d:aa","5e:06:ae:be:ee:ea","172.20.0.3","172.20.0.2","TCP","58228 → 4433 [ACK] Seq=1 Ack=1 Win=64256 Len=0 TSval=1308689496 TSecr=1499605291"
"126","0.419357184","1769","8a:05:5e:32:4d:aa","5e:06:ae:be:ee:ea","172.20.0.3","172.20.0.2","TLSv1.2","Client Hello"
"127","0.419363156","66","5e:06:ae:be:ee:ea","8a:05:5e:32:4d:aa","172.20.0.2","172.20.0.3","TCP","4433 → 58228 [ACK] Seq=1 Ack=1704 Win=64128 Len=0 TSval=1499605291 TSecr=1308689496"
"128","0.425411783","2052","5e:06:ae:be:ee:ea","8a:05:5e:32:4d:aa","172.20.0.2","172.20.0.3","TLSv1.3","Server Hello, Change Cipher Spec, Application Data, Application Data, Application Data, Application Data"
"129","0.425461432","66","8a:05:5e:32:4d:aa","5e:06:ae:be:ee:ea","172.20.0.3","172.20.0.2","TCP","58228 → 4433 [ACK] Seq=1704 Ack=1987 Win=64128 Len=0 TSval=1308689502 TSecr=1499605297"
"130","0.430950420","146","8a:05:5e:32:4d:aa","5e:06:ae:be:ee:ea","172.20.0.3","172.20.0.2","TLSv1.3","Change Cipher Spec, Application Data"
"131","0.431015070","66","8a:05:5e:32:4d:aa","5e:06:ae:be:ee:ea","172.20.0.3","172.20.0.2","TCP","58228 → 4433 [RST, ACK] Seq=1784 Ack=1987 Win=64128 Len=0 TSval=1308689507 TSecr=1499605297"
"132","0.447340961","74","8a:05:5e:32:4d:aa","5e:06:ae:be:ee:ea","172.20.0.3","172.20.0.2","TCP","58234 → 4433 [SYN] Seq=0 Win=64240 Len=0 MSS=1460 SACK_PERM TSval=1308689524 TSecr=0 WS=128"
"133","0.447369455","74","5e:06:ae:be:ee:ea","8a:05:5e:32:4d:aa","172.20.0.2","172.20.0.3","TCP","4433 → 58234 [SYN, ACK] Seq=0 Ack=1 Win=65160 Len=0 MSS=1460 SACK_PERM TSval=1499605319 TSecr=1308689524 WS=128"
"134","0.447389639","66","8a:05:5e:32:4d:aa","5e:06:ae:be:ee:ea","172.20.0.3","172.20.0.2","TCP","58234 → 4433 [ACK] Seq=1 Ack=1 Win=64256 Len=0 TSval=1308689524 TSecr=1499605319"
"135","0.447435978","1769","8a:05:5e:32:4d:aa","5e:06:ae:be:ee:ea","172.20.0.3","172.20.0.2","TLSv1.2","Client Hello"
"136","0.447440316","66","5e:06:ae:be:ee:ea","8a:05:5e:32:4d:aa","172.20.0.2","172.20.0.3","TCP","4433 → 58234 [ACK] Seq=1 Ack=1704 Win=64128 Len=0 TSval=1499605319 TSecr=1308689524"
"137","0.453657357","2053","5e:06:ae:be:ee:ea","8a:05:5e:32:4d:aa","172.20.0.2","172.20.0.3","TLSv1.3","Server Hello, Change Cipher Spec, Application Data, Application Data, Application Data, Application Data"
"138","0.453703476","66","8a:05:5e:32:4d:aa","5e:06:ae:be:ee:ea","172.20.0.3","172.20.0.2","TCP","58234 → 4433 [ACK] Seq=1704 Ack=1988 Win=64128 Len=0 TSval=1308689530 TSecr=1499605325"
"139","0.459108871","146","8a:05:5e:32:4d:aa","5e:06:ae:be:ee:ea","172.20.0.3","172.20.0.2","TLSv1.3","Change Cipher Spec, Application Data"
"140","0.459202890","66","8a:05:5e:32:4d:aa","5e:06:ae:be:ee:ea","172.20.0.3","172.20.0.2","TCP","58234 → 4433 [RST, ACK] Seq=1784 Ack=1988 Win=64128 Len=0 TSval=1308689535 TSecr=1499605325"
"141","0.474200594","74","8a:05:5e:32:4d:aa","5e:06:ae:be:ee:ea","172.20.0.3","172.20.0.2","TCP","58242 → 4433 [SYN] Seq=0 Win=64240 Len=0 MSS=1460 SACK_PERM TSval=1308689550 TSecr=0 WS=128"
"142","0.474228079","74","5e:06:ae:be:ee:ea","8a:05:5e:32:4d:aa","172.20.0.2","172.20.0.3","TCP","4433 → 58242 [SYN, ACK] Seq=0 Ack=1 Win=65160 Len=0 MSS=1460 SACK_PERM TSval=1499605345 TSecr=1308689550 WS=128"
"143","0.474258857","66","8a:05:5e:32:4d:aa","5e:06:ae:be:ee:ea","172.20.0.3","172.20.0.2","TCP","58242 → 4433 [ACK] Seq=1 Ack=1 Win=64256 Len=0 TSval=1308689550 TSecr=1499605345"
"144","0.474303371","1769","8a:05:5e:32:4d:aa","5e:06:ae:be:ee:ea","172.20.0.3","172.20.0.2","TLSv1.2","Client Hello"
"145","0.474308080","66","5e:06:ae:be:ee:ea","8a:05:5e:32:4d:aa","172.20.0.2","172.20.0.3","TCP","4433 → 58242 [ACK] Seq=1 Ack=1704 Win=64128 Len=0 TSval=1499605346 TSecr=1308689551"
"146","0.480373191","2053","5e:06:ae:be:ee:ea","8a:05:5e:32:4d:aa","172.20.0.2","172.20.0.3","TLSv1.3","Server Hello, Change Cipher Spec, Application Data, Application Data, Application Data, Application Data"
"147","0.480418256","66","8a:05:5e:32:4d:aa","5e:06:ae:be:ee:ea","172.20.0.3","172.20.0.2","TCP","58242 → 4433 [ACK] Seq=1704 Ack=1988 Win=64128 Len=0 TSval=1308689557 TSecr=1499605352"
"148","0.485796373","146","8a:05:5e:32:4d:aa","5e:06:ae:be:ee:ea","172.20.0.3","172.20.0.2","TLSv1.3","Change Cipher Spec, Application Data"
"149","0.485866157","66","8a:05:5e:32:4d:aa","5e:06:ae:be:ee:ea","172.20.0.3","172.20.0.2","TCP","58242 → 4433 [RST, ACK] Seq=1784 Ack=1988 Win=64128 Len=0 TSval=1308689562 TSecr=1499605352"
"150","0.501282957","74","8a:05:5e:32:4d:aa","5e:06:ae:be:ee:ea","172.20.0.3","172.20.0.2","TCP","58250 → 4433 [SYN] Seq=0 Win=64240 Len=0 MSS=1460 SACK_PERM TSval=1308689577 TSecr=0 WS=128"
"151","0.501311445","74","5e:06:ae:be:ee:ea","8a:05:5e:32:4d:aa","172.20.0.2","172.20.0.3","TCP","4433 → 58250 [SYN, ACK] Seq=0 Ack=1 Win=65160 Len=0 MSS=1460 SACK_PERM TSval=1499605373 TSecr=1308689577 WS=128"
"152","0.501332250","66","8a:05:5e:32:4d:aa","5e:06:ae:be:ee:ea","172.20.0.3","172.20.0.2","TCP","58250 → 4433 [ACK] Seq=1 Ack=1 Win=64256 Len=0 TSval=1308689578 TSecr=1499605373"
"153","0.501380124","1769","8a:05:5e:32:4d:aa","5e:06:ae:be:ee:ea","172.20.0.3","172.20.0.2","TLSv1.2","Client Hello"
"154","0.501385012","66","5e:06:ae:be:ee:ea","8a:05:5e:32:4d:aa","172.20.0.2","172.20.0.3","TCP","4433 → 58250 [ACK] Seq=1 Ack=1704 Win=64128 Len=0 TSval=1499605373 TSecr=1308689578"
"155","0.508354431","2051","5e:06:ae:be:ee:ea","8a:05:5e:32:4d:aa","172.20.0.2","172.20.0.3","TLSv1.3","Server Hello, Change Cipher Spec, Application Data, Application Data, Application Data, Application Data"
"156","0.508410196","66","8a:05:5e:32:4d:aa","5e:06:ae:be:ee:ea","172.20.0.3","172.20.0.2","TCP","58250 → 4433 [ACK] Seq=1704 Ack=1986 Win=64128 Len=0 TSval=1308689585 TSecr=1499605380"
"157","0.517222411","146","8a:05:5e:32:4d:aa","5e:06:ae:be:ee:ea","172.20.0.3","172.20.0.2","TLSv1.3","Change Cipher Spec, Application Data"
"158","0.517348892","66","8a:05:5e:32:4d:aa","5e:06:ae:be:ee:ea","172.20.0.3","172.20.0.2","TCP","58250 → 4433 [RST, ACK] Seq=1784 Ack=1986 Win=64128 Len=0 TSval=1308689594 TSecr=1499605380"
"159","0.537406588","74","8a:05:5e:32:4d:aa","5e:06:ae:be:ee:ea","172.20.0.3","172.20.0.2","TCP","58260 → 4433 [SYN] Seq=0 Win=64240 Len=0 MSS=1460 SACK_PERM TSval=1308689614 TSecr=0 WS=128"
"160","0.537440226","74","5e:06:ae:be:ee:ea","8a:05:5e:32:4d:aa","172.20.0.2","172.20.0.3","TCP","4433 → 58260 [SYN, ACK] Seq=0 Ack=1 Win=65160 Len=0 MSS=1460 SACK_PERM TSval=1499605409 TSecr=1308689614 WS=128"
"161","0.537461712","66","8a:05:5e:32:4d:aa","5e:06:ae:be:ee:ea","172.20.0.3","172.20.0.2","TCP","58260 → 4433 [ACK] Seq=1 Ack=1 Win=64256 Len=0 TSval=1308689614 TSecr=1499605409"
"162","0.537508482","1769","8a:05:5e:32:4d:aa","5e:06:ae:be:ee:ea","172.20.0.3","172.20.0.2","TLSv1.2","Client Hello"
"163","0.537516531","66","5e:06:ae:be:ee:ea","8a:05:5e:32:4d:aa","172.20.0.2","172.20.0.3","TCP","4433 → 58260 [ACK] Seq=1 Ack=1704 Win=64128 Len=0 TSval=1499605409 TSecr=1308689614"
"164","0.545265942","2052","5e:06:ae:be:ee:ea","8a:05:5e:32:4d:aa","172.20.0.2","172.20.0.3","TLSv1.3","Server Hello, Change Cipher Spec, Application Data, Application Data, Application Data, Application Data"
"165","0.545335991","66","8a:05:5e:32:4d:aa","5e:06:ae:be:ee:ea","172.20.0.3","172.20.0.2","TCP","58260 → 4433 [ACK] Seq=1704 Ack=1987 Win=64128 Len=0 TSval=1308689622 TSecr=1499605416"
"166","0.551066892","146","8a:05:5e:32:4d:aa","5e:06:ae:be:ee:ea","172.20.0.3","172.20.0.2","TLSv1.3","Change Cipher Spec, Application Data"
"167","0.551141818","66","8a:05:5e:32:4d:aa","5e:06:ae:be:ee:ea","172.20.0.3","172.20.0.2","TCP","58260 → 4433 [RST, ACK] Seq=1784 Ack=1987 Win=64128 Len=0 TSval=1308689627 TSecr=1499605416"
"168","0.566271603","74","8a:05:5e:32:4d:aa","5e:06:ae:be:ee:ea","172.20.0.3","172.20.0.2","TCP","58270 → 4433 [SYN] Seq=0 Win=64240 Len=0 MSS=1460 SACK_PERM TSval=1308689642 TSecr=0 WS=128"
"169","0.566301697","74","5e:06:ae:be:ee:ea","8a:05:5e:32:4d:aa","172.20.0.2","172.20.0.3","TCP","4433 → 58270 [SYN, ACK] Seq=0 Ack=1 Win=65160 Len=0 MSS=1460 SACK_PERM TSval=1499605438 TSecr=1308689642 WS=128"
"170","0.566322323","66","8a:05:5e:32:4d:aa","5e:06:ae:be:ee:ea","172.20.0.3","172.20.0.2","TCP","58270 → 4433 [ACK] Seq=1 Ack=1 Win=64256 Len=0 TSval=1308689643 TSecr=1499605438"
"171","0.566367552","1769","8a:05:5e:32:4d:aa","5e:06:ae:be:ee:ea","172.20.0.3","172.20.0.2","TLSv1.2","Client Hello"
"172","0.566374483","66","5e:06:ae:be:ee:ea","8a:05:5e:32:4d:aa","172.20.0.2","172.20.0.3","TCP","4433 → 58270 [ACK] Seq=1 Ack=1704 Win=64128 Len=0 TSval=1499605438 TSecr=1308689643"
"173","0.573144808","2052","5e:06:ae:be:ee:ea","8a:05:5e:32:4d:aa","172.20.0.2","172.20.0.3","TLSv1.3","Server Hello, Change Cipher Spec, Application Data, Application Data, Application Data, Application Data"
"174","0.573199375","66","8a:05:5e:32:4d:aa","5e:06:ae:be:ee:ea","172.20.0.3","172.20.0.2","TCP","58270 → 4433 [ACK] Seq=1704 Ack=1987 Win=64128 Len=0 TSval=1308689649 TSecr=1499605444"
"175","0.579200715","146","8a:05:5e:32:4d:aa","5e:06:ae:be:ee:ea","172.20.0.3","172.20.0.2","TLSv1.3","Change Cipher Spec, Application Data"
"176","0.579389763","321","5e:06:ae:be:ee:ea","8a:05:5e:32:4d:aa","172.20.0.2","172.20.0.3","TLSv1.3","Application Data"
"177","0.579437703","321","5e:06:ae:be:ee:ea","8a:05:5e:32:4d:aa","172.20.0.2","172.20.0.3","TLSv1.3","Application Data"
"178","0.579503416","66","8a:05:5e:32:4d:aa","5e:06:ae:be:ee:ea","172.20.0.3","172.20.0.2","TCP","58270 → 4433 [RST, ACK] Seq=1784 Ack=2497 Win=64128 Len=0 TSval=1308689656 TSecr=1499605451"
"179","0.594873852","74","8a:05:5e:32:4d:aa","5e:06:ae:be:ee:ea","172.20.0.3","172.20.0.2","TCP","58286 → 4433 [SYN] Seq=0 Win=64240 Len=0 MSS=1460 SACK_PERM TSval=1308689671 TSecr=0 WS=128"
"180","0.594896829","74","5e:06:ae:be:ee:ea","8a:05:5e:32:4d:aa","172.20.0.2","172.20.0.3","TCP","4433 → 58286 [SYN, ACK] Seq=0 Ack=1 Win=65160 Len=0 MSS=1460 SACK_PERM TSval=1499605466 TSecr=1308689671 WS=128"
"181","0.594914432","66","8a:05:5e:32:4d:aa","5e:06:ae:be:ee:ea","172.20.0.3","172.20.0.2","TCP","58286 → 4433 [ACK] Seq=1 Ack=1 Win=64256 Len=0 TSval=1308689671 TSecr=1499605466"
"182","0.594957484","1769","8a:05:5e:32:4d:aa","5e:06:ae:be:ee:ea","172.20.0.3","172.20.0.2","TLSv1.2","Client Hello"
"183","0.594963662","66","5e:06:ae:be:ee:ea","8a:05:5e:32:4d:aa","172.20.0.2","172.20.0.3","TCP","4433 → 58286 [ACK] Seq=1 Ack=1704 Win=64128 Len=0 TSval=1499605466 TSecr=1308689671"
"184","0.604532623","2051","5e:06:ae:be:ee:ea","8a:05:5e:32:4d:aa","172.20.0.2","172.20.0.3","TLSv1.3","Server Hello, Change Cipher Spec, Application Data, Application Data, Application Data, Application Data"
"185","0.604624501","66","8a:05:5e:32:4d:aa","5e:06:ae:be:ee:ea","172.20.0.3","172.20.0.2","TCP","58286 → 4433 [ACK] Seq=1704 Ack=1986 Win=64128 Len=0 TSval=1308689681 TSecr=1499605476"
"186","0.612404574","146","8a:05:5e:32:4d:aa","5e:06:ae:be:ee:ea","172.20.0.3","172.20.0.2","TLSv1.3","Change Cipher Spec, Application Data"
"187","0.612471388","66","8a:05:5e:32:4d:aa","5e:06:ae:be:ee:ea","172.20.0.3","172.20.0.2","TCP","58286 → 4433 [RST, ACK] Seq=1784 Ack=1986 Win=64128 Len=0 TSval=1308689689 TSecr=1499605476"
"188","0.629113501","74","8a:05:5e:32:4d:aa","5e:06:ae:be:ee:ea","172.20.0.3","172.20.0.2","TCP","58300 → 4433 [SYN] Seq=0 Win=64240 Len=0 MSS=1460 SACK_PERM TSval=1308689705 TSecr=0 WS=128"
"189","0.629142405","74","5e:06:ae:be:ee:ea","8a:05:5e:32:4d:aa","172.20.0.2","172.20.0.3","TCP","4433 → 58300 [SYN, ACK] Seq=0 Ack=1 Win=65160 Len=0 MSS=1460 SACK_PERM TSval=1499605500 TSecr=1308689705 WS=128"
"190","0.629169477","66","8a:05:5e:32:4d:aa","5e:06:ae:be:ee:ea","172.20.0.3","172.20.0.2","TCP","58300 → 4433 [ACK] Seq=1 Ack=1 Win=64256 Len=0 TSval=1308689705 TSecr=1499605500"
"191","0.629216754","1769","8a:05:5e:32:4d:aa","5e:06:ae:be:ee:ea","172.20.0.3","172.20.0.2","TLSv1.2","Client Hello"
"192","0.629223207","66","5e:06:ae:be:ee:ea","8a:05:5e:32:4d:aa","172.20.0.2","172.20.0.3","TCP","4433 → 58300 [ACK] Seq=1 Ack=1704 Win=64128 Len=0 TSval=1499605500 TSecr=1308689705"
"193","0.636149272","2052","5e:06:ae:be:ee:ea","8a:05:5e:32:4d:aa","172.20.0.2","172.20.0.3","TLSv1.3","Server Hello, Change Cipher Spec, Application Data, Application Data, Application Data, Application Data"
"194","0.636208169","66","8a:05:5e:32:4d:aa","5e:06:ae:be:ee:ea","172.20.0.3","172.20.0.2","TCP","58300 → 4433 [ACK] Seq=1704 Ack=1987 Win=64128 Len=0 TSval=1308689712 TSecr=1499605507"
"195","0.642927559","146","8a:05:5e:32:4d:aa","5e:06:ae:be:ee:ea","172.20.0.3","172.20.0.2","TLSv1.3","Change Cipher Spec, Application Data"
"196","0.643036215","66","8a:05:5e:32:4d:aa","5e:06:ae:be:ee:ea","172.20.0.3","172.20.0.2","TCP","58300 → 4433 [RST, ACK] Seq=1784 Ack=1987 Win=64128 Len=0 TSval=1308689719 TSecr=1499605507"
"197","0.665610540","74","8a:05:5e:32:4d:aa","5e:06:ae:be:ee:ea","172.20.0.3","172.20.0.2","TCP","58304 → 4433 [SYN] Seq=0 Win=64240 Len=0 MSS=1460 SACK_PERM TSval=1308689742 TSecr=0 WS=128"
"198","0.665644411","74","5e:06:ae:be:ee:ea","8a:05:5e:32:4d:aa","172.20.0.2","172.20.0.3","TCP","4433 → 58304 [SYN, ACK] Seq=0 Ack=1 Win=65160 Len=0 MSS=1460 SACK_PERM TSval=1499605537 TSecr=1308689742 WS=128"
"199","0.665673295","66","8a:05:5e:32:4d:aa","5e:06:ae:be:ee:ea","172.20.0.3","172.20.0.2","TCP","58304 → 4433 [ACK] Seq=1 Ack=1 Win=64256 Len=0 TSval=1308689742 TSecr=1499605537"
"200","0.665742363","1769","8a:05:5e:32:4d:aa","5e:06:ae:be:ee:ea","172.20.0.3","172.20.0.2","TLSv1.2","Client Hello"
"201","0.665753051","66","5e:06:ae:be:ee:ea","8a:05:5e:32:4d:aa","172.20.0.2","172.20.0.3","TCP","4433 → 58304 [ACK] Seq=1 Ack=1704 Win=64128 Len=0 TSval=1499605537 TSecr=1308689742"
"202","0.672655564","2051","5e:06:ae:be:ee:ea","8a:05:5e:32:4d:aa","172.20.0.2","172.20.0.3","TLSv1.3","Server Hello, Change Cipher Spec, Application Data, Application Data, Application Data, Application Data"
"203","0.672702311","66","8a:05:5e:32:4d:aa","5e:06:ae:be:ee:ea","172.20.0.3","172.20.0.2","TCP","58304 → 4433 [ACK] Seq=1704 Ack=1986 Win=64128 Len=0 TSval=1308689749 TSecr=1499605544"
"204","0.681111707","146","8a:05:5e:32:4d:aa","5e:06:ae:be:ee:ea","172.20.0.3","172.20.0.2","TLSv1.3","Change Cipher Spec, Application Data"
"205","0.681228631","66","8a:05:5e:32:4d:aa","5e:06:ae:be:ee:ea","172.20.0.3","172.20.0.2","TCP","58304 → 4433 [RST, ACK] Seq=1784 Ack=1986 Win=64128 Len=0 TSval=1308689757 TSecr=1499605544"
"206","0.697841533","74","8a:05:5e:32:4d:aa","5e:06:ae:be:ee:ea","172.20.0.3","172.20.0.2","TCP","58314 → 4433 [SYN] Seq=0 Win=64240 Len=0 MSS=1460 SACK_PERM TSval=1308689774 TSecr=0 WS=128"
"207","0.697866288","74","5e:06:ae:be:ee:ea","8a:05:5e:32:4d:aa","172.20.0.2","172.20.0.3","TCP","4433 → 58314 [SYN, ACK] Seq=0 Ack=1 Win=65160 Len=0 MSS=1460 SACK_PERM TSval=1499605569 TSecr=1308689774 WS=128"
"208","0.697884295","66","8a:05:5e:32:4d:aa","5e:06:ae:be:ee:ea","172.20.0.3","172.20.0.2","TCP","58314 → 4433 [ACK] Seq=1 Ack=1 Win=64256 Len=0 TSval=1308689774 TSecr=1499605569"
"209","0.697932982","1769","8a:05:5e:32:4d:aa","5e:06:ae:be:ee:ea","172.20.0.3","172.20.0.2","TLSv1.2","Client Hello"
"210","0.697938849","66","5e:06:ae:be:ee:ea","8a:05:5e:32:4d:aa","172.20.0.2","172.20.0.3","TCP","4433 → 58314 [ACK] Seq=1 Ack=1704 Win=64128 Len=0 TSval=1499605569 TSecr=1308689774"
"211","0.705062793","2052","5e:06:ae:be:ee:ea","8a:05:5e:32:4d:aa","172.20.0.2","172.20.0.3","TLSv1.3","Server Hello, Change Cipher Spec, Application Data, Application Data, Application Data, Application Data"
"212","0.705116400","66","8a:05:5e:32:4d:aa","5e:06:ae:be:ee:ea","172.20.0.3","172.20.0.2","TCP","58314 → 4433 [ACK] Seq=1704 Ack=1987 Win=64128 Len=0 TSval=1308689781 TSecr=1499605576"
"213","0.712518717","146","8a:05:5e:32:4d:aa","5e:06:ae:be:ee:ea","172.20.0.3","172.20.0.2","TLSv1.3","Change Cipher Spec, Application Data"
"214","0.712623981","66","8a:05:5e:32:4d:aa","5e:06:ae:be:ee:ea","172.20.0.3","172.20.0.2","TCP","58314 → 4433 [RST, ACK] Seq=1784 Ack=1987 Win=64128 Len=0 TSval=1308689789 TSecr=1499605576"
"215","0.730602176","74","8a:05:5e:32:4d:aa","5e:06:ae:be:ee:ea","172.20.0.3","172.20.0.2","TCP","58328 → 4433 [SYN] Seq=0 Win=64240 Len=0 MSS=1460 SACK_PERM TSval=1308689807 TSecr=0 WS=128"
"216","0.730635315","74","5e:06:ae:be:ee:ea","8a:05:5e:32:4d:aa","172.20.0.2","172.20.0.3","TCP","4433 → 58328 [SYN, ACK] Seq=0 Ack=1 Win=65160 Len=0 MSS=1460 SACK_PERM TSval=1499605602 TSecr=1308689807 WS=128"
"217","0.730659262","66","8a:05:5e:32:4d:aa","5e:06:ae:be:ee:ea","172.20.0.3","172.20.0.2","TCP","58328 → 4433 [ACK] Seq=1 Ack=1 Win=64256 Len=0 TSval=1308689807 TSecr=1499605602"
"218","0.730716277","1769","8a:05:5e:32:4d:aa","5e:06:ae:be:ee:ea","172.20.0.3","172.20.0.2","TLSv1.2","Client Hello"
"219","0.730723057","66","5e:06:ae:be:ee:ea","8a:05:5e:32:4d:aa","172.20.0.2","172.20.0.3","TCP","4433 → 58328 [ACK] Seq=1 Ack=1704 Win=64128 Len=0 TSval=1499605602 TSecr=1308689807"
"220","0.739601192","2052","5e:06:ae:be:ee:ea","8a:05:5e:32:4d:aa","172.20.0.2","172.20.0.3","TLSv1.3","Server Hello, Change Cipher Spec, Application Data, Application Data, Application Data, Application Data"
"221","0.739664235","66","8a:05:5e:32:4d:aa","5e:06:ae:be:ee:ea","172.20.0.3","172.20.0.2","TCP","58328 → 4433 [ACK] Seq=1704 Ack=1987 Win=64128 Len=0 TSval=1308689816 TSecr=1499605611"
"222","0.746407279","146","8a:05:5e:32:4d:aa","5e:06:ae:be:ee:ea","172.20.0.3","172.20.0.2","TLSv1.3","Change Cipher Spec, Application Data"
"223","0.746486167","66","8a:05:5e:32:4d:aa","5e:06:ae:be:ee:ea","172.20.0.3","172.20.0.2","TCP","58328 → 4433 [RST, ACK] Seq=1784 Ack=1987 Win=64128 Len=0 TSval=1308689823 TSecr=1499605611"
"224","0.768561705","74","8a:05:5e:32:4d:aa","5e:06:ae:be:ee:ea","172.20.0.3","172.20.0.2","TCP","58344 → 4433 [SYN] Seq=0 Win=64240 Len=0 MSS=1460 SACK_PERM TSval=1308689845 TSecr=0 WS=128"
"225","0.768592272","74","5e:06:ae:be:ee:ea","8a:05:5e:32:4d:aa","172.20.0.2","172.20.0.3","TCP","4433 → 58344 [SYN, ACK] Seq=0 Ack=1 Win=65160 Len=0 MSS=1460 SACK_PERM TSval=1499605640 TSecr=1308689845 WS=128"
