frame.number,frame.time_relative,frame.len,eth.src,eth.dst,ip.src,ip.dst,_ws.col.protocol,_ws.col.info
"1","0.000000000","42","e6:55:1f:c0:1a:81","ff:ff:ff:ff:ff:ff",,,"ARP","ARP Announcement for 172.20.0.3"
"2","0.029779407","42","e6:55:1f:c0:1a:81","ff:ff:ff:ff:ff:ff",,,"ARP","Who has 172.20.0.2? Tell 172.20.0.3"
"3","0.029802582","42","02:fc:13:7e:fa:69","e6:55:1f:c0:1a:81",,,"ARP","172.20.0.2 is at 02:fc:13:7e:fa:69"
"4","0.029809567","74","e6:55:1f:c0:1a:81","02:fc:13:7e:fa:69","172.20.0.3","172.20.0.2","TCP","39608 → 4433 [SYN] Seq=0 Win=64240 Len=0 MSS=1460 SACK_PERM TSval=1306572950 TSecr=0 WS=128"
"5","0.029829408","74","02:fc:13:7e:fa:69","e6:55:1f:c0:1a:81","172.20.0.2","172.20.0.3","TCP","4433 → 39608 [SYN, ACK] Seq=0 Ack=1 Win=65160 Len=0 MSS=1460 SACK_PERM TSval=1497488745 TSecr=1306572950 WS=128"
"6","0.029848566","66","e6:55:1f:c0:1a:81","02:fc:13:7e:fa:69","172.20.0.3","172.20.0.2","TCP","39608 → 4433 [ACK] Seq=1 Ack=1 Win=64256 Len=0 TSval=1306572950 TSecr=1497488745"
"7","0.029885371","1288","e6:55:1f:c0:1a:81","02:fc:13:7e:fa:69","172.20.0.3","172.20.0.2","TLSv1.2","Client Hello"
"8","0.029891059","66","02:fc:13:7e:fa:69","e6:55:1f:c0:1a:81","172.20.0.2","172.20.0.3","TCP","4433 → 39608 [ACK] Seq=1 Ack=1223 Win=64128 Len=0 TSval=1497488745 TSecr=1306572950"
"9","0.030783025","1472","02:fc:13:7e:fa:69","e6:55:1f:c0:1a:81","172.20.0.2","172.20.0.3","TLSv1.3","Server Hello, Change Cipher Spec, Application Data, Application Data, Application Data, Application Data"
"10","0.030811986","66","e6:55:1f:c0:1a:81","02:fc:13:7e:fa:69","172.20.0.3","172.20.0.2","TCP","39608 → 4433 [ACK] Seq=1223 Ack=1407 Win=64128 Len=0 TSval=1306572951 TSecr=1497488746"
"11","0.031798771","146","e6:55:1f:c0:1a:81","02:fc:13:7e:fa:69","172.20.0.3","172.20.0.2","TLSv1.3","Change Cipher Spec, Application Data"
"12","0.031862680","66","e6:55:1f:c0:1a:81","02:fc:13:7e:fa:69","172.20.0.3","172.20.0.2","TCP","39608 → 4433 [RST, ACK] Seq=1303 Ack=1407 Win=64128 Len=0 TSval=1306572952 TSecr=1497488746"
"13","0.042152032","74","e6:55:1f:c0:1a:81","02:fc:13:7e:fa:69","172.20.0.3","172.20.0.2","TCP","39622 → 4433 [SYN] Seq=0 Win=64240 Len=0 MSS=1460 SACK_PERM TSval=1306572962 TSecr=0 WS=128"
"14","0.042178706","74","02:fc:13:7e:fa:69","e6:55:1f:c0:1a:81","172.20.0.2","172.20.0.3","TCP","4433 → 39622 [SYN, ACK] Seq=0 Ack=1 Win=65160 Len=0 MSS=1460 SACK_PERM TSval=1497488757 TSecr=1306572962 WS=128"
"15","0.042197426","66","e6:55:1f:c0:1a:81","02:fc:13:7e:fa:69","172.20.0.3","172.20.0.2","TCP","39622 → 4433 [ACK] Seq=1 Ack=1 Win=64256 Len=0 TSval=1306572962 TSecr=1497488757"
"16","0.042241014","1288","e6:55:1f:c0:1a:81","02:fc:13:7e:fa:69","172.20.0.3","172.20.0.2","TLSv1.2","Client Hello"
"17","0.042246811","66","02:fc:13:7e:fa:69","e6:55:1f:c0:1a:81","172.20.0.2","172.20.0.3","TCP","4433 → 39622 [ACK] Seq=1 Ack=1223 Win=64128 Len=0 TSval=1497488757 TSecr=1306572962"
"18","0.042744250","1472","02:fc:13:7e:fa:69","e6:55:1f:c0:1a:81","172.20.0.2","172.20.0.3","TLSv1.3","Server Hello, Change Cipher Spec, Application Data, Application Data, Application Data, Application Data"
"19","0.042778120","66","e6:55:1f:c0:1a:81","02:fc:13:7e:fa:69","172.20.0.3","172.20.0.2","TCP","39622 → 4433 [ACK] Seq=1223 Ack=1407 Win=64128 Len=0 TSval=1306572963 TSecr=1497488758"
"20","0.043856576","146","e6:55:1f:c0:1a:81","02:fc:13:7e:fa:69","172.20.0.3","172.20.0.2","TLSv1.3","Change Cipher Spec, Application Data"
"21","0.043919251","66","e6:55:1f:c0:1a:81","02:fc:13:7e:fa:69","172.20.0.3","172.20.0.2","TCP","39622 → 4433 [RST, ACK] Seq=1303 Ack=1407 Win=64128 Len=0 TSval=1306572964 TSecr=1497488758"
"22","0.058478341","74","e6:55:1f:c0:1a:81","02:fc:13:7e:fa:69","172.20.0.3","172.20.0.2","TCP","39630 → 4433 [SYN] Seq=0 Win=64240 Len=0 MSS=1460 SACK_PERM TSval=1306572979 TSecr=0 WS=128"
"23","0.058512528","74","02:fc:13:7e:fa:69","e6:55:1f:c0:1a:81","172.20.0.2","172.20.0.3","TCP","4433 → 39630 [SYN, ACK] Seq=0 Ack=1 Win=65160 Len=0 MSS=1460 SACK_PERM TSval=1497488774 TSecr=1306572979 WS=128"
"24","0.058536101","66","e6:55:1f:c0:1a:81","02:fc:13:7e:fa:69","172.20.0.3","172.20.0.2","TCP","39630 → 4433 [ACK] Seq=1 Ack=1 Win=64256 Len=0 TSval=1306572979 TSecr=1497488774"
"25","0.058583608","1288","e6:55:1f:c0:1a:81","02:fc:13:7e:fa:69","172.20.0.3","172.20.0.2","TLSv1.2","Client Hello"
"26","0.058593153","66","02:fc:13:7e:fa:69","e6:55:1f:c0:1a:81","172.20.0.2","172.20.0.3","TCP","4433 → 39630 [ACK] Seq=1 Ack=1223 Win=64128 Len=0 TSval=1497488774 TSecr=1306572979"
"27","0.059016442","1472","02:fc:13:7e:fa:69","e6:55:1f:c0:1a:81","172.20.0.2","172.20.0.3","TLSv1.3","Server Hello, Change Cipher Spec, Application Data, Application Data, Application Data, Application Data"
"28","0.059050802","66","e6:55:1f:c0:1a:81","02:fc:13:7e:fa:69","172.20.0.3","172.20.0.2","TCP","39630 → 4433 [ACK] Seq=1223 Ack=1407 Win=64128 Len=0 TSval=1306572979 TSecr=1497488774"
"29","0.060509851","146","e6:55:1f:c0:1a:81","02:fc:13:7e:fa:69","172.20.0.3","172.20.0.2","TLSv1.3","Change Cipher Spec, Application Data"
"30","0.060589369","66","e6:55:1f:c0:1a:81","02:fc:13:7e:fa:69","172.20.0.3","172.20.0.2","TCP","39630 → 4433 [RST, ACK] Seq=1303 Ack=1407 Win=64128 Len=0 TSval=1306572981 TSecr=1497488774"
"31","0.075881104","74","e6:55:1f:c0:1a:81","02:fc:13:7e:fa:69","172.20.0.3","172.20.0.2","TCP","39632 → 4433 [SYN] Seq=0 Win=64240 Len=0 MSS=1460 SACK_PERM TSval=1306572996 TSecr=0 WS=128"
"32","0.075908887","74","02:fc:13:7e:fa:69","e6:55:1f:c0:1a:81","172.20.0.2","172.20.0.3","TCP","4433 → 39632 [SYN, ACK] Seq=0 Ack=1 Win=65160 Len=0 MSS=1460 SACK_PERM TSval=1497488791 TSecr=1306572996 WS=128"
"33","0.075931628","66","e6:55:1f:c0:1a:81","02:fc:13:7e:fa:69","172.20.0.3","172.20.0.2","TCP","39632 → 4433 [ACK] Seq=1 Ack=1 Win=64256 Len=0 TSval=1306572996 TSecr=1497488791"
"34","0.075993918","1288","e6:55:1f:c0:1a:81","02:fc:13:7e:fa:69","172.20.0.3","172.20.0.2","TLSv1.2","Client Hello"
"35","0.076001743","66","02:fc:13:7e:fa:69","e6:55:1f:c0:1a:81","172.20.0.2","172.20.0.3","TCP","4433 → 39632 [ACK] Seq=1 Ack=1223 Win=64128 Len=0 TSval=1497488791 TSecr=1306572996"
"36","0.076462577","1472","02:fc:13:7e:fa:69","e6:55:1f:c0:1a:81","172.20.0.2","172.20.0.3","TLSv1.3","Server Hello, Change Cipher Spec, Application Data, Application Data, Application Data, Application Data"
"37","0.076493640","66","e6:55:1f:c0:1a:81","02:fc:13:7e:fa:69","172.20.0.3","172.20.0.2","TCP","39632 → 4433 [ACK] Seq=1223 Ack=1407 Win=64128 Len=0 TSval=1306572997 TSecr=1497488792"
"38","0.077914971","146","e6:55:1f:c0:1a:81","02:fc:13:7e:fa:69","172.20.0.3","172.20.0.2","TLSv1.3","Change Cipher Spec, Application Data"
"39","0.077989065","66","e6:55:1f:c0:1a:81","02:fc:13:7e:fa:69","172.20.0.3","172.20.0.2","TCP","39632 → 4433 [RST, ACK] Seq=1303 Ack=1407 Win=64128 Len=0 TSval=1306572998 TSecr=1497488792"
"40","0.089703273","74","e6:55:1f:c0:1a:81","02:fc:13:7e:fa:69","172.20.0.3","172.20.0.2","TCP","39640 → 4433 [SYN] Seq=0 Win=64240 Len=0 MSS=1460 SACK_PERM TSval=1306573010 TSecr=0 WS=128"
"41","0.089730676","74","02:fc:13:7e:fa:69","e6:55:1f:c0:1a:81","172.20.0.2","172.20.0.3","TCP","4433 → 39640 [SYN, ACK] Seq=0 Ack=1 Win=65160 Len=0 MSS=1460 SACK_PERM TSval=1497488805 TSecr=1306573010 WS=128"
"42","0.089751028","66","e6:55:1f:c0:1a:81","02:fc:13:7e:fa:69","172.20.0.3","172.20.0.2","TCP","39640 → 4433 [ACK] Seq=1 Ack=1 Win=64256 Len=0 TSval=1306573010 TSecr=1497488805"
"43","0.089798099","1288","e6:55:1f:c0:1a:81","02:fc:13:7e:fa:69","172.20.0.3","172.20.0.2","TLSv1.2","Client Hello"
"44","0.089803989","66","02:fc:13:7e:fa:69","e6:55:1f:c0:1a:81","172.20.0.2","172.20.0.3","TCP","4433 → 39640 [ACK] Seq=1 Ack=1223 Win=64128 Len=0 TSval=1497488805 TSecr=1306573010"
"45","0.090236741","1472","02:fc:13:7e:fa:69","e6:55:1f:c0:1a:81","172.20.0.2","172.20.0.3","TLSv1.3","Server Hello, Change Cipher Spec, Application Data, Application Data, Application Data, Application Data"
"46","0.090269456","66","e6:55:1f:c0:1a:81","02:fc:13:7e:fa:69","172.20.0.3","172.20.0.2","TCP","39640 → 4433 [ACK] Seq=1223 Ack=1407 Win=64128 Len=0 TSval=1306573010 TSecr=1497488805"
"47","0.091287994","146","e6:55:1f:c0:1a:81","02:fc:13:7e:fa:69","172.20.0.3","172.20.0.2","TLSv1.3","Change Cipher Spec, Application Data"
"48","0.091352099","66","e6:55:1f:c0:1a:81","02:fc:13:7e:fa:69","172.20.0.3","172.20.0.2","TCP","39640 → 4433 [RST, ACK] Seq=1303 Ack=1407 Win=64128 Len=0 TSval=1306573011 TSecr=1497488805"
"49","0.101811966","74","e6:55:1f:c0:1a:81","02:fc:13:7e:fa:69","172.20.0.3","172.20.0.2","TCP","39642 → 4433 [SYN] Seq=0 Win=64240 Len=0 MSS=1460 SACK_PERM TSval=1306573022 TSecr=0 WS=128"
"50","0.101846161","74","02:fc:13:7e:fa:69","e6:55:1f:c0:1a:81","172.20.0.2","172.20.0.3","TCP","4433 → 39642 [SYN, ACK] Seq=0 Ack=1 Win=65160 Len=0 MSS=1460 SACK_PERM TSval=1497488817 TSecr=1306573022 WS=128"
"51","0.101871645","66","e6:55:1f:c0:1a:81","02:fc:13:7e:fa:69","172.20.0.3","172.20.0.2","TCP","39642 → 4433 [ACK] Seq=1 Ack=1 Win=64256 Len=0 TSval=1306573022 TSecr=1497488817"
"52","0.101942985","1288","e6:55:1f:c0:1a:81","02:fc:13:7e:fa:69","172.20.0.3","172.20.0.2","TLSv1.2","Client Hello"
"53","0.101949300","66","02:fc:13:7e:fa:69","e6:55:1f:c0:1a:81","172.20.0.2","172.20.0.3","TCP","4433 → 39642 [ACK] Seq=1 Ack=1223 Win=64128 Len=0 TSval=1497488817 TSecr=1306573022"
"54","0.102467932","1472","02:fc:13:7e:fa:69","e6:55:1f:c0:1a:81","172.20.0.2","172.20.0.3","TLSv1.3","Server Hello, Change Cipher Spec, Application Data, Application Data, Application Data, Application Data"
"55","0.102499023","66","e6:55:1f:c0:1a:81","02:fc:13:7e:fa:69","172.20.0.3","172.20.0.2","TCP","39642 → 4433 [ACK] Seq=1223 Ack=1407 Win=64128 Len=0 TSval=1306573023 TSecr=1497488818"
"56","0.103465027","146","e6:55:1f:c0:1a:81","02:fc:13:7e:fa:69","172.20.0.3","172.20.0.2","TLSv1.3","Change Cipher Spec, Application Data"
"57","0.103521335","66","e6:55:1f:c0:1a:81","02:fc:13:7e:fa:69","172.20.0.3","172.20.0.2","TCP","39642 → 4433 [RST, ACK] Seq=1303 Ack=1407 Win=64128 Len=0 TSval=1306573024 TSecr=1497488818"
"58","0.114059158","74","e6:55:1f:c0:1a:81","02:fc:13:7e:fa:69","172.20.0.3","172.20.0.2","TCP","39646 → 4433 [SYN] Seq=0 Win=64240 Len=0 MSS=1460 SACK_PERM TSval=1306573034 TSecr=0 WS=128"
"59","0.114089392","74","02:fc:13:7e:fa:69","e6:55:1f:c0:1a:81","172.20.0.2","172.20.0.3","TCP","4433 → 39646 [SYN, ACK] Seq=0 Ack=1 Win=65160 Len=0 MSS=1460 SACK_PERM TSval=1497488829 TSecr=1306573034 WS=128"
"60","0.114108842","66","e6:55:1f:c0:1a:81","02:fc:13:7e:fa:69","172.20.0.3","172.20.0.2","TCP","39646 → 4433 [ACK] Seq=1 Ack=1 Win=64256 Len=0 TSval=1306573034 TSecr=1497488829"
"61","0.114152089","1288","e6:55:1f:c0:1a:81","02:fc:13:7e:fa:69","172.20.0.3","172.20.0.2","TLSv1.2","Client Hello"
"62","0.114157841","66","02:fc:13:7e:fa:69","e6:55:1f:c0:1a:81","172.20.0.2","172.20.0.3","TCP","4433 → 39646 [ACK] Seq=1 Ack=1223 Win=64128 Len=0 TSval=1497488829 TSecr=1306573034"
"63","0.114683151","1472","02:fc:13:7e:fa:69","e6:55:1f:c0:1a:81","172.20.0.2","172.20.0.3","TLSv1.3","Server Hello, Change Cipher Spec, Application Data, Application Data, Application Data, Application Data"
"64","0.114712090","66","e6:55:1f:c0:1a:81","02:fc:13:7e:fa:69","172.20.0.3","172.20.0.2","TCP","39646 → 4433 [ACK] Seq=1223 Ack=1407 Win=64128 Len=0 TSval=1306573035 TSecr=1497488830"
"65","0.115723987","146","e6:55:1f:c0:1a:81","02:fc:13:7e:fa:69","172.20.0.3","172.20.0.2","TLSv1.3","Change Cipher Spec, Application Data"
"66","0.115780641","66","e6:55:1f:c0:1a:81","02:fc:13:7e:fa:69","172.20.0.3","172.20.0.2","TCP","39646 → 4433 [RST, ACK] Seq=1303 Ack=1407 Win=64128 Len=0 TSval=1306573036 TSecr=1497488830"
"67","0.129752050","74","e6:55:1f:c0:1a:81","02:fc:13:7e:fa:69","172.20.0.3","172.20.0.2","TCP","39660 → 4433 [SYN] Seq=0 Win=64240 Len=0 MSS=1460 SACK_PERM TSval=1306573050 TSecr=0 WS=128"
"68","0.129784490","74","02:fc:13:7e:fa:69","e6:55:1f:c0:1a:81","172.20.0.2","172.20.0.3","TCP","4433 → 39660 [SYN, ACK] Seq=0 Ack=1 Win=65160 Len=0 MSS=1460 SACK_PERM TSval=1497488845 TSecr=1306573050 WS=128"
"69","0.129808936","66","e6:55:1f:c0:1a:81","02:fc:13:7e:fa:69","172.20.0.3","172.20.0.2","TCP","39660 → 4433 [ACK] Seq=1 Ack=1 Win=64256 Len=0 TSval=1306573050 TSecr=1497488845"
"70","0.129866305","1288","e6:55:1f:c0:1a:81","02:fc:13:7e:fa:69","172.20.0.3","172.20.0.2","TLSv1.2","Client Hello"
"71","0.129875411","66","02:fc:13:7e:fa:69","e6:55:1f:c0:1a:81","172.20.0.2","172.20.0.3","TCP","4433 → 39660 [ACK] Seq=1 Ack=1223 Win=64128 Len=0 TSval=1497488845 TSecr=1306573050"
"72","0.130345299","1472","02:fc:13:7e:fa:69","e6:55:1f:c0:1a:81","172.20.0.2","172.20.0.3","TLSv1.3","Server Hello, Change Cipher Spec, Application Data, Application Data, Application Data, Application Data"
"73","0.130387624","66","e6:55:1f:c0:1a:81","02:fc:13:7e:fa:69","172.20.0.3","172.20.0.2","TCP","39660 → 4433 [ACK] Seq=1223 Ack=1407 Win=64128 Len=0 TSval=1306573050 TSecr=1497488845"
"74","0.131748930","146","e6:55:1f:c0:1a:81","02:fc:13:7e:fa:69","172.20.0.3","172.20.0.2","TLSv1.3","Change Cipher Spec, Application Data"
"75","0.131818709","66","e6:55:1f:c0:1a:81","02:fc:13:7e:fa:69","172.20.0.3","172.20.0.2","TCP","39660 → 4433 [RST, ACK] Seq=1303 Ack=1407 Win=64128 Len=0 TSval=1306573052 TSecr=1497488845"
"76","0.146289706","74","e6:55:1f:c0:1a:81","02:fc:13:7e:fa:69","172.20.0.3","172.20.0.2","TCP","39662 → 4433 [SYN] Seq=0 Win=64240 Len=0 MSS=1460 SACK_PERM TSval=1306573066 TSecr=0 WS=128"
"77","0.146323993","74","02:fc:13:7e:fa:69","e6:55:1f:c0:1a:81","172.20.0.2","172.20.0.3","TCP","4433 → 39662 [SYN, ACK] Seq=0 Ack=1 Win=65160 Len=0 MSS=1460 SACK_PERM TSval=1497488861 TSecr=1306573066 WS=128"
"78","0.146344375","66","e6:55:1f:c0:1a:81","02:fc:13:7e:fa:69","172.20.0.3","172.20.0.2","TCP","39662 → 4433 [ACK] Seq=1 Ack=1 Win=64256 Len=0 TSval=1306573066 TSecr=1497488861"
"79","0.146389787","1288","e6:55:1f:c0:1a:81","02:fc:13:7e:fa:69","172.20.0.3","172.20.0.2","TLSv1.2","Client Hello"
"80","0.146394429","66","02:fc:13:7e:fa:69","e6:55:1f:c0:1a:81","172.20.0.2","172.20.0.3","TCP","4433 → 39662 [ACK] Seq=1 Ack=1223 Win=64128 Len=0 TSval=1497488861 TSecr=1306573066"
"81","0.146914491","1472","02:fc:13:7e:fa:69","e6:55:1f:c0:1a:81","172.20.0.2","172.20.0.3","TLSv1.3","Server Hello, Change Cipher Spec, Application Data, Application Data, Application Data, Application Data"
"82","0.146948197","66","e6:55:1f:c0:1a:81","02:fc:13:7e:fa:69","172.20.0.3","172.20.0.2","TCP","39662 → 4433 [ACK] Seq=1223 Ack=1407 Win=64128 Len=0 TSval=1306573067 TSecr=1497488862"
"83","0.147955030","146","e6:55:1f:c0:1a:81","02:fc:13:7e:fa:69","172.20.0.3","172.20.0.2","TLSv1.3","Change Cipher Spec, Application Data"
"84","0.148021997","66","e6:55:1f:c0:1a:81","02:fc:13:7e:fa:69","172.20.0.3","172.20.0.2","TCP","39662 → 4433 [RST, ACK] Seq=1303 Ack=1407 Win=64128 Len=0 TSval=1306573068 TSecr=1497488862"
"85","0.158513145","74","e6:55:1f:c0:1a:81","02:fc:13:7e:fa:69","172.20.0.3","172.20.0.2","TCP","39678 → 4433 [SYN] Seq=0 Win=64240 Len=0 MSS=1460 SACK_PERM TSval=1306573079 TSecr=0 WS=128"
"86","0.158542081","74","02:fc:13:7e:fa:69","e6:55:1f:c0:1a:81","172.20.0.2","172.20.0.3","TCP","4433 → 39678 [SYN, ACK] Seq=0 Ack=1 Win=65160 Len=0 MSS=1460 SACK_PERM TSval=1497488874 TSecr=1306573079 WS=128"
"87","0.158561456","66","e6:55:1f:c0:1a:81","02:fc:13:7e:fa:69","172.20.0.3","172.20.0.2","TCP","39678 → 4433 [ACK] Seq=1 Ack=1 Win=64256 Len=0 TSval=1306573079 TSecr=1497488874"
"88","0.158619035","1288","e6:55:1f:c0:1a:81","02:fc:13:7e:fa:69","172.20.0.3","172.20.0.2","TLSv1.2","Client Hello"
"89","0.158623400","66","02:fc:13:7e:fa:69","e6:55:1f:c0:1a:81","172.20.0.2","172.20.0.3","TCP","4433 → 39678 [ACK] Seq=1 Ack=1223 Win=64128 Len=0 TSval=1497488874 TSecr=1306573079"
"90","0.159098158","1472","02:fc:13:7e:fa:69","e6:55:1f:c0:1a:81","172.20.0.2","172.20.0.3","TLSv1.3","Server Hello, Change Cipher Spec, Application Data, Application Data, Application Data, Application Data"
"91","0.159132477","66","e6:55:1f:c0:1a:81","02:fc:13:7e:fa:69","172.20.0.3","172.20.0.2","TCP","39678 → 4433 [ACK] Seq=1223 Ack=1407 Win=64128 Len=0 TSval=1306573079 TSecr=1497488874"
"92","0.160060149","146","e6:55:1f:c0:1a:81","02:fc:13:7e:fa:69","172.20.0.3","172.20.0.2","TLSv1.3","Change Cipher Spec, Application Data"
"93","0.160114570","66","e6:55:1f:c0:1a:81","02:fc:13:7e:fa:69","172.20.0.3","172.20.0.2","TCP","39678 → 4433 [RST, ACK] Seq=1303 Ack=1407 Win=64128 Len=0 TSval=1306573080 TSecr=1497488874"
"94","0.170073475","74","e6:55:1f:c0:1a:81","02:fc:13:7e:fa:69","172.20.0.3","172.20.0.2","TCP","39692 → 4433 [SYN] Seq=0 Win=64240 Len=0 MSS=1460 SACK_PERM TSval=1306573090 TSecr=0 WS=128"
"95","0.170097484","74","02:fc:13:7e:fa:69","e6:55:1f:c0:1a:81","172.20.0.2","172.20.0.3","TCP","4433 → 39692 [SYN, ACK] Seq=0 Ack=1 Win=65160 Len=0 MSS=1460 SACK_PERM TSval=1497488885 TSecr=1306573090 WS=128"
"96","0.170114078","66","e6:55:1f:c0:1a:81","02:fc:13:7e:fa:69","172.20.0.3","172.20.0.2","TCP","39692 → 4433 [ACK] Seq=1 Ack=1 Win=64256 Len=0 TSval=1306573090 TSecr=1497488885"
"97","0.170156728","1288","e6:55:1f:c0:1a:81","02:fc:13:7e:fa:69","172.20.0.3","172.20.0.2","TLSv1.2","Client Hello"
"98","0.170162322","66","02:fc:13:7e:fa:69","e6:55:1f:c0:1a:81","172.20.0.2","172.20.0.3","TCP","4433 → 39692 [ACK] Seq=1 Ack=1223 Win=64128 Len=0 TSval=1497488885 TSecr=1306573090"
"99","0.170666824","1472","02:fc:13:7e:fa:69","e6:55:1f:c0:1a:81","172.20.0.2","172.20.0.3","TLSv1.3","Server Hello, Change Cipher Spec, Application Data, Application Data, Application Data, Application Data"
"100","0.170699842","66","e6:55:1f:c0:1a:81","02:fc:13:7e:fa:69","172.20.0.3","172.20.0.2","TCP","39692 → 4433 [ACK] Seq=1223 Ack=1407 Win=64128 Len=0 TSval=1306573091 TSecr=1497488886"
"101","0.171719308","146","e6:55:1f:c0:1a:81","02:fc:13:7e:fa:69","172.20.0.3","172.20.0.2","TLSv1.3","Change Cipher Spec, Application Data"
"102","0.171777696","66","e6:55:1f:c0:1a:81","02:fc:13:7e:fa:69","172.20.0.3","172.20.0.2","TCP","39692 → 4433 [RST, ACK] Seq=1303 Ack=1407 Win=64128 Len=0 TSval=1306573092 TSecr=1497488886"
"103","0.182321415","74","e6:55:1f:c0:1a:81","02:fc:13:7e:fa:69","172.20.0.3","172.20.0.2","TCP","39696 → 4433 [SYN] Seq=0 Win=64240 Len=0 MSS=1460 SACK_PERM TSval=1306573102 TSecr=0 WS=128"
"104","0.182346846","74","02:fc:13:7e:fa:69","e6:55:1f:c0:1a:81","172.20.0.2","172.20.0.3","TCP","4433 → 39696 [SYN, ACK] Seq=0 Ack=1 Win=65160 Len=0 MSS=1460 SACK_PERM TSval=1497488897 TSecr=1306573102 WS=128"
"105","0.182363911","66","e6:55:1f:c0:1a:81","02:fc:13:7e:fa:69","172.20.0.3","172.20.0.2","TCP","39696 → 4433 [ACK] Seq=1 Ack=1 Win=64256 Len=0 TSval=1306573102 TSecr=1497488897"
"106","0.182444926","1288","e6:55:1f:c0:1a:81","02:fc:13:7e:fa:69","172.20.0.3","172.20.0.2","TLSv1.2","Client Hello"
"107","0.182449929","66","02:fc:13:7e:fa:69","e6:55:1f:c0:1a:81","172.20.0.2","172.20.0.3","TCP","4433 → 39696 [ACK] Seq=1 Ack=1223 Win=64128 Len=0 TSval=1497488898 TSecr=1306573103"
"108","0.183074103","1472","02:fc:13:7e:fa:69","e6:55:1f:c0:1a:81","172.20.0.2","172.20.0.3","TLSv1.3","Server Hello, Change Cipher Spec, Application Data, Application Data, Application Data, Application Data"
"109","0.183116554","66","e6:55:1f:c0:1a:81","02:fc:13:7e:fa:69","172.20.0.3","172.20.0.2","TCP","39696 → 4433 [ACK] Seq=1223 Ack=1407 Win=64128 Len=0 TSval=1306573103 TSecr=1497488898"
"110","0.184100518","146","e6:55:1f:c0:1a:81","02:fc:13:7e:fa:69","172.20.0.3","172.20.0.2","TLSv1.3","Change Cipher Spec, Application Data"
"111","0.184160846","66","e6:55:1f:c0:1a:81","02:fc:13:7e:fa:69","172.20.0.3","172.20.0.2","TCP","39696 → 4433 [RST, ACK] Seq=1303 Ack=1407 Win=64128 Len=0 TSval=1306573104 TSecr=1497488898"
"112","0.194948412","74","e6:55:1f:c0:1a:81","02:fc:13:7e:fa:69","172.20.0.3","172.20.0.2","TCP","39704 → 4433 [SYN] Seq=0 Win=64240 Len=0 MSS=1460 SACK_PERM TSval=1306573115 TSecr=0 WS=128"
"113","0.194977318","74","02:fc:13:7e:fa:69","e6:55:1f:c0:1a:81","172.20.0.2","172.20.0.3","TCP","4433 → 39704 [SYN, ACK] Seq=0 Ack=1 Win=65160 Len=0 MSS=1460 SACK_PERM TSval=1497488910 TSecr=1306573115 WS=128"
"114","0.194996183","66","e6:55:1f:c0:1a:81","02:fc:13:7e:fa:69","172.20.0.3","172.20.0.2","TCP","39704 → 4433 [ACK] Seq=1 Ack=1 Win=64256 Len=0 TSval=1306573115 TSecr=1497488910"
"115","0.195043325","1288","e6:55:1f:c0:1a:81","02:fc:13:7e:fa:69","172.20.0.3","172.20.0.2","TLSv1.2","Client Hello"
"116","0.195049880","66","02:fc:13:7e:fa:69","e6:55:1f:c0:1a:81","172.20.0.2","172.20.0.3","TCP","4433 → 39704 [ACK] Seq=1 Ack=1223 Win=64128 Len=0 TSval=1497488910 TSecr=1306573115"
"117","0.195547338","1472","02:fc:13:7e:fa:69","e6:55:1f:c0:1a:81","172.20.0.2","172.20.0.3","TLSv1.3","Server Hello, Change Cipher Spec, Application Data, Application Data, Application Data, Application Data"
"118","0.195578036","66","e6:55:1f:c0:1a:81","02:fc:13:7e:fa:69","172.20.0.3","172.20.0.2","TCP","39704 → 4433 [ACK] Seq=1223 Ack=1407 Win=64128 Len=0 TSval=1306573116 TSecr=1497488911"
"119","0.196554749","146","e6:55:1f:c0:1a:81","02:fc:13:7e:fa:69","172.20.0.3","172.20.0.2","TLSv1.3","Change Cipher Spec, Application Data"
"120","0.196612106","66","e6:55:1f:c0:1a:81","02:fc:13:7e:fa:69","172.20.0.3","172.20.0.2","TCP","39704 → 4433 [RST, ACK] Seq=1303 Ack=1407 Win=64128 Len=0 TSval=1306573117 TSecr=1497488911"
"121","0.207205196","74","e6:55:1f:c0:1a:81","02:fc:13:7e:fa:69","172.20.0.3","172.20.0.2","TCP","39720 → 4433 [SYN] Seq=0 Win=64240 Len=0 MSS=1460 SACK_PERM TSval=1306573127 TSecr=0 WS=128"
"122","0.207232123","74","02:fc:13:7e:fa:69","e6:55:1f:c0:1a:81","172.20.0.2","172.20.0.3","TCP","4433 → 39720 [SYN, ACK] Seq=0 Ack=1 Win=65160 Len=0 MSS=1460 SACK_PERM TSval=1497488922 TSecr=1306573127 WS=128"
"123","0.207249557","66","e6:55:1f:c0:1a:81","02:fc:13:7e:fa:69","172.20.0.3","172.20.0.2","TCP","39720 → 4433 [ACK] Seq=1 Ack=1 Win=64256 Len=0 TSval=1306573127 TSecr=1497488922"
"124","0.207293155","1288","e6:55:1f:c0:1a:81","02:fc:13:7e:fa:69","172.20.0.3","172.20.0.2","TLSv1.2","Client Hello"
"125","0.207297168","66","02:fc:13:7e:fa:69","e6:55:1f:c0:1a:81","172.20.0.2","172.20.0.3","TCP","4433 → 39720 [ACK] Seq=1 Ack=1223 Win=64128 Len=0 TSval=1497488922 TSecr=1306573127"
"126","0.207846080","1472","02:fc:13:7e:fa:69","e6:55:1f:c0:1a:81","172.20.0.2","172.20.0.3","TLSv1.3","Server Hello, Change Cipher Spec, Application Data, Application Data, Application Data, Application Data"
"127","0.207880172","66","e6:55:1f:c0:1a:81","02:fc:13:7e:fa:69","172.20.0.3","172.20.0.2","TCP","39720 → 4433 [ACK] Seq=1223 Ack=1407 Win=64128 Len=0 TSval=1306573128 TSecr=1497488923"
"128","0.208840568","146","e6:55:1f:c0:1a:81","02:fc:13:7e:fa:69","172.20.0.3","172.20.0.2","TLSv1.3","Change Cipher Spec, Application Data"
"129","0.208897705","66","e6:55:1f:c0:1a:81","02:fc:13:7e:fa:69","172.20.0.3","172.20.0.2","TCP","39720 → 4433 [RST, ACK] Seq=1303 Ack=1407 Win=64128 Len=0 TSval=1306573129 TSecr=1497488923"
"130","0.219073419","74","e6:55:1f:c0:1a:81","02:fc:13:7e:fa:69","172.20.0.3","172.20.0.2","TCP","39730 → 4433 [SYN] Seq=0 Win=64240 Len=0 MSS=1460 SACK_PERM TSval=1306573139 TSecr=0 WS=128"
"131","0.219096931","74","02:fc:13:7e:fa:69","e6:55:1f:c0:1a:81","172.20.0.2","172.20.0.3","TCP","4433 → 39730 [SYN, ACK] Seq=0 Ack=1 Win=65160 Len=0 MSS=1460 SACK_PERM TSval=1497488934 TSecr=1306573139 WS=128"
"132","0.219114696","66","e6:55:1f:c0:1a:81","02:fc:13:7e:fa:69","172.20.0.3","172.20.0.2","TCP","39730 → 4433 [ACK] Seq=1 Ack=1 Win=64256 Len=0 TSval=1306573139 TSecr=1497488934"
"133","0.219156197","1288","e6:55:1f:c0:1a:81","02:fc:13:7e:fa:69","172.20.0.3","172.20.0.2","TLSv1.2","Client Hello"
"134","0.219162243","66","02:fc:13:7e:fa:69","e6:55:1f:c0:1a:81","172.20.0.2","172.20.0.3","TCP","4433 → 39730 [ACK] Seq=1 Ack=1223 Win=64128 Len=0 TSval=1497488934 TSecr=1306573139"
"135","0.219683270","1472","02:fc:13:7e:fa:69","e6:55:1f:c0:1a:81","172.20.0.2","172.20.0.3","TLSv1.3","Server Hello, Change Cipher Spec, Application Data, Application Data, Application Data, Application Data"
"136","0.219716829","66","e6:55:1f:c0:1a:81","02:fc:13:7e:fa:69","172.20.0.3","172.20.0.2","TCP","39730 → 4433 [ACK] Seq=1223 Ack=1407 Win=64128 Len=0 TSval=1306573140 TSecr=1497488935"
"137","0.220663243","146","e6:55:1f:c0:1a:81","02:fc:13:7e:fa:69","172.20.0.3","172.20.0.2","TLSv1.3","Change Cipher Spec, Application Data"
"138","0.220719969","66","e6:55:1f:c0:1a:81","02:fc:13:7e:fa:69","172.20.0.3","172.20.0.2","TCP","39730 → 4433 [RST, ACK] Seq=1303 Ack=1407 Win=64128 Len=0 TSval=1306573141 TSecr=1497488935"
"139","0.231766454","74","e6:55:1f:c0:1a:81","02:fc:13:7e:fa:69","172.20.0.3","172.20.0.2","TCP","39736 → 4433 [SYN] Seq=0 Win=64240 Len=0 MSS=1460 SACK_PERM TSval=1306573152 TSecr=0 WS=128"
"140","0.231794153","74","02:fc:13:7e:fa:69","e6:55:1f:c0:1a:81","172.20.0.2","172.20.0.3","TCP","4433 → 39736 [SYN, ACK] Seq=0 Ack=1 Win=65160 Len=0 MSS=1460 SACK_PERM TSval=1497488947 TSecr=1306573152 WS=128"
"141","0.231819009","66","e6:55:1f:c0:1a:81","02:fc:13:7e:fa:69","172.20.0.3","172.20.0.2","TCP","39736 → 4433 [ACK] Seq=1 Ack=1 Win=64256 Len=0 TSval=1306573152 TSecr=1497488947"
"142","0.231874685","1288","e6:55:1f:c0:1a:81","02:fc:13:7e:fa:69","172.20.0.3","172.20.0.2","TLSv1.2","Client Hello"
"143","0.231882073","66","02:fc:13:7e:fa:69","e6:55:1f:c0:1a:81","172.20.0.2","172.20.0.3","TCP","4433 → 39736 [ACK] Seq=1 Ack=1223 Win=64128 Len=0 TSval=1497488947 TSecr=1306573152"
"144","0.232620622","1472","02:fc:13:7e:fa:69","e6:55:1f:c0:1a:81","172.20.0.2","172.20.0.3","TLSv1.3","Server Hello, Change Cipher Spec, Application Data, Application Data, Application Data, Application Data"
"145","0.232659099","66","e6:55:1f:c0:1a:81","02:fc:13:7e:fa:69","172.20.0.3","172.20.0.2","TCP","39736 → 4433 [ACK] Seq=1223 Ack=1407 Win=64128 Len=0 TSval=1306573153 TSecr=1497488948"
"146","0.233743057","146","e6:55:1f:c0:1a:81","02:fc:13:7e:fa:69","172.20.0.3","172.20.0.2","TLSv1.3","Change Cipher Spec, Application Data"
"147","0.233803904","66","e6:55:1f:c0:1a:81","02:fc:13:7e:fa:69","172.20.0.3","172.20.0.2","TCP","39736 → 4433 [RST, ACK] Seq=1303 Ack=1407 Win=64128 Len=0 TSval=1306573154 TSecr=1497488948"
"148","0.244241814","74","e6:55:1f:c0:1a:81","02:fc:13:7e:fa:69","172.20.0.3","172.20.0.2","TCP","39742 → 4433 [SYN] Seq=0 Win=64240 Len=0 MSS=1460 SACK_PERM TSval=1306573164 TSecr=0 WS=128"
"149","0.244267191","74","02:fc:13:7e:fa:69","e6:55:1f:c0:1a:81","172.20.0.2","172.20.0.3","TCP","4433 → 39742 [SYN, ACK] Seq=0 Ack=1 Win=65160 Len=0 MSS=1460 SACK_PERM TSval=1497488959 TSecr=1306573164 WS=128"
"150","0.244284596","66","e6:55:1f:c0:1a:81","02:fc:13:7e:fa:69","172.20.0.3","172.20.0.2","TCP","39742 → 4433 [ACK] Seq=1 Ack=1 Win=64256 Len=0 TSval=1306573164 TSecr=1497488959"
"151","0.244330323","1288","e6:55:1f:c0:1a:81","02:fc:13:7e:fa:69","172.20.0.3","172.20.0.2","TLSv1.2","Client Hello"
"152","0.244335074","66","02:fc:13:7e:fa:69","e6:55:1f:c0:1a:81","172.20.0.2","172.20.0.3","TCP","4433 → 39742 [ACK] Seq=1 Ack=1223 Win=64128 Len=0 TSval=1497488959 TSecr=1306573164"
"153","0.244814511","1472","02:fc:13:7e:fa:69","e6:55:1f:c0:1a:81","172.20.0.2","172.20.0.3","TLSv1.3","Server Hello, Change Cipher Spec, Application Data, Application Data, Application Data, Application Data"
"154","0.244845210","66","e6:55:1f:c0:1a:81","02:fc:13:7e:fa:69","172.20.0.3","172.20.0.2","TCP","39742 → 4433 [ACK] Seq=1223 Ack=1407 Win=64128 Len=0 TSval=1306573165 TSecr=1497488960"
"155","0.245813005","146","e6:55:1f:c0:1a:81","02:fc:13:7e:fa:69","172.20.0.3","172.20.0.2","TLSv1.3","Change Cipher Spec, Application Data"
"156","0.245871825","66","e6:55:1f:c0:1a:81","02:fc:13:7e:fa:69","172.20.0.3","172.20.0.2","TCP","39742 → 4433 [RST, ACK] Seq=1303 Ack=1407 Win=64128 Len=0 TSval=1306573166 TSecr=1497488960"
"157","0.255880613","74","e6:55:1f:c0:1a:81","02:fc:13:7e:fa:69","172.20.0.3","172.20.0.2","TCP","39748 → 4433 [SYN] Seq=0 Win=64240 Len=0 MSS=1460 SACK_PERM TSval=1306573176 TSecr=0 WS=128"
"158","0.255899260","74","02:fc:13:7e:fa:69","e6:55:1f:c0:1a:81","172.20.0.2","172.20.0.3","TCP","4433 → 39748 [SYN, ACK] Seq=0 Ack=1 Win=65160 Len=0 MSS=1460 SACK_PERM TSval=1497488971 TSecr=1306573176 WS=128"
"159","0.255919135","66","e6:55:1f:c0:1a:81","02:fc:13:7e:fa:69","172.20.0.3","172.20.0.2","TCP","39748 → 4433 [ACK] Seq=1 Ack=1 Win=64256 Len=0 TSval=1306573176 TSecr=1497488971"
"160","0.255959393","1288","e6:55:1f:c0:1a:81","02:fc:13:7e:fa:69","172.20.0.3","172.20.0.2","TLSv1.2","Client Hello"
"161","0.255964576","66","02:fc:13:7e:fa:69","e6:55:1f:c0:1a:81","172.20.0.2","172.20.0.3","TCP","4433 → 39748 [ACK] Seq=1 Ack=1223 Win=64128 Len=0 TSval=1497488971 TSecr=1306573176"
"162","0.256387973","1472","02:fc:13:7e:fa:69","e6:55:1f:c0:1a:81","172.20.0.2","172.20.0.3","TLSv1.3","Server Hello, Change Cipher Spec, Application Data, Application Data, Application Data, Application Data"
"163","0.256428212","66","e6:55:1f:c0:1a:81","02:fc:13:7e:fa:69","172.20.0.3","172.20.0.2","TCP","39748 → 4433 [ACK] Seq=1223 Ack=1407 Win=64128 Len=0 TSval=1306573177 TSecr=1497488971"
"164","0.257446812","146","e6:55:1f:c0:1a:81","02:fc:13:7e:fa:69","172.20.0.3","172.20.0.2","TLSv1.3","Change Cipher Spec, Application Data"
"165","0.257503836","66","e6:55:1f:c0:1a:81","02:fc:13:7e:fa:69","172.20.0.3","172.20.0.2","TCP","39748 → 4433 [RST, ACK] Seq=1303 Ack=1407 Win=64128 Len=0 TSval=1306573178 TSecr=1497488971"
"166","0.267672922","74","e6:55:1f:c0:1a:81","02:fc:13:7e:fa:69","172.20.0.3","172.20.0.2","TCP","39754 → 4433 [SYN] Seq=0 Win=64240 Len=0 MSS=1460 SACK_PERM TSval=1306573188 TSecr=0 WS=128"
"167","0.267699308","74","02:fc:13:7e:fa:69","e6:55:1f:c0:1a:81","172.20.0.2","172.20.0.3","TCP","4433 → 39754 [SYN, ACK] Seq=0 Ack=1 Win=65160 Len=0 MSS=1460 SACK_PERM TSval=1497488983 TSecr=1306573188 WS=128"
"168","0.267715130","66","e6:55:1f:c0:1a:81","02:fc:13:7e:fa:69","172.20.0.3","172.20.0.2","TCP","39754 → 4433 [ACK] Seq=1 Ack=1 Win=64256 Len=0 TSval=1306573188 TSecr=1497488983"
"169","0.267755399","1288","e6:55:1f:c0:1a:81","02:fc:13:7e:fa:69","172.20.0.3","172.20.0.2","TLSv1.2","Client Hello"
"170","0.267762054","66","02:fc:13:7e:fa:69","e6:55:1f:c0:1a:81","172.20.0.2","172.20.0.3","TCP","4433 → 39754 [ACK] Seq=1 Ack=1223 Win=64128 Len=0 TSval=1497488983 TSecr=1306573188"
"171","0.268216943","1472","02:fc:13:7e:fa:69","e6:55:1f:c0:1a:81","172.20.0.2","172.20.0.3","TLSv1.3","Server Hello, Change Cipher Spec, Application Data, Application Data, Application Data, Application Data"
"172","0.268247404","66","e6:55:1f:c0:1a:81","02:fc:13:7e:fa:69","172.20.0.3","172.20.0.2","TCP","39754 → 4433 [ACK] Seq=1223 Ack=1407 Win=64128 Len=0 TSval=1306573188 TSecr=1497488983"
"173","0.269232700","146","e6:55:1f:c0:1a:81","02:fc:13:7e:fa:69","172.20.0.3","172.20.0.2","TLSv1.3","Change Cipher Spec, Application Data"
"174","0.269287789","66","e6:55:1f:c0:1a:81","02:fc:13:7e:fa:69","172.20.0.3","172.20.0.2","TCP","39754 → 4433 [RST, ACK] Seq=1303 Ack=1407 Win=64128 Len=0 TSval=1306573189 TSecr=1497488983"
"175","0.279346067","74","e6:55:1f:c0:1a:81","02:fc:13:7e:fa:69","172.20.0.3","172.20.0.2","TCP","39764 → 4433 [SYN] Seq=0 Win=64240 Len=0 MSS=1460 SACK_PERM TSval=1306573199 TSecr=0 WS=128"
"176","0.279368898","74","02:fc:13:7e:fa:69","e6:55:1f:c0:1a:81","172.20.0.2","172.20.0.3","TCP","4433 → 39764 [SYN, ACK] Seq=0 Ack=1 Win=65160 Len=0 MSS=1460 SACK_PERM TSval=1497488994 TSecr=1306573199 WS=128"
"177","0.279384840","66","e6:55:1f:c0:1a:81","02:fc:13:7e:fa:69","172.20.0.3","172.20.0.2","TCP","39764 → 4433 [ACK] Seq=1 Ack=1 Win=64256 Len=0 TSval=1306573199 TSecr=1497488994"
"178","0.279430967","1288","e6:55:1f:c0:1a:81","02:fc:13:7e:fa:69","172.20.0.3","172.20.0.2","TLSv1.2","Client Hello"
"179","0.279436783","66","02:fc:13:7e:fa:69","e6:55:1f:c0:1a:81","172.20.0.2","172.20.0.3","TCP","4433 → 39764 [ACK] Seq=1 Ack=1223 Win=64128 Len=0 TSval=1497488995 TSecr=1306573200"
"180","0.280084393","1472","02:fc:13:7e:fa:69","e6:55:1f:c0:1a:81","172.20.0.2","172.20.0.3","TLSv1.3","Server Hello, Change Cipher Spec, Application Data, Application Data, Application Data, Application Data"
"181","0.280124875","66","e6:55:1f:c0:1a:81","02:fc:13:7e:fa:69","172.20.0.3","172.20.0.2","TCP","39764 → 4433 [ACK] Seq=1223 Ack=1407 Win=64128 Len=0 TSval=1306573200 TSecr=1497488995"
"182","0.281046707","146","e6:55:1f:c0:1a:81","02:fc:13:7e:fa:69","172.20.0.3","172.20.0.2","TLSv1.3","Change Cipher Spec, Application Data"
"183","0.281101894","66","e6:55:1f:c0:1a:81","02:fc:13:7e:fa:69","172.20.0.3","172.20.0.2","TCP","39764 → 4433 [RST, ACK] Seq=1303 Ack=1407 Win=64128 Len=0 TSval=1306573201 TSecr=1497488995"
"184","0.291795580","74","e6:55:1f:c0:1a:81","02:fc:13:7e:fa:69","172.20.0.3","172.20.0.2","TCP","39778 → 4433 [SYN] Seq=0 Win=64240 Len=0 MSS=1460 SACK_PERM TSval=1306573212 TSecr=0 WS=128"
"185","0.291824102","74","02:fc:13:7e:fa:69","e6:55:1f:c0:1a:81","172.20.0.2","172.20.0.3","TCP","4433 → 39778 [SYN, ACK] Seq=0 Ack=1 Win=65160 Len=0 MSS=1460 SACK_PERM TSval=1497489007 TSecr=1306573212 WS=128"
"186","0.291843941","66","e6:55:1f:c0:1a:81","02:fc:13:7e:fa:69","172.20.0.3","172.20.0.2","TCP","39778 → 4433 [ACK] Seq=1 Ack=1 Win=64256 Len=0 TSval=1306573212 TSecr=1497489007"
"187","0.291890574","1288","e6:55:1f:c0:1a:81","02:fc:13:7e:fa:69","172.20.0.3","172.20.0.2","TLSv1.2","Client Hello"
"188","0.291897241","66","02:fc:13:7e:fa:69","e6:55:1f:c0:1a:81","172.20.0.2","172.20.0.3","TCP","4433 → 39778 [ACK] Seq=1 Ack=1223 Win=64128 Len=0 TSval=1497489007 TSecr=1306573212"
"189","0.292427618","1472","02:fc:13:7e:fa:69","e6:55:1f:c0:1a:81","172.20.0.2","172.20.0.3","TLSv1.3","Server Hello, Change Cipher Spec, Application Data, Application Data, Application Data, Application Data"
"190","0.292457270","66","e6:55:1f:c0:1a:81","02:fc:13:7e:fa:69","172.20.0.3","172.20.0.2","TCP","39778 → 4433 [ACK] Seq=1223 Ack=1407 Win=64128 Len=0 TSval=1306573213 TSecr=1497489007"
"191","0.293365208","146","e6:55:1f:c0:1a:81","02:fc:13:7e:fa:69","172.20.0.3","172.20.0.2","TLSv1.3","Change Cipher Spec, Application Data"
"192","0.293431434","66","e6:55:1f:c0:1a:81","02:fc:13:7e:fa:69","172.20.0.3","172.20.0.2","TCP","39778 → 4433 [RST, ACK] Seq=1303 Ack=1407 Win=64128 Len=0 TSval=1306573214 TSecr=1497489007"
"193","0.303764031","74","e6:55:1f:c0:1a:81","02:fc:13:7e:fa:69","172.20.0.3","172.20.0.2","TCP","39780 → 4433 [SYN] Seq=0 Win=64240 Len=0 MSS=1460 SACK_PERM TSval=1306573224 TSecr=0 WS=128"
"194","0.303791326","74","02:fc:13:7e:fa:69","e6:55:1f:c0:1a:81","172.20.0.2","172.20.0.3","TCP","4433 → 39780 [SYN, ACK] Seq=0 Ack=1 Win=65160 Len=0 MSS=1460 SACK_PERM TSval=1497489019 TSecr=1306573224 WS=128"
"195","0.303813144","66","e6:55:1f:c0:1a:81","02:fc:13:7e:fa:69","172.20.0.3","172.20.0.2","TCP","39780 → 4433 [ACK] Seq=1 Ack=1 Win=64256 Len=0 TSval=1306573224 TSecr=1497489019"
"196","0.303855312","1288","e6:55:1f:c0:1a:81","02:fc:13:7e:fa:69","172.20.0.3","172.20.0.2","TLSv1.2","Client Hello"
"197","0.303859988","66","02:fc:13:7e:fa:69","e6:55:1f:c0:1a:81","172.20.0.2","172.20.0.3","TCP","4433 → 39780 [ACK] Seq=1 Ack=1223 Win=64128 Len=0 TSval=1497489019 TSecr=1306573224"
"198","0.304356176","1472","02:fc:13:7e:fa:69","e6:55:1f:c0:1a:81","172.20.0.2","172.20.0.3","TLSv1.3","Server Hello, Change Cipher Spec, Application Data, Application Data, Application Data, Application Data"
"199","0.304388687","66","e6:55:1f:c0:1a:81","02:fc:13:7e:fa:69","172.20.0.3","172.20.0.2","TCP","39780 → 4433 [ACK] Seq=1223 Ack=1407 Win=64128 Len=0 TSval=1306573224 TSecr=1497489019"
"200","0.305332989","146","e6:55:1f:c0:1a:81","02:fc:13:7e:fa:69","172.20.0.3","172.20.0.2","TLSv1.3","Change Cipher Spec, Application Data"
"201","0.305386271","66","e6:55:1f:c0:1a:81","02:fc:13:7e:fa:69","172.20.0.3","172.20.0.2","TCP","39780 → 4433 [RST, ACK] Seq=1303 Ack=1407 Win=64128 Len=0 TSval=1306573225 TSecr=1497489019"
"202","0.315473741","74","e6:55:1f:c0:1a:81","02:fc:13:7e:fa:69","172.20.0.3","172.20.0.2","TCP","39792 → 4433 [SYN] Seq=0 Win=64240 Len=0 MSS=1460 SACK_PERM TSval=1306573236 TSecr=0 WS=128"
"203","0.315497994","74","02:fc:13:7e:fa:69","e6:55:1f:c0:1a:81","172.20.0.2","172.20.0.3","TCP","4433 → 39792 [SYN, ACK] Seq=0 Ack=1 Win=65160 Len=0 MSS=1460 SACK_PERM TSval=1497489031 TSecr=1306573236 WS=128"
"204","0.315518330","66","e6:55:1f:c0:1a:81","02:fc:13:7e:fa:69","172.20.0.3","172.20.0.2","TCP","39792 → 4433 [ACK] Seq=1 Ack=1 Win=64256 Len=0 TSval=1306573236 TSecr=1497489031"
"205","0.315560425","1288","e6:55:1f:c0:1a:81","02:fc:13:7e:fa:69","172.20.0.3","172.20.0.2","TLSv1.2","Client Hello"
"206","0.315567067","66","02:fc:13:7e:fa:69","e6:55:1f:c0:1a:81","172.20.0.2","172.20.0.3","TCP","4433 → 39792 [ACK] Seq=1 Ack=1223 Win=64128 Len=0 TSval=1497489031 TSecr=1306573236"
"207","0.316035939","1472","02:fc:13:7e:fa:69","e6:55:1f:c0:1a:81","172.20.0.2","172.20.0.3","TLSv1.3","Server Hello, Change Cipher Spec, Application Data, Application Data, Application Data, Application Data"
"208","0.316065736","66","e6:55:1f:c0:1a:81","02:fc:13:7e:fa:69","172.20.0.3","172.20.0.2","TCP","39792 → 4433 [ACK] Seq=1223 Ack=1407 Win=64128 Len=0 TSval=1306573236 TSecr=1497489031"
"209","0.317020724","146","e6:55:1f:c0:1a:81","02:fc:13:7e:fa:69","172.20.0.3","172.20.0.2","TLSv1.3","Change Cipher Spec, Application Data"
"210","0.317075609","66","e6:55:1f:c0:1a:81","02:fc:13:7e:fa:69","172.20.0.3","172.20.0.2","TCP","39792 → 4433 [RST, ACK] Seq=1303 Ack=1407 Win=64128 Len=0 TSval=1306573237 TSecr=1497489031"
"211","0.327736469","74","e6:55:1f:c0:1a:81","02:fc:13:7e:fa:69","172.20.0.3","172.20.0.2","TCP","39794 → 4433 [SYN] Seq=0 Win=64240 Len=0 MSS=1460 SACK_PERM TSval=1306573248 TSecr=0 WS=128"
"212","0.327762891","74","02:fc:13:7e:fa:69","e6:55:1f:c0:1a:81","172.20.0.2","172.20.0.3","TCP","4433 → 39794 [SYN, ACK] Seq=0 Ack=1 Win=65160 Len=0 MSS=1460 SACK_PERM TSval=1497489043 TSecr=1306573248 WS=128"
"213","0.327784195","66","e6:55:1f:c0:1a:81","02:fc:13:7e:fa:69","172.20.0.3","172.20.0.2","TCP","39794 → 4433 [ACK] Seq=1 Ack=1 Win=64256 Len=0 TSval=1306573248 TSecr=1497489043"
"214","0.327822579","1288","e6:55:1f:c0:1a:81","02:fc:13:7e:fa:69","172.20.0.3","172.20.0.2","TLSv1.2","Client Hello"
"215","0.327828859","66","02:fc:13:7e:fa:69","e6:55:1f:c0:1a:81","172.20.0.2","172.20.0.3","TCP","4433 → 39794 [ACK] Seq=1 Ack=1223 Win=64128 Len=0 TSval=1497489043 TSecr=1306573248"
"216","0.328308110","1472","02:fc:13:7e:fa:69","e6:55:1f:c0:1a:81","172.20.0.2","172.20.0.3","TLSv1.3","Server Hello, Change Cipher Spec, Application Data, Application Data, Application Data, Application Data"
"217","0.328338586","66","e6:55:1f:c0:1a:81","02:fc:13:7e:fa:69","172.20.0.3","172.20.0.2","TCP","39794 → 4433 [ACK] Seq=1223 Ack=1407 Win=64128 Len=0 TSval=1306573248 TSecr=1497489043"
"218","0.329267713","146","e6:55:1f:c0:1a:81","02:fc:13:7e:fa:69","172.20.0.3","172.20.0.2","TLSv1.3","Change Cipher Spec, Application Data"
"219","0.329327651","66","e6:55:1f:c0:1a:81","02:fc:13:7e:fa:69","172.20.0.3","172.20.0.2","TCP","39794 → 4433 [RST, ACK] Seq=1303 Ack=1407 Win=64128 Len=0 TSval=1306573249 TSecr=1497489043"
"220","0.339464115","74","e6:55:1f:c0:1a:81","02:fc:13:7e:fa:69","172.20.0.3","172.20.0.2","TCP","39806 → 4433 [SYN] Seq=0 Win=64240 Len=0 MSS=1460 SACK_PERM TSval=1306573260 TSecr=0 WS=128"
"221","0.339486319","74","02:fc:13:7e:fa:69","e6:55:1f:c0:1a:81","172.20.0.2","172.20.0.3","TCP","4433 → 39806 [SYN, ACK] Seq=0 Ack=1 Win=65160 Len=0 MSS=1460 SACK_PERM TSval=1497489055 TSecr=1306573260 WS=128"
"222","0.339503925","66","e6:55:1f:c0:1a:81","02:fc:13:7e:fa:69","172.20.0.3","172.20.0.2","TCP","39806 → 4433 [ACK] Seq=1 Ack=1 Win=64256 Len=0 TSval=1306573260 TSecr=1497489055"
"223","0.339544612","1288","e6:55:1f:c0:1a:81","02:fc:13:7e:fa:69","172.20.0.3","172.20.0.2","TLSv1.2","Client Hello"
"224","0.339550291","66","02:fc:13:7e:fa:69","e6:55:1f:c0:1a:81","172.20.0.2","172.20.0.3","TCP","4433 → 39806 [ACK] Seq=1 Ack=1223 Win=64128 Len=0 TSval=1497489055 TSecr=1306573260"
