frame.number,frame.time_relative,frame.len,eth.src,eth.dst,ip.src,ip.dst,_ws.col.protocol,_ws.col.info
"1","0.000000000","42","16:7d:35:96:b4:e2","ff:ff:ff:ff:ff:ff",,,"ARP","ARP Announcement for 172.20.0.3"
"2","0.029780241","42","16:7d:35:96:b4:e2","ff:ff:ff:ff:ff:ff",,,"ARP","Who has 172.20.0.2? Tell 172.20.0.3"
"3","0.029803641","42","e2:5e:0c:13:7c:04","16:7d:35:96:b4:e2",,,"ARP","172.20.0.2 is at e2:5e:0c:13:7c:04"
"4","0.029814138","74","16:7d:35:96:b4:e2","e2:5e:0c:13:7c:04","172.20.0.3","172.20.0.2","TCP","47726 → 4433 [SYN] Seq=0 Win=64240 Len=0 MSS=1460 SACK_PERM TSval=1313088140 TSecr=0 WS=128"
"5","0.029835615","74","e2:5e:0c:13:7c:04","16:7d:35:96:b4:e2","172.20.0.2","172.20.0.3","TCP","4433 → 47726 [SYN, ACK] Seq=0 Ack=1 Win=65160 Len=0 MSS=1460 SACK_PERM TSval=1504003935 TSecr=1313088140 WS=128"
"6","0.029853307","66","16:7d:35:96:b4:e2","e2:5e:0c:13:7c:04","172.20.0.3","172.20.0.2","TCP","47726 → 4433 [ACK] Seq=1 Ack=1 Win=64256 Len=0 TSval=1313088140 TSecr=1504003935"
"7","0.029893600","1672","16:7d:35:96:b4:e2","e2:5e:0c:13:7c:04","172.20.0.3","172.20.0.2","TLSv1.2","Client Hello"
"8","0.029899503","66","e2:5e:0c:13:7c:04","16:7d:35:96:b4:e2","172.20.0.2","172.20.0.3","TCP","4433 → 47726 [ACK] Seq=1 Ack=1607 Win=64128 Len=0 TSval=1504003935 TSecr=1313088140"
"9","0.032012918","1955","e2:5e:0c:13:7c:04","16:7d:35:96:b4:e2","172.20.0.2","172.20.0.3","TLSv1.3","Server Hello, Change Cipher Spec, Application Data, Application Data, Application Data, Application Data"
"10","0.032043344","66","16:7d:35:96:b4:e2","e2:5e:0c:13:7c:04","172.20.0.3","172.20.0.2","TCP","47726 → 4433 [ACK] Seq=1607 Ack=1890 Win=64128 Len=0 TSval=1313088142 TSecr=1504003937"
"11","0.034716901","146","16:7d:35:96:b4:e2","e2:5e:0c:13:7c:04","172.20.0.3","172.20.0.2","TLSv1.3","Change Cipher Spec, Application Data"
"12","0.034780222","66","16:7d:35:96:b4:e2","e2:5e:0c:13:7c:04","172.20.0.3","172.20.0.2","TCP","47726 → 4433 [RST, ACK] Seq=1687 Ack=1890 Win=64128 Len=0 TSval=1313088145 TSecr=1504003937"
"13","0.045390856","74","16:7d:35:96:b4:e2","e2:5e:0c:13:7c:04","172.20.0.3","172.20.0.2","TCP","47738 → 4433 [SYN] Seq=0 Win=64240 Len=0 MSS=1460 SACK_PERM TSval=1313088155 TSecr=0 WS=128"
"14","0.045417310","74","e2:5e:0c:13:7c:04","16:7d:35:96:b4:e2","172.20.0.2","172.20.0.3","TCP","4433 → 47738 [SYN, ACK] Seq=0 Ack=1 Win=65160 Len=0 MSS=1460 SACK_PERM TSval=1504003950 TSecr=1313088155 WS=128"
"15","0.045436829","66","16:7d:35:96:b4:e2","e2:5e:0c:13:7c:04","172.20.0.3","172.20.0.2","TCP","47738 → 4433 [ACK] Seq=1 Ack=1 Win=64256 Len=0 TSval=1313088155 TSecr=1504003950"
"16","0.045474697","1672","16:7d:35:96:b4:e2","e2:5e:0c:13:7c:04","172.20.0.3","172.20.0.2","TLSv1.2","Client Hello"
"17","0.045480992","66","e2:5e:0c:13:7c:04","16:7d:35:96:b4:e2","172.20.0.2","172.20.0.3","TCP","4433 → 47738 [ACK] Seq=1 Ack=1607 Win=64128 Len=0 TSval=1504003950 TSecr=1313088155"
"18","0.047138531","1955","e2:5e:0c:13:7c:04","16:7d:35:96:b4:e2","172.20.0.2","172.20.0.3","TLSv1.3","Server Hello, Change Cipher Spec, Application Data, Application Data, Application Data, Application Data"
"19","0.047167057","66","16:7d:35:96:b4:e2","e2:5e:0c:13:7c:04","172.20.0.3","172.20.0.2","TCP","47738 → 4433 [ACK] Seq=1607 Ack=1890 Win=64128 Len=0 TSval=1313088157 TSecr=1504003952"
"20","0.049922891","146","16:7d:35:96:b4:e2","e2:5e:0c:13:7c:04","172.20.0.3","172.20.0.2","TLSv1.3","Change Cipher Spec, Application Data"
"21","0.049979489","66","16:7d:35:96:b4:e2","e2:5e:0c:13:7c:04","172.20.0.3","172.20.0.2","TCP","47738 → 4433 [RST, ACK] Seq=1687 Ack=1890 Win=64128 Len=0 TSval=1313088160 TSecr=1504003952"
"22","0.060569893","74","16:7d:35:96:b4:e2","e2:5e:0c:13:7c:04","172.20.0.3","172.20.0.2","TCP","47754 → 4433 [SYN] Seq=0 Win=64240 Len=0 MSS=1460 SACK_PERM TSval=1313088170 TSecr=0 WS=128"
"23","0.060602227","74","e2:5e:0c:13:7c:04","16:7d:35:96:b4:e2","172.20.0.2","172.20.0.3","TCP","4433 → 47754 [SYN, ACK] Seq=0 Ack=1 Win=65160 Len=0 MSS=1460 SACK_PERM TSval=1504003965 TSecr=1313088170 WS=128"
"24","0.060621318","66","16:7d:35:96:b4:e2","e2:5e:0c:13:7c:04","172.20.0.3","172.20.0.2","TCP","47754 → 4433 [ACK] Seq=1 Ack=1 Win=64256 Len=0 TSval=1313088170 TSecr=1504003965"
"25","0.060661063","1672","16:7d:35:96:b4:e2","e2:5e:0c:13:7c:04","172.20.0.3","172.20.0.2","TLSv1.2","Client Hello"
"26","0.060668043","66","e2:5e:0c:13:7c:04","16:7d:35:96:b4:e2","172.20.0.2","172.20.0.3","TCP","4433 → 47754 [ACK] Seq=1 Ack=1607 Win=64128 Len=0 TSval=1504003965 TSecr=1313088170"
"27","0.062281282","1956","e2:5e:0c:13:7c:04","16:7d:35:96:b4:e2","172.20.0.2","172.20.0.3","TLSv1.3","Server Hello, Change Cipher Spec, Application Data, Application Data, Application Data, Application Data"
"28","0.062312682","66","16:7d:35:96:b4:e2","e2:5e:0c:13:7c:04","172.20.0.3","172.20.0.2","TCP","47754 → 4433 [ACK] Seq=1607 Ack=1891 Win=64128 Len=0 TSval=1313088172 TSecr=1504003967"
"29","0.065092187","146","16:7d:35:96:b4:e2","e2:5e:0c:13:7c:04","172.20.0.3","172.20.0.2","TLSv1.3","Change Cipher Spec, Application Data"
"30","0.065148746","66","16:7d:35:96:b4:e2","e2:5e:0c:13:7c:04","172.20.0.3","172.20.0.2","TCP","47754 → 4433 [RST, ACK] Seq=1687 Ack=1891 Win=64128 Len=0 TSval=1313088175 TSecr=1504003967"
"31","0.075779453","74","16:7d:35:96:b4:e2","e2:5e:0c:13:7c:04","172.20.0.3","172.20.0.2","TCP","47756 → 4433 [SYN] Seq=0 Win=64240 Len=0 MSS=1460 SACK_PERM TSval=1313088186 TSecr=0 WS=128"
"32","0.075805414","74","e2:5e:0c:13:7c:04","16:7d:35:96:b4:e2","172.20.0.2","172.20.0.3","TCP","4433 → 47756 [SYN, ACK] Seq=0 Ack=1 Win=65160 Len=0 MSS=1460 SACK_PERM TSval=1504003981 TSecr=1313088186 WS=128"
"33","0.075824893","66","16:7d:35:96:b4:e2","e2:5e:0c:13:7c:04","172.20.0.3","172.20.0.2","TCP","47756 → 4433 [ACK] Seq=1 Ack=1 Win=64256 Len=0 TSval=1313088186 TSecr=1504003981"
"34","0.075865713","1672","16:7d:35:96:b4:e2","e2:5e:0c:13:7c:04","172.20.0.3","172.20.0.2","TLSv1.2","Client Hello"
"35","0.075871805","66","e2:5e:0c:13:7c:04","16:7d:35:96:b4:e2","172.20.0.2","172.20.0.3","TCP","4433 → 47756 [ACK] Seq=1 Ack=1607 Win=64128 Len=0 TSval=1504003981 TSecr=1313088186"
"36","0.077425225","1955","e2:5e:0c:13:7c:04","16:7d:35:96:b4:e2","172.20.0.2","172.20.0.3","TLSv1.3","Server Hello, Change Cipher Spec, Application Data, Application Data, Application Data, Application Data"
"37","0.077456140","66","16:7d:35:96:b4:e2","e2:5e:0c:13:7c:04","172.20.0.3","172.20.0.2","TCP","47756 → 4433 [ACK] Seq=1607 Ack=1890 Win=64128 Len=0 TSval=1313088187 TSecr=1504003982"
"38","0.080113667","146","16:7d:35:96:b4:e2","e2:5e:0c:13:7c:04","172.20.0.3","172.20.0.2","TLSv1.3","Change Cipher Spec, Application Data"
"39","0.080174626","66","16:7d:35:96:b4:e2","e2:5e:0c:13:7c:04","172.20.0.3","172.20.0.2","TCP","47756 → 4433 [RST, ACK] Seq=1687 Ack=1890 Win=64128 Len=0 TSval=1313088190 TSecr=1504003982"
"40","0.090326239","74","16:7d:35:96:b4:e2","e2:5e:0c:13:7c:04","172.20.0.3","172.20.0.2","TCP","47768 → 4433 [SYN] Seq=0 Win=64240 Len=0 MSS=1460 SACK_PERM TSval=1313088200 TSecr=0 WS=128"
"41","0.090349768","74","e2:5e:0c:13:7c:04","16:7d:35:96:b4:e2","172.20.0.2","172.20.0.3","TCP","4433 → 47768 [SYN, ACK] Seq=0 Ack=1 Win=65160 Len=0 MSS=1460 SACK_PERM TSval=1504003995 TSecr=1313088200 WS=128"
"42","0.090368663","66","16:7d:35:96:b4:e2","e2:5e:0c:13:7c:04","172.20.0.3","172.20.0.2","TCP","47768 → 4433 [ACK] Seq=1 Ack=1 Win=64256 Len=0 TSval=1313088200 TSecr=1504003995"
"43","0.090412214","1672","16:7d:35:96:b4:e2","e2:5e:0c:13:7c:04","172.20.0.3","172.20.0.2","TLSv1.2","Client Hello"
"44","0.090417802","66","e2:5e:0c:13:7c:04","16:7d:35:96:b4:e2","172.20.0.2","172.20.0.3","TCP","4433 → 47768 [ACK] Seq=1 Ack=1607 Win=64128 Len=0 TSval=1504003995 TSecr=1313088200"
"45","0.092041095","1955","e2:5e:0c:13:7c:04","16:7d:35:96:b4:e2","172.20.0.2","172.20.0.3","TLSv1.3","Server Hello, Change Cipher Spec, Application Data, Application Data, Application Data, Application Data"
"46","0.092071513","66","16:7d:35:96:b4:e2","e2:5e:0c:13:7c:04","172.20.0.3","172.20.0.2","TCP","47768 → 4433 [ACK] Seq=1607 Ack=1890 Win=64128 Len=0 TSval=1313088202 TSecr=1504003997"
"47","0.094768689","146","16:7d:35:96:b4:e2","e2:5e:0c:13:7c:04","172.20.0.3","172.20.0.2","TLSv1.3","Change Cipher Spec, Application Data"
"48","0.094828515","66","16:7d:35:96:b4:e2","e2:5e:0c:13:7c:04","172.20.0.3","172.20.0.2","TCP","47768 → 4433 [RST, ACK] Seq=1687 Ack=1890 Win=64128 Len=0 TSval=1313088205 TSecr=1504003997"
"49","0.105376917","74","16:7d:35:96:b4:e2","e2:5e:0c:13:7c:04","172.20.0.3","172.20.0.2","TCP","47782 → 4433 [SYN] Seq=0 Win=64240 Len=0 MSS=1460 SACK_PERM TSval=1313088215 TSecr=0 WS=128"
"50","0.105403243","74","e2:5e:0c:13:7c:04","16:7d:35:96:b4:e2","172.20.0.2","172.20.0.3","TCP","4433 → 47782 [SYN, ACK] Seq=0 Ack=1 Win=65160 Len=0 MSS=1460 SACK_PERM TSval=1504004010 TSecr=1313088215 WS=128"
"51","0.105421435","66","16:7d:35:96:b4:e2","e2:5e:0c:13:7c:04","172.20.0.3","172.20.0.2","TCP","47782 → 4433 [ACK] Seq=1 Ack=1 Win=64256 Len=0 TSval=1313088215 TSecr=1504004010"
"52","0.105473478","1672","16:7d:35:96:b4:e2","e2:5e:0c:13:7c:04","172.20.0.3","172.20.0.2","TLSv1.2","Client Hello"
"53","0.105490955","66","e2:5e:0c:13:7c:04","16:7d:35:96:b4:e2","172.20.0.2","172.20.0.3","TCP","4433 → 47782 [ACK] Seq=1 Ack=1607 Win=64128 Len=0 TSval=1504004010 TSecr=1313088215"
"54","0.107227377","1955","e2:5e:0c:13:7c:04","16:7d:35:96:b4:e2","172.20.0.2","172.20.0.3","TLSv1.3","Server Hello, Change Cipher Spec, Application Data, Application Data, Application Data, Application Data"
"55","0.107256007","66","16:7d:35:96:b4:e2","e2:5e:0c:13:7c:04","172.20.0.3","172.20.0.2","TCP","47782 → 4433 [ACK] Seq=1607 Ack=1890 Win=64128 Len=0 TSval=1313088217 TSecr=1504004012"
"56","0.110090245","146","16:7d:35:96:b4:e2","e2:5e:0c:13:7c:04","172.20.0.3","172.20.0.2","TLSv1.3","Change Cipher Spec, Application Data"
"57","0.110151582","66","16:7d:35:96:b4:e2","e2:5e:0c:13:7c:04","172.20.0.3","172.20.0.2","TCP","47782 → 4433 [RST, ACK] Seq=1687 Ack=1890 Win=64128 Len=0 TSval=1313088220 TSecr=1504004012"
"58","0.120667490","74","16:7d:35:96:b4:e2","e2:5e:0c:13:7c:04","172.20.0.3","172.20.0.2","TCP","47796 → 4433 [SYN] Seq=0 Win=64240 Len=0 MSS=1460 SACK_PERM TSval=1313088230 TSecr=0 WS=128"
"59","0.120707581","74","e2:5e:0c:13:7c:04","16:7d:35:96:b4:e2","172.20.0.2","172.20.0.3","TCP","4433 → 47796 [SYN, ACK] Seq=0 Ack=1 Win=65160 Len=0 MSS=1460 SACK_PERM TSval=1504004026 TSecr=1313088230 WS=128"
"60","0.120725214","66","16:7d:35:96:b4:e2","e2:5e:0c:13:7c:04","172.20.0.3","172.20.0.2","TCP","47796 → 4433 [ACK] Seq=1 Ack=1 Win=64256 Len=0 TSval=1313088231 TSecr=1504004026"
"61","0.120770778","1672","16:7d:35:96:b4:e2","e2:5e:0c:13:7c:04","172.20.0.3","172.20.0.2","TLSv1.2","Client Hello"
"62","0.120776663","66","e2:5e:0c:13:7c:04","16:7d:35:96:b4:e2","172.20.0.2","172.20.0.3","TCP","4433 → 47796 [ACK] Seq=1 Ack=1607 Win=64128 Len=0 TSval=1504004026 TSecr=1313088231"
"63","0.122402280","1954","e2:5e:0c:13:7c:04","16:7d:35:96:b4:e2","172.20.0.2","172.20.0.3","TLSv1.3","Server Hello, Change Cipher Spec, Application Data, Application Data, Application Data, Application Data"
"64","0.122430742","66","16:7d:35:96:b4:e2","e2:5e:0c:13:7c:04","172.20.0.3","172.20.0.2","TCP","47796 → 4433 [ACK] Seq=1607 Ack=1889 Win=64128 Len=0 TSval=1313088232 TSecr=1504004027"
"65","0.125078633","146","16:7d:35:96:b4:e2","e2:5e:0c:13:7c:04","172.20.0.3","172.20.0.2","TLSv1.3","Change Cipher Spec, Application Data"
"66","0.125130852","66","16:7d:35:96:b4:e2","e2:5e:0c:13:7c:04","172.20.0.3","172.20.0.2","TCP","47796 → 4433 [RST, ACK] Seq=1687 Ack=1889 Win=64128 Len=0 TSval=1313088235 TSecr=1504004027"
"67","0.135355637","74","16:7d:35:96:b4:e2","e2:5e:0c:13:7c:04","172.20.0.3","172.20.0.2","TCP","47806 → 4433 [SYN] Seq=0 Win=64240 Len=0 MSS=1460 SACK_PERM TSval=1313088245 TSecr=0 WS=128"
"68","0.135380201","74","e2:5e:0c:13:7c:04","16:7d:35:96:b4:e2","172.20.0.2","172.20.0.3","TCP","4433 → 47806 [SYN, ACK] Seq=0 Ack=1 Win=65160 Len=0 MSS=1460 SACK_PERM TSval=1504004040 TSecr=1313088245 WS=128"
"69","0.135398945","66","16:7d:35:96:b4:e2","e2:5e:0c:13:7c:04","172.20.0.3","172.20.0.2","TCP","47806 → 4433 [ACK] Seq=1 Ack=1 Win=64256 Len=0 TSval=1313088245 TSecr=1504004040"
"70","0.135441436","1672","16:7d:35:96:b4:e2","e2:5e:0c:13:7c:04","172.20.0.3","172.20.0.2","TLSv1.2","Client Hello"
"71","0.135447661","66","e2:5e:0c:13:7c:04","16:7d:35:96:b4:e2","172.20.0.2","172.20.0.3","TCP","4433 → 47806 [ACK] Seq=1 Ack=1607 Win=64128 Len=0 TSval=1504004040 TSecr=1313088245"
"72","0.137039099","1954","e2:5e:0c:13:7c:04","16:7d:35:96:b4:e2","172.20.0.2","172.20.0.3","TLSv1.3","Server Hello, Change Cipher Spec, Application Data, Application Data, Application Data, Application Data"
"73","0.137065425","66","16:7d:35:96:b4:e2","e2:5e:0c:13:7c:04","172.20.0.3","172.20.0.2","TCP","47806 → 4433 [ACK] Seq=1607 Ack=1889 Win=64128 Len=0 TSval=1313088247 TSecr=1504004042"
"74","0.139765237","146","16:7d:35:96:b4:e2","e2:5e:0c:13:7c:04","172.20.0.3","172.20.0.2","TLSv1.3","Change Cipher Spec, Application Data"
"75","0.139820515","66","16:7d:35:96:b4:e2","e2:5e:0c:13:7c:04","172.20.0.3","172.20.0.2","TCP","47806 → 4433 [RST, ACK] Seq=1687 Ack=1889 Win=64128 Len=0 TSval=1313088250 TSecr=1504004042"
"76","0.149994023","74","16:7d:35:96:b4:e2","e2:5e:0c:13:7c:04","172.20.0.3","172.20.0.2","TCP","47820 → 4433 [SYN] Seq=0 Win=64240 Len=0 MSS=1460 SACK_PERM TSval=1313088260 TSecr=0 WS=128"
"77","0.150018347","74","e2:5e:0c:13:7c:04","16:7d:35:96:b4:e2","172.20.0.2","172.20.0.3","TCP","4433 → 47820 [SYN, ACK] Seq=0 Ack=1 Win=65160 Len=0 MSS=1460 SACK_PERM TSval=1504004055 TSecr=1313088260 WS=128"
"78","0.150037268","66","16:7d:35:96:b4:e2","e2:5e:0c:13:7c:04","172.20.0.3","172.20.0.2","TCP","47820 → 4433 [ACK] Seq=1 Ack=1 Win=64256 Len=0 TSval=1313088260 TSecr=1504004055"
"79","0.150080106","1672","16:7d:35:96:b4:e2","e2:5e:0c:13:7c:04","172.20.0.3","172.20.0.2","TLSv1.2","Client Hello"
"80","0.150084942","66","e2:5e:0c:13:7c:04","16:7d:35:96:b4:e2","172.20.0.2","172.20.0.3","TCP","4433 → 47820 [ACK] Seq=1 Ack=1607 Win=64128 Len=0 TSval=1504004055 TSecr=1313088260"
"81","0.151674620","1955","e2:5e:0c:13:7c:04","16:7d:35:96:b4:e2","172.20.0.2","172.20.0.3","TLSv1.3","Server Hello, Change Cipher Spec, Application Data, Application Data, Application Data, Application Data"
"82","0.151714114","66","16:7d:35:96:b4:e2","e2:5e:0c:13:7c:04","172.20.0.3","172.20.0.2","TCP","47820 → 4433 [ACK] Seq=1607 Ack=1890 Win=64128 Len=0 TSval=1313088262 TSecr=1504004056"
"83","0.154340880","146","16:7d:35:96:b4:e2","e2:5e:0c:13:7c:04","172.20.0.3","172.20.0.2","TLSv1.3","Change Cipher Spec, Application Data"
"84","0.154404269","66","16:7d:35:96:b4:e2","e2:5e:0c:13:7c:04","172.20.0.3","172.20.0.2","TCP","47820 → 4433 [RST, ACK] Seq=1687 Ack=1890 Win=64128 Len=0 TSval=1313088264 TSecr=1504004056"
"85","0.168889057","74","16:7d:35:96:b4:e2","e2:5e:0c:13:7c:04","172.20.0.3","172.20.0.2","TCP","47834 → 4433 [SYN] Seq=0 Win=64240 Len=0 MSS=1460 SACK_PERM TSval=1313088279 TSecr=0 WS=128"
"86","0.168921892","74","e2:5e:0c:13:7c:04","16:7d:35:96:b4:e2","172.20.0.2","172.20.0.3","TCP","4433 → 47834 [SYN, ACK] Seq=0 Ack=1 Win=65160 Len=0 MSS=1460 SACK_PERM TSval=1504004074 TSecr=1313088279 WS=128"
"87","0.168946500","66","16:7d:35:96:b4:e2","e2:5e:0c:13:7c:04","172.20.0.3","172.20.0.2","TCP","47834 → 4433 [ACK] Seq=1 Ack=1 Win=64256 Len=0 TSval=1313088279 TSecr=1504004074"
"88","0.169014489","1672","16:7d:35:96:b4:e2","e2:5e:0c:13:7c:04","172.20.0.3","172.20.0.2","TLSv1.2","Client Hello"
"89","0.169021239","66","e2:5e:0c:13:7c:04","16:7d:35:96:b4:e2","172.20.0.2","172.20.0.3","TCP","4433 → 47834 [ACK] Seq=1 Ack=1607 Win=64128 Len=0 TSval=1504004074 TSecr=1313088279"
"90","0.170673061","1955","e2:5e:0c:13:7c:04","16:7d:35:96:b4:e2","172.20.0.2","172.20.0.3","TLSv1.3","Server Hello, Change Cipher Spec, Application Data, Application Data, Application Data, Application Data"
"91","0.170715692","66","16:7d:35:96:b4:e2","e2:5e:0c:13:7c:04","172.20.0.3","172.20.0.2","TCP","47834 → 4433 [ACK] Seq=1607 Ack=1890 Win=64128 Len=0 TSval=1313088281 TSecr=1504004075"
"92","0.175228565","146","16:7d:35:96:b4:e2","e2:5e:0c:13:7c:04","172.20.0.3","172.20.0.2","TLSv1.3","Change Cipher Spec, Application Data"
"93","0.175311323","66","16:7d:35:96:b4:e2","e2:5e:0c:13:7c:04","172.20.0.3","172.20.0.2","TCP","47834 → 4433 [RST, ACK] Seq=1687 Ack=1890 Win=64128 Len=0 TSval=1313088285 TSecr=1504004075"
"94","0.186496163","74","16:7d:35:96:b4:e2","e2:5e:0c:13:7c:04","172.20.0.3","172.20.0.2","TCP","47846 → 4433 [SYN] Seq=0 Win=64240 Len=0 MSS=1460 SACK_PERM TSval=1313088296 TSecr=0 WS=128"
"95","0.186522873","74","e2:5e:0c:13:7c:04","16:7d:35:96:b4:e2","172.20.0.2","172.20.0.3","TCP","4433 → 47846 [SYN, ACK] Seq=0 Ack=1 Win=65160 Len=0 MSS=1460 SACK_PERM TSval=1504004091 TSecr=1313088296 WS=128"
"96","0.186541987","66","16:7d:35:96:b4:e2","e2:5e:0c:13:7c:04","172.20.0.3","172.20.0.2","TCP","47846 → 4433 [ACK] Seq=1 Ack=1 Win=64256 Len=0 TSval=1313088296 TSecr=1504004091"
"97","0.186585692","1672","16:7d:35:96:b4:e2","e2:5e:0c:13:7c:04","172.20.0.3","172.20.0.2","TLSv1.2","Client Hello"
"98","0.186596741","66","e2:5e:0c:13:7c:04","16:7d:35:96:b4:e2","172.20.0.2","172.20.0.3","TCP","4433 → 47846 [ACK] Seq=1 Ack=1607 Win=64128 Len=0 TSval=1504004091 TSecr=1313088296"
"99","0.188223407","1954","e2:5e:0c:13:7c:04","16:7d:35:96:b4:e2","172.20.0.2","172.20.0.3","TLSv1.3","Server Hello, Change Cipher Spec, Application Data, Application Data, Application Data, Application Data"
"100","0.188247978","66","16:7d:35:96:b4:e2","e2:5e:0c:13:7c:04","172.20.0.3","172.20.0.2","TCP","47846 → 4433 [ACK] Seq=1607 Ack=1889 Win=64128 Len=0 TSval=1313088298 TSecr=1504004093"
"101","0.190829390","146","16:7d:35:96:b4:e2","e2:5e:0c:13:7c:04","172.20.0.3","172.20.0.2","TLSv1.3","Change Cipher Spec, Application Data"
"102","0.190881100","66","16:7d:35:96:b4:e2","e2:5e:0c:13:7c:04","172.20.0.3","172.20.0.2","TCP","47846 → 4433 [RST, ACK] Seq=1687 Ack=1889 Win=64128 Len=0 TSval=1313088301 TSecr=1504004093"
"103","0.200892791","74","16:7d:35:96:b4:e2","e2:5e:0c:13:7c:04","172.20.0.3","172.20.0.2","TCP","47850 → 4433 [SYN] Seq=0 Win=64240 Len=0 MSS=1460 SACK_PERM TSval=1313088311 TSecr=0 WS=128"
"104","0.200914535","74","e2:5e:0c:13:7c:04","16:7d:35:96:b4:e2","172.20.0.2","172.20.0.3","TCP","4433 → 47850 [SYN, ACK] Seq=0 Ack=1 Win=65160 Len=0 MSS=1460 SACK_PERM TSval=1504004106 TSecr=1313088311 WS=128"
"105","0.200930955","66","16:7d:35:96:b4:e2","e2:5e:0c:13:7c:04","172.20.0.3","172.20.0.2","TCP","47850 → 4433 [ACK] Seq=1 Ack=1 Win=64256 Len=0 TSval=1313088311 TSecr=1504004106"
"106","0.200967944","1672","16:7d:35:96:b4:e2","e2:5e:0c:13:7c:04","172.20.0.3","172.20.0.2","TLSv1.2","Client Hello"
"107","0.200972771","66","e2:5e:0c:13:7c:04","16:7d:35:96:b4:e2","172.20.0.2","172.20.0.3","TCP","4433 → 47850 [ACK] Seq=1 Ack=1607 Win=64128 Len=0 TSval=1504004106 TSecr=1313088311"
"108","0.202507005","1956","e2:5e:0c:13:7c:04","16:7d:35:96:b4:e2","172.20.0.2","172.20.0.3","TLSv1.3","Server Hello, Change Cipher Spec, Application Data, Application Data, Application Data, Application Data"
"109","0.202532381","66","16:7d:35:96:b4:e2","e2:5e:0c:13:7c:04","172.20.0.3","172.20.0.2","TCP","47850 → 4433 [ACK] Seq=1607 Ack=1891 Win=64128 Len=0 TSval=1313088312 TSecr=1504004107"
"110","0.205204713","146","16:7d:35:96:b4:e2","e2:5e:0c:13:7c:04","172.20.0.3","172.20.0.2","TLSv1.3","Change Cipher Spec, Application Data"
"111","0.205274016","66","16:7d:35:96:b4:e2","e2:5e:0c:13:7c:04","172.20.0.3","172.20.0.2","TCP","47850 → 4433 [RST, ACK] Seq=1687 Ack=1891 Win=64128 Len=0 TSval=1313088315 TSecr=1504004107"
"112","0.215217154","74","16:7d:35:96:b4:e2","e2:5e:0c:13:7c:04","172.20.0.3","172.20.0.2","TCP","47860 → 4433 [SYN] Seq=0 Win=64240 Len=0 MSS=1460 SACK_PERM TSval=1313088325 TSecr=0 WS=128"
"113","0.215237649","74","e2:5e:0c:13:7c:04","16:7d:35:96:b4:e2","172.20.0.2","172.20.0.3","TCP","4433 → 47860 [SYN, ACK] Seq=0 Ack=1 Win=65160 Len=0 MSS=1460 SACK_PERM TSval=1504004120 TSecr=1313088325 WS=128"
"114","0.215255452","66","16:7d:35:96:b4:e2","e2:5e:0c:13:7c:04","172.20.0.3","172.20.0.2","TCP","47860 → 4433 [ACK] Seq=1 Ack=1 Win=64256 Len=0 TSval=1313088325 TSecr=1504004120"
"115","0.215288952","1672","16:7d:35:96:b4:e2","e2:5e:0c:13:7c:04","172.20.0.3","172.20.0.2","TLSv1.2","Client Hello"
"116","0.215294019","66","e2:5e:0c:13:7c:04","16:7d:35:96:b4:e2","172.20.0.2","172.20.0.3","TCP","4433 → 47860 [ACK] Seq=1 Ack=1607 Win=64128 Len=0 TSval=1504004120 TSecr=1313088325"
"117","0.216825562","1954","e2:5e:0c:13:7c:04","16:7d:35:96:b4:e2","172.20.0.2","172.20.0.3","TLSv1.3","Server Hello, Change Cipher Spec, Application Data, Application Data, Application Data, Application Data"
"118","0.216849894","66","16:7d:35:96:b4:e2","e2:5e:0c:13:7c:04","172.20.0.3","172.20.0.2","TCP","47860 → 4433 [ACK] Seq=1607 Ack=1889 Win=64128 Len=0 TSval=1313088327 TSecr=1504004122"
"119","0.219467620","146","16:7d:35:96:b4:e2","e2:5e:0c:13:7c:04","172.20.0.3","172.20.0.2","TLSv1.3","Change Cipher Spec, Application Data"
"120","0.219519644","66","16:7d:35:96:b4:e2","e2:5e:0c:13:7c:04","172.20.0.3","172.20.0.2","TCP","47860 → 4433 [RST, ACK] Seq=1687 Ack=1889 Win=64128 Len=0 TSval=1313088329 TSecr=1504004122"
"121","0.229610394","74","16:7d:35:96:b4:e2","e2:5e:0c:13:7c:04","172.20.0.3","172.20.0.2","TCP","47870 → 4433 [SYN] Seq=0 Win=64240 Len=0 MSS=1460 SACK_PERM TSval=1313088339 TSecr=0 WS=128"
"122","0.229632977","74","e2:5e:0c:13:7c:04","16:7d:35:96:b4:e2","172.20.0.2","172.20.0.3","TCP","4433 → 47870 [SYN, ACK] Seq=0 Ack=1 Win=65160 Len=0 MSS=1460 SACK_PERM TSval=1504004134 TSecr=1313088339 WS=128"
"123","0.229649855","66","16:7d:35:96:b4:e2","e2:5e:0c:13:7c:04","172.20.0.3","172.20.0.2","TCP","47870 → 4433 [ACK] Seq=1 Ack=1 Win=64256 Len=0 TSval=1313088339 TSecr=1504004134"
"124","0.229718407","1672","16:7d:35:96:b4:e2","e2:5e:0c:13:7c:04","172.20.0.3","172.20.0.2","TLSv1.2","Client Hello"
"125","0.229724733","66","e2:5e:0c:13:7c:04","16:7d:35:96:b4:e2","172.20.0.2","172.20.0.3","TCP","4433 → 47870 [ACK] Seq=1 Ack=1607 Win=64128 Len=0 TSval=1504004135 TSecr=1313088340"
"126","0.231351148","1955","e2:5e:0c:13:7c:04","16:7d:35:96:b4:e2","172.20.0.2","172.20.0.3","TLSv1.3","Server Hello, Change Cipher Spec, Application Data, Application Data, Application Data, Application Data"
"127","0.231382849","66","16:7d:35:96:b4:e2","e2:5e:0c:13:7c:04","172.20.0.3","172.20.0.2","TCP","47870 → 4433 [ACK] Seq=1607 Ack=1890 Win=64128 Len=0 TSval=1313088341 TSecr=1504004136"
"128","0.234044702","146","16:7d:35:96:b4:e2","e2:5e:0c:13:7c:04","172.20.0.3","172.20.0.2","TLSv1.3","Change Cipher Spec, Application Data"
"129","0.234107010","66","16:7d:35:96:b4:e2","e2:5e:0c:13:7c:04","172.20.0.3","172.20.0.2","TCP","47870 → 4433 [RST, ACK] Seq=1687 Ack=1890 Win=64128 Len=0 TSval=1313088344 TSecr=1504004136"
"130","0.244182110","74","16:7d:35:96:b4:e2","e2:5e:0c:13:7c:04","172.20.0.3","172.20.0.2","TCP","47880 → 4433 [SYN] Seq=0 Win=64240 Len=0 MSS=1460 SACK_PERM TSval=1313088354 TSecr=0 WS=128"
"131","0.244206615","74","e2:5e:0c:13:7c:04","16:7d:35:96:b4:e2","172.20.0.2","172.20.0.3","TCP","4433 → 47880 [SYN, ACK] Seq=0 Ack=1 Win=65160 Len=0 MSS=1460 SACK_PERM TSval=1504004149 TSecr=1313088354 WS=128"
"132","0.244222175","66","16:7d:35:96:b4:e2","e2:5e:0c:13:7c:04","172.20.0.3","172.20.0.2","TCP","47880 → 4433 [ACK] Seq=1 Ack=1 Win=64256 Len=0 TSval=1313088354 TSecr=1504004149"
"133","0.244264618","1672","16:7d:35:96:b4:e2","e2:5e:0c:13:7c:04","172.20.0.3","172.20.0.2","TLSv1.2","Client Hello"
"134","0.244270095","66","e2:5e:0c:13:7c:04","16:7d:35:96:b4:e2","172.20.0.2","172.20.0.3","TCP","4433 → 47880 [ACK] Seq=1 Ack=1607 Win=64128 Len=0 TSval=1504004149 TSecr=1313088354"
"135","0.245917621","1955","e2:5e:0c:13:7c:04","16:7d:35:96:b4:e2","172.20.0.2","172.20.0.3","TLSv1.3","Server Hello, Change Cipher Spec, Application Data, Application Data, Application Data, Application Data"
"136","0.245945830","66","16:7d:35:96:b4:e2","e2:5e:0c:13:7c:04","172.20.0.3","172.20.0.2","TCP","47880 → 4433 [ACK] Seq=1607 Ack=1890 Win=64128 Len=0 TSval=1313088356 TSecr=1504004151"
"137","0.248699039","146","16:7d:35:96:b4:e2","e2:5e:0c:13:7c:04","172.20.0.3","172.20.0.2","TLSv1.3","Change Cipher Spec, Application Data"
"138","0.248792204","66","16:7d:35:96:b4:e2","e2:5e:0c:13:7c:04","172.20.0.3","172.20.0.2","TCP","47880 → 4433 [RST, ACK] Seq=1687 Ack=1890 Win=64128 Len=0 TSval=1313088359 TSecr=1504004151"
"139","0.258886616","74","16:7d:35:96:b4:e2","e2:5e:0c:13:7c:04","172.20.0.3","172.20.0.2","TCP","47888 → 4433 [SYN] Seq=0 Win=64240 Len=0 MSS=1460 SACK_PERM TSval=1313088369 TSecr=0 WS=128"
"140","0.258911403","74","e2:5e:0c:13:7c:04","16:7d:35:96:b4:e2","172.20.0.2","172.20.0.3","TCP","4433 → 47888 [SYN, ACK] Seq=0 Ack=1 Win=65160 Len=0 MSS=1460 SACK_PERM TSval=1504004164 TSecr=1313088369 WS=128"
"141","0.258927108","66","16:7d:35:96:b4:e2","e2:5e:0c:13:7c:04","172.20.0.3","172.20.0.2","TCP","47888 → 4433 [ACK] Seq=1 Ack=1 Win=64256 Len=0 TSval=1313088369 TSecr=1504004164"
"142","0.258968993","1672","16:7d:35:96:b4:e2","e2:5e:0c:13:7c:04","172.20.0.3","172.20.0.2","TLSv1.2","Client Hello"
"143","0.258982819","66","e2:5e:0c:13:7c:04","16:7d:35:96:b4:e2","172.20.0.2","172.20.0.3","TCP","4433 → 47888 [ACK] Seq=1 Ack=1607 Win=64128 Len=0 TSval=1504004164 TSecr=1313088369"
"144","0.260587248","1956","e2:5e:0c:13:7c:04","16:7d:35:96:b4:e2","172.20.0.2","172.20.0.3","TLSv1.3","Server Hello, Change Cipher Spec, Application Data, Application Data, Application Data, Application Data"
"145","0.260613928","66","16:7d:35:96:b4:e2","e2:5e:0c:13:7c:04","172.20.0.3","172.20.0.2","TCP","47888 → 4433 [ACK] Seq=1607 Ack=1891 Win=64128 Len=0 TSval=1313088370 TSecr=1504004165"
"146","0.263285958","146","16:7d:35:96:b4:e2","e2:5e:0c:13:7c:04","172.20.0.3","172.20.0.2","TLSv1.3","Change Cipher Spec, Application Data"
"147","0.263345806","66","16:7d:35:96:b4:e2","e2:5e:0c:13:7c:04","172.20.0.3","172.20.0.2","TCP","47888 → 4433 [RST, ACK] Seq=1687 Ack=1891 Win=64128 Len=0 TSval=1313088373 TSecr=1504004165"
"148","0.273257012","74","16:7d:35:96:b4:e2","e2:5e:0c:13:7c:04","172.20.0.3","172.20.0.2","TCP","47892 → 4433 [SYN] Seq=0 Win=64240 Len=0 MSS=1460 SACK_PERM TSval=1313088383 TSecr=0 WS=128"
"149","0.273280878","74","e2:5e:0c:13:7c:04","16:7d:35:96:b4:e2","172.20.0.2","172.20.0.3","TCP","4433 → 47892 [SYN, ACK] Seq=0 Ack=1 Win=65160 Len=0 MSS=1460 SACK_PERM TSval=1504004178 TSecr=1313088383 WS=128"
"150","0.273296367","66","16:7d:35:96:b4:e2","e2:5e:0c:13:7c:04","172.20.0.3","172.20.0.2","TCP","47892 → 4433 [ACK] Seq=1 Ack=1 Win=64256 Len=0 TSval=1313088383 TSecr=1504004178"
"151","0.273337960","1672","16:7d:35:96:b4:e2","e2:5e:0c:13:7c:04","172.20.0.3","172.20.0.2","TLSv1.2","Client Hello"
"152","0.273343815","66","e2:5e:0c:13:7c:04","16:7d:35:96:b4:e2","172.20.0.2","172.20.0.3","TCP","4433 → 47892 [ACK] Seq=1 Ack=1607 Win=64128 Len=0 TSval=1504004178 TSecr=1313088383"
"153","0.274961949","1954","e2:5e:0c:13:7c:04","16:7d:35:96:b4:e2","172.20.0.2","172.20.0.3","TLSv1.3","Server Hello, Change Cipher Spec, Application Data, Application Data, Application Data, Application Data"
"154","0.274990618","66","16:7d:35:96:b4:e2","e2:5e:0c:13:7c:04","172.20.0.3","172.20.0.2","TCP","47892 → 4433 [ACK] Seq=1607 Ack=1889 Win=64128 Len=0 TSval=1313088385 TSecr=1504004180"
"155","0.277640895","146","16:7d:35:96:b4:e2","e2:5e:0c:13:7c:04","172.20.0.3","172.20.0.2","TLSv1.3","Change Cipher Spec, Application Data"
"156","0.277707849","66","16:7d:35:96:b4:e2","e2:5e:0c:13:7c:04","172.20.0.3","172.20.0.2","TCP","47892 → 4433 [RST, ACK] Seq=1687 Ack=1889 Win=64128 Len=0 TSval=1313088388 TSecr=1504004180"
"157","0.287571923","74","16:7d:35:96:b4:e2","e2:5e:0c:13:7c:04","172.20.0.3","172.20.0.2","TCP","47908 → 4433 [SYN] Seq=0 Win=64240 Len=0 MSS=1460 SACK_PERM TSval=1313088397 TSecr=0 WS=128"
"158","0.287600665","74","e2:5e:0c:13:7c:04","16:7d:35:96:b4:e2","172.20.0.2","172.20.0.3","TCP","4433 → 47908 [SYN, ACK] Seq=0 Ack=1 Win=65160 Len=0 MSS=1460 SACK_PERM TSval=1504004192 TSecr=1313088397 WS=128"
"159","0.287615353","66","16:7d:35:96:b4:e2","e2:5e:0c:13:7c:04","172.20.0.3","172.20.0.2","TCP","47908 → 4433 [ACK] Seq=1 Ack=1 Win=64256 Len=0 TSval=1313088397 TSecr=1504004192"
"160","0.287651656","1672","16:7d:35:96:b4:e2","e2:5e:0c:13:7c:04","172.20.0.3","172.20.0.2","TLSv1.2","Client Hello"
"161","0.287656466","66","e2:5e:0c:13:7c:04","16:7d:35:96:b4:e2","172.20.0.2","172.20.0.3","TCP","4433 → 47908 [ACK] Seq=1 Ack=1607 Win=64128 Len=0 TSval=1504004192 TSecr=1313088397"
"162","0.289253273","1954","e2:5e:0c:13:7c:04","16:7d:35:96:b4:e2","172.20.0.2","172.20.0.3","TLSv1.3","Server Hello, Change Cipher Spec, Application Data, Application Data, Application Data, Application Data"
"163","0.289276859","66","16:7d:35:96:b4:e2","e2:5e:0c:13:7c:04","172.20.0.3","172.20.0.2","TCP","47908 → 4433 [ACK] Seq=1607 Ack=1889 Win=64128 Len=0 TSval=1313088399 TSecr=1504004194"
"164","0.291965260","146","16:7d:35:96:b4:e2","e2:5e:0c:13:7c:04","172.20.0.3","172.20.0.2","TLSv1.3","Change Cipher Spec, Application Data"
"165","0.292025546","66","16:7d:35:96:b4:e2","e2:5e:0c:13:7c:04","172.20.0.3","172.20.0.2","TCP","47908 → 4433 [RST, ACK] Seq=1687 Ack=1889 Win=64128 Len=0 TSval=1313088402 TSecr=1504004194"
"166","0.302094680","74","16:7d:35:96:b4:e2","e2:5e:0c:13:7c:04","172.20.0.3","172.20.0.2","TCP","47918 → 4433 [SYN] Seq=0 Win=64240 Len=0 MSS=1460 SACK_PERM TSval=1313088412 TSecr=0 WS=128"
"167","0.302118071","74","e2:5e:0c:13:7c:04","16:7d:35:96:b4:e2","172.20.0.2","172.20.0.3","TCP","4433 → 47918 [SYN, ACK] Seq=0 Ack=1 Win=65160 Len=0 MSS=1460 SACK_PERM TSval=1504004207 TSecr=1313088412 WS=128"
"168","0.302133480","66","16:7d:35:96:b4:e2","e2:5e:0c:13:7c:04","172.20.0.3","172.20.0.2","TCP","47918 → 4433 [ACK] Seq=1 Ack=1 Win=64256 Len=0 TSval=1313088412 TSecr=1504004207"
"169","0.302172421","1672","16:7d:35:96:b4:e2","e2:5e:0c:13:7c:04","172.20.0.3","172.20.0.2","TLSv1.2","Client Hello"
"170","0.302178393","66","e2:5e:0c:13:7c:04","16:7d:35:96:b4:e2","172.20.0.2","172.20.0.3","TCP","4433 → 47918 [ACK] Seq=1 Ack=1607 Win=64128 Len=0 TSval=1504004207 TSecr=1313088412"
"171","0.303762525","1955","e2:5e:0c:13:7c:04","16:7d:35:96:b4:e2","172.20.0.2","172.20.0.3","TLSv1.3","Server Hello, Change Cipher Spec, Application Data, Application Data, Application Data, Application Data"
"172","0.303791634","66","16:7d:35:96:b4:e2","e2:5e:0c:13:7c:04","172.20.0.3","172.20.0.2","TCP","47918 → 4433 [ACK] Seq=1607 Ack=1890 Win=64128 Len=0 TSval=1313088414 TSecr=1504004209"
"173","0.306423505","146","16:7d:35:96:b4:e2","e2:5e:0c:13:7c:04","172.20.0.3","172.20.0.2","TLSv1.3","Change Cipher Spec, Application Data"
"174","0.306481382","66","16:7d:35:96:b4:e2","e2:5e:0c:13:7c:04","172.20.0.3","172.20.0.2","TCP","47918 → 4433 [RST, ACK] Seq=1687 Ack=1890 Win=64128 Len=0 TSval=1313088416 TSecr=1504004209"
"175","0.316282853","74","16:7d:35:96:b4:e2","e2:5e:0c:13:7c:04","172.20.0.3","172.20.0.2","TCP","47924 → 4433 [SYN] Seq=0 Win=64240 Len=0 MSS=1460 SACK_PERM TSval=1313088426 TSecr=0 WS=128"
"176","0.316303057","74","e2:5e:0c:13:7c:04","16:7d:35:96:b4:e2","172.20.0.2","172.20.0.3","TCP","4433 → 47924 [SYN, ACK] Seq=0 Ack=1 Win=65160 Len=0 MSS=1460 SACK_PERM TSval=1504004221 TSecr=1313088426 WS=128"
"177","0.316319241","66","16:7d:35:96:b4:e2","e2:5e:0c:13:7c:04","172.20.0.3","172.20.0.2","TCP","47924 → 4433 [ACK] Seq=1 Ack=1 Win=64256 Len=0 TSval=1313088426 TSecr=1504004221"
"178","0.316366268","1672","16:7d:35:96:b4:e2","e2:5e:0c:13:7c:04","172.20.0.3","172.20.0.2","TLSv1.2","Client Hello"
"179","0.316370824","66","e2:5e:0c:13:7c:04","16:7d:35:96:b4:e2","172.20.0.2","172.20.0.3","TCP","4433 → 47924 [ACK] Seq=1 Ack=1607 Win=64128 Len=0 TSval=1504004221 TSecr=1313088426"
"180","0.317986360","1955","e2:5e:0c:13:7c:04","16:7d:35:96:b4:e2","172.20.0.2","172.20.0.3","TLSv1.3","Server Hello, Change Cipher Spec, Application Data, Application Data, Application Data, Application Data"
"181","0.318014793","66","16:7d:35:96:b4:e2","e2:5e:0c:13:7c:04","172.20.0.3","172.20.0.2","TCP","47924 → 4433 [ACK] Seq=1607 Ack=1890 Win=64128 Len=0 TSval=1313088428 TSecr=1504004223"
"182","0.320650739","146","16:7d:35:96:b4:e2","e2:5e:0c:13:7c:04","172.20.0.3","172.20.0.2","TLSv1.3","Change Cipher Spec, Application Data"
"183","0.320717688","66","16:7d:35:96:b4:e2","e2:5e:0c:13:7c:04","172.20.0.3","172.20.0.2","TCP","47924 → 4433 [RST, ACK] Seq=1687 Ack=1890 Win=64128 Len=0 TSval=1313088431 TSecr=1504004223"
"184","0.334619589","74","16:7d:35:96:b4:e2","e2:5e:0c:13:7c:04","172.20.0.3","172.20.0.2","TCP","47926 → 4433 [SYN] Seq=0 Win=64240 Len=0 MSS=1460 SACK_PERM TSval=1313088444 TSecr=0 WS=128"
"185","0.334646909","74","e2:5e:0c:13:7c:04","16:7d:35:96:b4:e2","172.20.0.2","172.20.0.3","TCP","4433 → 47926 [SYN, ACK] Seq=0 Ack=1 Win=65160 Len=0 MSS=1460 SACK_PERM TSval=1504004239 TSecr=1313088444 WS=128"
"186","0.334666756","66","16:7d:35:96:b4:e2","e2:5e:0c:13:7c:04","172.20.0.3","172.20.0.2","TCP","47926 → 4433 [ACK] Seq=1 Ack=1 Win=64256 Len=0 TSval=1313088444 TSecr=1504004239"
"187","0.334731123","1672","16:7d:35:96:b4:e2","e2:5e:0c:13:7c:04","172.20.0.3","172.20.0.2","TLSv1.2","Client Hello"
"188","0.334740885","66","e2:5e:0c:13:7c:04","16:7d:35:96:b4:e2","172.20.0.2","172.20.0.3","TCP","4433 → 47926 [ACK] Seq=1 Ack=1607 Win=64128 Len=0 TSval=1504004240 TSecr=1313088445"
"189","0.336376239","1955","e2:5e:0c:13:7c:04","16:7d:35:96:b4:e2","172.20.0.2","172.20.0.3","TLSv1.3","Server Hello, Change Cipher Spec, Application Data, Application Data, Application Data, Application Data"
"190","0.336406485","66","16:7d:35:96:b4:e2","e2:5e:0c:13:7c:04","172.20.0.3","172.20.0.2","TCP","47926 → 4433 [ACK] Seq=1607 Ack=1890 Win=64128 Len=0 TSval=1313088446 TSecr=1504004241"
"191","0.340912844","146","16:7d:35:96:b4:e2","e2:5e:0c:13:7c:04","172.20.0.3","172.20.0.2","TLSv1.3","Change Cipher Spec, Application Data"
"192","0.340990565","66","16:7d:35:96:b4:e2","e2:5e:0c:13:7c:04","172.20.0.3","172.20.0.2","TCP","47926 → 4433 [RST, ACK] Seq=1687 Ack=1890 Win=64128 Len=0 TSval=1313088451 TSecr=1504004241"
"193","0.352091442","74","16:7d:35:96:b4:e2","e2:5e:0c:13:7c:04","172.20.0.3","172.20.0.2","TCP","47942 → 4433 [SYN] Seq=0 Win=64240 Len=0 MSS=1460 SACK_PERM TSval=1313088462 TSecr=0 WS=128"
"194","0.352118470","74","e2:5e:0c:13:7c:04","16:7d:35:96:b4:e2","172.20.0.2","172.20.0.3","TCP","4433 → 47942 [SYN, ACK] Seq=0 Ack=1 Win=65160 Len=0 MSS=1460 SACK_PERM TSval=1504004257 TSecr=1313088462 WS=128"
"195","0.352138113","66","16:7d:35:96:b4:e2","e2:5e:0c:13:7c:04","172.20.0.3","172.20.0.2","TCP","47942 → 4433 [ACK] Seq=1 Ack=1 Win=64256 Len=0 TSval=1313088462 TSecr=1504004257"
"196","0.352182131","1672","16:7d:35:96:b4:e2","e2:5e:0c:13:7c:04","172.20.0.3","172.20.0.2","TLSv1.2","Client Hello"
"197","0.352187747","66","e2:5e:0c:13:7c:04","16:7d:35:96:b4:e2","172.20.0.2","172.20.0.3","TCP","4433 → 47942 [ACK] Seq=1 Ack=1607 Win=64128 Len=0 TSval=1504004257 TSecr=1313088462"
"198","0.354065606","1954","e2:5e:0c:13:7c:04","16:7d:35:96:b4:e2","172.20.0.2","172.20.0.3","TLSv1.3","Server Hello, Change Cipher Spec, Application Data, Application Data, Application Data, Application Data"
"199","0.354100011","66","16:7d:35:96:b4:e2","e2:5e:0c:13:7c:04","172.20.0.3","172.20.0.2","TCP","47942 → 4433 [ACK] Seq=1607 Ack=1889 Win=64128 Len=0 TSval=1313088464 TSecr=1504004259"
"200","0.356855669","146","16:7d:35:96:b4:e2","e2:5e:0c:13:7c:04","172.20.0.3","172.20.0.2","TLSv1.3","Change Cipher Spec, Application Data"
"201","0.356916187","66","16:7d:35:96:b4:e2","e2:5e:0c:13:7c:04","172.20.0.3","172.20.0.2","TCP","47942 → 4433 [RST, ACK] Seq=1687 Ack=1889 Win=64128 Len=0 TSval=1313088467 TSecr=1504004259"
"202","0.367246588","74","16:7d:35:96:b4:e2","e2:5e:0c:13:7c:04","172.20.0.3","172.20.0.2","TCP","47952 → 4433 [SYN] Seq=0 Win=64240 Len=0 MSS=1460 SACK_PERM TSval=1313088477 TSecr=0 WS=128"
"203","0.367270240","74","e2:5e:0c:13:7c:04","16:7d:35:96:b4:e2","172.20.0.2","172.20.0.3","TCP","4433 → 47952 [SYN, ACK] Seq=0 Ack=1 Win=65160 Len=0 MSS=1460 SACK_PERM TSval=1504004272 TSecr=1313088477 WS=128"
"204","0.367286744","66","16:7d:35:96:b4:e2","e2:5e:0c:13:7c:04","172.20.0.3","172.20.0.2","TCP","47952 → 4433 [ACK] Seq=1 Ack=1 Win=64256 Len=0 TSval=1313088477 TSecr=1504004272"
"205","0.367329554","1672","16:7d:35:96:b4:e2","e2:5e:0c:13:7c:04","172.20.0.3","172.20.0.2","TLSv1.2","Client Hello"
"206","0.367333639","66","e2:5e:0c:13:7c:04","16:7d:35:96:b4:e2","172.20.0.2","172.20.0.3","TCP","4433 → 47952 [ACK] Seq=1 Ack=1607 Win=64128 Len=0 TSval=1504004272 TSecr=1313088477"
"207","0.369016520","1955","e2:5e:0c:13:7c:04","16:7d:35:96:b4:e2","172.20.0.2","172.20.0.3","TLSv1.3","Server Hello, Change Cipher Spec, Application Data, Application Data, Application Data, Application Data"
"208","0.369045224","66","16:7d:35:96:b4:e2","e2:5e:0c:13:7c:04","172.20.0.3","172.20.0.2","TCP","47952 → 4433 [ACK] Seq=1607 Ack=1890 Win=64128 Len=0 TSval=1313088479 TSecr=1504004274"
"209","0.371612792","146","16:7d:35:96:b4:e2","e2:5e:0c:13:7c:04","172.20.0.3","172.20.0.2","TLSv1.3","Change Cipher Spec, Application Data"
"210","0.371674495","66","16:7d:35:96:b4:e2","e2:5e:0c:13:7c:04","172.20.0.3","172.20.0.2","TCP","47952 → 4433 [RST, ACK] Seq=1687 Ack=1890 Win=64128 Len=0 TSval=1313088481 TSecr=1504004274"
"211","0.381660039","74","16:7d:35:96:b4:e2","e2:5e:0c:13:7c:04","172.20.0.3","172.20.0.2","TCP","47968 → 4433 [SYN] Seq=0 Win=64240 Len=0 MSS=1460 SACK_PERM TSval=1313088491 TSecr=0 WS=128"
"212","0.381694055","74","e2:5e:0c:13:7c:04","16:7d:35:96:b4:e2","172.20.0.2","172.20.0.3","TCP","4433 → 47968 [SYN, ACK] Seq=0 Ack=1 Win=65160 Len=0 MSS=1460 SACK_PERM TSval=1504004286 TSecr=1313088491 WS=128"
"213","0.381709580","66","16:7d:35:96:b4:e2","e2:5e:0c:13:7c:04","172.20.0.3","172.20.0.2","TCP","47968 → 4433 [ACK] Seq=1 Ack=1 Win=64256 Len=0 TSval=1313088492 TSecr=1504004286"
"214","0.381748748","1672","16:7d:35:96:b4:e2","e2:5e:0c:13:7c:04","172.20.0.3","172.20.0.2","TLSv1.2","Client Hello"
"215","0.381753683","66","e2:5e:0c:13:7c:04","16:7d:35:96:b4:e2","172.20.0.2","172.20.0.3","TCP","4433 → 47968 [ACK] Seq=1 Ack=1607 Win=64128 Len=0 TSval=1504004287 TSecr=1313088492"
"216","0.383352566","1956","e2:5e:0c:13:7c:04","16:7d:35:96:b4:e2","172.20.0.2","172.20.0.3","TLSv1.3","Server Hello, Change Cipher Spec, Application Data, Application Data, Application Data, Application Data"
"217","0.383379239","66","16:7d:35:96:b4:e2","e2:5e:0c:13:7c:04","172.20.0.3","172.20.0.2","TCP","47968 → 4433 [ACK] Seq=1607 Ack=1891 Win=64128 Len=0 TSval=1313088493 TSecr=1504004288"
"218","0.386000096","146","16:7d:35:96:b4:e2","e2:5e:0c:13:7c:04","172.20.0.3","172.20.0.2","TLSv1.3","Change Cipher Spec, Application Data"
"219","0.386051584","66","16:7d:35:96:b4:e2","e2:5e:0c:13:7c:04","172.20.0.3","172.20.0.2","TCP","47968 → 4433 [RST, ACK] Seq=1687 Ack=1891 Win=64128 Len=0 TSval=1313088496 TSecr=1504004288"
"220","0.396013266","74","16:7d:35:96:b4:e2","e2:5e:0c:13:7c:04","172.20.0.3","172.20.0.2","TCP","47978 → 4433 [SYN] Seq=0 Win=64240 Len=0 MSS=1460 SACK_PERM TSval=1313088506 TSecr=0 WS=128"
"221","0.396036978","74","e2:5e:0c:13:7c:04","16:7d:35:96:b4:e2","172.20.0.2","172.20.0.3","TCP","4433 → 47978 [SYN, ACK] Seq=0 Ack=1 Win=65160 Len=0 MSS=1460 SACK_PERM TSval=1504004301 TSecr=1313088506 WS=128"
"222","0.396053124","66","16:7d:35:96:b4:e2","e2:5e:0c:13:7c:04","172.20.0.3","172.20.0.2","TCP","47978 → 4433 [ACK] Seq=1 Ack=1 Win=64256 Len=0 TSval=1313088506 TSecr=1504004301"
"223","0.396091300","1672","16:7d:35:96:b4:e2","e2:5e:0c:13:7c:04","172.20.0.3","172.20.0.2","TLSv1.2","Client Hello"
"224","0.396097649","66","e2:5e:0c:13:7c:04","16:7d:35:96:b4:e2","172.20.0.2","172.20.0.3","TCP","4433 → 47978 [ACK] Seq=1 Ack=1607 Win=64128 Len=0 TSval=1504004301 TSecr=1313088506"
